Sequence,Score,Mutations,Number of Mutations
MQYKLILNGKTLKGETTTECVDAASAEKVFQQYANDNGYDGEWTYEDATKTFTVTE,-4.3935847,"A20C, T25S, K31Q, V39Y, D46E",5
MKYKLILNGKTLKGETTTEAEDAATALKQFKQYANDNGVDGEWQYDDATKTFTVTE,-2.0813212,"Q2K, V21E, E27L, V29Q, T44Q",5
MKYKLILNGQTLKGETTTEAVDAAPFERVFKQYANDNGVDGEWTYDDATKTFTVTE,-2.0685627,"Q2K, K10Q, T25P, A26F, K28R",5
MKYKLILNGKTLKGVTTTEAVDAATAEKMFKQLANDNGVDGEWTYDDATKTVTVTE,0.24236044,"Q2K, E15V, V29M, Y33L, F52V",5
MQYKLILNGKTLKGETTVEATDAAEAEKVFKQYANDNGVDEEWTYDDATKTLTVTE,-4.323536,"T18V, V21T, T25E, G41E, F52L",5
MQYKLILDGKTLKGETTCEEVDAATAESVFKQYANDNGVDGEWDYDDATKTFTVTE,-1.1118828,"N8D, T18C, A20E, K28S, T44D",5
MQYKLILNEMTLKGEWTTEAVDAATLEKVFKQYATDNGVDGEWTYDDATKTFTVTE,-5.635356,"G9E, K10M, T16W, A26L, N35T",5
MQYKLILNGAVLKGETTTEAVDAATAEKVFKQNANDNGGDGEWTYDDATVTFTVTE,-3.816502,"K10A, T11V, Y33N, V39G, K50V",5
MQYKITLNGKTLKGGTTTEAVDAATAEKVFKQYANRNGVMGEWTYDDATKTFTVTE,1.7898903,"L5I, I6T, E15G, D36R, D40M",5
MQYKLILNGKTLKGETTTEAVDAATAEKVFKQYANDKRTDGEWTYDDTTKVFTVTE,0.6614978,"N37K, G38R, V39T, A48T, T51V",5
MEYKLILNGKTLKGETTTEAVDYATAEKVFKQYAADNGVDKEWTYDKATKTFTVTE,-5.571224,"Q2E, A23Y, N35A, G41K, D47K",5
MQYKLILNGKVLKGETTTKAVDAATAEKVFEQYANDNGVDGNWTFDDATKTFTVTE,-2.7696207,"T11V, E19K, K31E, E42N, Y45F",5
MQYKLIVNGKTLKGETTIEAVDAATAQKVFKQYASDNGVDGEWTYDDATKTFTRTE,-5.7562284,"L7V, T18I, E27Q, N35S, V54R",5
MQYKLILNGKTRKTETTTEAVDAATAEKVFKQYANDNGVDGEWVYDDNTKTFTVSE,-0.26236737,"L12R, G14T, T44V, A48N, T55S",5
MQYKLILNGKTAKGETTTEKVDAATAEKVFKQYANANGYDGEWTYDDATKEFTVTE,0.49856508,"L12A, A20K, D36A, V39Y, T51E",5
MQYKLIVNGKTLKGETTTEAVDAATAEKVFKQYLNDNGTDGEWTYNDATKTFTVTI,-2.284897,"L7V, A34L, V39T, D46N, E56I",5
MQYKLILNRKTLKGETLTEAVDAATAEKVFKQYANDNGVQGEWAYDDATKTFTVTK,1.2632426,"G9R, T17L, D40Q, T44A, E56K",5
MKYKLILNGKPLTGEMTTENVDAATAEKVFKQYANDNGVDGEWTYDDATKTFTVTE,1.6925887,"Q2K, T11P, K13T, T16M, A20N",5
MQYELIYNGKTLKGETTDEAVDAATTEKVFKQYANDNGVDGEWTYDDATKTFTVTA,-3.8147416,"K4E, L7Y, T18D, A26T, E56A",5
MQYKLILNGKTLTSETTTEAVDAATAEEVFKQYANDNGVDGEWDYDDATGTFTVTE,-2.7916124,"K13T, G14S, K28E, T44D, K50G",5
MQYKLTLNGKTLKGETTTEAVEAATAEKVFKQYFNENGVDGEWTYNDATKTFTVTE,0.060981683,"I6T, D22E, A34F, D36E, D46N",5
MQYKLILNGETLKGETTTEAVDAATALEVFKQYANDNKVDGEWTYDDATKTFTVTR,-6.1793466,"K10E, E27L, K28E, G38K, E56R",5
MQYKLILNGKTLPGEHTTEAVDAATAEKVAKQYANDNGVDGEWFYDDYTKTFTVTE,-0.641631,"K13P, T16H, F30A, T44F, A48Y",5
MQYKLILNGKTLKEETTTEAVDSATAEKIFKQYANDNGIDGEWTYDDATKTFTVIE,1.8446717,"G14E, A23S, V29I, V39I, T55I",5
MQYKLILNGKTLKGEITTDAVTAATAEQVFKQYANDNGVDGEWTYDDATKTFTQTE,-1.9520422,"T16I, E19D, D22T, K28Q, V54Q",5
MQYKVILNGKTLKGETTTEAVDAATAESLFGQYANDNGFDGEWTYDDATKTFTVTE,-5.657344,"L5V, K28S, V29L, K31G, V39F",5
MQYKLVLNGKTLKAEATTEAVDAATAEKMFKQYANDNGVDGNWTYDDATKTFTVTE,2.1234639,"I6V, G14A, T16A, V29M, E42N",5
MKYKLILNGKTLKDETTIEAVDAATAEKEFKQAANDNGVDGEWTYDDATKTFTVTE,-0.8933971,"Q2K, G14D, T18I, V29E, Y33A",5
MQYKLILNGKTKKGETTTEAVDAATVEKVFKQYLNDNGVEGEWTYDDATKTFVVTE,-2.7190082,"L12K, A26V, A34L, D40E, T53V",5
MNYKLILNGKTLKGETTTEAVDAATAEKVGKQWANDNGWDGEWTYDDAHKTFTVTE,-3.8928342,"Q2N, F30G, Y33W, V39W, T49H",5
MQYKLINNGKTVKGETTVAAVDAATAEKVFKQYANDNGVDGEWTYDDATKTFTVAE,0.7467229,"L7N, L12V, T18V, E19A, T55A",5
MQYKLILNGKTLKHITTTEAVDAATAENVFKQYANDNGVDLELTYDDATKTFTVTE,-6.479309,"G14H, E15I, K28N, G41L, W43L",5
MQYKLILNGKTLKGETTTAAVTAATAEEVFKQVAADNGVDGEWTYDDATKTFTVTE,-4.9474154,"E19A, D22T, K28E, Y33V, N35A",5
MQYKLILNGKTLKGETTTEAVDAATAEKVFKQYAAANGVDGEWSFDDATATFTVTE,-0.045092374,"N35A, D36A, T44S, Y45F, K50A",5
MQYKLILNGKTLNGETTTEAVDADTAEEVFDQYANDNSVDGEWTYDDATKTFTVTE,-5.4303946,"K13N, A24D, K28E, K31D, G38S",5
MQYKLILNGKTLKGETTTEAKDEATAEKVAKRYANDNGVDGEWVYDDATKTFTVTE,-0.16186655,"V21K, A23E, F30A, Q32R, T44V",5
MQYKLILNGKTLKGETTTEAVDFATAEKVVKTYANDNKVDGEWTYDDATGTFTVTE,-3.6678247,"A23F, F30V, Q32T, G38K, K50G",5
MQYKLILNGKTLKEEYTTEAVDKATAEKVFKQYANYSGVDGEWTYDDATKTFTVTE,-1.955109,"G14E, T16Y, A23K, D36Y, N37S",5
MQYKLIANGKTGKGETTTEAVDAATAEKVFKQYANDNGWQGEWTYDDATITFTVTE,-2.6318347,"L7A, L12G, V39W, D40Q, K50I",5
MQYKLILNGKTLKGETTTEAVDAATAEEVFKQYANDNGIDGEWTYDDATITFTEVE,-4.3489337,"K28E, V39I, K50I, V54E, T55V",5
MQYKIILNGKELKGETTFEAVDAATAEKVFKAYANDNGVDGEWTYDAATKTFTVTE,0.8667132,"L5I, T11E, T18F, Q32A, D47A",5
MQYKLILNGKTLDGVTTTYAADAATAEKMFKQYANDNGVDGEWTYDDATKTFTVTE,3.8933947,"K13D, E15V, E19Y, V21A, V29M",5
MQYKLKLNGKTLKGETLTEAVNAATAEKVFKQYANDNGVDGEWTYDDDTKTFAVTE,3.6521056,"I6K, T17L, D22N, A48D, T53A",5
MQYKLILNGKTSKGYTTTEAVDAATFEKAFKQYANDNGVDGAWTYDDATKTFTVTE,-1.8308487,"L12S, E15Y, A26F, V29A, E42A",5
MQYKLIKDGKTLKGEYTTEAVDRATAEKVFKQYANDNGVTGEWTYDDATKTFTVTE,-2.0863626,"L7K, N8D, T16Y, A23R, D40T",5
MQYKLILNGKTLKGETTTEAVDAATAEKIFKDYANDNQPDGEWTYDDASKTFTVTE,-4.5440617,"V29I, Q32D, G38Q, V39P, T49S",5
MQYKLILNGKPLKGETTTEAVDAATAEKVFKQYLDDNGVDGQWTYDDAKKTFTVTE,-4.4781413,"T11P, A34L, N35D, E42Q, T49K",5
MKAKLILNGKTLKGETTTEAVDTATAEKVFKQYANDNGVKGEWTYDDATKTFTVDE,0.40622443,"Q2K, Y3A, A23T, D40K, T55D",5
MQYKLILNGKTLKGQTTIEAVDAATAEKVAEQYANDNGVDGEWTYDDATKTFTETE,-4.9868903,"E15Q, T18I, F30A, K31E, V54E",5
MQYKLILNGKTLKGMTTTEAKDAITAEAVFKQYANDNGVDGEWTYDDKTKTFTVTE,1.0143372,"E15M, V21K, A24I, K28A, A48K",5
MQGKLILNGKTLKGEFTTEAVDAATAEKVFKQAAIHNGVDGEWTYDDATKTFTVTE,-5.3514433,"Y3G, T16F, Y33A, N35I, D36H",5
MAYKLILNGKTLKGITTTEAVDAATAEKVFKQYGNDNGVDGSWTYDDATGTFTVTE,3.4969177,"Q2A, E15I, A34G, E42S, K50G",5
MQYKLILNGKTLKGEVTTEAVSSATAIKVFKQYANDNGVDGEWTYDDATGTFTVTE,-2.6800928,"T16V, D22S, A23S, E27I, K50G",5
MQYKLILNGKTLKRETTTEDVDAATAEKVLKQYANDNGVTGEWTYDDETKTFTVTE,0.11070972,"G14R, A20D, F30L, D40T, A48E",5
MQYKLVLNGKTLKGETKTEAVDAATAIKVFKDYANDNGVDGEWTYNDATKTFTVTE,-4.0147715,"I6V, T17K, E27I, Q32D, D46N",5
MQYKLILNGKTLKGETTTEAVDAATAEKVFNQYANDNGVDGEWTYDESTKDATVTE,-4.685656,"K31N, D47E, A48S, T51D, F52A",5
MQYKLHLNGKTLKGETTTEAVSAATAEAVFEQYANDNGVDGEFTYDDATKTFTVTE,-5.74146,"I6H, D22S, K28A, K31E, W43F",5
MQYKLILNGKTLKGEMTTEAVAAATANKVFKQWAADNGVDGEWTYDDATKTFTVTE,-5.760975,"T16M, D22A, E27N, Y33W, N35A",5
MQYKLILNGETLKGETTIEAVDAAIAEKKFKQYANDNGVDREWTYDDATKTFTVTE,-1.3563163,"K10E, T18I, T25I, V29K, G41R",5
MQYKLFLNGKTLKGETTTEAVDAATAKKVFKQYANDSEVDGEWTYDDATSTFTVTE,-3.4515257,"I6F, E27K, N37S, G38E, K50S",5
MQYKLILNGKTYKGETTTEAVDAATAEKVFQQYANDNPVDGEWTYDDATNTVTVTE,-6.081291,"L12Y, K31Q, G38P, K50N, F52V",5
MQYKLILNGKTLKGETTTEAVDAETALKSFKQYANDNGVDGEVTYDDATKTFTLTE,-5.4452896,"A24E, E27L, V29S, W43V, V54L",5
MKYKLILHGKTLKGETTFEAADAAVAEKVFKQYANDNGVDGEWTYDDATKTFTVTE,3.86772,"Q2K, N8H, T18F, V21A, T25V",5
MSYKLILNGKTLNGETTTEAVDAATAEKVFKQYANTNGVDGEWTYDDATKTFTVCA,2.721433,"Q2S, K13N, D36T, T55C, E56A",5
MQYKLILNGKTLKGETTTEAVDAATAEKVFKGTANKNGVDGEITYDDATKTFTVTQ,-4.014828,"Q32G, Y33T, D36K, W43I, E56Q",5
MKYKLILNGKTFKGETTTEAVDAATAEKAFKQAANDNGVDGEVTYDDATKTFTVTE,-3.6990097,"Q2K, L12F, V29A, Y33A, W43V",5
MQYKYILNGKTLKGEKTTEAVDAATAEKQFKQYANDNGLDGTWTYDDATKTFTVTE,1.9636743,"L5Y, T16K, V29Q, V39L, E42T",5
MQYTLILNGKTLKGETTIEAVDAAGAEKVFKQIANDNGVDGEATYDDATKTFTVTE,-4.0127964,"K4T, T18I, T25G, Y33I, W43A",5
MQYKLILNGKTLHGETTTEAVDAATAEKVFKQYCNDNGVDGEVKYDDKTKTFTVTE,-2.3797014,"K13H, A34C, W43V, T44K, A48K",5
MQYKLILNGKTLQGETTTETVDAATAAKVFKQYANDNGYDGEWTYDDATKTFTVTI,-5.415651,"K13Q, A20T, E27A, V39Y, E56I",5
MQYKLTLNGKTLKGETSTEAVDAATAEKMFKQYCNDNGVDVEWTYDDATKTFTVTE,-0.851071,"I6T, T17S, V29M, A34C, G41V",5
MKYKLILDGKTLKGETNTEATDADTAEKVFKQYANDNGVDGEWTYDDATKTFTVTE,3.5438693,"Q2K, N8D, T17N, V21T, A24D",5
MKYKFILNGKKLKGETTTEAVDAATAEKVFKQEANDNGVDGEWTYDDATKTFTVKE,-1.0746957,"Q2K, L5F, T11K, Y33E, T55K",5
MQYKLILNGKTLKGETTTEKVDAGEAEKVFRQYAKDNGVDGEWTYDDATKTFTVTE,-2.640244,"A20K, A24G, T25E, K31R, N35K",5
MQYKLILKGKTAKGETTTEAVDAATAAKVFKQYLNDQGVDGEWTYDDATKTFTVTE,-5.5314226,"N8K, L12A, E27A, A34L, N37Q",5
MQYKLMLNGKYLKTETTTEAVDAAVAEKVFKQYANDNGVDGEWTYDDATLTFTVTE,0.66618794,"I6M, T11Y, G14T, T25V, K50L",5
MQYKLIKNGKTLSGETTTENVDAATAEKVFKQYAKDNGVDGEWTYDDKTKTFTVTE,-3.1837234,"L7K, K13S, A20N, N35K, A48K",5
MQYKTTLNGKTVKGETTTEAVDAATAEKVFQQYANDNGVDGEWSYDDATKTFTVTE,-4.952725,"L5T, I6T, L12V, K31Q, T44S",5
MQYKLILSGKSLKGETTTEAVDPATAEQVFKDYANDNGVDGEWTYDDATKTFTVTE,-2.645548,"N8S, T11S, A23P, K28Q, Q32D",5
MQYKLILNGTTLKGETTTEKVDEATAEKVFKQYANDLGVDGEWTYDDATKTFTVVE,0.76237947,"K10T, A20K, A23E, N37L, T55V",5
MQYKAILNGETYKGETTTEAVDAATAEKVFKQYANDNGVDGEWTYDQATKTLTVTE,-1.1645511,"L5A, K10E, L12Y, D47Q, F52L",5
MKYKLILNGKTLKGGTTTEAVDAATAEKLCEQYANDNGVDGEWTYDDATKTFTVTE,-3.6148398,"Q2K, E15G, V29L, F30C, K31E",5
MQYKLILNGKTLKGNTTTFAVDAATAEKVFKQYVADNGVDGSWTYDDATKTFTVTE,-1.8148372,"E15N, E19F, A34V, N35A, E42S",5
MQYKVILNGKTLKGPTTTEAVDAATAEKVFKQLANANGVDGIWTYDDATKTFTVTE,2.5162368,"L5V, E15P, Y33L, D36A, E42I",5
MTYKLIYNGKTLKGETTTEAVDAVTAEAVFKQYANDNGVDGEWAYDDATKTFTVTE,-0.39453167,"Q2T, L7Y, A24V, K28A, T44A",5
MQYKLILNGKTLKGETTTEAVNKATAEKVFKQIANDNGVTGEWTYDDATKTVTVTE,-3.5634732,"D22N, A23K, Y33I, D40T, F52V",5
MQYLLILNGKTLKPVTTTEADDAATAEKVFKQYAIDNGVDGEWTYDDATKTFTVTE,-1.9620814,"K4L, G14P, E15V, V21D, N35I",5
MQYKLILNGKTLKGETTTEAVDAAKVEKVIKQYAKDNGVDGEVTYDDATKTFTVTE,-6.187211,"T25K, A26V, F30I, N35K, W43V",5
MQYKLIQNGKTLKGETTTKHVDAATAEKVFKQYANDTWVDGEWTYDDATKTFTVTE,0.3564833,"L7Q, E19K, A20H, N37T, G38W",5
MQYKLILNGKTLKGETTTEAVDRATAQKVFKQWAEDNGVDGEWTYDDATKTFTVTK,-5.952314,"A23R, E27Q, Y33W, N35E, E56K",5
MKYKLIDNGKVLKGETTTEAVDAATAEKVFKQYANDNGVDGEWTYDDTTKTFEVTE,-0.5924906,"Q2K, L7D, T11V, A48T, T53E",5
MQYKLILNGKTLHGETTTEAVDYATAEKVFKQYVNDNGVDGEVTYDDATKTFTVIE,-5.758113,"K13H, A23Y, A34V, W43V, T55I",5
MQYVLILMGKTLTGETTTEAVDAATAEKVFRQYANDNGVDGGWTYDDATKTFTVTE,2.3048165,"K4V, N8M, K13T, K31R, E42G",5
MQIKLILNGKTLKGETTTEAVDQATAEKDFKDYLNDNGVDGEWTYDDATKTFTVTE,-4.7460527,"Y3I, A23Q, V29D, Q32D, A34L",5
MQYKLILNGKTLTGETTTEAVDAATAEKTFKQYVNDNGVDCYWTYDDATKTFTVTE,-0.32514176,"K13T, V29T, A34V, G41C, E42Y",5
MQYKLILNGKILTGETTTFPVDAATAEKVEKQYANDNGVDGEWTYDDATKTFTVTE,-3.695818,"T11I, K13T, E19F, A20P, F30E",5
MQYKLILNGKTLKGESTTEAVEAATAEKVFKQYANMNGVDGEWKYDDATKTITVTE,0.7158147,"T16S, D22E, D36M, T44K, F52I",5
MQYKLILNGKTLNKETTTEAVDAATAEKVFKQYANDNGVSGEWTADEATKTFTVTE,-0.8531078,"K13N, G14K, D40S, Y45A, D47E",5
MQYKVALNGKTLKGTLTTEAVDAATAEKVFKQYANDNGVDGEWTYDDATKTFTVTY,1.0249538,"L5V, I6A, E15T, T16L, E56Y",5
MQYKLILNGKTLKGETTDEAVLAATAEKVFKQYANDNGVDVTWTYDDATKTFNVTE,-2.102829,"T18D, D22L, G41V, E42T, T53N",5
