Sequence,Score,Mutations,Number of Mutations
MQYDLILNRKTLKGETTTEAVDAATAEKVFKQYANDNGWDGEWTYDDAWKSFTVTE,-3.7478826,"K4D, G9R, V39W, T49W, T51S",5
MQYKLILNGKTLWGETTTEAVDAFYAEKVFKQYANDNGVDGEWWYDDATQTFTVTE,5.886712,"K13W, A24F, T25Y, T44W, K50Q",5
MQYKLILNGKTLKGETTYEAVDAWTYFKVFKQYANDNGVDGEWTYDDATKLFTVTE,-4.4825864,"T18Y, A24W, A26Y, E27F, T51L",5
MQYYLILNGKTLKGWRTTEAVDAATKEKVFKQYANDNGVDGEWTYDDATKTFWVTE,-1.6645259,"K4Y, E15W, T16R, A26K, T53W",5
MQYKLILNGKTLKGETTTEAVDAAWAERVFKQYANDNGVDGEWWYNDATKTFTVYE,3.5477207,"T25W, K28R, T44W, D46N, T55Y",5
MQYKLILNGKTLKFEWTTEAVDAATAFKVFKQYANMNGVDGEWTYDDATKTLTVTE,-6.004635,"G14F, T16W, E27F, D36M, F52L",5
MQYKLILNGKTLKGDLTTEAVDYATAEKVFKQYAYDNGVDGEWTYDDATKTFTVTK,-5.448182,"E15D, T16L, A23Y, N35Y, E56K",5
MQYKLILNGKTLKGETTYEAVDAATAEKVFKQYANDNGYDGEWTYKLATKTFTVYE,0.9987199,"T18Y, V39Y, D46K, D47L, T55Y",5
MQGKLILNGKTLKGEYTTFAVDAATAEKVFKQYAWDNGVDGWWTYDDATKTFTVTE,-3.4796474,"Y3G, T16Y, E19F, N35W, E42W",5
MQYKLILNGKTLKRETTTEAVLAATAYKVKKQYANDNGVDGEWTYDDATQTFTVTE,-5.38457,"G14R, D22L, E27Y, F30K, K50Q",5
MRYKLILNGKEMKGETTTEAVDAATAEKVFKQYANPYGVDGEWTYDDATKTFTVTE,-3.5445313,"Q2R, T11E, L12M, D36P, N37Y",5
MQYKLILNGKTLKLLTTTEAVDAATARKVFFQYANDNGVDGEWTYDDATKTWTVTE,-7.179382,"G14L, E15L, E27R, K31F, F52W",5
MQYKLRYNGRTLKGETTTEAVDAARAEKVFKQYANDNGWDGEWTYDDATKTFTVTE,-1.5577233,"I6R, L7Y, K10R, T25R, V39W",5
MQYKLILNGKTLKGETTTEAFDAATAEKVFKYYANDNGVWGEWTYDRATKTFTVTR,3.5845761,"V21F, Q32Y, D40W, D47R, E56R",5
MQYKLILNGKTWKGETTTEAVDAATAEKVFYQWANDNGVDGEWDYDDAWKTFTVTE,-4.3456755,"L12W, K31Y, Y33W, T44D, T49W",5
MQYKLILNGKTLKGETTTEAVDAATAEKRFKQYANDNGVYGTWTYDRATKTFTQTE,5.2623153,"V29R, D40Y, E42T, D47R, V54Q",5
MQYKLILNGETLKGETTTEWVDAYTREKVFWQYANDNGVDGEWTYDDATKTFTVTE,-4.7012014,"K10E, A20W, A24Y, A26R, K31W",5
MQYKYILNGKILKGETTTEAVDAAYAELVVKQYANDNGVDGEWTYDDATKTFTVTE,-3.519912,"L5Y, T11I, T25Y, K28L, F30V",5
MQYKLILNGKTLKGETTTEAVDAARAEKVFKQMANDNGVWGEWTYDDWTKYFTVTE,5.7883344,"T25R, Y33M, D40W, A48W, T51Y",5
MQYKLILNGKTLKGETTIEAWDAATAEKVFKQYAADNGVDGEIKYDDATKTFTVTE,-4.8875256,"T18I, V21W, N35A, W43I, T44K",5
MYYKLILNGKTLFGETTTEAVDRATAWKVFKQYANDNGVDGEWTYDDATKIFTVTE,-4.0471125,"Q2Y, K13F, A23R, E27W, T51I",5
MWYKLIWNGKTLKGITTTEAVDAATAEKVFKQYANDNGVDIYWTYDDATKTFTVTE,-3.5589728,"Q2W, L7W, E15I, G41I, E42Y",5
MQYKSILNGKTLKGETTTEAVDAATAEWVYKQYANDNWVDGEWRYDDATKTFTVTE,-3.7500238,"L5S, K28W, F30Y, G38W, T44R",5
MQYKLILNGKTYKGETTTEAVDAATAEKVFKWYANDNGVDGEWTYDDATKTFKKTN,-4.944926,"L12Y, Q32W, T53K, V54K, E56N",5
MQYKLILNGKTLWGETTTEAVDAATVEKRFWQYANDNGVDGEWTYDDATKTFTYTE,-4.6289825,"K13W, A26V, V29R, K31W, V54Y",5
MQYKLILNGKTLKGETTTEAWDAATAEKVFKQYANDNGVDGEWTYDDARKVFTRFE,-1.0409929,"V21W, T49R, T51V, V54R, T55F",5
MQYRLIVNGWTLKGETTTEAVDAATAEKVFFQYANDNGWDGEWTYDDATKTFTVTE,-4.6282067,"K4R, L7V, K10W, K31F, V39W",5
MQYILILNGKTLKGETTWEALKAARAEKVFKQYANDNGVDGEWTYDDATKTFTVTE,4.229268,"K4I, T18W, V21L, D22K, T25R",5
MQYKLWLNGLTLKGETTTEAVDAATAEKVFWQYANDNGVDYEWTYDDAYKTFTVTE,-5.1065183,"I6W, K10L, K31W, G41Y, T49Y",5
MQVKLILNPKTYKGETTTEAVDAATREWVFKQYANDNGVDGEWTYDDATKTFTVTE,-6.18425,"Y3V, G9P, L12Y, A26R, K28W",5
MQYKLILNGITLKGETTTEAVDAATAEKVFKAYANDNGVDGEWYYDDATKRYTVTE,1.1954938,"K10I, Q32A, T44Y, T51R, F52Y",5
MQYKLILCGKTLKGETTTEAVDAATREKVGKQYANDNGVDGYWTYDDATKTFTVTQ,-4.289548,"N8C, A26R, F30G, E42Y, E56Q",5
MQYKLILNGKTLKWETTTEAVDAATAEKVFKQYAYDIGVDDEWTYDRATKTFTVTE,-4.9431043,"G14W, N35Y, N37I, G41D, D47R",5
MQYKLILNGKTLKEETTTEYVDAATAYKKFKQYANDNGVDGEWTYDDATKTFRVTE,-4.585221,"G14E, A20Y, E27Y, V29K, T53R",5
MQYKLIINGKTLWGETTYEWVDAATAEKVFKQYANDNGVDGEWTYNDATKTFTVTE,3.724604,"L7I, K13W, T18Y, A20W, D46N",5
MQYKLIRNGKTLKGWTTTEAVDAATAEKVQKQYANYNGVDGEWTYDDATQTFTVTE,-1.5919192,"L7R, E15W, F30Q, D36Y, K50Q",5
MQYKLILNGVFLKGETWTEAVDAATAEKVFKQYANDNGVDGEWTYEDATKTFTVTK,1.4959934,"K10V, T11F, T17W, D46E, E56K",5
MQYKLILNGKTLKGETTIEAVDWATAEKVFYQYANDNWVDGEWTYDDATKTFWVTE,-4.99611,"T18I, A23W, K31Y, G38W, T53W",5
MQYKLILNGKTLKGETWTEAVDYATAERYFKQYANDNGVDGEWTYDDATKTFWVTE,-1.726301,"T17W, A23Y, K28R, V29Y, T53W",5
MQKKLILNGKTLKGETTREAVDAATAEKVFKQYANDNGVWGFWTYDDATKTFWVTE,1.9010271,"Y3K, T18R, D40W, E42F, T53W",5
MQYKLILNGKTLKGERTTEAVDAATAEKRFKQYANDNGVWGWWKYDDATKTFTVTE,7.1584444,"T16R, V29R, D40W, E42W, T44K",5
MQYILILNGKTLKGYTTTGAWDAATAQKVFKQYANDNGVDGEWTYDDATKTFTVTE,-1.1915246,"K4I, E15Y, E19G, V21W, E27Q",5
MQYKLILNGKTLIGETTTEYVDAATAEKVKKQYANDGGVDGWWTYDDATKTFTVTE,-1.9286293,"K13I, A20Y, F30K, N37G, E42W",5
MQYKLILNGKTLKWETTTEAVDAATAEKVFKQYANDNWYDGEWTYDRATKTFTVTG,-0.38830787,"G14W, G38W, V39Y, D47R, E56G",5
MQYKLILNGKTLWGWTTTWAVDAATAEKVFKQYANDNGVDGEWTYDDYTKGFTVTE,4.7831283,"K13W, E15W, E19W, A48Y, T51G",5
MQYKLTLNGKWLKGETTTEAVDAATAEKVFKQYANFNGVDGTWRYDDATKTFTVTE,3.2649357,"I6T, T11W, D36F, E42T, T44R",5
MQYKLIYNGKTLKGETTTEAVDAAYAKKVFKQYANDNGVDGYWTYDDATKTWTVTE,-5.3747354,"L7Y, T25Y, E27K, E42Y, F52W",5
MQYKLILNGKWLKGETTTEAVDYATAEKVRKQYANDNLVDGEWTYDDASKTFTVTE,-5.23314,"T11W, A23Y, F30R, G38L, T49S",5
MQYKLILNWKTLKGETTTEAVDAATAEKVRKRYANDNGVDGEWWYDRATKTFTVTE,-1.4601672,"G9W, F30R, Q32R, T44W, D47R",5
MQYKLILNGYTLWGETETEAVDAATAIKVFKQYWNDNGVDGEWTYDDATKTFTVTE,-4.886853,"K10Y, K13W, T17E, E27I, A34W",5
MQYRLILNGKTLKGETTTFAVDAATAEKRFKQYANDNGVDGSWTYRDATKTFTVTE,5.901093,"K4R, E19F, V29R, E42S, D46R",5
MQYKLKLNGKTLKGETTTEAVDFATAEEVFKRYANDNGVDGEWTYDDATKTWTVTE,-5.112795,"I6K, A23F, K28E, Q32R, F52W",5
MQYKLILNGKTLKGETNTEAWDAATAEKVFKQRANDNGVDGEWTYEDATKMFTVTE,2.9358048,"T17N, V21W, Y33R, D46E, T51M",5
MQYKLIRNYKTLKGETTWEAIDAWTAEKVFKQYANDNGVDGEWTYDDATKTFTVTE,2.00344,"L7R, G9Y, T18W, V21I, A24W",5
MRYKLILNGKTLKGETTFEAVDAATAEKVFKSYANDMGVDGIWTYDDATKTFTVTE,2.984043,"Q2R, T18F, Q32S, N37M, E42I",5
MQYKLILRGKWLKGETTTELVDAATAEKVFKQYANDNGVWGEWTYDDFTKTFTVTE,3.7275748,"N8R, T11W, A20L, D40W, A48F",5
MQYKLILNGKTLKGRTTFEYVDAATAEYVFKQYANDNGVDGEWTYDDATKTFFVTE,-1.2175702,"E15R, T18F, A20Y, K28Y, T53F",5
MQYKLILNGKTLKYETTTEAVDAATARKVFKQVANDNSLDGEWTYDDATKTFTVTE,-5.8013225,"G14Y, E27R, Y33V, G38S, V39L",5
MQYKLILNGKTLKGWTPTEAVDAATAEKVKLQYANDNGVDGWWTYDDATKTFTVTE,-4.824935,"E15W, T17P, F30K, K31L, E42W",5
MQYRLILNGKTLKGETTTEAVDAAYAEKVFKQYANDNGVDYEWTYSDATKTFWVTE,-0.544772,"K4R, T25Y, G41Y, D46S, T53W",5
MQYKLILNGKTRKGETTTEAVDAATAEKVRKQYFNDNGVDWELTYDDATKTFTVTE,-7.0195174,"L12R, F30R, A34F, G41W, W43L",5
MQYKLTLNGKTLKGETTTEAVDAATARRVFAQYANDNGVDGEWTYDDATKTYTVTE,-7.029233,"I6T, E27R, K28R, K31A, F52Y",5
MQYKLILNGKTLKGFGWTEAVDAAAAEKVFKQYANDNGVDGEWTYDDALKTFTVTE,3.539474,"E15F, T16G, T17W, T25A, T49L",5
MQRKLILNGKTLKGETTTEAVDAATAEKVFKQYANRNGADGEETYDDRTKTFTVTE,-5.552373,"Y3R, D36R, V39A, W43E, A48R",5
MQYKLILWGKTLKGETTPEAVDAATAEKVFKQYANDNGVDGEWTYDDATKTFWVYM,-1.8116949,"N8W, T18P, T53W, T55Y, E56M",5
MQYKLILNGYTLKGRFTTEAVDAATREKVKKQYANDNGVDGEWTYDDATKTFTVTE,-4.5602703,"K10Y, E15R, T16F, A26R, F30K",5
MQYKLILNGKTLKGETRTEAVDAATAEKVRKQYWNDNGVDYEWTYDDATKHFTVTE,-5.2208033,"T17R, F30R, A34W, G41Y, T51H",5
MQYKLILGGKTLKGETLTEAVDAARAEKVFKQYANFNGVDGEWTYDDWTKTFTVTE,4.1849923,"N8G, T17L, T25R, D36F, A48W",5
MQYKLIKNKKTLKGETTTEFVDAALAEKVFKQYANDNGVDGEWTYDDAWKTFTVTE,-1.702937,"L7K, G9K, A20F, T25L, T49W",5
MQYKLYLNGKTLKGETTTEAVDAATAEKVRKQYANYNGYDGYWTYDDATKTFTVTE,-3.633309,"I6Y, F30R, D36Y, V39Y, E42Y",5
MQYKVILNGKTLKGETTTEAVDAATAERVFKQYANDNGVWGEWFYDDATKTFWVTE,3.7516136,"L5V, K28R, D40W, T44F, T53W",5
MQYKLILNGKTLKGETTTEKVDAATAKKVFKQYANDNGVWGEWTYDDATKTFTVNA,-2.1973505,"A20K, E27K, D40W, T55N, E56A",5
MQYKLILLGKTLKGEFTTEAVDAAYAEKVFKQYANDNGVDYEWTYDDATKWFTVTE,-1.5667173,"N8L, T16F, T25Y, G41Y, T51W",5
MQYKLILNGKTLKGETTTEIVDAARAEKVFKQYANDNHVDGEWTYDDATGTFTVTP,0.6363093,"A20I, T25R, G38H, K50G, E56P",5
MQYKLILNGKTLKGETWTMAVDAATAEKVFKQYANDNWVDGDYTYDDATKTFTVTE,-1.5305932,"T17W, E19M, G38W, E42D, W43Y",5
MQYKLIINGKTLVGETTYEFVDAATAEWVFKQYANDNGVDGEWTYDDATKTFTVTE,-0.71290183,"L7I, K13V, T18Y, A20F, K28W",5
MQYKLILNGKTYKGETTTEAVDAATAEKVFKQYAWDNGVWGEWTWDDATKTFWVTE,0.084932,"L12Y, N35W, D40W, Y45W, T53W",5
MYYFLILNGKTLKGETTTEAVTAATAEKVFRQYANDNGVDGEYTYDDATKTFTVTE,-2.6574535,"Q2Y, K4F, D22T, K31R, W43Y",5
MQYKLILNGKTYKGETTTEAVDWATWEKVFKQYANDNGFDGEWTWDDATKTFTVTE,-5.339236,"L12Y, A23W, A26W, V39F, Y45W",5
MQYYLILNGKTLKGETTTEAVDRAWAEKVFKQYANDNRVDGEWTYDDATKTFTITE,-1.3007876,"K4Y, A23R, T25W, G38R, V54I",5
MQYKLILNGKTLKGETTTEAVDIATAEKVFKQYAWDNGVDGHWWYDDATDTFTVTE,-1.9551778,"A23I, N35W, E42H, T44W, K50D",5
MQYKLILNKKTGKGEITTEAVDAATAYKVFKQYANDNGVDGYWTYDDATKTFTVTE,-4.748478,"G9K, L12G, T16I, E27Y, E42Y",5
MQYKLILNGKTLKGETTTEAVDAYTALKRFKQYANDNAVDYEWTYDDATKTFTVTE,-4.0196915,"A24Y, E27L, V29R, G38A, G41Y",5
MQYKLILNGKTLKGERWTKAVDAATAEKVFKQYANDNFVDGEWTYDDATKTFWVTE,3.6934521,"T16R, T17W, E19K, G38F, T53W",5
MQYKLILNGKTLKGETTTEAVDRATAEKVFKQYANDNGVDGEFWYDRATKTFYVTE,-2.771192,"A23R, W43F, T44W, D47R, T53Y",5
MQYKLIINGKTLKGETYTEAVYAATAEKVFKQYANDHGVDGEWTYDDATKCFTVTE,3.5222487,"L7I, T17Y, D22Y, N37H, T51C",5
MQYKLILNGKTLKAETTCEAVDAATAEKVFKQYANDNGVYGEWTYDDATKTFTVYY,2.0803676,"G14A, T18C, D40Y, T55Y, E56Y",5
MWYKLILRGKTLKGETRTEAVDAATAEKVFKQFLNDNGVDGEWTYDDATKTFTVTE,2.0212545,"Q2W, N8R, T17R, Y33F, A34L",5
MQYKLILYGKTLKGETTTEAVDAATAEKVFKQYANDNGLDGHWWYDDATKTFTVFE,4.26277,"N8Y, V39L, E42H, T44W, T55F",5
MQRKLILNGKTLKGETTTEAVDAATAEKVFKQYANDNGVDGEWTYDDWTKRFYFTE,-0.35389215,"Y3R, A48W, T51R, T53Y, V54F",5
MQYKLILNGKTLKFETTTEAVDAYTAEKVRKWYANDNGVDGEWTYDDATKTFTVTV,-4.1735964,"G14F, A24Y, F30R, Q32W, E56V",5
MQYKLILYGKTYKGETFTEAFDAATAEKVFKQYANDNGVDGEWTYDDATKTFTVRE,2.4493923,"N8Y, L12Y, T17F, V21F, T55R",5
MQYKLYLNGYTLKGETTTEKVDAHTAEYVFKQYANDNGVDGEWTYDDATKTFTVTE,2.583374,"I6Y, K10Y, A20K, A24H, K28Y",5
MQYKLILNGKTLKGETTTEAYLAATAEYVFKQYANDNGVDGWWTYDDATKRFTVTE,2.124519,"V21Y, D22L, K28Y, E42W, T51R",5
MQYKLILNGKTLKGETTTEAVDAATAEKKFKWYANYNGVWGEWTYDDATKTWTVTE,-0.50579125,"V29K, Q32W, D36Y, D40W, F52W",5
MQYKLILNGKTLKRETTTEYVDRATAEKVFKQYANVNGVDGEWTYDDATKTFTVTR,-3.75754,"G14R, A20Y, A23R, D36V, E56R",5
MQYKLILNGKTLKGETTCEAVDAYTAYKVWKQYANDNGVDGEWTYDDATKTWTVTE,-5.046429,"T18C, A24Y, E27Y, F30W, F52W",5
MRYKLILNGKTLKGEFTTEAVAAATAEKVFKQYANDNGFDGEWTYDDATKTFTVTA,1.2607945,"Q2R, T16F, D22A, V39F, E56A",5
MQYKLWLNGKTLWGETTTEAVDAATAEKVFKQYANDNWVDGYWTYDDATKTFEVTE,4.011999,"I6W, K13W, G38W, E42Y, T53E",5
MQYKLWLNGKTLKGYTPTEAVDAATAEKVKKQYANDNGLDGEWTYDDATKTFTVTE,-0.64881265,"I6W, E15Y, T17P, F30K, V39L",5
MQYKLILNGKYLKGETTTEAVDRATAEWVFKQYANDNGVWGEWTYDDATKYFTVTE,-2.1424868,"T11Y, A23R, K28W, D40W, T51Y",5
MQYKLILNGKTLKGETTTEAWDAARAEKRFKQWANDNGVDGEWTYDDATKTFTRTE,0.24795994,"V21W, T25R, V29R, Y33W, V54R",5
MQYKLILNGHTLKGETTTEAVDAATAEKVYKQYANDNGVDYEHTYDDATKTFLVTE,-5.3751316,"K10H, F30Y, G41Y, W43H, T53L",5
MQYKLILHGKILKGETTTEAVDAATAEKVLKQYANDNGVDFEWTYDDATKTFTVKE,-0.9007189,"N8H, T11I, F30L, G41F, T55K",5
MYYKLILNGKTLKGETGTEAVDAAYAEKVFKQMANRNGVDGEWTYDDATKTFTVTE,4.2878118,"Q2Y, T17G, T25Y, Y33M, D36R",5
MQYKLILNGKTLKGETTTEAVDAATAEKRFKKYANDNGVDGEHTYDWATKTFYVTE,-0.53909516,"V29R, Q32K, W43H, D47W, T53Y",5
MQYKLILNGKTYYGETTTEARDAATAEKVFKQYANDNGVDGEWTYDRATMTFTVTE,2.4937968,"L12Y, K13Y, V21R, D47R, K50M",5
MQYKLILNGKTVKGETLTEAVDAATAENRFKQYANDNGVDGEWTYDDATKRFTVTE,0.5931112,"L12V, T17L, K28N, V29R, T51R",5
MQYKLILNGRTLKGVTTTEWVDAATAVKVFKQYLNDNGVDGEWTYDDATKTFTVTE,-5.3703957,"K10R, E15V, A20W, E27V, A34L",5
MQYKLILNGKTLKGETTTWAVDAATREKVFKQYANDNGVDGEWTYDDWTKTFTVRW,-1.8927966,"E19W, A26R, A48W, T55R, E56W",5
MQYKLILNGKTLKGWTTTEAVYAATAEKRFKRYANDNGVDGEWTYDDRTKTFTVTE,5.9055037,"E15W, D22Y, V29R, Q32R, A48R",5
MQYKLILNGKTLKIETTTEAVDYATAEKVFKQYANANGVDGEWTYDRATKTFTRTE,-4.776929,"G14I, A23Y, D36A, D47R, V54R",5
MQMKLILNGKTLKGYTTTEAIDAATAEKVFKRYANDNGVDGEWTYDDWTKTFTVTE,3.7841303,"Y3M, E15Y, V21I, Q32R, A48W",5
MQYKLILNMKTLKGETTTEAVRAATAEKVFKQYYNDNGVLGEWYYDDATKTFTVTE,-2.4594815,"G9M, D22R, A34Y, D40L, T44Y",5
MQYKLILNGKYLKGETTTEAVDAAYAEKVWKQYRNDNGVDGEWTYDDATKTFTVYE,-3.5264804,"T11Y, T25Y, F30W, A34R, T55Y",5
MQYKLILQGKTLKGETTTEYVDYATAEKVFKQYANDNGVDGEWTYDDATKTWTVTK,-5.4859786,"N8Q, A20Y, A23Y, F52W, E56K",5
MQYKLILNGKTLKGETDTWAVDAATAELVFKQYANYNGVDGEWTYDDATKTFTVTP,-0.6076749,"T17D, E19W, K28L, D36Y, E56P",5
MQEKLILNGKTLKVETTTEAVKAATAKKVFKQYANDNGVDGEWTYDRATKTFTVTE,-4.950767,"Y3E, G14V, D22K, E27K, D47R",5
MQYKLILNGKTLWGWTTTEAVDAATAEKRFKQYANDNGVYGEWTYDDATKTFWVTE,7.0640073,"K13W, E15W, V29R, D40Y, T53W",5
MQYKLIYNGKTYKGETTTYAVDAATFEKVFKQYAWDNGVDGEWTYDDATKTFTVTE,-5.1033587,"L7Y, L12Y, E19Y, A26F, N35W",5
MQYKLILNGKTLKGETQTEAVDAATAEKRFKQYANDNGVWGEWTYDDRWKTFTVTE,6.685863,"T17Q, V29R, D40W, A48R, T49W",5
MQYKLILNGKTLKGETTTEAVDYATAEKRFQQYANDYGVDGEWTYDDATKTFTVTS,-5.161676,"A23Y, V29R, K31Q, N37Y, E56S",5
MQYGLIWNGKWLKGETTTEAVDAATAEKVFKQYAYDNGVWGEWTYDDATKTFTVTE,-2.9330812,"K4G, L7W, T11W, N35Y, D40W",5
MQYKLILNGKMLKGITTTEAVDAATAEKVFKQYANDLGVYGEWTYDDATKVFTVTE,3.5586066,"T11M, E15I, N37L, D40Y, T51V",5
MQYKLWLNGKTLKGETRTEAVDAATAEKVFKQYYNDRGVDGEWTYDDATKTFWVTE,-1.6061893,"I6W, T17R, A34Y, N37R, T53W",5
MQYKLIYNGKTLKGETTTEAVDAATAEKVFKQYANDNGVDGEWYYDDAYKTFKVYE,0.9191799,"L7Y, T44Y, T49Y, T53K, T55Y",5
MQLKLILNGKTLKGEFTTEAVDAATAEKVFKQYANDNGVDGEWTYWDFFKTFTVTE,2.3535342,"Y3L, T16F, D46W, A48F, T49F",5
MQFKLILNGKTLKGETTTERVDAYTAEKVFKFYANDNGVDGEWTYDDATKTFTVWE,4.5878277,"Y3F, A20R, A24Y, Q32F, T55W",5
MQYKLILNGKILKGETTYEAVDAATAEKVFKQYYNYNGVDGEWTYDDATKTFTVYE,-1.8772892,"T11I, T18Y, A34Y, D36Y, T55Y",5
MQYKLILNGKVLKGETTTEAVDMATAEKVFKQYANDLGVDGEITYNDATKTFTVTE,-4.7026415,"T11V, A23M, N37L, W43I, D46N",5
MQYKYILNGKTLKRETTTYAVDAATAEKVFKQYANDNGVDGWWTYDDATKTFTVTY,-0.5344275,"L5Y, G14R, E19Y, E42W, E56Y",5
MQYKLILNGKTLKGETTTEAVDAATAEKRFKQYANDNGVDLEWTYDKATKWFTVEE,0.40298072,"V29R, G41L, D47K, T51W, T55E",5
MQYQLILYGKTLKGETTTEAVDAATAEKVRKQYANLNGVDGEWTYNDATKTFTVTE,-0.84134525,"K4Q, N8Y, F30R, D36L, D46N",5
MQYKLILNGKWLKGETFTEAVDAAYAEKVFKQYANDNGVDAEWTYDDRTKTFTVTE,0.5038023,"T11W, T17F, T25Y, G41A, A48R",5
MQYKLILNGKTLKGEYTTSAVDYATAEKVFKQYAKDNGVDGEWTYDDATKWFTVTE,-5.1664224,"T16Y, E19S, A23Y, N35K, T51W",5
MFVKLILNGKTLKGETTTEAVDAATAEKVFKLYANDYGWDGEWTYDDATKTFTVTE,-3.6965418,"Q2F, Y3V, Q32L, N37Y, V39W",5
MQYKLYLNGKTLWGETTTEAVDAATAEKVFKQYANDNWVDGEWVYDDATKTYTVTE,0.3787807,"I6Y, K13W, G38W, T44V, F52Y",5
MQYKLILNGKLLKGETTTEAVDAFTAEKVFKQYANDNGVWGEWTYHDATKTFTVTT,4.9806285,"T11L, A24F, D40W, D46H, E56T",5
MQYKLILNGKTYKGETTTEWVDAATAEKVFKQYANQNGVDGEWTYDDATYTFYVTE,0.010484539,"L12Y, A20W, D36Q, K50Y, T53Y",5
MQYKLIKNGKTLKGETTTEAYDAAWAEWVFKQYANDNGVDGEWTYNDATKTFTVTE,-0.13586044,"L7K, V21Y, T25W, K28W, D46N",5
MQYKLFYQGKTLKGETTTEAVDAATAEKVFKQYANGNGVDGEWTYDDRTKTFTVTE,2.5127022,"I6F, L7Y, N8Q, D36G, A48R",5
MQYKLILNGKTLKGETTTEAVDRATAEKVFKLYANDNGVDWEWYYDDATYTFTVTE,-3.575117,"A23R, Q32L, G41W, T44Y, K50Y",5
MQYKLILWGKTLKGEWTTEAVDAATAEKVFKQYANDNGVDGEFTYDDARFTFTVTE,-1.89837,"N8W, T16W, W43F, T49R, K50F",5
MNYKLILYGKTLKGETTTEAVDAATAEKVFKWYANDNGVDGEWTYDDATKTFVVTD,1.020331,"Q2N, N8Y, Q32W, T53V, E56D",5
MQYKLIHNGKSLKGETTTEAVDAAWAEKVFKQYGNDNGVDGEWTYDDATKTWTVTE,-5.211765,"L7H, T11S, T25W, A34G, F52W",5
MRYKLILNGKTLKGETTTEAVDAARREKVFKQYAGDNGVWGEWTYDDATKTFTVTE,-1.62629,"Q2R, T25R, A26R, N35G, D40W",5
MTYKLILNGKTLKGETTREAVDAATAEKVFKQYANDNGVDGEWNYDRATKTFTKTE,-0.051452365,"Q2T, T18R, T44N, D47R, V54K",5
MQYKLILNGKTLKGEWTTEAVDAATAEKVFKQYANFNGVDGEWTYDDATKTWYYTE,-5.028166,"T16W, D36F, F52W, T53Y, V54Y",5
MQYKWILNGKTYKGEWTTEAVDAATAEKVFKQYANDNGVDGEWTYDDATKEFTVFE,-2.2681992,"L5W, L12Y, T16W, T51E, T55F",5
MQYKLILNGKTLKGWTTTEAVRIVTAEKVFKQYANDFGVDGEWTYDDATKTFTVTE,-0.72016037,"E15W, D22R, A23I, A24V, N37F",5
MQYKVILNGKTWKGETTTEAVDAATAEKVFKQYANDNGVDGEWIYDDATKEFWVTE,0.8294701,"L5V, L12W, T44I, T51E, T53W",5
MQYKLILNGKTLKGETTTEAVLAATAERVFKQYANDNGVDGEWTYNDYTKTWTVTE,-1.5867467,"D22L, K28R, D46N, A48Y, F52W",5
MKYKLILNGKTLKGETTTEAYDAATAEKVFWQYANDNWVDGEWTYDDATKWFTVTE,-1.6750692,"Q2K, V21Y, K31W, G38W, T51W",5
MQYKLILNGKTLKGFTTREAVDAATAEKWFKQYANDNWVDGEWTYDDATKTFYVTE,2.5056539,"E15F, T18R, V29W, G38W, T53Y",5
MQYKWILNGKTLKGFTTTEAVDAATAEKVFKQYANDNGVDGEWYYDDATKKFTVTS,-0.08248081,"L5W, E15F, T44Y, T51K, E56S",5
MQYKLILNGKTLIGERTTEAVDAATAEKVFKQYANFNGVLGEWTYDDATKTFTVRE,2.8655992,"K13I, T16R, D36F, D40L, T55R",5
MQYKLILNGKTLKGETTTEAYDAATAEKVFWQYANDNGVDGAWTYDRASKTFTVTE,-0.06850084,"V21Y, K31W, E42A, D47R, T49S",5
MQYKLILNGKYLKGETTTEAVDLATAEKVFKQYANMNGWDGEWTYDDATKTFTLTE,-4.233215,"T11Y, A23L, D36M, V39W, V54L",5
MQYKLILNGKTLYGLTTTEATDAATAYKVFKQYANDNGRDGEWTYDDATKTFTVTE,-5.675503,"K13Y, E15L, V21T, E27Y, V39R",5
MQYKLILNGKTLKGETTTESVDAATAEKVFKQYANDNHVDGEWTYDHATKTYTVTW,0.0010592267,"A20S, G38H, D47H, F52Y, E56W",5
MQYKSILNGKTLKGETTTEAVDAATAEFVWKQYANDNGVDGEWTFDDATKTFTVTW,-3.4073665,"L5S, K28F, F30W, Y45F, E56W",5
MQFKLILNGKTLKGHTTTEAVDAARAEKVFKQYAYDNGYDGEWTYDDATKTFTVTE,-1.7973341,"Y3F, E15H, T25R, N35Y, V39Y",5
MQYKLYRNGKWLKQETTTEAVDAATAEKVFKQYANDNRVDGEWTYDDATKTFTVTE,-0.6061894,"I6Y, L7R, T11W, G14Q, G38R",5
MQYKLILNGKTLKGETTTEAVDAATKLKVFKQYMNDNGVDGEWTYDDRTKTFTFTE,-5.776771,"A26K, E27L, A34M, A48R, V54F",5
MQYKLIVNGKTLKGETTTEAVDAYTAYKVFKQYANDYGVDGEWTYDDATKTFTVRE,-2.4702501,"L7V, A24Y, E27Y, N37Y, T55R",5
MQYKLILNGKTLKGETTTEFVDAATKEKVFKQYANDNGVYGEWTYDRATKTFYVTE,-1.218094,"A20F, A26K, D40Y, D47R, T53Y",5
MQYKLILNGKTLKGETTTEACDAYTAEKVFKWYANYNGVDGEWTYDDATKYFTVTE,4.475713,"V21C, A24Y, Q32W, D36Y, T51Y",5
MRYKLILNQKTLKGETTTEAVDAATWERVFKQYANDNGVDGEWTYDDATKTFTVYE,-3.3826873,"Q2R, G9Q, A26W, K28R, T55Y",5
MSYKLILNGKTLKGETTTEAVDAATAWKVFKQYANDNWVDGEWTYDDAWKTFWVTE,-2.7469702,"Q2S, E27W, G38W, T49W, T53W",5
MQYKLILNGKTLKGETTTEAWDAATAWKVFKGYANDNYVDGEWTYDDATKTYTVTE,-4.553818,"V21W, E27W, Q32G, G38Y, F52Y",5
MTYKLIYNGKTLKLETTTEAVDAATAEKVFKQYANDNGVDGKYTYDDATKTFTVTE,-3.8551192,"Q2T, L7Y, G14L, E42K, W43Y",5
MQYKLIKNGKTLKGEWTTEAVRAATAEKVFKQYANDNGVDPEWTYDDATKTWTVTE,-5.974257,"L7K, T16W, D22R, G41P, F52W",5
MQYKLIWNGKTLYGETTTEAVDAATAYKVFKQYANDNGVDGEWTYLDATKFFTVTE,-4.72822,"L7W, K13Y, E27Y, D46L, T51F",5
MQYKLILNGKTLKGEWTYEAVDWATAIKVFKQYANDNGVDGEWTYDWATKTFTVTE,-5.1121097,"T16W, T18Y, A23W, E27I, D47W",5
MQYKLILNGKTYKGETTTEAVDAATFEKVFKQYANDNGVDGWWTYDDAWKTYTVTE,-4.8175344,"L12Y, A26F, E42W, T49W, F52Y",5
MQYKLILNGKWLYGETTTEAVDAATAEKVFKQYANDNGVWGEWLYDRATKTFTVTE,4.8264256,"T11W, K13Y, D40W, T44L, D47R",5
MQYKNIWNWKTLNGETTTEAVDAATAEKVFKQYANDNGVDGEWTYDDATKTFYVTE,-2.4158263,"L5N, L7W, G9W, K13N, T53Y",5
MQYKLIRNGKTFKGETTTEWVDAATAEKVFRQYAWDNGVDGEWTYDDATKTFTVTE,-5.1943145,"L7R, L12F, A20W, K31R, N35W",5
MQYKLILNGKTLKGETTTEAVDAATREVVFKVYLNDNGVDGEWTYDDATKTFTVTW,-5.626876,"A26R, K28V, Q32V, A34L, E56W",5
MQYKLIWNGKTLKGETTTEAIDAATQAKVFKQYLNDNGVDGEWTYDDATKTFTVTE,-5.866971,"L7W, V21I, A26Q, E27A, A34L",5
MQYKLILQGKTLYGETTTEYVDAATAEKVFKQYANDNGVWGEWTYDDATWTFTVTE,3.392401,"N8Q, K13Y, A20Y, D40W, K50W",5
MQYKLILNGKTYKWETTTEAVDAATAEKVAKQYANDNGVDGEWTYDDRTKTFWVTE,-1.4838156,"L12Y, G14W, F30A, A48R, T53W",5
MQYWLILNGKTLKGETWTEAVDAATAEKVFKQYANDNGVWGEWTYWDATKTFIVTE,4.9613585,"K4W, T17W, D40W, D46W, T53I",5
MYYKLILNGKTLKGETTTEAVDAATAEKRFKQYANDNWVDGEWTYDRARKTFTVTE,5.8377275,"Q2Y, V29R, G38W, D47R, T49R",5
MWYYLIYNGKTLKGETTTEAVDAATAEKVFKQYANDNGWDGETTYDDATKTFTVTE,-4.717816,"Q2W, K4Y, L7Y, V39W, W43T",5
MQYKLILNGKTLKGERTTEAVMAATAERVFKQYANDNGVDGYWIYDDATKTFTVTE,2.322663,"T16R, D22M, K28R, E42Y, T44I",5
MQYKLILNGKTLYGETTTEAVDAATAEEVFYQYAWDNGVDGEWTYDDRTKTFTVTE,-6.009153,"K13Y, K28E, K31Y, N35W, A48R",5
MQYKLILNGRTLKGETTTEAVDYATAENVFKQYANDNGWDGEWTYFDATKTFTVTE,-4.9483967,"K10R, A23Y, K28N, V39W, D46F",5
MCYKLILNGRTLKKETTTEAVDAATREKVFKQYANDNGVDGEWTYDDATKTFTVTK,-3.688871,"Q2C, K10R, G14K, A26R, E56K",5
MQQWYILNGKTLKGETTTRAVDAATAEKVFKQYANDNGVDGEWTYDDWTKTFTVTE,-1.3771518,"Y3Q, K4W, L5Y, E19R, A48W",5
MQYKMWLNGKRLKGETTTEAVDALTREKVFKQYANDNGVDGEWTYDDATKTFTVTE,-2.9480114,"L5M, I6W, T11R, A24L, A26R",5
MQYKLILNGKTLKGETTTSAVDAATAEKVFKQYRNLNGVDGEWTYDRATKTWTVTE,-4.2032065,"E19S, A34R, D36L, D47R, F52W",5
MQYKLIWNGKTLKGETTTIAVDAATAEKVFKQYRNDNGVDGEWTYDDATKTFRVTY,-3.9147758,"L7W, E19I, A34R, T53R, E56Y",5
MQYELILNGKTYKGETTTEAVDAATAEKVFVQYANDFGVDGEWTYDDATKTFTVTR,-5.485538,"K4E, L12Y, K31V, N37F, E56R",5
MQYKLILNWKTLKGETTTEAWDAAWREKVFKQYANDNGVDWEWTYDDATKTFTVTE,-4.755448,"G9W, V21W, T25W, A26R, G41W",5
MQYLLILNGKTIWGETTTEAVDAATREKVFKQYWNDNGVDGEWTYDDATKTFTVTE,-5.1662636,"K4L, L12I, K13W, A26R, A34W",5
MQYKLILNGKTLIGYTTTQAVDAATAEKVFKQYANDNGVDGEWYYDDAVKTFTVTE,4.1989665,"K13I, E15Y, E19Q, T44Y, T49V",5
MQYKLILNGKTLKGEWTTEAVDAATAEKRFKQIANDNGVDGEWTYRDATKTFTVTW,1.3313179,"T16W, V29R, Y33I, D46R, E56W",5
MQYKLILNGKTLKGETTTYAVDAATAEKVWKQYLNDNGVDGEWTYDDARKTFTVYE,-0.4520946,"E19Y, F30W, A34L, T49R, T55Y",5
MQYKLIFNGKTLKGETTTEAVDQATREKVFKQYANDNGVDGEWWYDDATKTFCVTE,-3.7589273,"L7F, A23Q, A26R, T44W, T53C",5
MQYKLILNGKTLKGETYTEAYDAATATKRFKQYANDNGVDFEWTYDDATKTFTVTE,-4.0401626,"T17Y, V21Y, E27T, V29R, G41F",5
MQYKLILNGKTLKGETTTEAVDAATAEYVFKQYANDNGVYWEWTYDDAQYTFTVTE,-2.6228106,"K28Y, D40Y, G41W, T49Q, K50Y",5
MQYKLILNGKTLKGETWTESVDAATAEKVFDQYANDKGVDGEWTYDDAWKTFTVTE,-3.227438,"T17W, A20S, K31D, N37K, T49W",5
MQFKLILNGKTYKGETTTEAVDAATAEKVFKQYANYNDVDWEWTYDDATKTFTVTE,-3.7540348,"Y3F, L12Y, D36Y, G38D, G41W",5
MQYKLILNGKTYKNETTTEAVDAATAEKVFKQYLNDNGVDGEWTYDDATKTYTKTE,-5.8330956,"L12Y, G14N, A34L, F52Y, V54K",5
MQYKLFWNGKTLKRETNTEAVDAATAEKVFKQYANDNGVDGEWTYNDATKTFTVTE,-0.3514105,"I6F, L7W, G14R, T17N, D46N",5
MQYKLILNGMWLKGETTTEAVDTATAEKVFKQYANLNGVDGEWTYDRATKTFTVTE,2.5213788,"K10M, T11W, A23T, D36L, D47R",5
MQYKLILNGKYLKGETTWEAVDAATARKVWKQYANDNGVDGEWTYDDATYTFTVTE,-4.904167,"T11Y, T18W, E27R, F30W, K50Y",5
MWYKLILNGKTLKGETCTEFVDAATAEKKFKQYANDNGVDGEWTYDDATKTFTVLE,2.9371552,"Q2W, T17C, A20F, V29K, T55L",5
MQYKLILNGKTLKGETTTEAVDKATAWKRFKQYANDNGVDGYWWYDDATKTFTVTE,-3.392322,"A23K, E27W, V29R, E42Y, T44W",5
MQYKLILNGKWLFGETTTEAVDKATAEKVFKQYANDNGVDWEWTYDDATKTWTVTE,-5.4442415,"T11W, K13F, A23K, G41W, F52W",5
MQMKLILNGKTLKGETRTEAVDAWTAEKVFKQYANDNGVDYEWTYDDATKTFTVTK,-1.5366257,"Y3M, T17R, A24W, G41Y, E56K",5
MQYKLILNGKTLKGYTYWIAVDAATAEKVFKQYANDNGVDGEWTYDDYTKTFTVTE,4.7736516,"E15Y, T17Y, T18W, E19I, A48Y",5
MQYKVILEGKTLKGETTTEYWDAATAWKVFKQYANDNGVDGEWTYDDATKTFTVTE,-3.902699,"L5V, N8E, A20Y, V21W, E27W",5
MQYKLILNGKTLKGEWTTEWVDAATAEKVFKQYANDNGVWGEWTYDRATRTFTVTE,4.133756,"T16W, A20W, D40W, D47R, K50R",5
MQYKLILNGKYLKGETTTEAVDAAYAEKVRKQYANENGVDGEWTYDDATKTFTVTY,-3.436889,"T11Y, T25Y, F30R, D36E, E56Y",5
MQRKLILNGKTLKGWTTTEAVDAATAEKVFKQYANDWMVDGEWTLDDATKTFTVTE,-3.2914479,"Y3R, E15W, N37W, G38M, Y45L",5
MQYKLFLNGKTLKGETTTEAQDAATREKYFKSYANDNGVDGEWTYDDATKTFTVTE,-1.1561278,"I6F, V21Q, A26R, V29Y, Q32S",5
MQYHLSLNGKTLKGETTTEAMDAATREKVFKQYANDNGVFGEWTYDDATKTFTVTE,-1.0767205,"K4H, I6S, V21M, A26R, D40F",5
MQYKLYLNGDTLFGETTTEAVDAARAEKVFKQRANDNGVDGEWTYDDATKTFTVTE,3.259703,"I6Y, K10D, K13F, T25R, Y33R",5
MQYKLILNGLWWKGETTTEAVDAATAEKVFKQYANDNGVDGEWYIDDATKTFTVTE,-1.1086267,"K10L, T11W, L12W, T44Y, Y45I",5
MQYKLILNGKTLKGETTTEALDAATAEKVFKFYANDNGVDGEWTYDDATKTFVVKR,0.6127427,"V21L, Q32F, T53V, T55K, E56R",5
MQYKLILNGRTLMGETTTEAVDAATAEKWFKQYANANGVDGEWTYDDATKTFTRTE,-1.12066,"K10R, K13M, V29W, D36A, V54R",5
MQYKLILNGKTLKGETTTEAVMAATREYVFKQYANDNGVWGEWLYDDATKTFTVTE,-3.098053,"D22M, A26R, K28Y, D40W, T44L",5
MQYKLILNGKFLYGETTWEAVDAATAEKVFKQYANDNGVDGEWTYDRATKTFTVYE,2.727775,"T11F, K13Y, T18W, D47R, T55Y",5
MQYKLILNGKFLKGETNTEAVDAATAEKVFKQYANWNGVDGYWTYDDATGTFTVTE,2.8827865,"T11F, T17N, D36W, E42Y, K50G",5
MQYKLILNGKTLKGETTTEAVDYATAEKVFKQYAYDNGVDGEWTYNRATKTFLVTE,-4.1272635,"A23Y, N35Y, D46N, D47R, T53L",5
MQYKLILNGKTLKGETTTIAVDRATAEKVRKQYANDNGVDGEWTYDDYTKIFTVTE,-3.2487376,"E19I, A23R, F30R, A48Y, T51I",5
MQYKLIRNGKTLKRETTTEAVDAATAEKVFKQYANDNGVDIWWTYDDRTKTFTVTE,-4.0842876,"L7R, G14R, G41I, E42W, A48R",5
MQIKLILNGKTLKGETTTEAVDAATAEWVFKWYRNDNGVDGEWTYDDATKFFTVTE,-4.492599,"Y3I, K28W, Q32W, A34R, T51F",5
MQYKLILNGKTLKGETTTEAVFAATAEKVFKDYALDNGVDGENRYDDATKTFTVTE,-5.7875977,"D22F, Q32D, N35L, W43N, T44R",5
MQYKLILNGKTLLFETTTGAVDAATAEKVFKWYAYDNGVDGEWTYDDATKTFTVTE,-4.2778306,"K13L, G14F, E19G, Q32W, N35Y",5
MQYKLILNGKTLKGETTTEAVDAATAEKLFKQYANDNGVDMEWYYDDLYKTFTVTE,-0.5145875,"V29L, G41M, T44Y, A48L, T49Y",5
MQYKFILNGKFLKGETTTEAVDAATAEKVYKQRANDNGVDGEWTYLDATKTFTVTE,-0.5968274,"L5F, T11F, F30Y, Y33R, D46L",5
MQYKLILNGKTLKGETTTEAVDAATAEKRFKQYAFDNDVDGEWTYDDATKTYTVTR,-3.974605,"V29R, N35F, G38D, F52Y, E56R",5
MYYKLILNGKTLKGWTLTEAVDAATHMKVFKQYANDNGVDGEWTYDDATKTFTVTE,-5.2644277,"Q2Y, E15W, T17L, A26H, E27M",5
MQYKLILNGKTLKGETTTEWWDAATAEKVFKQYANDNGYYGLWTYDDATKTFTVTE,2.356482,"A20W, V21W, V39Y, D40Y, E42L",5
MNYKLILNGRTLKWETTTEAVDAATAEKVFKKYANDNGVDGEWTYLDATKTFTVTE,3.2981474,"Q2N, K10R, G14W, Q32K, D46L",5
MQYKLILNGKTHKGETTTEAVDAWTALKVFKQYANDNGVWGEWTYDDATKTFTVYE,-1.3754526,"L12H, A24W, E27L, D40W, T55Y",5
MQYKLILNGKWLKGETTTEAVDWAYAEKVFKKHANDNGVDGEWTYDDATKTFTVTE,-2.6442459,"T11W, A23W, T25Y, Q32K, Y33H",5
MQYKLYLNGKTLKGETTTEAVDAATAEKVFKQYANDNCVDGEWYYDDWTWTFTVTE,3.1379938,"I6Y, G38C, T44Y, A48W, K50W",5
MQYKLRLNGKWLKGETTTEAVDMATAEKVFKQYANDNGVYGEWTYDDATKTFTVWE,0.2602657,"I6R, T11W, A23M, D40Y, T55W",5
MQYKLILNGKTLYGETTTEAVDAATAYKVFKQYANDNGVDCEWTYDDYTKTFTVTY,-5.699361,"K13Y, E27Y, G41C, A48Y, E56Y",5
MPYKLIVNGKTLKPETTTEAVDAATREKVFKQYANDNVVDGEWTYDDATKTFTVTE,-3.8860335,"Q2P, L7V, G14P, A26R, G38V",5
MRYKLILNGKTLYGETMTEAVDAATAEKRFEQYANDNGVDGEWTYDDATKTFTVTE,-1.488444,"Q2R, K13Y, T17M, V29R, K31E",5
MQYKLILNGKLLKGETTTEAVDAAWAEKVFRQYANDMGVDGEWTYDDATKTFRVTE,-0.060637094,"T11L, T25W, K31R, N37M, T53R",5
MQYYLIINGKTLKGETTTEAVDAATAEKVFKQYANNNGVDGERTYDDATRTFTVTE,-1.0235616,"K4Y, L7I, D36N, W43R, K50R",5
MQYKKILNGKTLKGETTSEAVDAAWAEKVFKQYANDNGVDMEWTYDRATKTFTVTE,-3.871444,"L5K, T18S, T25W, G41M, D47R",5
MQYKLILNGKTLKGWTTTWAVDAATAYKVFKQIANDNGVDGEWWYDDATKTFTVTE,-2.707716,"E15W, E19W, E27Y, Y33I, T44W",5
MQYKLELNGKTLKGETTTEAVAAATAEKVFKQYANDNGWDGWWTYDDRTKTFTVTE,0.38379332,"I6E, D22A, V39W, E42W, A48R",5
MQYKLILYGKTLKGETTTEAVDAATAEKVFKQMVNDNGVDGEWTYDDWTKTFTVWE,1.329099,"N8Y, Y33M, A34V, A48W, T55W",5
MQYKLILNGKTLKGRTTTEAYDAATAEKVFKQYANDNGVDGEWYYDWATKAFTVTE,4.563094,"E15R, V21Y, T44Y, D47W, T51A",5
MQYYLILNGKTLKGETTTEAVDAARAEKVFYQFANDNGVDGEWTYDDATKTLTVTE,-3.5041885,"K4Y, T25R, K31Y, Y33F, F52L",5
MQPKLILNGKWLKGETTTEAVDAATREWVFKQYANDNGVDGFWTYDDATKTFTVTE,-5.185259,"Y3P, T11W, A26R, K28W, E42F",5
MQYKLLLNGKWLKGEWTTEAVDAATAEKVFKQYANDNGVDGEWTYDRATRTFTVTE,3.3043325,"I6L, T11W, T16W, D47R, K50R",5
MQYKLILNGKTLKGQTTTEAVDAATAEKVVKQYANDNGVDCLWTYDDATKTFLVTE,-0.46084192,"E15Q, F30V, G41C, E42L, T53L",5
MQYKLILNNKTLKGETTTEAFDAYTAEKVFKQYANDNGVWGEWTYNDATKTFTVTE,5.753,"G9N, V21F, A24Y, D40W, D46N",5
MQFKLILNGKTLKGETTTEAVDYATAEKVFKQYANWNGVDGEWTYDRITKTFTVTE,-0.20750815,"Y3F, A23Y, D36W, D47R, A48I",5
MQYKLILNGKTLYGKTYTWAVNAATAEKVFKQYANDNGVDGEWTYDDATKTFTVTE,3.8450775,"K13Y, E15K, T17Y, E19W, D22N",5
MQYKLILNGKTLKGETTTEAVDAATAEKVSRQYANWNGYDGEWTYDDWTKTFTVTE,-2.5181112,"F30S, K31R, D36W, V39Y, A48W",5
