Sequence,Score,Mutations,Number of Mutations
MQYKLILNGKTLYGETTTEAVDAATAEKVFKQYANDNGVDGWYQYDDATKTFTVTW,-2.0502548,"K13Y, E42W, W43Y, T44Q, E56W",5
MQYKLILNGKTLKGETTTEAVDAWTAEKRFKQYSNDNGYDGEWTYDRATKTFTVTE,4.575878,"A24W, V29R, A34S, V39Y, D47R",5
MQYKLILNGKMLKGETRFEAVDAATAEKVFKQYANDLGVDGEWTYDDFTKTFTVTE,1.5286949,"T11M, T17R, T18F, N37L, A48F",5
MQYKLILNGKTLKGETYTEAVDAATWKWVFKQYANDNGVWGEWTYDDATKTFTVTE,-4.9444265,"T17Y, A26W, E27K, K28W, D40W",5
MQWKLIFNGKTLKGETTTEAVDAATAEKVYKQYANDGGVDGEWTYDDATKTFTVTK,-1.0979595,"Y3W, L7F, F30Y, N37G, E56K",5
MNYKLILNGKTLKLETTTEAVDFWTAEKVFKQYANDNGVYGEWTYDDATKTFTVTE,0.17215666,"Q2N, G14L, A23F, A24W, D40Y",5
MQYELILNGKTLKGRTTTEAVDAATAEKVFKQYANDWYVDGEWTYNDATKTFTVTE,1.0539196,"K4E, E15R, N37W, G38Y, D46N",5
MQMKWILNGKTLKGETWTEAVDAATIEKVRKQYANDNGVDGEWTYDDATKTFTVTE,-4.9201283,"Y3M, L5W, T17W, A26I, F30R",5
MQPKIILNGKTLKGETTTFAVDAAYAEKVFKQYAWDNGVDGEWTYDDATKTFTVTE,-4.0163217,"Y3P, L5I, E19F, T25Y, N35W",5
MQYKLILNGKTLKGRTTTEAVDRAYAEKVFKQYANLNGVDGEATYDDATKTFTVTE,-4.107688,"E15R, A23R, T25Y, D36L, W43A",5
MQYKLIKNGKRLKGFTTTEAVDAATAEKVFIQYLNDNGVDGEWTYDDATKTFTVTE,-5.5310497,"L7K, T11R, E15F, K31I, A34L",5
MQYKLILNGKTLKGEWTTEWVDAATAEKVFKQWANDNWVDGWWTYDDATKTFTVTE,1.1617767,"T16W, A20W, Y33W, G38W, E42W",5
MQYKLILNGKTLKGETTTEAVDAATAEKVYEQYANDNGVDGEIIYQDATKTFTVTE,-5.756615,"F30Y, K31E, W43I, T44I, D46Q",5
MQYKLILNGKTLKGETTTYAVDGATAEWVFKQYANDAWVDGEWTYDDATKTFTVTE,-2.2746806,"E19Y, A23G, K28W, N37A, G38W",5
MQYKLILNGDTLKGETTTEAVDAATAEKVFKRYAKDNGVYGEQTYDDATKTFTVTE,-5.0146747,"K10D, Q32R, N35K, D40Y, W43Q",5
MQYKLIRNGKTLKGETTTEAVDAYTAEKVWKQYANDNGVDGEWTYDDAWRTFTVTE,2.6616526,"L7R, A24Y, F30W, T49W, K50R",5
MQYKLILNGKTLKGETTTEAVDAATAEKVRKQYANDNLYDGEWTYYDWTKTFTVTE,-4.730887,"F30R, G38L, V39Y, D46Y, A48W",5
MQYKLILNGKTLKGETTTEAVDAATAEKVKKQYANDYGVDGEWTYEDATKWFTATE,-2.030006,"F30K, N37Y, D46E, T51W, V54A",5
MQYKLILNRKWLKGETTTEAVDAATAEKVFKQYANDNGWDGEWTYNDWTKTFTVTE,-1.9994063,"G9R, T11W, V39W, D46N, A48W",5
MQYKLILNGKTLKGETTTEAFDAATAEKVFKEYANDNGVDGEMTYDDATYTFYVTE,-4.029466,"V21F, Q32E, W43M, K50Y, T53Y",5
MQYKLILKGKTLKGETKTEARDAATAEKVFKQYANDNYVDGWWTYDDATKTFTVTE,4.3173633,"N8K, T17K, V21R, G38Y, E42W",5
MQYKLILNGKTLYGETRTEAVDAATAEKVFKQYANDNGVDGEWWYDRATKWFTVTE,5.0699077,"K13Y, T17R, T44W, D47R, T51W",5
MQYKLILNGQTLKGRTTYEAVDAYTAEKVKKQYANDNGVDGEWTYDDATKTFTVTE,2.1929708,"K10Q, E15R, T18Y, A24Y, F30K",5
MQYKLILNGKTLKGEATWEAVRYATAEKVLKQYANDNGVDGEWTYDDATKTFTVTE,-3.0363004,"T16A, T18W, D22R, A23Y, F30L",5
MQYKLILNGKTLKGEIRTEAVDAATAEKVFKQWAVDNGVDIEWTYDDATKTFTVTE,-5.550716,"T16I, T17R, Y33W, N35V, G41I",5
MQYKLILNGKTLKGEWTTEEVDAATYEKRFKQYANDNGVDGEWTYDDATKTYTVTE,-4.817678,"T16W, A20E, A26Y, V29R, F52Y",5
MQYKLILNGKYLKGETTTEWVDAATAEKVAKQYAKDNGVDGEWTYDDATKTFTVTV,-5.806524,"T11Y, A20W, F30A, N35K, E56V",5
MQYKLILNGKTYTGETTTEAVDAATAEKVFKQYAVDNGVDGEWTYDRRTKTFTVTE,-1.2140439,"L12Y, K13T, N35V, D47R, A48R",5
MQYKLIYNGKTLKGETTTWAVDAAYAEKVFKQYANDNGVDGEWTYDDARKTFTVTY,0.6915911,"L7Y, E19W, T25Y, T49R, E56Y",5
MQYKLILNGRTLKGETTTEAVDNATAEKVFKRYANRYGVDGEWTYDDATKTFTVTE,1.9100883,"K10R, A23N, Q32R, D36R, N37Y",5
MQYKLILNGKTLKGEWTTFAVDAATAEKVFKQYAWDNGVDGEWEYDDATCTFTVTE,-0.81123066,"T16W, E19F, N35W, T44E, K50C",5
MQYKLLLYGKTLKGETTTEAVDAATAEKVFKQYYNDEGVDGWWTYDDATKTFTVTE,-0.7238838,"I6L, N8Y, A34Y, N37E, E42W",5
MQYKLYLNGKTLKGYTTTEAVDAATREKVFLQYANDNGVDWEWTYDDATKTFTVTE,-5.6609993,"I6Y, E15Y, A26R, K31L, G41W",5
MQYKVILNGKTLKWEWTTEAVDAATAEKVFKQYANDNGVDGWWTYDDATKWFTVTE,2.0006073,"L5V, G14W, T16W, E42W, T51W",5
MQYTLILNGKTIKGETYTEAVRAATAEKVFKQYANDNGVDGEWTYDRATKTFTVTE,3.9324088,"K4T, L12I, T17Y, D22R, D47R",5
MQYKLILNGKTLKGETTTEFVDAATWEKVFKQYANDNGYDWEWTYDDWTKTFTVTE,-5.359764,"A20F, A26W, V39Y, G41W, A48W",5
MQYKLILNGKTLKGETWTEAVDAAYAEKVFKQYANYNGVDNEWTYDDATVTFTVTE,-1.5987778,"T17W, T25Y, D36Y, G41N, K50V",5
MQYKLILNGKTLWGETTTEAVDPATKEKVFKQYANDNGVDGEWTYDRATKTFTLTE,-1.1584643,"K13W, A23P, A26K, D47R, V54L",5
MQYKLILNGKTLKGETTTEAVYAATAEKVFKQYLYDNGVDGEWTYDDATKTVTVWE,-5.0241404,"D22Y, A34L, N35Y, F52V, T55W",5
MDYKLILNGKTLKGETTTEAVDAAWAGKVFDQYANDNGVDGEWTYDDATKTITVTE,-6.145458,"Q2D, T25W, E27G, K31D, F52I",5
MQYKLIQNGKTLKGETTTEAVDAATAEKVFKQLANDNGVDGFWTYDDRTKTFTWTE,1.0255016,"L7Q, Y33L, E42F, A48R, V54W",5
MFYGLILNGKTLKGETTWEAVDFATAEKVFKQYANDNGVDGEWTYDDATKTYTVTE,-3.4251997,"Q2F, K4G, T18W, A23F, F52Y",5
MQYKLILNGKTLKGRWTTEAVDAATAEWVFKWYANDNGFDGEWTYDDATKTFTVTE,-3.247504,"E15R, T16W, K28W, Q32W, V39F",5
MQYKLILNGKTLKGETTTEFVAAATAEKVFKQYAWDNGFDHEWTYDDATKTFTVTE,-4.957301,"A20F, D22A, N35W, V39F, G41H",5
MQYKLILNGKTLKGFTTTEAVDAYTAEKVFKQYANDNVYFGEWTYDDATKTFTVTE,3.3617728,"E15F, A24Y, G38V, V39Y, D40F",5
MQYKLILNGKTLWGETTTEAVDAATAEWVFKQYAFDNGVDGWWTYDRATKTFTVTE,-1.2336329,"K13W, K28W, N35F, E42W, D47R",5
MKEKLILNGKTLKGPTTTEAVDAATLEKVFRQYANDNGVDGEWTYDDATKTFTVTE,-5.385314,"Q2K, Y3E, E15P, A26L, K31R",5
MQYKLLLNGKTLKGETTTEAVDAATAEKVFKQYWNFNGVDGYWTYDDATLTFTVTE,-0.73222053,"I6L, A34W, D36F, E42Y, K50L",5
MQYKLIWNGKTLKGERLTEAVDAATAEKVFKQYANDNGLDGEWTYDDATKTFTVTW,0.41585314,"L7W, T16R, T17L, V39L, E56W",5
MQYKLILNGKTLKGEDTTELFDAATAEKVFKQYANDNGVDGEWTYDKATKTFTRTE,-3.4277995,"T16D, A20L, V21F, D47K, V54R",5
MQYKLILNGKTLKGWTTTEAVDAATAEKVFKQYAYDNGVDGEWTYDRHTKTFTVRE,0.9782153,"E15W, N35Y, D47R, A48H, T55R",5
MQYKLILNGCTLKGETTYEAVDAATFEKVFKYYANDNGVDGEWTFDDATKTFTVTE,-2.8619287,"K10C, T18Y, A26F, Q32Y, Y45F",5
MQTKLILNGKTLWGEATTEAVKAATAEKVFKQYANDNGVDGEWTYDLATKTFTVTE,0.55693173,"Y3T, K13W, T16A, D22K, D47L",5
MQYKLILNGWTLKGETTTSAVDAATAEKVFKLYANDNGVDGMWTFDDATKTFTVTE,4.361363,"K10W, E19S, Q32L, E42M, Y45F",5
MQYKLYWNGKTLKGETTTEAVDAETAEKVFKQWANDNGVDDEWTYDDATKTFTVTE,-2.3559117,"I6Y, L7W, A24E, Y33W, G41D",5
MQYKLIWWGKTLKGETHTEAVDAATAEKVFKQYANDNGVDGEYHYDDATKTFTVTE,-3.4345293,"L7W, N8W, T17H, W43Y, T44H",5
MQYELILKGKTLKGETTTEAVDAATAEKVFKQWYNFNGVDGEWTYDDATKTFTVTE,-1.4619279,"K4E, N8K, Y33W, A34Y, D36F",5
MQYKLIWNGKTLKGEFTTEAVDAATAEYVFKQYANDNGWDGEYTYDDATKTFTVTE,-5.60444,"L7W, T16F, K28Y, V39W, W43Y",5
MQRKLILNGKTWKWETTTEAVDAYTAEKVFKQYANDNGVDGEWTYDDATKTFTRTE,-4.608879,"Y3R, L12W, G14W, A24Y, V54R",5
MQYKLILNGKTYKGETTYEWVDAATAEKVFWQYANDNGVDGEWDYDDATKTFTVTE,-5.2894177,"L12Y, T18Y, A20W, K31W, T44D",5
MQYKFIVNGKTLKGETTTEAVDAATREHVFKQYANDNGVDGEWTYDDATETFTVTE,-4.3438797,"L5F, L7V, A26R, K28H, K50E",5
MQYFLILRGKTLKGETTTEAVDAATAEKVKKQYANDNGVDWEWTYDDGTKTFTVTE,-4.4427156,"K4F, N8R, F30K, G41W, A48G",5
MQYKLILNGKYLKGETTTYYYDAATAEKVWKQYANDNGVDGEWTYDDATKTFTVTE,0.8771949,"T11Y, E19Y, A20Y, V21Y, F30W",5
MQWKLYLNGKTLKGETTTEAVDAATAEKVFKQYMNDNGVWGEWTYDDATKTFTVLE,4.4940157,"Y3W, I6Y, A34M, D40W, T55L",5
MQYKLIFNGKTWKGETTTEAVDAATAEKVAKMYANDNGVDVEWTYDDATKTFTVTE,-4.8062987,"L7F, L12W, F30A, Q32M, G41V",5
MQYKLILNGKTLKGETTTEAVDAATAEKVFKWLANWRGVDGEWTYDDYTKTFTVTE,0.041308403,"Q32W, Y33L, D36W, N37R, A48Y",5
MQYKLIRNGWTLKGETTTEAVDAWTAEKVFKWYAYDNGVDGEWTYDDATKTFTVTE,-2.4861047,"L7R, K10W, A24W, Q32W, N35Y",5
MQVKLKLNGKTWKFETTTEAVDAAWAEKVFKQYANDNGVDGEWTYDDATKTFTVTE,-1.0979085,"Y3V, I6K, L12W, G14F, T25W",5
MQYKLILYGKTYKGETTTEFVDAATAEKVFKQYANDNGVDGEWTYDDWTKTSTVTE,-4.3980865,"N8Y, L12Y, A20F, A48W, F52S",5
MKYKLILNGKTLKGETTTEAVDAYTAEKVFKQYANDNGIDGEWTYDDARWTFTVTE,6.2283626,"Q2K, A24Y, V39I, T49R, K50W",5
MQYKLILNGKTLKGETTTEAVDAATAEKVRKQYAVDNGVDGEWLYDDWTKTFTVTY,-5.92473,"F30R, N35V, T44L, A48W, E56Y",5
MQYKLIRNGKTLKGETTTEFVDAATAEKVFKQYANDNGVDGEYTYDDRTKTFTVIE,-5.0470686,"L7R, A20F, W43Y, A48R, T55I",5
MQVKAILNGKTLKGETTTEAYDAATAEKVFKQYANDNGVDGEWTYDDAKKTFLVTE,0.8402913,"Y3V, L5A, V21Y, T49K, T53L",5
MQYKLILNGKTLLGWTTTEAVYAATAWKVFKQYANDNGVDGEWTYDDATKTFTVTL,-3.781158,"K13L, E15W, D22Y, E27W, E56L",5
MQYKLILNGKTLKGETTTEFVYAATAEKIFKQYANDNGVDGEWTYDDATVTFTVTW,1.4177591,"A20F, D22Y, V29I, K50V, E56W",5
MQYKLILNGKTLKGETTTEAVDAATAEWVFKQYANDNWVDGYWTYDDFTKTYTVTE,-2.1659458,"K28W, G38W, E42Y, A48F, F52Y",5
MQYKLIQLGKTLKGETTTEYFDAATAEKVFKQYANDNGVDGEWTYDDATKTVTVTE,-3.306451,"L7Q, N8L, A20Y, V21F, F52V",5
MQYILILFGKTLKGVTTTEAVDAWTAEKVFKQYANDNGVDGSWTYDDATKTFTVTE,6.521138,"K4I, N8F, E15V, A24W, E42S",5
MQYKLILNGKTLKGETTTEAVPAYTAEKVFKWYANDYGVDGYWTYDDATKTFTVTE,1.636993,"D22P, A24Y, Q32W, N37Y, E42Y",5
MQYKLILNGKTYKGETTTEAVDAATWEKVFKQYANDNGGDGRWTYNDATKTFTVTE,-4.952797,"L12Y, A26W, V39G, E42R, D46N",5
MQYKLILNGATLKGETTTFAVDAATAEKVFKQYANDNGVDGEWTYDRATKTFWVTY,3.52946,"K10A, E19F, D47R, T53W, E56Y",5
MQYKLILNGKTLYGLTTTEAVRAATAEKVFKQYANVNGVDGEWYYDDATKTFTVTE,3.4014647,"K13Y, E15L, D22R, D36V, T44Y",5
MQFKLILNGKTLKGETTYEAVDAATAEKVFKQYANDMGWWGEWTYDDATKTFTVTE,-0.7876669,"Y3F, T18Y, N37M, V39W, D40W",5
MQYKLILNGKTLKGETTTEAFDAATAEKVFKQYANDNYVYGWWTYDDATKTFTVFE,4.9701996,"V21F, G38Y, D40Y, E42W, T55F",5
MQYKLTLNGKTLKGETTTEAVDAITAEKVFKQYANDNGVDGWWTYDRATKTFTVWE,5.536486,"I6T, A24I, E42W, D47R, T55W",5
MQYKLIWNGKTLKGETTTEAVDAWTAEKVFKQWANDNGVDGEWTYDDKTKTFLVTE,1.6940446,"L7W, A24W, Y33W, A48K, T53L",5
MQYKLILNGKTLYGETTTEAVDAATFEKVFKQYKNDNGVDGEWTYDDETKTFFVTE,-5.05373,"K13Y, A26F, A34K, A48E, T53F",5
MQYKLIINGKTLKGETRTEALDAATAEKVFKQWANDNGVDGEWTYDDATKTFYVTE,3.3888693,"L7I, T17R, V21L, Y33W, T53Y",5
MQYKLILNGKTLKGETTTEAVDAATRIKVFKQKANDNGWVGEWTYDDATKTFTVTE,-5.602911,"A26R, E27I, Y33K, V39W, D40V",5
MQYKLILNGKTLKGETTTEAVDAWTAEKVFKQYANDNGVDGEWTYIWATKTFYVTF,4.0276976,"A24W, D46I, D47W, T53Y, E56F",5
MQYYLILNGKTLKWETTTEAVDAATAEKVFWEYANDNGVDGEWTYDDARKTFTVTE,-5.097718,"K4Y, G14W, K31W, Q32E, T49R",5
MQYKLILNGKTLKGETYTEAVDAATAYKVFKQYQNDCGVWGEWTYDDATKTFTVTE,-4.510545,"T17Y, E27Y, A34Q, N37C, D40W",5
MQYKLILNGKTLKGETSTEAVDAATAERVFKQYYNDNYVDGEWTYDDDTKTFTVTE,-1.7780502,"T17S, K28R, A34Y, G38Y, A48D",5
MQYKLIYNGKTLKGETTTEAVDYATAEKVRKWYARDNGVDGEWTYDDATKTFTVTE,-5.860783,"L7Y, A23Y, F30R, Q32W, N35R",5
MQYKLILNGKTLKNETTTEWVDAALAEKVFKQKANDNGVDGEWWYDDATKTFTVTE,-0.35744908,"G14N, A20W, T25L, Y33K, T44W",5
MQYKLILNGKTLKGYTTTEAYDAATAEKRAKQYARDNGVDGEWTYDDATKTFTVTE,-0.8544669,"E15Y, V21Y, V29R, F30A, N35R",5
MQYKLILNGFTLKGETTTEAVDWATAEKVFKRRANDHGVDGEWTYDDATKTFTVTE,-3.0501814,"K10F, A23W, Q32R, Y33R, N37H",5
MQYKLILNGKTLKRETTTEAVDAATYEKVFKQYANDNGVWYEWTYDDATKTFTVTI,-4.8752546,"G14R, A26Y, D40W, G41Y, E56I",5
MQYKLYLNGKYLKGETTTEAVDAWTAEKVFKQYANDNGVDGEYFYDDATKTFTVTE,-0.46190277,"I6Y, T11Y, A24W, W43Y, T44F",5
MQYKLIYDGKTLKTETTTEAVDAATAEKVFKQYWNDNGVDGEWTYHDATKTFTVTE,-3.968994,"L7Y, N8D, G14T, A34W, D46H",5
MQYKLILNGKTLKGETTTEARDRAWAEKVFKQYANDNGVDGEWTYDDATKTFWVWE,1.5751593,"V21R, A23R, T25W, T53W, T55W",5
MQYKLILDGKTLKGEWTTEAYDAATAEKVFKQYANRNGVDGEWTYDDATKTFTVTF,1.8381512,"N8D, T16W, V21Y, D36R, E56F",5
MQYKLILNGKTLKGWTTTEAVWAATAERVFKQYWNDNGVDGEWTYRDATKTFTVTE,-1.0792689,"E15W, D22W, K28R, A34W, D46R",5
MQIKLILNGKTLFGETGTEAVDAATAEYVFKQYANDNGVDGEWTYDKATKTFTVTE,-0.20935866,"Y3I, K13F, T17G, K28Y, D47K",5
MQYKLIRNGKTLKWETTTEAVDAAVAEKVRKQYANDNGVDGEWTYDDARKTFTVTE,-4.4654465,"L7R, G14W, T25V, F30R, T49R",5
MQYKLIRNGKTLKGETTTEAVDAATAEKVFKQYANLNGVDGWWTYDDATKTFTVYK,0.80511594,"L7R, D36L, E42W, T55Y, E56K",5
MQYKLILNGKTWKRETTTEYVRAATAEKRFKQYANDNGVDGEWTYDDATKTFTVTE,-0.11802366,"L12W, G14R, A20Y, D22R, V29R",5
MYYKLIYNGKTYKGETTTEAVKAATAEKVFKYYANDNGVDGEWTYDDATKTFTVTE,-2.058743,"Q2Y, L7Y, L12Y, D22K, Q32Y",5
MQYKLILNMYTLKGETTTEAVDAYTAEYVLKQYANDNGVDGEWTYDDATKTFTVTE,0.05960793,"G9M, K10Y, A24Y, K28Y, F30L",5
MKYKLWLNGKTLKGETNTEAVDAATAEKVFKQWANDNGVDGEWTYDDYTKTFTVTE,3.4935791,"Q2K, I6W, T17N, Y33W, A48Y",5
MYYKLIWNGKTLKGETTTEAWDAATAEKVFKQYANDNGVDGEYTYDDATKTYTVTE,-4.8562055,"Q2Y, L7W, V21W, W43Y, F52Y",5
MQYKLILWGKTLKGETTTEAVDAATAEKVWKLYANDNGVYGEWTYDDATKTFTVTV,2.6982677,"N8W, F30W, Q32L, D40Y, E56V",5
MQYKLILNGKTLKGPTHTEYVDAATAEKVFRQYANANGVDGEWTYDDATKTFTVTE,-0.20964444,"E15P, T17H, A20Y, K31R, D36A",5
MQYKLYLNGKTYKYETTTEAVDAATAEKDFKQYANDNGVDGEWTYDDATKTFTVTF,-2.3932815,"I6Y, L12Y, G14Y, V29D, E56F",5
MQYKLILNGKTLKGETGTEAVDEYTAEKVFKQYANDNGVDWEWTYYDATKTFTVTE,-0.5320586,"T17G, A23E, A24Y, G41W, D46Y",5
MQYWLLLNGKTLKGETWTWAVDAATAEKVFKQYANDNGVDGEWTYDDAYKTFTVTE,4.542296,"K4W, I6L, T17W, E19W, T49Y",5
MQYKLELNGKTLKGEWTTEAVRAATAEKVFYQYANDNGVDGEWTYDDATKTFTYTE,-4.705664,"I6E, T16W, D22R, K31Y, V54Y",5
MQYKLLWNGKTLKGETTTEAVDAATYEKVRKQYANDNGLDGEWTYDDATKTFTVTE,-5.1511574,"I6L, L7W, A26Y, F30R, V39L",5
MQYKLILNGKTRKGETTYEAVDAATAEKVFKQYAYDNGVDGEWWYDDWTKTFTVTE,-1.8479525,"L12R, T18Y, N35Y, T44W, A48W",5
MTYKLILRVKTLKGETTWEAVDAATAEKVFKQYRNDNGVDGEWTYDDATKTFTVTE,-2.021856,"Q2T, N8R, G9V, T18W, A34R",5
MQYKLYLNGKTLKGETTTEAVDAAWAEYVFKQYANDNGVDWEWTYFDATKTFTVTE,-3.470646,"I6Y, T25W, K28Y, G41W, D46F",5
MQYKLILNGKTLKGETTTEAVDAATAQTVFKQIANLNGVDGEWTYDDATKTYTVTE,-5.5090055,"E27Q, K28T, Y33I, D36L, F52Y",5
MQYKLILNGKTIKGETTTEAVDAYTAEKVFKQYYNDNGVDGEWWYDDWTKTFTVTE,1.3875481,"L12I, A24Y, A34Y, T44W, A48W",5
MQYKLILNGKTLKGYTTTEAVDAATAEKVFKQFANDNGVDWEWVYDRATKTFTVTE,-0.18882698,"E15Y, Y33F, G41W, T44V, D47R",5
MQWKLILNGKTLKGETTTEAVDAAYAEKVLKQYANDNGVDGEWTYDDATKWFWVTE,3.6857705,"Y3W, T25Y, F30L, T51W, T53W",5
MQYKLILGGKTLIGGTMTEAVDAATAEKVFKQYANDNGVDGEWTYDDATKTFTVTY,0.7635644,"N8G, K13I, E15G, T17M, E56Y",5
MQYKKWLNGKTLKGETTTEAVDAATAEKVFKQYAYPNGVDGEWTYDDATKTFWVTE,-5.630747,"L5K, I6W, N35Y, D36P, T53W",5
MQYKLLLNGKTLKGETTTEAWDAYTAEKVFKQYAWDNGVDGEWTYDDATKTFTVTW,1.4547848,"I6L, V21W, A24Y, N35W, E56W",5
MQYKLILNGKTLKGETTYEAVDAATAERVFKQYANDNLVDGRWTYDDATKTFTYTE,-1.0435448,"T18Y, K28R, G38L, E42R, V54Y",5
MQYKLILNGKTLKGETTTYAVDYATAEKVFKQYANDNWVDGEWTYDDATKTTTVTW,-4.9199224,"E19Y, A23Y, G38W, F52T, E56W",5
MQYKLILNGKTLKGETTTELVDAAYAERVFKQYRNDNGVDGEWTYDRATKTFTVTE,-1.7331126,"A20L, T25Y, K28R, A34R, D47R",5
MQYKLILNGKTLKGETTTEAVKWATAEKVFKQYARDNGVWGEWTYDDATKTFFVTE,-3.5348434,"D22K, A23W, N35R, D40W, T53F",5
MQYTLILNGKWLKGETTTEAVDAATAEKVFKQWANDNGVDGEWVYDDATKTFTVWE,0.84661883,"K4T, T11W, Y33W, T44V, T55W",5
MQYKLIQNGKTLTGETTTEAVDAATAEKVFWQHANDNGVDGEWTYDRATKTFTVTE,-2.9856517,"L7Q, K13T, K31W, Y33H, D47R",5
MQYKLILNGKTLKGETTTEAVDAAAYEKVFKQYANDNGVDGWWWYDDATKTFTRTE,-4.606661,"T25A, A26Y, E42W, T44W, V54R",5
MQYKLILNGKTLKGYTTTEAVDAATAAKVAKQYANDNGVDGEWTYDWATRTFTVTE,-2.9340162,"E15Y, E27A, F30A, D47W, K50R",5
MQYKLTLNGKTLQGETTTEAVDAATAEKVFKFYANDNWVDGEWTYDDRTKTFTVTE,1.754873,"I6T, K13Q, Q32F, G38W, A48R",5
MQYKLILNGKWLKGETTTEYVDAATQEKVFKQYANDNGVDGEWTYWDATKTWTVTE,-5.527113,"T11W, A20Y, A26Q, D46W, F52W",5
MQYKLILNGKTLKGETTTEAVDAATAEKRFKAYANDNRVDGTWTYDDAWKTFTVTE,4.3819475,"V29R, Q32A, G38R, E42T, T49W",5
MQYKLILNGKTLKGETTTEAVDAYTAEKVFKQWANDNGFWGEWTYDDAWKTFTVTE,5.6857233,"A24Y, Y33W, V39F, D40W, T49W",5
MQYKLILNGKTLWYETTTEAWDAATYEKVFKQYANDNGVDGEFTYDDATKTFTVTE,-5.3866973,"K13W, G14Y, V21W, A26Y, W43F",5
MQYKKILNGKTWKGETTTEAVDAATAEWVFKQYAWDNYVDGEWTYDDATKTFTVTE,-5.9406056,"L5K, L12W, K28W, N35W, G38Y",5
MQYKYILNGKTLKGETTTWAVDAATAEKVFKIYANDNGVDGEWWYSDATKTFTVTE,0.7128013,"L5Y, E19W, Q32I, T44W, D46S",5
MQYKLILNGKTLKGWTTTEAVDAATAEKVFKQYANDNGVDGYWTYDDNTKRFTITE,3.6505926,"E15W, E42Y, A48N, T51R, V54I",5
MQYILILNGKTLKGETTTEAVDAATAEKVFKQYANDYGVDGEWFYDDAHKTFTRTE,-3.5477562,"K4I, N37Y, T44F, T49H, V54R",5
MQFKLILNGKTLKRETTTEANDAATAEKVFKQYANDNGVDGEWWYDDATKTWTVTE,-2.9322755,"Y3F, G14R, V21N, T44W, F52W",5
MQYKLILNGKTLYGETTTEAVDAATAEYVFKQYANDYGWDGEWTYDRATKTFTVTE,-4.3985395,"K13Y, K28Y, N37Y, V39W, D47R",5
MQYKLILNGKTLKGETTTIAVAAWTAYKVFKQYANDNGVWGEWTYDDATKTFTVTE,1.461347,"E19I, D22A, A24W, E27Y, D40W",5
MQYKLILNGKTLAGEYYTEAVDAATAEKVRKQYANDNGVDGEWTYDDATKTLTVTE,-4.8276377,"K13A, T16Y, T17Y, F30R, F52L",5
MQYKLILNGKTWKGTTWTEARYAATAEKVFKQYANDNGVDGEWTYDDATKTFTVTE,3.2061253,"L12W, E15T, T17W, V21R, D22Y",5
MQYRLILNGKTLKGETTTEAVDAWTAEKVFKQYVNDNGVDGEWTYDDWTKTFTVTK,2.2790186,"K4R, A24W, A34V, A48W, E56K",5
MQYKKILNGKTLKGETTTFAVDAATAEKVFKQYFNFNGVDGEWTYDDATKTFTVTY,-4.9704385,"L5K, E19F, A34F, D36F, E56Y",5
MQYKLILFGKFLKGETWTEAVDAATAEKVFKQLANDNGVDGEWTYDDATKTFTVTY,1.8352722,"N8F, T11F, T17W, Y33L, E56Y",5
MTYKLILNGKTLKGETTTEAYDAATAEKVRKQYANDNGVDGEWTYDDATKTYTVTR,-4.8122373,"Q2T, V21Y, F30R, F52Y, E56R",5
MQYFLILNYKTLKGETTTEYVDAATAEKVHKQYANDNGVDGEWTYDYATKTFTVTE,0.4510969,"K4F, G9Y, A20Y, F30H, D47Y",5
MQYKLILNGKTLKGETTTVWVDAAIAEKVFKQYAWDNGVDGEWTYDDATKTFTVYE,-0.7863964,"E19V, A20W, T25I, N35W, T55Y",5
MQYKLYLNGKTLKGETTTEAVDAWTAEKVFKQYANTNGVDYEWTYDDRTKTFTVTE,1.6830173,"I6Y, A24W, D36T, G41Y, A48R",5
MQYKLIYNGKTLKGETTTEWVDAATAEKEFKQYANDNGVDGEWTYYDATKTITVTE,-4.2873483,"L7Y, A20W, V29E, D46Y, F52I",5
MQYKLILNGKTLKGETTTEMVDAATARKVFKQYANDNGVDGEWTYNDATKKFTVRE,-3.405642,"A20M, E27R, D46N, T51K, T55R",5
MQYKLILNGKTWKFETTTEAVFAATAEKVFLQYANDNGVDGEWTYDDAWKTFTVTE,-4.4720783,"L12W, G14F, D22F, K31L, T49W",5
MQYKLILNGKFLKIETGTEAVDAATKEKVFKQYANKNGVDGEWTYDDATKTFTVTE,-2.7339513,"T11F, G14I, T17G, A26K, D36K",5
MQYKLIRNGKTLKGGTTTEWVDAATAEKRFKQYANDNGVDIEWTYDDATKTFTVTE,-4.9270215,"L7R, E15G, A20W, V29R, G41I",5
MQYKLILNGKTLKGETTTEAVYYATAEKVFKQYANDWGVDGWWTYDDMTKTFTVTE,-2.0832973,"D22Y, A23Y, N37W, E42W, A48M",5
MRYKLILNGKHLKGETTTEWYDAATAEKVFKQYAYDNGVDGEWTYDDATKTFTVTE,-2.0181308,"Q2R, T11H, A20W, V21Y, N35Y",5
MWYKLILNGKTLKGWTTFEAVDAATAEKVFKQYANDRGVDGEWWYDDATKTFTVTE,2.6286378,"Q2W, E15W, T18F, N37R, T44W",5
MQYKLILNGKTLLGETTTEAVDRATAEKVFKQYENDNGVDGEWTYDDYTKTFTVRE,-4.665102,"K13L, A23R, A34E, A48Y, T55R",5
MQYKLILNGKVLKGETTTWAVYAATAEKVFKQYANDNGVDGEWTYADATKTFTKTE,-1.353422,"T11V, E19W, D22Y, D46A, V54K",5
MVYYLILFGKTLKGETTTEAVDAATAEKVFWQYINDNGVDGEWTYDDATKTFTVTE,-4.1448526,"Q2V, K4Y, N8F, K31W, A34I",5
MQYKLILNGKTLKGETTTEAVDRAMAEKVFKQYANDNGWDGEWTYDRATKTFTPTE,-4.350473,"A23R, T25M, V39W, D47R, V54P",5
MQYKLILNGKTLKGEVTTEAVDAATAEKVFAQRANMNGVDGEWTYDDATKWFTVTE,-3.0413578,"T16V, K31A, Y33R, D36M, T51W",5
MKWKLILNGKTLKGETTTEAVDAATAEKVFKQYANDNGVLWEWTYDDATKTFYVTE,-1.699497,"Q2K, Y3W, D40L, G41W, T53Y",5
MQYKQILNGKTLKGETTTEAVDAATAEKVFKQYARDNMVWGEWTYKDATKTFTVTE,-2.891194,"L5Q, N35R, G38M, D40W, D46K",5
MQYKHILNGKTLKGETTTEAVDAYTAYKVFKQKANDNWVDGEWTYDDATKTFTVTE,-4.6796656,"L5H, A24Y, E27Y, Y33K, G38W",5
MQYKLILNGKTLKGETLTEAVDAATAEKVVKQYAYDNYVDGEWTYKDATKTFTVTE,-3.0715318,"T17L, F30V, N35Y, G38Y, D46K",5
MQYKLWLNGKTLKGETTTEAVDAATAEKVFKQYANDYGYDGEWTYDRATTTFTVTE,-0.14015642,"I6W, N37Y, V39Y, D47R, K50T",5
MFYKLILNGKTLKGYTTTEAVDAYTAEKVFKQYWNDNGYDGEWTYDDATKTFTVTE,-0.9113298,"Q2F, E15Y, A24Y, A34W, V39Y",5
MQYKLILNGKTLKGEYTTEAVDAATAEKVFKQYANWNGVDYEWTWDDATKTYTVTE,-4.1774626,"T16Y, D36W, G41Y, Y45W, F52Y",5
MQYRWILNGKTLKGETTYEAVDAATAEKVFKWYANDNGVYGEWTYDDATKTFTVTE,0.5808852,"K4R, L5W, T18Y, Q32W, D40Y",5
MQYKLILNGKTLKGETTTEAVDAATAEKVFKQYAMDNGVDLEWTYDDAKKLFTVTN,-5.107943,"N35M, G41L, T49K, T51L, E56N",5
MYYKLILNWKTRKGETTTEAVDYATAEKVFKQYANDNGVDGEWTYDKATKTFTVTE,-2.4621563,"Q2Y, G9W, L12R, A23Y, D47K",5
MQYKLILEGVTLKGETTTEAVDAATAEKRFKQYANDNGVDGEWHYDYATKTFTVTE,5.335374,"N8E, K10V, V29R, T44H, D47Y",5
MQYKLILYGKTLKGEYTTEAVDAARAEKVFKQYFNSNGVDGEWTYDDATKTFTVTE,0.18578336,"N8Y, T16Y, T25R, A34F, D36S",5
MQYKLILEGKTLKGETTTEAVDAATAEKVFKQYANDNMVDGEWTYHHATKTFTVTR,2.359084,"N8E, G38M, D46H, D47H, E56R",5
MQYKLILNGKTLKGRTTTEAVDAATAEKVFKQYANWNYVDGEWTYDDATKTFTVWF,1.2939973,"E15R, D36W, G38Y, T55W, E56F",5
MQYKLILNGKTLKGELTYFAVDAATAEKVFKQYANDNGVDYEWTYDDATKYFTVTE,-0.4674689,"T16L, T18Y, E19F, G41Y, T51Y",5
MQYKWILNGKYLVGETTTEAVDAATAEKVFKQYYNDNGVDGEWTYFDATKTFTVTE,-3.928723,"L5W, T11Y, K13V, A34Y, D46F",5
MQYKLILNGKYLKGERTTEAVDAATAEKVFKQYANDNGVDGEWTPSHATKTFTVTE,-1.071856,"T11Y, T16R, Y45P, D46S, D47H",5
MQYKLIYNGYTLKGETTTEVVDAATAEKVFKQWVNDNGVDGEWTYDDATKTFTVTE,-0.97743016,"L7Y, K10Y, A20V, Y33W, A34V",5
MQYWLILNGKTLKGETTWEAVDAATARKVFKQYANDNGVDGEWHYDDATITFTVTE,-3.3303092,"K4W, T18W, E27R, T44H, K50I",5
MQYKLILNGKLLKGETTTEAVGRATAEKVMKQYANDNGVDGEWTYNDATKTFTVTE,-0.77593154,"T11L, D22G, A23R, F30M, D46N",5
MQYKYILNGKTLKGETTTEAVDAATAFKVFKWYANDNGVDSEWTYDRATKTFTVTE,-5.8731947,"L5Y, E27F, Q32W, G41S, D47R",5
MQYFLILNGKTLKGETTTEAVDAATAFKVFKQYANDNGVDGEWTYDRARKTFTYTE,-4.420083,"K4F, E27F, D47R, T49R, V54Y",5
MIYKLILNGKTLKGETTTFAVDAATAEFVFKQYAYDNGVDGYWTYDDATKTFTVTE,-1.4975367,"Q2I, E19F, K28F, N35Y, E42Y",5
MQYKLILNRKTLKGETTTRAVDKATAEKVFKQYANDYGVDGEATYDDATKTFTVTE,-4.917979,"G9R, E19R, A23K, N37Y, W43A",5
MQYYLILNGKTLKGETTTEAVDAAYAEKHFKQYANDNGVDGEWIYDDARKTFTVTE,3.2426183,"K4Y, T25Y, V29H, T44I, T49R",5
MQYKMILNWKTLWQETTTEAVDAATAEKVFKQYANDNGVDGEWTYDDAPKTFTVTE,-0.40672046,"L5M, G9W, K13W, G14Q, T49P",5
MQYKLVLNGFTLKGWTTTEAWDAATAEKVAKQYANDNGVDGEWTYDDATKTFTVTE,2.2134202,"I6V, K10F, E15W, V21W, F30A",5
MQYKLILNGKTLKGETWTEAVDAATAEKRFKQYVNDNGVDGWWTYDDATKTFTVYE,3.5046039,"T17W, V29R, A34V, E42W, T55Y",5
MQWKLILNGKYLKGETTTEAVDWATAEKVFKQYANDNGVDGEYTYDDWTKTFTVTE,-5.0364347,"Y3W, T11Y, A23W, W43Y, A48W",5
MQYKLILNYKTLWGETTTEAVIAATAEKVFKQYANDNGMDGEWTYDDATKTFYVTE,2.2138972,"G9Y, K13W, D22I, V39M, T53Y",5
MQYKWILNGKTLKGETTTEAVDAWTGEWVFKQYAYDNGVDGEWTYDDATKTFTVTE,-4.486142,"L5W, A24W, A26G, K28W, N35Y",5
MMYKLILLGKTWKGELTTEAVDAATAEKVFKQYANDNGWDGEWTYDDATKTFTVTE,-1.9389143,"Q2M, N8L, L12W, T16L, V39W",5
MQYKLIVNGKTLKGETTMEAVDAATAEKVFKQYANDNGVDGNWYYDDATKTFTRTE,-2.1847963,"L7V, T18M, E42N, T44Y, V54R",5
MQYKLILNGKTLKGETYTEAVDAATARKVMKWYANDNGVDGEWTYYDATKTFTVTE,-4.7668586,"T17Y, E27R, F30M, Q32W, D46Y",5
MQYKLILNGKTLKGETTWEAYDAWTAEKVFKQYANDNGVWGEWTYDDATKTFTVYE,6.599216,"T18W, V21Y, A24W, D40W, T55Y",5
MQYKLILNGKTLKGETYTEAVDAATAEYVFKQYARDNGVDGEWTYDRATKWFTVTE,-2.4703937,"T17Y, K28Y, N35R, D47R, T51W",5
MQYKLILNGKTLKGETTTEAVDRATAEKVFKQYANDRYVDGEYRYDDATKTFTVTE,-5.2897334,"A23R, N37R, G38Y, W43Y, T44R",5
MQYKLILNGKYLKYETTTEAVDAATAERKFKQYANDNGVWGEWTYDDATKTFTVTE,2.6155667,"T11Y, G14Y, K28R, V29K, D40W",5
MQYKLILWGKTLKRETYTEAVDAWTAEKVFKQYANDNLVDGEWTYDDATKTFTVTE,3.665701,"N8W, G14R, T17Y, A24W, G38L",5
MQYKLFLNGKYLFGESTTEAVDAATAEKVFKQYANDNGVDGEWTYDDATKTFTVKE,1.923994,"I6F, T11Y, K13F, T16S, T55K",5
MQYKLILNGKTLYGETLTEAVDAATAEKVFKQYANDNGVDGEWFYHDVTKTFTVTE,3.4323165,"K13Y, T17L, T44F, D46H, A48V",5
MQYKLILNGKTLKGETTTEAVDWARAEKVFQQYANWNGVDGEWWYDDATKTFTVTE,-4.9119616,"A23W, T25R, K31Q, D36W, T44W",5
MQYKLWLNYKTLKGETTTEAVDRATAEKKFKQYANDNGVDGEWTYDDATKTWTVTE,-4.849894,"I6W, G9Y, A23R, V29K, F52W",5
MQYKLILNGKELWGEFTTEAVDAATAEKVFKQYANINGLDGEWTYDDATKTFTVTE,2.7686775,"T11E, K13W, T16F, D36I, V39L",5
MQYKLILEGKTLKGETTTEAVGRATAEKVFKQYANDNGVDGEWTYDDAQWTFTVTE,0.9414139,"N8E, D22G, A23R, T49Q, K50W",5
MQYKLILFGKTLKGETTTEAVDAATAEKVFKYYANDNGFDGEWTYNDATKTFYVTE,1.1065549,"N8F, Q32Y, V39F, D46N, T53Y",5
MQYKLILNGWTLKGETTTEAQDAATAEKVFKQYYNDNGVDGEYTYDDATYTFTVTE,-4.156171,"K10W, V21Q, A34Y, W43Y, K50Y",5
MQYKLILNGKTLKEETTTEAVDAATHEKVFKHYAWDNGVDGEITYDDATKTFTVTE,-5.8850946,"G14E, A26H, Q32H, N35W, W43I",5
MQVKLILNGKTLKGEYTTEAVDYATAEKVFKRYANDNGVDGEWTYDDATKTFTPTE,-5.1106925,"Y3V, T16Y, A23Y, Q32R, V54P",5
MQYKLILNGKTLKGETTQEAVRAAFAEKVFKQYANDNGVDGHATYDDATKTFTVTE,-1.8919052,"T18Q, D22R, T25F, E42H, W43A",5
MQYKLYLNGYTYKGYTTTEAVDAATAEKVFKQYAYDNGVDGEWTYDDATKTFTVTE,-1.7473735,"I6Y, K10Y, L12Y, E15Y, N35Y",5
MWYKLILGGKTLKGETTTWAVDAATAEKVFKQYANDNGVYGEWTYNDATKTFTVTE,5.8491783,"Q2W, N8G, E19W, D40Y, D46N",5
MQYKLTLNGKTLKGETTTEAYDAATAEKVFKQYANDNYVDGEWTFDDATLTFTVTE,3.033364,"I6T, V21Y, G38Y, Y45F, K50L",5
MQYKLILNGKTLKGETTTYAVDAATAEKRFKQYANDKGVDGEYTYDDATKTFTYTE,-4.070648,"E19Y, V29R, N37K, W43Y, V54Y",5
MQYKLILNGKTLKGETTTEAVDAATWEKVFKQYYNDNGVDGWWTYDPATKTFTRTE,-4.6558657,"A26W, A34Y, E42W, D47P, V54R",5
MQYKLILNGKTYWGETTTEAVDAATAYKVFKQYANDNGVDGNWTYDDATKTFWVTE,-3.4308877,"L12Y, K13W, E27Y, E42N, T53W",5
MQYKYILNGWTLYGETTTEAVDAATAVKVFKQYANDNWVDGEWTYDDATKTFTVTE,-5.2933116,"L5Y, K10W, K13Y, E27V, G38W",5
MQYKLILNGKTYRGETYTEAVDAWTAEKVFKQYANDNGVDGEWTYDDAHKTFTVTE,4.0121865,"L12Y, K13R, T17Y, A24W, T49H",5
MIYKLKLNGKTLKGETTTEAVDAATREKVFKQYANDNLVDGEWTYDDATKTYTVTE,-3.9509957,"Q2I, I6K, A26R, G38L, F52Y",5
MQYKLILQGKTLKGETWTEAVDAATLEKVFKQYANDNWVDGEWTYDDATKYFTVTE,-1.1612055,"N8Q, T17W, A26L, G38W, T51Y",5
MQYKFILNGKTLKGETTTEAVDAAYAEKVFKQYAYDNGVDGEWTYDDATKYWTVTE,-4.891891,"L5F, T25Y, N35Y, T51Y, F52W",5
MQAKLILNGKTLKGETTTEAVDAATAEKVKKQYANDNWVDGEWTYKDATKTFTWTE,-3.802978,"Y3A, F30K, G38W, D46K, V54W",5
MQYKLILNGIWLKGETTGEAWDAATAEKVFKQYARDNGVDGEWTYDDATKTFTVTE,-1.9727855,"K10I, T11W, T18G, V21W, N35R",5
MQYKLILNGKTLKYEFTTEAVDYATAEKVFKQYAYDNGVDWEWTYDDATKTFTVTE,-6.0917687,"G14Y, T16F, A23Y, N35Y, G41W",5
MQYKLILYGKELKGETTTWAVDAATAEWVFKQYANDNGVDGEWTYDDATKTFEVTE,-0.31438723,"N8Y, T11E, E19W, K28W, T53E",5
MQYKLILNAKGLKGETTTRAVDAATAEKVFKKYANDNGVDGEWTWDDATKTFTVTE,3.4142234,"G9A, T11G, E19R, Q32K, Y45W",5
MQYKLILNGKTLKGETATEQVDAATAEKVFKQYSNDNGVDGEWEYDDWTKTFTVTE,3.5497258,"T17A, A20Q, A34S, T44E, A48W",5
MQYKLILNGKTLKGEVTTEAVDAATAEKVFKQYANDWGWDGEWTYDDARKTFTVTR,-3.1660736,"T16V, N37W, V39W, T49R, E56R",5
MQYKLILNGKTLKGETTTNAVRAATREKVFKQYANDNGVDFEFTYDDATKTFTVTE,-5.225306,"E19N, D22R, A26R, G41F, W43F",5
MQYKLILNGKTLKGETTGEAVDAATAEKVFKQYANDNGVDFEWTYDDATKWWTVRE,-4.8728547,"T18G, G41F, T51W, F52W, T55R",5
MQYKLILNGKTLKGETTTEAVDAATAEKVFKQYRNDNGVDGEWTWFDATKTFWVTY,-2.325964,"A34R, Y45W, D46F, T53W, E56Y",5
MQLKLILNGKTLKGETTTEAVRAATAEKRFKQYANDNGVDFEWTYDDATKTFTVWE,0.88084006,"Y3L, D22R, V29R, G41F, T55W",5
MQYKLILDGKTLKGETTTEAVDAATAEKVFKWYANDNGVDWEVTYDDATKTWTVTE,-6.256335,"N8D, Q32W, G41W, W43V, F52W",5
MQYKLILNGKTLKGETTTEAVRAATAEKRFYQYANDNGVDVEWTYDDATKTFTVTS,-5.330427,"D22R, V29R, K31Y, G41V, E56S",5
MQYKYILNGKTLKGYTTTEAVDAATAEKVRRQYANDNGVDGEWTYDDATKTFIVTE,-4.4484973,"L5Y, E15Y, F30R, K31R, T53I",5
MQYKLHLNGKTLKGETTTEAVDAATAEKVYKYYMNDNGVDKEWTYDDATKTFTVTE,-5.0142784,"I6H, F30Y, Q32Y, A34M, G41K",5
MRYYLILNGKTLKGETTSEAVDAATAEKVFKQYAMDNGVDGVWTYDDATKTFTVTE,-0.046944313,"Q2R, K4Y, T18S, N35M, E42V",5
MQYKLILNGKTLKGETTTEAVDAYTAEKVFRQYAKDYGVDGEWTYDDATKTFTVTR,-4.107572,"A24Y, K31R, N35K, N37Y, E56R",5
MSYKLILNGKTLKGEYTTEAVDAATAEKVFKQYANDNGVDGEYDYDDATKTFTKTE,-5.1682863,"Q2S, T16Y, W43Y, T44D, V54K",5
MQYKLILNGKTLKGETTTEAVDAATAVKVFKEYANDNGVDYEWTYDDATKTFTVWA,-6.1282706,"E27V, Q32E, G41Y, T55W, E56A",5
MQYKTILNGKTLKGETTTEAWDAATAEKVFKQYANDNYRYGEWTYDDATKTFTVTE,-0.57583785,"L5T, V21W, G38Y, V39R, D40Y",5
MQYKLVLNGKTLKGELTTEAVDAATAEKVFKQYWNDNGVDGEWTYDDWTKTFWVTE,-1.3769065,"I6V, T16L, A34W, A48W, T53W",5
MQYKLILNGKTLKGELTTKAWDAARAEKVFKQYANDNGVDGEWTYDDAYKTFTVTE,5.112998,"T16L, E19K, V21W, T25R, T49Y",5
MQYKLILNGKTLYGETTTEAVDAATWEKVFKQYANDLGVDGEFTYDDATKTFTYTE,-5.2596555,"K13Y, A26W, N37L, W43F, V54Y",5
MQYKLILNGKTLKGLTTTEAVDAATAEKKFKQVAYDNGVDGEWTYDDATKIFTVTE,-0.99829537,"E15L, V29K, Y33V, N35Y, T51I",5
MQYKLILNGKTLKGETTTEAVDAYRAEKRFKQYANDNGVDGEYTYNDATKTFTVTE,2.803609,"A24Y, T25R, V29R, W43Y, D46N",5
MQYKLILNGKTRKGEWTTEAVDAATAEKVFWQYAYDWGVDGEWTYDDATKTFTVTE,-6.127975,"L12R, T16W, K31W, N35Y, N37W",5
MQYRLILNGKTLKGETTTEAVDAATAEKVFKQWANDNGVDGEWSYDDATKTFTRWE,-2.224334,"K4R, Y33W, T44S, V54R, T55W",5
MQYRLILNGKTLKGERLTEAVTAATAEKVFKQYANDNGVDGEWRYDDATKTFTVTE,3.869054,"K4R, T16R, T17L, D22T, T44R",5
MQYKLILNGKTLKGETTFEAVDAARAEKRFKQYANDNGVDGWWTYDDATKMFTVTE,6.737471,"T18F, T25R, V29R, E42W, T51M",5
