Sequence,Score,Mutations,Number of Mutations
MQYKLILNGKTLKGETTTEWVDAARAEKVFKYYANDNGVWGEWTYDRATKTFTVTE,4.276144,"A20W, T25R, Q32Y, D40W, D47R",5
MFYKLILNGKTLKGETTTEAPDYATALKKFKQYANDNGVDGEWTYDDATKTFTVTE,-4.8355136,"Q2F, V21P, A23Y, E27L, V29K",5
MYYKLILNGYTLKGETTTEAVDAATWEYVFKQYANDNGVDGEWTYYDATKTFTVTE,-3.226856,"Q2Y, K10Y, A26W, K28Y, D46Y",5
MQYKLILNGKTLKGWTTTEAVDAAYAEKVMKQLANDNGVDGEWTYDDATRTFTVTE,3.1945863,"E15W, T25Y, F30M, Y33L, K50R",5
MQYKLILNGKTLKGETTTEAVDAATAEKHFKQYANDNGVDIEWTYDRAAKTQTVTE,-5.2935386,"V29H, G41I, D47R, T49A, F52Q",5
MKYKLILNGKTLKGETTVEAVPAATAEKVFKQYANDNGVDGEWTYDDATKTVYVTE,-0.7948944,"Q2K, T18V, D22P, F52V, T53Y",5
MQYKLILNGKTLKGETTCEYVDAATREYVFKQYANDNGVDGYWTYDDATKTFTVTE,-4.0203366,"T18C, A20Y, A26R, K28Y, E42Y",5
MQYKLILDKWTLKGEWTTEAVDAATAEKVFKQYANDNGVDGEWTWDDATKTFTVTE,0.94340944,"N8D, G9K, K10W, T16W, Y45W",5
MQYKLILNAKTLKGETTTEAVDAATLEKVFKQYFNFNGIDGEWTYDDATKTFTVTE,-4.9448657,"G9A, A26L, A34F, D36F, V39I",5
MQYKYIFNGRTLKGETTTEAVDAATAEMVFKQYANDNGVDGEWTYDDATKRFTVTE,-1.7760973,"L5Y, L7F, K10R, K28M, T51R",5
MQYKLILNGKTLKGETTTEAVDAATAEKVFKQYANDNGYYWEWTYDDATKVFWVTE,-1.9837583,"V39Y, D40Y, G41W, T51V, T53W",5
MEYKLIRNGKTLKGETTTEAVDAATAEKVFKQYANDNYYDGEWTYDDAYKTFTVTE,-1.5231005,"Q2E, L7R, G38Y, V39Y, T49Y",5
MQYKLILNGKTLKGETTTEAVDAWTAEKVFKQYAGDNGVDYWWTYDDWTKTFTVTE,-1.4634002,"A24W, N35G, G41Y, E42W, A48W",5
MQYKLILNGKELKGETTTEWVDAATAEKVFRQYANDNGVDGEWTYRDATKTFTLTE,-1.8989944,"T11E, A20W, K31R, D46R, V54L",5
MQYKLIINGKTLKGETTYEAVDAATAMKVFKQYANRNGVDGEWTYDDATKTFTRTE,-5.1425853,"L7I, T18Y, E27M, D36R, V54R",5
MQYKLILNGKTYKKETTTEAVDAATAEKVFKQYANDNGVDGEWTYRDAWKTFTVKE,-0.32499674,"L12Y, G14K, D46R, T49W, T55K",5
MQYKLILNGKTIKGETTTEAHDAATAEKVFKQYANDSGVWGEWTYDDATKTFTVRE,3.7815385,"L12I, V21H, N37S, D40W, T55R",5
MQYKLIINRKTLKGETTTEAVDAATAEKVFKQYLNDNGYDGEWTYDDATKTFTVTK,-3.4946482,"L7I, G9R, A34L, V39Y, E56K",5
MQYKLILNGKTLKGETTTEAVDAATAEKVFKQWANDNGVDGEWTLDYATQTFTVTY,0.91782373,"Y33W, Y45L, D47Y, K50Q, E56Y",5
MQYKLILNQKTLYGETTAEAVDAATAEKVFKQYANDNWVDWEWTYDDATKTFTVTE,-3.9180973,"G9Q, K13Y, T18A, G38W, G41W",5
MKYKLILNGKWLKGEWTTEWVDAATFEKVFKQYANDNGVDGEWTYDDATKTFTVTE,-3.5815659,"Q2K, T11W, T16W, A20W, A26F",5
MQYSLIWNGKTLKGETTYEAVDAATAESVFKQYANDNGVDGEWTYDDATKTFTVTS,-3.8765225,"K4S, L7W, T18Y, K28S, E56S",5
MQYKLILNGKTLYIETTTEAVDAATAEYVFKQYANDNGVDGEWTWDDATKRFTVTE,-1.112497,"K13Y, G14I, K28Y, Y45W, T51R",5
MQYKLYLNGKTLKGETTTEAVRAATAEKVFKQYAHRNGVDGEWTYDWATKTFTVTE,1.1568683,"I6Y, D22R, N35H, D36R, D47W",5
MQYKLILNGRTLKGETTTEAVDAATALKVFKQYANDNWHDGEWTYDDATKTFTVTK,-5.574357,"K10R, E27L, G38W, V39H, E56K",5
MQYKLILNGKTLWGETTTEAVDAATAEYVRKQYANDNGVDGEWTYDDAWKTFYVTE,-3.8684793,"K13W, K28Y, F30R, T49W, T53Y",5
MQYKLILNGKTLKGETWTEAVDAATAEKRFKQYANDNGVWGEWTYHDATYTFTVTE,6.46754,"T17W, V29R, D40W, D46H, K50Y",5
MQYKLILNGYTLKGFTTTEAVDRATAEKVFKQYANDNGVDGEWTYDDATKTFTRHE,-3.8522055,"K10Y, E15F, A23R, V54R, T55H",5
MQYKLILNGKTLKGEYTTEAVDAATAEWVFKWYANDNGVDWEWTYDDATKTFTVWE,-5.1832404,"T16Y, K28W, Q32W, G41W, T55W",5
MQYKRILFGKTLKVETTTEYVDIATAEKVFKQYANDNGVDGEWTYDDATKTFTVTE,-4.8091073,"L5R, N8F, G14V, A20Y, A23I",5
MQYKLILNGKTLKGETTTEAVDAATAEQRFVQYANDNGVWGEWTYDDATKTFWVTE,-2.8027303,"K28Q, V29R, K31V, D40W, T53W",5
MQYKLLLNGKTLKAESTTEAVDAATAEKHFKQYANDNGVDGEWTYDDATKYFTVTE,2.6125193,"I6L, G14A, T16S, V29H, T51Y",5
MQYKLILYGKTLKGETTTYAVDAITAEKVFKQWANDNGVDGWWTYDDATKTFTVTE,5.043318,"N8Y, E19Y, A24I, Y33W, E42W",5
MQYKLILNGKTLKGKTTTEAVDAATAEKRFKQYLNFNGVDGEWWYDDATKTFTVTE,1.7704296,"E15K, V29R, A34L, D36F, T44W",5
MQYKLILNGKTYKFETTTEAVDAATKEKVFKQYLNDNGVDGEWTYDDATKTFRVTE,-6.0831223,"L12Y, G14F, A26K, A34L, T53R",5
MQYKLILNGKYLKGETTTEAVDAATAEKVFYQYWNDNGVDIEWTYDDACKTFTVTE,-5.911985,"T11Y, K31Y, A34W, G41I, T49C",5
MWYKLILNGKILKGETTREAVDAATAEKVFKQYANDNGVWGEWTYDDATKTFTVVE,4.155635,"Q2W, T11I, T18R, D40W, T55V",5
MQYKLIHNGKTLKWETTTEAVDAATAEWVFKQYANDNGVDLEWVYDDATKTFTVTE,-5.620326,"L7H, G14W, K28W, G41L, T44V",5
MWYKLILNGKTLKGYTTTGAVDQATAEKVFKQYARDNGVDGEWTYDDATKTFTVTE,-2.0385618,"Q2W, E15Y, E19G, A23Q, N35R",5
MQYKLILNGKTLKGETTTEAVDAATAEKRFKQKANDLGVDGEWTYTDYTKTFTVTE,3.0532272,"V29R, Y33K, N37L, D46T, A48Y",5
MQYKLILNGKTLKGETTTEAVDAATAEQVFKNYANLNGVDGEWTYDRATKLFTVTE,3.3504322,"K28Q, Q32N, D36L, D47R, T51L",5
MQYFLILNGKTLWGETTTEAVDAAFAEKVFKQYANDNGYDGEWTYDDATKTFTVYE,1.3924184,"K4F, K13W, T25F, V39Y, T55Y",5
MWYKLILNGKTLKGETTTEAVMKATAKKVFKQYANDNGVDGEWTYTDATKTFTVTE,-3.5577745,"Q2W, D22M, A23K, E27K, D46T",5
MQYKLILNGKTLKGEYTTEAVDAATAEKVFKKYANDNGWDGEWTYDRATKLFTVTE,0.42826942,"T16Y, Q32K, V39W, D47R, T51L",5
MQYKLILNRKTLKKETTTEAVDWATAEKVFKKYANDNNVDGEWTYDDATKTFTVTE,-4.145178,"G9R, G14K, A23W, Q32K, G38N",5
MQYKLILNGKTLKGEWTTEAVDFATAEKVFKQYANWNGVDWEWTYDDATDTFTVTE,-4.9615006,"T16W, A23F, D36W, G41W, K50D",5
MQYKLIRNGKTFKGETTTEAVDAATFEKVFKQYANDNGVWGEWTYDDYTKTFTVTE,-1.9762751,"L7R, L12F, A26F, D40W, A48Y",5
MQYKLILYGKTLKGETTTEAVDAATAEYVFKQYANDNGVDGEWTYDDATKNFTIFE,-0.93655485,"N8Y, K28Y, T51N, V54I, T55F",5
MQYKLYLNGKYLKGETTTEAVDAATAEKVFKAYANDNGYDGEWTYDDLTKTFTVTE,0.31642208,"I6Y, T11Y, Q32A, V39Y, A48L",5
MQYKLILFGKTLYGRTTWEAVLAATAEKVFKQYANDNGVDGEWTYDDATKTFTVTE,4.1299467,"N8F, K13Y, E15R, T18W, D22L",5
MQYKLILNGKTLKGETTTKAVDHATAEKHFKQYANDNGVDGEWTYDDAYKTFLVTE,1.0301948,"E19K, A23H, V29H, T49Y, T53L",5
MQYKLYLNGKTLKGETTLELVDAATHEKVFKQYANDNGVDGELTYDDATKTFTVTE,-5.900434,"I6Y, T18L, A20L, A26H, W43L",5
MQYKLILNGKYLKGWTTTEAVDAYTAEKRFKQYANDNGVDYEWTYDDATKTFTVTE,1.635667,"T11Y, E15W, A24Y, V29R, G41Y",5
MQYKLIYRGKTLKGETWTEAVDRATKEKVFKQYANDNGVDGEWTYDDATKTFTVTE,-4.2117696,"L7Y, N8R, T17W, A23R, A26K",5
MQYKLILNGKTLKGETTTEAVDAATAEKRFKQWANDNGWWGEWTYDDATGTFTVTE,1.7678146,"V29R, Y33W, V39W, D40W, K50G",5
MQYKLILNGKWLKGETTTEAVDAATAEKVFKQYLNFNGVDGWWTYDDATYTFTVTE,-0.05655644,"T11W, A34L, D36F, E42W, K50Y",5
MYAKLILNGKTLKGETTTEAVDKATAEKVFKQYANDNGVWGEWTYDDATKTFTVHE,0.3833112,"Q2Y, Y3A, A23K, D40W, T55H",5
MQYKLILNGKTLKGWTTTWAVDAATREKVFIQYANDNGVDGEWTYDDATKTFTRTE,-4.857679,"E15W, E19W, A26R, K31I, V54R",5
MQYKLILNGKTLKGWTTTEAVFAAFAEKVRKQYANDNGVDGEWTYDDAYKTFTVTE,-0.45204103,"E15W, D22F, T25F, F30R, T49Y",5
MQYKLILNGKTLKGETTTEAVDAATAERVFKQYANDWYVDGEWTYDRAWKTFTVTE,1.3655006,"K28R, N37W, G38Y, D47R, T49W",5
MQAKLILNGKTLKGYWTTEAVDAATAEKVFKQYANFNGVDGEWTYDRATKTFTVTE,2.300967,"Y3A, E15Y, T16W, D36F, D47R",5
MLYKLILNGKTLKGETTTEAVDAATAEKVRWQYLNDNGVDGEWTYDDATKLFTVTE,-5.5381007,"Q2L, F30R, K31W, A34L, T51L",5
MQYKLILNGKTLKGYTTTEAVDRATAEKVFKQYAFDNGVDGEETYDDATSTFTVTE,-4.8953147,"E15Y, A23R, N35F, W43E, K50S",5
MQYKLILNGKTLKGEITTEYVDRATAYKVFKQYANDNGVDGEWTYDDATKTFYVTE,-5.5836983,"T16I, A20Y, A23R, E27Y, T53Y",5
MQYKLILNGKTLKKETTTEAVDAATAFKVFLWYANDNGVDFEWTYDDATKTFTVTE,-6.7296705,"G14K, E27F, K31L, Q32W, G41F",5
MQYKLRLNGKTLKGETTHEAVDAATAEKVFKWYANDNGVDGEWTYDWHTKTFTVTE,3.2341628,"I6R, T18H, Q32W, D47W, A48H",5
MQYKLILNGKTLKGETTTEAVDRATAEKVFKQYANDNGVDGEWTYDDYRKWFRVTE,1.2876387,"A23R, A48Y, T49R, T51W, T53R",5
MQYKLWLNGKTLKGETTTEAVAAATAEEVFRQYANDNGVDGEWTWDDATKTFTVTE,-2.1833436,"I6W, D22A, K28E, K31R, Y45W",5
MQYKLILNGKTLKGEWTTEAVDAATAHKVFKQYMRDNGVDGEWTYDRATKTFTVTE,-5.8877983,"T16W, E27H, A34M, N35R, D47R",5
MQYKLILNGRTLKGETTTEAVDAATFEKRFKQYANDNGVDGYWTYDRATKTFTVTE,1.7544482,"K10R, A26F, V29R, E42Y, D47R",5
MQYKLILNGKTLKGETTFEAVDAATARKVFKQYANDNIVDGEWTYDDATGRFTVTE,-4.2336335,"T18F, E27R, G38I, K50G, T51R",5
MQYKLIWNGKTLKGETTTEAVDAATAYKVFKQYANDNHYDGEWTYDDATKWFTVTE,-5.2107687,"L7W, E27Y, G38H, V39Y, T51W",5
MQYKLILNGKWLKGETTTEAVDAATAGKRFWQYANDNGVDGEWTYDDATKTFTLTE,-5.4531455,"T11W, E27G, V29R, K31W, V54L",5
MMYKLILWGKTLKGETTWEAVDAARAEKVFKQYANDNGVDGEWFYDDATKTFTVTE,5.047862,"Q2M, N8W, T18W, T25R, T44F",5
MQYKLILNGKTLKGETTTIAVGAARAEKVFKQYANDFGVDGEWTYDDATKTFTVCE,2.2333264,"E19I, D22G, T25R, N37F, T55C",5
MQAKLILNGKTLWGETTTEAVDAATAEKVFKEYANDNGVDGEWTYDDATKYFTVTV,-1.7086807,"Y3A, K13W, Q32E, T51Y, E56V",5
MQYKLILNGKTLKGETTTEAVDAATAEKRFKQYRNDHGVDGEWYYDDATKTFTVTW,-1.8443737,"V29R, A34R, N37H, T44Y, E56W",5
MQYKLYLHGKTYKGETTTEAVDAATAEKVFKQRANDNGVDGEWWYDDATKTFTVTE,1.2386653,"I6Y, N8H, L12Y, Y33R, T44W",5
MFYKLILNGKTLKGEYTTEAVDAATAEKKFKQYANDNGVDGEYYYDDATKTFTVTE,-1.1902966,"Q2F, T16Y, V29K, W43Y, T44Y",5
MQYRWILNGKTLKGETYTEAVDAATAEKVFKQYINDNGVPGEWTYDDATKTFTVTE,-3.5420492,"K4R, L5W, T17Y, A34I, D40P",5
MQYKLILNGKTLKGETTYEAVDAFRAEKVFKQYANDNGVDGEWIYYDATKTFTVTE,5.1676164,"T18Y, A24F, T25R, T44I, D46Y",5
MQYKLILNGKTLWGETTTEAVDAATAEKVFKQYYWDNGVDGEWTYDDAWKTMTVTE,-4.159744,"K13W, A34Y, N35W, T49W, F52M",5
MQYKLILNGKTLWGETTTEAVDAATARKVFKQYANDNGVWGEWTYDDATKTFTVYK,-2.6954842,"K13W, E27R, D40W, T55Y, E56K",5
MQYKLILNGKTLKGETKTEAYDAATAEKVFKQYWNDNGVDGYWTYDDATKTFYVTE,-1.0541781,"T17K, V21Y, A34W, E42Y, T53Y",5
MQYKLKLQGKTLKGETTTEAVDAAYAEKVWKQYANDNGVDGEWTYDRATKTFTVTE,3.712551,"I6K, N8Q, T25Y, F30W, D47R",5
MYYKLILNGKTLKGETMTEAVRAATREKVFKQYANDNGVDGEWTYDDATKTFTVWE,-1.3982557,"Q2Y, T17M, D22R, A26R, T55W",5
MPYKYILNGKWLKGETTTEAVDYATAEKVFKQIANDNGVDGEWTYDDATKTFTVTE,-4.693657,"Q2P, L5Y, T11W, A23Y, Y33I",5
MQYKLILNGKTLKGETTTEAWDAYRAEKVFKKYANWNGVDGEWTYDDATKTFTVTE,6.97783,"V21W, A24Y, T25R, Q32K, D36W",5
MQYKLILNGKTVKGETTTEAVDAATARKVFKQYGNDNYVDGEWTYDDATKTFTVYE,-6.1237674,"L12V, E27R, A34G, G38Y, T55Y",5
MQYKLWLNGKWLKFETTTEAVDAARAEKVFKQYANDNGVDGEWTYDDATKLFTVTE,2.5505004,"I6W, T11W, G14F, T25R, T51L",5
MQYYLILNPKTLKGETTTEAWDAATAEKVFKQYANMNGVDGEWTYDDAWKTFTVTE,2.610797,"K4Y, G9P, V21W, D36M, T49W",5
MQYKFIYNGKTYKGETFTEAVDAATAEKVFKWYANDNGVDGEWTYDDATKTFTVTE,-2.3968484,"L5F, L7Y, L12Y, T17F, Q32W",5
MQYKLIFEGKDLKGETTTEAVDAYTAEKVFKQYANDNGVDGEWTYDDATKTFHVTE,2.771147,"L7F, N8E, T11D, A24Y, T53H",5
MQYKLILNGKTLKGETTTEWVDRATAEWVFKQYANDNSVDGEWTYDDATKTFTVIE,-4.272946,"A20W, A23R, K28W, G38S, T55I",5
MQYKVILNGTTWKGETTTEAVDAATAEKVFKQYANDNGVDGEWTYDDWTKTFEVTE,1.5737107,"L5V, K10T, L12W, A48W, T53E",5
MQYKLILNGKTLKGETTTEAVDAATAEKVERQYKNDNGVDGEWTYDRATKRFTVTE,-5.1433306,"F30E, K31R, A34K, D47R, T51R",5
MQYKLILNGFTLKGWTTTEWVDAARAEKVFKQYANDNGVDGEWTYDRATKTFTVTE,4.564593,"K10F, E15W, A20W, T25R, D47R",5
MQYKLILNGKTLKGYTTTEAVDAATAEKVFKQYLNLNGVDGIYTYDDATKTFTVTE,-2.9983363,"E15Y, A34L, D36L, E42I, W43Y",5
MQYKEIWNGKTLKGETTTEAVDAYTAERVFKQYANDNGVDGEWTYVDATKTFTVTE,-2.9916341,"L5E, L7W, A24Y, K28R, D46V",5
MRYKLILNGKTLKGETTTEAVHYATAEKVFKQYINDNGVDGEWTYDDATKTITVTE,-4.44856,"Q2R, D22H, A23Y, A34I, F52I",5
MQYLLILNGKTLKYETTTEAVDAATAEKVFKQYANFNGVWREWTYDDATKTFTVTE,-2.1690874,"K4L, G14Y, D36F, D40W, G41R",5
MQYKLILNGKTLKGFTTYEAYDAATQEKVFWQYANDNGVDGEWTYDDATKTFTVTE,-4.3515825,"E15F, T18Y, V21Y, A26Q, K31W",5
MQYKLILYGKTLKGETTTEAWDAAKREKVFKQYANYNGVDGEWTYDDATKTFTVTE,-0.41552562,"N8Y, V21W, T25K, A26R, D36Y",5
MQYKLILNGKTLKGETTTHAVDAATAEKVFKQYANRNFWDGEWTYDDATKTWTVTE,-4.5325003,"E19H, D36R, G38F, V39W, F52W",5
MQYKLILNGKTLKGETTTEAVDDATAWKVFKQYWNDNGVDGEWTYDDAYKTFTVTY,-5.627667,"A23D, E27W, A34W, T49Y, E56Y",5
MIYKLIYNGKFLKGETTTEAVDAATAEKVFKQYAYDNGVDGEWTYDDATKTFYVTE,-3.4491646,"Q2I, L7Y, T11F, N35Y, T53Y",5
MQYKLILNGKTLWGETTTEAVDWATAEKVFKQYANDNGVDGEWYYDRATKTFTVWE,-0.3180648,"K13W, A23W, T44Y, D47R, T55W",5
MQYLLILWGKTLKGETTTEAVDAATAEKVFKRYANDNGVDGSWTYDDATKTFTVTR,3.6024756,"K4L, N8W, Q32R, E42S, E56R",5
MQSKLILNGKTLKKETTTEAVDAWTAEKVFKQYVNDYGVDGEWTYDDATKTFTVTE,-3.0180724,"Y3S, G14K, A24W, A34V, N37Y",5
MQYKLILNRKTLWGETTTEAVDAATAEKRFKQYANDNGVDGWWTYDDYTKTFTVTE,4.8983874,"G9R, K13W, V29R, E42W, A48Y",5
MQYKLILNGKTLYGETTTEAVDAATAEKRFKQYAFDNMVDGWWTYDDATKTFTVTE,0.17838699,"K13Y, V29R, N35F, G38M, E42W",5
MQYKLILNGKYLYGETTTWWVDAATAEKVFKQYANDNGVDGEWTWDDATKTFTVTE,1.8321966,"T11Y, K13Y, E19W, A20W, Y45W",5
MQYKLILNGKTLKYEPTTEAVRAATAEKVFKQYANDWGVDGEWTYDDATKTFYVTE,-1.335543,"G14Y, T16P, D22R, N37W, T53Y",5
MQYKLILWGKTLWGETTTEAVDAATAEKVFKQYANDNGVYGEWTYDRATKTFTVTW,5.778362,"N8W, K13W, D40Y, D47R, E56W",5
MQYKVLLNGKTLKGYTLTEAVDAATAEKVFKQYANDNGVDGEFTYDDATKTFTVTE,-0.7295671,"L5V, I6L, E15Y, T17L, W43F",5
MQYKLILNGKTLKGETIQEAVDLATAEKVFKQYANDNGVDGFWTYDDATKTFWVTE,0.6830148,"T17I, T18Q, A23L, E42F, T53W",5
MAYKVILNGKTLKGETTTEAVDWATAEKVFKQYANDAGVDGEWTYDDATKTWTVTE,-4.620475,"Q2A, L5V, A23W, N37A, F52W",5
MQIKLKLNGKTLKGEKTTEFVDAATAEWVFKQYANDNGVDGEWTYDDATKTFTVTE,-2.8205917,"Y3I, I6K, T16K, A20F, K28W",5
MQYKLILNGKTLWGETTTEAVDAATAYKVFKQSKNWNGVDGEWTYDDATKTFTVTE,-5.983504,"K13W, E27Y, Y33S, A34K, D36W",5
MQYKRILNGKSLYGETTTEAVDAYTAEKVFKQYANDNGVDGEWTYDDATKTFTVTW,-0.73939216,"L5R, T11S, K13Y, A24Y, E56W",5
MQYKLILNGKTYKYETTTEAVDAATAEKVFKQAANDNGWDGEVTYDDATKTFTVTE,-6.2408366,"L12Y, G14Y, Y33A, V39W, W43V",5
MQYKLILGGKTLKGETTTEASDAFTAEKVFKQYANLNGVDGEWTWDDATKTFTVTE,5.756202,"N8G, V21S, A24F, D36L, Y45W",5
MQYKLILNGKTLKGETTTEKYDAATAWKVFKQYARDNGVDGEWTYDDYTKTFTVTE,-4.9814477,"A20K, V21Y, E27W, N35R, A48Y",5
MQYKLILNRKTLKWETTTEAVDAAYAEKVFKQYAWDNGVDGEWTYDDATKTFTVKE,-2.988269,"G9R, G14W, T25Y, N35W, T55K",5
MQYKLILNGKTLKGLTTTEAVDKATAEKRFKQYANTNGVDGEWTYDDATKTFTRTE,-3.0530643,"E15L, A23K, V29R, D36T, V54R",5
MQYKLTLNGKTLKGETTTEAVDAATAEKVFKQYANDNGVDKEWTYDDTTKKFHVTE,-2.2025175,"I6T, G41K, A48T, T51K, T53H",5
MQYKLIRNGKTLKGETTTESVDYATAEKVFKQYAWDNGVDGEWFYDDATKTFTVTE,-5.410247,"L7R, A20S, A23Y, N35W, T44F",5
MQYKLILNGKTLKGETTTEAVDAATAEKVFKYWWNDNGYDGEWTYDDATKTWTVTE,-5.6705513,"Q32Y, Y33W, A34W, V39Y, F52W",5
MQYKWILNGKTLKGETWTEAKDYATAEKRFKQYANDNGVDGEWTYDDATKTFTVTE,-2.7524505,"L5W, T17W, V21K, A23Y, V29R",5
MQFWLILNGKTLKGETTTEAVDAATYEKVFKWRANDNGVDGEWTYDDATKTFTVTE,-4.2379003,"Y3F, K4W, A26Y, Q32W, Y33R",5
MQYKLILNGKTLKGETTTEAVDAAWAEKVFKQYANFNYVDGEWTYDDATYTFTVTY,1.9099263,"T25W, D36F, G38Y, K50Y, E56Y",5
MQYKLILNGKTLKGETTTEAVDAYTVEKVFKQYANDNGVDGYWTYDDWTKTFTLTE,3.887901,"A24Y, A26V, E42Y, A48W, V54L",5
MQYKLILNGKTLKGEFTTEAVDAAKAEKVFKQYVNDNLVDGEWTYDDATKTFTVWE,-0.12778428,"T16F, T25K, A34V, G38L, T55W",5
MQYKLILNYKTLKRETTTEAVDAARARKVFKNYANDNGVDGEWTYDDATKTFTVTE,-3.8354907,"G9Y, G14R, T25R, E27R, Q32N",5
MQYKLILNGKTLKGETTSEAVDAYTAEWVFKQYANDNGVDGEWTYDRATKRFTVTE,3.5341525,"T18S, A24Y, K28W, D47R, T51R",5
MQYKLRLNGKWLKGETTTEAVDRATIEKVFKQYANDNYVDGEWTYDDATKTFTVTE,-3.5915372,"I6R, T11W, A23R, A26I, G38Y",5
MQYKLILNGKTLKGETTTEAVDAATAEKVFKQLANDNGVDREWTYDRATKTFYVTK,-3.6987731,"Y33L, G41R, D47R, T53Y, E56K",5
MQYKLILNGKTLKGETTYEAVEAATAEKVFKQYANDNGVWGEWTYDDATKTFMVTF,3.5870605,"T18Y, D22E, D40W, T53M, E56F",5
MQYKLILNGKTLKGETTTEAVDAARARWVWKQYANDNGVDGEWTYDDATKTFWVTE,-5.023406,"T25R, E27R, K28W, F30W, T53W",5
MQYKLILNGKTYKGETTTPYVDAATAEKVFPQYANDNFVDGEWTYDDATKTFTVTE,-5.363861,"L12Y, E19P, A20Y, K31P, G38F",5
MQYKRILNGKTFKRETITEAVDAATAEKVFKQYANDNGVFGEWTYDDATKTFTVTE,-1.9357264,"L5R, L12F, G14R, T17I, D40F",5
MQYKLILDWKTLKGETTTEAVDAATAEYVIKQYANDNGVDGEWTYDDATKTFTRTE,-5.401576,"N8D, G9W, K28Y, F30I, V54R",5
MQYKLILNGKTLKWWTTTEAVDAAFAEKVFKQYANDNGVDGEWTYSDATKTFTWTE,2.602702,"G14W, E15W, T25F, D46S, V54W",5
MQYKLILYGKTLKGETTTEAVDAATAEKVFKQYANWNGYWGEWTYDDATWTFTVTE,2.6241148,"N8Y, D36W, V39Y, D40W, K50W",5
MQYKIILNGKTLYGETTTEAVDAATAEKVFAQYANDNGVDGEWTYDDATKTFSVTY,-5.844353,"L5I, K13Y, K31A, T53S, E56Y",5
MQYKLIQNGKTLLGETTTEAVDRATREKVFFQYANDNGVDGEWTYDDATKTFTVTE,-6.2002993,"L7Q, K13L, A23R, A26R, K31F",5
MQYKLILNGGTLKGETYTEAVDAATAEKVFKQYANDNGVDGEWWYDDATKTWWVTE,-1.6943818,"K10G, T17Y, T44W, F52W, T53W",5
MQYKLILNWKTLKYETTHMAVDAATAEKVFKQYANDNGYDGEWTYDDATKTFTVTE,-0.8177724,"G9W, G14Y, T18H, E19M, V39Y",5
MQYKLILNGKTLKGETTTEAVDAATWEKVFYQYANDNGVDGEWTYSDSWKTFTVTE,-5.014659,"A26W, K31Y, D46S, A48S, T49W",5
MQYKLILNGVTLKGVTTTEAVDAATAEKVFKQYANDNGVDGEWTYDDARKTFTVWL,2.111974,"K10V, E15V, T49R, T55W, E56L",5
MQYKLILNGKTLKWYTTTEAVDYATAEKVRKQYANDNGYDGEWTYDDATKTFTVTE,-5.2070584,"G14W, E15Y, A23Y, F30R, V39Y",5
MQYKLILNGKTLKGETTWEAVDAATAWKVFKQYANDFGVWGEWTYNDATKTFTVTE,-2.840485,"T18W, E27W, N37F, D40W, D46N",5
MQYKLILNGKTLEGSTTYEARDAATAEKVFKQYANDNGVDGEWTYDDATKTYTVTE,1.6530125,"K13E, E15S, T18Y, V21R, F52Y",5
MQYKLILNGYTFKGETYTEAVDAATREKVFKQYANDKGVDGEWTYDDATKTFTVTE,-2.8596523,"K10Y, L12F, T17Y, A26R, N37K",5
MQYKLILNGKTLLGLTTTEAVDAATREKVFRQYANDNYVDGEWTYDDATKTFTVTE,-4.079299,"K13L, E15L, A26R, K31R, G38Y",5
MQYKLYLNGKTLKGETTTEAVDAATAEKVWKQYWNDNGDDGEWTYDDAWKTFTVTE,-5.0918193,"I6Y, F30W, A34W, V39D, T49W",5
MQAKLPLNGKTLKGETTTEWVDAATAEKVFKQWANDHGVDGEWTYDDATKTFTVTE,-5.0957217,"Y3A, I6P, A20W, Y33W, N37H",5
MQYRLILNGKTLKGETTTEAVDAATAEKVFKQYAEDNGVDGEWTYDDRTKHFWVTE,-0.85978705,"K4R, N35E, A48R, T51H, T53W",5
MQYKLILNGKTFKGETTTFAVDAYTAEKVFKQYANDNGVWGEWTYDDATKRFTVTE,6.9881496,"L12F, E19F, A24Y, D40W, T51R",5
MQYKLIYNGRTLKGETTTEAVDAATAEKVFKHKANDNGVDGEWTYDDATKRFTVTE,1.2774392,"L7Y, K10R, Q32H, Y33K, T51R",5
MQYKLILNGYTLKGETTTEYVDFATAEKVFKQYANDNGVDGEWMYIDATKTFTVTE,-2.201964,"K10Y, A20Y, A23F, T44M, D46I",5
MKYKLILNGKILKGETTTEAVDAARAQKVFKQYANDNGVDGEWTYDDATKTFTPTE,-4.6890554,"Q2K, T11I, T25R, E27Q, V54P",5
MQYKLILNGKTLKGETLTEAYDRATAEWVFKQYANDNGVDGEWTYDDAWKTFTVTE,-2.2832792,"T17L, V21Y, A23R, K28W, T49W",5
MQYKLILNGKTLKGEYTTEAVDRATAEKVFKQYANDNGWDGEWTYDDWTKTGTVTE,-5.4922643,"T16Y, A23R, V39W, A48W, F52G",5
MQYKLIYNTYTLKGETTTEAWDAATAEKVFKQYANDNGVDGEWTYDDATKWFTVTE,1.1555076,"L7Y, G9T, K10Y, V21W, T51W",5
MQYKLILMGKTLKGETTTEAVDAATAEYVFKQYYQDNGVDGEWTYDDATKTFIVTE,-4.875997,"N8M, K28Y, A34Y, N35Q, T53I",5
MQYKLILNGWTLKGETTTWAVDAYTAEKVFKQYANDNGVDGEWTYDDYTKRFTVTE,6.5984845,"K10W, E19W, A24Y, A48Y, T51R",5
MQYKLILNGKTLKGETTTWAWDAATAEKVFKQYFNDNGVDGEYTYDDATWTFTVTE,-3.7051463,"E19W, V21W, A34F, W43Y, K50W",5
MQYKLILNGKTLKGETTTYAVDAATAWKVFKQYANDNWVDGEWTYDDARKRFTVTE,-2.03134,"E19Y, E27W, G38W, T49R, T51R",5
MQYKLILNGKTLKGFTYTEYVDAATAEKVFKQYANDNGVDGEWTYDDATKWFMVTE,2.7307858,"E15F, T17Y, A20Y, T51W, T53M",5
MQYKLILYGKRLKGETTTWAVDAATAEKVFKQYAYDNGVDGEWTYDDATKYFTVTE,-0.35293603,"N8Y, T11R, E19W, N35Y, T51Y",5
MQYKLILNGTTLKGETTTEAVDAATAKKVFKQKAIDNGVDGEWTYDDATKTFTVTV,-5.736169,"K10T, E27K, Y33K, N35I, E56V",5
MQYKLILNGYTLKGETTTEAVDYATAEKVFKQLAYDNGVDGRWTYDDATKTFTVTE,-4.7434397,"K10Y, A23Y, Y33L, N35Y, E42R",5
MQYKLILNGKTLKGNTTTEWYDAATAEWVFKQYANDNGVDGEWWYDDATKTFTVTE,-0.7416674,"E15N, A20W, V21Y, K28W, T44W",5
MQYQLILNGKTLYGEVTTEAVDWATAEKVFKQYWNDNGVDGEWTYDDATKTFTVTE,-4.9557633,"K4Q, K13Y, T16V, A23W, A34W",5
MQYKLILSGKLLKGETTTEAVDAATAWKVFKQYADDNGVDGEWTYDDARKTFTVTE,-5.499509,"N8S, T11L, E27W, N35D, T49R",5
MQWKLILNGKTLKGMTTTEAVDAARAEKVFKQYANDNGVDGEWFYDDADKTFTVTE,4.349897,"Y3W, E15M, T25R, T44F, T49D",5
MQYKLILNGKTYKGETTTEAVDRATAEKVFKQYANDNGVDKEWTYYDATWTFTVTE,-5.617767,"L12Y, A23R, G41K, D46Y, K50W",5
MQYKLILNGRTLKGEWTTEAVDAATAEKRMKQYANDNGVDGEWTYDDATKTFTVLE,2.8779914,"K10R, T16W, V29R, F30M, T55L",5
MQYKLILNWKKLKGETKTEAVDAATAWKVFKQYANDNGVDAEWTYDDATKTFTVTE,-4.5748563,"G9W, T11K, T17K, E27W, G41A",5
MQYYLILNGKTLKGETTLEAVYAATAEKVFKQYKNDNGVYGEWTYDDATKTFTVTE,-1.184963,"K4Y, T18L, D22Y, A34K, D40Y",5
MQYRLILNGKTLKGETTYEAVDAATAEKVFKQYANRNGVDGRWTYDDATKWFTVTE,5.1311054,"K4R, T18Y, D36R, E42R, T51W",5
MQYKLILNGKTLKGEGTTEWVDAATIEKVFKQYAYDNGVDGEWTYDDATWTFTVTE,-4.979066,"T16G, A20W, A26I, N35Y, K50W",5
MQYKLILNGKTLKGETTTEAVDAAKAEKVRKQYANDNGVDGEWYYDRATFTFTVTE,-0.9429021,"T25K, F30R, T44Y, D47R, K50F",5
MQYKLYLNGKTLKGETTTEAVDAATAIKVFKQYAYDNGVDGEWQYDDATKKFTVTE,-4.9721727,"I6Y, E27I, N35Y, T44Q, T51K",5
MQYKLILNGKVLKGETTTYAVDAATAEKVFKYYANWNGWDGEWTYDDATKTFTVTE,-3.0616133,"T11V, E19Y, Q32Y, D36W, V39W",5
MQYKLILNGRTLKGETTTEAVDAATAEKVFAQYANDNGVYGEWTYNDATKTFTVYE,-0.74696875,"K10R, K31A, D40Y, D46N, T55Y",5
MQYNLILNGKWLWGETTTEAVRAATAEKVFKQYRNDNGVDGEWTYDDATKTFTVTE,-1.8650405,"K4N, T11W, K13W, D22R, A34R",5
MQYKLALNGKYLKGETTTEAKDAVTAEKVFVQYANDNGVDGEWTYDDATKTFTVTE,-3.392071,"I6A, T11Y, V21K, A24V, K31V",5
MQYKLILNGKTLKGETTTEAVDAFTAEKVFKQYANDNGYKGEWTYDDATKTFTDTR,-2.1194878,"A24F, V39Y, D40K, V54D, E56R",5
MQYKLILNGKWLYGETTTEAVDAARAEKVFKQYANDNGFDGEWTYDDATRTFTVTE,2.2736235,"T11W, K13Y, T25R, V39F, K50R",5
MQYKLILNGKTLKGETRTYAVDAATAEKVFKQYAYDNGVDGEWTYNDATDTFTVTE,0.2188442,"T17R, E19Y, N35Y, D46N, K50D",5
MQYKLIYNGKTLKGYTTTEAVTAATAEKVFKQYAWDNGVDWEWTYDDATKTFTVTE,-4.7493052,"L7Y, E15Y, D22T, N35W, G41W",5
MQYKLILNGKTLKGETTTEALDAATAEKVFKQYANDNGVDGEWWYDDFWKTFTETE,0.35314745,"V21L, T44W, A48F, T49W, V54E",5
MYYKLIRNGKTLKGETTTEAVYWATAEKVFKWYANDNGVDGEWTYDDATKTFTVTE,-4.1372666,"Q2Y, L7R, D22Y, A23W, Q32W",5
MQYKLILNGKTLKGETTTYAVDWATAEKVFKQYANFNYVDGEWTYDDAVKTFTVTE,-1.7951175,"E19Y, A23W, D36F, G38Y, T49V",5
MQKKLILNGKTYLGETTTEAVDAATAEKVFKQYAKDNGVDGEWTYDDATKTFWVTE,-5.8065457,"Y3K, L12Y, K13L, N35K, T53W",5
MIYKLILNGKTLKGETTTWAVDAARAEKVKKQYANDNGWDGEWTYDDATKTFTVTE,-2.4393072,"Q2I, E19W, T25R, F30K, V39W",5
MQYKVILNGKTLKGETLTEAVDAATAEKRFKQYANDNGWDLEWTYDDATKTFTVTE,-4.4758005,"L5V, T17L, V29R, V39W, G41L",5
MQYFLILNGKTLKGETTQEAVDAATAYKVFKQYANDNLWDGEWTYDDATKTFTVTE,-5.6825113,"K4F, T18Q, E27Y, G38L, V39W",5
MSYKLILNGKTLKGETTREAIDAATAEKVFKQYANDNGWDGEWTYDDATKTFTVTL,-1.9509101,"Q2S, T18R, V21I, V39W, E56L",5
MQYKLILNGKTLKGETTTEYVDAATAERVFKQYMNDKGVDGEYTYDDATKTFTVTE,-5.111506,"A20Y, K28R, A34M, N37K, W43Y",5
MMYKLILNGKTLKGETTTEAVDAATAEKRRKRYANDNGVDGYWTYDDATKTFTVTE,0.45291153,"Q2M, V29R, F30R, Q32R, E42Y",5
MQYKLILNGKTLKGWWTTEAVDAATPEKVFKQYANVNGVWGEWTYDDATKTFTVTE,2.5633004,"E15W, T16W, A26P, D36V, D40W",5
MKYKLILNGKTWKGETTTEAVDAATAEKVFKQYANDNGVDGWLTYDDATKWFTVTE,-2.6136754,"Q2K, L12W, E42W, W43L, T51W",5
MQYKLILNGKTLKGWTTTEAYDAATAERVFKYYANDNGVDIEWTYDDATKTFTVTE,-3.607818,"E15W, V21Y, K28R, Q32Y, G41I",5
MQYKLILNGKTLKGETTTEAVKAATAEKVFKQYANDNGYDKFWEYDDATKTFTVTE,-4.2373896,"D22K, V39Y, G41K, E42F, T44E",5
MQYKLILNGKTLKGETTTEAYDAAAAFKVFKQYANDNGVWGEWTYDWATKTFTVTE,0.19623494,"V21Y, T25A, E27F, D40W, D47W",5
MQVKLILNGKTLKPETTTEAADRATAEKVFKQYANDNGVDGEWTYDDATKTFTVTY,-4.4676933,"Y3V, G14P, V21A, A23R, E56Y",5
MQYKLILNGKTLKGETTTWAVDAATYEKVFKQYANDNGVDWEWTYDDAWKTFAVTE,-3.9734313,"E19W, A26Y, G41W, T49W, T53A",5
MQYKLILNGKELKGETTTEAVDAALAWFVFKQYANDNGVDGEWTWDDATKTFTVTE,-5.0294814,"T11E, T25L, E27W, K28F, Y45W",5
MQYKLILNGKTLKVATTTEAVDAWTAEKVFKQYANDNWYDGEWTYDDATKTFTVTE,1.0407346,"G14V, E15A, A24W, G38W, V39Y",5
MQYKLILNGKTLKYETTTEAVDAFTAEKVFKQYANDNGVDGEWTWDDARKTWTVTE,-1.1862056,"G14Y, A24F, Y45W, T49R, F52W",5
MQYKLILEGKTLKGETKTEAVDWARAEKVFKQYANDNGVDGEWTWDDATKTFTVTE,-0.35877785,"N8E, T17K, A23W, T25R, Y45W",5
MQYKLILNGKTLKGWTTTAAVDAATAEKIFWQYANDNGVDGEWTYDDATKTFTVTH,-2.4207911,"E15W, E19A, V29I, K31W, E56H",5
MQYKLILNGVTLKGETTTENVDRATAEKVFWQYANDNGVWGEWTYDDATKTFTVTE,-3.5863283,"K10V, A20N, A23R, K31W, D40W",5
MQYKLILNGKTLKGRTTTEAVDAYTAEKVFKQYANDNMVDGEWWYNDATKTFTVTE,5.5929413,"E15R, A24Y, G38M, T44W, D46N",5
MQYKLILNQKTQKSETTTEAVDAATAEKVFKHYANDNGVDGYWTYDDATKTFTVTE,-0.08782657,"G9Q, L12Q, G14S, Q32H, E42Y",5
MRYKWILYGKTYKGETTTEAVDAATAEKVFVQYANDNGVDGEWTYDDATKTFTVTE,-5.023849,"Q2R, L5W, N8Y, L12Y, K31V",5
MQYKLILFGKTLKGLTTTAAVDAWTAEKVFKQYANDNGVDGWWTYDDATKTFTVTE,6.640532,"N8F, E15L, E19A, A24W, E42W",5
MGYKLILNGKTLKGETTTEAVDAATAEKVFHQYANDNGVDGEVWYDDITKTFTVTE,-5.5484743,"Q2G, K31H, W43V, T44W, A48I",5
MQYYLILNGKTLKGYTTTEAVDAATAWKVFKQYANDNGVDGEWTYDDATKRFTVWE,-2.0167048,"K4Y, E15Y, E27W, T51R, T55W",5
MQYKLILNGKTLKGETTTEAFDAATAEKRFKQAANDNGVDGEWWYDDAWKTFTVTE,3.7341251,"V21F, V29R, Y33A, T44W, T49W",5
MQYKLILNGKTLKGITTTEAVDAATAEKVRKQWANDNGVDGEWTYDDATMTFTVYE,-2.510971,"E15I, F30R, Y33W, K50M, T55Y",5
MQYKLILNGKTLKGETTTIAVDAATWEKVFKQYANDNGVDGEYTWRDATKTFTVTE,-4.213865,"E19I, A26W, W43Y, Y45W, D46R",5
MQYYLILNGKTLKGETTTEAVDAATREKVIKQYANDNGVDWEWTYDDATKTFTATE,-5.316703,"K4Y, A26R, F30I, G41W, V54A",5
MQYRLILNGSTLKGETTTEAVDAATATKVFKQRANDNGVDGEWWYDDATKTFTVTE,-3.933409,"K4R, K10S, E27T, Y33R, T44W",5
MQYKLILNGKTLYGETTTEAVDAATAEKVFKQYCNDNGFDGEWTYDDATKTFYVWE,1.1758857,"K13Y, A34C, V39F, T53Y, T55W",5
MQYKLIYDGKTLKGETTTEALDAATAEKVFKQYEWDNGVDGEWTYDDATKTFTVTE,-5.2157073,"L7Y, N8D, V21L, A34E, N35W",5
MQYKLILNGKTLKWETTTYAMDAATAEKVFKQYAYDNGVDVEWTYDDATKTFTVTE,-4.7535596,"G14W, E19Y, V21M, N35Y, G41V",5
MMYKLILNGKTLKGETTTKAVDAATAEWRFKQYAYDNGVDGEWTYDDATKTFTVTE,-1.9541171,"Q2M, E19K, K28W, V29R, N35Y",5
MQYKLYLNGKTLKGETTTEAVDAYHALKVFKQYANDNGVDGEWTYDDATKTFTWTE,-0.97140574,"I6Y, A24Y, T25H, E27L, V54W",5
MQRKLILNGKTLKGETTTEAVDAATAEWYFKKYANYNGVDGEWTYDDATKTFTVTE,-2.5287669,"Y3R, K28W, V29Y, Q32K, D36Y",5
MQYKLILNGKTLKYETTTEAYDAARAEKVFKQYYNDNGVDGEWWYDDATKTFTVTE,-0.6744848,"G14Y, V21Y, T25R, A34Y, T44W",5
MQYKLILNGKTLKGETWTEAVDKAKAEKVFKQWANDNGVDGEWTYDRATKTFTVTE,1.7024041,"T17W, A23K, T25K, Y33W, D47R",5
MQYKLYLNGKWLKGEYTTEAVDAATAFKVFKQYANDNGVDGEWTYDDATKTFTVWE,-3.815521,"I6Y, T11W, T16Y, E27F, T55W",5
MQYKLILNGKTLKGETTGMAVDAATRAKVFKQYANDNGVDGEWTYHDATKTFTVTE,-5.261283,"T18G, E19M, A26R, E27A, D46H",5
MQYIVILNGKTLKKETTTEAYDAATAEKVFKQYANDNYVDGEWTYDDATKTFTVTE,1.0178843,"K4I, L5V, G14K, V21Y, G38Y",5
MQYKLILRGKTLKPETTTEAVDAATWAKVFKQYANDNGVDGEWTYDDATKTFWVTE,-5.539517,"N8R, G14P, A26W, E27A, T53W",5
MQYKSILNGKTYKGETTTEAVDAAYAEKVFKQYYNDNGWDGEWTYDDATKTFTVTE,-5.5805926,"L5S, L12Y, T25Y, A34Y, V39W",5
MAYKLILNTKTLKGETTTEAVDAATAEKVFKQYANDNGVDWWWTYDDATKTFYVTE,-1.9736487,"Q2A, G9T, G41W, E42W, T53Y",5
MQYKLILNGKTLKGETTTEAYDAATAEMKRKQYANDWGVDGEWTYDDATKTFTVTE,-4.408719,"V21Y, K28M, V29K, F30R, N37W",5
MQYKLILNGKYLKTETTTEALDAATAEKVRKQYANDNGVDGEWYYDDATKTFTVTE,-3.6779351,"T11Y, G14T, V21L, F30R, T44Y",5
MQYKLILNGKTLKGETTTYAVDDATAWKVFKQYANDNGVDGEWTYDDATKTFIVTK,-3.8084335,"E19Y, A23D, E27W, T53I, E56K",5
MQYKLILNGKTLKYETTTEWVDAAWAEKVFKQYANDNGVDGWWTYDDAKKTFTVTE,2.3320312,"G14Y, A20W, T25W, E42W, T49K",5
MQYKLILNGKTLKGETLTEAVDRATAEKVFKRYANDNGVDGEWWYDDANKTFTVTE,1.0062094,"T17L, A23R, Q32R, T44W, T49N",5
MQYKAILNGKTLKGETTTEWVDAATAEKVFKQYANLNGVDMEWTYDDATKDFTVTE,-3.4344606,"L5A, A20W, D36L, G41M, T51D",5
MQYKLILNGKTWKGETITEAVDRATAEKVFKQYANDNGYDGEWTYDDYTKTFTVTE,-3.6791978,"L12W, T17I, A23R, V39Y, A48Y",5
MQYKLILNGKTLKRVTTTEAVDAATAEKVFKRYANDNGVDGEWTYDDAWKVFTVTE,3.368028,"G14R, E15V, Q32R, T49W, T51V",5
MQYYLILNGFTLWGETTTEAYDAATAEKVFKQYANDNGWDGEWTYDDATKTFTVTE,-0.42691073,"K4Y, K10F, K13W, V21Y, V39W",5
MQYKLILNGKYLKGKTTTEYVDAATAEKVRKQYANDNGVDGEWTYDDATKTWTVTE,-5.8039145,"T11Y, E15K, A20Y, F30R, F52W",5
MQYKLILNGKTLKGETTTEAVDRYTALKVFKQYANDNGVDAEWTYDDATKTFTVWE,-4.806411,"A23R, A24Y, E27L, G41A, T55W",5
MQYKLILNGKTLKGETTTEAVWAATAEKVFKQYAWDNGWDAEFTYDDATKTFTVTE,-5.502692,"D22W, N35W, V39W, G41A, W43F",5
MQYSLILNGKYLKGETTTYAVDAATARKVFKQYANDMGVDGEWTYDDATKTFTVTE,-4.1520667,"K4S, T11Y, E19Y, E27R, N37M",5
MQYKYYLNGKTLKGETTTEAVDLATAEKVFKYYANDNGVDGEWTYDDAWKTFTVTE,-3.0850003,"L5Y, I6Y, A23L, Q32Y, T49W",5
MRYKLILNGKTLWGETTTEARDAATAVKVFKQYANDNGWDGEWTYDDATKTFTVTE,-4.913168,"Q2R, K13W, V21R, E27V, V39W",5
MQYKLILNGKTLKGETTTEAVDAATAAYVAKQYANDNGVDGEWTYDDWTKWFTVTE,-5.309003,"E27A, K28Y, F30A, A48W, T51W",5
MQYKLILNGKTLKGETTTEAVDAAYAKKVFKQYANDNGVDGWWTYDWATKTFTVWE,-1.0134406,"T25Y, E27K, E42W, D47W, T55W",5
MDYKLILNGKTLKGETTTEAVDAATWEKRFKQYAWDNGVDGEWTYDDATKTFRVTE,-3.2008657,"Q2D, A26W, V29R, N35W, T53R",5
