Sequence,Score,Mutations,Number of Mutations
MQYKLYLNGKWLKGETTTEAVDAATAEKVFKQYANLNWVDGSWTYDDATKTFTVTE,3.4535248,"I6Y, T11W, D36L, G38W, E42S",5
MQYVWILNGVTLKGETTTEAVDAATAQKVFKQYANRNGVDGEWTYDDATKTFTVTE,-4.286048,"K4V, L5W, K10V, E27Q, D36R",5
MQYRLILNGKTIKGETTTEAVDAATAEKVFKQYANDNGVDGEWTYDDATKTFYLTP,-0.5999133,"K4R, L12I, T53Y, V54L, E56P",5
MQYKLILNGKTLKGETTFEWVDAATAYKVFKQYAYDNGYDGEWTYDDATKTFTVTE,-5.656165,"T18F, A20W, E27Y, N35Y, V39Y",5
MQYKLILNGKTLKGETTTYAVNAYTAEKVFKQYANDNGVDGYWTYDDATKTFTVWE,6.322583,"E19Y, D22N, A24Y, E42Y, T55W",5
MQYKLILNGKTLKGETTIEAVDAATAEKVFKQYANYNWVDGWYTYDDATKTFTVTE,-1.5417637,"T18I, D36Y, G38W, E42W, W43Y",5
MQYKLYFNGKTLKGETTTEAVDAATAEKVFKQYANDNGVDGEWTYVRATKIFTVTE,4.627958,"I6Y, L7F, D46V, D47R, T51I",5
MQYKLILNGKTLKGETTGEAVDAATAERVFKQYADDNGVDGEWTYDRAYKTFTVTE,-1.7339801,"T18G, K28R, N35D, D47R, T49Y",5
MQYKLILNGKTLKGETTTEAVDAATALRVFKQYANKNGVWGEWTYDDAYKTFTVTE,-1.5819753,"E27L, K28R, D36K, D40W, T49Y",5
MQYKLILNGKTLKNETTTEAVDRATALKVFKTYANDNGVDGEWTWDDATKTFTVTE,-5.7888017,"G14N, A23R, E27L, Q32T, Y45W",5
MQYKLILNGKTLKGETTTEAVDAATAEYVFKQYANDNGVDGEWTYDYWQKHFTVTE,1.5422204,"K28Y, D47Y, A48W, T49Q, T51H",5
MQALLILNGKTLKGETFTEWVDAATAEKVFKQYLNDNGVDGEWTYDDATKTFTVTE,-2.2544246,"Y3A, K4L, T17F, A20W, A34L",5
MQYKLILNGKTLKGETYTEAVDAATAEKVFKQYANDNGVDWEWKYDRATKTFLVTE,-0.654781,"T17Y, G41W, T44K, D47R, T53L",5
MQYKLILNGKTLYGETTTEAVDAATAEKVFKQYLNDNGVDGEWTYDDYTKWFTGTE,-1.7293732,"K13Y, A34L, A48Y, T51W, V54G",5
MQYKLILDGKTLKGETTTEAVDAAFAEKVFKQYNNMNGVDGEWTYDDATKTFWVTE,-0.47005704,"N8D, T25F, A34N, D36M, T53W",5
MLYKLILNGKTLKGETTTEAWDAATAEKVFKQYYNDNFVDGEWTYDDATKWFTVTE,0.051926084,"Q2L, V21W, A34Y, G38F, T51W",5
MQYKLILNGKTYNGETTTEAVDAATAEKVFKQYANDWGVDGEWTYDRATKTFTVTF,0.20393911,"L12Y, K13N, N37W, D47R, E56F",5
MQYKLWLNGKTLKGETTTEAVDAATAERVFKQYRNDNGWDGEWTYDDATKTFTVTV,-5.4485664,"I6W, K28R, A34R, V39W, E56V",5
MQYKHIQVGKTLKGETTTEAVDAATAEKRFKQYANDNGVDGEWTYDYATKTFTVTE,0.8223783,"L5H, L7Q, N8V, V29R, D47Y",5
MQYKTILNGKTLKGETTTEAVDAATFEWVFKQYANDNGFDGEWTYDDAYKTFTVTE,-5.2895427,"L5T, A26F, K28W, V39F, T49Y",5
MQYKLILNGKWLVGETTTEAVDAATAEKVFRQYANANGVDYEWTYDDATKTFTVTE,-3.0284123,"T11W, K13V, K31R, D36A, G41Y",5
MQYKLILNGKTLKGETTTEAVFAFTAEKVFKQYANDNGVDGFWTYDDYTKTFWVTE,5.951391,"D22F, A24F, E42F, A48Y, T53W",5
MQYKLILNGKTLKGEFTYEAVDYARAEKVFKQYANDNGVDGEWTYDDATKTYTVTE,-3.9812286,"T16F, T18Y, A23Y, T25R, F52Y",5
MKYKLILNGKTLKGETTTEAVIYATAEKVRKQYANDNGVDGEWTYDDATKTFWVTE,-4.202176,"Q2K, D22I, A23Y, F30R, T53W",5
MQYKIIANGVTLKGETTTEAVDAATAEKVFKQYANWNGVDGEWTYDDATKTFTVWE,1.1874303,"L5I, L7A, K10V, D36W, T55W",5
MQYKLILNGYTLKGETTYELVDAATFEKVFKQYANDNGVDGEWTYDDATKRFTVTE,-2.3144872,"K10Y, T18Y, A20L, A26F, T51R",5
MQYKLILNGKTLKGETTTWAVDAATAEKVFKQYAFDNWVDGEWTYDDRTKTFWVTE,-0.34677616,"E19W, N35F, G38W, A48R, T53W",5
MQYKLILNGKTLKGETTTEAWDAATAEWVFKQYWNDNFVDGEWWYDDATKTFTVTE,-4.233904,"V21W, K28W, A34W, G38F, T44W",5
MQYKLILNGKTLKGETTTEAVDAATAYKVFKQYANDNWVDGEWSYDRATKWFTVTE,-1.6960335,"E27Y, G38W, T44S, D47R, T51W",5
MQYKLILNGKTLMGETTTEAVAKATAEKVFRQYANDNGVDGEWTYDRATKTFTVTE,0.37335175,"K13M, D22A, A23K, K31R, D47R",5
MQYKLILNAKTLKGETTTEAVDAATARKVFKQYANDNWVDGEWTWDDAYKTFTVTE,-3.434469,"G9A, E27R, G38W, Y45W, T49Y",5
MQYQLILNGKTLKWETTTEAVDRATAEKVKKQYANDNGVDGEWTYDDAVKTFTVTE,-4.4736357,"K4Q, G14W, A23R, F30K, T49V",5
MQYKLILNGKTLKGETTTEAVDAATAWKVFKQYYNDNGVDGEWTYDRWTKTFTVIE,-4.729345,"E27W, A34Y, D47R, A48W, T55I",5
MQYKLILNGKWLKGEQTTEAVDAAIARKVFKQYANDNGVDGEWTYDDATKTFTVTR,-4.44418,"T11W, T16Q, T25I, E27R, E56R",5
MQFKLILNGKLLWGETTTEAVDAATAEKVLKQYANDNGVDGEWTYDDATKTFTVTW,1.4341697,"Y3F, T11L, K13W, F30L, E56W",5
MQYKLILNGKTLKGLTTTWAVDAATAEKVFKQYANGNWVDGEWTYDDATKTFGVTE,4.2183867,"E15L, E19W, D36G, G38W, T53G",5
MQYKLILNGKTLWAETTTEAVDAYTAEKVFKQYANDNGVWHEWTYDDATKTFTVTE,0.6593424,"K13W, G14A, A24Y, D40W, G41H",5
MKYKLILNGKTLKGETTTEAVDAATAEKVFKQYANDYGVYGIWTYDDATKRFTVTE,4.269212,"Q2K, N37Y, D40Y, E42I, T51R",5
MQWKLILNGKTLKGETTTEAVDAATAEKVFKWYAYDNGYDGEWTYDDATKTFYVTE,-3.9914277,"Y3W, Q32W, N35Y, V39Y, T53Y",5
MQYKLILNGKTLWGETTTEAVDAAEAEKVFKFLANSNGVDGEWTYDDATKTFTVTE,1.5615804,"K13W, T25E, Q32F, Y33L, D36S",5
MQYKLINNGKTLKGETTTEYVNAATAFKVFKQYANDNGVDYEWTYDDATKTFTVTE,-5.6142864,"L7N, A20Y, D22N, E27F, G41Y",5
MQYKLILNGKTLKGETTTEAYDAATAEKVFKQWANDNGVDGEWTYDDATYTFWVTY,1.5816473,"V21Y, Y33W, K50Y, T53W, E56Y",5
MQYKLILNGKTHKGETTTEAVYAWTAEKRFKQYANDNGVDGEWTYDDATKTFYVTE,4.5593476,"L12H, D22Y, A24W, V29R, T53Y",5
MQYKLILLGKTYKGETTTEAVDAWFAEKVFKQYANKNGVDGEWTYDDATKTFTVTE,4.393211,"N8L, L12Y, A24W, T25F, D36K",5
MQYKYILNGKTLKGETTTEAVDAATALKVVKQYLNDNGVDGEWTYDDAWKTFTVTE,-6.306339,"L5Y, E27L, F30V, A34L, T49W",5
MQYKLILNGKTLKGETTTELVDAATHEKVWKQYLNDNGVDGEWTYDDAWKTFTVTE,-5.55277,"A20L, A26H, F30W, A34L, T49W",5
MQYKLILNGKTLKGWTTYEAVDAATAEKVFKQYFNDNGVDGEVTYDDATKKFTVTE,-4.700715,"E15W, T18Y, A34F, W43V, T51K",5
MQYKLILDGKTLKGETTTEAVDLATAEKVFKQWAWDNGVDGEWTYDDATKTFTVTW,-4.0366707,"N8D, A23L, Y33W, N35W, E56W",5
MQYKLILNGRTLKGWTTTEAVDAATAEKVFKQYANDWGVDGEWTYDDATKIFTVME,2.4753175,"K10R, E15W, N37W, T51I, T55M",5
MQYKLILNGRTLKGKYTTEAVDAATAEKVFKQYANDNGVDGEWTYCDATKTLTVTE,1.2603399,"K10R, E15K, T16Y, D46C, F52L",5
MQYKLILNGKTLYGETTTEAVDAATAEKVRKQYANDNGVYGEWRYDDATKRFTVTE,-0.2703231,"K13Y, F30R, D40Y, T44R, T51R",5
MQYKVRLNGKTLKWETTTEAVDAATAEKVFKQYANDNYVDGWWTYDDATKTFTVTE,2.171242,"L5V, I6R, G14W, G38Y, E42W",5
MQYKLRLNGKTYKGETTTEAVDAATAEKVFKEYANDNGVYGEWTYDDAWKTFTVTE,0.61247766,"I6R, L12Y, Q32E, D40Y, T49W",5
MQYGLILNGHTLKGETTTEAVDAATAEKVFKQYARDNGVDGEWYYDDARKTFTVTE,-1.4587662,"K4G, K10H, N35R, T44Y, T49R",5
MQYKLILNGMTLKGETTTEAVDYARAEKVFKQYANRNGVDGYWTYDDATKTFTVTE,0.100158595,"K10M, A23Y, T25R, D36R, E42Y",5
MQYKLILNGKTLKGETTTEAVDAATAEKVFRQYANDRWVDQEWTYYDATKTFTVTE,-5.0948114,"K31R, N37R, G38W, G41Q, D46Y",5
MQYKLILNGKTYKGETTTEAVDAATAEKKFYQYANNNGVDGEWTYDDARKTFTVTE,-2.370449,"L12Y, V29K, K31Y, D36N, T49R",5
MQYKLILNGLTLKGETTTEAVDYATAEKVFKQYANDNGVDGEWTYYDALKTFTLTE,-2.3802164,"K10L, A23Y, D46Y, T49L, V54L",5
MQYKLILNGKWLKGETTTEAVYAATAEKVFKKYANDYGVDGEWTYDDATKTFYVTE,0.36572075,"T11W, D22Y, Q32K, N37Y, T53Y",5
MQYKLILNGKTLKRETTTEAVDAATAEKVFKQYANDFGWDGEWTYDDAMKTFTVTY,-3.989767,"G14R, N37F, V39W, T49M, E56Y",5
MQYKLILNGKTLKGYETTWAVDAATAEKVFWQYANDNGVDGEWTYDDATLTFTVTE,-2.0241358,"E15Y, T16E, E19W, K31W, K50L",5
MQYKLILNGKTLYGETTTEWVDAATAEKVRKQYANDNGVDGEWTYIDATKTFVVTE,-3.4638104,"K13Y, A20W, F30R, D46I, T53V",5
MQYKLILKGKTLKGYTTTEWVDAATAEKVFKQYANDNGVDGECTYDDATKTYTVTE,-4.081798,"N8K, E15Y, A20W, W43C, F52Y",5
MQYKLWYNGKTLKGETTTEAVQAPTAEKVFKQYANDNGVDGEWTYDDATKTFTVWE,3.100854,"I6W, L7Y, D22Q, A24P, T55W",5
MQYKFILLGKTLKGETTTEAVDAANAEKVFKQYANDYGVDGEWTYDDATKFFTVTE,0.70094717,"L5F, N8L, T25N, N37Y, T51F",5
MQYKLILNGKTLKGETTTFAVWAATAEKVFKQRAIWNGVDGEWTYDDATKTFTVTE,-0.64044917,"E19F, D22W, Y33R, N35I, D36W",5
MQYKWILNGKTWKGETTTEAVDAATAEKVFKQYANDMGVDGEWTWDDATKYFTVTE,-1.3052075,"L5W, L12W, N37M, Y45W, T51Y",5
MQYKLIWNGKTYKGETTTEAVDWATAEKVFKQYRNDNGVDGEWTYDYATKTFTVTE,-5.0118093,"L7W, L12Y, A23W, A34R, D47Y",5
MQYKLILNGKTLWGETTTSWVDAATGRKVFKQYANDNGVDGEWTYDDATKTFTVTE,-3.5004628,"K13W, E19S, A20W, A26G, E27R",5
MQYKLILWGKYLPGETTTNAVDAYTAEKVFKQYANDNGVDGEWTYDDATKTFTVTE,3.7845795,"N8W, T11Y, K13P, E19N, A24Y",5
MQYKLILNGKTYKGETRTEAVDAATAEKVRKQYAFDNGVDGEWTYDDRTKTFTVTE,-5.5900187,"L12Y, T17R, F30R, N35F, A48R",5
MQYKLILNGHTYKGETTTEWVDAATAEKVFKQYAWDNGVDGEWTYDDATKWFTVTE,-3.0996568,"K10H, L12Y, A20W, N35W, T51W",5
MQYKLILNGKWLKGWTTYWAYDAATAEKVFKQYANDNGVDGEWTYDDATKTFTVTE,3.521228,"T11W, E15W, T18Y, E19W, V21Y",5
MQYKLILNGKTLWGETTTEAVDAATAEKVFKQLINDNGVWGEWTYDDATKTFTRTE,-3.1821465,"K13W, Y33L, A34I, D40W, V54R",5
MQYKVILNGKTLKGETTTEAVDAAWAEWVFKQYANINGVDGEWTYDDATKTFTVYE,0.41672453,"L5V, T25W, K28W, D36I, T55Y",5
MQYKLILNGKFLWGETTTEAVDAATAWKVFKQYANDNGTDGELTYDDATKTFTVTE,-5.9537935,"T11F, K13W, E27W, V39T, W43L",5
MQYKLILNGKTLKGETTTEAVDAATAEKVFKQYANGNGVDGWWYYDDATKTWTVTY,-2.0188348,"D36G, E42W, T44Y, F52W, E56Y",5
MQYKKILNGKTLKGEMTTIAVDAATAEKVFWQYANDNGVDGEVTYDDATKTFTVTE,-5.93004,"L5K, T16M, E19I, K31W, W43V",5
MQYKLILNGKTLKRETTTEAVDYATAEKVFKKYANDNGVDIEWIYDDATKTFTVTE,-5.7377996,"G14R, A23Y, Q32K, G41I, T44I",5
MKYKLILNGKTLKGETTTEAVDAYTAEKVFKQRANDNYVDGEWTYDDATKTFTVTR,3.061202,"Q2K, A24Y, Y33R, G38Y, E56R",5
MQYKLILNGKTLKGETRTEAVDAATAEKVRKQYANDNGVWGEWTYQDATKTFFVTE,-0.55764747,"T17R, F30R, D40W, D46Q, T53F",5
MQYKLYLNGHTLKGETTTYAVDAATAEKVRKQYANDNGVDGEWTYDDATKTFYVTE,-1.4104974,"I6Y, K10H, E19Y, F30R, T53Y",5
MQYFLILNGKTLKGETTTEVVDAARAEKVKKWYANDNGVDGEWTYDDATKTFTVTE,-0.9794452,"K4F, A20V, T25R, F30K, Q32W",5
MQYKLILNGKWLKGETTTEAVDSATAEKVFKQYANDNGVFGEWKYDDARKTFTVTE,4.0044465,"T11W, A23S, D40F, T44K, T49R",5
MQYKLILTGKTLKGETTTEQVDAATAEKVFKQYANDNGVWGEWTYDDAKKTWTVTE,-0.37133276,"N8T, A20Q, D40W, T49K, F52W",5
MQYKLILNGFTLKGETTTEAYDYATAEKKFRQYANDNGVDGEWTYDDATKTFTVTE,-1.795004,"K10F, V21Y, A23Y, V29K, K31R",5
MQYKLILNGKTYKGETTTEAVDAATCEKVFLQYANDNGVDGEWTYDDATKTFYYTE,-5.3830285,"L12Y, A26C, K31L, T53Y, V54Y",5
MQHKLILNGKTLKGITTTEAVDAAWAEKVFKQYANDNGVDGEWTYDDAIKWFTVTE,5.2403636,"Y3H, E15I, T25W, T49I, T51W",5
MQYKYILNGKTYKGETTTEAVDAATMEKVFKQYANDNGYDVEWTYDDATKTFTVTE,-6.167207,"L5Y, L12Y, A26M, V39Y, G41V",5
MQYKLILNGKTLKGEYTTEAVEAATARKVFKQEANDNGVDGWWTYDDATKTFTVTE,-4.860941,"T16Y, D22E, E27R, Y33E, E42W",5
MQYKLIYNGKTLKGETTTEAVDAYTAEKVFKQYANDNMVDGEWTYNDATKWFTVTE,3.4602227,"L7Y, A24Y, G38M, D46N, T51W",5
MQYVLILNGKTLKGEYTTEAVDAATARKRFKQYANRNGVDGEWTYDDATKTFTVTE,-1.9214107,"K4V, T16Y, E27R, V29R, D36R",5
MQYKLIKNGKTLKGEVTTEAVDAATAWKVFKQYANDNGVDGEWQYNDATKTFTVTE,-3.1700718,"L7K, T16V, E27W, T44Q, D46N",5
MQYKLILNGKTLKAWTTTEAVDAATREKVFKQYANDFGVDGEWTYDDATKTLTVTE,-4.6076627,"G14A, E15W, A26R, N37F, F52L",5
MQSKLILNGKTLKGEWTIEAVDAATAEKVFKQYYNDNGVDGEWTYNDATKTFTVTE,-3.6552603,"Y3S, T16W, T18I, A34Y, D46N",5
MQYKLILNGKTLKGEPYTEAVDAATAEKVFKQYANDNGVDGIWTYADATRTFTVTE,3.615334,"T16P, T17Y, E42I, D46A, K50R",5
MQYKLILNGKTLKGEFRTEAVDAATAEKVKKYYANDNGVDGEWTYDDAVKTFTVTE,-2.4269845,"T16F, T17R, F30K, Q32Y, T49V",5
MQYKLILNGKTLWGETTTEAVDAITAEYVFKQYANDNGVDGLWTYNDATKTFTVTE,2.4185026,"K13W, A24I, K28Y, E42L, D46N",5
MQYKLILNGKTLKGEETTEAVDAWTREKVFKQYANDNGVDGEWWYDDATKTWTVTE,-4.7214327,"T16E, A24W, A26R, T44W, F52W",5
MQYKLILNGKTLYGETLTEAVDAATKEKVFKQYANDNHVDGEWTYDDATKRFTVTE,-2.8456678,"K13Y, T17L, A26K, G38H, T51R",5
MTYDLILNGKTLKGETTTEAVSAATAEKVFKAYANDNAVDGEWTYDDATKTFTVTE,2.7735667,"Q2T, K4D, D22S, Q32A, G38A",5
MQYKLILNGKTLKGELTTEAVKAATAERVFKQYANDNWVDGEWTYDDARKTFTVTE,1.4247731,"T16L, D22K, K28R, G38W, T49R",5
MQYKLILNGKTLKGETTREAVDAAIAEKWFKQYANDNGVDGEWTYDDATGYFTVTE,4.6496477,"T18R, T25I, V29W, K50G, T51Y",5
MQYKLILNGKTLKGETWTEAVVAATAEKVFKQYAWDNGVDGWWTYDDARKTFTVTE,1.4304776,"T17W, D22V, N35W, E42W, T49R",5
MQYKLILSGKTLKGETTTEAVDAATAYKVFAQYANWNGVDGEWTYDDAWKTFTVTE,-6.151378,"N8S, E27Y, K31A, D36W, T49W",5
MQYKLIRNGKTLKGETTTEAVDAFTAEKVFKEYANDNGVWGEWTYDDATKTFTVTW,0.67198414,"L7R, A24F, Q32E, D40W, E56W",5
MQYKLILNGKTLKGTYTTEAVDAATAEKVFKQYAWDNGVDGEWWYDDATMTFTVTE,-0.7380281,"E15T, T16Y, N35W, T44W, K50M",5
MQYKLILNGKWLKGETTDNAVDAATAEKVFKQYANDNGVDGEWTYDDATKRFWVTE,1.9740629,"T11W, T18D, E19N, T51R, T53W",5
MQYKLILNGKNLKGETTYEYSDAATAEKVFRQYANDNGVDGEWTYDDATKTFTVTE,-0.4711957,"T11N, T18Y, A20Y, V21S, K31R",5
MQYKLILNGKTLKGETCTEAVDAATAEKVFKQYYNDNGVDSEWGYDDYTKTFTVTE,-3.9846315,"T17C, A34Y, G41S, T44G, A48Y",5
MQYKLILNGKTLKGEYTTEAVDAATAERVFKQYANDNGVDGEWTYDDWTKMFTVTY,0.6693617,"T16Y, K28R, A48W, T51M, E56Y",5
MQYKLILNGKTLKGETITEAVDAATAEKVFKQYAQDNGVDWEWTYDDATTTWTVTE,-5.8649597,"T17I, N35Q, G41W, K50T, F52W",5
MQYKLILNGKTLKGETTTEPVDTATAIKVFKYYANDNGVDGEWTYDDAWKTFTVTE,-5.2056584,"A20P, A23T, E27I, Q32Y, T49W",5
MQYKLILSGKVLSGETTTEAVDAATAEKVFKQYANDNGVDGFWYYDDATKTFTVTE,3.1606207,"N8S, T11V, K13S, E42F, T44Y",5
MQYKIIWNGKTYKGETTTEAWDAATAEKRFKQYANDNGVDGEWTYDDATKTFTVTE,-0.8554142,"L5I, L7W, L12Y, V21W, V29R",5
MQYKLIKNGKTLKGETTTFAVDAATAEKVFKQYANDNGVWGEWTYDDALKYFTVTE,4.3609858,"L7K, E19F, D40W, T49L, T51Y",5
MQYKLILNGKTLKGEWTTEAVVAATAEKVWKQYANDNGVDGEWWYWDATKTFTVTE,1.3950801,"T16W, D22V, F30W, T44W, D46W",5
MQYKLIYNGKTLKGETMTEAVDAATAEKVFKQYANDNGVDGWWIYFDATKTFTVTE,1.4157296,"L7Y, T17M, E42W, T44I, D46F",5
MQYKLILNGKYLKGETFTEAVDAATAEKVFKQYANDNGVDGEWTYHDATKTFTKYE,-2.175441,"T11Y, T17F, D46H, V54K, T55Y",5
MQYKLILNGKTLKGETTTEYKDAAYAEKVFKQYAYDNGVDGEWTYDRATKTFTVTE,-0.57870597,"A20Y, V21K, T25Y, N35Y, D47R",5
MLLKLILNGKTWKKVTTTEAVDAATAEKVFKQYANDNGVDGEWTYDDATKTFTVTE,0.15797994,"Q2L, Y3L, L12W, G14K, E15V",5
MQYKLILNGKTYKGETTTEAVDAATAEKAFKWYANDNGVDGEWMYDDATKTFEVTE,0.58079,"L12Y, V29A, Q32W, T44M, T53E",5
MQYKLILNGKTLKGETTTEAVDAATAEKVFKRYANKNGWDGEWTYDDYTFTFTVTE,-0.27005365,"Q32R, D36K, V39W, A48Y, K50F",5
MWYKLILNGKTLKGETTTAAVDAATAEKVYKYYAYDNGVDGEWTYDDATKTFTVTE,-2.5793827,"Q2W, E19A, F30Y, Q32Y, N35Y",5
MQYKLILNGKTLKGETTTEAVDAATAEYVFKQYANDYGVDGEITYDRARKTFTVTE,-4.713332,"K28Y, N37Y, W43I, D47R, T49R",5
MQYKLIRNGKTLKFETTTEAVDAAWAEKVFKQYFNDNGVDGEWTYDDATKTITVTE,-5.56342,"L7R, G14F, T25W, A34F, F52I",5
MQYNLLLNGKTLKGETTTEAWDAATAEKVFKQYANDNGVDGEWTYYDATKWFTVTE,4.0824237,"K4N, I6L, V21W, D46Y, T51W",5
MQYKLILNFKTLKGETTTEAVDAATAEKVFYQYANDLGVDGEWTYSDAWKTFTVTE,-3.698272,"G9F, K31Y, N37L, D46S, T49W",5
MQYKLILNGKTLKYETTTEAVDAATAEKVFKQYANDNGVDGEWTYLDARKQFWVTE,2.5194597,"G14Y, D46L, T49R, T51Q, T53W",5
MQYKLIWNGKTLKGETTTEAVDAATYEKVFKQYKNDLGVDGEWTYDDATKLFTVTE,-4.9567904,"L7W, A26Y, A34K, N37L, T51L",5
MQYKLILNDKTLKGETTTEAVRAATAEKVFKQYAYDNGVDGWWTYDDATKTFYVTE,-2.4912384,"G9D, D22R, N35Y, E42W, T53Y",5
MQYKLILNGKTLKGWTTTEAVDWFTAEKVFKQYANDNGVDGEWTYDDWTATFTVTE,0.57538253,"E15W, A23W, A24F, A48W, K50A",5
MQYRLILNGKTIKGETTTEAVDAATAEKVFWQYARDNGVDGEWTYDDAWKTFTVTE,-5.8673277,"K4R, L12I, K31W, N35R, T49W",5
MYYKLILNGKTLKGELTTEAVDAAFARKYFKQYANDNGVDGEWTYDDATKTFTVTE,-2.0916207,"Q2Y, T16L, T25F, E27R, V29Y",5
MQYKLILNYKSLKGETTTEAVDAYTAEKVFKQYANDNYVDYEWTYDDATKTFTVTE,-0.48194253,"G9Y, T11S, A24Y, G38Y, G41Y",5
MQYKLIRNGKTLVGETTTEYVDAATAEKVFKQYAWDNGVDYEWTYDDATKTFTVTE,-5.791198,"L7R, K13V, A20Y, N35W, G41Y",5
MQYKLWLNGKTLKGETTTEAVDAATAEYVYKQYANDMGVDGEWTYRDATKTFTVTE,-2.3961048,"I6W, K28Y, F30Y, N37M, D46R",5
MQYKLILNGKTYKGETTTLAVDAATAEKVFKQYANDNGWDGEWTYRDATKTFTVLE,-2.87753,"L12Y, E19L, V39W, D46R, T55L",5
MQYKLILNGKTLKGWTTTEAVDAATAWKRFKQYANFWGVDGEWTYDDATKTFTVTE,-2.6309865,"E15W, E27W, V29R, D36F, N37W",5
MQYKLILNGKTLKGETTTEAVDAARAEKVFKQYANYHGWDGEWTYDDATKTFTVTK,-1.965133,"T25R, D36Y, N37H, V39W, E56K",5
MQYKLILSGKTLKFETTTEAVDAATAEKVFKQYANDNGFDGEWTYDDETSTFTVTE,0.54683906,"N8S, G14F, V39F, A48E, K50S",5
MQYKLILNGKTLKGETTTEAWDAATARKVFKQYANDNGVDLEWTYDKATKTWTVTE,-6.088795,"V21W, E27R, G41L, D47K, F52W",5
MQYKLILNGKTLKGETTTEAVDAATAEKVRKQYALDNGVDGWWTYDDAKKTFTVTY,-5.1948028,"F30R, N35L, E42W, T49K, E56Y",5
MQYKLKLNGKTYKGETTTEAVDMATAEKVFKQYANDNGWDGEWTYDDWTKTFTVTE,-4.492677,"I6K, L12Y, A23M, V39W, A48W",5
MQYKLILNGKTLWGETTTEAVDAATAEKVFKQYANMNGVDGEWTYFDATKTMTVTW,1.1911794,"K13W, D36M, D46F, F52M, E56W",5
MQYKLILNGKTLKGETTTEAVDAATAEIVFKQYARDYWVDGEWTYDDARKTFTVTE,-4.6698246,"K28I, N35R, N37Y, G38W, T49R",5
MQYKWILNGKTLKGETWTEAVDAATAEKVWKQYANDNIVDGEWTYDDARKTFTVTE,-1.8680795,"L5W, T17W, F30W, G38I, T49R",5
MQYYLWLNGKTLKGETTTEAVDAATAEYVFKQYANWNGVDGEWTYDDAKKTFTVTE,0.2178222,"K4Y, I6W, K28Y, D36W, T49K",5
MQYKLILNGKLLGGETTTEAVDAARAEKVFKQYAYDNGWDGEWTYDDATKTFTVTE,-4.608904,"T11L, K13G, T25R, N35Y, V39W",5
MQYKLILNGKTLKGETTTEAVDAATTEKRFKQYANDNGVYGEWTYDDAYKTFTPTE,-0.3018278,"A26T, V29R, D40Y, T49Y, V54P",5
MQYYLILNGKYLKGETWTEAVDAATAEKVFKQYANDNGVWGWWTYDDATKTFTVTE,5.0229077,"K4Y, T11Y, T17W, D40W, E42W",5
MQYKLILNGKTLKGETTTEAVDAARAEKVFKQYENDNGVDGEWYYDDATKTFTRTY,-5.391596,"T25R, A34E, T44Y, V54R, E56Y",5
MQYKFILNGKTLKGETTTEAVLRATAEKVFKQYANDNGVWGEWTYDDALKTFTVTE,1.8919702,"L5F, D22L, A23R, D40W, T49L",5
MQYKLILNGKTLKGWTTTEAVDAATREKVFKRYARYNGVDGEWTYDDATKTFTVTE,-4.4746614,"E15W, A26R, Q32R, N35R, D36Y",5
MYYKLIFNGKTLKGSTTWEAVDAATAEKVFKQYANDNGVDGLWTYDDATKTFTVTE,3.9520023,"Q2Y, L7F, E15S, T18W, E42L",5
MQFKLILNGKTLKIETTTEAVDAATAEKVFKQYANYNGVDGEWTYFDATKLFTVTE,2.7220747,"Y3F, G14I, D36Y, D46F, T51L",5
MQYKLILNGKTLIGETTTFYVDAATAEKRFKQYANDNGVDGEWTYDLATKTFTVTE,4.14766,"K13I, E19F, A20Y, V29R, D47L",5
MQYKLILNGKTLKYETTTRAVDAATAEKVFKQYANDNGVDGELTYDDARKTATVTE,-5.400648,"G14Y, E19R, W43L, T49R, F52A",5
MIYKLLLNGITLKGETLTEAVDAATAEKVFKQYANDNGVDGEWTYDDATKTFTVTY,2.4360013,"Q2I, I6L, K10I, T17L, E56Y",5
MQYRLILNGKTLKGERTTEAVDAATAEKVFKWYANDNGVWGEWTYDDATKTFTVTF,2.249878,"K4R, T16R, Q32W, D40W, E56F",5
MQYKLILNGKTLKGETYTEAVDAATAELWFKQYANDNGVYGEWTYDDATKTFTVWE,2.8815365,"T17Y, K28L, V29W, D40Y, T55W",5
MQYKLILNGKTLKGETTTEAVDAATAEKVFKQYANWNGDDPMWWYDDATKTFTVTE,-5.380302,"D36W, V39D, G41P, E42M, T44W",5
MQYKLILNGKTLKGETTTEAVWRATAEFVFKQYANDNGVDGEWTYDDATTEFTVTE,-1.0425236,"D22W, A23R, K28F, K50T, T51E",5
MQYSLILNGKTLLRETTTEAVDAATAYKVFKQYANDNGVDGEWTYDDATKTFTVWE,-5.085878,"K4S, K13L, G14R, E27Y, T55W",5
MQYKLILNGKQIKGETTYEAVRAATAEKVFKQYANDNGVDGEWTYDDATNTFTVTE,1.7128776,"T11Q, L12I, T18Y, D22R, K50N",5
MQYKLILNGWTLKGETTTEAVDAAYKEKVFKQYANDHGVDGEWTYDDQTKTFTVTE,-2.5018456,"K10W, T25Y, A26K, N37H, A48Q",5
MQYKLILNGKTLKGETTTEAWDAATAEKYFKQYANDNKVWGEWTYDDATKTFTVYE,4.2846327,"V21W, V29Y, G38K, D40W, T55Y",5
MQYKLYLNGKTLKGETRMEAVDAATAEKVRKQYANDNGVDGEWYYDDATKTFTVTE,-2.3648243,"I6Y, T17R, T18M, F30R, T44Y",5
MQYKLILNGKTLKGVTTTEAVDAATAEKKFKQYANDNLWDGEWTYDDATKTFTVTY,-1.1851624,"E15V, V29K, G38L, V39W, E56Y",5
MQYKLILNGKTLRGETTTERVDAATAEKVFWQYANDNRVDGEWTYDDATKTPTVTE,-5.8746395,"K13R, A20R, K31W, G38R, F52P",5
MQYKLILNGKTLKGEWTTEAVDAATAEKRLKQYANDYGVDGEWWYDDATKTFTVTE,1.189072,"T16W, V29R, F30L, N37Y, T44W",5
MQYKLILNGKNLKGETTTEAVDAATAEKVFKWYANDNGVDGWWTYSDAYKTFTVTE,2.309032,"T11N, Q32W, E42W, D46S, T49Y",5
MQYKLILNGKTLKWETTTEAVDYAWAEKVFKQYVNDNGVDGEWTYDRATKTFTVTE,-2.7034564,"G14W, A23Y, T25W, A34V, D47R",5
MQYKLILNGKTQKGETTTEAVDAATARKFFKQLANDNGVDGEWTYDDATKTFKVTE,-4.535858,"L12Q, E27R, V29F, Y33L, T53K",5
MQYKLILNGYTLKKERTTNAVDAATAEKVFKFYANDNGVDGEWTYDDATKTFTVTE,0.5888353,"K10Y, G14K, T16R, E19N, Q32F",5
MQYKLILNGKTLKGFTTTEAVDRATKEKVFKVYANDNGVDGEWTYDDATKTFTITE,-4.030618,"E15F, A23R, A26K, Q32V, V54I",5
MQYKKILNGKTLKGETTTEAVDYATAEKVFKQYRNDNGVDGEWTYDDRLKTFTVTE,-5.4642973,"L5K, A23Y, A34R, A48R, T49L",5
MQYKLILNGKTLKGEYTTEAVDAATAEKVFKQYANRNGVGGEWFYDDATKFFTVTE,3.2053037,"T16Y, D36R, D40G, T44F, T51F",5
MQYKLIRNGFTLFGETTTEAVDAATAEKVFKQRANDNGVDGEWTYDDATKTFWVTE,-0.01484859,"L7R, K10F, K13F, Y33R, T53W",5
MQYRLILNGKTYFGETTTEAVDAATFEKVFKQYANDNGVDGEFTYDDATKTFTVTE,-5.8870206,"K4R, L12Y, K13F, A26F, W43F",5
MYYKLYLNGKTLKGETGTEAVDAATAEKVFKKYANDNGVDYEWTYDDATKTFTVTE,0.48629582,"Q2Y, I6Y, T17G, Q32K, G41Y",5
MQKKLILNGKTLKGETTTEAWDAATAEKVKKQYANDNGVDIEWYYDDATKTFTVTE,-5.371826,"Y3K, V21W, F30K, G41I, T44Y",5
MQYKLIWNGKTIKGETCTEAVHAATAEKVFKQYANDNGVDGEWTYDDAMKTFTVTE,0.81211704,"L7W, L12I, T17C, D22H, T49M",5
MQYKLILNGKTVKGETTTEAVDAATAEKWFKQYANDNGVDGEFTYDDAQKTFTVTY,-3.2257993,"L12V, V29W, W43F, T49Q, E56Y",5
MQYKLILNGWTLKGETCTEARDAATAEKVFKQYANDNWVDGEWTYDDATKTFTRTE,-1.5024271,"K10W, T17C, V21R, G38W, V54R",5
MQYKLLLNGATLKTETTTEAVDAATAEKVFKQYANDNGVDGEWTYDDATKTFLVQE,1.3188958,"I6L, K10A, G14T, T53L, T55Q",5
MQYKLILNGKTLKGETTTIAVDAATAEKVYKQYARDNGVDGEWTYDDKTKWFTVTE,-0.9483361,"E19I, F30Y, N35R, A48K, T51W",5
MQYKLFLNGKTLKVETKTEAVDAATAEEVFKQYAYDNGVDGEWTYDDATKTFTVTE,-4.976809,"I6F, G14V, T17K, K28E, N35Y",5
MQYALILNGKTLKGETTTEAVDAATAEKVFKQGYNDNGVWGEWTYDDATKTFWVTE,-0.99034727,"K4A, Y33G, A34Y, D40W, T53W",5
MQYTYILNGKTLKGETTTEAVDARTAEKVFKQYANDNGVDWEWTYDDATKTFTVTW,-4.9568996,"K4T, L5Y, A24R, G41W, E56W",5
MQYKLILNGKTLKGEYTYEAFDAATAEYVFKQYANDNLVDGEWTYDDATKTFTVTE,-0.9976745,"T16Y, T18Y, V21F, K28Y, G38L",5
MQYKLISNGKTLKGETWTEAVDAYTAEKVFKWYANDNGVWGEWTYDDATKTFTVTE,5.3100224,"L7S, T17W, A24Y, Q32W, D40W",5
MQYKLILNGKTLKGETYTEAVKAATAEKVFKQYRNDNGVDGEWTYDDATYRFTVTE,-0.902745,"T17Y, D22K, A34R, K50Y, T51R",5
MQYKLILNGKTLKGEFTTEAVDAYKAEKVFKQWAMDNGVDGEWTYDDATKTFTVTE,0.024667516,"T16F, A24Y, T25K, Y33W, N35M",5
MQYKLIYNGKTLKGETTTEAVDAATAEKVKKQYWNDNGVWGEWTYDDATKTFTVIE,-4.318697,"L7Y, F30K, A34W, D40W, T55I",5
MQYKLILNGKTLKLEDTTEAVDAFTAEKVFKQYANFNGVDGEWTYDDATKTFTVSE,1.560078,"G14L, T16D, A24F, D36F, T55S",5
MDYKLILNGKKLKNETTTEAVDKATAIKVFKQYANDNGVDGEWTYDDATKTFTVTE,-5.13778,"Q2D, T11K, G14N, A23K, E27I",5
MQYKLILNGKTLKGETTTEAVDAATAEKVFKQYAWDNGWDGEWRYDDATKWFTRTE,-5.3003774,"N35W, V39W, T44R, T51W, V54R",5
MQYKLILNGKTYKHETKKEAVDAATAEKVFKFYANDNGVDGEWTYDDATKTFTVTE,-0.96325046,"L12Y, G14H, T17K, T18K, Q32F",5
MQYKMILNGKTLKGELTTWAVNAATAEKVFKQYANDNGVDGEWTYDDARKTFTVTE,3.0481465,"L5M, T16L, E19W, D22N, T49R",5
MQYKLFWNGKTLKGETTTWAVDAATAEKVFWQYANDNGVDGEWTYDDATKKFTVTE,-2.9201922,"I6F, L7W, E19W, K31W, T51K",5
MQYKLILNRKTLKGETTTEAVDAWTAEKVFNQYAVDNGVDGEWTYDDATKTFTVWE,-5.2735443,"G9R, A24W, K31N, N35V, T55W",5
MQYKLILNGKTLKGLTTGEAVDAATAEKVFKQWANDNGVDWEWTYCDATKTFTVTE,-2.1912146,"E15L, T18G, Y33W, G41W, D46C",5
MQYKLILNGKTLKGETFTEAVDAATAERVFKQYANDNGVDGEWTYDFATGTFTVTA,2.5283341,"T17F, K28R, D47F, K50G, E56A",5
MQYKLILNGKYLLGATTTEAVDAATARKVFKQYANDYGVDGEWTYDDATKTFTVTE,-5.1436825,"T11Y, K13L, E15A, E27R, N37Y",5
MQYKLIRLGKTYKGETTTEAVDAATAEKVFKQYANDNGWDGEWWYDDATKTFTVTE,-3.9077055,"L7R, N8L, L12Y, V39W, T44W",5
MQYKLILNGKTLKGETTTYAVDAARAEKVFKQYVNDNGVDGEWTYDRATKTFTSTE,3.0972846,"E19Y, T25R, A34V, D47R, V54S",5
MQYKIIRNGKTLWGETTTEAVDAATAYKVFKQYANDNGVDGEWTYDRATKTFTVTE,-4.564507,"L5I, L7R, K13W, E27Y, D47R",5
MYYKLILNGKTLYGETTTEFVDAATAEKVFKQYANDNGVDGEWFYDDATKTFYVTE,1.5442805,"Q2Y, K13Y, A20F, T44F, T53Y",5
MQYKLILNGKTFWGETRTEAVDAATAEKVFKQYANDNGVDGEWTYDDATWTFTVTG,1.8720692,"L12F, K13W, T17R, K50W, E56G",5
MQYKLILNGKTLKGEYTTDAWDAATAEKRFKQYANDNGVDGEWTYDDATKTFTVTY,2.8781943,"T16Y, E19D, V21W, V29R, E56Y",5
MQYKLILNGKTLKGETTTEAVWAATAEKVFKQYANDNGYWGFWTYDAATKTFTVTE,3.7598832,"D22W, V39Y, D40W, E42F, D47A",5
MQYKLILNGKTLKGETTYEAVDAAAYEKVFKQYANVNGVDGEWTYDDATKTFTVTW,-1.9342304,"T18Y, T25A, A26Y, D36V, E56W",5
MRYKLILNGKTLKGETTWEAVLAATAEKVFKWYENDNGVDGEWTYDDATKTFTVTE,-2.7934964,"Q2R, T18W, D22L, Q32W, A34E",5
MQYKLILNGKTLKGETTSEWVDAATAEKRFKQYANDNGWDGEWTYDDATKTFTVTW,-2.209818,"T18S, A20W, V29R, V39W, E56W",5
MQYKLILYGWTLKGETTTRAVDAATAEWVFKQYANDNGVDGEWTYFDATKTFTVTE,1.0205706,"N8Y, K10W, E19R, K28W, D46F",5
MRYKLILYGKTLKGETTTEAVDAARAEKVFKQYANDNGVWGEWTYDRATKTFTVTE,8.062699,"Q2R, N8Y, T25R, D40W, D47R",5
MQYDLILNGKTLKGETTTEAVDAATAEKVFKQYALDNGYDGEWTYDDATKWFTVYE,-4.8838415,"K4D, N35L, V39Y, T51W, T55Y",5
MQYKLILNGKTLKGETTTEYVDAATAEKVFKQYANDWWVDGWWTYDDFTKTFTVTE,0.8720065,"A20Y, N37W, G38W, E42W, A48F",5
MQYKLILNGKTLKGETTTEAVDAATNESVFKQCANDNGWDGEWTYDDATKTFTVTY,-5.5737944,"A26N, K28S, Y33C, V39W, E56Y",5
MQYKLHLNGKTLKGETTTEAVIAATAEKVFKQYANLNGVYGLWTYDDATKTFTVTE,6.4554563,"I6H, D22I, D36L, D40Y, E42L",5
