Sequence,Score,Mutations,Number of Mutations
NDKFKLLAEKVEEIVAKNARAEIDYSYVPDEFIDPLMRTLMTDPLRLPSGTVMDRDIILRHLLNSPTDPFNRQPLTESMLEPVPELKAQIQAWMREKQSSDH,-2.1661947,"I1N, E2D, D27Y, A28V, R33I, D38R, V45L, S56D, M74P, E88A",10
MENFKLLAEKFEEIVAKNAQAEIDYSDAPDEFRDPLMFTIMTDPVILPSGHVMDRSIILRHLLNSPTDPFNRQMLTEEMLEPVPELKEQIQAYMREKQSSDH,-0.1030073,"I1M, K3N, V11F, R20Q, D38F, L40I, R46I, T51H, S78E, W93Y",10
FEKFKLLAEKVEEIVAKNVRAEADYSDAPEEFRDPLMDELMTDPVRLPNGTVMDRSIILRHLLNSPTDPFNRQMLTESDLEPVPELKEKIQAWMRESRSSDH,-0.88120866,"I1F, A19V, I23A, D30E, T39E, S49N, M79D, Q89K, K97S, Q98R",10
IEKFKLRAEKLEEIVAKNARMECDYSDAPDEFRDPLMDTLMTDPVKLPSGTVMDRSIITRHLLNDPTDPFNRQILTESMLEPVPELKEQIQAWMEEKKSSDH,-0.033017434,"L7R, V11L, A21M, I23C, R46K, L59T, S65D, M74I, R95E, Q98K",10
EEKFKLAAEKVEEIVAKNAAAEIDYSDAPDEFRDPLMDTLMTDPVRLPSGTVMDRSIILRHLLASPTDPFNRTPLTYSQLEPVPELKEQIQTWMAEKQSSDH,-0.44525725,"I1E, L7A, R20A, N64A, Q73T, M74P, E77Y, M79Q, A92T, R95A",10
IEKFKLLAEKVEEAVAKNARAEDDYDDAPDEFRDPLMDTLMTDPVRLPSGTVVDRSIILRHLLNSPTDPFNRQMLTEDMIEPVPELREKIQAWMREKQAEDH,4.813285,"I14A, I23D, S26D, M53V, S78D, L80I, K87R, Q89K, S99A, S100E",10
IEKFKLGAEKVEESRAENARAEIDYSDAPDEFRDPLMDTLMTDPVRLPSGTVMDRSIILRHLLNDPTDPFNRQMLDESMLEPVPGLKEQIMAWMREKQSGSH,0.46193224,"L7G, I14S, V15R, K17E, S65D, T76D, E85G, Q91M, S100G, D101S",10
IEKFKLLREKEEEISAKNARAEIDYSDIPDEFRDPLMDTLMTDPVRLPSGTVMDRSIILRHLLNSSTDPFNRQPLTESMLEPVPELKEKIQAWMRSKQSSRI,0.9952017,"A8R, V11E, V15S, A28I, P66S, M74P, Q89K, E96S, D101R, H102I",10
MEKFKLLAEKIKEIVEKNANAELDYSDAPDEFRDPLMDTLMTDPVRLPSGTVMDRSTILRHLLNSPTDPFNRQMLTEKMLEPVPALKEQIQAWKREKQSSDH,2.7122977,"I1M, V11I, E12K, A16E, R20N, I23L, I57T, S78K, E85A, M94K",10
IEKAKLLFEKVEEIVAERARAEIDYSDAPDEFRDPLMDILMTDPVRLPSGTVMDRSIILRHLKNSETDPFNRQMLTESMLEPVPELKFQIQAWRREKQSSDA,0.4297116,"F4A, A8F, K17E, N18R, T39I, L63K, P66E, E88F, M94R, H102A",10
IEKFKLTAEKVEEIVDKNARFEIDYSDAPDEFRDPLMDTLMLDPVTLPSGTSMDRSIILRHLLNSPTDPFNRKMLTESMLEPVPELKEQIQHWMRENQSSDE,-0.5701015,"L7T, A16D, A21F, T42L, R46T, V52S, Q73K, A92H, K97N, H102E",10
IEKFKLLAEKNEEIVAKNERDEIDYSDAPDEFRDPLMDTLMTDPVQLPDGTVMDRSTILRHLLNSPTDPFNRQPLTPSMLEPVPELKEQIQAWMREKQGNDH,2.970315,"V11N, A19E, A21D, R46Q, S49D, I57T, M74P, E77P, S99G, S100N",10
IEKFRALAEKVEEIVAKAARVEIDYRDAPDEFRDPLMDTLMTDPVRLPDGTVLDRSIIIRHLLNSPTDPFNRQMLTESMLEPVPELKEQIQAWMTEKPSSDH,3.5462108,"K5R, L6A, N18A, A21V, S26R, S49D, M53L, L59I, R95T, Q98P",10
IPKFKLLAKKVEEIVATNERAEIIYSDAPDEFRDPLVDTLMTDPVRLPDGTVMDRSIILRHLLNSQTDPFNRQMLTESMIEKVPELKEQIQAWMREKQSSDH,-2.3813934,"E2P, E9K, K17T, A19E, D24I, M37V, S49D, P66Q, L80I, P82K",10
INKFKLLAEKVEELDAKNARAEIDYSDAPDEFRDPLMDTLMTDPVRLPSGTTMDRSIIYRVLLNSPTDPFNRQMLHESMLEPVPELKEQIQCWMREKASSAH,-0.7807429,"E2N, I14L, V15D, V52T, L59Y, H61V, T76H, A92C, Q98A, D101A",10
IEKFKLLQEKVEEIVAKHDRAEVDLADAPDEFRCPLMDTLMTDPVQLPSGTVMDRSIILRHLLNSPTDPFNRQMLTEAMLEGVPELKEQIQAWMREKQSSDH,-0.1701239,"A8Q, N18H, A19D, I23V, Y25L, S26A, D34C, R46Q, S78A, P82G",10
MEKFKLLAEKVEEIVEQNARAEIDYSDAPDEFRDPLMDTLMTDPVRLPSGTVMDREIISRHLLSSGTDPFNRQMLTESMLEPVPELKSKIQAWMAEKQSSDH,-0.038337104,"I1M, A16E, K17Q, S56E, L59S, N64S, P66G, E88S, Q89K, R95A",10
INKQKLLAEKVEEIVAKNAEAEIDYSDAPPEFRDPLMFTLMTDPVRLPSGYSMDRSIILRHLLNSPTDPFNRQPLTESMLEPVPELRTQIQAWMREKQSSDH,1.2810137,"E2N, F4Q, R20E, D30P, D38F, T51Y, V52S, M74P, K87R, E88T",10
IEKFKLLAERVEEIVAKRARFEIDYSDAPDEFRDPIMDTLMTDPVRLPSGTVMDREIILRHLLNSHTDPFTRQMLTEKMLEPVPELKEQIQAYLREKQSSDH,5.7805877,"K10R, N18R, A21F, L36I, S56E, P66H, N71T, S78K, W93Y, M94L",10
IEKFKLLVKKVEEISAKNARAEIDYSDAPDEFRDPLMDTLMTDPVRLPSGTVMDRSIILRHLLNSPTDPFNRQPLNESMLEPVPELKEQIRAWINEKRSEDH,-0.17809534,"A8V, E9K, V15S, M74P, T76N, Q91R, M94I, R95N, Q98R, S100E",10
IEKFKILAPKVEEIVATNGRAEYDMSDAPLEFRDPLMDTLMTDPVRLPSGTVMDRAIILRHLLNSPTDPFNRQMLTESMLEPVPELKEQLQAWMREKKSSDH,-0.15713304,"L6I, E9P, K17T, A19G, I23Y, Y25M, D30L, S56A, I90L, Q98K",10
IEKFKKLAEKVEEIVAKNARAELDYGAAPDEFRCPLMDQLMTDPVRLPKGTVMDRSIILRHLLNSPTDPFNRQMLTESMLLPVPELKEQIQKWMREKLSSDH,-0.43354666,"L6K, I23L, S26G, D27A, D34C, T39Q, S49K, E81L, A92K, Q98L",10
IEKRKLDAESVEEEVAKNQRNEIDYSDAPDEFRDELSDTLMTDPVRLPSGTVMDRSIILRHLLNSPTDPFNRKMLTETMLEPVPELKEQIQAWMREKQSSDH,-1.2012396,"F4R, L7D, K10S, I14E, A19Q, A21N, P35E, M37S, Q73K, S78T",10
IDAFKLLAEKVEEKVAKNARAEIDYSDAPDEFRDPVMDTLMTDPVRLPSGTVMDRSSILRHLLNDPTDPFNRQMLTPSMLEPVPELKEQIQQFMREKQSKDH,0.46130273,"E2D, K3A, I14K, L36V, I57S, S65D, E77P, A92Q, W93F, S100K",10
IEKFKLLAEKVEEIVAKNNRAEIKYSDAPDEFRDPLMFTLMTDPVLLPSGTSVDRSIILRHLLNSPCDPFNRQMLTESMLEPVPELKERIKKWMREKQSSDH,0.8200914,"A19N, D24K, D38F, R46L, V52S, M53V, T67C, Q89R, Q91K, A92K",10
IAAFKLLAEKVEEIVAKNEKAEIDYSDAPDEFRDPLMDTLMTDPVRLPSGIIMDRSIIVRHLLNDPTDPFNRQMLTESMLEPVPELKEKIQAWMAEKQSSDH,1.2882555,"E2A, K3A, A19E, R20K, T51I, V52I, L59V, S65D, Q89K, R95A",10
IEKFKLLAEKVEEIVAENDRDEIDYSRAPDEFRDPLMDTLMTDPVRLPSGTVMDRQIILRHLVNSPTDPFNRQMLTEEMLEPVPELKEQIEAWRREKTSSDH,2.045878,"K17E, A19D, A21D, D27R, S56Q, L63V, S78E, Q91E, M94R, Q98T",10
IEKFAAIAEKVEEIVAKNARAEDDYSDAPDEFRDPLMDTLMTDPVRLPSGTVMDRSSILRHLLNSPTDPFNRQMLTESMLEPVPELKFKIQEWMQERQSSDH,0.91845965,"K5A, L6A, L7I, I23D, I57S, E88F, Q89K, A92E, R95Q, K97R",10
IEKFKWLAEKVEEIVAKNARNEIDYSDAPDEFLDPLMDTLMTDPVLLPSGTVMERSIIQRHLLSSPTDPFNRQMLTEIMLEPVPELKIQIQAWMEEKQSSDH,-1.6774709,"L6W, A21N, R33L, R46L, D54E, L59Q, N64S, S78I, E88I, R95E",10
IEKFKLYAEKVEEIVAKNARAEIEYSDAPDEFRDPLMDTLMEDPVRLPDGTVQDRSIILRHLLNSPTDPFTRKMLTESMLEPVPELKEQIQAWFSSKQSSDH,5.601675,"L7Y, D24E, T42E, S49D, M53Q, N71T, Q73K, M94F, R95S, E96S",10
MEKFKLLAHKVEEFVAKNARAEIFYSDAPDEFRDPLMNELMTEPVRLPSGKVMDRSIILRHLLNSPTDPFNRQMLTESMLEPRPELKEQIQAWMREKQSADH,-1.9289427,"I1M, E9H, I14F, D24F, D38N, T39E, D43E, T51K, V83R, S100A",10
IAKFKLLAEKVEEIVKKNARAEIDVSDAPDEFRDPLMDTLMTDPVRLPDGTVMDRSIIERHLLNSNTDPFNRQMLTESMLEPKPELKEQIQAWMKEKQSSCN,-2.5344315,"E2A, A16K, Y25V, S49D, L59E, P66N, V83K, R95K, D101C, H102N",10
MEKMKDLAEQVEEIKAKNARDEIDYSDAPDEFRDPLMDTLMTDPVRLPDGTVMDRSIIARHLLNSPTDPFNRQMLTESMLRPDPELKEQIQAWMREKQSSDH,0.34041286,"I1M, F4M, L6D, K10Q, V15K, A21D, S49D, L59A, E81R, V83D",10
IEKSKLLAEKVEEIHAKNARADIDYSDAPDEFRDPLAVTLMTDPVRLPSGTVMDRSIIRRHLLNSPTDPFNRQMLGESMLEPEPEVKEQIDAWMREKQSSDH,-0.8608451,"F4S, V15H, E22D, M37A, D38V, L59R, T76G, V83E, L86V, Q91D",10
IEKFKLLAEKVEEIVKKNARAEIDYSDVPDEFRDPLMDTLMTEPVRLPSGTVMDRSIIKRHLMNSPTDPFNRQMLDESTLEPVPELKEQIQAWMRRKTSSDE,-2.1034617,"A16K, A28V, D43E, L59K, L63M, T76D, M79T, E96R, Q98T, H102E",10
IKKFKLSAERVEEIVAKNARADIDYSDAPEEFRDPLMFELMTDPVRLPSGHVMDRSIILQHLLNSPTDPFNRQMLTESMLEPVPELKERIQAWMREKQSSDH,-0.17411155,"E2K, L7S, K10R, E22D, D30E, D38F, T39E, T51H, R60Q, Q89R",10
QEKFQLLAEKVEKIVAKNARAEIDYSDIPDEFRDPLMNTLMTEPVRLPSGTVMERSIIERHLLNQPTDPFNRQMLTESMLEPVPELKEQIQAWMREKQSQDH,-2.0636826,"I1Q, K5Q, E13K, A28I, D38N, D43E, D54E, L59E, S65Q, S100Q",10
IEKFKHLATKVENLVAKIARAEIDYSDIPDEFRDPLMGTLMTDPVRLPSGTVMDRSIILRHLLNSPTDPFTRQMLTESMLEPVPELKEQIQAWMLEKQSTDH,-0.28574222,"L6H, E9T, E13N, I14L, N18I, A28I, D38G, N71T, R95L, S100T",10
IEKQDLRKEPVEEIVAANARADIDYSDAPDEFRDPLMDTLMTDPVRLPSGTVMDRPIILRHLLNSNTDPFNRQMLTESMLEPVPELKEQIQQWMREKQSSDH,1.2439692,"F4Q, K5D, L7R, A8K, K10P, K17A, E22D, S56P, P66N, A92Q",10
IEKFKLLAGKVEEVQAKNARAEIDYSDAPDEFRCPLTDTLMTDPVRTPSGTVMDRSVILRHLLNSPTDPLNRQMLTESMLEPVPELKEQIQAWMRENQSSSH,-2.5012658,"E9G, I14V, V15Q, D34C, M37T, L47T, I57V, F70L, K97N, D101S",10
IDKFSLLAEKVREIVAKNAAAEIDYSDAPDEFRDPLMDTLMTDPVRLPSGEMMDRSIILRHLLNSPTDPFNRQMLTESMLEPVPELKERIYAWMEEVQSSDH,0.21634269,"E2D, K5S, E12R, R20A, T51E, V52M, Q89R, Q91Y, R95E, K97V",10
IEKFKLLAEKVDEIVAKNKQAEIDYNDAPDEFRDPLMDELMTDPVRLPSGTVVDRSIILRHLVNEGTDPFNRQMLTESMLEPVPELKERIQAWMREKQSSDH,3.9201438,"E12D, A19K, R20Q, S26N, T39E, M53V, L63V, S65E, P66G, Q89R",10
REKFELYAEKVEEIVAKKARAEIDYSDAPDEFQDPISDTLMTDPVRLPSGTVMDRSIILRHLLNSKTDPFNRQMLTESMLTPVPELKEQIQAWMRVKQSSDH,0.20229699,"I1R, K5E, L7Y, N18K, R33Q, L36I, M37S, P66K, E81T, E96V",10
IEKLKLLAEKVEEIVAKNERAEIDYSDAPEEFRDPLMFEIMTDPVRLPSGTIMDRSIILRHLLNSNTDPFNRQMLTEEMLEPSPELKEQIQAWMREKQSSDH,2.0798144,"F4L, A19E, D30E, D38F, T39E, L40I, V52I, P66N, S78E, V83S",10
IEKFKLLQEKVEEIVAKNARAEIDNSDMPDEFRDPLMDELMTDPIRLPSGTVMDRSIIYRHLLNDPTDPFTRQMLTESMLEPVPELKEQIQAWMRDKQSSDK,2.9775224,"A8Q, Y25N, A28M, T39E, V45I, L59Y, S65D, N71T, E96D, H102K",10
KEKFKLTAEKVEEIVAMNARAEIDYSDAPDEFRCPLMDTLMTDPVRLPSGTVMDRSIILRHLVNSPTDPFNRQMLTESMLEPDPELKDQIQKWMREKESKDH,0.70343494,"I1K, L7T, K17M, D34C, L63V, V83D, E88D, A92K, Q98E, S100K",10
IESLKLLAMKVEEIVAENARAEIDYSDAPDEFRDPLTDTLMTDPVRLPSGYVMDRSVILRHLLNSNTDPFNRQMLTESMFEPVPELKEQIQAWMREKQSSDS,0.1884261,"K3S, F4L, E9M, K17E, M37T, T51Y, I57V, P66N, L80F, H102S",10
IEKFKLLAEKVERIVRKQARTEIDYSDAPDEFRDPLMDTLMTDPVRLPDGFVMDRSIILRHLVNSHTDPFNRQMLTESCLEPVPELKEQIQAWMRENQSSDH,0.25423068,"E13R, A16R, N18Q, A21T, S49D, T51F, L63V, P66H, M79C, K97N",10
IEKAKLLANKVEEINAKNADAEIDYSDAPDEFRDPLMDTLMTDPVRLPSGTVMDRSIILRHLLNSPTDPFNRQMLTSEMLEPVPELKARIQAWMREKHSSDY,0.62568223,"F4A, E9N, V15N, R20D, E77S, S78E, E88A, Q89R, Q98H, H102Y",10
IEKFVELAEKVEEIVAKNAREEEDYGDAPDEFRCPLMDTLMTDPVMLPSGTVMDRSIILRHLLNNPSDPFNRQMLTESMLEPVPELKEQIQAWMRQKQSSDH,-0.17393987,"K5V, L6E, A21E, I23E, S26G, D34C, R46M, S65N, T67S, E96Q",10
IEKSKLLAEKVEAIKRKNARAEIDYSDAPDEFRDPLTDTLMDDPVRLPSGTVMDRSAIFRHLLNSPTDPFNRQMLTESMLEPVPELREQIQAWMREKQSSNH,-0.090709634,"F4S, E13A, V15K, A16R, M37T, T42D, I57A, L59F, K87R, D101N",10
IEKFKLLAAKVEEIRAKQARAEIDYSDLPDEFRDPLGDTLMTDPVRLPSGTVMDRSIILRHLLNEPTDPFSRQKLTESMLVPVPDLKEQIQAWMREKQSSDH,-1.5606382,"E9A, V15R, N18Q, A28L, M37G, S65E, N71S, M74K, E81V, E85D",10
IEKFKLLAEEVEEIVAQNARAEIDYSEAPEEFRDPLMFTLMTFPVRLPSGTVMDRSIILRHLLCSPTDPFNRQMLTESMLQPVPELKEQIEAWMREKQSEDH,-0.19433363,"K10E, K17Q, D27E, D30E, D38F, D43F, N64C, E81Q, Q91E, S100E",10
IEKFKSLAEGVEEIVAKNLRAEIDYSDAPDEFRDPVMDTLMTDPVRLPSGFVMDRSIILRHLLNSDTDPFNRQMLTEEMLEPVPELKEQVQAWMRENQSGDH,2.6863494,"L6S, K10G, A19L, L36V, T51F, P66D, S78E, I90V, K97N, S100G",10
IEKFNLLVEKVEEIVAKNARAEIDYADAPDEFTDPLMDTLMTDPVRLPDGTVMDRSTILQHLLNSPTDPFNRQPLTESMLEPRPELKEQIQAWMRKKQSSDH,0.062793314,"K5N, A8V, S26A, R33T, S49D, I57T, R60Q, M74P, V83R, E96K",10
IIKHKELAEKVEEIVAKNARADIDYSDAPDEFRCPLMMTIMTDPVRLPSGTVMDRSIIVRHLLNSPTDPFNRQMLTESMLEPVPELKEQIQAWKREKQSSDI,1.231322,"E2I, F4H, L6E, E22D, D34C, D38M, L40I, L59V, M94K, H102I",10
IEKFKLLAEKVEEIVAKEARDEIDYSDAPDEFRDPLSQTLMEDPVRLPSGTVMDRSIILRHLLNDPTDPLNRQMLTESDLEPVPELKEQIQAWMREKQLSNH,-2.6046395,"N18E, A21D, M37S, D38Q, T42E, S65D, F70L, M79D, S99L, D101N",10
IEKFKLLAEKFEPIVAKNARAEADYSDAPDEFRDPLMQTLMTDPVQLPSGTVMDREIILRHLLNSPTDPFTRQMLTESMLEPVPELKDRIQAWMEEKQSSDH,3.2226841,"V11F, E13P, I23A, D38Q, R46Q, S56E, N71T, E88D, Q89R, R95E",10
IEKFKALAEKVEEIVAKNARAEIDYSDAPDEFLDPLMDTLMRDPVRLPSGTVMDRSIILRHLLNSPTDPFNRQMLDSSMLEPVPELKEKIQAWMRENGSSIE,0.17923498,"L6A, R33L, T42R, T76D, E77S, Q89K, K97N, Q98G, D101I, H102E",10
IEKFKLLAEKVEEIDAKNARAEDVYMDAPVEFRDPLMSTLMTDPVQLPSGTIMDRSIILRHLLNSPTDPFNRQMLTESMLEPVPELKEQIQAWMRSHQSSDH,-1.2720886,"V15D, I23D, D24V, S26M, D30V, D38S, R46Q, V52I, E96S, K97H",10
IEKFELLAEWVEEIRAKVARARIDYSDAPDEFRDPLMDTLMTDPVILPSGTVVDRSIILRHLLNSPTDPFTRQGLTESMLEPVPELKEQIQAWMREKQASDH,5.1080236,"K5E, K10W, V15R, N18V, E22R, R46I, M53V, N71T, M74G, S99A",10
IEKFKLLAPKVEEIVAKFAHAEIDYSDAPDEFRDPLMFTLMTDPVRLPSGQVMDRSIILRHLLNSPTDPFNREPLTESMLEPVPELVEQIQAWCREKQWSDH,-0.38948146,"E9P, N18F, R20H, D38F, T51Q, Q73E, M74P, K87V, M94C, S99W",10
IEKIRLLAEEVEEIVEKNARAEIDYSDAPDEFRDPLMDTLMVDPVRLPSGTVLDRSIILRHLLNYPTDPFNRQMLTESMLEPVPELKEQIQAWKREGQSSDP,2.3713593,"F4I, K5R, K10E, A16E, T42V, M53L, S65Y, M94K, K97G, H102P",10
IEKFKLLTEKVAEIVAANARADDDYSDAPDEFRDPLMDTLMTDPVRLPSGTVVDRSIILRHLLNSPTDPFNRRMLTESMLEPNPELKEQIQAWMRKHQSSDH,3.0913825,"A8T, E12A, K17A, E22D, I23D, M53V, Q73R, V83N, E96K, K97H",10
IEKFKLLAEKLEEIVAKKARAEIDFSDAPDEFRDPLMDNLMTDPVRLPSGTVVDRSIILRHLLNSPTDPFNRQMLTESMLEPVPGLKEQAQSWMREKQSSHL,-0.6331692,"V11L, N18K, Y25F, T39N, M53V, E85G, I90A, A92S, D101H, H102L",10
IEKFKLLAEKAEEIVAKQAAAEDDYSDAPDEFRDPLMDELMNDPVRLPSGTSMDRSIILRHLLNSKTDPFNREMLDESMLEPVPELKEQIQAWMREKQSSDH,-1.0211174,"V11A, N18Q, R20A, I23D, T39E, T42N, V52S, P66K, Q73E, T76D",10
IEKFKLLAEKVKEAVLKLARADIDYSDAPDEFRDPLMDSLMTDPVRLPSGTVMERSIILRHLMNSPTDPFTRQMLTESMLEPVPELKEQIQNWMREKQSSDH,1.0999131,"E12K, I14A, A16L, N18L, E22D, T39S, D54E, L63M, N71T, A92N",10
IAKVKTVAEKVEEIVAKNARAEIDYSNAPDEFRDPLMDTLMTDPVRLPSGHVMDRSDILRHLLNSPTDPFNRVMLTESMLEPVPELKEQIQAWMKEKGSSDH,-2.2117429,"E2A, F4V, L6T, L7V, D27N, T51H, I57D, Q73V, R95K, Q98G",10
IEKFKLLKEKVEEVVAKNARAEIDESEAPDEFRDPLMDTLMTDPVRLPSGTVMDRSTIERHLLNSPTDPFNRQMLTPSMLEPVPELKESIQAWMSEKKSSDH,1.9578922,"A8K, I14V, Y25E, D27E, I57T, L59E, E77P, Q89S, R95S, Q98K",10
IRKFKLLAEKVKSIVAKNARAEIDYSDAPDEFRCPLMTTLMRDPYRLPSGTVMDRSIILRHLLNSPTDPFNRQMLTESMLEPNPELREQIQAWMREKQSRDH,-1.6453235,"E2R, E12K, E13S, D34C, D38T, T42R, V45Y, V83N, K87R, S100R",10
IEKFKLLKEKEDEIVAKNATAAIDYSDIPDEFRDPLMDTLMTDPVRLPSGTVMDRSIILRHLLNSPTDPFNRQPLTESMLEPVPELKEQIQQWKREVQSSDH,0.23945892,"A8K, V11E, E12D, R20T, E22A, A28I, M74P, A92Q, M94K, K97V",10
IEKFKLLAEQHDEIVAKNARAEIDYSDPPDEFRDPIMDTLMTDPVTLPSGTVMDRSIIIRHLLSSPTDPFNRQMLTESMLEPVPELKEQIQAWRRERQSSDH,0.5892232,"K10Q, V11H, E12D, A28P, L36I, R46T, L59I, N64S, M94R, K97R",10
IEKFKLLAEKVEEIVAKNATADIDMDEAPDEFRDPLMDTLMTNPVRLPSGTVMDRSIILRHLLNSPTDPFNRQMLTESMLEPVPELKEQIEAWKSENQSSDH,0.8930477,"R20T, E22D, Y25M, S26D, D27E, D43N, Q91E, M94K, R95S, K97N",10
IEKFKLLAKKQEEIVAKNARAEIDYSDAPDEFRCPLMDTLMREPVRLPSGTVMDRSLIERHLLTSPTDPFNRQMLTESMLEPVPELKEQIQAWMTEKQSSDA,-1.418875,"E9K, V11Q, D34C, T42R, D43E, I57L, L59E, N64T, R95T, H102A",10
IEKKKLLAEKVEEIVRKNERAEIDYSDVPDEFCDPLMDTLMTDPVKLPSGTVMDRSIIAQHLLRSPTDPFNRQMLTESMLEPNPELKEQIQAWMREKQSSDH,-0.3127842,"F4K, A16R, A19E, A28V, R33C, R46K, L59A, R60Q, N64R, V83N",10
IEMFKLLGEKVEAIVAKNPRVEIDYSDAPDEFRDPLMDGLMNDPVRLPSGTVMDRSIILRHLLNSPTDPFNRQMLTESMLRPVPELKEQIESWMREKQSSDH,-1.4965613,"K3M, A8G, E13A, A19P, A21V, T39G, T42N, E81R, Q91E, A92S",10
IEKFKLLAEEVEEIRAKNARDEIDYSDAPDEFRDPLMLTLMTDPVRLPDGTIMDRSIILRHLLNSPTDPFNRQMLTEEMLEPRPELKEQIQAWWREKQSQDH,2.063295,"K10E, V15R, A21D, D38L, S49D, V52I, S78E, V83R, M94W, S100Q",10
IEKKKLLAIKCEEIVAKNARADIDYSDAPDEFKDPLMDTLMQDPVRLPSGTVMDRSIILRHLLNSPTDPFNRQPLTASMLEPVPELKEQIQAWMREIQSLDH,-0.20517036,"F4K, E9I, V11C, E22D, R33K, T42Q, M74P, E77A, K97I, S100L",10
IEKGKLLAEKVEEIVAKNAAAEDDYNDAPDEFRDPLMFTIMTDPVRLPSGIVMDRSIILRHLLTDPTDPFNRQMLTESMLEPVPELKEQIQAWKREKQSSDH,2.1046958,"F4G, R20A, I23D, S26N, D38F, L40I, T51I, N64T, S65D, M94K",10
IEKFKPLAEKVEEIVAKNARAEIDQSDAPDEFRDPLMDTLMRDPVRLPSGTVMDRDIILRHLKNHPTDPFNRQPLTESMLEPEPELKAQIQAWMEEKQSSDH,-1.0328846,"L6P, Y25Q, T42R, S56D, L63K, S65H, M74P, V83E, E88A, R95E",10
IEKDKLLAEKVEDVVKKNARAEIDYSDAPSEFRDPLMDTLMTDPVRLPSGTVLERSIIERHLLNSPTDPFNRQTLTESMLEPVPELKEQIQAWMREKQSSRH,3.1652942,"F4D, E13D, I14V, A16K, D30S, M53L, D54E, L59E, M74T, D101R",10
IEKFKALAEKVHEIVSENARAEIDYSDVPDEFRDPLADTLMTDPVRLPSGTVMDRSIILRHLLNSPTDPFNRQPLTESMLEPVPELKEQIQAYMREKRSSDA,0.20079009,"L6A, E12H, A16S, K17E, A28V, M37A, M74P, W93Y, Q98R, H102A",10
IEKFKLTAEKVEEIVAKNRREEIDFSDAPDEFRDPLMDTLMTDPVRLPSGTVMDRSIILRHLLHSPTDPFNRQELTPSMLEPNPELKEQIEAWIREKQSSDH,2.0422444,"L7T, A19R, A21E, Y25F, N64H, M74E, E77P, V83N, Q91E, M94I",10
MEKFKLAAEKVEEIVLKNARAEIDTSDLPDEFRCPLMDTLMTDPVRLPSGTVMDRSIILRHLVNDPTDPFNRKMLTESMLEPVPELKEQIQAWMREKQGSDH,-0.71844435,"I1M, L7A, A16L, Y25T, A28L, D34C, L63V, S65D, Q73K, S99G",10
PEKFVLLAEKVEEEVAKNARAEVDHSDAPDEFRDPLMLTLMTDPVRLPTGTTMDRSIILRHLLNSPTDPFNRQMLTASMLEPVPELKEQIQAWMREKISSDH,-1.7561625,"I1P, K5V, I14E, I23V, Y25H, D38L, S49T, V52T, E77A, Q98I",10
EEKQKLLAEKVEEIVAKNARAEISYSDAPDEFRDPLMDTLMTDPVRLPSGTVMDRSIILSHLLNSDTDPFLRLPLTESMLKPVPELKEQIQAWMREKQSSDL,-0.38328385,"I1E, F4Q, D24S, R60S, P66D, N71L, Q73L, M74P, E81K, H102L",10
MEKFKLLAEKVEEIVAKNFRNEIDYDDAPDEFRDPLMDTEMTDPVRLPSGKVMDRSVILQHLLNEPTDPFNRQMLTESDLEPVPELKEQIQAWMREKQSSDH,0.5872385,"I1M, A19F, A21N, S26D, L40E, T51K, I57V, R60Q, S65E, M79D",10
MEKFKLLAEKVEEIQAKNMRAEIDYSDIPDEFRDPLMDTLMTDPVRLPSGTVMDRSIILRHLLNSPTDPFNRTMLTPEQLLPVPELKEQIQAWMNEKQSSDH,-1.1660222,"I1M, V15Q, A19M, A28I, Q73T, E77P, S78E, M79Q, E81L, R95N",10
IEVFKLLAEKVEEIVAENARAEIDHSDLPDEFRDPLMDDLMTDPVRLPSGTVMDRSIILRHLLNSPTDPFNRQMLTEEMLEEVPELKEHINAWMREKQSSDT,1.1709282,"K3V, K17E, Y25H, A28L, T39D, S78E, P82E, Q89H, Q91N, H102T",10
IEKFKLLAEKVEAIVAKVARAEIDYSDAPDEFRDPLTLTLMMDPVILPSGTVMDRSIILRHLLNSPTDPFNREMLTEQMLEPVPPLKEQIQAWMRELQSSDH,-2.5533752,"E13A, N18V, M37T, D38L, T42M, R46I, Q73E, S78Q, E85P, K97L",10
IEKFKLLAGKVEEIVAKKARADIAYSDAPDEFRDPIADSLMTDPVRLPSGTVMDRSIILRHLLNSPTDPWNRQMLTESMLEPVPELKEQIAAWMRKKQSSDH,-1.1590359,"E9G, N18K, E22D, D24A, L36I, M37A, T39S, F70W, Q91A, E96K",10
IEKFKLLAEKVSEIVAKGNRAEIDYGDAPDEFRDPLMDTLMTDPVRLPSGQVFDRDIILRHLLNSPTDPFNRQMLTESTLEPCPELKEQIQAWMREKQSSDK,-0.6803092,"E12S, N18G, A19N, S26G, T51Q, M53F, S56D, M79T, V83C, H102K",10
FEKFMLLAQKREEIEAKSARAEIDLSDAPDEFRDPIMDTLMTDPVRLPSGTVLDRSIILRHLLNSPTDPFNRQMLTESDLEPVPELKEQIQAWMREKQSSDH,3.3171446,"I1F, K5M, E9Q, V11R, V15E, N18S, Y25L, L36I, M53L, M79D",10
IAKNKLLAEKLEEIVAKARRAEIDYSDAPREFKDPLMDTLMTDPVRLPSGTVMDRSIILRHLLNSPTDPFNRQMLTESMLVPVPELKEQIVAWIREKQSSDH,0.88243747,"E2A, F4N, V11L, N18A, A19R, D30R, R33K, E81V, Q91V, M94I",10
IEKFKLLAEKVEEIVAKNASAEIDYSDVPDEFRDVLMDTLMTDPVRLPSGEVRDRSNILRHLLNSPTDPFNRQMLTESMLEPNPELKEQIQQWMVEKQSSIH,-2.1112375,"R20S, A28V, P35V, T51E, M53R, I57N, V83N, A92Q, R95V, D101I",10
IEKNKLLAEKVEEIVAKNARAEIDYGDAPDEFRDPLMDEIMTDPVRLPSGNVMDRSIILRHLSNSPTDPFNRQMLTEDMLEPNPGLKEQIQAWMREKASSDH,0.18096867,"F4N, S26G, T39E, L40I, T51N, L63S, S78D, V83N, E85G, Q98A",10
IEKAKLLAEKAEEIVARNARAEIDYSDAPDEFRDPLMDTLMRDPVRLPSGTVMDRSIIERWLLYSPTDPFNRQRLTESMLEPVPELKEQIQAWMREKRSQDH,0.25688735,"F4A, V11A, K17R, T42R, L59E, H61W, N64Y, M74R, Q98R, S100Q",10
MEKFKLLKEKVEEIVAKNARAEIDGDDIPDEFRDPLMDTLMTSPVMLPDGTVMDRSIILRHLLSSPTDPFNRQMLTESMLEPVPELKEQIQAWMREKQQSDH,-0.59652925,"I1M, A8K, Y25G, S26D, A28I, D43S, R46M, S49D, N64S, S99Q",10
IESFKTLAEKVEEIVAKNARAEIDYSDAPEEFRDPLMDQLMTDPTRLPSGFVMDRSVILDHLLNDPTDPFNRQMLTESMLEPNPELKEQIQAWMREKQSSDH,0.620708,"K3S, L6T, D30E, T39Q, V45T, T51F, I57V, R60D, S65D, V83N",10
IEKFKRLAEKVEEKVAKKADADIDFSDAPDEFRDPLMFTLMTDPVRLPSGTVMDRSIIMRHLLNSPTDPFNRQMLTESMLEPVPELKERIQAWMREKQSHDH,-0.4942624,"L6R, I14K, N18K, R20D, E22D, Y25F, D38F, L59M, Q89R, S100H",10
