Sequence,Score,Mutations,Number of Mutations
QRKFKLLAEKVEEIVAKNARAEIHLSDVPDEFRDPVMDTLMTDPVRTPSGTVMDRTIILRHLLNSPTDPFNRQMLTESMLEPVPELKKRIQAWMREKQSSDH,-0.946879,"I1Q, E2R, D24H, Y25L, A28V, L36V, L47T, S56T, E88K, Q89R",10
MEQFKLLAEQVEEIVAKHARAEIDYSDAPDEFRDPIMHTLMIDPVRLPSGHVMDRSIILRHLLNSPTDPFNRQMLTESMLEPVPELKEQIDAWMEEKQSSDH,-0.67872953,"I1M, K3Q, K10Q, N18H, L36I, D38H, T42I, T51H, Q91D, R95E",10
MEKFKLLREKVEEIVAKVARCEIEYSDAPDEFRDPLTDTLMRDPVRTPSGTVMDRSIILRHLLNSPTDPFNRQMLTESMLEPVPELKEQIQAWLREKASSDH,0.06617805,"I1M, A8R, N18V, A21C, D24E, M37T, T42R, L47T, M94L, Q98A",10
IEKFKELAEGMSEIVAKHARAEIDYSDAPDEFRDPLMLTLMTDPVRLPSGTVMDRSIILKHLLRSPTDPFNRQMLEESMLEPVPELKEQIQAWMRSKQSSDH,-0.81434673,"L6E, K10G, V11M, E12S, N18H, D38L, R60K, N64R, T76E, E96S",10
EEKFKLLAEKVEEIVAKGARAEIDYSDAPDEFRDPLMDTLMQDPVRLPSGTVMDRSIILRHLLNSPTDPFNRTPLTENMLIPVPELKEQIQAWSRAKQKSDH,-0.50254434,"I1E, N18G, T42Q, Q73T, M74P, S78N, E81I, M94S, E96A, S99K",10
IEKFKLLAEKVEGIVAKNARTEIDYSDAPDEFCDPLMDKLMTDPVRLPSGTLMDRSIILRHLLSSPTDPFNRQMLTESMLEPNPELKERIQAWLREKQSEDH,-2.2665005,"E13G, A21T, R33C, T39K, V52L, N64S, V83N, Q89R, M94L, S100E",10
IEKFKLLAEKVEAVVEKNARAEIDPSDAPDEFRDPLMDTLMTDPVRLPSGTVMDRSIILRHLLNSETDPFNRQMLTEDMLEPVPELKAQIQAWCREKQSGSH,0.88690436,"E13A, I14V, A16E, Y25P, P66E, S78D, E88A, M94C, S100G, D101S",10
IEKFKLLSEKVEEITAKNAAAEIDYSDAPDEFRDPLMDTLMTDPVRLPSGTVMDRSIIQEHLLNSPTDPFNRQPLTESMLEPVPELKAQIQAWMKERQSSDT,-0.478038,"A8S, V15T, R20A, L59Q, R60E, M74P, E88A, R95K, K97R, H102T",10
MESFKLFAEKVQEIFAKHARDEIQYSDAPDEFRDPLMDTLMRDPVRLPSGTVMDRSIILRHLLNSPTDPFNRQMLTESMLEPVPELKEQIQAWMREKQSSDA,-0.700099,"I1M, K3S, L7F, E12Q, V15F, N18H, A21D, D24Q, T42R, H102A",10
IEKFKRLAEKGEEIVEKNARAEIDYSEAPDEFRDPLMLTLMTDPVRLPSGTVMDRSIILRHLQNSPTDPFNRQPLTESMLEPVPELKEKIQAWMSEKQSSDE,-0.17655572,"L6R, V11G, A16E, D27E, D38L, L63Q, M74P, Q89K, R95S, H102E",10
IEKFKLLAEKVEETVAENNRAEIDYSDAPDEFRDPLMDTLMTDPVRLPSGTLMDRSIILRHLLNSPTDPFNRQMLTESMLEPVPELKQQIQAWCKEKRGKDH,-1.4512384,"I14T, K17E, A19N, V52L, E88Q, M94C, R95K, Q98R, S99G, S100K",10
IEKFKLLAKQVEEIVAKNRRAEEDYSDVPEEFRDPLMDTLMMDPVRLPSGTVMDRSNILRHLLNSPTDPFNRQMLTEDMLEPVPELKEQIQAWMREKQSQDH,1.8005108,"E9K, K10Q, A19R, I23E, A28V, D30E, T42M, I57N, S78D, S100Q",10
IEKTKALAEKVEEIVAKNGRAEIDYSDAPDEFRDPLMDTLMRDPVKLPSGTVMERSIIKRHLLNSPTDPFNRQMLTEDMLEPVPELKEQIQAWMREQQDSDH,1.3851676,"F4T, L6A, A19G, T42R, R46K, D54E, L59K, S78D, K97Q, S99D",10
IDKFKLLNEKVEEIVPENARAEIDYSDAPDEFLDPLMDTLMTDPVRLPSGTVMDRSIILEHLLNDPTDPFNRQMLTESMLQPVNELKEQIQAWMREKQASDH,1.0467293,"E2D, A8N, A16P, K17E, R33L, R60E, S65D, E81Q, P84N, S99A",10
MEKFKLLAEKVDSIVAKNAREELDYSDAPDEFRDPLMDTLMTDPVRLPSGTIMDRSIIMRHLLNSPTDPFNRQMLTEMMLEPVPELKEQIQAWCREKQSSLH,1.8776772,"I1M, E12D, E13S, A21E, I23L, V52I, L59M, S78M, M94C, D101L",10
MEKFKLFAEKVEEIVHDNARAELDYSDAPDEFRDPLMDTLMHDPVRLPSGTVMDRSIILRHLSNSPTDPFNRQMLTESMLEPVAELKAQIDAWMREKQSSDH,-0.5614395,"I1M, L7F, A16H, K17D, I23L, T42H, L63S, P84A, E88A, Q91D",10
IEKFKLLAEKVEEVYAKNARAEIDYSDAPDEFADPLMDRLMTDPVRLPSGTVMDRSIILRHLLVSSTDPFNRQPLTESMLEPVPELKERIQAWMRAKQSSIH,-2.0025182,"I14V, V15Y, R33A, T39R, N64V, P66S, M74P, Q89R, E96A, D101I",10
MEKFKLLAEKVEEIVEKNARAEIDYKDAPDEFRDPLMDTLMTDPVRLPSGNVMDRSSILRHLLNSPTDPFNRVPLTESMLEPVPELKARIQAWMRAKQSSDH,0.2967808,"I1M, A16E, S26K, T51N, I57S, Q73V, M74P, E88A, Q89R, E96A",10
IEKFKLLQEKVEELVAKNNRAEIDYSDAPDEFRDPLMDTLMTDPVRLPSGTVMDRSIILRHLLNNPTDPFNRQMLTENMLEPVPELKEQIQKWMTNKQTSRH,-0.7508946,"A8Q, I14L, A19N, S65N, S78N, A92K, R95T, E96N, S99T, D101R",10
IEKFKLLKEKVDEIYASNARQEMDYADAPDEFRDPLMDTLMTDPVRLPSGTVMDRSAILRHLLNSPTDPFNRQPLTESMLEPVPELKEQILAWMREKQSSDH,2.541821,"A8K, E12D, V15Y, K17S, A21Q, I23M, S26A, I57A, M74P, Q91L",10
IEKFQLLAEKVEEIVAKNAAAEVAYSDIPDEFRDPLMHTLMTDPVRTPSGTVMDRSIILRHLLNSPTDPFNRQMLTESMLEPVLELKEQIQAWIREKQLSDH,-1.6272265,"K5Q, R20A, I23V, D24A, A28I, D38H, L47T, P84L, M94I, S99L",10
IETFKLTAEKVEEIVAQNQRAEIDYSDAPEEFRDPLMDTLMTDPVRLPSGIVMDRSTILRHLLNSPTDPFNRQPLTEDQLEPVPELKEQIQAWMREKQSSDH,3.49826,"K3T, L7T, K17Q, A19Q, D30E, T51I, I57T, M74P, S78D, M79Q",10
MAKFKLLAEKVQEIVAKNARAEIDYSDAPEEFRDPLMDTLMTDPVRLPSGTVMDRSIILRHLLTSPTDPFNRQMLTEDMLKPVPELKEQIQAWKAEKQSKDH,-1.05182,"I1M, E2A, E12Q, D30E, N64T, S78D, E81K, M94K, R95A, S100K",10
IEKFKLLAEKVEEIVANNARADIDYDDAPDEFLDPLMRTLMVDPVRLPSGTVMDRSIILRHLLNSPTDPFNRAMLTESMLEPVPELKEQITQWTREKQSSDH,2.0009809,"K17N, E22D, S26D, R33L, D38R, T42V, Q73A, Q91T, A92Q, M94T",10
AESFKLLAEKVEEIVAENARAEIDYSDAPDEFRDPLMDTLMTDPVRLPSGKIMDRSIILRHLLTSHTDPFNRRMLTESMLEPVPELKEQIDAWMRAKQSSDH,-0.9970522,"I1A, K3S, K17E, T51K, V52I, N64T, P66H, Q73R, Q91D, E96A",10
IEKFKLLAEKVEEIKADNSRAEIDYSDAPEEFRDPLMDTLMTDPVRLPSGTLMDRSIILRHLRNSPTDPFNRQMLTESQLEPVPELKEQIQAWLVEKQISDH,0.014257992,"V15K, K17D, A19S, D30E, V52L, L63R, M79Q, M94L, R95V, S99I",10
IEKFAALAEKVEEIVAKNAPAEIDYSDAPDEFRDPLMNTLMTDPVRLPSGTVMDRPTILRHLLNSPTDPFNRQMLTESMLEPVPELKEKIDEWLREKQSSDH,0.99396956,"K5A, L6A, R20P, D38N, S56P, I57T, Q89K, Q91D, A92E, M94L",10
IEKFKCLAEKVEEIVAKNNRAEIDYSEAPDEFRDPLMDTLMADPVRLPSGTVMDRGIILRHLLSSPTDPFNRQMLTESMLEPVPEVKERIQAWMRKKVSSDH,-1.2520415,"L6C, A19N, D27E, T42A, S56G, N64S, L86V, Q89R, E96K, Q98V",10
IEKFKLLAERVEEIVAKNAREEIDYSDAPDEFRDPLMITIMTDPVKLPSGTVMDRSIILKHLLNSPTDPFNRVMLTESMLEPVPELKERIQAWMASKQSSDH,2.0061488,"K10R, A21E, D38I, L40I, R46K, R60K, Q73V, Q89R, R95A, E96S",10
IEKFKQLAEKVEQIVAKNARAEIDYSDAPDEFRDPLMDSVMTDPVRSPSGTVMDRSIILRHLLNSPTDPFNRTPLTESMLEPVPELKEQIQAWMRQRQSLDH,-1.0449793,"L6Q, E13Q, T39S, L40V, L47S, Q73T, M74P, E96Q, K97R, S100L",10
MAKFKLLCEKVEEKVAKNARNEVDYGDAPDEFRDPLMDTLMTDPVRLPSGTVMDRSIILRHLLNSKTDPFNRQMLTESMLEPVPELKEQIQAWMREKQSSCA,-0.07563138,"I1M, E2A, A8C, I14K, A21N, I23V, S26G, P66K, D101C, H102A",10
MEKFKILAQKVEEIVAKNPRAEIDYSDAPDEFRDPLMDTLMTDPVRLPSGTVMDRAIIARHLLNSQTDPFNRQMLTESMLEPVNELKEQIQAWMRKKQSSDN,0.22685255,"I1M, L6I, E9Q, A19P, S56A, L59A, P66Q, P84N, E96K, H102N",10
IERHKLLAEKVEEIVAKNADDEIDYSDAPDEFRDPLMDTLMTDPVRTPSGTVMDRSIIEKHLLNSPTDPFNRQMLTASMLEPESELKEQIQAWMREKQSSDH,-0.51677334,"K3R, F4H, R20D, A21D, L47T, L59E, R60K, E77A, V83E, P84S",10
IEKFKLLAEKVEEHYAKNARAEIDYSDAPDEFLDPLMDELMTDPVRLPSGTVMDRSIIQRHLMNSPTDPFNRQMLTEDMLEPVPELKQQIQQWMREKPSSDH,-0.2129485,"I14H, V15Y, R33L, T39E, L59Q, L63M, S78D, E88Q, A92Q, Q98P",10
IEKFKELARKVEEIVAKNAEAEIDLSDAPDEFRDPLMDTLMTDPVRLPSGHVMDRSIILQHLLNSPTDPFNRQMLTESMLEPVPELKEQIDAWMREKISSIT,0.94991773,"L6E, E9R, R20E, Y25L, T51H, R60Q, Q91D, Q98I, D101I, H102T",10
KEKFQLLAEKVQEIVAKNAPAEIDYSDVPDEFLDPLMRTLMTDPVRLPSGTVMDRVIISRHLLNSPTDPFNRQMLTESMLEPVPELKEQIQAWMREKQSKDH,0.4706512,"I1K, K5Q, E12Q, R20P, A28V, R33L, D38R, S56V, L59S, S100K",10
IEKFKLLIEKVEAIVTKNARAEIDISDAPDEFRDPIMDSLMTDPVRLPSGTVMDRSIILRHLLNNPTDPFNREMLTESMLEPVPELKEQIQAWMRLKQSSRH,-0.91449124,"A8I, E13A, A16T, Y25I, L36I, T39S, S65N, Q73E, E96L, D101R",10
IEKFKHLKTKVNELAAKNARAEIDFSDAPDEFRDPLMDTLMTDPVRLPSGTVMDRSIILRHLLNQPTDPFNRQMLTESMLEPVPELKVQIQAWNREKQSSDH,-1.4908116,"L6H, A8K, E9T, E12N, I14L, V15A, Y25F, S65Q, E88V, M94N",10
IEKFKELVEKVEEIVAKNARAEIKYSDAPEEFRDPLMDTLMKDPVRLPSGTVMDRDSILRHLLNSPTDPFNRAMLTESMLEPVPELKEQIQAWMREKDSSSH,0.58679664,"L6E, A8V, D24K, D30E, T42K, S56D, I57S, Q73A, Q98D, D101S",10
IIKFRLLAEKAEEQVAKAARAEIDYSDAPDEFRDPLMDTLMTDPVRLPSGRMMDRSIILRHLLNSPTDPFNRQMLTESMLEPVPELKEQIDNWMREKASSDH,0.50180364,"E2I, K5R, V11A, I14Q, N18A, T51R, V52M, Q91D, A92N, Q98A",10
IEKFKLLAEKTEEIVAKHARAEINYSDAPDEFRDPIMDTLMTDPVRLPSGTVMERSIILKHLLSSPTDPFNRQMLTESMLVPVPELKEQIEAWMRSKQSSDH,0.09596736,"V11T, N18H, D24N, L36I, D54E, R60K, N64S, E81V, Q91E, E96S",10
EEKRKQLAEKVEEIVKKNARAEIDYSDAPDEFLDPLMDTLMVDPVRLPSGTVMDRSIILKHLLNSPTDPFNRQMLTEDMLEPVPELKAQIQAWMRERQSSDH,0.8675145,"I1E, F4R, L6Q, A16K, R33L, T42V, R60K, S78D, E88A, K97R",10
IELFKLLAEKVEEIVAENAREEIDLSDAPDEFRDPIMFTLMTDPVRLPSGTIMDRSIILRHLLNQPTDPFNRQMLTESDLEPVPELKEQIQAWMIEKQSSDH,1.982108,"K3L, K17E, A21E, Y25L, L36I, D38F, V52I, S65Q, M79D, R95I",10
DEKFKLLQEKVEEIVAKNARAEIDMSDAPEEFRDPIMDTIMTDPVRLPSGTVMDRSIIMRHLLNSPTDPFNRVMLTESMLEPVPELKEQIQAWIREKQSSDK,4.763168,"I1D, A8Q, Y25M, D30E, L36I, L40I, L59M, Q73V, M94I, H102K",10
IEKLKLEHEKVEEIHAKNARAEIDYSDIPDEFRDPLMDTLMTDPVRLPSGTVMDRSIILRHLRNSPTDPFNRQMLTESMLEPVDELKERIQAWMREKQSSKS,1.51983,"F4L, L7E, A8H, V15H, A28I, L63R, P84D, Q89R, D101K, H102S",10
IEEFKLLAEKVEEMKAKNARAEIDYSDAPDEFFDPLMDTLMTDPVRTPSGTVMDRSSILRHLLNSQTDPFNRTMLTESMLCPVPELKEQIQKWMREKQSSDH,-1.8103665,"K3E, I14M, V15K, R33F, L47T, I57S, P66Q, Q73T, E81C, A92K",10
IEKFKLLAEKVDEIFAKNARAEPIYSEAPDEFRDPLMDTLMTDPVRSPSGHVMDRSIILRHLRNSHTDPFNRQMLTESMLEPVPELKEQIQAWMREKTSSDH,-0.009973837,"E12D, V15F, I23P, D24I, D27E, L47S, T51H, L63R, P66H, Q98T",10
IEKVKALCEKVEENVKKDARAEIDYSDAPDEFRDPLMDTLMTDPVRLPSGTVMDRSIILRHLLNSPTDPFNRQMLTEEMLEPVPELKERIEAWMREKQSSDM,2.084258,"F4V, L6A, A8C, I14N, A16K, N18D, S78E, Q89R, Q91E, H102M",10
IEKFRLLAEKVEEIVAKNEREEIEYSDIPDEFRDPLMDTLMHDPVRLPSGTVMDRSIIQRHLLNSSTDPFNRQMLTESMLEPVPELKEQIQAWMRENQMSDH,2.1801662,"K5R, A19E, A21E, D24E, A28I, T42H, L59Q, P66S, K97N, S99M",10
IEKFKLLAEKVGEEVKKNARAEIDYSDAPDEFLDPLMDTLMTDPVRLPSGTVMDRSVILKHLLGSPTDPFNRQKLTESMLEPVPELKERIQAWMREKQSSNH,0.16917415,"E12G, I14E, A16K, R33L, I57V, R60K, N64G, M74K, Q89R, D101N",10
IEKFKLLAAKVEEIVNKNARAEIELSDAPDEFTDPLMDCLMTDPVRLPSGTVMDRSIILRHLLHSPTDPFNRAMLTESMLEPVPELKEQIQRWMREKQSSSH,-1.0370376,"E9A, A16N, D24E, Y25L, R33T, T39C, N64H, Q73A, A92R, D101S",10
IEKFRLLAAKVEEIVALNARAEIDYSDAPEEFRDPLMDTLMTDPVRTPSGTVMDRSIILRHLLNSPTDPFNRQMLTESDLEPDPELKEQIQSWMREKTSGDH,-0.3593691,"K5R, E9A, K17L, D30E, L47T, M79D, V83D, A92S, Q98T, S100G",10
IEKFNLLAEKVEEIVAKNARAELDYSDVPDEFRDPLMDTLMTDPVRVPSGTVMDRSNILQHLQNSPTDPFNRQPLTESMLEPVRELKEQIQAWMREQQSSDH,0.5812098,"K5N, I23L, A28V, L47V, I57N, R60Q, L63Q, M74P, P84R, K97Q",10
IIKHELLAEKVEEIVAKNQRAEIDLSDVPDEFRDPLMYTLMTDPVRLPSGTVMDRYIIARHLLNSPTDPFNRQMLTESMLEPVPELKEQIQAWMREKQSSDD,1.4503858,"E2I, F4H, K5E, A19Q, Y25L, A28V, D38Y, S56Y, L59A, H102D",10
IEKFKLLAEKVEEIVAKNERAEIDYSDAPDEFLDPIMGTLMTDPVRLPSGTVMDRSIILRHLLSSPTDPFNRLMLTESMLEPVPELKEQIQQWMKEKQSLNH,-1.8488116,"A19E, R33L, L36I, D38G, N64S, Q73L, A92Q, R95K, S100L, D101N",10
IEKFKLLAEQVEEIVSKNARAEIDYSDAPDEFLDPLMSTLMYDPVRLPSGTVMDREIILRHLLNSPTDPFNRQMLTESMLEPVPELKSRIDAWMRERQSSDH,-0.66015464,"K10Q, A16S, R33L, D38S, T42Y, S56E, E88S, Q89R, Q91D, K97R",10
IEKFALLAEKVQEIVAKNAGAEIDYSDAPDEFRDPLMQTLMTDPVRLPSGTVMDRSIILRHLLNSPTDPFNREMLTEEMLEPVPELKEQIDAWMREKTASDR,-0.8534677,"K5A, E12Q, R20G, D38Q, Q73E, S78E, Q91D, Q98T, S99A, H102R",10
IEKFKLLAEKVEERVAKNARDEMTYGDAPDEFRDPLMDTLMNDPVRLPSGHVMDRSIILRHLLNSPTDPFNRQMLTESMLEPVPELKEQIQAWMRERHSSDI,1.7746136,"I14R, A21D, I23M, D24T, S26G, T42N, T51H, K97R, Q98H, H102I",10
IEKFRLLRHKVEEVVGKNAEAEIDYSDAPDEFRDPLMDTLMKDPVRLPSGTVMDRSIILRHLLNSPTDPFNRVMLTVSMLEPVPELKEQIQAWMREKQGSDH,-1.743857,"K5R, A8R, E9H, I14V, A16G, R20E, T42K, Q73V, E77V, S99G",10
IEKFKLLQEKVEEIVANCARAEIDYSDAPDEFRDPIMDTLMTDPVRLPSGKVMDRSIILRHLLMSPTDPFNRQPLTESMLEPVPELKAQIQAWMHEKQSCDH,2.7260008,"A8Q, K17N, N18C, L36I, T51K, N64M, M74P, E88A, R95H, S100C",10
IEKFKLLRGKLEEILAKNTRAEIDYSDAPEEFRDPLMGTLMTDPVRLPSGTVMDRSIILRHLLNSPTDPFNRQMLTESMLEPVPELKEQIQAWMTEQQSSDK,-2.0747955,"A8R, E9G, V11L, V15L, A19T, D30E, D38G, R95T, K97Q, H102K",10
IEKFKLLAEQAEEIVAKNARPDIDYSDAPDEFRDPLMDTLMTDPVRLPSGTVMDRSIILRHLLNSPTDPFNRQPLTESMLEPVPELKAQIANWLREKQSSDL,0.526176,"K10Q, V11A, A21P, E22D, M74P, E88A, Q91A, A92N, M94L, H102L",10
IEKFKLLAEKVEELVNGGARDEIDYSDAPDEFRDPLMHTLMTDPVRLPSGTVMDRSIILRHLLNSQTDPFNRQPLTESMLEPVPELKEQIQAWMRERQSSHH,-1.0570302,"I14L, A16N, K17G, N18G, A21D, D38H, P66Q, M74P, K97R, D101H",10
IEKFKLLAEEIEVIVALNAPAEIDLSDAPDEFRDPLLDTLMTDPVRLPSGTVMDRGIILRHLLNSPTDPFNRSMLTESMLEPVPELKEQIQAWMTEKQSSDH,1.2265241,"K10E, V11I, E13V, K17L, R20P, Y25L, M37L, S56G, Q73S, R95T",10
IAKFKSLAEKVEEILAKNARAEIHYSDAPDEFRDPLMDTLMTDPVRLPSGHVMDRSNILQHLRNSPTDPFNRQSLTESMLEPVPELKEQIQAWMREKQASDH,-1.2379465,"E2A, L6S, V15L, D24H, T51H, I57N, R60Q, L63R, M74S, S99A",10
IEKTKLEAESVESIVAKNARAEVDYSDAPDEFRDPLMDTLMTDPVRLPSGTVMDRSIIKRHLLNSPTDPFNRQMLTEDMLEPVPELKEQIEAWMRSKQKSDH,2.198823,"F4T, L7E, K10S, E13S, I23V, L59K, S78D, Q91E, E96S, S99K",10
MEKFKLLAEKIEEIVAKNARAEIIYSDVPDEFRDPIMDELMTDPVRLPSGTVMDRSNIERHLLNSPTDPFNRQMLTESMLEPVPEIKERIQAWMREKQSSDH,0.85934985,"I1M, V11I, D24I, A28V, L36I, T39E, I57N, L59E, L86I, Q89R",10
IEKFKLLAEKVEEIVAKRAAAEIDSSDAPDEFRDPLMDTIMTDPVRLPSGTVMDRSIILRHLLNSPTDPFNRQPLTESMLEPVPELKEQIQQWKRDKASRDH,1.534018,"N18R, R20A, Y25S, L40I, M74P, A92Q, M94K, E96D, Q98A, S100R",10
IEKFKLLIQDVQEIVAKNARADIDPSDAPDEFRDPLMDTLMTDPVRLPSGTVMDRSIIKRHLLNSPTDPFNRQMLTESMLEPVPELKEQIDAWMEEKSSSDH,0.6264219,"A8I, E9Q, K10D, E12Q, E22D, Y25P, L59K, Q91D, R95E, Q98S",10
IEKFKLLAEKMEEIVAKNATAEIDYSDAPDEFRDPLMDTIMTDPVRLPSGTVMDRSIILKHLLNSPTDPFNRTMLTESMLEPEPELKEQIQEWCQSKQSSDH,-0.5561806,"V11M, R20T, L40I, R60K, Q73T, V83E, A92E, M94C, R95Q, E96S",10
IEKFKLLAKKVEEIVAKDARAEFDYSDVPDEFRDPLMDTLMTDPVRLPSGTVMDRSLIVRHLATSPTDPFNRQMLTESMLEPVPELKEQIQAWMREKPSSDA,0.15317944,"E9K, N18D, I23F, A28V, I57L, L59V, L63A, N64T, Q98P, H102A",10
IEDFKLLAEKTEEVVAENARAEIDLSMAPDEFRDPLMDSLMQDPVRLPSGTVMDRSIILRHLLRSPTDPFNRQMLTESMLEPVPDLKEQIQAWMREKQSSDH,-0.8390335,"K3D, V11T, I14V, K17E, Y25L, D27M, T39S, T42Q, N64R, E85D",10
IENFKLLAEKVAEIVAKNGRAEIDYSDAPDEFRDPLLHTLMTDPVRLPSGTVMDRSIILQHLRNSPTDPFNRQMLTESKLEPVEELKEQIQAWVREKQSSDH,-1.5830038,"K3N, E12A, A19G, M37L, D38H, R60Q, L63R, M79K, P84E, M94V",10
IEKFKLLAAKAEEVVAKNKRAEIDYSDAPDEFRDPLMDTLMTDPVKLPSGHVMDRSIILRHLLNSPTDPFNRQMLTESMLEPVPELKDQIQAWMMEKQSLNH,-0.25427046,"E9A, V11A, I14V, A19K, R46K, T51H, E88D, R95M, S100L, D101N",10
IEKYKLLKEHVDEIVAKNAAAEIDYSDAPDEFRDPLMDQLMTDPVRLPSGTVMDRSIILKHLLNSPTDPFNRQMLTESGLEPVPELKEQIQAWMRQKESSDH,-0.07338297,"F4Y, A8K, K10H, E12D, R20A, T39Q, R60K, M79G, E96Q, Q98E",10
IEKSKLLAEKVEEIVAKAARPEINYSDAPDEFLDPLMNTLMTDPVRLPSGTVMDRSIILRHLLTSPTDPFNRQMLTESMLEPAPELKERIQAWMKEKQSSDH,-2.8213978,"F4S, N18A, A21P, D24N, R33L, D38N, N64T, V83A, Q89R, R95K",10
IEKFKLLAEKVAEIVAKNARAELDYSDAPDEFRDPLMQTLMTDPVRLPSGTVMDRTIILRHLQFSPTDPFNRQPLTESMLEPVRELKRQIQAWMREKQSSTH,-0.34305623,"E12A, I23L, D38Q, S56T, L63Q, N64F, M74P, P84R, E88R, D101T",10
IEKFKALAEKVDEIFAKNARAEIDLGDAPDAFRDPLMDTLMTDPVRLPSGTVMERAIIERHLLNSPTDPFNRQMLTESMLEPVPELKEQIQAWMREKQSSDA,0.302243,"L6A, E12D, V15F, Y25L, S26G, E31A, D54E, S56A, L59E, H102A",10
IEKFKLLAEKVHELSAKNARAETDYSDAPDEFLDPLMDTLMTDPVRLPSGTVMDRSIILRHLQNSPTDPFNRQELTLSMLEPVPELKEQIQAWLREKQRSDH,-0.22633883,"E12H, I14L, V15S, I23T, R33L, L63Q, M74E, E77L, M94L, S99R",10
IEKFKELAEKVEEIVARNSRAEIDLSDAPDEFRDPLMDTLMTDPVRLPSGTVMDRSIILRHLMNSPTDPFNRQMLTEKMLEPVPEMKEQIQRWCREKQASDH,0.84697753,"L6E, K17R, A19S, Y25L, L63M, S78K, L86M, A92R, M94C, S99A",10
MEKFKALGEKVEEIVAKNARAEEDYTDPPDEFRDPLMDTLMTDPVRLPSGTVMDRSNILRHLLTSPTDPFNRQPLTESMLEPVPELKEQIQAWLREKQSSDH,-0.52218974,"I1M, L6A, A8G, I23E, S26T, A28P, I57N, N64T, M74P, M94L",10
PEKAKLLAEKVEEIAAKNAEANIDYSDAPDEFRDPLMDTLMTDPVRLPSGKVMDRSIILRHLRNSPTDPFNRQPLTESLLEPVPELKEQIQAWMREKISSDH,-0.2397978,"I1P, F4A, V15A, R20E, E22N, T51K, L63R, M74P, M79L, Q98I",10
EEKFKLLAEKVEEIVAKNAREEIDLSDAPDEFRDPLMDTLMVDPVRLPSGTVMDRSIILKHLLNSPTDPFNRLPLTESMLRPDPELKEQIQAWMREKQSSDL,0.17883259,"I1E, A21E, Y25L, T42V, R60K, Q73L, M74P, E81R, V83D, H102L",10
MEKFKLLAEKVEEIVANNQRAEIDYSDAPDEFRDPLMQTLMTDPVRLPSGKVMDRSVILRHLLSSPTDPFNRQMLTEDMLDPLPELKEQIQAWMREKQSSDH,-0.32515308,"I1M, K17N, A19Q, D38Q, T51K, I57V, N64S, S78D, E81D, V83L",10
IEKFKLLAEKVEKIVAKHARAEIDISDAPDEFRDPLMDTLMEDPVRLPSGTVMDRTIILRHLLNSPTDPFNRQPLTEEMLEPVSELKEQIHAWMRNKQSSDH,-1.8393986,"E13K, N18H, Y25I, T42E, S56T, M74P, S78E, P84S, Q91H, E96N",10
IEEFKLLAEKVSEIVEKNARAEMDLSDAPEEFRDPLMDTLMTDPVRLPSGTVMDRSIILRHLLNSPTDPFNRQMLTEDMLEPVPELKEQIQNWMREKASSDT,2.0417194,"K3E, E12S, A16E, I23M, Y25L, D30E, S78D, A92N, Q98A, H102T",10
IEKFKLLAEKVEEIVKANARAEIDYSDAPEEFLDPLMDCLMIDPVRLPSGTVMDRSIILRHLLNSPTDPFNRHPLTESMLEPVPELKEQIQVWMREQQSSDH,-0.9317242,"A16K, K17A, D30E, R33L, T39C, T42I, Q73H, M74P, A92V, K97Q",10
IEKFKLLVEKAEEIVANNAEASIDYSDAPEEFRDPVMDTLMTDPVRLPSGTIMDRSIILRHLLNSPTDPFNRQMLTEDMLEPVPELKEQIQAWMREKQSSDQ,2.053077,"A8V, V11A, K17N, R20E, E22S, D30E, L36V, V52I, S78D, H102Q",10
IEKHKLLAEKVEELVSGNARAEISYSDAPDEFRDPLMDTLMTDPVRLPSGTIMDRDIILRHLLNSPTDPFNRTMLTESMLEPVPNLKTQIQAWMREKQSSDH,-0.3370465,"F4H, I14L, A16S, K17G, D24S, V52I, S56D, Q73T, E85N, E88T",10
KEKFKLLADKVEEIVAKLARAELDYSDAPDDFRDPLMDTLMTDPVRLPSGTVMERSIILRHLLNSPTDPFNRQMLTESMLQPVKELKEQIQSWMEEKQSSDH,-0.46816567,"I1K, E9D, N18L, I23L, E31D, D54E, E81Q, P84K, A92S, R95E",10
VEKFKLLAEAVEEIVARNARAEIDLSDAPDEFRDPLMDQLMTDPVRLPSGTVMDRDHILRHLLNSPTDPFNRQMLTESMLEPVPELKEQIQAWKRSKQSSCH,-1.166358,"I1V, K10A, K17R, Y25L, T39Q, S56D, I57H, M94K, E96S, D101C",10
IEKFKLLAEKVEEIVAKEARAELDYSDAPEEFRDPLTHTLMTDPVRLPSGIVMDRSIILRHLLNSPTDPFNRQMLTESMLEPIPELKAQIQAWMQEKQSSTH,-1.2290583,"N18E, I23L, D30E, M37T, D38H, T51I, V83I, E88A, R95Q, D101T",10
IEELKLLAESVEEINAKNARAEIDYSDAPDEFRDPLMDRLMTDPVRLPSGKVMDRSIILRHLRNSPTDPFNRQMLTESMIEPVPELKEQIQAWMREKQTQDH,-0.3727556,"K3E, F4L, K10S, V15N, T39R, T51K, L63R, L80I, S99T, S100Q",10
IEKFKLEAEKVEEIVNKNARAEIDISDAPDEFRDPLMDTLMTDPVRTPSGTVMDRSIILNHLRFSPTDPFNRQRLTESELEPVPELKEQIQAWMREKQRSDH,0.35768914,"L7E, A16N, Y25I, L47T, R60N, L63R, N64F, M74R, M79E, S99R",10
MSKFKRLAEKVEEIVAKNARAEIDYSDAPEEFRDPIMDALMHDPVRLPSGTVMDRSSILRHLRNSPTDPFNRQMLTESMLEPVPELKEQIQAWMREKQQSDH,0.59965324,"I1M, E2S, L6R, D30E, L36I, T39A, T42H, I57S, L63R, S99Q",10
IEKFKLLAEKVEEIVKKNAQAEIDLSDAPDEFLDPLMDTIMTDPVRTPSGTVMDRSIIMKHLLNDPTDPFNRQMLTESMLEPVKELKEQIQAWMREKQSSDH,1.5666312,"A16K, R20Q, Y25L, R33L, L40I, L47T, L59M, R60K, S65D, P84K",10
IEKFKELAEKVEKIVAKKARVDIDYSDAPEEFRDPIMNTLMTDPVRLPSGTVMDRSIILRHLLNSPTDPFNRQMLTESMLEPVPELKEQIEAWMREKQSHDH,0.75125796,"L6E, E13K, N18K, A21V, E22D, D30E, L36I, D38N, Q91E, S100H",10
IEKAKLLASKVEEIVEKNARAEIDISDAPDEFRDPLMCSLMTDPVRLPSGTVMDRSIILRHLLNSPTDPFNRSMLTESMLEPVPELKQQIQAWMKEKKSSDH,-1.9622893,"F4A, E9S, A16E, Y25I, D38C, T39S, Q73S, E88Q, R95K, Q98K",10
IAKFRLLAEKVEEIVEKNARAEIDYSDAPDEFVDPLMDTLMTDPVRLPSGTVMDRSIILKHLLNSNTDPFNRQPLTENMVEPVPELKEQIQAWMREKRSSDH,-2.1578636,"E2A, K5R, A16E, R33V, R60K, P66N, M74P, S78N, L80V, Q98R",10
IEKFKLLAEKVDEIVGKNARAEVDLSDAPDEFRDPLMDCLMKDPVKLPSGKLMDRSIILRHLLNSPTDPFNRQMLTESMLEPVPELKEQIQAWMREKQSSDE,-1.3240125,"E12D, A16G, I23V, Y25L, T39C, T42K, R46K, T51K, V52L, H102E",10
