Sequence,Score,Mutations,Number of Mutations
MNIFIKNLHPDIDNKALYDTFSVCGEIISSEIALDKNGKPKGFGFVHFEEEGKAKEAIDALNGVLLNGQEIYVAP,-0.17032847,"G1M, F24C, D26E, L28I, K31E, T34L, E36K, S40P, A53K, M64V",10
MKIFIKNLHYDIDNKAIYDTFSVFGDILSSKFAKDQNGKSKGFAFVHFEEEGAAKEAIDALNNMLLDGQEIYVAP,-0.8983871,"G1M, N2K, P10Y, L17I, I32F, T34K, E36Q, G44A, G63N, N67D",10
MNIFIKNLHPDIDNKALYDLFSVFGDVLSSRIATDNNGKSKGFGFVHFEEEGAAKTAIDALNGMPLAGQVIRVAP,4.473857,"G1M, T20L, I27V, K31R, E36N, E56T, L65P, N67A, E70V, Y72R",10
MNIFIKNLDAHIDNKALMDCFSIFGDILSSKLATDENGKSKGFGFVHFREEGAAKEAIDAMNGMLLNGQEIYVAP,5.5530944,"G1M, H9D, P10A, D11H, Y18M, T20C, V23I, I32L, E49R, L61M",10
MNIFVGNLHPSIDNKALYDTFSVFGDILSSKIAQDENGKSKGFGFVHFEDEGGAMEAIDALNGMLLNGREIKVAP,3.854424,"G1M, I5V, K6G, D11S, T34Q, E50D, A53G, K55M, Q69R, Y72K",10
MNIFIGNLHPDIDNKALYDTFSVFGDILHSKIATDENGKSKGFGFVHFAEPESAKKAIDALNGMLLDGSEIYVAP,2.1057792,"G1M, K6G, S29H, E49A, E51P, G52E, A53S, E56K, N67D, Q69S",10
MNIFIKNLHPDVDNKALYDIFSKFGDILSSKIKTDENGRSKGFGFVHFEEEGAAKEAINALNGVQLNGQEIVVAP,3.6564379,"G1M, I12V, T20I, V23K, A33K, K39R, D59N, M64V, L65Q, Y72V",10
MNIFIGNLHPDITNDALYDTFSVFGPILSSKIATDENGKSKGFGFVHFSEEGAVKEAIDALDGMLMNGQEIYVSP,1.491558,"G1M, K6G, D13T, K15D, D26P, E49S, A54V, N62D, L66M, A74S",10
MNIFIKNLHPDISNKALYDTFSVFGDILSSKIATDENGKSKGYGFVAFESEGSAKEAIDALSGFLLNDQEIYVAK,3.9353232,"G1M, D13S, F43Y, H47A, E50S, A53S, N62S, M64F, G68D, P75K",10
MNIFIKNLHNNIDEKALHDIFSQFGDILSSKIATDENGKSKGFGFVHFEEPGAAKQAIDALNGMLLNGQEIYVAA,3.8380036,"G1M, P10N, D11N, N14E, Y18H, T20I, V23Q, E51P, E56Q, P75A",10
MNLFIKNLHPDIDEDALYDTFSVFGDILSSKIAIDENGKSKGFGFVDFEREGAAKEAIDAMNGHLLNGREIYVAP,0.51090884,"G1M, I3L, N14E, K15D, T34I, H47D, E50R, L61M, M64H, Q69R",10
MNIFISNLHPEIDNKALYDTFSVFGDIESSKILIDEEGKSKGFGFVHFEEEDAAKEAIDALNGMLLNGQEVYVAK,1.9218035,"G1M, K6S, D11E, L28E, A33L, T34I, N37E, G52D, I71V, P75K",10
MNIFIKNLHPNIDEKRLIDTFSVFGDILSSKIATDDNGKSKGFGFVHFEEEGSAKEAIDALNNMLLNGQEISVFP,1.7395785,"G1M, D11N, N14E, A16R, Y18I, E36D, A53S, G63N, Y72S, A74F",10
MKIFIKNLPPDIDNKVLYDTFSKFGDIESSKIATTENGVSKGFGFVHFEEEGAAKKAIDALNGMLLNGQEIKVAP,0.46069717,"G1M, N2K, H9P, A16V, V23K, L28E, D35T, K39V, E56K, Y72K",10
MKIFAKNLPPDIDNKLLVDTFTVFGDILSSKIATNENGKSKGFGFVHFEEEGAAKEAINALNGMLLNGQKIYVAP,1.4830421,"G1M, N2K, I5A, H9P, A16L, Y18V, S22T, D35N, D59N, E70K",10
MNIFIKNLHPDIDEKELYDTFSVFGDILSAKIATDENGKSKGFAFVGFEDEGAAREAIDNLNGMLLNGQEIVVAP,1.4310596,"G1M, N14E, A16E, S30A, G44A, H47G, E50D, K55R, A60N, Y72V",10
MNIFIKNLHPDVDNKALYDAFSGFGDILSSKIAMDEKGKSKGFVFVHFEEEGAAHEAIDALNGMLLCGQEIYVGP,1.6701537,"G1M, I12V, T20A, V23G, T34M, N37K, G44V, K55H, N67C, A74G",10
MNIFIKNLHPDIDNHDLYDTFSGFGDITSSKIATDENGKSKGFAFVHFEVEGAAKAAIDALNGSKLNGQEIYVAP,2.9704034,"G1M, K15H, A16D, V23G, L28T, G44A, E50V, E56A, M64S, L65K",10
MNIFIKNLHPDIDDKALYDTFSVFGDILSVKIPIDENGKIKGFGFVHFAEEGSAKEAIDALNGMLLNGVEIYVKP,4.2472878,"G1M, N14D, S30V, A33P, T34I, S40I, E49A, A53S, Q69V, A74K",10
MNIFIKNLHIDIDNRALRDTFSVFGDISYSKIATDENGKSKGFGFVHFEESGTAKEAIDALNGKLLNGVEIYVAP,2.1102822,"G1M, P10I, K15R, Y18R, L28S, S29Y, E51S, A53T, M64K, Q69V",10
MNIFIKNLHPDISNKALYDTFSVFGDILDSKIAPDENGKSKGFGFVHFENEGAAFQAIDALNGMLINGIEIIVAP,2.1962895,"G1M, D13S, S29D, T34P, E50N, K55F, E56Q, L66I, Q69I, Y72I",10
MNIFVKNLPPDTDNKSLYDHFSVFGDILSSKIATDENGKAKGFGFVHFEEEGSAKEAIDALNGMALNGQEIYVTP,3.4213943,"G1M, I5V, H9P, I12T, A16S, T20H, S40A, A53S, L65A, A74T",10
MNIFIKNLHPDIDNKALYDLFSRVGGIKSSKPATDNNGKSKGFGFVHFEEEGAAKEAIDALNGMLLQGQEILVAP,-0.3780648,"G1M, T20L, V23R, F24V, D26G, L28K, I32P, E36N, N67Q, Y72L",10
MNIFISNLSPDTDNKFLYQTFSVFGDILVSKIATDENGKSKGFGFVHFEEEGDAKDAILALNGMLLNGQEIYVAP,0.91961443,"G1M, K6S, H9S, I12T, A16F, D19Q, S29V, A53D, E56D, D59L",10
MVVFIKNLHPDIDNKALYDTFSVFGDILESKIATDENGKSKGFGFVSFTEEGAAQEAKDALNGMLLNGQEIRVKP,-1.8056381,"G1M, N2V, I3V, S29E, H47S, E49T, K55Q, I58K, Y72R, A74K",10
MNIFIKNLHPDIDNKMLYDTFKVFGDILSVKLAVDEEGRSKGFGFVHFEEVGAAKEAIDALNGMLFNGQEIYVAP,5.1964703,"G1M, A16M, S22K, S30V, I32L, T34V, N37E, K39R, E51V, L66F",10
MGIFIKNLHPDIDNKTLQDTFSVFGDILSSKIATDEEGKSKGFGFVHFTEHGAAKEAIDALNGKTLNGVEIYVAP,4.0652256,"G1M, N2G, A16T, Y18Q, N37E, E49T, E51H, M64K, L65T, Q69V",10
KNIFIKNLHPDIDNKDLEDTFSVFGDIVSSKIITDEFGKSKGFGFVEFEEEGAAKEAISALNGMLVNGREIYVAP,1.2459865,"G1K, A16D, Y18E, L28V, A33I, N37F, H47E, D59S, L66V, Q69R",10
MNISVTNLHPDIDNDALYDFFSVFGDILSSKIITDENGKSKGFGFVHFEEEGAAKRAIDALNGHLLNGQEIKVAP,-4.182873,"G1M, F4S, I5V, K6T, K15D, T20F, A33I, E56R, M64H, Y72K",10
MNIFCKNLHPDIDNKALYDTFSVFGDISSSKIALDENGRQKGFGFVHFEEEGAAKEAIDAFNGMTLEGQELYVAP,4.837964,"G1M, I5C, L28S, T34L, K39R, S40Q, L61F, L65T, N67E, I71L",10
MNIFIKNLHTDIDNKALMDEFSVFGDIASSKIYTDENGKSKGFGFIHFEEEGAAKDAIDALNGDLLNGREIYVAP,1.7852371,"G1M, P10T, Y18M, T20E, L28A, A33Y, V46I, E56D, M64D, Q69R",10
MNIFIQNLHPDMDNKALYDTFSVFGDILSVKILTDRNGKSKGFGFVHFEEEIAAKEAIDALNGMLLNGMRIYLAP,-0.47591233,"G1M, K6Q, I12M, S30V, A33L, E36R, G52I, Q69M, E70R, V73L",10
MVIFIKNLHPDIDPKALYDTFNRFGDVLSSEIATDENGKSKGFGFVHFEIEGAAKEAIDALNGMLLNGQEIYVCG,-1.7729917,"G1M, N2V, N14P, S22N, V23R, I27V, K31E, E50I, A74C, P75G",10
MNIFIENLNPDIDNKALKDTFSVFGDILSSKIATDKNGKSKGFAFVHFENEGAAKEAIDTLNGMLLNGKEIYVAY,2.6093755,"G1M, K6E, H9N, Y18K, E36K, G44A, E50N, A60T, Q69K, P75Y",10
MNLFIKNLHPDIDHKALYDTFKVFGDILSARIATDENGKSKGFGFVEFEEEGAAKEAITSLNGMLFNGQEIYVAP,1.855144,"G1M, I3L, N14H, S22K, S30A, K31R, H47E, D59T, A60S, L66F",10
MNIFIKNLHPDIDDKALYDTFSVFGTILSSKIATDENGKSKGFGFVNFEEEGAVKRAIDALNGMLLNGQPVYVKD,1.5767951,"G1M, N14D, D26T, H47N, A54V, E56R, E70P, I71V, A74K, P75D",10
MNIFIGNLDPDIDNKALYKTFSVFGDVLSVKLATDNNGKSKGFGFVNFEEEGAAKEAIDALNGTLLNGQEIYVAP,2.3382406,"G1M, K6G, H9D, D19K, I27V, S30V, I32L, E36N, H47N, M64T",10
MNIYIKNLHPDIDNKALYDTFSVFGKITSARIATDENGISKGFAFVHFKEEGAAKEAIDALNGMLLNGQEIYVKP,3.628273,"G1M, F4Y, D26K, L28T, S30A, K31R, K39I, G44A, E49K, A74K",10
MNIFIHNLPPDWSNKDLYDTFSVFGDILSSKIATDENGKSKGFGFVEFEEETAAKEAIDALNGMLLNGLEIYVIP,-0.78763616,"G1M, K6H, H9P, I12W, D13S, A16D, H47E, G52T, Q69L, A74I",10
MNIFIGNLPKDIDEKALYETFSVFGQILSSEIATDENGKPKGFGFVHFEKEGAAKEAIDALNGMLLNGQEIYVAP,-0.23814428,"G1M, K6G, H9P, P10K, N14E, D19E, D26Q, K31E, S40P, E50K",10
MNIFIKNLSPRVDNKALYDTFSKFGDILESKIAFDENGKSKGFGFVHFEEAGAAKEAIDALNGMLLNGQEVYVEP,2.4041772,"G1M, H9S, D11R, I12V, V23K, S29E, T34F, E51A, I71V, A74E",10
MKIFIKNLHPEIKNKALYDTFSVFGDILSSKIATDSHGKSKGFGFVHFEEEGAAKEAIDALNGILYNGRELYVAP,1.9098709,"G1M, N2K, D11E, D13K, E36S, N37H, M64I, L66Y, Q69R, I71L",10
MNIFIKNLHPDIDNKKIYDTFSNFGDILSSRIATDENGESKGFGFVEFAEEGAAKEALDALNGMELNGQEIYVAP,0.8833315,"G1M, A16K, L17I, V23N, K31R, K39E, H47E, E49A, I58L, L65E",10
MNLFIQNLHPDIDNKALYDTFSVFGDIKKAKIAEDENGKSKGFGFVHFEDEGAADSAIDALNGMLLNGQEIYVAP,0.43398753,"G1M, I3L, K6Q, L28K, S29K, S30A, T34E, E50D, K55D, E56S",10
MNIFIKNLPPDIDNKRLYDIFSKFGFILSSRIATDENKKSKGFGFVHFEKEEAAKEAIDALNGMLLNGQEIYVAP,5.027348,"G1M, H9P, A16R, T20I, V23K, D26F, K31R, G38K, E50K, G52E",10
MNIFISNLHPDIDNKALYDTFSVFGDILESKIAYDENGKSKGFGFIHFSEEGHAKEAIDALNGMLLKGQKIYVAK,1.9886156,"G1M, K6S, S29E, T34Y, V46I, E49S, A53H, N67K, E70K, P75K",10
MNLFIKNLHPEIDYKALYDTFSVFGDIQSSKIATDENGKSKGFGFVEFEEEGAAKEAIDTLNGKLLNGQEIRVKP,0.76912916,"G1M, I3L, D11E, N14Y, L28Q, H47E, A60T, M64K, Y72R, A74K",10
MRIFIKNLHDDIDNDALYDTFSVFGDILSIKIATDKNGKSKGFGFVEFEKEGAAKEAINALNGMLLNGQEIYVAE,-2.6069574,"G1M, N2R, P10D, K15D, S30I, E36K, H47E, E50K, D59N, P75E",10
MNIFIKNLHPDIDEKALYDTFSQYGDILSSKIATDTQGKSKGFGFVEFEEPGAAKEACDALNGMPLNGQEIYVAP,1.6656252,"G1M, N14E, V23Q, F24Y, E36T, N37Q, H47E, E51P, I58C, L65P",10
MNIFIKNLYPDTDNKKLRDTFSVFGDISSSKIATDENGKSKGFGFVHFEYEGAAKEAIDAMNGMELNGQEVYVAP,1.9906211,"G1M, H9Y, I12T, A16K, Y18R, L28S, E50Y, L61M, L65E, I71V",10
MNLFLKNLHPDIDDKALLDTFSVFGDILSSKIATDENGKSKGFGFVHFEEEGAAREAIEALNGALLNGQEIHVAM,4.5645485,"G1M, I3L, I5L, N14D, Y18L, K55R, D59E, M64A, Y72H, P75M",10
MRIFVKNLHPDIDNKALEEVFSVFGDIKSSKIAMDENGKSKGFGFVHFESEGAAKEAIDALNGMLLNGQQIYVAP,2.3100233,"G1M, N2R, I5V, Y18E, D19E, T20V, L28K, T34M, E50S, E70Q",10
MNLFIKNLHPDIDEKALYDTFSRFGDILSVKIPTDENGKSKGFGFVEFFEEGAAKEAIDALNGRLLNGQEIYVAY,-0.45093054,"G1M, I3L, N14E, V23R, S30V, A33P, H47E, E49F, M64R, P75Y",10
MNIFIKNLHPSITNKKLYDTFSVFGDILSSKIATDENGKSKGFAFVHFAEEVYAKEAISAYNGMLLNGQEIYVAP,4.239462,"G1M, D11S, D13T, A16K, G44A, E49A, G52V, A53Y, D59S, L61Y",10
MNIFIKNLAPDIDNQALYDTFSVFGDILVVKIHTDENGKSKGFGFVEFCEEGAAKEAIDALNGMTLNGQEIYVRP,-0.74416786,"G1M, H9A, K15Q, S29V, S30V, A33H, H47E, E49C, L65T, A74R",10
MNIFVKNLHADIDNKLLYDTFSVFGDILESKIATDPNGKSKGFGFVHFETEGAAKEAIQALNGMELNGREIYVAP,3.6205387,"G1M, I5V, P10A, A16L, S29E, E36P, E50T, D59Q, L65E, Q69R",10
MNIYIKNLHPDIDNKALYDTFSVFGDIISSKIATDKNGKSKGYGFVQYEEEGSAKEAIDELNGMLLNGQKIYVAP,5.2326555,"G1M, F4Y, L28I, E36K, F43Y, H47Q, F48Y, A53S, A60E, E70K",10
MKIFVKNLHPDIDNKALYQTFSVFGEIDSCKIATDENGMSKGFAFVHFEEEGAAKEAIDALNGMLLNGQEIYVAK,1.995059,"G1M, N2K, I5V, D19Q, D26E, L28D, S30C, K39M, G44A, P75K",10
MNIFIKNLHPDIDNKALYDTFSVFGDILESKILTDENGKSKGFGFVEFTEEDAAKEAIDALNGMLFNKQEILVKP,-1.0494636,"G1M, S29E, A33L, H47E, E49T, G52D, L66F, G68K, Y72L, A74K",10
MNIFIKNLHYDIDNEALRDTFSVFGDILSAIILYDENGKTKGFGFVHFEELGAAKEAIDALNGMLLNGQEIYVAP,1.1387805,"G1M, P10Y, K15E, Y18R, S30A, K31I, A33L, T34Y, S40T, E51L",10
MNIFVKNLHPDIDNKALYDLFSVFGDIVSAKITTDENGKSKGFGFVHFEEERAAKEAIDALNGKTLNGQRIYVAP,3.3233266,"G1M, I5V, T20L, L28V, S30A, A33T, G52R, M64K, L65T, E70R",10
MNIFIKNLHPDIDNKALYDQFSVFGDVLSSKIAYDENGKSKGFAFVHFEEEGAAREAIDALNGKLLNGQEMSVAQ,3.8385162,"G1M, T20Q, I27V, T34Y, G44A, K55R, M64K, I71M, Y72S, P75Q",10
MNIFIKNLDPDITNEALYETFSYFGDILSAKIAVDENGKSKGFGFVHFEEEEAAKEAIDALNGMLLNGQRIYVAP,3.9915938,"G1M, H9D, D13T, K15E, D19E, V23Y, S30A, T34V, G52E, E70R",10
MNIFIKNLHWDIDNKFMYDTFSVFGDILSSDIAKDEDGKSKGFGFVHFEEEEKAKEAIDALNGMLLNGQEIWVAP,0.86810124,"G1M, P10W, A16F, L17M, K31D, T34K, N37D, G52E, A53K, Y72W",10
MNVFIKNLPEDIDEKALYDTFSVFGDILSSKIATDENGLSKGFGFVHFMEEGAAKEAIDALNGMLLNGCELYVAQ,5.005131,"G1M, I3V, H9P, P10E, N14E, K39L, E49M, Q69C, I71L, P75Q",10
MNIFIKNLPPGIDNAALYDFFKVFGDILSSKIATDENGISKGFGFVHFEEEEAAKEAIDKLNGMLLNGQKIYVAP,3.8112195,"G1M, H9P, D11G, K15A, T20F, S22K, K39I, G52E, A60K, E70K",10
MNIFIKNLHMSIDNKKLYDTFSVFGDILPSKFATDENGKSKGFGFVHFEEEGAAKEAIDALDGMVLNGQEIYVHL,-2.1849425,"G1M, P10M, D11S, A16K, S29P, I32F, N62D, L65V, A74H, P75L",10
MNIFIKNLHPDIDEQGLYDKFSVFGDILSSKIMTDEEGKSKGFGFVHFETEEAAKEAIDALNGMLLNGQRIYVAP,2.532076,"G1M, N14E, K15Q, A16G, T20K, A33M, N37E, E50T, G52E, E70R",10
MNIFIKNLHEKISNKALYKTFSVFGEILSSRLATDENGKSKGFGFVHFEEEEAAKEAIDALNGMLLDGQEIYVAP,5.8479333,"G1M, P10E, D11K, D13S, D19K, D26E, K31R, I32L, G52E, N67D",10
MNIFVGNLHPDIDAKLLYDTFSVFGDILSSKIATDYNGRSKGFGFVNFEEEAAAKEAIDALNGMLLFGQEIYVAP,2.2644615,"G1M, I5V, K6G, N14A, A16L, E36Y, K39R, H47N, G52A, N67F",10
MVLFIKNLHPDIDNKALYDTFSVCGDILESKIATDENGKSKGYGFVSFEEKGAAKEAIDALNGMELNGQEIKVAP,-3.0390291,"G1M, N2V, I3L, F24C, S29E, F43Y, H47S, E51K, L65E, Y72K",10
MNIFISNLHPNIENKALYDTFSVFGDILSSKIATDENGKSKGYAFVHFEEEGAAQEAIDKLNGSLLNGREIYVAP,2.6450362,"G1M, K6S, D11N, D13E, F43Y, G44A, K55Q, A60K, M64S, Q69R",10
MNIFIKNLHPDVDNKALYATFSVFGPIASSRIRHDENGKSKGFGFVHFEEEGDAKEAIDALNGMLLNGQELYVAP,3.9226308,"G1M, I12V, D19A, D26P, L28A, K31R, A33R, T34H, A53D, I71L",10
MNIFIKNLPKTIDNKALYDTFSVFGKILSSKIADDENGKSKGFGFVHFEEEGEAKEAIDALNGMQLNGKELYVAP,5.8899174,"G1M, H9P, P10K, D11T, D26K, T34D, A53E, L65Q, Q69K, I71L",10
MNIFIKNLQPYIDNKALYDTFKVFGNILRSKIATDENGKSKGFGFVEFEEEGAAKEAIDALNGMKLHGREIYVAP,1.1385156,"G1M, H9Q, D11Y, S22K, D26N, S29R, H47E, L65K, N67H, Q69R",10
MNIFIKNLPPDIDNKALYTTFSNYGDILSSKIMTDENGKSKGFGFVHFIEPGAAKEAIRALNGMLLNGKEIYVAP,5.202777,"G1M, H9P, D19T, V23N, F24Y, A33M, E49I, E51P, D59R, Q69K",10
MNIFIKNLHPEVDNKALYDTFSVFGDIDSSKIETDENGKSKGFAFVEFEEEGAAKAAIDALNGMLLNGQDIYVAG,2.0371194,"G1M, D11E, I12V, L28D, A33E, G44A, H47E, E56A, E70D, P75G",10
MNIFIKNLHPNIDNKELYDTFSVHGIIHSSKIANDENGKSKGVGFVHFREEGAAKEAIDNLNGMLLNGQEIYVAP,1.1583629,"G1M, D11N, A16E, F24H, D26I, L28H, T34N, F43V, E49R, A60N",10
MNVFIKNLSPDADEKALSDTFSVFGDILSSKIMTDENGKSKGFGFVEFEEEGAAKEAIDDLNGMLVNGQEIYVAP,-0.7782946,"G1M, I3V, H9S, I12A, N14E, Y18S, A33M, H47E, A60D, L66V",10
MNIFIKNLHPDITNKKLYDTFSVFGDIVSAKLATDENGKSKGFGFVHFEEEGAAKRAIDSLNRMLLNMQEIYVAP,3.2062802,"G1M, D13T, A16K, L28V, S30A, I32L, E56R, A60S, G63R, G68M",10
MNIFIKNLHWSIDNKALKDVFSVFGDILSSKIYTDKNGKSKGFGFVHFEEEGAAKAAIDALNGMLLNGQELYVLP,1.7499995,"G1M, P10W, D11S, Y18K, T20V, A33Y, E36K, E56A, I71L, A74L",10
MNLFIKNLPPDTDNKALYDLFSVFGDIKSSKIATDENGKSKGFGFVEFETEGGAKEAIGALNGMLLNGQEIYVAP,1.3973701,"G1M, I3L, H9P, I12T, T20L, L28K, H47E, E50T, A53G, D59G",10
MNIFIKNLHPDIDNKALLDQFSNFGDILSVKIATDEEGKSKGFGFVHFDEEGAAKEAIDALNGALLNNKEIYVAP,4.294604,"G1M, Y18L, T20Q, V23N, S30V, N37E, E49D, M64A, G68N, Q69K",10
MNIFIKNLHPDIDNKALYDTFRAFGDILSSKISTDENGKPKGFGFVDFEEEGQAKEAIDSLNGMLLNGRTIYVAP,3.3978164,"G1M, S22R, V23A, A33S, S40P, H47D, A53Q, A60S, Q69R, E70T",10
MNVFIKNLHPEIDDKALYDTFSVFGDVLSSKIATDENGASKGFAFVHFYEEGGAKEAIDALNGMLLNGQEIYVIP,3.567802,"G1M, I3V, D11E, N14D, I27V, K39A, G44A, E49Y, A53G, A74I",10
MNIFAKNLHPDTDNKALYDTFSVFGEILAAKIATDENGASKGFGFVHFEEEGSAKEAIDALNGMLLNGQEIDVAV,-0.42870116,"G1M, I5A, I12T, D26E, S29A, S30A, K39A, A53S, Y72D, P75V",10
MNIFIGNLHPWIDEKALRDTFSKFGDILSAKIATDENGKSKGFGFVHYEEEGAAKEAIDALNGMLLEGTEIYVAP,2.5732586,"G1M, K6G, D11W, N14E, Y18R, V23K, S30A, F48Y, N67E, Q69T",10
MNIFIKNLHPDIDNKILYDTFSVFGAIESSKIATDENGKSKGFGFVHMEEEGAAQEAIDQLNGMELHGQEISVAP,1.5778515,"G1M, A16I, D26A, L28E, F48M, K55Q, A60Q, L65E, N67H, Y72S",10
MTIFIGNLSPDIDAKALYDTFSPFGDIHSSKIATDENGKSKGFGFVEFEEETAAKEAIDALNGMLLGGQEIYVAP,-3.4717884,"G1M, N2T, K6G, H9S, N14A, V23P, L28H, H47E, G52T, N67G",10
MNIFIKNLHPDITNKALYSAFYVFGDILSSSIATDEQGKSKGFGFVHFEEEKKAKAAIDALNGMLLNGQEIYVAP,3.5758953,"G1M, D13T, D19S, T20A, S22Y, K31S, N37Q, G52K, A53K, E56A",10
MNIFIKNLHPDIDNKALYDTFSKFGEILSSKIITDENGKSKGFGFAHFEDLGNAKEAIKALNGMLLNGQEIYVAL,4.570966,"G1M, V23K, D26E, A33I, V46A, E50D, E51L, A53N, D59K, P75L",10
MNIFIKNLHPDIDNKMLFDTFSVFGDILSSKVAVDRNGKSIGFGFVKFAEEGAAKEAVDALNGMLLNGQEIYVAP,2.4717379,"G1M, A16M, Y18F, I32V, T34V, E36R, K41I, H47K, E49A, I58V",10
MNIFIKNLHPDIPNKAFYDTFSVFGPILSSKIARDENGKSKGFGFVHFEEEEAAQSAIAALNGMLLNGHEIYVAP,5.8583117,"G1M, D13P, L17F, D26P, T34R, G52E, K55Q, E56S, D59A, Q69H",10
MNIFIKNLHPDIDNKALYDTFSVFGRVLSSGIITDENGKSKGFGFVHFEEEGAVRSAIDGLNGMHLNGQEIYVAP,1.8127728,"G1M, D26R, I27V, K31G, A33I, A54V, K55R, E56S, A60G, L65H",10
MEIFIKNLHPDIDNDALYDTFSFFGVILESKIATDENGKSKGFGFVHFEEEGAAKNAIDALNGMLYNGQELYVAK,-1.2540891,"G1M, N2E, K15D, V23F, D26V, S29E, E56N, L66Y, I71L, P75K",10
MNIFIKNLHPDVDNEALYDTFSVFGDILSIAIMKDENGKSKGFGFVHFEEHEAAKEAIDAMNGMLLNGQEIYVAP,-1.9141345,"G1M, I12V, K15E, S30I, K31A, A33M, T34K, E51H, G52E, L61M",10
MNIFIKNLSPDIDNQLLYDTFSVFGDIVHAEIATDENGKSKGFGFVHFEEEGAAKEAIDAMNGMLLNGQKIYVAP,-2.5216036,"G1M, H9S, K15Q, A16L, L28V, S29H, S30A, K31E, L61M, E70K",10
MNIFIKNLHPSIDNKFLYETFAEFGDILSSKIATDRNGNSKGFGFVHFEEEGAAIEAIDALNGMLLNGQEIYVAF,4.5585423,"G1M, D11S, A16F, D19E, S22A, V23E, E36R, K39N, K55I, P75F",10
MNIHIKNLKPDIENEVLYDTFSVFGDILSSKIATDENEKPKGFGFVHFEEEDAAKEAIDHLNGMLLNGQEIYVAP,0.51247287,"G1M, F4H, H9K, D13E, K15E, A16V, G38E, S40P, G52D, A60H",10
MNIFIKNLPPDITNSALYDTFSAFGDILDSKIATDENGGSKGFGFVHFEEEGAAKEAFDQLNGMLLNGREIYVAP,1.3426176,"G1M, H9P, D13T, K15S, V23A, S29D, K39G, I58F, A60Q, Q69R",10
