Sequence,Score,Mutations,Number of Mutations
MSKGEELFTGVVPILVELDGDVNGHKFSVSGEGEGDATYGKLTLKFICTTGKLPVPWPTLVTTLSYGVQCFSRYPDHMKQHDFFGSAMPEGKVQERTIFFKDSGNYKGRAEVKFEGDTLVNRIELKGADFKEDKNILGHKLEYNYNSHNVYIMADKQKNGIKGNFKIKHNIEDGSVQLAEHYQQNTPIGDGPVLLPANHYLSTQSALSKDPNEKRDHMVLLEFVTAAGITHGMDELYK,3.4768977,"K85G, Y92K, D103S, T108G, I128A, G134K, V163G, R168K, D180E, D197A",10
MSKGEKLFTGVVPILVELDGDVNGHKFSVSGEGQGDATYGKLTLKFICTTGKLPVPWPTLVTTLSYGVQCFSRYPDHMKQHDFFKSAMPEGYVQERTIFFKDDGNYKGRAEVKAEKDTLVNKIELKGADFKEDGNILGHKLEYNYNSHNVYIMADKQKNGIKGNFKIRHNIEDGSVQLAEHYQQNTPIGDGPKLLPDNHYLSTQSALSKDPNEKRDHMVLLEFVTAAGITHGMDELYK,3.8634243,"E6K, E34Q, T108G, F114A, G116K, R122K, I128A, V163G, D180E, V193K",10
MSKKEELFNGVVPILVELDGDVNGHKFSVSGEGEGDATYGKLTLKFICTTGKLPVPWPQLVTTLSYGVQCFSRYPDHMKQHDFFKSAMPEGYVQERTIFFKDDKNYKGYAEVKFEGDTLVNREELKGADFKEDGNILGHKLEYNYNSHNVYIMADKQKNGIKGNFKIRHNIEDGSVQLAEHYQQNTPIGDGPVLLPDNHYLSTQSALSKDPNEKRDHMVLLEFVTAAGITHGMDELYK,3.7871256,"G4K, T9N, T59Q, G104K, T108G, R109Y, I123E, I128A, V163G, D180E",10
MSKIEELFTGVVPILVELDGDVNGHKFSVSGEGEGDATYGKLTLKFICTTGKLPVPWPGLVTTLSYGVQCFSRYPDHMKQHDFFKSAMPEGYVQERTIFFKDDGNYKGRAEVKFEGDTLVNYIELKGADFKEDGNILGHLLEYNYNSHNVYIMADKQKNGIKGNFKIRHNIEDGSVQLAEHYQQNTPIGDGPVLLPDRHYLSTQSALSEDPNEKRDHMVLLEFVTAAGITHGMDELYK,3.7751014,"G4I, T59G, T108G, R122Y, I128A, K140L, V163G, D180E, N198R, K209E",10
MSKGEELFTGVVPILVELDGDVNGHKFSVSGEGEGDATYGKLTLKFICTTGKLPVPWPTLVTTLSYGVQGFSRYPDHMKQHDFFKSEMPEGYVQERTIFFKDDGNGKGRAEVKFEGDTLVNRIELKGADFKEDGNILGHKLEYNYNSHNVYIMADKQKNGIKGNFKIRHNIEDGSVELAEHYQQNTPIGDGPVLLPDNHYLSTQSALSKDPNEKRDHMALLEFDTAAGITHGMDELYK,2.7516234,"C70G, A87E, Y106G, T108G, I128A, V163G, Q177E, D180E, V219A, V224D",10
MSKGEELFTGVVPILVELDGDVNGHKGSVSGEGEGHATYGKLTLKFICTTGKLPVPWPTLVTTLSYGVQCCSRYPDHMEQHDFFKSAMPEGYVQERTIFFKDDGNYKGRAEVKFEGVTLVNRIELKGADFKEDGNILGHKLEYNYNSHNVYIMADKQKNGIKGNFKIRHNIEDGSVQLAEHYQQNTPIGKGPVLLPDNHYLSTQSALSKDPNEKRDHMVLLEFVTAAGITHGMDELYK,3.5389147,"F27G, D36H, F71C, K79E, T108G, D117V, I128A, V163G, D180E, D190K",10
MSKGEELFTGVVPILVELDGDVNGHKFSVSGEAEGDATYGKLTLKFICTTGKLPVPWPTLVNTLSYGVQCFSRYPDHMKQHDFFKSAMPEGYVQERTIFFKDDGNYLGRAEVKFEGDTLVNRIELKGADFKEDGNILGHKLEYNYNSHNVEIMADKQKNGIKGNFKGRHNIEDGSVQLAEHYQQNTPIGDGPVLLPDNHYLSTQSALSKDPNGKRDHMVLLEFVTAAGITHGMDELYK,2.643197,"G33A, T62N, K107L, T108G, I128A, Y151E, V163G, I167G, D180E, E213G",10
MSKGEELFTGVVPILVKLDGDRNGHKFSVSGEGEGDGTYGKLTLKFICTTGKLPVPWPTLVTTLSYGVQCFSRYPDHMKQHDFFKSAMPEGYVQERTIFFKDDGNYKGRAEVKFEKDTLVNRIELKGADFKEDGNILGHKLEYNYNSHNVYIMAEKQKNGIKGNFKIVHNIEDGSVQLAEHYQQNTPIGDGPVLLPDNHYLSTQSALSKDPNEKRDHMVLLEFVTAAGITHGMDELYK,3.8097434,"E17K, V22R, A37G, T108G, G116K, I128A, D155E, V163G, R168V, D180E",10
MSKGEELFTGVVPILVELDGDVNGHKFSVSGEGEGDATYGKLTLKFICTTGKLPVPWPTAVTTLSYGVQCFSRYPDHMKQHDFFKSAMPEGYVQERTIFFKDDGNYKGRAEVKFEGDTLVNRIELKGADFKEDGNILGHKLEYNYNSHNVYIMADKQKKGIKGVFKIRHNIYDGSVQLAEHYQQNTPIGDGPVLLPDNHYLSTQSALSKDPNEKADHMVLLEKVTAAGITHGMDELYK,3.776888,"L60A, T108G, I128A, N159K, V163G, N164V, E172Y, D180E, R215A, F223K",10
MAKGEELFTGVVPILVELDGDVLGHKFSVSGEGEGDATYGKLTLKFICTTGKLPVPWPTLVTTLSYGVQCFSRYPDHMKQHDFFKSAMPEGYVQERTIFFKDDGNYKGRAEVKFEGDTLVNRIELKGADFKEDGNILGHKLEYNYNSHAVYIMADKQKNGIKGNFKGRHNIEDGSVQLIEHYQQNTPIGDGPVLLPDNHYLSTQSELSKDPNEKRDHMVLLEFVTAAGITHGMDELYK,3.8712683,"S2A, N23L, T108G, I128A, N149A, V163G, I167G, A179I, D180E, A206E",10
MSKGEELFTGVVPILVELDGDVNGHKFSVSGEGEGDATYGALTLKFICTTGKLPVPWPTLVTTLSYGVQCFSRYPDHKKQHDFFKSAMPEGYVQERTQFFKDDGNYKGRAEVKFEGDTLVNRIELKGAAFKEDGNILGHKLEYNYNSHNVYIMADKQKNGIKGNFKIRHNIEDGYVQLAEKYQQNTPIGDGPVLLPDNHYLSTQSALSKDPNEKRDHMVLLEFVTAAGITHGMDELYK,3.6396132,"K41A, M78K, I98Q, T108G, I128A, D129A, V163G, S175Y, D180E, H181K",10
MSKGEELFTGVVPILVELDGDVGGHKFSVSGEGEGDATYGKLTLKFICTTGKLPVPWPTLVTTLSYGVQDFSRYPDHMKQHDFFKSAMPEGYVQERTIFFKDDGNYKGRAEVFFEGDTLVNRIELKGADFKEDGNILGHKLEYNYNSHNVYIMADKQKNGIKGNFKIRHNIEDGSVQLAEHYQQNTPIGDGPVGLPDNHYLSTQSALSKDPNEKRDHMVLLEFVTAEGFTHGMDELYK,3.8141496,"N23G, C70D, T108G, K113F, I128A, V163G, D180E, L194G, A227E, I229F",10
MSKGEELFTGVVPILVELDGDVNGHKFSVSGEGEGDATYGKLTGEFICTTGELPVPWPTLVTTLSYGVQCFSRYPDHMKQHDFFKSAMPEGYVQERTIFFKDDGNYKGRAEVKFEGDTLVNRIELKGADFKEDGNILGHKLEYNYNSHNGYIMADKQKNGIKGNFKIRHNIEDGSVQLAEHYQQNTPIGDGPVLLPDNHYLSTQQALSKDPNEKRDHMVLLEFVTAAGITHGADELYK,3.2537847,"L44G, K45E, K52E, T108G, I128A, V150G, V163G, D180E, S205Q, M233A",10
MSKGEELFTGVVPILVELDGDVNGHKFSVSGEGEGDATYGKLTGKFICTTGKLPVPWPTLVTTLSYGVQCFSRYPDHMKQHDDFKSAMPEGYVQERTIFFKDDGNYKGRAEVKFEGDTLVNRIELKGADFKEDGNILGHKLEYNYNSHNVYIMGDKQKNGIKGNFKIRENIEDGSVQLAEHYQQNTPIGDGAVLLPDNHYLSTQSALSKDPNEKRDHMVLLEFVTAAGIGHGMDELYK,3.7156353,"L44G, F83D, T108G, I128A, A154G, V163G, H169E, D180E, P192A, T230G",10
MSKGEELFTGVVPILVELDGDVNGAKFSVSGEGEGDATYGKLTLKFICTTGKLPVPWPTLVTTLSYGVQCFSRYPDHMKQHDFFKSAMPEGYVQERTIFFKDDGNYKGRAEVKFEGDTLVNRIELKGADFKEDGNILGHKLEYNANSHNVYIMADKQKNGIKGNFVIRHNIEDGSVQLAEHYQQNTPIGDGPVLLPDKHYLSTQSALSKDPNEKRDGMVLLEFVTAAGITHGMDVLYK,3.81596,"H25A, T108G, I128A, Y145A, V163G, K166V, D180E, N198K, H217G, E235V",10
MSKGEELFTGVVPILVELDGDVNGHKFSVSGEGEGDATYGKLTLKFICTTGKLPVPWPTLVTTLSYGVACFSRYPDHMKQHDFFKSAMPEGYVQERTIFFKDDGNYKGRAEVKFEGDTLVNRIELKGADFKEDGNILGEKLEYNYNSHNVYIMADKQKNGIKGNFKIRHNIEDGYVQLAEHYQQNTPIGAGPVLLPDNHYLSTQSALSKKPNEKRDHMVLLEFVTAAGITHGMDELYR,3.8621914,"Q69A, T108G, I128A, H139E, V163G, S175Y, D180E, D190A, D210K, K238R",10
MSKGKELFTGVVPILVELDGDVNGHKFSVSGKGEGDAQYGKLTLKFICRTGKLPVPWPTLVTTLSYGVQCFSRYPDHMKKHDFFKSAMPEGYVQERTIFFKDDGNYKGRAEVKFEGDTLVNRIELKGADFKEDGNILGHKLEYNYNSHNVYIMADKQKNFIKGNFKIRHNIEDGSVQLAEHYQQNTPIGDGPVLLPDNHYLSTQSALSKDPNEKRDHMVLLEFVTAAGITHGMDELYK,3.9321532,"E5K, E32K, T38Q, T49R, Q80K, T108G, I128A, G160F, V163G, D180E",10
MSKGEELFTGAVPILVELDGDVNFHKFSVSGEGEGDATYGKLTLKFICTTGKLPVPWPTLFTTLSYGVQCDSRYPDHMKQHDFFKSAMPEGYVQERTIFFKDDGNYFGRAEVKFEGDTLVNRIELKGADFKEDGNILGHKLEYNYNSHNVYIMADKQKNGIKGNFKIRHNIEDGSVQLAEHYQQNTPIGDGPVLLPDNHYLSTQSALSKDPNEKRDHMVLLEFVTAAGITHGMDELAK,3.798544,"V11A, G24F, V61F, F71D, K107F, T108G, I128A, V163G, D180E, Y237A",10
MSKGEELFTGVVPILVELDGDVNGHKFSVSGEGEGDATYGKLTLKFICTKGKEPVPWPTLVTTLSYGVQCFSRYPDHMKQHDFFKSAMPEGYVQERTIFFKDDGNYKGRAEVKFEKDTLVNRIELKGADFKEDGNILGHKLEYNYKSHNVYIMADKQKNGIKGNFKIRHNIEDGSVQLAEHYQQNTPIKDGPVLLPDNHYLSTQSALSKDPREKRDHMVLLEFVTAAGITHGMDELYK,3.8991883,"T50K, L53E, T108G, G116K, I128A, N146K, V163G, D180E, G189K, N212R",10
MSKGEELFTGVVPILVELDGKVNGHKFSVSGEGEADATYGKLTLKFICTTGKLPVPWPTLVTTLSYGVQCFSRYPDHMKQHDFFKSAMPDGYVQERTIFFKDDGNYKGRAEVKFEGDTLVNRIELKGADFKEDGNILGHKLEYNYNSHNVYISADKQKNGIKGNFKIRHNIEDGSVQLAEHYQQNTPIGDGPVLLPYNHYLSTQSALSKDPNEKRDHMVLLEFVTAAGITHGMDEVYK,3.890763,"D21K, G35A, E90D, T108G, I128A, M153S, V163G, D180E, D197Y, L236V",10
MSKGEELFTGVVPILVELDGDVNGHKFSVSGEGEGDATYGKLTLKFKCTTGKLPVPWPTLVTTQSYGVQCFSRYPDHMKQHDFFKSAMPEGYVQERTIFFKDDGNYKGRAEVKFEKDTLVNRIELKAADFKEDGNILGHKLEYNYNSHNVYIMADKQKNGIKGNFKIRHNIEDGSVQLAEHYQQNTPIGDGPQLLPDNHYLSTQSWLSKDPNEKRDHMVLLEFVTAAGITHGMDELYK,3.3916812,"I47K, L64Q, T108G, G116K, G127A, I128A, V163G, D180E, V193Q, A206W",10
MSKGEELFTGVVPILVELDGDVNGHKFSVSGEGQGDATYGKLTLKFICTTGKLPVEWPTLVTTLSYGVQCFSRYPDHMKQHDFFKSAMPEGYVAERTIFFKDDGNYKGRAEVKFEGDTLVNRIELKGADFKEDGNILGHKLEYNYNSHNVYIMADKQKNGIKGNFKGRHNIEDGSVQLAEHYQQNTPIGDGPVLLPDNHYLSTQSALSKDPNEKRDHMVLLEFVTEAGIKHGMDELYK,3.7985337,"E34Q, P56E, Q94A, T108G, I128A, V163G, I167G, D180E, A226E, T230K",10
MSKGEELFTGVVPILVELDGDVNGHKFSVSGEGEGDATYGKLTLKFICTTGKLPGPWPTLVTELSYGVQCFSRYPDHMKQHDFFKSAMPEGYVQERTIFFKDDGNYKGRAEVKFEKDTLVNRIELKGADFKEDGNFLGHKLEYNYNSHNVYIMADKQKNGIKGNFKIRHNIEKGSVQLAEHYQQNTPIGDGPVLLPDNHYLSTQSALSKDPNEKRDHMVLLEFVTAAGIFHGMDELYK,3.000431,"V55G, T63E, T108G, G116K, I128A, I136F, V163G, D173K, D180E, T230F",10
MSKGEELFQGVVPIVVELDGDVNGHKFSESGEGEGDATYGKLTLKFICTTGKLPVPWPTLVTTLSYGVQCFSRYPDHKKQHDFFKSAMPEGAVQERTIFFKDDGNYKGRAEVKFEGDTLVNRIELKGADFKEDGNILGHKLEYNYNSHNVYIMADKQKNGIKGNFKIRHNIEDGSVQLAEHYQQNTPIGDGPVLLPDNHYLSTQSALSKDPNEKRDHMVLLEFVKAAGITHGMDELYK,2.5858588,"T9Q, L15V, V29E, M78K, Y92A, T108G, I128A, V163G, D180E, T225K",10
MSKGEELFTGVVPILVELAGDVNGHKFSVSGEGEGDATYGKLTLKFICTTGKLPVPWPTLVTGLSYGVQCFSRYPDHMKQHDFFKSAMPEGYVQERTIFFKDDGNYKGRAEVKFEGVTLNNRIELKGADAKEDGNILGHKLEYNYNSHNVYIMADKQKNGIKGNFKIRHDIEDGSVQLAEHYQQNTPIGDGPVLLPDNHYLSTQSALSKDPNEKRDHMVLLEFVTAAGITHGMDELYK,3.8055766,"D19A, T63G, T108G, D117V, V120N, I128A, F130A, V163G, N170D, D180E",10
MSKGEKLFTGVVPILVELDGDVNGHKGSVSGEGEGDATYGKLTLKFICTTGKLPAPWPTLVTTLSYGVQCFSRYPDHMKQHDFFKSAMPEGYVQERTIAFKDDGNYKGRAEVKFEGDTLVNRIELKGADFKEDGNILGGKLEYNYNSHNVYIMADKQKNGIKGNFKIRHNIEDGSVQLAEHYQQNTPIGDGPVLLPDNHYLSTQSALSKDPNEKREHMVLLEFVTAAGITHGMDELYK,3.160812,"E6K, F27G, V55A, F99A, T108G, I128A, H139G, V163G, D180E, D216E",10
MSKGEELFTGVVPILVELDGDVNGHKFSVSGEGEGDATYGKLTLKFICTTGKLPVVWPTLVTTLSYGVQCFSRYPDHMKQHDFFKSAMPEGYVQERTIFFKDDGNYKGRAEVKFEGDTLVNEIELKGADFKEDGNILGHKAEYNYNSHNVYIEADKQKNGIKGNFKIRHNIEDGSVQLAEHYQQFTPIGDGPVLLPDNHYLSTQSALSKDPNEKRDHMVLLEFVEAAGITHGMDELYK,3.7783482,"P56V, T108G, R122E, I128A, L141A, M153E, V163G, D180E, N185F, T225E",10
MSKGEELFTGVVPILVELDGDVNGHKFSVSGEGEGDATRGKLTLKEICTTGKLPVPWPTLVTTLSYGVQCFSRYPDHMKQHDFFKSAMPEGYVQERTIFFKDDGNGKGRAEVKFEGDTLVNRIELKGADFKEDGNILGHKKEYLYNSHNVYIMADKQKNGIKGNFKIRHNIEDGSVQLAEHYQQNTPIGDGPVLLPDNHYLSTQSACSKDPNEKRDHMVLLEFVTAAGITHGMDELYK,3.6697807,"Y39R, F46E, Y106G, T108G, I128A, L141K, N144L, V163G, D180E, L207C",10
MSKGENLFTGVVPILVELDGDVNGHKFSVSGEGEGDATYGKGTLKFICTTGKLPVPWPTLVTTLSYGVQCVSRYPDHAKQHDFFKSAMPEGYVQERTIFFKDDGNYKGRAEVKFEGDTLVNRIELKGADFKEDGNILGHKLEYNYNSHNVYIMADKQKNGIKGNFKIRHWIEDGSVQLAEHYQQNTPIGDGPVLLPDNHYLSTQSALSKDPNEKRDHMVLLEFVTAAGITHGADELYK,3.7714944,"E6N, L42G, F71V, M78A, T108G, I128A, V163G, N170W, D180E, M233A",10
MSKGEELFTGVVPILVELDGDVNGEKFSVSGEGEGDATYGKLTLKFICTTGKMPVPWETLVTTLSYGVQCFSRYPDHMKQHDFFKSAMPEGYVQERTIFFKDDGNYKGRAEVKFFGDTLVNRIELKGADFKEDGNILGHKLEYNYNSHNVYIMADKQKNGIKGNFKIRHNIEDGSAQLAEHYQANTPIGDGPVLLPDNHYLSTQSALSKDPNEKRDHMVLLEFVTAAGITHGMDELYK,3.8552618,"H25E, L53M, P58E, T108G, E115F, I128A, V163G, V176A, D180E, Q184A",10
MQKGEELFTGVVPILVELDGDVNGHKFSVSGEGEGDATYGKLTLKFICTTGKLPVPWPTLVTTLSYGVQCFSRYPAHMKQHDFFKSAMPEGYEQERTIFFKDDGNYKGRAEVKFEGDTVVNRIELKGADFKEDGNILGHGLEYNYNSGNVYIMADKQKNGIKGNFKIRHNIEDGSVQLAEHYQQNTPIGDGPVLLPDNHYLSTQSALSKDPNEKRDHMVLLEFVTAAGITHGMDELYK,3.866879,"S2Q, D76A, V93E, T108G, L119V, I128A, K140G, H148G, V163G, D180E",10
MSKGEELFTGVVPILVELDGDVNGHKFSVSGEGEGDATYGKLTLKFICTTGKLPVPWPTLVTTLSYGVQCFSRYPDHMKQHDFFKSAMPEGYVQERTIFFKDDGNYKGRAEVKFEGDTLVNRIELKGADFKEDGNILGHKLEYNYNSHNVAIMAAKQKNGIKGNFKIRHNIEDGSVQLAEHYQQNTPIGDVPVLEPDNHFLSTQSALSKDPNAKRDHMVLLEFVTAAGITHGMDELYK,3.5972476,"T108G, I128A, Y151A, D155A, V163G, D180E, G191V, L195E, Y200F, E213A",10
MSKGEELFTGKVPILVELDGDVNGHKFSVSGEGEGDATYGKLTLKFDCTKGKLPVPWPTLVTTLSYGVQCFSRYPDHMKQHDFFKSAMPEGYVQERTIFFKDDGNYKGRAEVKREGDTLVNRIELKGADFKEDENILGHKLEYNYNSHNVYIMADKQKNGIKGNFKIRHNIEDGSVQLAEHYQQNTPIGDGPVLLPDNHYLSTQSALSKDPNEKRDHMVLLEFVTAAGITHGVDELYK,3.8489285,"V11K, I47D, T50K, T108G, F114R, I128A, G134E, V163G, D180E, M233V",10
MSKGNELFTGVVPILVELDGDVNGHKFSVSGEGEGDATYGKLTLKFICTTGKLPVPWPTLVTTLSYGVQCFSRYPDHMKQHDFFKKAMPEGYVGERTIFFKDDGNYKGRAEGKFEGDTLVNRIELKGADFKEDGNILGHKLEYNYNSHNVYIMADKQKNGIKGNGKIRHNIEDGSVQLAEHYQQNTPIGDGPALLPDNHYLSTQSALSKDPNEKRDHMVLLEFVTAAGITHGMDELYK,3.4609067,"E5N, S86K, Q94G, T108G, V112G, I128A, V163G, F165G, D180E, V193A",10
MSKGEELFTGVVPILVELDGDVNGHKFSVSGEGEGDATYGKLTLKFICTTGKLPVPWPTLVETLSYGVQCFSRYPDHMKQHDFFKSAMPEGYVQERTIFFKDDGNYKGRAEVKFEGDTLVNRIEEKSADFKEDGNGLGHKLEYNYNSHNVYIMADKQKNGIKGNFRIRHNIEDGSVQLAEHYQQNTPIGDGPVLKPDNHYLSTQSALSKDPNEKRDHMVLLEFVTAAGITHGMDELYK,3.550926,"T62E, T108G, L125E, G127S, I128A, I136G, V163G, K166R, D180E, L195K",10
MSKGEELFTGVVPILVELDGDVNGHKFSVSGEGEGDATYGKLTLKFICTTGKLEVPWPTLVTTLSYGVQCFSRYPDHMKQHDFFKSAMPEGYVQETTIFFKDDGNYKGRAEVKFEGDTLVNRIELKGADFKEDGIILGHKLEYNYNSHNVYIFADKQKNVIKGNFKIRHNIEDGSVQLAEHYQQNTPIGDGPVLLPDNHYLSTQSALSKDPNAKRDHMVLLEFVTAAGITHGMDELYK,3.4135628,"P54E, R96T, T108G, I128A, N135I, M153F, G160V, V163G, D180E, E213A",10
MSKGEELFTGVVPILVELDGDVNGAKFSVSGEGEGDATYGKLTLGFICTTGKLPVPWPTLVTTQSYGVQCFSRYPDHMKQHDFFKSAMPEGYVQEGTIFFKDDGNYKGRAEVKFEGDTLVNRIELKGADFKEDGNILGHKLEYNYNSHNVYIMADKQKNGIKGNFKIRHNIEDGYVQLAEHYQQNTPIGDGPVLLPDNHYLSTQSALSKKPNEKRDHMVLLEFVTAAGITHGMDELYK,2.0521004,"H25A, K45G, L64Q, R96G, T108G, I128A, V163G, S175Y, D180E, D210K",10
MSKGEELFTGVVPILVELDGDVNGHKFSVSGEGEGDATYGKLTLKFICTTGKLPVPWPTLVTTLSYGVQCFSRYPDHMKQHDFFKSAMPEGYVQERTIFFKDDGYYKGRAEVKREGDTLVNRIELKGADFKEDGNILGHKLEYNYNSHNVYIMADKQKNGIKGNFKIRHYIEDGSVQLAEHYQQNTPIGDGPVLLPDNHYLSEQSALSKDPKEFRDHMVLLEFVTAAGITHGMDELYK,3.9436069,"N105Y, T108G, F114R, I128A, V163G, N170Y, D180E, T203E, N212K, K214F",10
MSKGEELFTGVVPILVELDGDVNGHKFKVSGEGEGDATIGKLTLKFICTTGKLPVPWPTLVTTLSYGVQCFSRYPDHMKQHDFFKSAMPEGYVQERTIFFKDDGNYKGRAEVKFEGDTLVNRIELKGADFKEDGNILGHKLEYNYNSHNVYIMADKQKNGIKGNFVIRHNIEDGSVQLAEHYQQNTPIGDGPVLLPDNHYLSTQSALSKDPKEKRDHMVLLEFVDAAGITGGMDELYK,3.9552789,"S28K, Y39I, T108G, I128A, V163G, K166V, D180E, N212K, T225D, H231G",10
MSKGEELFTGVVPILVEDDGDVNGHKGSVSGEGEGDATYGKLTLKFICTTKKLPVPGPTLVTTLSYGVQCFSRYPDHMKQHDFFKSAMPEGYVQERTIFFKDDGNYKGRAEVKFEGDTLVNRIELKGADFKEDGAILGHKLEYNYNSHNVYIMADKQKNGIKGNFKIRHNIEDGSVQLAEHYQQNTPIGDGPVLLPDNHLLSTQSALSKDPNEKRDHMVLLEFVTAAGITHGMDELYK,2.7357767,"L18D, F27G, G51K, W57G, T108G, I128A, N135A, V163G, D180E, Y200L",10
MSKGEELFTGVVPILVELDGDVNGHKFSVSGEGEGDATYGKLTLKFICTTGKLPVPWPTLVTTLSYGVQCFSRYPFVMKQHDFFKAAMPEGFVQERTIFFKDDGNYKGRAEVKFEGDTLVERIELKGADFKEDGNILGHKLEYNYNSHNVYIMADKQKNGIKGNFKIRHNIEDGSVQLAEHYQQNTPIGDGPVLLPDNHYLSTQSALSKDPNEKRDHMVLLEFVKAAGITHGMDELYK,3.788512,"D76F, H77V, S86A, Y92F, T108G, N121E, I128A, V163G, D180E, T225K",10
MSKGEELFTGVVPILVEKDGDVNGHKFSVSGEGEGDATYGKLTLKFICTTGKLPVPWPTLVTTLSYGVACFSRYPDHMKQADFFKSAMPEGYVQERTIFFKDDGNYYGRAEVKFEGDTLVNRIELKGADFKEDGNILGHKLEYNYNSHNVYIMADKQKNGIKGNFKIRHNIEDGSVQLAEHYQQNTPIGDGPVLLPDNHYLSTQSKLSKDPNEKRDHMVLLEAVTAAGITHGMDELYK,3.7762537,"L18K, Q69A, H81A, K107Y, T108G, I128A, V163G, D180E, A206K, F223A",10
MSKGEELFTGVVPILVELDGDVNGHKFSVSGEGEGDATYGKGTLKFICTTGKLPVPQPTLVTTLSYGVQCFSRYPDHMKQHDFFKSAMPEGYVQERSIFFKDDGNYKGRAEVKFEGDTLVNRAELKGADFKEDGNILGHKLEYNYNSHNVYIMADKQKNGIKGNFKIRHNIEDSSVQLAEHYLQNTPIGDGPVLLPDNHYLSTQSALSKDPNEKRDHMVLLEFVTAAGITHGMDELYK,2.3085861,"L42G, W57Q, T97S, T108G, I123A, I128A, V163G, G174S, D180E, Q183L",10
MSKGEELFTGVVPILVELDGDKNGHKFSVVGEGEGDATYGKLTLKFICTTGKLPVPWPTLVTTLQYGVQCFSRYPDHMKQHDFFKSAMPEGYVAERTIFFKDDGYYKGRAEVKFEGDTLVNRIELKGADFKEDGNILGHKLEYNYNSHNVYIMADKQKNGIKGNEKIRHNIEDGSVQLAEHYQQNTPIGDGPVLLPDNHYLSTQSALSKDPNEKRDHMVLLEFVTAAGITHGMDELYK,3.7126243,"V22K, S30V, S65Q, Q94A, N105Y, T108G, I128A, V163G, F165E, D180E",10
MSKGEELFTGDVPILVELDGDVNGHKFSVSGEGEGDATYGKLTLKFICTTGKLPVPWPTLVTTLSYGVQCFSRYPDHMKQHDFFKSAMPEGYVQERTIFFKDDGNYKGRAEVKFEGDTVVNRIELKGADFKEDGNINGHKLEYNGNSHNVYIMADKQKNGIKGNFKIRHIIEDGSVQLAEHYQQNTPIGDGPVLLPDNHYLSTQSALSADPNEKRDHMVLLEFVTAAGITHGMDELYK,3.83078,"V11D, T108G, L119V, I128A, L137N, Y145G, V163G, N170I, D180E, K209A",10
MSKGKELATGVVPILVELDGDVNGHKFSVSGEGEGDATYGKLTLKFICTTGKLPVPWPTLVTTLSYGVQCFSRYPDHMKQHDFFKSAMPEGYVQVRTIFFKDDGNYKGRAEVKFEGDTLVNRIELKGADFKEDGNILGHKLEYNYNSHNVEIMADKQKNGIKGNFKIRHNIEDGSVQLAEHYQQNTPIGDGPVLLPDNHYLSTQSALKKDPNEKRDHMVLLEFVTAAGIKHGMDELYK,3.8346772,"E5K, F8A, E95V, T108G, I128A, Y151E, V163G, D180E, S208K, T230K",10
MSKGEELFTGVVPILVELDGDVNGHKFSVSGEGEGDATYGKLTLKFICTTGKLPVPKPTLVTTLSYGVQCFSRKPDHMKQHDFFKSAMPEGYVQERTIFFKDDGNYKGRAEVKFEGDTLVNRIELKVADAKEDGNILGHKLEYNYNSHNVYIMADKQKNGIKGNFKIRHNKEDGSVQLAEHYQQNTPIGDGPVLLPDNHYLSTQSALSKDPNEKRDHMVLLEFVTEAGITHGMDELYK,3.4315157,"W57K, Y74K, T108G, G127V, I128A, F130A, V163G, I171K, D180E, A226E",10
MSKGEELFTGVVPILVELDGDVNGHKFSVSGEGEGDATYGKLTLKFICTTGKLPVPWNTLVTTLSYGVQCFSRYPDHMKQHDFFKSKMPEGYVQERTIFFKKDGNYKGRAEVKFEEDTLVNRIELKGADFKEDGNILGHKLEYNYNSHNVYIMADKQKNGIKGNFKIRHNIEDGSVQLAEHYQQNTPIGDGPVLLPDNHYLSKQEALSKDPNEKRDHMVLLEFVTAAGITHGMDELYK,3.8602612,"P58N, A87K, D102K, T108G, G116E, I128A, V163G, D180E, T203K, S205E",10
MSKGEELFVGVVPILVELDGDVNGHKFSVSGEGEGDATYGKLTLKFICTTGKLPVEWPTLVTTLSYGVQCFSRYPDHMKQHDFFKSAMPEGYVQERTIFFKDDGNYKGRAEVKFEGDTLVNRIELKGADFKEDGNILGHKLEYNYNSHNVYIMADKFKGFIKGNFKIRHNIEDGSVQLAEHYQQNTPIGDGPVLLPDEHYLSTQSALSKDPNEKRDHMVLLEFVTAAGITHGMDELYK,3.9641924,"T9V, P56E, T108G, I128A, Q157F, N159G, G160F, V163G, D180E, N198E",10
MSKGEELFTGVVPILVELDGDVNGHKFSVSGEGEGDATYGKLTLKFICTTGKLPVPWPTLKTTLSYGVQCFSRYPDHMKQHDFFKSAMPEGYVQERTIFFKDDGNYKGRAEVKFEGDTLVNRIVLKGADFKEDGNILGHKLAYNYNSHNVEIMADKQKNGIKGNFKIRHNIEDGSVQLAEHYQQNTPIGDGPVLLPDEHYLSTQSALSKDPNAKRDHMVLLEFVTAAGITHGMDELYK,3.650023,"V61K, T108G, E124V, I128A, E142A, Y151E, V163G, D180E, N198E, E213A",10
MSKGAELFTGVVPILVELDGDVNGHKFSVSGEGEGDATYGKLTLKFICTTGKLPVPWETLVTTLSYGVQCFSRYPDHMKQHDFFKSAMPEGYVAERTIFFKDDGNYKGRAEVKFEGDTLVNRIELKGADFKEDGNILGHKLEYNYRSHNVYIMADKQKNGIKGNFKIRHNIEDGSVQLAEGYQQNTPIGDGPVLLPDNHYLSTQSALSKDGNEKRDHMVLLEFVTAAGITHGMDELYK,3.7375722,"E5A, P58E, Q94A, T108G, I128A, N146R, V163G, D180E, H181G, P211G",10
MSKGEELFTGVVPILVELDGDVNGHKFSVSGEGEGDATYGKLTLKFICTTKKLPVPWPTLVTTESYGVQCFSRYPDHMKQEDFFKSAMPEGYGQERTIFFKDDGNYKGRAEVKFEGDTLVNRIELKGADFKEDGNILGHKLEYNYNSHNVYIMADKQKNGIKGNFKIRHNIEDGSVQLAEHYQQNTPIGDGPVLLPDNHYLSTQEALSKDPNEKRDHMVLLEFKTAAGITHGMDELYK,3.5379639,"G51K, L64E, H81E, V93G, T108G, I128A, V163G, D180E, S205E, V224K",10
MSKGEELFTGVVPIAVELDGKVNGHKFSVSGEGEGDATYGKLTLKFICTTGKLPVPWPTLVTTLSYGVQCFSRYPDHMKQHDFFKSAMPEGYVQERTIFFKDDGNYKGREEVKFEGDTLVNRIELKGADFKEDGYILEHKLEYNYNSHNVYIMADKQKNGIKGNFKIRHNIEDGFVQLAEHYQQNTPIGDGPVLLPDNHYLSTQSALSKDPNEKRDHMVLLEFVTAAGITHGMDELYK,3.77035,"L15A, D21K, T108G, A110E, I128A, N135Y, G138E, V163G, S175F, D180E",10
MSKGEELFTGVVPILVEADGDVNGHKFSVSGEGEGDATYGKLTLKFICTTGKLPVPWPTLVTTLSYGVPCFSRYPDHMKQHDFFKSAMPEGYVQERTIFFKDDGNYKGRAEVKFEGDTLVNRIELKGADFKEKGNILGHKLEYNYNSHNVYIMADKQKNGIKGNFKIRHNIEDGSVQLAEHYQQNTPIGDGPVLLPYNDYLSTQSVLSKDPNEKRDHMVLLEFVTAAGITHGMDELYK,3.4629116,"L18A, Q69P, T108G, I128A, D133K, V163G, D180E, D197Y, H199D, A206V",10
MSKGEELFTGVVPILVEHDGDVNGHKFSVSGEGEGDATYGKLTLKFICTTGKLPVPWPTLVTTLSYGVQCFSRYPDHMKQHDFFKSAMPEGAVQERTIFFKDDGNYKGRAEVKFEGDTLVNRIELKGADFKEDGNILGHKLEYNYNSHNVYIMADKQKNGIKGNFKIRHNIEDGSVQLAEHYQQNTPKGDGPVLLPDNHYESTQSALSKDPNEKKDHMVLAEFVTAAGITHGMDELYK,3.578733,"L18H, Y92A, T108G, I128A, V163G, D180E, I188K, L201E, R215K, L221A",10
MSKGEELFTGVVPILVELDGDVNGHKFSVSGEGEGDATYGKLTLKFICTTGKLPVPWPTLVNTLSYGVQCFSRYPDHMKQHDFFKSAMPAGYVQERTIFFKDDGNYKGRAEVKFEGDTLVNRIELKGADFKGDGNILGHKLKYNYNSGNVYIMADKQKNGIKGNFKIRHNIEDGSVQLAEHYQQNTPIGDGPVLLPENHYLSTQSALSKDPNEKRDHMVLLEFVTAAGITHGMDELYK,3.8257484,"T62N, E90A, T108G, I128A, E132G, E142K, H148G, V163G, D180E, D197E",10
MSKGEELFTGVVPILVELDGDVNGHKFSVSGEGGGDATYGKLTLKFICTTGKLPVPWPTLVTTLSYGVQCFSRYPDHMKQHDFFKSAMPEGYVQERTIFFKDDGNYKGRAEVKKEGDTLINRIELKGADFKEDGNILGHKLEYNYNSHNVYIMADKQKNGIKGNFKIRHNIEDGSVELAEHYQQNTPIGDGPVLKPDNHYLSTQSALSKDPNEKGDHMVLLEFVTAAGITHGMDELYK,3.6929178,"E34G, T108G, F114K, V120I, I128A, V163G, Q177E, D180E, L195K, R215G",10
MSKGEELFTGVVPILVELDGDVNGHKFSVSGEGEGDATYGKLTLKFICTTGKLPVPWPTLVTTLSYGVQCFERYPDHMKQHDFFKSAMPEGYVQERTIFFKDDGNGKGRGEVKFEGDTLVNRIELKGADFKEDGNILGHKLEYNYNSHNVYIMADKQKNVIKGNFKIRHNIEDGSVQLAEHYQQNTPIGDGPVLLPDNHYLSTQSALSKAPNGKRDHMVLLEFVTAAGITHGMDELYK,2.5024812,"S72E, Y106G, T108G, A110G, I128A, G160V, V163G, D180E, D210A, E213G",10
MSKGEELFTGVVPILVELDGDYNGHKFSVSGEGEGDATYGKLTLKFICTTGKLPVPWPTLVTTLSYGVQCFSRYPDHMKQHDFFKSAMPEGYVQERTIFFKDDGNYKGRAEVKKEGDTLVNRIELKGADKKEDGNILGHKLEYNYNSHNVYIMADKQKNGIKGVFKIRHNIEDGSVQLAEHYQQNTPIGDGPVLLPDNHYLSTQSALSKDPNYKRDGMVLLEFVTAAGITHGMDELYK,3.526366,"V22Y, T108G, F114K, I128A, F130K, V163G, N164V, D180E, E213Y, H217G",10
MSKGEELFTGVVPILVELDGDVNGHKFSVSGEGEGDATYGKGTLKFICTTGKLPVPWPTLVTTLSYGVQCFSRYPDHMKQHDFFKSAMPEGYVQERTIFFKRDGNYKGRAEVAFEGDTLVNEIELKGADFKEDGNILGHKLEYNYNSHNVYIMADKQKNGIKGNFKIRHNIEDGSVQLAEHYQQNTPRGDGPVLLPDNHYLSTQSALSKDPNEKRDHMVLLEFVTAAGATHGMDELYK,3.8340478,"L42G, D102R, T108G, K113A, R122E, I128A, V163G, D180E, I188R, I229A",10
MSKKEELFTGVVPILVELDGDVNGHKFSVSGEGEGDATYGKLTLKFICTTGKLPVPWPTLVTTLSYGVQCFSYYPEHMKQHDFFKSAMGEGYVQERTIFFKDDGFYKGRAEVKFEGDTLVNRIELKGADFKEDGNILGHKLEYNYNSHNVYIMAEKQKNGIKGNFKIRHNIEDGSVQLAEHYQQNTPIGDGPVLLPDNHYLSTQSALSKDPNEKRDHMVLLEFVTAAGITHGMDELYK,3.9598093,"G4K, R73Y, D76E, P89G, N105F, T108G, I128A, D155E, V163G, D180E",10
MSKGEALFTGVVPILVELDGDVNGHKFSVSGEGEGDATYGKLTLKFKCTTGKLPVPWPTLVTTLSYGVQCFSRYPDHMKQHDFFKSAMPEGYVQERTIFFKDDGNYKGRAEVKFEGDTLVNRIELKGADFKEDANILGHKLEYNYNSHNVYIMADKQKNGIKGNFKIRHNIEDGSVQLAEHYQQNTPIGDGPVLLPDNHYLSTQSALSKDPNKKRDHMVLLEFVTAAGITHGCDEAYK,3.4502206,"E6A, I47K, T108G, I128A, G134A, V163G, D180E, E213K, M233C, L236A",10
MSKGEELFTGVVPILVELDRDVNGHKFSVSGEGEGDATYGKLTLKEICTTGKLPVPWPTLVTTLSYGVQCFSRYPDHMKQHDFFKSAMPEGYVQERTIFFKDDGNYKGRAEVKFEGDTLGNRIELKGADFKEDGNILGHKGEYNYNSHNVYIMADKQKNGIKGNFKIRHNIEDGSVQLAEHYQQNRPIGDGPVLLPDNHYLSTQSALSKDPNEKRDHMVLLEFVTAAGITHGMDEIYK,3.7028193,"G20R, F46E, T108G, V120G, I128A, L141G, V163G, D180E, T186R, L236I",10
MSKGEELFTGVVPILVELDGDVNGHKFSVYGEGEGDATYGKLTLKFICTTGKLPVPWPTLVTTKSYGVQCFSRYPDHMKQHDFFKSAMPEGYVQERTIFFKDDGNYKGRAEVKFEGDTLVNKIELKGADFKEDGNILGAKLEYNYNSHNVYIMADKQKNGIKGNFKIRHNIEDGSVQLAEHYQNNTVIGDGPVLLPDNHYLSTQSALSKDPNEKRDHMVLLEFVTAAGITHGMDELYK,3.8377116,"S30Y, L64K, T108G, R122K, I128A, H139A, V163G, D180E, Q184N, P187V",10
MSKGEELFTGVVQILVELDGDVNGHKFSVSGEGEGDATYGKLTLKFICTTGKLPVPWPTLVTTLSYDVQCFSRYPDHMKQHDFFKSAMPEGYVQERTIFFKDDGNYKGRAEVKFEGDTLVNRIELKGADFKEDGNILGHKGEGNYNSHNVYIMADKQKNGIKGNFKIRANIEDGSVQLAEHYRQNTPIGDGPVLLPDNHYLSTQSALSKDPNEKRDHMVLLEFVTAAGITHGMDELYK,1.7416302,"P13Q, G67D, T108G, I128A, L141G, Y143G, V163G, H169A, D180E, Q183R",10
MSKGEELFTGVEPILVELDGDVNGHKFSVSGEGEGDATYGKLTLKFICTTGKLPVPWPTLVTTLSYGVQCFSKYPDHMKQHDFFKSAMPEGYVQERTIAFKDAGNYKGRAEVKFEGDTLVNRIELKGADFKEDGNILGHKLEYNYNSHNVYIMADKQKNGIKGNFKIRHNIEDGSVQLAEHYQQNAPIGDGFVLLPDNHYLSTQSALSKDPNEKRDHMVLLEFVTAAGITHGMDELYK,3.3105433,"V12E, R73K, F99A, D103A, T108G, I128A, V163G, D180E, T186A, P192F",10
MSKGEELFTGVVPILVELDGDVNGHKFSVSGEGEGDATYGKLTLKFHCTTGKLPVPWPTLVTTLSYGVQCFSRYPDHMKQHDFFKSAMPEGYVQERTIFFKDDGNYKGRAEVKFEGDTLVNRIELKGADFKEDGNILGHKGEYNYFSHNVYIMADKQKNGIKGNFKIRHNIEDGSVQLAEHYQQNTGIGDGPVLLPDNHYLSIQSALSKDPNEKRDHMELLEFVTAAGITHGMDELYK,3.9107428,"I47H, T108G, I128A, L141G, N146F, V163G, D180E, P187G, T203I, V219E",10
MSKGEELFTGVVPILVELDGDVNGHKFSVSGEGEGDATYGKLTLKFIKTTGKLPVPWPTLVTTLSYGVQCFSRYPDHMKQHDFFKSAMPEGYVQERTIFFKDDGNYKGRAEVVFEGDTLVNRIELKGADFKEDGNILGHKLEYNYNSHNVYIMADKQKNGIKGNFKIRENIEDGSVQLAEHYQQNTPIGDGPVLLPDNHYLSTQSALSKDPNEKRDHMVLLEEVTAAGITHGMEELRK,3.7389934,"C48K, T108G, K113V, I128A, V163G, H169E, D180E, F223E, D234E, Y237R",10
MSKGEELFTGVVPILVELDGDVNGHKFSVEGEGEGDATYGKLTLKFICTTGKLPVPWPTLVTTLSEGVQCFSRYPDHMKQHDEFKSAMPEGYVQERTIFFKDDGNYKGRAEVKFEGDTLVNRPELKGADFKEDGNILGHKLEYYYNSHNVYIMADKQKNGIKGNFKIRHNIEDGSVELAEHYQQNTPIGDGPVLLPDNHYLSTQSALSKDPNEKRDHMVLLEFVTAAGITHGMDELYK,3.376595,"S30E, Y66E, F83E, T108G, I123P, I128A, N144Y, V163G, Q177E, D180E",10
MSKGKELFTGVVPILVELDGDVNGHKFSVSGEGEGDATYGKLTLKFICTTGKLPVPWPTLVTTLSKGVQCFSRYPDHMKQHDFFKEAMPEGYVQERTIFFKKDGNYGGRAEVKFEGDTLVNRIELKGADFKEDGNILGHKLEYNYNSHNVYIMADKQKNGIKGNFKIRHNIEDGSVQLAEHYQQNTPIGDGPVLLPDGHYLSTQSALSKDPNEKRDHMVLLEFVTAAGITHGMDELYK,3.7488954,"E5K, Y66K, S86E, D102K, K107G, T108G, I128A, V163G, D180E, N198G",10
MSKREELFTGVVPIKVELDGDVNGHKFSVSGEGEGDAQYGKLTLKFICTTGKLPVPWPTLVTTLSYGVQCFSRYPDHMKQHDFFKSAMPEGSVQERTIFFKDDGNYKGRAEVKFEGDTLVNRIELKGADFKEDGNILGAKLEYNYNSHNVYIMADKQKNGIKGNFKIRHNIEDGSVQLAEHYQQNTPIGDGPVLLPDNHYLSTQSALSKDPNEKRDHMVLLEFVTAAGIKHGMDELYK,3.7624323,"G4R, L15K, T38Q, Y92S, T108G, I128A, H139A, V163G, D180E, T230K",10
MSKGEELFTGVVPILVELDGDVNGHKFSVSGEGEGDATYGKLTLKFICTTGKLPVPWPTLVTTLSYGVQCFSRYPDHMKQHPFFKSAMPEGYVQERTIFGKDDRNYKGRAEVVFEGDTLVNRIELKGADFKEVGNILGHKLEYNYNSHNVYRMADKQKNGIKGNFKIRHNIEDGSVQLAEHYQQNTPIGDGPVLLPDNHYLSTQSALSKDPNEKRDHMVLLEFVTAAGITHGMDELYK,2.8778543,"D82P, F100G, G104R, T108G, K113V, I128A, D133V, I152R, V163G, D180E",10
MSKGEELFTGVVPILVELDGDVNGHKGSVSGEGEGDATYGKLTGKFICTTGKLPVPWPTLVTTLSYGVQCFSRYPDHMKQHDFFKSAMPEGYVQERTIFFKDDGNYKGRAEVKFEGDTLVNRIELKGADFKEDGNILGHKLEYNGNSHNVYIMADKQKNGGKGNFKIRHNIEDGSVQLAEHYQQNTPIGDGPVLLPDNHYLSTQSALSKDPNLKRDHMVLLEFVTAAGIRHGMDELYK,3.6099534,"F27G, L44G, T108G, I128A, Y145G, I161G, V163G, D180E, E213L, T230R",10
MSKGEELFTGVVPILVELDHDVNGHKFSVSGRGEGDATYGKLTLKFICTTGKLIVPWPTLVTTLSYGVQCFSRYPDHMKQHDKFKSAMPEGYVQERTIFFKDGGNYKGRAEVKFEGDTLVNRIELKGADFKEDGNILGHKLEYNYNSHNVYIDADKQKNGIKGNFKIRHNIEDGSVQLAEHYQQNTPIGDGPVLLPDNHYLSTQSALSKDPNEKRDHMVLLEFVTAAGITHGMDELYK,3.5758984,"G20H, E32R, P54I, F83K, D103G, T108G, I128A, M153D, V163G, D180E",10
MSKGEELFTGVKPILVELDGDVNGHQFSVSGEGEGDATYGKLTLKGICTEGKLPVPWPTLVTTLSPGVQCFSRYPDHMKQHDFFKSAMPEGYVQERTIFFKDDGNYKGRAEVKFEGDTLVNRIELKGADFKEDGNILGHKLEYNYNSHNVYIMADKQKNGIKGNFKIRHNIEDGSVQLAEHYQQNTPIGDGPVLLPDNHYLSTQSFLSKDPNEKRDHMVLLEFVTAAGITHGMDELYK,3.6849887,"V12K, K26Q, F46G, T50E, Y66P, T108G, I128A, V163G, D180E, A206F",10
MSKGEELFTGVVPILEELDGDRNGHKFAVSGEGEGDATYGVLTLKFICTTGKLPVPWPTLVTTLSYGVQCFSRYPDHMKQHDFFKSAMPEGYVQERTIFFKDDGNYKGRAEVKFEGDTLVNRIELKGADFKEDKNILGHKLEYNYNSHNVYIMADKQKNGIKGNFKIRHNIEDGSVQLAEHYQQNTPIGDGAVLLPDNHYLSTQSALSKDPNEKRDHMVLLEFVTAAGITHGMDELYK,3.8158946,"V16E, V22R, S28A, K41V, T108G, I128A, G134K, V163G, D180E, P192A",10
MSKGEELFTGVVPILVELDGDVNGHKFSVSGEGEGDATYGKLTLKFICTTGKLPVPWPTLVTTLSYGVQCFSRYPDHMKQHDFFKSAMPEGYVQEREIFFKDDGNYKGRAEVKFEGDFLVNRIELKGADFKEDGNIKGHKLEYNYNSHNVYIMADKQKAGIKGNFKIRHNIEDGSVQLAEHYQQNTPIGDGPVLLPDNHYLSTQSALSKDPNEKRDHMVLLEEVTAAGITHGADELYK,3.8741527,"T97E, T108G, T118F, I128A, L137K, N159A, V163G, D180E, F223E, M233A",10
MSKGEELFTGVVPIAVELDGDVNGHKFSVSGEGEAEATYGKLTGKFICTTGKLPVPWPTLVTTLSYGVQCFSRYPDHMKPHDFFKSAMPEGYVGERTIFFKDDGNYKGRAEVKFEGDTLVNRIELKGADFKEDGNILGHKLEYNYNSHNVYIMADKQKNGIKGNFKIRHNIEDGSVQLAEHYQQNTPIGDGPVLLPDNHYLSTQSALSKDPNEKRDHMVLLEFVTAAGITHGMDELYK,3.5554874,"L15A, G35A, D36E, L44G, Q80P, Q94G, T108G, I128A, V163G, D180E",10
MSKGEELFTGVVPILVELDGDVNGHKFSVSGEGEGDATYGKLTLKFICTTGKLPVPWPGLVTTLSYGVQCFSRYPDHMKQHDFFKSAMPEGYVQERTIFFKDDGNYKGRAEVKFEGDTLVNRAELKFADFKEDGNILGHKLEYNYNSHNVYIMADKQKNGIKGNFKIRHNIEDGSVQLAEHYQQNTPIGDGPVLLPDEHYLSQQSALSKDPNEKRDHMVALEFVTAAGITHGMDELYK,3.7546244,"T59G, T108G, I123A, G127F, I128A, V163G, D180E, N198E, T203Q, L220A",10
MSKGEEKFTGVVPILVELDGDVNGHKFSVSGEGEGDATYGKLTLKFICTTGKLPVPWPTLVTTLSYGVQCFSRYPDHFKQHDFFKSAMPEGYVQERTIFFKDDGFYKGRAEVKFEGDTLVNRIELKGADAKEDGNILGHKLEYNENSHNVYIMADKQKNGIKGNFKIRHNIEDGSVQLAEHYQQNTPIGDGPVLLPDNHYLSTQSALSKDPNERRDHMVLLEFVTAAGITHGMDELYK,3.8692722,"L7K, M78F, N105F, T108G, I128A, F130A, Y145E, V163G, D180E, K214R",10
MSKGEELFTGVVPILVELDGDVNGHKFSVSGEGEGKATYGKLTLKFICTTGKLPVPWKTKVTTLSYGVQCFSRYPDHMKQHDFFKSAMPEGYVQERTIFFKDDGNYKGRAEVKFEGDTLVNRIELKGADFKEDGNILGHKLEYNYNSHNVAIAADKQKNGIKGNFKIRHNIEDGSVQLAEHYQQNTPIGDGPVLLPDGHYLSTQSALSKDPNEKRDHMVLLEFVTAAGITHGMDELYK,3.8011208,"D36K, P58K, L60K, T108G, I128A, Y151A, M153A, V163G, D180E, N198G",10
