Sequence,Score,Mutations,Number of Mutations
MSKGEELFTGVVPIGVELDGDFNGHKFSVSGEGEGDATYGKLTLKFICTTGKLPVPWPTLVTTLSYGVQCFSRYPDHMKQHDFFKSAMPEGYVQERTIFFKDDGNYKGRAEVKFEGDALVNRIELKGADFKEDGNILGHKLAYNYNSHNVYIMADKQKNGIKGNFKIRHNIEDGSVQLAEHYKQNTPIGDGPALLPDNHYLSTQSALSKDPNEKRDHMVLLEFVTAAGITHGMDELYK,2.9498982,"L15G, V22F, T108G, T118A, I128A, E142A, V163G, D180E, Q183K, V193A",10
MAKGEELFTGVVPILVELDGDVNGHKFSVSGEGEGDATYGKLTLKFICTTGKKPVPWPTLVTTLSYGVQCFSRYPDHMKQHDFFKSAMPEKYVQERTIFVKDDGNYKGRAEVKFEGDTLVNRIELKGADFKEDGNILGHKLEYNYNSHNVYIMADKQKNGIKGNFKIRHNKEDGSVQLAEHYQQNTPIGDGPVLLPDNHYLSTQSALSKDPNEKRDHGVLLEFVTAAGITHGMDELYK,3.4594328,"S2A, L53K, G91K, F100V, T108G, I128A, V163G, I171K, D180E, M218G",10
MSKGEELFTGLVPILVELDGDVNGHKFSVSGEGEGDATYGKLTLKFICTTGKLPVPEPTLVTTLSYGVQCFSRYPDHMKQHDFFESAMPEGYVQERTIFFKDDGNYKGRAEVKFEGDTLVNRIELKGADFKEDGNILGHKLEYNYNSHNVYEMADKQKNGIKGNFKIRHNIEDGKVQLAEHYQQNTPIGDGPVLLPDNHYLSTQSALSKKPNEKRDHMVLLEFVTAAGITHGMDELYK,2.9464145,"V11L, W57E, K85E, T108G, I128A, I152E, V163G, S175K, D180E, D210K",10
MSKGEELFTGVVPILVELDGDVNGHNFSVSGEGEGDATYGKLTLKFICTTGKLPVPWPTLVTTLSYGVQRFSRYPDHMKQHDFFKSAMPEGYVQERTIFFKDKGFYKGRAEVKFEGDTLVNRIELKGADFKEDGNILGHKLEYNYNSHNVYIDADKQKNGIKGNFKIRHNIEDGSVQLAEHYQQNTPVGDGPVLLPDNHYLSTQSALSKDPNEKRDHMVLLEFVTAAGITHGMDELYK,3.375893,"K26N, C70R, D103K, N105F, T108G, I128A, M153D, V163G, D180E, I188V",10
MSKGEELFTGVVPILVELDGDVNGHKFSVSGEGEGDATYGKLTLKFICTTGKLPVPWPTLVTTLSYGVQCFSRYPKHMKQHDYFKSAMPEGYVQERTIFFKDDGNGKGRAEVKFEGDTLVNRIELKGADFKEDGNILGHKLEYNYNSHNVYVMADKQKNGGKGNFKIRHNIEDGSVQLAEHYQQNTPIGDGPVLLPDNHYLSTQSALSKDPNEKRDEMVLLEFVTAAGITHGMDELYK,3.3802361,"D76K, F83Y, Y106G, T108G, I128A, I152V, I161G, V163G, D180E, H217E",10
MSKGEELFTGVVPILVELDGDVKGHKFSVSGEGEGDATYGKLTLKFICTTGKLPVPWPTLVTTLSYGVQCFSRYPDHMKQHDFFKSAMPEGYVGERTIFFKDDGNYKGRAEVKKEGDTLVNRIELKGADFKEDGNILGHKKEYNYNSHNVYIMADKQKNGIKGNFKIRHNIEDGSVQLAEHYQQNTPIGDGPVLLPDNHYLSTQSAKSKDPNEKRDHMVLLEFVTAAGITHGMDELKK,3.56483,"N23K, Q94G, T108G, F114K, I128A, L141K, V163G, D180E, L207K, Y237K",10
MSKGEELFTGVVPILVELDGDVNGHKFSVSGEGEGDAVYGKLTLKFICTYGKLPVPWPTLVTTLSYGVQCFSRYPDHMKQHDFFKSAMPEGYYQERTIFFKDDGNYKGRAEVKFEGDTLVNRIELKGADFKEDGNILGHKLEYNYISHNVYIMADKQKNGIKGNFKIRHNIEDGSVQLAEHYQQNTPIGDGPVLLKDNHYLSTQSALSKDPNEKRDHMVLLEFRTAAGITHGMDELYK,3.8409224,"T38V, T50Y, V93Y, T108G, I128A, N146I, V163G, D180E, P196K, V224R",10
MSKGEELFTGVVAILVELDGDVNGHKKSVSGEGEGDATYGKLTLKFICTTGKLPVPWPTLVTTLSYGVQCFSRYPDHMKQHDFFKSAMPEGYVQERTIFFKDDGNYKGRAEVKFEGDTLVNRIELKGADFKEDGNILGHKLEYNYNSHNVYIMARKQKNGIKGNFKIRHNIEDGSVQLAEHYQQNEPIGDGPVLLPDNHYLSTQSALSKDPNEKRDHMVLLEFVTAAGITKGMDVLYK,3.668878,"P13A, F27K, T108G, I128A, D155R, V163G, D180E, T186E, H231K, E235V",10
MSKGEELFEGVVPILVELDGDVNGHKFSVSGEGEGDATYGKLTLKFICTTKKLPVPWPTLVTTLSYGVQCFSRYPDHMKQHDFFKSAMPEGYVQERTEFFKDDGNYKGRAEVKFEGDTLVNREELKGADFKEDGNVLGHKLEYNGNSHNVYIMADKQKNGIKGNFKIRHNIEDGSVQLAEHYQQNTPIGDGPVLLPDNHYLSTQSALSKDPNEKRDHMVLLEFVTAAGITHGMDELYK,3.7625742,"T9E, G51K, I98E, T108G, I123E, I128A, I136V, Y145G, V163G, D180E",10
MSKGEELFTGVVPILVELDGDVNGHKFSVSGVGEGDATYGKLTLKFYDTTGKLPVPWPTLVTTLSYGVQCFSRYPDHMKQHDFFKSAMPEGYVQERTIFFKDDGNYKGRAEVKFEGDTLVNRIELKGADFKEDGNILGHKLEYNYNSHNVYIMADKQKNKIKGNFKIRHNIEDGSVCLAEHYQQNTPIGDGPVLLPDNHYLETQSALSKDPNEKRDHMVLLEFVTAAGITHGMDELYK,3.81023,"E32V, I47Y, C48D, T108G, I128A, G160K, V163G, Q177C, D180E, S202E",10
MSKGEELFTGVVPILVELDGDVNGHKFSVSGEGEGDATYGKLTLKFIDTTGKLPVPWPTLVTTLSYGVQCFSRYNDHMKQDDFFKSAMPEGYVQERTIFFKDDGNYKGRAEVKFEGDTLVNEIEEKGADFKEDGNILGHKLEYNYRSHNVYIMADKQKNGIKGNFKIRHNIEDGSVQLAEHYQQNTPIGDGPVLLPDNHYLSTQSALSKDPNEKRDHMVLLEFVTAAGITHGMDELYK,3.6345544,"C48D, P75N, H81D, T108G, R122E, L125E, I128A, N146R, V163G, D180E",10
MSKGEELFTGVVPILVELDGDVNGHKFSVSGEGEGDAKYGKLTLKFICTTGKLPVPWPTLVTTESYGVQCFSRYPDHMKQHDFFKSAMREGYVQERTIFFKDDGNYKGRAEVKFEGDTLVNRIELKGADFKEDGNILGHKLEYNYNSHNVYIMANKQKNGIKGNFKIRHNIEDGSVQLAEHYQQNTPIKDGPVLLPDNHYLSTQSALSKDPNEKRDHMVLEEFVTAAGITHGMDELYK,3.80754,"T38K, L64E, P89R, T108G, I128A, D155N, V163G, D180E, G189K, L221E",10
MSKGEELFTGVVPILVELDGDVNGHKFYVSGEGEGDATYGKLTLKFNCTTGKLPKPWPTLVTTLSYGVQCFSRYPDHMKQHDFFKSAMPEGYVQERTIFFKDDGNYKGRAEVKFEGDTLVNRIELKGADFKEDGNILGHKLEYNYNSHNVYIMADKQKNGIKGNFKIRHNREDGSVQLAEHYQQNTPIGDGPVLLADNVYLSTQSALSKDPNEKRDHMVLLEFVTAAGITHGMDELYK,3.6149676,"S28Y, I47N, V55K, T108G, I128A, V163G, I171R, D180E, P196A, H199V",10
MSKGEELFTGVVVILVELAGDVNGHKFSVSGEGEGDATYGKLTLKFICTTGKLPVPWPRLVTTASYGVQCFSRYPDHMKQHDFFKSAMPEGYVQERTIFFKDDGNYKGRAEVKFEGDTLVNRIELKGADFKEDGNILGHKLEYNYNSHNVYIMADKQKNGIKGNFKIRHNIEDGSVQLAEHEQQNTPIGDGPVLLPDNHYLSTQSALSKDPNEKRDHMVLLEFVTAAGITHGMDEKYK,3.822701,"P13V, D19A, T59R, L64A, T108G, I128A, V163G, D180E, Y182E, L236K",10
MSKGEALFTGVVPILVELDGDVNGHKFSVSGEGEGDATYGKLTLKFICTTGKLPVPWPTLVTTLEYGVQEFSRYPDHMKQHDFFKSAMPEGYAQERTIFFKDDGNYKGRAEVKFEGDTLVNRIELKGADFKEDGNILGHKLEYNYNSHNVYIMADKQKNGIKGNFKIRHNIEDGSVQLAEHYQQNTPIGDGPVLLPDNHYLSTQSALSKDPNEKRDHQVLLEFVNAAGITHGMDELYK,3.429174,"E6A, S65E, C70E, V93A, T108G, I128A, V163G, D180E, M218Q, T225N",10
MSKGEELFTGVVPIAVEEDGDVNGHKFSVSGEGEGDATYGKLTLKFICTTGKLPVPWPTLVTTESYGVQCFSRYPDHMKQHDFFKSAMPEGYQQERTIFFKDDGNYKGRAEVKFEEDTLVNRIELKGADFKEDGNILGHKLEYNYNSHNVYIMADAQKNGIKGNFKIRHNIEDGSVQLAEHYQQNTPIGDGPVLLPDNHYLSTQSALSKDPNEKRDHMVLLEFVTAAGITHGMDELYK,3.696866,"L15A, L18E, L64E, V93Q, T108G, G116E, I128A, K156A, V163G, D180E",10
MSKGEERFTGVVPILVELDGDVNGHKFSVSGEGEGDATYGKLTLKFICTTGKLPVPWPTLVTTLSYGVQCFSRYPDHMEQHDFFKSAMPEGYVQERTIFFKDDGNYKGRAIVKFENDTLVNRIELKGADFKEDGNILGHFLEYNYNSHNKYIMADKQKNGIKGNFKIRHNIEDGSVQLAEHYQQNTPIGDGPVLLPDNHYLSTQSALSKDPNEKRDHMVLLEFVTAAGITHGMDELYK,3.7657604,"L7R, K79E, T108G, E111I, G116N, I128A, K140F, V150K, V163G, D180E",10
MSKGEELFTGVVEILVELDGDVNGHKFSVSGEGEGDATYGKLTLKFKDTTGKLPVPWPTLVTTLSYGVQCFSRYPDHMKQHDFFKSAMPEGYVQERTIFFKDDGNYKGRAEVKFEGDTLVNRIELKGADFKEDGNILAHKLEVNYNSHNVYIMADKQKNGIKGNFKIRHNIEDGSVQLAEHYQQNTPIGDGPVELPDNHYLSTQSALSKDPNEKRDHMVLLEFVTAAGITHGMDELYK,3.7778707,"P13E, I47K, C48D, T108G, I128A, G138A, Y143V, V163G, D180E, L194E",10
MSKGEELFTGVVPILVELDGDVNGHKFSVSGEGEGDAAYGKLTGKFICTTGKLNVPWPTLVTTLSYGVQCFSRYPDHMKQHDFFKSAMPEGYVQERTEFFKDDGNYKGRAEVKFEGDTLVNRIELKGADFKEDGNILGHKAEYNYNSHNVYIMADKQKNGIKGNEKIRHNIEDGSVQLAEHYQQNTPIGDGPVLLPDNHYLSTQSALSKDPNEKRDHMVLLEFVTAAGITHGMDELYK,3.6800203,"T38A, L44G, P54N, I98E, T108G, I128A, L141A, V163G, F165E, D180E",10
