Sequence,Score,Mutations,Number of Mutations
MSKGEELFTGVVPILVELDGDVNGHKFSVSGEGEGDATYGKLTLKFICTTGKLPVPWPTLVTTLSYGVQCFSRYPDHMKQMDFFKSAMPEGEVQERTIFFKDSGNYKGRAEVKFEGDTLVNRIELKGADFKEDDNILGHKLEYNYNSHNVYIMADKQKNGIKGNFKIKHNIEDGSVQLAEHYQQNTPIGDGPVLLPANHYLSTQSALSKDPNEKRDHMVLLEFVTAAGITHGMDELYK,3.5108254,"H81M, Y92E, D103S, T108G, I128A, G134D, V163G, R168K, D180E, D197A",10
MSKGEKLFTGVVPILVELDGDVNGHKFSVSGEGKGDATYGKLTLKFICTTGKLPVPWPTLVTTLSYGVQCFSRYPDHMKQHDFFGSAMPEGYVQERTIFFKDDGNYKGRAEVKAEGDTLVNDIELKGADFKEDGNILGHKLEYNYNSHNVYIMADKQKNGIKGNFKIRHNIEDGSVQLAEHYQQNTPIGDGPKLLPDNHYLSTQSALSKDPNEKRDHMVLLEFVTAAGITHGMDELYK,3.6156247,"E6K, E34K, K85G, T108G, F114A, R122D, I128A, V163G, D180E, V193K",10
MSKKEELFNGVVPILVELDGDVNGHKFSVSGEGEGDATYGKLTLKFICTTGKLPVPWPTLVTTLSYGVQCFSRYPDHMKQHDFFKSAMPEGYVQERTIFFKDDKNYKGYAEVKFEKDTLVNREELKGADFKEDGNILGHKLEYNYNSHNVYIMADKQKNGIKGNFKIRHNIEDGSVQLAEHYQQNTPIGDGPVLLPDNHYLSTQSALSKDPNEKRDHMVLLEFVTAAGITHGMDELYK,3.8321362,"G4K, T9N, G104K, T108G, R109Y, G116K, I123E, I128A, V163G, D180E",10
MSKGEELFTGVVPILVELDGDVNGHKFSVSGEGEGDATYGKLTLKFICTTGKLPVPWPGLVTTLSYGVQCFSRYPDHMKQHDFFKSAMPEGYVQERTIFFKDDGNYKGRAEVKFEGDTLVNFIELKGADFKEDGNILGHALEYNYNSHNVYIMADKQKNGIKGNFKIRHNIEDGSGQLAEHYQQNTPIGDGPVLLPDEHYLSTQSALSSDPNEKRDHMVLLEFVTAAGITHGMDELYK,3.8311357,"T59G, T108G, R122F, I128A, K140A, V163G, V176G, D180E, N198E, K209S",10
MSKREELFTGVVPILVELDGDVNGHKFSVSGEGEGDATYGKLTLKFICTTGKLPVPWPTLVTTLSYGVQGFSRYPDHMKQHDFFKSEMPEGYVQERTIFFKDDGNGKGRAEVKFEGDTLVNRIELKGADFKEDGNILGHKLEYNYNSHNVYIMADKQKNGIKGNFKIRHNIEDGSVQLAEHYQQNTPIGDGPVLLPDNHYLSTQSALSKDPNEKRDHMALLEFRTAAGITHGMDELYK,3.0319183,"G4R, C70G, A87E, Y106G, T108G, I128A, V163G, D180E, V219A, V224R",10
MSKGEELFTGVVPILVELDGDVNGHKGSVSGEGEGDATYGKLTLKFICTTGKLPVPWPTLVTTLSYGVQCCSRYPDHMKGHDFFKSAMPEGYVQERTIFFKDDGNYKGRAEVKFEGGTLVNRIELKGADFKEDGNILGHKLEYNYNSHNVYIMADKQKNGIKGNFKIRHNIEDGSVELAEHYQQNTPIGKGPVLLPDNHYLSTQSALSKDPNEKRDHMVLLEFVTAAGITHGMDELYK,3.7415745,"F27G, F71C, Q80G, T108G, D117G, I128A, V163G, Q177E, D180E, D190K",10
MSKGEELFTGVVPILVELDGDVNGHKFSVSGIAEGYATYGKLTLKFICTTGKLPVPWPTLVNTLSYGVQCFSRYPDHMKQHDFFKSAMPEGYVQERTIFFKDDGNYLGRAEVKFEGDTLVNRIELKGADFKEDGNILGHKLEYNYNSHNVEIMADKQKNGIKGNFKIRHNIEDGSVQLAEHYQQNTPIGDGPVLLPDNHYLSTQSALSKDPNEKRDHMVLLEFVTAAGITHGMDELYK,3.4293451,"E32I, G33A, D36Y, T62N, K107L, T108G, I128A, Y151E, V163G, D180E",10
MSKGEELFTGVVPILVELDGDRNGHKFSVSGEGEGDGTYGKLTLKFICTTGKLPVPWPTLVTTLSYGVQCFSRYPDHMKQHDFFKSAMPEGYVQERTIFFKDDGNYKGRAEVKFEKDTLVNRIELKGADFKEDGNILGHKLEYNYNSHNVYIMAEKQKNGIKGNFKGRHNIEDGSVQLAEHYQQNTPIGDGPVLLPDNHYLSTQSALSKDPNGKRDHMVLLEFVTAAGITHGMDELYK,3.2429647,"V22R, A37G, T108G, G116K, I128A, D155E, V163G, I167G, D180E, E213G",10
MSKGEELFTGVVPILDELDGDVNGHKFSVSGEGEGDATYGKLTLKFICTTGKLPVPWPTAVTTLSYGVQCFSRYPDHMKQHDFFKSAMPEGYVQERTIFFKDDGNYKGRAEVKFEGDTLVNRIELKGADFKEDGNILGHKLEYNYNSHNVYIMADKQKNGIKGGFKIAHNIYDGSVQLAEHYQQNTPIGDGPVLLPDNHYLSTQSALSKDPNEKRDHMVLLEKVTAAGITHGMDELYK,3.096584,"V16D, L60A, T108G, I128A, V163G, N164G, R168A, E172Y, D180E, F223K",10
MAKGEELFTGVVPILVELDGDVAGHKFSVSGEGEGDATYGKLTLKFICTTGKLPVPWPTLVTTLSYGVQCFSRYPDHMKQHDFFKSAMPEGYVQERTIFFKDDGNYKGRAEVKFEGDTLVNRIELKGADFKEDGNILGHKLEYNYNSHNVYIMADKQKGGIKGNFKGRHNIEDGSVQLAEHYQQNTPIGDGPVLLPDNHYLSTQSELSKDPNEKADHMVLLEFVTAAGITHGMDELYK,3.8985996,"S2A, N23A, T108G, I128A, N159G, V163G, I167G, D180E, A206E, R215A",10
MSKGEELFTGVVPILVELDGDVNGHKFSVSGEGEGDATYGKLTLKFICTTGKLPVPWPTLVTTLSYGVQCFSRYPDHMKQHDFFKSAMPEGYVQERTKFFKDDGNYKGRAEVKFEGDTLVNRIELKGAAFKEDGNILGHKLEYNYNSHAVYIMADKQKNGIKGNFKIRHNIEDGYVQLEEHYQQNTPIGDGPVLLPDNHFLSTQSALSKDPNEKRDHMVLLEFVTAAGITHGMDELYK,3.8425848,"I98K, T108G, I128A, D129A, N149A, V163G, S175Y, A179E, D180E, Y200F",10
MSKGEELFTGVVPILVELDGDVNGHKFSVSGEGEGDATYGKGTLKFICTTGKLPVPWPTLVTTLSYGVQCFSRYPDHKKQHDFFKSAMPEGYVQERTIFFKDDGNYKGRAEVFFEGDTLVNRIELKGADFKEDGNILGHKLEYNYNSHNVYIMADKQKNGIKGNFKIRHNIEDGSVQLAEKYQQNTPIGDGPVALPDNHYLSTQSALSKDPNEKRDHMVLLEFVTARGITHGMDELYK,3.6216884,"L42G, M78K, T108G, K113F, I128A, V163G, D180E, H181K, L194A, A227R",10
MSKGEELFTGVVPILVELDGDGNGHKFSVSGEGEGDATYGKLTLEFICTTGKLPVPWPTLVTTLSYGVQDFSRYPDHMKQHDFFKSAMPEGYVQERTIFFKDDGNYKGRAEVKFEGDTLVNRIELKGADFKEDGNILGHKLEYNYNSHNGYIMADKQKNGIKGNFKIRHNIEDGSVQLAEHYQQNTPIGDGPVLLPDNHYLSTQVALSKDPNEKRDHMVLLEFVTAAGVTHGMDELYK,2.0452993,"V22G, K45E, C70D, T108G, I128A, V150G, V163G, D180E, S205V, I229V",10
MSKGEELFTGVVPILVELDGDVNGHKFSVSGEGEGDATYGKLTGKFICTTGELPVPWPTLVTTLSYGVQCFSRYPDHMKQHDFFKSAMPEGYVQERTIFFKDDGNYKGRAEVKFEGDTLVNRIELKGADFKEDGNILGHKLEYNYNSHNVYIMADKQKNGIKGNFKIRHKIEDGSVQLAEHYQQNTPIGDGAVLLPDNHYLSTQKALSKDPNEKRDHMVLLEFVTAAGITHGADELYK,3.824228,"L44G, K52E, T108G, I128A, V163G, N170K, D180E, P192A, S205K, M233A",10
MSKGEELFTGVVPILVELDGDVNGAKFSVSGEGEGDATYGKLTGKFICTTGKLPVPWPTLVTTLSYGVQCFSRYPDHMKQHDIFKSAMPEGYVQERTIFFKDDGNYKGRAEVKFEGDTLVNRIELKGADFKEDGNILGHKLEYNYNSHNVYIMGDKQKNGIKGNFKIRHNIEDGSVQLAEHYQQNTPIGDGPVLLPDNHYLSTQSALSKDPNEKRDGMVLLEFVTAAGIAHGMDELYK,3.3649879,"H25A, L44G, F83I, T108G, I128A, A154G, V163G, D180E, H217G, T230A",10
MSKGEELFTGVVPILVELDGDVNGHKFSVSGEGEGDATYGKLTLKFICTTGKLPVPWPTLVTTLSYGVQCFSRYPDHMKQHDFFKSAMPEGYVQERTIFFKDDGNYKGRAEVKFEGDTLVNRIELKGADFKEDGNILGHKLEYNANSHNVYIMADKQKNGIKGNFVIRHNIEDGSVQLAEHYQQNTPIGDAPVLLPDKHYLSTQSALSKKPNEKRDHMVLLEFVTAAGITHGMDELIK,3.9287105,"T108G, I128A, Y145A, V163G, K166V, D180E, G191A, N198K, D210K, Y237I",10
MSKGEELFTGVVPILVELDGDVNGHKFSVSGIGEGDAKYGKLTLKFICTTGKLPVPWPTLVTTLSYGVACFSRYPDHMKQHDFFKSAMPEGYVQERTIFFKDDGNYKGRAEVKFEGDTLVNRIELKGADFKEDGNILGEKLEYNYNSHNVYIMADKQKNKIKGNFKIRHNIEDGYVQLAEHYQQNTPIGDGPVLLPDNHYLSTQSALSKDPNEKRDHMVLLEFVTAAGITHGMDELYK,3.8988476,"E32I, T38K, Q69A, T108G, I128A, H139E, G160K, V163G, S175Y, D180E",10
MSKGKELFTGVVPILVELDGDVNNHKFSVSGEGEGDATYGKLTLKFICTTGKLPVPWPTLNTTLSYGVQCDSRYPDHMKKHDFFKSAMPEGYVQERTIFFKDDGNYDGRAEVKFEGDTLVNRIELKGADFKEDGNILGHKLEYNYNSHNVYIMADKQKNGIKGNFKIRHNIEDGSVQLAEHYQQNTPIGDGPVLLPDNHYLSTQSALSKDPNEKRDHMVLLEFVTAAGITHGMDELYK,3.8014076,"E5K, G24N, V61N, F71D, Q80K, K107D, T108G, I128A, V163G, D180E",10
MSKGEELFTGAVPILVELDGDVNGHKFSVSGEGEGDATYGKLTLKFICTTKKLPVPWPTLVTTLSYGVQCFSRYPDHMKQHDFFKSAMPEGYVQERTIFFKDDGNYKGRAEVKFEKDTLVNRIELKGADFKEDGNILGHKLEYNYNSHNVYIMADKQKNGIKGNFKIRHNIEDGSVQLAEHYQQNTPIKDGPVLLPDNHYLSTQSALSKDPIEKRDHMVLLEFVTAAGITHGMDELAK,3.8895345,"V11A, G51K, T108G, G116K, I128A, V163G, D180E, G189K, N212I, Y237A",10
MSKGEELFTGVVPILVELDEQVNGHKFSVSGEGEGDATYGKLTLKFICTTGKGPVPWPTLVTTLSYGVQCFSRYPDHMKQHDFFKSAMPEGYVQERTIFFKDDGNYKGRAEVKFEGDTLVNRIELKGADFKEDGNILGHKLEYNYNKHNVYIVADKQKNGIKGNFKIRHNIEDGSVQLAEHYQQNTPIGDGPVLLPFNHYLSTQSALSKDPNEKRDHMVLLEFVTAAGITHGMDELYK,3.8479948,"G20E, D21Q, L53G, T108G, I128A, S147K, M153V, V163G, D180E, D197F",10
MSKGEELFTGVVPILVELDGDVNGHKFSVSGEGEADATYGKLTLKFICTTGKLPVPWPTLVTTLSYGVQCFSRYPDHMKQHDFFKSAMPKGYVQERTIFFKDDGNYKGRAEVKFEKDTLVNRIELKAADFKEDGNILGHKLEYNYNSHNVYIMADKQKNGIKGNFKIRHNIEDGSVQLAEHYQQNTPIGDGPVLLPDNHYLSTQSHLSKDPNEKRDHMVLLEFVTAAGITHGMDEVYK,3.829681,"G35A, E90K, T108G, G116K, G127A, I128A, V163G, D180E, A206H, L236V",10
MSKGEELFTGVVPILVELDGDVNGHKFSVSGEGEGDATYGKLTLKFIKTTGKLPVPWPTLVTTQSYGVQCFSRYPDHMKQHDFFKSAMPEGYVQERTIFFKDDGNYKGRAEVKFEGDTLGNRIELKGADFKEDGNILGHKLEYNYNSHNVYIMADKQKNGIKGNFKIVHNIEDGSVQLAEHYQQNTPIGDGPKLLPDNHYLSTQSALSKDPNEKRDHMVLLEFVTAAGIKHGMDELYK,3.4101284,"C48K, L64Q, T108G, V120G, I128A, V163G, R168V, D180E, V193K, T230K",10
MSKGEELFTGVVPILVELDGDVNGHKFSVSGEGKGDATYGKLTLKFICTTGKLPVEWPTLVTELSYGVQCFSRYPDHMKQHDFFKSAMPEGYVAERTIFFKDDGNYKGRAEVKFEGDTLVNRIELKGADFKEDGNILGHKLEYNYNSHNVYIMADKQKNGIKGNFKIRHNIEDGSVQLAEHYQQNTPIGDGPVLLPDNHYLSTQSALSKDPNEKRDHMVLLEFVTEAGIFHGMDELYK,3.773263,"E34K, P56E, T63E, Q94A, T108G, I128A, V163G, D180E, A226E, T230F",10
MSKGEELFTGVVPILVELDGDVNGHKFSESGEGEGDATYGKLTLKFICTTGKLPGPWPTLVTTLSYGVQCFSRYPDHKKQHDFFKSAMPEGYVQERTIFFKDDGNYKGRAEVKFEKDTLVNRIELKGADFKEDGNKLGHKLEYNYNSHNVYIMADKQKNGIKGNFKIRHNIEKGSVQLAEHYQQNTPIGDGPVLLPDNHYLSTQSALSKDPNEKRDHMVLLEFVTAAGITHGMDELYK,1.5368676,"V29E, V55G, M78K, T108G, G116K, I128A, I136K, V163G, D173K, D180E",10
MSKGEELFNGVVPIGVELDGDVNGHKFSVSGEGEGDATYGKLTLKFICTTGKLPVPWPTLVTTLSYGVQCFSRYPDHMKQHDFFKSAMPEGYEQERTIFFKDDGNYKGRAEVKFEGGTLVNRIELKGADAKEDGNILGHKLEYNYNSHNVYIMADKQKNGIKGNFKIRHNIEDGSVQLAEHYQQNTPIGDGPVLLPDNHYLSTQSALSKDPNEKRDHMVLLEFVKAAGITHGMDELYK,3.8626058,"T9N, L15G, V93E, T108G, D117G, I128A, F130A, V163G, D180E, T225K",10
MSKGEELFTGVVPILVEADGDVNGHKFSVSGEGEGDATYGKLTLKFICTTGKLPAPWPTLVTGLSYGVQCFSRYPDHMKQHDFFKSAMPEGYVQERTIFFKDDGNYKGRAEVKFEGDTLFNRIELKGADFKEDGNILGHKLEYNYNSHNVYIMADKQKNGIKGNFKIRHPIEDGSVQLAEHYQQNTPIGDGPVLLPDNHYLSTQSALSKDPNEKREHMVLLEFVTAAGITHGMDELYK,3.1539898,"L18A, V55A, T63G, T108G, V120F, I128A, V163G, N170P, D180E, D216E",10
MSKGEKLFTGVVPILVELDGDVNGHKGSVSGEGEGDATYGKLTLKFICTTGKLPVPWPTLVTTLSYGVQCFSRYPDHMKQHDFFKSAMPEGYVQERTIAFKDDGNYKGRAEVKFEGDTLVNRIELKGADFKEDGNILGGKAEYNYNSHNVYIMADKQKNGIKGNFKIRHNIEDGSVQLAEHYQQQTPIGDGPVLLPDNHYLSTQSALSKDPNEKRDHMVLLEFVTAAGITHGMDELYK,3.7345808,"E6K, F27G, F99A, T108G, I128A, H139G, L141A, V163G, D180E, N185Q",10
MSKGEELFTGVVPILVELDGDVNGHKFSVSGEGEGDATYGKLTLKFICTTGKKPVGWPTLVTTLSYGVQCFSRYPDHMKQHDFFKSAMPEGYVQERTIFFKDDGNGKGRAEVKFEGDTLVNSIELKGADFKEDGNILGHKLEYNYNSHNVYIEADKQKNGIKGNFKIRHNIEDGSVQLAEHYQQNTPIGDGPVLLPDNHYLSTQSALSKDPNEKRDHMVLLEFVEAAGITHGMDELYK,3.5209444,"L53K, P56G, Y106G, T108G, R122S, I128A, M153E, V163G, D180E, T225E",10
MSKGEELFTGVVPILVELDGDVNGHKFSVSGEGEGDATRGKLTLKEICTTGKLPVPWPTLVTTLSYGVQCFSRYPDHMKQHDFFKSAMPEGYVQERTIFFKDDGNYKGRAEVKFEGDTLVNRIELKGADFKEDGNILGHKKEYAYNSHNVYIMADKQKNGIKGNFKIRHCIEDGSVQLAEHYQQNTPIGDGPVLLPDNHYLSTQSACSKDPNEKRDHMVLLEFVTAAGITHGMDELYK,3.850854,"Y39R, F46E, T108G, I128A, L141K, N144A, V163G, N170C, D180E, L207C",10
MSKGENLFTGVVPILVELDGDVNGGKFSVSGEGEGDATYGKGTLKFICTTGKLPVPWPTLVTTLSYGVQCVSRYPDHAKQHDFFKSAMPEGYVQERTIFFKDDGNYKGRAEVKFEGDTLVNRIELKGADFKEDGNILGHKLEYNYNSHNVYIMADKQKNGIKGNFKIRHNIEDGSVQLAEHYQQNTPIGDGPVLLPDNHYLSTQSALSKDPNEKRDHMVLLEFVTAAGITHGADELYK,3.7654715,"E6N, H25G, L42G, F71V, M78A, T108G, I128A, V163G, D180E, M233A",10
MSKGEELFTGVVPILVELDGDVNGHKFSVSGEGEGDATYGKLTLKFICTTGKYPVPWETLVTTLSYGVQCFSRYPDHMKQHDFFKSAMPEGYEQERTIFFKDDGNYKGRAEVKFNGDTLVNRIELKGADFKEDGNILGHKLEYNYNSHNVYIMADKQKNGIKGNFKIRHNIEDGSAQLAEHYQANTPIGDGPVLLPDNHYLSTQSALSKDPNEKRDHMVLLEFVTAAGITHGMDELYK,3.808232,"L53Y, P58E, V93E, T108G, E115N, I128A, V163G, V176A, D180E, Q184A",10
MKKGEELFTGVVPILVELDGDVNGHKFSVSGEGEGDATYGKLTLKFICTTGKLPVPWPTLVTTLSYGVQCFSRYPAHMKQHDFFKSAMPEGYVQERTIFFKDDGNYKGRAEVKFEGDTGVNRIELKGADFKEDGNILGHGLEYNYNSGNVYIMADKQKNGIKGNFKIRHNIEDGSVQLAEHYQQNTPIGDGPVLLPDNHKLSTQSALSKDPNEKRDHMVLLEFVTAAGITHGMDELYK,3.8695254,"S2K, D76A, T108G, L119G, I128A, K140G, H148G, V163G, D180E, Y200K",10
MSKGEELFTGVVPILVELDGDVNGHKFSVSGEGEGDATYGKLTLKFIETTGKLPVPWPTLVTTLSYGVQCFSRYPDHMKQHDFFKSAMPEGYVQERTIFFKDDGNYKGRAEVKREGDTLVNRIELKGADFKEDGNILGHKLEYNYNSHNVAIMAAKQKNGIKGNFKIRHNIEDGSVQLAEHYQQNTPIGDGPVLEPDNHYLSTQSALSKDPNAKRDHMVLLEFVTAAGITHGMDELYK,3.4109483,"C48E, T108G, F114R, I128A, Y151A, D155A, V163G, D180E, L195E, E213A",10
MSKGEELFTGKVPILVELDGDVNGHKFSVSGEGEGDATYGKLTLKFICTKGKLPVPWPTLVTTLSYGVQCFSRYPDHMKQHDFFKSAMPEGYVQERTIFFKDDGNYKGRAEGKFEGDTLVNRIELKGADFKEDGNILGHKLEYNYNSHNVYIMADKQKNGIKGNFVIRHNIEDGSVQLAEHYQQNTPIGDGPALLPDNHYLSTQSALSKDPNEKRDHMVLLEFVTAAGITHGVDELYK,3.6163583,"V11K, T50K, T108G, V112G, I128A, V163G, K166V, D180E, V193A, M233V",10
MSKGNELFTGVVPILVELDGDVNGHKFSVSGEGEGDATYGKLTLKFICTTGKLPVPWPTLVETLSYGVQCFSRYPDHMKQHDFFKKAMPEGYVGERTIFFKDDGNYKGRAEVKFEGDTLVNRIEEKGADFKEDGNGLGHKLEYNYNSHNVYIMADKQKNGIKGNFKIRHNIEDGSVQLAEHYQQNTPIGDGPVLLPDNHYLSTQSALSKDPNEKRDHMVLLEFVTAAGITHGMDELYK,3.7226923,"E5N, T62E, S86K, Q94G, T108G, L125E, I128A, I136G, V163G, D180E",10
MSKGEELFTGVVPILVELDGDVNGHKFSVSGEGEGDATYGKLTLKFICTTGKLSVPWPTLVTTLSYGVQCFSRYPDHMKQHDFFKSAMPEGYVQEETIFFKDDGNYKGRAEVKFEGDTLVNRIELKGADFKEDGGILGHKLEYNYNSHNVYIMADKQKNGIKGNFEIRHNIEDGSVQLAEHYQQNTPIGDGPVLKPDNHYLSTQSALSKDPNAKRDHMVLLEFVTAAGITHGMDELYK,2.7404523,"P54S, R96E, T108G, I128A, N135G, V163G, K166E, D180E, L195K, E213A",10
MSKGEELFTGVVPILVELDGDVNGAKFSVSGEGEGDATYGKLTLKFICTTGKLPVPWPTLVTTQSYGVQCFSRYPDHMKQHDFFKSAMPEGYVQEGTIFFKDDGNYKGRAEVKFEGDTLVNRIELKGADFKEDGNILGHKLEYNYNSHNVYIQADKQKNGIKGNFKIRHNIEDGYVQLAEHYQQNTPIGDGPVLLPDNHYLSTQSALSKKPNEKRDHMVLLEFVTAAGITHGMDELYK,2.6506867,"H25A, L64Q, R96G, T108G, I128A, M153Q, V163G, S175Y, D180E, D210K",10
MSKGEELFTGVVPILVELDGDVNGHKFSVSGEGEGDATYGKLTLKGICTTGKLPVPWPTLVTTLSYGVQCFSRYPDHMKQHDFFKSAMPEGYVQERTIFFKDDGYYKGRAEVKFEGDTLVNRIELKGADFKEDGNILGHKLEYNYNSHNVYIMADKQKNGIKGNFKIRHYIEDGSVQLAEHYQQNTPIGDGPVLLPDNHYLETQSALSKDPKENRDHMVLLEFVTAAGITHGMDELYK,3.946426,"F46G, N105Y, T108G, I128A, V163G, N170Y, D180E, S202E, N212K, K214N",10
MSKGEELFTGVVPILVELDGDVNGHKFKVSGEGEGDATYGKLTLKFICTTGKLPVPWPTLVTTLSYGVQCFSRYPDHMKQHDFFKSAMPEGYVQERTIFFKDDGNYKGRAEVKREGDTLVNRIELKGADFKEDGNILGHKLEYNYNSHNVYIMADKQKNGIKGNFVIRHNIEDGSVQLAEHYQQNTPIGDGPVLLPDNHYLSTQSALSKDPKEKRDHMVLLEFVDAAGIGHGMDELYK,3.9213479,"S28K, T108G, F114R, I128A, V163G, K166V, D180E, N212K, T225D, T230G",10
MSKGEELFTGVVPILVKLDGDVNGHKGSVSGEGEGDATKGKLTLKFICTTGKLPVPWPTLVTTLSYGVQCQSRYPDHMKQHDFFKSAMPEGYVQERTIFFKDDGNYKGRAEVKFEGDTLVNRIELKGADFKEDGAILGHKLEYNYNSHNVYIMADKQKNGIKGNFKIRHNIEDGSVQLAEHYQQNTPIGDGPVLLPDNHLLSTQSALSKDPNEKRDHMVLLEFVTAAGITHGMDELYK,3.772243,"E17K, F27G, Y39K, F71Q, T108G, I128A, N135A, V163G, D180E, Y200L",10
MSKGEELFTGVVPILVELDGDVNGHKFSVSGEGEGDATYGKLTLKFICTTKKLPVPAPTLVTTLSYGVQCFSRYPNHMKQHDFFKAAMPEGYVQERTIFFKDDGNYKGRAEVKFEGDTLVERIELKGADFKEDGNILGHKLEYNYNSHNVYIMADKQKNGIKGNFKIRHNIEDGSVQLAEHYQQNTPIGDGPVLLPDNHYLSTQSALSKDPNEKRDHMVLLEFVKAAGITHGMDELYK,3.730235,"G51K, W57A, D76N, S86A, T108G, N121E, I128A, V163G, D180E, T225K",10
MSKGEELFTGVVPILVELDGDVNGHKFSVSGEGEGDATYGKLTLKFICTTGKLPVPWPTLVTTLSYGVACFSRYPDGMKQADFFKSAMPEGQVQERTIFFKDDGNYKGRAEVKFEGDTLVNRIELKGADFKEDGNILGHKLEYNYNSHNVYIMADKQKNGIKGNFKIRHNIEDGSVQLAEHYQQNTPIGDGPVLLPDNHYLSTQRALSKDPNEKRDHMVLLEAVTAAGITHGMDELYK,3.6756945,"Q69A, H77G, H81A, Y92Q, T108G, I128A, V163G, D180E, S205R, F223A",10
MSKGEELFTGVVPILVEKDGDVNGHKFSVSGEGEGDATYGKLVLKFICTTGKLPVPKPTLVTTLSYGVQCFSRYPDHMKQHDFFKSAMPEGYVQERTIFFKDDGNYYGRAEVKFEGDTLVNRAELKGADFKEDGNILGHKLEYNYNSHNVYIMADKQKNGIKGNFKIRHNIEDGSVQLAEHYAQNTPIGDGPVLLPDNHYLSTQSALSKDPNEKRDHMVLLEFVTAAGITHGMDELYK,3.4991548,"L18K, T43V, W57K, K107Y, T108G, I123A, I128A, V163G, D180E, Q183A",10
MSKGEELFTGVVPILVELDGDKNGHKFSVGGEGEGDATYGKLTLKFICTTGKLPVPWPTLVTTLQYGVQCFSRYPDHMKQHDFFKSAMPEGYVQERSIFFKDDGYYKGRAEVKFEGDTLVNRIELKGADFKEDGNILGHKLEYNYNSHNVYIMADKQKNGIKGNFKIRHNIEDGFVQLAEHYQQNTPIGDGPVLLPDNHYLSTQSALSKDPNEKRDHMVLLEFVTAAGITHGMDELYK,3.8302689,"V22K, S30G, S65Q, T97S, N105Y, T108G, I128A, V163G, S175F, D180E",10
MSKGEELFTGDVPILVELDGDVNGHKFSVSGEGEGDATYGKLTLKFICTTGKLPVPWPTLVTTLSYGVQCFSRYPDHMKQHDFFKSAMPEGYVAERTIFFKDDGNYKGRAEVKFEGDTGVNRIELKGADFKEDGNINGHKLEYNYNSHNVYIMADKQKNGIKGNGKIRHIIEDGSVQLAEHYQQNTPIGDGPVLLPDNHYLSTQSALSKDPNEKRDHMVLLEFVTAAGITHGMDELYK,3.7507033,"V11D, Q94A, T108G, L119G, I128A, L137N, V163G, F165G, N170I, D180E",10
MSKGEELATGVVPILVELDGDVNGHKFSVSGEGEGDATYGKLTLKFICTTGKLPVPWPTLVTTLSYGVQCFSRYPDHMKQHDFFKSAMPEGYVQGRTIFFKDDGNYKGRAEVKFEGDTLVNRIELKGADFKEDGNILGHKLEYNANSHNVEIMADKQKNGIKGNFKIRHNIEDGSVQLAEHYQQNTPIGDGPVLLPDNHYLSTQSALKADPNEKRDHMVLLEFVTAAGITHGMDELYK,3.697895,"F8A, E95G, T108G, I128A, Y145A, Y151E, V163G, D180E, S208K, K209A",10
MSKGKELFTGVVPILVELDGDVNGHKFSVSGEGEGDATYGKLTLKFICTTGKLPVPKPTLVTTLSYGVQCFSRKPDHMKQHDFFKSAMPEGYVQERTIFFKDDGNYKGRAEVKFEGDTLVNRIELKGADFKEDGNILGHKLEYNYNSHNVYIMADKQKNGIKGNFKIRHNKEDGSVQLAEHYQQNTPIGDGPVLLPDNHYLSTQSALSKDPNEKRDHMVLLEFVTRAGIPHGMDELYK,3.7544007,"E5K, W57K, Y74K, T108G, I128A, V163G, I171K, D180E, A226R, T230P",10
MSKGEELFTGVVPILVELDGDVNGHKFSVSGEGEGDATYGKLTLKFICTTGKLPVPWNTLVTTLSYGVQCFSRYPDHMKQHDFFKSKMPEGYVQERTIFFKKDGNYKGRAEVKFEGDTLVNRIELKGADAKEDGNILGHKLEYNYNSHNVYIMADKQKNGIKGNFKIRHNIEDGSVQLAEHYQQNTPIGDGPVLLPDNHYLSKQEALSKDPNEKRDHMVLLEFVTAAGITHGMDELYK,3.7889562,"P58N, A87K, D102K, T108G, I128A, F130A, V163G, D180E, T203K, S205E",10
MSKGEELFGGVVPILVELDGDVNGHKFSVSGEGEGDATYGKLTLKFICTTGKLPVEWPTLVTTLSYGVQCFSRYPDHMKQHDFFKSAMPEGYVQERTIFFKDDGNYKGRAEVKFEVDTLVNRIELKGADFKEDGNILGHKLEYNYNSHNVYIMADKQKGKIKGNFKIRHNIEDGSVQLAEHYQQNTPIGDGPVLLPDGHYLSTQSALSKDPNEKRDHMVLLEFVTAAGITHGMDELYK,3.9366884,"T9G, P56E, T108G, G116V, I128A, N159G, G160K, V163G, D180E, N198G",10
MSKGEELFTGVVPILVELDGDVNGHKFSVSGEGEGDATYGKLTLKFICTTGKLPVPWPTLKTTLSYGVQCFSRYPDHMKQHDFFKSAMPEGYVQERTIFFKDDGNYKGRAEVKFEGDTLVNRIGLKGADFKEDGNILGHKLAYNYNSHNVEIMADKQKNGIKGNFKIRHNIEDGSVQLAEHYQQNTPIGDGPVLLPDSHYLSTQSALSKDPNAKRDHMVLLEFVTAAGITHGMDELYK,3.4595132,"V61K, T108G, E124G, I128A, E142A, Y151E, V163G, D180E, N198S, E213A",10
MSKGAELFTGVVPILVELDGDVNGHKFSVSGEGEGDATYGKLTLKFICTTGKLPVPWETLVTTLSYGVQCFSRYPDHMKQHDFFKSAMPEGYVAERTIFFKDDGNYKGRAEVKFEGDTLVNRIELKGADFKEDGNILGHKLEYNYESHNVYIMADKQKNGIKGNFKIRHNIEDGSVQLAEAYQQNTPIGDGPVLLPDNHYLSTQSALSKDGNEKRDHMVLLEFVTAAGITHGMDELYK,3.7375722,"E5A, P58E, Q94A, T108G, I128A, N146E, V163G, D180E, H181A, P211G",10
MSKGEELFTGVVPILVELDGDVNGHKFSVSGEGEGDATYGKLTLKFICTTKKLPVPWPTLVTTESYGVQCFSRYPDHMKQSDFFKSAMPEGYAQERTIFFKDDGNYKGRAEVKFEGDTLVNRIELKGADFKEDGNILGHKLEYNYNSHNVYIMADKQKNGIKGNFKIRHNIEDGSVQLAEHYQQNTPIGDGPVLLPDNHYLSTQEALSKDPNEKRDHMVLLEFKTAAGITHGMDELYK,3.5979571,"G51K, L64E, H81S, V93A, T108G, I128A, V163G, D180E, S205E, V224K",10
MSKGEELFTGVVPIAVELDGKVNGHKFSVSGEGEGDATYGKLTLKFICTTGKLPVPWPTLVTTLSYGVQCFSRYPDHMKQHDFFKSAMPEGYVQERTIFFKDDGNYKGRGEVKFEGDTLVNRIELKGADFKEDGYILEHKLEYNYNSHNVYIMADKQKNGIKGNFKIRHNIEDGKVQLAEHYQQNTPIGDGPVLLPDNHYLSTQSALSKDPNEKRDHMVLLEFVTAAGITHGMDELYK,3.7388191,"L15A, D21K, T108G, A110G, I128A, N135Y, G138E, V163G, S175K, D180E",10
MSKGEELFTGVVPILVEADGDVNGHKFSVSGEGEGDATYGKLTLKFICTTGKLPVPWPTLVTTLSYGVDCFSRYPDHMKQHDFFKSAMPEGYVQERTIFFKDDGNYKGRAEVKFEGDTLVNRIELKGADFKEKGNILGHKLEYNYNSHNVYIMADKQKNGIKGNFKIRHNIEDGSVQLAEHYQQNTPIGDGPVLLPNNDYRSTQSALSKDPNEKRDHMVLLEFVTAAGITHGMDELYK,2.6412213,"L18A, Q69D, T108G, I128A, D133K, V163G, D180E, D197N, H199D, L201R",10
MSKGEELFTGVVPILVEHDGDVNGHKFSVSGEGEGDATYGKLTLKFICTTGKLPVPWPTLVTTLSYGVQCFSRYPDHMKQHDFFKSAMPEGYEQERTIFFKDDGNYKGRAEVKFEGDTLVNRIELKGADFKGDGNILGHKLEYNYNSHNVYIMADKQKNGIKGNFKIRHNIEDGSVQLAEHYQQNTPKGDGPVLLPDNHYLSTQSALSKDPNEKKDHMVLAEFVTAAGITHGMDELYK,3.7308936,"L18H, V93E, T108G, I128A, E132G, V163G, D180E, I188K, R215K, L221A",10
MSKGEELFTGVVPILVELDGDVNGHKFSVSGEGEGDATYGKLTLKFICTTGKLPVPWPTLVNTLSYGVQCFSRYPDHMKQHDFFKSAMPAGYVQERTIFFKDDGNYKGRAEVKKEGDTLVNRIELKGADFKEDGNILGHKLKYNYNSHAVYIMADKQKNGIKGNFKIRHNIEDGSVQLAEHYQQNTPIGDGPVLLPENHYLSTQSALSKDPNEKRDHMVLLEFVTAAGITHGMDELYK,3.867971,"T62N, E90A, T108G, F114K, I128A, E142K, N149A, V163G, D180E, D197E",10
MSKGEELFTGVVPILVELDGDVNGHKFSVSGEGAGDATYGKLTLKFICTTGKLPVPWPTLVTTLSYGVQCFERYPDHMKQHDFFKSAMPEGYVQERTIFFKDDGNGKGRAEVKFEGDTLVNRIELKGADFKEDGNILGHKLEYNYNSHNVYIMADKQKNGIKGNFKIRHNIEDGSVELAEHYQQNTPIGDGPVLKPDNHYLSTQSALSKDPNEKGDHMVLLEFVTAAGITHGMDELYK,3.5361311,"E34A, S72E, Y106G, T108G, I128A, V163G, Q177E, D180E, L195K, R215G",10
MSKGEELFTGVVPILVELDGDFNGHKFSVSGEGEGDATYGKLTLKFICTTGKLPVPWPTLVTTLSYGVQCFSRYPDHMKQHDFFKSAMPEGYVQERTIFFKDDGNYKGRGEVKKEGDTLVNRIELKGADFKEDGNILGHKLEYNYNSHNVYIMADKQKNGIKGGFKIRHNIEDGSVQLAEHYQQNTPIGDGPVLLPDNHYLSTQSALSKAPNGKRDHMVLLEFVTAAGITHGMDELYK,3.041454,"V22F, T108G, A110G, F114K, I128A, V163G, N164G, D180E, D210A, E213G",10
MSKGEELFTGVVPILVELDGDVNGHKFSVSGEGEGDATYGKGTLKFICTTGKLPVPWPTLVTTLSYGVQCFSRYPDHMKQHDFFKSAMPEGYVQERTIFFKDDGNYKGRAEAKFEGDTLVNSIELKGADRKEDGNILGHKLEYNYNSHNVYIMADKQKNGIKGNFKIRHNIEDGSVQLAEHYQQNTPIGDGPVLLPDNHYLSTQSALSKDPNFKRDGMVLLEFVTAAGITHGMDELYK,3.028552,"L42G, T108G, V112A, R122S, I128A, F130R, V163G, D180E, E213F, H217G",10
MSKKEELFTGVVPILVELDGDVNGHKQSVSGEGEGDATYGKLTLKFICTTGKLPVPWPTLVTTLSYGVQCFSFYPDHMKQHDFFKSAMPEGYVQERTIFFKEDGNYKGRAEVKFEGDTLVNRIELKGADFKEDGNILGHKLEYNYNSHNVYIMADKQKNGIKGNFKIRHNIEDGSVQLAEHYQQNTPRGDGPVLLPDNHYLSTQSALSKDPNEKRDHMVLLEFVTAAGATHGMDELYK,3.8041458,"G4K, F27Q, R73F, D102E, T108G, I128A, V163G, D180E, I188R, I229A",10
MSKGEELFTGVVPILVELDGDVNGHKFSVSGEGEGDATYGKLTLKFICTTGKLPVPWPTLVTTLSYGVQCFSRYPEHMKQHDFFKSAMGEGYVQERTIFFKDDGFYKGRAEVKFEGDTLVNRIELKGADFKEDGNILGHKLEYNYNSHNVYIMAEKQKNGIKGNFKIRHNIEDGSVQLAEHYQQNTPIGDGPVLLPDNHYLSTQSALSKDPNEKRDHMVLLEFVTAAGITHGCDEAYK,3.9789267,"D76E, P89G, N105F, T108G, I128A, D155E, V163G, D180E, M233C, L236A",10
MSKGEALFTGVVPILVELDGDVNGHKFSVSGEGEGDATYGKLTLKFIKTTGKLPVPWPTLVTTLSYGVQCFSRYPDHMKQHDFFKSAMPEGYVQERTIFFKDDGNYKGRAEVKFEGDTLVNRIELKGADFKEDANILGHKLEYNYNSHNVYIMADKQKNGIKGNFKIRHNIEDGSVQLAEHYQQNEPIGDGPVLLPDNHYLSTQSALSKDPNKKRDHMVLLEFVTAAGITHGMDEIYK,3.152481,"E6A, C48K, T108G, I128A, G134A, V163G, D180E, T186E, E213K, L236I",10
MSKGEELFTGVVPILVELDEDVNGHKFSVFGEGEGDATYGKLTLKEICTTGKLPVPWPTLVTTLSYGVQCFSRYPDHMKQHDFFKSAMPEGYVQERTIFFKDDGNYKGRAEVKFEGDTLGNRIELKGADFKEDGNILGHAGEYNYNSHNVYIMADKQKNGIKGNFKIRHNIEDGSVQLAEHYQQNTPIGDGPVLLPDNHYLSTQSALSKDPNEKRDHMVLLEFVTAAGITHGMDELYK,3.8046355,"G20E, S30F, F46E, T108G, V120G, I128A, K140A, L141G, V163G, D180E",10
MSKGEELFTGVVKILVELDGDVNGHKFSVSGEGEGDATYGKLTLKFICTTGKLPVPWPTLVTTKSYGRQCFSRYPDHMKQHDFFKSAMPEGYVQERTIFFKDDGNYKGRAEVKFEGDTLVNDIELKGADFKEDGNILGHKLEYNYNSHNVYIMADKQKNGIKGNFKIRHNIEDGSVQLAEHYRQNTVIGDGPVLLPDNHYLSTQSALSKDPNEKRDHMVLLEFVTAAGITHGMDELYK,3.1013064,"P13K, L64K, V68R, T108G, R122D, I128A, V163G, D180E, Q183R, P187V",10
MSKGEELFTGVSPILVELDGDVNGHKFSVSGEGEGDATYGKLTLKFICTTGKLPVPWPTLVTTLSYGVQCFSKYPDHMKQHDFFKSAMPEGYVQERTIFFKDDGNYKGRAEVKFEGDTLVNRIELKGADFKEDGNILGHKGEGNYNSHNVYIMADKQKNGIKGNFKIRANIEDGSVQLAEHYQQNAPIGDGPVLLPDNHYLSTQSALSKDPNEKRDHMVLLEFVTAAGITHGMDELYK,3.726858,"V12S, R73K, T108G, I128A, L141G, Y143G, V163G, H169A, D180E, T186A",10
MSKGEELFTGVVPILVELDGDVNGHKFSVSGEGEGDATYGKLTLKFHCTTGKLPVPWPTLVTTLSYGVQCFSRYPDHMKQHDFFKSAMPEGYVQERTIAFKDAGNYKGRAEVKFEGDTLVNRIELKGADFKEDGNILGHKLEYNYNSHNVYIMADKQKNGIKGNFKIRHNIEDGSVQLAEHYQQNTAIGDGKVLLPDNHYLSEQSALSKDPNEKRDHMVLLEFVTAAGITHGMDELYK,3.8247614,"I47H, F99A, D103A, T108G, I128A, V163G, D180E, P187A, P192K, T203E",10
MSKGEELFTGVVPILVELDGDVNGHKFSVSGEGEGDATYGKLTLKFIKTTGKLPVPWPTLVTTLSYGVQCFSRYPDHMKQHDFFKSAMPEGYVQERTIFFKDDGNYKGRAEVAFEGDTLVNRIELKGADFKEDGNILGHKGEYNYNSHNVYIMADKQKNGIKGNFKIRENIEDGSVQLAEHYQQNTPIGDGPVLLPDNHYLSTQSALSKDPNEKRDHMELLEFVTAAGITHGMRELYK,3.6497958,"C48K, T108G, K113A, I128A, L141G, V163G, H169E, D180E, V219E, D234R",10
MSKGEELFTGVVPILVELDGDVNGHKFSVSGEGEGDATYGKLTLKFICTTGKLPVPWPTLVTTLSEGVQCFSRYPDHMKQHDEFKSAMPEGYVQERTIFFKDDGNYKGRAEVKFEGDTLVNRIELKGADFKEDGNILGHKLEYFYNSHNVYIMADKQKNGIKGNFKIRHNIEDGSVELAEHYQQNTPIGDGPVLLPDNHYLSTQSALSKDPNEKRDHMVLLEEVTAAGITHGMDELRK,3.6434739,"Y66E, F83E, T108G, I128A, N144F, V163G, Q177E, D180E, F223E, Y237R",10
MSKGEELFTGVVPILVELDGDVNGHKFSVEGEGEGDATYGKLTLKFICTTGKLPVPWPTLVTTLSKGVQCFSRYPDHMKQHDFFKEAMPEGYVQERTIFFKKDGNYKGRAEVKFEGDTLVNRTELKGADFKEDGNILGHKLEYNYNSHNVYIMADKQKNGIKGNFKIRHNIEDGSVQLAEHYQQNTPIGDGPVLLPDGHYLSTQSALSKDPNEKRDHMVLLEFVTAAGITHGMDELYK,3.5863438,"S30E, Y66K, S86E, D102K, T108G, I123T, I128A, V163G, D180E, N198G",10
MSKRKELFTGVVPILVELDGDVNGHKFSVSGEGEGDATYGKLTLKFICTTGKLPVPWPTLVTTLSYGVQCFSRYPDHMKQHDFFKSAMPEGGVQERTIFFKDDGNYGGRAEVKFEGDTLVNRIELKGADFKEDGNILGAKLEYNYNSHNVYIMADKQKNGIKGNFKIRHNIEDGSVQLAEHYQQNTPIGDGPVLLPDNHYLSTQSALSKDPNEKRDHMVLLEFVTAAGIKHGMDELYK,3.8149567,"G4R, E5K, Y92G, K107G, T108G, I128A, H139A, V163G, D180E, T230K",10
MSKGEELFTGVVPIKVELDGDVNGHKFSVSGEGEGDAKYGKLTLKFICTTGKLPVPWPTLVTTLSYGVQCFSRYPDHMKQHDFFKSAMPEGYVQERTIFGKDDVNYKGRAEVKFEGDTLVNRIELKGADFKEAGNILGHKLEYNYNSHNVYEMADKQKNGIKGNFKIRHNIEDGSVQLAEHYQQNTPIGDGPVLLPDNHYLSTQSALSKDPNEKRDHMVLLEFVTAAGITHGMDELYK,3.3241186,"L15K, T38K, F100G, G104V, T108G, I128A, D133A, I152E, V163G, D180E",10
MSKGEELFTGVVPILVELDGDVNGHKGSVSGEGEGDATYGKLTGKFICTTGKLPVPWPTLVTTLSYGVQCFSRYPDHMKQHDFFKSAMPEGYVQERTIFFKDDGNYKGRAEVAFEGDTLVNRIELKGADFKEDGNILGHKLEYNGNSHNVYIMADKQKNGGKGNFKIRHNIEDGSVQLAEHYQQNTPIGDGPVLLPDNHYLSTQSALSKDPNEKRDHMVLLEFVTAAGIEHGMDELYK,3.6738815,"F27G, L44G, T108G, K113A, I128A, Y145G, I161G, V163G, D180E, T230E",10
MSKGEELFTGVVPILVELDHDVNGHKFSVSGEGEGDATNGKLTLKFICTTGKLPRPWPTLVTTLSYGVQCFSRYPDHMKQHDKFKSAMPEGYVQERTIFFKDAGNYKGRAEVKFEGDTLVNRIELKGADFKEDGNILGHKLEYNYNSHNVYIMADKQKNGIKGNFKIRHNIEDGSVQLAEHYQQNTPIGDGPVLLPDNHYLSTQSALSKDPNLKRDHMVLLEFVTAAGITHGMDELYK,3.447309,"G20H, Y39N, V55R, F83K, D103A, T108G, I128A, V163G, D180E, E213L",10
MSKGEELFTGVKPILVELDGDVNGHDFSVSGEGEGDATYGKLTLKFVCTTSKLPVPWPTLVTTLSYGVQCFSRYPDHMKQHDFFKSAMPEGYVQERTIFFKDDGNYKGRAEVKFEGDTLVNRIELKGADFKEDGNILGHKLEYNYNSHNVYIDADKQKNGIKGNFKIRHNIEDGSVQLAEHYQQNTPIGDGPVLLPDNHYLSTQKALSKDPNEKRDHMVLLEFVTAAGITHGMDELYK,3.691682,"V12K, K26D, I47V, G51S, T108G, I128A, M153D, V163G, D180E, S205K",10
MSKGEELFTGVVPILEELDGDENGHKFSVSGEGEGDATYGGLTLKFICTTGKLPVPWPTLVTTLSDGVQCFSRYPDHMKQHDFFKSAMPEGYVQERTIFFKDDGNYKGRAEVKFEGDTLVNRIELKGADFKEDINILGHKLEYNYNSHNVYIMADKQKNGIKGNFKIRHNIEDGSVQLAEHYQQNTPIGDGAVLLPDNHYLSTQSALSKDPNEKRDHMVLLEFVTAAGITHGMDELYK,2.4360662,"V16E, V22E, K41G, Y66D, T108G, I128A, G134I, V163G, D180E, P192A",10
MSKGEELFTGVVPILVELDGDVNGHKFAVSGEGEGDATYGKLTLKFICTTGKLPVPWPTLVTTLSYGVQCFSRYPDHMKQHDFFKSAMPEGYVQEREIFFKDDGNYKGRAEVKFEGDKLVNRIELKGADFKEDGNIKGHKLEYNYNSHNVYIMADKQKAGIKGNFKIRHNIEDGSVQLAEHYQQNTPIGDGPVLLPDNHYLSTQSALSKDPNEKRDHMVLLEFVTAAGITHGADELYK,3.8717942,"S28A, T97E, T108G, T118K, I128A, L137K, N159A, V163G, D180E, M233A",10
MSKGEELFTGVVPIAVELDGDVNGHKFSVSGEGEGSATYGKLTGKFICTTGKLPVPWPTLVTTLSYGVQCFSRYPDHMKRHDFFKSAMPEGYVGERTIFFKDDGNYKGRAEVKFEGDTLVNRIELKGADFKEDGNILGHKLEYNYNSHNVYIMADKQKNGIKGNFKIRHNIEDGSVQLAEHYQQNTPIGDGPVLLPDNHYLSKQSALSKDPNEKRDHMVLLEFVTAAGITHGMDELYK,3.7094092,"L15A, D36S, L44G, Q80R, Q94G, T108G, I128A, V163G, D180E, T203K",10
MSKGEKLFTGVVPILVELDGDVNGHKFSVSGEGEGDATYGKLTLKFICTTGKLPVPWPGLVTTLSYGVQCFSRYPDHMKQHDFFKSAMPEGYVQERTIFFKDDGNYKGRAEVKFEGDTLVNRAELKNADFKEDGNILGHKLEYNYNSHNVYIMADKQKNGIKGNFKIRHNIEDGSVQLAEHYQQNTPIGDGPVLLPDVHYLSTQSALSKDPNEKRDHMVALEFVTAAGITHGMDELYK,3.756028,"E6K, T59G, T108G, I123A, G127N, I128A, V163G, D180E, N198V, L220A",10
MSKGEELFTGVVPILVELDGDVNGHKFSVSGEGEGKATYGKLTLKFICTTGKLPVPWPTLVTTLSYGVQCFSRYPDHNKQHDFFKSAMPEGYVQERTIFFKDDGFYKGRAEVKFEGDTLVNRIELKGADAKEDGNILGHKLEYNENSHNVYIMADKQKNGIKGNFKIRHNIEDGSVQLAEHYQQNTPIGDGPVLLPDNHYLSTQSALSKDPNERRDHMVLLEFVTAAGITHGMDELYK,3.8414412,"D36K, M78N, N105F, T108G, I128A, F130A, Y145E, V163G, D180E, K214R",10
MSKGEELFTGVVPILVELDGDVNGHKFSVSGEGEGDATYGKLTLKFICTTGKLPVPWKTKVTTLSYGVQCFSRYPDHMKQHDFFKSAMPEGYVQERTIFFKDDGNYKGRAEVKFEGDTLVNRIELKGADFKEDGNILGHKLEGNYNSHNVAIAADKQKNGIKGNFKIRHNIEDGSVQLAEHYQQNTPIGDGPVLLPDGHYLSTQSALSKDPNEKRDHMVLLEFVTAAGITHGMDELYK,3.8045208,"P58K, L60K, T108G, I128A, Y143G, Y151A, M153A, V163G, D180E, N198G",10
MSKGEELFTGVVPIGVELDGDQNGHKFSVSGEGEGDATYGKLTLKFICTTGKLPVPWPTLVTTLSYGVQCFSRYPDHMKQHDFFKSAMPEGYVQERTIFVKDDGNYKGRAEVKFEGDALVNRIELKGADFKEDGNILGHKLEYNYNSHNVYIMADKQKNGIKGNFKIRHNIEDGSVQLAEHYKQNTPIGDGPALLPDNHYLSTQSALSKDPNEKRDHMVLLEFVTAAGITHGMDELYK,2.2873738,"L15G, V22Q, F100V, T108G, T118A, I128A, V163G, D180E, Q183K, V193A",10
