Sequence,Score,Mutations,Number of Mutations
MAKGEELFTGVVPILVELDGDVNGHKFSVSGEGEGDATYGKLTLKFICTTGKKPVPWPTLVTTLSYGVQCFSRYPDHMKQHDFFKSAMPEKYVQERTIFFKDDGNYKGRAEVKFEGDTLVNRIELKGADFKEDGNILGHKLSYNYNSHNVYIMADKQKNGIKGNFKIRHNKEDGSVQLAEHYQQNTPIGDGPVLLPDNHYLSTQSALSKDPNEKRDHAVLLEFVTAAGITHGMDELYK,3.7855248,"S2A, L53K, G91K, T108G, I128A, E142S, V163G, I171K, D180E, M218A",10
MSKGEELFTGLVPILVELDGDVNGHKFSVSGEGEGDATYGKLTLKFICTTGKLPVPWETLVTTLSYGVQCFSRYPDHMKQHDFFESAMPEGYVQERTIFFKDDGNYKGRAEVKFEGDTLVNRIELKGADFKEDGNILGHKLEYNYNSHNVYIEADKQKNGIKGNFKIRHNIEDGVVQLAEHYQQNTPIGDGPVLLPDNHYLSTQSALSKKPNEKRDHMVLLEFVTAAGITHGMDELYK,3.2391293,"V11L, P58E, K85E, T108G, I128A, M153E, V163G, S175V, D180E, D210K",10
MSKGEELFTGVVPILVELDGDVNGHKFSVSGEGEGDATYGKLTLKFICTTGKLPVPWPTLVTTLSYGVQEFSRYPDHMKQHDYFKSAMPEGYVQERTIFFKDKGFYKGRAEVKFEGDTLVNRIELKGADFKEDGNILGHKLEYNYNSHNVYIDADKQKNGIKGNFKIRHNIEDGSVQLAEHYQQNTPVGDGPVLLPDNHYLSTQSALSKDPNEKRDHMVLLEFVTAAGITHGMDELYK,3.71488,"C70E, F83Y, D103K, N105F, T108G, I128A, M153D, V163G, D180E, I188V",10
MSKGEELFTGVVPILVELDGDVNGHKFSVSGEGEGDATYGKLTLKFICTTGKLPVPWPTLVTTLSYGVQCFSRYPKHMKQHDFFKSAMPEGYVQERTIFFKDDGNGKGRAEVKFEGDTLVNRIELKGADFKEDGNILGHKLEYNYNSHNVYVMADKQKNGIGGNQKIRHNIEDGSVQLAEHYQQNTPIGDGPVLLPDNHYLSTQSALSKDPNEKRDEMVLLEFVTAAGITHGMDELYK,3.5133808,"D76K, Y106G, T108G, I128A, I152V, K162G, V163G, F165Q, D180E, H217E",10
MGKGEELFTGVVPILVELDGDVNGHKFSVSGEGEGDATYGKLTLKFICTTGKLPVPWPTLVTTLSYGVQCFSRYPDHMKQHDFFKSAMPEGYVQGRTIFFKDDGNYKGRAEVKKEGDTLVNRIELKGADFKEDGNILGHKEEYNYNSHNVYIMADKQKNGIKGNFKIRHNIEDGSVQLAEHYQQNTPIGDGPVLLPDNHYLSTQSAKSKDPNEKRDHMVLLEFVTAAGITHGMDELKK,3.6834397,"S2G, E95G, T108G, F114K, I128A, L141E, V163G, D180E, L207K, Y237K",10
MSKGEELFTGVVPILVELDGDVKGHKFSVSGEGEGDAVYGKLTLKFICTTGKLPVPWPTLVTTLSYGVQCFSRYPDHMKQHDFFKSAMPEGYVDERTIFFKDDGNYKGRAEVKFEGDTLVNRIELKGADFKEDGNILGHKLEYNYTSHNVYIMADKQKNGIKGNFKIRHNIEDGSVQLAEHYQQNTPIGDGPVLLKDNHYLSTQSALSKDPNEKRDHMVLLEFRTAAGITHGMDELYK,3.649604,"N23K, T38V, Q94D, T108G, I128A, N146T, V163G, D180E, P196K, V224R",10
MSKGEELFTGVVAILVELDGDVNGHKKSVSGEGEGDATYGKLTLKFICTNGKLPVPWPTLVTTLSYGVQCFSRYPDHMKQHDFFKSAMPEGYVQERTIFFKDDGNYKGRAEVKFEGDTLVNRIELKGADFKEDGNILGHKLEYNYNSHNVYIMADKQKNGIKGNFKIRHNIEDGSVQLAEHYQQNSPIGDGPVLLPDNHYLSTQSALSKDPNEKRDHMVLLEFVTAAGITKGMDVLYK,3.6639676,"P13A, F27K, T50N, T108G, I128A, V163G, D180E, T186S, H231K, E235V",10
MSKGEELFEGVVPILVELDGDVNGHKFSVSGEGEGDATYGKLTLKFICTTKKLPVPWPTLVTTLSYGVQCFSRYPDHMKQHDFFKSAMPEGYVQERTEFFKDDGNYKGRAEVKFEGDTLVNREELKGADFKEDGNILGHKLEYNGNSHNVYIMAEKQKNGIKGNFKIRHNIEDGSVQLAEHYQQNTPIGDGPVLLPDNHYLSTQSALSKDPNEKRDHMVLLEFVTAAGITHGMDELYK,3.74326,"T9E, G51K, I98E, T108G, I123E, I128A, Y145G, D155E, V163G, D180E",10
MSKGEELFTGVVPILVELDGDVNGHKFSVSGVGEGDATYGKLTLKFYCKTGKLPVPWPTLVTTLSYGVQCFSRYPDHMKQHDFFKSAMPEGYVQERTIFFKDDGNYKGRAEVKFEGDTLVNRIELKGADFKEDGNGLGHKLEYNYNSHNVYIMADKQKNGIKGNFKIRHNIEDGSVQHAEHYQQNTPIGDGPVLLPDNHYTSTQSALSKDPNEKRDHMVLLEFVTAAGITHGMDELYK,3.809963,"E32V, I47Y, T49K, T108G, I128A, I136G, V163G, L178H, D180E, L201T",10
MSKGEELFTGVVPILVELDGDVNGHKFSVSGEGEGDATYGKLTLKFICKTGKLPVPWPTLVTTLSYGVQCFSRYQDHMKQHDFFKSAMPEGYVQERTIFFKDDGNYKGRAEVKFEGDTLVGRIEEKGADFKEDGNILGHKLEYNYNVHNVYIMADKQKNKIKGNFKIRHNIEDGSVQLAEHYQQNTPIGDGPVLLPDNHYLSTQSALSKDPNEKRDHMVLLEFVTAAGITHGMDELYK,3.751915,"T49K, P75Q, T108G, N121G, L125E, I128A, S147V, G160K, V163G, D180E",10
MSKGEELFTGVVPILVELDGDVNGHKFSVSGEGEGDADYGKLTLKFICTTGKLPVPWPTLVTTLSYGVQCFSRYPDHMKQIDFFKSAMREGYVQERTIFFKDDGNYKGRAEVKFEGDTLVNRIELKGADFKEDGNILGHKLEYNYNSHNVYIMAQKQKNGIKGNFKIRHNIEDGSVQLAEHYQQNTPIGKGPVLLPDNHYLSTQSALSKDPNEKRDHMVLEEFVTAAGITHGMDELYK,3.8839545,"T38D, H81I, P89R, T108G, I128A, D155Q, V163G, D180E, D190K, L221E",10
MSKGEELFTGVVPILVELDGDVNGHKFYVSGEGEGDATYGKLTLKFQCTTGKLPKPWPTLVTTESYGVQCFSRYPDHMKQHDFFKSAMPEGYVQERTIFFKDDGNYKGRAEVKFEGDTLVNRIELKGADFKEDGNILGHKLEYNYNSHNVYIMADKQKNGIKGNFKIRHNIEDGSVQLAEHYQQNTPIGDGPVLLGDNGYLSTQSALSKDPNEKRDHMVLLEFVTAAGITHGMDELYK,3.6137142,"S28Y, I47Q, V55K, L64E, T108G, I128A, V163G, D180E, P196G, H199G",10
MSKGEELFTGVVGILVEADGDVNGHKFSVSGEGEGDATYGKLTLKFICTTGKLPVPWPELVTTASYGVQCFSRYPDHMKQHDFFKSAMPEGYVQERTIFFKDDGNYKGRAEVKFEGDTLVNRIELKGADFKEDGNILGHKLEYNYNSHNVYIMADKQKNGIKGNFKIRHNREDGSVQLAEHYQQNTPIGDGPVLLPDNHYLSTQSALSKDPNEKRDHMVLLEFVTAAGITHGMDEKYK,3.7174652,"P13G, L18A, T59E, L64A, T108G, I128A, V163G, I171R, D180E, L236K",10
MSKGEELFTGVVPILVELDGDVNGHKFSVSGEGEGDATYGKLTLKFICTTGKLPVPWPTLVTTLEYGVQEFSRYPDHMKQHDFFKSAMPEGYAQERTIFFKDDGNYKGRAEVKFEGDTLVNRIELKGADFKEDGNILGHKLEYNYNSHNVYIMADKQKNGIKGNFKIRHNIEDGSVVLAEHEQQNTPIGDGPVLLPDNHYLSTQSALSKDPNEKRDHMVLLEFVNAAGITHGMDELYK,3.5909896,"S65E, C70E, V93A, T108G, I128A, V163G, Q177V, D180E, Y182E, T225N",10
MSKGEALFTGVVPIAVELDGDVNGHKFSVSGEGEGDATYGKLTLKFICTTGKLPVPWPTLVTTLSYGVQCFSRYPDHMKQHDFFKSAMPEGYKQERTIFFKDDGNYKGRAEVKFERDTLVNRIELKGADFKEDGNILGHKLEYNYNSHNVYIMADKEKNGIKGNFKIRHNIEDGSVQLAEHYQQNTPIGDGPVLLPDNHYLSTQSALSKDPNEKRDHKVLLEFVTAAGITHGMDELYK,3.4874182,"E6A, L15A, V93K, T108G, G116R, I128A, Q157E, V163G, D180E, M218K",10
MSKGEERFTGVVPILVEVDGDVNGHKFSVSGEGEGDATYGKLTLKFICTTGKLPVPWPTLVTTESYGVQCFSRYPDHMVQHDFFKSAMPEGYVQERTIFFKDDGNYKGRAEVKFENDTLVNRIELKGADFKEDGNILGHKLEYNYNSHNIYIMADKQKNGIKGNFKIRHNIEDGSVQLAEHYQQNTPIGDGPVLLPDNHYLSTQSALSKDPNEKRDHMVLLEFVTAAGITHGMDELYK,3.6334662,"L7R, L18V, L64E, K79V, T108G, G116N, I128A, V150I, V163G, D180E",10
MSKGEELFTGVVPILVELDGDVNGHKFSVSGEGEGDATYGKLTLKFKDTTGKLPVPWPTLVTTLSYGVQCFSRYPDHMKQHDFFKSAMPEGYVQERTIFFKDDGNYKGRAEVKFEGDTLVNRIELKGADFKEDGNILAHQLESNYNSHNVYIMADKQKNGIKGNFKIRHNIEDGSVQLAEHYQQNTPIGDGPVELPDNHYLSTQSALSKDPNEKRDHMVLLEFVTAAGITHGMDELYK,3.7117124,"I47K, C48D, T108G, I128A, G138A, K140Q, Y143S, V163G, D180E, L194E",10
MSKGEELFTGVVGILVELDGDVNGHKFSVSGEGEGDAAYGKLTGKFICTTGKLKVPWPTLVTTLSYGVQCFSRYPDHMKQHDFFKSAMPEGYVQERTEFFKDDGNYKGRAEVKFEGDTLVNRIELKGADFKEDGNILGHKLEYNYNSHNVYIMADKQKNGIKGNFKIRHNIEDGSVQLAEHYQQNTPIGDGPVLLPDNHYLSTQSALSKDPNEKRDHMVLLEFVTAAGITHGMIELYK,3.7512197,"P13G, T38A, L44G, P54K, I98E, T108G, I128A, V163G, D180E, D234I",10
MSKGEELFTGVVPILVELDGDVNGHKFSVSGEGEGDATYGKLTLKFICTTGKLPVPWPTLVTTLSYGVQCFSRYPDHMKQHDFFKSAMPEGYVQERTIFFKDDGNYKGRAEVKFEGDTLVNRIELKGADFKEDGNILGHKAEYNYNSHNAYIMADKQKNGAKGNEKIRHNIEDGSVQLAEHGQQNTPIGIGPVLLPDNHYLSTQSALSKDPNEKRDHMVLLEFVTAAGITHGMDELYK,3.7622137,"T108G, I128A, L141A, V150A, I161A, V163G, F165E, D180E, Y182G, D190I",10
