Sequence,Score,Mutations,Number of Mutations
MQYKLILNGKTLKGEITTEAVDAATAESVFKQLANDNGEDCEWTYDDATKTFTVTE,-5.665363,"T16I, K28S, Y33L, V39E, G41C",5
MQYELTLNGKTLKGETTTEAVDAATAEKVFKQYANDQGVDAEWTYDDATKQFTVTE,-0.95519555,"K4E, I6T, N37Q, G41A, T51Q",5
MQYKLILNGKTLKGEITTEAVDAATAAKTFKQNASDNGVDGEWTYDDATKTFTVTE,-6.032851,"T16I, E27A, V29T, Y33N, N35S",5
MQYKLTFNGKTLKGEATTEAVDAATANKVFKQYANDNGVDGEVTYDDATKTFTVTE,-5.9597316,"I6T, L7F, T16A, E27N, W43V",5
MQYKLILNGKTLKAETTTEAVDAASAEKVFKQYANENGVDGEWIYDDATKTLTVTE,-0.0007114634,"G14A, T25S, D36E, T44I, F52L",5
MQVKLILNGTTLKGEFTVEAVDAATAEKVFKQYQNDNGVDGEWTYDDATKTFTVTE,-4.006038,"Y3V, K10T, T16F, T18V, A34Q",5
MQYKLILNGKTLKGEEKTEAVDAATAEKVVKQYANDNGVDGEWTLDDATETFTVTE,-0.3790649,"T16E, T17K, F30V, Y45L, K50E",5
MQYKLILNGKTLQGETGTEAVDVATAETVFKKYANDNGVDGEWTYDDATKTFTVTE,0.47008258,"K13Q, T17G, A23V, K28T, Q32K",5
MQYKLILNGKTLTGEGTTEAVDAKTAEKVFKQYANDNGVDLEYTYDDATKTFTVTE,-5.796021,"K13T, T16G, A24K, G41L, W43Y",5
MQYKLILNGKTLKGELTTEAADAATAEKVFKAYANDNKVDGEWTYDDATKEFTVTE,2.4223192,"T16L, V21A, Q32A, G38K, T51E",5
MEYTLILNGKTLKGETTTEAVDAATAEKVFKQYANDLGVDGEWTYDDSGKTFTVTE,2.4698308,"Q2E, K4T, N37L, A48S, T49G",5
MQYKLILNGKTLKGLTTTEATDAAEAEAVFKQYANDNHVDGEWTYDDATKTFTVTE,-1.6414276,"E15L, V21T, T25E, K28A, G38H",5
MQYKLILNGKTLKGETVTEAVDAATAEKCFKQYMNDNGVDKEWTYDDATGTFTVTE,-2.2313988,"T17V, V29C, A34M, G41K, K50G",5
MQYKLILNGKTLKGEFTTEAADAATAKKVFKQYANHNGVDGEWTYDDQTKTFTVTE,-2.9188302,"T16F, V21A, E27K, D36H, A48Q",5
MQYKLIVEGKTLKGETTTEAVDAATAEKVFAQYANDNGVVGEWTYDDATKTFTVTF,-3.0803661,"L7V, N8E, K31A, D40V, E56F",5
MQYKLILNGKTLKGDTTTEAVDAATAEKVFKVYYNDNGVDGEYTYDDATNTFTVTE,-4.8640614,"E15D, Q32V, A34Y, W43Y, K50N",5
MQYKLILNGKPLKGETSVEAVDAATAEKVFKQYANDNGVDGEWTYDDATKSFMVTE,1.589412,"T11P, T17S, T18V, T51S, T53M",5
MQYKLILNGETLKGETFTIGVDAATAEKVFEQYANDNGVDGEWTYDDATKTFTVTE,-2.3904853,"K10E, T17F, E19I, A20G, K31E",5
MQYKLILNGKTLKGECTTEAVDAATAEKVFKQYANDNGVVGELTYDDDTKTFTVTI,-3.531899,"T16C, D40V, W43L, A48D, E56I",5
MQYKLILNGKTLKGEKTTEAVDAATAEKAFKQYANDNGVDHEWTYDDKTKEFTVTE,-1.4769554,"T16K, V29A, G41H, A48K, T51E",5
MQYKLILNGKTLKGEVTTSAVDAATAEKVFKKYAEDNGVDGEWTYDDATKTWTVTE,-5.210517,"T16V, E19S, Q32K, N35E, F52W",5
MQYKLILNGVTLKGETTTEAVDRATAEKVFKQYANDNGVDGEITYDDNTKEFTVTE,-3.8811655,"K10V, A23R, W43I, A48N, T51E",5
MQYKVIGNGKTLGGETTTEAVDAATAEKEFKQYANDNGVDGTWTYDDATKTFTVTE,0.4486505,"L5V, L7G, K13G, V29E, E42T",5
MQYKLFLNGKTIKGETTTEYVDAATAEKVFKQYANDNGWDGEWTYDDAAKTFTVTE,-2.8650396,"I6F, L12I, A20Y, V39W, T49A",5
MIYKLTLNGKTLKGETTTEAVDAATAEKVFKQYANDNGYDGEITWDDATKTFTVTE,-3.8865976,"Q2I, I6T, V39Y, W43I, Y45W",5
MQYKLILNGKTLKGEFTTEAVAAATAEKVMKQYANDNGVDIEWDYDDATKTFTVTE,-4.399759,"T16F, D22A, F30M, G41I, T44D",5
MQYKLILNSKTLKGEQRTEAVDAATAEKVFKQYANDNGVDGEVTWDDATKTFTVTE,-2.6928277,"G9S, T16Q, T17R, W43V, Y45W",5
MQYKLILNGKILKGETTTEVVDAATAEKVFKQYRNDNGVDGEWTFDDATKTFTITE,-3.6219888,"T11I, A20V, A34R, Y45F, V54I",5
MQLKLIKNGKTLTGGTTTETVDAATAEKVFKQYANDNGVDGEWTYDDATKTFTVTE,0.7873172,"Y3L, L7K, K13T, E15G, A20T",5
MAYKLILNGKTYKGETTTEAVDAATAEKLFKNYANDNGVDGEITYDDATKTFTVTE,-2.8550842,"Q2A, L12Y, V29L, Q32N, W43I",5
MQYKLILNGKTIKGETTTEAVDAATAEKVFKQYANENGWDGEWTYDDTTKTFVVTE,-1.0573852,"L12I, D36E, V39W, A48T, T53V",5
MNYKLILNGKTLKGETTTAAVDAATAEKVSKDYARDNGVDGEWTYDDATKTFTVTE,-4.362184,"Q2N, E19A, F30S, Q32D, N35R",5
MQYKLILNGKTLKGETTTEAVDAAAAETVFKQYANDNGVDGEWTYDTAEKTATVTE,-2.4280417,"T25A, K28T, D47T, T49E, F52A",5
MQYKLVLNGKTLKTETTTEAVDAANAEKVFKQQANDNGVDGEWIYDDATKTFTVTE,-0.22521627,"I6V, G14T, T25N, Y33Q, T44I",5
MQYKLLLNGKTLKGETTTEKVDAATAEKVFKQYANDLGVDGEWTYDDADKKFTVTE,3.345694,"I6L, A20K, N37L, T49D, T51K",5
MQYKLILNGKTLKTETTTEAVDAATAAKVGKQYANDNGVDGEWLVDDATKTFTVTE,-6.3704214,"G14T, E27A, F30G, T44L, Y45V",5
MQYKLIYNGKTLKGETTTEAVDAATSEKVFKQYANDLGVDGEWTYDDGTETFTVTE,0.04557745,"L7Y, A26S, N37L, A48G, K50E",5
MQYKLILNGKTLKGETTTEASDAATAEKVFKQYENDNGVDGNWTYDDATLTFEVTE,-1.7941055,"V21S, A34E, E42N, K50L, T53E",5
MQYKLILKGKTLKGETTTEAVNAATAEKVFKQYADDNGVDMEWTYDDATATFTVTE,-4.340178,"N8K, D22N, N35D, G41M, K50A",5
MQYKLILNGKTVKGQTTTEAVDVATAEKVFKQYANDNGVDGEWTYDPQTKTFTVTE,2.0752053,"L12V, E15Q, A23V, D47P, A48Q",5
MKVNLIKNGKTLKGETTTEAVDAATAEKVFKQYAADNGVDGEWTYDDATKTFTVTE,-4.5477405,"Q2K, Y3V, K4N, L7K, N35A",5
MKYKLILNGDTLKGETTTEAVDAETAEKQFQQYANDNGVDGEWTYDDATKTFTVTE,-0.25270152,"Q2K, K10D, A24E, V29Q, K31Q",5
MQYKLILNGKVLKGLTTTEAVDATTAEKVFKQYANDNDVDTEWTYDDATKTFTVTE,-2.5672143,"T11V, E15L, A24T, G38D, G41T",5
MQYKYIVNGKTLKGETTTTAVDAATAEKVFKQYAQDNGVDTEWTYDDATKTFTVTE,-5.8640447,"L5Y, L7V, E19T, N35Q, G41T",5
MQYKLILNGKTLKGSTTLEAVDAATAEKVIKQYANDNGVDGEWTVDDATKTFTVLE,-1.8169199,"E15S, T18L, F30I, Y45V, T55L",5
MQYKLILNGKTIKGMTTTEAVDAATAENVFKQYAIDNGYDGEWTYDDATKTFTVTE,-5.6644416,"L12I, E15M, K28N, N35I, V39Y",5
MQYKLIVNGKTLIGETTTEAVDAAEAEKVAKQYANDNGWDGEWTYDDATKTFTVTE,-4.0501814,"L7V, K13I, T25E, F30A, V39W",5
MQFKLILNGKTLKGETTTEHVDAATAEKVFKQYANDNGVDGEWTYDPATGQFTVTE,4.5822525,"Y3F, A20H, D47P, K50G, T51Q",5
MQYKLILNGKTLKGETTTEAVDAATASKVAKQYALDNGVLGKWTYDDATKTFTVTE,-5.954919,"E27S, F30A, N35L, D40L, E42K",5
MQYKVILNGKTLKGETTTEAVDKATAEKVFKQYANDNGCDGEWTYDDQTKTFTVTK,-2.7446115,"L5V, A23K, V39C, A48Q, E56K",5
MQYKLILNGKTVKGETTTEAVDAATAEKVFKQYAKDNGVDGEWTFDDATKTITVTF,-6.1651325,"L12V, N35K, Y45F, F52I, E56F",5
MQYKLILNGKTYKGETTTEAVDAATAEEVFKQYANDPHVDGEWTYDDSTKTFTVTE,-5.1845336,"L12Y, K28E, N37P, G38H, A48S",5
MQYKCILNGTTLKGETYTEAVDAATAEKVFKQYAWDGGVDGEWTYDDATKTFTVTE,-1.3878549,"L5C, K10T, T17Y, N35W, N37G",5
MQYKLMLNGATAKGETTTEAVDAATAEIVFKQYADDNGVDGEWTYDDATKTFTVTE,-4.754727,"I6M, K10A, L12A, K28I, N35D",5
MQYKLILNGKTLKGETTTEAVDAAEAEKLFKQYANDNGADGEWTYDDTTKTFTRTE,-4.583543,"T25E, V29L, V39A, A48T, V54R",5
MQYKLILNGKTLKGEYTTEAVDAAEAEKVFKQYANDNGYDFEWTYDDATKTFTVTD,-4.774413,"T16Y, T25E, V39Y, G41F, E56D",5
MQYKLILNGKTLKGETTTEAADAATAEKVFKQYANDNGVKGEITYDDAAKTFTETE,-3.9705946,"V21A, D40K, W43I, T49A, V54E",5
MQYKIILNGKTLKGFTTTEAVEAATAEKVFKGYAVDNGVDGEWTYDDATKTFTVTE,-1.9031787,"L5I, E15F, D22E, Q32G, N35V",5
MKYKLTLNGKTLKGGTYTEAVDAATAEKVFKQYANDNGVDLEWTYDDATKTFTVTE,-1.5036898,"Q2K, I6T, E15G, T17Y, G41L",5
MQFKLILNGKTLGEETTTEAVDAATAEKTFKQYANDNGVDGEWTYDDATATFTVTE,2.2881126,"Y3F, K13G, G14E, V29T, K50A",5
MQYKLILNGKTLDGETTTTPVDAATAEKVFKQYANDNGVDGEWTYDLATKTLTVTE,-0.2881922,"K13D, E19T, A20P, D47L, F52L",5
MQYKLLLNGKTLKGETTVEAVDAATAEKVFKQYANDNAVDGAWTYDDVTKTFTVTE,4.6233625,"I6L, T18V, G38A, E42A, A48V",5
MTYKLILNGRTLKGETLTEAVDAATAEKVFKQYANDNGFDGEWTYDDATKTFTVTD,1.3495017,"Q2T, K10R, T17L, V39F, E56D",5
MQITLILNGKTLKGVTTTEAVDAATAEKHFKQYANDNGVDGEWTYDDATKTFTVTD,0.7232445,"Y3I, K4T, E15V, V29H, E56D",5
MQYKLILNGKTLKGETTTEAVDAATAELVFTQYANDNGLDGEFTYDDATKTFTVKE,-5.943523,"K28L, K31T, V39L, W43F, T55K",5
MQYKLILNGKTLKGETTTEAVEAATAETVFKQYANMNGVDGDWTYDDATGTFTVTE,2.4282842,"D22E, K28T, D36M, E42D, K50G",5
MQYKLILNGKTLKSETTTEANDAATAKEVFKQYANDNGVDGEWTYDDATKTFTVNE,-5.7970724,"G14S, V21N, E27K, K28E, T55N",5
MQYELILNGKVLKGETITEAVRAATAEKVFKQYANDNGVDGEWTYDEATKTFTVTE,1.4496864,"K4E, T11V, T17I, D22R, D47E",5
MQYKLILNGYTLKGETTTEMVDAAIREKVFKQYANPNGVDGEWTYDDATKTFTVTE,-5.0571394,"K10Y, A20M, T25I, A26R, D36P",5
MQYKLILNGKTLKGETTTEAVDAATAEKVAKQIANDRGYDGEWTYDDATKTFTVEE,-4.2794533,"F30A, Y33I, N37R, V39Y, T55E",5
MQYKLKLNGKTLKGGTNTEAVDAATAEKVFKQYANDNGFDGEWTYDDATKTFTVTK,0.014355011,"I6K, E15G, T17N, V39F, E56K",5
MQYKLILNGKTLGGETTTGAVDAATAEKKFQQYANDNGVDGEWTYDDATKEFTVTE,-1.1900272,"K13G, E19G, V29K, K31Q, T51E",5
MQYKLILNGETLKGENTTEAVDAATAEKVAKQYANINGVDGEFTYDDATKTFTVTE,-3.9093728,"K10E, T16N, F30A, D36I, W43F",5
MQYKLILNGKTLKGETTTEAVDKATAEKVFKQYANDNGVDTEFTGDDETKTFTVTE,-5.8734975,"A23K, G41T, W43F, Y45G, A48E",5
MQYKLILNGKTLKFETTTEAVDAAKAAKNFKQLANDNGVDGEWTYDDATKTFTVTE,-4.215996,"G14F, T25K, E27A, V29N, Y33L",5
MQYKLILNGKTVTGEVTVEAVDAATAEKVFKQYANDNGVDGEWTYDDATKTFEVTE,2.6992755,"L12V, K13T, T16V, T18V, T53E",5
MQYKLILNGKTLKGRTTTEAVSAATAEKVFKARANDNGVDGEWTYDDATKTFTITE,1.3367753,"E15R, D22S, Q32A, Y33R, V54I",5
MQYKVILNGKTLKGITTTEAVDAATAEKVFKQYAVDNGVLGEVTYDDATKTFTVTE,-5.5774846,"L5V, E15I, N35V, D40L, W43V",5
MQVKLELNGKTVKGETTTEAVDAATGEKVFKQVANDNGVDGEWTYDDATKTFTVTE,-1.9699436,"Y3V, I6E, L12V, A26G, Y33V",5
MQYKLILNGKTSSGETTTEAVDAATVEKVFKRYANDNGVDGTWTYDDATKTFTVTE,2.063867,"L12S, K13S, A26V, Q32R, E42T",5
MKYKLTLNGKTLKGEATTEAVDAATAEKVFKQYANDNGVDVEWEYDDATKTFTVTE,-1.5885228,"Q2K, I6T, T16A, G41V, T44E",5
MQNKLIWNGKTCKGETTTEAKDAATAEKVAKQYANDNGVDGEWTYDDATKTFTVTE,-4.470097,"Y3N, L7W, L12C, V21K, F30A",5
MQYKLILNGKTVKGETCTEAVQAATAEKMFKQYANDNGVDGEWTYDDDTKTFTVTE,3.1371417,"L12V, T17C, D22Q, V29M, A48D",5
MQYKLILNYKTAKGETTTEAVDAATAEKVFKQYANDNGVDGTATYDDATKTFTVTP,-5.02734,"G9Y, L12A, E42T, W43A, E56P",5
MQYKLILNGKTLKGECTTEAADAATAEKVFKQYANDNHVDGEWTYDDATKTFLGTE,-0.44358766,"T16C, V21A, G38H, T53L, V54G",5
MQYKLILNGATLKEETTTEAVDAATAEKVIKQYLNDNGVDGEWTYDDATNTFTVTE,-3.3861613,"K10A, G14E, F30I, A34L, K50N",5
MQYKLILNGKTLKGETEVEAVDAATAEKLFKQYINDNGVDGEWTYDDETKTFTVTE,0.6612331,"T17E, T18V, V29L, A34I, A48E",5
MQYSVILNGKTLKGETTTEAVDAATAEKVFKQYKNDNGVPGEWTYDDATKTYTVTE,-5.5942874,"K4S, L5V, A34K, D40P, F52Y",5
MQYKIILNGKTLKGETTTEAVDLATAEKVFKQLANDNGVNGEWTYDDATKTFTVTH,-2.3975995,"L5I, A23L, Y33L, D40N, E56H",5
MQYTLILNGKTLKGITPTEVVDAATAEKVFKQYANDLGVDGEWTYDDATKTFTVTE,1.2295357,"K4T, E15I, T17P, A20V, N37L",5
MQYKLIANGKTLKGEYTTEAVDATTAEKVFKQYANDNGVCGEWTYDDATNTFTVTE,4.1300488,"L7A, T16Y, A24T, D40C, K50N",5
MQYKLILNGKTLKGETFTEAVDAETAEKVFKQYVKDNGVDGEWTYDDATETFTVTE,-1.8706366,"T17F, A24E, A34V, N35K, K50E",5
MQYKLIFNGKTLKGETTTEAVDEATAEKVGKQWANDNGVDGEWTYDDATKTFTVVE,-3.0600019,"L7F, A23E, F30G, Y33W, T55V",5
MQYKLILNGKTLLGEVTTEAVDAATAEKVFKQYMTDNGVPGEWTYDDATKTFTVTE,-1.8770839,"K13L, T16V, A34M, N35T, D40P",5
MTYKLILNGKVLKTETTTEAVDVATAEKVFKQYANDNGVDGEWTYDDATKTFTVAE,-0.60121423,"Q2T, T11V, G14T, A23V, T55A",5
MQYKLILNGKTLKGETTTEAVDIATARKVFKQYAFDNGWDGEWTYDDATKTFTGTE,-5.918498,"A23I, E27R, N35F, V39W, V54G",5
MQYKLILNGKTFKGETTVEAVDAATAEKVFKDYANDNGVDGEATYDDATKNFTVTE,-5.3529463,"L12F, T18V, Q32D, W43A, T51N",5
MQYKQILNGKTLNGEETTQAVDAATAEKVFKQYANDNGVDGEWTYDDSTKTFTVTE,0.82083666,"L5Q, K13N, T16E, E19Q, A48S",5
MQYKLTHNGKTLKGATTTNAVDAATAEKVWKQYANDNGVDGEWTYDDATKTFTVTE,-0.20672163,"I6T, L7H, E15A, E19N, F30W",5
MQYKLIKNGKTLKGETTTEAVDAPTAEKVFTQYAADNGVDGEWTYDDATKTFTVKE,-5.567999,"L7K, A24P, K31T, N35A, T55K",5
MQYKLILNGKTLKAETTAEAVDAATAEKVFKQMANDNGVQGEWTCDDATKTFTVTE,-0.15928592,"G14A, T18A, Y33M, D40Q, Y45C",5
MQYKLILNGKTLKGETTTEAVDAATAEAVFKQYANDNGVDGEWSYNDAAKTFTVTL,-0.82580376,"K28A, T44S, D46N, T49A, E56L",5
MQYKLILNGKTIAGATTTEAVDAATAEAVFKQYANDNGFDGEWTYDDATKTFTVTE,-1.8125099,"L12I, K13A, E15A, K28A, V39F",5
MQYKLELNGKTLKGETTTEAVDASTAEKVFKQYANDNGVDGEWNYDSATKTFTLTE,3.5737817,"I6E, A24S, T44N, D47S, V54L",5
MQYTLIVNGKTLNGETTTEAVDAATAIKVFKQYANDNGVDGEWTYDSATKTFTVTE,-1.9424946,"K4T, L7V, K13N, E27I, D47S",5
MKYKLILNGKTLTGETTTEVVDAATAEKVFKQYANDNGVDGEWSYDDATKTFTVTL,2.5971847,"Q2K, K13T, A20V, T44S, E56L",5
MQYKLILNGKEYKGETVTEAVDAATAEKAFKQYANDNGVDGEWTYDDATHTFTVTE,1.0630146,"T11E, L12Y, T17V, V29A, K50H",5
MQYKLILEGKTLKGEITVENVDAATAEKVFKQYANDNGVDGEWTYDDATKTFTVTK,1.3636732,"N8E, T16I, T18V, A20N, E56K",5
MQYKLILNGKTLKGETTTEANDAATAEKVFKQYANDNDNDGEWTYDAATKTFTVTY,-2.210808,"V21N, G38D, V39N, D47A, E56Y",5
MSYKLILNGKTLKGETTIEAVDAAAVEKVFKQYANANGVDGEWTYDDATKTFTVTE,3.0605407,"Q2S, T18I, T25A, A26V, D36A",5
MQYKLLLNGDTLKGETMTEAADAATAEKVFKQKANDNGVDGEWTYDDATKTFTVTE,2.3315978,"I6L, K10D, T17M, V21A, Y33K",5
MQYKLILNGKTLKGETTVDAVDAATAEKTFKQYANDNGFDGEWTYDDATKTFTVTF,1.4255482,"T18V, E19D, V29T, V39F, E56F",5
MTYKLIYNGHTLKGETTVEAVDAATAEMVFKQYANDNGVDGEWTYDDATKTFTVTE,-0.29583752,"Q2T, L7Y, K10H, T18V, K28M",5
MQYILILNGKTLKGETTTEAVDAAEAEKVFKQYANDNGRDGEWTYDSATKTFTVEE,-1.681266,"K4I, T25E, V39R, D47S, T55E",5
MQYKLILNGKTLKGETTTEAVDAATAEKVFKQYAADYKVDYEWTYDDATKQFTVTE,-5.0985017,"N35A, N37Y, G38K, G41Y, T51Q",5
MQYKLILNGKTLKGETTTDAVDAATAEKLFKQCANDNGVDGEWTYDDETKTFTVTK,1.3676316,"E19D, V29L, Y33C, A48E, E56K",5
MQYKNILNGKTLKGETTTEAVTAATAEKVFKQYANLNKVDGAWTYDDATKTFTVTE,1.8505222,"L5N, D22T, D36L, G38K, E42A",5
MQYKLILNGIDLKGDTTTEAVDAATAQKVFKQYANDNGVTGEWTYDDATKTFTVTE,-3.3427694,"K10I, T11D, E15D, E27Q, D40T",5
MQYKLILNGKELKRETTTEAADAATAEKVFKQYAEDNGVDGEITYDDATKTFTVTE,-5.2427588,"T11E, G14R, V21A, N35E, W43I",5
MQYKLILNGKTYKGETTTEAVDAKTAEKVFQQYANDNGVKGEWTYDDATKTFTRTE,-5.797088,"L12Y, A24K, K31Q, D40K, V54R",5
MQYKLILNGKTLKGETTTEAVDAATAEKVFKQFANDNGVDLEVTYTDVTKTFTVTE,-5.2663593,"Y33F, G41L, W43V, D46T, A48V",5
MQYKKILNGKLLKLETTLEAVDAATADKVFKQYANDNGVDGEWTYDDATKTFTVTE,-5.968581,"L5K, T11L, G14L, T18L, E27D",5
MQYKLILNGKALKGETTTETVDAATAEAVAKQYAADNGVDGEWTYDDATKTFTVTE,-5.4876103,"T11A, A20T, K28A, F30A, N35A",5
MQYTIILNGQTLKGKTTTEAVDAATAEKVFKQYANANGVDGEWTYDDATKTFTVTE,2.2898614,"K4T, L5I, K10Q, E15K, D36A",5
MQYKLIRNGKLLKGETTTEAVDAATAEKVFKQLCTDNGVDGEWTYDDATKTFTVTE,-2.4384174,"L7R, T11L, Y33L, A34C, N35T",5
MAYKLITNGKTLKVETTTEAVDAATAEKVFKQYAADNGVDVEWTYDDATKTFTVTE,-5.7225695,"Q2A, L7T, G14V, N35A, G41V",5
MQYKLILNGKTLKGELTTEATDEATAEKVFEQYANDNLVDGEWTYDDATKTFTVTE,-4.8576283,"T16L, V21T, A23E, K31E, G38L",5
MKHKLILNGKTHKGETTTEAKDAATAEKVFKQYANDNGVDGEWTYDDATKTFTVTG,0.68104905,"Q2K, Y3H, L12H, V21K, E56G",5
MQYKLELNGKTLKGELATEAVDAATAEKVFKQYANDNGADGEWTYDDAAKTFTVTE,0.5070561,"I6E, T16L, T17A, V39A, T49A",5
MKYKLIWNGKTLIGETTTSAVDAATAEKSFKQYANDNGVDGEWTYDDATKTFTVTE,1.5677677,"Q2K, L7W, K13I, E19S, V29S",5
MQYKLILNGKTVKGETTTGAVDAATAEGVFKQYANDNGVDGEFTYDDATKTVTVTE,-5.883724,"L12V, E19G, K28G, W43F, F52V",5
MQYKGILKGKTYKGETTTEAVDAATAEKVFKQYVNDNGVDGEATYDDATKTFTVTE,-6.095766,"L5G, N8K, L12Y, A34V, W43A",5
MQYKLELNGKTLKGETTTEAVDAATAAKVFTQYMNANGVDGEWTYDDATKTFTVTE,-5.732541,"I6E, E27A, K31T, A34M, D36A",5
MQFKLILNGTTLKGETLTEAKDAATAEKAFKQYANDNGVDGEWTYDDATKTFTVTE,3.7325406,"Y3F, K10T, T17L, V21K, V29A",5
MQYKLILNGKTLKGETTTEAEDAATAEAVMKQYANDNMVDGEWTYDDATKTFTVVE,-2.144918,"V21E, K28A, F30M, G38M, T55V",5
MQYKLILNGGTLKTETKTEAVDIATAEKVFKQYALDNGVDGEWTYDDATKTFTVTE,-4.914388,"K10G, G14T, T17K, A23I, N35L",5
MQYKLILNGKTLKGETTTEAVDAATFEKVTEQYANDNGVDGEWTYDKADKTFTVTE,-5.578476,"A26F, F30T, K31E, D47K, T49D",5
MQYKVILNGKTLDGETTTEAVDAATAEKVFKQFANDNGLDGEWTIDDATKTFTVTE,1.2521691,"L5V, K13D, Y33F, V39L, Y45I",5
MQYKLILNGKILKGETTTEAVVTATAGKVFKQYANDNGVDDEWTYDDATKTFTVTE,-5.6855392,"T11I, D22V, A23T, E27G, G41D",5
MQYKLILVGKTLKGETTTEAVDAAAAEKIFKQYANDNGKDGEWTYDAATKTFTVTE,0.47007817,"N8V, T25A, V29I, V39K, D47A",5
MQYKLILNGYTSTGETTTEAVDKATAEKVFKQYANDNGGDGEWTYDDATKTFTVTE,-4.983191,"K10Y, L12S, K13T, A23K, V39G",5
MQYKLILNGKTLKGSTITEVVDAAAAEKVFKQYANDNGVDGHWTYDDATKTFTVTE,3.9508505,"E15S, T17I, A20V, T25A, E42H",5
MQYKLTLNGKTFKGETTPEAVDAATAEKVFKAYNNDNGVDGEWTYDDATKTFTVTE,-5.232448,"I6T, L12F, T18P, Q32A, A34N",5
MQYRLILNGETLKGETTTEAVDAGTAEKVFKQYANDNGLDGEWTYDDETKTFTVTE,4.8808284,"K4R, K10E, A24G, V39L, A48E",5
MQYKLILNGPTLKGETTAEAVDAAAAEKVFKEYANDNGVDLEWTYDDATKTFTVTE,-4.424658,"K10P, T18A, T25A, Q32E, G41L",5
MQYKLILNGKTLKGTTTTEAVDAATAEKVFKDYANDNKVDGEWTYDDETKIFTVTE,0.8767864,"E15T, Q32D, G38K, A48E, T51I",5
MEYKLILNGKTLKGETTTDAVDAATAEKVFKQYANENGVDGEWTYDDATKTFIETE,-0.32789314,"Q2E, E19D, D36E, T53I, V54E",5
MQYKLILLGKTLKVTTTTEAVDAATVEKVFKQYANDNGVDGLWTYDDATKTFTVTE,2.082389,"N8L, G14V, E15T, A26V, E42L",5
MQYKLILNGKTLKEETTTEAVDAETAEKVFKEYCNDNGVDGEWTYDDAGKTFTVTE,0.9937573,"G14E, A24E, Q32E, A34C, T49G",5
MQYKLILNGKTLKGEFTTEAVDALTAESVFKQYANDNGVDGEWTYDDVSKTFTVTE,0.10771898,"T16F, A24L, K28S, A48V, T49S",5
MQYKLILNGKTLKGETTHEAVDAATAEKDFKQYANGNGVDGEWTYDDATITFTVTQ,1.389044,"T18H, V29D, D36G, K50I, E56Q",5
MQYKLIINGKTLKEETTTEAVDAATAEKRFKQYAQDNGVDGEWGYDDATKTFTVTE,-0.35627818,"L7I, G14E, V29R, N35Q, T44G",5
MQYKLILNGKTLSGQTTTEKVDAATAEKVFKKYANDNGVDGEWTYDDATKQFTVTE,5.412824,"K13S, E15Q, A20K, Q32K, T51Q",5
MQYKLILNGKTLAGETTTEAVDAATAAKKFKQKANDNGVDGEWTYDDATKTFTVTI,-4.1083274,"K13A, E27A, V29K, Y33K, E56I",5
MQYKLIRNGKTLKGETTTEASDAAAAEKVFKQYANDNGIDGEWTYDDETKTFTVTE,1.8590795,"L7R, V21S, T25A, V39I, A48E",5
MQYKLILNGKTLKPETTREAVDAATAEDVAKTYANDNGVDGEWTYDDATKTFTVTE,-5.532249,"G14P, T18R, K28D, F30A, Q32T",5
MQYKVILNGRTLKGETTTEAVDAATAWKQFKQAANDNGVDGEWTYDDATKTFTVTE,-3.7242699,"L5V, K10R, E27W, V29Q, Y33A",5
MQYRLILNGITLKGETTTEAVDAATAEKLFKQYANDNGVDGEVTYDEATKTFTVTE,-2.0013232,"K4R, K10I, V29L, W43V, D47E",5
MQYKLILNGKTLKGETTTEAVDAATAEKKFKRYAQDNGVDGEITYDDATKEFTVTE,-4.5155687,"V29K, Q32R, N35Q, W43I, T51E",5
MQYKLELNGKTLKGETTTEAVDAATAEKVFKQYANDNGVDGTLTYDDATETFTVNE,-2.6653526,"I6E, E42T, W43L, K50E, T55N",5
MQYKLLLNGGTLKKETTTEAVDAATAEKQFKQYINDNGVDGEWTYDDATKTFTVTE,-1.2287197,"I6L, K10G, G14K, V29Q, A34I",5
MQYKLYLNGKTLKGETTTEANDAETAEKVFKQYANDNGVDGEWTYDDATLTFTRTE,0.10763051,"I6Y, V21N, A24E, K50L, V54R",5
MQYKLILNGKTLKGETTTEAVDAATAEKVMKKYANDNGVVGEWTYDDATKAMTVTE,1.5053674,"F30M, Q32K, D40V, T51A, F52M",5
MQYKLILNGKTEKFKTTTEAVDAATAEKVFKQYANDNGVDGKWTYDDNTKTFTVTE,0.79916954,"L12E, G14F, E15K, E42K, A48N",5
MQYKLILNGKTLKGETTTEAVDAATAEKRFKQYADDNDVKGGWTYDDATKTFTVTE,-0.6054695,"V29R, N35D, G38D, D40K, E42G",5
MQYKVILNGKTLKGETTGEAEDAATAEKVFEQYANDNGVDGELTYDDATKTFTVTE,-6.0828676,"L5V, T18G, V21E, K31E, W43L",5
MQYKLKLDGKTLKGEITTEAVDADTAEKVFKQYANDNGSDGEWTYDDATKTFTVTE,-0.07236508,"I6K, N8D, T16I, A24D, V39S",5
MQYKLILNGKELKGETTTEAVDAAAKEKVFKQYANDNGVDGEWTYDDATKAFTITE,-4.367967,"T11E, T25A, A26K, T51A, V54I",5
MQYKLILNGKPLKGETTTEAVDAATAENVFKQYANDFGVDGEWLYDDKTKTFTVTE,-3.4569817,"T11P, K28N, N37F, T44L, A48K",5
MDYKLIRNGKVLKGEITTEAVDAATAEKVFKQYANDNGVDGEWTYDSATKTFTVTE,1.3633233,"Q2D, L7R, T11V, T16I, D47S",5
MQYKLILNGKTVKGETTTEAVDAATAAKVFKQYANDNGVDGEWTYDGATNTFTVSE,-3.4714,"L12V, E27A, D47G, K50N, T55S",5
MQYKLILNGKTLKGETTVDAVDAATAEKVFKQYANDFGVDGEWTYDIATKTFNVTE,1.2616637,"T18V, E19D, N37F, D47I, T53N",5
MQYKYILNGKGLKGETTTEAVDAATAEKVFKQYAEDNGWDGEWTYDDATKTFTVRE,-5.781744,"L5Y, T11G, N35E, V39W, T55R",5
MQYKLILNGKTLKGVTTTEAVDAATAEKIFKQYANDNGVDVEWTYDDATKTFTVRK,-2.0107212,"E15V, V29I, G41V, T55R, E56K",5
MQYKLILNGKTLKGDTRTEAVDAATAEKVFKQYANDNGVGVEWTYDDATKTFTVPE,-4.3754334,"E15D, T17R, D40G, G41V, T55P",5
MTYKLILEGKTLKGETTTEAVDAATAERVVKQYANDNGYDGEWTYDDATKTFTVTE,-1.4922642,"Q2T, N8E, K28R, F30V, V39Y",5
MQYKLILTGKTLKGETTTEAVDAATAEKVFKQYANDNGVDGELLYDDATKTFTATF,-4.251789,"N8T, W43L, T44L, V54A, E56F",5
MQVNLILNGKELKGETTTEAVSAATAEKVFKQYANDNGVDGEWVYDDATKTFTVTE,-0.7400855,"Y3V, K4N, T11E, D22S, T44V",5
MQYKLIRNGKPLKGETTTEAVDAATAEKVFKQYANDNGVPGEITYDDATKTFHVTE,-5.831984,"L7R, T11P, D40P, W43I, T53H",5
MQYKLILNGKTAKGETTTEAADAATAEKVFKQYAKDNGVDGEWTYDDATKTITVGE,-5.3155403,"L12A, V21A, N35K, F52I, T55G",5
MQYKLILNGKTLKGETTTEATDAATAEKVFKQLANDKMVDGEWTYDDATNTFTVTE,0.85210335,"V21T, Y33L, N37K, G38M, K50N",5
MQYKLILNGKTVKGETTTEAVDAATAEKVMKQYANDNGFDGEWTYDNANKTFTVTE,1.1697668,"L12V, F30M, V39F, D47N, T49N",5
MQYKLIINGKTLKGETTTEADDAATAEKMFKQYANDNGVDGEWVYDDATSTFTVTE,3.2026052,"L7I, V21D, V29M, T44V, K50S",5
MQYKLILNGDTLKGETTTEATDAATKEKDFKQYAKDNGVDGEWTYDDATKTFTVTE,-5.608118,"K10D, V21T, A26K, V29D, N35K",5
MQYKLILNGKTLKGETTREAVDKATAEKVFKQYANDNGVDGEWTYNDDTKTFTVEE,0.6738825,"T18R, A23K, D46N, A48D, T55E",5
MQYKLILNGKTLNGATTTEAVDAATALKVFKQYANDNGVDGEVTYDDATKTLTVTE,-6.475634,"K13N, E15A, E27L, W43V, F52L",5
MQYKLILNGKTLDGEFTCEAVDAATAEKLFIQYANDNGVDGEWTYDDATKTFTVTE,-3.1329195,"K13D, T16F, T18C, V29L, K31I",5
MQYKLILNGKTLKGETTVKAVDAATAEAVFKQYLNENGVDGEWTYDDATKTFTVTE,-1.7082115,"T18V, E19K, K28A, A34L, D36E",5
MQYKLILNGKELKGETTTEAEDAATAEKVFKQYAEDNGVDGEFTYDDATKTFTKTE,-5.461107,"T11E, V21E, N35E, W43F, V54K",5
MQYKLTLNGKTLKGETTTEATDASTAEKVAKQYANDNGVDGEWTYDDATKTGTVTE,-3.518925,"I6T, V21T, A24S, F30A, F52G",5
MSYKLILNQKTLKGQTTTEAVDAATAEKVFKQYANDNGVDGEWTYDEATKTFTKTE,-2.615957,"Q2S, G9Q, E15Q, D47E, V54K",5
MKYKLILNGKTLKGETTTEAVDAATAEAVFKQFCNDNGVDGEWTYDDATDTFTVTE,1.0645463,"Q2K, K28A, Y33F, A34C, K50D",5
MQYKLILNMKTLKGETFTEAVDAATAAKVAKQYANDNGVDGEWVYDDATKTFTVTE,-5.87471,"G9M, T17F, E27A, F30A, T44V",5
MQYKTILNGKTLKGETTTEFVDAATAEKVGKDYANDNGVDGEWTYDDATKEFTVTE,-4.684712,"L5T, A20F, F30G, Q32D, T51E",5
MQTKLILNGKTLKGEGTTEVVDAATAEKVFKQYFNDNGVDGEWTYDDATHTFTVTE,-4.4528394,"Y3T, T16G, A20V, A34F, K50H",5
MQYKLILNGKTLKGITTTEAVDAADAEKVFKQYANDNGVMGNWSYDDATKTFTVTE,3.3497732,"E15I, T25D, D40M, E42N, T44S",5
MQYKLKQNGKTLKAETTTEAVDASTAAKVFKQYANDNGVDGEWTYDDATKTFTVTE,-3.973504,"I6K, L7Q, G14A, A24S, E27A",5
MQTKLILNGKTLKGETTTEAVDAATAEKVFKQYINDNGVDGEPTYDDATSTFTTTE,-5.1770463,"Y3T, A34I, W43P, K50S, V54T",5
MQYKLILNGKTFKVETTTDAVDAATAEKVFKQYAADNGVDGEWTYDDATKTVTVTE,-5.606377,"L12F, G14V, E19D, N35A, F52V",5
MQYKLILNGKTLKGETTTEAVDAATADKTFKQYANDAGLDGEYTYDDATKTFTVTE,-5.076154,"E27D, V29T, N37A, V39L, W43Y",5
MQYKLTLNGKTLKGETTTAAVDAATAEKVFKQYANDNGVDGTWTYDAATKTFTFTE,4.663136,"I6T, E19A, E42T, D47A, V54F",5
MQYKLILNGKTLKGETPTDAVDKASAEKKFKQYANDNGVDGEWTYDDATKTFTVTE,0.840565,"T17P, E19D, A23K, T25S, V29K",5
MQYKLILNGKTWKGETGTEAVDAATAEKIFKQYANDNGWDGEWYYDDATKTFTVTE,-1.8948244,"L12W, T17G, V29I, V39W, T44Y",5
MQYKLILNGKTLKGQTVTEAVDAATAEKVFKQYAEVNGVDGEWTYDDATKTITVTE,-4.076503,"E15Q, T17V, N35E, D36V, F52I",5
MQYKLILAGKTLKGEITTEAVDAATAEKVFKQKANDNGVDGEFTYDDATKTFVVTE,-2.3743076,"N8A, T16I, Y33K, W43F, T53V",5
MQYKLILNGKTLKGETTTEAVDAETAEKVFKQYANDNGVDGEWFYVDATKTFVLTE,4.2990756,"A24E, T44F, D46V, T53V, V54L",5
MQYKLILNGKTLKGETTTIPVDAATAEKVFKQYINDNKVDGEWTYDGATKTFTVTE,-1.1974216,"E19I, A20P, A34I, G38K, D47G",5
MIYKIIKNGKTLKGETTTEAVDAATAEKAFKQYANDNGIDGEWTYDDATKTFTVTE,0.91852164,"Q2I, L5I, L7K, V29A, V39I",5
MQYKLILNGKTLYGETTTEAVDAATAESVAKQYANDNGVDGEWTYNDATKTFSVTE,-1.9205425,"K13Y, K28S, F30A, D46N, T53S",5
MQIKLILNGKTLKGETTTEAKDAATAEKVFKQYVKDNGVDGEWTYDDATRTFTVTE,-4.0842905,"Y3I, V21K, A34V, N35K, K50R",5
MQYKLIPNGKTDKGETTTEAVDAATAEKVFEQYANENGVDGEWTYDDATKKFTVTE,-4.7266006,"L7P, L12D, K31E, D36E, T51K",5
MQYKLILNGKTLKGETTTEAVDADTAEKVFKQYANDNGFPTEWTYDDATKTFTWTE,-4.7477417,"A24D, V39F, D40P, G41T, V54W",5
MQYKLILNGVTLKGETTTLAVDAATAEKVFKQYANIIGVDGKWTYDDATKTFTVTE,3.8348033,"K10V, E19L, D36I, N37I, E42K",5
MQYKLILNGKTLKGETTFEAVDAATAEKAFKQLANDNGVLGEYTYDDATKTFTVTE,-2.158164,"T18F, V29A, Y33L, D40L, W43Y",5
MQYKLRLNGKTLKGETTTEAVDAATAKKVFEQYANDNGVDGEWDYVDATKTFTVTE,-5.901783,"I6R, E27K, K31E, T44D, D46V",5
MQYKLVLNGKTLKGETTTEAVDAATAEKPAKQYANDNGVDGEWDYNDATKTFTVTE,-1.0170897,"I6V, V29P, F30A, T44D, D46N",5
MQYKLILNGKTLKGETTEEAVDAATAKKVMKQYANDNGVDGEWTYDETTKTFTVTE,-3.855158,"T18E, E27K, F30M, D47E, A48T",5
MQYKLILNGKTLKGETTTEAVDAAAAEKVFKTYANDNVKDGEWTYDDSTKTFTVTE,-1.6471967,"T25A, Q32T, G38V, V39K, A48S",5
MQYKLILNGKTLDGETTTEAVDAATAEKVFKQYVNQYGVDGEWTYDDATKTFRVTE,-0.94408506,"K13D, A34V, D36Q, N37Y, T53R",5
MQYKLIWNGKTLKGETTTEAVDAATAEKVAKQYANQNGVDGTWTYDDATKTYTVTE,-2.679912,"L7W, F30A, D36Q, E42T, F52Y",5
MQYKLILNGKTLKGETTIEAVDAATAEKVAIQYANDNGVDGEWTYDDAKKTFTVQE,-4.034362,"T18I, F30A, K31I, T49K, T55Q",5
MQYKLILNGKTLKGETTTETVDAATAEKVFKQYANDNGVFGEVTYDPATKTFTVTF,-2.040744,"A20T, D40F, W43V, D47P, E56F",5
MQYKLILNGKTLKGERTTEAVDAATAEKLAKQYASDNGVDGEWTYDDADKTFTVTE,-1.623369,"T16R, V29L, F30A, N35S, T49D",5
