Sequence,Score,Mutations,Number of Mutations
MQYKLILNGKTLKGETTTECVDAASAEKVFKKYANDNGYDGEWTYEDATKTFTVTE,1.4615619,"A20C, T25S, Q32K, V39Y, D46E",5
MKYKLILNDKTLKGETTTEASDAATAEAQFKQYANDNGVDGEWTYDDATKTFTVTE,-0.8508879,"Q2K, G9D, V21S, K28A, V29Q",5
MKYKLILNGKTLKGETTTEAVDAADFETVYKQYANDNGVDGEWTYDDATKTFTVTE,-4.5446434,"Q2K, T25D, A26F, K28T, F30Y",5
MQYKLILNGKTLKGVTTTEAVDAATAEKMFKQLANDNGVDGEWTYDDAEKTVTVTE,-0.010202929,"E15V, V29M, Y33L, T49E, F52V",5
MTYKLILNGKTLKGETATEATDAAEAEKVFKQYANDNGVDGEWTYDDATKTLTVTE,0.7817738,"Q2T, T17A, V21T, T25E, F52L",5
MQYKLIRNGKTLKGETCTEAVDAATAEEVFKQYANDNGVDSEWKYDDATKTFTVTE,-5.324614,"L7R, T17C, K28E, G41S, T44K",5
MQYKLILNEMTLKGEMTTEAVDAATLEKVFKQYANTNGVDGEWTYDDATKTFTVTE,-3.6511376,"G9E, K10M, T16M, A26L, D36T",5
MQYKLTLNGETLKGETTTEAVDAATAEKVFKQYINDNGADGEWTYDDATKEFTVTE,-2.571143,"I6T, K10E, A34I, V39A, T51E",5
MQYKPILNGKTLKGGTTTEAVDAATAEKVFKQYANENGVMGEWTYDDATKTFDVTE,-2.6312206,"L5P, E15G, D36E, D40M, T53D",5
MSYKLVLNGKTLKGETTTEAVDAATAEKVFKQYANDQGIDGEWTYDDATKGFTVTE,2.3548057,"Q2S, I6V, N37Q, V39I, T51G",5
MQYKLILNGKTLKGETTTEAVDYATAEKVFKQYAADNGVDKPWTYDKATKTFTVTE,-5.7935376,"A23Y, N35A, G41K, E42P, D47K",5
MQYKLILNGKVLKGETTTPAVDAATAEKVFEQYANDNGVDGNWTIDDATKTFTVTE,-4.3642893,"T11V, E19P, K31E, E42N, Y45I",5
MQYKLELNGKTLKGETITEAVDAATAKKVFKQYAEDNGVDGEWTYDDSTKTFTVTE,-5.074881,"I6E, T17I, E27K, N35E, A48S",5
MQYKLILNGKTITGETTTEAVDAATAEKVFKQYANDNGVDGEWVYDDNTKTFTVSE,2.4392745,"L12I, K13T, T44V, A48N, T55S",5
MQYKLILNGKTVKGETTTEKVDAATAEKVFKQYANANGVKGEWTYDDATKTFTVVE,2.991461,"L12V, A20K, D36A, D40K, T55V",5
MQYKLIRNGKTLKGETTTEAVDAATAEKVFKQYLNDNGEDGEWTYDDATKEFTVTR,-5.007772,"L7R, A34L, V39E, T51E, E56R",5
MQYKLILNGKTLKGETLTEAVDAATAEKVFKQMANDNGVDGEWAYDKATKTFTVTP,2.0833924,"T17L, Y33M, T44A, D47K, E56P",5
MKYKLILNTKTLTGETTTEAVDAATAEKVFKQYANDNQVDYEWTYDDATKTFTVTE,-1.6037042,"Q2K, G9T, K13T, G38Q, G41Y",5
MQYKLIYNGKTLKGYTTDQAVDAADAEKVFKQYANDNGVDGEWTYDDATKTFTVTE,-0.19446123,"L7Y, E15Y, T18D, E19Q, T25D",5
MQYELILNGKTLTGETTTEAVDAATAEEVFKQYANDNGVDGEWKYDDATKTFTVTA,-3.1591208,"K4E, K13T, K28E, T44K, E56A",5
MQYKLILNGKTLKEETTTEAVDAATAEKVFKQYAKENGVDGEWTYYDATGTFTVTE,-2.5820448,"G14E, N35K, D36E, D46Y, K50G",5
MQYKLTLNGKTLKGETTTEAVTAATALKVFKQYANDNYVDGEWTYDDATKTFTVTI,-4.679341,"I6T, D22T, E27L, G38Y, E56I",5
MQYKLILNGETLKGETTTEAVDAATAERVAKQYANDNKVDGEWTYDDAYKTFTVTE,-0.7820901,"K10E, K28R, F30A, G38K, T49Y",5
MQYKLILNGKTFKGEYTTEAVDAATAEKIFKQYANDNGIDGEWTMDDATKTFTVTE,0.56614506,"L12F, T16Y, V29I, V39I, Y45M",5
MQYKLILNGKTLKEEITTEAVDEATAEKVFKQYANDNGVDGEWTYDDATKTFTGFE,-2.2939553,"G14E, T16I, A23E, V54G, T55F",5
MQNKLILNGKTLKGETTTDAVTAATAEQVFKQYANDNGVPGEWTYDDATKTFTVTE,-3.1789703,"Y3N, E19D, D22T, K28Q, D40P",5
MQYKVILNGKTLKGETTTEAVDAATAEEAFVQYANDNGVDGEWTYDDATKTFTPTE,-6.0188193,"L5V, K28E, V29A, K31V, V54P",5
MQYKLILNGKTLKAEGTIEAVDAATAEKMFKQYANDNGVDGFWTYDDATKTFTVTE,2.098387,"G14A, T16G, T18I, V29M, E42F",5
MKYKLIYNGKTLKEETTTEAVDAATAEKRFKQLANDNGVDGEWTYDDATKTFTVTE,1.7070493,"Q2K, L7Y, G14E, V29R, Y33L",5
MQYKLILNGKTIKTETTTEAVDAATAEKVFKQYLNDNGVEGEWTYDDATKTFVVTE,-1.4870754,"L12I, G14T, A34L, D40E, T53V",5
MQYKLILNGKELKGETTTEAVDAATAEKVAKQWANDNGVHGEWTYDDAHKTFTVTE,1.1574515,"T11E, F30A, Y33W, D40H, T49H",5
MNYKLILNGKVLKGETVTAAVDAATAEKVFKQYANDNGVDGEWTYDDATKTFTVAE,2.2784672,"Q2N, T11V, T17V, E19A, T55A",5
MQYKLIYNGKTLKHETTTEAVDAATAENVFKQYANDNGVDLELTYDDATKTFTVTE,-6.5845814,"L7Y, G14H, K28N, G41L, W43L",5
MKYKLILNGKTLKGDTTTAAVTAATAEKVFKQYAADNGVDGEWTYDDATKTFTVTE,-0.35578093,"Q2K, E15D, E19A, D22T, N35A",5
MQYKLILNGKTLKGETTTEAVDAATAEKTFKQRAADLGVDGEWSYDDATKTFTVTE,-2.6029978,"V29T, Y33R, N35A, N37L, T44S",5
MQYKLILNGKTINGETTTEAVDAATAETVFKDYANDNGVDGEWTYDDATGTFTVTE,-2.3859208,"L12I, K13N, K28T, Q32D, K50G",5
MQYKLILNGKTLKGETTTEAVDATTARKVFKQYANDNGIDGEWTEDDATKTFTVIE,-5.1870875,"A24T, E27R, V39I, Y45E, T55I",5
MNYKLILNGKTLKGETTTEAKDRATAEKVAKTYANDNGVDGEWTYDDATKTFTVTE,-1.6257963,"Q2N, V21K, A23R, F30A, Q32T",5
MQYKLILNGKTLKGERTTEAVDAATAEKVVKQYANDNGYDGEWTFDDATATFTVTE,-0.83368444,"T16R, F30V, V39Y, Y45F, K50A",5
MQYKLILDGKTLKEETTTEAVDFATAEKVFKTYANNNGVDGEWTYDDATKTFTVTE,-2.654307,"N8D, G14E, A23F, Q32T, D36N",5
MQYKLIVNGKTLKGEYTTEAVDKATAEKVFKQYANDNGVDYEWTYDDATDTFTVTE,-4.132478,"L7V, T16Y, A23K, G41Y, K50D",5
MQYKLILNGKTVKGETTTEAVDAADAEKVFKQYANDNGVYGEWTYDDTTKQFTVTE,3.5811367,"L12V, T25D, D40Y, A48T, T51Q",5
MQYKLIFNGKTLKGETTTEAVDAATAERVFKQYANDNGVDGEWTYDDATDTFTEVE,-2.6179895,"L7F, K28R, K50D, V54E, T55V",5
MQYKIILNGKELKGETTTEAVDAATAEKVFKAYANDNGEDGEWTYDAATKTFTVTE,-2.3851771,"L5I, T11E, Q32A, V39E, D47A",5
MQYKLIQNGKTLDVETYTEAADAATAEKVFKQYANDNGVDGEWTYDDATKTFTVTE,0.26361692,"L7Q, K13D, G14V, T17Y, V21A",5
MQYKLILNGKTLKGETLTEAVNAATAEKMFKQYANDNGVDGEWTYDDDTKTFLVTE,3.220863,"T17L, D22N, V29M, A48D, T53L",5
MQYKKILNGKTLKGYTTTEAVDAAQAEKVAKQYANDNGVDGELTYDDATKTFTVTE,-5.477252,"L5K, E15Y, T25Q, F30A, W43L",5
MQYKLKLDGKELKGETTTEAVDTATAEKVFKQYANDNGVDSEWTYDDATKTFTVTE,-3.6875572,"I6K, N8D, T11E, A23T, G41S",5
MQYDLILNGKTLKGEYTTEAVDGATAEKIFKQYANDNGYDGEWTYDDATKTFTVTE,-1.6808983,"K4D, T16Y, A23G, V29I, V39Y",5
MQYKLILNGKPLKGETTTEAVDAATAEKVFKQFLNDNGVIGEWTYDDAKKTFTVTE,0.08447013,"T11P, Y33F, A34L, D40I, T49K",5
MKAKLILNGKTLKGETTTEAVDDATAEKVFKQYANDNGVDGQWTYDDATKTFTVDE,1.4169203,"Q2K, Y3A, A23D, E42Q, T55D",5
MQYKLILNGKTLKGFTTQEAVDAATAEKVAEQYANDNGVKGEWTYDDATKTFTVTE,-4.6352506,"E15F, T18Q, F30A, K31E, D40K",5
MQYKLILNGKTLKGYTTTEAKDATTAEAVFKQYANDNGVDGEWTYDDKTKTFTVTE,2.2859657,"E15Y, V21K, A24T, K28A, A48K",5
MQAKLILNGKTLKRFTTTEAVDAATAEKVFKQYANDWGVDGEWTYDEATKTFTVTE,-1.210692,"Y3A, G14R, E15F, N37W, D47E",5
MQYKLILNGKTLKGETTTEAVDAATAEKVAKQYLIDNGVDGEWTYDTATKAFTVTE,-3.9909215,"F30A, A34L, N35I, D47T, T51A",5
MAYKLILNGKTLKGDTTTEAVDEATAEKVFKQYVNDNGVDGSWTYDDATKTFTVTE,0.5612161,"Q2A, E15D, A23E, A34V, E42S",5
MQYKLILNGKTLKGEVTTEAVSAATAIKVFKQYANDNGVDGEWTYDDETGTFTVTE,-2.249512,"T16V, D22S, E27I, A48E, K50G",5
MQYKLILNGKTLTGETTTETVDAATAKKVFAQYANDNGVDVEWTYDDATKTFTVTE,-6.470008,"K13T, A20T, E27K, K31A, G41V",5
MQYKAILNGKTLKGETQTEAVDAATAEKVFKQFANDNGVDGEWTYNPATKTFTVTE,4.33585,"L5A, T17Q, Y33F, D46N, D47P",5
MQYKLILNGKTLKGETTTEAVTAATAEKVFKQYANDNGVDGEWTYDESTKKATVTE,0.032600142,"D22T, D47E, A48S, T51K, F52A",5
MQYKCILNGKTLKGETTTEAVAAATAEAVFEQYANDNGVDGEWKYDDATKTFTVTE,-4.7338896,"L5C, D22A, K28A, K31E, T44K",5
MQYKLILNGKTLKGEMTTEAVDAATAEQVFKQYMADNGVDGEWTYDDATKEFTVTE,-4.6056967,"T16M, K28Q, A34M, N35A, T51E",5
MQYKLILNGETLKGETTVEAVDAATAEKKFKQYANDNGVDEEWTYDDATATFTVTE,-0.80330986,"K10E, T18V, V29K, G41E, K50A",5
MQYKLYLNGKTLKGETTTEAVDAATAEKVFQQYANDNKVDGEWTYDDATYTVTVTE,-5.3233128,"I6Y, K31Q, G38K, K50Y, F52V",5
MQYKLILNGKNLKGETTTEAVDAATAAKEFKQYANDNGVDGEWEYDDATKTFTLTE,-5.072935,"T11N, E27A, V29E, T44E, V54L",5
MKYKLICNGKTLKGETTMEAGDAETAEKVFKQYANDNGVDGEWTYDDATKTFTVTE,4.31263,"Q2K, L7C, T18M, V21G, A24E",5
MAYKLILNGKTLKGETTTEAVDAAGAEKVFKQYANRNGVDGEWTYDDATKTFTVCA,2.8630812,"Q2A, T25G, D36R, T55C, E56A",5
MQYKLILNGKTYKGETTTEAVDAATAEKVFKSYANDNGVDGEITYDDATKIFTVTN,-4.66965,"L12Y, Q32S, W43I, T51I, E56N",5
MDYKLILNGKTYKGEITTEAVDAATAEKVFKQAANDNGVDGEVTYDDATKTFTVTE,-5.2862816,"Q2D, L12Y, T16I, Y33A, W43V",5
MQYNLILNGKTLKGETDTEAVDAATAEKQFKQYANDNGLDGTWTYDDATKTFTVTE,3.5857165,"K4N, T17D, V29Q, V39L, E42T",5
MQYTLILNGKTLKGETTPEAVDAATAEKVFKQQGNDNGVDGEATYDDATKTFTVTE,-5.797244,"K4T, T18P, Y33Q, A34G, W43A",5
MQYKLILNGKTWKGETTTEAVDAAAAEKVFKQYANDNGVDGEVTYDDKTKTITVTE,-5.645752,"L12W, T25A, W43V, A48K, F52I",5
MQYKLILNGKTLQGETTTEEVDAATAVKVFKQYANDNGVKGEWTYDDATKTFTVTR,-4.9654913,"K13Q, A20E, E27V, D40K, E56R",5
MQYKLTLNGKTLKGESTTEAVDAATAEKVMKQYCNDNGVDVEWTYDDATKTFTVTE,-2.6909347,"I6T, T16S, F30M, A34C, G41V",5
MQYKLILKGKTLKGETFTEATDADTAEKVFKQYANDNGVDGEWTYDEATKTFTVTE,3.9736474,"N8K, T17F, V21T, A24D, D47E",5
MTYKLILNGKTLKGETTTEAVTAASAEKVFKQEANDNGVDGEWTYDDATKTFTVKE,1.1952374,"Q2T, D22T, T25S, Y33E, T55K",5
MQYKFILNGKKLKGETTTEAVDAAEAEKVFRQYANPNGVDGEWTYDDATKTFTVTE,-4.1193147,"L5F, T11K, T25E, K31R, D36P",5
MQYKLIDNGKTLKGETTTEQVDAATAVKVFKQYANDNPVDGEWTYDDATKLFTVTE,-5.833775,"L7D, A20Q, E27V, G38P, T51L",5
MQYKLHLNGKYLKTETTTEFVDAAAAEKVFKQYANDNGVDGEWTYDDATKTFTVTE,-0.08502049,"I6H, T11Y, G14T, A20F, T25A",5
MQYKIIQNGKTVSGETTTEAVDAATAEKVFKQYANDNGVDGEWTYDDKTKTFTVTE,-0.32117584,"L5I, L7Q, L12V, K13S, A48K",5
MQYKLTVNGKVLKGETTTEAVDAATAEKVFKQKANDNGVDGEWTQDDATKTFTVTE,-2.158705,"I6T, L7V, T11V, Y33K, Y45Q",5
MQYKLILNGTTLKGETTTPAVDRATAEKVFKQYANDAGVDGEWTYDDATKTFTVSE,-0.7662678,"K10T, E19P, A23R, N37A, T55S",5
MQYKVILNGRTYKGETTTEAVDAATAEKVFKQYANDNGVDGEWTYDDQTKTLTVTE,-0.37110665,"L5V, K10R, L12Y, A48Q, F52L",5
MKYKLILNGKTLKGVTTTEAVDAATAEKVAKQYANDNGVDGEWTYDRATKEFTVTE,3.7377653,"Q2K, E15V, F30A, D47R, T51E",5
MQYKLILNGKTLKGETTTFAVDAAEAEKVFEQYRNDNGVDGEWTYDEATKTFTVTE,-4.814702,"E19F, T25E, K31E, A34R, D47E",5
MQYKLILNGKTLKGKTTTEAVDAATAEKVFKQYLAANGVDGVWTYDDATKTFTVTE,-2.5995996,"E15K, A34L, N35A, D36A, E42V",5
MQYKVFLNGKTLKGETTTEAVDAATAEAVFKQYANDNGVDGEITLDDATKTFTVTE,-4.7283807,"L5V, I6F, K28A, W43I, Y45L",5
MEYKLILNGKTLKGETTTEAVNKVTAEKVFKQYANDNGVDGEWTYDDATKTVTVTE,-2.2746177,"Q2E, D22N, A23K, A24V, F52V",5
MQYLLILNGKTLKDETTTEAVDAATAEKVFKQYVNTNGVTGEWTYDDATKTFTVTE,0.566325,"K4L, G14D, A34V, D36T, D40T",5
MQYKLILNGKTLKGRTITEATDAATAEKVFNQYANDNGVDGEWVYDDATKTFTVTE,-2.8758557,"E15R, T17I, V21T, K31N, T44V",5
MQYKLIFNGKTLKGETTTPCVDAAEAEKVFKQYANDNEVDGEWTYDDATKTFTVTE,0.5130387,"L7F, E19P, A20C, T25E, G38E",5
MQYKLILNGKTLKGETTTEAVDTATAEQVFKQWANENGCDGEWTYDDATKTFTVTE,-2.438767,"A23T, K28Q, Y33W, D36E, V39C",5
MEYKLILNGETLKGETTTEAVDAATAEKVFKQYSNDNGVDGEWTYNDATKTFTVTK,1.8205384,"Q2E, K10E, A34S, D46N, E56K",5
MQYGLILNGKTLHGETTTEAVDYATAEKVFKQYANDNGVDGETTYDDATKTFTVDE,-5.6332,"K4G, K13H, A23Y, W43T, T55D",5
MQYKLIWNGKTLTGETTTEAVDKATAEKVFKTYANDNGVDGVWTYDDATKTFTVTE,-1.4486642,"L7W, K13T, A23K, Q32T, E42V",5
MQVKLILNGKTWKGETTTEAVDAATAEKVAKDYANDNGVDGFWTYDDATKTFTVTE,-4.302836,"Y3V, L12W, F30A, Q32D, E42F",5
MQYKLILNGKTLIGETTTEAVDAATAEKTIKQYAEDNGVDCEWTYDDATKTFTVTE,-5.1633196,"K13I, V29T, F30I, N35E, G41C",5
MQYKLILNGKILKGETTFETRDAATAEKVFKQYANDNGVDGEWQYDDATKTFTVTE,3.1840098,"T11I, T18F, A20T, V21R, T44Q",5
MQYKLIHNGKTLKKEETTEAVDAATAEKVFKQYANDHGVDGEWTYDEATKTFTVTE,-1.4941651,"L7H, G14K, T16E, N37H, D47E",5
MQYKLILNGKTYKGELTTEAVDAATAEKVFKQYANDNGVSGEWTYSDATKTFTVTY,1.4300019,"L12Y, T16L, D40S, D46S, E56Y",5
MQYTLILNGKTLKGDTTTEAVLAATAEKVFKQYANDNGVDGTWTYDDATKTFNVTE,3.536229,"K4T, E15D, D22L, E42T, T53N",5
MAYKAILNGKTLKGESETEAVDAATAEKVFKQYANDNGVDGEWTYDDATKTYTVTE,-0.30292836,"Q2A, L5A, T16S, T17E, F52Y",5
MQYKVILNGKTLKGEVTTEAVKAATAEGVFKQYANDLGVDGEWTYDDATKTFTVTE,-1.9096586,"L5V, T16V, D22K, K28G, N37L",5
MQTKLILNGKTLKGETTTSAVDAATAKNVFKQYAQDNGVDGEWTYDDATKTFTVTE,-6.0927467,"Y3T, E19S, E27K, K28N, N35Q",5
MQYKLILNGKTKKGETTTEAVDAATAEKVFKQAVNDNGVDGEWTFDDATKTFTVTN,-3.46794,"L12K, Y33A, A34V, Y45F, E56N",5
MQYTLILNGKVRKKETTTEAVDKATAEKVFKQYANDNGVDGEWTYDDATKTFTVTE,-3.2206137,"K4T, T11V, L12R, G14K, A23K",5
MQYKLILNGKTLKGETTTEAVDAATAEKVFKQLAADNGWDGVWIYDDATKTFTVTE,-5.1932445,"Y33L, N35A, V39W, E42V, T44I",5
MQYKLILSGKTLKGETTTEATDAATAHKVFKQYAHDNGVDGEWTYDDETKTFTVTE,-5.169966,"N8S, V21T, E27H, N35H, A48E",5
MQYKLILVGKTLNGETTTEAVDADTAEKVFKQYANDNGVDGNWTYDDATKTFTVSE,3.8608258,"N8V, K13N, A24D, E42N, T55S",5
MQYKLILNGKTLKLETTTEAVDTATAEKIFKQYANENGVDGEWTYDDATKTFTLTE,-0.18492356,"G14L, A23T, V29I, D36E, V54L",5
MQYKVIVNGKTLKGETTTGAVDAATAEKVFKQYANDNGVDGEVTYDSATKTFTVTE,-1.8644537,"L5V, L7V, E19G, W43V, D47S",5
MQYKLILNGKTLKGETTTEAVDAATAEKDFKKYCKDNGIDGEWTYDDATKTFTVTE,-2.2096713,"V29D, Q32K, A34C, N35K, V39I",5
MQYMYILNGKTLKGEYTTEASDKATAEKVFKQYANDNGVDGEWTYDDATKTFTVTE,-3.1204474,"K4M, L5Y, T16Y, V21S, A23K",5
MQFKVILNGKTLKGETTTEAVDAATAEKVFMQVANDNGVDGEWTYDDATKTFTVTD,-4.904264,"Y3F, L5V, K31M, Y33V, E56D",5
MQYKLILNGKTLKGETTTEAVDAKTAEKVFKQYADDNKVDGEWTYDDATNTFTLTE,-4.066353,"A24K, N35D, G38K, K50N, V54L",5
MQYKLILNGKTLKGETTTEAVDRATAGKVFKQYANDNGVDGTWTYDDKTKTFTVTQ,-4.921806,"A23R, E27G, E42T, A48K, E56Q",5
MQYKLILNGKTLKSERTTEAVDAAEASKVFKQYANDLGVDGEWTYDDATKTFTVTE,-5.363208,"G14S, T16R, T25E, E27S, N37L",5
MQYKLILNPKTLKGETTTEAVDASTAEQVFKDYANDNGVDGEWEYDDATKTFTVTE,-3.3626928,"G9P, A24S, K28Q, Q32D, T44E",5
MQYKLILNGKPLKGETGTEAVDAATAEKVFKQYANDNDVDGEWTYDEATKEFTVTE,2.0801108,"T11P, T17G, G38D, D47E, T51E",5
MQYKLILNGKTLKGETTTEAVSAATARKVFKQYANDNGVDGEWTYDPATKTISVTE,-4.7319384,"D22S, E27R, D47P, F52I, T53S",5
MQYKLILNGKTLKGETTDEAVDAATAEVVFKQLANDNGVIGEWTYDDATKTFTVTD,-1.458392,"T18D, K28V, Y33L, D40I, E56D",5
MQYKLILNGKTLKGETTVFAVDAATAEAVQKQYANDNGVDGEWTYDDATKTVTVTE,-4.2622805,"T18V, E19F, K28A, F30Q, F52V",5
MQYKIILNGKTPKGETTTEDVDAATAEKVFRQYANDNVVDGEWTYDDATKTFTVTE,-5.0152597,"L5I, L12P, A20D, K31R, G38V",5
MQYKVILNGKTSKVETVTEAVDAATAEKVFKQYANDNGLDGEWTYDDATKTFTVTE,0.2832507,"L5V, L12S, G14V, T17V, V39L",5
MQYKLIRHGKTLKGETTTEAVDAATAEDVAKQYANDNGVDGEWTYDDATKTFTATE,-5.092544,"L7R, N8H, K28D, F30A, V54A",5
MQYKLILNGKTLKYWTTTEAVDAARAEKVFKQYANDNGVDGEWTADDATKTFTWTE,-1.393192,"G14Y, E15W, T25R, Y45A, V54W",5
MQYKLINNGKTLKGETTTEAVDAATAEKVFKQYANHNVQDGEWTYDDATWTFTVTE,-2.2476714,"L7N, D36H, G38V, V39Q, K50W",5
MQYKVILEGKTLTGETTTEAVDAATAEKVFKQYANDNGVDGEWTYDDATPTLTVTE,-0.5823914,"L5V, N8E, K13T, K50P, F52L",5
MQYKLIINGKTLLGETTTEAVDEATAEKVFTQYANDNGVDGEWTYDDATKTFTVTK,-5.0658593,"L7I, K13L, A23E, K31T, E56K",5
MQYKLILNGATLKGEIPTEAVDAATAEKVFKQYANDNGDDGEFTYDDATKTFTVTE,-5.976488,"K10A, T16I, T17P, V39D, W43F",5
MQYKLILNQKTLKPETTDEAVDAANAEKVFKQYANDNGVDGEWTYDQATKTFTVTE,-1.5817772,"G9Q, G14P, T18D, T25N, D47Q",5
MQYKLILNGKTLKGETTTEAVDAATAEKVFIQYANDNGVDGEWVYDAVTKTFTVTL,-4.078948,"K31I, T44V, D47A, A48V, E56L",5
MQYKLILNGGTLKTVTTTEAVDKATAEKVFKQYANDNGVDGEWTYDDATKTFTVYE,-1.1929594,"K10G, G14T, E15V, A23K, T55Y",5
MQYKLILNGKTLKQETKTEAVDAATAEKVAKQYANDNSVDGEWTNDDATKTFTVTE,-4.505921,"G14Q, T17K, F30A, G38S, Y45N",5
MQYKLILNGKTAKGGTNTEAVDAATANKVFKQYANENGVDGEWTYDDATKTFTVTE,-4.3354425,"L12A, E15G, T17N, E27N, D36E",5
MQYKLILNGKTVKGETTTEGVDAAEAEKVFKQYANDSGVDGEWTYDDATKTVTVTE,-3.5930781,"L12V, A20G, T25E, N37S, F52V",5
MQYKLILNGKTLKLETFTEAVDAAAAEKVFEQYANDNIVDGEWTYDDATKTFTVTE,-4.921015,"G14L, T17F, T25A, K31E, G38I",5
MQYKIILNGKTLLGETTTEAVDAATAEKVMKQYCNDNGVDGEWTYDDQTKTFTVTE,0.830926,"L5I, K13L, F30M, A34C, A48Q",5
MQYKLELNGKTLKGETTTEHVDAATAEKVFKQWANDFGVDGEWTYDDATKTFTLTE,-1.0018295,"I6E, A20H, Y33W, N37F, V54L",5
MQGTLILNGKTLKGETTTEAVDAATAEKVFKQYLNDNGVDGEWTYDGATKDFTVTE,-3.6609607,"Y3G, K4T, A34L, D47G, T51D",5
MQYKLILNGKTVKGETTSEAVDTATAEKVFKQYANDNGVDGEWTYDDATKEFTKTE,-3.5497935,"L12V, T18S, A23T, T51E, V54K",5
MQYKLIKNGETLKGETTTEAVDAATAEKVFKQIANDNGVKGEWTYDDATKEFTVTE,0.52478224,"L7K, K10E, Y33I, D40K, T51E",5
MQYKLILNGKVLKGETTTERVDAATAEKVFKKYANDNGVDGEYTIDDATKTFTVTE,-3.462218,"T11V, A20R, Q32K, W43Y, Y45I",5
MIYKLILNGKTLKGETTTEAVDAAEAENVFKQYANDNGVDGEWTYDDADKTFTITE,-1.5051181,"Q2I, T25E, K28N, T49D, V54I",5
MQYKLILNGKTLKGITLTEPVDAATAEKVFKQYANDNGKDGEWTYDDATKTLTVTE,-4.168142,"E15I, T17L, A20P, V39K, F52L",5
MQYKLIPNSKTLKGETTTEAKDAATAEKVFKQYANDNGVDGEWTYDKATQTFTVTE,2.1987035,"L7P, G9S, V21K, D47K, K50Q",5
MQYKLILNGTTLKGETTTEAVDAATAERVFKQFAEDNGVDGEWTYDDATKTFSVTE,-1.6611167,"K10T, K28R, Y33F, N35E, T53S",5
MQYKLILNGYTLKGETTKEAVDPATAEKVFKQYANDNGVDGEWTYDDANETFTVTE,3.6169486,"K10Y, T18K, A23P, T49N, K50E",5
MQYKLILNGKTLKGETTKEYVDAATAENVFKQYINDNGVDGTWTYDDATKTFTVTE,-3.0693698,"T18K, A20Y, K28N, A34I, E42T",5
MQYKLILNGKTLKGTTTTKAVDAATAEKVFKQYANDNGVDGEWTYDDSTNSFTVTE,4.2907505,"E15T, E19K, A48S, K50N, T51S",5
MQYKLILKGDTLKGETTTYTVDAATAEKVFKQYADDNGVDGEWTYDDATKTFTVTE,-0.82270795,"N8K, K10D, E19Y, A20T, N35D",5
MQYKLILNGRVLKGETTTEAVDAATAEKVFKQRANDNGVDAEWTYDDATKTFTVTA,-1.4082828,"K10R, T11V, Y33R, G41A, E56A",5
MQYKLILNGKTLKGETTTEYVDAATAVKVFKQAATDNGVDGEYTYDDATKTFTVTE,-6.8540616,"A20Y, E27V, Y33A, N35T, W43Y",5
MQYKLILNGKTTKGEVTTETVYAATAEKVFKQYCNDNGVDGEWTYDDATKTFTVTE,2.2132564,"L12T, T16V, A20T, D22Y, A34C",5
MQYKLIVNGKALKGETTTEAVDAATANKVFKQYVNDNGVDGEWTYDDGTKTFTVTE,-5.0473614,"L7V, T11A, E27N, A34V, A48G",5
MQYKLILNGKTLKGKTTTEAVDAAAAEKVFKQYANDNGVDVEVTYDDETKTFTVTE,-5.2825203,"E15K, T25A, G41V, W43V, A48E",5
MQYKLILNGKTIKGETTTEAVSAATAEKKIKQYANDNGVDGEWTYDDATHTFTVTE,1.9488525,"L12I, D22S, V29K, F30I, K50H",5
MQYKLILEGGTLKGEFTTEAVDAATANKVFKQYANDNGVDGEWTYDDATKTFTVLE,-4.7589955,"N8E, K10G, T16F, E27N, T55L",5
MQYKLIKNMKTLKGETETEAVDAATAEKVFKQYANDNGVAGEWTYDDATKTVTVTE,-2.529509,"L7K, G9M, T17E, D40A, F52V",5
MQYKLILNGKELKGETLTEAVDAATAEKVFKQYENDNGVDGVWTYDDATNTFTVTE,-2.6652393,"T11E, T17L, A34E, E42V, K50N",5
MQYRLILNGKTLKGETKTYAVDAATAEKVFKQYANSNGVDGEWTYDDATHTFTVTE,4.603833,"K4R, T17K, E19Y, D36S, K50H",5
MQYKLILNGKTLKGATTTEAVDAETAEKVAKQYADDNGVDGEWTYDDATQTFTVTE,-2.0724657,"E15A, A24E, F30A, N35D, K50Q",5
MQYKIILNGKTLKGETTTEAVDAATAEKVFKQYMNDNGVDGEVTYSDATKEFTVTE,-4.226727,"L5I, A34M, W43V, D46S, T51E",5
MQYKLILNGRALKGETTTAAVDAATAEKVFKKYANDNGYDGEWTYDDATKTFTVTE,1.0083718,"K10R, T11A, E19A, Q32K, V39Y",5
MQYKLILNGKELKGETTTEVVDAATAEKVFAQTANDNGGDGEWTYDDATKTFTVTE,-6.409408,"T11E, A20V, K31A, Y33T, V39G",5
MQYKLALNGKTLKGETTTEAVDLATAEKVFKQYANDNGIDGEWTYDDATKTFTRTA,-4.303107,"I6A, A23L, V39I, V54R, E56A",5
MQYKLILNGHTVRGETTTEAVDASTAEKVFKQYANDNGVDGEWTYDDAEKTFTVTE,3.8705895,"K10H, L12V, K13R, A24S, T49E",5
MQYKLILNGKTLKGEVTTDAVDAATAEKVFKQYADDNGADGEWTYDDATDTFTVTE,-4.0831246,"T16V, E19D, N35D, V39A, K50D",5
MQYKLTLNGKTLKGTTTTEAVIAATAEKVFKQYAFDNGVQGEWTYDDATKTFTVTE,0.13400882,"I6T, E15T, D22I, N35F, D40Q",5
MKYKLSLNGKTLKGETTTEAVDAATAEKVFKQYANDNGVDGEYTYDDNTKTFTATE,-1.3905553,"Q2K, I6S, W43Y, A48N, V54A",5
MQYKLIVNGKTLKGETTTEAPNAATAEKVFKQYANDNKVDGEWTYDDAAKTFTVTE,3.1584163,"L7V, V21P, D22N, G38K, T49A",5
MEYKLILNGKTLLGETTMIAVDAATAEKVFKQYATDNGVDGEWTYDDATKTFTVTE,-0.06462072,"Q2E, K13L, T18M, E19I, N35T",5
MTYKLILNGKTLKGELTTEAVDAAAAEKVVKQYANDNGYDGEWTYDDATKTFTVTE,-0.46818033,"Q2T, T16L, T25A, F30V, V39Y",5
MQYKGILNGKTLKGETETEAVDAATAEKVFKQYANDNLKAGEWTYDDATKTFTVTE,-2.0686872,"L5G, T17E, G38L, V39K, D40A",5
MGYKLILNGKTLKGETTVEGVDAATADKVFKQYANDNGHDGEWTYDDATKTFTVTE,-4.754143,"Q2G, T18V, A20G, E27D, V39H",5
MQYKLILNGKTLKGETTTPAVDAATAEKVFKQYLNENGVDGPWTYDDATKTFTVTL,-1.4876797,"E19P, A34L, D36E, E42P, E56L",5
MKYKLILNGKTLKGETTTEAVDAATAEKAAKEYMNDNGVDGEWTYDDATKTFTVTE,-0.8992303,"Q2K, V29A, F30A, Q32E, A34M",5
MPYKLILNGKTLKGMFTTEAVDAATAEKVFKQYAADNGVKGEWTYDDATKTFTVTE,-1.5694629,"Q2P, E15M, T16F, N35A, D40K",5
MQYKLILNGKTYKGETTTEKVDAATAESVFKQYANDNGVDGAWTYDDATKNFTVTE,-1.1749841,"L12Y, A20K, K28S, E42A, T51N",5
MQYKLILNGKTLKGHTTTEATDAATAEKVFKQYANDNGDEGEATYDDATKTFTVTE,-5.2353134,"E15H, V21T, V39D, D40E, W43A",5
MQYKLILNGKTLKGETTTEAEDAAAAIKVFKQYANDNGVKGEWTYDYATKTFTVTE,-2.4985635,"V21E, T25A, E27I, D40K, D47Y",5
MQVKLILNGKTLKRETTTMAVDRATAEKVFKQYANDNGVDGEWTYDDATKTFTVTD,-4.476506,"Y3V, G14R, E19M, A23R, E56D",5
MQYKLILNGKTLKGETTTEAVDAAPAEKVFKQYANDNGVDYEWQYDDKTKTLTVTE,-2.6165648,"T25P, G41Y, T44Q, A48K, F52L",5
MQYKLILNGKVLKSETTTEAVDAALAMDVFKQYANDNGVDGEWTYDDATKTFTVTE,-5.9709535,"T11V, G14S, T25L, E27M, K28D",5
MQYKLILNGKTLKDETTTEAVDKATAEKVFKQYANDCGSDGEWTYDDATKTYTVTE,-5.0545745,"G14D, A23K, N37C, V39S, F52Y",5
MQYKLIVNGKTLKKETTTEAVDRATAEKVFKQYANDNGVDGEWKYDDGTKTFTVTE,-0.85298884,"L7V, G14K, A23R, T44K, A48G",5
MQYKLILNGKTLKGETSLEAVDMASAEKVFKQYANDNGVDGEWNYDDATKTFTVTE,-0.15754607,"T17S, T18L, A23M, T25S, T44N",5
MQYKLILNGKTLKGYTTTEAVDEATAEKVANQYANDNGVDGEWTYDDATKTFTVTQ,-4.3696594,"E15Y, A23E, F30A, K31N, E56Q",5
MQYKLILNGVTLKGETTTVAVDRATAEKVFQQYANDNGVTGEWTYDDATKTFTVTE,-4.0471773,"K10V, E19V, A23R, K31Q, D40T",5
MQYKLILNGKTLKVETTTEAVDAATAEKVFKKYANDNKVDGSCTYDDATKTFTVTE,-3.1025643,"G14V, Q32K, G38K, E42S, W43C",5
MQYKYILNSKTVKVETTTEAVDAATAEKVFKQYANDNGVDGTWTYDDATKTFTVTE,-0.78047556,"L5Y, G9S, L12V, G14V, E42T",5
MTYKLILNGKTEKGETTTAAVDKATAEKVFVQYANDNGVDGEWTYDDATKTFTVTE,-5.3457484,"Q2T, L12E, E19A, A23K, K31V",5
MQYKLILNGKTLKGLTTTEAVDAATAEKVFKQYANDNGVDMEYTYDDSTETFTVTE,-5.1775174,"E15L, G41M, W43Y, A48S, K50E",5
MAYKLILNGKTLKTETTTEATDAATANKVFKQYANDNGVDGEATYDDATKTFTVTE,-6.074144,"Q2A, G14T, V21T, E27N, W43A",5
MQYKLILNGKTLKGETTTEAVDAATAEKAFKQYANDNGVDGEFTYDDAPKSFTVHE,-1.8892144,"V29A, W43F, T49P, T51S, T55H",5
MQYKLILNGKTLKGETTTEVVDAATAEKVAIQWANDNGVDGEWTYDDAKKTFTVTE,-4.458789,"A20V, F30A, K31I, Y33W, T49K",5
MQYKLILNGKTLKGSTTTSAVDAATFEKVFKQYANDNGVDGIWVYDDATKTFTVTE,-0.7376614,"E15S, E19S, A26F, E42I, T44V",5
MQYKLILNGKTLKGETTTEAVDAASAEKVAKQYAEDNGVDYEWTYDDATKTFTLTE,-5.3204265,"T25S, F30A, N35E, G41Y, V54L",5
MQYGLILNGVTLKGETTTEAVDAATASKVFKQSANDNGVDGEFTYDDATKTFTVTE,-6.3774033,"K4G, K10V, E27S, Y33S, W43F",5
MQYRLILNGKTLDGETTTEAVDAATAEKVFKQYCNDNGGDGEWTYDDATKTFTVKE,-2.2589161,"K4R, K13D, A34C, V39G, T55K",5
MQYKLIKDGKTLKNETTTDAVDAATAEKVFKQYANDNGVDAEWTYDDATKTFTVTE,-1.9840975,"L7K, N8D, G14N, E19D, G41A",5
MKYKLILNGKTLKGETTTEQVDAATAENKFKQYATDNGVDGEWTYDDATKTFTVTE,-0.764493,"Q2K, A20Q, K28N, V29K, N35T",5
MQYKLILNGKTLKGETTVEAVDRAQALKVFKQYANDNGVDGEWTYDDATKTFTFTE,-4.7355433,"T18V, A23R, T25Q, E27L, V54F",5
MQVKTILNGKTLKGETTTEAVDAATAEQVAKDYANDNGVDGEWTYDDATKTFTVTE,-5.003747,"Y3V, L5T, K28Q, F30A, Q32D",5
MQYKLILNGKTLKDETTTEAEAAATAEKVFKQYMNDNGVDGEYTYDDATKTFTVTE,-3.982942,"G14D, V21E, D22A, A34M, W43Y",5
MQYKLILNGKTLKGEFTTEAVDPARAEKVFKQWANDNGVDGEWTYDEATKTFTVTE,3.128046,"T16F, A23P, T25R, Y33W, D47E",5
MQYKLQLNGKKLKGDTTTEAVDAATAIKVFKQYANDNGVDGEWTYDDATKTFTVYE,-4.162224,"I6Q, T11K, E15D, E27I, T55Y",5
MQYKLILNGKTLKGETTAEDVDAATAAKVFKQYANDNDVDGEWYYDDATKTFTVTE,-4.6375318,"T18A, A20D, E27A, G38D, T44Y",5
MQYTAILNGKTLKTETTTEAVDAATYAKVFKQYANDNGVDGEWTYDDATKTFTVTE,-6.4509354,"K4T, L5A, G14T, A26Y, E27A",5
MQYKVILTGKTLKRETTTEAVDAATAEKVFKQYNNDTGVDGEWTYDDATKTFTVTE,-4.1042447,"L5V, N8T, G14R, A34N, N37T",5
MQYKLILNGKTIKGETTTEAVDAITAEKVFKQYANDNGFDIEWTYDDATKTVTVTE,-5.7238197,"L12I, A24I, V39F, G41I, F52V",5
MAYKLILNGKTLKGETTTEIVDAATAEDVFKQYANDMGVYGEWTYDDATKTFTVTE,-2.8327413,"Q2A, A20I, K28D, N37M, D40Y",5
MQYKLILNGKRLKEETTTEAVDAATAEKIAKQYANDNGVDGEITYDDATKTFTVTE,-5.2436466,"T11R, G14E, V29I, F30A, W43I",5
MQYKLILNGKTLKGETTTIAATAATAYKVFKQYANDNGVDGEWTYDDATKTFTVTT,-2.595629,"E19I, V21A, D22T, E27Y, E56T",5
MQYKLILNGKTLKGETTTKAVDAAQAEKVFKQYANDNGVDYEWTYDDETKTFEVTE,0.050238423,"E19K, T25Q, G41Y, A48E, T53E",5
MQYELILNGKTLKGELTTEAVDVATAEKVFKEYANDNGVDGEYTYDDATKTFTVTE,-5.462022,"K4E, T16L, A23V, Q32E, W43Y",5
MQYKLILNGKTLKGETVTNAVSAATAEKVFKQYALDNGVDGEWTYDDATKRFTVTE,-0.27972415,"T17V, E19N, D22S, N35L, T51R",5
MQYKLILNGKTYEGETTTEAVDAATAEKVFKSYANDNGVDGEWTYDDGTKKFTVTE,1.7763098,"L12Y, K13E, Q32S, A48G, T51K",5
MQYKLILNGKTLMGETTTETVDAATAEKVFKQYANDNGVDGEWSYDDAKGTFTVTE,4.25229,"K13M, A20T, T44S, T49K, K50G",5
MQYKLILNGIDLKGETTTDAVDAATAEKVAKQYANDNFVDGEWTYDDATKTFTVTE,-0.2609862,"K10I, T11D, E19D, F30A, G38F",5
MQYKLILNGKTLKGSTTTEAVDAAAALKVFKQYANDNGVDAEWTYDDATKTWTVTE,-6.1172714,"E15S, T25A, E27L, G41A, F52W",5
MQYKLILNGKTLKGETTTEAVDRETAEKVFKQYAEDNGVDGEWTYDDATDTFTVNE,-2.8837235,"A23R, A24E, N35E, K50D, T55N",5
MQYKLILNGKTLKGETTTEAKDAATAEKVFKQYAKDNGHAGTWTYDDATKTFTVTE,-3.5630574,"V21K, N35K, V39H, D40A, E42T",5
MQVKIILNGKTLKGETTIEAVDLATAEKVFKQYANDNGVDGEWTYDDDTKTFTVTE,-2.5366054,"Y3V, L5I, T18I, A23L, A48D",5
MSYKLILNGKTLNGETTTEAVDAATAAKVFKDYANDNYVDGEWTYDDATKTFTVTE,-5.5138783,"Q2S, K13N, E27A, Q32D, G38Y",5
MQYKLILNGKTLKGETTTEAVDAATAADVAKQYANDNGVDGEWTYDDKTKKFTVTE,-5.731583,"E27A, K28D, F30A, A48K, T51K",5
MQQKLILNGKTLKGETTTEAVDATTAEKVFKQYANDNGVDGKWTYNDATKTFTVFE,2.1559327,"Y3Q, A24T, E42K, D46N, T55F",5
MTYKLILNGKTLKGETTTEAVDAATYEKVFKQYMNDNGVDGEWTYDDKTKTLTVTE,-3.4296803,"Q2T, A26Y, A34M, A48K, F52L",5
MQYILILNGKTLKGETTTEAVDADTAEKVFKQYANDNGWDGEFTYDDATKVFTVTE,-4.298903,"K4I, A24D, V39W, W43F, T51V",5
MQYKLILNGKTYKGETITEAVDQAKAEKVFKQYANDNGVDGEWTYDDATKLFTVTE,-0.59245497,"L12Y, T17I, A23Q, T25K, T51L",5
MQYKLILNGITLKGFSTTEAVDAATAEKVFKQYANDNGVDGEWTYDDATKTFYVRE,2.5208366,"K10I, E15F, T16S, T53Y, T55R",5
MQYKLILNGKTLKGEYTTEAVDAKTAIAVFKQYANDNGVDGEYTYDDATKTFTVTE,-6.5455346,"T16Y, A24K, E27I, K28A, W43Y",5
MQYKLILNGKTLKIATTTEAVDKATAEKVFKQYAIDNGVDGEWTYDDATKAFTVTE,-4.207544,"G14I, E15A, A23K, N35I, T51A",5
MQYKLILNGKTLKGETITEAVDAATAEKVFKQYADDNDVDGEWTFDLATKTFTVTE,-2.226941,"T17I, N35D, G38D, Y45F, D47L",5
MQGKLILNGKTLKGEITTEAADAATAEKVFKQYAKDNGVDQEWTYDDATKTFTVTE,-5.376009,"Y3G, T16I, V21A, N35K, G41Q",5
MQYKLILNGKVIKEETTTEAVDAATAIKVAKQYANDNGVDGEWTYDDATKTFTVTE,-5.7571588,"T11V, L12I, G14E, E27I, F30A",5
MEYKLILNGKTLLAETTTEAVDAATAEKVFDQYAEDNGVDGEWTYDDATKTFTVTE,-5.9627237,"Q2E, K13L, G14A, K31D, N35E",5
MQYKVTLNGETLKGETTTEAVDAAVAEKVFKQYANDNGVDGEWTYDDATKTITVTE,-0.6507675,"L5V, I6T, K10E, T25V, F52I",5
MQYKLILNGKTLKGETTTEVVDAATAEKVFKKYANDNGIDGEWTYDAATKTFTVTG,3.1335726,"A20V, Q32K, V39I, D47A, E56G",5
MQYKLILNGKTWKGETTTEAVDAATAEKVFDQYANDNGVDGEWSYDDDTRTFTVTE,-3.7065644,"L12W, K31D, T44S, A48D, K50R",5
MQYKLILNGSTLKGETTTNAVDAATAEKLFKQYANDNGADGEWTYDDATKTFTITE,-0.015630655,"K10S, E19N, V29L, V39A, V54I",5
MQYKLILNGNVLKGETTTEAVDADTAEAVFNQYANDNGVDGEWTYDDATKTFTVTE,-4.6561656,"K10N, T11V, A24D, K28A, K31N",5
MQYKLILNGKTLKGETTTEAVDASTAEKVAKQFLNDNGVDGEWTYDDDTKTFTVTE,-0.19678834,"A24S, F30A, Y33F, A34L, A48D",5
MKYKLILNGKTLKGETSTEAKTAATAEKVFKQYANDNGVDGEVTYDDATKTFTVTE,-1.7141067,"Q2K, T17S, V21K, D22T, W43V",5
MQYKLIRNGKTLEVETTTEAVDAATAMKVFKQYANDNGVDGEWTYDDATKRFTVTE,-5.4894214,"L7R, K13E, G14V, E27M, T51R",5
MMYKLYLNGKTLKGETTTEAVDAATAEKVFKQYANDNGVSTEATYDDATKTFTVTE,-5.2015967,"Q2M, I6Y, D40S, G41T, W43A",5
MQYKVILNGKTLKGETTTEAVDAATAENVVKQYANDYGVDGEWTYDDATKTFTVTI,-5.1334376,"L5V, K28N, F30V, N37Y, E56I",5
MQYKLILNGKEVKGETTTEAVDAATAEKVFKNYANDNGVDGEWTYDDATKTFEITE,0.37864402,"T11E, L12V, Q32N, T53E, V54I",5
MQYKLILNGKTLPGETTTEAVDAATAEKAFQQYANDNGVDGEWTYDDATGTFTSTE,-4.14429,"K13P, V29A, K31Q, K50G, V54S",5
MQYKLILNGKTLKGETTTEQVDAATAEKVFQQYANDNGVDGEWTYDDSTKTFTGTT,-4.96667,"A20Q, K31Q, A48S, V54G, E56T",5
MQYTLIANGFTLKGETTTEAVDAATAEKVFIQYANDNGYDGEWTYDDATKTFTVTE,-4.723731,"K4T, L7A, K10F, K31I, V39Y",5
MQKKLNLNGLTLKGETTQEALDAATAEKVFKQYANDNGVDGEWTYDDATKTFTVTE,-0.742262,"Y3K, I6N, K10L, T18Q, V21L",5
MQVLLILNGKTLKGETTTEAVDAATAEKVFNQYANDNGVTGEWTYDDTTKTFTVTE,-3.2464156,"Y3V, K4L, K31N, D40T, A48T",5
MQYKLILKRKDLKGETTTEAVDAASAEQVFKQYANDNGVDGEWTYDDATKTFTVTE,-1.3824912,"N8K, G9R, T11D, T25S, K28Q",5
MQYKLILNGKTLKGETTTEAVDAATAEKVFKAYANDNGVDGEITYDDATKEITLTE,-4.700501,"Q32A, W43I, T51E, F52I, V54L",5
MQYKLICNGKTLKGETTTEAVDAAEAEKVAKQYANDEGVDGEWTYDEATKTFTVTE,-1.6208891,"L7C, T25E, F30A, N37E, D47E",5
MQYKLILNGKTLKNETTTDAVDAATAEKQFKQYAKDNGVDVEWTYDDATKTFTVTE,-5.226502,"G14N, E19D, V29Q, N35K, G41V",5
MQYKLILNGKTLKVETDTNAVDAATAKKVFKQYANDNGVDGEWTYDDATKTFTLTE,-4.4509006,"G14V, T17D, E19N, E27K, V54L",5
MQYKLIVNGKTLQGHTTTEAVDAATAEKVGKQYANDNGVDGEWTFDDATKTFTVTE,0.56197006,"L7V, K13Q, E15H, F30G, Y45F",5
