Sequence,Score,Mutations,Number of Mutations
MQYKLILNGGELKGETFTEAVDAATAEKVFKQYANDHGVDGEWTVDDATKTFTVTE,-1.146727,"K10G, T11E, T17F, N37H, Y45V",5
MQFKLILNGKTLKGETLVEAVDMATAEKVFKQYANDNGVDGEWTYDDATKTWTVTE,-4.1497493,"Y3F, T17L, T18V, A23M, F52W",5
MQDKLILNGKTLKGETFTEAVDAATAEANFKQYANDNGVDGEWTYDDATKTFKVTE,-3.6434543,"Y3D, T17F, K28A, V29N, T53K",5
MQYKLILNGKTLKGSTTVEAVDAATAEKVFKQYANDNGYDGSWTYDDATKTFKVTE,1.8198102,"E15S, T18V, V39Y, E42S, T53K",5
MQYTLILNGKTLKGETTTEAVDAATAEKVVKQYANDNGVEGQVTYDDATKTFTVTE,-3.4033535,"K4T, F30V, D40E, E42Q, W43V",5
MQYKLILNGPTLKGTTTTGAPDAATARKVFKQYANDNGVDGEWTYDDATKTFTVTE,-3.2002704,"K10P, E15T, E19G, V21P, E27R",5
MQYKLILNGKTLVGETTTETVDAATAEKVGKQYANANGVDNEWTYDDATKTFTVTE,-4.7920775,"K13V, A20T, F30G, D36A, G41N",5
MQYKLILNGKTLGYETTTEAVDAATAEKVFKQYANDNHVDGEWTYDAATKTVTVTE,-2.4438844,"K13G, G14Y, G38H, D47A, F52V",5
MQYKLILNGKTLKGETTKEAVDAATAEKVFKQYANDNGPDGEYTYDDATKAFTVTA,-5.5770974,"T18K, V39P, W43Y, T51A, E56A",5
MQYKLELNGKFWKGMTTTEAVDAATAEKVFKQYANDNGVDAEWTYDDATKTFTVTE,-1.7426757,"I6E, T11F, L12W, E15M, G41A",5
MQYKLILNGKTLKGETTTEAVDATTARKVFKQYATDNGVDGVWVYDDATKTFTVTE,-4.141864,"A24T, E27R, N35T, E42V, T44V",5
MQYKLTLNGKNLKGETTTEAVDAATAEEVAKQYANDNGVDGEWTYDDAAKTFTVTE,-4.3388934,"I6T, T11N, K28E, F30A, T49A",5
MQYKLILNKETLKGETTTEAVDAATAEKVAKEYANDNLVDGEWTYDDATKTFTVTE,-4.5697355,"G9K, K10E, F30A, Q32E, G38L",5
MQYKLILNGKTLWGEGTVEAVDAATAEKVFKQWANDNGVDAEWTYDDATKTFTVTE,0.31003845,"K13W, T16G, T18V, Y33W, G41A",5
MQIKLILNGKTLKGETTTEAVDAATAEARFKAYANDNGVDGEWTVDDATKTFTVTE,-2.4520638,"Y3I, K28A, V29R, Q32A, Y45V",5
MQYKLTLNGKTLKGETVTEAVTAATAEKVFKQAANDNGVDGEWTYDDATKTYTVTE,-0.91410255,"I6T, T17V, D22T, Y33A, F52Y",5
MQYKLIVNGKTLKGETFTEVVDAKTAEKVFKQYANDNGVDGEWTVDDATKTFTVTE,-0.6776276,"L7V, T17F, A20V, A24K, Y45V",5
MSYKLILNIKTLKGETITEAVDAATAEKVFKGYANDNGVDGEWTYDEATKTFTVTE,2.1346672,"Q2S, G9I, T17I, Q32G, D47E",5
MQYKLILIGKQLKGVTTTELVDAATAEKVFKQYANDNGVRGEWTYDDATKTFTVTE,2.2938206,"N8I, T11Q, E15V, A20L, D40R",5
MQYKLILNGKTLKGETITRAVDAATAEGVFKQYANDNGLDGEWTYDDATKTFRVTE,0.74082005,"T17I, E19R, K28G, V39L, T53R",5
MQNKLILNGKTLKIETTTEAVDAATAEKVIAQLANDNGVDGEWTYDDATKTFTVTE,-6.3655996,"Y3N, G14I, F30I, K31A, Y33L",5
MQYKLILNGKTLKGQETTEAVDAATAEKVFKQYANDNGVDIEWTADDATKTFQVTE,-5.357756,"E15Q, T16E, G41I, Y45A, T53Q",5
MQYTLILNGKTGKGETTTEAVDAADAEKVFKQYANDNGVTQEWTYDDATKTFTVTE,-4.7067437,"K4T, L12G, T25D, D40T, G41Q",5
MQYKLILNGKTLKGETTTEAVDAATAVKVAKQKANDNGVDGGWTYDDATKTITVTE,-6.210234,"E27V, F30A, Y33K, E42G, F52I",5
MQYKLSLNGKTLKGELTTEAVDAATAEAVFGQYANDNGVDGEWTYDDATKTFTVTA,-6.333769,"I6S, T16L, K28A, K31G, E56A",5
MQYKLILNGKTLKSETQTEAVDAAAAEKVFKQYANDNGVDGEWTYDDSAKTFTVTE,2.578821,"G14S, T17Q, T25A, A48S, T49A",5
MQVKLILNGKTLKGETVTEAVDAATAEKVFKQYANENGLDGEVTYDDATKTFTVTE,-3.9388819,"Y3V, T17V, D36E, V39L, W43V",5
MQYKLILNGKTLKGETTTEAVDAATAEKLVKQYANDNGVDGEWTYDDATKTFKVRK,0.6882375,"V29L, F30V, T53K, T55R, E56K",5
MQYKLILNGKTLKGVETTEAVDAASAEKVFKQYCNDNGVDVEWTYDDATKTFTVTE,-1.2081926,"E15V, T16E, T25S, A34C, G41V",5
MQYKLILNGKTLKGETVTEAVDAATAEKVAKQYANTNGVDGEWTYDNATKTFTLTE,1.0014056,"T17V, F30A, D36T, D47N, V54L",5
MQYKLTLDGKTLKGELTTEAVDAALAEKVFKQYANDNGVDGEWTYDDKTKTFTVTE,3.549315,"I6T, N8D, T16L, T25L, A48K",5
MQYKVILNGKTLKGETTTEAVDAATAEKVAKQIANINGYDGEWTYDDATKTFTVTE,-3.083197,"L5V, F30A, Y33I, D36I, V39Y",5
MQYKLILNGKTLKGETTTEGVDAATAEEVFKQYANDNGVFGEVTYDDATKTFTVTL,-5.3822327,"A20G, K28E, D40F, W43V, E56L",5
MQFKLILNGKTLKGRTTTVAVDAATAEKVFKQYANDNGVDREWTYDDATKQFTVTE,-1.1436173,"Y3F, E15R, E19V, G41R, T51Q",5
MQYKLILNGKTLKGEYTTEAVDAATAEKVFKQYANDMGVDAEITYDDATGTFTVTE,-4.945493,"T16Y, N37M, G41A, W43I, K50G",5
MQYKLIRNGKTLAGETTQEEVDAATAEMVFKQYANDNGVDGEWTYDDATKTFTVTE,-2.8292596,"L7R, K13A, T18Q, A20E, K28M",5
MQYKLILNGKTEKGETTIEAVDAATAEKVFKQYAEDNGVDGEWQYDDATDTFTVTE,-3.2291782,"L12E, T18I, N35E, T44Q, K50D",5
MQYKLILNGKTLKGETTTEAVDAATAEKVFVQYAKDNGVKGEITYDDATRTFTVTE,-5.909071,"K31V, N35K, D40K, W43I, K50R",5
MKYKLILNGKTPKGETTTEAVTAATHEKVFKQYANDNGVDGEWKYDDATKTFTVTE,-2.9059741,"Q2K, L12P, D22T, A26H, T44K",5
MQYQLILNGKTLKGETTTEAVNRAHAEKVFKQYANDNGVDGEWTYDDATKTFTITE,-0.30031893,"K4Q, D22N, A23R, T25H, V54I",5
MQYKVILNGKTLKGETTTEAVDAATAEKVFKQYANDGGVDGIFTYDDATDTFTVTE,-2.1020234,"L5V, N37G, E42I, W43F, K50D",5
MQYKLILKGKTAKGETTTEAVDDATAEKVFKQYCNDNGVDGEWSYDDATKTFTVTE,1.3147697,"N8K, L12A, A23D, A34C, T44S",5
MQYKLILNGKTLKGEVTTEAVDADTALKEFKQYANDNAVDGEWTYDDATKTFTVTE,-4.1869473,"T16V, A24D, E27L, V29E, G38A",5
MQYKLILNGKTLKGEVKTEAVDAATAEKVFKQYANDNSVDGTWTYDEATKTFTVTE,3.4113812,"T16V, T17K, G38S, E42T, D47E",5
MQYKLIRNGKTLKGETITEAVDSATAEKVFKQYANDFGVDGEWTYDDATCTFTVTE,-1.4739357,"L7R, T17I, A23S, N37F, K50C",5
MNYKLILNGKTLKGETCTEAVDAATAEKVFKQIANDNGVVGEWTYDDATKTFTVTD,1.3208027,"Q2N, T17C, Y33I, D40V, E56D",5
MQYKLIFEGKTLKGETVTEAVDAATAEKVFKQYANDNGVDIEWTYDDATKTFTVEE,-3.8977008,"L7F, N8E, T17V, G41I, T55E",5
MQYKLILNGKTLKGETTTEAVDAATAEKVFKQYANDNGLDGEYTYDNATGTITVTE,-3.3219657,"V39L, W43Y, D47N, K50G, F52I",5
MQVKLILNGKTLKTETTTEAVDAATAEKVAKQYANDNGVDGEWTYDDATKTFTITA,-4.4708996,"Y3V, G14T, F30A, V54I, E56A",5
MQYKLILNGKTKKGEITTEARDKATAEKVFKQYANDNGVDGEWTYDDATKTFTVVE,-1.1054543,"L12K, T16I, V21R, A23K, T55V",5
MQYKLIFNGQTLKGETTTVAVDADTAEKEFKQYANDNGVDGEWTYDDATKTFTVTE,1.6498768,"L7F, K10Q, E19V, A24D, V29E",5
MQYKLILNGKTLKGETTTEADDAATAEIVFKQYANDLGVDGQWTYDDATGTFTVTE,1.8024853,"V21D, K28I, N37L, E42Q, K50G",5
MQYKLILNGKTLKGETTTEAADAATAEKVVKQYAIDNGVKGEWTYDDATKTYTVTE,-2.8926687,"V21A, F30V, N35I, D40K, F52Y",5
MQYKVILNGKTLKGETTTEEVDRATAEKVFKNYANDNGVDGEWTYDDATKTFTVTV,-2.1591609,"L5V, A20E, A23R, Q32N, E56V",5
MQYKLILNGKTLKSETCTEAVDARTAEKVFKQYANANGVDGEFTYDDATKTFTVTE,-2.5693498,"G14S, T17C, A24R, D36A, W43F",5
MEYKLILNGKTLKGETTTEAADAATAKKVWKQYANDNGVDGEWTYDDATKTFTVTL,-4.2675066,"Q2E, V21A, E27K, F30W, E56L",5
MQYKLTLNGKTLKGEITTEAVDAATAEKVFKQYANDNNVDEEWTYDDATKTFVVTE,-2.5910525,"I6T, T16I, G38N, G41E, T53V",5
MQYKLQLNGKTLFTEETTEAVDAATAEKVGKQYANDNGVDGEWTYDDATKTFTVTE,-2.3905852,"I6Q, K13F, G14T, T16E, F30G",5
MQYKLILNGKELKGETTTEAVDEATAEKNFKQYANDNGIDGEWTYDDATKDFTVTE,1.0206436,"T11E, A23E, V29N, V39I, T51D",5
MQYKLILNGKTLKGETTTEFVDAAAAEKEFKQYANDNGVDGEFTYDDATKTFTETE,-4.800582,"A20F, T25A, V29E, W43F, V54E",5
MQYKLILNGNTLKGETTTEAVDAATAEKVIKQYANDNGVDVEWIYDDATKTFLVTE,-4.137368,"K10N, F30I, G41V, T44I, T53L",5
MQYKLILNGKSLKGETTTEAVDAATAEKVLKQQANDNGVRGEWTYDDATKTFTVSE,1.7029287,"T11S, F30L, Y33Q, D40R, T55S",5
MKYKLILNGKTLKGEATTEAVDAKTAEKVFKQYANSNGVDGEWTYDYATKTFTVTE,2.0545459,"Q2K, T16A, A24K, D36S, D47Y",5
MQYKLILNGKTVKGETTTEAVDAATAEKAFKDYANDNGVDGEFTYDDAQKTFTVTE,-4.341171,"L12V, V29A, Q32D, W43F, T49Q",5
MQYKLILNGKTAKGELTTEAVDAATAEEVFKQYANDNAVDGEWTYDDATSTFTVTE,-3.1694093,"L12A, T16L, K28E, G38A, K50S",5
MQYKLILNGSTLKGETTTPAVDAATAAKAFKQYLNDNGVDGEWTYDDATKTFTVTE,-4.912932,"K10S, E19P, E27A, V29A, A34L",5
MQYKLILNGKTLKGETTYEAVDAAEAEKVFKQYANDNGVDGEWTYDHATKTFTVVK,1.307676,"T18Y, T25E, D47H, T55V, E56K",5
MQYKLILNGKTLKYETTTEADDAATAEKTFKEYANDNGVDGEWTYDAATKTFTVTE,-0.50053203,"G14Y, V21D, V29T, Q32E, D47A",5
MQYKLILNGKTLKETTTTEASDAATAEKVFKQYANANGVDGEWTYKDATKTFTVTE,3.2424936,"G14E, E15T, V21S, D36A, D46K",5
MQYKLILNGKTLKGETTTEASDAATAEKVFKEYANDNGYDGEITYDPATKTFTVTE,-4.7465405,"V21S, Q32E, V39Y, W43I, D47P",5
MQYKLILNGKTLKGETTTEAVDADTAEKVWKQYQNDTGVLGEWTYDDATKTFTVTE,-3.5409656,"A24D, F30W, A34Q, N37T, D40L",5
MQYKLIINGKELKGETTTEAVDAATAEKVFKQYANDNGLDGEWTYDDATKTYTVTT,-0.27666616,"L7I, T11E, V39L, F52Y, E56T",5
MQYKLILNGKTLKGESTTKAVDKATAEAVFKQYANDNGVDGEWSYDDATKTFTVTE,-2.2258618,"T16S, E19K, A23K, K28A, T44S",5
MSYKLILNGKTLKVETTTEATDAATARKVFKQYANDNGVDGEWTYDVATKTFTVTE,-3.6973348,"Q2S, G14V, V21T, E27R, D47V",5
MQYKLIQNGKTLKGQTTDEAVDAATAEKAFKQYANDNGVDGEWTYDDATKTFKVTE,0.8464806,"L7Q, E15Q, T18D, V29A, T53K",5
MQYKLILNGKTVKGETTTEAVDAATAEKATKQYAKDNGVDGEWTYDDAIKTFTVTE,-5.20456,"L12V, V29A, F30T, N35K, T49I",5
MQYKLILNGKTLKGESTTEAVDKATAEKVFKQKANDNGTDGEWTYDGATKTFTVTE,-2.4562485,"T16S, A23K, Y33K, V39T, D47G",5
MQYKLILNGKQLKGETTTEAVDAATAEKDAKQYANDQGVDGEWTYDDATKTFTVTA,-3.2601864,"T11Q, V29D, F30A, N37Q, E56A",5
MKYSLIYNGKTLKGETTTEAVDAATAEKVFKQYARDNGVKGEWTYDDATKTFTVTE,-2.786358,"Q2K, K4S, L7Y, N35R, D40K",5
MQYKLILNGKDLKGSTTTEAVDAATAEKVFKQYANANGTDGEWTYDDATGTFTVTE,2.1516156,"T11D, E15S, D36A, V39T, K50G",5
MQYKLILNGKTLKGEVTTEAVDAATAEKVFKQYANSNGVDGEVTYDDTTKTVTVTE,-5.381434,"T16V, D36S, W43V, A48T, F52V",5
MQLKLILNGKTLKGETTTEAVDKATAEKVFKQYANDNGVDGEWTWDDAEKTFTVKE,0.44853094,"Y3L, A23K, Y45W, T49E, T55K",5
MQKKLILNGKTLKGETKTEAVDAATAEKVFKDYANINGVDGEWTYDDATKTFEVTE,-2.924639,"Y3K, T17K, Q32D, D36I, T53E",5
MQYKLILNGKALKGETTTEAVDQATAEKVFKQYADDLGVDGEVTYDDATKTFTVTE,-5.612102,"T11A, A23Q, N35D, N37L, W43V",5
MQYKFILNGKTLSGETTTDAVDAATAEKVFKQYANDNGVDGNWTYDDATKTFTVTP,1.9450389,"L5F, K13S, E19D, E42N, E56P",5
MQYKLILNGKTLKGETTTEAVDAATAEKVFRQYALDNGVLGEWTYDDATKKFTVAE,-2.7465332,"K31R, N35L, D40L, T51K, T55A",5
MQYKLILNGKYLKGETTTEAVDAKTAEKVAKQYANDNGVDAEWTYDSATKTFTVTE,-3.4668765,"T11Y, A24K, F30A, G41A, D47S",5
MQYKLILNGKTLKGEITGEAVDAATAEKVFKQYAEDNGWDGEWTYDDATFTFTVTE,-5.160344,"T16I, T18G, N35E, V39W, K50F",5
MPVKTILNGKTLKGETTTEAVDAATAEKVFKDYANDHGVDGEWTYDDATKTFTVTE,-3.5956445,"Q2P, Y3V, L5T, Q32D, N37H",5
MQYKLILNGKTLQGETTTEAVDAATAEKVFKQYANDNGVTGELNYDDATKTITVTE,-5.305406,"K13Q, D40T, W43L, T44N, F52I",5
MQYKLILNGKLVKGETTTEHVDAATAEKVFKQYANENGVDGEWTYDDATQTFTVTE,1.2276721,"T11L, L12V, A20H, D36E, K50Q",5
MQYKTTLNGKTLKGETTTEATDAKTAEKVFKQYANDNGVDGEWRYDDATKTFTVTE,0.038824275,"L5T, I6T, V21T, A24K, T44R",5
MQYKVKINGKTLKGETTTEAVDAATAEKVFKQYANANGVDGEWTYDSATKTFTVTE,4.9558287,"L5V, I6K, L7I, D36A, D47S",5
MQYKLILNGKTLKGETTTEAVDRATAEKVFKAYANDNGVDFETTYDDAKKTFTVTE,-4.959519,"A23R, Q32A, G41F, W43T, T49K",5
MQYKLILNGKTLKGENTTEAVDAATAEKVFKQYANDNGVDGEITYDDVIKTLTVTE,-4.5270667,"T16N, W43I, A48V, T49I, F52L",5
MKYKLILNGVTLKGETTTEAVDAAQAEKVFKYYANDNGVDGEWTYDDATKKFTVTE,3.3781714,"Q2K, K10V, T25Q, Q32Y, T51K",5
MSYKLKLNGKTLKGETTTEAVDASTAEKVFKQVANDNGVNGEWTYDDATKTFTVTE,3.2997563,"Q2S, I6K, A24S, Y33V, D40N",5
MQYKLILNGKTLKGETVTEAVDAATAEKVFKQYLNDNGVDGEVTYDSATKTFTITE,-4.828013,"T17V, A34L, W43V, D47S, V54I",5
MEYKLILNGKTLKGMTTTEAVDAATAEKVFKQYANTNGVDGEWTYDDATKTYTFTE,0.76608956,"Q2E, E15M, D36T, F52Y, V54F",5
MQYHLILNGKTVKGENTTEAVDAATAEKVFKQYANDNGVDGEWTYDDATGTITVTE,-1.5399207,"K4H, L12V, T16N, K50G, F52I",5
MQYKLILNGKTLKGQTTTEAEDRATAEKVFKQYANDKGVDGEWTYDDATKTFTVSE,-1.3585395,"E15Q, V21E, A23R, N37K, T55S",5
MQYKGILNGKTYKGETTTEAVDAATAEKVFKQYANDNGVDGEGTYDDATKSFKVTE,-5.8502164,"L5G, L12Y, W43G, T51S, T53K",5
MTYKLILNGKTLKGETTTEATDAATAEKAFQQYANDNGVDGEWTYDDATQTFTVTE,-1.746331,"Q2T, V21T, V29A, K31Q, K50Q",5
MQYKLILNGKTLKGETTVEAVDAATAEKMFKQYANDNFVDGEVTYDDATKTFTVTA,-3.5746436,"T18V, V29M, G38F, W43V, E56A",5
MQYKMILNGKTVKEETTTEAVDAATAEKVFKQYANDNGVDGEWTYDDATDTFTVVE,-0.96037316,"L5M, L12V, G14E, K50D, T55V",5
MQYKLILNGKTLKGEVTTEAVDAATAEKVFKQYANINGLDLEWEYDDATKTFTVTE,-0.94976693,"T16V, D36I, V39L, G41L, T44E",5
MQYKLILNGKILKGETTTEATDAATAEKVFQQYANDNGVDGEWTVDDATKTFTLTE,-5.255257,"T11I, V21T, K31Q, Y45V, V54L",5
MQYKLILNGKTLTLETTTEAVLAATAEKVFKQYAKDNGFDGEWTYDDATKTFTVTE,-4.00093,"K13T, G14L, D22L, N35K, V39F",5
MQYKLILNGKTLKGETTTEAEDAATAQKVFKQYANDNGLDGEWTYDDATKTITVTN,-5.4733057,"V21E, E27Q, V39L, F52I, E56N",5
MQYKLILNGKTLKGETTTGAVDAATAEEVFKQYANDQGVDGEWVYDQATKTFTVTE,-2.669835,"E19G, K28E, N37Q, T44V, D47Q",5
MQYKVILNGKTLKGETTTEAVDAAVAEKVWKQYINDNGVDGEWTYDDATKTFTVTN,-3.2864773,"L5V, T25V, F30W, A34I, E56N",5
MQPKLQGNGKQLKTETTTEAVDAATAEKVFKQYANDNGVDGEWTYDDATKTFTVTE,-3.595519,"Y3P, I6Q, L7G, T11Q, G14T",5
MKYKLILNGKTLKGETTTEAVDAATALKVFKQYFNDNGVDGEWTYDAATKTFTKTE,-4.7625384,"Q2K, E27L, A34F, D47A, V54K",5
MQYKLVLNGKTLKGETTTEVVDKATAIKVFKQYANDNGVDGEWTYDDATKTFTVVE,-3.9150748,"I6V, A20V, A23K, E27I, T55V",5
MQYKLILNGKTLKGETTTSCVDAETVEKVFKQYANDNGVGGEWTYDDATKTFTVTE,3.5347195,"E19S, A20C, A24E, A26V, D40G",5
MSYKLILNEKTLKGETTTEAVDAATYPVVFKQYANDNGVDGEWTYDDATKTFTVTE,-6.17384,"Q2S, G9E, A26Y, E27P, K28V",5
MVYKLILNGKTLKGETTTEAVDAATANKVFKQYANDYGVDGEWTYDDKTKTVTVTE,-5.4457707,"Q2V, E27N, N37Y, A48K, F52V",5
MEYKLILNGKTLKGETTTEMVDAATANKVFKAYANDIGVDGEWTYDDATKTFTVTE,-4.5516396,"Q2E, A20M, E27N, Q32A, N37I",5
MQYKLIKNGKTLAGFTTTEAVDAATAEKVFKQYANDNGVDAEITYDDATKTFTVTE,-5.0398617,"L7K, K13A, E15F, G41A, W43I",5
MQYKLRLNGKTLTGETTTEATDAATAEKVFKQYANDNGVDGEWTLDDATKTYTVTE,0.478669,"I6R, K13T, V21T, Y45L, F52Y",5
MQYKLIYNGKTLKGHTTDEAVFAATAEKVFKQYANDNGVDGEWTYNDATKTFTVTE,1.0556346,"L7Y, E15H, T18D, D22F, D46N",5
MQYKLILNGKTTTGETTTEAVDAATAKKVFKQYANDNGVDFEWTYDDKTKTFTVTE,-5.495744,"L12T, K13T, E27K, G41F, A48K",5
MQYKLILNYKNSKGETTTEAVDAATAEKVFKQYANDNGVKGELTYDDATKTFTVTE,-4.5725536,"G9Y, T11N, L12S, D40K, W43L",5
MQYKTVYNGKTLKGETTTEAVDAATAEKVFEQYAKDNGVDGEWTYDDATKTFTVTE,-5.6663337,"L5T, I6V, L7Y, K31E, N35K",5
MQYKLILNGKTVKGETTTPAVDAASAEKVFKAYANDNGVDGEWTYDDATKTFTVTM,1.2959106,"L12V, E19P, T25S, Q32A, E56M",5
MQYKLIYNGKTLKGETTTEAVDAATAAAVFKQALNDNGVDGEWTYDDATKTFTVTE,-6.444543,"L7Y, E27A, K28A, Y33A, A34L",5
MQYKLIDNGDTLEGETTTRAVDAATAEKVFKQYANDNGVTGEWTYDDATKTFTVTE,-0.052944764,"L7D, K10D, K13E, E19R, D40T",5
MQYKLILNGKTLHGETTTEAVDAATAEKVAKQYANDNGVDGEWTYDAATMTFTKTE,-2.8339567,"K13H, F30A, D47A, K50M, V54K",5
MQYMLILNGKPLKGETTTEAVDAATAEKVFKQYANDNGVKGEWTWDDATKTFEVTE,2.229269,"K4M, T11P, D40K, Y45W, T53E",5
MKYKLILNGKTLKGETYTEAVDAATAEKVVKQYANDNGVDGEWTYDSASKTFTVTE,3.566222,"Q2K, T17Y, F30V, D47S, T49S",5
MMYKLKLNGKTLKGETTTEAVDAATAEAVFKQYANDNQPDGEWTYDDATKTFTVTE,-4.159573,"Q2M, I6K, K28A, G38Q, V39P",5
MQYKLILNGKTLKGEVTTEAKDAATAEKVFKQYANDNGVDTEVSYDDATKTFTVTE,-5.9207067,"T16V, V21K, G41T, W43V, T44S",5
MQYKLILNGSTLTGETTTEAVDAATAEAVFDQYAKDNGVDGEWTYDDATKTFTVTE,-6.0173655,"K10S, K13T, K28A, K31D, N35K",5
MHYKLILNGKTLKGETTTEAVDAATAEEVFKQIANDNYVDGEWTYDDATKTFTVTR,-4.3477488,"Q2H, K28E, Y33I, G38Y, E56R",5
MQKKLILNGKTLKRETTTGAVDAAEAEKVFKQYANDNGVDGEWTYDKATKTFTVTE,-2.1942873,"Y3K, G14R, E19G, T25E, D47K",5
MQYQYILNGKVLKGETTGEAVDAAEAEKVFKQYANDNGVDGEWTYDDATKTFTVTE,-2.1177928,"K4Q, L5Y, T11V, T18G, T25E",5
MQYKLILNGKTLKGETTVEAVDAATAEKVFKQYGNANGVDGEWTYDGATKTYTVTE,0.58543426,"T18V, A34G, D36A, D47G, F52Y",5
MQYKLMLNGKTLKGETTTEAVDAATAEKVFKQQANENGVDGEWTYDDATKTVTVTK,-3.4115958,"I6M, Y33Q, D36E, F52V, E56K",5
MQVKLILNGKTFKGETTTEAVDAFTAEKVFVQYANDNGVDGEWTYDDATKTFTVTS,-4.7500463,"Y3V, L12F, A24F, K31V, E56S",5
MQYKLILNFKTVPGETTTEYVDAATAEKVFKQYANDNGVDYEWTYDDATKTFTVTE,-4.9603148,"G9F, L12V, K13P, A20Y, G41Y",5
MQLKLILNGKTLKGKTTTSAVDAAEAEKVFKQWANDNGVDGEWTYDDATKTFTVTE,1.6944988,"Y3L, E15K, E19S, T25E, Y33W",5
MQYKLILNGKTLSGFTTTEAVDAATAEKVFKQVANDNGVDGEVTIDDATKTFTVTE,-4.58559,"K13S, E15F, Y33V, W43V, Y45I",5
MQYKLILNGKTLKGETTIEAVDAATAEKLFKQYLNDNGVDGEWTYDDSTKTFTVTN,-0.72713983,"T18I, V29L, A34L, A48S, E56N",5
MQYKLIINGKTLKGETTTEAVDAATAEKVCKQYANDNGVDGEFSYDDATKTCTVTE,-4.245828,"L7I, F30C, W43F, T44S, F52C",5
MQYKLILNGKTLKGEITTEAADKAGAEKVFKQYANDNGVDVEWTYDDATKTFTVTE,-3.5496585,"T16I, V21A, A23K, T25G, G41V",5
MQYKLILNGKTLKGETTTETVDAATAEEVAKQYANDNGVEGEWTYDDATQTFTVTE,-3.280296,"A20T, K28E, F30A, D40E, K50Q",5
MQYKLILNGKTLKGETYTEAVDAATAEKIFKQYANDNGVDWEWTIDDSTKTFTVTE,-2.7007844,"T17Y, V29I, G41W, Y45I, A48S",5
MQYKLILNEKTDKGETTTEAVDAATAEKVFEQYANDRGVDGEWTYDDDTKTFTVTE,-5.6763835,"G9E, L12D, K31E, N37R, A48D",5
MQIDLILNGKTLKGETTTEAVDAATAEKVFKQYATDNVVQGEWTYDDATKTFTVTE,-3.164083,"Y3I, K4D, N35T, G38V, D40Q",5
MQYKLILVGKTDKGETTTEAVDAATAEKVFKQYLNDNGVDGEWTYDDATKTVTITE,-5.5835996,"N8V, L12D, A34L, F52V, V54I",5
MQYKLTLNGKTLVTEETTEAVDAATAEKVFKQYANDNGVDGEWDYDDATKTFTVTE,0.71864504,"I6T, K13V, G14T, T16E, T44D",5
MQYKLIHNGQYLKGETTTEAVDAATAEKVFKQYANANGVDGEWTYDGATKTFTVTE,0.9191486,"L7H, K10Q, T11Y, D36A, D47G",5
MQYKLILNGKTLKGETTYEAVTAATAVKQFKQYANDNGVDGEWTYDDATQTFTVTE,-2.2226453,"T18Y, D22T, E27V, V29Q, K50Q",5
MQYKLILNGKTLKGECTTSAVDAATAEFAFKQYANDNGVDGEWTYDDATKTFTVLE,0.7674031,"T16C, E19S, K28F, V29A, T55L",5
MQYKLILNGKWLKGETTTEAVDAATAEQVFKQYANDNGVKVEWKYDDATKTFTVTE,-4.5077696,"T11W, K28Q, D40K, G41V, T44K",5
MQYKLILNGKTVKGETITEAVDFATAEKVFKQYANDNGVTGEWTYDTATKTFTVTE,-1.9492702,"L12V, T17I, A23F, D40T, D47T",5
MQYKLILTGKTLKGDTTTEFVDAATAYKVFKQYANDNGVDGEWTYDDATKTFTLTE,-5.2951617,"N8T, E15D, A20F, E27Y, V54L",5
MQYKAILNGKTLKGEYTTNAVDAATAEKVFKQYANDNGWDGEWTYDDATRTFTVTE,-1.6479032,"L5A, T16Y, E19N, V39W, K50R",5
MQYKLILNGKTLKQETTTEAVDAADAEKVAKQYANSNGVDGEWTYDDATKTFTVTK,-2.486003,"G14Q, T25D, F30A, D36S, E56K",5
MRYKLILNGKTLKGETTTEVVDAATAEKVFKQYANDNKVDGEWLYDDATKTFTVVE,2.6974971,"Q2R, A20V, G38K, T44L, T55V",5
MQYKLVLNGKTLKGETTTENVDAATAEKQFKAYANDNGVAGEWTYDDATKTFTVTE,4.079337,"I6V, A20N, V29Q, Q32A, D40A",5
MQYQLILNGTTLSGETTTEAVDAVTAEKVFKQGANDNGVDGEWTYDDATKTFTVTE,2.65628,"K4Q, K10T, K13S, A24V, Y33G",5
MQYKLTLNGATYKGETTTEAVDAATAEKVFKQYANDNGVDGEVAYDDATKTFTVTE,-4.0285454,"I6T, K10A, L12Y, W43V, T44A",5
MQYKLILNGKKLKGETTTELVDAATAEKVFKDYANDNGVDGEWTYDDATKTLTVTG,-4.831006,"T11K, A20L, Q32D, F52L, E56G",5
MQYKLILNGETKKGETTTEAVDAATAEKMFKQYANANGVDGEWTYDDATKTFTRTE,-2.5364773,"K10E, L12K, V29M, D36A, V54R",5
MQYKLILNGKTLKGETTTEAVPAASAETVFKQYANDNGVPGELTYDDATKTFTVTE,-4.9302053,"D22P, T25S, K28T, D40P, W43L",5
MQYKLILNGKELEGETTHEAVDAATAEKVFKQYANDNGVDGEWTYDDAGETFTVTE,1.992808,"T11E, K13E, T18H, T49G, K50E",5
MQYKLILNGKELKGEETTEAVDKATAEKVFKQYANHNGVDVEWTYDDATKTFTVTE,-5.1259556,"T11E, T16E, A23K, D36H, G41V",5
MQYKLILNGKTLKGETTTEAVTAATAEKVFKQYATDNGVDGEWTFDDETKTFAVTE,1.3682458,"D22T, N35T, Y45F, A48E, T53A",5
MQYKLILNGKTLKGETTVEAVDAATAEKVAKQYANDNGVDVEWTYDDGTETFTVTE,-3.032063,"T18V, F30A, G41V, A48G, K50E",5
MQYKLIVNGKTLKEETTTEAVDAATAEKVFKQDANDNGVDMYWTYDDATKTFTVTE,-4.4372106,"L7V, G14E, Y33D, G41M, E42Y",5
MEYKLILNGKTLKGETTTEADDAATAENVFKNIANDNGVDGEWTYDDATKTFTVTE,-0.8570106,"Q2E, V21D, K28N, Q32N, Y33I",5
MQYKLILNGKTLIGETTAEAVDAATAEKVFKDYAIDNGVDGEVTYDDATKTFTVTE,-5.454601,"K13I, T18A, Q32D, N35I, W43V",5
MQYKLILNGKTLKGETTTEAVDAATAEKLFKNYANDNGVDFEVTYDDDTKTFTVTE,-4.459378,"V29L, Q32N, G41F, W43V, A48D",5
MQYKAILNGKVLKGETTTEAVDAATAEKVIKQAANDNGVDGEWTYDDLTKTFTVTE,-1.8562855,"L5A, T11V, F30I, Y33A, A48L",5
MQYKEILNGKTLKGETTTEAVDAATAEKAFKQYAEDNGVDGEWLYDDATKTFTVTG,-5.4770646,"L5E, V29A, N35E, T44L, E56G",5
MKYKLILNGKTLKGNLTTEAVDAATAQKVFKQYANDNGVAGEWTYDDATKTFTVTE,-1.2404442,"Q2K, E15N, T16L, E27Q, D40A",5
MQYKLILNGTTLKGETTTEYVDAATAEKVFKQYANDNGIDGAWTLDDATKTFTVTE,1.8979497,"K10T, A20Y, V39I, E42A, Y45L",5
MKYKLILNGETLKWETTTEAVDAATAEKVFKQYANDNGVDGEWIYDDATKTITVTE,-1.4799984,"Q2K, K10E, G14W, T44I, F52I",5
MQYKLILNGKPLKGETTTEAVDADTAELVFKDYANDNGVQGEWTYDDATKTFTVTE,-2.7203026,"T11P, A24D, K28L, Q32D, D40Q",5
MQYKLILNGKPLKGETTTEAVDYADAEKVFKDYANDNGVDGEWTYDWATKTFTVTE,-5.1635838,"T11P, A23Y, T25D, Q32D, D47W",5
MQYKEILNGKTLKGETTTEAVPAATAEKVFKQYANDNCVDGEITYDDAKKTFTVTE,-4.8790154,"L5E, D22P, G38C, W43I, T49K",5
MQYKLSLNGKDLTGETTTEAVDAATAEKVFKQYANDNGVSGEWTYDDATKTFTVNE,2.7402658,"I6S, T11D, K13T, D40S, T55N",5
MTYKLILNGKTLKGETTTEAVDAAAAKKVFKQYANDNGVDCEWTYDDATKTFTVTD,-5.124409,"Q2T, T25A, E27K, G41C, E56D",5
MQYKLIANGKTLKEETKTEAVDAATAEKVFSQYANDNAVDGEWTYDDATKTFTVTE,-3.8916907,"L7A, G14E, T17K, K31S, G38A",5
MEYKLILNGKTIKGVTTTEAVDAATAEKVFEQYANDNGVDGEWTYDDATKTFVVTE,-2.858397,"Q2E, L12I, E15V, K31E, T53V",5
MQYKLILNGKLLKGETTTEAVDAKTAEKVFKQYAIDNGVDGEVTYDDASKTFTVTE,-5.3692474,"T11L, A24K, N35I, W43V, T49S",5
MQYKVIRNGKTLKGETATEAVDAKTAEKVFKQYANDNGVDPEWTYDDATKTFTVTE,-5.533474,"L5V, L7R, T17A, A24K, G41P",5
MQYKLILNGKTLKGQTTFEAVDAATAKKVFKQSANDNGVDGEWTYDEATKTFTVTE,-3.7561781,"E15Q, T18F, E27K, Y33S, D47E",5
MQYKLVLEGKTLKGETTTEAVDAATAEKVFKQYANDNNVDGEYTYDGATKTFTVTE,-2.1243281,"I6V, N8E, G38N, W43Y, D47G",5
MQYKLILNGKTLKGETTTEAVSAATAEKVFKQFANDNGVDWEWTYDNATKTFTVQE,-0.6968204,"D22S, Y33F, G41W, D47N, T55Q",5
MQYKLILNGKTLKGVTTTEIVDAATAEKVFKQYANDNGVDGEITWDDATKAFTVTE,-2.8959944,"E15V, A20I, W43I, Y45W, T51A",5
MQKQLILNGKTLKGETTTEAVDAAEAEKVFKQKANDNGVDGEWTYDDATKLFTVTE,-2.577317,"Y3K, K4Q, T25E, Y33K, T51L",5
MQYKLLLNGKQLKGETTTEAVDAATAENVFKQYANDNGVDGEWTYDGASKTFTVTE,0.3321962,"I6L, T11Q, K28N, D47G, T49S",5
MQYKLILNGKNLKGETTTEAVDAATAEKVAKQYANDNGVHLEWTYDDATKTFAVTE,-3.1492434,"T11N, F30A, D40H, G41L, T53A",5
MQKKLILNIKTLKGETTTEVVDAATAEKVFKQYANDNGFDGEWTYDTATKTFTVTE,-2.8817592,"Y3K, G9I, A20V, V39F, D47T",5
MQYKLILNGKTLKGEFTTEADDKATAEKVFKQYANQNGVDGEWTYDSATKTFTVTE,0.23467878,"T16F, V21D, A23K, D36Q, D47S",5
MQFKLILNGKTLEGTTTTNAVDAATAEKVFKQYANMNGVDGEWTYDDATKTFTVTE,4.582882,"Y3F, K13E, E15T, E19N, D36M",5
MQYKLILNGKTLKGETTTEAVDAATAEKVAEQYANDNGVDNEVTYDNATKTFTVTE,-6.5449257,"F30A, K31E, G41N, W43V, D47N",5
MQYKLILNGKTIKGETTTEAVDAATAEKVFKQSANDNGSDGIWTYDDATKTFTVTN,-2.9017735,"L12I, Y33S, V39S, E42I, E56N",5
MQYKLILNGKTLKGETTKEAVDKATAEKTFKQFANDNGVDGEWTYDDETKTFTVTE,1.56352,"T18K, A23K, V29T, Y33F, A48E",5
MQYKLILNGKDLKGEVISEAVDAATAEKVFKQYANDLGVDGEWTYDDATKTFTVTE,1.2428614,"T11D, T16V, T17I, T18S, N37L",5
MQYKLSLNGKTLKGETTTEAVDAANAEEVFKQYANDAGVDGEWTYDDATKTFTVTT,-4.026964,"I6S, T25N, K28E, N37A, E56T",5
MKYKLIINGKTLKGETTTEAVDKATAEKVGKQYANDNGVVGEWTYDDATKTFTVTE,-1.316623,"Q2K, L7I, A23K, F30G, D40V",5
MQYELILNGKTLKVETTTEAVDAATAEKVFKQYANKNDVDGEWTFDDATKTFTVTE,1.0189824,"K4E, G14V, D36K, G38D, Y45F",5
MQYKVILNGKTLKGETFTEAVDAADAEKVAKQYAQDNGVDGEWTYDDATKTFTVTE,-4.3417215,"L5V, T17F, T25D, F30A, N35Q",5
MQRKLILNGKTLKGETTSAAVDAANAEKVFKQYAADNGVDGEWTYDDATKTFTVTE,-3.8587108,"Y3R, T18S, E19A, T25N, N35A",5
MQYKLILNGKTLKGVTTTEAVEADTAEKVFKQLANDNGVDGVWTYDDATKTFTVTE,4.642821,"E15V, D22E, A24D, Y33L, E42V",5
MQYKLIINGKVLKGEFTTEQVDAATAEKVFRQYANDNGVDGEWTYDDATKTFTVTE,0.33783868,"L7I, T11V, T16F, A20Q, K31R",5
MQYKLILNGKTLKGETTTEAVDAATAEKVFSQYANDNYVDGVVTFDDATKTFTVTE,-5.687557,"K31S, G38Y, E42V, W43V, Y45F",5
MQYKLILNGKTLKGETTKEAVLAATAEFVKKQYANDYGVDGEWTYDDATKTFTVTE,-4.100118,"T18K, D22L, K28F, F30K, N37Y",5
MQYKLILNGKTLKGETTTEAVDAATAEKVFKEYGNDLGVSGRWTYDDATKTFTVTE,-0.7011175,"Q32E, A34G, N37L, D40S, E42R",5
MQYKLIVNGKTLKGETTTEAVDAATAEKVAKQYANDNGMDGEWTYDNATGTFTVTE,2.5638819,"L7V, F30A, V39M, D47N, K50G",5
MQYKLILNGKTLKGETTTEAVDAATAEKVAKQYANDNLVDGEWKADDATKTFTLTE,-3.8219974,"F30A, G38L, T44K, Y45A, V54L",5
MQYKLILNGKYLKGETTTEAVDAATAEKVFKQYANIDYVDGEWTYDDATKKFTVTE,0.5266242,"T11Y, D36I, N37D, G38Y, T51K",5
MQYKLILNGKTLKGETTTEVVDAATAEKVFKQYANDNGVDGEWTFDDDTNTFRVTE,3.33095,"A20V, Y45F, A48D, K50N, T53R",5
MQYKLILNGKTLKGEVTTEGVDAATAEKVFKVYANDNTVDGKWTYDDATKTFTVTE,1.5386037,"T16V, A20G, Q32V, G38T, E42K",5
MQYKLIRNGKTLIGETVTEAVDAATAEKVFKQYANDNGVDIEWTYDDATKKFTVTE,-4.1743913,"L7R, K13I, T17V, G41I, T51K",5
MQYKLILRGKTLKGSTTIEAVDAATAEKVFKQYANDNGVDGEFTYEDATKTFTVTE,-0.3501771,"N8R, E15S, T18I, W43F, D46E",5
MQYKLILNGKTLKGEATTEADAKATAEKVGKQYANDNGVDGEWTYDDATKTFTVTE,-3.243945,"T16A, V21D, D22A, A23K, F30G",5
MQYKLILNGKTLKGESYTEATDAATAEKVLKQYLNDNGVDGEWTYDDATKTFTVTE,-0.48431388,"T16S, T17Y, V21T, F30L, A34L",5
MQYKLILNGKTLKGWTTTGAVDAADAEKRFKQWANDNGVDGEWTYDDATKTFTVTE,3.6500015,"E15W, E19G, T25D, V29R, Y33W",5
MQYKLILNGKILKGETTTFAVDAATAEKVFKQYAEDNGVDGEWTYDDATKTITVTA,-5.051037,"T11I, E19F, N35E, F52I, E56A",5
MQYKLILNGKTVKGETTTEAVDAATAEKVAKQYAADNGVDGEITYDDVTKTFTVTE,-5.995932,"L12V, F30A, N35A, W43I, A48V",5
MQYKLIFNGKTLKGETTCEAVDAAKAEKVFKQYANDNGVDGEMTYDDASKTFTVTE,-2.7557406,"L7F, T18C, T25K, W43M, T49S",5
MQYKLILNGETLKGFTTTEAVDAATAEKVFKSYASDNGVDGEWTYDDATKTFTVTK,-1.1437275,"K10E, E15F, Q32S, N35S, E56K",5
MQYKLIYNGKTLKGETTTEAVDAATAEKVFKQYAQANGVDGELTYDDATCTFTVTE,-5.250229,"L7Y, N35Q, D36A, W43L, K50C",5
MQYKLLLNGKTLKGETTTEAVDAATAEKVFLQYKNDNGVNGNWTYDDATKTFTVTE,-5.1213746,"I6L, K31L, A34K, D40N, E42N",5
MQYKLKLNGKTLKRETTTEAVAAATAEKVFKQYANDNGVDSYWTYDDATKTFTVTE,-1.9678527,"I6K, G14R, D22A, G41S, E42Y",5
MQYKVILNGKTLKNYYTTEAVDAATAEKVFKQYANDNGVDGEWTYDDATKNFTVTE,1.1230078,"L5V, G14N, E15Y, T16Y, T51N",5
MQIKLILNGKTVKGETITEASDAATAEKVFKQYANDNGVDGEWTIDDATKTFTVTE,-1.6246201,"Y3I, L12V, T17I, V21S, Y45I",5
MQYKLILNGKTLKGETTTVAVDAATMEKVFKQYANDNEVYGEWTYDDFTKTFTVTE,2.5505505,"E19V, A26M, G38E, D40Y, A48F",5
MQYKLILNGKTLKGETFTEAVDAKTAEKVFKQYANINGVEGEWTYDDAGKTFTVTE,1.628645,"T17F, A24K, D36I, D40E, T49G",5
MQYKLILNGKTLYGETTTEAVDRATAEKVFKQYARDNGVDGEWTYDEATKTFTLTE,-4.03717,"K13Y, A23R, N35R, D47E, V54L",5
MQYKLILNGKTLKGETTTEAKDAATAEKVFEQLANDNGVDGEWTYDDATKGFTVPE,-5.324807,"V21K, K31E, Y33L, T51G, T55P",5
MTYKLILNGKTLKGETTTEAVDAANAAKVFEQYANDNGVDGEWTYDDATKTATVTE,-6.3829165,"Q2T, T25N, E27A, K31E, F52A",5
MQYKLIINGKTLVGETTTEAVDAATAEKVFKQLANDNGVDGEWTYDAATKTFTLTE,3.199432,"L7I, K13V, Y33L, D47A, V54L",5
MKYSLILNGKTLKGETTTEAVDAATAEKVFKQYANDNGVDGTWTYDDATKTITYTE,-2.5877552,"Q2K, K4S, E42T, F52I, V54Y",5
MQYKLILNGKTLKGQTFTEAVDAATAEKMFKQYANDNGEKGEWTYDDATKTFTVTE,0.8083598,"E15Q, T17F, V29M, V39E, D40K",5
MQYKLILNGKTLKGRTTTEAADAATAEKVFKQYAKDNGGAGEWTYDDATKTFTVTE,-4.0463667,"E15R, V21A, N35K, V39G, D40A",5
MQYKLILNGKTLNGETTTEAVDAETAEHVFKQYANDNGVDGKWTYDAATKTFTVTE,3.7412374,"K13N, A24E, K28H, E42K, D47A",5
MPVKLILNGKTLKGETTTEAVDAAAAEKVFEQYARDNGVDGEWTYDDATKTFTVTE,-5.463615,"Q2P, Y3V, T25A, K31E, N35R",5
MQYKLLLNGKTLKEETTTEAVDAATAEKVFKQYCNDNGVDEEWTYDDATLTFTVTE,-3.1112602,"I6L, G14E, A34C, G41E, K50L",5
MQYKLILNGKTLKGEVLTEAVDAATAEKVFKQYGNTNLVDGEWTYDDATKTFTVTE,1.4014704,"T16V, T17L, A34G, D36T, G38L",5
MQYKLIMNGKTLKGETTTEAVDAATAEKVVKQDANDNGVDGEWTYNDATKTFTVTK,-3.557235,"L7M, F30V, Y33D, D46N, E56K",5
MQYKLILNGKTLKGYTTTAAEDAATAEKVFKQYANDNGVDGEWTYDDATKTFTAAE,3.458573,"E15Y, E19A, V21E, V54A, T55A",5
MQYKLILNGCTLKGETITEAVDAATAKKVFKQYAKDNGVDGEWTYDDDTKTFTVTE,-5.036196,"K10C, T17I, E27K, N35K, A48D",5
MQEKLIKNGKTLKGETTTEAVDAATAEKVFKKYANDNGVDGEWVYLDATKTFTVTE,-3.4268627,"Y3E, L7K, Q32K, T44V, D46L",5
MQYKLILNGQTLKGATTTAAVDAATAEKVFKLYANDNGVDTEWTYDDATKTFTVTE,-2.1879683,"K10Q, E15A, E19A, Q32L, G41T",5
MQYKIIWNGKTLKGETTTEAVDLATAEKVFKQYANDNGVEGEWVYDDATKTFTVTE,-3.886189,"L5I, L7W, A23L, D40E, T44V",5
MQYKLYLNGKTLKGETQTEAVDAATAEKVFKQYMNDNGVDGEISYDDATKTFTVTE,-2.2268574,"I6Y, T17Q, A34M, W43I, T44S",5
MQYELILDGKTLKGETTTEAVDAATAEKVFKQYANTNKVDGIWTYDDATKTFTVTE,2.968946,"K4E, N8D, D36T, G38K, E42I",5
MQYILYLNGKTLKGERTTEAVDAATAEKDFKQYANDNGVDGEWTYDDATKTFTRTE,-3.0686479,"K4I, I6Y, T16R, V29D, V54R",5
MQVKLILNGKTYPGETTTEAVDEATAEKVFEQYANDNGVDGEWTYDDATKTFTVTE,-6.206101,"Y3V, L12Y, K13P, A23E, K31E",5
MQYKLILNGKTVKGETTDDAVDAATAEKVFQQYANDNGVDGEWVYDDATKTFTVTE,-5.1825204,"L12V, T18D, E19D, K31Q, T44V",5
MQYKVIANGKTLKGETTTEAVDAAEAEKIFKQYANDNGVDGEWTYDDATGTFTVTE,2.4314873,"L5V, L7A, T25E, V29I, K50G",5
MQYKLIVNGKTLKGETTTIAVDAATAEKVGKQYANDNGVPGEWTYDAATKTFTVTE,-0.019774444,"L7V, E19I, F30G, D40P, D47A",5
MQYKLILNGKSLKGETTTIPVDAATAEKVCKQYANDNGVDGEWTYDDATKTFTVLE,0.24479032,"T11S, E19I, A20P, F30C, T55L",5
MQYKLTLNGKTYKGETTTEAVDAATAEKVFKQYHNDNGFDAEWTYDDATKTFTVTE,-5.640649,"I6T, L12Y, A34H, V39F, G41A",5
