Sequence,Score,Mutations,Number of Mutations
MQYKLILNGKTLKGETTTEAVDAATAEKVAQKLANMNGVDGEWTYDDATKTFTVTE,-4.1338253,"F30A, K31Q, Q32K, Y33L, D36M",5
MQYKLILNGNTLKGETTTEAVDAKTAEKVFKKYANDVGVDGEWTYDTATKTFTVTE,1.0204997,"K10N, A24K, Q32K, N37V, D47T",5
MQYKLIVNGKTYKTETTTEAVDAKTAEKVFKQYADDNGVDGEWTYDDATKTFTVTE,-5.1138053,"L7V, L12Y, G14T, A24K, N35D",5
MGYKLTLNGKTRKGETTTEVVDAATAEKVFKQYANDNGVDGEWTYDKATKTFTVTE,2.941954,"Q2G, I6T, L12R, A20V, D47K",5
MPYKLILNGKTLKGETTTEAVDAATAEKVFKQYANDNGLDGEWTYDDASYVFTVTE,4.7759237,"Q2P, V39L, T49S, K50Y, T51V",5
MQYKLILNGKTLKGETTTEAVDAATAEKVAKQYLNDNGVDGELTYDDKTKTFTVTK,-5.9233894,"F30A, A34L, W43L, A48K, E56K",5
MQYKLIVNGKTLKGETTTSAVDAATAEKVFKQYANDNGVDGDWTYDDVTKTFTVVE,4.0963683,"L7V, E19S, E42D, A48V, T55V",5
MQVKAILNGKTLKGETTTEEVDAATAEKVFKQYANDNGVDGEWTYDDETKTFLVTE,-0.7854596,"Y3V, L5A, A20E, A48E, T53L",5
MQYKLILNGKTLLFETTTEAKDAATAENVFKQYANDNGVDGEWTYDDATKTFTVTL,-3.9792104,"K13L, G14F, V21K, K28N, E56L",5
MQYKLILNGKTLKGETTTSAVDAATAEKKFKQKANDNGVDGEWTYDDAAKTFTVTF,2.2932892,"E19S, V29K, Y33K, T49A, E56F",5
MQYKLILNGKTLKGETTTEAKDAATAEKVFKQYANDMGVDGTWTYDDETKTKTVTE,-3.0516145,"V21K, N37M, E42T, A48E, F52K",5
MQYKLIIEGKTLKGETTTEAEDAATAENVFKQYANDNGVDGEWTYDDATKTLTVTE,-1.634664,"L7I, N8E, V21E, K28N, F52L",5
MQYTLILNGKTLKGGTTTEATDANTAEKVFKQYANDNGVDAEWTYDDATKTFTVTE,1.0861639,"K4T, E15G, V21T, A24N, G41A",5
MQYKLILNGKTLKGETTTEAVDATQAEKVFKQYANDNGLDGGWIYDDATKTFTVTE,5.123133,"A24T, T25Q, V39L, E42G, T44I",5
MQYKLILNGADLKGETTAEAVDAATAEKVFKQYANDNGVDGEWTYDAATKTFTVTK,1.556572,"K10A, T11D, T18A, D47A, E56K",5
MQYKLILNGKTLTLETTTEAVAAAAAEKVFKQYANANGVDGEWTYDDATKTFTVTE,3.234587,"K13T, G14L, D22A, T25A, D36A",5
MQKKLILNGKTLKGETTIEAVDAATAEKVFKQYANDNGYDGNWTYDDATKTFTVEE,-3.0179844,"Y3K, T18I, V39Y, E42N, T55E",5
MQYKVILNGKTLKGETTTEAVDAATAEKVFKQYANDQGVEGDWTYDDATKTFTVQE,1.2539476,"L5V, N37Q, D40E, E42D, T55Q",5
MQYKLICNGKTLKGETTTEAVDAKTAEKVFKQYANDNGVDGEWTYEEATKTFAVTE,1.3119509,"L7C, A24K, D46E, D47E, T53A",5
MQYKLILNGKTLTGETTTEAVDAATVEKVFKQYSNDNGVDGEWTYDAATKTVTVTE,-0.91654176,"K13T, A26V, A34S, D47A, F52V",5
MQYKLIENGKTLKGEVTTEAADAATAEKVFKQHANDNGVDGEWTYDDATKTFRVTE,-0.029830925,"L7E, T16V, V21A, Y33H, T53R",5
MQYKLILNGKTLKGETTTEAVDAASAEKVFKQTANDNGYAGEWTYDDATKTFTVTD,-0.85864145,"T25S, Y33T, V39Y, D40A, E56D",5
MQYKLILNGKTLKNETTTEAVDKATAEKVFNSYANDNGVDGEWTWDDATKTFTVTE,-5.163977,"G14N, A23K, K31N, Q32S, Y45W",5
MQYKLILNGKTLKGETTTEAVDAATAEDVFKQYTNDCGTDGEWTYDDSTKTFTVTE,-4.577872,"K28D, A34T, N37C, V39T, A48S",5
MQYKLILNGKTLKGETKTEAVDAATAEAVFKQFANDPGVDGEWTYDSATKTFTVTE,-3.1477077,"T17K, K28A, Y33F, N37P, D47S",5
MQYKLTLNGKTLKGETATEAVDKATAEKVAKQYLNDNGVDGEWTYDDATKTFTVTE,-3.900929,"I6T, T17A, A23K, F30A, A34L",5
MQYKLILNGKTLKTETTTEAVDAALAEKVFKQEANDNGVDGKWIYDDATKTFTVTE,-1.1293623,"G14T, T25L, Y33E, E42K, T44I",5
MQYKLILNGKTLKTETTTKAVDAATAEKVAKQYAAENGVDGEWTYDDATKTFTVTE,-3.7227283,"G14T, E19K, F30A, N35A, D36E",5
MQYKLILNEKTLKGETTTEEVDAATAEKVAKSYANDFGVDGEWTYDDATKTFTVTE,-4.294625,"G9E, A20E, F30A, Q32S, N37F",5
MQYKLILNGKTLKSETTTEAVNAATAEKVFKQVANDNGVDIEWTYDDATKTFTVTR,-5.4010754,"G14S, D22N, Y33V, G41I, E56R",5
MQYKLDLNGKTLKGETTTEAVDQATVEKVFKQYCNDNGVDGEITYDDATKTFTVTE,-4.2423487,"I6D, A23Q, A26V, A34C, W43I",5
MQYKLIKDGKTLKEETTTEAVDAATAEKVFKQYANDNGVDGEWTWDDATKTFMVTE,0.47377944,"L7K, N8D, G14E, Y45W, T53M",5
MQFKLIPNGKTLKGETTTEAVDRAYAEKVFKQYANDNGVDGEWTYDDATKTFTVKE,-0.8722085,"Y3F, L7P, A23R, T25Y, T55K",5
MQYKLIINGKTLKGQTTTEATDAATAEKVFKQYASDNGVDGEWTYDDATKTFTVTD,-0.39552727,"L7I, E15Q, V21T, N35S, E56D",5
MQYKLILNGKTLKGMTTTEAVNAATAESVFKQYANDNGVDGNWTVDDATKTFTVTE,-1.5215049,"E15M, D22N, K28S, E42N, Y45V",5
MQTKLILNGKTLSGEATTEAVDAATAEKVFKQYCNDNGVDGEWTYNDATKTFTVTE,0.57546043,"Y3T, K13S, T16A, A34C, D46N",5
MQYKLISNGKTLKFETTTEAVDAAAAEIVAKQYANDNGVDGEWTYDDATKTFTVTE,-2.8870523,"L7S, G14F, T25A, K28I, F30A",5
MQYKLISNGKTYKGETTTEAVDAATAEKVFKQYALDNGVDCEWTYDDVTKTFTVTE,-5.528109,"L7S, L12Y, N35L, G41C, A48V",5
MQYKLILNGKELSGETTTETVTAATAEKSFKQYANDNGVDGEWTYDDATKTFTVTE,3.4049635,"T11E, K13S, A20T, D22T, V29S",5
MKYKLIINGKTLKGETTTEAVIAATAEDVFKDYANDNGVDGEWTYDDATKTFTVTE,-3.2670562,"Q2K, L7I, D22I, K28D, Q32D",5
MQYKLILNPPTLKGERTTEAVDAETAEKVLKQYANDNGVDGEWTYDDATKTFTVTE,2.378307,"G9P, K10P, T16R, A24E, F30L",5
MKYKLYKNGKTLKGETTTEAPDAATAEKVFKQYANDNGVDGEWVYDDATKTFTVTE,1.6525402,"Q2K, I6Y, L7K, V21P, T44V",5
MQYKLIWNGKTLKGETTTEAVDAATAEKVFKAYANDNGVVGTWTYDDATKTITVTE,-1.4464383,"L7W, Q32A, D40V, E42T, F52I",5
MQYKLILNGKTLKGEQTTEDVDAATAEKVYEQYANDNGVDGEWTYDDATKTFTVTA,-5.891579,"T16Q, A20D, F30Y, K31E, E56A",5
MQYKLKLNGKTLDGETTTEAVDAATAEKKFKQYAADNGVDGEWTYDDATKTFTVTT,-1.3752513,"I6K, K13D, V29K, N35A, E56T",5
MQYKLILNGKTIKGETLTEAVARATAEKVFKQYANDNGVDGEWKYDDATKTFTVTE,0.040275544,"L12I, T17L, D22A, A23R, T44K",5
MQYKLLLNGKTLKGEFTTNAVDAATAEKVFKQYANDNGVDFEWTYDDITKTFTVTE,0.69362164,"I6L, T16F, E19N, G41F, A48I",5
MQYKLVLNGKTLKGEFTTEASDAATAEKVFDQYANDNGVDGEWTYDDATKTFTKTE,-4.447704,"I6V, T16F, V21S, K31D, V54K",5
MQYKLLYNGKTVKGETTTEAVDAATAEKVAKQYANDNGLDGEWTYDDATKTFTVTE,-1.4351293,"I6L, L7Y, L12V, F30A, V39L",5
MQYKLILNGKTAKGETTPEAVDAATAEKVFKQYKNDNGVDGEFTYDDDTKTFTVTE,-6.187777,"L12A, T18P, A34K, W43F, A48D",5
MRYKLILTVKTLKGETTYEAVDAATAEKVFKQYGNDNGVDGEWTYDDATKTFTVTE,0.20926508,"Q2R, N8T, G9V, T18Y, A34G",5
MQYKLTLNGKTLKGETTTEAVDAAQATTVFKQYANDNGVMGEWTYDDATKTFTVTE,-4.4887958,"I6T, T25Q, E27T, K28T, D40M",5
MQYKLILNGKTLKGETTTEAVDAATAEEVFKQIAADNGVDGEWYYDDATKTITVTE,-5.641099,"K28E, Y33I, N35A, T44Y, F52I",5
MQYKLILNGKTVKGETTTEAVDRATAEKVFKQYQNDNGVYGEWTYDPATKTFTVTE,-3.4832816,"L12V, A23R, A34Q, D40Y, D47P",5
MQYKLILNGKTLKTETTTEAVDAATAEKVAKQIANDNGVDGEATYDDATQTFTVTE,-5.2867,"G14T, F30A, Y33I, W43A, K50Q",5
MQYKLILKGKTLVGEFTTEAVDATTAEKVFKQYANDNGVDGEWTYDDATKTFTVTK,2.5370686,"N8K, K13V, T16F, A24T, E56K",5
MQYKLFANGKTLKGGTTTEAVDAATAEKVFKQYADDNGVDGEWTYDDATKTFTKTE,-4.532057,"I6F, L7A, E15G, N35D, V54K",5
MQYKLILNGKTLKGETTTEANDAETAEKVFKQYCEDNGVDGEWTYDDATKTFTVTQ,-0.87286156,"V21N, A24E, A34C, N35E, E56Q",5
MQYKLILNGKTLKGETDTEAVDKATAEKVFKQYANDLGVDGGWTYDDATKTFTKTE,-4.220455,"T17D, A23K, N37L, E42G, V54K",5
MQYKLILNGKTLKGETTTTAVDAATAEAVFKQYANDNHVDGEWTYDDATKTATVTN,-5.298755,"E19T, K28A, G38H, F52A, E56N",5
MQYKLILNGKTLKGETTTEATDYATAEKVFKQYVNDNGFDGEWTYDDATKTFEVTE,-4.036236,"V21T, A23Y, A34V, V39F, T53E",5
MQYTLILNGKTLKGETTTEAVDAATAEKVFKQYAGENGVDGELTYDDATKTFTVDE,-5.137295,"K4T, N35G, D36E, W43L, T55D",5
MQYKLIRNGKPLGGETTTEAVDAATAEKVFKQMLNDNGVDGEWTYDDATKTFTVTE,-3.6717184,"L7R, T11P, K13G, Y33M, A34L",5
MQYKLILNGKTLKGETTTEAVDAAAIEKVFKQYANDNGVDCEFTYDEATKTFTVTE,-4.6676745,"T25A, A26I, G41C, W43F, D47E",5
MQYKLILNGKTLKGITTTEAVDAATAAKVAKQYANDNGVDGEWTYNDATETFTVTE,-4.066218,"E15I, E27A, F30A, D46N, K50E",5
MQYKLSLNGKTLSGETTTEAVDAATAEKVFKDYANDCGVDGEWTYDDGTKTFTVTE,0.32109404,"I6S, K13S, Q32D, N37C, A48G",5
MQYKLILNGKQLKGETTTEAVDAADAEKTFKQYANDNGVDAEWYYDDATKTFTVTE,-1.0400447,"T11Q, T25D, V29T, G41A, T44Y",5
MQYKLILNGKTLKGETTTEAVDEATAEKVFKAWANDNGADGEWTYDDDTKTFTVTE,-1.4149791,"A23E, Q32A, Y33W, V39A, A48D",5
MQYKLILNGKTLKPETTTEAVDAATIEKVFKQYANDNGVPGTWTYDDKTKTFTVTE,-1.5569354,"G14P, A26I, D40P, E42T, A48K",5
MQYKVILNGKTFKGETTTEFVDAATAENVFKQYANDNDVDGEWTYDDATKTFTVTE,-3.6032119,"L5V, L12F, A20F, K28N, G38D",5
MQYKDILNGKTYKGETTNEAVDAATAEKVFKQYAKDNGVDGEMTYDDATKTFTVTE,-6.968844,"L5D, L12Y, T18N, N35K, W43M",5
MQYKLILNGKTLKGMTTTEAVDAATAEKVFKTYANDNGVDGTYTVDDATKTFTVTE,-3.643019,"E15M, Q32T, E42T, W43Y, Y45V",5
MQYKLILNGKTLKNETTTEAVDAATAEKVFKQYANDQGVDGEWTYDDETGTFTATE,1.7135481,"G14N, N37Q, A48E, K50G, V54A",5
MQKTLILNGKTLEGETTTEAEDAATAEKVFKQYANDNGVDGEHTYDDATKTFTVTE,-5.273913,"Y3K, K4T, K13E, V21E, W43H",5
MQYKLILNGKTLEGETTTEAVDAATAEKVFKQYANDKGYDGEWTYDPATKTITVTE,-3.340501,"K13E, N37K, V39Y, D47P, F52I",5
MQYKLILNGKTLKGETTVEAVDADTAKTVFKQYANDNGVKGEWTYDDATKTFTVTE,-4.3112535,"T18V, A24D, E27K, K28T, D40K",5
MQYKLILNGKTLKGTKTTEAADAATAEKVAKQYANDNGVDGEWTYDDATKTLTVTE,-0.457179,"E15T, T16K, V21A, F30A, F52L",5
MQYKLILNGKTYAGSTTTEATDAATAEKVFKQYANDNGVDGEWTYDDATKAFTVTE,1.6411625,"L12Y, K13A, E15S, V21T, T51A",5
MQYKLILNGKTYKGEFHTEAGDAATAEKVFKQYANDNGVDGEWTYDPATKTFTVTE,1.9068481,"L12Y, T16F, T17H, V21G, D47P",5
MQYELILNGKTLKGETTVEAVDAKTAEKVFKQYANDNGVDGQWTYDDATKTFTVTK,0.026427977,"K4E, T18V, A24K, E42Q, E56K",5
MQYKVILNGKTLKGEMTTEAVDAATAEKVFKQLANTNGVDGEWTYDDATKTFTVTD,1.150553,"L5V, T16M, Y33L, D36T, E56D",5
MEYKLILNGKTLKGETTTEATDAATAEKVAKQYANDNGVDGEWTYDDATKTITVTV,-3.4793098,"Q2E, V21T, F30A, F52I, E56V",5
MQKKLILNDKTLKGETTTEDVDAATAEKVFKQYAGDNGVDGEWTYDDATKTFTVIE,-5.4190598,"Y3K, G9D, A20D, N35G, T55I",5
MQYKLILNGKTLKGETTANAVDAASAEKVFKQYAEDNGVDGEWTYDGATKTFTVTE,-0.10531816,"T18A, E19N, T25S, N35E, D47G",5
MQYKLILEGKTLKGETTTKAVDAPTAEKVFKQYANDNGVDIEWNYDDATKTFTVTE,-0.79465896,"N8E, E19K, A24P, G41I, T44N",5
MQYKLILNGKTLKGETTTPAVDAATAVKLFKQYANDNGVDGEWTYDDATKEFTVAE,-2.4675777,"E19P, E27V, V29L, T51E, T55A",5
MQFKLILNGKKLKTETTTEAVDAATAEKVFAQYANDNGVDGEWTYDDANKTFTVTE,-4.0493927,"Y3F, T11K, G14T, K31A, T49N",5
MQYKLILNGKELKEETATEAVDAATAIKVFKQYANENGVDGEWTYDDATKTFTVTE,-4.0202093,"T11E, G14E, T17A, E27I, D36E",5
MQYKLIVNGKTLKGETTTEFKDKATAEKVFKQYANDNGVDGEWTYDPATKTFTVTE,0.117052995,"L7V, A20F, V21K, A23K, D47P",5
MTYKLILNGKTLKGETTTNATDAATAEKVFKQYANKNGVDGPWTYDDATKTFTVTE,4.006429,"Q2T, E19N, V21T, D36K, E42P",5
MKYKLILNGKDLKGNTTTEAVDAATAEKVFKQYENDNGVDGEWNYDDATKTFTVTE,-3.1542914,"Q2K, T11D, E15N, A34E, T44N",5
MQYKLILNGKTLAGETTTEAVDEATAEKVFKQAANDGGVDGEWTYDDATKTFTVVE,-1.4874537,"K13A, A23E, Y33A, N37G, T55V",5
MQYKLILNGKALKGETTYEAPDAATAEKVFKQYANDNGVDGEWTLDDATKTFTITE,-0.12097059,"T11A, T18Y, V21P, Y45L, V54I",5
MSYKLILNGKTLKGETTTEAVDAAKAEKVFYQYVNDNGVDGEWRYDDATKTFTVTE,-3.7747965,"Q2S, T25K, K31Y, A34V, T44R",5
MQYKLILNGKTLKGEATTEAVSAATAEKVFKQYANDNGFDGEWTYDDATNTFTITE,0.5034767,"T16A, D22S, V39F, K50N, V54I",5
MPYKLILNGKTLKGETTTEAVDAATAEKVFAQGANDNGLDPEWTYDDATKTFTVTE,-6.066052,"Q2P, K31A, Y33G, V39L, G41P",5
MQYKLILNGKTLKGETTTEAVDAATAEKVFKQAAADNQYDGEWEYDDATKTFTVTE,-5.2881017,"Y33A, N35A, G38Q, V39Y, T44E",5
MQYKLILNGKTLKGETTTEAVDAETAKKVFKQYENDHGVDGEWEYDDATKTFTVTE,-5.088463,"A24E, E27K, A34E, N37H, T44E",5
MQYKLILNGKTLKGETLTEAVDAATAEKVAKQYANDNTEDGEWTYDDATTTFTVTE,-3.609406,"T17L, F30A, G38T, V39E, K50T",5
MKYKLYLNGKTLKGTTTTEAVDRATAEKVFKQYCNDNGVDGEWTYDDATKTFTVTE,1.5661288,"Q2K, I6Y, E15T, A23R, A34C",5
MQYKLILNGKTLKGEITTEAVDAATAEKVFKQYANHNGVDSEWTYDDATDTITVTE,-4.7353115,"T16I, D36H, G41S, K50D, F52I",5
MQYTHILNGKTLKGETTIEAVDAATAEKVFKQYANDNGVSGEWKYDDATKTFTVTE,1.6718394,"K4T, L5H, T18I, D40S, T44K",5
MQYKLILNGKTLKGETTTEAVDKATAEKVFKQYAKDNGVDLEWTYDDATLTFTVTI,-5.468932,"A23K, N35K, G41L, K50L, E56I",5
MKYKLIVNNKTGKGETTTEAVDAATAEKVFKQYANDNGVDGEWTYDPATKTFTVTE,1.6456445,"Q2K, L7V, G9N, L12G, D47P",5
MQYKLILNGVTLKGETTTEAVDAATAEKLFKQYINDNGVDGEITYNDATKTFTVTE,-4.259121,"K10V, V29L, A34I, W43I, D46N",5
MQYKLIFNGKTLKGDTTTEAVDAAEAEKVFKQYANVNGVDGEWTWDDATKTFTVTE,1.8146819,"L7F, E15D, T25E, D36V, Y45W",5
MQYKLILEGKTLKGETTTEAVDAATAEKVFKQFANDNDVDGEWTYNDATKTFTVTV,2.2808292,"N8E, Y33F, G38D, D46N, E56V",5
MQYKLILNGKTLKGVTTTEAVDAATAEKVFKQYAQDNGVTGEWTYDDATKTFTVKD,-2.425792,"E15V, N35Q, D40T, T55K, E56D",5
MQYKFILNGKELKGLTTDEAVDAATAEKVFKQYANDNGVDGEWDYDDATKTFTVTE,-0.58205616,"L5F, T11E, E15L, T18D, T44D",5
MQYKLILNGKELGGETTTEAVDAATAEKVFKQYANDNGVDGEWEWDQATKTFTVTE,3.0689433,"T11E, K13G, T44E, Y45W, D47Q",5
MQYKLINNGKTLKGEVTTGAVDAATAEKVFKQWANDNGVDGEWTVDDATKTFTVTE,-0.9959964,"L7N, T16V, E19G, Y33W, Y45V",5
MQYKLILNEKTLKGETTHEAVDAATAESVFKQYANDNGVDGEITYDDATDTFTVTE,-5.181171,"G9E, T18H, K28S, W43I, K50D",5
MQYNLILNGKALKGETTTEASAAATAEKVFKQYANDNGVDGEWTFDDATKTFTVTE,2.2927535,"K4N, T11A, V21S, D22A, Y45F",5
MQYKIILNGKTLKGETTTEAVDAATAIKVFKQYANDNGVVHEWTYDEATKTFTVTE,-5.5880594,"L5I, E27I, D40V, G41H, D47E",5
MQYKLILNGKTLKGETTTEAVDAATAIKVFKQYAIDNGVDGEWTYSDASKTFTKTE,-5.119105,"E27I, N35I, D46S, T49S, V54K",5
MTYKLILNGKTLKGETTVSAVDTATAEEVFKQYANDNGVDGEWTYDDATKTFTVTE,-1.8304154,"Q2T, T18V, E19S, A23T, K28E",5
MQYQLILDGKTLKGETTTEAVDATTAEKMFKQYANDNGVDGVWTYDDATKTFTVTE,5.103473,"K4Q, N8D, A24T, V29M, E42V",5
MQYKFILNYKTLTGETTTEAVDAATAEKVFKQYANDNGVDGEVTYDDETKTFTVTE,-4.03785,"L5F, G9Y, K13T, W43V, A48E",5
MQYKLVLNGKTLKGQYTTEAKDAATAEKVAKQYANDNGVDGEWTYDDATKTFTVTE,0.8615213,"I6V, E15Q, T16Y, V21K, F30A",5
MQYKLIDNGKTLKGETTTEAVDAATAEKSFKQYANDNGVDGKYTYDDATKTFTVIE,-4.7981744,"L7D, V29S, E42K, W43Y, T55I",5
MQHKLILNKKTLKGETTTEAVDQATAEKVFKQYANDNGVDGETTYDPATKTFTVTE,-5.2517834,"Y3H, G9K, A23Q, W43T, D47P",5
MQYKLIKNGKTLYGETTTEATDAATAEKVFKQYINDNKVDGEWTYDDATKTFTVTE,-2.6163893,"L7K, K13Y, V21T, A34I, G38K",5
MQYKNILNGKTYKGATTTEAVDADTAEKVFKQYANDNGWDGEWTYDDATKTFTVTE,-4.1296225,"L5N, L12Y, E15A, A24D, V39W",5
MKYKLILNGKTLKGETTPEAVDAATAEKVFKQYANDNGVDVEITYDDATKTFTATE,-5.0016427,"Q2K, T18P, G41V, W43I, V54A",5
MQYKLIANGKTLKGEDITEAVDAATAEKVIKNYANDNGVDGEWTYDDATKTFTVTE,-0.3767084,"L7A, T16D, T17I, F30I, Q32N",5
MQYKLILNGKTLKGETYTEATDKATAEKVFKQYANDNGYDGEWTYDDATKTFTVIE,-2.405137,"T17Y, V21T, A23K, V39Y, T55I",5
MQYKVILNGKTLKGETITEAVDAATAERVFKQYANDNGVDGEWTYDAATKKFTVTE,2.7940412,"L5V, T17I, K28R, D47A, T51K",5
MQYKLILNGKTLKGETTTEAVSAATAEKVFKQIAADQGVDGEWVYDDATKTFTVTE,-3.811075,"D22S, Y33I, N35A, N37Q, T44V",5
MQYKLILNGKTLKIETTTEAVDAATAEANFKQYANVNGVDGEPTYDDATKTFTVTE,-5.576945,"G14I, K28A, V29N, D36V, W43P",5
MQYKLIHNGKTLKSEITTEAVDAATAEKVFKDYANDNGVTGEWTYDDATKTFTVTE,-3.1714308,"L7H, G14S, T16I, Q32D, D40T",5
MQYKVILNGKELEGETTTEAVDAKTAEKVFKQYANDLGVDGEWTYDDATKTFTVTE,-1.5614337,"L5V, T11E, K13E, A24K, N37L",5
MQYKLILNGKTLKGEGLTEAVDAATAEKVFKQYANDNGVDGEWTWDAATKTFTVEE,3.11369,"T16G, T17L, Y45W, D47A, T55E",5
MQYKLILNGKTIKGETTTEAVDYATAEKVFRQYAKDNGVDGEYTYDDATKTFTVTE,-6.481577,"L12I, A23Y, K31R, N35K, W43Y",5
MQYKLILNGKTLKGETTTEAVSAAGAEKQFKQYANDNGVDGEWTYDDATKTWTVTA,-2.2753298,"D22S, T25G, V29Q, F52W, E56A",5
MQYKYILNDKTLPGTTTTEAVDAATAEKVFKQYANDNGVDGEWVYDDATKTFTVTE,-3.124096,"L5Y, G9D, K13P, E15T, T44V",5
MQYKLILTGKVLKGETTTEAVDVATAEKVFKQYANENGLDGEWTYDDATKTFTVTE,0.9410043,"N8T, T11V, A23V, D36E, V39L",5
MQYKLIKNGKTLKGETTTEAVDAATAEKVFKDYANDNGGDGEWTYDDATYTVTVTE,-5.7310276,"L7K, Q32D, V39G, K50Y, F52V",5
MQYKLILNGKTLKGETTTEAEDAATAEKVFKKYKNDNGVDGEWIYDDADKTFTVTE,-2.764993,"V21E, Q32K, A34K, T44I, T49D",5
MQYKLILNGFTLKVETTTEAVDAATAEKVFKQYHNDNGVDGAVTYDDATKTFTVTE,-4.9334826,"K10F, G14V, A34H, E42A, W43V",5
MAYKLILNGKTLKGETTTEAVDAATKEKVFKGYANDNGVDGEWTYDDATKTVTITE,-4.6019115,"Q2A, A26K, Q32G, F52V, V54I",5
MQYKLILNGKTLKGEDTTEATDAETAEKVFKQYANDNGVDTGWTYDDATKTFTVTE,-2.2355435,"T16D, V21T, A24E, G41T, E42G",5
MQYKIILNGKVLKGDTTEEAVDAATAEKVFKQYARDNGVDGEWTYDDATKTFTVTE,-4.9741397,"L5I, T11V, E15D, T18E, N35R",5
MNYKLIANGKILKGETTQEAVDAATAEKVFKQYANDNGADGEWTYDDATKTFTVTE,-0.855486,"Q2N, L7A, T11I, T18Q, V39A",5
MQYKLELNGKTLKGETTTEEVDAATAEKVFKQYANDNDVDGEWVYDDAAKTFTVTE,0.95997,"I6E, A20E, G38D, T44V, T49A",5
MQYKLILNGKTLKGETTTDAVDAATAEKLFKQYANENGVDGEITYDDATKTFTPTE,-4.680018,"E19D, V29L, D36E, W43I, V54P",5
MQYKLILNGKTIKGETTTEAVDAANAEKVFKQYFNDNGVDIEWTYKDATKTFTVTE,-5.8307395,"L12I, T25N, A34F, G41I, D46K",5
MQYKLILNGMTLPGETTTEAVDAATAKKVFKQYANDNKVDAEWTYDDATKTFTVTE,-5.775962,"K10M, K13P, E27K, G38K, G41A",5
MQYKIILNGKTIGGETTTEAVDKATAAKVFKQYANDNGVDGEWTYDDATKTFTVTE,-6.053604,"L5I, L12I, K13G, A23K, E27A",5
MTYKLILNGKTLKGETITEAVDAATAEKVFKQYANDNGVDGKWTYDDDTKTVTVTE,0.23177904,"Q2T, T17I, E42K, A48D, F52V",5
MQKKLTLDGKTLKGETTTEAVDAATAEKVFKQYANDLGVDGEWTYDDATKTVTVTE,-5.076225,"Y3K, I6T, N8D, N37L, F52V",5
MQYKIILNGKTLKGETFTEAVDAATLEKVFKQYAIDNGVDGEWTYDDATKTITVTE,-5.808732,"L5I, T17F, A26L, N35I, F52I",5
MQAKLILNGKTLKGETTTEAVDAATAEKVAKQYANDHGVDGEWTFDDATKTFTMTE,-2.3375223,"Y3A, F30A, N37H, Y45F, V54M",5
MQYKLILNENTLKGETTLEAKDAATAEKVFKQYAADNGVDGEWTYDDATKTFTVTE,-3.5363395,"G9E, K10N, T18L, V21K, N35A",5
MQYKLILNGKTLKPTTTTEAVDKATAEKVFKQYAIDNGVDMEWTYDDATKTFTVTE,-5.47524,"G14P, E15T, A23K, N35I, G41M",5
MQYKLINNGKVLKGETTFEAVDAATAEMVFKQYANDNGVDGEWTYDDATKTFVVTE,-1.5781971,"L7N, T11V, T18F, K28M, T53V",5
MQYKLILGGKGLKGETTVEAVDAATAEKVFKTYANDNGVDGEWYYDDATKTFTVTE,1.5009774,"N8G, T11G, T18V, Q32T, T44Y",5
MQYKLILNGKTLKGEGTTVAVDAATAEKVFKQYANDYGVDGELTYDDQTKTFTVTE,-4.07105,"T16G, E19V, N37Y, W43L, A48Q",5
MQYKLILNGKTLKGEGTTEAVDAATAEKVFKQYANDNGFDVEWTYDDGTKTFTVTV,-3.8307343,"T16G, V39F, G41V, A48G, E56V",5
MQYKLILNGKTLKGETTVEAVEAATAEKVFKQYANDNGVEGTWTYDDATKTWTVTE,-0.6958889,"T18V, D22E, D40E, E42T, F52W",5
MQYKLILNGKTLKGETTAEAVDAATAEKVFKQTANDNGVDGEWTYDDATKQFTVVK,0.24723008,"T18A, Y33T, T51Q, T55V, E56K",5
MQYKLILNGKTLKGETTTEAEDAATAEKVAKQYANDNGVRGEWDYDDATKTFKVTE,0.9571928,"V21E, F30A, D40R, T44D, T53K",5
MQNKLILDGKTLKGETTTEAVDAATAEKVFKKYANDNGVDGEWTFDDATKTFTVYE,0.10669988,"Y3N, N8D, Q32K, Y45F, T55Y",5
MQYKLILNGKTLKGETTTEAEDAATAEKVFKQYANDNGVVMVWTYDDATKTFTVTA,-1.3486412,"V21E, D40V, G41M, E42V, E56A",5
MQFKIILNGKTLKGETTTEAVDAATAEKVAEQYANDNGVDGEWTYDDATKTFSVTE,-5.2476954,"Y3F, L5I, F30A, K31E, T53S",5
MQYKKILNGKTLKIETTTEAVDAATAEKVRKKYANDNGVDVEWTYDDATKTFTVTE,-5.9168286,"L5K, G14I, F30R, Q32K, G41V",5
MSYQLILNGKTLKGETGTEAVDAATAEKVFKQYFNDNGVDGGWTYDDATKTFTVTE,0.0063726157,"Q2S, K4Q, T17G, A34F, E42G",5
MQYKLILNGKTLKGETTTEAVDVATAEKVFSQYAEPNGVDGEWTYDDATKTFTVTG,-6.205826,"A23V, K31S, N35E, D36P, E56G",5
MSYKLILNGKTLKGETTTEAVDAATAEKVFKQYANDNGVDGYFVYDDATKTFTITE,-2.1261907,"Q2S, E42Y, W43F, T44V, V54I",5
MQYKLILNGKTLKGEDTTEAVDAATAAKVFKAYANDNGVDGEVTYDDATKTFTVTL,-6.3624945,"T16D, E27A, Q32A, W43V, E56L",5
MQYKLILNGKTLKGETTTEAQDAATAEKVFKQYANDNTADEEWTYDDATKTFTVQE,-5.5181804,"V21Q, G38T, V39A, G41E, T55Q",5
MQYKVILNGKTLKGELTTEAVDAATAEKVFKQYCNDNGIDGEWTYDGATKTFTVTE,3.4400506,"L5V, T16L, A34C, V39I, D47G",5
MQYKLVLNGKTLKGELTTEQVDAATAEKVFKQYANDNGVDGEWTYDPTTKTFTVTE,3.9793684,"I6V, T16L, A20Q, D47P, A48T",5
MQYKLILNGKTLDGETTTEAVDAANAEKVFKQYANDLGVDGEVTYDDATKTFTKTE,-5.0635176,"K13D, T25N, N37L, W43V, V54K",5
MQYKLILNGKTLKGATTTEAVDAATAEKVVKQLATDNGVDGEWTYDDATKEFTVTE,-0.9665915,"E15A, F30V, Y33L, N35T, T51E",5
MQYKLILNGKTLKGETTTEAVDAVAAEKVAKQYANDNGVDGDWTFDDATKTFTVTE,2.2543821,"A24V, T25A, F30A, E42D, Y45F",5
MQYKLILNGKTAKGENTTEAVDAATAEKVFQQYARDHGVDGEWTYDDATKTFTVTE,-5.960904,"L12A, T16N, K31Q, N35R, N37H",5
MQYTLILNGKTLKGEVTTEAVDAATAEKVFKQWANDNGVDGELTYDDATKTFTVKE,-3.3134663,"K4T, T16V, Y33W, W43L, T55K",5
MQYKLILNGKTLKGETETEAVTAAEAEKVFKQYANDNGVDGKATYDDATKTFTVTE,-3.0217009,"T17E, D22T, T25E, E42K, W43A",5
MQYKLKLNGKNLKGETTTEAVDAATAEKTFKQYANDNGVDGEWIYDDATKKFTVTE,2.6481543,"I6K, T11N, V29T, T44I, T51K",5
MQYSLILNGKTLKGETTTEAVDAATAEKVFKQYANAYGVDGGWTYDDETKTFTVTE,2.020633,"K4S, D36A, N37Y, E42G, A48E",5
MQYKYILNGGTGKGETTTEAVDAATATKVFKQYAEDNGVDGEWTYDDATKTFTVTE,-6.6860185,"L5Y, K10G, L12G, E27T, N35E",5
MQYRLILNGKTLKGETRTEAVDAATAEKVFKQYANDNTVDGEWTYDDATKTFELTE,1.8392621,"K4R, T17R, G38T, T53E, V54L",5
MQYKLILNGKTLKGETTTNAVDKDTAKKVFKQYADDNGVDGEWTYDDATKTFTVTE,-4.6646614,"E19N, A23K, A24D, E27K, N35D",5
MQYKLILNGKTLKGETTIEATDAATAEKVFKQYANDNYVDGDWTYDDATKTFTVKE,2.627036,"T18I, V21T, G38Y, E42D, T55K",5
MQYKPILNGKTLKGETTVEAVDAATAEKVFKQYAKDNGVDGEWTYDTATRTFTVTE,-4.653342,"L5P, T18V, N35K, D47T, K50R",5
MQYKLTLNGKTLKGETATEAVDAATAEKLFKQYVNDNGVDGEWTLDDATKTFTVTE,1.0219626,"I6T, T17A, V29L, A34V, Y45L",5
MQYKLILNGKTLKGETTTEAVDAATALKAFKQYANENGIDGEWTYDDITKTFTVTE,-1.7224107,"E27L, V29A, D36E, V39I, A48I",5
MQYKLILNGKTLKTETTTEAVSAATALKVFKEYANDNGVDGEWNYDDATKTFTVTE,-5.823767,"G14T, D22S, E27L, Q32E, T44N",5
MQYKLILNGKTLKGETTTEAVDAATAETTFKQYANDNGVDGEWTYDDDSKDFTVTE,1.3258933,"K28T, V29T, A48D, T49S, T51D",5
MQAALILNGKTLKGETRTEAVDAATAEKVFKQYLNDNGVDGEWTYDTATKTFTVTE,-0.93227744,"Y3A, K4A, T17R, A34L, D47T",5
MQYKLILNGKTLKGEDTTQAVDAATAEKVFKQYANDNGVDGEVTYDDATKTFSLTE,-4.194075,"T16D, E19Q, W43V, T53S, V54L",5
MQYKLILNGKTLIGETTTEAVDAATAEKVFKQYANDNGVDYEWTYDTATNTFTLTE,-1.8475296,"K13I, G41Y, D47T, K50N, V54L",5
MLYKLILDGKTLKGETTTEAVDAATAEKVFKQYINDNGVDGEWTYDDATMTFQVTE,0.62614846,"Q2L, N8D, A34I, K50M, T53Q",5
MQYKLILNGKTLSGETTTEAKDAATAEKVFKQYKNDDGVDGEWTYDDATKTFTVTD,-4.7308545,"K13S, V21K, A34K, N37D, E56D",5
MQYKLILNGKTIKGETTTEAVDAATAEGVFKQYVNDYGDDGEWTYDDATKTFTVTE,-5.973133,"L12I, K28G, A34V, N37Y, V39D",5
MQYKFMANGKTLKGETTTEAVDAATAEKAFKQYANDNGVDGEWTYDDATKTFTVTA,1.347019,"L5F, I6M, L7A, V29A, E56A",5
MQYKLIRNGKTLKGETTTEAVDAATVEEVFKQYANDNGADGEWTYDKATKTFTVTE,-5.5812383,"L7R, A26V, K28E, V39A, D47K",5
MQYTLILNGKTLAGETTTEAVDAATAEQVFSQYANDNGVDGEWTYDDITKTFTVTE,-5.0847535,"K4T, K13A, K28Q, K31S, A48I",5
MQYKLILNGKKLKGETTTEADDAATAEKVFKQYAAENGVDGEWTYDDETKTFTVTE,-1.9184428,"T11K, V21D, N35A, D36E, A48E",5
MQYKLILNGKTLKGETTIEAVDAEAAEKVFKQYANDNGVDGEWSYDDATKTFHVTE,4.7499766,"T18I, A24E, T25A, T44S, T53H",5
MTYKLILNGKTLKGETTKEAVTAATAEKVAKQYANDNGVDGEWTYDDATKTWTVTE,-3.1687994,"Q2T, T18K, D22T, F30A, F52W",5
MQYKVILNGVTLKGETTPEAVDAATAEKVFKQYANKNGVDGEWTYDDATKTFTVDE,-0.6530201,"L5V, K10V, T18P, D36K, T55D",5
MQYKLILNGKTLKGETTTELVDAATVEKVFKQYANDHGVDGEWTYDAATETFTVTE,0.45240235,"A20L, A26V, N37H, D47A, K50E",5
MQYKLILNGKTLKGETTYEFVDAATAEKVFKQYVNDEGVDGEWTYDDATKTFKVTE,-1.7688338,"T18Y, A20F, A34V, N37E, T53K",5
MQFKLILNGKTLKGETTTEAVDAATAEKVFKQWANDNGVDGEYTYDSATKQFTVTE,-1.0397323,"Y3F, Y33W, W43Y, D47S, T51Q",5
MQYKLILNGKTLKGETTTEAVDAATAEKVFEQYANDNMVDGELTYVDATKTFSVTE,-6.0708137,"K31E, G38M, W43L, D46V, T53S",5
MQYKLILAGKTLPGETTTEAADKATAAKVFKQYANDNGVDGEWTYDDATKTFTVTE,-4.828119,"N8A, K13P, V21A, A23K, E27A",5
MQFKLILNGKTLKYETTTEAVSAATAEKVFKQYANDNHVDGEWKYDDATKTFTVTE,1.4237309,"Y3F, G14Y, D22S, G38H, T44K",5
MQYKLILNGKTLKGETTTEAVDAATAQKVGKQYKNDNGVDGEWTYDNATKTFTVVE,-5.856113,"E27Q, F30G, A34K, D47N, T55V",5
MQYKLILNGKPLKGEETTEAVDAETAEKVFKQYANENGVDGEWTYDDATKTFTVTV,2.0984626,"T11P, T16E, A24E, D36E, E56V",5
MQKKLILNGKLLMGETTTEAVDAATAEKVLKQYANDNGVDGEWTYDDATKTFTVTY,-3.7380571,"Y3K, T11L, K13M, F30L, E56Y",5
MQYKLILNGKTLKGATTTYAVDAATAEKVFKQYANDYGVDGEWTYDDATKTFGVVE,1.6792645,"E15A, E19Y, N37Y, T53G, T55V",5
MQYKLILNGKTLAGETTTEAVDDATAEKVFKQYANANGKPGEWTYDDATKTFTVTE,-2.3259828,"K13A, A23D, D36A, V39K, D40P",5
MDWKLILNGKTLKGETTTEAVDAATAEKVFKQYANDNGEVGEWTYDDATSTFTVTE,0.70164317,"Q2D, Y3W, V39E, D40V, K50S",5
MQYKLILNGKTLHGETTTEAVDAAAAEKVFTQYAIVNGVDGEWTYDDATKTFTVTE,-5.1295443,"K13H, T25A, K31T, N35I, D36V",5
MQYKLIRNGKTLKGETTTDAVDAATADKVFKQLANDNGVDTEWTYDDATKTFTVTE,-5.9981337,"L7R, E19D, E27D, Y33L, G41T",5
MQYKLILNGKTYKGETTTEIVDAATAEKVFKQWANDNGVDGEWTYDDAKKTFTVTK,-1.5131032,"L12Y, A20I, Y33W, T49K, E56K",5
MQYKLILNGKTEKGETTTEAKDAQTAEKIFKQYANENGVDGEWTYDDATKTFTVTE,3.4419804,"L12E, V21K, A24Q, V29I, D36E",5
MQYKLILAGTTLKGETTTEAVDAATALKVFKQLANDNGVDGEWTYDDDTKTFTVTE,-3.2573607,"N8A, K10T, E27L, Y33L, A48D",5
MQYKIILNGKTLKGETTTAAVDAATVEKVAKQYANDNGVDGEWTYDDQTKTFTVTE,-1.1736454,"L5I, E19A, A26V, F30A, A48Q",5
MQYKLILNGKTLKGETTIAAVDAATAEKVCKQYLNDNGVDGEWTYDDATRTFTVTE,-0.16654342,"T18I, E19A, F30C, A34L, K50R",5
MQYDLILDGKTLKGYTTTEAVDAATAEKVFKQYINDNGVDGEATYDDATKTFTVTE,-4.882066,"K4D, N8D, E15Y, A34I, W43A",5
MQYKLILNGKTLKGETTTEAVDLATAEKVFKQMAMDNGVDGEWTYDDATKEFTVTQ,-4.631744,"A23L, Y33M, N35M, T51E, E56Q",5
MQYKLILNGETLKGFITTEAVDAATAEKVFKQYANMNGVDGEWTYDDATKTFTVTK,2.3826947,"K10E, E15F, T16I, D36M, E56K",5
MQYKLILNGETLKGETTTEAVDAATAEKVFKQYANDNGLDGEWTCDDATKELTVTE,-0.026896775,"K10E, V39L, Y45C, T51E, F52L",5
MQYKVILNGKTKKGETTTEAVDAATAEKVAKQYANDNGVDGFATYDDATKTFTVTE,-5.5638433,"L5V, L12K, F30A, E42F, W43A",5
MQYKLILNGKTLKQETTTEAVDAATAEKVFKGYANDQGVVGEWTYDDAKKTFTVTE,2.1610618,"G14Q, Q32G, N37Q, D40V, T49K",5
MQYSLVLNGQTIKGETTTEAVDAATAEKVFKQYANDNGVDGEWTYDDGTKTFTVTE,2.542517,"K4S, I6V, K10Q, L12I, A48G",5
MQYKLILNGQTLKGETTTEAVDAATAEKVFKQYAVDAFVDGTWTYDDATKTFTVTE,-2.6408243,"K10Q, N35V, N37A, G38F, E42T",5
MQYKLILNGKTVKGETTTEAVDAATAEKIFDQYANENGVTGEWTYDDATKTFTVTE,-2.7377822,"L12V, V29I, K31D, D36E, D40T",5
MQYKLILEGLTLKGETTTEAVDKATAEKVFKQYANDNGVDGEWTYDDALKTFTLTE,-0.29928243,"N8E, K10L, A23K, T49L, V54L",5
MQYKLILNGKQLKGETTTEADDAATAEKVFKDYANDNGFDGEWTYDDATKTFTVTD,-3.4715064,"T11Q, V21D, Q32D, V39F, E56D",5
MQYKLILNGKTLKEETTTEAVDAATAEKVFQQYANDKGVDGEWVYDDATKTFTVTK,-5.6217227,"G14E, K31Q, N37K, T44V, E56K",5
MQYKLILNGKTLKDGTTFEAVDAATAEKVAKQYANDNGVDGEWTYDDALKTFTVTE,-1.2332557,"G14D, E15G, T18F, F30A, T49L",5
MQYKLILNGKTTKGETTTEFVDAATAEKVFKDYANDNGVDGEWTIDDATKTFVVTE,-4.1915493,"L12T, A20F, Q32D, Y45I, T53V",5
MQYKLIINGKTLKGDTTTEYVDAATAEKVFKQYANDNGVDGCWTYDDATKTTTVTE,-2.4328775,"L7I, E15D, A20Y, E42C, F52T",5
MQYKLFFNGKTLKGETTTEADDAVTAEKVFKQYANDNGVDGEWTYDDATKTFTVYE,2.3591344,"I6F, L7F, V21D, A24V, T55Y",5
MQYKIILNGKTLKGETTIEAQDAETAEKVFKQYANDQGVDGEWTYDDATKTFTVTE,1.9162791,"L5I, T18I, V21Q, A24E, N37Q",5
MQYKFILNGKQLKGETTTEAVDAATAEKVFKQLAGMNGVDGEWTYDDATKTFTVTE,-1.5639435,"L5F, T11Q, Y33L, N35G, D36M",5
MQYKLIFNGKELHGETTTEAVNAATAEKVFKQYVNDNGVDGEWTYDDATKTFTVTE,-0.58071554,"L7F, T11E, K13H, D22N, A34V",5
MQYKLILNGKTLKGETTGDAVDAAAAVDVFKQYANDNGVDGEWTYDDATKTFTVTE,-5.3944077,"T18G, E19D, T25A, E27V, K28D",5
MQYKLIMNGKPLSGETTTEAVDEATAEKVAKQYANDNGVDGEWTYDDATKTFTVTE,-2.66672,"L7M, T11P, K13S, A23E, F30A",5
MQYKLILNGNTTKGETVTEAVDAATAEKVFKQYATDNGVDGEWTYDGATKTFTVTE,-0.07138686,"K10N, L12T, T17V, N35T, D47G",5
MQYGLILNGKTKKGETTTEKVDLATAEKVFKQYANDNGVDGEWTYDDATNTFTVTE,-1.3530304,"K4G, L12K, A20K, A23L, K50N",5
MQYKLILNGKNLKGYTKQEIVDAATAEKVFKQYANDNGVDGEWTYDDATKTFTVTE,1.2920831,"T11N, E15Y, T17K, T18Q, A20I",5
MQYKLILNGKTLKGETTTEAVDAATAEKVFKQLVNENGFDGEWTYDDATKTFTRTE,-4.7402306,"Y33L, A34V, D36E, V39F, V54R",5
MQYELILNGKTLKGETTTEAVDAANAFYVFKQYANDNGVDGEWTYDDATKTFTVIE,-5.495512,"K4E, T25N, E27F, K28Y, T55I",5
MQYKLILNGTTLKGETTTEAVDAATAEKVFKQYANANAVDGAWVYDDATKTFTVTE,3.7474747,"K10T, D36A, G38A, E42A, T44V",5
MQYKLILNGKTLKGEKTTEAVDAATAEKVFKQYANDNGVDIETTYDDATKTHTVTK,-6.277195,"T16K, G41I, W43T, F52H, E56K",5
MQYKVILNGKTLKGETTTSAVDAATAEKVFQQYANDNGVDGVGTYDDATKTFTVTE,-5.323995,"L5V, E19S, K31Q, E42V, W43G",5
MQYKLIKNGKTLKSETTTEAVDAATAEKVFKTSANDNGVDGEWTYDDATKTFTVTV,-2.5616689,"L7K, G14S, Q32T, Y33S, E56V",5
MDYKLILNGKTLKGETTTEAVDKATAEKVAKQYANDNTVDGEWTYDDATKTFRVTE,-2.9515877,"Q2D, A23K, F30A, G38T, T53R",5
MQYKLILNGKTLKGETVEEAVDAATAEKVAKQYANDNGIDGEWTFDDATKTFTVTE,-0.08138467,"T17V, T18E, F30A, V39I, Y45F",5
MQYKLKLNGNTLKGETTTEAVDAAEAEKVAKQYANDNGVDGEWTYDDATKTITVTE,-2.3946948,"I6K, K10N, T25E, F30A, F52I",5
MQYKLILNGKKLKGETTTEAVDAATAEKVVKQYANDNGVLGEVTYDDGTKTFTVTE,-4.5819626,"T11K, F30V, D40L, W43V, A48G",5
MQYKLILDGKTLKGETTTEAVDAATAEKQFKQYANDNGVTGEWTYDDSTKTYTVTE,1.5805141,"N8D, V29Q, D40T, A48S, F52Y",5
MQYKLILNGKTTKGETTTEATDAATCEKVFEQYANDNGVDGEWTYDDATKTFTKTE,-5.336898,"L12T, V21T, A26C, K31E, V54K",5
MQYKLILNGKTLKGSTTTEAVDAKTAEKVFLQYANDNGVDGEWTYDDETQTFTVTE,-2.8384647,"E15S, A24K, K31L, A48E, K50Q",5
MQYKKILNGKTQKGETTTEAVAAATQEKVFKQYANDNGVDAEWTYDDATKTFTVTE,-5.8344803,"L5K, L12Q, D22A, A26Q, G41A",5
