Sequence,Score,Mutations,Number of Mutations
NDKFKLLAEKVEEIVAKNARAEIDYSDCPDEFRDPIMDTLMTDPVRLPSGTIMDRSTILRHLLNSPTNPFTRQPLTESMLEPVPELVEQIQAWMREKQSSDH,10.19599,"I1N, E2D, A28C, L36I, V52I, I57T, D68N, N71T, M74P, K87V",10
MENFKLLAEKVQEIVAKNARAEIDYSDAPDEFRDPLMDTIMTNPVRLPDGTIMDRSIILRHLLNSPTNPFTRQMLTESMLEPVPQLKEQIQAWMREKQSSDH,5.155302,"I1M, K3N, E12Q, L40I, D43N, S49D, V52I, D68N, N71T, E85Q",10
IEKFKLLAEKVEEIVAKNAVAEIDYSDAPDEFRDPLMDTLMTDPVRLPSGTNMDRSIILLHLLNSPTNPFTRQMLTEEMLEPVPELKDQILRWMRSKQSSDH,5.7195387,"R20V, V52N, R60L, D68N, N71T, S78E, E88D, Q91L, A92R, E96S",10
YEKFKLLAEKVEEIVAKNARAEISYSDVPDEFRDPLMDTLMEDPVRLPDGTVMDRSIILRHLLNSPTNPFTRQMLTEDMLEPVPELKEQIQAWMRAKRSSDH,6.5328875,"I1Y, D24S, A28V, T42E, S49D, D68N, N71T, S78D, E96A, Q98R",10
IEKFKLLAEKLHEIVAKNARMEIDHSDAPDEFRDPLMDTLMLDPVRLPSGTVMDRSIILRHLLNSNTNPFTRQELTESMLEPNPELKEQIQAWMREKQSSDH,5.60623,"V11L, E12H, A21M, Y25H, T42L, P66N, D68N, N71T, M74E, V83N",10
IEKFKKTAEKVESIVAKNAVAEIDYSDAPDEFRDPLMDTLMTDPVRLPSGTVMDRSIILRHLLNSPTNPFTRTILHESMLEPVPELKEQIQAWRREKQSSDH,5.0192375,"L6K, L7T, E13S, R20V, D68N, N71T, Q73T, M74I, T76H, M94R",10
EEKFKLLAEKVEEIVAKNARAEIDYSDAPDEFRDPLMHTLMTDPVRLPSGTVMDRSIILRHLLNEPTNPFTRRMLTDSKLEPVPELKEQIRAWMAEKQSSDH,0.6368129,"I1E, D38H, S65E, D68N, N71T, Q73R, E77D, M79K, Q91R, R95A",10
IEKFKLLEEKVEEAVAKNARAEIDYSDAPDEFRDPLMDTLMTDPVKLPSGTVMDRSIILRHLLNSDTNPFTRQMLTESFLEPVPELKQQISAWMREKQESDH,4.5521708,"A8E, I14A, R46K, P66D, D68N, N71T, M79F, E88Q, Q91S, S99E",10
IEKFKLLAEKVEEITAKTARAEIDYSDAPDDFRDPLMDTLMTDPVRLPSGTVMDRSIILRHLLNSPTNPFTRQPLTESMLEPVVELKEQIMAWMREKQSVEH,5.867491,"V15T, N18T, E31D, D68N, N71T, M74P, P84V, Q91M, S100V, D101E",10
IEKFKLLEEKREEISAKNARAEIDYSDAPDEFRDPLMDTLMTDPVRLPSGTVMDRSIILRHLLLSPSNPFTREMLTESMLEPVPELKEQIQAWMEEKQSSTH,2.4608521,"A8E, V11R, V15S, N64L, T67S, D68N, N71T, Q73E, R95E, D101T",10
IEKFKLLAEKKEEIVAENARAEIVYSDAPDEFRDPLMDTLMTDPVRLPSGTVMDRSIIQRHLLNSPTNPFTRQMLTKSMLEPVLELKQQIQAWMREKQSSDD,3.9092185,"V11K, K17E, D24V, L59Q, D68N, N71T, E77K, P84L, E88Q, H102D",10
MEKFKLLMEKVEKIVAKNARMEIDDSDIPDEFRDPLMDTLMKDPVRLPSGTVMDRSIILRHLLNSPTNPFTRQMLTESMLEPVPELKEQIQAWMREKQSSDA,7.428041,"I1M, A8M, E13K, A21M, Y25D, A28I, T42K, D68N, N71T, H102A",10
IEKGKLNAEKVEEIVARRARAEIDYSDAPDEFRDPLMDTLMTDPVRLPSGTVMDRSIILRHLLNSDTNPFTRQMLTESMLEPNPELHEQIQAWVREKQSSDH,6.2305346,"F4G, L7N, K17R, N18R, P66D, D68N, N71T, V83N, K87H, M94V",10
IEKFKLDAEKVEEIVDKNARADIDYSDAPDEFRDPLMDTLMTDPLRLPSGTVMERSIILRHLLNSPTNPFTRQMLTESMLEPVPELKEQIWAWMRENQSSDR,3.6692996,"L7D, A16D, E22D, V45L, D54E, D68N, N71T, Q91W, K97N, H102R",10
IEKFKLLAEKVQEIVAKNRRAEIDYSDAPDEFRDPLMDTLMTDPVRLPSGFVMDRSIILRHLLNSPTNPFTRQPLTESMLEPVPNLKEQIQQWMREKQVKDH,6.725959,"E12Q, A19R, T51F, D68N, N71T, M74P, E85N, A92Q, S99V, S100K",10
IEQFKLLAEKVEEIVAKNVRADIDYSDAPDEFRDPISDTLMTDPVRLPSGTVMDRSDILRHLLNSPTNPFTRQMLTPSMLEPVPELKEQIQAWMREKQSFDH,5.5954647,"K3Q, A19V, E22D, L36I, M37S, I57D, D68N, N71T, E77P, S100F",10
IEKFRALAEKVEEIVAKNARADIDYSDAPDEFRDPLMDTLMTDPVRLPDGHVMDRVIILRHLLNSPTNPFTRQPLTESMLEPVPELKEQIQAWMREKKSSDH,6.5332484,"K5R, L6A, E22D, S49D, T51H, S56V, D68N, N71T, M74P, Q98K",10
IKKFKLLAQKVEEIVAKNARAEIDDSDAPDEFRDPLMFTLMTDPVRLPSGTVMDRSIILSHLLNSNTNPFTRQMLTESMLHPVPELKEQIQAWMDEKQSSDH,6.5766773,"E2K, E9Q, Y25D, D38F, R60S, P66N, D68N, N71T, E81H, R95D",10
IEKFKLLAEKVEETVDKDERAEIDYSDAPDEFRDPLMDTLMIDPVRLPSGTTMDRSIILNHLLNSPTNPFTRQMLTESMLEPVPELKEQIQAWMREKASSDH,6.236236,"I14T, A16D, N18D, A19E, T42I, V52T, R60N, D68N, N71T, Q98A",10
IYKFKLLNEKVEEVVAKNARAEIDDSEAPDEFRDPLMDTLMTDPVRIPSGTVMDRSIILRHLLNSPTNPFTRQMLTESMLEPVPELKEQIQCWMREKQSSLH,6.6397343,"E2Y, A8N, I14V, Y25D, D27E, L47I, D68N, N71T, A92C, D101L",10
MEKFKLLAEKVEEIVAKWADAEIDYGDAPDEFRDPIMDTLMTDPVRLPSGTVMDRSIILRHLLNDPTNPFTRQMLTEAMLLPVPELKEQIQAWMREKQSSDH,8.111689,"I1M, N18W, R20D, S26G, L36I, S65D, D68N, N71T, S78A, E81L",10
IEKFKLLAEKVEEIVRKNARAEIDYSDAPDEFRDPLMDTLMTDPVRLPSGNVMDRSTILRHLLNSGTNPFTRQMLTESMLEPVRELREKIQAWLREKQSSDH,6.6909394,"A16R, T51N, I57T, P66G, D68N, N71T, P84R, K87R, Q89K, M94L",10
IMKNKLLAEKVEEIVANNARAEIDYSDAPDEFKDPLTDTLMTDPVRLPSGTVMDRSIILRHLLNSPTNPFTREMLTESMLEPVPSLKEQIQAWMREKQSSPH,2.7126098,"E2M, F4N, K17N, R33K, M37T, D68N, N71T, Q73E, E85S, D101P",10
IEKFKLLAEKVEEIVAKRARDDIDYSDAPDEFRDPLMDTLMTDPVRLPSGTVVDRSVILRHLLNSPMNPFTRKMLTESMLEPVPELKEQIQAWLREKQSSDH,8.106045,"N18R, A21D, E22D, M53V, I57V, T67M, D68N, N71T, Q73K, M94L",10
IEKFKLLVEKVEEIVVKNARAEIDYSDAPDEFRDPLTDTLMPDPVRLPSGTVMDRSIILRHLLNSPTNPFTRQMMTKSMLEPVPELKEDIQRWMREKQSSDH,0.024389448,"A8V, A16V, M37T, T42P, D68N, N71T, L75M, E77K, Q89D, A92R",10
IEKFKDLAKKVEEEVAKNARAEIDYSDAPDEFRDPLMDTLMTDPVRLPSGTVMDRSLILRHLLNSPTNPFTREMLTESMLEPVPELKEQIQAWIREKTSRDH,3.5282803,"L6D, E9K, I14E, I57L, D68N, N71T, Q73E, M94I, Q98T, S100R",10
IEKFKLLAKKVEEIVADNERAEIDDYDAPDEFLDPLMDTLMTDPVRLPSGTVMDRSIILRHLLNSPTNPFTRQMLTESMLEPVPELKELIQAWMREKNSSDH,7.7979193,"E9K, K17D, A19E, Y25D, S26Y, R33L, D68N, N71T, Q89L, Q98N",10
IEKFKKLAEKVEEIVAKNARAEIGYSILPDEFRDPIMDTLMTDPVRLPSGHVMDRSIILRHLLNSPTNPFTRQMLTESMLEPVPELKEQIDAWMREKLSSDH,8.2750225,"L6K, D24G, D27I, A28L, L36I, T51H, D68N, N71T, Q91D, Q98L",10
IEKFKLLKEEVEEIRAKNANAEIDYSDAPDEFRDPLMYTLMNDPVRLPSGTVMDRSIILRHLLNSPTNPFTRQMLTDSMLLPVPELKEQIQAWMREKQSSDH,7.9223213,"A8K, K10E, V15R, R20N, D38Y, T42N, D68N, N71T, E77D, E81L",10
IEKDKLLAEKVEEIVAKNARADIDYSDAPDEFRDPLVDTLMDDPVRLPSGQVMDRSIIIRHLLSSNTNPFTRQMLTESMLEPVPELKEQIQAWMREKQSSDH,4.876728,"F4D, E22D, M37V, T42D, T51Q, L59I, N64S, P66N, D68N, N71T",10
IPAFKLLAEKVEEKVAKNARAEIDYSDAPDEFRDPLTDTLMTDPVRLPSGTVMDRSIILRHLLNSPTNPFTRQMLDESQLEPVPELKEQIQQWMREKQSKDH,4.2855825,"E2P, K3A, I14K, M37T, D68N, N71T, T76D, M79Q, A92Q, S100K",10
IEKFKLLAEKVEEIVAKNAMAEIDYKDAPDEFIDPLMDTLMEDPVRLPSGTVLDREIILRHLLNSPTNPFTRQMLTESMLEPVPELKEQIIAWMREKESSDH,9.295217,"R20M, S26K, R33I, T42E, M53L, S56E, D68N, N71T, Q91I, Q98E",10
ILAFKLLAEKVEEIVAKNTRPEIDYSDAPDEFRDPLMDTLMTDPVRLSSGTVMDRSIILRHLLNSNTNPFTRQMLTESMLEPVPELKDQIQAWLREKQSSDH,2.7317204,"E2L, K3A, A19T, A21P, P48S, P66N, D68N, N71T, E88D, M94L",10
IEKFKLLAEKVEEIVAKNADADIDYSDAPDEFRDPLSDTLMTDPVILPSGTVMDRSIILRHLLISPTNPFTRQMLTESILEPVPELKEQIEAYMREKQSSDH,0.8029672,"R20D, E22D, M37S, R46I, N64I, D68N, N71T, M79I, Q91E, W93Y",10
IEKFAAPAEKVEEIVAKTARAEIDYSDAPDEFRDPLMDTLMTDPVRLPSGTVMERSFITRHLLNSPTNPFTRQMLTESMLEPVPELKEQIQAWMREKDSSDH,5.2137766,"K5A, L6A, L7P, N18T, D54E, I57F, L59T, D68N, N71T, Q98D",10
IEKFKCLAEKVEEIVAKNARAEIDYSDAPDEFRDPLMDTLMTDPVRLPSGTVMDRSDILRHLLNSPTNPFTRQMLTESMLEPVPELHQRIVAWMQERQSSDH,5.3328857,"L6C, I57D, D68N, N71T, K87H, E88Q, Q89R, Q91V, R95Q, K97R",10
IEKFKLLAEKVEEIVAKNARMEIDYSDAPDEFRDPLMDTLMTDPVQLPSGTVMDREIILRHILNDPTNPFTRQMLTESMLEPNPELIEQIQAWMEEKQSSDH,3.6527247,"A21M, R46Q, S56E, L62I, S65D, D68N, N71T, V83N, K87I, R95E",10
IEKFKLLAEKVREIVAKNARAEIDDSDAPDEFRDPLMDTLMDDPVRLPSGYVMDRSIILRHLLNSPTNPKTRQMLTEDMLEPVPELKEQIQAFVREKQSSDH,8.224836,"E12R, Y25D, T42D, T51Y, D68N, F70K, N71T, S78D, W93F, M94V",10
IEKFKLMAEKVEEYVAKNARAEIDYSDAPDEFRDPLMDELMTDPVLLPSGTTMDRKIILRHLLNSPTNPFTRQMLTESMLEPDPELKEQIQAWMREKQLSDH,5.5449963,"L7M, I14Y, T39E, R46L, V52T, S56K, D68N, N71T, V83D, S99L",10
MAKFKLLAWKVEEIVNKNARAEIDNEDAPDEFRDPLMDTLMTDPVRLPSGTVMDRSIILRHLLNSPTNPFTRQMLTESMLEPVPELKEQIQAWMREKQSSCL,3.615602,"I1M, E2A, E9W, A16N, Y25N, S26E, D68N, N71T, D101C, H102L",10
IEKFKLKAEFVEEIVKKNARAEIDYSDAPDEFRDPLMDTLMTDPVRLPSGTVMDRSAILEHLLNSPTNPFTRQMLTESMLMPVPELKEQIQAWKREKQSSDN,6.2988853,"L7K, K10F, A16K, I57A, R60E, D68N, N71T, E81M, M94K, H102N",10
MEKMKLLAEKVEEIVAKNARADDDYSDAPDEFRDPLMDTLMTDPVRLPSGTIMDRSIILRHLVNSPTNPFTRQALTESMLEPKPELKEQIQAWMREKQSSDH,5.4654293,"I1M, F4M, E22D, I23D, V52I, L63V, D68N, N71T, M74A, V83K",10
IEKEKLLAEKVEEIVWKNARAEIDDSDAPDEFRDPLMFTLMTDPVRLPSGTVMDRSIILRHLLHSPTNPFTRQPLTESMLEPVPQLKEQIQAWMRIKQSSDH,6.701597,"F4E, A16W, Y25D, D38F, N64H, D68N, N71T, M74P, E85Q, E96I",10
IEKFKLLAEKVEEIVQKNARAEIDYSDAPDEFRDPLMDTLMTDPVLLPSGTIMDRSIILRHLMNSPTNPFTRQMLTEEMLEPVPELKEQIQAWMRENQSSPT,5.9368773,"A16Q, R46L, V52I, L63M, D68N, N71T, S78E, K97N, D101P, H102T",10
MQKFKLEAETVEEIVAKNARAEDDYSDAPDEFRDPLMDILMEDPVRLPSGTVMDRSIILRHLLNSPTNPFTRQMLTESMLEPVPELKEQIQAWMREKQSQDH,4.8103,"I1M, E2Q, L7E, K10T, I23D, T39I, T42E, D68N, N71T, S100Q",10
IEKFQLLAEKVEQIVAKNARAEIDYSDAPDEFRDPIMDSVMTDPVLLPSGTVMDREIILRHLLNSNTNPFTRQMLTESMLEPVPELKEQIQAWMREKQSSDH,6.7435884,"K5Q, E13Q, L36I, T39S, L40V, R46L, S56E, P66N, D68N, N71T",10
IEKFKLWAIKVEEMAAKNIRAEIDYSDAPDEFRDPLMDTLMTDPVRLPSGTVMDRSIILRHLLSSPTNPFTRQMLTESMLEPVPELKEQIQAWLREKQSIDH,5.156349,"L7W, E9I, I14M, V15A, A19I, N64S, D68N, N71T, M94L, S100I",10
IEKNKLLAKKIEEIVSSNARAEIDYSDAPPEFRDPLMDTLMTDPVRLPSGTVMDRSIILRHLLNSNTNPFTRQMLTESMLEPVPELKEQINAWMREKQSSDH,6.4073067,"F4N, E9K, V11I, A16S, K17S, D30P, P66N, D68N, N71T, Q91N",10
IEKFPLRAGKVEEAVAKNARADIDYSDAPDEFRDPLMYTLMTDPVRLPSGTVMDRSIIRRHLLNSPTNPFTRQMLTESMLEPVPELKEQIQAWMRENQSSDH,6.707645,"K5P, L7R, E9G, I14A, E22D, D38Y, L59R, D68N, N71T, K97N",10
IEKFSLLAEKVIEINAKNARAEIDYSDIPDEFRDPLSDTLMTDPVRLPDGTVMDRSIILRHLLNSPTNPVTRQMLTESMLEPVPELKEQIQAWMREKQSSSH,2.8338203,"K5S, E12I, V15N, A28I, M37S, S49D, D68N, F70V, N71T, D101S",10
IDKFKLLAEKVREIVAKNAGAEIDYSDAPDEFRDPLMDTLMTDPVRLPSGTVMNRSIILRHLLNSPTNPFTRQMLTESMLEPVPELKTMIQAWRREVQSSDH,2.8215277,"E2D, E12R, R20G, D54N, D68N, N71T, E88T, Q89M, M94R, K97V",10
IEKFKLLAEKVEDIVAKNADAEIDYSDNPDEFRDPLMDTVMTDPVRLPSGTVMDRSIILRHLLDSGTNPFTRQMLTESTLIPVPELKEQIQAWMREKQSSDH,2.688838,"E13D, R20D, A28N, L40V, N64D, P66G, D68N, N71T, M79T, E81I",10
TEKFELYAEKVEEIVAKNARAEIDYSDAPDEFRDPLTDELMTDPVRLPTGTVMDRSIILRHLLNSPTNPFTRQMLTESMLEPVPALKEQIQAWMRSKQSSDH,3.2822082,"I1T, K5E, L7Y, M37T, T39E, S49T, D68N, N71T, E85A, E96S",10
IEKLKLLAKKVEEIVAKQARAEIDYSDAPDEFRDKLMDTEMTDPVRLPSGTVMDRSIILRHLLNSNTNPFTRQMLTESMLEPRPELKEQIQDWMREKQSSDH,3.9341083,"F4L, E9K, N18Q, P35K, L40E, P66N, D68N, N71T, V83R, A92D",10
IEKFKLLAEKVEEIVAKNARAEIDYDDAPMEFRDPLTDTLMRDPVRIPSGTVMDRSIILRHLLNSDTNPFTRCMLTESMLEPVPELKEQIQAWMKEKQSSDH,3.3312557,"S26D, D30M, M37T, T42R, L47I, P66D, D68N, N71T, Q73C, R95K",10
KEKFKLLKEKVEEIVAHNARAEIDYSDAPDEFRDPLMDTLMTDPVRLPSGTVMDRSIILRHLLDSPTNPFTRQMLTESMLEPVPELKEQIQKWMREKESKDQ,4.6880374,"I1K, A8K, K17H, N64D, D68N, N71T, A92K, Q98E, S100K, H102Q",10
IEKLKLLAHKVEEIVAKIARAEIDYSDAPDEFRDPLMYTLMTDPVRLPSGTVMDRSVILRHLLNSPTNPFTRQMLTESELRPVPELKEQIQAWMREKQSSDE,6.1925483,"F4L, E9H, N18I, D38Y, I57V, D68N, N71T, M79E, E81R, H102E",10
IESFKLLAEKEEEIVHKNARAEIDYSDAPDEFRDPLMDTLMTDPVRLPSGTTMDRSIIRRHLLSSPTNPFTRQMLTEWMLEPVPELKEKIQAWMREKQSSDH,4.475211,"K3S, V11E, A16H, V52T, L59R, N64S, D68N, N71T, S78W, Q89K",10
IEKFKLLAEKVEDIVARNARAEIDYNDAPDEFRDPLMDTLMTDPVRLPSGQVVDRSIILRHLLTSPTNPFTRQMLTESMLEPNPELKEQIQAWMRENQSSDH,8.572528,"E13D, K17R, S26N, T51Q, M53V, N64T, D68N, N71T, V83N, K97N",10
IEKSKLLAYKVEEIVNKNQDAVIDYSDAPDEFRDPLMDTLMTDPVRLPSGTVMDRSIILRHLLNSPTNPFTRQMLRESMLEPVPELVEQIQAWMREKQSSDH,5.7211065,"F4S, E9Y, A16N, A19Q, R20D, E22V, D68N, N71T, T76R, K87V",10
IAKFVLLAEKVEEIVAKNARADIDYSDAPDEFRDPIMDTLMTDPVRLPTGTVMDRSIILRHLLNSPTNPFTRQMLTEEMLEPVPELKEQIQAWMRQKHSSDH,7.250306,"E2A, K5V, E22D, L36I, S49T, D68N, N71T, S78E, E96Q, Q98H",10
IEKFKELAEKVEEIVAKNARADIDYSDVPDEFRDPLMDTLMTDPVILQSGTVMDRSIILNHLSNNPTNPFTRQMLTESMLEPVPELKEQIQAWMREKQSSDH,3.301431,"L6E, E22D, A28V, R46I, P48Q, R60N, L63S, S65N, D68N, N71T",10
IEKEKLLAEKVESITIKNNRAEIDYSDAPDEFRDPLMYTLMTDPVRLPSGTVMDRSIIVRHLLNSPTNPFTRQMLTESMLEPVPELKEQIQAWMREKQSSFH,8.008368,"F4E, E13S, V15T, A16I, A19N, D38Y, L59V, D68N, N71T, D101F",10
IEKFKLLAEVVEEIVAKNARAEIDYSDAPDEFRDPLMFTLMTDPVMLPSGTVMDRSIILSHLLSSGTNPFTRFMLTESMLEPVPELKERIQAWMREKQSSDH,4.205859,"K10V, D38F, R46M, R60S, N64S, P66G, D68N, N71T, Q73F, Q89R",10
IEKFKLLAEKLEEIVAKFLRAEIDYSDAPEEFRDPLMDDLMTDPVRLPSGTVMDRSIILRHLLNHPTNPFTRQMLTESMIEPVPELKEQIQAWMREKQSEDH,5.8498597,"V11L, N18F, A19L, D30E, T39D, S65H, D68N, N71T, L80I, S100E",10
IEKFKSLAEKVEEIVAKNARAEIDYSEAPDEFRDPLTDTLMTDPVRLPSGTTMDRSIILRHLLNSPTNPFTRQMLTESMLSPVPELKERIQAWMRENQGSDH,5.5217876,"L6S, D27E, M37T, V52T, D68N, N71T, E81S, Q89R, K97N, S99G",10
IEKFNLLVEKVEEIVAKNARAEIDYSDAPDEFRDPIMDTLMTDPVRLPSGTTMDRSIIQRHLFNSPTNPFTRRMLTESMLEPVPELKEQIQAWMRQKQSSDH,6.8199267,"K5N, A8V, L36I, V52T, L59Q, L63F, D68N, N71T, Q73R, E96Q",10
IDKWKLLAEKVEEIVAKNARADIDYSDAPDEFRDPLTDTLMKDPVRLPSGTVMDRNIILEHLLNSPTNPFTRQMLTESMLEPVPELKEQIQAWMREKQSSDD,4.4902925,"E2D, F4W, E22D, M37T, T42K, S56N, R60E, D68N, N71T, H102D",10
IEKFKELAEKVEEIVAKNARAEIDYSDAPDEFRDPLMYNLMTEPVRLPSGTVMDRSIILRHLLNSNTNPFTRQMLTEDMLEPVPELKEQIQAWMREKQLSNH,6.512516,"L6E, D38Y, T39N, D43E, P66N, D68N, N71T, S78D, S99L, D101N",10
IEKFKLLAEKFEEIVAKRARADIDYSDAPDEFRDPLMDEIMTDPVRLPSGTVMDRSTILRHLLNSPTNPLTRQMLTESMLEPVTELKEQIQAWMREKQSSDH,2.505259,"V11F, N18R, E22D, T39E, L40I, I57T, D68N, F70L, N71T, P84T",10
IEKFKALAEKVEKIVAKNARAEEDYSDAPDEFRDPLMDELMTDPVRLPSGTVMDRSIILRHLLNSPTNPFTRQMLTESMLEPVPELKTQIQAWMEENGSSDH,6.0811033,"L6A, E13K, I23E, T39E, D68N, N71T, E88T, R95E, K97N, Q98G",10
IEKFKLLAEKVEEIVAKNARAEIDDSDAPDEFLDPLMDTLMTDPVRLPSGTVMDRSIILSHLLNSPTNPFTRQPLRESMLEPVPELKKQIQAWMRENQSSDT,7.7751627,"Y25D, R33L, R60S, D68N, N71T, M74P, T76R, E88K, K97N, H102T",10
IEKFKLLAEKVEEIVIKNARAEIDDSNIPDEFRDPLMDELMTDPVRLPSGTVIDRSIILRHLLNSPTNPFTRQMLTESMLEPVPELKEQIQAWMEEWQSSDH,9.726109,"A16I, Y25D, D27N, A28I, T39E, M53I, D68N, N71T, R95E, K97W",10
IEKFELLAERCEEIRAKNSRAEEDYSDAPDEFRDPLMDTLMTDPVRLPSGTVMDRSIILRHLLNSPTNPFTRQVLTESMLEPVPELKEQIQAWMREKQGSDH,6.0751395,"K5E, K10R, V11C, V15R, A19S, I23E, D68N, N71T, M74V, S99G",10
IEKFKLLAKKVEEIVAKNYWAEIDYSDAPDEFRDPLMDTLMTDPVRLPSGTTMDRSIILRHLLNSPTNPFTRQPLTESMLEPVPGLKEQIQAWCREKQCSDH,6.2725163,"E9K, A19Y, R20W, V52T, D68N, N71T, M74P, E85G, M94C, S99C",10
IEKDRLLAEKGEEIVARNARAEIDYSDAPDEFRDPLMDTLMTDPVRLPSGTVMDRAIILRHLLNSHTNPFTRQMLTESMLEPVPELKEQIQAWMREVQSSDK,5.0489626,"F4D, K5R, V11G, K17R, S56A, P66H, D68N, N71T, K97V, H102K",10
IEKFKLLARKVEEIVALNARADIDYSDAPDEFRDPLSDTLMTEPVRLPSGTVMDREIILRHLLNSPTNPFTRQMLTESMLEPVPELKEQIQAWMRQHQSSDH,5.55346,"E9R, K17L, E22D, M37S, D43E, S56E, D68N, N71T, E96Q, K97H",10
IEKFKLLAEKMEAIVAKNKRAEIDYDDAPDEFRDPLMDTLMNDPVRLPSGTVMDRSIILRHLLNSPTNPFTRRMLTESMLEPVPELKENIDAWMREKQSSDH,5.64369,"V11M, E13A, A19K, S26D, T42N, D68N, N71T, Q73R, Q89N, Q91D",10
IEKFKLLAEKVGEIVAKNAVAEIDYSDAPDEFRDPLMDTLMTDPVRLPSGTVMDRRIILRHLLNSPTNPFTRQMLTESMLEPVVELKEAIVAWMREKQSHDL,5.97202,"E12G, R20V, S56R, D68N, N71T, P84V, Q89A, Q91V, S100H, H102L",10
IEKFKLLAEKVEEIVAKNISAEIDDSDAPDEFRDPLTDTLMTDPIRLPSGTVLDRSIILRHLLNSPTNPFTRQPLTESMLEPVPILKEQIQAWMREKQSSDH,10.998658,"A19I, R20S, Y25D, M37T, V45I, M53L, D68N, N71T, M74P, E85I",10
IEKFKLLAEKVEDIELKNLRAEDDYSDAPDEFRDPLMDTLMVDPVRLPSGTVMDREIILRHLLNSPTNPFTRQMLTESMLEPVPELKEQIQTWMREKQSSDH,5.940268,"E13D, V15E, A16L, A19L, I23D, T42V, S56E, D68N, N71T, A92T",10
IEKFKDVAEKVEEIVAKNARAEIDYSDAPMEFRDPLMDTLMTDPVRLPSGTNMDRSIIFRHLLHSPTNPFTRQMLTESMLEPVPELKEQIYAWMREKGSSDH,5.0327797,"L6D, L7V, D30M, V52N, L59F, N64H, D68N, N71T, Q91Y, Q98G",10
IGKEKLLAEKVEEIEAKNARAEIDYTDAPDEFRDPLMYTLMTDPVRLPSGTVMDRSIILRHLLVSPTNPFTRQMLTESMLEPVPELKSQIQAWMSEKQSSDH,6.753528,"E2G, F4E, V15E, S26T, D38Y, N64V, D68N, N71T, E88S, R95S",10
IEKFKLLKEKVQEIVAKNARAEIDYSDVPDEFRDPIMDTLMTDPVRLPSGTVMDRSIIQRHLLNSPTNPFTRQMLPESMLEPNPELKEQIQAWVREKQSSDH,6.2592087,"A8K, E12Q, A28V, L36I, L59Q, D68N, N71T, T76P, V83N, M94V",10
ITKFKLLAEKVEEVVAKNARAELDYSDAPDEFRDPLMDTVMTDPVRMPSGTVMDRSIILRHLLNSPTNPFTRQMLTESMLEPVPELKEQIQQWMREVQTSDH,4.5960264,"E2T, I14V, I23L, L40V, L47M, D68N, N71T, A92Q, K97V, S99T",10
IEKFKLLAIKRTDIVAKNARDEIDYSDAPDEYRDPLMDTLMTDPVRLPSGTVMDRSIILRHLLNSPTNPFTRKMLTESMLEPVPELKEQIQAWKREKQSSDH,4.9307494,"E9I, V11R, E12T, E13D, A21D, F32Y, D68N, N71T, Q73K, M94K",10
IEKFKLLAENVMEIVAKNARAEIDYKDAPDEFRDPLMYTLMTDPVRLPSGTVMDRSIILRHLLNDPTNPFTRQMLTESMLEPVPELKEKIQAWRREIQSSDH,7.198523,"K10N, E12M, S26K, D38Y, S65D, D68N, N71T, Q89K, M94R, K97I",10
IEKFKLLAEKVEEIVAKNARAEIDYQDAPDHFRDPLMDTLMTDPVMLPSGTVMDRSIILRHLTNSPTNPFTRQMLTESDLEPVPELKEQIEMWMEEKQSSDH,6.219366,"S26Q, E31H, R46M, L63T, D68N, N71T, M79D, Q91E, A92M, R95E",10
IEKFKLLAEKVDEIVAKNAIAEDDYFDTPDEFRDPLMDTLMTDPVRLPSGTVMDRSIILRHLLNNPTNPFTRQMLTESMLEPVPELKEQIQAWKRENQSSDH,6.778118,"E12D, R20I, I23D, S26F, A28T, S65N, D68N, N71T, M94K, K97N",10
IEKFKLLAEKVQESVAKNARAEIDYSDAPDEFRDPIMDTLMTDPVRLPSGTVMDRSIILRHLLSSPTNPFTRQMLTEEMLEPVPELKEQIQAWKDEKQSSDA,6.942177,"E12Q, I14S, L36I, N64S, D68N, N71T, S78E, M94K, R95D, H102A",10
IEKQKLLAEKVEEIVRKNARAEIDYSDAPNEFRDPFMDTLMTDPVLLPSGTVMDRSIILRHLMNKPTNPFTRQMLTESMLEPNPELKEQIQAWMREKQSSDH,3.7125664,"F4Q, A16R, D30N, L36F, R46L, L63M, S65K, D68N, N71T, V83N",10
IEHFKLLAGKVEELVAKNARATIDYSDAPDEFRDPLMDTLMTDPFRLPSGTVMDRSIILRHLLESPTNPFTRQMLTESMLRPVPELKEQIVAWMREKQSSDH,3.0783896,"K3H, E9G, I14L, E22T, V45F, N64E, D68N, N71T, E81R, Q91V",10
IEKFKLLAEKVEEIVRKNADAEIDYSDAPDEFRDPLMDVLMVDPVRLPSGYVMDRSIILRHLLNSPTNPFTRQMLTESMLVPVPKLKEQIEAWMREKQSSDH,5.9151278,"A16R, R20D, T39V, T42V, T51Y, D68N, N71T, E81V, E85K, Q91E",10
IEKFKLLAEKCESIVAKNARDEDDYSDAPDEFRDPLMDTLMTDPVQLPSGTVIDRSIILRHLLNSPTNPFTRQMLTLSMLEPVPELKEQIQAWMREKQSLDH,8.366431,"V11C, E13S, A21D, I23D, R46Q, M53I, D68N, N71T, E77L, S100L",10
IEKNKLLADKVEEEVAKNARAEILYSDAPDEFRCPLMDTLMTDPVRLPSGTVMDRSIILRHLENSPTNPFTRQTLTESMLEPVPELKEQIQAWMRSKQSSDH,4.765648,"F4N, E9D, I14E, D24L, D34C, L63E, D68N, N71T, M74T, E96S",10
IEKSKLLAEKVEEIVAKNAREEIDYSDKPDEFRDPLMDTLMIDPVRLPSGTVMDRSIILRHLLNDDTNPFTRQMLTESELEPVPELKEQIQAWKREKQSSDH,5.3244896,"F4S, A21E, A28K, T42I, S65D, P66D, D68N, N71T, M79E, M94K",10
IEKFKPLAEKVEEIVAKNARAEIDYDDAPDEFRDPLMDELMTDPVRLPSGTVLDRSIILRHLLNSHTNPFTRQMLTESMLVPVPELVEQIQAWRREKQSSDH,8.535873,"L6P, S26D, T39E, M53L, P66H, D68N, N71T, E81V, K87V, M94R",10
IEKQKLLAEKVRKLVAKNARAEIDYSDAPDEFRDPLMDTLMTDPVRLPSGTVMDRAIILRHLLNSPTNPFTRQRLTESMLEPVPILKEQIQAWMREKQSSIH,4.6003237,"F4Q, E12R, E13K, I14L, S56A, D68N, N71T, M74R, E85I, D101I",10
IEKFKLLAEKVEERVAQNARAEIDYSDAPDEFLDPLLDTLMTDPVRLPSGTVMDRVIILRHLLNSPTNPFTREALTESMLEPVPELKEQIQAWMREKQSSDG,4.7874026,"I14R, K17Q, R33L, M37L, S56V, D68N, N71T, Q73E, M74A, H102G",10
IEKFKLLAEKVEWIVERNARAEIDYSDAPDEFRDPLMFELMTDPVRLPSGTVMDRSIILRHLLNSPTNPFTRSMLTESMLEPVPELKEQIQEWMREKISSDH,5.255306,"E13W, A16E, K17R, D38F, T39E, D68N, N71T, Q73S, A92E, Q98I",10
IEKFKLDAEKVEEIVAKNAIADIDYDDAPDEFRDPLMDTLMTDPVRLPSGTVMDRSIILRHLLHNPTNPFTRQMLKESMLEPVPELKERIQAWMREKQSSDH,5.7298517,"L7D, R20I, E22D, S26D, N64H, S65N, D68N, N71T, T76K, Q89R",10
MEKFKLGAVKVEEIVAKNARAEIDYSDAPDSFRDPMMDTLMTDPVRLPSGTVMDRSIILRHLLNSPTNPFTRQMLTESMLEPNPELKEQIHAWMREKVSSDH,0.5887246,"I1M, L7G, E9V, E31S, L36M, D68N, N71T, V83N, Q91H, Q98V",10
IEKFKLLAEKVEEIVALNARAEIDYDDAPDEFIDPIMDTLMTDPVRLPSGTVMDRSIIQRHLLSSQTNPFTRQMLTESMLEPVPELKEQILAWMREKQSSDH,6.7014875,"K17L, S26D, R33I, L36I, L59Q, N64S, P66Q, D68N, N71T, Q91L",10
KRKFKLLAEKVEEIDAKNARASIDYHDAPDEFRDPLMDTLMTDPVRLPSGTVVDRSIILRHLLNSPTNPFTRQMLTLSMLEPVPELKEQIQAWMRENQSSDH,6.186852,"I1K, E2R, V15D, E22S, S26H, M53V, D68N, N71T, E77L, K97N",10
IEKNSLLAEKVEEIVAKNARAEIIYSDAPDEFRDPLMDTLMTDPVILPSGIVMDRSIILRHLLNSPTNPLTRLPLTESMLEPVPELKEQIQAWMREKQSSDH,0.5499136,"F4N, K5S, D24I, R46I, T51I, D68N, F70L, N71T, Q73L, M74P",10
EEKFKLLAEKVEEIVAKNARAEIDDSDIPDEFRDPLMDTLMTDPVRLPSGTVMDRSIILRHLQNSPTNPFTRNMLTESDVEPVPELKEQIQAWMREKQSSDL,5.789178,"I1E, Y25D, A28I, L63Q, D68N, N71T, Q73N, M79D, L80V, H102L",10
MEKFKLLAEKVEEIVAKNAMADIDYSDAPDEFRDPLMDTLMTDPVRLPSGSTMDRSIIERHLLNSSTNPFTRQMLPESMLEPVPELKEQIQAWMREKQSSDH,2.3821692,"I1M, R20M, E22D, T51S, V52T, L59E, P66S, D68N, N71T, T76P",10
MEKFKLLAEKVEEINAKNAHAEIDYSDAPDEFRDPLMDTLMTDPVRLPSGTVMDRDIILRHLLNSPTNPFTRRMLTEEMLVPVPELKEQIQAWMMEKQSSDH,5.3288374,"I1M, V15N, R20H, S56D, D68N, N71T, Q73R, S78E, E81V, R95M",10
IESFKLLAEKVEEIVAKTARAEIDYHDAPDEFRDPLTDTLMTDPVTLPSGTVMDRSIILRHLLNSPTNPFTRQPLTESMLEPVPELKHQIQAWMREKQSSDD,3.0853763,"K3S, N18T, S26H, M37T, R46T, D68N, N71T, M74P, E88H, H102D",10
IEKFKLLAEKVEVIVAKVARAEIDYSDAPDEFRDPLMDTLMQDPVMLPDGTVMDRSIILRHLLNSPTNPFTRQMLTQSMLEPVKELKEQIQAWMRELQSSDH,4.893737,"E13V, N18V, T42Q, R46M, S49D, D68N, N71T, E77Q, P84K, K97L",10
IEKFKLLAEKVEEIVAKQARAEIDYSDAPDEFRDPLTFTLMTDPVRLPSGTVMDRSIILRHLLNSPTNPWTREMLTESMLEPNPELKEQVQAWMRQKQSSDH,1.9202961,"N18Q, M37T, D38F, D68N, F70W, N71T, Q73E, V83N, I90V, E96Q",10
IEKFKLLAEEVEEIVAKNAFAEDDVSDAPDEFRDPLMDTLMTDPVRLPSGTTMDKSIILRHLLNSPTNPFTRQMLTESMLEPNPELKEQIQAWMREKQSSNH,6.1951632,"K10E, R20F, I23D, Y25V, V52T, R55K, D68N, N71T, V83N, D101N",10
IEKFKLLAEKVEGIVAKNSRAEIDYSDVPDEFRDPLSDTLMTDPVRLPSGTVMDTSIILRHLLNSPTNPFTRQMLTEEMLECVPDLKEQIQAWMREKQSSDH,4.7898016,"E13G, A19S, A28V, M37S, R55T, D68N, N71T, S78E, P82C, E85D",10
FEKFHLLAEQIEEIRAKSARAEIDYSDAPDEFRDPLMDTLMTDPVRLPSGTVMDRVIILRHLLNSPTNPFTRQMLTESDLEPVPELKEQIQAWMREKQSSDH,4.0903015,"I1F, K5H, K10Q, V11I, V15R, N18S, S56V, D68N, N71T, M79D",10
IEKFKLLAEKVEEIVAKGALAEIDYADAPDEFRDPLTDTLMTDPVRLPSGTVMDRSIILRHLLNSPTNPFTRQMLTEQMLYPVPELKEEIQAWRREKQSSDH,5.7577677,"N18G, R20L, S26A, M37T, D68N, N71T, S78Q, E81Y, Q89E, M94R",10
IAKNKLLAEKLEEIVAKNIRAEIDYSDAPDEFRDPLMDTLMTDPVQLPSGTVMDRDIILRHLLNSPTNPFTRQMLTESMLEPVPELKEQIQAWVREKQSSCH,4.8086524,"E2A, F4N, V11L, A19I, R46Q, S56D, D68N, N71T, M94V, D101C",10
IEKFKLLAEKVEEIVAKNAEAEIDYSEAPDEFRDPLADTLMTDPVRLPSGTVMDRTIIYSHLLNSPTNPFTRQMLTESMLQPVPELKEQIQNWMREKQSSDH,5.875679,"R20E, D27E, M37A, S56T, L59Y, R60S, D68N, N71T, E81Q, A92N",10
IEKFKLLAEKVEEIVAKNARAEIDYSDAPDEFRDPLMDTLMEDPVRLPSGTVLDRSIILRHLLISPTNPFTRQMLTENMVEPNAELKEQIQAWMREKLSSDH,6.650572,"T42E, M53L, N64I, D68N, N71T, S78N, L80V, V83N, P84A, Q98L",10
IEKSKLLAEKVEEIVATNARAEIDYSDAPDEFRDPLMDTLMTDPVELPSGTVMDRSIILRHLHESPTNPFTREMLTESMLEPVPELKEQIQAWMREKDSNDH,4.5767126,"F4S, K17T, R46E, L63H, N64E, D68N, N71T, Q73E, Q98D, S100N",10
IEKFKLLKERVEEIVAKNFRAEIDYSDAPLDFRDPLMDTLMTDPVRLPSGTTMDRSIILRHLLNDPTNPFTRQMLTVSMLEPVPELKEQIQAWMREKQSSDH,4.711934,"A8K, K10R, A19F, D30L, E31D, V52T, S65D, D68N, N71T, E77V",10
INKFKLLAEKVEEIVAKNARAEIDYEDAPDEFRDPLTDTIMTDPVLLQSGTVMDRSIILRHLLNDPTNPFTRQMLTESMLEPVPELKEQIQAWMREKYSSDH,5.5436373,"E2N, S26E, M37T, L40I, R46L, P48Q, S65D, D68N, N71T, Q98Y",10
IESFKILAEKVEEIVAKNARAEIDYSDAPDEFRDPLMDTLMTDPVRIPSGTTMDRSIIRRHLINSNTNPFTRQMLTESMLFPVPELKEQIQAWMREKQSSDH,5.520983,"K3S, L6I, L47I, V52T, L59R, L63I, P66N, D68N, N71T, E81F",10
IEKFKLLAEKVEENVAKQARAEKDYSDAPDEFRDPLTDVIMTDPVRLPSGTVMDRSIILNHLLNSPTNPFTRQMLTESMLEPVPELKEQIQAWMREKQSHDH,5.011611,"I14N, N18Q, I23K, M37T, T39V, L40I, R60N, D68N, N71T, S100H",10
IEKRKLDAEKVETIVAKNARDEIDDDDAPDEFRDPLMDTLMTDPVLLPSGTVMDRSIILRHLLNSPTNPFTRQMLTESMLEPVNELKEQIQAWMREKQSSDH,8.243214,"F4R, L7D, E13T, A21D, Y25D, S26D, R46L, D68N, N71T, P84N",10
IEKFVELAEEVEEIVAKNTRAEIDYSDAPDEFRDPLMDTLMHDPVLLPSGTVMDRSIILRHLLNSPTNPFTRQMLTESMLEPVPELKEQIQKWMRENQSSDH,7.2689986,"K5V, L6E, K10E, A19T, T42H, R46L, D68N, N71T, A92K, K97N",10
IAKFKLLAEKREEIRAKNARAEIDYSDAPDEFRDPLMDTLMTDPVRLPDGTVMDRSIILRHLLNSPTNPFTRKMLHEDMLEPVPELKEQIQAWMREQQSSDH,5.317243,"E2A, V11R, V15R, S49D, D68N, N71T, Q73K, T76H, S78D, K97Q",10
IEKFKLLAEKVEETVAKRARAEIDYSDAPDEIRDPIMDTLMTDPVMLPSGTVLDRSIILRHLLNSPTNPFTRQMLTESMLEPVPELKEQIQAWMREDQSSDR,8.726957,"I14T, N18R, F32I, L36I, R46M, M53L, D68N, N71T, K97D, H102R",10
IEKAKLLAEKVEEIVAKQARAEIDYSDAPDEFRDPLSDTIMTDPVRLPSGTVMDRSVILRHLLNSPTNPFTRQMLTEQMLQPVPELKEQIEAWMREKQSSDH,7.35606,"F4A, N18Q, M37S, L40I, I57V, D68N, N71T, S78Q, E81Q, Q91E",10
IEKFKLLAEKVEEIVNKNARAEEDYSDPPDEFRDELMDTLMTDPVRLPSGTVMDRSIILRHLLNSGTNPFTREMLTESMLEPVPELKEKIQAWIREKQSSDH,4.4105024,"A16N, I23E, A28P, P35E, P66G, D68N, N71T, Q73E, Q89K, M94I",10
IEKQKLLAEKVPEIVAKEVRAEIDYSDAPDEFRDPLMDTLMTDPVRLPSGTVMDRSAILRHLLNSPTNPFTRQMLTESMLEPVPELKEQINAWLKEKQSSDH,4.738485,"F4Q, E12P, N18E, A19V, I57A, D68N, N71T, Q91N, M94L, R95K",10
IEKFKLLAEKVERIVAHNAEAEIDYSDIPDEFRDPLMDTLMLDPVLLPSGTVMDRSIILRHLLNSPTNPFTRQMLTESMLEPDPELKEQIQAWMHEKQSSDH,5.563613,"E13R, K17H, R20E, A28I, T42L, R46L, D68N, N71T, V83D, R95H",10
IEKFKLLAEKVEEDVAKNARAEIDYSDAPDEFYDPLMYTLMTDPVRLPSGTVMDRSIILRHLLNNPTNPFTRQNLSASMLEPVPELKEQIQAWMREKQSYDH,5.0666437,"I14D, R33Y, D38Y, S65N, D68N, N71T, M74N, T76S, E77A, S100Y",10
IEVFKDLAEKVETIVAKNARAEIDYDDAPDEFRDPLLDTLMTDPVSLPSGTVMDRSTILRHLLNSPTNPFTRQMLTESMLEPVPELKEQIDAWMREKQSSDH,7.1720934,"K3V, L6D, E13T, S26D, M37L, R46S, I57T, D68N, N71T, Q91D",10
REKFKLLAEKVEEIVANNARAEIDYSDAPEEFRDPLMDTLMTDPVLLPDGTVMERSIILRHLLNSPTNPFTRQMLTESMLEPVPELKEQIQAWFREKQSHDH,5.893568,"I1R, K17N, D30E, R46L, S49D, D54E, D68N, N71T, M94F, S100H",10
FEDDKLLAEKVEEIVAKNARAEIDYSDAPDEFRDPLMDTLMMDPVRLPSGTVMDRSIILRHLLNSPTNPFTRQMLTESKLEPVPELNEQIFAWMRESQSSDH,1.4579692,"I1F, K3D, F4D, T42M, D68N, N71T, M79K, K87N, Q91F, K97S",10
IEKFKLLAEKREEIVQKNARAEIDYSDAPDEFRDPLMYILMQDPVRLPSGTVMDRSIILRHLLNSPTNPFTRMMLTESMLEPNPELKEQIQAWLREKQSSDH,5.970374,"V11R, A16Q, D38Y, T39I, T42Q, D68N, N71T, Q73M, V83N, M94L",10
IEKNKLLAEKVERIVAKNANADIDYSDAPDEFRDPLMDTLMDDPVRLPSGTVMDRSIILRHLLNSPTNPFTRQMLTESMLEPVPDLKEQIQAWLREHQSSDH,7.5050197,"F4N, E13R, R20N, E22D, T42D, D68N, N71T, E85D, M94L, K97H",10
IEKFKLLAEKVEEIVAKKARFEIDYSDAPDEFRDPLMDQLMTDPVTLSSGTVMDRSIILRHLLNSPTNPFTRQMLTESMLFPVPELKEQIQAWMLEKQSSTH,-0.08029467,"N18K, A21F, T39Q, R46T, P48S, D68N, N71T, E81F, R95L, D101T",10
IGKFKLLAEKVEEIVAKNAEDEIDYSDAPDEFRDPLTDTLMTDPVRLPSGTVMDRSIILRHLLNQNTNPFTRQMLTESMLEPVPELKLQIQAWMREKQSSIH,4.4946604,"E2G, R20E, A21D, M37T, S65Q, P66N, D68N, N71T, E88L, D101I",10
IEKFKLLAEKVEGIQAKEARAEIDYSDAPDEFRSPLMDTLMTDPVILPSGTVMDRSIILRHLLNNPTNPFTRQMLTEDMLEPVPELKEQIQDWMREKQSSDH,4.577188,"E13G, V15Q, N18E, D34S, R46I, S65N, D68N, N71T, S78D, A92D",10
IEKFKSLPEKVEEIVAKLARAEIDYSDAPEEFRDPLMDTLMTDPVRLPSGTVMDRIIILRHLLNSQTNPFTRQPLTESMLEPVPELKEQIQAWMRIKQSSDH,7.182887,"L6S, A8P, N18L, D30E, S56I, P66Q, D68N, N71T, M74P, E96I",10
IEKFKLLAEKVEEIVAKNARAEIDYSDAPDEFRDPLMDTLMTDPVRLPSGTVMDRRTIYRHLLNSPTNPFTRQMLTESMLEPIPELKAQIDRWMREKQSSDV,6.371468,"S56R, I57T, L59Y, D68N, N71T, V83I, E88A, Q91D, A92R, H102V",10
IEKFKLLAEKVEEIHAKNARAEIDYSDDPDEFRDPLMDTLMTDPVRLPSGVVMDRSIILRHLLNSPTNPFTRQELTEEMLEPVPEVKEQIQRWMREKQDSDH,5.362627,"V15H, A28D, T51V, D68N, N71T, M74E, S78E, L86V, A92R, S99D",10
IEKNKLLAEKVENIVAKNARAEIDYSDAPDEFRDPLMFELMTDPVRLPSGTVMDRNIILKHLLNSPTNPFTRQMLTESMLEPVPELKEQIQAWKKEKQSSDH,3.8032022,"F4N, E13N, D38F, T39E, S56N, R60K, D68N, N71T, M94K, R95K",10
MEKFKLLAEKVEEIVAKEERAEDDYSDAPDEYRDPLMDTLMTDPVMLPSGTVMDRSIILRHLLASPTNPFTRQMLTESMLVPVPELKEQIQAWMREKQSSDH,6.0513,"I1M, N18E, A19E, I23D, F32Y, R46M, N64A, D68N, N71T, E81V",10
HEKFKSLMEKVEEIVAKNARAEIDYSDAPDEFRDPLMDTLMTDPVRLKSGTVMDRSIILRHLLNSPTNPYTRQMLREDMLVPVPELKEQIQAWMREKQSSDH,7.4139447,"I1H, L6S, A8M, P48K, D68N, F70Y, N71T, T76R, S78D, E81V",10
IEKFKLLAEKVEEIRAKNARAEIDYSDAPDEFRDPLMDTLMTEPVRLPSGEIMDKSMILRHLLNSPTNPFTRQMLTESMLEPVPELKEQIQAWMREKQESTH,6.2645764,"V15R, D43E, T51E, V52I, R55K, I57M, D68N, N71T, S99E, D101T",10
