Sequence,Score,Mutations,Number of Mutations
IEKNKLLAEKVEEIVAKNARAEKDYSDAPDEFRDPLMDTLMTDPVRLPSGHVMDRSQILRHLLNSPTNPFTRQMLTESDLEPVPELKELIQNWMREKQSMDH,6.0197954,"F4N, I23K, T51H, I57Q, D68N, N71T, M79D, Q89L, A92N, S100M",10
AEKFKALAEKVEEIVAKNARDEIDYSDAPDEYRDPLMDTLMTDPVRLPSGTVMDRSIILRHLLNSPTNPFTRQMLTESMLSPVPELKEQIQRWMRKKQSVDH,6.531892,"I1A, L6A, A21D, F32Y, D68N, N71T, E81S, A92R, E96K, S100V",10
IEKTKLLAEKVEEIVRKNARAEIDYSDAPDEFRDPLMYTLMTDPVRLPSGTVMDRSIILQHLLNSPTNPFTRQMLTESMLEPQEELKEQVQAWMREKQSSRH,6.8730307,"F4T, A16R, D38Y, R60Q, D68N, N71T, V83Q, P84E, I90V, D101R",10
IEKFKLLAEKVPELVAKNARAEIDYADAPDEFRDPLMDTLMTDPVRLPSGYVMDRSHILRHLLNDPTNPFTRWMLTESMLEPVPELKEQIQAWMREQQSSDH,5.5958447,"E12P, I14L, S26A, T51Y, I57H, S65D, D68N, N71T, Q73W, K97Q",10
IEKFKTLAEKREEIVARNARKEIDYSDAPDEFRDPLMYTLMTDPVRLPSGTTMDRSIILRHLLNNPTNPFTRQMLTESMLEPVPELKEQILAWMREKQSSDH,6.7589703,"L6T, V11R, K17R, A21K, D38Y, V52T, S65N, D68N, N71T, Q91L",10
IEKFKALNEKVEEIVAKNARAEIDYDDAPDEFIDPLMDTVMTDPVRLPSGTTMDRSIILRHLQNSPTNPFTRQSLTESMLEPVPELKEQIQAWMREKQSSDH,6.2824545,"L6A, A8N, S26D, R33I, L40V, V52T, L63Q, D68N, N71T, M74S",10
IEKDTLLAKKVEEIVAKNARAEIDYSDAPDEFRDPLTDELMTDPVRLPSGTVMDRSIILRHLLNSPTNPFTRQMLTESMLEPVPEMKEQIQAWMRAKQGSDH,3.5910091,"F4D, K5T, E9K, M37T, T39E, D68N, N71T, L86M, E96A, S99G",10
IEKMKRLAEKVEEIVAKNANAEFTYSDAPDEFRDPLMDTLMTDPVRLPSGTVMDRSIILRHLLNSPTNPFTRQMLTESMLEPVPELKEQIQAWIQQKQSSDH,5.723851,"F4M, L6R, R20N, I23F, D24T, D68N, N71T, M94I, R95Q, E96Q",10
IESFTLLAEKVEEIVAKNARAEIDYSDLPDEFRDPIMDTLMTDPVRLPSGNVMDRSIILRHLLNSPTNPFTRQMITPSMLEPVPELKEQIQAWMREKQSSDK,5.7221704,"K3S, K5T, A28L, L36I, T51N, D68N, N71T, L75I, E77P, H102K",10
IEKFKLLAEKVEEIVAGNARAVIDYSDAPDEFRDPLMDTLMTDPVRLPSGTVMDRSIILRHLLISPTNPFTRCMLTESMLEPVKELKEQIQAWKREHQSADH,4.137027,"K17G, E22V, N64I, D68N, N71T, Q73C, P84K, M94K, K97H, S100A",10
IEKFKLLAEKNEEIVAKNARAEIDESDAPDEFRDPLMDTLMTDPVMLPSGTTLDRSIILRHLLNSPTNPFTRQMLTESMLEPVPELKEAIQAWMREKQSRHH,8.491972,"V11N, Y25E, R46M, V52T, M53L, D68N, N71T, Q89A, S100R, D101H",10
IYKFRLLAEKVEEIVAKNARAEIDYSDAPDEFRDPLMDTLMTDPVRLPSGTVVDRSIILRHLLNSNTNPITRQVLTESMLEPVPELKEKIQAWMREHQSSDH,5.294174,"E2Y, K5R, M53V, P66N, D68N, F70I, N71T, M74V, Q89K, K97H",10
IEKFLLPAEKKEEEVAKNARAEIDYSDAPDEFRDPLMDTMMTDPVRLPSGIVLERSIILRHLLNSPTNPFTRQMLTESMLEPVPELKEQIQAWMREKQSSDH,9.283734,"K5L, L7P, V11K, I14E, L40M, T51I, M53L, D54E, D68N, N71T",10
YEKFKLLAEKVEEAVAKNARAGIDYSDAPDEFRDPLMDELMTDPVRLPSGTVMDRSLILRHLLNSNTNPFTRSMLTENMLEPVPELKEQIQAWMREKQSSDH,2.842095,"I1Y, I14A, E22G, T39E, I57L, P66N, D68N, N71T, Q73S, S78N",10
IEKFKLLAEKVEEIVAKNARAEIDDSDAPDEFRDPLMDTLMVDPVRLPSGFVMDRSIILRHLLNNPTNPLTRQLLTESMLEPVPELKEQIQAWMRDKSSSDH,2.79251,"Y25D, T42V, T51F, S65N, D68N, F70L, N71T, M74L, E96D, Q98S",10
IEKFKLIAEKVEEIVAKNARAEIDYLDAPDEFRDPLMDTLMTDPVRLPDGTVMDRSIILRHLLNSPTNPFTRQMLDESMLEPVPDLKRQIQAWIAEKQSSDH,6.8516216,"L7I, S26L, S49D, D68N, N71T, T76D, E85D, E88R, M94I, R95A",10
IEKFKLLAEKVEEIVAKQARAEIDYNDIPDEFRDPLMDTLMTDPVKLPSGTVMDRSIILRHLTNSPTNPFTRQMLTESMLNPVPELKEQIQAWMREKDSSDR,6.723214,"N18Q, S26N, A28I, R46K, L63T, D68N, N71T, E81N, Q98D, H102R",10
IEKFKLLQEKVEEIVSKNARAEDDYSDAPDEFRDPLMDTLMTDPVRLPDGTVMDRSIILAHLLNSPNNPFTRQPLTESMLEPVPELKEQIQAWMREKESSDH,5.0468855,"A8Q, A16S, I23D, S49D, R60A, T67N, D68N, N71T, M74P, Q98E",10
IEKFKILAQKVDEIVAENARAEIDYSDAPDEFRDPLMDTLMVDPVRLPSGTVMDRSIILRHLLNSPTNPFTRQMLTESMLEPVPELRKQIQAWMREKQKSDH,5.7607985,"L6I, E9Q, E12D, K17E, T42V, D68N, N71T, K87R, E88K, S99K",10
KEKFDLLAEKVEEIVAKNARAEIDYSDAPDEYRDPLMDTLMTDPVRLPSGTIMDRSIILRHLLNSPTNPFTREMLTESMLRPVPELKRQIQAWMREKQSSDQ,3.2316952,"I1K, K5D, F32Y, V52I, D68N, N71T, Q73E, E81R, E88R, H102Q",10
IQKFELLAEKVQEIVAKNARAEIDYSDAPDEFRDPLMDTLMTDPVRLSSGTVMDRSIILRHLLVSPFNPFTRQMLTESMLEPVPELKSQIQAWMRCKQSSDH,0.96800315,"E2Q, K5E, E12Q, P48S, N64V, T67F, D68N, N71T, E88S, E96C",10
MEKFKLLKPKVEDIVAKNAREDIDYSDAPDEFRDPLMDTLMTDPVRLPSGTVMDRSIILRHLLNSPTNPFTRQMLTESMLEPRPELKEQIQAWMREKQSNDH,5.7176304,"I1M, A8K, E9P, E13D, A21E, E22D, D68N, N71T, V83R, S100N",10
IEVFKLLAEKVEEEVAKNARAEIDYDDAPDEFRDPISDTLMTDPVRLPSGHVMDRSIILRHLLNSPTNPFTRQMLTEDSLEPVPELKEQIQAWMREKQSSDH,8.03001,"K3V, I14E, S26D, L36I, M37S, T51H, D68N, N71T, S78D, M79S",10
IEEFRLLAERVEEIVAKNARAEIDYSDAPDEFRDPLSDTLMTDPVRLPSGTVMDRSIILEHLLNSPTNPFTRQMLTKSMLEPVPELKEQIQAWMAEKQDSDH,3.9195929,"K3E, K5R, K10R, M37S, R60E, D68N, N71T, E77K, R95A, S99D",10
IEKFKLLAEKAEEIVASNARAEIDYSDAPDEFRDPLMDTLMTDPVRLPSGTVMDRSIILRHLVFEGTNPFTRQMLTEEMLEPVPELKEQIQAWMREVQSSDH,6.7770815,"V11A, K17S, L63V, N64F, S65E, P66G, D68N, N71T, S78E, K97V",10
IEKYKALAEKVEEIVAKNARDEIDYSDLPDEFRDPLMDTLMTEPVRLPSGTVMDRSIILRHLLNSPTNPFTRQMLTESMLHPVPELKNQIQAWMREHQSSDH,6.4933844,"F4Y, L6A, A21D, A28L, D43E, D68N, N71T, E81H, E88N, K97H",10
IEKFKLLFEKVEEIVAKNARAEIDYSDAPDEFRDPLMDTLMTDPVRLPSGTVMDRSIILRHLLNSPTNPFTRQPLTESMLIPLPELKEQIQAWMREICSRPH,4.734616,"A8F, D68N, N71T, M74P, E81I, V83L, K97I, Q98C, S100R, D101P",10
IEKFKLLAEKVEEIVAKNARAEIDYSDAPDEFRDPLMDTMMTDPVRLPSGTVMDRSLILRHLLNNPTNPYTRQMLTESMLEPVPELKEQIQAWIQEKDSSLH,5.900948,"L40M, I57L, S65N, D68N, F70Y, N71T, M94I, R95Q, Q98D, D101L",10
IEKFKLLAEKVHEIVAKNARAEIDDSDAPDEFRDPLMYTLMTDPVRLPSGYVMDRSIILRHLLNSNTNPFTRQMLTESMLEPVPELRERIQAWMREKYSSDH,9.223797,"E12H, Y25D, D38Y, T51Y, P66N, D68N, N71T, K87R, Q89R, Q98Y",10
IEDFKLLAEKVETIIAKNARNDIDYSDAPDEFRDPLMDTLMTDPVRLPSGTVMDRSIIFRHLLNSPTNPFTRRMLSESMLEPVPELKEQIQAWMREKQSSDH,3.507563,"K3D, E13T, V15I, A21N, E22D, L59F, D68N, N71T, Q73R, T76S",10
IEKFKLLAEKVDEIVAKNARAEIDDSDIPDEFRDPLMDQLMTDPVRLPSGTVMDRDIIVRHLLNNPTNPFTRQMLTESMLEPVPELKEQIQAWMREQQSSDH,7.173003,"E12D, Y25D, A28I, T39Q, S56D, L59V, S65N, D68N, N71T, K97Q",10
IEEFKELAELVEEIVEKNARAEIDDSDAPDEFRDPLMDTLMTDPVRLPSGTVMDRSIILRHLHNSPLNPFTRQMLTESMLEPVPELKQQIQAWMREKQSSDH,5.5264874,"K3E, L6E, K10L, A16E, Y25D, L63H, T67L, D68N, N71T, E88Q",10
IEPFKLRAEKLEEIVDKNARAEIDYSDAPDEFRDPLMDTLMTDPVRLPSGDVMDRSIILRHLLNSDTNPFTRQMLTESQLEPVPELKEQIQAWMREHQSSDH,5.952882,"K3P, L7R, V11L, A16D, T51D, P66D, D68N, N71T, M79Q, K97H",10
IETFKTLASKVEEIDAKNARAEIDYSDAPDEFRDPLMYTLMTDPVRLPSGTVMDYSIILDHLLNSPTNPFTRQMLTESQLEPVPELKEQIQAWMREKQSSDH,6.881139,"K3T, L6T, E9S, V15D, D38Y, R55Y, R60D, D68N, N71T, M79Q",10
IEKFKLLAEKVEEIVAKNARAEIDYSDAPDEFRDPLTDTLMTDPVRLPSGNVMDRAIIERHLLNDPTNPFTRQPLTESMLEPVPELKERIQAWMRENQSSDH,5.575538,"M37T, T51N, S56A, L59E, S65D, D68N, N71T, M74P, Q89R, K97N",10
IEKFKLLAEKVEEIVAKRRRASIDYDDAPIEFRDPLMDTLMTDPVRLPSGTVMDRSIILRHLLYSPTNPFTRQMLTESMLVPVPELKEQMQAWMREKQSSDH,6.725739,"N18R, A19R, E22S, S26D, D30I, N64Y, D68N, N71T, E81V, I90M",10
IEQFKLLARKVEEIVPENARAEIDYSDIPDEFRDPLMDRLMTDPVRLPSGTVMDRSIILRHLLNDPTNPFTRQMLTESMLEPVPELEEQIQAWMREKQSSDH,4.1622505,"K3Q, E9R, A16P, K17E, A28I, T39R, S65D, D68N, N71T, K87E",10
IEKFKLWAEKVEEIVAVNARAEIDYSDAPDEFRDPLMDTLMTDPVRLPSGTVMDRSIILRHLFNNPTNPFTRQPLTESMLEPVPELKKQINAWMREKMSSDH,6.1016827,"L7W, K17V, L63F, S65N, D68N, N71T, M74P, E88K, Q91N, Q98M",10
IEKFKLLAEKYEEIVAKNAEAEDDYDDAPDEFRDPLMDTLMTDPVILPSGTTMDRSVILRHLLNSPTNPFTRQMLTESMLEPVKELKEQIQAWMREKQSSDH,7.371548,"V11Y, R20E, I23D, S26D, R46I, V52T, I57V, D68N, N71T, P84K",10
IEKFELLAEKVEEIVADNARAEIDYSDAPDEFRDPLMDTLMTDPVRLPSGTVVDRSIILRHLLNSPTNPFTRQMLTESDLEPVKELKEAIQAWMRENQSSLH,8.269449,"K5E, K17D, M53V, D68N, N71T, M79D, P84K, Q89A, K97N, D101L",10
IEKFKNLAEKVEEIVANEARAEIDYSDAPDEFRDPLMFELMTDPVRLPSGTVMDRSIILRHLLNSPTNPFTRQMLTESMFQPVPELKEQIQRWMREKQSSDH,5.1923475,"L6N, K17N, N18E, D38F, T39E, D68N, N71T, L80F, E81Q, A92R",10
IEKFKLLAEKVEEIVAKNARAEIDYSDDPDEFRDPLMDTLMTDPVRLPSGTVMDRSIILRHLLNSPTNPFTRQTLTEMMLEPMIELKEQILAWMREHQSSDR,4.508728,"A28D, D68N, N71T, M74T, S78M, V83M, P84I, Q91L, K97H, H102R",10
IEKPKLTAEKVEEPVAKKARAEIDYSDAPDEFRDPLMDTLMTDPVRLPSGTVMDRSIIQRHLLNSPTNPFTRQMLTESMLVPVPELKEQIEAWMNEKQSSDH,4.936742,"F4P, L7T, I14P, N18K, L59Q, D68N, N71T, E81V, Q91E, R95N",10
IEKFKLLAEKVEEIVEKNQRAEIDYSDAPDEFRDPLMDTLMADPVRLPDGTVMDRSIILRHLLCSPTNPFTRQMLTESELEPVPELKELIQAWLREKQSSDH,4.1046667,"A16E, A19Q, T42A, S49D, N64C, D68N, N71T, M79E, Q89L, M94L",10
IEKFKLLAEKYEEEELKNARAEIDYSDAPDEFRDPLMDTLMTDPVRLPSGTIMDRSIIIRHLLNSPTNPFTRQMLTEDMLEPVPELKEQIQAWMREKQSRDH,6.397736,"V11Y, I14E, V15E, A16L, V52I, L59I, D68N, N71T, S78D, S100R",10
IEKFKLLAAKVEEIQAKNARADIDYSDVPDEFRDPLMDTLMTDPVRLPSGTVMDRSIILRHLLNSNTNPFTRQMLTETMLEPVPELKEQIRAWMREKQSSDQ,5.211424,"E9A, V15Q, E22D, A28V, P66N, D68N, N71T, S78T, Q91R, H102Q",10
IEKFKLLAEKYEEIVAKNARADIDDDDAPDEFRDPLMDTLMTDPVRLPSGTIMDRSIILRHLLNSPTNPLTRQMLTESMLIPVPELKEQIQDWMREKQSSDH,4.2137947,"V11Y, E22D, Y25D, S26D, V52I, D68N, F70L, N71T, E81I, A92D",10
IDKFKLLAEKVFENVAKNARAEIDYSDAPDEFRDPLMDTIMTDPVILPSGTVMDRSIILRHLLNDPTNPFTRQMLTEDMLEPVPELKEQIEAWMREKQSSDH,5.5704193,"E2D, E12F, I14N, L40I, R46I, S65D, D68N, N71T, S78D, Q91E",10
IERFKLLAEKVEELVAKNARAEIDYSDAPDEFRDPLMDTLMTDPVRLPSGQIMDREIILRHLLNSPTNPFTRQMLTESMLEPVEELKEQILAWMNEKQSSDH,5.1206427,"K3R, I14L, T51Q, V52I, S56E, D68N, N71T, P84E, Q91L, R95N",10
IEKFKLLAEKVEEIVAKNTSAKDDESDAPDEFRDPLMDALMTDPVRLPSGTVMDRSIILRHLLNSPTNPFTRQMLTESMLEPVPELQEQIQAWMREKQSSDF,2.91121,"A19T, R20S, E22K, I23D, Y25E, T39A, D68N, N71T, K87Q, H102F",10
IIKMKLLAEAVEEPVAKNARAEIDYSDVPDEFRDPLMDTLMTDPVRLPSGTVMSRSIILRHLLNSPTNPFTRQMLTESMLEPVPELKEQIQRWMHEKQSSDH,5.700496,"E2I, F4M, K10A, I14P, A28V, D54S, D68N, N71T, A92R, R95H",10
IEKFKLLQEKVEEIVAKEARAEIDYSDAPDEFRDPLMDTLMTDPVVLPSGTVMDRSIIHSHLLNSPTNPFTRQMLTESMLEPVPELKEQILAWIREKQSSAH,6.3989,"A8Q, N18E, R46V, L59H, R60S, D68N, N71T, Q91L, M94I, D101A",10
IEKFKLLAEKVEEIVLKNARAEIDYIEVPDEFRDPLMDTLMTDPVRLPSGTVMDRSIIRRHLLQSPTNPFTRQMLTESMLEPAPDLKEQIQAWMREKQSSDH,4.865177,"A16L, S26I, D27E, A28V, L59R, N64Q, D68N, N71T, V83A, E85D",10
IEGFKLLAEKVEEIVAKNARAEIDYSDAPDEFRCPLMDTLMTDPVRLPSGTVMDRSIILRHLLNSPTNPFTREPLTESMLEPVPELEEAIQAWMREKKSSDE,2.6554866,"K3G, D34C, D68N, N71T, Q73E, M74P, K87E, Q89A, Q98K, H102E",10
IEKFELLAEKVENIVRKIARAEIDYSDAPDEFRDPLMYTLMTDPVRLPDGTVMDRSTILRHLLNSPTNPFTRQMLTESMLEPVPELKEDIQAWMREKQSSDH,8.786151,"K5E, E13N, A16R, N18I, D38Y, S49D, I57T, D68N, N71T, Q89D",10
KEKFKRLAEKVERIVAKNARAEIDYSDAPDEFRDPIMDTLMTDPVRLPSGTVMDRSIILRHLLNSPTNPFTRQMLTESMLEPVPELKEWIQAWMEEKQSKDF,7.1010776,"I1K, L6R, E13R, L36I, D68N, N71T, Q89W, R95E, S100K, H102F",10
IEKFKLLAEKNEEIVAKNAAAEIDYSDAPDEFRDPLMDTLMTDPVRLPSGTVMDRSIILRHLLNNPTNPFTRQMLTESMLEPNPELKEAIVAWMRDKQSSDM,5.9112077,"V11N, R20A, S65N, D68N, N71T, V83N, Q89A, Q91V, E96D, H102M",10
IEKFKNLAEKVEEIVAGNARAEIDYSDVPDEFRDPLTDTLMTDPVRLPSGTVMDRSIILRHLLSSPTNPFTRQMLTESMLEPVPELKETIEMWMREKQSSDH,4.582899,"L6N, K17G, A28V, M37T, N64S, D68N, N71T, Q89T, Q91E, A92M",10
IEKFKLLAEKVQDIVAKNARAEIDYSEAPDEFRDPLMDTLMTDPVRLPDGTVMDRSTILRHLLNNPTNPFTRQMLTESMLEPVPELKEQIQAWFREMQSSDH,7.3202105,"E12Q, E13D, D27E, S49D, I57T, S65N, D68N, N71T, M94F, K97M",10
IEKFKLLAEKFEENVAKDQRADIDYSDAPDEFRDVLMHTLMTDPVRLPSGTVMDRSIILRHLLNDPTNPFTRQMLTESMLEPVPELKEQIQAWMREKQSSDH,3.2289648,"V11F, I14N, N18D, A19Q, E22D, P35V, D38H, S65D, D68N, N71T",10
ISKEKLLAEKVEEIVAKNARAEIDDSDAPDEFRDPLSDTLMTDPVRLPDGTVLDRSIILRHLLNSPTNPFTRQPLTEEMLEPVPELKEQIQAWMREKQSSDH,11.209616,"E2S, F4E, Y25D, M37S, S49D, M53L, D68N, N71T, M74P, S78E",10
IEKFPVLAEKVEEIVAKNARAEIDYSDYPDEFRDPLMDTLMTDPVRLPSGTVMDRSIILRHLLDSPTNPFTRQMLTESMLWNVPELVEQIQAWMREKQSSMH,3.3523495,"K5P, L6V, A28Y, N64D, D68N, N71T, E81W, P82N, K87V, D101M",10
IEKMKQLAEKVEEIVAKNDRAEIDYSDAPDEFRDPLMDTLMTDPVRLPSGYVLDRSIILRHLLNSPTNPFTRQMLTESMLVPVKELKEQIQAWMREKKSSDH,9.526343,"F4M, L6Q, A19D, T51Y, M53L, D68N, N71T, E81V, P84K, Q98K",10
IEKFKLLAEKVEEIVAKNALAEIDYSDAPDEFRDPLMDTLMTDPVRCPSGTVMDRSIILRHLLNSPTNPFTRQMLDESMLEPVPEWKSSIQAYMREKDSSDH,5.842769,"R20L, L47C, D68N, N71T, T76D, L86W, E88S, Q89S, W93Y, Q98D",10
IEKFKLLAEKVEEIVAKNARAEIDYSDIPDIFRDPLMDALMTDPVRLPSGTVMDRSTILRHLLNSPTNPFTRQMLTESMLKPVPELQRQIQAWMRAKQSSDH,4.9805202,"A28I, E31I, T39A, I57T, D68N, N71T, E81K, K87Q, E88R, E96A",10
MEKFQLLAEKVEEIVAKNARAEIDYSDIPEEFRDPLMDTIMTDPVRLPSGTVMDRSIILRHLLNSPTNPFTRQMLTESMLIPVPELKEQIQAWRREKQKSDH,6.491121,"I1M, K5Q, A28I, D30E, L40I, D68N, N71T, E81I, M94R, S99K",10
IEKFKLLQEKVEEIVEKNARAVIDYSDAPDEFRDPLMDTLMTDPVRLPSGTTMDRSIILRHLLNSPTNPFTRQMLTESMLEPVPELKEQIESWMREKSSSMH,5.968889,"A8Q, A16E, E22V, V52T, D68N, N71T, Q91E, A92S, Q98S, D101M",10
IEKFSDLADKVEEIVARNARAEIDYSDAPDEFRDPLMDTLMKDPVRLPSGTVMDRSVILRHLLNSPTNPFTRQMLTESMLEPVPELKRQIQAWMREKQSSRH,6.367523,"K5S, L6D, E9D, K17R, T42K, I57V, D68N, N71T, E88R, D101R",10
IEKFKLLAEKVDEIVAKNARAEIDYDDAPDEFRDPLMDTLMTDPVRLPSGTVMDRSVILRHLLNNPTNPFTRQMLTESMLEPVPELKRQIQAWKRENQSKDH,7.166604,"E12D, S26D, I57V, S65N, D68N, N71T, E88R, M94K, K97N, S100K",10
IEKFELLSEKVEEIVAGNAEAEIDYSDAPDEFRDPIMDTLMTDPVRLPSGTVMDRSIILRHLLNSPTNPFTRQMLIESMLEPVPELKEQIQAWMREKQSLDE,6.852702,"K5E, A8S, K17G, R20E, L36I, D68N, N71T, T76I, S100L, H102E",10
IEDFKLLAEKVEEIVAKNANAEIDDSDAPDELRDPLMDTLMTDPVRLPSGTVMEREIILRHLLDSPVNPFTRQMLTESMLEPVPELKEQIQAWMREKQSSDH,1.8658578,"K3D, R20N, Y25D, F32L, D54E, S56E, N64D, T67V, D68N, N71T",10
IEKNQLLAEKVEEIVAKNARAEIVYSDAPDEFCDPLMDTLMTDPVRLPSGTVMDRSIIARHLLNSPTNPFTRQMLTESMLEPVPELKERIQAWMRENQSSTH,3.9848158,"F4N, K5Q, D24V, R33C, L59A, D68N, N71T, Q89R, K97N, D101T",10
IIKFKLLAEKVEEEVAKCARAEIDYSDIPDEFRDPLMDTLMTDPVRLPSGTVVDRSIILRHLLNSPTNPFTRQPLTESNLEPVPELKEQIDAWMREKQSSDH,8.442602,"E2I, I14E, N18C, A28I, M53V, D68N, N71T, M74P, M79N, Q91D",10
IDKFSILAEKVEEIVAKEARDDIDYSDAPDEFLDPLMDSLMTDPVRLPSGTVMDRSIILRHLLNSPTNPFTRQMLTESMLEPVPELKEQIQAWMREKQSSDH,5.678092,"E2D, K5S, L6I, N18E, A21D, E22D, R33L, T39S, D68N, N71T",10
KEKTKLLAEKVEEIVAKNARAEIEYSDAPDEFRDPLMDTLMTDPVRLPSGTTMDRKIILRHLMNSPTNPFTRQPLTESMLLPVPELKEQIQAWMREKQSSDH,6.271444,"I1K, F4T, D24E, V52T, S56K, L63M, D68N, N71T, M74P, E81L",10
IETFKLLAEKAEEIVGKNYRDEIDESDAPDEFRDPLMDTIMTDPVRLPSGTVMDRSIILRHLLNSPTNPFTREMLTESMLEPVPELKEQIQAWMREKQSSDH,4.7225046,"K3T, V11A, A16G, A19Y, A21D, Y25E, L40I, D68N, N71T, Q73E",10
IEKFKLLAEKYEEIVAKNARAEIDYSDAPDEFRDPLMDTIMTDPVRLLSGTVMDRSIILRHLLNSPTNPFTRQMLTDNDLEPVPELKEQIQAYMREKQDSDH,2.649942,"V11Y, L40I, P48L, D68N, N71T, E77D, S78N, M79D, W93Y, S99D",10
IEKFKLLTEKVEEMVAKNARAEIDYSDAPDEFRDPLTDTLMTDPVRLPSGTVMDRSIIERHLLQQPSNPFTRQMLTESMLEPVPELVEQIQAWMREKQSSDH,3.2326813,"A8T, I14M, M37T, L59E, N64Q, S65Q, T67S, D68N, N71T, K87V",10
IQKFKDLAEKVEEIVAKNARAEIDYSDAPDEFRDPLMYTLMTDPVRLPSGTVMDRSLILRHLLNHETNPFTRQMLTESMVEPVPELKEQIQRWMREKQSSDH,3.8905094,"E2Q, L6D, D38Y, I57L, S65H, P66E, D68N, N71T, L80V, A92R",10
IEKFKLLASKVEEIVAKVARAEIDYSDAPDEFRDPLTDTLMTDPVRLPDGTVMDRSIILRHLLNSPTNPFTRQMLTESDLEPVPELKSQILAWHREKQSSDH,5.6905804,"E9S, N18V, M37T, S49D, D68N, N71T, M79D, E88S, Q91L, M94H",10
IEKFKLLAEKVEEMVAKNAREEIDYSDAPDEFRDPLMDTLMTDPVRLPSGTVMDRSIILRHLQYSPTNPFTRTRLTESMLEPVPELKIQIQNWMREKQSSDH,6.874527,"I14M, A21E, L63Q, N64Y, D68N, N71T, Q73T, M74R, E88I, A92N",10
MKKFKLLAVKVFEIVAKNARFEIDYSDAPDEFRDPLTDTLMTDPVRLPSGTVMDRSIILRHLLNSPTNPFTRQMLTEDMLEPVPELKEQIQAWMREKTSSDH,4.456279,"I1M, E2K, E9V, E12F, A21F, M37T, D68N, N71T, S78D, Q98T",10
IEKFCKLAEKVEEIVAKNARAEIDDSDAPDEFRDPLMFTLMTDPVILPSGTVMDRSIILRHLLNSPTNPFTREMLTESMLQPNPELKEQIQAWMREKQSSDH,4.714243,"K5C, L6K, Y25D, D38F, R46I, D68N, N71T, Q73E, E81Q, V83N",10
IEKFKLLLEKVETIVAKNARADIDYSDDPDEFRDPLMDQLMTDPVRLPSGTVLDRSIILRHLLNSPTNPFTRQMLTESMLEPVPELKEQIQAWVKEKQSSDH,4.530438,"A8L, E13T, E22D, A28D, T39Q, M53L, D68N, N71T, M94V, R95K",10
MEKFKLSAEKVDEIVAKNARAEIDYSDAPDEFRDPLMDTLMTDPIRLPSGTVMDRSIILRHLLNSPTNPFTREMLTESNLEPTPALKEQIQAWMREKQSSDH,1.5123675,"I1M, L7S, E12D, V45I, D68N, N71T, Q73E, M79N, V83T, E85A",10
SKKDKLLAEKVESIVAKNAEAEIDYSEAPDEFRDPLMDTLMTDPVRLPSGYVMDRSIILRHLLNSPTNPFTRQPLTESMLEPVPELKEQIQAWMREKQSSDH,7.1959195,"I1S, E2K, F4D, E13S, R20E, D27E, T51Y, D68N, N71T, M74P",10
MEKFKALAEKVEDIVAKNANAEIDYSDAPDEFRDPLMYTLMTDPVRLPNGTVMDRSIILRHLLNSPTNPFTRQMLTESMLEPVPELKEQTQAWMRQKQSSDH,5.124032,"I1M, L6A, E13D, R20N, D38Y, S49N, D68N, N71T, I90T, E96Q",10
IEKFKLLAETHQEIVAKNARAEIDGGDAPDEFRDPLMDTLMTDPVRLPSGTVMERSIILRHLLNSPTNPFTRQMLTESQLEPVPELKEQIIAWMREKQSSDH,4.6648817,"K10T, V11H, E12Q, Y25G, S26G, D54E, D68N, N71T, M79Q, Q91I",10
IEKFKLLAEKVEEIVAKNERADIDYSDAPIEFIDPLMDELMTDPVRLPSGTVMDRSIIKRHLLNSPTNPFTRQMLTESDLEPNPELKEQIQAWMREKQSSDH,3.6702871,"A19E, E22D, D30I, R33I, T39E, L59K, D68N, N71T, M79D, V83N",10
IEKFKLLAEKIEEIVAKFARARIDESDAPDEFRDPLMDTLMTDPVRLPSGTVMDRSIILRHLLNSPTNPFTRQPLTESMLEPVPELKEQIQAWMEQNQSSDH,5.7720976,"V11I, N18F, E22R, Y25E, D68N, N71T, M74P, R95E, E96Q, K97N",10
IEKFKLLAEKVEEIVAKKARAEDDDSDAPDEFRDPLMDTLMTDPVRLPSGETMDRSIILRHLLNNPTNPFTRQMLTESMLLPVPELKEQIQKWMREKQSSDH,6.5569096,"N18K, I23D, Y25D, T51E, V52T, S65N, D68N, N71T, E81L, A92K",10
IEKFRLLAEKVEEDVAKNARAEIDYSDAPDEFRDPLTDTLMTDPVILPSGTIMDREIILRHLLNSPTNPFTRQMLTEEMLEPVPKLKEQIQAWMREKQSSDH,4.667533,"K5R, I14D, M37T, R46I, V52I, S56E, D68N, N71T, S78E, E85K",10
IEKFQLLAEKVEEEVAKNARAEIDYSDAPDEFRDPLMDTLMKDPVRLPSGTVMDRSIILRHLLNSPTNPFTRQMLTSSQLEPNPELKCQIQAWMREHQSSDH,4.7220354,"K5Q, I14E, T42K, D68N, N71T, E77S, M79Q, V83N, E88C, K97H",10
IEEFKLLAEKVEEIVAKNARAEIDYSDAPDEFRDPLMYTVMTDPVILPSGTTMDRSIILRHLLNSPTNPFTRQMLTESMLEPVPELKEQIQAWMQSKQSKDH,5.134898,"K3E, D38Y, L40V, R46I, V52T, D68N, N71T, R95Q, E96S, S100K",10
IEKFKLDAEEVEEIVAKNARAEIDYSDAPDEFRDPIMDTLMTDPVCLPSGTVYDRSAILRHLLNSPTNPFTRQMLTESMLEPVPELKELIQRWMREKQSSDH,9.293547,"L7D, K10E, L36I, R46C, M53Y, I57A, D68N, N71T, Q89L, A92R",10
IEKFKLLADKIEEIVAVNARAEIDYSDIPDEFRDPLSDTLMTDPVRLPSGTVMDRSIILRHLLNEPTNPFTRQMLTESMLEPVIELKEQIQAWMREKQTSDH,5.8490415,"E9D, V11I, K17V, A28I, M37S, S65E, D68N, N71T, P84I, S99T",10
IIKFKLLAEKAEEIVAKRARAEIDNSDAPDEFRDPLMDTLMTDPVRLPSGTVVDRSIILRHLLNSPTNPFTRQPLTESMLEPVPELKEQIQKWMREKDSSDH,8.914736,"E2I, V11A, N18R, Y25N, M53V, D68N, N71T, M74P, A92K, Q98D",10
IEKFKLLAEKVYEIVAKNARAEIDYEDAPMEFTDPLMDTLMTDPVRLPSGTVMDRSIILRHLLNSHTNPFTRTMLTESMMEPVPNLKEQIQAWMREKQSSDH,0.75034755,"E12Y, S26E, D30M, R33T, P66H, D68N, N71T, Q73T, L80M, E85N",10
IEKFKQLLGKVEEFVAKNARAEIDYSAAPDEFKDPLMDTLMTDPVRLPSGTVMDRSIILRHLLNSPTNPFTRQMLTESMVEPVPELKEQIQAWMREKLSSDH,2.7523222,"L6Q, A8L, E9G, I14F, D27A, R33K, D68N, N71T, L80V, Q98L",10
IEKFKLLAEKVEEIVAKNARAEIDESDAPDEFRDTLMYTLMTDPVRLPSGTVMDRSIILRHLLNSPTNPFTRHMLHESMLEPVPELKEEIQAWMAEKQSSDD,2.3742304,"Y25E, P35T, D38Y, D68N, N71T, Q73H, T76H, Q89E, R95A, H102D",10
IEKFKLLAEKWAEIHAKNAGAEIDYSDAPDEFRDPLMDALMTDPVRLPDGTVMDRSIILRHLLNSPTNPFTRQMLTESMLEPVPELKEQIQAWFVEKQSSDH,4.0827284,"V11W, E12A, V15H, R20G, T39A, S49D, D68N, N71T, M94F, R95V",10
IAKFKLLAEKVEEVVAKNARAEDDYTDAPDEFRDPLMDTLMTDPVRLPSGTVMDRSIIEHHLLNSPTNPFTRQMMTESMLEPVPELKEQIQAWMREKFSSDH,3.681594,"E2A, I14V, I23D, S26T, L59E, R60H, D68N, N71T, L75M, Q98F",10
IEKFKNLAEKVDEIVAKDARADIDDSDAPDEFRDPLTDTLMTDPVRLPSGTVMDRSIILRHLLNSPTNPFTRQMLTEEDLEPVPELKEQIQAWMREKQSSDH,6.6897964,"L6N, E12D, N18D, E22D, Y25D, M37T, D68N, N71T, S78E, M79D",10
IEKFKLWAEKVKEIVAENAREEIDYSDAPDEFRDPLMYTLMTDPVILPSGTVMDRSIILRHLLNSPTNPFTRQPLTESMLEPVPELREQIQAWMREKQSSDH,7.9361095,"L7W, E12K, K17E, A21E, D38Y, R46I, D68N, N71T, M74P, K87R",10
IEKIKELAEKVEEIVAANARAEIDYSDAPDEFKDPLMDTLMTDPVRLPSGTVVDRSIILRHLLNSPTNPRTRQMLTESMLEPVPELKEQIQAWCREKQSSDN,9.280899,"F4I, L6E, K17A, R33K, M53V, D68N, F70R, N71T, M94C, H102N",10
IEKFKLLAEDVEEIQAKNGRAERDYSDAPDEFRDPLMDTLMDDPVRLPSGTSMDRSIILRHLLNDPTNPFTRQPLTESMLEPVPELKEQIQAWMREKQSSDH,6.2812924,"K10D, V15Q, A19G, I23R, T42D, V52S, S65D, D68N, N71T, M74P",10
IQEFKLNAEKVEEIVGKNARAEIDYSDLPDEFRDPLMDTLMTDPVRLPSGTVMDRSIIERHLLKSPTNPFTRQMLTESMLEPVPELREQIQAWMREKQSSDH,1.2928435,"E2Q, K3E, L7N, A16G, A28L, L59E, N64K, D68N, N71T, K87R",10
IEKFKLLAEKVEEIVAKNARDEIDYSDAPDEFRDPLMFTLMTDPVRLPSGTVMDRSTILRHLLNSPTNPFTRQMLTASMLEPYPELKEQIQAWLREHLSSDH,7.4039736,"A21D, D38F, I57T, D68N, N71T, E77A, V83Y, M94L, K97H, Q98L",10
IKKFKLWAEKVEEQAAKNARDEIDYSDAPDEFRDPLMYTLMTDPVRLPSGTVMDRSIILRHLLNSPTNPFTRQMLTESMLEPVPELKKQIQAWMRRKQSSDH,6.884386,"E2K, L7W, I14Q, V15A, A21D, D38Y, D68N, N71T, E88K, E96R",10
MEKFNLLAEKVEEIVVDSARAEIDDSDAPDEFRDPLMDTIMTDPVRCPSGTVMDRSIILRHLLNSPTNPFTRQMLTESMLEPVPELKEQIQAWMREKQSSDH,7.620942,"I1M, K5N, A16V, K17D, N18S, Y25D, L40I, L47C, D68N, N71T",10
IEKFKLLAEKVEEIKAKKADAEIDYSDAPDEFRDTIMDTLMTDPVRLPSGTVMDRSIILRHLSNSPTNPFTRQMLTESMLQPVPELKEQIQAWMRENQSSDH,4.929709,"V15K, N18K, R20D, P35T, L36I, L63S, D68N, N71T, E81Q, K97N",10
IEKFKLLAEKVEEIVAANRRAEEDYSDAPDEFRCPLMDTLMTDPVRLPSGTIMDRSIILRHLLNSPTNPYTRQMLTESMLEPVPGLKEQIQAWMREKQRSDH,8.45756,"K17A, A19R, I23E, D34C, V52I, D68N, F70Y, N71T, E85G, S99R",10
IEKFTLLAERVKEIVAKNARAEIDYSDAPDEFRDPLMDTLMTDPVRLPSGTVMDRSNILRHLLLSPTNPVTRQMLTESMLEPVPELKEQIQAWMREKQSHDQ,0.4622401,"K5T, K10R, E12K, I57N, N64L, D68N, F70V, N71T, S100H, H102Q",10
IEKFKLLAEKVEEIVAENARAEIDYSDDPDEFRDPIMYTLMTDPVRLPSGTVMDRSIILRHLLNQPTNPFTRQMLTESMLRPVPELKEQIYAWMEEKQSSDH,7.135932,"K17E, A28D, L36I, D38Y, S65Q, D68N, N71T, E81R, Q91Y, R95E",10
IEKFKLLAEKVEEIVAKNARHEIDYSDAPDEFRDPLMYTLMTDPVRLPSGTVMDRSIIVRHLLNSHTNPFTRQMLTESQLEPVPELNEQIQAWIREKLSSDH,6.576849,"A21H, D38Y, L59V, P66H, D68N, N71T, M79Q, K87N, M94I, Q98L",10
AEKFKRLASKVEEIVAKNARAEIDYSDIPDEFRDPLMDTLMTDPVILPSGTVMDRSIILRHLLNSPRNPFTRLPLTESMLEPVPELKEQIQAWMREKQSSDH,3.5031018,"I1A, L6R, E9S, A28I, R46I, T67R, D68N, N71T, Q73L, M74P",10
IEKFKELAEKVEEIVAKNSRAEIDASDAPTEFRDPLMDTLMTDPVRLPSGTVMDRMIILRHLVNSPTNPFTRQMLTESMLEPVPELKEQIQAWMLEKQWSDH,5.198201,"L6E, A19S, Y25A, D30T, S56M, L63V, D68N, N71T, R95L, S99W",10
KEKFKALAEEVEEIVAKNARADIDYSDAPDEFRCPLMDTLMHDPVRLPSGTVMDRSIILRHLLNSPTNPFTRQMLTESMLEPVPELLEQILAWMREKQSSDH,6.1522417,"I1K, L6A, K10E, E22D, D34C, T42H, D68N, N71T, K87L, Q91L",10
IEKFKLLAEKVAEIVAKNARAEIDYSNAPDEFLDPLMDTIMTDPVTLPSGTLMDRSIILRHLLNSPTNPFTRQMLTESMLEPVPELKEQIQAWMNETQSSDH,2.5863442,"E12A, D27N, R33L, L40I, R46T, V52L, D68N, N71T, R95N, K97T",10
IDKFKLLAGKVDEIVAKNARIEIDYSDAPDEFRDPLMDTLMTNPVRLPSGTVMDRSTILRHLLNSPTNPFTRQMLTESQLEGVPELKEQIQAWMREKQSSDH,5.842194,"E2D, E9G, E12D, A21I, D43N, I57T, D68N, N71T, M79Q, P82G",10
IEKFKLLAEKVEEIVQKNNRAEIDYSDAPDEFRDPLTDTLMTDPVRLPSGTVMDRSFILRHLLNSPTNPFTRQMLTEDMLEPVPELKEVIQAWMTEKKSSDH,4.7419815,"A16Q, A19N, M37T, I57F, D68N, N71T, S78D, Q89V, R95T, Q98K",10
IEKFKLLAEKVEELVAKNNAAEIDEDDAPDEFRDPLMDTLMTDPVRLPSGTVMDRSIILRHLLNSPTNPFTRQPCTESMLEPVPELKEQIQAWMREKQSSDP,7.517997,"I14L, A19N, R20A, Y25E, S26D, D68N, N71T, M74P, L75C, H102P",10
IEKFKLLAEKVEEIVAKNARAEIDYSEAPDEFRDPLMDTLMEDPVRLPSGTIMDRSIILRHLANSPTNPFTRQMLTDSDLEPVPELKEQIQAWMTEKDSSDH,5.6490364,"D27E, T42E, V52I, L63A, D68N, N71T, E77D, M79D, R95T, Q98D",10
MEKFKLLAEKMEEIVAKNARAEIDYSDAPDEFQDPLTDTLMTDPVRLPSGTVMDRSIILRHLLNSHTNPFTKQMLTESMLEPVPELKEQIQAWMREKDSSDY,1.9175427,"I1M, V11M, R33Q, M37T, P66H, D68N, N71T, R72K, Q98D, H102Y",10
IEAFKLLLEKVEEVVAKNARDEIDYSDAPDEFRDPLMDTLMTDPVRLPSGTVMDRSIILRHLLFSPTNPFTRQMLTPSMLEPVPELKEQIQAWIREKQSSDV,5.870234,"K3A, A8L, I14V, A21D, N64F, D68N, N71T, E77P, M94I, H102V",10
IEKFKELAEKVEEIVAKNERAEIDYSDVPDEFRDPLMDTLMIDPVRLPDGTVMDRSIILRHLLNSPTNPFTRQMLTLSMLEPVPELKERIQAWMREVQSSDH,5.462723,"L6E, A19E, A28V, T42I, S49D, D68N, N71T, E77L, Q89R, K97V",10
IEKFELLAEKVEEIVTKNADAEIDYKDAPDEFRDPLMDTLMTDPVRLPSGTVMDRSIILRHLLVSPTNPFTRQELTESMLIPNPELKEQIQAWMREKQSSDH,6.0399837,"K5E, A16T, R20D, S26K, N64V, D68N, N71T, M74E, E81I, V83N",10
IEKFKLLAEKVEEEVAKGGRAEIDYSDAPDEFRDPLMDTLMTDPVRLPSGTVMDRSIILRHLINSPTNPVTRQMLTVSDLEPVPELKEQIQAWMREKQESDH,0.8838997,"I14E, N18G, A19G, L63I, D68N, F70V, N71T, E77V, M79D, S99E",10
SEKFKLLMEKVEEIVAKRADAEIDYSDAPDEFRDPLMDTLMTDPVRLPSGTTMDRQIILRHLLNSPTNPFTRQMLTESMLEPVPELKEQIQAWKRAKQSSDH,6.5094867,"I1S, A8M, N18R, R20D, V52T, S56Q, D68N, N71T, M94K, E96A",10
IEQFKLLAEKQEEIVAKNARAEIDYSDAPDEFRDPLMDTLMTDPVRLPSGTVMDREIISRHLLNSPVNPFTRQPLLESMLEPVPELKEQIQAWMREKQSSDE,3.7492704,"K3Q, V11Q, S56E, L59S, T67V, D68N, N71T, M74P, T76L, H102E",10
IEKFKLLFEKVEEIVAKNARAEIDYSDAPDEFRDPLMDTLMTDPVRLPSGTVMERSIILRQLLNSQTNPFTRQMLTESMVEPVPELMEQIQAWRRDKQSSDH,-0.73244786,"A8F, D54E, H61Q, P66Q, D68N, N71T, L80V, K87M, M94R, E96D",10
IEKFFLLAEKHEEEVAKNARAEIDYSDAPDEFRDPLMDTLMTDPVRLPSGTVMDREIILRHLSNSPTNPFTRQMLTHSMLEPVPELKRQIQAWIREKQSSDH,5.991938,"K5F, V11H, I14E, S56E, L63S, D68N, N71T, E77H, E88R, M94I",10
IEKFKLLDAKVEEIVAKVARAEIDYSSVPDEFRDPLMDTLMTDPVRLPSGTVMDRSIILRHLLNQPTNPFTRQMLTESMLEPVPELKEQIQAWMREKQSSSE,5.497658,"A8D, E9A, N18V, D27S, A28V, S65Q, D68N, N71T, D101S, H102E",10
IEKFKMDAEKVEEIVAKEARAMDDYSDAPDEFRDPLMDTLMTDPVRLPSGTVMDRSEILRHLLNSPTNPFTRQMLTESQLEPVPELKEQIQAWMREKQSQDH,6.3526983,"L6M, L7D, N18E, E22M, I23D, I57E, D68N, N71T, M79Q, S100Q",10
ISKFKLLAEKVEEILAKNARAEDDYSDAPDEFRDPLMDTLMTDPVRLPSGTVMDRSFIKRHLLNSPTNPFTREMLTESMLEPVPELKEQIQAWIREKQSGDH,4.0292845,"E2S, V15L, I23D, I57F, L59K, D68N, N71T, Q73E, M94I, S100G",10
IEKFKLLAEKVEEIVAENARAEIDYSDIPDEFRDPLMYTLMTDPVRLPSGTVMDRSIILRHLLISPTNPFTRQMLTESMLVLVPELKEQIQAWMRETQSSDR,5.0413284,"K17E, A28I, D38Y, N64I, D68N, N71T, E81V, P82L, K97T, H102R",10
IEKFKLTAEKLEEIVDKNAPAEIDYSDAPDEFRDPLMDTLMTDPVRLPDGTVMDRSIILRHLLNSNTNPFTRKMLTESMLEPVPELKEQIQAWMRENQSSDH,6.3018208,"L7T, V11L, A16D, R20P, S49D, P66N, D68N, N71T, Q73K, K97N",10
IEKFKALAEKVEEIKAKNARAEIDYSDAPDEFRDPLMCTLMTDPVRLPSGTVMDRSIILRHLMNSPTNPFTRQPLTESMLEPNPKLKEQIQQWMREKQSSDH,5.46968,"L6A, V15K, D38C, L63M, D68N, N71T, M74P, V83N, E85K, A92Q",10
IEKFKLLAEKVEEIVAKEARAEIDYSDAPDEFRDPLMFTLMTDPVRLPSGTTLDRSIILRHLLNNPTNPFTRYMLTESMLEPVPVLKEQIQAWMREKQASDH,8.186239,"N18E, D38F, V52T, M53L, S65N, D68N, N71T, Q73Y, E85V, S99A",10
IPKFKLLAEKVEEIVAKNARAEIDDSDAPDEFRDPLMDTLMTDPVLLPSGTVLDRSIILRHLLNSPTNPFTRQHLTEEMLEPNPELKEQIQAWMRQKQSSDH,10.165213,"E2P, Y25D, R46L, M53L, D68N, N71T, M74H, S78E, V83N, E96Q",10
IEKFKLLAEKVDEIVAKNARAEDDYSDAPDEFRDPLMDTLMSDPVRLPSGTVMDRSIILRHLLNSPTNPFTRQMLTMSMIRPVPELKEQIQAWMQEKQSTDH,3.0352628,"E12D, I23D, T42S, D68N, N71T, E77M, L80I, E81R, R95Q, S100T",10
IENFKLLAEKVEEIQAKNARADIDYSDAPDEFRDPLMDTLMTDPVRLPSGTVLDRSIILRHLLNSPTNPFTRQMLHEIMLEPVPELKKQIQAWMLEKQSSDH,7.492608,"K3N, V15Q, E22D, M53L, D68N, N71T, T76H, S78I, E88K, R95L",10
MEKFKLLLEKIEEGVAKNARDEIDYSDAPDEFRDPLMDTLMTDPVRTPSGIVMDRSIILRHLLNSPTNPFTRQMLTESMLEPIPELKEQIQAWMREKQSSDH,6.597422,"I1M, A8L, V11I, I14G, A21D, L47T, T51I, D68N, N71T, V83I",10
IEKFKLLAIKVEEIVAKNAIAEIDYKDAPDEFRDPLMDTLMTDPARLPSGTVMDRSIILRHLLNDPTNPFTRQKLTESMLEPVPVLKEQIQTWMREKQSSDH,4.7079725,"E9I, R20I, S26K, V45A, S65D, D68N, N71T, M74K, E85V, A92T",10
IEKFKDLAEDVEEIVAKNARAEIDYSDAPDEFRDPLMDDIMTDPVRLPSGTVMDRSIILRHLLNDPTNPFTRQMLTESMLEPVPELKEQILAWMEEKQSSDS,6.686443,"L6D, K10D, T39D, L40I, S65D, D68N, N71T, Q91L, R95E, H102S",10
IEKFKLLAAKVEEIVQKNARAEIDDEDAPDHFRDPLMDTLMADPVRLPDGTVMDRSIILRHLLNSPTNPFTRQMLTESMLEPVPELKEQIQQWMREKQSSDH,7.526725,"E9A, A16Q, Y25D, S26E, E31H, T42A, S49D, D68N, N71T, A92Q",10
IEKFKLAAEKVEEIVAKNARDEIDDSDAPDEFRDPLMDTLMTDPVLLPTGTVMDRSIILRHLLNSPTNPFTRQMLTSDMLEPVPELKEQIQEWMREKQSSDH,7.7116566,"L7A, A21D, Y25D, R46L, S49T, D68N, N71T, E77S, S78D, A92E",10
