Sequence,Score,Mutations,Number of Mutations
MESFKLLAEKVEEIVAQNAEAEIDYSDAPDEFRDPLMDTLMLDPVRLPSGTVMDRSIILRHLMNDPTNPFTRQMLTESMLEPVPELKEQIQLWMREKQSSDH,4.5627165,"I1M, K3S, K17Q, R20E, T42L, L63M, S65D, D68N, N71T, A92L",10
IEKFKLLANKVEEIVAKNARVEGDYSDAPDEFRDPLMDTLMTDPVRLPSGTVVDRSIILRHLLNSPTNPFTGQMLTETMLEPVPELKEQIQAWMREKQGSDQ,3.5427165,"E9N, A21V, I23G, M53V, D68N, N71T, R72G, S78T, S99G, H102Q",10
IEKFKLLAEKVECIVAKNANDEIDYSDLPDEFRDPLMDTLMTPPVRLPSGTVMDRSIILRHLLNNPTNPFTRQMLTESMLEPVPELKEKIQAWMREKQSVDH,6.4325905,"E13C, R20N, A21D, A28L, D43P, S65N, D68N, N71T, Q89K, S100V",10
IEEFKLLADKVEEIVAKNARVEIDYSDAPDEFRDPLMDTLMTDPVRLPSGTVMDRSLIKRHLLNSPTNPFTRQMLTEDMLEPRPELLEQIQAWMREKQSSDH,4.3203077,"K3E, E9D, A21V, I57L, L59K, D68N, N71T, S78D, V83R, K87L",10
IEKFKDLCEKVNEIVAKNARAEIDYVDAPDEFRDPLLDTLMTDPVRLPSGTVMDRSIIKRHLLNSPTNPFTRQMLTESMLIPRPELKEQIQAWMREKQSSDH,6.9596877,"L6D, A8C, E12N, S26V, M37L, L59K, D68N, N71T, E81I, V83R",10
IEKAKLLHETVEEIVAKNARAEDDYSDAPDEFRDPLMDTLMTDPVRLPSGTVMDRSIILQHLLNSNTNPFTRQMLTESMVEPVRELKEQIQAWMREKQSSDH,3.8381739,"F4A, A8H, K10T, I23D, R60Q, P66N, D68N, N71T, L80V, P84R",10
ISKKKLLMEKVEEIVQKNARDEIDYSDAPDEFRDPLMFTLMTDPVRLPDGTVMDRSIILRHLLNSPTNPFTRQMLTESMLEPVPELKEQIQAWMREKQRSDH,6.0393095,"E2S, F4K, A8M, A16Q, A21D, D38F, S49D, D68N, N71T, S99R",10
IEKFDLLAEKVEEIVEKNARAEIDDSDIPDEFRDPLMDTLMRDPVRLPDGTVMDRKIILRHLLNSPTNPFTRQMLTESMLEPTPELKEQIQAWMREKQSSDH,7.134232,"K5D, A16E, Y25D, A28I, T42R, S49D, S56K, D68N, N71T, V83T",10
IEKNKLIAEKVEEIVAKNARAEIDYSDIPDEFRDPLMDTLMTDPVRLPSGTVMDRSIILRHLQNSPTNPFTRQMLDESMLEPVPELKELIQAWVREKQSLDH,5.8136106,"F4N, L7I, A28I, L63Q, D68N, N71T, T76D, Q89L, M94V, S100L",10
IENDKLLTEKVEEIYAKNARAEIDYSDAPDEFRDPLMDTLMTDPVRLPSGTVVDRKIILRHLLNSPTNPFTRQPLTGSMLEPVPELKEQIQAWMREKQSSDH,8.088188,"K3N, F4D, A8T, V15Y, M53V, S56K, D68N, N71T, M74P, E77G",10
IEKFKLLSEKVNEIVAKNARAEIDYSDAPDEFRDPLMYKLMTDPVRLPSGTVMDRSDILSHLLNSHTNPFTRQMLTESMLEPVPELKEDIQAWMREKQSSDH,4.4341516,"A8S, E12N, D38Y, T39K, I57D, R60S, P66H, D68N, N71T, Q89D",10
IGKFKELAEKVEEITAKIARAEIDYSDAPEEFRDPLMDFLMTDPVRLPSGTVMDRSIILRHLLKSPTNPFTRQMLTESMLEPVPELKEQIQAWMAEKQSSDH,2.118702,"E2G, L6E, V15T, N18I, D30E, T39F, N64K, D68N, N71T, R95A",10
MEKDKLLAEKVEEIVAKNARAEIDYSDAPDEFRDPLMFTLMTDPVRLPSGTVLDRSIILRHLLVSPTNPFTRQSLTESMLEPVPELKEQIQEWWREKQSSDH,8.357628,"I1M, F4D, D38F, M53L, N64V, D68N, N71T, M74S, A92E, M94W",10
IEKFKLLVEKVEEIVAKNARAEIDYSEAPTEFRDPLMDTLMTDPVRLPSGTVMDRSIILRHLLNSPTNPFTRQMLTESQLELVPELKEQVEAWMREKQSSSH,2.7622652,"A8V, D27E, D30T, D68N, N71T, M79Q, P82L, I90V, Q91E, D101S",10
IGKFKALAEKVEEIVALNARAEIDYSDAPDEFKCPLMDTLMTDPVRIPSGTVMDRSIILRHLLNSPTNPFTRQMLTESMLEPVPELKEQIQAWMREKLSSDL,5.262745,"E2G, L6A, K17L, R33K, D34C, L47I, D68N, N71T, Q98L, H102L",10
IEKFKLLAEKVEEIVAKNFRAEIDYSDVPDEFQDPLMDTLMTDPVRLPSGYVMDRSIILRHLLNSPTNPFTRQMLTESDLEPVPELKEQIQVWMRDKQSSFH,4.4128723,"A19F, A28V, R33Q, T51Y, D68N, N71T, M79D, A92V, E96D, D101F",10
IEKDKLLAEKAEEIVAKNARAEIDYSDVPDEFRDPLMHTLMTDPVRLPDGTVMDRSIILRHLLNSPTNPYTRQMLTEGMLEPVPELKEQIQAWMRAKQSSDH,5.719661,"F4D, V11A, A28V, D38H, S49D, D68N, F70Y, N71T, S78G, E96A",10
IEKRKLLAEKVEEIKAKNAGAEIDYSDAPDEFRDPLMYTLMNDPVRLPSGTVMDRSFILRHLLNSPTNPFTRAMLTESSLEPVPELKEQIQAWMREKQSSDH,5.688344,"F4R, V15K, R20G, D38Y, T42N, I57F, D68N, N71T, Q73A, M79S",10
IEKFKLLAEKVAEIVAKNARAEIDYVTAPDEFRDPLMDTLMVDPVRLPSGTVMDRSIILRHLLNSETNPFTRQMLTESMLEPVPELKAQIQAWMREKKSSDK,5.779917,"E12A, S26V, D27T, T42V, P66E, D68N, N71T, E88A, Q98K, H102K",10
IETFKLLAEKVEEIVARNLRAEIDDSDAPDEFRDPLMDTLMTDPVRLPSGTVMDRSIILRHLLNSPQNPFTRQPLTESMLEPKPELKEQIQAWMREKQSSRH,5.997923,"K3T, K17R, A19L, Y25D, T67Q, D68N, N71T, M74P, V83K, D101R",10
IEKFKSLAWKVEEIVAKNARAEIDYSDAPDEFRDPLMYTLMTDPVRLPSGTVMDRSIILRHLLNSPTNPFTRQMLTEQQLEPVPELVEQIQAWMREKLSSYH,6.45156,"L6S, E9W, D38Y, D68N, N71T, S78Q, M79Q, K87V, Q98L, D101Y",10
IEKFKLLAEKVEEIVIQNARADIDYSDAPDEIRDPLMDTLMTDPVRLPSGTVMDRSIILKHLLDSPTNPFTRQMLTESMLEPVPELKAQIQAWMREQQSSDH,1.7030108,"A16I, K17Q, E22D, F32I, R60K, N64D, D68N, N71T, E88A, K97Q",10
IEKIKLLEEKVEEIVAKNARAEIDYSDAPDEFRDPLMYTLMEDPVVLPSGTVMDRSIINRHLLNSPTNPFTRQMLTESMLEPVPEMKEQIQAWMREKQSSDI,8.8176775,"F4I, A8E, D38Y, T42E, R46V, L59N, D68N, N71T, L86M, H102I",10
IEKDKLLAEKVEEIVAKNARAEIDYSDAPDEFRDPLMDTLMTDPVRSPSGTVMDRQIIARHLLNSPTHPFTRQPLTESMLEPNPELKEQIEAWMRENQSSDH,1.4475005,"F4D, L47S, S56Q, L59A, D68H, N71T, M74P, V83N, Q91E, K97N",10
IEKFKLLPEKVEEIVAKNTRAEEDYSDAPDEFRDPLTDTLMTDPVRLPSGTVLDRSFILRHLLVSPTNPFTRQMLTESMIEPVPELKEQIQAWMREKQSSDH,6.9806643,"A8P, A19T, I23E, M37T, M53L, I57F, N64V, D68N, N71T, L80I",10
IEKFKLLAEKVDEIVAKNIRAEIDYSDAPDEFRDPIMDTLMTDPVRLPSGTVLDRSVILRHLLNDKTNPFTRQMLTESMLEPNPELKEQIQAWMREKQSSDH,11.936047,"E12D, A19I, L36I, M53L, I57V, S65D, P66K, D68N, N71T, V83N",10
IEKFKLQAEKVEEIVAKEARAEIDYSDAPDEFRDPLTDTLMKDPVRLPSGTVMDRSIIVRHLLNSPTNPFTRQMLTEDMVEPVPELKEQIQAWMREKQSSDE,3.7001746,"L7Q, N18E, M37T, T42K, L59V, D68N, N71T, S78D, L80V, H102E",10
IEKFKLLKERVEEIVAKNERAEIDYSDAPDEFRDPLTDTLMTDPVRLPSGTVMDRSIILRHLMNSPTNPFTRQMLTESMLEPVPYLKEQIQAWMREWQSSNH,5.2425556,"A8K, K10R, A19E, M37T, L63M, D68N, N71T, E85Y, K97W, D101N",10
IEPFKLLARKVEEIVAKNAMDEIDYSDAPDEFRDPLMDHLMTDPVRLTSGTVMDRSIILRHLLNSDTNPFTRQMLTESMLEPVPELKEQIQAWMREKQSSDT,3.546693,"K3P, E9R, R20M, A21D, T39H, P48T, P66D, D68N, N71T, H102T",10
IEEFKLLEEKVEEIVAENNRAEIDYSDAPDEFRDKLMDTLMTDPVRLPDGTVMDRSIILRHLMNSPTNPFTRQMLTESMIEPVPELKEQIQAWMREKQSSDH,5.0409336,"K3E, A8E, K17E, A19N, P35K, S49D, L63M, D68N, N71T, L80I",10
IEKFKLLEEKVEEIVQKEARAEIDYSDAPDEFRDPLMDTLMTDPVRLPSGTVMDRSIILRHLLNEPTNPFTRQMLTEHMLEPVPELKEQIVAWMREKQSIDE,4.608282,"A8E, A16Q, N18E, S65E, D68N, N71T, S78H, Q91V, S100I, H102E",10
MEKFKLLIEKFEEIRAKNARAEIDYSDIPDEFRDPLMDTLMTDPVRLPSGQLMDRSIIRRHLLNSPTNPFTRQMLTESMLEPVPELKEQIQAWMREKQSSDH,5.8298216,"I1M, A8I, V11F, V15R, A28I, T51Q, V52L, L59R, D68N, N71T",10
MENFKLYAEKVKEIVAKNARADIDYSDAPDEFRDPLMYTLMTDPVRLPSGTVMDRSIILRHLLNSPTNPFTRQMLTESMLEPRPELKEKIQAWMREKQSSDH,7.23166,"I1M, K3N, L7Y, E12K, E22D, D38Y, D68N, N71T, V83R, Q89K",10
MEKFKLLFHKVEEIVAKNARAEIDYSDAPDEYRDPLMDTLMTDPVRLPSGTVYDRSLIDRHLLNSPTNPFTRQELTESMLEPVPELKEQIQAWMREKQSSDH,6.541235,"I1M, A8F, E9H, F32Y, M53Y, I57L, L59D, D68N, N71T, M74E",10
IEKFKKLAEKVEEIVAKPAEADIDYSDIPDEFRDPLMDTLMTDPVRLPSGYVMDRSIILRHLLNTPTNPFTRQMLTESMLEPVPELKEQIQAWMREKQSSDT,4.855258,"L6K, N18P, R20E, E22D, A28I, T51Y, S65T, D68N, N71T, H102T",10
IEHFKLLAEKVEEIDAKNARADSDYSDAPDEFRDPLSFTLMTDPVRLPSGTVMDRSIILRHLLNSPTNPFTRQMLTEDMLEPVPELKEQIDAWMREKQSSDH,5.458164,"K3H, V15D, E22D, I23S, M37S, D38F, D68N, N71T, S78D, Q91D",10
IEKFKLLANKVEEIVSKNARDEIDYSDAPDEFLDPLMDTLMTNPVRLPSGTVLDRSIILRHLLNSPTNPFTRLMLTESMLEPVPELKEQIQAWMREKNSSDH,8.420472,"E9N, A16S, A21D, R33L, D43N, M53L, D68N, N71T, Q73L, Q98N",10
KEKFKLLAEEAEEIVAKNARAEIDQSDAPDEFRDPLMDTLMTDPVRLPDGTVMDRSIILRHLLTSPTNPFTRQMLTESMLKPVPELKESIQAWMREKQSSDH,5.0872154,"I1K, K10E, V11A, Y25Q, S49D, N64T, D68N, N71T, E81K, Q89S",10
IEKFKILAEKVEEIVAKNARAEIDYSDAPDEFRDPLMDTIMTDPVTLPSGTVMDRSIIERHLLNEPTNPFTRQMLTMSMLEPVPEVKEQIQAWMRRKQSSDH,2.5447235,"L6I, L40I, R46T, L59E, S65E, D68N, N71T, E77M, L86V, E96R",10
IEKFKLLAEKVEEIEAKNDRAEIDYSDAPDEFRDPLMYTLMTDPVRLPSGTVMDRSIILRHLINSPTNPFTRQMLTFSMLLPMPELKQQIQAWMREKQSSDH,6.4128046,"V15E, A19D, D38Y, L63I, D68N, N71T, E77F, E81L, V83M, E88Q",10
IYKFKLLAEDVEEIVVKNAVADIDYSDAPDEFRDPLMDTLMTDPVRLPSGTVMDRSIILRHLLNSPTNPFTRQMLTESMLEPVPELKEQIQAWKRENQSSQH,5.297682,"E2Y, K10D, A16V, R20V, E22D, D68N, N71T, M94K, K97N, D101Q",10
IKKFKLNAGKVEEIVAKNARAEIDYSDAPDEYRDPLMDTLMTDPVRLPSGTVMDRSIILRHLLFDPTNPFTRQMLTESMLEPVPELKEQIQAWMREKNSSFH,5.256426,"E2K, L7N, E9G, F32Y, N64F, S65D, D68N, N71T, Q98N, D101F",10
IEKFKLLAEKVEEIVAKNARAEIDYSDAPDEFRDPLTDRLMTDPVRLPDGTVMDRSIILRHLLNSPTNPLTRQMLTESELEPVPELKEQIQAWMIEKNSSDF,-0.8715039,"M37T, T39R, S49D, D68N, F70L, N71T, M79E, R95I, Q98N, H102F",10
IEKFKLLAEKVEEIVAKNARAEIDYSDAPLEFRDPLNDTIMTDPVRLSSGTVMDRSIILRHLVNSPTNPFTRQPLTESMLEPVPELKEQIQAWMRVPQSSDH,4.501377,"D30L, M37N, L40I, P48S, L63V, D68N, N71T, M74P, E96V, K97P",10
IEKRKLLAEKVEEQVAANARAEIDYSDAPDEFRDPLMDTLMTDPVRLPSGTVMDRDIIQRHLLNDPTNPFTRQMLTESMLLPVPELKEQIQAWMREKQSKDH,6.240046,"F4R, I14Q, K17A, S56D, L59Q, S65D, D68N, N71T, E81L, S100K",10
IEKFKLLREKVEEIVAKNADAEIDYSDAPDEFRDPLMDTLMQDPVRLPSGTVMDRSIILKHLLNSPTNPFTRQMLTENMLKPVPELHRQIQAWMREKQSSDH,5.463698,"A8R, R20D, T42Q, R60K, D68N, N71T, S78N, E81K, K87H, E88R",10
IEKFKLGAEKVEEIVAENARAEIDYSDAPDEFRDPLMDTLMTDPVLLPSGTVLDRSTILRHLLNSPTNPWTRQMLTESMLEPVPELKEEIQAYMREKQSSDH,10.474039,"L7G, K17E, R46L, M53L, I57T, D68N, F70W, N71T, Q89E, W93Y",10
IEKFKLLAEKVDEYVAKNARAEIDYSDVPDEFRDPLMDTLMKDPVRLPSGNVMDRSIILRHLLNSPTNPFTRQMLTEEMLEPVFELKEQIQAWMRENQSSDH,6.4400187,"E12D, I14Y, A28V, T42K, T51N, D68N, N71T, S78E, P84F, K97N",10
IEKFKLLLEKVEEIVAKQARAEIDYSDAPDEFRDPLMFTLMTNPVRLPSGTVMDRSIILNHLLNSPTNPFTREMLDESDLEPVPELKEQIQAWMREKQSSDH,1.7991617,"A8L, N18Q, D38F, D43N, R60N, D68N, N71T, Q73E, T76D, M79D",10
IEKFKKLAEKVEEIKKKNARAEIDYKDAPPEFRDPLMDTLMTDPVRLKSGTVMDRSIILRHLLNNPTNPFTRQMLTESMLMPVPELKEQIQAWMREKQSSDH,6.0825872,"L6K, V15K, A16K, S26K, D30P, P48K, S65N, D68N, N71T, E81M",10
IEKFKLLAEKVEEIVAKNNMAEIDYSDAPDEFRDPLMDTLMTDPVRLPSGTVMDRSVILRHLLNSPTNPFTRQMLTESDLKPVPALKEQIQAWVREKQRSDH,6.466093,"A19N, R20M, I57V, D68N, N71T, M79D, E81K, E85A, M94V, S99R",10
IEITKLLAEKVEEIVAKEARAEIDYSDAPDEFRDPLMDTLMTDPVRLPSGTVMDRSIILRHLLNSPTNPFTRQMLTESMLHPVPELKERIDAWMRRKGSSDH,4.9950843,"K3I, F4T, N18E, D68N, N71T, E81H, Q89R, Q91D, E96R, Q98G",10
IEKFKLLAEKVEEIVAENARAEIDYEDAPDEFLDPLMDDLMTDPVILPDGTVMDRSIILRHLLNSPTNPFTRQMLPESMLEPVPELKKQIQAWMREKQSSDH,3.4424663,"K17E, S26E, R33L, T39D, R46I, S49D, D68N, N71T, T76P, E88K",10
IEKFKLLAEKVEEIVNANAEDDIDYSDAPDEFRDPLMDTLMTDPVRLPSGTVLDRSIILRHLLNSPTNPFTRQMLTESMLEPVPELKEQIQAWMLLKQSSDH,9.526051,"A16N, K17A, R20E, A21D, E22D, M53L, D68N, N71T, R95L, E96L",10
IEKVKLLAEKVEEINAKNARAEHDYSDAPDEFRCPLMDTLMTDPVRLPSGTVMDRSIILRHLGNSPTNPFTRQMLTESMIEPVPELKQQIQAWMREKQSSDE,5.6074634,"F4V, V15N, I23H, D34C, L63G, D68N, N71T, L80I, E88Q, H102E",10
IEKFKRLAEKVEEIVAKNARAEFDDSDAPDEFRDPLMYTLMTDPVRLPSGTVLDRSIILAHLLNSNTNPFTRQMLTESMLEPVPELKEQIQAWMREKQSSDD,12.641643,"L6R, I23F, Y25D, D38Y, M53L, R60A, P66N, D68N, N71T, H102D",10
DEDFKLLAEKFEEIVAKNARAEIDYSDIPDEFRDPLMDTLMTDPVRLPSGTVIDRSIILRHLLNDPTNPFTRQMLTESMLEPVPEIKEQIQAWMREKQSSDS,6.727046,"I1D, K3D, V11F, A28I, M53I, S65D, D68N, N71T, L86I, H102S",10
IEKFKLPAEVVEEIVAKNARAEIDESDAPDEFRDPLMDTVMTDPVRLPSGTVMDRSIILRHLLNNDTNPFTRQMLTDSMLEPVPELKEEIQAWMREKQSSDH,5.5337496,"L7P, K10V, Y25E, L40V, S65N, P66D, D68N, N71T, E77D, Q89E",10
IEKFKLDAEKVEEIVAKNARAEIDYSDIPDEFRDPLMYTLMTDPVLLPSGTLMDRSIILRHLLNSPTNPFTRQMLTESMLEPVKELKEQIQAWMEEKQSGDH,6.088421,"L7D, A28I, D38Y, R46L, V52L, D68N, N71T, P84K, R95E, S100G",10
IEPFKLLAEKVEEINAKDARAEEDYSDIPDEFRDPLMDTLMTDPVRLPSGTVMDRSIILRHLLNSPTNPFTRQMLTESMLEPVPTLKEQIQHWMIEKQSSDH,6.1617694,"K3P, V15N, N18D, I23E, A28I, D68N, N71T, E85T, A92H, R95I",10
IEKFKLLSEKVEEIVAKNARAEIDYSDAPDEFKDPLTDTLMTDPVRLPSGTTMDRSIILRHLLNSQTNPFTRQMLTSSQLEPVPELKEKIQAWMREKQSSDH,4.7239094,"A8S, R33K, M37T, V52T, P66Q, D68N, N71T, E77S, M79Q, Q89K",10
DEKFKLLAEKVEEDVAKNAKAEIDDSDMPDEFRDPLMDTLMTDPVRLPSGTVMDRSIILRHLLDSPNNPFTRQMLTESMLEPNPELKEQIQAWMREKQSSDH,5.661454,"I1D, I14D, R20K, Y25D, A28M, N64D, T67N, D68N, N71T, V83N",10
MEKFKLLAEKVEELVALNARAEIDYSDAPDEFIDPLSDTLMTDPVRLPSGTVMDRSIILRHLLNSPTNPFTRQMLTESMLEPVPELKQKIQAWMREKQDSDH,4.1601524,"I1M, I14L, K17L, R33I, M37S, D68N, N71T, E88Q, Q89K, S99D",10
EEKNKLLAEKVEEIVAKNARAEIDYYDAPDEFRDPLMDTIMTDPVRLPSGTVMNRSIILRHLSNSPTNPFTRQMLTESMLEPVPLLKDQIQAWMREKQSSDH,4.2627954,"I1E, F4N, S26Y, L40I, D54N, L63S, D68N, N71T, E85L, E88D",10
IEKFKLLAEKVEEILAKNAREEIDYSDAPDEFRDPLMDTLMTDPVRLPSGTVMERSIILEHLLNSPKNPFTRQPLTESMLEPVPELKEQIQAWFREKDSSDH,6.090025,"V15L, A21E, D54E, R60E, T67K, D68N, N71T, M74P, M94F, Q98D",10
MNKFDLLAEKVEEIVAKNARAEIDYSDAPDEFRDPLMDTLMTDPVRLPSGTVMDRSIILRHLLNDPTNPFTRQPLTDSMLEPVDELKEQIQAWMREKRSSDH,4.3221,"I1M, E2N, K5D, S65D, D68N, N71T, M74P, E77D, P84D, Q98R",10
IEKNKLMAEKVEEIVAKNARAELDYSDAPDEFRDPLMDRLMTDPVILPSGTVMDRSIILRHLLDSPTNPFTREMLTESMLEPVPELKIQIQAWMREKQSSDH,1.6053963,"F4N, L7M, I23L, T39R, R46I, N64D, D68N, N71T, Q73E, E88I",10
MEKFKLLAEKVEEIVAKNADAEIDYSDAPDEFRDPLMYTLMTDPVRLPSGTVMDRSIILRHFLNSCTNPFTREMLTDSMLEPVPELKEQIQAWMRENQSSDH,4.669802,"I1M, R20D, D38Y, L62F, P66C, D68N, N71T, Q73E, E77D, K97N",10
IEKEHLLAEKVEEIVAKNARADIDDSDAPDEFRDPLMDTLMTDPVRLPSGTVMDRSYILRHLLNSPTNPFTRQMLTESMLEPNPELKEQIQIWLREKQSSDH,6.9142,"F4E, K5H, E22D, Y25D, I57Y, D68N, N71T, V83N, A92I, M94L",10
MEKFKLLAEKHEEIAAKNARAEIDYSDAPDEFRDPLTDTLMTDPVRLPSGTVMDRSIILRHLLNSPTNPFTRQMLTELMLEPVPELKQQIEAWMREKQSSDI,5.7084455,"I1M, V11H, V15A, M37T, D68N, N71T, S78L, E88Q, Q91E, H102I",10
IEKFKLLAVKVGEIVAKNARDEIDYSDAPDEFRDPLMDTVMTDPVRLPSGAVMDRSIILRHLTNSRTNPFTRQMLTESMLEPVPELQEQIQAWMREKQSSDH,4.194744,"E9V, E12G, A21D, L40V, T51A, L63T, P66R, D68N, N71T, K87Q",10
IEKFKLLAQEVEEIVAKNASAEIDYSDAPDEFRDPLMDTLMTDPVRLPSGTVMDRSIILDHLLNSYTNPFTRQMLTESMLEPVPYLKEQIQAWMREKQSSIS,5.7855015,"E9Q, K10E, R20S, R60D, P66Y, D68N, N71T, E85Y, D101I, H102S",10
IEKFNLLAEKVEEIVAKNARLEIDDTDAPDEFRDPLMDTLMTDPVRLPSGTVMDRSIILRHLLNSPTNPFTRQMLTESMLEPVPDLKFQIQAWMDEKQSSFH,7.243449,"K5N, A21L, Y25D, S26T, D68N, N71T, E85D, E88F, R95D, D101F",10
IEKFKLLAKKVDEEVAKNARREIDYSDLPDEFRDPLMDTLMTDPVRLPSGTVMDRSIILNHLLNSPTNPFTRQMLTESMLEPDPALKEQIQAWMREKQSSDH,5.1409597,"E9K, E12D, I14E, A21R, A28L, R60N, D68N, N71T, V83D, E85A",10
IEKMKPLAEKVEELVAKNARAEIDYSDAPDEFLDSLMDTLMTDPVILPSGTIMDRSIILRHLLNSPTNPFTRQMLTESMLIPVPELKEQIQAWMREKQSSDH,0.10564503,"F4M, L6P, I14L, R33L, P35S, R46I, V52I, D68N, N71T, E81I",10
IEKNKLLAEKVEEIVAKNARAEIDYSDAPDEFRDPLMDTLMTDPVILPSGTVMDRSDILRHLLNSPTNPFTRQMLSFSMLEPVPELKAQIQEWMREKQQSDH,4.327933,"F4N, R46I, I57D, D68N, N71T, T76S, E77F, E88A, A92E, S99Q",10
KEKNKLLAERVEEIVAKNARAEIDYEEAPDEFRDPLTDTLMTDPVRLPSGTVMDRSIILRHLLNQPTNPFTRQMLTESDLEPVPELKEQIQAWMREKQSSDH,4.1453533,"I1K, F4N, K10R, S26E, D27E, M37T, S65Q, D68N, N71T, M79D",10
IEKFNLLAEKVEEIVAMDARAEIDYSDAPDEFRDPLMDTLMTDPVRLPSGHVMDRSIILRHLLNSPTNPFTRQMLTESMLETNPELKEQVEAWMREKQSSDH,5.3986616,"K5N, K17M, N18D, T51H, D68N, N71T, P82T, V83N, I90V, Q91E",10
IEKFKLAATKWDEIVAKNAQADIDYSDAPDEYRDPLMDTLMTDPVRLPSGTVMDRSIILRHLLNSPTNPFTRQMLTESMLEPVPELKEQIQAWMREKQSSPH,6.3426404,"L7A, E9T, V11W, E12D, R20Q, E22D, F32Y, D68N, N71T, D101P",10
IHKFKLLAEKFEEIVAKNARAEIDYSDAPDEFLDPLTDTLMTDPVRLPSGKVMDRSIILRHLLNSPTNPFTRQMLTESQLRPVPELKEKIQAWMREKQSSDH,4.346834,"E2H, V11F, R33L, M37T, T51K, D68N, N71T, M79Q, E81R, Q89K",10
IEKFKQLADKVEEIVAYNARAEIDYSDAPDEFRDPLMDDLMVDPVRLPDGTVMDRSIILRHLLDSPTNPFTRQMLTESMLEPVPELKEQIQAWMRENQSSDH,6.0977526,"L6Q, E9D, K17Y, T39D, T42V, S49D, N64D, D68N, N71T, K97N",10
MEKFKLLLLKVEEINAKNARAEIDDSDAPDEFRDPLMDTLMTDPVRLPSGTVMDRSIILRHLLNSPTNPFTRMMLTEEMLEPVPELKEQIQAWMREKQVSDH,6.2824917,"I1M, A8L, E9L, V15N, Y25D, D68N, N71T, Q73M, S78E, S99V",10
IEKFKLLAEKVEEIVAKNARADINDSDAPDEFRDPLMYTLMTDPVVLPSGTVIDRSIIMRHLLNSPTNPFTRQMLTESMLEPVPQLKEQIQAWMREKQSSDH,9.987915,"E22D, D24N, Y25D, D38Y, R46V, M53I, L59M, D68N, N71T, E85Q",10
IEKFKELAEKVEEIVAKNARAEDDYSDAPDEYRDPLMDTLMTDPVRLPSGTVMDRSIILRHLLNDPTNPFTRQPLTESMLEPRPELKAQIQAWFREKQSSDH,5.924968,"L6E, I23D, F32Y, S65D, D68N, N71T, M74P, V83R, E88A, M94F",10
IEKFKLLAEKVEEDVAKVARAEDDYSDAPDEFRDPLMDTLMTDPVRLTSGHVMDRSSILRHLLNSPTNPFTRQPLTESMLIPVPELKEQIQAWMREKQSSDH,4.239617,"I14D, N18V, I23D, P48T, T51H, I57S, D68N, N71T, M74P, E81I",10
IEKFKELAMKVEEEVEKNARAIIDYSDAPDEFRDPLMDQLMTDPVRLPSGTVMDRSIILRHLLNSPTNPLTRQMLTESMLEPVPELKEQIQAWMREKQSSEH,1.3497056,"L6E, E9M, I14E, A16E, E22I, T39Q, D68N, F70L, N71T, D101E",10
IEKIKLLAEKAEEIVRKNARAEADYSDAPDEFRDPLMDTLMTDPVRLPSGTVMDRSIILRHLLNNPTNPFTRQMLTESMLQPVPFLKAQIQAWMREKQSSDH,4.8773355,"F4I, V11A, A16R, I23A, S65N, D68N, N71T, E81Q, E85F, E88A",10
IEKFKFLAEKFEEIVDKNARDEIDYSDAPDEFRDPIMDTLMTDPVRLPSGHVMDRSIILRHLLNSPTNPFTRQMLTESMLEPVPELKEQIQAWMRMKQSSDA,9.6189,"L6F, V11F, A16D, A21D, L36I, T51H, D68N, N71T, E96M, H102A",10
IEKFKLLAEVVEEAVAKNARAEIDYSDAPDEFLDPLSDTLMTDPVRLPSGTVMDRSIILRHLLNSPTNPFTRQLLTESMLEPRPELKEQIQRWMRENQSSDH,5.8959427,"K10V, I14A, R33L, M37S, D68N, N71T, M74L, V83R, A92R, K97N",10
IEKFKLLAPKVYEIVAKSARAEIDYSDAPDEFRDPLMDTLMTDPVRLPSGTVMDRSIIRRHLINSPTNPFTREMLTESMLVPVPELKEQIQQWMREKQSSDH,3.4602137,"E9P, E12Y, N18S, L59R, L63I, D68N, N71T, Q73E, E81V, A92Q",10
IVKFKLLAEKVEEIVAKNARDEIDYSDAPDEFRDPIMDTLMNDPVRLPSGTVMDRSAILRHLLYSPTNPFTRQMLTESMLEPVPELKEQIQAWMRSKQISDH,8.579858,"E2V, A21D, L36I, T42N, I57A, N64Y, D68N, N71T, E96S, S99I",10
IEKFKDLAEKVEPIVAKNADAEIDDSDAPDEFRDPLMDTLMTDPVRLPSGTVMDRSIILRHLLNKPTNPFTRQMLTEDELEPVPELKEQIQDWMREKQSSDH,7.4300127,"L6D, E13P, R20D, Y25D, S65K, D68N, N71T, S78D, M79E, A92D",10
IHKFKLVAAKVEEVDAKNARAEIDDSDAPDEFRDPLMDTLMTDPVRLPSGTVMDRSIILRHLLNSPTNPFTRQELTESMLEPEPELKEQIQAWMREKQSSDH,6.098097,"E2H, L7V, E9A, I14V, V15D, Y25D, D68N, N71T, M74E, V83E",10
IEKFKLLAEKVEEIVAKNARAEIDYDDAPDEFRDPLMDTLMYDPVRLPSGTAMDRSIILRHVLNSPTNPFTRQMLTEDMLIPVPELKEQIQLWMREKQQSDH,1.3468399,"S26D, T42Y, V52A, L62V, D68N, N71T, S78D, E81I, A92L, S99Q",10
IEKFKKLAEKVHEIDAANARAEIDYSDAPDEFRDPLTDTLMTDPVLLPSGTVMDRSIILRHLLNSPTNPFTRQMLTEEMLEPVPELKEQIQAWMRENQSSDH,6.303154,"L6K, E12H, V15D, K17A, M37T, R46L, D68N, N71T, S78E, K97N",10
KEKFKLEAETVEEIVAKNARAEDDYSDAPDEFRDPLMDTLMLDPVRLPSGTVMDRSIILRHLLNSPTNPLTRQMLTESQLEPVPELKEQIDAWMREKQSSDH,1.2462239,"I1K, L7E, K10T, I23D, T42L, D68N, F70L, N71T, M79Q, Q91D",10
IEKFKDLAEKVEEIVAKNARAEQDYSDAPDEFRDPLMDTIMTDPVRLPSGTVMDRSIILRHLLNNPTNPYTRQMLTESMLEPVPELKEQIQAWIDDKQSSDH,8.351725,"L6D, I23Q, L40I, S65N, D68N, F70Y, N71T, M94I, R95D, E96D",10
IAKFALLAEKVENIVAKNARAEIDYSDAPDEFIDPLMDTLMTDPVRLPSGTVLDRSIILRHLLNDPTNPYTRQMLTESMLEPVPELKEQIQAWMREKQMSDH,8.509012,"E2A, K5A, E13N, R33I, M53L, S65D, D68N, F70Y, N71T, S99M",10
IEKFKLLAEKLDEIVAKNKRDEIDESDAPDEFRDPLTDTLMTDPVRLPSGTVMDRSIILRHLLNDPTNPFTRQMLTNSMLEPVPELKEQIQAWMREKQSSDH,4.5271773,"V11L, E12D, A19K, A21D, Y25E, M37T, S65D, D68N, N71T, E77N",10
IEKFKLLAKAVEEVVAKNARAEIDYEDAPDEFRDPLMDTLMTDPVRLFSGTVMDRSVILRHLLNSPTNPFTRQMLTESMLEPVFELKEQIQAWMREKLSSDH,5.9252687,"E9K, K10A, I14V, S26E, P48F, I57V, D68N, N71T, P84F, Q98L",10
IEKFKLLAEKVEEAVAKNAREEIDYSDVPDEFRDPLMDTLMTDPVRLPSGTVMDRSIILRHLLNSPTNPFTRKMLTETMVEPVPELKEQIVAWMREKQSSSH,4.210223,"I14A, A21E, A28V, D68N, N71T, Q73K, S78T, L80V, Q91V, D101S",10
IEKFKLLAEKVEEIVAKNARAEIDEEDAPDEFRDPLMDTLMEDPVRLPSGTVMDRSIILRHLLNSPTNPFTRQMLTESMLEPNPELKEQIQAWMNHHQSSDQ,5.7643228,"Y25E, S26E, T42E, D68N, N71T, V83N, R95N, E96H, K97H, H102Q",10
IEDFKLLAERVEEIVAKNARAEIDYSDAPDEFLDPLMDTLMTDPVRLPSGITMDRSIILRHLLNSPTNPFTRQMLTENMLEPVPELKEQIQAWMKEKQSWDH,3.5788517,"K3D, K10R, R33L, T51I, V52T, D68N, N71T, S78N, R95K, S100W",10
IEDFKKLAEKVEEIVAKNDRAEIDYSDAPDEFRDPLMDTLMTDPVRLPSGTTMDRDIILRHLLNSPTNPFTRQMLSESMLEPVPELKEQIQAWMRETQSSDA,5.114028,"K3D, L6K, A19D, V52T, S56D, D68N, N71T, T76S, K97T, H102A",10
IEKFKQLAEKVEEIVAKNARAEIEYSDAPDEFRDPLMFTLMTDPVRLPSGTVVDRSIILRHLLNDPTNPFTRQMLTEEELEPVPELKEQIQAWMREKQSSDG,8.244644,"L6Q, D24E, D38F, M53V, S65D, D68N, N71T, S78E, M79E, H102G",10
EEKFKLLAEKVEEIVAKNARDEIDYSDAPDEFRDPLMDTLMTDPVRLPSGTVMDRSAILRHLLNSPKNPFTRQMLTESMIEPRPELKEQIQAWMREKQDSDL,5.624247,"I1E, A21D, I57A, T67K, D68N, N71T, L80I, V83R, S99D, H102L",10
IEKFRLLAEKVEEIVAKNARAAIDYSDAPDEYRDPLMDTLMTDPVRLPSGTVMDRSIILRHLLNSPTNPFTRQPLTDSMLEPVPELKEAIQAWMRENQSFDH,3.5849948,"K5R, E22A, F32Y, D68N, N71T, M74P, E77D, Q89A, K97N, S100F",10
IEKFKLLAEKVEEIVATNARAGIDYEDAPDEFRDPLMDTLMEDPVRLPSGTVMDRSIILRHLYNSPTNPFTRQMLTESMLEPVPELKQQIIAWMREKQQSDH,5.9509125,"K17T, E22G, S26E, T42E, L63Y, D68N, N71T, E88Q, Q91I, S99Q",10
IEKFKLLAEKVEEIVAKNALQEIDYSDAPDEFRDPLMYTLMMDPVRLPSGTRMDRSIILRHLLDDPTNPFTRQMLTESMREPVPELKEQIQAWMREKQSSDH,3.3266282,"R20L, A21Q, D38Y, T42M, V52R, N64D, S65D, D68N, N71T, L80R",10
IEKEKLLAEKVEEIVAKNARDELDYSDAPDEFRDPLMDTLMTDPVRLPSGTVMDRQIILNHLLNSPTNPFTRQMLTESMLLEVPELKEQIQAWMREKQSQDH,6.5580225,"F4E, A21D, I23L, S56Q, R60N, D68N, N71T, E81L, P82E, S100Q",10
IEKFKLQAEKVEEFVAKNARAEIDYSDAPDEFRDPLMDTLMTDPVRLPSGTTMDRSIILRHLLNSGTNPFTRQMLTESQLEPNPELKEQIEAWMKEKQSSDH,3.6480246,"L7Q, I14F, V52T, P66G, D68N, N71T, M79Q, V83N, Q91E, R95K",10
IEKAMLLAEKVGEIVGKNARAEIDYSDAPDEFRDPLMDTLMTDPVRLPSGTVMDRSIILRHLLNSDTNPYTRQMLTESELEPVPELKEQIQDWMREKQSSDH,5.8321466,"F4A, K5M, E12G, A16G, P66D, D68N, F70Y, N71T, M79E, A92D",10
IEKSKLLAEKVEEIVAKNARAEIDYSDAPDEFRDPLTYTLMTDPVILPSGTVMDRSIILRHLLKSPTNPFTRQMLTESMLEPVPELKEQIQAWMREKELSDE,2.2328088,"F4S, M37T, D38Y, R46I, N64K, D68N, N71T, Q98E, S99L, H102E",10
IEKFKKLAEKVEEIVAKNARAEIDDSDAPDEFRDPLMDTLMTDPVRLPSGTVMDRSIILRHLLNSNTNPYTRQMLTESDLEPVPELKIQIQAWTREKQSSNH,8.4449215,"L6K, Y25D, P66N, D68N, F70Y, N71T, M79D, E88I, M94T, D101N",10
IEKFKLLKEKVEEIVAKNARAEIVYSDAPDEFRDPLMDTLMTDPVRLPTGTVMDRSIILRHLLTSPTNPFTRQPLTESMLEPVPALREQIIAWMREKQSSDH,3.4291658,"A8K, D24V, S49T, N64T, D68N, N71T, M74P, E85A, K87R, Q91I",10
IEQFKLLAEKVEEIVAKDARAEIDYSDAPDEFRDPLMDTLMTDPVLLPDGTVMDRSVILRHLLNSPTNPFTRQMLTESMLEPNPELKEQIEAWKREKQSSDH,5.444868,"K3Q, N18D, R46L, S49D, I57V, D68N, N71T, V83N, Q91E, M94K",10
IAKLKLLAEKVEEIVAKNARADDDYSDIPDEFRDPLMDTLMTDPVRLPSGTVMDRSIILRHLLNSPTNPFTRQMLTESMLVPVPELKDQIQAWMREKASSDH,5.1433597,"E2A, F4L, E22D, I23D, A28I, D68N, N71T, E81V, E88D, Q98A",10
IEKFKLLAEKVEEIVATNARAEIDYSDAPDEFRDPLMDTIMTDPVRLPSGTVMDRSIILRHLLNSPTNPFTRQMLTKSMLEPVPELREDIQAWFREKLASDH,6.549884,"K17T, L40I, D68N, N71T, E77K, K87R, Q89D, M94F, Q98L, S99A",10
LEKFKLLAERVEEIVASNARAEIDYSDAPDEYRDPLMDTLMTDPVRLPSGTVMDRSIILRHLINSPKNPFTRQMLTESMLEPVPELKEQIQAWWREKYSSDH,4.940487,"I1L, K10R, K17S, F32Y, L63I, T67K, D68N, N71T, M94W, Q98Y",10
IENFKNLAAKVEEIVTKNARAEIDYSDAPDEFRDPLMDTLMTDPVRLPSGTVMDRSIILRHLLNSPTNPFTRIMLTESMLEPVPELRNQIQAWMREKQSSDA,5.1325684,"K3N, L6N, E9A, A16T, D68N, N71T, Q73I, K87R, E88N, H102A",10
IEKFRLLREKVEEIVAANARAEIDYSDAPDEFRDPLMDTLMDDPVRLPDGTVMERSIILRHLLNSPTNPFTREMLTESMLEPVPELKEQIIAWMREKQSSDH,3.675335,"K5R, A8R, K17A, T42D, S49D, D54E, D68N, N71T, Q73E, Q91I",10
IEKFKLLAEKVEENVAKNARAEIDYSDAPDEFRNPLMYTLMTDPVRLPSGTVMDRSIILRHLLNSSTNPFTRQMLDESILEPVPELKEIIQAWMRECQSSDH,2.1078858,"I14N, D34N, D38Y, P66S, D68N, N71T, T76D, M79I, Q89I, K97C",10
IEKFKLLAEKVEEIVAKNARDEIDDSDAPDEFRDPIMDSLMTDPVRLPSGTVLDRSIILRHLLNSPTNPFTRQMLTESMLEPVRELKEQIQAWMRRHQSSDH,11.638857,"A21D, Y25D, L36I, T39S, M53L, D68N, N71T, P84R, E96R, K97H",10
IIKFRLLLEKVVEIVAKNARAEIDDSDAPDEFRDPLMDTLMTDPVRLPSGTVMDRSIILRHLLNSNTNPFTRQMLTESMLEPVPELKEQIQAWVREKQSKDH,6.6379337,"E2I, K5R, A8L, E12V, Y25D, P66N, D68N, N71T, M94V, S100K",10
IEKFKLLAEKVQEIVAKNARAEIDYYDLPDEFRDPLMDTLMKDPVRLPSGTVMDRSIILRHLLTSPTNPYTRQMLTESMLEPVPELKEAIQAWMREHQSSDH,6.786131,"E12Q, S26Y, A28L, T42K, N64T, D68N, F70Y, N71T, Q89A, K97H",10
IDKFKLLAEKVEEIVAKNARAEIDYSDAPDFFRDPLMDTLMTDPVRTPSGTVMDRSIILRHLLNSPTNPKTRQMLTESMLEVVPELAEQIQAWMFEKVSSDH,4.3476725,"E2D, E31F, L47T, D68N, F70K, N71T, P82V, K87A, R95F, Q98V",10
IEKFKLLAELVEEIVDKNYRAEIDYSDAPDEFLDPLTDTLMTDPVRLPSGTVMDREIILRHLLNSPTNPFTRQMLTESMLEPNPELKEQILAWMREKQSSDH,5.2339816,"K10L, A16D, A19Y, R33L, M37T, S56E, D68N, N71T, V83N, Q91L",10
IEKFKLLAEKVEEKVAKNARADIDYSDAPDEFRDPLMDELMTDPVQLPSGTVVDRSIILRHLKNSPTNPFTRQMLTESMLEPVPELKEHIQAWMREKQSSDS,7.7521563,"I14K, E22D, T39E, R46Q, M53V, L63K, D68N, N71T, Q89H, H102S",10
ITKFKLLAEKVEELVAHNAAAEIDYHDAPDEFRDPLMDTLMTDPVRLPSGTVLDRSIILRHLLNSPTNPFTRQMLTESMLEPVPELKEQIQAWMREKLSSDY,9.013393,"E2T, I14L, K17H, R20A, S26H, M53L, D68N, N71T, Q98L, H102Y",10
MEKFKLLAEKVEEIVAQAARAEIDYSDAPDEFRDPLMYTLMTDPVRLPSGTVMDRSIILRHLLNSETNPFTRQPLSEEMLEPVPELKEQIQAWMREKQSSDH,7.128298,"I1M, K17Q, N18A, D38Y, P66E, D68N, N71T, M74P, T76S, S78E",10
IEWFKLLAEKVEEIVAHNARAEIDYSDAPDEFRDPLMDTLMTDPVRLPSGTVMDRSDILRHLLDSRTNPFTREMLTESMLEPVPELKEQIQAWVREKRSSDH,2.365271,"K3W, K17H, I57D, N64D, P66R, D68N, N71T, Q73E, M94V, Q98R",10
IEKFKLLREKVEEIVAKNARAEIDYSDIPDEFRDPLMDTLMTDPVRLPSGTVMDRRIIWRHLLNSPTNPFTRQMLTDSMLEPVPELKEQIQQWMRENQSSDK,6.052393,"A8R, A28I, S56R, L59W, D68N, N71T, E77D, A92Q, K97N, H102K",10
IEKFKLLAEKVEEIQAKLARAEIDYSDAPDEFIDPLMYTIMTDPVRLPSGTTMDRSIILRHLLNSQTNPFTRQMLTESMLEPVPELKEQIQAWMRENQSSDH,7.8791647,"V15Q, N18L, R33I, D38Y, L40I, V52T, P66Q, D68N, N71T, K97N",10
IEKFKLLAELVREIRAKNARAEIDYSDLPDEFRDPLMDTLMTNPVLLPSGTVMDRSIILRLLLNSPTNPFTRQMLTESMLEPVPELKEQIKAWMREKQSSDH,0.7552404,"K10L, E12R, V15R, A28L, D43N, R46L, H61L, D68N, N71T, Q91K",10
IEKDKLLAEKVEEIVAKNARAEIDDSDLPDEFRDPLMDTLMTDPVRLPSGTMMDRSIILRHLINSPTNPFTRQMLTESMLEPVPELKEQLMAWIREKQSSDH,6.4959664,"F4D, Y25D, A28L, V52M, L63I, D68N, N71T, I90L, Q91M, M94I",10
IEKFKLLAERVEEIVAKNANAEIDYSDAPDEFRDPLLDTLMTDPVRLPSGTVMDRSIILQHLLHSPTNPFTRQMLTESMLEPKPELKEQIQAWTREKQSSDN,4.6516633,"K10R, R20N, M37L, R60Q, N64H, D68N, N71T, V83K, M94T, H102N",10
IEKFKLLAEKVEEIVAKNAEADIDYSDAPDEFRDPLMDTLMTDPVRLPSGTVMDRSIILRHLLNSPCNPFTRQVLTESMLEPVPCLKEQIQAWVRLKQSSKH,5.206662,"R20E, E22D, T67C, D68N, N71T, M74V, E85C, M94V, E96L, D101K",10
IEKFSVLAEKVEEIVTKNNRAEIDYSDAPDEFRDPLMDTLMTDPVRLPSGTTMDRSAILRHLLNSPTNPFTRQRLTESMLEPRPELKEQIQAWMREKQSSDH,6.1650734,"K5S, L6V, A16T, A19N, V52T, I57A, D68N, N71T, M74R, V83R",10
IEKLKVLAEKVNEIDAKNARAEIDYSDAPDEFRDPLMDTLMTDPVRLPSGTVMDRSIILRHLLNDPTNPFTRQMLTESDLEPNPELKEQIVAWMREKQSSDH,3.0788198,"F4L, L6V, E12N, V15D, S65D, D68N, N71T, M79D, V83N, Q91V",10
IEKFKLLAEKVNEIEAKNARAEIDYSDAPDEFRDPIMDLLMTDPVRLPSGTVMDRIIILRHLLNDQTNPFTRQMLTESMLEPVPQLKEQIQAWMREKQSSDH,5.5051594,"E12N, V15E, L36I, T39L, S56I, S65D, P66Q, D68N, N71T, E85Q",10
IEKFKLLAESVELIVAKNARAEIDYSDAPDEFRDPLTDTLMTDPVRLPSGTTMDRSIILRHLLNSPTNPFTRQMLTESMLEPVPKLKEQILLWMREKQLSDH,5.441071,"K10S, E13L, M37T, V52T, D68N, N71T, E85K, Q91L, A92L, S99L",10
IENFKLLAEKVEEFVAKNARAEIDYSDAPDEFRCPLMDTLMTDPVRLPSGTVMDRSSILRHLLNSPINPFTRQPLTESMLEPVPELKEQIQAWMRENQSSDD,2.4318945,"K3N, I14F, D34C, I57S, T67I, D68N, N71T, M74P, K97N, H102D",10
IEKFKLLAEKVEEIVAKEDRDEIDYQDAPDEFRDPLMDTLMTDPVRLPSGTVMDRQIILRHLLNSPTNPFTRQMLTESMLEPRPELKEQIDAWMREKQSSPH,6.469508,"N18E, A19D, A21D, S26Q, S56Q, D68N, N71T, V83R, Q91D, D101P",10
IEKFKLLAEKVEEIVEKNAKAEIDYSDAPNEFRDPLMDTLMTDPVRLPSGTVLDRSIIRRHLLNSPTNPFTRQMLTESMLEPVPSLKEQIQLWMREVQSSDH,8.256491,"A16E, R20K, D30N, M53L, L59R, D68N, N71T, E85S, A92L, K97V",10
IEKFKLYAAKVEEIVAKNADAEIDYSDAPDEFRNPLMFTLMTDPVRLPSGTVMDRSIILRHLLNSPTNPFTRQMLTESMWEPVPELKEQIQAWIREKQSSWH,4.264782,"L7Y, E9A, R20D, D34N, D38F, D68N, N71T, L80W, M94I, D101W",10
IEKFPLLAEKVEEIVAKNARAEIDDSDAPDEFNDPLMDRLMTDPVRLPSGTVMDRSIILEHLLESHTNPFTRQMLTESMLEPVPELKEQIQAWMKEKQSSDH,3.1507978,"K5P, Y25D, R33N, T39R, R60E, N64E, P66H, D68N, N71T, R95K",10
IEKFKFLNEKVEEIRAKNARAEIDYSDAPDEFRDPIMDTLMTDPVRLPSGTVMDRSIILRHLVNSPKNPFTRQMLTESMLEPNPEIKEQIQAWMREKQSSDH,8.563994,"L6F, A8N, V15R, L36I, L63V, T67K, D68N, N71T, V83N, L86I",10
