Sequence,Score,Mutations,Number of Mutations
IEKFKLLANKVEEQVAENARAEIDYVDIPDEFRDPLMYTLMVDPVVLPSGTVMDRSIILRHLLNSPTNPFTRQMLTESMLEPVPELKEQIQAWMREKQSSDH,9.457586,"E9N, I14Q, K17E, S26V, A28I, D38Y, T42V, R46V, D68N, N71T",10
IEKFKLLAEKVNEIDAKNARAETDYTDAPDEFRDPLLDTLMTDPVRLPSGTVLDRSIILRHLLNDPTNPFTRQMLTESMLEPVPELKESIQAWMREKQSSDH,8.212753,"E12N, V15D, I23T, S26T, M37L, M53L, S65D, D68N, N71T, Q89S",10
IEKFLLLAEKVENIVAQNANAEIDYQDAPDEFRDPLMDTLMTDPVRLPSGTVMDRSIILRHLLNNPTNPFTRQMLTESMLEPVPELKEQIQAWQREKTSSDH,7.231453,"K5L, E13N, K17Q, R20N, S26Q, S65N, D68N, N71T, M94Q, Q98T",10
IEKVKLLAEKVEEIVAQNARAEIDYSDAPDEFRDPLMDNLMTDPVKMPSGTVMDRSIILRHLLNSDTNPFTRQPLTESMLEPVPELKEQIQAWMREKQSPDH,3.5982134,"F4V, K17Q, T39N, R46K, L47M, P66D, D68N, N71T, M74P, S100P",10
IEKFKLLAEKVEEIVAKNARADIDYEDAPDEFRDPLMDTLMTDPVRLPSGTVMDRSIILRHLLNSSTNPFTRQMLTEDMLRPVTELKEQIQAWMRMKQSSKH,4.690682,"E22D, S26E, P66S, D68N, N71T, S78D, E81R, P84T, E96M, D101K",10
IEKFDLLADKVEEIVAKEARAEIDYSDAPDEFRDPIMDTLMTDPVRLPSGTVMDRSVIVRHLLNSPTNPFTRQMLTESMLEPRPELKEQIQAWMREKQSSDV,8.034355,"K5D, E9D, N18E, L36I, I57V, L59V, D68N, N71T, V83R, H102V",10
MEKFKLKAEKVNEIVAKNARAEEDYIDAPDEFRDPLTDTLMTDPVRLPSGTSMDRSIILRHLLNSPTNPFTRQPLTESMLEPVPELKEQIQAWMREKQSSDH,4.9726906,"I1M, L7K, E12N, I23E, S26I, M37T, V52S, D68N, N71T, M74P",10
IEKNKLLAEKVEEQVAKNARAEIDYSDLPDEFRDPLMDTVMTDPVRLPSGTILDRSIILRHLLNSPTNPFTRQALTESMLEPVPELKEQIQAWMRENQSSDH,10.8628645,"F4N, I14Q, A28L, L40V, V52I, M53L, D68N, N71T, M74A, K97N",10
IEKFKLLAEEVEDIVAKNARAEIDYSDVPDEFRDPLGDTLMTDPVRLPSGHVMDRSIILRHLLNSPTNPFTRQPLTESMLEPVPELKEQINAWMRQKQSSDH,5.944647,"K10E, E13D, A28V, M37G, T51H, D68N, N71T, M74P, Q91N, E96Q",10
IEKFKLLAEKVEEIRAKNASAEIDYSDAPDEYRDPLMDNLMCDPVRLPSGTVMDRLIILRHLLNSPTNPFTRQMLTESMLEPVPELKEQIQAWKREKPSSDH,5.593501,"V15R, R20S, F32Y, T39N, T42C, S56L, D68N, N71T, M94K, Q98P",10
IENFQLLAEKVEEIPAKNARAEIDYSDAPDEFRDALMDTLMQDPVRLPSGTVMDRSIILRHLLNSPTNPFTREMLTEMMLEPVPELKEQIEAWMREKQSSDH,1.3807447,"K3N, K5Q, V15P, P35A, T42Q, D68N, N71T, Q73E, S78M, Q91E",10
IEKAKLLIEKVEEIVAKNARADIDYSDAPDEFRDPLMFTLMTDPVRLPSGNVMDRSIILRHLLNSPTNPFTRQMLTVSMLEPVPDLKEQIQAWMNEKQSSDH,4.0991545,"F4A, A8I, E22D, D38F, T51N, D68N, N71T, E77V, E85D, R95N",10
IEKFKLLREKVEEIVAKNMRAEIDYSDAPDEFRDPLMDTLMEDPIRLPSGTVMDRSIIRRHLLNDPTNPFTRQMLTESMLVPVPELKEQIQAWMRLKQSSDH,4.920312,"A8R, A19M, T42E, V45I, L59R, S65D, D68N, N71T, E81V, E96L",10
ISKFKLLAEKVEEIVAKNARTDDDDSDAPDEFRDPLMDTLMTDPVRLPDGTVMDRSIILRHLINSPTNPFTRQMLTESMLEPVPELKEQIQAWRREKQSSDH,7.366005,"E2S, A21T, E22D, I23D, Y25D, S49D, L63I, D68N, N71T, M94R",10
IEKFKALAEKVEEIVAKNARDEEDYSDAPDEFRDPLMDTLMTDPVRLPSGTVVDRSTILRHLLNSPTNPFTRQMLTEEMLEPVPALKEQILAWMREKQSSDH,11.027155,"L6A, A21D, I23E, M53V, I57T, D68N, N71T, S78E, E85A, Q91L",10
IEKKKLLAEKVEEIVQKNARAEIDYSDAPDEFRDPLMFNLMTDPVRLPDGTVMDRSIILRHLLNSPTNPFTRQMLTEAMLYPVPELKEQIQAWMRDKQSSDH,4.591584,"F4K, A16Q, D38F, T39N, S49D, D68N, N71T, S78A, E81Y, E96D",10
IEKFKLLAEKVEEIVARNARADGDYSDAPDEFLDPLMDTLMDDPVRLPSGTVMDRSAILRHLLNSPTNPLTRQMLTESMLEPVPELKEQIQAWVREKQSSDH,2.484345,"K17R, E22D, I23G, R33L, T42D, I57A, D68N, F70L, N71T, M94V",10
IEKIKLLAEKVEEIVAKNARLEIDYSDAPDEFRNPLMDELMTDPVRLPSGTVMDRSIILRHLLNSPTNPFTRQMLTESMLEPVPELKEQVQVFKREKQSSDH,3.551903,"F4I, A21L, D34N, T39E, D68N, N71T, I90V, A92V, W93F, M94K",10
IEKFKLLAEKVEEIVAKNARADIEYSDAPDEFRDPLMDTLMTDPIRLPYGTVMDRSIILRHLLNSWTNPFTRQMLTEDMLEPVPELKEQVFAWMREKQSSDH,6.6690035,"E22D, D24E, V45I, S49Y, P66W, D68N, N71T, S78D, I90V, Q91F",10
IEKFKLLGEEVEEIVAKNASAEIDYSDAPDEFRDPLMFTLMTDPVRLPSGTVMDRAIIVRHLLNSPTNPFTRQMLTESMLMPVPELKEQIQAWMREKQSSDY,6.601738,"A8G, K10E, R20S, D38F, S56A, L59V, D68N, N71T, E81M, H102Y",10
IEKFKLLAEKVESQVAKNARDEIDDSDIPDEFRDPLMDTLMTDPVRLPSGTVMDRSIILRHLLYSPTNPFTRQMLTESMLEPVPELKEQIQAWMSEKWSSDH,9.183571,"E13S, I14Q, A21D, Y25D, A28I, N64Y, D68N, N71T, R95S, Q98W",10
IEKFKLLAEKVEEIVAKNARPWIDYSDAPDEFRDPLMDTLMTDPVRLPTGTVMDRSIILRHLLNSPTNPFTRQMLSENMLEAVPELKEQIQAWMEEKQSSDD,3.6920712,"A21P, E22W, S49T, D68N, N71T, T76S, S78N, P82A, R95E, H102D",10
IEKFKLLAEKVEEIVAKNARADIDYSDVPDEFRDPLSDTLMTDPVVLPSGTVMDRSIILRHLLNDPTNPFTRQMLTESMLEPVPELKEQIHRWMRHKQSSDH,4.374878,"E22D, A28V, M37S, R46V, S65D, D68N, N71T, Q91H, A92R, E96H",10
IEKFELLAGKVEGIVAANARAEIDYSDAPDEFRDPLMDTLMTDPVRLPDGTVMDRSIILRHLLNSPTNPFTRQMLTESDLIPVPELKEQIQAWMEEKQSSDH,4.254243,"K5E, E9G, E13G, K17A, S49D, D68N, N71T, M79D, E81I, R95E",10
IDKFKLYREKVEEIIAKNARAEIDYSDAPDYFRDPLMDTLMTDPVRLPSGTVMDRSIILRHLLNSPTNPFTRQPLTESMLEPVPELKEQILAWIREKQSSDH,6.1506042,"E2D, L7Y, A8R, V15I, E31Y, D68N, N71T, M74P, Q91L, M94I",10
IEKFKLKAEKVEEIVAKNARPDIDYEDAPDEFRDPLMDTLMTDPVRLPSGTFLDRSIILRHLLNSPTNPFTRQMLTEDMLEPVPWLKEQIQAWMREKQSSDH,9.115225,"L7K, A21P, E22D, S26E, V52F, M53L, D68N, N71T, S78D, E85W",10
IEKFKLLAEKIEEDVAKNARAEDDYSDAPDEFRDPLMDTIMTDPVRLPSGTVMDRSIILRHLLDSPTNPFTRQMLTESMLEPVPFLKEQIQAWMREKQITDH,6.0254307,"V11I, I14D, I23D, L40I, N64D, D68N, N71T, E85F, S99I, S100T",10
ILLFKLLADKVEEINAKIAAAEIDYSDIPDEFRDPLMDTLMTDPVRLPSGTVMDRSWILRHLLNSPTNPFTRQMLTESMLEPVPELKEQIQAWMREKQSSDH,5.4793277,"E2L, K3L, E9D, V15N, N18I, R20A, A28I, I57W, D68N, N71T",10
IEKFKLLAEKVEEIVTKNARAEIDYSDAPDEFRDPLMDTLMTDPVRLPSGAVMDRSIIARHLLNSKTNPFTRMMLTESMLEPVPELKEKIQIWMREKLSSDH,3.7461023,"A16T, T51A, L59A, P66K, D68N, N71T, Q73M, Q89K, A92I, Q98L",10
IHKFKLLAEKVEEIVAKNARAEIDYADAPDEFRDPLMDTLMTDPVRLPSGTVVDRSTIMRHLLISPTNPFTRQMLTESMLEPVPELKIQIQRWMREKQSSDH,9.006563,"E2H, S26A, M53V, I57T, L59M, N64I, D68N, N71T, E88I, A92R",10
IEKKKLLAEKDEEIVAKPARAEIDYSDAPDDFRDPLMDTPMTDPVRLPSGTVMDRSIILRHLLNSPTNPFTRQMLTESMLEPVPKLKEQIQAWMQGKQSSDH,3.6661055,"F4K, V11D, N18P, E31D, L40P, D68N, N71T, E85K, R95Q, E96G",10
IEKFKLLFEKVEEIVAKKARAEIDYSDAPDEFRDPLMDTLMTNPVRLPSGTVMDRSIILRHLLNSPTDPFTRQMLTESMIEPVLVLKEQISAWLREYQSSDH,1.4045732,"A8F, N18K, D43N, N71T, L80I, P84L, E85V, Q91S, M94L, K97Y",10
IEKFKLLAEDVEEIVAKNARAEIDYSDAPDEFLDFLMDTLMTDPVRLPSGTVMDRSIILRHLENNPTNPFTRQMLTENMLEPVPELKEQIQAWLREQQSSDH,4.860491,"K10D, R33L, P35F, L63E, S65N, D68N, N71T, S78N, M94L, K97Q",10
MEKMKLLADKVEEIVGKNAKAEIDYSDAPDEFRDPLMFTLMTDPVRLPSGTVMDRSIILRHLLNDPTNPFTRQMLTESMLEPVPELKQQIQAWMREKQSSDH,4.387189,"I1M, F4M, E9D, A16G, R20K, D38F, S65D, D68N, N71T, E88Q",10
MEEFKLLAEKYDELVAKNARLEIDYSDAPDEFRDPLMDTLMTDPVVLPSGYVMDRSIILRHLLNSPTNPFTRQMLTESMLEPVPELKEQIQAWMREKQSSDH,5.1330175,"I1M, K3E, V11Y, E12D, I14L, A21L, R46V, T51Y, D68N, N71T",10
IEKFKNLAVKVEEIVAKNARTEIDYSDAPDEFRDPLMYTLMTDPVRLPSGTVIDRSIILRHLLNNPTNPFTRQMLTEDMLEPVPSLKEQIQAWMREKQSSDH,8.591749,"L6N, E9V, A21T, D38Y, M53I, S65N, D68N, N71T, S78D, E85S",10
IEKFKLLAEKVEEIVRKNAMAEIDYADAPDEFRDPLMDTVMTDPVRIPSGTVMDRSIILRHLLNSNTNPFTRQMLTESMLEPVPGLKEQIQAWMREKQSLDH,5.8124056,"A16R, R20M, S26A, L40V, L47I, P66N, D68N, N71T, E85G, S100L",10
IEKFKLLAGKVEEIVAKDARAEIDYSDAPDEFRDPLMDTLMTDPVRLPSGTVMDRSIILRHLLNSNQNPFTRFMLTESMLEPVPELKEQVQAWVREKQSSRH,4.701927,"E9G, N18D, P66N, T67Q, D68N, N71T, Q73F, I90V, M94V, D101R",10
IKKFKLLAEKVEEIVAKNARAEIDYSDAPDHFRDPLMDTLMTDPVLLPSGTVMDRSIILRHLLNSPTNPFTRQMLLESQLEPVPELKQQIEAWMNEKQSSDH,5.1117353,"E2K, E31H, R46L, D68N, N71T, T76L, M79Q, E88Q, Q91E, R95N",10
IEKFKELAEKVEEIVEKNARAEIDYSDAPDEFRDPLTDTLMTDPVRLPSGTVLDRSIILRHLLNAPTNPFTRWMLTESMLEPVPELKEFIQAWMREKQSSKH,7.147443,"L6E, A16E, M37T, M53L, S65A, D68N, N71T, Q73W, Q89F, D101K",10
IEKFKLLAEKVEEIVNKNARAEIDYSDAPDEFRDPLMDTLMTDPVRLPSGTVMDRSIILRHLLSNPTNPITRQMLTESMLEPVPDLKEQIEAWMRTKQSSDY,1.5875719,"A16N, N64S, S65N, D68N, F70I, N71T, E85D, Q91E, E96T, H102Y",10
IEKFCLWAEKVDEIVAKNARAENDYSDAPDEFRDPLMDTLMTDPVRLPSGTIMDRSIILRHLLNSCTNPFTRQMLTESMLEPVPELKEQVEAWMREKQSSDH,6.521434,"K5C, L7W, E12D, I23N, V52I, P66C, D68N, N71T, I90V, Q91E",10
IEKNKLLAEKVEAIVAKNARAEIDYSDAPDEFRDPLMDVLMTDPVRLPSGVVMDRSIILRHLLNSPTNPFTRQSLTEDMLEPVPELKEQIRAWMREKQRSDH,5.681714,"F4N, E13A, T39V, T51V, D68N, N71T, M74S, S78D, Q91R, S99R",10
IEKNKLLAEKVEEIVAKNARADIDYSDAPDEFRDPLMDELMTDPVRLPSGTVMDRSIILRHLGNSPTNPFTRQPATESMLEPVPELKEQIQAWMREKQSRDD,5.2996364,"F4N, E22D, T39E, L63G, D68N, N71T, M74P, L75A, S100R, H102D",10
IEKFPLLAEKVEEIVAKNAKAEIDYSDAPDEFLDPLMDTLMRDPVRLPSGTVMDRSVILRHLLNDNTNPFTRQMLTESMLEPVPELKEQILAWMREKQSSDH,6.0559454,"K5P, R20K, R33L, T42R, I57V, S65D, P66N, D68N, N71T, Q91L",10
MEKFKLLIEKVEEIVAKNAGAEINYSDAPDEFRDPLMDTLMTDPVRLPSGTVMDRSIILRHLLNSNTNPFTRQMLTELMLEPVPDLKEQIQAWLREKQSSDH,5.480671,"I1M, A8I, R20G, D24N, P66N, D68N, N71T, S78L, E85D, M94L",10
IEDFKLLAEKVEEIVAGKRRAEIDYDDIPDEFRDPLMDTLMTDPVRLPDGTVMDRSIILRHLLNSPTNPFTRQMLTESMLEPVPELKLQIQAWMREKQSSDH,6.414977,"K3D, K17G, N18K, A19R, S26D, A28I, S49D, D68N, N71T, E88L",10
NEKFKLLAEKVTEIVAKNARAELDDSDAPDEFRDPLMDTLMTDPVRLPSGTVMDRSIILRHLLNSPTNPLTRQMLTESMLEPVPELKEQIVAWMRAKQSSKH,2.593845,"I1N, E12T, I23L, Y25D, D68N, F70L, N71T, Q91V, E96A, D101K",10
IETEKLLAEKVEEIVAKNARIEDDYSDAPDEFRDPLMDTLMTDPVRLPSGHVMDRSFILRHLLNSPTNPFTRQVLTESMLEPVPELKEQIQAWMREKQSSIH,5.9883766,"K3T, F4E, A21I, I23D, T51H, I57F, D68N, N71T, M74V, D101I",10
IEKFKLLAEKVEEIVAKNARAEIDYSDAPDEFMDPLMDTLMTDPVRLPSGTVMDREIILRHLLNSHTNPFTRQMLTESDLEPNPELKEQIQRWVREKQSNDH,4.4491796,"R33M, S56E, P66H, D68N, N71T, M79D, V83N, A92R, M94V, S100N",10
IEKAKLLAEKVEEEVLKEARAEIDDSDAPDEFRDPLMDTLMTDPVILPSGTVMDRSIILRHLLNSPTNPFTRQMLTESMLEPVPELKEQIQQWMREKQSHDH,6.5567174,"F4A, I14E, A16L, N18E, Y25D, R46I, D68N, N71T, A92Q, S100H",10
IEKFKLLAEKVYEIVAKNARAEIDYSDAPMEFRDPLMDTIMDDPVRLPSGTVMDRSIILRHLLNSPQNPKTRQKLTESMLEPVPELKERIQAWMREKQSSDH,5.907919,"E12Y, D30M, L40I, T42D, T67Q, D68N, F70K, N71T, M74K, Q89R",10
IEKFKLNAEKVEEIVAKNAAAEEDDSDAPDEFRDPLMDTLMTDPVRLPSGTILDRSIILRHLLNSPTNPFTRQMLTESMLEPNPELKEQIQAWMREKQSTDH,11.893625,"L7N, R20A, I23E, Y25D, V52I, M53L, D68N, N71T, V83N, S100T",10
IEKFKLLAEKAEEIVAANARAEIDYSEAPDEFRDPLMDTLMTDPVRLPSGYVMDRQIILRHLLNSPTNPLTRKMLTESMLEPVPELKEQIQAWMREKQSSDK,1.5495152,"V11A, K17A, D27E, T51Y, S56Q, D68N, F70L, N71T, Q73K, H102K",10
IEKFKLLAEKVEEIVAKNARDEIDYSDAPDEFRDPLTDTLMTDPVRLPSGTVLDRSDILRHLLNSPTNPFTRQMLTEDMLEPVPALKEQITAWMEEKQSSDH,9.56312,"A21D, M37T, M53L, I57D, D68N, N71T, S78D, E85A, Q91T, R95E",10
IEKFKLLAEKVEEIVSKIFRAEIDYSDAPDEFRDPLMDTIMTDPVRLPSGTIMDRSIILAHLLNSPTNPFTRQMLTESMLYPVPELKEQIQAWMREKSSSDH,7.0398083,"A16S, N18I, A19F, L40I, V52I, R60A, D68N, N71T, E81Y, Q98S",10
IEKFKLLAEKVEKIVAKNAIEEIDYEDAPDEFRDPIMDTLMIDPVRLPSGTVMDRSAILRHLLNSPTNPFTRQMLTESMLEPVPELKEQIQAWMREKQISDH,9.734983,"E13K, R20I, A21E, S26E, L36I, T42I, I57A, D68N, N71T, S99I",10
IEKFDLLAEKVEEIVAKAARDEIDYSDAPDEFRDPLMDTLMTDPVRLPSGTVMDRSIILRHLLNDPTNPFTRQMLGESMLEPVPELKEALQAWIREKQSSDH,4.112421,"K5D, N18A, A21D, S65D, D68N, N71T, T76G, Q89A, I90L, M94I",10
IEEFKLLEEKVEDIVEENARAEIDYSDAPDEFRDPLMDTLMKDPVRLPSGTVMDRSIIERHLLNSPTNPFTRQMLTESMLEPVPELKEQIQAWMREKKSSDH,6.2917194,"K3E, A8E, E13D, A16E, K17E, T42K, L59E, D68N, N71T, Q98K",10
MERFKLDAEKVEEIVAKNARAEIDYSDAPDEYRDPLMDTLMTDPVRLPSGTVVDRSIIERHLLNSPTNPFTRQMLTSSMLEPDPELKEQIQAWMREKQSSDH,6.621219,"I1M, K3R, L7D, F32Y, M53V, L59E, D68N, N71T, E77S, V83D",10
IEKFKLLHEKVEEIVKKNARAECDYSDAPDEFRCPLMDTLMTDPVRLPSGHVMDRSIILRHLLNSPTNPFTRQMLTESDLEPVPELKEQIDTWMREKQSSDH,6.0067086,"A8H, A16K, I23C, D34C, T51H, D68N, N71T, M79D, Q91D, A92T",10
IEKFKLLAEKVNAIVAKRARAWIDYSDAPDEFRDPLMDTLMTDPVRLPSGTVMDRSIILRHLLNSPTNPMTRQMLTESMLVPVPELKEQIQAWMRELVSSDH,3.450274,"E12N, E13A, N18R, E22W, D68N, F70M, N71T, E81V, K97L, Q98V",10
IEKFKLLAEKVEEIVAKNVRAETDYEDAPDEFRDPLMDTLMTDPVRLPSGTIMDRSIILRHLLKSPTNPFTRQMLTESMLEPVPELKERIQAWQREKQSSTH,3.2738569,"A19V, I23T, S26E, V52I, N64K, D68N, N71T, Q89R, M94Q, D101T",10
IEKLQRLAEKVEEIVAKNARAEIDYSDAPDEFRDPLMDTLMTDPVRLPSGTVMDRSIILRHLLQSPTNPFTRQPLTQSMLEPVPELKEQIQAWMREYQSSDW,4.924661,"F4L, K5Q, L6R, N64Q, D68N, N71T, M74P, E77Q, K97Y, H102W",10
IEKIKLLVEKVEEIVAKNARDDIDYSDAPDEFRDPLMRTLMTDPVRLPSGTVMDRSIIQRHLLNSPTNPLTRQMCTESMLEPVPELKEQIQAWMREKQSSDH,0.7043364,"F4I, A8V, A21D, E22D, D38R, L59Q, D68N, F70L, N71T, L75C",10
IEKFKLLAEKVEEIVAKNARADDDYSDAPDEFRDPLSDELMTDPVRLPSGTVMDRSIILNHLVNNPTNPFTRQMLTESMLEPVPELKEQIQAWRREKQSSDH,4.523073,"E22D, I23D, M37S, T39E, R60N, L63V, S65N, D68N, N71T, M94R",10
IEKFKLLQEKVEEIVAKLARDEIDYSDAPDEFRDPLMFTLMTDPVRLPSGTTMDRSIILRHLLNSNTNPFTRQMLDESMLEPVPELKEQIQAWMREKQSADH,6.028014,"A8Q, N18L, A21D, D38F, V52T, P66N, D68N, N71T, T76D, S100A",10
IRKFKLLAEKVEESVAKNDRAEIDYSDAPDEFRDPLTDTLMTDPVELPSGTVMDRSIILRHLLHSPTNPFTRMMLTESMLEPVPELKEQIQAWMREKQVSDH,2.2693987,"E2R, I14S, A19D, M37T, R46E, N64H, D68N, N71T, Q73M, S99V",10
IEKFQLLAEKVEEIDAKNARAEDDDSDAPDEFRDPLMDTLMTDPVRLPSGTVMDRSIIRRHLLNSPTNPFTRQMLTESMLGPVPELKEQIVAWWREKQSSDH,6.139657,"K5Q, V15D, I23D, Y25D, L59R, D68N, N71T, E81G, Q91V, M94W",10
IEKFKLTHDKVEEIVAKNARAEIDYKDAPDEFRDPLMYTLMTDPVRLPSGTVMNRSIILRHLLVSPTNPFTRQMLTESMLEPVPELKEQIQAWMREKQSFDH,5.319488,"L7T, A8H, E9D, S26K, D38Y, D54N, N64V, D68N, N71T, S100F",10
IEKFKLLAEKVEEIVAKNALADIDESDAPDEFRDPLMDTLMTDPVRLVSGTVMDRSIILQHLLNSPTNPFTRQMLKESMLEPVPWLKQQIQAWMREKQSSDH,5.1833735,"R20L, E22D, Y25E, P48V, R60Q, D68N, N71T, T76K, E85W, E88Q",10
IEKFKLLALKVEEIVTKNAAAEIDYSDAPDEFRDPLMDTLMTDPVLLPSGTVMDRSIILRHLLNSPINPFTRQPLTESMLEPDPELKEQIQAWMREKQSSDL,2.7153254,"E9L, A16T, R20A, R46L, T67I, D68N, N71T, M74P, V83D, H102L",10
IEKFRLLSEKVEEIVAKNARAEIDDSDAPDEFRDPLMDELMTDPVILPSGTVMDRSIILRHLLNSPTNPFTRQMLTESMLEPNPELKSQIQAWMREKQASDH,6.1386805,"K5R, A8S, Y25D, T39E, R46I, D68N, N71T, V83N, E88S, S99A",10
MEKFKLLVEKVEEIVARNARAEIDYSDVPDEFRDPLMDTLMTDPVRLPSGTVMDRSIILRHLLNSPTNPFTRQMLTESMLEPDPELKEQIQHWMRENQSSDL,6.2908134,"I1M, A8V, K17R, A28V, D68N, N71T, V83D, A92H, K97N, H102L",10
IEKFKLLAEKVEEIRFKNARDDEDYEDAPDDFRDPLMDTLMTDPVRLPSGTVMDRSIILRHLLNSPTNPFTRQMLTESMLEPVPELKEQIQAWMREKQSSDQ,7.3972483,"V15R, A16F, A21D, E22D, I23E, S26E, E31D, D68N, N71T, H102Q",10
IEKFKLLAEEVEEIVAKNARAEIDDSDAPDEFMDPLMDTLMQDPVRLPSGTVMDRSIILRHLLNSSTNPFTRQPLTEEMLEPVPELKLQIQAWMREKQSSDH,7.3214645,"K10E, Y25D, R33M, T42Q, P66S, D68N, N71T, M74P, S78E, E88L",10
EEKFKLLLEKVDEIVAKNARAEIFYSDAPDEFLDPLMDTLMTDPVRLPSGTVMDRSFILRHLLNSPTNPFTRKMLTESMLEPVPELKEQIQAWMREKQSSDY,4.305333,"I1E, A8L, E12D, D24F, R33L, I57F, D68N, N71T, Q73K, H102Y",10
PEKFKLLAQKVHEIVAKNARAEIDDSDIPDEFRDPLMDTLMTDPVRLPNGQVMDRSIILRHLLNSPTNPFTRQMLTESMLEPVPDLKEQIQAWMREKQSSDH,6.598865,"I1P, E9Q, E12H, Y25D, A28I, S49N, T51Q, D68N, N71T, E85D",10
IEKTKLLAEQVEEIVAKNARAEIDYSDAPDEFRDPLMDTIMTDPVRLPSGTVMDRSIILRHLLNVPTNPFTREPLTESMLEPVPELKSQIQAWMREKQSRDH,4.254572,"F4T, K10Q, L40I, S65V, D68N, N71T, Q73E, M74P, E88S, S100R",10
IEKFKQLLEKVEEIVAKNARAEIDYSDIPDEFRDPLMDTLMTDPVRLPSGTVMDRSIICRHLLNSGTNPFTRQMLTELMLEPVPELKEQIQAWMNEKQSSDK,5.3964443,"L6Q, A8L, A28I, L59C, P66G, D68N, N71T, S78L, R95N, H102K",10
IEKFKLLAEKVEEDNAKNTDAEIDYSDAPDEFRDPLMDTLMTDPIRLPSGTVMDRSIILRHLLNDPTNPFTRQPLTEEMLEPVPELKEQIQAWMREKQSSDH,6.604662,"I14D, V15N, A19T, R20D, V45I, S65D, D68N, N71T, M74P, S78E",10
IEKFKLLAEKVEELVAKNARAEIDYSDAPDEFRDPLMDQLMTDPVRLPSGTVMDRSIILRHLLNSPTNPFTRQMLTPAMLRPVPELREQVQAWMREKQRSDH,3.8433099,"I14L, T39Q, D68N, N71T, E77P, S78A, E81R, K87R, I90V, S99R",10
IEKFKQLAEKVEEAVAKVLRAEIDSSDAPDEFRDPLMDTLMTDPVRLPSGTVLDKSIILRHLLNTPTNPFTRQMLTESMLEPVPELKEQIQAWMREKQSSDH,8.205418,"L6Q, I14A, N18V, A19L, Y25S, M53L, R55K, S65T, D68N, N71T",10
IEKEKLLEEKVQELVAKNADAEIDYSDAPDEFRDPLMDTLMTDPVRLPSGTVMDRSIILEHLLHSPENPFTRQMLTESMLEPVPELKEQIQAWMREKQSSDH,5.3737826,"F4E, A8E, E12Q, I14L, R20D, R60E, N64H, T67E, D68N, N71T",10
MAKFKLLREKVEEIVAKNSRAAIDYSDAPDEFIDPLMYTLMTDPVRLPSGTVMDRSIILRHLLSSPTNPFSRQMLTESMLEPVPELKEQIQAWMREKQSSDH,-1.4469446,"I1M, E2A, A8R, A19S, E22A, R33I, D38Y, N64S, D68N, N71S",10
MEWFKLSAEKVEEIVMKNARAEGDYSEAPDEFRDPLMDTLMTDPVRLPSGTVMDRSIILRHLLNSPTNPFTREMLTESMLEPVPELKEQIQAWMREKQSSGH,3.1453238,"I1M, K3W, L7S, A16M, I23G, D27E, D68N, N71T, Q73E, D101G",10
MEKFKLLSHKIEEIVVKDARAEIDYSDAPDEFRDPLMDTLMTDPVRLPSGIVMDRSIILRHLLNSPTNPFTRQMLTESMLIPVPELKEQIQAWMREKQSSDH,6.866644,"I1M, A8S, E9H, V11I, A16V, N18D, T51I, D68N, N71T, E81I",10
IEKFSLLAEIVDEIVQKNARAEIDYSDLPDEFRDPLMDTLMTDPVRLPSGTVMDRSIILRHLSNSPTNPFTRQMLTESMLVPVPELKEQIQAWMRSKQSSDH,3.6722524,"K5S, K10I, E12D, A16Q, A28L, L63S, D68N, N71T, E81V, E96S",10
IEKFKLLEEQVEEIVAKNARAEIDYSDAPDEFRCPLMDTLMTDPVLLPSGQVMDRRIILRHLNNSETNPFTRQMLTESMLEPVPELKEQIQAWMREKQSSDH,7.0384126,"A8E, K10Q, D34C, R46L, T51Q, S56R, L63N, P66E, D68N, N71T",10
IEDFKLLAEKVKEIVAKNARAEILYSDAPDEFRDPLMDTLMTDPVRLASGTVYDRSIIQRHLLNSPTNPFTREMLTESMLEPVPELKEQIQAWMREKQSVDH,1.2432102,"K3D, E12K, D24L, P48A, M53Y, L59Q, D68N, N71T, Q73E, S100V",10
IEKFKLLAEKVEAIAAKNDRAEIDYSDAPDEFVDPLMYTLMMDPVRLPSGTVMDRSIILRHLLNSGTNPFTRQMLTESMLEPVPELKEQIQAWMREKQSIDH,5.904784,"E13A, V15A, A19D, R33V, D38Y, T42M, P66G, D68N, N71T, S100I",10
IEKFRLLAEKVEEIVAKPARAEIDYSDAPDEFRDPLTDTLMTDPVLLPSGTTMDRSIILRHLLNSPTNPFTRQALTESMLEPVPELKEQIQQWMREKSSSDH,4.9867187,"K5R, N18P, M37T, R46L, V52T, D68N, N71T, M74A, A92Q, Q98S",10
IEKFKLLAEKLEEIVAKNGRAEIDYSDAPDEFRDPVMDTLMLDPVRLPSGYVMDRSIILRHLLNSPTNPFTRRMLTEDMLEPVPELKEAIQAWMREKQSSDH,5.8622594,"V11L, A19G, L36V, T42L, T51Y, D68N, N71T, Q73R, S78D, Q89A",10
IEKFKLLAEKVYEIVEENAREEIDYSDAPDEFRDPITDTLMVDPVRLPSGTVMDRSIILRHLLNSPTNPFTRQELTESMLEPVPELKEQIQAWMREKQSSDH,8.9534445,"E12Y, A16E, K17E, A21E, L36I, M37T, T42V, D68N, N71T, M74E",10
IEKFKLTAEKVEEIKAKNARADDDYDDAPEEFRDPLMDTLMTDPVRLPSGTVMDRSAILRHLLNSPTNPFTRQMLTESHLEPVPELKEQIQAWMREKQSSDH,7.7366962,"L7T, V15K, E22D, I23D, S26D, D30E, I57A, D68N, N71T, M79H",10
IEKSKLLAEYVEEIVAKNARAEIDYSDAPDEFRDPLMFTLMTDPVRLPSGTVMDRSYIVRHLLNSPTNPFTRAMLTELMLEPVPELKEQIEAWMREKQSSDH,5.916417,"F4S, K10Y, D38F, I57Y, L59V, D68N, N71T, Q73A, S78L, Q91E",10
DEKFKLLAEKVDEIVAKNATAEIDESDAPDEFRDPLMDTLMTDPVRLPSGTVMDRSIITRHLLNSDTNPFTRQMLTESMLEPVPELKEQIRAWMKEKQSSDH,3.9974556,"I1D, E12D, R20T, Y25E, L59T, P66D, D68N, N71T, Q91R, R95K",10
IEKFKLLAELVEEIVAKEARDEIDYDDAPDEFRDPLMDTLMTDPVRLPSGTVMDRSIIQRHMLNSPTNPFTRQMLTESALEPVPELKEQIQAWMREKQESDH,6.3535576,"K10L, N18E, A21D, S26D, L59Q, L62M, D68N, N71T, M79A, S99E",10
IEKFKLLAEKVEEIVAKNRRKEIDYSDAPDEFRDPLMLELMTDPVRLDSGTVMDRSVILRHLLNSPTNPFTRQMLTESMLEPVPELKEQVQSWMREKQSSDH,5.83779,"A19R, A21K, D38L, T39E, P48D, I57V, D68N, N71T, I90V, A92S",10
IEKFKLLARKVEEIVAKNRRAEIDYMDAPDEFRDPLMDTLMTDPVRLPSGTTMDRSIILRHLLNSNTNPFTRQMLTESMLEPSPELKEQIQAWIREKQSSDF,7.451458,"E9R, A19R, S26M, V52T, P66N, D68N, N71T, V83S, M94I, H102F",10
IEKFKLLAEKVEEIVAELARDEIDYSDAPDEFRDPLMDTLMTDPVRLPSGTTMDRSIIIRHLLNNPTNPFTRQMLTESMLEPVPELKEQIQAWMNEKQSSDI,6.1628504,"K17E, N18L, A21D, V52T, L59I, S65N, D68N, N71T, R95N, H102I",10
IEKFKLLAEKVEEIVAKNARAEIDYSDAPDEFLDPIMDTLMEEPVRLPSGYVMDRSIIRRHLLNSPTNPFTRQPLTESMLEPVPELKEQIEAWMREKQSSDH,8.810548,"R33L, L36I, T42E, D43E, T51Y, L59R, D68N, N71T, M74P, Q91E",10
IEKFKELAEKVEEIVAKKARAEIDDSDAPDEFRDPLMDTLMTDPVRLPDGYVLDRSVILRYLLNSPTNPFTRQMLTESMLEPVPELKEQIQAWMREKQSSDH,7.577839,"L6E, N18K, Y25D, S49D, T51Y, M53L, I57V, H61Y, D68N, N71T",10
IEKSKLLAEKVDEIVAKNARAEIDYSDAPDEFRDPLMDTLMTDPVHLPSGVVMDRSIILRHLLNSPTNPFTRQMLTESDLVPVPELKERIIAWMREKQSSDH,5.3493867,"F4S, E12D, R46H, T51V, D68N, N71T, M79D, E81V, Q89R, Q91I",10
IEKFKLSAEKVEEIVAKNARAEIDYSDAPEEFRDPLMDTLMTDPVRLPSGTSMDRSVILRHLLMNPTNPFTRQMLTESMLIPVPELKEQIQAWVREKQSSDH,6.012237,"L7S, D30E, V52S, I57V, N64M, S65N, D68N, N71T, E81I, M94V",10
IEKFKLLLEKVEAIVAKNARAEIDYSDAPDEFRDPLMDTLMTDPVRLPDGTVMDRSIILRHLLNSPTNPFTRQMLTESMALPVPELKKQIQAWRREKQSSHH,3.5100164,"A8L, E13A, S49D, D68N, N71T, L80A, E81L, E88K, M94R, D101H",10
IEKFKLMAEKVEEIVAKNKRAEIDYSDAPDEFMDPLMYTLMTDPVRLPSGTVMDRSIILRHLLQSPTNPFTRQMLTESMLEPVPELKEQIQLWMAEKQRSDH,6.4892664,"L7M, A19K, R33M, D38Y, N64Q, D68N, N71T, A92L, R95A, S99R",10
IEKFKLLAEKVEEIVEKNFRDEIDYSDAPDEFRDPLMDTLMTDPVRLPSGTVMDRSTILRHLLNSPTNPFTRQMLSESMVEPVPELKEQMQAWMRNKQSSDH,4.4107704,"A16E, A19F, A21D, I57T, D68N, N71T, T76S, L80V, I90M, E96N",10
IEKFKSNAEKVEEIVAKNARAEIDESDAPDEFVDPLMDTLMTDPVRLPDGTVMDRSIILRHLLNNPTNPFTRQMITEVMLEPVPELKEQIQAWMREKQSSDH,2.883611,"L6S, L7N, Y25E, R33V, S49D, S65N, D68N, N71T, L75I, S78V",10
IEKFKLLAEKIEEIVAKNARADIDYSDAPDEFRDPLMDDLMNDPVRLPSGTVMDRSIILRHLLNSPTNPFTRQPLTESMLEPVPELKEQIQRWMRENQVSDH,6.587593,"V11I, E22D, T39D, T42N, D68N, N71T, M74P, A92R, K97N, S99V",10
MEKFKLLAEKVEEKVAKNARDEIDYSDAPDEFRDPLMDTLMTDPVRIPSGTVMDRSIILRHLLNSPTNPFTRQMLTESMLEPLPELKEQINAWMAEKQTSDH,5.953701,"I1M, I14K, A21D, L47I, D68N, N71T, V83L, Q91N, R95A, S99T",10
IEKFKLLAEKVEEVSAKNARAEIDYEDEPDEFRDPLMDTLMTDPVLLPSGTVMDRSIILRHLLNSPTNPFTRQMLTESMLEPVPELKVQIQAWMREHQSEDH,6.5557613,"I14V, V15S, S26E, A28E, R46L, D68N, N71T, E88V, K97H, S100E",10
IEKFNLLAEKVEEAVAKNARAEIDYSDAPDEFRDPLMDTLMTDPVRLPSGTVMDRSIILRHLLESPTNPFTRQYLTESMLEPVPELKEDIQAWMREKSSSTE,4.9039283,"K5N, I14A, N64E, D68N, N71T, M74Y, Q89D, Q98S, D101T, H102E",10
IEKFKLLAEKVEEIVAKNAGAEDDYSDAPDEFRDPLMDTLMTDPVRLPSGFVMDRSIILRHLLNSPTNPFTRQMLSESMLEPVPELKEQLQAWMREKQSKTK,4.419656,"R20G, I23D, T51F, D68N, N71T, T76S, I90L, S100K, D101T, H102K",10
KEKFKLLAEEVEEIVAKNADAEIDYSDAPDEFRDPLMDTLMTDPVRLPSGTVVDRSIILRHLLNSPTNPFTRQMLTESMLESLPELKEQIQAWMREKQVSDF,7.479296,"I1K, K10E, R20D, M53V, D68N, N71T, P82S, V83L, S99V, H102F",10
IESMKLLAEKEEKEVAKNARAEIDYSDAPDEFRDPLMDTLMTDPVRLPSGTVMDRSIILRHLLNNPTNPFTRQMLTESMLEPNPELKEQIQAWMREKCSSDH,5.023511,"K3S, F4M, V11E, E13K, I14E, S65N, D68N, N71T, V83N, Q98C",10
IEKFKLLAEKVEEIGAKNARAEIDYSDAPDEFRDPLMDTLMTDPVRLPSGTVMDRSIILRHLLNNPTNPYTRQMLDESMLEPVPELKEQLQMWMRENQSSGH,5.149784,"V15G, S65N, D68N, F70Y, N71T, T76D, I90L, A92M, K97N, D101G",10
IEKFKLLARKVEEIEAKNARAEIDYSDAPDEYRDPLMDTLMTDPVRLPSGTVMNRSIILRHLLNSPTNPFTRKMLTESMLEPVPEVKMQIQAWRREKQSSDH,2.80065,"E9R, V15E, F32Y, D54N, D68N, N71T, Q73K, L86V, E88M, M94R",10
IEKFKLLAEKVDEILAKNARAEDDYSDAPDEFRDPLMDTLMNDPVRLPSGHIMDRSIILRHLLNSPTNPFTRQMLTESMLEPVVELKEQIQAWMREKQSRDH,6.238,"E12D, V15L, I23D, T42N, T51H, V52I, D68N, N71T, P84V, S100R",10
IEKFKLLAEKVEEIVAKFARAEIDYDDAPDEFRDPLTDTLMTEPVRLPSGTVMDRSIILRHLLNHPTNPFTRQMLTESMLSPVPELKQQIQAWMRAKQSSDH,4.217785,"N18F, S26D, M37T, D43E, S65H, D68N, N71T, E81S, E88Q, E96A",10
IEKFKLLAEKVEEIVAKKARADIDYRDAPDEFRDPLMDTLMTDPVRLSSGTVMDRTIILRHLLVSKTNPFTRQMLTESMLEPVPELKEQIQAWMREKQQSDH,1.1473479,"N18K, E22D, S26R, P48S, S56T, N64V, P66K, D68N, N71T, S99Q",10
ISKFKLDAEKVEEEVAKNARAEIDYSDAPDEFRDPLMDELMTDPVRLPSGTVMDRSIILRHLLNSKTNPFTRQMLTESMLIPVPELKERIQAWMRVKQSSDH,4.9714975,"E2S, L7D, I14E, T39E, P66K, D68N, N71T, E81I, Q89R, E96V",10
MEKFKLLAEKYEEIVAKNAKAEIDYSDVPDEFRDPLMDTLMTDPVRLPSGTVMDRSIIRRHLNNSPTNPFTRQMLTESMLEPVPELKEQIQAWMDEKNSSDH,6.408851,"I1M, V11Y, R20K, A28V, L59R, L63N, D68N, N71T, R95D, Q98N",10
IEKFKLLAEKCEEIVAKNARAEIPYSDAPDEFRDPLMDTLMTDPVLLGSGTVLDRSIILRHLLNSPTNPFTRQMLTESMLEPDSDLKEQIQAWMREKQSSDH,8.325018,"V11C, D24P, R46L, P48G, M53L, D68N, N71T, V83D, P84S, E85D",10
IEEFPLLAEKVEEIVAKQARAEIDYSDAPDEYRDPLMDTLMTDPVRLPSGTVLDRSSILRHLLNSPTNPFTRQMLTESMLEPVPELKEQIQAWCEEKQSSDH,8.205118,"K3E, K5P, N18Q, F32Y, M53L, I57S, D68N, N71T, M94C, R95E",10
IEKFKLLAEKVEEIVAKNARDEIDYSDVPDEFRCPLMDTIMTDPVRLPSGTVMDRSIILRHLLNSPTNPFTRQMLHESMIEPDPKLKEQIQAWMREKQSSDH,6.601337,"A21D, A28V, D34C, L40I, D68N, N71T, T76H, L80I, V83D, E85K",10
IERFKLLQKKVEEIVAKAARAEIDYSDAPDEFRDPLMYTLMTDPVLLPSGTVMDRSIILRHLLNSPTNPFTRQMLTESMLIPVPELKEQIQAWMREKQTSDH,6.4776163,"K3R, A8Q, E9K, N18A, D38Y, R46L, D68N, N71T, E81I, S99T",10
IEKFKLLAEKVEEIVKKSARAEIDYDDVPDEFRDPLMDTLMTDPVRLPSGTVMDRSIILRHLLNRPTNPFTRQLLTESMLYPVPELKEQIQRWMREKQSSDH,5.939839,"A16K, N18S, S26D, A28V, S65R, D68N, N71T, M74L, E81Y, A92R",10
IEKFKLTAEKVEEIVAKNARAEIDYSEIPDEFRDPLMYTVMTDPVRLPSGMVMDRSIILRHLLNSPTNPFTRQMLTESMVEPVPELKEAIQAWMREKQSSDH,6.673726,"L7T, D27E, A28I, D38Y, L40V, T51M, D68N, N71T, L80V, Q89A",10
IEKFKLLAEKVEEIVHKNARQEETYSDAPDEFRDPLMDTLMTDPVRLPSGYVMDRSIILRHLLNSTTNPFTRHMLTESMLEPYPELKEQIQAWMREKQSSDH,2.6195002,"A16H, A21Q, I23E, D24T, T51Y, P66T, D68N, N71T, Q73H, V83Y",10
IEKFKLLAEMVEEIVAKNARDEIDYSDAPDEFRDPLMDELMTDPVRLPSGTVMDRSIILRHLLNSPTNPFTRQMLTESMLQPVPELAEQIQAWMRTVQASDH,6.7817664,"K10M, A21D, T39E, D68N, N71T, E81Q, K87A, E96T, K97V, S99A",10
IDKFKDLPEKVEEIVAKNARAEIDYSDIPDDFRDPLMDTLMTDPVVLPSGTVMDRSIILRHLLNSPTNPFTREMLTESMLEPVPELKEVIQAWMREKQSSDH,4.0426087,"E2D, L6D, A8P, A28I, E31D, R46V, D68N, N71T, Q73E, Q89V",10
IEKFKLLAEKVEEIVAKMARAEIDYSDAPDEYRDPLMDTLMTDPVRLDSGTVLDRSIILRHLLNNPTNPFTRQMLTESMLEPVPELQEQIQAWMDEKASSDH,8.2216,"N18M, F32Y, P48D, M53L, S65N, D68N, N71T, K87Q, R95D, Q98A",10
IEKFKLLADKVEDIVDKNARAEIDYSDAPDEFRDPLMDTLMTDPVRLPSGTVMDRSIILRHLLDSPTNPFTRQMLTDSMLEPVPELIEQIQAWIQEKQSSDH,3.4609811,"E9D, E13D, A16D, N64D, D68N, N71T, E77D, K87I, M94I, R95Q",10
IEKFKLLAEKVEEIVAKNARAEIDYSDLPDEFRDPLMDTLMTDPVRLPSGTVMDRSIILLHLLNSPTNPFTRQPLTESQLEPVPQLKDQVQAWMREKCSSDH,5.525998,"A28L, R60L, D68N, N71T, M74P, M79Q, E85Q, E88D, I90V, Q98C",10
IEKFKLEAEKVEEIVAKNARDEIDYNDAPDEFRDPLMDTLMTDPVILPSGTVMDRSIILRHLLNSPTNPFTRQMLLESMLEPNPELLEQIAAWMREKQSSDH,5.593579,"L7E, A21D, S26N, R46I, D68N, N71T, T76L, V83N, K87L, Q91A",10
IEKFKLLGEKVEEIVAKNARAEIDYIDAPDEFRDPLMDTLMTDPVRLPSGYTMDRSIILRHLLNSPTNPFTRQMLTESMLEPNPELQEKIQAWMREKQSDDH,7.871088,"A8G, S26I, T51Y, V52T, D68N, N71T, V83N, K87Q, Q89K, S100D",10
IEKKKLLAEKVEEIDAKNARAEIDYSDAPDEFRDPLMDTLMTDPVILPSGTNMDRSIILRHLLNSPTNPFTRQPLTESMLEPVPELKRQVQAWMREKQSTDH,4.6006575,"F4K, V15D, R46I, V52N, D68N, N71T, M74P, E88R, I90V, S100T",10
IEKFKDLAEKVEEIVATNARAEIDYSDAPDEFRDPLMDTLMTDPVRLPSGTVMDRSIIERHLLESPNNPYTRQPLTESMAEPVPELKEQIQAWMREKQSSDH,5.890724,"L6D, K17T, L59E, N64E, T67N, D68N, F70Y, N71T, M74P, L80A",10
IENFKLLCEKVEEIVAKNARAEIDYSDAPDEFRDPLMDTLMTDPVRLPSGTVLDRTIILRHLLNSPYNPFTRQMLTESMLEPVPELKEQIQAWMDKKQSSYH,8.165363,"K3N, A8C, M53L, S56T, T67Y, D68N, N71T, R95D, E96K, D101Y",10
IEKFKLLALKVEEIVAKNARAEIDDSDAPDEFRDPLMDTLMTDPVRLPSGTVMDRSIILRHLLNDPTNPFTRQMMTESMLEPDPELKEKIQQWMREKQSSDY,5.559925,"E9L, Y25D, S65D, D68N, N71T, L75M, V83D, Q89K, A92Q, H102Y",10
IEKQKLLAEKVEEIVAKNARADIDYSDAPDEFQDPLMDTLMEEPVRLPSGTVLDRSIILRHLLNSPTNPFTRQMLTESMLEPVPELKEQVQAWMFEKQSSDH,7.428114,"F4Q, E22D, R33Q, T42E, D43E, M53L, D68N, N71T, I90V, R95F",10
IEKFKLLTEKVEEIVAKNAREEIDYSDIPDEFRDPLMDTLMTDPVRLPSGTVMDRSIILRHLVNSPTNPFTRQPLTESMLEPVPELKEEIQKWMREKQSSDS,7.9276686,"A8T, A21E, A28I, L63V, D68N, N71T, M74P, Q89E, A92K, H102S",10
KEKFKSLAYLVEEIVAKNARAEIDYSDAPDEFRDPLMDKLMTDPVILPSGTVMDRSIILRHLLNSPTNPFTRQMLTESMLEPVPELKEQIQSWMREAQSSDH,3.39635,"I1K, L6S, E9Y, K10L, T39K, R46I, D68N, N71T, A92S, K97A",10
IEKFKLEAEKVEEIVAKNARAEIDYSDAPDEFRDPIMDTLMTDPVRSPSGTVMDRQIILRHLLNSPTNPITRQMLDESMLEPVPELYEQIQAWYREKQSSDH,6.1683292,"L7E, L36I, L47S, S56Q, D68N, F70I, N71T, T76D, K87Y, M94Y",10
IEKFKLLAEKVEEIVAKNARAEDDYSDAPDEFRDPLMYTLMTDPVQLPSGTVMDRSIIVRHLLNSPTNPFTRRMLTEDMLEPVPELCEQIQAWKREKQSSDH,6.8495674,"I23D, D38Y, R46Q, L59V, D68N, N71T, Q73R, S78D, K87C, M94K",10
IEKFKLLEEGVEEIVAKNARAEIDYSDVPDEFRDPLMDTLMTDPVRLPSGTVMDRSIILRHLLNSPTNPYTRQMLTESMVEPVPELQELIQAWMREKQSSNH,6.2496777,"A8E, K10G, A28V, D68N, F70Y, N71T, L80V, K87Q, Q89L, D101N",10
