Sequence,Score,Mutations,Number of Mutations
IEKFELLAEKVETIAAKNQREEIDYSDAPDEFRDPLMDTLMTDPVRLPSGTVMDRSIILRHLLNSPTDPFNRQMLTESQLEPVPELKERIQAWMREKQSADH,0.10555041,"K5E, E13T, V15A, A19Q, A21E, M79Q, Q89R, S100A",8
IEKFKLLAEKAEELAAKNARAEIDYSDAPDEFRDPLMDTLMTDPVRLPSGTIMDRSIILRHLLNSSTDPFNRQPLTESMLEPVPELKERIQAWMREKQSSSH,0.27870792,"V11A, I14L, V15A, V52I, P66S, M74P, Q89R, D101S",8
VEKFKLLAEKVEEVSAKNARAEIDYSDAPEEFRDPLMDTLMTDPVRLPSGTIMDRSVILRHLLNSPTDPFNRQMLTESMLEPVTELKEQIQAWMREKQLSDH,1.0301099,"I1V, I14V, V15S, D30E, V52I, I57V, P84T, S99L",8
ITKFKNLAEKVEEIVAKNARAEIDYSDAPDEFRDPLMDTLMTDPVKLPSGTIMDRAIILRHLLNSPTDPFNRQMLTEDMLEPVLELKEQIQAWMREKQSSDE,0.17932081,"E2T, L6N, R46K, V52I, S56A, S78D, P84L, H102E",8
IEKFKLLADKVEEIVAKNARAEIDYSDAPDEFRDPLMDTLMTDPVRLPSGKIMDRSVILRHLLNSPTDPFNRSMLTESMLAPAPELKEQIQAWQREKQSSDH,0.32096007,"E9D, T51K, V52I, I57V, Q73S, E81A, V83A, M94Q",8
IEKFKQLKEKVEEIVAKNARAEVDYSDAPDEFRDPLMDTLMTDPVRLPSGTVMDRSIILRHLLNSPTDPFTRQMLTISMLEPVPELKERIQAWRREKQISDH,2.9080675,"L6Q, A8K, I23V, N71T, E77I, Q89R, M94R, S99I",8
IEQFKLLGNKVEEIVAKNARAEIDYSDAPDEFRDPLMDTLMTDPVRLPSGTIMDRSVILRHLLNSPTDPFNRQMLTESMLENVPELKEQIQAWMREKRSSDS,-0.80195844,"K3Q, A8G, E9N, V52I, I57V, P82N, Q98R, H102S",8
IEKFKELAERVEELVATNAVEEIDYSDAPDEFRDPLMDTLMTDPVRLPSGTVMDRSIILRHLLNSPTDPFNRQMLTESMLEPVPELKEQIQAWMREKQSSKS,0.9925547,"L6E, K10R, I14L, K17T, R20V, A21E, D101K, H102S",8
IEKFNLLAEKVAEIVAKNAIAEIDYDDAPDEFRDPLMDTLMTDPVRLPSGTVMDRTIILRHLLNSPTDPFNRQMLTEDMLEPVPELKERIQAWMREKQSSGH,0.8364111,"K5N, E12A, R20I, S26D, S56T, S78D, Q89R, D101G",8
IEKFKLLAEKVEEIEAKNARAEIDYSDAPDEFRDPLMDTLMTDPVRLPSGTVMDRSVILRHLLNSPTDPFNRTPLTESMLEPVPELKERIQAWMREKQAEDE,0.37343448,"V15E, I57V, Q73T, M74P, Q89R, S99A, S100E, H102E",8
IEKFTLLAAKVEEIVAKNARAEIDYNDAPDEFRDPLMDTLMTDPVRLPSGTVMDRSVIMRHLLNSPTDPFNRQPLTEDMLEPVPELKEQIQAWMRKKQSSDH,0.6386031,"K5T, E9A, S26N, I57V, L59M, M74P, S78D, E96K",8
IEKFGLLAEKVDELVAKNARAEIDYSDAPEEFRDPLMDTLMTDPVRLPSGHVMDRSIILRHLLNSPTDPFNRQMLTEKMLEPVPELKERIEAWMREKQSSDH,1.7311703,"K5G, E12D, I14L, D30E, T51H, S78K, Q89R, Q91E",8
IEKFKLLAEKVEEIVAKNTRAEIDYSDAPDEFRDRLMDTLMTDPVKLPSGNVMDRSIILRHLLNSPTDPFNRQMLTESMLEPLPELKEQIEAWMREKQQSGH,-2.8084512,"A19T, P35R, R46K, T51N, V83L, Q91E, S99Q, D101G",8
MTKFKLLAEKVEEIVAKQARAEIDYSDAPDEFRDPLMDTLMTDPVRLPSGTVMDRSIILRHLLNSPTDPFNRQPLTENMLEPVPELKERIQAWMREKKSSRH,-0.37982184,"I1M, E2T, N18Q, M74P, S78N, Q89R, Q98K, D101R",8
IDKFKLLAEKVDEIVAKNARAEIDYSDAPDEFRDRLMDTLMTDPVRLPSGNVMDRSIILRHLLNSPTDPFNRQMLTESMLQPAPELKEQIQAWIREKLSSDH,-3.212654,"E2D, E12D, P35R, T51N, E81Q, V83A, M94I, Q98L",8
MEKFKLLADKAEEIVTKNARAEIDYSDAPDEFRDPLMDTLMTDPVRLPSGTVMDRSIILRHLLNSPTDPFNRQMLTESMLEPVPELKERIQKWVKEKQSSDH,-1.3350143,"I1M, E9D, V11A, A16T, Q89R, A92K, M94V, R95K",8
IEKFKALREKSEEIAAKNQRAEIDYSDAPDEFRDPLMDTLMTDPVRLPSGTVMDRSIILRHLLNSPTDPFNRQMLTEEMLEPVPELKEQISAWMKEKQSSDH,-1.2273765,"L6A, A8R, V11S, V15A, A19Q, S78E, Q91S, R95K",8
IEKFKLLTEKVEEIVAKNARAEADYSDAPEEFRDPLMDTLMTDPVRLPSGTVMDRSIILRHLLNSPTDPFNRQMLTEDMLEPVPELKEQIQAWMLKKSSSDS,1.2477123,"A8T, I23A, D30E, S78D, R95L, E96K, Q98S, H102S",8
IEKFKLLGEKVEKIVSKNTRMEIDYSDAPDEFLDPLMDTLMEDPVRLPSGTVMDRSIILRHLLNSPTDPFNRQMLTESMLEPLPELKEQIQAWMREKQSSDH,-0.55661774,"A8G, E13K, A16S, A19T, A21M, R33L, T42E, V83L",8
MEKFKALAERVEEIVAKANRAEIDYSDAPDEFRDPLMDTLMTDPVRLPSGTVMDRSIILRHLLNSPTDPFNRQMLTESMLEPVPELKERIQAWMKEKQSKDH,-1.3485248,"I1M, L6A, K10R, N18A, A19N, Q89R, R95K, S100K",8
IEKFKLLAERVDEIVLENARMEIDYSDAPDEFRDPLMDTLMTDPVRLPSGTVMDRSIILRHLLNSPTDPFNRQMLTESMLEPVPELKEQIQAWRRERLSSDH,0.18566419,"K10R, E12D, A16L, K17E, A21M, M94R, K97R, Q98L",8
IELFKDLCEKVEEIVAKHARAEIDLSDAPEEFRDPLMDTLMTDPVRLPSGTVMDRSIITRHLLNSPTDPFNRQMLTESMLEPVPELKEQIQRWMREKQSSDH,0.57423335,"K3L, L6D, A8C, N18H, Y25L, D30E, L59T, A92R",8
IEKFELLAENVERIVAAAARAEIDLSDAPDEFRDPLMDTLMTDPVRLPSGKVMDRSIILRHLLNSPTDPFNRQMLTESMLEPVPELKEQIEAWMREKQSSDH,1.3811921,"K5E, K10N, E13R, K17A, N18A, Y25L, T51K, Q91E",8
IEKFKELAEKVDELVAKEARDEIDYSDAPDEFRDPLMDTLMTDPVRLPSGTVMDRSVILRHLLNSPTDPFNRQMLTESMLEPVPELKEQIQAWMREKQSSRR,1.4992654,"L6E, E12D, I14L, N18E, A21D, I57V, D101R, H102R",8
IEKFKLLSAKVEEIVAKNAREEIDYSDAPDEFRDPLMDTIMTDPVRLPSGTVMDRSVILRHLLNSPTDPFNRQPLTESMLEPVVELKEQIQAWIREKQSSDH,3.1794152,"A8S, E9A, A21E, L40I, I57V, M74P, P84V, M94I",8
MEKFKLLAEKVETMVAKHSRAEIDYSDAPDEFRDPLMSTLMTDPVRLPSGTVMDRSIILRHLLNSPTDPFNRQMLTEDMLEPVPELKEQIQAWMREKQSSDA,-1.6968389,"I1M, E13T, I14M, N18H, A19S, D38S, S78D, H102A",8
MERMKQLAEKVDEIVAKNRRAEIDYSDAPDEFRDPLMDTLMTDPVRLPSGTVMDRSIILRHLLNSPTDPFNRQMLTESDLEPVTELKEQIQAWMREKQSSDH,-0.91596204,"I1M, K3R, F4M, L6Q, E12D, A19R, M79D, P84T",8
MEKFKDLAEKVEEIVAQNLAAEIDYSDAPDEFRDPLMDTLMTDPVRLPSGTVMDRSIILRHLLNSQTDPFNRSMLTESMLEPVTELKEQIQAWMREKQSSDH,0.109044984,"I1M, L6D, K17Q, A19L, R20A, P66Q, Q73S, P84T",8
IEKFKELNEKVEAIVAKNARAEIDYSDAPDEFRDPLMDTLMTDPVKLPSGTVMDRSVILRHLLNSPTDPFNRQMLTEDMLEPVPELKEQILAWMRNKQSSDH,0.8354602,"L6E, A8N, E13A, R46K, I57V, S78D, Q91L, E96N",8
IEKFKLLAEKVEEVVAKQARAEIDYSDAPDEFLDPLMDTLMTDPVRLPSGTVMDRSIILRHLLNSPTDPFNRQMLTESMLEPVPELKEQIHHWIREKQSSRK,0.5673182,"I14V, N18Q, R33L, Q91H, A92H, M94I, D101R, H102K",8
IEKFKLLSEKFEEIVALNARAEIDYSDAPDEFRDPLMDTLMLDPVRLPSGTVMDRPIILRHLLNSPTDPFNRQPLTEDMLEPVPELKEQIQNWMREKQSSDH,1.3403302,"A8S, V11F, K17L, T42L, S56P, M74P, S78D, A92N",8
IEKFKLLCEKVNELVKKNATAEIDYSDAPDEFRDPLMDTLMTDPVRLPSGTVMDRSIILRHLLNSPTDPFNRQMLTESMLEPVPELKERIQAWMRSKQSSDS,-0.8544791,"A8C, E12N, I14L, A16K, R20T, Q89R, E96S, H102S",8
MQKFKLLAEKVEKIVAKNARDEADLSDAPDEFRDPLMDTLMTDPVRLPSGTVMDRSIILRHLLNSPTDPFNRQMLTESMLEPVPELKEQIQAWMRERQSSDT,0.4178428,"I1M, E2Q, E13K, A21D, I23A, Y25L, K97R, H102T",8
IEKFKTLAEKVEEIVAKNARAEIDYSDAPEEFRDPLMDTLMTDPVRLPSGTVADRSIILRHLLNSPTDPFNRQPLTESMLETTPELKEQIRAWMREKLSSDH,-1.0940897,"L6T, D30E, M53A, M74P, P82T, V83T, Q91R, Q98L",8
IEKFKLLSEKVEEIVAKNALAEIDYSDAPDEFRDPLMDTLMTDPVRLPSGTVADRSIILRHLLNSPTDPFNRQPLTEDMLEPVPELKEQIQSWMREKQSTVH,0.5427826,"A8S, R20L, M53A, M74P, S78D, A92S, S100T, D101V",8
IEKFKLLAEKAEEIAAKNARAEIDYSDAPEEFRDPLMNTLMTDPVRLPSGTVMDRSIILRHLLNSPTDPFNRQPLTEDMLEPVPELKERIQAWMKEKQSSDH,-1.6918957,"V11A, V15A, D30E, D38N, M74P, S78D, Q89R, R95K",8
IEKFKDLAAKVEEISAKNALAEIDYSDAPDEFRDPLMDTLMTDPVKLPSGTVMDRSIILRHLLNSPTDPFNRQMLTESMLEPVPELKEQIQAWMRTKNTSDH,0.9707723,"L6D, E9A, V15S, R20L, R46K, E96T, Q98N, S99T",8
IEGFKALKEKMEEIVAKNAGAEIDYSDAPDEFRDPLMDTLMTDPVRLPSGTVMDRSIILRHLLNSPTDPFNRSELTESMLEPVPELKEQIQAWMREKQSSDS,-0.36212134,"K3G, L6A, A8K, V11M, R20G, Q73S, M74E, H102S",8
IEKLKLLAEKVEEIVATRARAEIDYSDAPDEFRDALMDTLMTDPVRLPSGTVMDRSIILRHLLNSPTDPFNRQMLTESMLLPVPELKEQIQEWMKEKQTSDH,-2.8412533,"F4L, K17T, N18R, P35A, E81L, A92E, R95K, S99T",8
IEKFELLSKKVEEIVAKNARAEIDYSDAPDEFRDPLMDTLMTDPVKLPSGTVMDRSVILRHLLNSPTDPFNRQMLTESMLEPLVELKEQIQAWMREKMSSDH,0.14736113,"K5E, A8S, E9K, R46K, I57V, V83L, P84V, Q98M",8
IEKFKELAEKADELVAKNARAEIDYSDAPPEFRDPLMDTLMTDPVRLPSGTVMDRSIIMRHLLNSPTDPFNRQMLTESMLEPVPELKEQIQAWMKEKQRSDH,-1.6311364,"L6E, V11A, E12D, I14L, D30P, L59M, R95K, S99R",8
IEKFKMLTEKMEEIVAKNARAEIDYSDAPDEFRDPLMDTLMTDPVKLPSGTIMDRSIILRHLLNSPTDPFNRQPLTESMLEPVPELKEQIIAWMREKQKSDH,1.1766719,"L6M, A8T, V11M, R46K, V52I, M74P, Q91I, S99K",8
IEKFDALAEKVEELAAKNQRAEIDYSDAPEEFRDPLMDTLMTDPVRLPSGTVMDRSIIMRHLLNSPTDPFNRQMLTESMLEPVPELKEQIQAWIREKQSSDH,1.1535683,"K5D, L6A, I14L, V15A, A19Q, D30E, L59M, M94I",8
IEHFKLLAVKVEEIVAKNAMEEMDYSDAPDEFRDPLMDTLMTDPVRLPSGTVMDRSIILRHLLNSPTDPFTRQMLTESMLEPVPELKEQIQAWMRSKQSSGH,3.1888924,"K3H, E9V, R20M, A21E, I23M, N71T, E96S, D101G",8
IDKFKLLAEKLEEIVAKNARAEIDYSDAPEEFKDPLMDTLMTDPVRLPSGTVMDRAIILRHLLNSPTDPFNRQMLTESQLEPVPELKEQIQAWMREKQRSDQ,-0.018843357,"E2D, V11L, D30E, R33K, S56A, M79Q, S99R, H102Q",8
IEKFKLLAEKVEEIVAKNRRAEIDYSDAPDEFKDPVMDTLMTDPVKLPSGKVMDRSIILRHLLNSKTDPFNREMLTESQLEPVPELKEQIQAWMREKQSSDH,0.31782848,"A19R, R33K, L36V, R46K, T51K, P66K, Q73E, M79Q",8
IEKFKALAEKVEEVVAKNAREEIDYSDAPDEFRDPLMDTLMTDPVRLPSGTVMDRSIILRHLLNSPTDPFNRQMLTESMLEPVPELKEQIQQWMEEKQRPDL,0.16069569,"L6A, I14V, A21E, A92Q, R95E, S99R, S100P, H102L",8
IEKFKSLAEKVEEIVQKSAAAEIDYSDAPDEFRDPLMDTLMTDPVRLPSGTVMDRAIILRHLLNSPTDPFNRQMLTESMLEPVPELKEQIQAWVRSKQSSDA,1.3608301,"L6S, A16Q, N18S, R20A, S56A, M94V, E96S, H102A",8
IEKFKLLIEKVEEIAAKNATKEIDYSDAPDEFRDPLMDTLMTDPVRLPSGTIMDRSIILRHLLNSPTDPFNRSMLTESMLEPVVELKEQIQTWMREKQSSDH,1.0464604,"A8I, V15A, R20T, A21K, V52I, Q73S, P84V, A92T",8
MEKFKLLAEKVEEIVASNAQAEIDYSDAPDEFRDPLMDTLMTDPVRLPSGKIMDRSIILRHLLNSPTDPFNRQMLTESQLEPVPELKEQIQAWMRTKQPSDH,1.8261514,"I1M, K17S, R20Q, T51K, V52I, M79Q, E96T, S99P",8
IEGFKLLAEKVEEIVAKNARAEIDYSDAPEEFRDPLMDTLMTDPVKLPSGNVMDRSVILRHLLNSPTDPFNRQMLTESMLEPVPELKEQIQAWVRNKQFSDH,0.012812009,"K3G, D30E, R46K, T51N, I57V, M94V, E96N, S99F",8
IEKFKLLAEKVEAIVAQNAEAEIDFSDAPDEFRDTLMDTLMTDPVRLPSGTIMDRSVILRHLLNSPTDPFNRQMLTESMLEPVPELKEQIQAWMREKQGSDH,-1.6895113,"E13A, K17Q, R20E, Y25F, P35T, V52I, I57V, S99G",8
LEKFALLREKLEEIVAKNLRAEIDYSDAPEEFRDPLMDTLMTDPVRLPSGTVMDRSIILRHLLNSPTDPFNRQMLTESMLEPVPELKAQIQAWIREKQSSDH,0.07260688,"I1L, K5A, A8R, V11L, A19L, D30E, E88A, M94I",8
IEDFKLLAEKVEEASATEARAEIDYSDAPDEFRDPLMDTLMTDPVRLPSGTVMDRSIILRHLLNSPTDPFNRQMLTESMLEPVPELKEQIQAWMREKQKSGQ,-0.073927715,"K3D, I14A, V15S, K17T, N18E, S99K, D101G, H102Q",8
MEKFSLLAQRVEEIVAKNARAEVDYSDAPDEFVDPLMDTLMADPVRLPSGTVMDRSIILRHLLNSPTDPFNRQMLTESMLEPVPELKAQIQAWMREKQSSDH,-1.7944221,"I1M, K5S, E9Q, K10R, I23V, R33V, T42A, E88A",8
IEKFQLLAEKMEEMVAKNARAEVDYSDAPDEFKDPLMDTLMTDPVRLPSGTIMDRSIILRHLLNSPTDPFNRQMLTESMLEPVPELKEQIQAWMREKQNSDA,0.029206987,"K5Q, V11M, I14M, I23V, R33K, V52I, S99N, H102A",8
IEKFKLLAEKCEEIVNKNARAEIDYSDAPDEFRDPIMDTLMTDPVKLPSGQVMDRSIIMRHLLNSPTDPFNRQMLTESMLEPVVELKEQIQAWMREKQLSDH,3.9854383,"V11C, A16N, L36I, R46K, T51Q, L59M, P84V, S99L",8
IEVFKLLQEKMEEIVAQNAMAEIDYSDAPDEFRDPLMDTLMADPVRLPSGNVMDRSVILRHLLNSPTDPFNRQMLTESMLEPVPELKEQIQAWMREKQSSDH,0.4050516,"K3V, A8Q, V11M, K17Q, R20M, T42A, T51N, I57V",8
IEKFKLLAEKVEEIVAKNARKEIDYSDAPDEFRDPLMDTLMTDPVRLPSGNVMDRSIILRHLLNSPTDPFNRQPLTEEMLEPVPELKEQIEAWMRAKIASDH,1.2264351,"A21K, T51N, M74P, S78E, Q91E, E96A, Q98I, S99A",8
IEKFKLLKEKCEEIVAKESREEIDYSDAPDEFRDPLMDTLMTDPVRLPSGTVMDRSIILRHLLNSPTDPFNRQMLTEDMLEPAPELKEQIQAWMREKQSSDM,1.0288603,"A8K, V11C, N18E, A19S, A21E, S78D, V83A, H102M",8
MEKFKLLAEKVEEIVAKNARVEIDYSDAPDEFRDPLMDTLMTDPVRLPSGKIMDRPIILRHLLNSETDPFNRQMLTEDMLEPVPELKEQIQAWMREKVSSDH,1.0559582,"I1M, A21V, T51K, V52I, S56P, P66E, S78D, Q98V",8
IEKFIVLAEKVEELVAKNAADEIDYSDAPDEFRDPLMDTLMTDPVRLPSGNIMDRSIILRHLLNSPTDPFNRQMLTESMLEPVPELKDQIQAWMREKQSSDH,0.54227734,"K5I, L6V, I14L, R20A, A21D, T51N, V52I, E88D",8
MEKFKLLTEKVEEIVAKNNRAEIDYSDAPDEFRDPLMDTLMTDPVRLPSGTVMDRSIILRHLLNSPTDPFTRQMLTESDLEPQPELKAQIQAWMREKQSSEH,1.9790123,"I1M, A8T, A19N, N71T, M79D, V83Q, E88A, D101E",8
IEKFKLLAEKMDEIVAKNQTADIDYSDAPDEFRDPLMDTLMTDPVRLPSGTVMDRSIILRHLLNSPTDPFNRQMLTESMLEPVPELKEQIYAWMREKLSSDS,-0.5514014,"V11M, E12D, A19Q, R20T, E22D, Q91Y, Q98L, H102S",8
IEKFKLLAEKVEIIAAKNAREEMDYSDAPDEFRDPLMDTLMTDPVRLPSGTIMDRSIILRHLLNSPTDPFNREMLTESMLEPVPELKEQIQAWMKEKQSSDK,-1.602442,"E13I, V15A, A21E, I23M, V52I, Q73E, R95K, H102K",8
IEKFKLLSEKVEAIAAKNARNEIDYEDAPDEFRDPLMDTIMTDPVRLPSGTVMDRSIILRHLLNSPTDPFNRQELTESMLEPVPELKEQIQAWMREKQSSSH,2.3636622,"A8S, E13A, V15A, A21N, S26E, L40I, M74E, D101S",8
ISKFKDLCEKVEEIAAKNARAEIDYSDAPDEFRDPLMDTLMTDPVRLPSGTIMDRSIIIRHLLNSPTDPFNRQMLTEDMLEPMPELKEQIQAWMREKQSSDH,1.5269341,"E2S, L6D, A8C, V15A, V52I, L59I, S78D, V83M",8
IEKFKELAEKVQEIVAKKIRAEIDYSDAPDEFRDGLMDTLMTDPVRLPSGTVMDRSIILRHLLNSPTDPFNRQMLTESMLEPAPELKEQIEAWVREKQSSDH,-1.0829341,"L6E, E12Q, N18K, A19I, P35G, V83A, Q91E, M94V",8
MEKFKLLAEKVEEIVAKNAAAEIDYSDAPDEFRDPLMDTLMTDPVKLPSGVIMDRKIILRHLLNSPTDPFNRQPLTESMLEPSPELKEQIQAWMREKQSSDH,1.6098812,"I1M, R20A, R46K, T51V, V52I, S56K, M74P, V83S",8
IEKFLLLAEKVEEIVAKNHRDEIDYSDAPDEFRDPLMDTLMTDPVKLPSGTIMDRSIILRHLLNSPTDPFNRQMLTEDMLEPVTELKEQIQAWQREKQSSDH,1.6858568,"K5L, A19H, A21D, R46K, V52I, S78D, P84T, M94Q",8
IEKFKLLAEKVEEIVAKNAAAEIDYSDAPDEFRDPLMDTLMTDPVRLPSGTVMDRSIILRHLLNSATDPFNRQMLTEDMLEPAVELKEQIQAWIREKQSSSM,1.3229972,"R20A, P66A, S78D, V83A, P84V, M94I, D101S, H102M",8
MEKFKLLSMKVEEIAAENQRAEIDYSDAPDEFRDPLMDTLMTDPVRLPSGTIMDRSIILRHLLNSPTDPFNRQMLTESMLEPVPELKEQIQAWMREKLSSDH,0.98786104,"I1M, A8S, E9M, V15A, K17E, A19Q, V52I, Q98L",8
IEKFKELAEKVEEIAAKNAAAEIDYSDAPEEFRDPLMDTLMTDPVRLPSGNVMDRSIILRHLLNSPTDPFNRQMLTEDMLEPVPELKEQIQAWMREKQSKRH,2.1356297,"L6E, V15A, R20A, D30E, T51N, S78D, S100K, D101R",8
IEKFKLLAEKVEEIAAKNAVASIDYDDAPDEFRDPLMDTLMTDPVRLPSGHVMDRSIILRHLLNSPTDPFNRQMLTEDMLEPVPELKERIQAWMRKKQSSDH,2.173966,"V15A, R20V, E22S, S26D, T51H, S78D, Q89R, E96K",8
IEKFNQLAEKCEEIVKKNARAEIDYSDAPDEFRDPLMDTLMTDPVRLPSGTVMDRSIILRHLLNSPTDPFNRQMLTESMLEPVPELKEQIQAWIREKQSKLG,1.4224858,"K5N, L6Q, V11C, A16K, M94I, S100K, D101L, H102G",8
IEKFKDLAEKADEIVAKNDDAEIDYSDAPDEFKDPLMDTLMTDPVRLPSGTVMDRSVILRHLLNSPTDPFNRQMLTESMLEPVPELKEQIQAWMREKQSSDM,1.5574965,"L6D, V11A, E12D, A19D, R20D, R33K, I57V, H102M",8
MEKFKLLAEKVEEIVAKNARAEIDYSDAPDEFLDPLMATLMTDPVRLPSGEVMDRSVILRHLLNSETDPFNRQPLTESMLESVPELKEQIQAWMREKQSSDH,-0.26243448,"I1M, R33L, D38A, T51E, I57V, P66E, M74P, P82S",8
IEKLKLLAEKAENIVALNARAEIDYSDAPDEFRDPLMDTLMTDPVKLPSGTVMDRSIILRHLLNSPTDPFNRQPLTESMLEPVPELKEQIQAWMKEKVSSDH,-0.6543391,"F4L, V11A, E13N, K17L, R46K, M74P, R95K, Q98V",8
IESFKLLREKVEENVAKAARAEIDYSDAPDEFRDPLMDTLMTDPVRLPSGTVMDRSIILRHLLNSPTDPFNRQMLTEEMLEPVPELKEKIQAWIREKQSSPH,0.5303025,"K3S, A8R, I14N, N18A, S78E, Q89K, M94I, D101P",8
IEKFKLLASKVEEIVAKGARAEIDYSDAPDEFKDPIMDTLMTDPVRLPSGTVMDRSIILRHLLNSPTDPFNRQMLTESMLESVPELKEQIQAWMRLKGSFDH,1.4427269,"E9S, N18G, R33K, L36I, P82S, E96L, Q98G, S100F",8
IEKFHLLAEKVEELVAKNAVEEIDYSDAPDEFRDPLMDTLMVDPVRLPSGTVMDRSIILRHLLNSPTDPFNRQMLTESALEPVPELKEQIQAWIREKQSSDL,-0.09478183,"K5H, I14L, R20V, A21E, T42V, M79A, M94I, H102L",8
IEKFKLLAQKVEEIAAKNANAEIDLSDAPDEFKDPLMDTLMTDPVKLPSGTVMDRSIILRHLLNSPTDPFNRQMLTESMLEPVPELKEKIQAWMREKQSSDR,0.9357224,"E9Q, V15A, R20N, Y25L, R33K, R46K, Q89K, H102R",8
MEKFKLLAEKVEEITAKNAVAEIDYSDAPDEFRDPLMDTLMTDPVRLPSGTVMDRIIILRHLLNSPTDPFNRQPLTESMLESVPELKEQIQAWLREKQSSDK,0.31412116,"I1M, V15T, R20V, S56I, M74P, P82S, M94L, H102K",8
IEKFKLLAEKVNELVAKNMAAEIDYSDAPDEFRDPLMDTLMTDPVRLPSGTVMDRSIILRHLLNSPTDPFNRTMLTEDMLEPVPELKEQIQAWIRSKQSSDH,-0.5067769,"E12N, I14L, A19M, R20A, Q73T, S78D, M94I, E96S",8
IEKFKLLNEKVEEIVAKNAMAEFDYSDAPDEFRDPLMDTLMTDPVRLPSGTVMDRSIILRHLLNSPTDPFNREPLTESMLEPVPELKEQIKAWMRKKKSSDH,0.3392393,"A8N, R20M, I23F, Q73E, M74P, Q91K, E96K, Q98K",8
IENFKLLAEKVEEIVTRNARAEIDYSDAPDEFRDPLMDTLMTDPVRLPSGTIMDRAIILRHLLNSPTDPFNRQPLTESMLEPVAELKEQIQAWMREKQISDH,0.38192582,"K3N, A16T, K17R, V52I, S56A, M74P, P84A, S99I",8
IEKFQLLDEKVEEIVAKNARAEIDYSDAPDEFRDPLMDTLMTDPVRLPSGTVMDRSVILRHLLNSPTDPFNRQMLTEDMLEPVPELKEQIQAWMQEKRSSKT,0.21453969,"K5Q, A8D, I57V, S78D, R95Q, Q98R, D101K, H102T",8
LEKFKLLAEKCEEIVAANARAEIDYSDAPDEFRDPIMDTLMTDPVRLPSGTIMDRSIILRHLLNSNTDPFNRQMLTESMLEPVPELKEQIQAWMREKLSSRH,3.1981802,"I1L, V11C, K17A, L36I, V52I, P66N, Q98L, D101R",8
IEKFKLLAEKVEELVAKNAAAEIDYSDAPDAFRDPLMDTLMTDPVRLPSGTVMDRSIILRHLLNSPTDPFNRQPLTEADLEPVPELKEQIQAWMREKLSSWH,-0.059162162,"I14L, R20A, E31A, M74P, S78A, M79D, Q98L, D101W",8
IEKFKLLAEKVEEIKVKNQRAEIDYSDAPDEFRDPLMDTLMTDPVRLPSGTVMDRSVILRHLLNSPTDPFNRQMLTESMLEPAPELKEQIQAWLREKQSQDA,0.8003205,"V15K, A16V, A19Q, I57V, V83A, M94L, S100Q, H102A",8
IEKFKELAEKVEVIVAKNARAEIDYSDAPEEFRDPIMDTLMTDPVRLPSGTVMDRRIILRHLLNSPTDPFNRQMLTEDMLEPVPELKEQIQAWVREKQSGDH,3.8550417,"L6E, E13V, D30E, L36I, S56R, S78D, M94V, S100G",8
IETFKLLAEKVEHLVAKNAFAEIDYSDAPDEFRDPLMDTLMTDPVRLPSGTVMDRSIIQRHLLNSPTDPFNRQMLTESMLEPVPELKEQISAWMREKFPSDH,0.073581874,"K3T, E13H, I14L, R20F, L59Q, Q91S, Q98F, S99P",8
MEKFTLLAEKVEEIVAKNARPEIDYSDAPEEFRDPLMDTLMTDPVRLPSGTVMDRSVILRHLLNSPTDPFNRQMLTESMLEPVPELKERIQAWMRQKQSSSH,0.30573294,"I1M, K5T, A21P, D30E, I57V, Q89R, E96Q, D101S",8
MSKFKLLAEKVETIVAKNARAEIDYSDAPDEFVDPLMDTLMTDPVRLPSGNVMDRSIILRHLLNSPTDPFNRQMLTEDMLEPVPELKEQIQAWMKEKQSSDD,-2.511245,"I1M, E2S, E13T, R33V, T51N, S78D, R95K, H102D",8
IEKFKLLAEKVEEVAAKNARAEIDFSDAPDEFRDPLMDTLMTDPVRLPSGTVMDRSIILRHLLNSETDPFNRMPLTESMLEPVPELKEQIQAWMREKLSLDH,-0.27144063,"I14V, V15A, Y25F, P66E, Q73M, M74P, Q98L, S100L",8
IEKMKSLAEKVEEIVAKKTRAEIDFSDAPDEFRDPLMDTLMTDPVRLPSGTVMDRRIILRHLLNSPTDPFNRQMLTESMLEPVPELKEQIQAWLREKQSEDH,0.3109318,"F4M, L6S, N18K, A19T, Y25F, S56R, M94L, S100E",8
MEKFALLARKAEEIVAKNARAEIDLSDAPDEFRDPIMDTLMTDPVRLPSGTIMDRSIILRHLLNSPTDPFNRQMLTESMLEPAPELKEQIQAWMREKQSSDH,1.7268474,"I1M, K5A, E9R, V11A, Y25L, L36I, V52I, V83A",8
IEKFKELCEKVEEIVAKNAEEEIDYSDAPEEFRDPLMDTLMTDPVRLPSGTVMDRSVILRHLLNSPTDPFNRQMLTESMLEPVPELKERIQAWMREKQSVDH,3.6149921,"L6E, A8C, R20E, A21E, D30E, I57V, Q89R, S100V",8
MEKFKLLCEKVNEIVAKNARAEVDYSDAPDEFRDPIMDTLMTDPVRLPSGTVMDRSIILRHLLNSPTDPFNRQMLTESMLEPVTELKEQIQAWMREKQTGDH,0.6407355,"I1M, A8C, E12N, I23V, L36I, P84T, S99T, S100G",8
IEKFKLLAEKVEGIVATNARAKIDYSDAPDEFRDPLMDTLMTDPVRLPSGHIMDRSIILRHLLNSPTDPFTRQMLTESMLEPVQELKEQIQAWIREKQSSDH,2.6064959,"E13G, K17T, E22K, T51H, V52I, N71T, P84Q, M94I",8
IEKFKLLAEKVEEIVAKAARAEIDYDDAPDEFRDPLMDTLMTDPVRLPSGTVMDRSIILRHLLNSPTDPFNRQMLTEEMLEPVPELKERIQAWRKEKQSRKH,-1.0226407,"N18A, S26D, S78E, Q89R, M94R, R95K, S100R, D101K",8
IEKFQLLREKVEEIAAKNARAEIDYSDAPDEFKDPLMDTLMVDPVRLPSGTVMDRSIILRHLLNSPTDPFNRQMLTEDMLEPVVELKEQIQAWMREKQSVDH,0.6023127,"K5Q, A8R, V15A, R33K, T42V, S78D, P84V, S100V",8
IEKFKLLEEKVEEIVQANALAEIDYSDAPDEFKDPLMDTLMTDPVRLPSGHVMDRSIILRHLLNSPTDPFNRQMLTQSMLEPVPELKEKIQAWMREKQSSDH,1.8762939,"A8E, A16Q, K17A, R20L, R33K, T51H, E77Q, Q89K",8
IEKFKLLKEKVEVIVQENARAEIDYSDAPEEFRDPLMDTLMTDPVRLPSGTVMDRSIILRHLLNSETDPFNRQPLTESMLEPVPELKEQIQAWMREKQSMDH,1.0780859,"A8K, E13V, A16Q, K17E, D30E, P66E, M74P, S100M",8
KEEFKLLAEKVEEIVAKNARQEIDYSDAPDEFRDPLMDTLMTDPVRLPSGHVMDRSIILRHLLNSSTDPFNRQMLTESMLEPVPELKNQIQAWMREKLRSDH,-1.0207276,"I1K, K3E, A21Q, T51H, P66S, E88N, Q98L, S99R",8
MEKFKLLAEKVENLVAKNARAEIDYSDAPDEFRDPLMDTLMTDPVKLPSGTVCDRSIILRHLLNSPTDPFNRQPLTESMLEPVPELKERIQAWMREKFSSDH,2.185728,"I1M, E13N, I14L, R46K, M53C, M74P, Q89R, Q98F",8
ISKFKLLASKVDEITAKNARAEIDYSDAPDEFRDPLMDTLMTDPVRLPSGTVMDRSIILRHLLNSPTDPFTRQMLTESMLEPQPELKEQIQSWMREKQSSDL,3.1292682,"E2S, E9S, E12D, V15T, N71T, V83Q, A92S, H102L",8
MEKFKLLAEKVEEHVAKNARPEIDYSDAPDEFKDPLMDTLMTDPVKLPSGTVMDRSIILRHLLNSPTDPFNRQMLTEDMLEPVPELKEKIQAWMREKQSADH,-0.22841468,"I1M, I14H, A21P, R33K, R46K, S78D, Q89K, S100A",8
IEEFKLLAEKVKEINAKKNRAEIDYSDAPEEFRDPLMDTLMTDPVRLPSGTVMDRSIILRHLLNSPTDPFNRQMLTESMLEPVVELKEQIQAWMREKISSDH,0.31696355,"K3E, E12K, V15N, N18K, A19N, D30E, P84V, Q98I",8
IEKFKELAEKVEYIVAKNSEVEIDYSDAPDEFRDPLMDTLMTDPVRLPSGTVMDRSIILRHLLNSPTDPFNRQMLTESMLEPVPELKEKIQAWIREKQSQDH,1.1759628,"L6E, E13Y, A19S, R20E, A21V, Q89K, M94I, S100Q",8
IEKFKKLAEKVEEIVAKNFRAEIDYSDAPDEFRDPVMDTLMTDPVRLPSGTVMDRSIILRHLLNSPTDPFNRKMLTESMLEPVVELKEQIQAWMREKLSSLF,0.43033642,"L6K, A19F, L36V, Q73K, P84V, Q98L, D101L, H102F",8
IEKFKLLAEKVEAIVAKNARAEIDYSDAPDEFRDPLMDTLMTDPVRLPSGYIMDRSIILRHLLNSPTDPFNRQPLTESMLEPVPELKERIQAWIREKQSSKK,1.5205412,"E13A, T51Y, V52I, M74P, Q89R, M94I, D101K, H102K",8
IEKFKLLAEKVEMIVAKNASAEIDYSDAPDEFRDPLMDTLMTDPVRLPSGTVIDRSIILRHLLNSPTDPFNRKMLTESMLESVPELKEQIQLWKREKQSSAH,1.719939,"E13M, R20S, M53I, Q73K, P82S, A92L, M94K, D101A",8
IEKFKLLAEKAEELVEQNARADIDYSDAPDEFRDPIMDTLMTDPVRLPSGTVMDRSIILRHLLNSPTDPFNRQMLTESMLEPVPELKEQIVAWMREKQSSFH,2.244904,"V11A, I14L, A16E, K17Q, E22D, L36I, Q91V, D101F",8
IEKFKLLAEKVEKIVAKNQRAEVDYSDAPDEFMDPLMDTLMTDPVRLPSGTVMDRSVILRHLLNSQTDPFNRQMLTESMLEPVPELKEQIDAWVREKQSSDH,0.3099268,"E13K, A19Q, I23V, R33M, I57V, P66Q, Q91D, M94V",8
MEQFKVLIEKVEQIGAKNSRAEIDYSDAPDEFRDPLMDTLMTDPVRLPSGTVMDRSIILRHLLNSPTDPFNRQMLTEDMLEPVPELKEQIQAWMREKQSSDH,-0.7465256,"I1M, K3Q, L6V, A8I, E13Q, V15G, A19S, S78D",8
IEKFKLLAEKVEEMVAKNAAAEIDFSDAPDEFRDPLMDTLMTDPVRLPSGTVMDRSVILRHLLNSPTDPFNRQMLTEDMLEPVVELKERIQAWMREKQASDH,2.4213438,"I14M, R20A, Y25F, I57V, S78D, P84V, Q89R, S99A",8
IEKFKLLAEKVEEIAAKNARAEVDYSDAPDEFRDPLMDTLMTDPVRLPSGTIMDRSIILRHLLNSQTDPFNRQMLTESMLEPVPELKEKIQAWMREKESSHS,-0.020198932,"V15A, I23V, V52I, P66Q, Q89K, Q98E, D101H, H102S",8
DEKFKLLGEKVEEIVAKNQRAEIDYSDAPDEFRDPLMDTLMTDPVRLPSGTVMDRSIILRHLLNSPTDPFNRQPLTEDMLEPVPELKEKIQRWMREKQSSEH,1.0743363,"I1D, A8G, A19Q, M74P, S78D, Q89K, A92R, D101E",8
IEKFKLLAEKCENVVAKNARAEIDYSDAPDEFRDPLMDTLMTDPVRLPSGTVMDRSVILRHLLNSPTDPFNRQMLTESMLEPVPELKEQIQAWIKEKQSLDM,0.0018177535,"V11C, E13N, I14V, I57V, M94I, R95K, S100L, H102M",8
IEKFAILAEKVEEIAAKHARAEIDYSDAPDEFKDPLMDTLMTDPVRLPSGTVMDRSIILRHLLNSPTDPFNRQMLTESMLEPVPELKEQIQAWMREKNVTDH,-0.5085623,"K5A, L6I, V15A, N18H, R33K, Q98N, S99V, S100T",8
IEKFKLLAEKVEEIVAKNNSIEIDLSDAPDEFKDPLMDTLMTDPVRLPSGTVMDRSIILRHLLNSPTDPFNRQMLTESMLEPVPELKERIQAWMREKISADH,1.9192653,"A19N, R20S, A21I, Y25L, R33K, Q89R, Q98I, S100A",8
EEKFKLLAEKVEEIVAKNANAEIDYSDAPEEFRDPLMDTLMTDPVRLPSGTVMDRSIILRHLLNSQTDPFNRQPLTESMLEPLPELKEQIQAWVREKQSSKH,1.1988558,"I1E, R20N, D30E, P66Q, M74P, V83L, M94V, D101K",8
IEKFKELAEKAEEVVAKNARQEIDFSDAPDEFRDPLMDTLMTDPVRLPSGTVMDRSIILRHLLNSPTDPFNRQMLTESMLEPVVELKEKIQAWMKEKQSSDH,-0.7246493,"L6E, V11A, I14V, A21Q, Y25F, P84V, Q89K, R95K",8
IEKFKLLAEKVEEIVAKNARDEIDYSDAPEEFRDPLMDTLMTDPVRLPSGAVMDRSIILRHLLNSPTDPFNRQPLTESMLEPVPELKEQILAWMRTKCLSDH,1.3964391,"A21D, D30E, T51A, M74P, Q91L, E96T, Q98C, S99L",8
IEKFKLLAEKVEEIVAANANQEIDYGDAPDEFKDPLMDTLMTDPVRLPSGTVMDRSIILRHLLNSPTDPFNRQCLTESMLEPVPELKERIQAWMREKQSKDH,2.4752636,"K17A, R20N, A21Q, S26G, R33K, M74C, Q89R, S100K",8
IEKFKLLAEKVDEIVAKNALAEIDYSDAPDEFRDPLMSTLMTDPVKLPSGTVMDRTIILRHLLNSQTDPFNRQMLTESMLEPVPELKEQIQAWMREKMSLDH,-0.80497885,"E12D, R20L, D38S, R46K, S56T, P66Q, Q98M, S100L",8
IEKFKLLTEKVEEIVAKNARAAIDYSDAPEEFKDPLMDTIMTDPVRLPSGTVMDRSIILRHLLNSPTDPFNRQMLTESMLEPVPELKEQILAWMRQKQSGDH,0.6994879,"A8T, E22A, D30E, R33K, L40I, Q91L, E96Q, S100G",8
IEKFKRLAEKVEEIVAKNARAEIDYSDAPDEFRDRLMDTLMTDPVRLPSGTVMDRSIILRHLLNSATDPFTRQPLTESMLEPVPELKEQIQAWMRKKQSEKH,-1.2661997,"L6R, P35R, P66A, N71T, M74P, E96K, S100E, D101K",8
IYKFKLLAEKCEQIEAKNNRAEIDYSDAPDEFRDPLMDTIMTDPVRLPSGTVMDRSIILRHLLNSPTDPFNRQPLTESMLEPVPELKEQIQAWMREKQSSFH,1.1051847,"E2Y, V11C, E13Q, V15E, A19N, L40I, M74P, D101F",8
IANFTLLCEKVEEIVAQNARAEIDYSDAPDEFRDPLMDTLMTDPVRLPSGTVMDRSIILRHLLNSPTDPFNRQMLTESMLEPVPELKERIQAWMRQKQSSKH,-0.8369477,"E2A, K3N, K5T, A8C, K17Q, Q89R, E96Q, D101K",8
ITKFKLLASKAEEIVAKNARLEIDYSDAPDEFRDPLMDTLMTDPVRLPSGTVMDRSIILRHLLNSPTDPFTRQMLTEEMLEPVPELKEQIDAWMREKQSEDH,4.2219095,"E2T, E9S, V11A, A21L, N71T, S78E, Q91D, S100E",8
IEKFKLLAEKVEEIVKKQARAEIDYSDAPDEFRDPLMDTLMTDPVRLPSGTIMDRGVILRHLLNSPTDPFNRQMLTEAMLEPVPELKEQIQAWMREKQSSKT,1.5363375,"A16K, N18Q, V52I, S56G, I57V, S78A, D101K, H102T",8
IEKFALLAEKVEEISASNARAEIDYSDAPDEFRDPLMDTLMTDPVRLPSGTVMDRSVILRHLLNSPTDPFNRQPLTEDMLESVPELKEQIQAWMKEKQSSDH,-0.77530706,"K5A, V15S, K17S, I57V, M74P, S78D, P82S, R95K",8
SEVFKGLREKMEEIVARNAEAEIDYSDAPDEFRDPLMDTLMTDPVRLPSGTVMDRSIILRHLLNSPTDPFNRQMLTESMLEPVPELKEQIQAWMREKASSDH,0.1572263,"I1S, K3V, L6G, A8R, V11M, K17R, R20E, Q98A",8
IEKFNLLAEKVEEIVKKNLRAEIDYSDAPDEFRDPLMDTLMTDPVKLPSGTVMDRSIILRHLLNSPTDPFNRQMLTESMLEPVPELKEQIQSWMNERQLSDH,0.3014363,"K5N, A16K, A19L, R46K, A92S, R95N, K97R, S99L",8
IEDFKLLAEKVEEIVAANARAEIDYSDAPEEFRDPLMDTLMTDPVRLPSGTVMDRSIILRHLLNSPTDPFNRQMLTESMLEPVPELKEKINAWMAEKSSSDN,1.8799981,"K3D, K17A, D30E, Q89K, Q91N, R95A, Q98S, H102N",8
IEKFKLLAEKVEEISAKHAREGADYSDAPDEFRDPLMDTLMTDPVRLPSGRVMDRSIILRHLLNSPTDPFTRQMLTESMLEPVPELKEQIQAWMREKQSSGH,2.7535608,"V15S, N18H, A21E, E22G, I23A, T51R, N71T, D101G",8
IEKFKLLQEKVEEAVAKFNRAEVDYSDAPDEFRDPLMDTLMTDPVRLPSGTVMDRSIILRHLLNSPTDPFNRQMLTESMLEPVPELKERIQAWMREKIGSDH,0.81835675,"A8Q, I14A, N18F, A19N, I23V, Q89R, Q98I, S99G",8
IEKFKLLCEKVEEIVAANARAEIDYSDAPLEFRDPLMDTIMTDPVRLPSGNVMDRSIILRHLLNSETDPFNRQMLTESMLEPVPELKEKIQAWMREKQSSDE,1.9687743,"A8C, K17A, D30L, L40I, T51N, P66E, Q89K, H102E",8
MERFSLLAEKCEETVKKNARAEIDYSDAPDEFRDPLMDTLMTDPVRLPSGTVMDRSIILRHLLNSPTDPFNRQMLTESMLSPVVELKEQIQAWMREKQSSDH,-0.2814706,"I1M, K3R, K5S, V11C, I14T, A16K, E81S, P84V",8
IEKFKLLGEKVEEIVKKQARAEIDFSDAPDEFRDPLMDTLMTDPVRLPSGTVMDRSVILRHLLNSSTDPFNRQMLTESMLEPVPELKEQIQAWMREKQSERH,0.33181033,"A8G, A16K, N18Q, Y25F, I57V, P66S, S100E, D101R",8
IEKFKLLAEKAEEIAAKNARDEIDMSDAPDEFMDPLMDTIMTDPVRLPSGTKMDRSIILRHLLNSPTDPFNRQMLTESMLEPAPELKEQIQAWMREKQSSDH,0.3675589,"V11A, V15A, A21D, Y25M, R33M, L40I, V52K, V83A",8
IEKFKLLAKKVEEIVLKSARAEIDYSDAPDEFRDPLMDTLMTDPVRLPSGVVMDRSIILRHLLNSPTDPFNRQMLTESQLEPVTELKEQIQSWMREKQSKDH,-0.8681927,"E9K, A16L, N18S, T51V, M79Q, P84T, A92S, S100K",8
IEKFKSLAEKCEEIVAKAARAEIDDSDAPDEFRDPLMDTLMTDPVKLPSGTVMDRSVILRHLLNSSTDPFNRQMLTEDMLEPVPELKEQIQAWMREKQSSDH,3.1110525,"L6S, V11C, N18A, Y25D, R46K, I57V, P66S, S78D",8
IEKFKELAGKVDEIVSKNARAEIDYSDAPEEFRDPLMDTLMTDPVRLPSGTVMDRSIILRHLLNSPTDPFNRQPLTESMLEPVPELKEQIQAWVREKISSDH,1.0629431,"L6E, E9G, E12D, A16S, D30E, M74P, M94V, Q98I",8
IEKFKLLAEKVDSIAAKNALAEIDYSDAPDEFRDPLMDTLMTDPVRLPSGTVMDRSIILRHLLNSQTDPFNRQMLQESMLEPLPELKEQIQAWMREKQSSDV,-0.0029956717,"E12D, E13S, V15A, R20L, P66Q, T76Q, V83L, H102V",8
LEKFKLLAERVEEIVAKNAEEEIDYSDAPDEFRDPLMDTLMTDPVRLPSGTVMDRSVIARHLLNSPTDPFNRQMLTEDMLEPVPELKEQIQAWMREKQSSDE,1.4907745,"I1L, K10R, R20E, A21E, I57V, L59A, S78D, H102E",8
VEKFKLLRTKVEEIVAKNARAEIDYSDAPEEFRDPLMDTLMTDPVRLPSGTVMDRSIILRHLLNSPTDPFNRTMLTEEMLEPVPELKEQIQAWMRRKQSHDH,-1.9672623,"I1V, A8R, E9T, D30E, Q73T, S78E, E96R, S100H",8
MEKFLDLAEKVEKIVAKNARAEIDYSDAPEEFRDPLMDTLMTDPVRLPSGTVMDRKIILRHLLNSPTDPFNRQPLTESMLEPVPELKEQIQAWMRKKQSSDH,0.6041166,"I1M, K5L, L6D, E13K, D30E, S56K, M74P, E96K",8
IEKFELLSRKVEEIAAKNARAEIDYSDAPDEFRDPLMDTLMTDPVKLPSGTVMDRSIILRHLLNSPTDPFNRQMLTESMLEPVVELKEQIQAWMREKQSCDL,0.2726551,"K5E, A8S, E9R, V15A, R46K, P84V, S100C, H102L",8
SEKFKLLAEKVEEIVAKNARAGIDYSDAPDEFRDPLMDTIMTDPVRLPSGTVMDRSIILRHLLNSPTDPFNRQPLTESMLEPASELKEQIQAWMREKQSQNH,-0.5716485,"I1S, E22G, L40I, M74P, V83A, P84S, S100Q, D101N",8
IENFRLLASKVEEIVAKNIRAEIDYSDAPDEFRDPIMDTLMTDPVRLPSGTVMDRSIILRHLLNSPTDPFNRQMLTESMLEPVPELKEQIQAWIREKQSSKL,3.3026552,"K3N, K5R, E9S, A19I, L36I, M94I, D101K, H102L",8
IEKFKLLAEKVEEIVAKNARAEIDFSDAPEEFRDPLMDTLMVDPVRLPSGNVMDRSIILRHLLNSPTDPFNREMLTESMLEPVPELKEQIQAWMREKTQSDS,-1.0348307,"Y25F, D30E, T42V, T51N, Q73E, Q98T, S99Q, H102S",8
MEKFKELAEKVEEIVAKNARDEIDFSDAPDEFRDPLMNTLMTDPVRLPSGTVMDRAIILRHLLNSPTDPFNRQMLTESMLEPVPELKEQIQAWLRDKQSSDH,-0.9122115,"I1M, L6E, A21D, Y25F, D38N, S56A, M94L, E96D",8
IEKFKKLAEKVEEIVAKNARAEIDLSDAPDEFRDPIMNTLMTDPVRLPSGTVMDRSIILRHLLNSPTDPFNRQPLTEEMLEPVPELKEQIQQWMREKRSSDH,1.1640332,"L6K, Y25L, L36I, D38N, M74P, S78E, A92Q, Q98R",8
IEKFKLLAEKVEEIAAKNQRAEIDYADAPEEFRDPLMDTLMTDPVRLPSGTVADRSIILRHLLNSPTDPFNRSMLTESMLVPVPELKEQIQAWIREKQSSDH,1.2477021,"V15A, A19Q, S26A, D30E, M53A, Q73S, E81V, M94I",8
IEKFKWLAEKVEEIVAKNARAEADYSDAPDEFRDPLMDTLMTDPVRLPSGTVMDRSIILRHLLNSPTDPFNRQMLTESMLEPVPELKEQIEAWIRRKVSSQA,0.9496275,"L6W, I23A, Q91E, M94I, E96R, Q98V, D101Q, H102A",8
