Sequence,Score,Mutations,Number of Mutations
IEKFKLLAEKVEEVVAKNARAEIDYSDAPDEFKDPLMDTLMTDPVRLPSGKVMDRSVILRHLLNSPTDPFSRQMLTEGMLEPVPELKEQIQAWIRQKQSSDH,0.42168623,"I14V, R33K, T51K, I57V, N71S, S78G, M94I, E96Q",8
IEKFKLLAAKYEEIAAKNARAEIDISDAPDEFLDPLMDTLMTDPVKLPSGTVMDRSIILRHLLNSPTDPFNRQMLTEDMLEPVPELKEQIQAWLREKQSSDH,0.28251967,"E9A, V11Y, V15A, Y25I, R33L, R46K, S78D, M94L",8
IEKFTLLANKVDEIVAKNQAAEIDYSDAPDEFRDPLMDTLMTDPVRLPSGTVMDRSIIKRHLLNSPTDPFNRQMLTEEMLEPVQELKEQIQAWMREKQSSDH,0.5670689,"K5T, E9N, E12D, A19Q, R20A, L59K, S78E, P84Q",8
IEEFKLLCERVEEIVATNARAEIDYSDAPESFRDPLMDTLMTDPVRLPSGTVMDRAIILRHLLNSPTDPFNRQMLTEAMLEPVPELKEQIQAWMREKQSSDH,0.9269016,"K3E, A8C, K10R, K17T, D30E, E31S, S56A, S78A",8
IEKFKLLAEKVEEIAAKSARAEIDYSDAPDEFRDPLMDTLMTDPVRLPSGTVMDRPIILRHLLNSPTDPFNREMLTESMLEPLPELKEQIQAWMKEKKSKDH,-2.4869628,"V15A, N18S, S56P, Q73E, V83L, R95K, Q98K, S100K",8
IEKFKLLLEKVEEAVSKNQRAEIDYSDAPDEFKDPLMDTLMTDPVRLPSGTVMDRAIILRHLLNSPTDPFNRQMLTESMLEPVLELKEQIQAWMRSKQSSDH,-0.6498353,"A8L, I14A, A16S, A19Q, R33K, S56A, P84L, E96S",8
IEKFKLLAEKVEEIVQKNARAEIDYLDAPEEFRDPLMDTLMTDPVKLPSGTVMDRSIILRHLLNSPTDPFTRQMLTESMLEPVPELKEQIQAWMRSKQSKDN,4.2665286,"A16Q, S26L, D30E, R46K, N71T, E96S, S100K, H102N",8
IEKFKLLREKVEVIAQKNMRAEIDYSDAPDEFRDPLMDTLMTDPVKLPSGTVMDRSIILRHLLNSQTDPFNRQMLTESMLEPVPELKERIQAWMREKQSSDH,-0.24118316,"A8R, E13V, V15A, A16Q, A19M, R46K, P66Q, Q89R",8
IEKFKLLAEKVEELVAKNARDEIDFSDAPDEFRDRLMDTLMTDPVKLPSGTVMDRSIILRHLLNSPTDPFNRQMLTEDMLEPVPELKEQIQAWMREKYSSDT,-2.2014732,"I14L, A21D, Y25F, P35R, R46K, S78D, Q98Y, H102T",8
IEKFKLLEEKYEEEVAKNRRSEIDYSDAPEEFRDPLMDTLMTDPVKLPSGRVMDRSIILRHLLNSPTDPFNRQMLTESMLEPVPELKEQIQAWMREKQSSDH,2.5732245,"A8E, V11Y, I14E, A19R, A21S, D30E, R46K, T51R",8
IERFELLAEKTEEIVAKNARAEIDYSDAPDEFRDPIMDTLMTDPVRLPSGTVMDRSVILRHLLNSPTDPFNRQMLTESMLEPVSELKEQIQAWRRTKQSSDH,1.9150302,"K3R, K5E, V11T, L36I, I57V, P84S, M94R, E96T",8
IEKFKNLAEKAEEIVAKNAREEIDYSDAPDEFRDPLMDTLMTDPVRLPSGTVMDRSIITRHLLNSQTDPFNRQMLTESMLEPVPELKERIQAWIREKVSSDH,1.9242015,"L6N, V11A, A21E, L59T, P66Q, Q89R, M94I, Q98V",8
IEKFNLLAEKVEEIVAKNARAQIDYSDAPEEFRDPLMDTLMTDPVRLPSGTVMDRRIILRHLLNSPTDPFNRQMLTESMLEPVPELKEQIQEWMRAKLSSRH,-0.21991694,"K5N, E22Q, D30E, S56R, A92E, E96A, Q98L, D101R",8
IEKFKLLAEKVNEISIKNARAEIDYSDAPDEFRDPLMDTLMTDPVRLPSGHVMDRSIILRHLLNSPTDPFNRQMLTESMLEPLPELKDQIQAWMNEKQNSDH,-1.5829868,"E12N, V15S, A16I, T51H, V83L, E88D, R95N, S99N",8
IEKFSKLATKVEEIVAINARAEIDYSDAPEEFRDPLMDTLMTDPVRLPSGTVMDRSIILRHLLNSPTDPFNRQMLTEDMLEPVPELKAQIQAWMREKQSRDH,1.3547816,"K5S, L6K, E9T, K17I, D30E, S78D, E88A, S100R",8
IEKFKLLSEKMEEIVAKNARAEIDYSDAPDEFKDPLMDTLMTDPVRLPSGTVMDRSIILRHLLNSPTDPFNRQPLTESMLEPVPELKERIQAWMQEKLSRDH,-0.21875955,"A8S, V11M, R33K, M74P, Q89R, R95Q, Q98L, S100R",8
MEKFKLLASKAEEIVRKNSRAEIDYSDAPDEFRDPLMDTLMTDPVRLPSGTVMDRSIILRHLLNSPTDPFNRQMLTESMLEPVPELKEQIQAWVRQKQSSSH,0.03747277,"I1M, E9S, V11A, A16R, A19S, M94V, E96Q, D101S",8
IEKMKLLAEKAEEIVAKNASAEIDYSDAPDEFRDPLMDTLMTDPVRLPSGTVMDRSIILRHLLNSDTDPFNRQPLTENMLEPVPELKEQIQAWIREKQSSDE,0.6155187,"F4M, V11A, R20S, P66D, M74P, S78N, M94I, H102E",8
IEKFKLLGEKVEEISAKKARAEIDYSDAPDEFRDPLMDTLMTDPVKLPSGTVMDRSIILRHLLNSPTDPFNRQMLTESMLEPAPELKEQIQAWMAEKQSSKK,-0.7735653,"A8G, V15S, N18K, R46K, V83A, R95A, D101K, H102K",8
KEKFKLLSEKVEDIVAKNARAEIDYSDAPDEFRDPLMDTLMTDPVRLPSGNVMDRSIILRHLLNSPTDPFNRQMLTEDMLEPVPELKERIQAWMREKQSSSN,0.54729927,"I1K, A8S, E13D, T51N, S78D, Q89R, D101S, H102N",8
ISNFKLLTEKFEEIVAKNARAEIDLSDAPDEFRDPLMDTLMTDPVRLPSGTVMDRSIILRHLLNSQTDPFNRQMLTESMLEPVPELKERILAWMREKQSSDH,0.09835469,"E2S, K3N, A8T, V11F, Y25L, P66Q, Q89R, Q91L",8
IEKFKLLAEKVEEIVAKNARAEIDYSDAPDEFRDPLMDTLMTDPVRLPSGTVMDRSIILRHLLNSQTDPFNRQPLTQSMLEPVPELKERIQAWMLEKQPCGH,-0.79700565,"P66Q, M74P, E77Q, Q89R, R95L, S99P, S100C, D101G",8
IEKFKLLAEKVEEIVAKNAREEIDYSDAPDEFRDPLMDTLMTDPVRLPSGHVMDRAIILRHLLNSPTDPFNRQPLTEDMLEPVPELKEQIQEWKRQKQSSDH,1.4858445,"A21E, T51H, S56A, M74P, S78D, A92E, M94K, E96Q",8
IEKFKLLREKVSEIVADNARTEIDYSDAPDEFKDPLMDTLMTDPVKLPSGTVMDRSIILRHLLNSPTDPFNRQMLTESMLEPVPELKEQISAWMRERQSSDH,0.40683234,"A8R, E12S, K17D, A21T, R33K, R46K, Q91S, K97R",8
IEKFKLLAEKVEEIVAKNIRAEIDFSDAPDEFKDPLMDTLMTDPVKLPSGTVMDRSIILRHLLNSQTDPFNRQMLTESMLEPVPELKEQIQAWIKEKQSSRH,-0.9416925,"A19I, Y25F, R33K, R46K, P66Q, M94I, R95K, D101R",8
IEKFKLLAEKVEETVAKNSQAEIDYSDAPDEFRDALMSTLMTDPVRLPSGTIMDRSIILRHLLNSPTDPFNREMLTESMLEPVPELKEQIQAWMREKQLSDH,-2.5841951,"I14T, A19S, R20Q, P35A, D38S, V52I, Q73E, S99L",8
REKFKELAEKVEEIVAKNAREEIDYSDAPEEFRDPLMDTLMTDPVRLPSGTVMDRSIILRHLLNSPTDPFTRQMLTESMLEPVPELKEQIQAWRREKQGSQH,4.3979635,"I1R, L6E, A21E, D30E, N71T, M94R, S99G, D101Q",8
MEKFKLLAQKVEEISAKNLVAEIDYSDAPDEFRDPLMATLMTDPVRLPSGTVMDRSIILRHLLNSPTDPFNRQMLTESMLEPVPELKEQIQAWMREKTSQDH,-0.20834276,"I1M, E9Q, V15S, A19L, R20V, D38A, Q98T, S100Q",8
IEKFKLLAHKVEEIVAKNAGQEIDYSDAPDEFRDPLMDTLMTDPVRLPSGNVMDRSVILRHLLNSPTDPFNRQMLTESMLEPVPELKERIRAWMREKMSSDH,1.0308554,"E9H, R20G, A21Q, T51N, I57V, Q89R, Q91R, Q98M",8
IEKFKDLAEKVEEIVEGNARAEIDYSDAPEEFRDPLMDTLMTDPVRLPSGTVMDRSIILRHLLNSPTDPFNRQMLTESMLQPVPELKKRIQDWMREKQSSDH,0.9684,"L6D, A16E, K17G, D30E, E81Q, E88K, Q89R, A92D",8
IEKFKLLQEKVEKLVAKNAIAEIDYSDAPDEFRDPLMDTLMTDPVRLPSGTVMDRSVILRHLLNSQTDPFNRQMLTESMLEPVPELKEKIQAWMREKQSSRH,1.1463394,"A8Q, E13K, I14L, R20I, I57V, P66Q, Q89K, D101R",8
IEKFKLLAEKVEEIVAKNARAEIDYSDAPDEFRDPLMDTLMTDPVKLPSGTVMDRSIILRHLLNSSTDPFNRQTLTEAMLEPVPELKDQIQAWLREKQVSNH,-0.67351496,"R46K, P66S, M74T, S78A, E88D, M94L, S99V, D101N",8
IEKFKELAEKVEMIVKSNAEAEIDYSDAPDEFRDPLMDTLMTDPVRLPSGTVMDRSIILRHLLNSPTDPFNRQMLTENMLEPVTELKEQIQAWMREKQSSRH,0.5275781,"L6E, E13M, A16K, K17S, R20E, S78N, P84T, D101R",8
IEKFKLLCEKVEEIVTKDARAEIDYSDAPDEFRDPLMDTLMTDPVRLPSGTVMDRSVILRHLLNSPTDPFNRSMLTESMLEPVPELKEQIQAWMRDKQLLDH,1.2148347,"A8C, A16T, N18D, I57V, Q73S, E96D, S99L, S100L",8
IEKFKELAEKVEEIVAKNARDEIDYSDAPEEFRDPLMDTLMSDPVRLPSGTVMDRSVILRHLLNSPTDPFNRQMLTEDMLEPVPELKEQIQAWAREKQSADH,2.3048506,"L6E, A21D, D30E, T42S, I57V, S78D, M94A, S100A",8
MEKFKLLAEKVEQMVAKNARDEIDYSDAPDEFRDPLMSTLMTDPVRLPSGTVMDRSIILRHLLNSPTDPFNRQMLTESMLEPVPELKEQIQQWMREKRSADH,-1.5007575,"I1M, E13Q, I14M, A21D, D38S, A92Q, Q98R, S100A",8
IEKFKLLCEKFDEIVAKNARAEIDYSDAPDEFRDPLMDTLMTDPVRLPSGTVMDRSIILRHLLNSQTDPFNRQPLTESMLEPAPELKEQIQSWMREKKSSDH,-0.3368801,"A8C, V11F, E12D, P66Q, M74P, V83A, A92S, Q98K",8
IEKFKLLASKVEEIVAKNALAEIDYSDAPEEFRDPLMDTLMTDPVRLPSGTVMDRSIILRHLLNSPTDPFNRKMLTEDMLEPVPELKEQIQAWIEEKQSCDH,1.4721812,"E9S, R20L, D30E, Q73K, S78D, M94I, R95E, S100C",8
IEKFKSLAERVEEIVAKNNRAEIDYSDAPDEFRDPIMDTLMTDPVRLPSGTVMDRSLILRHLLNSPTDPFNRQPLTESLLEPVPELKEKIQAWMREKQSSDH,1.8842968,"L6S, K10R, A19N, L36I, I57L, M74P, M79L, Q89K",8
IEKFKALAEKVEEIVSKNARAEIDYSDAPDEFRDPLMDTLMTDPVKLPSGNVMDRSIILRHLLNSPTDPFNRQMLTESMLEPVPELKEKIQQWIAEKQSSDH,0.9801234,"L6A, A16S, R46K, T51N, Q89K, A92Q, M94I, R95A",8
IEKFALLAEKVEEIVAKNTRAEIDYSDAPDEFRDPIMDTLMTDPVRLPSGHVMDRSIILRHLLNSPTDPFNRQMLSEDMLEPVPELKEQIQAWRREKQSSIH,2.1561651,"K5A, A19T, L36I, T51H, T76S, S78D, M94R, D101I",8
IKKFKYLAEKVDEIVAKNARAEIDYSDAPDEFRDPLMDTLMTDPVRLPSGNVMDRSIILRHLLNSPTDPFNRQPLTESMLEPVPELKEQIQAWMREKIKSRH,0.8084434,"E2K, L6Y, E12D, T51N, M74P, Q98I, S99K, D101R",8
IEKFKLLAEKVEEIVAKNQREEIDYSDAPDEFRDPLMDTLMTDPVRLPSGNIMDRSIILRHLLNSPTDPFNRQPLTESMLEPVPELKEQIQAWIRQKQSSDF,1.3134811,"A19Q, A21E, T51N, V52I, M74P, M94I, E96Q, H102F",8
IEKFKLLAEKVEEIVARNARSEIDYSDAPDEFRDPLMDTLMVDPVRLPSGQVMDRSIILRHLLNSPTDPFNRQMLTEDMLEPVPELKERIQAWMRDKMSSDH,0.7145593,"K17R, A21S, T42V, T51Q, S78D, Q89R, E96D, Q98M",8
IEKFKELAEKVETIVAKNATADIDYSDAPDEFRDPLMDTLMTDPVRLPSGTVMDRSVILRHLLNSPTDPFNRQMLTESMLEPVPELKEQIQAWVRDKQSSDS,0.41292298,"L6E, E13T, R20T, E22D, I57V, M94V, E96D, H102S",8
PEKFALLAEKVEEIVAKTARAEIDYSDAPDEFRDPIMDTLMTDPVRLPSGTVMDRSIILRHLLNSPTDPFNRQPLTESMLEPVPELKEQIRIWMRSKQSSDH,-0.09565617,"I1P, K5A, N18T, L36I, M74P, Q91R, A92I, E96S",8
IEKFSSLCEKVEEIVAKNAQAEIDYSDAPDEFRDPLMDTLMTDPVRLPSGTIMDRSIILRHLLNSPTDPFNRQMLTESMLEPVPELKEQIQNWMREKKLSDH,2.8069172,"K5S, L6S, A8C, R20Q, V52I, A92N, Q98K, S99L",8
IEKFKLLAEKVEEIVAKNAAAEVDYSDAPDEFRDPIMDTLMTDPVRLPSGTVMDRAIILRHLLNSPTDPFNRQPLTEDMLEPVPELKEQIQQWMREKQSSDQ,3.9876108,"R20A, I23V, L36I, S56A, M74P, S78D, A92Q, H102Q",8
IEKFKVLGEKVEEIVAQNARAEIDYSDAPEEFRDPLMDTLMIDPVRLPSGTVMDRSIILRHLLNSPTDPFNRQPLTESMLEPVPELKEQIQAWLREKQSSFH,1.1296618,"L6V, A8G, K17Q, D30E, T42I, M74P, M94L, D101F",8
IEKFGLLAEKVEEIVTKNARREIDYSDAPDEFRDPLMDTLMTDPVRLPSGTVMDRSIILRHLLNSPTDPFNRQMLTESMLEPVTELKERIQAWLREKQKSVH,-0.11267796,"K5G, A16T, A21R, P84T, Q89R, M94L, S99K, D101V",8
AEKFKLLAEKVDEIVAKNARAEVDFSDAPDEFRDPLMDTLMTDPVRLPSGTVMDRSVILRHLLNSPTDPFNRQMLTESMLEPVPELKERIEAWMREKQSSSH,1.1656984,"I1A, E12D, I23V, Y25F, I57V, Q89R, Q91E, D101S",8
IETFKLLAEKLEEVVQKNLRAEIDYSDAPDEFRDPLMDTLMTDPVRLPSGTVMDRSVILRHLLNSPTDPFNRQMLTENMLEPVPELKEQIQAWMREKQVSDH,-0.9625479,"K3T, V11L, I14V, A16Q, A19L, I57V, S78N, S99V",8
IEKFTQLAEKVEEIVQKNAPAEIDFSDAPDEFRDPLMDTLMTDPVKLPSGTVMDRSIILRHLLNSPTDPFNRQMLTEEMLEPVPELKEQIQAWMRAKQSSDH,-0.29703215,"K5T, L6Q, A16Q, R20P, Y25F, R46K, S78E, E96A",8
IERFGLLAEKVEEIVAKNARADIDYSDAPEEFRDPLMDTLMTDPVRLPSGTVMDRSTILRHLLNSPTDPFNRQPLTESMLEPVPELKEQIQNWMREKQASDH,2.4569726,"K3R, K5G, E22D, D30E, I57T, M74P, A92N, S99A",8
IEKFKLLNEKVEEIIANNADAEIDYSDAPEEFRDPLMDTLMTDPVRLPSGTVMDRSIILRHLLNSPTDPFNRQSLTESMLEPVPELKEQIQAWMREKQQGDH,1.7691513,"A8N, V15I, K17N, R20D, D30E, M74S, S99Q, S100G",8
ISTFTLLAEKVEEIVAKDAAAEIDYSDAPDEFRDPLMDTLMTDPVKLPSGTVMDRSIILRHLLNSPTDPFNRQMLTESMLEPVPELKEQIQAWMREKKSSDP,-0.23000322,"E2S, K3T, K5T, N18D, R20A, R46K, Q98K, H102P",8
IEKFKLLAEKVEAIVAANARAEIDYSDAPDEFRDPIMDTLMTDPVRLPSGTVMDRSIILRHLLNSPTDPFNRQELTEHMLEPVPELKEQINAWMREKQQSHH,2.6655588,"E13A, K17A, L36I, M74E, S78H, Q91N, S99Q, D101H",8
IQKFKLLAKKVEEIVAKNARAEIDYSDAPDEFRDPLMDTLMTDPVKLPSGNVMDRSIILRHLLNSPTDPFNRQPLTESQLEPVPELKEQIQAWIREKQSQDH,-0.15660009,"E2Q, E9K, R46K, T51N, M74P, M79Q, M94I, S100Q",8
IEKLKDLAIKVEEIVALNARAEIDYSDAPEEFRDPLMDTLMTDPVRLPSGSVADRSIILRHLLNSPTDPFNRQMLTESMLEPFPELKEQIQAWMREKQSSDH,0.06720457,"F4L, L6D, E9I, K17L, D30E, T51S, M53A, V83F",8
MEKFKLLAEKAEEIVAKQARAEIDYSDAPDEFRDPLMDTLMTDPVRLPSGTVMDRSIILRHLLNSQTDPFNRQRLTEELLEPVPELKEQIQAWMREKQSVDH,-0.83596015,"I1M, V11A, N18Q, P66Q, M74R, S78E, M79L, S100V",8
IEKFKLLAEKVEEIAAKNLREEIDLSDAPDEFRDPLMDTLMTDPVRLPSGTVMDRSIILRHLLNSPTDPFNRQMLTQSMLEPVPELKEQIQAWLREKGISDH,1.2757635,"V15A, A19L, A21E, Y25L, E77Q, M94L, Q98G, S99I",8
REKFTLLAEKVEEIVAKNARAEIDYSDAPDEFRDPIMDTLMTDPVRLPSGTVMDRSVILRHLLNSPTDPFNRQMLTESMLEPVPELKEKIQAWMREKISRDE,2.0473995,"I1R, K5T, L36I, I57V, Q89K, Q98I, S100R, H102E",8
IEKFTTLCEKVEGIVAKNMEAEIDYSDAPDEFRDPLMDTLMTDPVRLPSGTVMDRSVILRHLLNSPTDPFNRQMLTESMLEPVPELKEQIQAWMREKQSSKH,1.1839359,"K5T, L6T, A8C, E13G, A19M, R20E, I57V, D101K",8
KEKFKLLCEKVEGIVAKNARDEIDYSDAPDEFRDPLMDTLMTDPVKLPSGTVMDRSIILRHLLNSPTDPFNRQMLTEDMLEPVPELKERIQAWVREKQSSDH,1.6028639,"I1K, A8C, E13G, A21D, R46K, S78D, Q89R, M94V",8
IERFKLLAKKVEEIVAKNARAEIDYSDAPDEFRDPLMSTLMTDPVRLPSGNVMDRSIILRHLLNSPTDPFNRQMLTEDMLEPVPELKEQIQAWIREKQCSDK,-1.3294601,"K3R, E9K, D38S, T51N, S78D, M94I, S99C, H102K",8
MEKFKTLKEKVEEIVAKNARAEIDYSDAPDEFRDPLMDTLMTDPVKLPSGTVMDRSIILRHLLNSPTDPFNRQMLTESMLEPVVELKERIQAWVREKQSSQH,1.1954792,"I1M, L6T, A8K, R46K, P84V, Q89R, M94V, D101Q",8
IEKFKLLTEKVEELVAKNQRAEIDLSDAPDEFRDPLMDTLMTDPVRLPSGTVMDRSVIMRHLLNSPTDPFNRQMLTESMLEPVPELKEQIQAWMREKLSPDH,0.41201645,"A8T, I14L, A19Q, Y25L, I57V, L59M, Q98L, S100P",8
IEKFKLLHGKVEEIVAKNARAEIDYSDAPDEFRDPLMNTLMTDPVRLPSGTVMDRSVILRHLLNSSTDPFNRGMLTESMLEPAPELKEQIQAWMREKQLSDH,-2.0380106,"A8H, E9G, D38N, I57V, P66S, Q73G, V83A, S99L",8
IEQFGLLAEKVEEIVKKNALAEIDYSDAPDEFRDPLMDTLMTDPVRLPSGTVMDRAIILRHLLNSPTDPFNRQMLTESMLEPVPELKQQIQAWKREKQQSDH,-0.30471593,"K3Q, K5G, A16K, R20L, S56A, E88Q, M94K, S99Q",8
IEKFKQLAEKVEEIVAKNARAEIDYSDAPDEFRDSLMDTLMTDPVRLPSGTVMDRSIILRHLLNSPTDPFNRQMLTESMLEPVPELKESIQAWIREKIAWKH,-1.9513438,"L6Q, P35S, Q89S, M94I, Q98I, S99A, S100W, D101K",8
IEKFKLLAEKVEEIVAKNARAEIDYSDAPQEFRDPLMDTLMTDPVRLPSGTVADRSIILRHLLNSQTDPFNRQPLTESMLESVPELKEQIQAWMREKSSTLH,-0.13779993,"D30Q, M53A, P66Q, M74P, P82S, Q98S, S100T, D101L",8
IEKFKLLAENVDEIVAKNTRREIDYDDAPDEFRDPLMDTLMTDPVRLPSGTVMDRSIILRHLLNSPTDPFNRQMLTEDMLEPVPELKEQIQAWVREKQSQDH,1.861316,"K10N, E12D, A19T, A21R, S26D, S78D, M94V, S100Q",8
IEKFKLLATKTEEIVQRNARAEIDYSDAPDEFRDPLMDTLMTDPVRLPSGTVMDRAIILRHLLNSQTDPFNRQMLTESMLEPVVELKEQIQAWIREKQSSDH,0.91363174,"E9T, V11T, A16Q, K17R, S56A, P66Q, P84V, M94I",8
IEKFRLLAEKVDEIVAKNINAEIDYSDAPDEFRDPLMDTLMTDPVRLPSGTIMDRSNILRHLLNSPTDPFNRLMLTESMLEPVPELKEQIQAWIREKQSSDH,0.14573433,"K5R, E12D, A19I, R20N, V52I, I57N, Q73L, M94I",8
IEKFKELAVKVETIVAKNARAEIDYSDAPDEFRDPLMDTLMTDPVRLPSGTVMDRSVILRHLLNSPTDPFTRQMLTESMLEPVPELKERIQAWMREKQHKDH,3.030571,"L6E, E9V, E13T, I57V, N71T, Q89R, S99H, S100K",8
IEKFLLLSEKVDEIVAKNARAEIDYSDAPEEFRDPLMDTLMTDPVRLPSGTIMDRSIILRHLLNSPTDPFTRQMLTESMLEPVPELKEQIQAWLREKQISDH,4.4949036,"K5L, A8S, E12D, D30E, V52I, N71T, M94L, S99I",8
IEKFKLLAEKVEEVAAKNSGAEIDFSDAPDEFRDPLMDTLMTDPVRLPSGTVMDRAIILRHLLNSPTDPFNRQMLTESMLESVPELKEQIQAWMNEKQSSDH,-0.9911126,"I14V, V15A, A19S, R20G, Y25F, S56A, P82S, R95N",8
IDKFKLLEEKVEEIVAAQAIAEIDYSDAPEEFRDPLMDTLMTDPVRLPSGTVMDRSIIMRHLLNSPTDPFNRQMLTESMLEPVPELKEQIQAWVREKQSSDH,2.4150627,"E2D, A8E, K17A, N18Q, R20I, D30E, L59M, M94V",8
IEKFKFLAEKVEGIVAKNAKAEIDYSDAPDEFRDPLMDTLMTDPVRLPSGTVMDRSIIMRHLLNSPTDPFNRQMLTEDMLEPVPELKEQIQAWIRQKQSNDH,0.63331985,"L6F, E13G, R20K, L59M, S78D, M94I, E96Q, S100N",8
IEKFSLLAQKVEEIAAKNARAEIDYSDAPDEFRDPIMDTLMTDPVKLPSGTVMDRSIILRHLLNSPTDPFNRQMLTESMLEPVVELKEQINAWMREKQSSDL,3.2360694,"K5S, E9Q, V15A, L36I, R46K, P84V, Q91N, H102L",8
IEKFQLLAEKVETLVAKNARAEIDYSDAPEEFRDPLMDTLMTDPVRLPSGNVMDRSIILRHLLNSPTDPFNRQMLTESMLEPVPELKEQIQAWLREKQSRSH,-0.45768014,"K5Q, E13T, I14L, D30E, T51N, M94L, S100R, D101S",8
IEKFKLLAEKVEEIVAKNAQAEVDYSDAPDEFRDPLMDTLMTDPVRLPSGTVMDRSIILRHLLNSPTDPFNRQPLTESMLEPMPELKEQIRAWMRAKQQSDE,0.17410663,"R20Q, I23V, M74P, V83M, Q91R, E96A, S99Q, H102E",8
IEKFKELAEKIEETVAKNAREEIDYSDAPDEFKDPLMDTLMTDPVRLPSGTVMDRKIILRHLLNSPTDPFNRQMLTEDMLEPVPELKEQIQAWMREKMSSDH,2.0309381,"L6E, V11I, I14T, A21E, R33K, S56K, S78D, Q98M",8
IEKFKLLAEKIEEISAKNARAEIDYSDAPDEFLDPLMDTLMTDPVRLPSGTVMDRSIILRHLLNSPTDPFNRQALTESMLEPVVELKEQIQAWLRERQSSTH,1.4449857,"V11I, V15S, R33L, M74A, P84V, M94L, K97R, D101T",8
IEKFKLLAQKVEAIVAKNARAEIDYSDAPDEFIDPLMDTLMTDPVKLPSGTVMDRSIILRHLLNSPTDPFNRQPLSESMLEPVVELKEQIQAWMREKQSSRH,-1.2802396,"E9Q, E13A, R33I, R46K, M74P, T76S, P84V, D101R",8
IEKFKLLGEKVDEIVAKNASAEIDYSDAPDEFRDPLMDTLMTDPVRLPSGTIMDRSIILRHLLNSPTDPFNRQPLTESMLEPAPELKEQIQAWMKEKQSSDK,-1.3944309,"A8G, E12D, R20S, V52I, M74P, V83A, R95K, H102K",8
IEKFKLLAQKVEEIVAKNTQAEVDYSDAPEEFRDPLMDTLMTDPVKLPSGTVMDRSIILRHLLNSPTDPFNRQELTESMLEPVPELKEQIQAWMRRKQSSDH,-0.1734857,"E9Q, A19T, R20Q, I23V, D30E, R46K, M74E, E96R",8
MEKFKLLAEKCEEIVAKNAKAEVDYSDAPDEFRDPIMDTLMTDPVRLPSGTVMDRSVILRHLLNSPTDPFNRQMLTESMLEPVPELKEQIEAWMRAKQSSDH,3.4991078,"I1M, V11C, R20K, I23V, L36I, I57V, Q91E, E96A",8
IEKFKLLAEKAEEIAAQNAQAEIDYSDAPDEFRDPLMDTLMTDPVKLPSGTIMDRSIILRHLLNSPTDPFNRQMLTESMLEPVPELKEQIQAWMREKFSSDN,1.3993762,"V11A, V15A, K17Q, R20Q, R46K, V52I, Q98F, H102N",8
IEKFKLLAEKCEEIAAQNARAEIDYSDAPEEFRDPLMDTLMTDPVRLPSGTVMDRSVILRHLLNSPTDPFNRQPLTEDMLEPVPELKEQIQQWMREKQSSDH,2.2753556,"V11C, V15A, K17Q, D30E, I57V, M74P, S78D, A92Q",8
MENFKLLAEKVEEIVAKQAEAEIDYSDAPDEFRDPVMDTLMTDPVRLPSGAVMDRSIILRHLLNSPTDPFNRQMLTESQLEPVPELKEQIQAWMQEKQSSDH,-0.85498375,"I1M, K3N, N18Q, R20E, L36V, T51A, M79Q, R95Q",8
IEKFKLLAEKVEEIVAKNAAAEIDYSDAPEEFRDPLMDTLMTDPVRLPSGTVMDRNVILRHLLNSPTDPFNRQPLTESMLEPVLELKEQIQAWMREKHSSAH,1.6833472,"R20A, D30E, S56N, I57V, M74P, P84L, Q98H, D101A",8
IEKFKDLAEKVELAVAKNRRAEIDYSDAPDEFRDPLMDTLMTDPVRLPSGTVMDRSVIQRHLLNSPTDPFNRQMLTESMLEPVPELKEQIQAWMAEKSSSDH,2.8463192,"L6D, E13L, I14A, A19R, I57V, L59Q, R95A, Q98S",8
IAKFKLLAEKVEEIVAKNAVAEIDYDDAPDEFRDPLMDTLMTDPVRLPSGTVMDRSIILRHLLNSPTDPFNRQMLTEDMLEPVPELKERIQAWIREKQSKDS,1.3439033,"E2A, R20V, S26D, S78D, Q89R, M94I, S100K, H102S",8
IEKFRLLAEKIEEVVAKNARAEVDYSDAPDEFRDPLMDTLMTDPVRLPSGTVMDRSIILRHLLNSPTDPFNRQMLSESMLEPVPELKEQIQAWVREKVSSDN,0.25931352,"K5R, V11I, I14V, I23V, T76S, M94V, Q98V, H102N",8
KEKFKLLADKFEEIVAKNARAEIDYSDAPDEFRDPLMDTLMTDPVRLPSGTVMDRSIILRHLLNSKTDPFNRQMLTESMLEPVPELKEQIQAWLREKQPSKN,0.94754386,"I1K, E9D, V11F, P66K, M94L, S99P, D101K, H102N",8
IEKFNLLAEKVEEIAAKNAAAEIDLSDAPDEFRDPLMDTLMTDPVRLPSGTVMDRSIILRHLLNSPTDPFNRQMLTESMLEPVPELKEKIQAWIKQKQSSDH,-0.5671941,"K5N, V15A, R20A, Y25L, Q89K, M94I, R95K, E96Q",8
IEKFKLLAEKVEAVVAKNAAAEVDYSDAPDEFRDPLMDTLMTDPVRLPSGTVMDRSIILRHLLNSQTDPFNRQMLTESMLEPVPELKEQIQEWMDEKQSKDH,0.38439178,"E13A, I14V, R20A, I23V, P66Q, A92E, R95D, S100K",8
IEKFKLLAKKMEEISAKNARAEIDYDDAPDEFKDPLMDTLMTDPVRLPSGTVMDRSIILRHLLNSPTDPFSRQPLTESMLEPVTELKEQIQAWMREKQSSDH,0.21636075,"E9K, V11M, V15S, S26D, R33K, N71S, M74P, P84T",8
VERFKLLAEKVEEIVAKNVREEIDLSDAPDEFRDPLMDTLMTDPVRLPSGNVMDRSIILRHLLNSPTDPFNRQMLTEDMLEPAPELKEQIQAWMREKQSSDH,-1.1263242,"I1V, K3R, A19V, A21E, Y25L, T51N, S78D, V83A",8
IEKFQLLAEKVEEIAAKNASAEIDYSDAPDEFRDPLMDTLMTDPVRLPSGTVMDRSIIIRHLLNSPTDPFNRQMLTESMLEPVPELKEQIQLWLKEKQSSDF,-1.340538,"K5Q, V15A, R20S, L59I, A92L, M94L, R95K, H102F",8
IEQFKLLAEKVEEIVAKNAKAETDYSDAPDEFRDPLMDTLMTDPVRLPSGNVMDRSIILRHLLNSPTDPFNRQMLTESMLEPVPELKSQIDAWMREKVSDDH,-0.15729311,"K3Q, R20K, I23T, T51N, E88S, Q91D, Q98V, S100D",8
IEKFKLLAEKVEEIAAKNADAEIDYSDAPDEFRDPLMCTLMTDPVRLPSGTVMDRSIILRHLLNSPTDPFNRQMLTESMLEPVPELKEQIQHWVESKQSTDH,0.24116349,"V15A, R20D, D38C, A92H, M94V, R95E, E96S, S100T",8
MEKFKLLAEKVEEIVAKNAQDEIDYSDAPEEFRDPLMDTLMTDPVRLPSGTVMDRSIILRHLLNSPTDPFNRQMLTESMLEPVPELKERIQAWKREKAASDH,1.5040382,"I1M, R20Q, A21D, D30E, Q89R, M94K, Q98A, S99A",8
IEKFKDLSEKVEEIVLKNARSEIDYSDAPEEFRDPLMDTLMTDPVKLPSGTVMDRSIILRHLLNSPTDPFNRQMLTESMLEPVPELKEQIQAWMDEKQSSNH,0.02197839,"L6D, A8S, A16L, A21S, D30E, R46K, R95D, D101N",8
IEKFDLLCEKVEEIVAKNARAEIDYSDAPDEFKDPVMDTLMTDPVRLPSGNVMDRAIILRHLLNSPTDPFNRQMLTESMLEPVPELKEQIQAWTREKQSSAH,0.8792887,"K5D, A8C, R33K, L36V, T51N, S56A, M94T, D101A",8
IEKFKLLADKVEEIVAKNAQEEVDYSDAPDEFRDPLMDTLMTDPVRLPSGTVMDRSIILRHLLNSPTDPFNRQMLTESMLEPVPELKEQIQAWIREKQKSKE,1.6916134,"E9D, R20Q, A21E, I23V, M94I, S99K, D101K, H102E",8
IEKFEVLAEKVEAIAAKNARAEIDYSDAPDEFRDPLMDTLMTDPVRLPSGSIMDRSIILRHLLNSPTDPFNRQMLTESMLEPVPELKEQIQAWMREKQSSAE,-0.54849756,"K5E, L6V, E13A, V15A, T51S, V52I, D101A, H102E",8
IEKFKLLAEKVEEITLKAARSHIDYSDAPDEFRDPLMDTLMTDPVRLPSGTVMDRAIILRHLLNSPTDPFNRVMLTESMLEPVPELKEQIQAWMREKQISDH,-1.5971453,"V15T, A16L, N18A, A21S, E22H, S56A, Q73V, S99I",8
MEQFKLLASKVEEMVAKNARAEIDYSDAPDEFRDPLMDTLMTDPVRLPSGTVMDRSIILRHLLNSPTDPFNRQPLTESMLEPVPELKEQIQAWIKEKQSSDR,-1.9980056,"I1M, K3Q, E9S, I14M, M74P, M94I, R95K, H102R",8
IEKFILLAEKVEELVAKNAQSEIDYSDAPEEFRDPLMDTLMTDPVRLPSGNVMDRSIILRHLLNSPTDPFNRQPLTESMLEPVPELKEQIQAWMKEKQSSDH,-1.3917499,"K5I, I14L, R20Q, A21S, D30E, T51N, M74P, R95K",8
KEKFKLLAEKVEEIVKSSARAEIDYSDAPDEFRDPLMDTLMTDPVKLPSGTIMDRSIIMRHLLNSPTDPFNRQMLTESMLEPVPELKESIQAWMREKQSSDH,0.44194722,"I1K, A16K, K17S, N18S, R46K, V52I, L59M, Q89S",8
IEKFKLLAQKVEEIQRKNARAEIDYSDAPDEFRDPLMDTLMTDPVRLPSGTVMDRSIILRHLLNSPTDPFNRQMLTEEMLEPLPELKEQIQAWVRERQSPDH,0.3665036,"E9Q, V15Q, A16R, S78E, V83L, M94V, K97R, S100P",8
IEKFKELAEKCEEIVAKNARAEIDLSDAPDEFRDPLMLTLMTDPVRLPSGTVMDRAIIQRHLLNSPTDPFNRQPLTESMLEPVTELKEQIQAWMREKQSSDH,0.2977513,"L6E, V11C, Y25L, D38L, S56A, L59Q, M74P, P84T",8
MEKFILLKEKVEEIVAKNARAEIDASDAPDEFRDPLMDTLMTDPVRLPSGTVMDRAIILRHLLNSQTDPFNRQMLTESMLEPVTELKEQIQAWMRTKQSSDH,-0.580014,"I1M, K5I, A8K, Y25A, S56A, P66Q, P84T, E96T",8
IEKFKLLSEKVEELVAKNAEAEIDFSDAPDEFRDPLMDTLMTDPVRLPSGTVMDRSIILRHLLNSPTDPFNRSMLTESMLEPVPELKEQIQAWVRAKMSSDH,0.36391056,"A8S, I14L, R20E, Y25F, Q73S, M94V, E96A, Q98M",8
IEKFKLLAEKCEEIVAKNARAEVDYSDAPDEFRDPLMDTLMTDPVRLPSGTVMDRSVIMRHLLNSQTDPFNRQMLTEDMLEPVRELKEQIQAWMRQKQSSDH,0.0067098476,"V11C, I23V, I57V, L59M, P66Q, S78D, P84R, E96Q",8
MEKFKLLGQKVEEIVNKNARAEIDESDAPDEFRDPLMDTLMTDPVRLPSGTVMDRSIILRHLLNSPTDPFNRQMLTESQLEPVPELKEQIQAWIREKQSRDH,-0.36853114,"I1M, A8G, E9Q, A16N, Y25E, M79Q, M94I, S100R",8
MEKCKLLAEKVEEIVAKNKRAEIDYADAPDEFRDPIMDTLMTDPVRLPSGTVMDRSIILRHLLNSPTDPFNRQMLTEEMLEPVSELKERIQAWMREKQSSDH,2.065442,"I1M, F4C, A19K, S26A, L36I, S78E, P84S, Q89R",8
IEKFRLLADKVEEIVAINANAEIDYSDAPEEFRDPLMDTLMTDPVRLPSGTVMDRSIILRHLLNSPTDPFNRQMLTESMLEPVPELKERIAAWMREKKSSDH,1.1344669,"K5R, E9D, K17I, R20N, D30E, Q89R, Q91A, Q98K",8
MEKFKLLAEKVEEIAAKNARAEIDYSDAPDEFRDPIMDTLMTDPVKLPSGKVMDRSVILRHLLNSPTDPFNREMLTEDMLEPVPELKEQIQAWMREKQSSDH,2.101222,"I1M, V15A, L36I, R46K, T51K, I57V, Q73E, S78D",8
MDKFALLAERVEEIVAKNAAAEIDYSDAPEEFRDPLMDTLMTDPVRLPSGTVMDRSIILRHLLNSPTDPFNRQMLTESMLEPVPELKEQIEAWMREKKSSDH,0.8907832,"I1M, E2D, K5A, K10R, R20A, D30E, Q91E, Q98K",8
IEKFKLLANKFEEIQAKAARAEIDYSDAPDEFRDPLMDTFMTDPVRLPSGTVMDRSIILRHLLNSPTDPFNRQMLTESMLEPVVELKEQIQAWIKEKQSSDH,-0.75923073,"E9N, V11F, V15Q, N18A, L40F, P84V, M94I, R95K",8
IEKFKLLTQKVEELVAKNAREEIDYSDAPEEFRDPLMDTLMTDPVRLPSGKVMDRSIILRHLLNSPTDPFNRQMLTESQLEPVPELKERIQAWMREKQSSDH,1.296469,"A8T, E9Q, I14L, A21E, D30E, T51K, M79Q, Q89R",8
IEKFKLLATKVEEIVATNARAEIDYSDAPDEFRDPLMDTLMTDPVRLPSGHVMDRRIILRHLLNSPTDPFNRQMLTEDMLEPVTELKEQIQAWMRSKQQSDH,0.9385592,"E9T, K17T, T51H, S56R, S78D, P84T, E96S, S99Q",8
IEKFKLLAEKVEETVAVQTRAEIDYSDAPDEFRDPLMDTLMTDPVRLPSGNVMDRSIILRHLLNSPTDPFNRQMLTESMLEPVPELKERIQAWMREKASSSH,0.32664734,"I14T, K17V, N18Q, A19T, T51N, Q89R, Q98A, D101S",8
IEKFKLLAEKMEEIVAKNARAEIDPSDAPDEFRDPIMDTLMTDPVRLPSGNIMDRSIILRHLLNSPTDPFNRKMLTESMLEPAPELKEQIQAWMREKQMSDH,1.3513739,"V11M, Y25P, L36I, T51N, V52I, Q73K, V83A, S99M",8
IEKFKLLAEKVEEIVAKNARAEIDYSDAPDEFKDPLMDTLMTDPVKLPSGTIMDRSIILRHLLNSPTDPFNRQMLTESMLEDVPELKEKIQAWMREKDVSKH,0.8313844,"R33K, R46K, V52I, P82D, Q89K, Q98D, S99V, D101K",8
IEKFKLLSEKVEEIVAKNARAAIDYSDAPEEFRDPMMDTLMTDPVRLPSGHVVDRSIILRHLLNSPTDPFNRQMLTESMLEPVPELKEQIQAWMLEKQSTDH,-1.4065423,"A8S, E22A, D30E, L36M, T51H, M53V, R95L, S100T",8
IEKFKLLITKVESIVAKHAEAEIDLSDAPDEFRDPLMDTLMTDPVRLPSGTVMDRSIILRHLLNSPTDPFSRQMLTESMLEPVPELKEQIRAWMREKQSSDH,0.1358841,"A8I, E9T, E13S, N18H, R20E, Y25L, N71S, Q91R",8
MEKFKLLAVKVEEVVAKNARAEIDYSDAPDEFRDPLMDTLMTDPVRLPSGNVMDRSIILRHLLNSPTDPFNRQMLTEDMLEPVPELKEQIQAWTRTKQSRDH,-0.85969085,"I1M, E9V, I14V, T51N, S78D, M94T, E96T, S100R",8
IEKFKLLAEQVEEIVAKNSHADIDYSDAPDEFRDPLMDTLMTDPVRLPSGTVMDRSIILRHLLNSPTDPFNRQMLTEDMLEPVQELKEQIQAWRREKQSSDT,-0.072247565,"K10Q, A19S, R20H, E22D, S78D, P84Q, M94R, H102T",8
IEKFKLLGEKMEEIVAKNALAEVDYDDAPDEFRDPLMDTLMTDPVRLPSGTVMDRSIILRHLLNSPTDPFNRQMLTEDMLQPVPELKEQIQAWMREKQSLDH,1.8966806,"A8G, V11M, R20L, I23V, S26D, S78D, E81Q, S100L",8
IEKFKLLAAKVNEIAAKAARAEIDYSDAPEEFRDPLMDTLMTDPVRLPSGTVMDRSIILRHLLNSPTDPFNRQMLTENMLEPVPELKEQIQAWMREKLSSDI,-0.6289569,"E9A, E12N, V15A, N18A, D30E, S78N, Q98L, H102I",8
AEKFKLLAGKVEEIVAKKTRAEIDYSDAPDEFRDPLMDTLMTDPVRLPSGTIMDRSYILRHLLNSPTDPFNRQMLTESMLEPVPELKEQIQAWMREKQGQDH,-0.40854388,"I1A, E9G, N18K, A19T, V52I, I57Y, S99G, S100Q",8
IEKFQLLAEKVEEVVAEHARAEIDLSDAPDEFRDPLMDTLMTDPVRLPSGTVMDRSIILRHLLNSPTDPFNRQHLTESMLEPATELKEQIQAWMREKQSSDH,-1.3040409,"K5Q, I14V, K17E, N18H, Y25L, M74H, V83A, P84T",8
IEKFMLLAKKVEEIVAKNARAVIDYDDAPDEFRDPIMDTLMTDPVRLPSGTVMDRSIILRHLLNSPTDPFNRSELTEDMLEPVPELKEQIQAWMREKQSSDH,2.5443149,"K5M, E9K, E22V, S26D, L36I, Q73S, M74E, S78D",8
IERFEALAEKVEELVAKNARADIDYSDAPDEFRDPVMDTLMTDPVRLPSGTVMDRSIILRHLLNSPTDPFNRQMLTESMLEPVPELKEQIQAWMRENQSSDK,0.037392013,"K3R, K5E, L6A, I14L, E22D, L36V, K97N, H102K",8
IEKFKLLQEKVDALVAKTARAEIDYSDAPDEFRDPLMDTLMTDPVTLPSGHVMDRSIILRHLLNSPTDPFNRQMLTESQLEPVPELKEQIQAWMREKQSSDH,-0.90823543,"A8Q, E12D, E13A, I14L, N18T, R46T, T51H, M79Q",8
MEKFQKLAEKVEEIVAKQAAAEIDYSDAPDEFRDPLMDTLMTDPVRLPSGTVMDRSIIIRHLLNSPTDPFNRQMLTQSMLEPLPELKEQIQAWMREKQSSDH,-0.95083624,"I1M, K5Q, L6K, N18Q, R20A, L59I, E77Q, V83L",8
IEKFKLLAEKVEEIVAKNARQEIDYSDAPEEFRDPLMDTLMTDPVRLPSGTVMDRSIILRHLLNSPTDPFNRQMLTEEMLEPVPELKEKIQKWMREKLYLDH,1.6001176,"A21Q, D30E, S78E, Q89K, A92K, Q98L, S99Y, S100L",8
MEKFKMLAEKCEEIVEKNNRAEIDYSDAPEEFRDPLMDTLMTDPVRLPSGTVMDRSIILRHLLNSPTDPFNRQMLTESMLEPVPELKEQIQAWIREKQRSDH,1.5243429,"I1M, L6M, V11C, A16E, A19N, D30E, M94I, S99R",8
MEKFNLLAEKVEALVAKNARAEIDYSDAPEEFRDPLMCTLMTDPVRLPSGTVMDRSIILRHLLNSPTDPFNRQMLTESMLEPVPELKEQIQQWMREKQSSSH,-0.31210613,"I1M, K5N, E13A, I14L, D30E, D38C, A92Q, D101S",8
IEKFKLLAEKVDAIAAKNARAEVDYSDAPDEFRDPLMDTLMTDPVRLPSGTVMDRSIILRHLLNSPTDPFNRQPLTESMLEPVPELKEKIQAWMREKQESRH,0.9151725,"E12D, E13A, V15A, I23V, M74P, Q89K, S99E, D101R",8
IEKFKLLAEKVEAAVAKTARAQIDYSDAPDEFRDPLMDTLMTDPVKLPSGTVMDRSIILRHLLNSPTDPFNRQPLTESALEPVPELKEQIGAWMREKQSSDH,-1.5130355,"E13A, I14A, N18T, E22Q, R46K, M74P, M79A, Q91G",8
IETFKLLSKKVEEIVAKNAEAEIDYSDAPDEFRDPLMDTLMTDPVRLPSGTVMDRSIILRHLLNSATDPFNRQPLTESMLEPVPELKEQIQAWMREKQSSFK,-0.35163325,"K3T, A8S, E9K, R20E, P66A, M74P, D101F, H102K",8
IEKFKLLAEKVEEVVAKNAQAEVDYSDAPEEFRDPLMDTLMTDPVRLPSGTVMDRSIILRHLLNSPTDPFNRQMLTESMLEPVPELKERIQAWMRQKVSRDH,0.67244875,"I14V, R20Q, I23V, D30E, Q89R, E96Q, Q98V, S100R",8
IEKFKLLAEKVEEIVMKNARAEIDYDDAPDEFRDPLMDTLMTDPVRLPSGTVMDRAIILRHLLNSPTDPFNRQPLTESQLEPVPELKEQIQNWMREKRSADH,1.5017431,"A16M, S26D, S56A, M74P, M79Q, A92N, Q98R, S100A",8
LEKFTLLSEKVEEIVAKNAPAEIDYSDAPDEFRDPIMDTLMTDPVRLPSGTVMDRSIILRHLLNSPTDPFNRQPLTEAMLESVPELKEQIQAWMREKQSSDH,1.8572385,"I1L, K5T, A8S, R20P, L36I, M74P, S78A, P82S",8
IEKFELLAEKVEEIAAKNLRAEIDYSDAPDEFRDPLMDTLMTDPVRLPSGTIMDRSVILRHLLNSPTDPFNRKMLTESMLEPVPELKEQIQAWMREKVSSCH,0.09097595,"K5E, V15A, A19L, V52I, I57V, Q73K, Q98V, D101C",8
IEKFALLSEKVEEIVKKNAREEIDYSDAPDEFNDPLMDTLMTDPVRLPSGTVMDRSIILRHLLNSPTDPFNRQMLTESMLEPVPELKEQIQLWMRAKLSSDH,-0.08569484,"K5A, A8S, A16K, A21E, R33N, A92L, E96A, Q98L",8
KEKFKLLAAKMEEIVAKNAMAEIDYSDAPDEFRDQIMDTLMTDPVRLPSGTVMDRSIILRHLLNSPTDPFNRQMLTESMLEPVPELKEQIQAWMREKMSGDH,1.0998693,"I1K, E9A, V11M, R20M, P35Q, L36I, Q98M, S100G",8
MEKFKLLGKKVEDIIAKNARAEIDYSDAPDEFRDPLMDTLMTDPVRLPSGTVMDRSVILRHLLNSPTDPFNRQMLTESMLEPVPELKERIEAWMREKQSSDH,0.19251285,"I1M, A8G, E9K, E13D, V15I, I57V, Q89R, Q91E",8
IEKFKLLQEKVEKIVAKNARAEIDFSDAPDEFRDPLMDTLMTDPVRLPSGTVMDRKIILRHLLNSPTDPFNRQMLTESMLEPVPELKERIQAWVREKRSIDH,0.37543976,"A8Q, E13K, Y25F, S56K, Q89R, M94V, Q98R, S100I",8
IEKFKLLAEKAEEIAAKAPRAEIDYSDAPDEFRDPLMDTLMTDPVRLPSGHVMDRSIILRHLLNSPTDPFNRQMLTEDMLEPAPELKEQIQAWMREKQSSDD,0.14615695,"V11A, V15A, N18A, A19P, T51H, S78D, V83A, H102D",8
IEKFKLLAEKVEEIVAKNAADEVDFSDAPDEFRDPLMDTLMTDPVRLPSGTVMDRSIILRHLLNSPTDPFNRQMLTESMLEPVTELKEQIQAWMREKRSTDN,0.5252856,"R20A, A21D, I23V, Y25F, P84T, Q98R, S100T, H102N",8
MEKFKLLAQKAEEIVSKNARAEIDYSDAPDEFRDPLMDTLMTDPVRLPSGTVMDRSIILRHLLNSQTDPFNRQMLTEDMLEPVPELKEQIQAWMREKQSRDG,-0.585125,"I1M, E9Q, V11A, A16S, P66Q, S78D, S100R, H102G",8
IAKFKLLAEKVEEIVAKNAAAEVDYSDAPDEFKDPLMDTLMTDPVRLPSGTVMDRSIILRHLLNSPTDPFNRQMLTESMLESVPELKERIQAWVREKISSDH,0.36382037,"E2A, R20A, I23V, R33K, P82S, Q89R, M94V, Q98I",8
