Sequence,Score,Mutations,Number of Mutations
IEKFKGLAEKVEEIAAKNAQADIDFSDAPDEFRDPLMDTLMTDPVRLPSGTVMDRSIILRHLLNSPTDPFNRTMLTESMLEPAPELKEQIQAWIREKQSSDH,-0.60082734,"L6G, V15A, R20Q, E22D, Y25F, Q73T, V83A, M94I",8
KEKFKLLAEKMEEIIAKRAMEEIDYSDAPDEFRDPLMDTLMTDPVRLPSGTVMDRSIIVRHLLNSPTDPFNRQMLTESMLEPVPELKEKIQAWMREKQSSDH,1.2815237,"I1K, V11M, V15I, N18R, R20M, A21E, L59V, Q89K",8
MEKFKLLAEKVEELVAKNARAEIDLSDAPDEFRDPLMDTLMTDPVRLPSGTVMDRSVILRHLLNSPTDPFNRQPLTESMLEPVPELKEQIQAWIREKQSTSH,0.69065976,"I1M, I14L, Y25L, I57V, M74P, M94I, S100T, D101S",8
EEKFKLLKEKAEEIVAKNMRADIDYSDAPDDFRDPLMDTLMTDPVRLPSGHVMDRSIILRHLLNSPTDPFNRQMLTESMLEPVPELKEQIDAWMREKQSSDH,1.3568186,"I1E, A8K, V11A, A19M, E22D, E31D, T51H, Q91D",8
MEKFKLLAEKVGEIVAKNARAEVDYSDAPDEFRDPLMDTLMTDPVRLPSGSVMDRSVILRHLLNSPTDPFNRQMLTEDMLEPVPELKEQIQAWIREKQSTDH,0.2656811,"I1M, E12G, I23V, T51S, I57V, S78D, M94I, S100T",8
MEKFKLLAEKVEEIVAKAARAEIDYSDAPEEFRDPIMDTLMTDPVRLPSGTVMDRSVILRHLLNSETDPFNRQPLTESMLEPVPELKEQIRAWMREKQSSDH,3.7593546,"I1M, N18A, D30E, L36I, I57V, P66E, M74P, Q91R",8
MEKFKNLAEKVEEIAAKNARAEIDLSDAPDEFRDPLMDTLMTDPVRLPSGTVMDRSIILRHLLNSPTDPFNRQPLTEEMLEPVPELKEQIQAWIREKQTSDH,0.7738565,"I1M, L6N, V15A, Y25L, M74P, S78E, M94I, S99T",8
IERWKLLAEKVEEIVADNTRAEIDYSDAPDEFRDPLMDTLMTDPVRLPSGTVMDRSIILRHLLNSPTDPFNRQMLTESQLEPLPELKEKIQAWMREKLSSDH,-0.9293702,"K3R, F4W, K17D, A19T, M79Q, V83L, Q89K, Q98L",8
MEKFKLLVNKVEEIVAKNARAEIDFSDAPDEFRDPLMDTLMTDPVRLPSGTVMDRSIILRHLLNSQTDPFNRQMLTESMLEPVPELKEQIQAWIDEKQSSDT,-0.044760875,"I1M, A8V, E9N, Y25F, P66Q, M94I, R95D, H102T",8
IEKFKLLCAKVEEIVTKNARAEIDYSDAPEEFRDPLMDTLMTDPVRLPSGTVMDRSIIVRHLLNSPTDPFTRQMLTESMLEPVPELKERIQQWMREKQSSDH,3.9702985,"A8C, E9A, A16T, D30E, L59V, N71T, Q89R, A92Q",8
IEKFKLLVEKVEEIAAKNVRAEIDYSDAPDEFRDPLMDTLMTDPVRLPSGTVMDRSVILRHLLNSPTDPFNRQPLTESMLEPVPELKEQIQQWMREKQSSQT,1.3927472,"A8V, V15A, A19V, I57V, M74P, A92Q, D101Q, H102T",8
IEKYKLLAEKVEAIVLKNQRAEIDYSDAPDEFRDPLMDTLMTDPVRLPSGTVMDRSVILRHLLNSPTDPFNRQMLTESMLEPVPELKERIQAWIREKTSSDH,0.7589878,"F4Y, E13A, A16L, A19Q, I57V, Q89R, M94I, Q98T",8
IENFKLLQKKVEEIVAKNHLAEIDYSDAPDEFRDPLMDTLMTDPVRLPSGTVMDRSVILRHLLNSPTDPFNRQMLTESMLEPVPELKEKISAWMREKQSSDH,1.6415588,"K3N, A8Q, E9K, A19H, R20L, I57V, Q89K, Q91S",8
IEKFKLLAEKLEEIVAKNARAEVDYSDAPDEFRDPIMDTLMTDPVKLPSGTVMDRSIILRHLLNSPTDPFNRQMLTESMLEPVPELKEQIDAWGRSKQSKDH,2.2723155,"V11L, I23V, L36I, R46K, Q91D, M94G, E96S, S100K",8
NEQFKLLAEKVEEIVAKNSAAEIDFSDAPDEFRDPLMDTLMTDPVKLPSGTVMDRSIILRHLLNSPTDPFNRQPLTESMLEPVVELKEQIQAWMREKQSSDH,-0.04563182,"I1N, K3Q, A19S, R20A, Y25F, R46K, M74P, P84V",8
IEKFVLLATKVENVVAQNARFEIDYSDAPEEFRDPLMDTLMTDPVRLPSGTVMDRSIILRHLLNSPTDPFNRQMLTESMLEPVPELKERIQAWMREKQSSDH,1.7508252,"K5V, E9T, E13N, I14V, K17Q, A21F, D30E, Q89R",8
INKFKLLTQKFEEIVAKNARAEIDYSDAPDEFRDPLMDTLMTDPVKLPSGTVMDRSIILRHLLNSPTDPFNRQMLTEDMLEPVPELKEQIQAWIREKQSSPH,0.53074545,"E2N, A8T, E9Q, V11F, R46K, S78D, M94I, D101P",8
IEKFQLLKEKVEEMVAKNARAEIDYSDAPEEFLDPLMDTIMTDPVRLPSGTVMDRSIISRHLLNSPTDPFNRQMLTENMLEPVPELKEQIQAWMREKQSSDH,1.3099697,"K5Q, A8K, I14M, D30E, R33L, L40I, L59S, S78N",8
MEKFKLLAEKVNEIVAKNQRAEIDYSDAPDEFRDPLMDTLMTDPVRLPSGHVMDRKIILRHLLNSPTDPFNRQMLTESMLEPAPELKERIQAWMREKQSSSH,-1.1984609,"I1M, E12N, A19Q, T51H, S56K, V83A, Q89R, D101S",8
IEKFELLAEKVEEIVAKHAREEIDYEDAPDEFRDPLMDTLMTDPVRLPSGTVMDRSIILRHLLNSPTDPFNRQMLTEDMLEPVPELKEQIQQWLREKFSSDH,1.5678949,"K5E, N18H, A21E, S26E, S78D, A92Q, M94L, Q98F",8
IEKFKLLAEKVEESVAKNARAEVDYSDAPDEFRDPLMDTLMIDPVRLPSGTVMDRSVILRHLLNSETDPFNRSPLTESMLEPVPELKERIQAWMREKQSSDH,0.59505075,"I14S, I23V, T42I, I57V, P66E, Q73S, M74P, Q89R",8
IEKFSLLCEKVESLVAKAARAEIDYSDAPDEFRDPLMDTLMTDPVRLPSGTVMDRSIILRHLLNSPTDPFNRQELTESMLEPVPELKEQIYAWMREKQSSDS,0.90721536,"K5S, A8C, E13S, I14L, N18A, M74E, Q91Y, H102S",8
IEKFKLLAKKVEEIVAKNARAEVDYSDAPEEFRDPLMDTLMTDPVRLPSGNVMDRSIILRHLLNSPTDPFNRQMLTESMLEPVPELKEKIQAWLREKQYSDA,1.3425646,"E9K, I23V, D30E, T51N, Q89K, M94L, S99Y, H102A",8
IEKFNLLAEKAEDIVRKNARAEIDLSDAPDEFRDPLMDTLMTDPVRLPSGTVMDRSIILRHLLNSPTDPFNRTMLTEAMLEPVPELKERIQAWMREKQSSDH,-0.8408954,"K5N, V11A, E13D, A16R, Y25L, Q73T, S78A, Q89R",8
IEKFKLLKIKVEEIVAKNAREEIDYSDAPDEFRDPLMDTLMTDPVRLPSGTVMDRPIIVRHLLNSPTDPFNRQMLTEEMLEPVPELKEQIQAWMRQKQESDH,1.3553405,"A8K, E9I, A21E, S56P, L59V, S78E, E96Q, S99E",8
IEKFKLLAEQVEELVAKNARAEIDYSDAPDEFKDPLMDTLMTDPVRLPSGTVMDRPIIMRHLLNSPTDPFNRQMLTESMLEPVAELKEQIQAWMREKQGSTH,-0.80548346,"K10Q, I14L, R33K, S56P, L59M, P84A, S99G, D101T",8
VEKFKLLAEKVEEISIKQARAEIDYSDAPEEFRDPLMDTLMTDPVRLPSGTVVDRSIILRHLLNSPTDPFNRQMLTESMLEPVVELKEQIQAWMRRKQSSDH,2.3448663,"I1V, V15S, A16I, N18Q, D30E, M53V, P84V, E96R",8
MEKFDLLSEKVDEIVAKNNREEIDYSDAPDEFRDPLMDTLMTDPVRLPSGTVMDRSIILRHLLNSPTDPFNRQMLTESQLEPVPELKEQIDAWMREKQSSDH,0.4770624,"I1M, K5D, A8S, E12D, A19N, A21E, M79Q, Q91D",8
IEKFKGLAEKVEEIVAKNIRAEIDYSDAPDEFRDPLMDTLMTDPVRLPSGTVMDRSVILRHLLNSPTDPFNRQPLTESMLEPVPELKERIQRWMRAKQSSKH,1.2812709,"L6G, A19I, I57V, M74P, Q89R, A92R, E96A, D101K",8
MEKFKLLAFKVDEIVAKNARAEIDYSDAPDEFKDPLMDTLMTDPVRLPSGTVMDRSIILRHLLNSPTDPFNRQALTESMLEPLPELKEQIQAWMKEKQVSDH,-2.2001328,"I1M, E9F, E12D, R33K, M74A, V83L, R95K, S99V",8
IRKFKELKEKVEEIVAQNARAEIDYSDAPDEFLDPLMDTLMTDPVRLPSGTVMDRSIILRHLLNSPTDPFNRQPLTESMLEPVPELKEQIQAWMREKTRSDH,-0.022605164,"E2R, L6E, A8K, K17Q, R33L, M74P, Q98T, S99R",8
IAKFALLAEKVEEIVAKNARAEIDYSDAPEEFRDPLMDTLMTDPVRLPSGNVMDRSIILRHLLNSPTDPFNRQPLTESMLEPVPELKEQIQVWMREKISSHH,-0.8404465,"E2A, K5A, D30E, T51N, M74P, A92V, Q98I, D101H",8
IEKFKLLAAKCEEVVRKAARDEIDFSDAPDEFRDPLMDTLMTDPVRLPSGTVMDRSIILRHLLNSPTDPFNRQMLTESMLEPDPELKEQIQAWMREKQSSDH,0.15443753,"E9A, V11C, I14V, A16R, N18A, A21D, Y25F, V83D",8
IEKFKLLAEKAEEIVAANAAAEIDYSDAPDEFRDPLMCTLMTDPVRLPSGTVMDRSVILRHLLNSPTDPFNRQMLTESMLEPVPELKEQIHAWMQEKQSADH,0.7202261,"V11A, K17A, R20A, D38C, I57V, Q91H, R95Q, S100A",8
IEKFKLLAEKVEEIVAKNSRAEVDYSDAPDEFRDPLMDTLMTDPVRLPSGTVMDRSIILRHLLNSPTDPFNRQPLTEDMLEPATELKERIQAWMREKQSSDS,-1.0293038,"A19S, I23V, M74P, S78D, V83A, P84T, Q89R, H102S",8
IEKFKLLAEKVEEIVAKGARAEIDYSDAPDEFRDPLMDTLMTDPVKLPSGTVMDRSVILRHLLNSPTDPFNRQMLTESMLEPVPELKEKIQAWMREKFQSSK,1.6470045,"N18G, R46K, I57V, Q89K, Q98F, S99Q, D101S, H102K",8
IEKFKLLREKVEEIVAKNAREEIDYSDAPDEFRDPLMDTLMTDPVKLPSGTIMDRSIILRHLLNSPTDPFNRQMLTESMLEPQVELKEQIQAWMREKISSHH,0.9276885,"A8R, A21E, R46K, V52I, V83Q, P84V, Q98I, D101H",8
IEQFKLLAEKVEEIGAKNARAEIDYSDAPDEFRDPLMDTLMTDPVRLPSGNVMDRPIIQRHLLNSPTDPFNRQMLTESMLEPAPELKEQIQAWMREKQSGDA,-1.4234459,"K3Q, V15G, T51N, S56P, L59Q, V83A, S100G, H102A",8
AEKFKLLAEKVEEIVAKSARAEIDYSDAPDEFRDPLMDTLMTDPVRLPSGTVMDRSIILRHLLNSPTDPFNRQPLTESMLEPVVELKDRIQAWMREKQSTDG,0.43879673,"I1A, N18S, M74P, P84V, E88D, Q89R, S100T, H102G",8
IEKFRLLAEKVEEIVILNARNEIDYSDAPDEFRDSLMDTLMTDPVRLPSGTVMDRSIILRHLLNSPTDPFNRQMLTEDMLEPVPELKEQIQAWMREKQSSNL,-2.5308352,"K5R, A16I, K17L, A21N, P35S, S78D, D101N, H102L",8
IEKFALLAEKVEEIVLKNTRKEIDYSDAPDEFRDPLMDTLMTDPVRLPSGTVMDRSIIMRHLLNSPTDPFNRQMLTESMLEPVPELKEQIQAWIKEKQPSDH,-1.5533873,"K5A, A16L, A19T, A21K, L59M, M94I, R95K, S99P",8
IEKFKLLAEKVSEIAAKNARAEIDYSDAPDEFKDPLMDTLMTDPVRLPSGTVMDRAIILRHLLNSPTDPFNRQELTESMLEPVPELKEQIQEWMREKVSSKH,0.93665254,"E12S, V15A, R33K, S56A, M74E, A92E, Q98V, D101K",8
IERFKLLAEKVEEIVAADARAEVDYSDAPDEFRDPLMDTLMTDPVRLPSGTIMDRSIILRHLLNSPTDPFNRQKLTESMLEPVPELKERIQAWMREKQSSSH,0.8721142,"K3R, K17A, N18D, I23V, V52I, M74K, Q89R, D101S",8
IEKFKILAEKCEEIVAKNARAEIDYSDAPEEFRDPLMDTLMTDPVKLPSGTVMDRSIILRHLLNSPTDPFNRAMLTESMLEPVPELKEKIQAWMEEKKSSDH,1.496607,"L6I, V11C, D30E, R46K, Q73A, Q89K, R95E, Q98K",8
IERWKLLAERVEAIVAKNARAEIDYSDAPDEFRDPLMDTLMTDPVRLPSGTVMDRSIILRHLLNSPTDPFTRQPLTESMLEPVVELKEQIQAWMREKQSLDH,3.0702124,"K3R, F4W, K10R, E13A, N71T, M74P, P84V, S100L",8
IEKFKLLAEKVEEIVAKQQQAERDYSDAPEEFRDPIMDTLMTDPVRLPSGTVMDRSIILRHLLNSPTDPFNRQMLTESMLEPVTELKEQIQAWMREKQSSDQ,3.27527,"N18Q, A19Q, R20Q, I23R, D30E, L36I, P84T, H102Q",8
IEKFKELAEKVEEIVAKRARAEIDYSDAPDEFRDPLMDTLMTDPVRLPSGTVMDRSIILRHLLNSPTDPFNRQPLTESMLEPVTELKEQIASWIRRKQSSDH,-0.85671353,"L6E, N18R, M74P, P84T, Q91A, A92S, M94I, E96R",8
IEKFKLLAEKVEEVVAKAARAEIDYSDAPDEFRDPLMDTLMVDPVRLPSGTVVDRSIILRHLLNSPTDPFTRQMLTEDMLEPVPELKEKIQAWMKEKQSSDH,4.397396,"I14V, N18A, T42V, M53V, N71T, S78D, Q89K, R95K",8
IAAFKLLAEKVEEIVAKNARAEVDYSDAPDEFRDPLMDTLMTDPVRLPSGTVMDRSVILRHLLNSPTDPFNRQMLTESMLEPVPELKEQIQAWIKSKKSSDH,-2.0164833,"E2A, K3A, I23V, I57V, M94I, R95K, E96S, Q98K",8
IEKFKLLREKVEEIVAKNAQAEIDYSDAPEEFRDPLMDTLMTDPVRLPSGTVMDRSVILRHLLNSPTDPFNRQMLTESMLEPVPELKERIQAWIREKQSNGH,1.6177485,"A8R, R20Q, D30E, I57V, Q89R, M94I, S100N, D101G",8
LEKFKLLAEKVEGIVAKNARQEIDYSDAPDEFRDPLMDTLMTDPVRLPSGTVMDRSVIQRHLLNSPTDPFNRQPLTESMLEPVPELKEQIQAWMREKMSSDT,0.82400584,"I1L, E13G, A21Q, I57V, L59Q, M74P, Q98M, H102T",8
IDKFMLLAEKVDEIVAKNARAEIDYSDAPDEFRDPLMSTLMTDPVRLPSGTVMDRSVILRHLLNSPTDPFNRQPLTEDMLEPVPELKEQIQAWMREKQSSDA,0.033442125,"E2D, K5M, E12D, D38S, I57V, M74P, S78D, H102A",8
IERFQELGEKVEEIVAKNARAEIDYSDAPDEFKDPLMDTLMTDPVRLPSGTVMDRSIILRHLLNSPTDPFNRQMLTEEMLEPVPELKEQIQAWKKEKQSSDH,-1.9571626,"K3R, K5Q, L6E, A8G, R33K, S78E, M94K, R95K",8
IEKFKLLAEKMEAIVAKNARAEIDYSDAPDEFRDPLMDTLMTDPVRLPSGIVMDRSIILRHLLNSPTDPFSRQMLTESMLEPVSELKEQIRAWMKEKQCSDH,-2.1620126,"V11M, E13A, T51I, N71S, P84S, Q91R, R95K, S99C",8
MERFKLLAAKVEEIVEKNARAEVDYSDAPEEFRDPLMDTLMTDPVRLPSGNVMDRSIILRHLLNSPTDPFNRQMLTESMLEPVPELKEQIQAWMREKQYSDH,-0.65080494,"I1M, K3R, E9A, A16E, I23V, D30E, T51N, S99Y",8
IEKFKLLAEKVEEIVAKNMLAEIDYSDAPDEFKDPLMDTLMTDPVRLPSGTVMDRSIILRHLLNSPTDPFNRQPLTESMLEPVPELKEQIQAWLREKASQKH,2.2593164,"A19M, R20L, R33K, M74P, M94L, Q98A, S100Q, D101K",8
MEKFKLLAEKVEEIVAKNARQEIDYSDAPDEFRDPLMQTLMTDPVRLPSGTVMDRSIILRHLLNSPTDPFNRQPLNESMLEPVPELKERIQAWVREKMSSDH,0.4155835,"I1M, A21Q, D38Q, M74P, T76N, Q89R, M94V, Q98M",8
IEKFKLLAEKVETIVAKNARAVIDFSDAPDEFRDPLMDTLMTDPVRLPSGTVMDRSIILRHLLNSPTDPFNRQMLNESMLEPVPELKEKIQLWMRKKQSGDH,-1.083221,"E13T, E22V, Y25F, T76N, Q89K, A92L, E96K, S100G",8
IRKFKLLAEKVEEMVAKNARAEVDYSDAPDEFRDPLMDTLMTDPVRLPSGNVMDRSVILRHLLNSPTDPFNRQMLTESMLEPVPELKEQIQAWNAEKQSSSH,-0.06088999,"E2R, I14M, I23V, T51N, I57V, M94N, R95A, D101S",8
MEKFKLLAEKMEEIVSKNARAEIDYSDAPEEFRDPIMDTLMTDPVRLPSGVVMDRSIILRHLLNSPTDPFNRQPLTESMLEPVPELKEQIQAWMREKQSSDS,2.9601307,"I1M, V11M, A16S, D30E, L36I, T51V, M74P, H102S",8
IEKFKLLAEKAENIAAKNMRAEIDYSDAPDEFRDPLMDTLMTDPVRLPSGTVMDRSIILRHLLNSPTDPFNRQPLTESMLEPVPELKEQIQAWMREKQSLSF,1.6480005,"V11A, E13N, V15A, A19M, M74P, S100L, D101S, H102F",8
MYKFKLLAEKVEQLVAKNARAEIDYSDAPDEFRDPLMDTLMTDPVRLPSGTIMDRSIILRHLLNSPTDPFNRQMLTEDMLEPAPELKEQIQAWMREKLSSDH,-1.519547,"I1M, E2Y, E13Q, I14L, V52I, S78D, V83A, Q98L",8
IEKFKELAEKVEMIVAKNAEEETDYSDAPDEFRDPLMDTLMTDPVRLPSGTIMDRAIILRHLLNSPTDPFTRQMLTESMLEPVPELKEQIQAWMREKQSSDH,5.1974015,"L6E, E13M, R20E, A21E, I23T, V52I, S56A, N71T",8
IEKFKLLAEKVDEIVAKNARADIDYEDAPDEFRDPLMDTLMTDPVKLPSGTVMDRHIILRHLLNSPTDPFNRQMLTESMLEPVPELKEQIQAWMRQKQPSDP,1.1238768,"E12D, E22D, S26E, R46K, S56H, E96Q, S99P, H102P",8
IEKFKLLAEKVEELVAKNALAEIDYDDAPDEFKDPLMDTLMTDPVRLPSGKVMDRSAILRHLLNSPTDPFNRQMLTESMLEPVPELKEQIQAWMKEKQSRDH,0.041950613,"I14L, R20L, S26D, R33K, T51K, I57A, R95K, S100R",8
IEDFKLLAEKVEEIVAKNQLAEIDYSDAPDEFRDPLMDTLMTDPVRLPSGHVMDRSVIIRHLLNSPTDPFNRQMLTESMLEPVPELKEQIQAWMAEKRSSDH,1.2583611,"K3D, A19Q, R20L, T51H, I57V, L59I, R95A, Q98R",8
IEKFKLLRSKVEEIIAKNARAEIDLSDAPDEFRDPLMDTLMTDPVRLPSGTVMDRSIILRHLLNSNTDPFNRQMLTESMLEPVPELKERIQAWMREKSSSDQ,0.58490413,"A8R, E9S, V15I, Y25L, P66N, Q89R, Q98S, H102Q",8
IEKFKLLASKVEEIATKNARAEIDYSDAPDEFRDPLMDTLMTDPVRLPSGTVMDRSIILRHLLNSPTDPFNRQQLTESMLEPVPELKEQICAWMREKGLSDD,1.1549361,"E9S, V15A, A16T, M74Q, Q91C, Q98G, S99L, H102D",8
IEKFSLLAEKVEEIVAKNARAEIDYSDAPDEFRDPLMDTLMTDPVKLPSGTVADRSIILRHLLNSPTDPFNRQPLTEEQLEPVPELKERIQAWMRDKQSSDH,0.50842845,"K5S, R46K, M53A, M74P, S78E, M79Q, Q89R, E96D",8
IESFSLLAEKVDEIVAKNARAEIDYSDAPEEFRDPLMDTLMTDPVRLPSGTVMDRSIILRHLLNSETDPFNRQMLTESMLEPVTELKERIQAWMEEKQSSDH,0.27871364,"K3S, K5S, E12D, D30E, P66E, P84T, Q89R, R95E",8
IEKFKLLAQKVEEIVAKNARAEIDYSDAPAEFRDPLMDTLMTDPVKLPSGTIMDRSIILRHLLNSPTDPFTRQPLQESMLEPVPELKEQIQKWMREKQSSDH,2.7118921,"E9Q, D30A, R46K, V52I, N71T, M74P, T76Q, A92K",8
IDKFKLLGERMEEIVAKNARAEIDYSDAPDEFRDPLMDTLMTDPVRLPSGTVMDRSIILRHLLNSPTDPFNRQMLTESMLEPVPELKEQIQAWMSAKQELDH,-0.19930318,"E2D, A8G, K10R, V11M, R95S, E96A, S99E, S100L",8
IEKFKLLAEKVEEAVAKNNRAEIDYSDAPDEFRDPLMDTLMTDPVRLPSGTIMDRSIILRHLLNSPTDPFNRQPLTEDMLEPVPELKERIQAWMRDKQSSDD,0.99008006,"I14A, A19N, V52I, M74P, S78D, Q89R, E96D, H102D",8
IEKFKLLAEKVESIAAKNAMAEIDYSDAPDEFRDPLMDTLMTDPVRLPSGKVMDRSIILRHLLNSPTDPFNRQMLTESMLEPVMELKEQIEAWMRAKQESDH,2.1552906,"E13S, V15A, R20M, T51K, P84M, Q91E, E96A, S99E",8
IEKFDLLAEKVEEIVAKNDRADIDYSDAPEEFRDPLMDTLMTDPVRLPSGTVMDRSVILRHLLNSPTDPFNRQPLTESMLEPVPELKEQIQAWMREKRSSHH,0.23643589,"K5D, A19D, E22D, D30E, I57V, M74P, Q98R, D101H",8
IEKFNLLAEKVNEIVAKNARAEIDYSDAPDEFRDPLMDTLMTDPVRLPSGTVMDRSVILRHLLNSETDPFNRNPLTESMLEPVPELKERIQAWMREKISSDH,-0.4121316,"K5N, E12N, I57V, P66E, Q73N, M74P, Q89R, Q98I",8
IEKFKKLCEKVEGIVAKNADAEDDLSDAPDEFLDPLMDTLMTDPVRLPSGTVMDRSIILRHLLNSPTDPFNRQMLTESMLEPVPELKEQIQQWMREKQSSDH,1.468272,"L6K, A8C, E13G, R20D, I23D, Y25L, R33L, A92Q",8
IEKFKLLAQKMDEIVARNRQAEIDYSDAPDEFRDPLMDTLMTDPVRLPSGNVMDRSIILRHLLNSPTDPFNRQMLTESMLEPVPELKEQIQAWVREKQSSDH,1.1898052,"E9Q, V11M, E12D, K17R, A19R, R20Q, T51N, M94V",8
IEGFKLLAEKCEEIQAKNNREEIDLSDAPDEFRDPLMDTLMTDPVRLPSGTVMDRSIILRHLLNSQTDPFNRQMLTESMLEPVPELKEQIQAWMREKQSRDH,0.8053906,"K3G, V11C, V15Q, A19N, A21E, Y25L, P66Q, S100R",8
IEEFKLLAEKVEEIVAKNARAEIDYSDAPDEFRDPIMCTLMTDPVRLPSGTVMDRAVILRHLLNSPTDPFNRAMLTESMLEPVPELKAQIEAWMREKQSSDH,2.334375,"K3E, L36I, D38C, S56A, I57V, Q73A, E88A, Q91E",8
IEKFTLLAEKVEEIVKKNVRAEIDYSDAPDEFRDPLMDTLMTDPVRLPSGNVMDRSIILRHLLNSPTDPFNRQMLTESMLEPVPELKGRIQAWMREKQMSDK,-0.38052672,"K5T, A16K, A19V, T51N, E88G, Q89R, S99M, H102K",8
MEKFKLLKEKVEELVAKNARAEIDFSDAPDEFRDPLMDTLMTDPVRLPSGTVMDRAIILRHLLNSPTDPFNRQPLTESMLESVPELKEQIQAWMREKQSSDG,0.070571035,"I1M, A8K, I14L, Y25F, S56A, M74P, P82S, H102G",8
IEKFKTLAEKVEEIVAKRTRAEIDYSDAPDEFRDPLMDTLMTDPVRLPSGNIMDRSIILRHLLNSPTDPFNRQMLTEDMLEPVPELKEQIQSWMREKQRSDH,-0.14897794,"L6T, N18R, A19T, T51N, V52I, S78D, A92S, S99R",8
IEKFKLLAEKCEEIVAKNAAAEIDLSDAPDEFRDPLMDTLMTDPVRLPSGNVMDRSIILRHLLNSPTDPFNRQMLTESSLEPVPELKERIQAWMQEKQQSDH,-0.59915185,"V11C, R20A, Y25L, T51N, M79S, Q89R, R95Q, S99Q",8
IKKFKLLSEKVEEIAAKNAREEIDYSDAPDEFCDPLMDTLMTDPVKLPSGTVMDRSIILRHLLNSPTDPFNRQMLTESQLEPVPELKEQIQAWMREKQSDDH,0.78925073,"E2K, A8S, V15A, A21E, R33C, R46K, M79Q, S100D",8
IEKFKLLAEKVDEIVSKNARAELDYSDAPDEFKDPLMDTLMTDPVRLPSGTVMDRAIILRHLLNSPTDPFNRQPLTEDMLEPMPELKEQIQAWMREKQSSDH,0.8709871,"E12D, A16S, I23L, R33K, S56A, M74P, S78D, V83M",8
IESFKELAEKVEEIVTKNARAEIDYSDAPDEFRDRLMDTLMTDPVKLPSGTVMDRSIILRHLLNSPTDPFTRQMLTESMLEPLPELKEQIQAWMREKMSSDH,-1.3239503,"K3S, L6E, A16T, P35R, R46K, N71T, V83L, Q98M",8
IEKFKELAEKVEEIFAANARAEIDYSDAPDEFVDKLMDTLMTDPVRLPSGTVMDRSIILRHLLNSPTDPFNRQMLTESMLEPVPELKERIDAWMREKLSSDH,-0.74471295,"L6E, V15F, K17A, R33V, P35K, Q89R, Q91D, Q98L",8
ISKFKLLAEKVEEIASKNLRAEIDYSDAPDEFRDPLMDTLMTDPVRLPSGTVMDRSVILRHLLNSPTDPFNRKMLTESMLEPLPELKEQILAWMREKQSSDH,-0.03717323,"E2S, V15A, A16S, A19L, I57V, Q73K, V83L, Q91L",8
IEDFALLAEKVEQIVVSNARAEIDYSDAPDEFRDPLMDTLMTDPVRLPSGNVMDRSIILRHLLNSPTDPFNRQMLTESMLEPVPELKEQIIAWMAEKQSSDH,-1.0202112,"K3D, K5A, E13Q, A16V, K17S, T51N, Q91I, R95A",8
IEKFKLLAEKVEEIVAANARAGIDYSDAPDEFKDPLMDTLMTDPVRLPSGTVADRSIILRHLLNSPTDPFNRQMLTESMLEPLPELKEKIQAWMREKADSDH,0.43651718,"K17A, E22G, R33K, M53A, V83L, Q89K, Q98A, S99D",8
VEDFKLLAEKVEEIVLKNARAEIDYSDAPDEFRDPLMSTLMTDPVRLPSGTVMDRSIILRHLLNSPTDPFNRQELNESMLEPVPELKEQIQAWMSSKQSSDH,-2.600123,"I1V, K3D, A16L, D38S, M74E, T76N, R95S, E96S",8
IEKFKLLAEKVEEIVAQEARAEVDYSDAPEEFRDPLMDTLMCDPVRLPSGTVMDRSIIMRHLLNSPTDPFNRMMLTESMLEPVPELKEQIQAWMREKISSDH,0.45679158,"K17Q, N18E, I23V, D30E, T42C, L59M, Q73M, Q98I",8
IEKFKALVEKVEEIAAKNARAEIDYGDAPDEFRDPLMDTLMTDPVRLPSGTVMDRAIILRHLLNSPTDPFNRQMLTESMLEPVPELKEKIQAWMQEKQSSDY,0.70096457,"L6A, A8V, V15A, S26G, S56A, Q89K, R95Q, H102Y",8
IEKFKLLAEKMEEIVDKESRAEIDYSDAPDEFRDPLMDTLMTDPVRLPSGTVMDRSIIMRHLLNSPTDPFNRQMLTESMLEPVPELKEQIQAWMRQKLSHDH,-0.54790485,"V11M, A16D, N18E, A19S, L59M, E96Q, Q98L, S100H",8
IEKFKLLAEKAEEIVAHNASAEIDYSDAPDEFRDPLMDTLMTDPVRLPSGTIMDRSVILRHLLNSPTDPFNRQMLTESMLEPVPELKERIQAWMKEKQSSDT,-0.38201118,"V11A, K17H, R20S, V52I, I57V, Q89R, R95K, H102T",8
IEKFKLLAEKVEEIVKENARAEIDYSDAPDEFRDPLMDTLMVDPVRLPSGTIMDRSIILRHLLNSPTDPFNRQMLTESMLEPQPELKEQIQAWIREKAMSDH,1.6557446,"A16K, K17E, T42V, V52I, V83Q, M94I, Q98A, S99M",8
IEKFKLLGEKAEAIVAKNAAAEIDLSDAPDEFRDPLMDTLMTDPVRLPSGTVMDRSIILRHLLNSPTDPFNRQMLTESMLEPVPELKEKIQAWMNEKSSSDH,0.8272766,"A8G, V11A, E13A, R20A, Y25L, Q89K, R95N, Q98S",8
MEKFRSLAEKVDEIVAKNARNEIDYSDAPDEFRDPLMDTLMTDPVRLPSGTVMDRSIILRHLLNSPTDPFNRQMLTESMLEPVTELKEQIQAWMRAKISSDH,-0.25070417,"I1M, K5R, L6S, E12D, A21N, P84T, E96A, Q98I",8
IEKFKILARKVEEIVQKNAGAEVDYSDAPDEFRDPLMDTLMTDPVRLPSGHVMDRSIILRHLLNSPTDPFNRQMLTESMLEPVPELKERIQAWMREKQSSRH,0.800674,"L6I, E9R, A16Q, R20G, I23V, T51H, Q89R, D101R",8
IEKFKLLAEKMEEIVARNAEEEIDYSDAPEEFRDPLMDTLMTDPVRLPSGTVMDRSIIVRHLLNSPTDPFNRQMLTESMLEPVPELKEQIQSWMREKQSTDH,1.1040424,"V11M, K17R, R20E, A21E, D30E, L59V, A92S, S100T",8
LAKFKLLQEKVQEVAAKNARAEIDYSDAPDEFRDPLMDTLMTDPVRLPSGTVCDRSIILRHLLNSPTDPFNRQMLTESMLEPVPELKERIQAWMREKQSSDH,0.2152257,"I1L, E2A, A8Q, E12Q, I14V, V15A, M53C, Q89R",8
MEKFKLLAEKVDEIVAKNARAEIDYSDAPDEFRDPLMDTLMTDPVRLPSGNVMDRQIILRHLLNSPTDPFNRTMLTEKMLEPVPELKEQIQAWMKEKQSADH,-2.5330324,"I1M, E12D, T51N, S56Q, Q73T, S78K, R95K, S100A",8
IEKFKALAEKVEEVVAKNLRDEIDYSDAPDEFRDPLMDTLMTDPVRLPSGTVMDRSVILRHLLNSPTDPFNRQPLTESMLEPVPELKEQIQAWIREKQASDH,2.730647,"L6A, I14V, A19L, A21D, I57V, M74P, M94I, S99A",8
IEKFKLLADKVEEIVAKNARAEIDYSDAPDEFRDVLMDTLMTDPVRLPSGNVMDRSIILRHLLNSPTDPFNRQALTESMLEPVPELKEQILAWMEQKTSSDH,-0.6900944,"E9D, P35V, T51N, M74A, Q91L, R95E, E96Q, Q98T",8
IEKFKQLAEKVEEIVAKNAREEIDYSDAPDEFKDPLMDTLMTDPVRLPSGTVMDRSIILRHLLNSPTDPFNRQALTESMLEPVPELKEQIQAWMREVVKRDH,1.5803962,"L6Q, A21E, R33K, M74A, K97V, Q98V, S99K, S100R",8
IENFKLLARKVEEIVAKNARAEMDLSDAPDEFRDPLMDTLMTDPVRLPSGTVMDRSIILRHLLNSPTDPFNRQMLTESMLEPQPELKEQIQAWIQERQSSDH,1.2204373,"K3N, E9R, I23M, Y25L, V83Q, M94I, R95Q, K97R",8
MEKFKLLDQKVEEIVLKNARAEIDYSDAPEEFRDPLMDTLMTDPVKLPSGMVMDRSIILRHLLNSETDPFNRQMLTESMLEPVPELKEQIQAWMREKQSSDH,-0.09162849,"I1M, A8D, E9Q, A16L, D30E, R46K, T51M, P66E",8
IEKFQLLSEKAEAIVVKNAVAEIDYSDAPEEFRDPLMDTLMTDPVRLPSGTVMDRSIILRHLLNSQTDPFNRQMLTESMLEPVPELKEQIQAWMREKQSSDH,0.15535891,"K5Q, A8S, V11A, E13A, A16V, R20V, D30E, P66Q",8
IEKFKLLAEKVEEIEAKNLRAEIDYSDAPDEFRDPLMDTLMTDPVRLPSGHVMDRSIILRHLLNSPTDPFTRQPLTEDMLEPVPELKEQISAWMREKQSSLH,4.833923,"V15E, A19L, T51H, N71T, M74P, S78D, Q91S, D101L",8
IEKFKLLGEKVEEINAKNARAEIDYSDAPEEFRDPIMDTLMTDPVRLPSGTVMDRSIILRHLLNSPTDPFNRQPLTEDMLEPVPELKEQIQAWMRERQSSDE,4.175643,"A8G, V15N, D30E, L36I, M74P, S78D, K97R, H102E",8
IDKFKLLAEKVEEIVAKNARMEIDYSDAPDEFRDPLMDTLMTDPVRLPSGNVMDRSIILRHLLNSATDPFNRQMLTESMLLPVPELKEQIQAWIAEKMSSDH,0.10799211,"E2D, A21M, T51N, P66A, E81L, M94I, R95A, Q98M",8
IEKFRLLAEKVEQIVAKNARAEIDYSDAPDEFRDPLMDTLMTDPVRLPSGTVMDRSIILRHLLNSPTDPFNRQPLTQNMLEPVPELKEQIQAWMQEKQTSDY,-1.412956,"K5R, E13Q, M74P, E77Q, S78N, R95Q, S99T, H102Y",8
IEKFCMLAEKAEEIVAQNARAEIDYSDAPEEFRDPLMDTLMTDPVRLPSGHVMDRSIILRHLLNSPTDPFNRQPLTESMLEPVPELKEQIQAWMEEKQSSDH,1.2214954,"K5C, L6M, V11A, K17Q, D30E, T51H, M74P, R95E",8
IEKFKLLAEKVEAIVAQNARAEIDYSDAPDEFKDPLMDTLMTDPVRLPSGTVMDRSIILRHLLNSQTDPFNRQMLTEDQLEPVPELKEQIQAWMKEKQSSRH,-1.4662223,"E13A, K17Q, R33K, P66Q, S78D, M79Q, R95K, D101R",8
IEQFKLLAEKSEEIVAKNARAAIDYSDAPEEFRDPLMDTLMTDPVRLPSGTVMDRSIILRHLLNSPTDPFNRQMLTESMLEPVPELKERIQAWMRSKQSSRI,-0.6231297,"K3Q, V11S, E22A, D30E, Q89R, E96S, D101R, H102I",8
MEKFKELAEKVEEIAAKNARAEIDLSDAPDEFRDPLMDTLMTDPVRLPSGTVADRSIILRHLLNSRTDPFNRQMLTESMLEPLPELKEQIQAWMREKLSSDH,-1.0970497,"I1M, L6E, V15A, Y25L, M53A, P66R, V83L, Q98L",8
IEKFALLAEKVEAVVAKNATAEIDYSDAPDEFRDPLMDTLMTDPVRLPSGTVMDRSIILRHLLNSPTDPFNRQELTESMLEPVVELKEQIQAWLREKQLSDH,0.9560568,"K5A, E13A, I14V, R20T, M74E, P84V, M94L, S99L",8
QERFKLLAEKVEEIVAPNARAEIDYSDAPDEFRDPLMDTLMTDPVKLPSGTVMDRSIILRHLLNSPTDPFNRQMLTESMLEPAPELKEKIQAWMREKQSSKT,-0.8339183,"I1Q, K3R, K17P, R46K, V83A, Q89K, D101K, H102T",8
IEKFKLLAEKVEELVAKNARMEVDYSDAPDEFRDPLMDTLMTDPVRLPSGTIMDRSIILRHLLNSPTDPFNRNMLTEDMLEPVPELKEQIQAWMREKLSSHH,0.01931688,"I14L, A21M, I23V, V52I, Q73N, S78D, Q98L, D101H",8
IEEFKLLAEKAEAIVAKQARAEVDYSDAPDEFRDPIMSTLMTDPVRLPSGTVMDRSIILRHLLNSPTDPFNRQMLTESMLEPVPELKEQIQAWMRKKQSSDH,0.3817542,"K3E, V11A, E13A, N18Q, I23V, L36I, D38S, E96K",8
IEKFKLLANKVEEIVAKNARMEIDYSDAPEEFRDPLMDTLMTDPVKLPSGNVMDRSIILRHLLNSPTDPFNRQPLTESMLEPVPELKEQIQAWTREKQSSRH,1.2528794,"E9N, A21M, D30E, R46K, T51N, M74P, M94T, D101R",8
IEKFKLLAGKVEEIAAGNARAEIDYSDAPDEFRDPLMDTLMTDPVKLPSGTVMDRSVILRHLLNSPTDPFNRQMLTEDMLEPVPELKERIQAWMREKQSSDD,0.40183783,"E9G, V15A, K17G, R46K, I57V, S78D, Q89R, H102D",8
IEKFKLLAEKVEAIVQKNAAAEIDYSDAPDEFRDPLMDTLMTDPVRLPSGRIMDRSIILRHLLNSPTDPFNRQALTESMLEPVPELKERIQAWMREKGSSDH,0.9028271,"E13A, A16Q, R20A, T51R, V52I, M74A, Q89R, Q98G",8
IEKFKLLAEKVEEIKAKNARAEIDYSDAPDEFRDRLMDTLMTDPVKLPSGTVMDRSVILRHLLNSPTDPFNRQMLTESMLEPVPELKDQIAEWMKEKQSSDH,-3.0411046,"V15K, P35R, R46K, I57V, E88D, Q91A, A92E, R95K",8
IEKFKLLAEKVEGAAAKNSRAEVDYSDAPDEFKDPLMDTLMTDPVRLPSGTVADRSIILRHLLNSPTDPFNRQMLTESMLEPVPELKEQIQAWMREKQSSTH,-0.91214544,"E13G, I14A, V15A, A19S, I23V, R33K, M53A, D101T",8
IEKFKLLAEKVEELVRKNARAETDYSDAPDEFRDPLMDTLMTDPVRLPSGTVMDRSVILRHLLNSPTDPFTRQMLTESMLEPVPELKERIQAWMAEKRSSDH,3.5359468,"I14L, A16R, I23T, I57V, N71T, Q89R, R95A, Q98R",8
IGKFKELAEKVEAIVAKNARAEIDYSDAPDEFKDPLMDTLMTDPVRLPSGTVMDRAIILRHLLNSPTDPFNRQMLTESMLAPVTELKEQIQAWMREKQSDDH,-0.13524476,"E2G, L6E, E13A, R33K, S56A, E81A, P84T, S100D",8
MSKFKELAEKVEEIVAANARNEIDYSDAPDEFRDPLMDTLMTDPVRLPSGNVMDRSIILRHLLNSPTDPFNRQMLTESMLEPAPELKERIQAWMREKQSSDH,-0.32364178,"I1M, E2S, L6E, K17A, A21N, T51N, V83A, Q89R",8
IEKFKYLANKVEEIVAKHARAEIDYSDAPDEFRDPLMDTLMNDPVRLPSGTVMDRSIILRHLLNSPTDPFNRQMLTESMLEPVTELKERIQAWMKEKQSSDD,-2.2631373,"L6Y, E9N, N18H, T42N, P84T, Q89R, R95K, H102D",8
IEKFALLAERVEEVVAHNARAEIDYSDAPDEFRDPLMDTLMTDPVRLPSGTVMDRSIILRHLLNSPTDPFNRQKLTESMLEPVPELKEQIQAWMREKQLVPH,0.025041843,"K5A, K10R, I14V, K17H, M74K, S99L, S100V, D101P",8
IEKFTLLAEKVEEIAAKQSRAEIDYSDAPDEFRDPLMDTLMVDPVKLPSGTVMDRSIIRRHLLNSPTDPFNRQMLTESMLEPVPELKEQIQAWRREKQSSDH,-1.0480173,"K5T, V15A, N18Q, A19S, T42V, R46K, L59R, M94R",8
IPRWKLLAEKVEEIVAKNAREEIDYADAPDEFRDPLMDTLMTDPVRLPSGTVMDRAIIQRHLLNSPTDPFNRQMLTESMLEPVPELKEQIQAWMREKQKSDH,0.4464498,"E2P, K3R, F4W, A21E, S26A, S56A, L59Q, S99K",8
IEKFKALAEKVEEIVRQNARAEEDYSDAPEEFRDPLMDTLMTDPVRLPSGTVMDRPIILRHLLNSPTDPFNRQSLTESHLEPVPELKEQIQAWMREKQSSDH,0.7301035,"L6A, A16R, K17Q, I23E, D30E, S56P, M74S, M79H",8
IEKFKKLAEKVEEIVEQNARAEIDLSDAPEEFRDPLMDTLMTDPVKLPSGTVMDRSIILRHLLNSKTDPFNRQMLTESMLEPVPELKEQIQAWMREKQSSSH,1.4931393,"L6K, A16E, K17Q, Y25L, D30E, R46K, P66K, D101S",8
YEKFKLLAEKAEELAAKNARAEIDEVDAPDEFRDPLMDTLMTDPVRLPSGTVMDRSIIMRHLLNSPTDPFNRQMLTESMLEPVPELKEQIQAWMREKQSSGH,1.1740673,"I1Y, V11A, I14L, V15A, Y25E, S26V, L59M, D101G",8
IEKFKLLAEKVDEIVAERARAEIDYSDAPDEFRDPLMDTLMTDPVRLPSGTVMDRSIILRHLLNSQTDPFNRQMLTENMLEPVPELKAQIQAWMREKMSSSH,-0.020419974,"E12D, K17E, N18R, P66Q, S78N, E88A, Q98M, D101S",8
IEKFKELTEKVEEIVLKNNFAETDYSDAPDEFRDPLMDTLMTDPVRLPSGHVMDRSIILRHLLNSPTDPFNRQMLTESMLEPVPELKEQIQAWMREKSSSDH,1.580144,"L6E, A8T, A16L, A19N, R20F, I23T, T51H, Q98S",8
IEKFKLLAEKVEEIAARNARAEIDYSDAPEEFRDPLMSTLMTDPVRLPSGTIMDRSIILRHLLNSSTDPFNRQMLTESMLEPVPELKEQIHAWMREKQSSNH,-1.0746648,"V15A, K17R, D30E, D38S, V52I, P66S, Q91H, D101N",8
IEKFKLLAEKMEAIAAKNARAEIDYSDAPDEFRDPLMDTLMTDPVRLPSGTVMDRSIILRHLLNSPTDPFNRQPLTESMLEPVPELKERIQAWIRSKQSSDL,0.3930376,"V11M, E13A, V15A, M74P, Q89R, M94I, E96S, H102L",8
IEKFKGLAEKVDEIVAKNTRAEIDYSDAPEEFRDPLMDTLMTDPVRLPSGTVMDRSVILRHLLNSPTDPFNRQMLTEDMLEPVPELKEKIQAWMREKQSADH,1.948091,"L6G, E12D, A19T, D30E, I57V, S78D, Q89K, S100A",8
MERFKALAEKVESIVAKNAAAEIDYSDAPDEFRDPIMDTLMTDPVRLPSGTVMDRSIILRHLLNSPTDPFNRQMLTESMLEPVPELKERIQAWVREKQSSDH,3.2983613,"I1M, K3R, L6A, E13S, R20A, L36I, Q89R, M94V",8
IEKFKLLAEKVEQIVAQEAADEIDYSDAPDEFRDPLMDTLMTDPVRLPSGTVMDRSIILRHLLNSPTDPFNRQMLTESMLEPVPELKEQIQAWMRNKQTSDK,0.56895006,"E13Q, K17Q, N18E, R20A, A21D, E96N, S99T, H102K",8
IEKFKLLSEKVEEIVRKNSRAQIDYSDAPDEFRDPLMDTLMTDPVRLPSGTVMDRSIILRHLLNSPTDPFNRQMLTEDMLEPLPELKEQIQAWLREKQSSDM,-0.5192746,"A8S, A16R, A19S, E22Q, S78D, V83L, M94L, H102M",8
VEKFKLLAEKVEEIVAKHQRAAIDYSDAPEEFKDPLMDTLMTDPVRLPSGTVMDRSVILRHLLNSPTDPFTRQMLTESMLEPVPELKEQIQAWMREKQSSDH,2.9899514,"I1V, N18H, A19Q, E22A, D30E, R33K, I57V, N71T",8
IEKFKLLAENVEEIVAKSVIAEIDYSDAPDEFRDPLMDTPMTDPVRLPSGTVMDRSVILRHLLNSPTDPFNRQMLTEDMLEPVPELKEQIQAWMREKQSSDF,-0.33175883,"K10N, N18S, A19V, R20I, L40P, I57V, S78D, H102F",8
IEKFKLLNEKVEEIVAKNARAEIDYSDAPEEFRDPLMDTLMTDPVRLPSGTVMDRSIILRHLLNSATDPFNRQPLTEDMLEPVPELKEQIQAWVREKMSSRH,2.009056,"A8N, D30E, P66A, M74P, S78D, M94V, Q98M, D101R",8
IEKFQLLAEKVEEIVAKNATAEVDYSDAPDEFKDPLMDTLMADPVRLPSGTVMDRCIILRHLLNSPTDPFNRQMLTESMLEPLPELKEQIQAWMREKQSSDK,-0.7212956,"K5Q, R20T, I23V, R33K, T42A, S56C, V83L, H102K",8
IEKFKLLAEKVEEVAAKNARAEADYSDAPDEFRDPLMDTLMTDPVRLPSGNVMDRSIILRHLLNSDTDPFNRAMLTESMLEPAPELKERIQAWMREKQSSDH,-0.4946819,"I14V, V15A, I23A, T51N, P66D, Q73A, V83A, Q89R",8
IEKFKLLAEKLDEIVAKNARAEIDYSDAPDEFRDPLMDTLMTDPVRLPSGNVMDRSVILRHLLNSPTDPFNRQMLTESMLEPLPELKERIQAWVREKQSRDH,-0.11800255,"V11L, E12D, T51N, I57V, V83L, Q89R, M94V, S100R",8
IEKFQLLAEKAEELLAKNLREEIDYSDAPDEFRDPLMSTLMTDPVRLPSGTVMDRSIILRHLLNSPTDPFSRQMLTESMLEPVPELKEQIQAWMREKQSSDH,-1.2750072,"K5Q, V11A, I14L, V15L, A19L, A21E, D38S, N71S",8
IERFKELAEKAEEIVAKNARAEIDYSDAPDEFRDPLMDTLMTDPVRLPSGKIMDRSVIMRHLLNSPTDPFNRQPLTESMLEPVPELKEQIQAWMREKQSSDH,0.8602562,"K3R, L6E, V11A, T51K, V52I, I57V, L59M, M74P",8
AEKFKELAEKVEELVALNARAEIDLSDAPDEFRDPLMDTLMTDPVRLPSGTVMDRSIILRHLLNSETDPFNRQMLSESMLEPAPELKEQIQAWMREKQSSDH,-0.92651695,"I1A, L6E, I14L, K17L, Y25L, P66E, T76S, V83A",8
MYKFKELAEKVNEIVAKNAREDIDYSDAPDEFRDPLMDTLMTDPVRLPSGTVMDRSIILRHLLNSPTDPFNRQMLTESMLEPVPELKEQIQAWMRGKQSSDG,-1.3396163,"I1M, E2Y, L6E, E12N, A21E, E22D, E96G, H102G",8
MEKFKVLCEKVEEVVAANAAAEIDYSDAPDEFRDPLMDTLMTDPVRLPSGNVMDRSIILRHLLNSPTDPFNRQMLTEEMLEPVPELKEQIQAWMREKQSSDH,1.245306,"I1M, L6V, A8C, I14V, K17A, R20A, T51N, S78E",8
IEEFKVLKEKVEQIVAKNAAAEIDYSDAPDEFRDPLMDTLMTDPVRLPSGTIMDRSIILRHLLNSPTDPFNRQMLTESMLEPVPELKEKIQAWMREKQGSDH,0.88285476,"K3E, L6V, A8K, E13Q, R20A, V52I, Q89K, S99G",8
IEKFKLLNEKIEEIVAKAARAEIDYSDAPDEFRDPLMDTLMVDPVRLPSGTVMDRSIIMRHLLNSPTDPFNRSMLTEDMLEPVPELKEQIQAWMREKQSSSH,0.7807917,"A8N, V11I, N18A, T42V, L59M, Q73S, S78D, D101S",8
IEKFKLLADRVSEIVAKNARAEIDYSDAPDEFRDPLMGTLMTDPVRLPSGHVMDRPIILRHLLNSPTDPFNRQMLTQSMLEPVPELKEQIQAWMREKQSSRH,-1.9709054,"E9D, K10R, E12S, D38G, T51H, S56P, E77Q, D101R",8
