Sequence,Score,Mutations,Number of Mutations
MEKFKLLAEKVEEIVAKNAHSEIDYSDAPEEFRDPLMLTLMTDPVKLPSGTVMDRSIILRHLLNSPTDPFNRQMLTEDMLEPVPELKEQINAWMREKQSSDH,0.72500575,"I1M, R20H, A21S, D30E, D38L, R46K, S78D, Q91N",8
MDKFKLLAQKVEEIEAKNARAEIDYSDAPDEFKDPLMDTLMTDPVKLPSGTVMDRSAILRHLLNSPTDPFNRQMLTESMLEPAPELKEQIQAWMREKQSSDH,-0.77736914,"I1M, E2D, E9Q, V15E, R33K, R46K, I57A, V83A",8
MEKFKLLAEKVEEIAAKAARAEIDYSDAPDEFRDPLMDTLMTDPVKLPSGTVMDRSIILRHLLNSPTDPFNRQMLTESMLEPVPELKEQIQAWIAEKQARDH,0.68333566,"I1M, V15A, N18A, R46K, M94I, R95A, S99A, S100R",8
IEKFKLLRTQVEEIVNKHAVAEIDYSDAPDEFRDPLMDTLMTDPVRLPSGTVMDRSIILRHLLNSPTDPFNRQMLTESMLEPAPELKEKIQAWMREKQSSDH,-0.8126924,"A8R, E9T, K10Q, A16N, N18H, R20V, V83A, Q89K",8
IEKFKELAARVEEIVAKNARAEIDYSDAPDEFLDPLMDTLMTDPVRLPSGTVMDRSVILRHLLNSPTDPFNRQPLTEEMLEPVPELKEQIQAWMREKVSSDH,1.0686214,"L6E, E9A, K10R, R33L, I57V, M74P, S78E, Q98V",8
VEKFKALAEKVEEIAAKNARAEIDYSDAPDEFRDPLMDTLMTDPVRLPSGTVMDRSIILRHLLNSPTDPFNRQPLTEDMLQPVPELKEQIQAWMREKLSKDH,0.67100346,"I1V, L6A, V15A, M74P, S78D, E81Q, Q98L, S100K",8
IEKFKLLAEKAEEIVAKNADAEIDYDDAPDEFRDPIMDTLMTDPVRLPSGTVMDRSIILRHLLNSSTDPFNRQMLTESMLEPVPELKEQIQAWIREKQSARH,3.7963767,"V11A, R20D, S26D, L36I, P66S, M94I, S100A, D101R",8
IEKFKVLAEKVDEVVAKNARAEIDYSDAPDEFRDPLMDTLMTDPVRLPSGTVMDRSIILRHLLNSPTDPFTRQMLTESMLEPVPELKEQIVAWMNEKQSSVS,1.4271983,"L6V, E12D, I14V, N71T, Q91V, R95N, D101V, H102S",8
IEKFKSLAEKVEEIVAKNARDEIDYSDAPDEFRDPLMDTLMTDPVRLPSGTVMDRSIILRHLLNSPTDPFNRSMLTEDMLEPVPELKEQIQAWKRTKGSSDT,1.3496181,"L6S, A21D, Q73S, S78D, M94K, E96T, Q98G, H102T",8
MEKFKLLATKCEEIVAKAARAEIDYSDAPDEFRDPLMDTLMTDPVRLPSGTVMDRPIILRHLLNSPTDPFNRQPLTESMLEPSPELKEQILAWMREKQSSDH,0.33787036,"I1M, E9T, V11C, N18A, S56P, M74P, V83S, Q91L",8
IESFKNLAEKVEEIVNKNAQAEIDYSDAPDEFKDPLMSTLMTDPVRLPSGTVMDRSIILRHLLNSPTDPFNRQMLTESMLEPVPELKEKIQAWMREKQSSDA,0.4771979,"K3S, L6N, A16N, R20Q, R33K, D38S, Q89K, H102A",8
IEKFKELAEKVEEVVAKNARAEVDYSDAPDEFRDPLMDTLMTDPVRLPSGTVMDRSIILRHLLNSQTDPFNREMLTISMLEPVPELKEQIQYWMREKLSSDH,-1.7511947,"L6E, I14V, I23V, P66Q, Q73E, E77I, A92Y, Q98L",8
IEKFKLLAERVETIVANNARAEIDYSDAPDEFRDALMDTLMTDPVRLPSGTVMDRSIILRHLLNSPTDPFNRQMLTESMLEPVPELKEQINAWMRNKQRSDE,-2.5253508,"K10R, E13T, K17N, P35A, Q91N, E96N, S99R, H102E",8
IEKFKLLAKKVEEIAAKNARAEIDLSDAPDEFRDPLMDTLMTDPVKLPSGTVMDRSIILRHLLNSPTDPFNRQMLTEDMLEPVPELKEQIQAWMRKKQSVKH,0.80277145,"E9K, V15A, Y25L, R46K, S78D, E96K, S100V, D101K",8
IEKFKLLQEKVEEIASKNAEAEVDYSDAPDEFRDPLMNTLMTDPVRLPSGTVMDRPIILRHLLNSPTDPFNRQMLTESMLEPVPELKEQIQAWMREKQSSNH,-1.3460276,"A8Q, V15A, A16S, R20E, I23V, D38N, S56P, D101N",8
IDKFALLAEKVEELVAKNQRAEIDYSDAPDEFRDPLMDTLMQDPVRLPSGTVMDRSVILRHLLNSPTDPFNRQMLTESMLEPVPELKEQIQAWMREKTSKDH,0.9345125,"E2D, K5A, I14L, A19Q, T42Q, I57V, Q98T, S100K",8
MEKFKLLCEKVEEVAAKNARAEIDYSDAPEEFRDPLMDTLMTDPVKLPSGTVMDRSVILRHLLNSPTDPFNRQMLTESMLEPVPELKEQIQAWMREKQSADH,1.1959344,"I1M, A8C, I14V, V15A, D30E, R46K, I57V, S100A",8
MEKFKLLAEKAETIVAKNAAAEIDYSDAPDEFKDPLMDTLMTDPVRLPSGNVMDRSIILRHLLNSPTDPFNRQMLTESMLEPVPELKEQIQAWMRHKQSSAH,-0.6080237,"I1M, V11A, E13T, R20A, R33K, T51N, E96H, D101A",8
IEKFKQLAEKVEEMEAKRARAEIDKSDAPDEFRDPLMNTLMTDPVRLPSGTVMDRSIILRHLLNSPTDPFNRQMLTESMLEPLPELKAQIQAWMREKQSSDH,-1.7472497,"L6Q, I14M, V15E, N18R, Y25K, D38N, V83L, E88A",8
MEKFKLLAEKVEEIVAKNARAEIDYSDAPDEFRDPLMDTLMTDPVRLPSGTVMDRSVILRHLLNSSTDPFSRQSLTESMLEPVPELKEQIRAWIREKLSSDH,-0.6976328,"I1M, I57V, P66S, N71S, M74S, Q91R, M94I, Q98L",8
MEKFKLLAEKVEQIVAKNARQEIDVSDAPEEFRDPLMDTLMTDPVRLPSGTVMDRSIILRHLLNSPTDPFNRQMLTEDMLEPVPELKEQIEAWMREKQSSPH,0.246761,"I1M, E13Q, A21Q, Y25V, D30E, S78D, Q91E, D101P",8
IEKFKLLAEKVEEVVSQNARAEIDYSDAPDEFRDPLMDTLMTDPVRLPSGNVMDRSIILRHLLNSPTDPFNRQPLTEDMLEPVPELKEQIQEWMREKLSSDH,-0.13585858,"I14V, A16S, K17Q, T51N, M74P, S78D, A92E, Q98L",8
IEKFKALMEKVEEIVAKNARAEIDFSDAPDEFRDPLMDTLMTDPVRLPSGTVMDRSIILRHLLNSPTDPFNRQMLTEDMLEPVPELKEQIQAWMKEKMSRRH,-1.144666,"L6A, A8M, Y25F, S78D, R95K, Q98M, S100R, D101R",8
IEKFKLLNEKVEEVAAKHHRAEIDYSDAPDEFRDPLMDTLMTDPVRLPSGTVMDRAIILRHLLNSPTDPFNRQMLTESMLEPVPELKEQIQAWLREKQSKDH,1.0336578,"A8N, I14V, V15A, N18H, A19H, S56A, M94L, S100K",8
IEKFKILAEKVEEIQAKAALAEIDYSDAPDEFKDPLMDTLMTDPVRLPSGTVMDRSIILRHLLNSPTDPFNRQMLTESMLEPVPELKLQIQAWMKEKQSLDH,-0.42674732,"L6I, V15Q, N18A, R20L, R33K, E88L, R95K, S100L",8
IAKFKLLSEKCEEIVAQNARAEIDFSDAPDEFRDPLMDTLMTDPVRLPSGTVMDRSIILRHLLNSPTDPFNRQMLTEDMLEPVPELKEQIQAWMRQKQSSPH,-0.59855074,"E2A, A8S, V11C, K17Q, Y25F, S78D, E96Q, D101P",8
MEKFKLLAEKVEEINAKNNRADIDYSDAPEEFRDPLMDTLMTDPVRLPSGKIMDRSIILRHLLNSPTDPFNRQMLTESMLEPVPELKEQIQAWMKEKQSSDH,-0.7403107,"I1M, V15N, A19N, E22D, D30E, T51K, V52I, R95K",8
IAKFKLLAEKVEEIAQKNARAEIDYSDAPDEFRDPLMSTLMTDPVRLPSGTVMDRSIILRHLLNSPTDPFTRQQLTESMLEPVPELKEQIQAWIKEKQSSDH,-0.49286294,"E2A, V15A, A16Q, D38S, N71T, M74Q, M94I, R95K",8
LEKFKLLAEKVEEIAAKNARAEIDLSDAPDEFRDPIMDTLMTDPVRLPSGHVMDRSVILRHLLNSPTDPFNRQMLTESMLEPVVELKEQIQAWMREKLSSDH,3.5760818,"I1L, V15A, Y25L, L36I, T51H, I57V, P84V, Q98L",8
IEKFKLLAEKVEEVVASNAEAEIDLSDAPDEFRDPLMDTLMTDPVRLPSGVVMDRKIILRHLLNSPTDPFNRQMLTESMLEPAPELKEQIQAWMREKQSTDH,0.08128699,"I14V, K17S, R20E, Y25L, T51V, S56K, V83A, S100T",8
IEKLCTLAEKVEEIVAKNARAEVDYSDAPDEFRDPLMDTLMTDPVRLPSGTIMDRSIILRHLLNSPTDPFNRQMLTESMLEPVPELKEKIQAWIREKQASDH,1.4281584,"F4L, K5C, L6T, I23V, V52I, Q89K, M94I, S99A",8
IEKFKLLAEKVEEIVNKNARAEVDYSDAPDEFRDPIMDTLMTDPVRLPSGTTMDRSIILRHLLNSETDPFNRQMLTESMLEPAPELKEQIQAWIREKVSSDH,2.3800483,"A16N, I23V, L36I, V52T, P66E, V83A, M94I, Q98V",8
IEKFKQLASKVEEIVAKNTRAEIDYSDAPDEFKDPLMDTLMTDPVRLPSGTVMDRSIILRHLLNSPTDPFNRQPLTESMLEPVPELKEQIQEWMRGKVSSDH,1.0615097,"L6Q, E9S, A19T, R33K, M74P, A92E, E96G, Q98V",8
IEKFKLLAEKCEEIVAKNARAEIDYSDAPDEFRDPLMDTLMTDPVKLPSGTIMDRSIILRHLLNSPTDPFNRQMLTKDMLEPVPELKERIQAWMREKVSSAH,0.1824596,"V11C, R46K, V52I, E77K, S78D, Q89R, Q98V, D101A",8
GEKFKLLCEKVEQIVAKNSRAEIDYSDAPEEFRDPLMDTLMTDPVRLPSGTVMDRSIILRHLLNSPTDPFNRQPLTESMLEPVPELKEQIQAWMREKQSSCA,0.2144289,"I1G, A8C, E13Q, A19S, D30E, M74P, D101C, H102A",8
IEKFKLLAEKVDEIVAKNARAEIDYSDAPDEFRDPLMDTLMSDPVRLPSGTVVDRSVILRHLLNSPTDPFNRQPLTESMLEPVPELKERIQAWMREKPSSDN,3.4364047,"E12D, T42S, M53V, I57V, M74P, Q89R, Q98P, H102N",8
MERFKLLCEKVEEIVAKNQRAEIDYSDAPDEFRDPLMDTLMTDPVKLPSGTVMDRSVILRHLLNSPTDPFNRQMLTESSLEPVPELKERIQAWMREKQSSDH,-0.8940445,"I1M, K3R, A8C, A19Q, R46K, I57V, M79S, Q89R",8
IEKFKLLAEKVEHIVAKNARAEIDYGDAPEEFRDPLMDTLMTDPVRLPSGTVMDRSVILRHLLNSPTDPFNRQMLTESMLEPVPELKERINAWMQEKQISDH,1.0760922,"E13H, S26G, D30E, I57V, Q89R, Q91N, R95Q, S99I",8
IEKFKLLAEKVEQIVARNAREEIDYSDAPDEFRDPLMDTLMTDPVRLPSGTVMDRSIIMRHLLNSQTDPFNRQMLTESMLEPAPELKEQIQAWMREKQSRDR,-0.8266705,"E13Q, K17R, A21E, L59M, P66Q, V83A, S100R, H102R",8
MEKFKSLTEKVEEIVAKNAREEIDYSDAPEEFRDPLMDTLMTDPVKLPSGTVMDRSIILRHLLNSPTDPFNRQMLTESMLEPVPELKEQIQAWRREKQSSQH,1.5634972,"I1M, L6S, A8T, A21E, D30E, R46K, M94R, D101Q",8
MEKFKLLREKMEEIVAKNARDETDYSDAPEEFRDPLMDTLMTDPVRLPSGTIMDRSVILRHLLNSPTDPFNRQMLTESMLEPVPELKEQIQAWMREKQSSDH,1.3793523,"I1M, A8R, V11M, A21D, I23T, D30E, V52I, I57V",8
IEKFCLLAKKCEEVVAKNARMEIDYSDAPEEFRDPLMDTLMTDPVRLPSGTVMDRSIILRHLLNSPTDPFNRQMLTESMLEPVPELKEQIQAWMREKLSSTH,0.06990534,"K5C, E9K, V11C, I14V, A21M, D30E, Q98L, D101T",8
IEKFKELGEKAEGIVARNARAEIDYSDAPDEFRDPLMDTLMTDPVRLPSGTVMDRSIILRHLLNSPTDPFNRQMLTESMLEPVPELKEQIEAWMQEKQTSDH,-0.12823121,"L6E, A8G, V11A, E13G, K17R, Q91E, R95Q, S99T",8
IEKVKLLAETVQEIVAKNAIAEIDVSDAPDEFRDPLMDTLMTDPVRLPSGTVMDRSIILRHLLNSPTDPFNRQTLTESMLEPVPELKEQIQAWMQEKQSSSH,-0.540455,"F4V, K10T, E12Q, R20I, Y25V, M74T, R95Q, D101S",8
MEKFKLLAEKVEEITAKNAMAEIDYSDAPDEFRDPLMDTLMTDPVRLPSGHVMDRSIILRHLLNSPTDPFSRQMLTESMLEPVPELKEQIQAWLREKGLSDH,0.4507308,"I1M, V15T, R20M, T51H, N71S, M94L, Q98G, S99L",8
VEKFKQLAEKVEEIVAKNARAEIDYSDAPEEFRDPLMDTLMVDPVRLPSGTVMDRSVILRHLLNSPTDPFNRAMLTESMLEPVVELKEQIAAWMREKQSSDH,1.1586449,"I1V, L6Q, D30E, T42V, I57V, Q73A, P84V, Q91A",8
IEAFKLLAEKVEEIAAKNAREEIDYSDAPDEFKDPLMDTLMTDPVRLPSGTVMDRSVILRHLLNSPTDPFNRQMLTESMLEPAPELKERIQAWMREKQGSDH,0.70728725,"K3A, V15A, A21E, R33K, I57V, V83A, Q89R, S99G",8
IEKFKLLNEKVEEIVAKQAKMEIDYSDAPEEFRDPLMDTLMTDPVRLPSGHVMDRSIILRHLLNSPTDPFNRSMLTENMLEPVPELKEQIQAWMREKQSSDH,1.2875721,"A8N, N18Q, R20K, A21M, D30E, T51H, Q73S, S78N",8
IEKFKTLAEKVEEIVAKNARAEIDVSDAPDEFRDPLMNTLMTDPVRLPSGTVMDRSIIVRHLLNSPTDPFNRQMLTESMLEPVPELKEQIQDWMRTKISSDK,-1.6437407,"L6T, Y25V, D38N, L59V, A92D, E96T, Q98I, H102K",8
IEGFKLLCEKVEMIVAKNARAEIDYSDAPDEFRDPLMDTLMTDPVRLPSGTVMDRSIILRHLLNSPTDPFNRQPLTESMLEPVVELKERIQAWMREKQSSKS,0.38403288,"K3G, A8C, E13M, M74P, P84V, Q89R, D101K, H102S",8
ISKFKLLAEKVEEVVAKNARAEIDYTDAPDEFRDPLMDTLMTDPVKLPSGNVMDRSIILRHLLNSPTDPFNRQPLTESMLEPCPELKEQIQAWIREKQSSDH,0.32395652,"E2S, I14V, S26T, R46K, T51N, M74P, V83C, M94I",8
IEKFKLLAEKFEEIVARNNKAEVDYSDAPDEFRDPLMDTLMTDPVRLPSGTVMDRSIILRHLLNSPTDPFNRQKLTESMLEPVPELKEKIQAWMREKQTSDH,0.84504986,"V11F, K17R, A19N, R20K, I23V, M74K, Q89K, S99T",8
IERFALLCEKVEQISAANARAEIDYSDAPDEFRDPLMDTLMTDPVRLPSGTVMDRSIILRHLLNSPTDPFNRQMLTESMLEPVPELKEQIQAWRREKQSSDM,0.31795698,"K3R, K5A, A8C, E13Q, V15S, K17A, M94R, H102M",8
IEKFKLLAEKVEEIAASKARAEIDLSDAPDEFRDPLMDTLMTDPVRLPSGTVMDRSIILRHLLNSPTDPFNRQMLTESMLEPATELKEQIQAWMREKQQHDH,-1.0047745,"V15A, K17S, N18K, Y25L, V83A, P84T, S99Q, S100H",8
AEKLRLLAEKVEEIVAENAAAEIDYSDAPDEFRDPLMCTLMTDPVRLPSGTVMDRSVILRHLLNSPTDPFNRQELTESMLEPVPELKEQIQAWMREKQSSDH,1.3533688,"I1A, F4L, K5R, K17E, R20A, D38C, I57V, M74E",8
IERFKLLAEKATEIVAKNARAEIDYSDAPDEFRDPLMDTLMTDPVRLPSGTVMDRAVILRHLLNSPTDPFNRQMLTEKMLEPVVELKEQIQAWMREKQSSDN,1.0521399,"K3R, V11A, E12T, S56A, I57V, S78K, P84V, H102N",8
IEKFKLLGEKVEEIVAKNAAEEIDYGDAPDEFRDPIMDTLMTDPVRLPSGTVMDRSIILRHLLNSPTDPFSRQPLTESMLEPVPELKEQIQAWRREKQSSDH,3.455223,"A8G, R20A, A21E, S26G, L36I, N71S, M74P, M94R",8
IEKFKLLAAKVEEILAKNARAEIDVSDAPEEFRDPLMDTLMTDPVKLPSGTVMDRSIILRHLLNSHTDPFNRSMLTESMLEPVPELKEQIQAWMREKQSSGH,-1.4370145,"E9A, V15L, Y25V, D30E, R46K, P66H, Q73S, D101G",8
IEKFSALAEKVEEIVAKNAAAEIDYSDAPDEFRDPLMDTLMTDPVRLPSGTVMDRSIILRHLLNSPTDPFNRQMLTESMLETVPELKERIQAWVREKRTSDH,0.4827484,"K5S, L6A, R20A, P82T, Q89R, M94V, Q98R, S99T",8
IEKFKLLAEKVEEIVAQNAREEIDYSDAPDEFKDPLMDTLMTDPVKLPSGTVMDRPIILRHLLNSQTDPFNRQMLTEDMLEPVPELKEQIQAWMREKQKSDH,1.6467392,"K17Q, A21E, R33K, R46K, S56P, P66Q, S78D, S99K",8
IRNFSLLAEKVEEIVAKNARAEIDYSDAPDEFRDPLMDTLMTDPVRLPSGTIMDRSVILRHLLNSPTDPFNRQMLTESMLEPVPELKEQIQAWMRQKQSLDI,0.60950214,"E2R, K3N, K5S, V52I, I57V, E96Q, S100L, H102I",8
IEKFKLLAEKVEEVVARNARAEIDYSDAPEEFRDPLMDTLMTDPVRLPSGTVMDRSIILRHLLNSPTDPFNRQALTESMLEPAPELKEQIEAWMKEKQSSDQ,-1.6383411,"I14V, K17R, D30E, M74A, V83A, Q91E, R95K, H102Q",8
IEKFKLLAQKCEEIVAKSARAEIDYSDAPEEFRDPLMNTLMTDPVRLPSGTVMDRSIILRHLLNSPTDPFNRQMLTESMLEPVPELKEQIQTWIREKVSSDH,-0.96687335,"E9Q, V11C, N18S, D30E, D38N, A92T, M94I, Q98V",8
IEKFALLAEKVEEIVAKNARAEVDYSDAPDEFRDPLMNTLMTDPVRLPSGTVMDRSVILRHLLNSPTDPFNRQMLTESMLEPVPELKEQIQAWIREKQRADR,-1.3945822,"K5A, I23V, D38N, I57V, M94I, S99R, S100A, H102R",8
IEKFKLLAEKVDEIVAKNVMAEIDYSDAPEEFRDPLMSTLMTDPVRLPSGHVMDRSIILRHLLNSPTDPFNRQMLTESMLEPVPELKEQIQAWMREKLHSDH,0.2587577,"E12D, A19V, R20M, D30E, D38S, T51H, Q98L, S99H",8
IEKFKLLEHKVEELVASNAEAEIDYSDAPDEFRDPLMDTLMTDPVRLPSGNIMDRSIILRHLLNSPTDPFNRQMLTESMLEPVPELKEQIQAWMREKQSVDH,1.733844,"A8E, E9H, I14L, K17S, R20E, T51N, V52I, S100V",8
IEKFKLLNVKVEEIMAKNARAEIDYSDAPEEFRDPLMDTLMTDPVRLPSGTVMDRSIILRHLLNSPTDPFNRQMLTEDMLEPVPELKEQIVAWMREKQLCDH,0.2706644,"A8N, E9V, V15M, D30E, S78D, Q91V, S99L, S100C",8
IEKFKLLTEKVEELVAKNARAEIDLSDAPDEFRDRLMDTLMTDPVRLPSGTIMDRSIILRHLLNSPTDPFNRQMLTESMLEPVPELKEKIQAWMREKQNSDK,-2.470457,"A8T, I14L, Y25L, P35R, V52I, Q89K, S99N, H102K",8
IEKFKLLAQRVEEIAAKNQRAEIDYSDAPDEFKDPLMDTLMTDPVRLPSGTVMDRSIILRHLLNSPTDPFNRQMLTEDMLEPVPELKEQIQAWIREKQKSDH,1.3349096,"E9Q, K10R, V15A, A19Q, R33K, S78D, M94I, S99K",8
IEKFKLLAAKVEEIVAKNARAEIDYSDAPDEFRDPLMDTLMTDPVRLPSGTIMDRSIILRHLLNSPTDPFNRQMLTESMLEPVPELKEQIEAWLEKKQSSHL,-0.043293193,"E9A, V52I, Q91E, M94L, R95E, E96K, D101H, H102L",8
IEKFKLLAEKVEAIAAQNAREEIDYSDAPDEFLDPLMDTLMTDPVRLPSGKVMDRSIILRHLLNSPTDPFNREPLTESMLEPVPELKEQIQAWMREKQSSDH,-0.059845068,"E13A, V15A, K17Q, A21E, R33L, T51K, Q73E, M74P",8
IEKFKELAEKVELIAAKNARAEIDYSDAPDEFRDPLMDTLMTDPVKLPSGTVMDRKIIMRHLLNSPTDPFNRQPLTESMLEPVPELKEQIQAWMQEKQSSDH,0.8054576,"L6E, E13L, V15A, R46K, S56K, L59M, M74P, R95Q",8
IAEFKLLAEKVEEIVAKNRMAEIDSSDAPDEFRDPLMDTLMTDPVRLPSGTVMDRSIILRHLLNSPTDPFNRQMLTESMLEPVPELKEQIQAWVREKKSKDH,0.8115474,"E2A, K3E, A19R, R20M, Y25S, M94V, Q98K, S100K",8
IEKFKRLAVQVEEIVAKNASAEIDYSDAPDEFRDPLMDTLMTDPVRLPSGTVMDRTVILRHLLNSPTDPFNRQMLTESMLEPVPELKEKIQAWMREKASSDH,-0.0008771159,"L6R, E9V, K10Q, R20S, S56T, I57V, Q89K, Q98A",8
MEKFKLLAEKAEEIVAKNARAEIDLSDAPEEFRDPVMCTLMTDPVRLPSGTVMDRSIILRHLLNSPTDPFNRQMLTESMLEPVPELKEQIQAWMRKKQSSTH,-0.17330697,"I1M, V11A, Y25L, D30E, L36V, D38C, E96K, D101T",8
IEKFKLLAEKVEEIAAANARIEIDLSDAPDEFRDPLMDTLMTDPVRLPSGTVMDRSIILRHLLNSPTDPFNRQMLTEDMLEPVPELKEQIQAWKREKRLSDH,1.7179681,"V15A, K17A, A21I, Y25L, S78D, M94K, Q98R, S99L",8
IEKFKLLCNKVEEIVAKNNRKEIDYSDAPDEFRDPLMDTLMTDPVRLPSGTVMDRSVILRHLLNSPTDPFNRQMLTESMLEPVPELKEQIQAWIREKAGSDH,2.122675,"A8C, E9N, A19N, A21K, I57V, M94I, Q98A, S99G",8
IEKFKLLAEKVEEIVAKNNRNEIDYSDAPDEFRDPIMDTLMTDPVRLPSGTVMDRSIITRHLLNSPTDPFNRQPLTESMLEPVTELKEQIQAWMRNKLSSDH,2.468053,"A19N, A21N, L36I, L59T, M74P, P84T, E96N, Q98L",8
IEKFKLLQTKSEEIAAKNMVAEIDYSDAPDEFRDPLMDTLMTDPVRLPSGTVMDRSIILRHLLNSPTDPFNRQMLTESMLEPVPELKEQIQAWMREKTDSDH,2.5598936,"A8Q, E9T, V11S, V15A, A19M, R20V, Q98T, S99D",8
IEKFKLLAKKVEEIAAKNARFEIDYSDAPDEFRDPLMDTLMTDPVRLPSGTVMDRAVILRHLLNSPTDPFNRQMLTESMLEPLPELKEKIQAWMREKQSSDA,1.1465551,"E9K, V15A, A21F, S56A, I57V, V83L, Q89K, H102A",8
INKFKLLGEKLEEIVASNAREEMDYSDAPDEFLDKLMDTLMTDPVRLPSGTVMDRSIILRHLLNSPTDPFNRQMLTESMLEPVPELKEQIQAWMREKQSSDH,0.7037432,"E2N, A8G, V11L, K17S, A21E, I23M, R33L, P35K",8
IEKFKLLAAKVDEIVAKNARAEVDYSDAPEEFRDPLMDTLMTDPVRLPSGHVMDRSIILRHLLNSPTDPFNRQMLTESMLEPAPELKERIQAWMRENQSSDH,0.3290245,"E9A, E12D, I23V, D30E, T51H, V83A, Q89R, K97N",8
IEKFKLLAHRVEEIVQKKARAEIDYSDAPDEFRDPIMDTLMTDPVRLPSGTVMDRSIILRHLLNSPTDPFNRQMLTESMLESVPELKEQIQAWMREKQGSLH,1.1688699,"E9H, K10R, A16Q, N18K, L36I, P82S, S99G, D101L",8
IEQFKLLKEKNEEIVAKAARAEIDYSDAPDEFRDPLMDTLMTDPVRLPSGTVMDRSIIVRHLLNSPTDPFNRQMLTEDMLEPVVELKEQIQAWMREKNSSDH,0.58259696,"K3Q, A8K, V11N, N18A, L59V, S78D, P84V, Q98N",8
IERFKLLAEKVEEIVAKNAYAEIDYSDAPEEFKDPLMDTLMTDPVRLPSGKVMDRSIILRHLLNSPTDPFNREMLTESMLEPVPELKERIQAWMREKASSDH,-0.49471056,"K3R, R20Y, D30E, R33K, T51K, Q73E, Q89R, Q98A",8
IEKFKLLAEKAEEIVAKNQLAEIDYSDAPDEFRDPLMDTLMTDPVRLPSGTVMDRSIIQRHLLNSPTDPFNRQMLTEDMLEPVPELKERIQAWMREKESSDT,1.7614896,"V11A, A19Q, R20L, L59Q, S78D, Q89R, Q98E, H102T",8
IEKFALLAEKVEKIVAKNAREEIDLSDAPDEFRDPLMDTLMTDPVRLPSGTVMDRSVILRHLLNSPTDPFNRQMLTEDMLEPVPELKEQIQAWMREKQSRDA,1.3154027,"K5A, E13K, A21E, Y25L, I57V, S78D, S100R, H102A",8
IEKFKLLAEKCESIVAENKRAEIDYGDAPEEFRDPLMDTLMTDPVRLPSGTVMDRSIILRHLLNSPTDPFNRQMLTEEMLEPVPELKEQIDAWMREKQSSDH,2.66713,"V11C, E13S, K17E, A19K, S26G, D30E, S78E, Q91D",8
IEKFKELAEKVEEIAAKNARAEVDYSDAPDEFRDPLMDTLMTDPVRLPSGTVMDRSIILRHLLNSNTDPFNRQMLTESMLIPVPELKEKIQAWMMEKQSGDH,0.19844827,"L6E, V15A, I23V, P66N, E81I, Q89K, R95M, S100G",8
MEKFKALVEKVEEIVAKNARADMDYSDAPDEFRDPLMDTLMTDPVRLPSGTVMDRPIILRHLLNSPTDPFTRQMLTESMLEPVPELKEQIQAWMRSKQSSDH,2.9246657,"I1M, L6A, A8V, E22D, I23M, S56P, N71T, E96S",8
MEKFKLLAEKVDLIVAKNMRAEIDYSDAPEEFRDPLMDTLMTDPVRLPSGNVMDRSIILRHLLNSPTDPFNRQMLTEDMLEPVPELKEQIQAWMREKQSTDH,1.1241225,"I1M, E12D, E13L, A19M, D30E, T51N, S78D, S100T",8
KEKIKLLAEKVEEIVAARARAEIDYSDAPDEFRDPIMDTLMTDPVRLPSGTVMDRSIILRHLLNSPTDPFNRQLLTEDMLESVPELKEQIQAWMREKQSSDH,3.010759,"I1K, F4I, K17A, N18R, L36I, M74L, S78D, P82S",8
VEKFKLLAEKVEEIVAKNVKSEIDYSDAPDEFRDPLMDTLMTDPVRLPSGTVMDRSVILRHLLNSPTDPFNRQPLTEDMLEPVPELKEQIQAWMREKQSSDL,0.8579782,"I1V, A19V, R20K, A21S, I57V, M74P, S78D, H102L",8
MEKFKLLAEKVEEINAQNARAEIDYSDAPDEFRDPLMDTLMVDPVRLPSGNVMDRAIILRHLLNSPTDPFTRQMLTESMLEPVRELKEQIQAWMREKQSSDH,2.0655966,"I1M, V15N, K17Q, T42V, T51N, S56A, N71T, P84R",8
MEKFKLLAEKVKEIVAKNARDEIDYSDAPDEFKDPLMDTLMTDPVRLPSGTIMDRSIILRHLLNSPTDPFNRQMLTESMLEPAAELKEQIQAWMREKMSSDH,-0.49511778,"I1M, E12K, A21D, R33K, V52I, V83A, P84A, Q98M",8
IEKFKLLAEKVEEINAKNAREEIDYSDAPDSFRDPVMDTLMTDPVRLPSGTVMDRSIILRHLLNSPTDPFNRQMLTEDMLEPLPELKAQIQAWMREKQSSDT,1.3725946,"V15N, A21E, E31S, L36V, S78D, V83L, E88A, H102T",8
ISKFKLLAEKAEEVVAKNHRAEIDLSDAPDDFRDPLMDTLMTDPVRLPSGTVMDRSIILRHLLNSPTDPFNRQMLTESMLEPVPELKEQIQAWMQEKQLSDH,-0.009947974,"E2S, V11A, I14V, A19H, Y25L, E31D, R95Q, S99L",8
IEKFKLLAEKVEEIAAKNARAEIDYDDAPLEFRDPIMDTLMTDPVRLPSGTVMDRSIILRHLLNSPTDPFNRQHLTEDMLEPVPELKEKIQAWMREKQQSDH,5.058938,"V15A, S26D, D30L, L36I, M74H, S78D, Q89K, S99Q",8
IEKFKLLGEKVEEIFARNLRAEIDMGDAPDEFRDPLMDTLMTDPVRLPSGTIMDRSIILRHLLNSPTDPFNRQMLTESMLEPVPELKEKIQAWMREKQSSDH,1.6219751,"A8G, V15F, K17R, A19L, Y25M, S26G, V52I, Q89K",8
IEKFKLLAERVEEIAAKNAAAEIDLSDAPDEFRDPLMDTLMTDPVKLPSGNVMDRSIILRHLLNSPTDPFNRQMLTESMLEPVVELKEQIQAWMREKQSSDK,1.255877,"K10R, V15A, R20A, Y25L, R46K, T51N, P84V, H102K",8
MEKWKLLKRKVEELLAKNLRAEIDYSDAPDEFRDPLMDTLMTDPVRLPSGTVMDRSIILRHLLNSPTDPFNRQMLTESMLEPVTELKEQIQAWMREKQSSDH,0.043739386,"I1M, F4W, A8K, E9R, I14L, V15L, A19L, P84T",8
GEKFKLLAAKVEEIAAKNARAEIDYSDAPDEFRDPIMDTLMTDPVRLPSGTIMDRSIILRHLLNSPTDPFNRQMLTESMLEPVPELKSQIQAWVREKLSSDH,2.6399088,"I1G, E9A, V15A, L36I, V52I, E88S, M94V, Q98L",8
IEKFKLLAEKVEEIVAKNAREEIDLSDAPDEFRDPLMDTLMTDPVRLPSGTIMDRKIILRHLLNSPTDPFNRQMLTESMLEPVPELKEKIQAWMRQKQSSCT,0.9762893,"A21E, Y25L, V52I, S56K, Q89K, E96Q, D101C, H102T",8
IEGFKLLAEKVEEIAAKNAAAEIDYSDAPDEFRDPLMDTLMTDPVRLPSGNVMDRSIILRHLLNSPTDPFNRQMLTESMLEPVIELKEKIEAWMREKQSADH,0.5416033,"K3G, V15A, R20A, T51N, P84I, Q89K, Q91E, S100A",8
IEEFKLLAGKVEEVVAKNARAEIDYSDAPDEFRDPVMDTLMTDPVRLPSGTVMDRSVIMRHLLNSPTDPFNRQMLTESMLEPVPELKEQIQAWMREKQSTQH,-0.4932667,"K3E, E9G, I14V, L36V, I57V, L59M, S100T, D101Q",8
IEKFKELREKVEEMVAKNAKLEIDYSDAPDEFRDPLMDTLMTDPVRLPSGTVMDRSIILRHLLNSQTDPFNRQMLTEEMLESVPELKEQIQAWMREKQSSDH,0.06834659,"L6E, A8R, I14M, R20K, A21L, P66Q, S78E, P82S",8
MEKFKLLAEKVEEIVAKNSRDEIDLSDAPDDFRDPLMMTLMTDPVKLPSGTVMDRSIILRHLLNSPTDPFNRQMLTESMLEPVPELKEQIQAWMREKQSNDH,-0.37033784,"I1M, A19S, A21D, Y25L, E31D, D38M, R46K, S100N",8
ISKFTLLAEKVEEIVAKNAREEADYSDAPEEFRDPLMDTLMTDPVKLPSGTVMDRSSILRHLLNSPTDPFNRQMLTESMLEPVPELKEKIQAWMREKQSSDH,1.5278739,"E2S, K5T, A21E, I23A, D30E, R46K, I57S, Q89K",8
IEKFTLLAEKCEEIVIQNARAEIDFSDAPEEFRDPLMDTLMTDPVRLPSGTVMDRSIILRHLLNSPTDPFNRQMLTESMLEPVPELKEQIQAWRREKQSSHH,-0.28981864,"K5T, V11C, A16I, K17Q, Y25F, D30E, M94R, D101H",8
IEDLKLLAEKVEEIAAKNARDEIDYSDAPDEFMDPLMDTLMTDPVRLPSGTVMDRSIILRHLLNSPTDPFNRQMLTESMLEPVPELKEQIHAWMRTKQPSDH,0.035456613,"K3D, F4L, V15A, A21D, R33M, Q91H, E96T, S99P",8
IEKFRLLSEKVEEVVAKNARAEIDYSDAPEEFRDPLMDTLMTDPVRLPSGTVMDRSIIQRHLLNSPTDPFNRQPLTEDMLEPVPELKEQIQAWMREKQVSDH,0.5963204,"K5R, A8S, I14V, D30E, L59Q, M74P, S78D, S99V",8
AEKFKLLAEKMEEAVAKNAREEIDYSDAPDEFRDPLMDTLMTDPVRLPSGNVMDRSIILRHLLNSPTDPFNRQPLTESMLQPVPELKERIQAWMREKQSSDH,0.8056016,"I1A, V11M, I14A, A21E, T51N, M74P, E81Q, Q89R",8
IEKFKLLAEKVEEIVAKNAPAEVDYSDAPDDFRDPIMDTLMTDPVRLPSGTVMDRAIILRHLLNSPTDPFNRQMLTESMLEPSPELKEQIQAWMREKQGSDE,2.454074,"R20P, I23V, E31D, L36I, S56A, V83S, S99G, H102E",8
IESFKLLAEKVEEIVAANANAEIDLSDAPDEFRDPLMDTLMTDPVRLPSGTVMDRSIILRHLLNSPTDPFSRQMLTEEMLEPVPELKTQIQAWMREKVSSDH,0.56010073,"K3S, K17A, R20N, Y25L, N71S, S78E, E88T, Q98V",8
IEKFKLLAEKVQEAVAKRARAEVDYSDAPDEFRDPLMDTLMTDPVRLPSGTVADRSIILRHLLNSPTDPFNRQMLTESMLEPVPELKEQIQAWIRQKKSSDH,0.0036775488,"E12Q, I14A, N18R, I23V, M53A, M94I, E96Q, Q98K",8
IEKFKLLAKKVEQIAAKNATEEIDYSDAPDEFRDPLMDTLMTDPVRLPSGTVMDRSIILRHLLNSPTDPFNRQMLTEDMLEPVPELKEQIRAWMREKLSSDH,0.7005799,"E9K, E13Q, V15A, R20T, A21E, S78D, Q91R, Q98L",8
IEKFKLLAEKSEEIAAKNARAEIDTSDAPEEFLDPLMDTLMTDPVRLPSGTVMDRSIILRHLLNSPTDPFNRQMLTESMLEPLPELKEQIQAWMREKMSSNH,0.54511654,"V11S, V15A, Y25T, D30E, R33L, V83L, Q98M, D101N",8
ISKFKLLAEKSEEIVAKNIRADIDYSDAPDEFRDPLMDTLMTDPVRLPSGTVMDRSIILRHLLNSPTDPFNRQPLTEDMLVPVTELKEQIQAWMREKQSSDH,0.7162413,"E2S, V11S, A19I, E22D, M74P, S78D, E81V, P84T",8
VEKFTLLAEKVEQIVAKNARVEIDLSDAPDEFRDSLMDTLMTDPVRLPSGTVMDRSIILRHLLNSPTDPFNRQMLTQSMLEPVPELKEQIQAWMKEKQSSDH,-2.9018972,"I1V, K5T, E13Q, A21V, Y25L, P35S, E77Q, R95K",8
IEKFKLLAEKVEEIVAKNARAEIDYSDAPEEFRDPLMDTLMTDPVTLPSGTVMDRSIIQRHLLNSPTDPFNRQMLTESMLEPVPELKEQIQQWMQEKYGSHH,-1.3466927,"D30E, R46T, L59Q, A92Q, R95Q, Q98Y, S99G, D101H",8
FEKFKLLAEKVEQIVAKNARAEIDYSDAPEEFKDPLMDTLMTDPVRLPSGTVMDRSIILRHLLNSPTDPFNRQMLTENMLEPVPELKEKIQAWMQEKLSSDH,-1.3243471,"I1F, E13Q, D30E, R33K, S78N, Q89K, R95Q, Q98L",8
IEKFKLLAEKVEEITASNARAEIDYDDAPDEFKDPLMETLMTDPVRLPSGTVMDRSIILRHLLNSPTDPFNRQMLTESMLEPVPELKDQIQAWMREKLHSDH,-0.6820296,"V15T, K17S, S26D, R33K, D38E, E88D, Q98L, S99H",8
IEKFKLLAEKVEEIAAKQARAEIDFSDAPDEFRDPIMDTLMTDPVRLPSGTVMDRSIILRHLLNSPTDPFNRQMLTESMLEPVPELKEQIRAWLREKLSSDT,2.955348,"V15A, N18Q, Y25F, L36I, Q91R, M94L, Q98L, H102T",8
IGKFKLLAEKVEEIVKKNAAAAIDYSDAPDEFRDPIMDTLMTDPVRLPSGNVMDRSIILRHLLNSQTDPFNRQMLTEDMLEPVPELKEQIQAWMREKQSSDH,2.1022456,"E2G, A16K, R20A, E22A, L36I, T51N, P66Q, S78D",8
IEKFKLLAEKAKELAAKNARAEIDYSDAPDEFRDALMDTLMTDPVRLPSGTVMDRSIILRHLLNSPTDPFTRQPLTESMLEPVPELKEQIQAWMRRKQSSDH,-0.49498862,"V11A, E12K, I14L, V15A, P35A, N71T, M74P, E96R",8
IEKFERLAVKVEEIVAKNAREEIDYSDAPEEFRDPLMDTLMTDPVRLPSGTIMDRSIILRHLLNSPTDPFNRQMLTEDMLEPVPELKEQIQAWMREKQTSDH,0.36200216,"K5E, L6R, E9V, A21E, D30E, V52I, S78D, S99T",8
IEKFKLLAEKVNEIVAKNARAEIDYSDAPDEFRDPLMDTLMTDPVRLPSGTIMDRKIILRHLLNSPTDPFNRQMLTESDLEPVPELKERIQAWLKEKQSSDG,-2.1468937,"E12N, V52I, S56K, M79D, Q89R, M94L, R95K, H102G",8
IEKFKLLAERCEEIVAKNAQAEIDYSDAPEEFRDPLMDTLMTDPVRLPSGTIMDRSIILRHLLNSPTDPFNRQMLTESMLEPAPELKEQIQRWMREKISSDH,0.96433544,"K10R, V11C, R20Q, D30E, V52I, V83A, A92R, Q98I",8
IEKFKLLAEKVEEIVAKKARQEVDYSDAPDEFRDPLMDTLMTDPVRLPSGTVMDRSVILRHLLNSPTDPFNRQMLTESMLEPVPELKSRIQAWMKEKISSDH,-1.3960624,"N18K, A21Q, I23V, I57V, E88S, Q89R, R95K, Q98I",8
MEKFKQLAEKVEEAAAKNARAEIDYSDAPDEFRDPIMHTLMTDPVRLPSGTVMDRSIILRHLLNSPTDPFNRQMLTESMLEPVPELKERIQAWMREKVSSDH,0.8733866,"I1M, L6Q, I14A, V15A, L36I, D38H, Q89R, Q98V",8
IEKFSLLAEKVREIVAKNARAEIDYSDAPDEFRDPLMDTLMTDPVRLPSGNICDRSIILRHLLNSPTDPFNRQPLTESMLEPVPELKEQIQAWMREKQSKDR,1.5716825,"K5S, E12R, T51N, V52I, M53C, M74P, S100K, H102R",8
IEKFKLLAEKVEDIVAKNARQEIDYSDAPDEFRDPLMDTLMVDPVRLPSGNIMDRSIILRHLLNSPTDPFNRQMLTESMLEPVPELKEQIQAWMREKLSVDR,0.43645588,"E13D, A21Q, T42V, T51N, V52I, Q98L, S100V, H102R",8
IERFKDLGNKVEEIVAKNNRLEIDYSDAPEEFRDPLMDTLMTDPVRLPSGTVMDRSIILRHLLNSPTDPFNRQMLTEDMLEPVPELKEQIQAWMREKQSSDH,0.9043908,"K3R, L6D, A8G, E9N, A19N, A21L, D30E, S78D",8
IGLFKLLATEVEEIVAKNARAEIDYSDAPDEFLDPLMNTLMTDPVRLPSGHVMDRSIILRHLLNSPTDPFNRQMLTESMLEPVPELKEQIQAWMKEKQSSDH,-2.4143066,"E2G, K3L, E9T, K10E, R33L, D38N, T51H, R95K",8
IEKFKLLCEKVDEIVAKNARAEIDYSDAPDEFRDPLMDTLMTDPVRLPSGTVADRSIILRHLLNSPTDPFNRQMLTESMLEPLPELKERIQAWMREKGRLDH,0.013065776,"A8C, E12D, M53A, V83L, Q89R, Q98G, S99R, S100L",8
IEKFKLLAEKVEEIAAKNATAEIDYSDAPDEFRDPLMDTLMTDPVKLPSGTVMDRSIILRHLLNSQTDPFNRQPLTESMLEPAPELKEQIQAWIREKQSSDE,-0.33635497,"V15A, R20T, R46K, P66Q, M74P, V83A, M94I, H102E",8
IEKFKELSEKVEQIVAKNAQAEIDYSDAPDEFRDPIMDTLMTDPVKLPSGTVMDRSIILRHLLNSPTDPFNRQMLTESMLEPVPELKEQIDAWMREKQSADH,3.199483,"L6E, A8S, E13Q, R20Q, L36I, R46K, Q91D, S100A",8
MEKFKLLAERVEEIQAQNARAEIDMSDAPDEFRDPLMDTLMTDPVRLPSGTVMDRSIILRHLLNSPTDPFNRQKLTESMLEPVPELKEQIGAWMREKQSSDS,0.155362,"I1M, K10R, V15Q, K17Q, Y25M, M74K, Q91G, H102S",8
IEKFKLLAEKVEEIVAQNARAEIDYSDAPDEFRDPLMDTLMTDPVKLPSGTIMDRSIILRHLLNSPTDPFNRQMLTESQLEPVVELKERIQAWMREKQHNDH,0.5152267,"K17Q, R46K, V52I, M79Q, P84V, Q89R, S99H, S100N",8
IEDFALLAEKVEELAAKNAVDEIDYSDAPDEFRDPLMDTLMTDPVRLPSGNVMDRSIILRHLLNSPTDPFNRQTLTESMLEPVPELKEQIQAWMREKQSSDH,-0.36819065,"K3D, K5A, I14L, V15A, R20V, A21D, T51N, M74T",8
IEKFKLLAEKVEEMVAKNNRAEIDYSDAPDEFRDPLMDTLMTDPVRLPSGTVMDRSIILRHLLNSPTDPFNRQMLNEEMLEPVPELKEQIQAWIREKLESDA,0.96608925,"I14M, A19N, T76N, S78E, M94I, Q98L, S99E, H102A",8
IEKFSLLAEKCEMINAKNARAEIDYSDAPDEFRDPLMDTLMTDPVRLPSGTVMDRSIILRHLLNSPTDPFNRQMLTESMLEPLEELKDRIQAWMREKQSSDH,0.42308637,"K5S, V11C, E13M, V15N, V83L, P84E, E88D, Q89R",8
IEKFKELAEKCEEIVAKNARAETDYSDAPEEFRDPLMDTLMTDPVRLPSGNVMDRSIILRHLLNSPTDPFNRQMLAESMLEPVPELKEQIQAWMRSKQKSDH,0.5854402,"L6E, V11C, I23T, D30E, T51N, T76A, E96S, S99K",8
IEKFKLLAVRVEEIVAANARAEIDYSDAPDEFRDPLMDTLMTDPVRLPSGQVMDRVNILRHLLNSPTDPFNRQMLTESMLEPVPELKQQIQAWVREKQSSDH,0.14649673,"E9V, K10R, K17A, T51Q, S56V, I57N, E88Q, M94V",8
IEKFKELAEKVEHIVAKNSRAEIDYSDAPDEFRDPLMATLMTDPVKLPSGTVADRSIILRHLLNSPTDPFNRQMLTESMLEPLPELKEQIEAWMREKQSSDH,-1.2427979,"L6E, E13H, A19S, D38A, R46K, M53A, V83L, Q91E",8
IEKFKLLSKKVEEIVAKNAREEIDFSDAPDEFRDPLMDTLMTDPVRLPSGTVMDRSVILRHLLNSPTDPFNRQPLTESMLEPVPELKEQIQAWMREKKQSDH,1.7941103,"A8S, E9K, A21E, Y25F, I57V, M74P, Q98K, S99Q",8
IEKFKLLSEKCEEIVAKQALAEIDYSDAPDEFRDPLMDTLMTDPVRLPSGTVADRSIILRHLLNSPTDPFNRQMLTESQLEPLPELKEQIQAWIREKQSSDH,0.5294809,"A8S, V11C, N18Q, R20L, M53A, M79Q, V83L, M94I",8
IEKFKLLAEKVEEVAAEQAGAEIDYSDAPDEFRDPLMDTLMTDPVRLPSGNVMDRAIILRHLLNSPTDPFNRQMLTEAMLEPVPELKEQIQAWMREKQSSDH,0.6483414,"I14V, V15A, K17E, N18Q, R20G, T51N, S56A, S78A",8
IERFKLLAEKVSEISAKNARAEIDYSDAPDEFRDPLMDTLMTDPVRLPSGQVMDRSVILRHLLNSPTDPFNRQMLTESMLEPVVELKEQIAAWMREKQSFDH,-0.057364464,"K3R, E12S, V15S, T51Q, I57V, P84V, Q91A, S100F",8
VEKFSLLAEKVEEIAAKNARAEIDYSDAPDAFRDPLMDTLMTDPVRLPSGTVMDRSIILRHLLNSPTDPFNRQMLTESMLEPVPELKEQIQAWMSAKRSSDA,-0.55283725,"I1V, K5S, V15A, E31A, R95S, E96A, Q98R, H102A",8
IEKFKLLCEKVEEIVAKTARAEIDYSDAPDEFRDPLMDTLMLDPVRLPSGTVMDRSIILRHLLNSPTDPFNREMLTEAMLEPVPELKSQIQAWMREKQSQRH,-0.73899955,"A8C, N18T, T42L, Q73E, S78A, E88S, S100Q, D101R",8
IEKFKLLAEKVEEIAAANARAEIDYSDAPDEFRDPLMDTLMTDPVRLPSGKVMDRSIILRHLLNSPTDPFNREMLTESMLEPAPELKEQIQAWMREKKSSAK,-1.2383735,"V15A, K17A, T51K, Q73E, V83A, Q98K, D101A, H102K",8
IEKFKELGRKVEEIVAANAAAEIDYSDAPAEFRDPLMDTLMTDPVRLPSGTVMDRSIILRHLLNSPTDPFNRQMLTESMLEPVPELKEQIQAWKKEKQSSDH,-0.9861535,"L6E, A8G, E9R, K17A, R20A, D30A, M94K, R95K",8
IEKFKLLAEKVEEIVAKNAAAEIDYSDAPDEFRDPLMDTLMTDPVRLPSGNVMDRSVILRHLLNSPTDPFNRQMLTEDMLEPVTELKERIQAWMREKQSKDL,1.3576624,"R20A, T51N, I57V, S78D, P84T, Q89R, S100K, H102L",8
IEKFKLLAEKVEEIVSKNAAAEIDYSDAPDEFRDPLMDTLMTDPVRLPSGTVMDRSIILRHLLNSPTDPFNRQPLTESMLEPVPELKERIQAWMRERMSSSS,1.4103473,"A16S, R20A, M74P, Q89R, K97R, Q98M, D101S, H102S",8
IEKFKSLAEKVEAIVAQNNRAEIDYSDAPEEFRDPLMCTLMTDPVRLPSGTVMDRSIILRHLLNSPTDPFNRQPLTESMLEPLPELKEQIQAWMREKQSSDH,0.39237505,"L6S, E13A, K17Q, A19N, D30E, D38C, M74P, V83L",8
MEKFKLLAEKVDEIVAKNAAAEIDYSDAPDEFMDPLMDTLMTDPVRLPSGTVMDRSIILRHLLNSQTDPFNRQMLTESMLEPVPELKEKIQAWMREKLSIDH,-0.22845827,"I1M, E12D, R20A, R33M, P66Q, Q89K, Q98L, S100I",8
IEQFRLLAEKVEEIVAKNARAEIDASDAPDHFRDPLMDTLMTDPVRLPSGTVMDRSIIMRHLLNSPTDPFNRQPLTEDMLEPVPELKEQIQAWMREKQSSTH,-1.1216509,"K3Q, K5R, Y25A, E31H, L59M, M74P, S78D, D101T",8
