Sequence,Score,Mutations,Number of Mutations
MSKGEELFTGVVPILVEGDGDVNGHKFSVSGEGEGDATYGKLTLKFICTTGKLPVPWPTLVTTLSYGVQCFSRYPDHMKQHDFFKSAMPEGYVQERTVFFKKDGNYKTRGEVKFEGDTLVNRIELKGIDFKEDGNILGHKLEYNYNSHNVEIMADKKKNGFKGNFKIRHNIEDGSVQLADHYQQNTPIGDGPVLLPDNHYLSTQSALSKDFNEKRDHMVLLEFVTAAGITHGMDELKK,3.236741,"L18G, I98V, D102K, A110G, Y151E, Q157K, I161F, V163G, P211F, Y237K",10
MSKGEELFTGVVPILVELDGDVNGHKFSVSGEGEGDATYGKLTLKFICTTGKLPVPWPTLVTTLEYGVQCFSRYPDHMKQHDFFKSAMPEGYVQERTIFFKDDTNYKTRAGVKFEGDTLVNRIELKGIDFKEDGNILGHKLEYNGNSHNVYIMADKKKNLIKGNFKIRHNIEDGSVQLEDHYQQNTPIGDGPVLLPDNHYLSTFSALSKDPNEKRDHMVLLEFVTAAGITHGMKELYK,3.5803246,"S65E, G104T, E111G, Y145G, Q157K, G160L, V163G, A179E, Q204F, D234K",10
MSKGEELFTGVVPILVELDGDVNGHKFSVSGEKEGDATYGKLTLKFICTTGKLEVPWPTLVTTLSYGVQCFSRYPDHMKQHDFFKSAMPEGYVQERTIFFSGDGNYKTRAEVKFENDTLVNRIELKGIDFKEDENILGHKLEYNYNSHNVYIMADKKKNGIKGNFKIRHNIEDGSVQLADHYQQNTPIGDVPVLLPDNHYLSTQSALSKDPNEKRGHMVLLEFVTAAGITHGMDELYK,3.0777087,"G33K, P54E, K101S, D102G, G116N, G134E, Q157K, V163G, G191V, D216G",10
MSKGEELFTGVVPILVALDGDVNGHKFSVSGEGEGDATKGKLTLKFICTTGKLPVPWPTLVTTLSYGVQAFSRYPDHMKQHDFFKSAMPEGYGQERTIFFKDDGNYKTRGEVKFEGDTLVNRIELKGIDFKEDGNILGHKLEYNYNSHNVYIMADKKKNGIDGNFKIRHNIEDGSVQLADHYQQNTPIGDGPVLLEDNEYLSTQSALSKDPNEKRDHMVLLEFVTAAGITHGMDELYK,3.2733703,"E17A, Y39K, C70A, V93G, A110G, Q157K, K162D, V163G, P196E, H199E",10
MSKGEELFTGVVPILVELDGDVNGHKFSVSGEGEGDATYGKLTLKFICTTGKLPVPWPTLVTTLSYGVQCFSRYPDHMKQHDFFKSAMPEGYVQERTIFFKDDGNYKTRAEVKFEGDTLVNRIELKGIDFKEDGNILGHALEYNYNSHNVYIMADKKKNGIKGNFKIRENIGDGSVQLADHYQQNTPIGDGPVLLPDIHYLSTQSALSKDPNEKRDHMVLEGFATAAGITHGMDELYE,3.28428,"K140A, Q157K, V163G, H169E, E172G, N198I, L221E, E222G, V224A, K238E",10
MSKGEELFTGVVPILVELDGDVNGHKFSVSGEGEGDATYGKLTLKFICTTGKLPVPWPTLVTTLSYGVQCFKRYPDHMKQHDFFKSAGPEGYVQERTIFFKGDGNYKTRAEVKGEQDTLVNRIELKQIDFKEDGNILGHKLEYNYNSHNVYIMADKKKNGIKGNFKIRHNIEDGSVQLADHYQQNTPIGDGPVLLPDNHYLSTQSALSKDPNEKRDGMVLYEFVTAAGITHGMDELYK,3.4275055,"S72K, M88G, D102G, F114G, G116Q, G127Q, Q157K, V163G, H217G, L221Y",10
MSKGEELFTGVVPEGVELDGDVNGHKFSVSGEGEGDATYGKLTLKEICTTGKLPVPWPTLVTTLSYGVQCFSRYGDHMYQHEFFKSAMPEGYVQERTIFFKDDGNYKTRAEVKFEGDTLVNRIELKGIGFKEDGNILGHKLEYNYNSHNVYIMADKKKNGIGGNFKIRHNIEDGSVQLADHYQQNTPIGDGPVLLPDNHYLSTQSALSKDPNEKRDHMVLLEFVTAAGITHGMDELYK,3.0924163,"I14E, L15G, F46E, P75G, K79Y, D82E, D129G, Q157K, K162G, V163G",10
MSKGEELFTGVVPILVELDGDVNGHKFEVSGWGEGDATYGKLTLKEICTTGKLPVYWPTHVTTLSYAVQCFSRYPDHMKQHDFFKSAMPEGYVQERTIFFKDDGNYKTRAEVKFEGDTLVNRIELKGIDFKEDGNILGHKLEYNYNSHNVYIMADKKKNGIKGNFKIAHNIEDGSVQLADHYQQNTPIGDGPVLLPDNHYLSTQSALSKDPNEKRDHMVLLEFVTACGITHGMDELYK,2.446487,"S28E, E32W, F46E, P56Y, L60H, G67A, Q157K, V163G, R168A, A227C",10
MSKGEELFTGVVPILVELDGDVNGHKVSVSGEGEGDATYGKLTLKFICTEGKLPVPWPTLVTTLSYGVQCFSRYPDHMKQHDFFKSAMPEGYVQERTIFFKDEGNYKTRAEVKFEGDTLVNRIELKGIDFKEDGNILGHKLEYNYNSHNVYYMADKKKNGIKGNFKIKHNIEDGSVQLADHYQQNTPIGDGPALLPDNHYLSTQSALSKDENEKRDHMVLAEFVTAAGITHGMDELYK,3.398669,"F27V, T50E, D103E, I152Y, Q157K, V163G, R168K, V193A, P211E, L221A",10
MSKGEELFTGVEPIEVELDGDVNGHRFSVSGVGEGDATYGKLTLKFICTTGALPVPWPTLVTTLSYGVQCFSRYPDHMKQHDFFKSAMPEGYVQEGTIFFKDDGNYKTRAEVKFEGDTLVNRIELKGIDSKEDGNILGHKLEYNYNSHNVYIMADKKKNGIKGNFKIRHNIEDGSVQLADHYQQNTPIGDGPVLLPDNHYLSTQSALSKDPNEKRDHMVLLEFVTAAGITHGMDEKYK,1.2173862,"V12E, L15E, K26R, E32V, K52A, R96G, F130S, Q157K, V163G, L236K",10
MSKGEELFTGVVPILVELDGDVNGHKFSVSGEGEGDAAYGKLTLKFICTTGKLPVPWPTLVTTLSYEVQCKSRYKDHMKQHDFFKSAMPEGYVQERTIFFKDDGNYKTRAEVKFEGDTLVNRIELKGIDFKEDGNILGHKLEYNYNSHNVYIMADKKKNGIKGNGKIRHNIEDGSVQLADHYQQNTNIGDGPVLLPDNHYLSTQSALSKDPNEKRDHKVLKEFVTAAGITHGMDELYK,2.6258845,"T38A, G67E, F71K, P75K, Q157K, V163G, F165G, P187N, M218K, L221K",10
MSKGEELFTGVVPILVELDGDVNGHKFSVSGYGEGDATYGKLTLKFICTTGKLPVKWPTLVTTLSYGVQCFSRYPDHMKQHDFFKSAMPEGYVQERTIFFKDDGNYYTRAEVKFEGDTLVNRIELKGIDEKEDGNILGHKLEYNYNSHNVYIMADKKKNGIKGNFKIRHNIEDGSVQLADHYQQNTPIGDGAVLLPDNHYLATQSGFSKDPNEKRDHMVLLEFVTAAGITHGMDELYK,3.7280493,"E32Y, P56K, K107Y, F130E, Q157K, V163G, P192A, S202A, A206G, L207F",10
MSKGEELFTGVVPILVELDGDVNGHKFSVSGEGEADATYGKLTLKFICTTGKLPQPWETLATTLSYGVQCKSRYPDHMKQHDFFKSAMPEGYVQEETIFFKDDGNYKTRAEVKFEGDTLVNRIELKGIDFKEDGNILGHKLEYNYNSHNVYIMADKKKNGIKGNFKIRHNIEDGSVQLADHYQQNTPIGDGPVLLPDNHYLSTQSALSKDPNEKRDHMVLLEFVTAAGITHYMDELLK,2.9272618,"G35A, V55Q, P58E, V61A, F71K, R96E, Q157K, V163G, G232Y, Y237L",10
MSKGEELFTGVVPILVELDGDVNGHKFSVSGEGEGDATYGKLTLKFIGTTGKLPVPWPALVTTLSYGVQCFPRYPDHMKQHDFFKSAMPEGYVQERTIFFKDDGNYKTRAFVKFEGDTLVNRIELKGIDFKEDGNILGHKLEYNYNSHNVYIMAEKKKNGIKGNFKIRGNIEDGSVQLADHYQQNTPIGDGPELLPDNHYLSTQSALSKDPNEKRDHGVLLEFVTAAGITHGMDELYK,2.1861012,"C48G, T59A, S72P, E111F, D155E, Q157K, V163G, H169G, V193E, M218G",10
MSKGEELFTGVVPILVELDGDVNGHKFSVSGEGVGDANYGKLTGKFICTTGKLPVPWPTLVTTLSYGKQCFSRYPDHMKQHDFVKSAMPEGYVQERTIFFKDDGNGKTRAEVKFEGDTLVNRIELKGIDFKEDGNILGHKLEYNYNSHNVYIMADKKGNGIKGNFKIRHNIEDGSVQLADHYQQNTPIGDGPVLLPDNHYLSTQSALSEDPNEKRDHMVLLEFVTAAGITHGMDELYK,2.4492261,"E34V, T38N, L44G, V68K, F84V, Y106G, Q157K, K158G, V163G, K209E",10
MSKGEELFTGVVPILVELDGDVNGHKFSVSGEGEGDATYGKLTLKFICATGKLPVPLPTLVTTLSYGVQCFSRYPDHMKQHDFFKSAMPEGYVQERTIFFKDDGNYATRAEVKFEGDTLVNRIYLKGIDFKEAGNILGHKLEYNFNSHNVYIMADKKKNGEKGNFKIRHNIEDGSVQLADHYQQNTPIGDGPVLLPDNHYLSTQSAYSKDPNEKRDHMVLLEFVTAAGITHGMDELYK,3.1923387,"T49A, W57L, K107A, E124Y, D133A, Y145F, Q157K, I161E, V163G, L207Y",10
MSKGEEAFTGVVPILVEEDGKVNGHKFSVSGEGEGDATYGKLTLKFICTTGKLPVPWPTLVTTLSYGVQCFSRYPDHMKQHYFFKSAMPEGYVQERTIFFKDDGNYKTRAEVKFEGDTLVNRIELKGIDFKEDGNILKHKLEYNYASHNVYIMADKKKNGIKGNFKIRHNIEDGSVQLADHYQQNTPIGDGPVLLPDNHYLSTQSALSKDPNEKKDHMVLLEFVAAAGITHGMDELYK,2.7758775,"L7A, L18E, D21K, D82Y, G138K, N146A, Q157K, V163G, R215K, T225A",10
MSKGEELFTGVVGILVELDGDVNGHKFSVSGEGEGDATYGKLTGKFICTTGKLPVPWPTLVTTLSYGVQCFSRYPEHMKQHDFFKSAMPEGYVQERTVFFKDDGNYKTRAEVKFEGDTLVNRIELKGIDFKEDGNILGHKLEYNYNSHNVYIMADKKKNGIKGNFKIRHNKEDGSVQLADHYQQNTPIGDGPVLLPDNHVLSTQSALSKDPNEKRAHMVLLEFVKAAGITHGMDELYK,3.5312934,"P13G, L44G, D76E, I98V, Q157K, V163G, I171K, Y200V, D216A, T225K",10
MSKGEELFTGVVPILVELDGDVDGHKFSVSGEGEGNATYGKLTLKFICTTGKLPVPWPTLVTTLSYGVQCFSRYPDHMKQVDFFKSAMPEGYVQERTIFFKDDGNYKTRAEVKFEGDTLVNRIELKGIDFKEDGNIFGHVEEYNYNSHNVYIMADKKKNGIKGNFKIRHNIEDGSVQLADHYQQNTPIGDGPVLVPDNHYLSTQSALSKDPNEGRDHMVLLEFVTAAGITHGMDELYK,3.5920105,"N23D, D36N, H81V, L137F, K140V, L141E, Q157K, V163G, L195V, K214G",10
