Sequence,Score,Mutations,Number of Mutations
MSKGERLFTGVVPILVELDGDVNGHKFSVSGEGEGDATYGKLTLKFICTTGKLPVPWPTLVTTLSYGVQCFSRYPDHMKQHDFFKGAMPEGYKQERTIFFKDGGNYKTRAEVKFAGDTLVNRIELKGIDFKEDINILGHKLEYNYNSHNVYIMADKKKNGIKGNFKIKHNIEDGSVQLADHYQQNTPIGDGPVLLPANHYLSTQSALSKDPNEKRDHMVLLEFVTAAGITHGMDELYK,3.6488154,"E6R, S86G, V93K, D103G, E115A, G134I, Q157K, V163G, R168K, D197A",10
MSKKEELFNGVVPILVELDGDVNGHKFSVSGEGNGDATYGKLTLKFICTTGKLPVPWPTLVTTLSYGVQCFSRYPDHMKQHDFFKSAMPEGYVQERTIFFKDDFNYKTYAEVKFEGETLVNRRELKGIDFKEDGNILGHKLEYNYNSHNVYIMADKKKNGIKGNFKIRHNIEDGSVQLADHYQQNTPIGDGPVFLPDNHYLSTQSALSKDPNEKRDHMVLLEFVTAAGITHGMDELYK,3.8147814,"G4K, T9N, E34N, G104F, R109Y, D117E, I123R, Q157K, V163G, L194F",10
MSKGEELFTGVVPILVELDGDVNGHKFSVSGEGEGDATYGKLTLKFICTTGKLPVPWPTGVTTLSYGVQCFSRYPDHMKQHDFFKSAMPEGYVQERTIFFKDDGNYKTRAEVKFEGDTLVNRFNLKGIDFKEDGNILGHKAEYNYNSHNVYIMADKKKNGIKGNFKIRHNIEDGSVQLADHYQQNTPIGDGPVLLPDNIYLSTQSAASVDPNEKRDHMGLLEFVTAAGITHGMDELYK,1.7285529,"L60G, I123F, E124N, L141A, Q157K, V163G, H199I, L207A, K209V, V219G",10
MSKEEELFTGVVPILVELDGDVNGHKFSVSGEGEGDATYGKLTLKFICTTGKLPVPWPTLVTTLSYGVQCASRYPDHMKVHDFFKSAVPEGYVQERTIFFKDDGNYGTRAEVKFEGDTLVNRIELKGIDFKEDGNILGHKLEYNYNSHNVYIMADKKKNGIKGNFKIRHNIEDGSVELADHYQQNTPIGDGPVLLPDNHYLSTQSALSKDPNEKRDHMALLEGVTAAGITHGMDELYK,3.17732,"G4E, F71A, Q80V, M88V, K107G, Q157K, V163G, Q177E, V219A, F223G",10
MSKGEELFTGVVPILVELDGDVNGHKGSVSGESEGDYTYGKLTLKFICTTGKLPVPWPTLVTFLSYGVQCFCRYPDHMKQHDFFKSAMPEGYVQERTIFFKDDGNYKTRAEVKFEGDELVNRIELKGIDFKEDGNILGHKLEYNYNSHNVEIMADKKKNGIKGNFKIRHNIEDGSVQLADHYQQNTPIGFGPVLLPDNHYLSTQSALSKDPNEKRDHMVLLEFVTAAGITHGMDELYK,2.7698889,"F27G, G33S, A37Y, T63F, S72C, T118E, Y151E, Q157K, V163G, D190F",10
MSKGEELFTGVVPILVELDGDINGHKFSVSGEGAGDAGYGKLTLKFICTTGKLPVPWPTLVTTLSYGVQCFSRYPDHMKQHDFFKSAMPEGYVQERTIFFKDDGNYKARAEVKFEGDTLVNRIELKGIDFKEDGNILGHKLEGNYNSHNVYIMAEKKKNGIKGNFKARHNIEDGSVQLADHYQQNTPIGDGPVLLPDNHYLSTQSALSKDPNEVRDHMVLLEFVTAAGITHGMDELYK,3.5431247,"V22I, E34A, T38G, T108A, Y143G, D155E, Q157K, V163G, I167A, K214V",10
MSKGEELFTGVVPILEELDGDVNGHKFSVSGEGEGDATYGKLTLKFICTTGKLPVPWPTLATTLSYGVQCFSRYPDHMKQHDFFKSAMPEGYVQERTIFFKDDGNYKTRAEVKFEKDTLVNRIELKGIDFKEDGNILGHKLEYNYNSHNVYIMADKKKNGIKGNGKIRGNIYDGSVQLADHYQQNTPIGDGPVLLPDNHYLSTQSALSKDPNEKADHMVLLEEVTAAGITHGMDELYK,3.4663801,"V16E, V61A, G116K, Q157K, V163G, F165G, H169G, E172Y, R215A, F223E",10
MAKGEELFTGVVPILVELDGDVAGHKFSVSGEGEGDATYGKLTLKFICTTGKLPVPWPTLVTTLSYGVQCFSRYPDHMKQHDFFKSAMPEGYVQERTIYFKDDGNYKTRAEVKFEGDTLVNRIELKGIDFKEDGNILGHKLEYNYNSHAVYIMADKKKRGIKGNFKVRHNIEDGSVQLIDHYQQNTPIGDGPVLLPDNHYLSTQSAKSKDPNEKRDHMVLLEFVTAAGITHGMDELYK,3.7846184,"S2A, N23A, F99Y, N149A, Q157K, N159R, V163G, I167V, A179I, L207K",10
MSKGEELFTGVVPILVELDGDVNGHKFSVSGEGEGDATYGKATLKFICTTGKLPVPWPTLVTTLSYGVQCESRYPDHMKQHDFFKSAMPEGYVQERTIFFKDDGNYKTRAEVKKEGDTLVNRIELKGIDGKEDGNILGHKLEYNYNSHNVYIMADKKKNGIKGNFKIRHNIEDGFVQLADFYQQNTPIGDGPVLGPDNHYLSTQSALSKDPNEKRDHMVLLEFVTAAGVTHGMDELYK,3.5142112,"L42A, F71E, F114K, F130G, Q157K, V163G, S175F, H181F, L195G, I229V",10
MSKGEELFTGVVPILVELDGDVGGHKFSVSGEGEGDATYGKLTLVEICTTGKEPVPWPTLVTTLSYGVQCFSRYPDHMKQHDFFKSAMPEGYVQERTIFFKDDGNYKTRAEVKFEGDTLVNRIELKGIDFKEDGNILGHKLEYNYNSHNVGIMADKKKNGIKGNFKIRHNIEDGSVQLADHYQQNTPIGDGAVLLPDNHYLSTQYALSKDPNEKRDHMVLLEFVTAAGITHGGDELYK,2.8439624,"N23G, K45V, F46E, L53E, Y151G, Q157K, V163G, P192A, S205Y, M233G",10
MSKGEELFTGVVPILVELDGDVNGGKFSVSGEEEGDATYGKLTLGFICTTGKLPVPWPTLVTTLSYGVQCFSRYPDHMKQHDFKKSAMPEGYVQERTIFFKDDGNYKTRAEVKFEGDTLVNRIELKGIDFKEDGNILGHKLEYNANSHNVYIMADKKKNGIKGNFKIRHKIEDGSVQLADHYQQNTPIGDGPVLLPDNHYLSTQSALSKDPNEKRDGMVLLEFVTAAGIAHGMDELYK,3.363442,"H25G, G33E, K45G, F84K, Y145A, Q157K, V163G, N170K, H217G, T230A",10
MSKGEELFTGVVPILVELDGDVNGHKFSVSGEGEGDATYGKLTLKFICTTGKLPVPWPTLVTTLSYGVQAFSRYPDHMKQHDFFKSAMPEGYVQERTIFFKDDGNYKTRAEVKFEGDTLVNRIELKGIDFKEDGNILGEKLEYNYNSHNVYIMADKKKNGIKGNFKGRHNIEDGYVQLADHYQQNTPIGDLPVLLPDFHYLSTQSALSKDKNEKRDHMVLLEFVTAAGITHGMDELKK,3.7883596,"C70A, H139E, Q157K, V163G, I167G, S175Y, G191L, N198F, P211K, Y237K",10
MSKIEELFTGVVPILVELDGDVNGHKFSVSGEIEGDAQYGKLTLKFICTRGKLPVPWPTLVQTLSYGVQCFRRYPDHMKQKDFFKSAMPEGYVQERTIFFKDDGNYKTRAEVKFEGDTLVNRIELKGIDFKEDGNILGHKLEYNYNSHNVYIMADKKKNGFKGNFKIRHNIEDGSVQLADHYQQNTPIGDGPVLLPDNHYLSTQSALSKDPNEKRDHMVLLEFVTAAGITHGMDELYK,2.3670907,"G4I, G33I, T38Q, T50R, T62Q, S72R, H81K, Q157K, I161F, V163G",10
MSKGEELFTGAVPILVELDGDVNFHKFSVSGEGEGDATYGKLTLKFICTTEKLEVPWPTLVTTLSYGVQCFSRYPDHMKQHDFFKSAMPEGYVQERTIFFKDDGNYKTRAEVKFEGSTLVNRIELKGIDFKEDGNILGHKLEYNYNSHNVYIMADKKKNGIKGNFKIRHNIEDGSVQLADHYQQNTPIGQGPVLLPDNHYLSTQSALSKDPVEKRDHMVLLEFVTAAGITHGMDELAK,3.8770432,"V11A, G24F, G51E, P54E, D117S, Q157K, V163G, D190Q, N212V, Y237A",10
MSKGEELFTGVVPILVELDGKVNGHKFSVSGEGEGGATYGKLTLKFICTTGKLPVPWPTLVTTLSYGVQCFSRYPDHMKQHDFFKSAMPEGYVQERTIFFKDDGNYKTRAAVKFEGETLVNRIELKGIDFKEDGNILGHKLEYNYNKHNVYISADKKKNGIKGNFKIRHNIEDGSVQLADHYQQNTPIGDGPVLLPMNHYLSTQSALSKDPNEKRDHMVLLEFVTAAGITHGMDEVYK,3.747955,"D21K, D36G, E111A, D117E, S147K, M153S, Q157K, V163G, D197M, L236V",10
MSKGEELFTGVVPILVELDGDVNGHKFSVSGEGEGDATYGKLTLKFIRTTGKLPVPWPTLVTTLNYGVQCFSRYPDHMKQHDFFKSAMPEGYVQERTIFFKDDGNYKTRAEVKFEGDTLVERIELKGADFKEDGNILGHKLEYNYNSHNVYIMADKKKNGIKGNFKIEHNIEDGSVQLADHYQQNTPIGDGPVYLPDNHYLSTQSAWSKDPNEKRDHMVLLGFVTAAGITHGMDELYK,2.5277305,"C48R, S65N, N121E, I128A, Q157K, V163G, R168E, L194Y, L207W, E222G",10
MSKGEELFTGVVPILVELDGDVNGHKFSVSGEGEKDATYGKLTLKFICTTGKLPVPEPTLVTTESYGVQCFSRYPDHMKQHDFFKSAMPEGYVQGRTIFFKDDGNYKTRAEVKFEGFTLVNRIELKGIDFKEDGNILGHKLEYNYNSHNVYIMADKKKNGIKGNFKIRHNIEKGSVQLADHYQQNTPIGDGPVLLPDNHYLSTQSALSKKPNEKRDHMVLLEFVTAAGIFHGMDELYK,3.3749275,"G35K, W57E, L64E, E95G, D117F, Q157K, V163G, D173K, D210K, T230F",10
MSKGEELFKGVVPIEVELDGDVNGHKFSVKGEGEGDATYGKLTLKFICTTGKLPVAWPTLVTTLSYGVQCFSRYPDHMIQHDFFKSAMPEGYEQERTIFFKDDGNYKTRAEVKFEGDTLVNRIELKGIDFKEDGNFLGHKLEYNYNSHNVYIMADKKKNGIKGNFKIRHNIEDGSVQLADHYQQNTPIGDGPVLLPDNHYLSTQSALSKDPNEKRDHMVLLEFETAAGITHGMDELYK,2.789157,"T9K, L15E, S30K, P56A, K79I, V93E, I136F, Q157K, V163G, V224E",10
MSKGEELFTGVVPILVEADGDVNGHKFSVSGEGEGDATYGKLTLKFICTTGKLPVAWPTLVTTASYGVQCFSRYPDHMKQHDFFKSAMPEGYVQERTIFFKDDGNYKTRAEVKFEGDELYNRIELKGIDFGEDGNILGHKLEYNYNSHNVYIMADKKKNGIKGNFKIRHIIEDGSVQLADHYQQNTPIGDGPVLLPDNHYLSTQSALSKDPNEKREHMVLLEFVTAAGITHGMDELYK,3.1397512,"L18A, P56A, L64A, T118E, V120Y, K131G, Q157K, V163G, N170I, D216E",10
MSKGEKLFTGVVPILVELDGDVNGHKVSVSGEGEGDATYGKLTLKFICTTGKLPVPWPTLVTTLSYGVQCFSRYEDHMKQHDFFKSAMPEGYVQERTIFAKDDGNYKTRAEVKFEGDTLVNRIELKGIDFKEDGNILGHRAEYNYNSHNVYIMADKKKNGIKGNFKIRHNIEDGSVQLADYYQQFTPIGDGPVLLPDNHYLSTQSALSKDPNEKRDHMVLLEFVTAAGITHGMDELYK,3.038713,"E6K, F27V, P75E, F100A, K140R, L141A, Q157K, V163G, H181Y, N185F",10
MSKGEELFTGVVPILVELDGDVNGHKFSVSGEGEGDATYGKLTLKFKCTTGKKPVPVPTLVTTLSYGVQCFSRYPDHMKQHDFFKSAMPEGYVQERTIFFKDDGNYETRAEVKFEGDTLVNSIELKGIDFKEDGNILGHKLEYNANSHNVYIEADKKKNGIKGNFKIRHNIEDGSVQLADHYQQNTPIGDGPVLLPDNHYLSTQSALSKDPNEKRDHMVLLEFATAAGITHGMDELYK,3.2656765,"I47K, L53K, W57V, K107E, R122S, Y145A, M153E, Q157K, V163G, V224A",10
MSKGYELFTGVVPILVELDGDVNGHKFSVSGEGEGDATYGILGLKFICTTGKLPVPWPTLVTTLSYGVQCFSRYPDHMKQHDFFKSAMPEGYVQERTIFFKDDGNYKTRAEVKFEGDTLVNRIELKGGDFKEDGNILGHKFEYNYNSHNVYIMADKKKNGIKGNFKIRHMIVDGSVQLADHYQQNTPIGDGPVLLPDNHYLSTQSALCKDPNEKRDHMVLLEFVTAAGITHGMDELYK,3.9084668,"E5Y, K41I, T43G, I128G, L141F, Q157K, V163G, N170M, E172V, S208C",10
MSKGEELFTGVVPILVELDGDVNGKKFSVSGEGEGDATYGKLTLKFICTTGKLHVPWPTLVTTLSYGVQCFVRYPDHMAQHDFFKSAMPEGYVQERTIFFKDDGNYKTRAEVKFYGDTLVNRIELKGIDFKEDGNILGHKLEYNYNSHNVYIMADKKKNGIKGNFKIRHNIEDGSAQLADHYQQATPIGDGPVLLPDNHYLSTQSALSKDPNEKRDHMVLLEFVTAAGITHGADELYK,3.5392568,"H25K, P54H, S72V, K79A, E115Y, Q157K, V163G, V176A, N185A, M233A",10
MFKGEELFTGVVPILVELDGDVNGHKFSVSGEGEGDATYGKLTLKFICTTGKLPVPWPELVTTLSYGVQCFSRYPDAMKQHDFFKSAMPEGYVVERTIFFKDDGNYKTRAEVKFEGDTRVNRIELKGIDFKEDGNILGHKGEYNYNSHGVYIMADKKKNGIKGNFKIRHNIEDGSVQLADHYQQNTPIGDGPVLLPDNHYKSTQSALSKDPNEKRDHMVLLEFVTAAGITHGMDELYK,3.6454086,"S2F, T59E, H77A, Q94V, L119R, L141G, N149G, Q157K, V163G, L201K",10
MSKGEELFTGVVPILVELDGDVNGHKFSVSGEGEGDATYGKLTLKFIETTGKLPVPWPTLVTTLSYGVQCFSRYPDHMKQHDFFKSAMPEGYVQERTIFFKDDGNYKTRAEVKFRGDTLVNRIELKGIDFKEDVNILGHKLEYNYNSHNVAIMADAKKNGIKGNFKIRHNIEDGSVQLADHYQQNTPIGDGGVLLGDNHYLSTQSALSKDPNAKRDHMVLLEFVTAAGITHGMDELYK,3.0838022,"C48E, E115R, G134V, Y151A, K156A, Q157K, V163G, P192G, P196G, E213A",10
MSKGEELFTGKVPILVELDGDVNGHKFSVSGEGEGDATYGKLTLKFICTTKKLPVPWPTLVTTLSYGVQCFSRYPDHMKQHDFFKSAMPEGYVQGRTIFFKEDGNYKTRAEVGFEGDTLVNRIELKGIDFKEDGNILGHKLEYNYNSHNVYIMADKKKNGIKGNFGIRHNIEDGSVQLADHYQQNTPIGDGPVVLPDNHYLSTQSALSKDPNEKRDHMVLLEFVTAAGITHGRDELYK,3.7182887,"V11K, G51K, E95G, D102E, K113G, Q157K, V163G, K166G, L194V, M233R",10
MSKGYELFTGVVPILVELDGDVNGHKFSVSGEGEGDATYGKLTLKFICTTGKLPVPWPTLVTGLSYGVQCFSRYPDHMKQHDFFKSAFPEGYVQERTIFFKDDGNYKTRAEVKFEGDTLVNRIEEKGIDFKEDGNVLGHKLEYNYNSHNVYIMADKKKNGIKGNFTIRHNIEDGSVQLADHYQQNTPIGDGPVLLRDNHYLSTQSALSKDPNAKRDHMVLLEFVTAAGITHGMDELYK,3.1755962,"E5Y, T63G, M88F, L125E, I136V, Q157K, V163G, K166T, P196R, E213A",10
MSKGEELFTGVVPILVELDGDVNGHKFSVSGEGEGDATYGKLTLKFICTTGKLEVPWPTLVTTLFYGVQCFSRYPDHMKQHDFFKSAMPEGYVQESNIFFKDDGNYKTRAEVKFEGDTLVNRIELKGIDFKEDGTILGHKLEYNYNSHNVYIMKDKKKNGIKGNFKIRHNIEDGYVQLADHYQQNTPIGDGPVLLPDNHYLSTQSALSKSPNEKRDHMVLLEFVTAAGITHGMDELYK,3.0855236,"P54E, S65F, R96S, T97N, N135T, A154K, Q157K, V163G, S175Y, D210S",10
MSKGEELFTGVVPILVELDGDVNGAKFSVSGEGEGDATYGKLTLKGICTTGKLPVPWPTLVTTLSYGVQCFSRYPDHMKQHDFFKSAMPEGYVQERTIFFKDDGNKKTRAEVKFIGDTLVNRIELKGIDFKEDGNILGHKLEYNYNSHNVYIMADKKKNGIKGNFKIRHYIEDGSVQLADHYQQNTPIGDGPVLLPDNHYLSEQSALSKDPKEYRDHMVLLEFVTAAGITHGMDELYK,3.7734346,"H25A, F46G, Y106K, E115I, Q157K, V163G, N170Y, T203E, N212K, K214Y",10
MSKGEELFTGVVPILVRLDGDVNGHKFKVSGEGEGDATYGELTLKFICTTGKLPVPWPTLVTTLSYGVQCFSRYPDHMKQHDFFKSAMPEGYVQERTIFFKDDGNYKTRAEVKFEGDTLVNRIELKGIDFKEDGAILGHKLEYNYNSHNVYIMADKKKNGIKGNFGIRHNIEDGSVQLADHYQQNTPIGDGPVLLPDNHYLSTQSALSKDPPEKRDHMVLLEFVSAAGIVHGMDELYK,3.864492,"E17R, S28K, K41E, N135A, Q157K, V163G, K166G, N212P, T225S, T230V",10
MSKGEELFTGVVPILVELDGDVNGHKVSVSGEGEGDATYGKLTLKFICTTGKLPVPWGTLVTTLSYGVQCFFRYPDYVKQHDFFKSAMPEGYYQERTIFFKDDGNYKTRAEVKFEGDTLVKRIELKGIDFKEDGNILGHKLEYNYNSHNVYIMADKKKNGIKGNFKIRHNIEDGSVQLADHYQQNTPIGDGPVLLPDNHYLSTQSALSKDPNEKRDHMVLLEFITAAGITHGMDELYK,2.8241959,"F27V, P58G, S72F, H77Y, M78V, V93Y, N121K, Q157K, V163G, V224I",10
MSKGEELFTGVVPILVEEDGDVNGHKFSVSGEGEGDATYGKLTLKFICTTGKLPVPWPTLVTTLSYGVQAFSRYPDHMKQHAFFKSAMPEGYVQERTIFFKDDGNYFTRAEVKFEGDTLVNRIGLKGIDFKEDGNILGHKLEYNYNSHNVYIMADKKKNGIKGNFKIRHNIEDGSVQLADHYQLNTPIGDGPVLLPDNHYLSTQSKLSKDPNEKRDHMVLLEAVTAAGITHGMDELYK,3.1728728,"L18E, C70A, D82A, K107F, E124G, Q157K, V163G, Q184L, A206K, F223A",10
MSKGEELFTGVVPILVELDGDKNGHKFSVSGEGEGDATYGKLELKFICTTGKLPVPWQTLVTTLSNGVQCFSRYPDHMKQHDFFKSAMPEGYVQARTGFFKDDGNKKTRAEVKFEGDTLVNRIELKGIDFKEDGNILGHKLEYNYNSHNVYIMADKKKNGIKGNFKIRHNIEDGFVQLADHYQQNTPIGDGPVLLPDNHYLSTQSALSKDPNEKRDHMVLLEFVTAAGITHGMDELYK,2.1858063,"V22K, T43E, P58Q, Y66N, E95A, I98G, Y106K, Q157K, V163G, S175F",10
MSKGEELFTGDVPILVELDGDVNGHKFSVSGEGEGDATYGKLTLKFICTTGKLPVPWPTLVTTLSYGVQCFSRYPDHMKQHDFFKSAMPEGYVQERTIFFKDDGNYKTRAEVKFEGDTLENRIELKGIDFKEDGNILEHKLEYNGNSHNVYEMADKKKNGIKGNEKIRHRIEDGSVQLADHYQQNTPIGDGPVLLPDNHYLSTQSALSADPNEKRDHMVLLEFVTAAGITHGMDELYK,3.6548114,"V11D, V120E, G138E, Y145G, I152E, Q157K, V163G, F165E, N170R, K209A",10
MSKGIELATGVVPILVELDGDVNGHKFSVSGEGEGDATYGKVTLKFICTTGKLPVPWPTLVTTLSYGVQCFSRYPDHMKQHDFFKSAMPEGYVQEGTIFFKDDGNYKTRAEVKFEGDTLVNRIELKGIDFKEDGNILGHKLEYNYNSHNVYIMADKKKNGIKGNFKIRHNFEDGSVQLAEHYQQNTPIGDGPVLLPDNHYLSTQSALFKDPNEKRDHMVLLEFVTAAGIDHGMDELYK,3.2839677,"E5I, F8A, L42V, R96G, Q157K, V163G, I171F, D180E, S208F, T230D",10
MSKGEELFTGVVPILVELDGDVNGHKFSVSGEGEGDATYGKLTLKFICTTGKLPVPWKFLVTTLSYGVQCFSRYKDHMKQHDFFKSAKPEGYVQERTIFFKEDGNYKGRAEVKFEGDTLVNRIELKGIDGKEDGNILGHKLEYNYNSHNVYIMADKKKNGIKGNFKIRHNIEDGSVQLADHYQQNTPIGDGPVLLPDNHYLSTQSALSKDPNEKRDHMVLLEFVTGAGITHGMDELYK,2.2092798,"P58K, T59F, P75K, M88K, D102E, T108G, F130G, Q157K, V163G, A226G",10
MSKGEELFTGVVPILVELDGDVNGHKFSVSGEGEGDATYGKLTLKFICTTGKLPVPEPTLVTTLSYGVQCFSRYPDHMKQHDFFKSAMPEGYVQERTIFFKDDGNYKTRAEVKFEADTLVNRIELKGIDFKEDGNILGHKLEYNYNSHNVYIMADKKYAPIKGNFKIRHNIEDGSVQLADHYQQNTPIGDGPVLLPDNEYLSTDSILSKDPNEKRDHMVLLEFVTAAGITHGMDELYK,3.6893013,"W57E, G116A, Q157K, K158Y, N159A, G160P, V163G, H199E, Q204D, A206I",10
MSKGEELFAGVVPILVELDGDVNGHKFSVSGEGEGDATYGKLTLKFICTTGKLPVPWPTLVDTLSYGVQCFSRYPDHMKQHDFFKSAMPEGYVQERTIFFKDDGNYKTRAEVKFEGDTLVNRIGLKGFDFKEDGNILGHKLGYNYNSHNVEIMADKKKNGIKGNFKIRHNIEDGSVQLADHYQQNTPIGDGPVLLPDEHYLSTQSALSKDPNEARDHMVLLEFVTAAGITHGMDELYK,3.8192801,"T9A, T62D, E124G, I128F, E142G, Y151E, Q157K, V163G, N198E, K214A",10
MSKGAELFTGVVPILVELDGDVNGHKFSVSGEGEGDATYGKLTLKFICTTGKLPVPWPELVTTLGYGVQCFSRYPDHMKQHDFFKSAMPEGYVQEGTIFFKDDGNYKTRAEGKFEGDTLVNRIELKGIDFKEDGNILGHKLEYNYESHNVYIMADKKKNGIKGNFKIRHNIEDGSVQLADGYQQNTPIGDGPVLLPDNHYLSTQSALSKDGNEKRDHMVLLEFVTAAGITHGMDELYK,2.0767436,"E5A, T59E, S65G, R96G, V112G, N146E, Q157K, V163G, H181G, P211G",10
MSKGEELFTGVVPILVELDGDVNGHKFSVSGEGEGDATYGKLTLKFICTTGELPVPWPTLVTTLSYGVQCFSRYPDHMKQHEFFKSAMPEGYVGERTIFFKDDGNYKTREEVKFEGDTLVNRIELKGADFKEDGNYLGHKLEYNYNSHNVYIMADKKKNGIKGNFKIRHNIEDGKVQLADHYQQNTPIGDGPVLLPDNHYLSTQVALSKDPNEKRDHMVLLEFVTAAGITHGMDELYK,3.043856,"K52E, D82E, Q94G, A110E, I128A, I136Y, Q157K, V163G, S175K, S205V",10
MSKGEELFTGVVPIAVEADGKVNGHKFSVSGEGEGDATYGKLTLKFICTTGKLPVPWPTLVTTLSYGVQIFSRYPDHMKQHDFFKSAMPEGYVQERTIFFKDDGNYKTRAEVKFEGDTLVNRIELKGIDFKEKGNILVHKLEYNYNSHNVYIMADKKKNGIKGNFKIRHNIEDGSVQLADHYQQNTPIGDGPVLLPDYHNLSTQSALSKDPNEKRDHMVLLEFVTAAGITHGMDELYK,3.0377302,"L15A, L18A, D21K, C70I, D133K, G138V, Q157K, V163G, N198Y, Y200N",10
MSKGEELFTGVVPILVEHDGDVNGHKFSVSGEGEGDATYGKLTLKFICTTGKLPVPWPTLVTTLSYGVQCFSRYPDHMKQHDFFKSAMPEGYEQERTIFFKDDGNYKTRAEVKFEGATLVNRIELKGIDFKEDGNILGHKLEYNYNSHNVYIMADKKKNGIKGNFKIRHNIEDGSVQLADHYQQNTPIKDGPVLLPDNHYLETQSVLSKDPNEKNDHMVLAEFVTAAGITHGMDELYK,3.792479,"L18H, V93E, D117A, Q157K, V163G, G189K, S202E, A206V, R215N, L221A",10
MSKGEELFTGVVPILVELDGDVNGHKFSVSGEGEGDATYGKLTLKFICTTGKLPVPWPTLVTFLSYGVQCFSRYPDHMKQHDFFKSAMPEAYVQERTIFFKDDGNYKTRAEVKKEGDTLVNRIELKGIDFKEGGNILGHKLEENYNSHGVYIMADKKKNGIKGNFKIRHNIEDGSVQLADHYQQNTPIGDGPVLLPDVHYLSTQSALSKDPNEKGDHMVLLEFVTAAGITHGMDELYK,3.1060524,"T63F, G91A, F114K, D133G, Y143E, N149G, Q157K, V163G, N198V, R215G",10
MSKGEELFTGVVPILVELDGDVNGHKFSVSGEGEGDATYGKLTLKFICTTGKLPVPWPTLVTTLSYGVQCFSEYPDHMKQHDFFKSAMPEGYVQERTIFFKDDGNKKTRGEVKFEGDTLKNRIELKGIDFKEDGNILGHKLEYNYNSHNVYIMADKKKNGIKGNFKIRHNIEDGSVELADHYQQNTPIGDGPVLLEDNHYLSTQSALSKAPNGKRDHMVLLEFVTAAGITHGMDELYK,2.5645072,"R73E, Y106K, A110G, V120K, Q157K, V163G, Q177E, P196E, D210A, E213G",10
MSKGEELFTGVVPILVELDGDYNGHKFSVSGEGEGDATYGKLNLKFICTTGKLPVPWPTLVTTLSYGVQCFSRYPDHMKQHDFFKSAMPEGYVQERTIFFKDDGNYKTRAEVKKEGDTLVNRGELKGIDKKEDGNILGHKLEYNYNSHNVYIMADKKKNGIKGSFKIRHNIEDGSVQLADHYQQNTPIGDGPVLLPDNHYLSTQSALSKDPNYKRDGMVLLEFVTAAGITHGMDELYK,3.2793047,"V22Y, T43N, F114K, I123G, F130K, Q157K, V163G, N164S, E213Y, H217G",10
MSKNEELFTGVVPILVELDGDVNGHKHSVSGEGEGDATYGKLTLKFICTTGKLPVPWPTLVTTLSYGVQCFSRMPDHMKQHDFFKSAMPAGYVQERTIFFKVDGNYKTRAEVAFEGDTLVNRIELKGIDFKEDGNILGHKLEYNYNSHNVYIMADKKKNGIKGNFKIRHNIEDGSVQLADHYQQNTPIVDGPVLLPDNHYLSTQSALSKDPNEKRDHMVLLEFVTAAGATHGMDELYK,2.3991466,"G4N, F27H, Y74M, E90A, D102V, K113A, Q157K, V163G, G189V, I229A",10
MSKGEALFTGVVPILVELDGDVNGHKFSVSGEGEGDATYGKLTLKFIKTTGKLPVPWPTLVTTLSYGVQCFSRYPDVMKQHDFFKSAMPEGYVQERTIFFKDDGFYKTRAEVKFEGDTLVNRIELKGIDFKEDANILGHKLEYNYNSHNVYIMAEKKKNGIKGNFKIRHNIEDGSVQLADHYQQNTPIGDGPVLLPDNHYLSTQSALSKDPNEKRDHMVLLEFVTAAGITHGCDEAYK,3.7912028,"E6A, C48K, H77V, N105F, G134A, D155E, Q157K, V163G, M233C, L236A",10
MSKGEELFTGVVPILVELKGDVNGHKFSVFGEGEGDATYGKLTLKFKCTTGKLPVPWPTLVTTLSYGVQCFSRYPDHMKQHDFFKSAMPEGYVQERTIFFKDDGNYKTRAEVKFEGDTLGNRIELKGIDFKEDGNILGHKLGYNYNSHNVYIMADEKKNGIKGNFKIRHNIEDGSVQLADHYQQNRPIGDGPVLLPDNHYLSTQSALSKDPNEKRDHMVLLEFVTAAGITHGMDEFYK,3.9112523,"D19K, S30F, I47K, V120G, E142G, K156E, Q157K, V163G, T186R, L236F",10
MSKGEELFTGVVNILVELDGDVNGHKFSVSGEGEGDATYGKLTLKFICTTGKLPVPWPTLVTTLEYGVECFSRYPDHMKQHDFFKSAMPEGYVQERTIFFKDDGNYKTRAEVKFEGDTLVNKIELKGIDFKEDGNILGHALEYNYNSHNVYIMADKKKNGIKGNFKIRHNIEDGSVQLADHYEQYTPRGDGPVLLPDNHYLSTQSALSKDPNEKRDHMVLLEFVTAAGITHGMDELYK,2.619907,"P13N, S65E, Q69E, R122K, K140A, Q157K, V163G, Q183E, N185Y, I188R",10
MSKGEELFTGVVPILVELDGDVNGHKFSVSGEGEGDATYGKLTLKFICTTGKLPVPWPTLVTTLSYGVQCFSRKPDHMKQHDFFKSAMPEGYVQERTIFAKDDANYKTRAEVKFEGDTLVNRIELKGIDFKEDGNILGHKGEGNYNSHNVYIMADKKKNGIKGNFKIRANIEDGSVQLADHYQQNGPIGDGFVLLPDNHYLSTQSALSKDPNEKRDHMVLLEFVTAAGITHGMDELYK,3.1007469,"Y74K, F100A, G104A, L141G, Y143G, Q157K, V163G, H169A, T186G, P192F",10
MSKGEELFTGVVPILVELDGDVNGHKFSVSGEGEGDATYGKLTLKFIYKTGKLPVPWPTLVTTLSYGVQCFSRYPDHMKQHDFFKSAMPEGYVQERTIFFKDDGNYKTRAEVKFEGDTLVNRIELKGIDFKEDGNILGHKLKYNYNYHNVYIMADKKKNGIKGNFKIRHKIEDGSVQLADHYQQNTVIGDGPVLLPDNHYLSTKSALSKDPNEKRDHMELLEFVTAAGITHGMDELYK,3.287086,"C48Y, T49K, E142K, S147Y, Q157K, V163G, N170K, P187V, Q204K, V219E",10
MSKGEELFTGVVPILVELDGDVNGHKFSVSGEGEGDATYGKLTLKFICTTGKLPVPWPTLVTTLSYGVQCFSRYPDHMKQHDFVKSAMPEGYVQERTIFFKDDGNYKTRAEVKAEGDTLVNRIYLKGIDFKEDGNILGHKLEYFYNSHNVYIMADKKKNGIKGNFKIRHNIEDGSVVLADHYQQNTPIGDGPVLLPDNHYLSTQSALSKDPNEKRDHMVLLGFVTAAGITHGMEELEK,3.0420718,"F84V, F114A, E124Y, N144F, Q157K, V163G, Q177V, E222G, D234E, Y237E",10
MSKGQELFTGVVPILVELDGDVNGHKFSVRGEGEGDATYGKLTLKFICTTGKLPVPWPTLVTTLSYDVQCFSRYPDHMKQHDFFKSASPEGYVQERTIFFKRDGNYGTRAEVKFEGDTLVNRIELKGIDFKEDGNILGHKLEYNYNSHNVYIMADKKKNGIKGNFKIRHNIEDGSVQLADHYQQNTPIGDGPVLLPDGHYLSTQSALSKDPNEKRDHMVLLEFVTAAGIKHGMDELYK,2.893732,"E5Q, S30R, G67D, M88S, D102R, K107G, Q157K, V163G, N198G, T230K",10
MSEGEELFTGVVPIKVELDGDVNGHKFSVSGEGEGDATKGKLTLKFICTTGKLPVPWPTLVTTLSYGVQCFSRYPDHMKQHDFFKSAMPEGYKQERTIFFADDGNYKTRAEVKFEGDTLVNRIELKGIDFKEGGNILGHGLEYNYNSHNVYEMADKKKNGIKGNFKIRHNIEDGSVQLADHYQQNTPIGDGPVLLPDNHYLSTQSALSKDPNEKRDHMVLLEFVTAAGITHGMDELYK,3.7178693,"K3E, L15K, Y39K, V93K, K101A, D133G, K140G, I152E, Q157K, V163G",10
MSKGEELFTGVVPILVELDGDVNGHKFTVSGEGEGDATYGKLTAKFICTTGKLPVPWPTLVTTLSYGVQCFSRYPDHMKQHDFFKSAMPEGYVQERTIFFKDDENYKTRAEVKAEGDTLVNRIELKGIDFKEDGNILGHKLEYNANSHNVYIMADKKKNGKKGNFKIRHNIEDGSVQLADHYQQNTPIGDGPVLLPDNHYLSTQSALSKDPNELRDHMVLLEFVTAAGIEHGMDELYK,3.6357586,"S28T, L44A, G104E, F114A, Y145A, Q157K, I161K, V163G, K214L, T230E",10
MSKGEELFTGVKPILVELDMDVNGHKFSVSGIGEGDATYKKLTLKFICTTGKLPRPWPTLVTTLSYGVQCFSRYPDHMKQHDFFKSAMPEGYVQERTIFFKDAGNYKTRAEVKFEGDTLVNRIELKGIDFKEDGNILGHKLEYNYNSHNVYIKADKKKNGIKGNFKIRHNIEDGSVQLADHYQQNTPIGDGPVLLPDNHYLSTQSYLSKDPNEKRDHMVLLEFVTAAGITHGMDELYK,3.343407,"V12K, G20M, E32I, G40K, V55R, D103A, M153K, Q157K, V163G, A206Y",10
MSKGEELFTGVVPIDVELDGDENGHNFGVSGEGEGDATYGKGTLKFVCTTGKLPVPWPTLVTTLSYVVQCFSRYPDHMKQHDFFKSAMPEGYVQERTIFFKDDGNYKTRAEVKFEGDTLVNRIELKGIDFKEDKNILGHKLEYNYNSHNVYIMADKKKNGIKGNFKIRHNIEDGSVQLADHYQQNTPIGDGPVLLPDNHYLSTQSALSKDPNEKRDHMVLLEFVTAAGITHGMDELYK,2.1307418,"L15D, V22E, K26N, S28G, L42G, I47V, G67V, G134K, Q157K, V163G",10
MSKGEELFTGVVPILVELDGDVNGHKFSVSGEGEGDVTYGKLTLKFICTTGKLPVPWPTLVTTLSYGVQCFSRYPDHMKQRDFFKSAMPEGYVQGRTEFFKDDGNYKTRAEVKFEGDFLVNRIELKGIDFKEDGNILGHKLEYNYNSHNVYIMADKKKNAIKGNFKIRHNIEDGSVQLADHYQQNTPIGDGPVLLPDNHYLSTQSALSKDPNEKRDHMVLLGFVTAAGITHGGDELYK,2.3285997,"A37V, H81R, E95G, I98E, T118F, Q157K, G160A, V163G, E222G, M233G",10
MSKGEELFTGVVPIGVELDGDVNGHKFSVSGEGEGVATYGKLTLKFICTTGKLPVPWPTAVTTLSYGVQCFSRYPDHMKQHDFFKSAMPEGYVQERTIFFKDDGNYKTRAEVKFEGDTLVNRIGLKGYDFKEDGNILGHKLEYNYNSHNVYIMADKKKNGIKGNFKIRHNIEDGSVQLADHYQQNTPIGDGPVLLPDEHYLSYQSALSKDPNEKRDHMVALEFVTAAGITHGMDELYK,3.3533273,"L15G, D36V, L60A, E124G, I128Y, Q157K, V163G, N198E, T203Y, L220A",10
MSKGERLFTGVVPILVELDGDVNGHKFSVSGEGEGDPTYGKLTLKFICTTGKLPVPWPTLVTTLSYGVQCFSRYPDHMYQHDFFKSAMPEGYVQERTIFFKDDGFYKTRAEVKFEGDTLVNRIELKGIDFVEDGNILGHKLEYNVNSHNVYIMADKKKNGIKGNFKIRHNIEDGSVQLADHYQQNTPIGDGPVLLPDNVYLSTQSALSKDPNEVRDHMVLLEFVTAAGITHGMDELYK,3.7202976,"E6R, A37P, K79Y, N105F, K131V, Y145V, Q157K, V163G, H199V, K214V",10
MSKGEELFTGVVPIGVELDGDVNGHKFSVSGEGEGDATYGKLTLKFICTTGKLPVPWPKLNTTLSYGVQCFSRYPDHMKQHDFFKSAMPEGYVQERTIFFKDDGNYKTRAEVKFEGDTLVNRIELKGIDFKEDGNILGHKLEANYNSHNVAIAADKKKNGIKGNFKIRHNIEDGSVQLAGHYQENTPIGDGPVLLPDNHYLSTQSALSKDPNEKRDHMVLLEFVTAAGITHGMDELYK,3.6083007,"L15G, T59K, V61N, Y143A, Y151A, M153A, Q157K, V163G, D180G, Q184E",10
MAKGEELFTGVVPILVELDGDYNGHKFSVSGEGEGDATYGKLTLKFICTTGKLPVPWPTLVTTLSYGVQCFSRYPDHMKQHDFFKSAMPEGFVQEETIFFGDDGNYKTRAEVKFEGDGLVNRIELKGIDFKEDGNILGHKLEYNYNSHNVYIMADKKKNGIKGNFKIRHNIEDGSVQLADHYQQNTPIGDGPALLPDNHYLSTQSALSKDPNEKRDHGVLLEFVTAAGITHGMDELYK,3.3190486,"S2A, V22Y, Y92F, R96E, K101G, T118G, Q157K, V163G, V193A, M218G",10
MSKGEELFTGLVPILVELDGDVNGHKFSVSGEGEGDATYGKLTLKFICTTGKLKVPWETLVTTLSYGVQCFSRYPDHMKQHDFFKEAMPEGYVQERTIFFKDDGNYKTRAEVKFEGDTLVNRIELKGIDFKEDGNILGHKLEGNYNSHNVYIEADKKKNGIKGNFKIRHNREDGSVQLADHYQQNTPVGDGPVLLPDNHYLSTQSALSKDPNEKRDHMVLLEFVTAAGITHGMDELYK,3.7071974,"V11L, P54K, P58E, S86E, Y143G, M153E, Q157K, V163G, I171R, I188V",10
MSKGEELFTGVVPILVELDGDVNGHKVSVSGEGEGDATYGKLTLKFICTTGKLPVPWPTLVTTLSYGVQCESRYPDHMKQHDMFKSAMPEGYVQERTIFFKDDKIYGTRAEVKFEGDTLVNRIELKGTDFKEDGNILGHKLEYNYNSHNVYIDADKKKNGIKGNFKIRHNIEDGSVQLADHYQQNTPIGDGPVLLPDNHYLSTQSALSKDPNEKRDHMVLLEFVTAAGITHGMDELYK,3.4648576,"F27V, F71E, F83M, G104K, N105I, K107G, I128T, M153D, Q157K, V163G",10
MSKGEELFTGVVPILVELDGDVNGHKFSVSGEGEGDATYGKLTLKFICTTGKLPVPWPTLVTTLSYGVQCFSRYPDKMKQHDFFKSAMPEGYVQEGTIFFKDDGNYKTRAEVKFNGDTLVNRIELKGIDFKEDGNILGHKLYYNYNSHNVYGMADKKKNGIVGNFWIRHNIEDGSVQLADHYQQNTPIGDGPVLLPDNHYLSTQSALSKDPNEKRDEMVLLEFVTAAGITHGMDELYK,2.975168,"H77K, R96G, E115N, E142Y, I152G, Q157K, K162V, V163G, K166W, H217E",10
MGKGEELFTGVVPILVELDGDVPGHKFSVSGEGEGDATSGKLTLKFICTTGKLPVPWPTLVTTLSYGVQCFSRYPDHMKQHDFFKSAMPEGYVQERTIFFKDDGNYKTRAEVKFEGDTLVNRIELKGIDFKEDGNILGHKLEYNYESHNVYIMADKKKNGIKGNFKIRHNIEDGSVQLADHYQQNTPIGDGPVLLPKNHYLSTQSALDKDPNEKRDHMVLLEGVTAAGITHGMDELKK,3.940289,"S2G, N23P, Y39S, N146E, Q157K, V163G, D197K, S208D, F223G, Y237K",10
MSKGEELFTGVVAILVELDGDVNGHKFHVSGEGEGDATYGKLTLKFICTTYKLPVPWPTLVTTLSYGVQCFSRYPDHMKQHDFFKSAMPEGYVFERTIFFKDDGNYKTRAEVKFEGDTLVNRIELKGIDFKEDGNILGHKLEYNYNSHNVYIMADKKKNGIKGNFKIRHNIEDGSVQLAGHYQQNEPIGDGPVLLPDNHYLSTQSALSKDPNEKRDHMVLLEFVTAAGITIGMDVLYK,3.4767766,"P13A, S28H, G51Y, Q94F, Q157K, V163G, D180G, T186E, H231I, E235V",10
MSKGEELFGGVVPILVELDGDVNGHKFSVSGEGEGDATYGKLTLKFICTTGELPVPWPTLVTTLSYGVQCFSRYPDHMKQHDFFKSAMPEGYVQERTIKFKDDGNYKTRAEVKFEGDTLVNREELKGIDFKEDGNELGHKLEYNGNSHNVYIMADEKKNGIKGNFKIRHNIEDGSVQLADYYQQNTPIGDGPVLLPDNHYLSTQSALSKDPNEKRDHMVLLEFVTAAGITHGMDELYK,3.6198778,"T9G, K52E, F99K, I123E, I136E, Y145G, K156E, Q157K, V163G, H181Y",10
MSKGEELFTGVVPILVELDGDVNGHKFSVSGEEEGDATYGKLTLKFIFETGKLPVPWPTLVTTLSYGVQCFSRYPDHMKQHDFFKSAMPEGYVQERTIFFKDDGNYKTRAEVKFEGDTLVNEIELKGIDFKEDGNILGHKLEYNYNGHNVYIMADKKKNKIKGNFKIRHNIEDGSVQCADHYQQNTPIGDGPVLLPDNHYLETQSALSKDPNEKRDHMVLLEFVTAAGITHGMDELYK,3.015552,"G33E, C48F, T49E, R122E, S147G, Q157K, G160K, V163G, L178C, S202E",10
MSKGEELFTGVVPILVELDGDVNGHKFSVSGEGEGDATKGKLTLKFICETGKLPVPWPTLVTTLGYGVQCFSRYPFHMKQHEFFKSAMPEGYVQERTIFFKDDGNYKTRAEVKFEGDTLVNRIEEKGIDFKEDGNILGHKLEYNYNSHNVYIMADKKKNGIKGNFKIRHNIEDGSVQLADHYQQNTPIGFGPVLLPDNHYLSTQSALSKDPNEKRDHMVLVEFVTAAGITHGMDELYK,3.423321,"Y39K, T49E, S65G, D76F, D82E, L125E, Q157K, V163G, D190F, L221V",10
MSKGEELFTGVVPILVELDGDVNGHKFYVSGEGEGDATYGKLTLKFIKTTGKLPVNWPTLVTTLAYGVQCFSRYPDHMKQHDFFKSAMPEGYVQERTIFFKDDGNYKTRAEVKFEGDTLVNRIELKGIDFKEDGNILGHKLEYNYNSHNVYIMADKKKNGIKGNFKIRHNEEDGSVQLADHYQQNTPIGDGPVLLPANVYLSTQSALSKDPNEKRDHMVLLEFVTAAGITHGMDEYYK,3.5536685,"S28Y, C48K, P56N, S65A, Q157K, V163G, I171E, D197A, H199V, L236Y",10
MSKGEELFTGVVGILVEADGDVNGHKFSVSGEGEGDATYGKLTLKFICTTGKLPVPWPTRVTTLSYGVQCESRYPDHMKQHDFFKSAMPEGYVAERTIFFKDDGNYKTRAEVKFEGDTLVNRIELKGIDFKEDGNILGHKLEYNYNSHNVYIMADKKKNGIKGNFKIRHNIEDGSVVLADHEQQNTPIGDGPVLLPDNHYLSTQSALSKDPNEKRDHMVLLEFYTAAGITHGMDELYK,2.5840487,"P13G, L18A, L60R, F71E, Q94A, Q157K, V163G, Q177V, Y182E, V224Y",10
MSKGAELFTGVVPIGVEGDGDVNGHKFSVSGEGEGDATYGKLTLKFICTTGKLPVPWPTLVTTLVSGVQCFSRYPDHMKQHDFFKSAMPEGYVKERTIFFKDDGNYKTRAEVKFEGATLVNRIELKGIDFKEDGNILGHKLEYNYNSHNVYIMADKEKNGIKGNFKIRHNIEDGSVQLADHYQQNTPIGDGPVLLPDNHYLSTQSALSKDPNEKRDHKVLLEFVTAAGITHGMDELYK,0.48471147,"E5A, L15G, L18G, S65V, Y66S, Q94K, D117A, Q157E, V163G, M218K",10
MSKGEESFTGVVPILVELDGDVNGHKFSVSGEGEGDATYGKLTLKFICTTGKLPVPWPTLVTTLSYGVQCFSRYPDHMKGHDFFKSAMPEGYVQERTIFFKDDGNYKTRAKVKFEGYTLVNRIELKGIDFKEDGNILGHKKEGNYNSHNVQIMADKKKNGIKGNFKIRHNIEDGSVQLADHYQQNTPIGDGPVLVPDNHYLSTQSALSKDPNEKRDHMVLLEFVTAAGITHGMDELYK,3.703792,"L7S, Q80G, E111K, D117Y, L141K, Y143G, Y151Q, Q157K, V163G, L195V",10
MSKGEELFTGVVGILVELDGDVNGHKFSVSGEGEGDATGGKLTLVFIDETGKLPVPWPTLVTTLSYGVQCFSRYPDHMKQHDFFKSAMPEGYVQERTIEFKDDGNYKTRAEVKFEGDTLVNRIELKGIDFKEDGNILGAKLEYNYNSHNVYIMADKKKNGIKGNFKIRHNIEDGSVQLADHYQQNTPIGDGPVLLPDNHYLSTQSALSKDPNEKRDHMVLLEFVTAAGITHGMKELYK,3.6572406,"P13G, Y39G, K45V, C48D, T49E, F99E, H139A, Q157K, V163G, D234K",10
MSKGEELFTGVVPILVELDGDVNGHKFSISGEGEGDATYGKLTLKFICTTGKLPQPWPTLVTTLSYGVQCFSRYPDHMKQHDFFKSAMPEGYVQERTAFFKDDGNYKTRAEVKFEGDTLVNRIELKGIDFKEDGNILGHKAEYNYNSHNVAIMADKKKNGAKGNFKIRHNIEDGSVQLADHYGQNTPIGDKPVLLPDNHYLSTQSALSKDPNEKRDHMVLLEFVTAAGITHGMDELYK,2.5474124,"V29I, V55Q, I98A, L141A, Y151A, Q157K, I161A, V163G, Q183G, G191K",10
MSKGEELFTGVVPILVELDGDVNGHKFSASGEGEGDATYGKLTLKFICTTGKLPVPWPTLVTTLSYGVQCFSRYPDHMKQHDVFAEAMPEGYVQERTIFFKDDGNYKTRAEVYFEGDTLVNRIELKGIDFKEDGNILGHKLEYNYGSHNCYIMADKKKNGIKGNFKIRHNIEDGSVQLADHYQQNTPIGDGPVLLPDNHYLSEQSALSKDPNEKRDHMVLLEFVTAAGITHGMDELYK,2.573533,"V29A, F83V, K85A, S86E, K113Y, N146G, V150C, Q157K, V163G, T203E",10
MSKGEELFTGVVPILVELDGDVNGHKFSVSGAGEGDATYGKLTLKFICTTGKFPVPLPTLVTTLSYGVQCFSRYPDHMKQHDFFKSAMPEGYVQEGTIFFKDDGNYKTRAEVKFEGDTLVNREELKGIDFKEDGNILGHKLEYNYNSHNVYIMADKKKNGIKGNFKIRHNIEDGSVQLADHYFQNTPIGDGPVLLPDNHYLSTQSALSKDPNEKRDHMVLLEFVTAAGATGGMDELYK,2.067023,"E32A, L53F, W57L, R96G, I123E, Q157K, V163G, Q183F, I229A, H231G",10
MSKGEELFTGVVPILVEADGDVNGAKFSVSGEGEGDATYGKLTLKFICTTGKLPVPWPTLVTTLSYGVQCFSRYPDHMAQHDFFKSAMPEGYVQERTIFFKDDGNYKTRAEVKFEGDTLVNRIELKGIDFKEDGNILGHKLEYNYNSHNVYISADKKKNGIKGNFKIRHNIEDGSVQLADHYQQNVPIGDGPVLLPDNHYLVTQSALSKDPNEKSDHMVLLGFVTAAGITHGMDELYK,3.3600218,"L18A, H25A, K79A, M153S, Q157K, V163G, T186V, S202V, R215S, E222G",10
MSKGEELFTGVVPINVELDGDVNGHKFSVSGEGEGDATYGKLTLKFICTTGKLPVPWPTLVTTLSYGVQCFSRYPDHMKQHDFFKSAMPEGYKQERTIFFKDDGNYKTRAEVKFEGDTLVNREELKGIDFKEDGNIFGHKLEENYNKHNVYIMADKKKNGIKGNFVIRHNIEDGSVQLADHYQQNTPIGDGPVLLPDNHYLSTQSALSKDPNEKRDHKVLLEFVTAAGITHGMDELYK,2.536402,"L15N, V93K, I123E, L137F, Y143E, S147K, Q157K, V163G, K166V, M218K",10
MSKGEEKFTGVYPILVELDGDVNGHKFSVSGEGEGDATYGKLTLKFICTTGKLPVPWPTLVTTLSNGVQCFSRYPDHMKQHDFFKGAMPEGYVIERTIFFKDDGNYKGRAEVKFEGDTLVNRIELKGIDFKEYGNILGHGLEYNYNSHNVYIMADKKKNGIKGNFKIRHNIEDGSVQLADHYQQNTPIGDGPVLLPDNHYLSTQSALSKDPNEKRDHMVLLEFVTAAGITHGMDELYK,2.4263952,"L7K, V12Y, Y66N, S86G, Q94I, T108G, D133Y, K140G, Q157K, V163G",10
