Sequence,Score,Mutations,Number of Mutations
MNIFIKNLHPKIDNKALYDTFSVFGTILSTKIVTAENGKSKGFGFVDFEEEGAAQEAIDALNGFSLNGQEIYVAP,1.9344721,"G1M, D11K, D26T, S30T, A33V, D35A, H47D, K55Q, M64F, L65S",10
MNIYIKNLHPDIDNKALEDTFSVFGDILSSKIIYDTNGNSKGFGFVHLEEEGAAKEAIEALNGMKLNGQEIYVAP,4.2789607,"G1M, F4Y, Y18E, A33I, T34Y, E36T, K39N, F48L, D59E, L65K",10
MNIFIKNLHPDMDNKALYDTFCVFGDIESSKIVTDENGNSKGFGFVHFEEEGAAKEAITALNGMLLGGQVITVAP,3.0131469,"G1M, I12M, S22C, L28E, A33V, K39N, D59T, N67G, E70V, Y72T",10
GNIFIKNLSPAVDNKALYNTFSVFGDILSSKILTDENGKSKGFGFVHMEDEEAAVEAIDALNGMLLNGREIYVAP,5.4562917,"H9S, D11A, I12V, D19N, A33L, F48M, E50D, G52E, K55V, Q69R",10
MNIFIKNLAPDIDNKALSDTFSVFGDILSSKIATDKNGKSKGFGFVHFEEETAADYAIDALNGMLLKGSEIFVAP,5.2445555,"G1M, H9A, Y18S, E36K, G52T, K55D, E56Y, N67K, Q69S, Y72F",10
GNIFIKNLHPDITNKALYDTFTVYGDILSSMIATDENGKSKGFGFVHFESEGAAKEAIKNLNGGQLNGQEIAVAP,3.1640391,"D13T, S22T, F24Y, K31M, E50S, D59K, A60N, M64G, L65Q, Y72A",10
GNIFIKNLSPDIDEKTLYDTFSVFGKILSSKIATDENGKSKGFGFVHFEEGGAAKKAIDALNGSLLHGQRIYVSP,4.0384736,"H9S, N14E, A16T, D26K, E51G, E56K, M64S, N67H, E70R, A74S",10
GNIFIKNLSPDIDNDALYDTFLVFGDILSSKIATDENGKSKGFGFVHMLEEGQAEEAIDALNGMQLNEQEIYVAK,3.895328,"H9S, K15D, S22L, F48M, E49L, A53Q, K55E, L65Q, G68E, P75K",10
MNIVIKNLNPDIDNIALYNTFIVYGDILSSKIITDRNGKSKGFGFVHFEEEGAAKEAIDALNGMLLNGQEIYVAL,-0.9294245,"G1M, F4V, H9N, K15I, D19N, S22I, F24Y, A33I, E36R, P75L",10
GNIFIKNLPPDVDNKELYDTFSVFGDIVSSKIALDENGKSKGFGFVHFKEEGKAKEAIDALNGMMLNGREIYVAI,6.094223,"H9P, I12V, A16E, L28V, T34L, E49K, A53K, L65M, Q69R, P75I",10
GNIFIKNLHPDIDNQALYDHFSVFGDILSSKIATDEDGKSRGFGFVHFEEEGAAIEAIDALNGQLLHDQEIVVKP,3.2379365,"K15Q, T20H, N37D, K41R, K55I, M64Q, N67H, G68D, Y72V, A74K",10
GNIYVKNLHFKIDNKALYDTFSVYGDILSSKIATDQNGKSKGFGFVNFEEEGAAKKAIDALNGMLLNGQEIKVFP,3.1325426,"F4Y, I5V, P10F, D11K, F24Y, E36Q, H47N, E56K, Y72K, A74F",10
GNIFIGNLHYDIDNKLLYETFSKFGDILSSKIATDEFGKSKGFGFVHMEEEGAAKKAINALNGMLLNGQPIYVAP,4.3009777,"K6G, P10Y, A16L, D19E, V23K, N37F, F48M, E56K, D59N, E70P",10
MNIFIKNLHPDIDDKTLRDTFSVFGDILSSKVITDENGTSKGFGFVHFAEEGAAKEAIDAMNGMLLNGQEIGVAP,4.5518446,"G1M, N14D, A16T, Y18R, I32V, A33I, K39T, E49A, L61M, Y72G",10
MNIFIKNLNPDITNKMLYDTFVVFGDILSSKIATDNNGKSKGFGFVHMEEEGAAKMAIDALNGMLLCGQEIYVVP,3.1926084,"G1M, H9N, D13T, A16M, S22V, E36N, F48M, E56M, N67C, A74V",10
MNIFIKNLHPDIDNKALNDTFSAFGDILSTKIATDEKGKSKGFGFVHYESEGAAKEAIAALNGRKLNGQEIYVAP,4.598855,"G1M, Y18N, V23A, S30T, N37K, F48Y, E50S, D59A, M64R, L65K",10
GNIYIKNLHPDIDNNALYDTFSVFGDILSSKVATDENGKSKGFGFVDFESEAAAIEAIDALNGELLNGVEIYVKP,2.9389224,"F4Y, K15N, I32V, H47D, E50S, G52A, K55I, M64E, Q69V, A74K",10
MNIFIKNLHPEIDNKALYETFSVFGDILSCKIARDENGQSKGFGFVEFEEEGAAQEAIDALNGKLLNGVEIYVAP,3.643754,"G1M, D11E, D19E, S30C, T34R, K39Q, H47E, K55Q, M64K, Q69V",10
GNIFIKNLVPDIDEKELYDHFSVFGDILSTKIITDENGKSKGFGFVHFEENGEAKNAIDALNGMLINGQEIYVAP,2.2285433,"H9V, N14E, A16E, T20H, S30T, A33I, E51N, A53E, E56N, L66I",10
GNIFITNLHFDITNKALYDTFNVFGDILSSKIATDENGKSKGFGFVSFEEEGAAREAIDALNGMALNGKEIIVKP,-0.084362745,"K6T, P10F, D13T, S22N, H47S, K55R, L65A, Q69K, Y72I, A74K",10
GNIFIKNLHPDIDNKALEDTFAEFGGVLSCKIITDEFGRSKGFGFVHFEEEGAAKEAIDALNGMLLNGQEILVAP,4.891324,"Y18E, S22A, V23E, D26G, I27V, S30C, A33I, N37F, K39R, Y72L",10
GNIFIKNLPRDITNKALYDHFSVFGDILSAKIITDEDGKSKGFGFVDFEEEGAVKKAIDALNGMLLNGQEIYVAP,1.7572901,"H9P, P10R, D13T, T20H, S30A, A33I, N37D, H47D, A54V, E56K",10
MNLFIKNLHPDIDNKALYDTFSVFGDILSTKIATDENGKSKGFGFVHFAEDGAAKKAIQALNGMLLYGQEISVKP,2.5558083,"G1M, I3L, S30T, E49A, E51D, E56K, D59Q, N67Y, Y72S, A74K",10
GNIFIKNLHPDIDNKALHDTFSQFGDIKSSKVAVDANGKSKGFGFVHFEEEGDAKEAIDALNGMDFQGQEIYVAP,6.7212152,"Y18H, V23Q, L28K, I32V, T34V, E36A, A53D, L65D, L66F, N67Q",10
VNLFIKNLHPDIDNKTLYQTFSVFGDILSSKIATDENGESKGFGFVHFEDEMAAKEAIDGLNGMPLNGSEIYVAP,4.64818,"G1V, I3L, A16T, D19Q, K39E, E50D, G52M, A60G, L65P, Q69S",10
GNIFIKNLHPDIDNTALNDAFSVFGTILSAKIAIDENGKSKGFGFVHFREEGAAKEAIDALNGMLLDGREIIVAP,6.1055603,"K15T, Y18N, T20A, D26T, S30A, T34I, E49R, N67D, Q69R, Y72I",10
GNIFVSNLHPDIDNKALYDTFKVFGDILSSKIAIDENGKSRGYGFVDFEEEGAAKEAIDALNGMKIRGQEIYVAP,2.0379577,"I5V, K6S, S22K, T34I, K41R, F43Y, H47D, L65K, L66I, N67R",10
GNIFICNLHPDIDNKALYNTFSVFGDIASSKIATQANGKSKGFGFVHMESEGAAKEAIDALNGMILNGKELYVAP,4.957459,"K6C, D19N, L28A, D35Q, E36A, F48M, E50S, L65I, Q69K, I71L",10
GNIFIKNLNPSIDNKALYDTFSVFGDILSSKIIRDENGKSKCFGFVHFEEEGKAKEAIIALNGKLLNGFRIYVAP,4.972902,"H9N, D11S, A33I, T34R, G42C, A53K, D59I, M64K, Q69F, E70R",10
MNIFIKNLHHDIQNKALYDTFSMFGDIASSKVVLDENGTSKGFGFVHFEEEGAAKEAIDAMNGMLLNGQEIYVAP,4.754875,"G1M, P10H, D13Q, V23M, L28A, I32V, A33V, T34L, K39T, L61M",10
MNIFIKNLHPDIDNFALYDTFSRFGDILSSKIATDEEGKSKGFGFVSFEEEPAAKEAIDAMNGMLLNGKEIYVCY,2.3586652,"G1M, K15F, V23R, N37E, H47S, G52P, L61M, Q69K, A74C, P75Y",10
MNIFIKNLHYDIDDKALYDYFSQFGDILSSKIVTDENGQSKGFGFVHFEEEGAAAEAIDKANGMLLNGQEIYVAP,3.599944,"G1M, P10Y, N14D, T20Y, V23Q, A33V, K39Q, K55A, A60K, L61A",10
GNIFIKNLHPDIDWQALYDTFSVFGDILSSRIATDENGKSKGFGFVHYNEEGAAQEAIDAYNGQLINGQIIYVAP,3.6382914,"N14W, K15Q, K31R, F48Y, E49N, K55Q, L61Y, M64Q, L66I, E70I",10
GNIFIKNLHKDIDNKALYDVFSVFGPILSSKTATDENGNSKGFGFVHFNEEGAAKEAIEALNGMTLNGQEIIVAI,5.7277,"P10K, T20V, D26P, I32T, K39N, E49N, D59E, L65T, Y72I, P75I",10
MNIFIKNLHPDIDNKALYDMFSVFGKILSTKVVTRENGKSKGFGFVHYEEPGAAKEAIDALNGMLLNGQEIYVQP,3.7516918,"G1M, T20M, D26K, S30T, I32V, A33V, D35R, F48Y, E51P, A74Q",10
GNIFIKHLHKDINSKTLYDTFSVFGDILSSKIVTDENGKSKGFGFVHFGEEGKAKEAIDALNGMLLNGLEIYVKP,5.730547,"N7H, P10K, D13N, N14S, A16T, A33V, E49G, A53K, Q69L, A74K",10
GNIYVKNLDPRIDTEALYDIFSVFGNILSSKIATDENGKSKGFGFVHFEEPGAAKEAIDALNGMLLYGQEIYVAP,4.066611,"F4Y, I5V, H9D, D11R, N14T, K15E, T20I, D26N, E51P, N67Y",10
GNIFIKNLSRDITNKALYDTFSVYGDILSSKIATDKNGKSKGFGFVDFEEEAAAKEAIDALNGRLLNGQEIDVRP,0.42389473,"H9S, P10R, D13T, F24Y, E36K, H47D, G52A, M64R, Y72D, A74R",10
MNIFVKNLHPDVDKKALSDTFSVFGDILSSKIATDENGVSKGFGFVHFEEEGAAKEAIDALNGMIFNGRELYVAP,3.8347182,"G1M, I5V, I12V, N14K, Y18S, K39V, L65I, L66F, Q69R, I71L",10
GNIFVKNLNPDIDNKALYDTFSVHGDILSSKIVTDENGKSKGFGFVHFRSAGAAKEAISDLNGMRLNGQEIYVAP,5.28113,"I5V, H9N, F24H, A33V, E49R, E50S, E51A, D59S, A60D, L65R",10
MNILIKNLHPDIDNKKLYDTFSVFGDIQSCKVATDSNGKSKGFGFVHMEEEGAAKRAIDALNGALLNGQEIYVAP,0.61813927,"G1M, F4L, A16K, L28Q, S30C, I32V, E36S, F48M, E56R, M64A",10
GNIFIKNLHFDIDNKALKDTFSKFGNILSSKIVKDENGKSKGFGFVHFEEPGEAMEAIDASNGMLLNGQEIYVAP,5.7863226,"P10F, Y18K, V23K, D26N, A33V, T34K, E51P, A53E, K55M, L61S",10
MNIFIKNLDPDVDNKALYDTFSVFGDILSTKIATDENGKSKGFGFVHMIEEGAAKEAIDALNGMLLKGQPISVAY,2.3864489,"G1M, H9D, I12V, S30T, F48M, E49I, N67K, E70P, Y72S, P75Y",10
GNIFVKNLHHDIDNHALYDTFSVFGDILSCKIATDENGKSKGFGFVDFEEEGAAKEAIAAMNGMKLNGQEIYVKS,2.7929206,"I5V, P10H, K15H, S30C, H47D, D59A, L61M, L65K, A74K, P75S",10
GNLFIKNLHPEIDNKALYDTFSQFGDILSSKIATDEDGNSKGFGFVDFEEEDKAKEAIHALNGMLINGQEIYVAP,3.9102685,"I3L, D11E, V23Q, N37D, K39N, H47D, G52D, A53K, D59H, L66I",10
GNIFIKNLHYDTDNKKLYDSFSVFGKIVSSKIATDENGKSKGFGFVHFEEENAAKSAIDALNGMSLNGQEIYVAM,3.4743845,"P10Y, I12T, A16K, T20S, D26K, L28V, G52N, E56S, L65S, P75M",10
VNIFVANLHPDIDNKALKDEFSVFGDILSAKIATDENGKSKGFGFVHFEEEGAAKEAIESLNGMLLNGQKIMVAP,1.3005345,"G1V, I5V, K6A, Y18K, T20E, S30A, D59E, A60S, E70K, Y72M",10
GNLFVRNLHPDIDNKALYDEFSVFGDILSCKIAKDFNGKSKGFGFVHMENEAAAKEAIDALNGMLLNGQEIYVAP,4.0080585,"I3L, I5V, K6R, T20E, S30C, T34K, E36F, F48M, E50N, G52A",10
GNIFVKNLHPDADDKQLYDTFSVFGDILSSKIATDENGKSKGFGFVELREEGAVKEAIDALNGTLLNGQEIYVAY,0.05483362,"I5V, I12A, N14D, A16Q, H47E, F48L, E49R, A54V, M64T, P75Y",10
GNIFIKNLHSDIDNKFLYDTFSVFGEILSSRIATYENGKSKGFGFVHFVHEGGAKEAIDALNGMLINGQEIYVRP,4.6019535,"P10S, A16F, D26E, K31R, D35Y, E49V, E50H, A53G, L66I, A74R",10
GNIFIRNLGPGIDNKALLDTFSVNGDILSTKIATDENGKSKGFGFVHFEEEGAAKEAIDNFNGMLVNGIEIYVAP,2.8323064,"K6R, H9G, D11G, Y18L, F24N, S30T, A60N, L61F, L66V, Q69I",10
GNIMIKNLHPDIDNKALYDHFSVFGEILSCKIITDENGKSKGYGFVQFQNEGAAKEAIDALNGMLLNGQKIYVAP,2.7311654,"F4M, T20H, D26E, S30C, A33I, F43Y, H47Q, E49Q, E50N, E70K",10
GNIFIRNLHPDIDNKALYDTFSVFGDILSSKIALDENGKSKGFGFVHFSDEGKAKEAITALNGMLINDQEIYLAF,7.0512924,"K6R, T34L, E49S, E50D, A53K, D59T, L66I, G68D, V73L, P75F",10
GNIFIKNLHPKIDNKELYDIFSVFGDILSSKVVRDQNGKSKGFGFVDFEEEGLAKEAIDALNGKLLNGQEIYVAP,2.6500044,"D11K, A16E, T20I, I32V, A33V, T34R, E36Q, H47D, A53L, M64K",10
GNIFIGNLHPDIDNKALYDTFAVFGDILSAKIATDENGKSKGFGFVHLEEEGDAQAAIDALNGMPLNGQEIRVAI,3.9816175,"K6G, S22A, S30A, F48L, A53D, K55Q, E56A, L65P, Y72R, P75I",10
GNIFIKNLHPDIDNKALYDTFKEHGDIVSSKVATEKNGKHKGFGFVHFEEEGAAKEAIDALNGMLLNGQEMYVAK,3.8114038,"S22K, V23E, F24H, L28V, I32V, D35E, E36K, S40H, I71M, P75K",10
GNIFVKNLHPHIDDKVLYDSFSVFGKILSSKIATDDNGKSKGFGFVHFEEEGEAAEAIDALNGMLLNGQEISVAP,5.97756,"I5V, D11H, N14D, A16V, T20S, D26K, E36D, A53E, K55A, Y72S",10
GNIFIKNLHKDIDNKMLWDTFSVFGDILSSKIITDENGISKGFGFVHFEEEGEAQEAIDALNGVLLNGHEIWVAP,4.9076147,"P10K, A16M, Y18W, A33I, K39I, A53E, K55Q, M64V, Q69H, Y72W",10
GNIYVKNLDPSIDNLALYDTFSVFGDILSAKIALDENGKSKGFGFVHFEEYGAAKEAIDALNGMLLNGQELYVAN,5.8826447,"F4Y, I5V, H9D, D11S, K15L, S30A, T34L, E51Y, I71L, P75N",10
GNIFIKNLHPNADNKKLYDYFKQFGDILSSKIMTDENGKSKGFGFVHFEEEGAAKEAIDAMNGMLFNGQKIYVAP,2.2795105,"D11N, I12A, A16K, T20Y, S22K, V23Q, A33M, L61M, L66F, E70K",10
GNIFIKNLHPGIDNKQLNDTFTVFGDILSTKIATDENGKSKGFGFVHFEEEGEAKEAIDALNGVLLEGQEIYVML,3.996941,"D11G, A16Q, Y18N, S22T, S30T, A53E, M64V, N67E, A74M, P75L",10
GNIFIKNLHPSIDEKALGDTFEVFGRILSSKIVYDENGKSKGFGFVHFEEESAAQEAIDALNGKLLNGQEIYVAP,3.951173,"D11S, N14E, Y18G, S22E, D26R, A33V, T34Y, G52S, K55Q, M64K",10
GNIFIKQLHPDIDELLLYDHFSVFGDILSSKIVTDENGYSKGFGFVHFYEEGVAKEAIDALNGMLLMGQEIYVAP,1.7345834,"N7Q, N14E, K15L, A16L, T20H, A33V, K39Y, E49Y, A53V, N67M",10
GNLFVKNLHPDIDNKALYDTFSIFGNILSSKIATDENGKSKGFGFVNFGEEKAAKEAIDALNGMELNGKEIFVAP,5.158619,"I3L, I5V, V23I, D26N, H47N, E49G, G52K, L65E, Q69K, Y72F",10
GNIFIKNLDPSIDEKALYDTFSVFGKILSSKIATDENGKSKGFGFVDMEEEGAAKKAIDAMNGSLLNGREIYVAP,1.6010895,"H9D, D11S, N14E, D26K, H47D, F48M, E56K, L61M, M64S, Q69R",10
MNIFIKNLHPDITNKALYDLFSVFGKILSAKIVTDYNGKSKGFGFVHFEEEGAAQEAIDALNGMLLNGQELYVKP,4.6626244,"G1M, D13T, T20L, D26K, S30A, A33V, E36Y, K55Q, I71L, A74K",10
GNIFIKNLTPETDNKALQDTFSVFGKILSSKIATDRNGKSKGFGFVHMEEEGAAKEAIDALNGMLINGKEAYVAP,3.6668916,"H9T, D11E, I12T, Y18Q, D26K, E36R, F48M, L66I, Q69K, I71A",10
GNIFIKNLHYDMDNKALYDTFSQFGNILSSKIATDENGKSKGFGFVHFDTEGAAKEAIDKLNGMLINNREIYVAP,5.5305862,"P10Y, I12M, V23Q, D26N, E49D, E50T, A60K, L66I, G68N, Q69R",10
GNIFIKNLHPEIDNKALKDKFSNYGDILSSKIATFENGKSKGFGFVHFEDEGKAKEAIDALNGMLLRGKEIYVAP,4.272202,"D11E, Y18K, T20K, V23N, F24Y, D35F, E50D, A53K, N67R, Q69K",10
GNIFIKNLHFDVTNKALYDTFSVFGDILSSKIARDENGKSKGFGFVHYSEEGAAKEAIVALNGMLLNGKIIYVAL,6.05805,"P10F, I12V, D13T, T34R, F48Y, E49S, D59V, Q69K, E70I, P75L",10
GNIYIKNLHPDIDNKALKDTFSVFGKIMSCKIAVDKNGKSKGFGFVAFEDEGAAKEAIDAMNGMLLNGQEIYVAP,6.1649227,"F4Y, Y18K, D26K, L28M, S30C, T34V, E36K, H47A, E50D, L61M",10
GNIFIKNLHEDISNDALNDLFSVFGDILSSKVLYDENGKSKGFGFVHFEEEGAAKEAIDRLNGMLLDGQEIYVAP,3.0272255,"P10E, D13S, K15D, Y18N, T20L, I32V, A33L, T34Y, A60R, N67D",10
GNIFIKNLHPSVDDKALYDTFSVFGDILSVKIAQDENGKPKGFGFVHFEEEGAAKAAIDALNGKLLNGHEIYVLP,3.0623055,"D11S, I12V, N14D, S30V, T34Q, S40P, E56A, M64K, Q69H, A74L",10
GNIYVKNLHQMIDNKALYDRFKVYGDIISSKIATDENGKSKGFGFVHFREEGAAEEAIDALNGMLLNGQEIYVAP,4.9415755,"F4Y, I5V, P10Q, D11M, T20R, S22K, F24Y, L28I, E49R, K55E",10
GNIFIKNLHPDIDNKALYETFSVFGDILSSKVIRDENGSSKGFGFVHFEDEGAAKEAIDAANGGLLNGRTIYVAP,6.168078,"D19E, I32V, A33I, T34R, K39S, E50D, L61A, M64G, Q69R, E70T",10
GNIFVKNLHPDVDNNALYDTFSKFGDILSSKIATDENGKSKGFGFVQMKNEGAAREAIDALNGKLLNGQEIYVAP,4.259366,"I5V, I12V, K15N, V23K, H47Q, F48M, E49K, E50N, K55R, M64K",10
GNIFIANLHPDITNKALYDTFSVFGTIVSARVATDENGKSKGFGFVHFEEEGAAIEAIDALNGMLLNGQEIKVAL,1.9918131,"K6A, D13T, D26T, L28V, S30A, K31R, I32V, K55I, Y72K, P75L",10
GNIFIKNLDPDCDNIALYDEFSKFGDILSSKIATDENGKSKGFGFVHFEDEGAASQAIDALNGTLLNGREIYVAP,4.2547197,"H9D, I12C, K15I, T20E, V23K, E50D, K55S, E56Q, M64T, Q69R",10
MNIFIKNLSPDIDNKALFDTFSVFGAIRSSKIATDENGKSKGFGFVHFEYEGAAKEAIDAMNGMLVHGQEIVVAP,4.634552,"G1M, H9S, Y18F, D26A, L28R, E50Y, L61M, L66V, N67H, Y72V",10
GNIFIKNLSPDIDNAALYDTFSPFGDIISCKIATDENGKSKGFGFVDFVDEGKAKEAIDALNGMLLGGQEIYVAP,3.0804253,"H9S, K15A, V23P, L28I, S30C, H47D, E49V, E50D, A53K, N67G",10
MNIFVKNLHPDIDDKALYDLFSHFGDILSSKIVTDEEGKSKGFGFVHFEEEGARKAAIDALNGMLLNGQEIDVAP,2.3990467,"G1M, I5V, N14D, T20L, V23H, A33V, N37E, A54R, E56A, Y72D",10
MNIYIKNLHPDIDNKALYDTFSEFGRILSSKIAIDENGKSKGFGFVHLEEEELANEAIDALNGMLLNGQEIYVAL,5.1630964,"G1M, F4Y, V23E, D26R, T34I, F48L, G52E, A53L, K55N, P75L",10
MNIFIKNLHPDIDNKALHDMFSVYGDILSSKIITDESGKSKGFGFVSFKEEGAAKEAIEKLNGMLLNGQEIYVAP,3.0711036,"G1M, Y18H, T20M, F24Y, A33I, N37S, H47S, E49K, D59E, A60K",10
MNIFIKNLHPDIDKKALHDTFSVFGKIRSSKIATDENGKSKGYGFVHFEEEGAAKRAIEALNGMHLNGYEIYVAP,3.8056939,"G1M, N14K, Y18H, D26K, L28R, F43Y, E56R, D59E, L65H, Q69Y",10
GNLFIKNLHPDIDNKTLYDTFSHFGSILSTKIITDENGKSKGFGFVHFEEEGAAQEAMDALNGMLFNGQELYVAP,5.7264013,"I3L, A16T, V23H, D26S, S30T, A33I, K55Q, I58M, L66F, I71L",10
GNIFIKNLHPDVDNKQLADTFSVFGDILSVRILMDDNGKSKGFGFVHFEEEHAAKEAIDALNGMLLNGQKIYVAP,3.6889424,"I12V, A16Q, Y18A, S30V, K31R, A33L, T34M, E36D, G52H, E70K",10
GNIFIKNLHEDIDNKALMDEFSGFGDILSVKIVTDENGISKCFGFVHFEEEGAAKRAIDALNGMLLNGQEIYVAY,3.1399133,"P10E, Y18M, T20E, V23G, S30V, A33V, K39I, G42C, E56R, P75Y",10
GNIFIKNLHPTVDEKVLYDTFSVFGDILSSRIATDENGKSKGFGFVQFEEEGKAKEAIRAHNGKLLNGQEIYVAP,2.7546844,"D11T, I12V, N14E, A16V, K31R, H47Q, A53K, D59R, L61H, M64K",10
MNIFIKNLHYDIDDKALLDTFSAFGDIKSYKIATDENGKSKGFGFVHFEEEGAAKEAINNLNGMLLNGREIYVAP,3.9773114,"G1M, P10Y, N14D, Y18L, V23A, L28K, S30Y, D59N, A60N, Q69R",10
MNIYIKNLHPGIDNKTLYDTFSVFGDITSSKIATQENGKSKGYGFVHFEEEGAAKEAIDGLNGMLLNGREIYVCP,4.9661617,"G1M, F4Y, D11G, A16T, L28T, D35Q, F43Y, A60G, Q69R, A74C",10
GNIFIKNLHPDIDNKALTDTFSVFGTILSAKIVTDENGDSKGFGFVHMEEEGAAKEAIDKMNGMLLNKQEILVAP,2.4286194,"Y18T, D26T, S30A, A33V, K39D, F48M, A60K, L61M, G68K, Y72L",10
GNIIVKNLHPSIDNKALYDTFSVFGDILSSKIARDENGKSKGFGFVHFMEEGAASEAIQAMNGMLLNGQEITVNP,1.3149383,"F4I, I5V, D11S, T34R, E49M, K55S, D59Q, L61M, Y72T, A74N",10
MNIFIKNLTPDIDNKMLYDTFSEFGKILSSKIATGFNGKSKGFGFVHFSDEGAAKAAIDALNGMLLNGQEIYVAP,4.876726,"G1M, H9T, A16M, V23E, D26K, D35G, E36F, E49S, E50D, E56A",10
GNLFIKNLHPDIDNKKLYDTFSVFGDILSAKVITDKNGKSKGFGFVDFKEDGAAKEAIDAMNGMLLNGQEIYVAP,3.2503772,"I3L, A16K, S30A, I32V, A33I, E36K, H47D, E49K, E51D, L61M",10
GNIFIKNLHPDTDNKALYDHFSVFGDILSTKIIRGENGKSKGFGFVHMEEEGAAKEAIDALNGYELNGQEIYVMP,0.07225022,"I12T, T20H, S30T, A33I, T34R, D35G, F48M, M64Y, L65E, A74M",10
GNIFVRNLHPDIDNKTLYDTFSVFGKILSSKVALDENGKSKGFGFVHFTEEEDAKEAIDALNGMLLNEQEIYVAP,7.5329876,"I5V, K6R, A16T, D26K, I32V, T34L, E49T, G52E, A53D, G68E",10
KNIFIKNLHPEIDDKALYDTFSVFGKILSSKIATDKKGKSKGFGFVHFEEENAAKNAIKALNGMLLNGQELYVAP,5.8993015,"G1K, D11E, N14D, D26K, E36K, N37K, G52N, E56N, D59K, I71L",10
GNIFIKNLHPDITNKELYDTFSPFGSILSTKIAMDENGISKGFGFVHFEEEGAAKEAIDAMNGMLLNGQELYVAI,4.9669294,"D13T, A16E, V23P, D26S, S30T, T34M, K39I, L61M, I71L, P75I",10
GNIFIKNLHPDIDNKKLYDLFSVYGDILSAKIITDENGKSKGFGFVEFEEEGAAKEAIQAMNGMLIDGQEIYVAP,1.62658,"A16K, T20L, F24Y, S30A, A33I, H47E, D59Q, L61M, L66I, N67D",10
GNIFVKNLHPDIDKKALYDLFSVHGDIVSSKIATDENGKSKGFGFVHFEGEGAAKKAIDALNGMLISGREIYVAP,2.6954136,"I5V, N14K, T20L, F24H, L28V, E50G, E56K, L66I, N67S, Q69R",10
