Sequence,Score,Mutations,Number of Mutations
MNIFIKNLHPDIDNKALYDTMLVFGCILFSKVATDENGKSKGFGFVHFKREKAAKEAIDALNLMLLNGQEIYVAP,2.812988,"G1M, F21M, S22L, D26C, S29F, I32V, E49K, E50R, G52K, G63L",10
GKIFIKNLHPNIDNKALYDTMLVFGDVLSSKIATLEFGKSKGFGFVHFKREGAAKEAIDAMNGMLLNGQEIYVAP,3.9259763,"N2K, D11N, F21M, S22L, I27V, D35L, N37F, E49K, E50R, L61M",10
MNIFIKNLHPDIDNKALYKTMLVFGDILSSKVACDKNNKSKGFGFVHFKREGAAKEAIDALNGMLLNGQEIYVAP,7.841791,"G1M, D19K, F21M, S22L, I32V, T34C, E36K, G38N, E49K, E50R",10
GNIFIKNLHPDIDNKALYTTMLVFGDILSSKIATDEHGKSKGLGFVHFKREGAAREAIDALNKMLLVGQEIYVAP,4.9896975,"D19T, F21M, S22L, N37H, F43L, E49K, E50R, K55R, G63K, N67V",10
MNIFIKNLHPDIDNKALYDTMLVFGDIVSSKIITDENGKSKGFGFVHFKREGAAKDAIDALNGMLLNGQLVYVAP,6.049606,"G1M, F21M, S22L, L28V, A33I, E49K, E50R, E56D, E70L, I71V",10
GNIFIKNLVRWIDNKALYDKMMVFGDILSSKIATDRNGKSKGFGFVHFKREGAAKEAIDKLNGMLLNGQEIYVAP,5.646272,"H9V, P10R, D11W, T20K, F21M, S22M, E36R, E49K, E50R, A60K",10
GNIFIKRLHLDVDNKALYDTMLVFGDILSSKILTDENGKSKGFGFVHMKRESAAKEAIDALNGMLLNGQEIYVAP,5.9688187,"N7R, P10L, I12V, F21M, S22L, A33L, F48M, E49K, E50R, G52S",10
GNIFIKNLHPDIDNKALYTTMLVFGDILSSKIATDKNGKSKGFGFVHFKRIRCAKEAIDALNGMLLNGQECYVAP,8.690453,"D19T, F21M, S22L, E36K, E49K, E50R, E51I, G52R, A53C, I71C",10
MNIFIKGLHPDIDNKALYDTMLVFGDILSSKIATDENGKSKGFGFVHFKREKAAKKAIDALNGMLINAQEIYVAP,6.6026583,"G1M, N7G, F21M, S22L, E49K, E50R, G52K, E56K, L66I, G68A",10
GNIFIKNLHPDIDNKALYDTMLVCGDILSSCIATDENGKIKGFGFVLFKREGAAKECIDALNGCLLNGQEIYVAP,2.1068726,"F21M, S22L, F24C, K31C, S40I, H47L, E49K, E50R, A57C, M64C",10
GNIFIKRLHPDIVNKALYDTMLVFGDILSSKIATMENGKSKGFGFVRFKREGAAKEAIDALRGMLLNGQEIVVAP,3.4554877,"N7R, D13V, F21M, S22L, D35M, H47R, E49K, E50R, N62R, Y72V",10
GNIFIKNLHPDITSKILYDTMLVFGDILSSKIATDENGKSKGFGFVHFKREGMAKEAIDALNGMCLNGQEIYVVP,7.2975693,"D13T, N14S, A16I, F21M, S22L, E49K, E50R, A53M, L65C, A74V",10
GNIFIKNLHPDIVNKALYDTMLVFGDTLSSKIATDENGKSKGFGFVHMKREGAAKEAIDALNGMLLNGCEIVVAV,3.4322567,"D13V, F21M, S22L, I27T, F48M, E49K, E50R, Q69C, Y72V, P75V",10
GNIFIKNLHVDIDNKALYDTMLVFGDILSSKIATDENGKSKGFGLVHFKRERAAKEAIDALNFMLLMGQEIYVAT,3.766622,"P10V, F21M, S22L, F45L, E49K, E50R, G52R, G63F, N67M, P75T",10
MNIFIKNLHIDIDNIALYDTMLVFGKILSSKIATDENGKSKCFGFVHFKREGAAKEAIDLLNGMLLNGQEIYVAP,7.160805,"G1M, P10I, K15I, F21M, S22L, D26K, G42C, E49K, E50R, A60L",10
GNLFIKHLHPDIDNKALYKTMLVFGDILSSKIMTDLNGKSKGFGFVHFKREGAAKEAIDALNGMLLNGQEIYVAL,8.120743,"I3L, N7H, D19K, F21M, S22L, A33M, E36L, E49K, E50R, P75L",10
GNIFIKNLHPDIDNKVLYDTMLVFGDILSSKIATDINGKSKGFGFCHFKREGAAKEAIDKLNCMLLLGQEIYVAP,6.4921274,"A16V, F21M, S22L, E36I, V46C, E49K, E50R, A60K, G63C, N67L",10
GNIFIKYLHPDIDNKALYDTMLVFGDILRSKIALDENGKSKGFGFVHMKRKGAAKEAIDALNGMLLNGQEIYVAV,5.690242,"N7Y, F21M, S22L, S29R, T34L, F48M, E49K, E50R, E51K, P75V",10
GNIFIKNLHPSIDNKALYDTMLVFGDILSSKIATDINGVSKGFGFVHFKRKGAAKEAIDALNGMLCNGQTIYVAP,8.254591,"D11S, F21M, S22L, E36I, K39V, E49K, E50R, E51K, L66C, E70T",10
GNIFIKNLHPDIDTKALYDIMLVFGDILSSKIATDEKGKSKGFGFVHFKREIAAKEAIDAMNGMLLMGQEIYVAP,8.000156,"N14T, T20I, F21M, S22L, N37K, E49K, E50R, G52I, L61M, N67M",10
GNIFIKNLHPKIDNKALADAMLVFGDILSVKIATDENGKSKGFGFVHFKREGAAKEAIDALNGMLLNGQEIMMAP,6.90992,"D11K, Y18A, T20A, F21M, S22L, S30V, E49K, E50R, Y72M, V73M",10
GNIFIKNLHIDIDNKALLDTMLVYGDILSSKIATDYNGKSKCFGFVHFKREGAVKEAIDALNGMLLNGQEIYVAP,7.0161695,"P10I, Y18L, F21M, S22L, F24Y, E36Y, G42C, E49K, E50R, A54V",10
GNVVIKNLHPDIDNKALYDTMLVFGDILRSKIATDRNGKVKGFGFVHFKREGAAKEAIDALNGMLLNGQEMYVAP,2.0961313,"I3V, F4V, F21M, S22L, S29R, E36R, S40V, E49K, E50R, I71M",10
GNIFVKNLHPDIDNKALLDAMLVFGDILSSKIATDEHGKSKGFGFVHFKREGKAKEAIDALNGMLLNGCEIYVAP,8.709348,"I5V, Y18L, T20A, F21M, S22L, N37H, E49K, E50R, A53K, Q69C",10
GQIFIKNLIPDIDNKALYDTMLIFGDILSSVIATDENGKSKGFGFVHFKREGAAKECIQALNGMLLNGQEIYVAP,4.7367353,"N2Q, H9I, F21M, S22L, V23I, K31V, E49K, E50R, A57C, D59Q",10
GNIFIKNLHPDIDNKILLDTMLVFGDILSSKIATDETGKSKGVGFVHMKREGAAKEAIDALNGMLLNGQEAYVAP,4.754314,"A16I, Y18L, F21M, S22L, N37T, F43V, F48M, E49K, E50R, I71A",10
GNIFIKNLHPDVDTKALYDTMLVFGDILSSKIMTDENGKSKGCGLVHFKREGVAKEAIDALNGMLLNGQEIYVAP,1.072504,"I12V, N14T, F21M, S22L, A33M, F43C, F45L, E49K, E50R, A53V",10
GCIFIKNLHPDIRNKALYDTMLVFGDILSSKIATDENGISKGFGFVHFKREGCAKEAIDALNGMLCNGQEIYVLP,3.5399,"N2C, D13R, F21M, S22L, K39I, E49K, E50R, A53C, L66C, A74L",10
GNIFIKNIHPDIDNKCLYDTMLVAGDILSSKIATCENGKSKGFGFVHFKREGAALEAILALNGMLLNGQEIYVAP,7.167308,"L8I, A16C, F21M, S22L, F24A, D35C, E49K, E50R, K55L, D59L",10
MNIFIKNLHPDIDNKALYKTMLVAGDILKSKIATDINGKSKGFGFVVFKREGAAKEAIDALNGMLLNGQEIYVAP,2.2663865,"G1M, D19K, F21M, S22L, F24A, S29K, E36I, H47V, E49K, E50R",10
GNIFIKNLHPDIDNKALYDTMLVFGDILSSKIATDENGKSIGVGFVHMKREGAAKEAIDALKGCLLNLQEIYVAP,4.3203144,"F21M, S22L, K41I, F43V, F48M, E49K, E50R, N62K, M64C, G68L",10
GNVFIKNLHPDIDSQALYDTMLVFGDILSSKVATKENGKSKGFGFVHFKREGAAKEAIDALNGMLLNGQEIYVIP,7.2471833,"I3V, N14S, K15Q, F21M, S22L, I32V, D35K, E49K, E50R, A74I",10
GCIFIKNLHPDIDNKALYDTMLVFGDIKSVKIATDENGVSKCFGFVHFKRRGAAKEAIDALNGMLLNGQEIYVAP,3.9932685,"N2C, F21M, S22L, L28K, S30V, K39V, G42C, E49K, E50R, E51R",10
GNIFIKNLHPDIDNKALYDAMLVFGDILSCKIATDENGISRGFGFVHFKRKGAAKEAIDALNGMLLNLQEIYVAP,8.790964,"T20A, F21M, S22L, S30C, K39I, K41R, E49K, E50R, E51K, G68L",10
GNIFIKNLHVDIDNKVLYDKMLVFGDILSIKIATDENGKSKGFGFVHMKREGAAKEAIDALNGMLLIGQEIYVAP,4.9986544,"P10V, A16V, T20K, F21M, S22L, S30I, F48M, E49K, E50R, N67I",10
GNIFIKNLHPDIDVKALYDTMLVFGDILSSKIMTDENGKSKGFGFVHFKREGCAKEAIDALNGILLQHQEIYVAP,7.223849,"N14V, F21M, S22L, A33M, E49K, E50R, A53C, M64I, N67Q, G68H",10
GNIFIKNLVPDVDNKALYDTMLVFGDILSSKIATNENGKSKGFGFVHFKRERAAKEAIDALNGMLLKGQEVYVAP,8.510929,"H9V, I12V, F21M, S22L, D35N, E49K, E50R, G52R, N67K, I71V",10
GNIFVKNLVPDIDNKILLDTMLVFGDILSSKIATDENGKSLGFGFVHFKREGAAKEAIDALNGLLLNGQEIYVAP,7.624488,"I5V, H9V, A16I, Y18L, F21M, S22L, K41L, E49K, E50R, M64L",10
GNIFIKNLHPDIDNKALYDTMLVVGLILCSKIATDEWGKSKGFGFVHFKREGAAKEAIDALNGMLINGQELYVAP,5.4135513,"F21M, S22L, F24V, D26L, S29C, N37W, E49K, E50R, L66I, I71L",10
GNIFIKQLHPDITNKALMDTMLVFGDILSSVICTDENGKSKGFGFVHFKREGAAKEALDALNGMLLNGQEIYVAP,4.904248,"N7Q, D13T, Y18M, F21M, S22L, K31V, A33C, E49K, E50R, I58L",10
GNVFIKNLHVDIDNKALYDTMLVFGDILSAKIMTDKNGKSKGFGFVHFKRKGAAKEAIDALNGMLLNGQEIYVAP,7.7050877,"I3V, P10V, F21M, S22L, S30A, A33M, E36K, E49K, E50R, E51K",10
GNIFIKNLHPDIDNKALYDTMLVFGDILSSKIATDENGKSKCFGAVHMKREGKAKEAIDALNGMLMLGQEIYVAP,4.7445917,"F21M, S22L, G42C, F45A, F48M, E49K, E50R, A53K, L66M, N67L",10
MGIFIKNLHPDIKNKALYDTMLVFGDILSVKIATDENGKSKGFGFVHFKREGAAKKAIDALNGMLLNGQEIYIAP,3.5170023,"G1M, N2G, D13K, F21M, S22L, S30V, E49K, E50R, E56K, V73I",10
GNIFIKNLHPDIDNKALYDTMLKFGDILSSKIVTDENGVMKGFGFVHFKREGFAKEAIDALNGMLLNGQEIVVAP,6.7371883,"F21M, S22L, V23K, A33V, K39V, S40M, E49K, E50R, A53F, Y72V",10
GNIFIKNLHPDIDNKALYKTMLVFGDIISSKVATDLNGKSKGFGFVHFKREGAAKEAIDALNKMKLNGQEIYVAP,8.012077,"D19K, F21M, S22L, L28I, I32V, E36L, E49K, E50R, G63K, L65K",10
GVIFIKNLHPDIDNKALVKTMLVFGDILSSKIATDENGKSKGVGFVHMKREGAAKEAIDALNKMLLNGQEIYVAP,1.905321,"N2V, Y18V, D19K, F21M, S22L, F43V, F48M, E49K, E50R, G63K",10
TNIFIKNLHPDIDNKALYKTMLVFGDILSVKIATDENGCSKGFGFVHFKREGAAKEAIDALNGMLLLLQEIYVAP,6.577135,"G1T, D19K, F21M, S22L, S30V, K39C, E49K, E50R, N67L, G68L",10
GNIFIKNLHPDIDNKRLYDAMLVFGTILVSKIACDENGKSKGFGFVHFKREGAAKEAIDALNGMVLNGQEIYVAP,6.8098063,"A16R, T20A, F21M, S22L, D26T, S29V, T34C, E49K, E50R, L65V",10
GNILVKNLHPDIDNKALYDTMLVFGDILSSKIACDENGLSKCFGFVHFKREGAAIEAIDALNGMLLNGQEIYVAP,5.4413185,"F4L, I5V, F21M, S22L, T34C, K39L, G42C, E49K, E50R, K55I",10
GNIFIKNLHPDIDNKALYDTMLVFGDILSSKIATDENGKSMGFGFVHFKREGAAKEAIDALNCVLVNGCVIYVAP,7.967841,"F21M, S22L, K41M, E49K, E50R, G63C, M64V, L66V, Q69C, E70V",10
GNIFCKNLHPDIDNKALYDTMLVFGDILLSKIATDLNGKMKGFGFVHFKREGAAKEAIDKLNRMLLNGQEIYVAP,4.2250557,"I5C, F21M, S22L, S29L, E36L, S40M, E49K, E50R, A60K, G63R",10
GNIFIKNLHPEIDNKALYDKMLVFGDILSSKIATCEFGKSKGFGFVVFKREGAAKKAIDALNGMLLNGQEIYVAP,5.0519705,"D11E, T20K, F21M, S22L, D35C, N37F, H47V, E49K, E50R, E56K",10
GNIFIKHLHPDIDNKALYDTMLVFGDILSSKIMMMENGKSKGFGFVHFKRRGAAKEAIDALNGMLLLGQEIYVAP,7.24347,"N7H, F21M, S22L, A33M, T34M, D35M, E49K, E50R, E51R, N67L",10
GNIFIKNLHPDINNKALYDTMLVFGDILSSKIATDETGKCKGFGFVHFKRKGAAKEAIDALNGMLLNCCEIYVAP,7.7532296,"D13N, F21M, S22L, N37T, S40C, E49K, E50R, E51K, G68C, Q69C",10
MNIFIKNLMPDIDNKALYDTMLVFGDILSSKVATLENGKSKGFGFVHFKREGAAKEAIDSLNGMLLNGQEILVAP,6.2233915,"G1M, H9M, F21M, S22L, I32V, D35L, E49K, E50R, A60S, Y72L",10
GNIFIKNLHPDIDNKALYDTMLMVGDIVSSKIVTDENGKSKGFGFVHFKREGAAKEAIDALNGMLLNGQEIYVCL,5.2054834,"F21M, S22L, V23M, F24V, L28V, A33V, E49K, E50R, A74C, P75L",10
GVIFIKNLHPDIDKKALYDTMLVFGDILSSKIATDENGKSLGFGFVHFKREGAAKEAIKALNGMLLNQQEIYVAY,2.3003826,"N2V, N14K, F21M, S22L, K41L, E49K, E50R, D59K, G68Q, P75Y",10
MNIFIKNLHYDIDDKALYDTMLVFGDILSSKIATDEVGKSKGVGFVHFKREGAAKEAIIALNGMLLNGQEIYVAP,5.42169,"G1M, P10Y, N14D, F21M, S22L, N37V, F43V, E49K, E50R, D59I",10
GNIMIKNLHPDIDNKALYDAMLVFGDILSSKIATDEYGKSKGFGIVHFKREAAAKEAVDALNGMLLNGQEIYVAP,1.9730378,"F4M, T20A, F21M, S22L, N37Y, F45I, E49K, E50R, G52A, I58V",10
GNVFIKNLHPDIDNKALYDTMLKFGDILSSVVATDENGKSKGFGFVHFKREGAAKEAIAAMNGMLLNGQEIYVAP,6.323017,"I3V, F21M, S22L, V23K, K31V, I32V, E49K, E50R, D59A, L61M",10
GNIFIKNLHPDIDCKALYDTMLVFGDILSSKIATDENGKSKGYGFCHFKREGAAKEAISALNGMFLNGQIIYVAP,7.6309705,"N14C, F21M, S22L, F43Y, V46C, E49K, E50R, D59S, L65F, E70I",10
GNIFIKNLHPDIDKKALYDTMLVFGDILSSKIATVENGKSKGFGFVHFKREGYAKEAIDALNGMLLNGQTIYVIV,5.040985,"N14K, F21M, S22L, D35V, E49K, E50R, A53Y, E70T, A74I, P75V",10
GNIFIRNLHVDIDNKALYDTMLVFGEILSSKIATDENMKSKGFGMVHFKREGAAKRAIDALNGMLLNGQEIYVAP,6.1591,"K6R, P10V, F21M, S22L, D26E, G38M, F45M, E49K, E50R, E56R",10
MNIFIKNLHPDIDNKALYDTMLVFGDIVSSKVETDENGKSKGFGFVHFKREGAAKEAIDALNRMLLNGQEIYCAP,6.543351,"G1M, F21M, S22L, L28V, I32V, A33E, E49K, E50R, G63R, V73C",10
MNIYIKNLHPDIDNKALYDTMLVFGDILQSVIATDENGKSRGVGFVHFKREGAAKEAIDALNGMLLNGQEIYVAP,2.3825564,"G1M, F4Y, F21M, S22L, S29Q, K31V, K41R, F43V, E49K, E50R",10
GNIFIKNLVPDIVNKALYDTMLVFGKILSSKVATVENGKSKGFGFVHMKREGAAKEAIDALNGMLLNGQEIYVAP,5.708377,"H9V, D13V, F21M, S22L, D26K, I32V, D35V, F48M, E49K, E50R",10
GNIFICNLHPDCDNKALYDTMLVFGNILSSKVATDENGKSKGFGVVHFKREGAAKEAIDALNGMLLNLQEIYVAP,1.5326216,"K6C, I12C, F21M, S22L, D26N, I32V, F45V, E49K, E50R, G68L",10
GNVFIKNLVRDIDNKVLYDTMLVFGDILSSKIATDENGKSKGFGFVHMKREGAAKEAIDALNGMLMNGQEIYVAP,7.891672,"I3V, H9V, P10R, A16V, F21M, S22L, F48M, E49K, E50R, L66M",10
GNIFVKRLVPDIRVKALYDTMLVFGDILSSKIATDENGKSKGFGFVHFKREGAAKEAIDALNGMLLNGQIIYVAP,8.0637665,"I5V, N7R, H9V, D13R, N14V, F21M, S22L, E49K, E50R, E70I",10
GNIFIKNLHPDIDNKALYDTMLVFGPILSVVIATDKNGKSKCFGFVHFKREGAAKEAIDALNGMLLNGQEIYVVP,6.1526814,"F21M, S22L, D26P, S30V, K31V, E36K, G42C, E49K, E50R, A74V",10
GNIVIKNLHPRIKNKALYTTMLVFGDILSSKIATDENGKSKGFGFVHFKREGAAKEAIDALNGCLLNGQLIYVAP,3.0833325,"F4V, D11R, D13K, D19T, F21M, S22L, E49K, E50R, M64C, E70L",10
GKIFIKNLHPDIDNKALYDTMLVCGDILSSKITTDENGCSKGFGIVHFKREGAAKEAIDALNRMLLNGQEIYVAP,-2.5844088,"N2K, F21M, S22L, F24C, A33T, K39C, F45I, E49K, E50R, G63R",10
GNIFIKNLHPKIDNKALIKTMLVFGDILSSKIATDENGKSKGFGFVLFKREGAAKVAIDALNSMLLNGQEIYVAP,5.86962,"D11K, Y18I, D19K, F21M, S22L, H47L, E49K, E50R, E56V, G63S",10
GNIVIKHLHPDIDNKALYDTMLVFGDILSSVIATDANGKSKGFAFVHYKREGAAKEAIDALNGMLLNGQEIYVAP,2.476925,"F4V, N7H, F21M, S22L, K31V, E36A, G44A, F48Y, E49K, E50R",10
MNIFIKNLHPDIDNKKLYDTMLVFGDILCCKIATDENGKSKGFGFVHFKREGEAKEAIDALNGMLLNGCEIYVAP,6.371007,"G1M, A16K, F21M, S22L, S29C, S30C, E49K, E50R, A53E, Q69C",10
GNLFIKNLHPDIDNKALADTMLVFGDVLSSKIATDENGKSKGFGFVHMKREGAAREAIDALNGMLLFGQEIYVAP,7.016674,"I3L, Y18A, F21M, S22L, I27V, F48M, E49K, E50R, K55R, N67F",10
GNIFIKNLVPDIDNKALYDTMLVFGDILSSKVICDENGYSKGFGFVHMKREGAAKEAIDALNGMLLNGQEIYVAP,7.4384947,"H9V, F21M, S22L, I32V, A33I, T34C, K39Y, F48M, E49K, E50R",10
GNIFIKNLHPDIDNKALYDTMLVYGCILSSKIITDENGKSKGFGFVHMKRHGAAKEAIDALNGMLLNGCEIYVAP,6.207244,"F21M, S22L, F24Y, D26C, A33I, F48M, E49K, E50R, E51H, Q69C",10
MNIFIKNLHPDIDNKALYDTMLVFGDILSVKIATCENGKSKGCGFVHFKREGAAKEAIDALNGMLINGQEIYVAI,4.670831,"G1M, F21M, S22L, S30V, D35C, F43C, E49K, E50R, L66I, P75I",10
GNIFIKKLHPDVDNHALYDTMLVFGDILSCKIATDENGKSKGFGFVHFKREGAAKEAIDALMGMLLNGQEVYVAP,6.795314,"N7K, I12V, K15H, F21M, S22L, S30C, E49K, E50R, N62M, I71V",10
GNILIKNLIPDIDNKALYDTMLVFGDILSSKIATDENGKSKGFGFVHFKREGAAKAAIKALNGMLLNGQEIYVKV,4.422127,"F4L, H9I, F21M, S22L, E49K, E50R, E56A, D59K, A74K, P75V",10
GVIFIKNLHPDIDNKTLYDTMLVFGDILSSKIATDENRKSVYFGVVHFKREGAAKEAIDALNGMLLNGQEIYVAP,0.47490996,"N2V, A16T, F21M, S22L, G38R, K41V, G42Y, F45V, E49K, E50R",10
GNIFIKNLHVDIDCKALYDTMLVCGDILSSKIATDEKGQSKGFGFVHFKREGAAKCAIDALNGMLLNGQEIYVAP,6.400796,"P10V, N14C, F21M, S22L, F24C, N37K, K39Q, E49K, E50R, E56C",10
GNIFIKNLHPDVDNKALKDAMLVFGDIVSSKIATDENGKSKGFGFVHFKREGAAKEAIDFLNGMLLNGQTIYVAP,7.1485853,"I12V, Y18K, T20A, F21M, S22L, L28V, E49K, E50R, A60F, E70T",10
GNIFIKNLIPDIDFKALYDTMLVFGDILSSKIATDENGKSKGFGFVHFKREGVAKEAIDALASMLLNGQEIYVAC,7.444315,"H9I, N14F, F21M, S22L, E49K, E50R, A53V, N62A, G63S, P75C",10
GNIVVKNLHPDIDNKALYKLMLVFGDILSSKIATDENGKSKGFGFVHFKREGAAKEAVDALNGMLLNGQECYVAP,4.676468,"F4V, I5V, D19K, T20L, F21M, S22L, E49K, E50R, I58V, I71C",10
GAILIKNLHPDIDNKALYDAMLVFGDILLSKIATDENGKSKGFGFVHFKREGAAKRAIDALNGMLLNGCEIYVAP,0.16194361,"N2A, F4L, T20A, F21M, S22L, S29L, E49K, E50R, E56R, Q69C",10
GVIFVKNLHPDIDNKALYDAMLVFGDILHSKIATDMNGKSKGFGFVMFKREGAAKEAIDALNGMLLNGQEIYVAP,1.2607973,"N2V, I5V, T20A, F21M, S22L, S29H, E36M, H47M, E49K, E50R",10
GNIFIKNLHPDIDDKALYDTMLVFGDILSSKIACDENGKSKVCGIVHFKREGAAKEAIDALQGMLLNGQEIYVAP,-1.711519,"N14D, F21M, S22L, T34C, G42V, F43C, F45I, E49K, E50R, N62Q",10
GNIVIKNLHPDVDSKAVYDTMLVFGDILSSRIATDENGKSKGFGFVHFKREGAAKEAIDALNGMLLNGQEIYVMP,2.207467,"F4V, I12V, N14S, L17V, F21M, S22L, K31R, E49K, E50R, A74M",10
GNIFIKNLHPDIDNKALYDTMLVFGDILSSVIATDENGKSKGLGFVLFKRKGAAKEAVDKLNGMLLNGQEIYVAP,0.6753094,"F21M, S22L, K31V, F43L, H47L, E49K, E50R, E51K, I58V, A60K",10
GNIFIKNLVPDIDNKALYDTMLVFGVVLSSKIATCENGKSKGFGFVCFKREGAAKEAIDALNGVLLNGQEIYVAP,7.2797737,"H9V, F21M, S22L, D26V, I27V, D35C, H47C, E49K, E50R, M64V",10
GNIFIKNLHLDIDNKMLLDTMLVFGDILSVIIATDENGKSKGFGFVHFKREGAAKEACDALNGMLLNGQEIYVAP,6.440402,"P10L, A16M, Y18L, F21M, S22L, S30V, K31I, E49K, E50R, I58C",10
GNIFIKNLHPDIDNKALYDTMLVFGDILSSKIATDEKGKSKGFGFVHMKREGAAKEAIDALNGVLLNRQIIVVAP,6.8259196,"F21M, S22L, N37K, F48M, E49K, E50R, M64V, G68R, E70I, Y72V",10
GNIFVKSLHPDIDNKALYDTMLVAGDILFSKIATDENGKSKGFGFCHFKREGAAKEAIRALNGMLLNGQEIYVAP,2.2734919,"I5V, N7S, F21M, S22L, F24A, S29F, V46C, E49K, E50R, D59R",10
GNIMIKNLHPDIDNKALYDTMLVFGDILSSKIATDEFGKSKCFGMVHFKRTGAAKEAIDALNGMLLNGCEIYVAP,5.7459984,"F4M, F21M, S22L, N37F, G42C, F45M, E49K, E50R, E51T, Q69C",10
GIICIKNLHPDIDNKALYDTMLVFGDVLSCKIMTDENGKSCGFGFVHFKREGAAKEAIDALNGMLLNGQEIYVAP,-1.7356213,"N2I, F4C, F21M, S22L, I27V, S30C, A33M, K41C, E49K, E50R",10
GNIFVKNLHPDIDNKALYDTMLVFGDILSSKMATDENGKSKGVGFVIFKREGAAKEAIDALNGMLLMGQEIYVAR,3.465144,"I5V, F21M, S22L, I32M, F43V, H47I, E49K, E50R, N67M, P75R",10
GNIFIKNLHPDIDNKALYDTMLVFGDILSSVIAVDENGKSKGFGFVHFKREGAAKTAIDALNGMMLNGQEILVFP,5.409081,"F21M, S22L, K31V, T34V, E49K, E50R, E56T, L65M, Y72L, A74F",10
GNIFIKNLHPDIDNKVLYDAMLVFGDILSSKVAMDENGKSKGFGVVHFKREGAAKEAIDVLNGMLLNGQEIYVAP,4.609221,"A16V, T20A, F21M, S22L, I32V, T34M, F45V, E49K, E50R, A60V",10
