Sequence,Score,Mutations,Number of Mutations
MKYKLILNGKTLKGETTTECSDAASALKQFQQYANDNGYDGEWNYEDATKTFTVTE,-3.9483159,"Q2K, A20C, V21S, T25S, E27L, V29Q, K31Q, V39Y, T44N, D46E",10
MKYKLILNGQTLKGVTTTEAVDAAPFERHFKQLANDNGVDVEWTYDDATKTATVTE,-4.237527,"Q2K, K10Q, E15V, T25P, A26F, K28R, V29H, Y33L, G41V, F52A",10
MKYKLILTGHTLKGETTCEATDAAEAERVFKQYANDNGVDREWKYDDATKTLTVTE,0.07392538,"Q2K, N8T, K10H, T18C, V21T, T25E, K28R, G41R, T44K, F52L",10
MQYKLTLNGAVLKGEHTTEAVDAATLEKVFKQQAIRNGGDGEWTYDDATSTFTVTE,-4.7587457,"I6T, K10A, T11V, T16H, A26L, Y33Q, N35I, D36R, V39G, K50S",10
MRYKIIANGKTLKGGTTTEAVDAATAEKVFKQYANDDIRHGEWTYDDTTKVFTVTE,1.1058553,"Q2R, L5I, L7A, E15G, N37D, G38I, V39R, D40H, A48T, T51V",10
MQYKLILNGKVLKGETTTKAVDYATAEKVFEQYAADNGVDKNWTVDKATKTFTLTE,-5.3352056,"T11V, E19K, A23Y, K31E, N35A, G41K, E42N, Y45V, D47K, V54L",10
MQYKLIVNGKTEKTETTIEAVDAATAQKVFKQYASDNGVDGEWVYDDFTKTFTRVE,-6.0898995,"L7V, L12E, G14T, T18I, E27Q, N35S, T44V, A48F, V54R, T55V",10
MQYKLIENEKTAKGETTTEKVDAATAEKVFKQYLNANGRDGEWTYNDATKEFTVTI,-2.9579234,"L7E, G9E, L12A, A20K, A34L, D36A, V39R, D46N, T51E, E56I",10
MKYKLILNRKKLTGEYLTENVDAATAEKVFKQYANDNGVQGEWAYDDATKTFTVTK,6.0270476,"Q2K, G9R, T11K, K13T, T16Y, T17L, A20N, D40Q, T44A, E56K",10
MQYELIYNGKTLTSETTDEAVDAATTEEVFKQYANDNGVDGEWDYDDATGTFTVTA,-3.9370632,"K4E, L7Y, K13T, G14S, T18D, A26T, K28E, T44D, K50G, E56A",10
MQYKLTLNGETLKGETTTEAVEAATALRVFKQYFNENKVDGEWTYNDATKTFTVTI,-3.8493502,"I6T, K10E, D22E, E27L, K28R, A34F, D36E, G38K, D46N, E56I",10
MQYKLILNGKTLPTEHTTEAVDAATAEKIAKQYANDNGDDGEWFYDDYDKTFTVIE,-1.4321007,"K13P, G14T, T16H, V29I, F30A, V39D, T44F, A48Y, T49D, T55I",10
MQFKVILNGKTLKGEITTDAVTSATAESLFGQYANDNGVDGEWTYDDATKTFTQTE,-2.5661986,"Y3F, L5V, T16I, E19D, D22T, A23S, K28S, V29L, K31G, V54Q",10
MKYKLVLNGKTLKAEATIEAVDAATAEKMFKQFANDNGFDGNHTYDDATKTFTVTE,1.8586916,"Q2K, I6V, G14A, T16A, T18I, V29M, Y33F, V39F, E42N, W43H",10
MQYKLILNGKTPKISTTTEAVDAATAEKRVKQWLNDNGVSGEWTYDDACKTFVVTE,3.6593285,"L12P, G14I, E15S, V29R, F30V, Y33W, A34L, D40S, T49C, T53V",10
MNYKLIFNGKTVKHETTVAAVDAATAENVFKQYANDNGWDGELTYDDATKTFTVAE,-5.2066975,"Q2N, L7F, L12V, G14H, T18V, E19A, K28N, V39W, W43L, T55A",10
MQYKLILNGKTLKGITTTAAVTAATAERVFKQSAALNGVDLEWSFDDATKTFTVTE,-0.9445305,"E15I, E19A, D22T, K28R, Y33S, N35A, D36L, G41L, T44S, Y45F",10
MQYKLILNGKTLNGETTTEAKDSTTAISVFDQYAADNGVDGEWVYDDATGTFTVTE,-5.378886,"K13N, V21K, A23S, A24T, E27I, K28S, K31D, N35A, T44V, K50G",10
MQYKLILNGKTLKEEYTTEAVDKATAEKVEKEYANYVKVNGEWTYDDATGTFTVTE,-3.6604779,"G14E, T16Y, A23K, F30E, Q32E, D36Y, N37V, G38K, D40N, K50G",10
MQYKLIAKGKDGKGETTTEAVDAATAERVFKAYANDNGIDGEWTYDDATDTFTREE,-0.53995097,"L7A, N8K, T11D, L12G, K28R, Q32A, V39I, K50D, V54R, T55E",10
MQYKIILNGKTLDGVTTFRAANAATAEKMFKQYANDNGVDGEWTYDAATKTFLVTE,8.238216,"L5I, K13D, E15V, T18F, E19R, V21A, D22N, V29M, D47A, T53L",10
MQYKLKLNGKTVKGYTLTEAVDRATFEKAFKQYANDNGVTGAWTYDDDTKTFTVTE,1.6794832,"I6K, L12V, E15Y, T17L, A23R, A26F, V29A, D40T, E42A, A48D",10
MQYKLIKDGKTLKGEYTTEAVDAATAEKIFKDYLDDNQPDGEWTYDDAVKTFTVTE,-5.895169,"L7K, N8D, T16Y, V29I, Q32D, A34L, N35D, G38Q, V39P, T49V",10
MKAKLILNGKPLKGETTFEAVDTATAEKVFKQYANDNGVKGQWTYDDAKKTFTEDE,1.6458057,"Q2K, Y3A, T11P, T18F, A23T, D40K, E42Q, T49K, V54E, T55D",10
MQVKLILNGKTLKGRFTTEAKDATTAEAVAEQYANHNGVDGEWTYDDKTKTFTVTE,-2.4119797,"Y3V, E15R, T16F, V21K, A24T, K28A, F30A, K31E, D36H, A48K",10
MAYKLILNGKTLKGIVTTEAVAVATAIKVFKQAAIDNGVDGSWTYDDATGTFTVTE,-1.7753555,"Q2A, E15I, T16V, D22A, A23V, E27I, Y33A, N35I, E42S, K50G",10
MQYKLVLNGKTLKRETFTEDVDAATAIKVLKDYANDNGVTGEWTYNDETKTFTVTE,-2.288721,"I6V, G14R, T17F, A20D, E27I, F30L, Q32D, D40T, D46N, A48E",10
MQYKLHLNGKTLKGETTTEAVAAATAEAVFEQYAADNGVDGEFTYDESTKDATVTE,-5.359143,"I6H, D22A, K28A, K31E, N35A, W43F, D47E, A48S, T51D, F52A",10
MQYKLILNGETLKGEHTIEAVDAAIAFKKFKQWANDNGVDTEWTFDDATKEFTVTE,-2.1128767,"K10E, T16H, T18I, T25I, E27F, V29K, Y33W, G41T, Y45F, T51E",10
MQYKLFLNGKTYKGETTTEAVDAATALKEFKQYANDSDVDGEVTYDDATNTVTLTE,-6.0662246,"I6F, L12Y, E27L, V29E, N37S, G38D, W43V, K50N, F52V, V54L",10
MEYKLILHGKTLNGETTFEAVDAESAEKVFKGYANTNGVDGEWTYDDATKTFTVCA,10.903025,"Q2E, N8H, K13N, T18F, A24E, T25S, Q32G, D36T, T55C, E56A",10
MKYKFILNGKTFKGEDTTEAVDAATAEKNFKQAANKNGVDGTVTYDDATKTFTVTQ,-0.028298818,"Q2K, L5F, L12F, T16D, V29N, Y33A, D36K, E42T, W43V, E56Q",10
MQYTLILNGKTLHGETIIEAVDAAVAEKVFKQIANDNGLDGEVKYDDKTKTFTVTE,1.8945049,"K4T, K13H, T17I, T18I, T25V, Y33I, V39L, W43V, T44K, A48K",10
MQYKLTLNGKTLNGETETETVDAATAAKMFKQYCNDNGYDVEWTYDDATKTFTVTT,-4.1119595,"I6T, K13N, T17E, A20T, E27A, V29M, A34C, V39Y, G41V, E56T",10
MKYKIILDGKTLKGETNTEATIAATAEKVFRQEAKDNGVDGEWTYDDATKTFTVKE,-2.042428,"Q2K, L5I, N8D, T17N, V21T, D22I, K31R, Y33E, N35K, T55K",10
MQYKLHLKGKTAKTETTTEQVDAARAAKVFKQYLNDQGVDGEWTYDDATLTFTVTE,-2.1670282,"I6H, N8K, L12A, G14T, A20Q, T25R, E27A, A34L, N37Q, K50L",10
MQYKLIKNTKNGSGETETEFVDAAVAEKVFKQYAKDNGVDGEWTYDDKTKTFTVTE,-0.9230202,"L7K, G9T, T11N, L12G, K13S, T17E, A20F, T25V, N35K, A48K",10
MQYKITLSGKSLKGETTTEAVDDATAEQVFQDYANDLGVDGEWEYDDATKTFTVTE,-5.385241,"L5I, I6T, N8S, T11S, A23D, K28Q, K31Q, Q32D, N37L, T44E",10
MQYKAILNGRTYKGGTTTEKVDEATAEKVCKQYANDNGVDGEWTYDNATKTLTVVE,2.0698285,"L5A, K10R, L12Y, E15G, A20K, A23E, F30C, D47N, F52L, T55V",10
MKYKLILNGKTLKGFTTTNAVDAAEAEKLFEQYSADNGVDGVWTYDDATKEFTVTE,-0.058697082,"Q2K, E15F, E19N, T25E, V29L, K31E, A34S, N35A, E42V, T51E",10
MRYKVIYNGKTLKGPTTTEAVDAVTAEAVFKQLANANGVDGIWLYDDATKTFTVTE,4.364442,"Q2R, L5V, L7Y, E15P, A24V, K28A, Y33L, D36A, E42I, T44L",10
MQYLLILNGKTLKDSTTTEATNKATAEKVFKQIAIDNGVTGEWTYDDATKTVTVTE,-2.769975,"K4L, G14D, E15S, V21T, D22N, A23K, Y33I, N35I, D40T, F52V",10
MQYKLIKNGKTLKGETTTKYVDAARVEKVIKQYAKDDWVDGEVTYDDATKTFTVTE,-5.1421404,"L7K, E19K, A20Y, T25R, A26V, F30I, N35K, N37D, G38W, W43V",10
MIYKLIKNGKSLKGETTTEAVDRATAQKVFKQWAEDNGVDGEWTYDDDTKTFEVTK,-5.03023,"Q2I, L7K, T11S, A23R, E27Q, Y33W, N35E, A48D, T53E, E56K",10
MQEGLILHGKTLTGETTTEAVDQATAEKIFRQYANDNGVDGVVTYDDATKTFTVIE,-3.349643,"Y3E, K4G, N8H, K13T, A23Q, V29I, K31R, E42V, W43V, T55I",10
MQYKLILNGKTLTGETTTNKVDAATAEKIIKDYVNDNGVDCYWQYDDATKTFTVTE,2.0610075,"K13T, E19N, A20K, V29I, F30I, Q32D, A34V, G41C, E42Y, T44Q",10
MQYKLILNGKTLNKEETTEAVSAATAEKVFKQYANMNGVSGEWTLDEATKTITVTY,2.5791938,"K13N, G14K, T16E, D22S, D36M, D40S, Y45L, D47E, F52I, E56Y",10
MAYKVALNGKTLKGTVTEEAVAAATAEKVFKQYANDNGVDGRWTYDDATKTWNVTE,3.277867,"Q2A, L5V, I6A, E15T, T16V, T18E, D22A, E42R, F52W, T53N",10
MQVKATLNGKTLKGESTTVAVNAATANMVFKQYAQANGVDGEWTYDDATKTFTVTE,-4.5835767,"Y3V, L5A, I6T, T16S, E19V, D22N, E27N, K28M, N35Q, D36A",10
MQYKVILNGKVEIQETTTEAVDARTAEKVFKVIANDNGVDGEWTFDDATKTFTVTQ,0.24899855,"L5V, T11V, L12E, K13I, G14Q, A24R, Q32V, Y33I, Y45F, E56Q",10
MQYKLILGGKTLKGETTTEAVDAATAHKVFKQLVADGYVDGVWIYDTATKTFTVTE,-4.637848,"N8G, E27H, Y33L, A34V, N35A, N37G, G38Y, E42V, T44I, D47T",10
MQYKLILNGKTLKNLTTTESIDRDTAEKVFKQYAHDNGVDGNWTYDDATKTFTGSE,-0.58256084,"G14N, E15L, A20S, V21I, A23R, A24D, N35H, E42N, V54G, T55S",10
MQYKLEANGKTLKGETTTGAVDAATAEKIFKQMMEDNGVEGEVTYDEATKTFTVTE,-2.422839,"I6E, L7A, E19G, V29I, Y33M, A34M, N35E, D40E, W43V, D47E",10
MQYYFILNGKTLKGETFTEASDKATIEKPFKKYANDNEVDGEWTYDDATKTYTVTE,-1.7160735,"K4Y, L5F, T17F, V21S, A23K, A26I, V29P, Q32K, G38E, F52Y",10
MQYKLTLNGKTLKGETTTEAVDRQTLEKVFHQVAIDNGVDGEWTYDDATQTFTLTK,-5.072098,"I6T, A23R, A24Q, A26L, K31H, Y33V, N35I, K50Q, V54L, E56K",10
MQYKLILNQKTLKSETTTEAVDAVTAVNVFKQYANDLGVDVEWSYDDKTKTFTVKE,-5.7796965,"G9Q, G14S, A24V, E27V, K28N, N37L, G41V, T44S, A48K, T55K",10
MQYKLILNGKKLKGETVTEAVSAETARKVFKQYANDNDVDGEWTYKEATKEFVVTE,3.5481136,"T11K, T17V, D22S, A24E, E27R, G38D, D46K, D47E, T51E, T53V",10
MQYKLILNGKTLKGETTVNAVDAGTAAQVFKQLANDNGFSGEWTYDDATKTVTVTP,-4.2264576,"T18V, E19N, A24G, E27A, K28Q, Y33L, V39F, D40S, F52V, E56P",10
MQYKVILTWKTSKVETVTEDVDAATAEDVFRQYANDNGLDGEWTYDDATKTFTVTE,-3.8268182,"L5V, N8T, G9W, L12S, G14V, T17V, A20D, K28D, K31R, V39L",10
MQYKLILKGKTLKYWTTTEAVDARTAEKVAKQYAHDNGYDGEWGYDDATWTFTWTE,-1.8771886,"N8K, G14Y, E15W, A24R, F30A, N35H, V39Y, T44G, K50W, V54W",10
MQYKVIRNGKTLLGETITEAVDSATAEKVFTQYANDNGVDGEPTYDDATDTWTVTK,-6.6246734,"L5V, L7R, K13L, T17I, A23S, K31T, W43P, K50D, F52W, E56K",10
MQYKLILNYATLKKETTIEAVDAATAEKVFIQYANDNEVDGEWVYDAVTKTFTVTL,-1.5099875,"G9Y, K10A, G14K, T18I, K31I, G38E, T44V, D47A, A48V, E56L",10
MQYKLILNGGTLKNTTTNEAVDKATAEKVAKQYANDNVKDGEWIYDDATKTFTVYE,-3.5924573,"K10G, G14N, E15T, T18N, A23K, F30A, G38V, V39K, T44I, T55Y",10
MQYKLILNGVTGAGATTIEAVDAAEAFKVFKQYANTSGVDGEWTYDDATKTVTVTE,-3.3729095,"K10V, L12G, K13A, E15A, T18I, T25E, E27F, D36T, N37S, F52V",10
MQYKLTLNGKTLLLETNTEAVDAATLEKHFEQYCNDDGVDGEWTYDDQTKTFTVTE,-4.540166,"I6T, K13L, G14L, T17N, A26L, V29H, K31E, A34C, N37D, A48Q",10
MQATLTLNGKTLKGETTTEHVDEATAEKVFKQYLNDYGVDGEWTYDAATKEFTKTE,-2.8058486,"Y3A, K4T, I6T, A20H, A23E, A34L, N37Y, D47A, T51E, V54K",10
MQYKLIINGKVVKGETTTETVDAATAEKVFKKTANDNGVKGEYTIDDATSTFTVTE,-0.13133416,"L7I, T11V, L12V, A20T, Q32K, Y33T, D40K, W43Y, Y45I, K50S",10
MKYKLILNGKTLKGITLTEDVDAAEAENVFKQYANDNEYDGEWTYDDATKTLTPTE,-4.697569,"Q2K, E15I, T17L, A20D, T25E, K28N, G38E, V39Y, F52L, V54P",10
MQYKLIINGTDLKGETTTDAKDAATAERVFKQNGNDNGVDGEWTYDKATKTGTVTE,-0.30053127,"L7I, K10T, T11D, E19D, V21K, K28R, Y33N, A34G, D47K, F52G",10
MQYKLILNGMTLKGETTTQYVDTATAMKVFKQYINDNGVDGTWTYDDAYVSFTVTE,-1.187093,"K10M, E19Q, A20Y, A23T, E27M, A34I, E42T, T49Y, K50V, T51S",10
MQYKLILNGESLKGITITNDVDAATAEKVFKQIADDNGVDGEWTYDDSTDTFTVTE,1.5837967,"K10E, T11S, E15I, T17I, E19N, A20D, Y33I, N35D, A48S, K50D",10
MQYKLILNGKTLKGETTTEFVDAATAAPVFKAALIDNGVDAEFTYDDATKTFTVTA,-7.04674,"A20F, E27A, K28P, Q32A, Y33A, A34L, N35I, G41A, W43F, E56A",10
MQYKLIANGKVLTGEATTEADCAATAFKVFKQWANDNGVDGTWTYDDVTKTFTVTE,2.6743438,"L7A, T11V, K13T, T16A, V21D, D22C, E27F, Y33W, E42T, A48V",10
MQYKLILNGKTSKGFTTTEAVSAATLEKQIKQYANDNGVEGEVTYDDETHTFTVTE,-3.8211977,"L12S, E15F, D22S, A26L, V29Q, F30I, D40E, W43V, A48E, K50H",10
MQYKLILDGHRLKGEFETEAVDAATAFKVFKQYANDNGVAGEWTYDDATKTATLKE,-2.826471,"N8D, K10H, T11R, T16F, T17E, E27F, D40A, F52A, V54L, T55K",10
MQYRLILNGKTLKGETLDYAVDAATGEKVFKQYEVDNGSDGGWTYDDATFTFTVTE,-4.565568,"K4R, T17L, T18D, E19Y, A26G, A34E, N35V, V39S, E42G, K50F",10
MQYKIILNGKTLKGELTTEAVDAETASKVAKQYAKDNGVDGEVTADDATGEFTVTE,-6.4595113,"L5I, T16L, A24E, E27S, F30A, N35K, W43V, Y45A, K50G, T51E",10
MQYKLILNGEALKGETTILAVDAATAEKVFKKYFYDNFVDGEWIYDDATKTFTVRE,-1.1368535,"K10E, T11A, T18I, E19L, Q32K, A34F, N35Y, G38F, T44I, T55R",10
MQYKILLNGKELKGETTTEASDLATAEKVFAQTANDNGIDGEWTYDDATKTFTPTA,-5.9069223,"L5I, I6L, T11E, V21S, A23L, K31A, Y33T, V39I, V54P, E56A",10
MQYKLIINGKHLEGTVTTDAVDAETAEKVFKQYCNDNGVFGEWTYDDATTTFTVTE,11.806625,"L7I, T11H, K13E, E15T, T16V, E19D, A24E, A34C, D40F, K50T",10
MKYKLSVNGKTLKGETTTEAKMAATAEKVFKKYADDNDVDGEYTYDEATKTFTVTE,-0.6012499,"Q2K, I6S, L7V, V21K, D22M, Q32K, N35D, G38D, W43Y, D47E",10
MEYKLILNGKTTLGELTTYAVDAAAAEKAVKQYANDNFVAGEWTYDDATKTFTVTE,7.221326,"Q2E, L12T, K13L, T16L, E19Y, T25A, V29A, F30V, G38F, D40A",10
MIYKAILNGKTLKGETEVEASDAATAIKVFKQYANDLLFDGEWTYDDATKTFTVTL,-1.3088411,"Q2I, L5A, T17E, T18V, V21S, E27I, N37L, G38L, V39F, E56L",10
MDYKLILNGKTLKGHYTTPAVDAATAEAEFKSHAAENGVDGEWTYDDATKTFTVTE,-0.36239782,"Q2D, E15H, T16Y, E19P, K28A, V29E, Q32S, Y33H, N35A, D36E",10
MQYKLILNGKTFKGHTTTEKVDAATAEGVFQQYANDNEVEGAATYDDATKQFTVTE,-4.785818,"L12F, E15H, A20K, K28G, K31Q, G38E, D40E, E42A, W43A, T51Q",10
MQIKLILNGKTLKRETTTMATDEAAAIKVFKQYANDNGYDGEWTYDMATKTFTVTD,-4.2338686,"Y3I, G14R, E19M, V21T, A23E, T25A, E27I, V39Y, D47M, E56D",10
MQYKLILNGKVLKVETTTEAVDAKLAMIVFKQYANDNGVNGEWQYDDQTKTLTVTE,-3.1098366,"T11V, G14V, A24K, T25L, E27M, K28I, D40N, T44Q, A48Q, F52L",10
MQYKLILEGKTLKPATTTEAVDHASAEKVFKQYANDCGVDGEYKYDDGTKTYTVTE,-2.9766982,"N8E, G14P, E15A, A23H, T25S, N37C, W43Y, T44K, A48G, F52Y",10
MQYKLILNGGTLKGYTELEAVDSATAEKIINQYANDNGVTGEWTYDDATKTFTVTK,-0.41036916,"K10G, E15Y, T17E, T18L, A23S, V29I, F30I, K31N, D40T, E56K",10
MKYKMILNGDTEKGETTTEAVDEATAEKVFAKYANDNGVDIECIYDDATKTFTVTE,-6.308752,"Q2K, L5M, K10D, L12E, A23E, K31A, Q32K, G41I, W43C, T44I",10
MAYKLILNGKTLKGLTTTLAIDKATAEKVFQQYANDNGVDHNWTYDSATETFTVTE,-2.732826,"Q2A, E15L, E19L, V21I, A23K, K31Q, G41H, E42N, D47S, K50E",10
MQYKLILNGKTLKTETTTEGVDAATAFKAFKQLANDNGVDGSFTYDDAKVTFTVWE,-2.3967535,"G14T, A20G, E27F, V29A, Y33L, E42S, W43F, T49K, K50V, T55W",10
MQYKLILNGKTLKGVTTTSAVDLATYEKGFINYANDNGVDGIWVYDDAKKTFTVTE,-2.2619493,"E15V, E19S, A23L, A26Y, V29G, K31I, Q32N, E42I, T44V, T49K",10
MQYTLILNGVTLKGETTTEAVDAAEAVKVAKQSANDNGVDYEITYDDATKTFTAKE,-6.1113305,"K4T, K10V, T25E, E27V, F30A, Y33S, G41Y, W43I, V54A, T55K",10
MQYKLIDEGKTLIMETTTDKVDAATAEKKFKQYVTDNGVGGEWTYDDATKTFTVTE,0.048526525,"L7D, N8E, K13I, G14M, E19D, A20K, V29K, A34V, N35T, D40G",10
MQVKLILNGKTLKGETTTSAVDEANALKDFKTMAKDNGVDGEWTYDDATKTFTQTE,-5.1205387,"Y3V, E19S, A23E, T25N, E27L, V29D, Q32T, Y33M, N35K, V54Q",10
MQYKLTLNGKTYKKETQTEAEAKATAIKVFKQWANDNGVDGEWTYDDATKTFTVME,-4.0300527,"I6T, L12Y, G14K, T17Q, V21E, D22A, A23K, E27I, Y33W, T55M",10
MQYTLILNGITLKTEKTVPSVDAATALKVFKQYANDNDVDGEWFYDDATKTFTVTE,1.7518563,"K4T, K10I, G14T, T16K, T18V, E19P, A20S, E27L, G38D, T44F",10
MQYKAILIGKTGKRETTTEAVDADTMLKVFKQYQNDTDVDGEWTYDDATKTFTVTE,-5.237612,"L5A, N8I, L12G, G14R, A24D, A26M, E27L, A34Q, N37T, G38D",10
MAYKLILNGITLKGETTTEDVDAATAEIVAKQYANNNGVYIEVTYDDATKTVTVTE,-4.311689,"Q2A, K10I, A20D, K28I, F30A, D36N, D40Y, G41I, W43V, F52V",10
