Sequence,Score,Mutations,Number of Mutations
IEKFKLLMEKVEEIVAKNARAEIDYLDAPDEFRDPLTDTLMTDPVRLPSGTVMDRSIILRHLLNSPTNPATGRMLTESMLEPVPESKEQIQRWMREKQSSDH,-0.9331099,"A8M, S26L, M37T, D68N, F70A, N71T, R72G, Q73R, L86S, A92R",10
MEKFKLLAEKVEEIVAKNARAIIDYSDAPDEFRDPLTDELMTDPVRLPSGTVMDRSIILRHMLNSCTNPFTRQMLDESMLEPVPELKEQIQAWMRIKQSSDH,4.235424,"I1M, E22I, M37T, T39E, L62M, P66C, D68N, N71T, T76D, E96I",10
IEKEKMLAEKVEEIVAKNARAEIDDSDAPDEFRDPLTDTLMTDPVRLPSGTVMDRSIINRHLLNSPTNPFTRQELTESMLENVPELKEQIQDWMREKQSSDH,7.4090652,"F4E, L6M, Y25D, M37T, L59N, D68N, N71T, M74E, P82N, A92D",10
IEKFKLLAEKVYEIVAVNARAEIDYSDDPDEFRDPLTYTLMTDPVRLPSGTVMDRSIILRHLLNSPTNPFTRQMLTLSMLEPVPEIKEQIQALMREKQSSDH,1.4635224,"E12Y, K17V, A28D, M37T, D38Y, D68N, N71T, E77L, L86I, W93L",10
INKFKLLAESVEEAVAKNARAEIDYSDAPDEFRDPLTDTLMTDPVRLPSGTVLDRSIILRHLDNSPTNPFTRQMLTESMLPPVPNLKEQIQAWMREKQSSDH,9.11891,"E2N, K10S, I14A, M37T, M53L, L63D, D68N, N71T, E81P, E85N",10
IEKFKLLAEQVEEIVAKNARAEDDYSDAPDEFRDPLTDTLMRDPVRLPSGTVMDRSIILRHLLNSSTNPITRQMLTESMLEPVNEPKEQIQAWMREKQSSDH,-1.1386826,"K10Q, I23D, M37T, T42R, P66S, D68N, F70I, N71T, P84N, L86P",10
IEKFKLLAEKVEEIVAKNARAHVDYSDAPDEFRDPLTDTLMTDPVRLPSGTVMDRSIILRHLLNSFTNPFTRQMVTESMLEPVPELKEQIQAWMREKQSNIS,0.31454462,"E22H, I23V, M37T, P66F, D68N, N71T, L75V, S100N, D101I, H102S",10
IEKFIQLAEKVEEIEAKNARAELDYSDDPDEFRDPLTDTLMTDPVRLPSGTVMDRSIILRHFLNSPTNPFTRQMLTESMLEPVPELKEQIQAWIREKQSSDH,3.0278401,"K5I, L6Q, V15E, I23L, A28D, M37T, L62F, D68N, N71T, M94I",10
IEKFKLLAEKVEEIRAKAARAEIEYSDAPDAFRDPLTDTLMTDPVRLPSGTVMDRSIILRHLENSPTNPFTRQMLTESMLEPVVEFKEQIQAWMREKQSSDH,6.0151434,"V15R, N18A, D24E, E31A, M37T, L63E, D68N, N71T, P84V, L86F",10
IEKYKLLAEKVEDIVAKNARAEIDYSDWPDEFRDPLTDTLMTDPVRLPEGTVMDRSIILRHLLNSPTNPFTRQMLTESMLPPVDELKEQIQTWMREKQSSDH,4.8519883,"F4Y, E13D, A28W, M37T, S49E, D68N, N71T, E81P, P84D, A92T",10
IEKFKDLAEKVEEIVLKNARAEIDYSDAPDEFRDPLTDTLMTDPVRLDSGTVIDRSIILRHLLNSPTNPFTRQMLFESMLEPVPELREQIEAWMREKQSSDH,7.0021286,"L6D, A16L, M37T, P48D, M53I, D68N, N71T, T76F, K87R, Q91E",10
IEKFKLLAEKVEEIVAKNARAEIDYSDAIEEFRDPLTDILMTDPVRLPNGTVMDRSIILRHLLNKPTNPFTRQMLTEEMLEPVPELKEQIQAWMREKNSSDH,4.397958,"P29I, D30E, M37T, T39I, S49N, S65K, D68N, N71T, S78E, Q98N",10
IEKFNLLAEKVEEIVAKNARAEIDYSDAPDEFRDPLTDTLMPDPVRLPSGTVIDRSIILRHLLNSPTNPFTRQMLTESVLSPNPELKERIQAWMREKQSSDH,2.900796,"K5N, M37T, T42P, M53I, D68N, N71T, M79V, E81S, V83N, Q89R",10
IEKFKQLAEKVEHDVAKNHDAEIDYSDAPDEFRNPLTDTLMTDPVRLPSGTVMDRSIILRHLLNSPTNPFTRQMLTESMLEPVPELKETIQAWMREKQSSDH,4.2022266,"L6Q, E13H, I14D, A19H, R20D, D34N, M37T, D68N, N71T, Q89T",10
IEKFKLVAEKIEEIVAKNARANIDNSDAPDEFRDPLTDTLMTDPVRLPSGTVMERSIILRHLENSPTNPFTRQMLTESMLEPVPELKEQIQAWMREKQSPDH,3.8269105,"L7V, V11I, E22N, Y25N, M37T, D54E, L63E, D68N, N71T, S100P",10
IEHFKLLAEKVEEIVDKNARAEIDYSDAPDEFRDPLTYTLMTDPVRLPSGTTMDRSIILRHLLNSPTNPFTRQMLTEKMVEPVPELKKQIQAWMREKQSSDH,5.137408,"K3H, A16D, M37T, D38Y, V52T, D68N, N71T, S78K, L80V, E88K",10
IEKFKQLAEDVEQIVAKNMRAEIDYSDAPDEFRDPTTDTLMTDPVRLPSGTVMDRSIILRHLLDSPTNPFTKQMLTESMLEPVPELKEQIQAWMREKQSSDH,2.244493,"L6Q, K10D, E13Q, A19M, L36T, M37T, N64D, D68N, N71T, R72K",10
IEKFKLLAELVEEIVRNNARAEILYSDAPDEFRDPLTDTLMTDPVLLPSGHVMDRSIILRHLLNSPTNPFTHQMLTESMLEPVPELKEQIQAWMREKQSSDH,-0.30233508,"K10L, A16R, K17N, D24L, M37T, R46L, T51H, D68N, N71T, R72H",10
MEKFKLLAAKVEEIVAKNARAEIDYSDFPDEFRDPLTDTLMTDPVRLSSGTVMKRSIILRHLLNSPTNPFTRQMLTRSMLDPVPELKEQIQAWMREKQSSDH,1.1598637,"I1M, E9A, A28F, M37T, P48S, D54K, D68N, N71T, E77R, E81D",10
IEKFKLLAEKVEEIVAKNARAEIDDSYAPDEFRNPLTDTFMTDPVRLPSGTVMDRSIIYRHLLNSPTNPFTRQQLTESMLEPVQELKEQIQAWMREKQSSDH,4.1740427,"Y25D, D27Y, D34N, M37T, L40F, L59Y, D68N, N71T, M74Q, P84Q",10
IEKFKLEAEKVEEIVAKNARAEIDYDDAPDEFRDPLTDTLMTDPVRLPNGTVMDRSIILKHLLNSPTNPTTRQMLTESMLERVPELKEQIQAWMREKQSDDH,4.2628965,"L7E, S26D, M37T, S49N, R60K, D68N, F70T, N71T, P82R, S100D",10
IEKFKLLAEKVEEIVRKNADAEIDYSDAPDEFRDPLTFTLMTDPVRLPSGDIMDRSIILRHLLNSPENPFTRQMLTESMIEPVPELKEQIQAWMREKQSSDH,4.578559,"A16R, R20D, M37T, D38F, T51D, V52I, T67E, D68N, N71T, L80I",10
IEKFKLLAEKHEEIVEKNASAEIDDSDAPDEFRDPLTDTLMTDPVRLPSGTVMDRSIIERHLLNSPTNPLTRQDLTESMLEPVPELKEQIQAWMREKQSSDH,3.724084,"V11H, A16E, R20S, Y25D, M37T, L59E, D68N, F70L, N71T, M74D",10
IEKEKLEAEKVEVIVAKEARAEIDVLDAPDEFRDPLTDTLMTDPVRLPSGTVMDRSIILRHLLNSPTNPFTRQMLTESMLEPVPELKEQIQAWMREKQSSEH,5.020284,"F4E, L7E, E13V, N18E, Y25V, S26L, M37T, D68N, N71T, D101E",10
IEKFKLLAEKVEEIVAKTARAEIDYSDAPDEFRDPLTMTLMTDPVRLPSGTVMDRRIILRHLLNSQTNPFTRQMLTESMLQPVNELVEQIQAWMREKQSSDH,4.981223,"N18T, M37T, D38M, S56R, P66Q, D68N, N71T, E81Q, P84N, K87V",10
IEKFKLNAEKVQEIVAKKARAEIDYSDAPDEFRDPLTDTLMEDPVRLPSGTIMDRSIILRHLLNSPTNPFTRQMLTESMLEPVPELKEQIQAWMFEKQSSDA,4.58811,"L7N, E12Q, N18K, M37T, T42E, V52I, D68N, N71T, R95F, H102A",10
IEKFKLLAEKGEEIVGKNARAEIDYSDAPDEFRDPLTDELMTDPVRLPSGTVMDRSIILRHLLNSPTNPFTRLMLTESMLETVPELKEQITFWMREKQSSDH,2.5677857,"V11G, A16G, M37T, T39E, D68N, N71T, Q73L, P82T, Q91T, A92F",10
IEKFKLLAEKKEKIVAKNARAEIDYSDAPDEFRNPLTDTLMTDPVRLPSGTVMDRSIIKRHLDNSPTNPFTREMLTESMLEPNPELKEQIQAWMREKQSSDH,2.273891,"V11K, E13K, D34N, M37T, L59K, L63D, D68N, N71T, Q73E, V83N",10
IEKFKLLAEKVEEMVAKNASAEIDYSDAPDEFRDPLTDTLMTDPVYLPSGTVMDRSIIQRHLLNSPTNPFTRQMLTESALEPVPELKEQIKAWMSEKQSSDH,3.9687004,"I14M, R20S, M37T, R46Y, L59Q, D68N, N71T, M79A, Q91K, R95S",10
IVKFKLLAEKVEEIVAKNARAEIDYSDAPDEFRDPLTYTLMDDPVRLPSGTVMDRSIALRHLLNSPTNPFTRQMLTDDMLEPVPELKEQIQAWMREKQDSDH,6.4976683,"E2V, M37T, D38Y, T42D, I58A, D68N, N71T, E77D, S78D, S99D",10
IEKFKLLAEKVEEKVAKNARADIDYSDDPDEFRDPITDTLMTDPVRLPSGTVMDRSIILRHLLNKPTNPFTRQMLTESVLEPVPELKEQIIAWMREKQSSDH,3.409216,"I14K, E22D, A28D, L36I, M37T, S65K, D68N, N71T, M79V, Q91I",10
IHKFKLDAEAVEEIVDKNARAEIDYSDFPDEFRDPLTDTLMTDPVRLPSGTVMDRSIILRHLLNSPTNPFTRQSLTESMLEPVDELKEQIQAWMREKQSSDH,4.985579,"E2H, L7D, K10A, A16D, A28F, M37T, D68N, N71T, M74S, P84D",10
IEKFKLLEEKVEEIVAKNARAEIDYSDAPDEFTDPLTDTLMTDPVRLPSGTVLDRSIILRHLLNSPTNPVTRQMLTESMREEVPELKEQILAWMREKQSSDH,1.2538178,"A8E, R33T, M37T, M53L, D68N, F70V, N71T, L80R, P82E, Q91L",10
IEKFKLLAEKVEEIVATNARAEIDYSDAPDEFRDPLTDTLMTDPIRLPSGTVMDRSIILRHFLNSPTNPFTRQMLTPSMLEPVPEIKEQIQAWMREKEQSDH,3.5021417,"K17T, M37T, V45I, L62F, D68N, N71T, E77P, L86I, Q98E, S99Q",10
IEKFKPLAEKVEHIVAKKDRAEIDYSDAPDEFRDPLTDTLMTDPVRLVSGTVMDRSIILRHLLNSPTNPFTRQMLTEEMLEPVPELKEQIQAWMRDKQSSDH,3.0153227,"L6P, E13H, N18K, A19D, M37T, P48V, D68N, N71T, S78E, E96D",10
IEKFKLLAEKVEEIVADNGRAEIDYDDAPDEFRDPLTDNLMTDPVRLPSGTVMDRSIILRHLLNSPTNPFTRQMLTESNLEPVPELKEKIQAWMEEKQSSDH,4.6130786,"K17D, A19G, S26D, M37T, T39N, D68N, N71T, M79N, Q89K, R95E",10
IEDFKLLREKIEEIVAKNARAEIDYFDAPDEFRDPLTDTLMTDPVLLPSGTVMDRSIILRHLLNSPTNPITRQMLTESMLEPVPELKEQIQAWIREKQSSDH,2.004695,"K3D, A8R, V11I, S26F, M37T, R46L, D68N, F70I, N71T, M94I",10
IEAFKILAEKVEEIVAKNARAEIDYSDAPDEFRDPLTDTLMKDPVRLPSGTVMDRSIILRHLLNKPTNPFTRQMLTESMLEPVPELKEQIQAFMDEKQMSDH,4.281497,"K3A, L6I, M37T, T42K, S65K, D68N, N71T, W93F, R95D, S99M",10
IEKFKALAEKVEEIFAKNARAEIDYSDLPDEFRDPLTYTLMTDPVRLPSGTVMERSIILRHLLNSPTNPMTRQMLTESMLEPVIELKEQIQAWMREKQSSDH,5.83108,"L6A, V15F, A28L, M37T, D38Y, D54E, D68N, F70M, N71T, P84I",10
IEKFKLLAEKVAEIISKNARKEIDYSDAPDEFRDPLTDTLMTDPVRLPSGTVMDRSIILRHLLNKPTNPFTRQMLNESMLEPVPELKEQIQAWMREAQSSDH,3.716317,"E12A, V15I, A16S, A21K, M37T, S65K, D68N, N71T, T76N, K97A",10
IEKFKLLAEKLEEIGAKNARAEIDGSDAEDEFRDPLTDTLMTDPVRLPSHTVMDRSIIERHLLNSPTNPFTRQMLTESMLEPHPELKEQIQAWMREKQSSDH,3.4918702,"V11L, V15G, Y25G, P29E, M37T, G50H, L59E, D68N, N71T, V83H",10
IEKFKLLAEKVEEIVAKNARAEIVYSDAPDEFRDPLTDTLMTDPVRLPSGTVMDRSIILRHLLNSPTNPFTRKMLTTSDLESVPELKEEIQAWMREKQSSSH,2.777761,"D24V, M37T, D68N, N71T, Q73K, E77T, M79D, P82S, Q89E, D101S",10
IEKFKLLAEKVEEIVAKNARAEIDYSDLIDEFRDPLTDTLMTDPVVLPSGTVMDRSIILRHLLNSPTNPFTRQMLDESMLEPVPELKEQIQAWYHEKQSSDQ,4.8121014,"A28L, P29I, M37T, R46V, D68N, N71T, T76D, M94Y, R95H, H102Q",10
IELFKLLAEKVEEIVAKNARAEIDYSDAPDEFRDPLTDTLMTDPVRLPSGTVLDRSIILRHLLNSPTNPFTRQMLDESMLEPNPELKEQIQAWIRNKQSHDH,7.1119404,"K3L, M37T, M53L, D68N, N71T, T76D, V83N, M94I, E96N, S100H",10
IEIFKLLAEKREEIVAKNARAEIDYSDAPDEFRDPVTDTLMTDPVRLPSGTVLDRSIILRHLLNSPTNPFTRQMLTFSELEPVTELKEQIQAWMREKQSSDH,6.963562,"K3I, V11R, L36V, M37T, M53L, D68N, N71T, E77F, M79E, P84T",10
IEDFKPLAEKVEEIVAKNARADIDYSDAPDEFRDPLTDTLMTDPVRLPSGTVLDRSTILRHLLNSPTNPFTRQMLTESMLEPVPELKEQIQAWMRESQSSDA,9.316819,"K3D, L6P, E22D, M37T, M53L, I57T, D68N, N71T, K97S, H102A",10
IEKQKLKAEKVEEIVAKNARAEIDYSSAPDEFRDPLTDTLMTDPVRLPSGTVMDRQIIDRHFLNSPTNPFTRQMLTRSMLEPVPELKEQIQAWMREKQSSDH,4.6954136,"F4Q, L7K, D27S, M37T, S56Q, L59D, L62F, D68N, N71T, E77R",10
IEKFKLLAEKVEEIVAKNARAEIDYSDAPDEFRDPLTDELMTDPVRLPSGTVMDRSAILRHLLNTPTNPFTRQMLTEVMLKPVPELKEQIQAWMREKDSSDG,3.1320589,"M37T, T39E, I57A, S65T, D68N, N71T, S78V, E81K, Q98D, H102G",10
EEKFKLLAEKVEEIVAKNARAEIDYSDAPDEFRDPLTDTLMTDPVRLPSGTVMDRSILLRHLLNSPTNPFTRQMLDESNLETVPELKEQIQAWMREKQNSLH,2.214211,"I1E, M37T, I58L, D68N, N71T, T76D, M79N, P82T, S99N, D101L",10
IEKFKELAEKVEEIVAKNARAEIDLSDAPDEFRNPLTDTLMTDPVRLPSGTVMDRSIILRHLNNSPTNPFTRTMLTESMLEPVPELKVQIQAWMRDKQSSDH,2.137793,"L6E, Y25L, D34N, M37T, L63N, D68N, N71T, Q73T, E88V, E96D",10
IEKFKLAAEKVEEIVAKNDRAEILYSDAPDEFQDPLTDTLMTDPVRLPSGTVMDRSIILRHLLNSPTNPFTRQMLTESMAEPVPELNEQIQAWMREKQQSDH,1.8598742,"L7A, A19D, D24L, R33Q, M37T, D68N, N71T, L80A, K87N, S99Q",10
IEKFKLLAEKVEEIVAKNARALIDYSDAPDEFRDPLTDTLMTDPVMLPSGTVVDRSIILSHLLNKPTNPFTRQMLTESPLEPVPELKEQIQAWVREKQSSDH,5.5744553,"E22L, M37T, R46M, M53V, R60S, S65K, D68N, N71T, M79P, M94V",10
IEKFKLLAEKVEEIVAANARAEIQYSDAPDEFRDPLTDTLMSDPVRLPSGTVLDRSDILRHLLTSPTNPFTRQMLTESMLAPVPELKEQIQAWMREKQSSDH,7.059468,"K17A, D24Q, M37T, T42S, M53L, I57D, N64T, D68N, N71T, E81A",10
IEKEELLAEKVEEIVAKNARAEIEYLDAPDEFRDPLTDTLMTDPVRLPSGTVMDRSIILRHLLNSPTNPFTRQMLTEQMLVPVPELKEQIQAWMREKQESDH,6.118066,"F4E, K5E, D24E, S26L, M37T, D68N, N71T, S78Q, E81V, S99E",10
IEKFKLLKEKVEEINAKNARAEIDYSIAPDEFRDPLTDTLMEDPVRLPSGTVLDRSIILRHLLNSPTNPFTRQMLTESMLEPVPELKERIQAWQREKQSSDH,9.507828,"A8K, V15N, D27I, M37T, T42E, M53L, D68N, N71T, Q89R, M94Q",10
IEKGKFLAEKVEELVAKNARAEIDYSDAPDEFRDPLTDTLMTDPVRLPSGTVMDRSIILRHLLNSATNPYTRQMLTEVMLEPVPELKEQIQDWMREKQSSDH,5.8105836,"F4G, L6F, I14L, M37T, P66A, D68N, F70Y, N71T, S78V, A92D",10
IEKEKLLAEKVEEIVAKGARAEIDYSIAPDEFRDPLTDTLMTDPVRLPSGTVMDRSIILRHLLNSRTNPFTRQMLTESMLEPVPELKEQIQAWMRERLSSDE,4.1979737,"F4E, N18G, D27I, M37T, P66R, D68N, N71T, K97R, Q98L, H102E",10
IEKFKLLAEKVEEIVAKNARAEIDYSDDPDFFRDPLTDQIMTDPVRLPSGTVMDRSIILRHLLDSPTNPFTRQMLTESTLEPVPELKEQIQAWMREKQSSNH,0.43859664,"A28D, E31F, M37T, T39Q, L40I, N64D, D68N, N71T, M79T, D101N",10
IEKFKLPAEKVEEIVAKNARAEIDYSDEPDEFRDPLTDTLMTDPVRLPSGTVMDRSIILRHLLNSQTNPMTRQMLTEQDLEPVPELKEQIQRWMREKQSSDH,3.8602982,"L7P, A28E, M37T, P66Q, D68N, F70M, N71T, S78Q, M79D, A92R",10
IEKFKLLADKVEEIVAKNARAEIDYSAAPDEFRDPLTDTLMTDPVRLPSGVVMDRSIILRHLLRSPTNPFTRQDLTESMLEPVLELDEQIQAWMREKQSSDH,3.7182274,"E9D, D27A, M37T, T51V, N64R, D68N, N71T, M74D, P84L, K87D",10
IEKFKLLAEKVEEIVAKNARIEIDYSDAPDEFRDPLTNTLMTDPVRLASGVVMDRSIALRHLLNSTTNPFTRQMLTESMLENVPELKEQIQAWMREKQSSDH,0.03768237,"A21I, M37T, D38N, P48A, T51V, I58A, P66T, D68N, N71T, P82N",10
IEALKLLAEKVEEIVAKNARAEIDYSDAPDEFRDPLTDTLMTDPVRLPDGTTMDRSIILRHLSNSPTNPFTRQMLTESMLEPVPEVKEQVQAWMREKQSSDH,3.5965767,"K3A, F4L, M37T, S49D, V52T, L63S, D68N, N71T, L86V, I90V",10
IEKFKLLAEKVEEIVAKNARAEIDDIDAPDNFRDPLTDTLMTDPVRLPSGTVMDRSIILRHLLNSPTNPFTRQMLNESMLEPVPELKDQIQAWMRELQKSDH,7.502652,"Y25D, S26I, E31N, M37T, D68N, N71T, T76N, E88D, K97L, S99K",10
IEKFKLLAEKEEEIVAKNDRAEIDYSDAPDEFRDPLTDTLMPDPVRLPSGTVMDRSIILRHSLNSPKNPFTRQMLTESMLEPVPELKEQIQAWMREHQASDH,2.6394753,"V11E, A19D, M37T, T42P, L62S, T67K, D68N, N71T, K97H, S99A",10
LEKFKLLAEKVEEIVAKNERAEIDYSDAPDEFRNPLTDTLMTDPVRLPSGTVMDRSIILRHLKNSPTNPLTRQMLTESMLEPVPRLKEQIQAWMREKQSSDD,-1.5719326,"I1L, A19E, D34N, M37T, L63K, D68N, F70L, N71T, E85R, H102D",10
IEQFKLHAEAVEEIVAKDARAEIDYSDAPDEFRDPLTDTLMTDPVRLPSGTVMDRSIILRHLENSPTNPFTRKMLTESMLEPVPELKEQIQAWMREKQSSDA,3.9693954,"K3Q, L7H, K10A, N18D, M37T, L63E, D68N, N71T, Q73K, H102A",10
IEKFKQLAEKVEEIVAKNARAEIDYSDAPDEFRDPLTDTLMTDPVILPSGQVLDRSIILRHLLNSPTNPFTSQMLTESMLEPVPELNEKIQAWMREKQSSDH,3.559477,"L6Q, M37T, R46I, T51Q, M53L, D68N, N71T, R72S, K87N, Q89K",10
IEKFELLAEKVEEIVQKNARAEIDYSDAPDEFRDPLTDTLMTDPVRLPSETVMDRSIILRHLLNSSTNPFTRQMITESMLEPVPELKTQIQAWMRWKQSSDH,2.069475,"K5E, A16Q, M37T, G50E, P66S, D68N, N71T, L75I, E88T, E96W",10
IEKFKLLAEKVEEIVAKNARAEIDYSDFPDEFRDPLTYTVMEDPVRLPSGTVMDRSIILRHLLNSPTNPFTRQMLTESRLEPDPELKEQIQAWMTEKQSSDH,4.938452,"A28F, M37T, D38Y, L40V, T42E, D68N, N71T, M79R, V83D, R95T",10
IIKFRLLAEKVEVIVAKNARAEIDYSDAPDEFRDPLTYTLMTDPVRLPSGTVMERSIILRHLLNSNTNPFTRQMLTESMLEPVPELKEQIQAWMRYKQSSDH,4.5536704,"E2I, K5R, E13V, M37T, D38Y, D54E, P66N, D68N, N71T, E96Y",10
IEKFKLLAELVEEQVAKNARAEIDYSDNPDEFLDPLTDTLMTDPVILPSGTVMDRSIILRHLLNSPTNPFTRQMLTESMLEPVPELKEQIQAEMREKQKSDH,3.265252,"K10L, I14Q, A28N, R33L, M37T, R46I, D68N, N71T, W93E, S99K",10
IEKFKLLAEKVEEIVAKNARAEIDYSDAPFEFRMPLTDTLMTDPVRLPSSTVMDRSIILRHLLRSPTNPLTRQMLTESMLEPVPELKAQIQAWMREHQSSDH,-0.9609877,"D30F, D34M, M37T, G50S, N64R, D68N, F70L, N71T, E88A, K97H",10
IDKFKLLAEKVEEIVAKNARAEIDYSDAPDEFRDPLTDTLMTDPVRLPNGTVMDRSIILRHMLNSPTNPFTRQMLTESMLAPVPLLREQIQAWMRESQSSDH,4.36719,"E2D, M37T, S49N, L62M, D68N, N71T, E81A, E85L, K87R, K97S",10
IEKFKLLAEKVAEIVAKPARAEIDYSDAPDEFRDPLTYTLMTDPVRLSSGTVMDREIILRHLLNSPTNPFTRQMLTESMLENVPELKEAIQAWMREKQSSDH,3.6985834,"E12A, N18P, M37T, D38Y, P48S, S56E, D68N, N71T, P82N, Q89A",10
IEKDKLLAEKVEEIVAKNARMEIDYSDAPDEFRDPLTDTLITDPVRLPNGTVMDRKIILRHLQNSPTNPFTRQMLTESMLEPVPELKMQIQAWMREKQSSDH,5.5258975,"F4D, A21M, M37T, M41I, S49N, S56K, L63Q, D68N, N71T, E88M",10
IEIFKLLAEKVEEILAKNHRAEITYSDAPDEFRDPLTDTLMTDPVRLPSGTVMDRAIILRHLLNSPTNPFTRQMLTESMLEPVPELKEQIQAWMREKQSSFS,3.58919,"K3I, V15L, A19H, D24T, M37T, S56A, D68N, N71T, D101F, H102S",10
IEKFKLLAEKVEEIVAKNNAALIDYSDAPHEFRDPLTDTLMTDPVRLPSGTVMDRSIILRHLLNSSTNPFTRQMITESMLEPVPELKEQIQAWMRELQSSDH,2.044736,"A19N, R20A, E22L, D30H, M37T, P66S, D68N, N71T, L75I, K97L",10
MEHFKLLAEKVEEIVAKNARAEIDYSDAPDEFRDPLTDILMTDPVRLPSGTVMDRSIILRHLLNSPKNPFTRQPLTEEMLEPVPELKEQIQAVMREKQSSDH,2.1259208,"I1M, K3H, M37T, T39I, T67K, D68N, N71T, M74P, S78E, W93V",10
IEKFKLLAEKVEEIVAKNWRAEIDYSDAPDEFRDPLTDTLMTEPVRLPSGTVMDRSEILAHLLDSSTNPFTRQMLTESMLEPVPELKEQIQAWMRETQSSDH,3.1070771,"A19W, M37T, D43E, I57E, R60A, N64D, P66S, D68N, N71T, K97T",10
IEKFKLLAEKVEEIVAKNARAEIDYSDAPDPFRNPLTDTLMTDPVRLDSGTVMDRSIILHHLLNSPTNPFTRQMLDESMLEPVPELKEQIQAWMRKKQSSDK,2.8930252,"E31P, D34N, M37T, P48D, R60H, D68N, N71T, T76D, E96K, H102K",10
IEKFKLLAEKVEEIVAENAGAEIDYSDAPDEFRDPITDTMMTDPVRLPSGTVLDRSIILRHLLNSTTNPFTRQMLTESMLEPVPELKEQIQAWMREDQSSDH,10.237423,"K17E, R20G, L36I, M37T, L40M, M53L, P66T, D68N, N71T, K97D",10
IEKFKKLAEKLEERVAKNARAEIDYSDAPDLFRDPLTDTLMTDPVILASGTVMERSIILRHLLNSPTNPFTRQMLTESMLEPVPELKEQIQAWMREKQSSDH,0.03720101,"L6K, V11L, I14R, E31L, M37T, R46I, P48A, D54E, D68N, N71T",10
IEKTKLLAEKVEEIVAKNARAEIDYSDDPDELRDPLTDTLMTDPVRLPSGTVMYRSIILRHLDNSPTNPFTRQMLTESMLEPVPELKELIQAIMREKQSSDH,0.58995783,"F4T, A28D, F32L, M37T, D54Y, L63D, D68N, N71T, Q89L, W93I",10
IEKFKLLAEKREEIVAKNARAEFDYSDAPDEFRDPLTDALMTDPVRLPSGTVMDRSIILNHLLHSPTNPFTRQMLTESMLEPQPELKEQIQAWMREKQSSNH,2.1851974,"V11R, I23F, M37T, T39A, R60N, N64H, D68N, N71T, V83Q, D101N",10
IEKFKLLAEKVEESVAKNARAEEDYSDAPDEFRDPLTDTLMTDPVRLPSGTVMDRSIILRHLLNSPTNPFTRQVLTESMLEPVCELKEQIQAVMLEKQSSKH,4.2113113,"I14S, I23E, M37T, D68N, N71T, M74V, P84C, W93V, R95L, D101K",10
IEKFKSVAEKVEEIVAKIARAEIDYSDAPDEFRDPLTDTLMTDPVRLPSGTVLDRSIILRHLLNSPTNPTTRQMLTESFLERVPELKEQIQAWMREKQSSDH,3.6428761,"L6S, L7V, N18I, M37T, M53L, D68N, F70T, N71T, M79F, P82R",10
IEKAKLSAEKVEEYVARNARNEIDYSDAPDEFRDPLTDTLMTDPVRLPSGTVMDRSIIERHLLNSPTNPFTRQSLTESMLEPVPELKEQIQAWMREKQSSDH,5.834503,"F4A, L7S, I14Y, K17R, A21N, M37T, L59E, D68N, N71T, M74S",10
IEKFKLLAEKVENIVAKNARAEIDYSDAPDEFRDPLTYTLVTDPVRLPSGTVMDRSIILRHLLNRPTNPFTRQMLTEDMLEPVQELKEEIQAWMREKQSSDH,3.8009017,"E13N, M37T, D38Y, M41V, S65R, D68N, N71T, S78D, P84Q, Q89E",10
IEKFKLLAEKAEEIVEKNARAEIDYSDAPDEFRDPLTDTLLTDPVRLPSGTVADRSEILRHLLNSDTNPFTRQMVTESMLEPVPELKEQIQAWMREKQSSDH,1.3364578,"V11A, A16E, M37T, M41L, M53A, I57E, P66D, D68N, N71T, L75V",10
IENFKLLAEKVEELVAKNARAEIDYSDAPDEFRDPLTDKLMTDPVRLPSGTVMDRSIILRHLLNSPTNPFTRQMLTESMLEPVKELKEAILAWMREKLSSDH,3.2403321,"K3N, I14L, M37T, T39K, D68N, N71T, P84K, Q89A, Q91L, Q98L",10
IEKFKLLAEKVEEINAKNAEAEIDYSDAPDEFRDPLTDTLMTDPVRLPSGTVMDRSDILRHLLNSPKNPFTRKMLTESMLEPTPELKEQIQAWMREKQSSDD,3.5381665,"V15N, R20E, M37T, I57D, T67K, D68N, N71T, Q73K, V83T, H102D",10
IEKFKLLAEKVEEIVAKNARDESDYSDAFDEFRDPLTDTLMTDPVRLPSGTVMERSIIERHLLNSPTNPFTRQMLTESMLEPKPELKEQILAWMREKQSSDH,4.3030224,"A21D, I23S, P29F, M37T, D54E, L59E, D68N, N71T, V83K, Q91L",10
IEKFKLLAEKVEEIVAKEARADIDYSDAPDEFMDPLTDTLMTDPVRLPSGTVMDRSIILRHLLNSPTNPFTRQMLTESCLEPVEELKEQIQAWMEAKQSSDH,3.7448516,"N18E, E22D, R33M, M37T, D68N, N71T, M79C, P84E, R95E, E96A",10
IEKFKDNAELVEEIVAKNARAEIDYSDAPDEFRDPLTDTLFTDPVRLPSGTVMDRSIILRHLLNSPTNPTTRQMLTESMLEPVPELKEQIQAFMREKQSHDH,3.690895,"L6D, L7N, K10L, M37T, M41F, D68N, F70T, N71T, W93F, S100H",10
IEKFKLLAEKVEEIVNKNARAEIDYSDDPDEFRDPFTDTLMTDPVRLPSGTVMDRSIILRNLLESHTNPFTRQMLTESMLEPVPELKEQIQAWIREKQSSDH,0.27556747,"A16N, A28D, L36F, M37T, H61N, N64E, P66H, D68N, N71T, M94I",10
IEKFKNLAQKVEEIVEKNHRAEIDYSDAPDEFRDPLTDTLMTDPVRLPSGTVMDRSIILRHLENSPKNPFTRQMLTESMLEPVPNLKEQIQAWMREKQSSDH,4.9726524,"L6N, E9Q, A16E, A19H, M37T, L63E, T67K, D68N, N71T, E85N",10
IEKFKLLAEYVEEIVAKNERAEIDYSDASDPFRDPLTDELMTDPVRLSNGTVMDRSIILRHLLNSPTNPFTRQMLTESMLEPVPELKEQIQAWMREKQSSDH,0.5076748,"K10Y, A19E, P29S, E31P, M37T, T39E, P48S, S49N, D68N, N71T",10
IEKFKLLAEKVENIQAENARAEIDYEDAPDEFRDPLTDTLMTDPVRLPSGTVMERSIILRHLLNKPTNPFTRQMLTESMLEPVPELKSQIQAWMREKQSSDH,5.767721,"E13N, V15Q, K17E, S26E, M37T, D54E, S65K, D68N, N71T, E88S",10
IEKFLLLAEKVEEIYDKNARAEIDYSDAPDEFKDPLTRTLMTDPVRLPSGTVMDRSIILRHLLNHPTNPFTRQMLTESMLEPVPELKEQIQNWMREKQSSDH,4.795104,"K5L, V15Y, A16D, R33K, M37T, D38R, S65H, D68N, N71T, A92N",10
IEKFKLLAEKVEEIVAKNQRAEFDYSDAFDEFRNPLTDTLMTDPVRLPSGTVMDRSIILLHLLNSPTNPFTRQPLTESMLEPVPELKEQIQAWMREKISSDH,4.8693314,"A19Q, I23F, P29F, D34N, M37T, R60L, D68N, N71T, M74P, Q98I",10
IEKFELLAEKVEEIRAKNQRAEIDYSDAPDEFRDPLTDTLMYDPVRLPNGTVMDRSIILRHLLNSRTNPFTRQMLTESMLEPVPELKEQIQAWMREKQDSDH,5.095867,"K5E, V15R, A19Q, M37T, T42Y, S49N, P66R, D68N, N71T, S99D",10
IEKFKLLAEKVEEIVAKNARAEIDYSDAPDEFRDPLTDTLMTDPVRLPSGTVMDRSIILRHLLNSPVNPFTRQMLTEDAVEPIPELKEQIQAWMFEKQSSKH,0.4915232,"M37T, T67V, D68N, N71T, S78D, M79A, L80V, V83I, R95F, D101K",10
IEKFKRLAEKVEEIVAKNARAEIPYSDAPEEFRDPLTDTLMTDPVRLPSGTVMDRQIILRHLLNSPTNPFTRQMLEESSLERVPELKEQIQAWMREKQSSDH,1.7855906,"L6R, D24P, D30E, M37T, S56Q, D68N, N71T, T76E, M79S, P82R",10
IEKFKLLAEKDEEIVAKNASAEIDYSDAPDEFRDPLTYKLMTDPVRLPSGTVMDRSIIEEHLLNSPTNPFTRQMLTESMLEPVPELKEQIQAWMREKQSSDV,5.667099,"V11D, R20S, M37T, D38Y, T39K, L59E, R60E, D68N, N71T, H102V",10
MEKFKLLAEKVEEIVAKNARAEIDYSDAPDEFRDPLTDTLMTDPVRLPSGTVMERRIILRHLLNSPTNPATRRMLTESMLEPVDELKEQIQAWMRSKQSSDH,1.2126443,"I1M, M37T, D54E, S56R, D68N, F70A, N71T, Q73R, P84D, E96S",10
IEKKKLLKEKVEEYVAKNARAEIDYSDAPDEFLDPLTDTLMTDPVRLPSGTVMDRRTILRHLLNSPTNPFTRQMLTESMLEPVPELKEQIQAWMRRKQSSDH,6.3276863,"F4K, A8K, I14Y, R33L, M37T, S56R, I57T, D68N, N71T, E96R",10
IEKFKLLAEKEEEINAKNARAEIDYSDAPDEFRDPLTFTLMTDPVRLPSGTVMDRSIILRHLLNSPTNPFTRQILTESMLEPVPELKERVQAWMQEKQSSDH,4.697221,"V11E, V15N, M37T, D38F, D68N, N71T, M74I, Q89R, I90V, R95Q",10
IEKFKLLAEKVEEDVAENARAEIDYSDAPDEFRNPLTDTLMTDPVCLPSGTTMDRSAILRHLLNSPTNPFTRQMLTESMLEPVPELKEQIQAWMRENQSSDH,4.950515,"I14D, K17E, D34N, M37T, R46C, V52T, I57A, D68N, N71T, K97N",10
IENFKLLAEKVEEIVADNARASIDYSDAPDEFRDPLTDTLMQDPVRLPSGTVMDRSLILRHLLNSPTNPFTRQMLTESMLEPVPELKERIQAWMREQQSSDH,4.3248963,"K3N, K17D, E22S, M37T, T42Q, I57L, D68N, N71T, Q89R, K97Q",10
IEKDKKLAEKVEEIVAKNARAEIDYSDAPDEFRDPLTDTLMTDPVILPRGTVMDRSIILEHLLNSPTNPTTRQMLTHSMLEPVPELKEQIQAWMREKQSSDH,3.7938366,"F4D, L6K, M37T, R46I, S49R, R60E, D68N, F70T, N71T, E77H",10
IEKAKLLATKVEEIVAKNARAEIDYSDAPDEFRDPLTDTLMTDPVRIPSGTTMDRSIILDHLLNRPTNPFTRQMLSESMLEPVPELKEQIQAWMREKQSSDH,3.5277534,"F4A, E9T, M37T, L47I, V52T, R60D, S65R, D68N, N71T, T76S",10
IEKFKLLRKKVEEIVAKNARAEINGSDAPDEFRDPLTDTLMTDPVRLPSGTVMDRSIILRHLLNSPTNPFTRQMLTESMLEPNDELKEQIQAWMLEKQSSDH,2.6533718,"A8R, E9K, D24N, Y25G, M37T, D68N, N71T, V83N, P84D, R95L",10
IESFKLLAEKVEEIRAKNARAEEDYDDEPDEFRDPLTDTLMTDPVRLPSGHVMDRSIILRHLKNSPTNPFTRQMLTESMLEPVPELKEQIQAWMREKQSSDH,7.6415653,"K3S, V15R, I23E, S26D, A28E, M37T, T51H, L63K, D68N, N71T",10
IEKFKALAEKVEEIVAKNARAEIRYSDAPDEFRDPLTDTLMTDPVRLPSGTVMTRSIDLRHLLNSPTNPFTRQMLTEEMLEPVLELKEQIQRWMREKQSSDH,4.315487,"L6A, D24R, M37T, D54T, I58D, D68N, N71T, S78E, P84L, A92R",10
IEKFDLLAEKVEEIVAKNARAEIDYVDAPDEFRDPLTDELMTDPVRLPSGHVMDRSIILRHLLNSPTNPFTRQMLTLSMLEPVDELKEQLQAWMREKQSSDH,3.459248,"K5D, S26V, M37T, T39E, T51H, D68N, N71T, E77L, P84D, I90L",10
IEKFKLLAEKVEEIVAKNDRAEIVLSDAPDEFRDPLTDTLMTDPVTLPSGTVMDRSIILRHLLNSPTNPFTRQMLTESMLNPVPELKEQIQAEMDEKQSSDH,0.64868295,"A19D, D24V, Y25L, M37T, R46T, D68N, N71T, E81N, W93E, R95D",10
IEKRKLLAEKVEEIVAKNARAELDYSDAPDEFRDPLTDTLMTDPVRLPSGTVMDRSIISRHLLNSPTNPLTRQMLTESMLEPVPELKEEIVAHMREKQSSDH,0.024696538,"F4R, I23L, M37T, L59S, D68N, F70L, N71T, Q89E, Q91V, W93H",10
IEKFKLLAEKVEEIVAKNARAEIDQSEAPDEFRDPLTDTLMTDPVRLPSGTCMDRSIILRHLLNSKTNPFTRQMLTPSMLEPVPELKESIQSWMREKQSSDH,4.233744,"Y25Q, D27E, M37T, V52C, P66K, D68N, N71T, E77P, Q89S, A92S",10
IEKFKLLAESVEEIVAKNARAVIDYSDAPDEFRDPLTDTLMTDPVRLPSGTVMDRSAIERHLLNSWTNPFTRQPLTESMLEPVPELKEQIQAWMREKQSSMH,4.9119596,"K10S, E22V, M37T, I57A, L59E, P66W, D68N, N71T, M74P, D101M",10
IEKFKLLAEKVEEIQAKNARAEDDYSDEPDEFRDPLTDTLMTDPVRLPSGTVMDRSIILRHLLFSPTNPFTRQMLTESMLFPVPELKEQIQNWLREKQSSDH,7.637492,"V15Q, I23D, A28E, M37T, N64F, D68N, N71T, E81F, A92N, M94L",10
IEKFKLLAEKVEEISAKNARAEIDYENAPDDFRNPLTDTLMTDPVRLPSGTVMDREIILRHLLNSPTNPFTRQMLTESMLEPVPELKEQIQAWMREWQSSDH,3.9017272,"V15S, S26E, D27N, E31D, D34N, M37T, S56E, D68N, N71T, K97W",10
IEKFKLLAEKVEEIVAKNARAEIPCSDAPDEFRDPLTDTLMTDPVRLPSGTVMDRSIILRHFLNSPTNPFTRQMLTESMLLPVPELKEKIQAHMREKQSSDD,2.5325832,"D24P, Y25C, M37T, L62F, D68N, N71T, E81L, Q89K, W93H, H102D",10
IEKFKLLAEKVEEIVAKNARAEIDESDAPDEFRDPLTDTLMTDPVRLPSGTVMDRSIILRHLLNDPTNPFTRQMLTFSMLEPVPELKQQITAWLMEKQSSDH,4.932179,"Y25E, M37T, S65D, D68N, N71T, E77F, E88Q, Q91T, M94L, R95M",10
IEKFKLLAEKVEEIAAKNARAEIDYSDAPDEFRDPLTDELMTDPVRLESGTVMDRSTILRHLLNSPTNPFTRQMLTESMLDPVPELKEHIQAWLREKQSSDH,5.556539,"V15A, M37T, T39E, P48E, I57T, D68N, N71T, E81D, Q89H, M94L",10
IEKFKELAEKAEEIVAKGSRAEIDYSDAPDEFRNPLTDTLMTDPVRLPSGTTMDRSIILRHLLNSPTNPFTRQMLTEIMLEPVPELKEQIQAWMREKQSSDH,1.6191379,"L6E, V11A, N18G, A19S, D34N, M37T, V52T, D68N, N71T, S78I",10
IDKFKLLFEKVEEIVARNARAEIDYSDAPDEFRDPLTDTLMTDPVRLPSGTVMDRSIILRHLLNSPTNPFTRQKLTESMLKPVPELKEQLQAYMREKQSSDH,2.9032493,"E2D, A8F, K17R, M37T, D68N, N71T, M74K, E81K, I90L, W93Y",10
IEKFKLLKEKVEEIVAKNARAEINKSDAPDEFRDPLTDTLMTDPVRLPSGTVMNRSIILRHLLNSPTNPFTRQMLTEDMLEPNHELKEQIQAWMREKQSSDH,2.1861997,"A8K, D24N, Y25K, M37T, D54N, D68N, N71T, S78D, V83N, P84H",10
IEKFKLLAEKVEIIDAKNARAEIDTSDAPDEFRDPLTDTLMTDPVRLPSGTVMDRSIILRHLLNSPTNPFTRQMLTESMLRPVNELKEQIQAWMREKDTSDH,5.078264,"E13I, V15D, Y25T, M37T, D68N, N71T, E81R, P84N, Q98D, S99T",10
IEKFKLLAEDVEEIVAKNAIAGIDYSDAPDEFEDPLTDTLMKDPVRLPSGTVMDRSIILRHLLISPTNPFTRQMLTESMLEPVPDLKEQIQAWMREKQSSDH,2.2581196,"K10D, R20I, E22G, R33E, M37T, T42K, N64I, D68N, N71T, E85D",10
ILLFKLLAEKVEEIVATNARAEIDYSDAPDEFRDPLTDTLMTDPVRLPSGTLMDRSIMLRHLLNSPTNPFTRQMLTESMLPPVPELKEQIQAWMREAQSSDH,1.4237752,"E2L, K3L, K17T, M37T, V52L, I58M, D68N, N71T, E81P, K97A",10
IEKFKLLAEKVEEIVAKNARAEIDYSDAPDEFRDPLTDTLMTDPVRLPSGTVMKRSIIYRHLLTSTTNPFTHQMLTESMLEPVPELKDQIIAWMREKQSSDH,-1.0193453,"M37T, D54K, L59Y, N64T, P66T, D68N, N71T, R72H, E88D, Q91I",10
IHKFKLLAEKVEEIVAKNARAEIDYSDAPVEFRDPLTDTLMTDPVRLPNGTVMDRSIIIRHLLNSPTNPFTRQMLTESRLEPVPEVKEQIEAWMREKQSSDH,1.9800515,"E2H, D30V, M37T, S49N, L59I, D68N, N71T, M79R, L86V, Q91E",10
IEKFKLLVEKVEEIVAKNADAEIDYSDAPDEFRDPLTDTLMHEPVRLPSGTVMDRSIILRHVLNSPTNPFTRQMLTESMLEPNPELKEQIQAWMVEKQSSDH,1.2576832,"A8V, R20D, M37T, T42H, D43E, L62V, D68N, N71T, V83N, R95V",10
IEKFKLLLEKVKEIVAKNAPAEIDYSDAPDEFKDPLTDTLMTDPVRLPSGTVMDRKIILRHLLNSPTNPFTRQMLTESMLEPVVELKEQIQAWNREKQSSDH,5.8419886,"A8L, E12K, R20P, R33K, M37T, S56K, D68N, N71T, P84V, M94N",10
IEKFKLLANKVEEIVAKNARAEIDYSDAPDEFRDPLTDTLMTDPVILPSGTVMDRSIILRHLLNSPTDPFTRQMLTESNLEPVSELKEEIQLWRRQKQSSDH,0.49833697,"E9N, M37T, R46I, N71T, M79N, P84S, Q89E, A92L, M94R, E96Q",10
IEKFKLLAEKVDEIVAKNARAEQDYSDAPDEFRDPLTDTLMTDPVRLPSGTVMDRSIILRHLTNQPTNPFTRQMLTFSMLEPVPELNEQIQAWMRETQSSDH,4.417993,"E12D, I23Q, M37T, L63T, S65Q, D68N, N71T, E77F, K87N, K97T",10
IDKEKLLAEDVEEIVAKVARAEIDYSDAPDEFRDPLTDELMTDPVRLPSGTVMDRNIILRHLLNSPTNPFTRQMLTESMLEPVPELKEYIQAWMREKQSSDH,5.1350813,"E2D, F4E, K10D, N18V, M37T, T39E, S56N, D68N, N71T, Q89Y",10
MEKFKLLAEKVQEIVSKNARAELDYSDAPDEFRDPLTDTLNTDPVRLSSGTTMDRSIILRHLLNSPTNPFTRQMLTESMLEPVPELKEQIQAWMREKQSSDH,1.439938,"I1M, E12Q, A16S, I23L, M37T, M41N, P48S, V52T, D68N, N71T",10
IEKFKLNAESVEEIVAKAARAEIDYSDAPDDFRDPLTDTLYTDPVRLPSGTVMDRSIILRHLLNYPTNPFTRQMLTDSMLEPVPELKEQIQAWMREKQSSDH,2.1975183,"L7N, K10S, N18A, E31D, M37T, M41Y, S65Y, D68N, N71T, E77D",10
IEKFKLLAEKVEEIVAKIARAESDYSDALDEFRDPLTDTLMTDPVRLPSGHVMDRSIILRHLLNSPTNPITRQMLTESMLEPVVELKEQIQAWMREKQSLDH,0.87895775,"N18I, I23S, P29L, M37T, T51H, D68N, F70I, N71T, P84V, S100L",10
IEKFKLLAEKVEEIVAKNARAMIDYSDAPDEFRDPLTDTLMRDPVRLPNGTVLDRSIILRHLLNSKTNPNTRQMLTESMLEPVPELKEQIQAWMREKQSSRH,7.6327696,"E22M, M37T, T42R, S49N, M53L, P66K, D68N, F70N, N71T, D101R",10
IEKFKLLAESVEEIVAKNADAEIDYSDAPDEFRDPLTDTLMTDPVRLPSGTVMDRSIILRHLLNSKQNPFTRHMLTESMLEPVPELKEAIQSWMREKQSSDH,1.9681628,"K10S, R20D, M37T, P66K, T67Q, D68N, N71T, Q73H, Q89A, A92S",10
IEKFKLLAEKVEEIVAKNARAEIDYSDAPDEFRCPLTDTLMTDPVRLSSGTVMERSIILRHLLNLPTNPFTRQMLTEKMLEPVPELNEQVQAWMREKQSSDH,0.11628387,"D34C, M37T, P48S, D54E, S65L, D68N, N71T, S78K, K87N, I90V",10
IEKFKLEAEKVEEIVAKEARAEIDYSDAPDEFRDPLTYTLMTDPVRLPSGTVMDRSIILRHLLNSQTNPFTRCMLTESMLEPVPELKNQIQAWMREKQSSKH,6.54245,"L7E, N18E, M37T, D38Y, P66Q, D68N, N71T, Q73C, E88N, D101K",10
IEKFKLLAEKVEEIVAKNARAEIDYSDAPDEFRDPLTDTLMTDPVRLPDGTVMDRSIILRHLLSSPTNPITRQMLTESMLEPVKELKEEIQAWMDEKQSSDF,1.4204929,"M37T, S49D, N64S, D68N, F70I, N71T, P84K, Q89E, R95D, H102F",10
IEKFKWLHEKVEERVAKNARAEIDYYDAPDEFRDPLTDTLMTDPVRLPSGTVMDRSIILRHLLNSCTNPLTRQMLTESMLEPVPELKEVIQAWMREKQSSDH,1.2371254,"L6W, A8H, I14R, S26Y, M37T, P66C, D68N, F70L, N71T, Q89V",10
IEKKKLLAEKVEEILAKAARAEIDYSDAPDEFRDPLTDTLLTDPVRLPNGTVMDRSIILRHLLNSPTNPFTRQSLTESMLEPVPELKEQIRAWMREKQSSDH,3.3264987,"F4K, V15L, N18A, M37T, M41L, S49N, D68N, N71T, M74S, Q91R",10
