Sequence,Score,Mutations,Number of Mutations
IEKFKLLAEKVEIIVAKDARAEIDYYDAPDELRDPLTDTLMTDPVRLPSGTVMDRSSILRHLLNSPTNPLTRQMITESMLEPVPELKEQIQAWMREKQSSDH,-1.377174,"E13I, N18D, S26Y, F32L, M37T, I57S, D68N, F70L, N71T, L75I",10
IEIFDLLAEKVGEIVADNARAEIDYSDAPDEFRDPLTDTLMTDPVRLPSGTVMDRSIILRHLLNSKTNPFTRQMLTESMLEPVPELKEQIQAWMEEKDSSDH,4.4026027,"K3I, K5D, E12G, K17D, M37T, P66K, D68N, N71T, R95E, Q98D",10
IEKFKLIAFKVEEINAKNAEIEIDTSDAPDEFRDPLTDTLMTDPVRLPSGTVMDRSIILRHLLNSPTNPFTRQMLTESMLEPNPELKEQIQAWMREKQSSDH,6.1595907,"L7I, E9F, V15N, R20E, A21I, Y25T, M37T, D68N, N71T, V83N",10
IEKFKLLAEKVEEIIAKNARAEIDYSDHPDEFRDPLTDTLMTDPVRLESGTVMQRSIILRHLLNSPANPFTRQMLTESMLEPVPELEEQIQQWMREKQSSDH,0.2262767,"V15I, A28H, M37T, P48E, D54Q, T67A, D68N, N71T, K87E, A92Q",10
MEKFKLLAEKVEEIVAKNARAEIDCSDAPDTFRDPLTDTLMTDPVRLPHGTFLDRSIILRHLLNSPTNPFTRQMLTESMLEPVPELKEQIQAWMREKQSLDH,7.15064,"I1M, Y25C, E31T, M37T, S49H, V52F, M53L, D68N, N71T, S100L",10
IEKFKLLAEKVEEICAKNARAEIDYSDAPDEFRDPLTYTLMTDPVRLPNGTVMDRSIILRHLLNSPTNPFTRQMLNDSMLENVPELKEQIQAWMKEKQSSDH,3.8230171,"V15C, M37T, D38Y, S49N, D68N, N71T, T76N, E77D, P82N, R95K",10
IENFKLLAEKVEEIVAKEARAEIDYEHAPDEFRDPLTDYLMTDPVRLPSGTVMDRSIILRHLLNSPTNPFTRQMVTESMLEPVPELKEQIQAWMREKQSSDR,1.7118151,"K3N, N18E, S26E, D27H, M37T, T39Y, D68N, N71T, L75V, H102R",10
IEKFKLLAEKVEEIVAKNARADIDYDDAPDDYRNPLTDTLMTDPVRLPSGTVMDRSIILRHLLNSPTNPFTRQMLTESMLEPVPELDEQIQAWMREKQASDH,4.0352373,"E22D, S26D, E31D, F32Y, D34N, M37T, D68N, N71T, K87D, S99A",10
IEKFVLLAEKVEEIVAKNARAEIFYSDAPDNFRDPLTDTLMTDPVRLNSGTVMDRSIILRHLLNSPTNPFTRQHLTESMLEPVPELKEQIEAWMREKQSSDK,5.524708,"K5V, D24F, E31N, M37T, P48N, D68N, N71T, M74H, Q91E, H102K",10
IEKFKLLAEKVEEIDAKNARFEIDYSDAPDEFRDPLTDTLMKDPVRLPSGTVLDRSIILRHLLNSPENPFSRQMLTESMLELVPELKEQIQAWMREKQSEDH,1.070296,"V15D, A21F, M37T, T42K, M53L, T67E, D68N, N71S, P82L, S100E",10
IEKFKLRAEKVEEIVAKNARAEIDYSDAPDEFENPLTDTLMTDPVALPSGTIMDRSIIERHLLNSPTNPITRQMLTESMLEPVPELKEQIQAWMREKQSSDH,-0.7342777,"L7R, R33E, D34N, M37T, R46A, V52I, L59E, D68N, F70I, N71T",10
IEKFNLLVEKVERIVAKNERAEIDYSDAPDEFRDPLTDTLVTDPVTLPSGTVMDRSIILRYLLNSPTNPFTRQMLTESMLEPVPELKEQIQAWMREKQSSDH,-2.0111892,"K5N, A8V, E13R, A19E, M37T, M41V, R46T, H61Y, D68N, N71T",10
IEKFKLIAEKVEELNANNARAEIDYSDAPDEFRDPLTDTLMTDPVRLPSGTVMDRSIILRHLLNSPTNPFTRQMLTESMLTPSPELKEQIQAWMRAKQSSDH,5.094207,"L7I, I14L, V15N, K17N, M37T, D68N, N71T, E81T, V83S, E96A",10
IEKFKLLAEKVEEIVAKDARAEIDYSDAPDEFLDPLTDTLMTDPVRLPSGTVIDRSIILRHLLNSGTNPFTRQMLTESMLEPVPELKEQIQAWMREKTSTDG,8.057529,"N18D, R33L, M37T, M53I, P66G, D68N, N71T, Q98T, S100T, H102G",10
IEKFKLLAEKVEEISEKEARAEIDYSDWPDEFRDPLTDTLMTDPVRLPSGQVMDRSIILRHLLNSPTNPFTRQPLTESMLLPVPELKEQIQAWMREKQSSDH,6.409644,"V15S, A16E, N18E, A28W, M37T, T51Q, D68N, N71T, M74P, E81L",10
IEKFKLLAEKVEEIVEKNARAEIDTSDAPDEFRDPLTDTLMTDPVRLPSGTVMDRSIILRHLLNSHTNPFTRQMLTTSMLEPVPELKEQIAEWMREKQSDDH,4.4943314,"A16E, Y25T, M37T, P66H, D68N, N71T, E77T, Q91A, A92E, S100D",10
IEKFKLLAEKVEEIVAKNARAEIDYSDAIDEFRDPLTYTLMTDPVRLPSGTVMDRSIILRHLLDSPTNPFTRQMLTESMLEPNPDLKTQIQAWMRELQSSDH,4.8948975,"P29I, M37T, D38Y, N64D, D68N, N71T, V83N, E85D, E88T, K97L",10
IEKFALLAESVEEIVAKNAREEIDYSDAPDEFRDPLTDTLMTDPVRLPSGTVMDRSIILRHLLNSPTNPFTRQMLTFYMLEPVPELKSQIQADMREKQSSDH,3.54811,"K5A, K10S, A21E, M37T, D68N, N71T, E77F, S78Y, E88S, W93D",10
IEKFKLLAEKVEEIVAKNLRAEIDYSDAPDEFRDPLTDTLMTDPVRLPSGHVMDRSIIMDHLLLSPTNPFTRQMLTESMVEPVPELKEQIQAWIREKQSSDH,4.427769,"A19L, M37T, T51H, L59M, R60D, N64L, D68N, N71T, L80V, M94I",10
IEKFKLLAEKVEEIVAKNADAEIDYSDAVDEFRDPLTDTLMTDPVRLPSGTLMDRSIIMRHLLNKPTNPFTRQMLTESMLRPVPELKEKIQAWMREKQSSDH,3.4149683,"R20D, P29V, M37T, V52L, L59M, S65K, D68N, N71T, E81R, Q89K",10
IEKFKRLAEKVEEIVEKNARAEIDYSDAPDEFRDPLTDTLMTDPVRLPSGTVMDRSIILEHLLNSPTNPFTRQMLPESMLEPVLELKLQIQAWMREKQSSDV,0.717067,"L6R, A16E, M37T, R60E, D68N, N71T, T76P, P84L, E88L, H102V",10
IQKFKLLAEKVEEIVAKNARANIDLSDAPDEFRDPLTDTLMTDPVRLPSGTVLDRSIILRHLLNPPTNPLTRQMLTESMLEPVPELKEQIQAWIREKQSSDH,0.8917842,"E2Q, E22N, Y25L, M37T, M53L, S65P, D68N, F70L, N71T, M94I",10
MEKFKLLAEKVEEVVAKNARAEIDYSDAPDEFYDPLTDTLMTDPVRIPSGTVMDRSIILRHLLNSPTNPFTRTMLTEAMLEPVLELKEQIQAWMREKQSSDH,2.2627444,"I1M, I14V, R33Y, M37T, L47I, D68N, N71T, Q73T, S78A, P84L",10
IEKFKLLAEKVEEIVKKNARWEIDYSDAPDEFRDPLTDTLYKDPVRLPLGTVMDRSIILRHLLNSPTNPFTRQNLTESMLEPVPELKEQIQAWMREKQSSPH,4.292299,"A16K, A21W, M37T, M41Y, T42K, S49L, D68N, N71T, M74N, D101P",10
IEKFKLDEEKVEEIVKKNARAEIDYSDAPDEFRDPLTYTLMTDPVRLPSGTVMDRSIILKHLLNSPTNPFCRQMLTESMLIPVPELKWQIQAWMREKQSSDH,3.8211958,"L7D, A8E, A16K, M37T, D38Y, R60K, D68N, N71C, E81I, E88W",10
IEKFKLLAEKVEEIKAKNDRAEIDYSDAPDEFRDPLTDTLMTDPVRLPSGTVMDRSIILRHLLNSPTNPFTRQELWESMLEPVPELKPQIQAWMREKQSYDP,4.893155,"V15K, A19D, M37T, D68N, N71T, M74E, T76W, E88P, S100Y, H102P",10
MEKFKLLAGKVEEIVAKNARREIDYKDAPDEFRDPLTDTLMTDPVRLPSGTVLDRVIILRHLLNSPTNPLTRQMLTESMLEPVPELKEQIQAWMREKQSSDH,3.3484337,"I1M, E9G, A21R, S26K, M37T, M53L, S56V, D68N, F70L, N71T",10
IEKFKLLAEKVEEILAKTARAGIDYSDAPDEFRDPLTDTLMTDPVLLPSGTVMDRSSILRHLLNSPTNPFTRQMLTESMLEPVPELKEQIEAWMREAQSSDH,3.8345625,"V15L, N18T, E22G, M37T, R46L, I57S, D68N, N71T, Q91E, K97A",10
IEKFQRLAEKVEEIVAKNARAEIDYSGAPDEFRDPLTDTLMQDPVRLPSGTVMDRSIILRHLLNSKTNPFTRQMLPESMLEPVPEVKEQIQAWMREKQSSDH,0.4785422,"K5Q, L6R, D27G, M37T, T42Q, P66K, D68N, N71T, T76P, L86V",10
IEKFKLLAEKSEEIVAKNARAFIDYSDAQDEFRDPLTDTLMTDPVRLPNGTVMDRSIILEHLLNSPTNPFTRQMLTESMLQPVPELSEQIQAWMREKQSSDH,3.0888495,"V11S, E22F, P29Q, M37T, S49N, R60E, D68N, N71T, E81Q, K87S",10
IEKFKLSAEKNEEIVAKNARAEIDYSDAPDEFRDPLTDTLMTDPVRLPSGTVMDRSIILKHLENSPTNPFTRQMLTEYMLEPVPELKFQIQAWMREKQSSFH,4.44493,"L7S, V11N, M37T, R60K, L63E, D68N, N71T, S78Y, E88F, D101F",10
IEKNKLLAEKVEEIVAKNARAGIDYSDAPDEFRNPLTDTLMTDPVRLPSGTVMDRKIILRHLLNSPTNPFTRQMLTESMLPPVPMLKEQIQAWLREKQSSDH,3.27321,"F4N, E22G, D34N, M37T, S56K, D68N, N71T, E81P, E85M, M94L",10
IEEFKLLAEKVEEIVNKNARAEIDYSDAPDEFRDPLTDTLMTDPVVLPSGHVMDRSIILDHLLNSPTNPFTRQMLTEEMLEPVPELKEQIQAWLREKQSSDH,5.203496,"K3E, A16N, M37T, R46V, T51H, R60D, D68N, N71T, S78E, M94L",10
IEKFKLLAEKVEEIFAKNARAEQDYSDAPDEFRDPLTDTLMTDPVRLPSGTVLDRSIILRHLLNSPTNPFTRQMLHLSMLEPVPELKEQIEAWMRELQSSDH,7.53419,"V15F, I23Q, M37T, M53L, D68N, N71T, T76H, E77L, Q91E, K97L",10
IETFKLLAEKVDEIVAKNARAEIDYSDAPDEFEDPLTDTLVTDPVRLPSGTVMDRSIILRHLLNSPTNPFTRKMLTESMLEPVDELTEQIQAWMREKQSSDH,-0.6835176,"K3T, E12D, R33E, M37T, M41V, D68N, N71T, Q73K, P84D, K87T",10
IEDFKLLAEKVEEIVAKNRRAEIDQSDAPNEFRDPITDNLMTDPVRLPSGTVMDRSIILRHLLNSNTNPFTRQMLTESMLEPVPELKEQIQAWMREKQSSDH,5.9380245,"K3D, A19R, Y25Q, D30N, L36I, M37T, T39N, P66N, D68N, N71T",10
IEKFKLLAEKVEEIVAKNARATIDYSDAPDEFRDPLTDTLMTDPVRLPSGTVMERSAILRHLLNSPCNPFTREMLTEPMLEPVPELMEQIQAWMREKQSSDH,1.1773863,"E22T, M37T, D54E, I57A, T67C, D68N, N71T, Q73E, S78P, K87M",10
IEKFKLLAEKVEEIVAKDARAEIDYSDAPDEFRDPLTDNLMTDPVRLPSGTVMDRSIILRHLLNSPTNPFTREMLTESDLEPNPELDEQIQAWMREKQSSNH,1.2299387,"N18D, M37T, T39N, D68N, N71T, Q73E, M79D, V83N, K87D, D101N",10
IEKFKLLAEKVEEIKAKNARAEIDESDDPDEFRDPLTDTLMTDPVRLPSGTTMDRSIILKHLLNSPTNPLTRQMLTESMLEPVPELKRQIQAWMREKQSSDH,-0.7358278,"V15K, Y25E, A28D, M37T, V52T, R60K, D68N, F70L, N71T, E88R",10
IEYFKLLASKVEEIVAKNARAEIDYDDAPDEFRDPLTDTLMTDPIRLPDGHVMDRSIILRHLLNSPTNPFTRQMITESMLEPVPELKEQIQAWMREKQSSDH,5.099308,"K3Y, E9S, S26D, M37T, V45I, S49D, T51H, D68N, N71T, L75I",10
MEKFKLLARKVSEIVAKNARAEIDYSDAPDEFRDPLTYFLMTDPVRLPSGTVMDRSIILRHLLNSPTNPFTRQSLTESMLEPVPELKEQIQAWMREKQSSDT,6.5363426,"I1M, E9R, E12S, M37T, D38Y, T39F, D68N, N71T, M74S, H102T",10
IEKSKLLAEKVEEIVAKNARVEIDYNDAPDEFRDPLTDTLMTDPVSLPSGTVMDREIILRHLLNSPQNPFTRQMLTESMLEPVPILKEQIQAWMREKQSSDH,3.9614906,"F4S, A21V, S26N, M37T, R46S, S56E, T67Q, D68N, N71T, E85I",10
IEEFKELAEKVEEIVAKNARAEIDYSDAIDLFRDPLTDTLMKDPVRLPSGTVMDRSIILRHLLNYGTNPFTRQMLTESMLEPVPELKEQIQAWMREKQSSDH,2.2845716,"K3E, L6E, P29I, E31L, M37T, T42K, S65Y, P66G, D68N, N71T",10
IEKFKLLAEKVEEIGAKNARAVEDYSDAPDEFRDPLTFTLMKDPVRLPSGTVMDRSSILRHLLNSPTNPFTRQMLTESVLEPVPELKEQIQAWMREKQSSDH,1.7385659,"V15G, E22V, I23E, M37T, D38F, T42K, I57S, D68N, N71T, M79V",10
IEKDKLLAETVEEIVAKNARAEINYSDAPDEFFDPLTDTLMTDPVRLPSGTVMDRSIILRHLLNSPTNPFTRQMLTEQMLSPVIELKEQIQAWMREKQSSDH,3.6097996,"F4D, K10T, D24N, R33F, M37T, D68N, N71T, S78Q, E81S, P84I",10
IEKFKLLAEKVEEIVAKNARAEIDYSDAPDEFRDPLTQTLMTDPVRLPSGHVMDQSAILRHLLESPTNPMTRQMLTESSLEPVPELKEQIQAWMREKQSSDH,3.5374413,"M37T, D38Q, T51H, R55Q, I57A, N64E, D68N, F70M, N71T, M79S",10
IEKFKLLAEKVEEIVAKNARAEIDYSDAPDEFRDPLTDTLMTDPVRLPSGTVMEYSIVLRHLLNSPTNPFTRQELTESTLEPVPELKEQIDEWMREKQSSDH,0.64717674,"M37T, D54E, R55Y, I58V, D68N, N71T, M74E, M79T, Q91D, A92E",10
IEKFKLLAEKVEEIVAKNARAEIDYSDAPDEFRDPLTDTLMTDPVRLPSGTVMDRDIILRHLLNSPINPFSREMLTESMLEPNVELKNQIQAWMREKQLSDH,-1.8537608,"M37T, S56D, T67I, D68N, N71S, Q73E, V83N, P84V, E88N, S99L",10
IEKFKLLAEKVEEIMAKNARAEIDYSDAPDEFEDPLTDTLMTDPVRLPSGTVMDRSIIERHLLNSPTNPFTHQMLTESQLEPVDELKEQIQNWMREKQSSDH,-0.3313952,"V15M, R33E, M37T, L59E, D68N, N71T, R72H, M79Q, P84D, A92N",10
IEKFKLLAERVEEIVAKNIRAEIDEEDAPDEFRNPLTDTLMTDPVRLPSGTVMDRSIILRHLLNSPTNPFTRQMLTPSMLQPVPELKEQIQAWMREKQSSDH,3.9150019,"K10R, A19I, Y25E, S26E, D34N, M37T, D68N, N71T, E77P, E81Q",10
IEKFKLLAEKVEEDVAKNARAVIAYSDPPDEFRDPLTYKLMTDPVRLPSGTVMDRKIILRHLLNSPTNPFTRQMLTESMLEPVPELKEQIQAWMREKQSSDH,4.030443,"I14D, E22V, D24A, A28P, M37T, D38Y, T39K, S56K, D68N, N71T",10
IEKFKLLAEKVEEIVAKNARAEISSSYAPDEFRDPITDTLMTDPVRLPSGTVMDRAIILRHLLVSPTNPFTRQMLRESMLEPVPELKEQIQAWMREKQSSDH,5.9891567,"D24S, Y25S, D27Y, L36I, M37T, S56A, N64V, D68N, N71T, T76R",10
IEKFKLLAEKVEEIVDKNARAEWDYSDAPDGFRDPLTDTLMTDPVILPSGTVLDRSIILNHLLRSPTNPFTRQMLTESMLEPVPELKEQIQAWMREKQSSDH,6.787972,"A16D, I23W, E31G, M37T, R46I, M53L, R60N, N64R, D68N, N71T",10
IEKFKLLAEKVEEIVAPGARAEIDYSDAPDMFRDPLTDTLMTDPVRLPSGTVMERSIILRHLLNSPTNPFTRQMLTESMLEPVPDLKESIQAWMREKQSSDA,4.26165,"K17P, N18G, E31M, M37T, D54E, D68N, N71T, E85D, Q89S, H102A",10
IEKFKLLAEQVEEEVAKNARAEIDYSDAWDEFRDPLTDTLMTDPVRLPSGTVMDRSIILRHLLGSPTNPFTRQMLTESMFEPVPELKEQVQAWMREKQSSDQ,3.233467,"K10Q, I14E, P29W, M37T, N64G, D68N, N71T, L80F, I90V, H102Q",10
IEKFKLLAENVEEIVAKNARAEFDYSDAPDEFRDPLTYTLMTDPVRLPSGTVMDRSIIERHLLFSETNPFTRQMLTESMLEPVPELKEQIQWWMREKQSSDH,8.768286,"K10N, I23F, M37T, D38Y, L59E, N64F, P66E, D68N, N71T, A92W",10
IEKFKLVLEKVEEIVAKNARAEIDYSDAPDEFRDPLTDTLMTDPVVLPSGTVMDRSLILRHILNSPSNPFTRQMLTENMLEPVPELKEQIQAWMREKQSSDH,0.59517336,"L7V, A8L, M37T, R46V, I57L, L62I, T67S, D68N, N71T, S78N",10
IEKFKSLQEKVEEIVAKNARDEIDYSDAPDEFRDPLSDTLMTDPVRLPSGTVMDRSIILRHLLNSPTNPFTRQMLNIYMLEPVPELKEQIQAWWREKQSSDH,5.718094,"L6S, A8Q, A21D, M37S, D68N, N71T, T76N, E77I, S78Y, M94W",10
IEKEKLLAEKVETIVAVNARFEIFYDDAPDEFRDPLTDTLMTDPVRLPSGTVMDRSIILRHLLNSPTNPFTRQMLTESMLEPVPSLKEQIQAWMREKQSSDH,5.9648137,"F4E, E13T, K17V, A21F, D24F, S26D, M37T, D68N, N71T, E85S",10
IEKFKLLAEKVEEIVAKNARAEIDYNDAPDEFRDPLTDTLMTDPVMLPSGTVMDRSIILRHLLNSKTNPFTRQMLDESMLEPVPELDHQIVAWMREKQSSDH,4.7049584,"S26N, M37T, R46M, P66K, D68N, N71T, T76D, K87D, E88H, Q91V",10
IEKFKLLAEKVEEIVAKNMRAEIDYSDAPDEFRDPFTYTLMTDPVRLPSGTVMDRSIILRHLLNKPTNPFTRQMLTESMLEPVPELKEQIQAWLREKLSKDH,6.9378905,"A19M, L36F, M37T, D38Y, S65K, D68N, N71T, M94L, Q98L, S100K",10
MENFKLLAEKVEEIVAKNARAEIDYSDAPDEFRDPLTDTLMTNPVRLGSGTVMDRSSILRHLLNSPTNPFTRQMLTESMLEPVPELKEQIQAWLREKQGSDH,3.7368853,"I1M, K3N, M37T, D43N, P48G, I57S, D68N, N71T, M94L, S99G",10
IEKAKLLAERVEEIVAKNSRAEIDYSDAPDEFRDPLTDTLMTDPVRLPSGTVMDRSIILLHLLNSPTNPFTRQMLTESTLEPVPELKGQIQAWMREKMSSDH,2.3657837,"F4A, K10R, A19S, M37T, R60L, D68N, N71T, M79T, E88G, Q98M",10
MEKFKLLAEKVEEIVAKNARAGIDYFDAPDEFRDPLTYTLMTDPVRLPSGTNMDRSTILRHLLNSPTNPFTRQMLTESMLEPVPELKEQITAWMREKQSSDH,7.8483753,"I1M, E22G, S26F, M37T, D38Y, V52N, I57T, D68N, N71T, Q91T",10
IEKFKLLAEKVEEIVAKNARARQDYSDAPDEFRDPLTDTLYTDPVRLPSHTVMDRSIILRHLSNSPTNPFTREMLPESMLEPVPELKEQIQAWMREKQSSDH,-0.89893806,"E22R, I23Q, M37T, M41Y, G50H, L63S, D68N, N71T, Q73E, T76P",10
IEEFKLLAEKVEEIVAKNNRAEIDYSDAPDEFRDPLTDTLMTDPLRLPSGTVMDRSGILRHLLNKPTNPFTRQMLTEKMLEPVPELVEQIQAWMREKQSSDH,3.0668201,"K3E, A19N, M37T, V45L, I57G, S65K, D68N, N71T, S78K, K87V",10
MEKFKLLLEKVEEIVAKNARAEIDYSDAPDEFRDPLTDTLMTDPVRLPSGTVMDRSIILRHLFNSPINPFTLQMLTISMLEPVPELKEQIQLWMREKQSSDH,-1.875124,"I1M, A8L, M37T, L63F, T67I, D68N, N71T, R72L, E77I, A92L",10
IEKFKLLAEYVEEIVAKNARAEIVYLDAPDEFRDPLTDTLMTDPVRLPSGTVMDRSIILRHLENSPTNPFTRQMLTESMLEPVPNLKEQIQAWMREKVSSDQ,4.63313,"K10Y, D24V, S26L, M37T, L63E, D68N, N71T, E85N, Q98V, H102Q",10
IEKFKLLAEKVEEIVAKNARAEFDYSDAPDLFRNPLTDTLMTDPVRLPSGTVMDRSIILRHLLNNPTNPFTRQMLTESMLEPVPDLKKQIQAWMREKQSVDH,3.5966225,"I23F, E31L, D34N, M37T, S65N, D68N, N71T, E85D, E88K, S100V",10
IEEFKLLAEDVEECVAKNKRAEIDYSDAPDEFRDPLTDTLMTDPVRTPSGTVMDRSIIKRHLLNSPTNPFTRQMLTESMLEPEPELKEQIQAWMREKQSSDH,4.6514034,"K3E, K10D, I14C, A19K, M37T, L47T, L59K, D68N, N71T, V83E",10
IEKFKLLAEKVEEYVAKNARAEIAYSDAPEEFRDPLTDTLMTDPVRLPSGTVMDRSILLRHLLNSPTNPFTRQMLTDSMLEPDPLLKEQIQAWMREKQSSDH,2.2536874,"I14Y, D24A, D30E, M37T, I58L, D68N, N71T, E77D, V83D, E85L",10
IEKFKLDAHKMEEIVAKNARAEIDYSDAPDEFRDPLTDLLMTDPVRLPSGTVMDRSIILQHLLNSPTNPFTRQMLTESMIEPDPELKEQIQAWMREKQSSDH,2.2901113,"L7D, E9H, V11M, M37T, T39L, R60Q, D68N, N71T, L80I, V83D",10
IEKVKLLAYKIEEIVAKNARAEIDYQDAPDEFRDPLTDTLMTDPVRLPSGTVMDRSIILRHLQNSKTNPFTRQMLTESMVEPVPELKEQIQAWMREKQSSDH,4.9014626,"F4V, E9Y, V11I, S26Q, M37T, L63Q, P66K, D68N, N71T, L80V",10
IEKDKLLFEKVEEIVAKNARAEIIYSDAPDEFRDPLTDTLMTDPVRLPSGHVMDRSIILRHLLNSPTNPFTNQMLTESDLEPVPELKEQIQAWMREKQTSDH,2.6963854,"F4D, A8F, D24I, M37T, T51H, D68N, N71T, R72N, M79D, S99T",10
IESFKLLAEKVEEIVAKEAQAEIDYSDFPDPFRDPLTDTLMTDPVRLPSGTVMDRSTILRHLLNSPTNPFTRQMLTESMLEDVPELKEQIQAWMREKQSSDH,7.186677,"K3S, N18E, R20Q, A28F, E31P, M37T, I57T, D68N, N71T, P82D",10
IEKKILLAAKVEEIVAKNARAEIDYSDAPDEFRDPLTDTLMTDPVRLPSGHVMDTSIILRHLLNSPTNPFTRQMITESMLEPVPELKEQIQSWMREKQSSDH,3.112505,"F4K, K5I, E9A, M37T, T51H, R55T, D68N, N71T, L75I, A92S",10
IEKFKLLAEEVEEIEAKNARAEIDYSDAPDDFIDPLTDTLMTDPVRLPSGTVMYRSIILRHLLNSPTNPFTRQMLTESMLEPVPELLEQIQAWMREKQSLDH,3.8846812,"K10E, V15E, E31D, R33I, M37T, D54Y, D68N, N71T, K87L, S100L",10
IENFKLLDTKVEEIVAFNARAEIDYSDAPDEFRDPLTDTLMTDPVRLPSGTVMDRSIILRHLNNSPTNPFTRQPLSESMLEPVPELKEQIQAWMREKQSSDH,5.2471857,"K3N, A8D, E9T, K17F, M37T, L63N, D68N, N71T, M74P, T76S",10
IEKIKLLAEKVEEIVAKNARAEIDYSDAPDEFRDPLTDTLMTDPVRLPSGTVLDRSIILSTLLNSHTNPLTRQMLTESMLEPVPELKDQIQAWMREKQSSDH,1.8712229,"F4I, M37T, M53L, R60S, H61T, P66H, D68N, F70L, N71T, E88D",10
IEKFKLLAEEVENIVAQNADAEIDYSDAPDEFRDPLTDTPMTDPVRLPSGTVMDRSIIQRHLLKSPTNPFTRQMLTESMLEPVPELKEQIQAWMREKQSSDH,1.8484461,"K10E, E13N, K17Q, R20D, M37T, L40P, L59Q, N64K, D68N, N71T",10
IGKFKLTAEKKEEIVAENARAEIDYSDAPDEFEDPLTDTLMTDPVRLPSGTVMDRSIILRHLLNSPTNPFTRQMLTESMLEPVPELKQQIQAWLREKQSSDH,4.187047,"E2G, L7T, V11K, K17E, R33E, M37T, D68N, N71T, E88Q, M94L",10
IIKFDLLAEKVEEIVAKNARAEIDYSDAPDEFRDPLTDTLMTDPVRLPSGTVMDREIILRHLLGSPTNPFTRSMLTESMLEPVPELKEQIEMWMREKQSSDH,4.0937905,"E2I, K5D, M37T, S56E, N64G, D68N, N71T, Q73S, Q91E, A92M",10
IEKFKLLAESVEEIVAKNARAEIDYSDAPDRFTDPLTDTLMTDPVRLPSGTVMDRSIILRHLLNSPTNPFTRQMLTESPLLPVPELKEEIQAWMREKQSSQH,2.5775852,"K10S, E31R, R33T, M37T, D68N, N71T, M79P, E81L, Q89E, D101Q",10
IEGFKALAEKVEEIVAKNLRAEIDYSDAPDEFRDPLTDTLMTDPVRLPNGTVMDRSIILRHLLNSPTNPFTRQMLTESMLEPVPELKEQVQAWMRELQSSDL,4.723979,"K3G, L6A, A19L, M37T, S49N, D68N, N71T, I90V, K97L, H102L",10
IEKFKLLAEKVEEIVAKNARAYIDYSDAPDDFRDPFTDTLMTDPVRLPSGTTMDRSIILRHLLNSPTNPFTRQMLTESMLEPVPELKERIVAWMREKQSSNH,3.560144,"E22Y, E31D, L36F, M37T, V52T, D68N, N71T, Q89R, Q91V, D101N",10
IEKFDLLAEKVSEIVAKNARAEIDYSDAPDEFRNPLTDTLMTDPVRLPSGHVMDRSIILRHLLNSPTNPYTRQMLTEDMLEPVPELKEQIQAWMDEKQSSDH,5.271715,"K5D, E12S, D34N, M37T, T51H, D68N, F70Y, N71T, S78D, R95D",10
IEKFRLLAERKEEIVAKNARAAIDYSDAPDEFRDPLTDTMMTDPVRLPSGTVMDRSIILRHLLNSPTNPFTRQMLTASMLEPVPELKEQIQAWMAEKQSSDH,2.743805,"K5R, K10R, V11K, E22A, M37T, L40M, D68N, N71T, E77A, R95A",10
IEKFKLLAEKVEEIVAKNARAEIDYSDAPDEFRDPITDTIMTDPVFLPSGTVMDRSIINRHLLNSPTNPFTRAMLTEDVLEPVPELKEQIQAWMREKQSSDH,6.9055977,"L36I, M37T, L40I, R46F, L59N, D68N, N71T, Q73A, S78D, M79V",10
IEKFKLLAEKVEELVKKNARAEIDYSDASDEFRDPLTDTLMTDPVRLPSGTVMDRSIILRHLLNSPTNPFTRQMLTESMLEPNPELAEQIQAWMRENQSSQH,3.3928123,"I14L, A16K, P29S, M37T, D68N, N71T, V83N, K87A, K97N, D101Q",10
IEIFKLLAEKVEEIVAKNTRALIDYSDDPDEFRDPLTDTLMTDPVRLPSGTVMDRSIILRHLLNSSQNPFTRNMLTESMLEPVPELKEQIQAWMREKQSSDH,0.9440248,"K3I, A19T, E22L, A28D, M37T, P66S, T67Q, D68N, N71T, Q73N",10
IEKFKLSAEKVEEIVAKNARAEIDYSDAPDEFRNPLTDTLMTDPVRLPSGTVMDRSIILRHLLNSPTNPTTRQTLTEPMLEPVPALKEQIQAWMREKQSYDH,1.7256143,"L7S, D34N, M37T, D68N, F70T, N71T, M74T, S78P, E85A, S100Y",10
IEKFKLLAEWVEEIVAKDNRAEIDYSDAPDEFRDPLTDTLMTDPVRLPSGTVMDRSIILQHLINSPTNPFTRQMLTESMLEPVPELVEQIQAWMRELQSSDH,4.572314,"K10W, N18D, A19N, M37T, R60Q, L63I, D68N, N71T, K87V, K97L",10
IEKDKLLAEKVEEIVAKNARAEIDSSDAPDEFRIPLTDTLMTDPVILESGTVMDRSIILRHLLNSPTNPFTRQLLTESMLEPVPELKEQIQAWMREKQSSDI,4.3623686,"F4D, Y25S, D34I, M37T, R46I, P48E, D68N, N71T, M74L, H102I",10
IEKFQLLAEKVEEIVAKNANAEIDYSDAPDEFRDPLTDQLMTDPVRLPSGTVMDRSIIERHLLNSPTNPFTRQMLTESMLEPVEHLKEQIQAWMREQQSSDH,5.209313,"K5Q, R20N, M37T, T39Q, L59E, D68N, N71T, P84E, E85H, K97Q",10
IEKIKLLAEKVEEIVAKNARAEIDYKDAPDEFRDPLTDTLMTDPVRLPNGTVMDRSIILRHGLNSPTHPFTRQDLTESMLEPQPELKEQVQAWMREKQSSDH,-0.4690042,"F4I, S26K, M37T, S49N, L62G, D68H, N71T, M74D, V83Q, I90V",10
IEKFKLLADKVEEIVAKNARAEIDYGDAPDEFRDPLTDTLMTDPVRLPSGVVMDRSIILRHFLSSPTNPVTRQMLTESMLEPVPELREQIQAWMREKQSSDH,0.014140131,"E9D, S26G, M37T, T51V, L62F, N64S, D68N, F70V, N71T, K87R",10
IEKFKLLAEKVEEIVAKNARIEIDYSDAPDNFRDPLTYTLMLDPVRLPSGTVLERSIILRHLLNSPTNPFTRQMLTESNLEPVPELKEQIQAWMREKQSSDH,9.331152,"A21I, E31N, M37T, D38Y, T42L, M53L, D54E, D68N, N71T, M79N",10
IEKFKLLAEKVEDIVAKNARAEIDYSDAPDEFTDPLTYTLMTDPVRLPSGTVMDRSIALEHLLNSPTNPFTRQMLTPSMLEPVPELKEQIQAWMREKQSSDE,4.270855,"E13D, R33T, M37T, D38Y, I58A, R60E, D68N, N71T, E77P, H102E",10
IEKFKLPAEKVEEIVDKNAEAEIDYSDAPDEFRDPLTDNLMTDPVILPSGTVMDRSIILRHLLNSPTNPFTRQMETESMLRPVPELKEQIQAWMREKQSSDH,2.2364502,"L7P, A16D, R20E, M37T, T39N, R46I, D68N, N71T, L75E, E81R",10
IEKFKLLADKREEIVAKNAREEIDYSDAPDEFRDPLTDTLMTDPVRLPSGTVMDRSIILRHLMNSPTNPFTRQMLTESMIEPVNELKEQIQAWMRHKQSSDH,4.639529,"E9D, V11R, A21E, M37T, L63M, D68N, N71T, L80I, P84N, E96H",10
IEDFKLLAEKDEEIVAKNARAEIDYSDAPDEFRNPLTDRLMHDPVRLPSGTVMDRSIILRHLLNSPTNPFTRQMLTESMLEPVPELKEQIQAWMREKQSSNI,2.6365738,"K3D, V11D, D34N, M37T, T39R, T42H, D68N, N71T, D101N, H102I",10
IEKFKLLAERVEEIVAKNARAEHDYSDAPDEFRNPLTDTLMTDPVRLPSGVVMDRSIILRHLLNSETNPFTRQMLTESNLEPVPVLKEQIQAWMREKQSSDH,2.9872441,"K10R, I23H, D34N, M37T, T51V, P66E, D68N, N71T, M79N, E85V",10
IEEFKLLAEKVEEIVAKNERAEIDGSDAPDEFRDPLTDTLMTDPVRLPSGHVLDRSIILRHLNNSPTNPFTRQMLTESMLEPVPNLKEQIQAWMREKQSSDH,8.371473,"K3E, A19E, Y25G, M37T, T51H, M53L, L63N, D68N, N71T, E85N",10
IEKFKLLAEEVEEIVAKNARFEIDYSDAPDEFRDPLTDTLMVDPVRLPSGTVMDRSIILRHLLNSATNPFTRQMLTWSMLEPVPELKEQVQAWMREKQSSDR,4.235435,"K10E, A21F, M37T, T42V, P66A, D68N, N71T, E77W, I90V, H102R",10
MEKFKLLATKVEEIVEKNASAEIDYSDAPDEFIDPLTDTLMTDPVRLPSGTVLDRSIILRHLLNSPTNPFTRQMLTESMLEPVPELKEQIQAWMREKQSDDH,7.7178216,"I1M, E9T, A16E, R20S, R33I, M37T, M53L, D68N, N71T, S100D",10
IEKFKLLAEKVEQKVAKNARAEIDRSDAPDEFRDPLTDTVMTDPVRLPNGTVMSRSIIERHLLNSPTNPFTRQMLTESMLEPVPELKEQIQAWMREKQSSDH,5.5826397,"E13Q, I14K, Y25R, M37T, L40V, S49N, D54S, L59E, D68N, N71T",10
MENFKLLFEDVEEIVAKNARAEIDYSDAPDEFRDPLTDTLMTDPVRLPSGTVMDRSIILQHLLNSPTNPFTRQMLTESMLEPTPELKDQIQAWMREKQSSDH,3.0193157,"I1M, K3N, A8F, K10D, M37T, R60Q, D68N, N71T, V83T, E88D",10
MEKFKLLAQHVEEIVAKNARAEIDYSDAPDEFRNPLTDTLMTDPVRLPSGTVMDRSIILRHLLNSPTNPFTRQSLTESDLEPVPELKEQIQAWMEEKQSSDH,1.7951318,"I1M, E9Q, K10H, D34N, M37T, D68N, N71T, M74S, M79D, R95E",10
IEKFKLLAEKVEEIVAKNAAASIDKSDAPDEFRDPLTDTLMTDPVRLPSGTVMDYEIILRHLLNSSTNPFTRQMLTESMLEPVPELKEQIQAWMREKQSSDA,5.2351217,"R20A, E22S, Y25K, M37T, R55Y, S56E, P66S, D68N, N71T, H102A",10
IEKFKLPAEKVEEIVATNADAEIDYADAPDEFRDPLTFTLMTDPVRLPSGTTMDRSIILRHLLNSPTNPFTRQMLTESMLEPVPELKEQIQAWMREKQSSDI,6.016536,"L7P, K17T, R20D, S26A, M37T, D38F, V52T, D68N, N71T, H102I",10
IEKMKLLAEKVEEIVAKNARAEIDNSDAPNEFRDPLTDELMTDPVRLPSGTVMDRSIILRHLLNSPTNPFTRQMLTKSMLEPNPELKEQIQAWMREKNSSDH,2.759068,"F4M, Y25N, D30N, M37T, T39E, D68N, N71T, E77K, V83N, Q98N",10
IEKFKLLLENVEEIVAKSARAEIQYSDAPDEFRDPLTDTLMTDPVILPSGTVMDRDIILRHLLNSPTNPFTRLMLTESMLEPVPELKEQIQAWMREKQSSDH,3.0960367,"A8L, K10N, N18S, D24Q, M37T, R46I, S56D, D68N, N71T, Q73L",10
IEKFKLLAEKEEEIVAKAARAEIDYSDNPDEFRDPLTDTLMTDPVRLPSGTVMDRSIILRHLEQSPTNPFTRQMLTESMLKPVPELKSQIQAWMREKQSSDH,5.6723766,"V11E, N18A, A28N, M37T, L63E, N64Q, D68N, N71T, E81K, E88S",10
IEKFKLDAEKVESIVAKNARAEIDYSDMPDEFRDPLTDTLMTNPVRLPSGFVMDRSIILRHLLNSPTNPFTRQMLHESMLEPVPDLKEQIQAWMREKQSSDH,4.78012,"L7D, E13S, A28M, M37T, D43N, T51F, D68N, N71T, T76H, E85D",10
IEKFKLLAEKVEEIVAKNARAEIDYSDAPDEFRDPLTDTLMTDPVRLTTGTVMDRSIILTHLKNGPTNPFTRQMLTESMLENVPELKEQIQAWMTEKQSSDH,0.83748764,"M37T, P48T, S49T, R60T, L63K, S65G, D68N, N71T, P82N, R95T",10
IEKFKLLAEKVEEIVAVNARAEIDYSDAPDEFRDPLTDELMTDPVRLPSGTVMDRSIILDHLLNSPTNPFTRQMLFESMLAPVPETNEQIQAWMREKQSSDH,4.228119,"K17V, M37T, T39E, R60D, D68N, N71T, T76F, E81A, L86T, K87N",10
IEYFKLLAEKDEEIVAKNARDEIDYSDAPDEFRDPLTDTLMKDPVRLPSGTVMERSIILRHLLNSPTNPFTRQMLTESMLEPVPELKEQIQAWMRDKQSSQH,4.172699,"K3Y, V11D, A21D, M37T, T42K, D54E, D68N, N71T, E96D, D101Q",10
IEKFKLLNEGVEEIVAKVARAGIDPSDAPDEFRDPLTDTLMTDPVRLPSGTVMDRSIILRHLLDSPTNPFTRQMLTESMLEPVPELKEQIQAWMRENQSSDH,4.4988937,"A8N, K10G, N18V, E22G, Y25P, M37T, N64D, D68N, N71T, K97N",10
IEKFKILAEKVEEIVAKNARAEIDYSDAPDEFRHPLTDTLITDPVRLPSGTVMDRSIILRHLLNRPTNPFTRQMLTEVMLEPVPELKEQIQAWMREKNSSNH,2.3165839,"L6I, D34H, M37T, M41I, S65R, D68N, N71T, S78V, Q98N, D101N",10
IEKFKLLAEKVEEIVAKNARAEIDYSDAPDDFRDPLTDNLMTDPVRLPSGIVMDRSIILRHLLNSPTNPLTRQMLTESMLEPVPELKEQIQAWISEKQSSDN,0.89737105,"E31D, M37T, T39N, T51I, D68N, F70L, N71T, M94I, R95S, H102N",10
IEKFKLLAEKVEEIVAKNARAEIDYSDAPDEFLDPITMTLMTDPVRLPSGVVMDRSIILRHLENSPTNPFTRQKLTESMLEPVPDLKEQIQAWMREKQSSDH,8.071708,"R33L, L36I, M37T, D38M, T51V, L63E, D68N, N71T, M74K, E85D",10
IEKEKLLAEKVEEIVQKNARAEIDYSDAPDEFRDPLTDTLMTDPVRLPSGTVMDRSTILNHLLNEPRNPFTRQMLTESMLEPVPELKEQIQAWMREKQKSDH,4.859474,"F4E, A16Q, M37T, I57T, R60N, S65E, T67R, D68N, N71T, S99K",10
IEKFKLLAEKVEEIVAKNVRAEIDYSDAPDEFRDPLTDTLMADPVRLPSGTVMDRSIILRHLANSPTNPFTRQMLTYSMIEPVPELIEQIQAWMREKESSDH,3.7436757,"A19V, M37T, T42A, L63A, D68N, N71T, E77Y, L80I, K87I, Q98E",10
IEKFKLLAEKVEEIVAKNARAIIDYSDAPDEFRDPLTDTLMTDPVILGSGTVMDESIILRHLLNSPTNPCTRQMLTESMLEPVPEMKEQIQEWMREKQSSDH,0.28086263,"E22I, M37T, R46I, P48G, R55E, D68N, F70C, N71T, L86M, A92E",10
IEKFKLLEEKVEEIVNKNERAEIDYSDAPDEFRDPLTDTLMTDPIRLPSGTVMDRSEILRHLLNSPTNPFTRQMLTESMLEPHPELKEQIQAWMRDKQSSDH,6.197668,"A8E, A16N, A19E, M37T, V45I, I57E, D68N, N71T, V83H, E96D",10
IEKFKLLAEKVEEIVAKNARAEIDYSDAPDEFRDPLTDELMTDPVRLPSGTTMDRSIISHHLLNSPTNPLTREMLTEEMLEPVPELKEQIQAWMREKQSSDH,-1.060663,"M37T, T39E, V52T, L59S, R60H, D68N, F70L, N71T, Q73E, S78E",10
IEKFKLLALKVEEIVAKNAKAEIDYSDAPDEFYDPLTDTLMTDPVILPSGTVMDRSIILRHLLNSPTNPFTRQMITESDLEPVPELKEFIQAWMREKQSSDH,1.6928926,"E9L, R20K, R33Y, M37T, R46I, D68N, N71T, L75I, M79D, Q89F",10
IEKFKPLAEKVEEIVAPQARAEIDYSDAKDEFRDPLTDTLMTDPVRLPSNTVMDRSIILRHLLQSPTNPFTRQMLTESMFEPVPELKEQIQAWMREKQSSDH,2.0980997,"L6P, K17P, N18Q, P29K, M37T, G50N, N64Q, D68N, N71T, L80F",10
IEKFKLLAEKVEEIVAKNARYHIDYSDAPDEFRDPLTDTLMTDPVRLPSGTVMDRSISLRHLLNSPTNPFTRQMLTEDMIEPVGELKEQIQSWMREKQSSDH,2.3593934,"A21Y, E22H, M37T, I58S, D68N, N71T, S78D, L80I, P84G, A92S",10
IEDFTLLAEKVEEIVAKNAEAEIDYSDAPDEFRDPLTDTLMTDPVRLPSGTVMDRSIILRHLLNSPTNPFTRQMLTESMLYPVPELKRQIQAWMREKGTSDH,3.813734,"K3D, K5T, R20E, M37T, D68N, N71T, E81Y, E88R, Q98G, S99T",10
IEKFKLLAEKVEEIVAKNERAEIDYSDAPREFRNPLTDTLMTDPVRLPSGHVMDRSIILRHLLNSPTNPFTRNMLTESMLEPVPELQEQIQAWMDEKQSSDH,4.1195126,"A19E, D30R, D34N, M37T, T51H, D68N, N71T, Q73N, K87Q, R95D",10
IEKFKLLAEKVEEIVAKFLRAEDDDSDAPDEFRDPLTDTLMTDPVRLPSGTVMDRSIILRHLLNSPTNPFTRQMQTESMLEPVPELKEQIQAWLLEKQSSDH,3.6073954,"N18F, A19L, I23D, Y25D, M37T, D68N, N71T, L75Q, M94L, R95L",10
IEKFKLLAEKVEEIVAQNARAESDQWDAPDEFRNPLTDTLMTDPVRLPSGTVMDRSIILRHLLNSPTNPFTRQMLTESMLEPVPELNEQIQAWMREKQSSRH,3.8771248,"K17Q, I23S, Y25Q, S26W, D34N, M37T, D68N, N71T, K87N, D101R",10
IEKFERLAEKVEEIVAKNARAEIDYSDIPDEFRDPLTDTFMTDPVRLPSGTVMDRSIILRHLENSPTNPFTRQMLTESNLEPVPELKEQIQAWMREKQSSDK,3.898752,"K5E, L6R, A28I, M37T, L40F, L63E, D68N, N71T, M79N, H102K",10
IEKFKLLAEKQEEIDAKNARAEIDYSDAPDEFRDPLTDTLMTDPVRLPSGTVMERSIILAHILNSKTNPFTRQMLTESMLEPVPELKEQIQAWMREKQSSDD,2.9573176,"V11Q, V15D, M37T, D54E, R60A, L62I, P66K, D68N, N71T, H102D",10
MEKDKLLAEKVEKIVAKNARAEIDYSDAPDEFRNPLTDTLMTDPVRLPSGTVMDNSIILRHLLNSPTNPFTRQMLTESMLEPVPNLKEQIQAWMREKQSSDS,2.4972405,"I1M, F4D, E13K, D34N, M37T, R55N, D68N, N71T, E85N, H102S",10
IEKFKLLPEKVEEIVAKNARAEIDYSDLPDFFRDPLTDTLMEDPVRLPSGTVMDRSIILRHLLNNRTNPFTRQMLTPSMLEPVPELKEQIQAWMREKQSSDH,3.720149,"A8P, A28L, E31F, M37T, T42E, S65N, P66R, D68N, N71T, E77P",10
IEKFKLLDEKVEEIVAKNARAEIDYSDAPDPFRDPLTDTFMTDPVRLPSGTVLDRSIILRHLLNSPTNPFTRQMLTESMLEPHPELKEQIQAWLREKQGSDH,8.705419,"A8D, E31P, M37T, L40F, M53L, D68N, N71T, V83H, M94L, S99G",10
IEKDKLLAEKVEEIVNKNADAEIDYSDAPDPFRDPLTDTLMTDPVRLSSGTVMDRSIILRHLLNSPTNPFTRQMLTESMLEPVPELKEQIMAWIREKQSSDH,3.7415566,"F4D, A16N, R20D, E31P, M37T, P48S, D68N, N71T, Q91M, M94I",10
IEKFKLLAEKVEEIEAKNARLEIDYADAPDEFQDPLTDTLMTDPVRAPSGTVLDRAIILRHLLNSPTNPFTRQMLTESMLEPVPELKEQIQAWMREKQSSDH,7.936881,"V15E, A21L, S26A, R33Q, M37T, L47A, M53L, S56A, D68N, N71T",10
MEKFKLLAEKVEEIVAKNARAEIDYSDAPDEFRNPFTYTLMTDPVRLPSGTVMDRSIILRHLLNSPNNPFTRQMLTESKLEPVPELKKQIQAWMREKQSSDH,1.0305934,"I1M, D34N, L36F, M37T, D38Y, T67N, D68N, N71T, M79K, E88K",10
MEKFKLLAEKVEEIVPKNARANIDYSDDPDMFRDPLTDTLMTDPVRLPSGTVMDRSIILRHLLISPTNPFTRQMLTESMLENVPELKEQIQAWMREKQSSDH,2.0836413,"I1M, A16P, E22N, A28D, E31M, M37T, N64I, D68N, N71T, P82N",10
IEKFKLLAEKVEEIVAKNLRAEIDYSDAPDEFRDPITFTLMTDPVRLPSGTVMDRSIILRHLLNSPTNPFTRQMLTESMLEPVLELNDQIQAWMREKKSSDH,6.484975,"A19L, L36I, M37T, D38F, D68N, N71T, P84L, K87N, E88D, Q98K",10
EEKFKLLAEKQEEIVAKNARAEIDYSDAMDEFRDPLTDTLMQDPVRLPSGTVMDRMIILRHLENSPTNPFTRQMLTESMLEPDPELKEQIQAWMREKQSSDH,5.5713015,"I1E, V11Q, P29M, M37T, T42Q, S56M, L63E, D68N, N71T, V83D",10
IEKFKLLAEKVEEIVALNARAEIGYSDAPDEFRDPLTFTLMTDPVRLPSGTVMDRSIILRHLLNSPQNPFTRKMLTESMLEPVPELKEQIQNWMREKDSSDH,4.1577635,"K17L, D24G, M37T, D38F, T67Q, D68N, N71T, Q73K, A92N, Q98D",10
MNKFKLLAEKVEEIVAKNARAEIDYSDAPDEFRDPLTDTLMTDPVRLPSGTVMDRAIILEHLLNSPTNPFTRQLLPESMLEPVPELKEQIQAWMRETQSSDH,2.0715094,"I1M, E2N, M37T, S56A, R60E, D68N, N71T, M74L, T76P, K97T",10
IEKFQLLAEKVEEIVAKNARAEIDYSDAPDEFRDPLTDTLQTDPVRLPSGTVMERSIILRHLLISPTNPMTRQNLTESMLEPNPELKEQIQAWMREKQSSDH,2.0180464,"K5Q, M37T, M41Q, D54E, N64I, D68N, F70M, N71T, M74N, V83N",10
