Sequence,Score,Mutations,Number of Mutations
MDKFKLLAEKVEEIVAKNARAEIDYSDAPDEWRNPLTDTLMRDPVRLPAGTVVDRSIILRHLLNSPTNPFTRQMLTESMLEPVPELKEQIQAWMREKQSSDH,5.2531395,"I1M, E2D, F32W, D34N, M37T, T42R, S49A, M53V, D68N, N71T",10
IKNFKLLAEKVEQIVAKNARAEIDYSDAPDEFRDPLTDTLMKDPVMLPSGHVMDRSIILRHLLNSPTNPFTRQMLTESMLEPVNELKEQIQAWMREKQSSDH,4.716882,"E2K, K3N, E13Q, M37T, T42K, R46M, T51H, D68N, N71T, P84N",10
IEKFKLLAEKVEEIVAKNARAGFDYSDAPDEFRDPLTDTLMTDPVRLPSGTVIDRSIILRLLLNSPTNPFTRQMLTESMLEPVPELKEQLEAWMSEKQSSDH,3.1737757,"E22G, I23F, M37T, M53I, H61L, D68N, N71T, I90L, Q91E, R95S",10
IRKFKLLAEKVEEIVAKNARAEIDYSGAPDDFRDPLTDTLMTDPVRLPSGFVMDRSIILRHLLNSPTNPFTRQMLTDSMLEPVPELKEQIQAWMGEIQSSDH,2.7665763,"E2R, D27G, E31D, M37T, T51F, D68N, N71T, E77D, R95G, K97I",10
IEKFKLLAERVIEHVAKNARAEIMYSWAPDEFRDPLTDTLMTDPVRLPSGTVMDRSIILRHLLNSKTNPFTRQMLTESMLEPNPELKEQIQAWMREKQSSDH,3.9038348,"K10R, E12I, I14H, D24M, D27W, M37T, P66K, D68N, N71T, V83N",10
IEKFKLLIEKVEAVVAKNARAEIDYSDAPDEFRDPLTDTLMTDPVLLPSGTVMDRSIILRHSLNSPTNPFTRSMLTESMLEPVPELKEQIQARMREKQSSDH,0.5313397,"A8I, E13A, I14V, M37T, R46L, L62S, D68N, N71T, Q73S, W93R",10
IEKFKKLAEKVEEIVAKNARAEGDYSDAPDEFRDPLTDTLMTDPVRLPSGTVMDRSIILRHLLNSPTNPFTDQEMTESMLEPVPELKEQIQAWLRENQSSDH,3.5303109,"L6K, I23G, M37T, D68N, N71T, R72D, M74E, L75M, M94L, K97N",10
TEKFKLLAGKVEEIVAKNARAEIDYSDAPDEFRDPLTDTMMTDPVRLPSGTVMDRSIILRHLLNGPTNPTTRTMLTEDMLEPVPELKEQIQAWMREKQSSDH,1.2527293,"I1T, E9G, M37T, L40M, S65G, D68N, F70T, N71T, Q73T, S78D",10
IEKFKLLAEKVEEIVGKNARAEIDYSDAPDPFRDPLTDTLMTDPVRLPSGTVMDREIILRHLLNSPTNPFTRQMLPESYLEPVSELNEQIQAWMREKQSSDH,0.5189448,"A16G, E31P, M37T, S56E, D68N, N71T, T76P, M79Y, P84S, K87N",10
IEKFKLLEEKVEEIVARNARAEIDYSDAPDEFRDPLTDTLMTDPVRLPNGTVMDRSIILRHLLNSRTNPFTRQMLTESMLEPVPELKEEIQAWMREKLESDH,5.986464,"A8E, K17R, M37T, S49N, P66R, D68N, N71T, Q89E, Q98L, S99E",10
IEKFKLLAEKVEEIVAENATAEIDYSDAPDEFRDPLTDTLMTDPVRLPSGTVMDRSIILRHLLNSPTNPFTRQQLTESMLEPTPELKEHIQAWMREKQVSEH,3.5725389,"K17E, R20T, M37T, D68N, N71T, M74Q, V83T, Q89H, S99V, D101E",10
IEKFKLLAEKVTEIVAGNARAEIDYSDAPDEFPDPLTDTLMTDPVRLPSGTVMDRSIILRHLLNSPSNPFTREMLTESMLEPVPELKEQIQAWLREKQSSTH,1.0041752,"E12T, K17G, R33P, M37T, T67S, D68N, N71T, Q73E, M94L, D101T",10
IEKFKLLAEKVEEIVAKNARAEIDYSAAPDEFRDPLTDTLMTDPVRLPSGTVMDRSIILNHLLNSPTNPFTRQMLNESMLEPAPEIKEQIQKWMREKQSSDD,2.5003853,"D27A, M37T, R60N, D68N, N71T, T76N, V83A, L86I, A92K, H102D",10
IDKFKLLAEKVDEIQAKNTRAEMDYSDAPDKFRDPLTDTLMTDPVRLPSGTVMDRSIILRHLLNSPTNPKTRQMLTESMLEPVPELKEQIQAWMREKQSSDH,4.4316864,"E2D, E12D, V15Q, A19T, I23M, E31K, M37T, D68N, F70K, N71T",10
IEKVKLLANKVEEIVAKNARAEIDYSDQPDEFRDPLTDTLMTDPVILPSGLVMDRSIILRHLLNSPTNPFTRQMLTESMLEPNPELKEQIQAWMREKQSSDA,4.3928413,"F4V, E9N, A28Q, M37T, R46I, T51L, D68N, N71T, V83N, H102A",10
IEKFKLLDEKVEEIVAKNIRAEIDYSDAPDEFRDPLTDTLMTDPVRLPSGQVMDRSIILRHLLNSPENPFTRQMLTESMLEPVPEMKEQIQEWMREKQSSDT,5.189107,"A8D, A19I, M37T, T51Q, T67E, D68N, N71T, L86M, A92E, H102T",10
IEKFKLLAEKVEESVAKPARAEIDYSDAPDEFRDPLTDTLMTDPVRLPSGQTMDRSIILRHLLNSPTNPFTRQMLTESMLEPVNELKEQMQAWMRTKQSSDH,4.125494,"I14S, N18P, M37T, T51Q, V52T, D68N, N71T, P84N, I90M, E96T",10
IEKFKLLAEKVEKIVAKNARREIDYSDAPDEFRDPLTFTLMTDPVRLPSGTVMDRSIILRHLLNSPTNPFTRTMLTESMLEPVPELKEQIDAWMREKSKSDH,3.700368,"E13K, A21R, M37T, D38F, D68N, N71T, Q73T, Q91D, Q98S, S99K",10
IEKFKLLAEKVEEIVAKNARGEIIYSDAPDDFRDPLTDTLMTDPVRLPSGHVMDRSIIQRHLLNSPTNPFTRQMLPESMLEPVPELKEQIQAWMREKQFSDH,1.3978486,"A21G, D24I, E31D, M37T, T51H, L59Q, D68N, N71T, T76P, S99F",10
IEKFKELAEKQEEIVAKNARAEIDYSDAPDEFRDPLTYTLMTDPVRLPSGPLMDRSAILRHLLNSPTNPFTRQMLTESMLEPVPELKEQIQAWMREQQSSDH,8.677617,"L6E, V11Q, M37T, D38Y, T51P, V52L, I57A, D68N, N71T, K97Q",10
IEKFKLAAEKVEEIVAKNARAEIVYSDAPDEFRDPLTDTLMTDPVRLPSGTFMDRSIILKHLLNSPTNPFTRQPLTENMLEPVPELKEQIQAWIREKQSSDH,3.684603,"L7A, D24V, M37T, V52F, R60K, D68N, N71T, M74P, S78N, M94I",10
IPKFKLLAENVEEIVAKNAREEIDYSDDPDEFRDPLTDTLMTDPVRLPSGTVLDRSIILRHLLNSPKNPFTRQMLTESMLMPVPELKEQIQAWMREKQSSDH,6.384303,"E2P, K10N, A21E, A28D, M37T, M53L, T67K, D68N, N71T, E81M",10
IEKFKLLAEKVEEIIAKPADAEIDYSDAPDEFRDPLTDTLMTDPVTLPSGTVMDRDIILRHLLNSPTNPFTRQMLTESMLEPVPELKEQICAWMREGQSSDH,3.7783875,"V15I, N18P, R20D, M37T, R46T, S56D, D68N, N71T, Q91C, K97G",10
IYKFKLLAQKVEEIVSKNARAEIDYSEAPDAFRDPLTDTLMTDPVRLPSGTVMDRSIILRHLLNSPTNPFTRQHLTESMLEPVPELKEQIQAWMREKQSADH,2.920198,"E2Y, E9Q, A16S, D27E, E31A, M37T, D68N, N71T, M74H, S100A",10
MEKFKLLAEKVEEIVAKNAWADIDYSDAPVEFRDPLTYTLMTDPVRLPNGTVMDRSIILRHLLNSPTNPFTRQMLTLSMLEPVPELKEQIQAWMREKQSSDH,4.3627806,"I1M, R20W, E22D, D30V, M37T, D38Y, S49N, D68N, N71T, E77L",10
IEKFKLLAEKVEEIVAKIARAEIDYSDAPDEFRDPLTDTLMTDPVRLPDGTTMDRSIILRYLLNSGTNPFTRQMLTESMLEPDPELKEQIQALMREKQSSDH,-0.9250245,"N18I, M37T, S49D, V52T, H61Y, P66G, D68N, N71T, V83D, W93L",10
IEKQKLLAEKVEEIVAKNNRAEIDYSDAPDEFRDPLTDTLYTDPVRLRSGTVMDRSIILRHLLNSPTNPFTRRMLTESMLEPVEELKEQIQAWMREKQSPDH,2.5247962,"F4Q, A19N, M37T, M41Y, P48R, D68N, N71T, Q73R, P84E, S100P",10
IFKFKLLAEKVEEIVAKNARAEIIYSDAPDEFRDPLTYTLMTDPVRLPSGTVMDRSIIERHLLNSPTNPFTRKMLTESMLEPVPDLKEQIQALMREKQSSDH,3.099928,"E2F, D24I, M37T, D38Y, L59E, D68N, N71T, Q73K, E85D, W93L",10
IEKFKLLAEKVEEIVAKNAEAEIDYSDAPDEFRDPLTDKLMTDPVRLPSGTVMDRSIIERHLLNSPMNPLTRQMLNESMLEPVPELKEQIRAWMREKQSSDH,-1.3361298,"R20E, M37T, T39K, L59E, T67M, D68N, F70L, N71T, T76N, Q91R",10
IEKFKLLAESVEEIVAVNARAEIDYSDAPDEFRDPLTDTLMTDPVRLPKGTVMDRSIILRHLLNSPTNPFTRQHLTESMLEPVPELKDQIQIWMREKTSSDH,4.9682846,"K10S, K17V, M37T, S49K, D68N, N71T, M74H, E88D, A92I, Q98T",10
IEKFKLDAEKNEEIEAKNARAEIDYSDAPDEFRDPLTDTLMTDPVRLPSGTVMDRSIIVRHLLNSPTNPFTREMLTESMLEPVPELLEQIQAWMREKQRSDH,3.2272003,"L7D, V11N, V15E, M37T, L59V, D68N, N71T, Q73E, K87L, S99R",10
IEKFKLLAEKVEEIVAKNPRAVIDYSYAPMEFRDGLTDTLMTDPVRLPSGTQMDRSIILRHLLNSPTNPFTRQMLTESMLEPVPELKEQIQAWMRENQSSDH,2.7816117,"A19P, E22V, D27Y, D30M, P35G, M37T, V52Q, D68N, N71T, K97N",10
IEKFKLPAEKVEEIVAKNARAEIDYSLAPIELRDPLTYTLMTDPVMLPSGTVMDRSIILRHLLNSPTNPFTRQMLTESMLEPVPELKEQIQAWMRELQSSDH,4.2346144,"L7P, D27L, D30I, F32L, M37T, D38Y, R46M, D68N, N71T, K97L",10
IEKFKLLPEKEEEIVRKNARAYIDFSDAPDEFRDPLTDTLMTDPVRLPSGTVLDRSIILRHLLNSPTNPFTRQMLDESMLEPVPELKEQIQAWMREKQSSDH,7.839031,"A8P, V11E, A16R, E22Y, Y25F, M37T, M53L, D68N, N71T, T76D",10
IEKIKLLAEKVEEIVAKNARAEIDYSDAPDEFRDPLTFTLMTDPVRLPSGTTMDRSIILKHLLNSPTNPFTNQPLTESMLEPVPELKEQIAAWMREKQSSDH,3.1165252,"F4I, M37T, D38F, V52T, R60K, D68N, N71T, R72N, M74P, Q91A",10
IEAFKLLAEKVEEIVKKNARAEIDYSDAPDEFRDPLTDILMTDPVRLPSGTVMDRSIILRHLVNSKTNPFTRQMLTENMLEPVPELKEQIQAWMREKQKSDH,4.2269707,"K3A, A16K, M37T, T39I, L63V, P66K, D68N, N71T, S78N, S99K",10
IDKFKLLAEKVEEIVAKNARAFIDYSDFPDEFRDPLTDTLMTDPVVLPSGTVMDRSSILRHLLNSPTNPFTRQMITESMLEPVPELKEQIQAWMREKESSDH,3.132205,"E2D, E22F, A28F, M37T, R46V, I57S, D68N, N71T, L75I, Q98E",10
IEKFKLLAEKVEEIVAKNARTMIDYSDAPDEFRDPITDTLYTDPVRLPSGSVMDRSIILRHLLNSPTNPTTRQMLTESMLEPVPELDEQIQAWMREKQSSDH,5.613329,"A21T, E22M, L36I, M37T, M41Y, T51S, D68N, F70T, N71T, K87D",10
IEAFKLLAEKVEEIVAKNARAENDYSDAPDEFRDPLTDTLMTDPVRLPSGTVMERNIILRHLLNSKTNPFTRQMLTESMLEPVPEVKEQIQALMREKQSSDH,1.5810324,"K3A, I23N, M37T, D54E, S56N, P66K, D68N, N71T, L86V, W93L",10
ILKFKLLAEKVEEIVAKNARADIDYSDAPDEFRDPLTFTLMTDPVRLDSGTVMDRSIILRHLLTSPTNPFTRQMLTESELEPVPELKEQIQSWMREKQSSDH,1.8656149,"E2L, E22D, M37T, D38F, P48D, N64T, D68N, N71T, M79E, A92S",10
IEKFKLLAEKVEEIVAKNATAEIDESDAPDEFIDPLTFTLMTDPVRLPSGTVMDRSIILRHLLNSPTNPFTRQMLDESMLEPVPELKERIQAWMREQQSSDH,3.7875905,"R20T, Y25E, R33I, M37T, D38F, D68N, N71T, T76D, Q89R, K97Q",10
IEKFKALKEKVEEIVAKNARAEIDYSQAPDEFRDPLTDTLMTDPVRVPSGTVMDRAIINKHLLNSPTNPFTRQMLTESMLEPVPELKEQIQAWMREKQSSDH,7.290495,"L6A, A8K, D27Q, M37T, L47V, S56A, L59N, R60K, D68N, N71T",10
IEKFKLSAEKVEEIVAKNARAEIDYSDAPDEFRDPLTDTLMTDPVRLPSGTVMDRSDILRHLLNSPTNPFTRQMLTESMLEPVPEMQRQVQAWMRVKQSSDH,4.772992,"L7S, M37T, I57D, D68N, N71T, L86M, K87Q, E88R, I90V, E96V",10
IEKFKLWAEKVEEIVAKNARAEIDYSDAPDEFRDPLTFTLMTDPVRLPSGLVMDRSVILRHLLNSPTNPFTRQMLTESMLEKVPEVKEQIQAWFREKQSSDH,5.1085176,"L7W, M37T, D38F, T51L, I57V, D68N, N71T, P82K, L86V, M94F",10
IEKFKLLAEKVEEIVAKNARAEIMYSDAPDEFRDPLTDTLMTDPVRLPNGTVMDRSIILRHYLNEPTNPFTRQMLTDSMLEPVPDLKEQIQAIMREKQSSDH,2.199081,"D24M, M37T, S49N, L62Y, S65E, D68N, N71T, E77D, E85D, W93I",10
IEKFKLLYEKVEEIVAKNARAEIDYSDDPDEFRDPLTDTLMTDPVRLPNGTTMDRSTILRHLLNSPTNPLTRQMLTESMLEPVPELKEQIQAWMEEKQSSDH,0.56363285,"A8Y, A28D, M37T, S49N, V52T, I57T, D68N, F70L, N71T, R95E",10
IEKFKLLAEWVEEIVFKNARAEIDYSDAPDEFRDPLTDTLMRDPVRLGSGTVLDRSIILRHLLNSPTNPFTRQMLTESMLEDVPELKEQIQAWMREKQLSDH,8.035349,"K10W, A16F, M37T, T42R, P48G, M53L, D68N, N71T, P82D, S99L",10
MGKFKLLAEKVEEIVAKNARAEIDYSDHPDEFRDPLTDTLMTDPVRLPSGTVMDRSILLRHLLNSPTNPFTRQMLTESMLEPVPELKEQIQAMMREKQSCDA,1.9200444,"I1M, E2G, A28H, M37T, I58L, D68N, N71T, W93M, S100C, H102A",10
IEKFKLDAEKYEEIVAKNARAEIDYSDAPDEFRDPLTDTLMTDPVRLPSGTVMDRSIILEHLLNSPTNPFTRQMLTESMMPTVPELKEQIQAWMREKQSSDN,2.0056458,"L7D, V11Y, M37T, R60E, D68N, N71T, L80M, E81P, P82T, H102N",10
MEKFNLLAEKVEEIVAKNARAEIDDDDAPDEFRDPLTDTLMTDPVRLPSGTVVDRSIILRHLLNSPTNPFTRQLLTESDLEPVPELKEQIQAWMREKQSSDH,9.259798,"I1M, K5N, Y25D, S26D, M37T, M53V, D68N, N71T, M74L, M79D",10
IEKEKLLAEKVEEIVAKWARAEIDYSDFPDEFRDPLTDTLMEDPVRLPSGTVMDRSIILRHLENSPTNPFTRQMLTESMLEPVQELKENIQAWMREKQSSDH,5.326133,"F4E, N18W, A28F, M37T, T42E, L63E, D68N, N71T, P84Q, Q89N",10
IEKFKLLAEKVEEIVAKNARAEIDYSDAPDEFRDPLTDTLMTDPVRLPSGTVMDRSIILRHFLYSPTNPFTRQKLTESMLEPVPELKEQIQAWMDEQQSSPT,4.9502687,"M37T, L62F, N64Y, D68N, N71T, M74K, R95D, K97Q, D101P, H102T",10
IEKFKLLEEKIEEIVAKNARAEIDESDAPDEFTDPLTDTLMTDPVRLPSGTVIDRSIILRHLFNSPTNPFTRQMLTRSMLEPVPELKEQIQAWMREKQSSDH,7.142411,"A8E, V11I, Y25E, R33T, M37T, M53I, L63F, D68N, N71T, E77R",10
MKKFKLLAEKVEEIVAKNARAEIDYQDAPDEFRDPLTYTLMTDPVVLPSGTVMDRSIILEHLLNSPTNPFTRQMLTESMLEPVPELKEQIQAWMREKQQSDH,6.617367,"I1M, E2K, S26Q, M37T, D38Y, R46V, R60E, D68N, N71T, S99Q",10
IEKFKQLAEKVEEINAKNARAEIDYSDAPDEFKDPLTDTLARDPVRLPSGTVMDRSSILRHLLNSKTNPFTRQMLTESMLEPVPELKEQIQAWMREKQSSDH,4.8659887,"L6Q, V15N, R33K, M37T, M41A, T42R, I57S, P66K, D68N, N71T",10
IEKFKLLWEDVEEIVAANARDEIDYSDAPDEFRDPLTDTLMTDPVRLPSGTVMDRSIILRHLSNSPTNPFTRQMLTESMLEPVPELKEQIQALMREKQISDH,3.4095407,"A8W, K10D, K17A, A21D, M37T, L63S, D68N, N71T, W93L, S99I",10
IEKNKLLAEKVDEIMAKNSRAEIDYSDAPDEFFDPLTDTLMEDPVRLPSGTVMDRSIILRHLLNSPKNPFTRQMLTESMLEPVPELKEQIQAWMREKQSSDH,3.4645748,"F4N, E12D, V15M, A19S, R33F, M37T, T42E, T67K, D68N, N71T",10
IEKFKTLTEKAEEIVEKEARAEIDISDAPDEFRDPLTDTLMTDPVRLPSGTVMDRSIILRHLLNSPTNPFTRQMLTESMLEPVRELKEQIQAWMREKQSSDH,4.3066607,"L6T, A8T, V11A, A16E, N18E, Y25I, M37T, D68N, N71T, P84R",10
IEKFKLLAEKVEEIVAKNARAEIDYSDAPDEFRDPLTFKLMTDPVRLPSGHVMDRSIILDHLLNSPTNPLTRQMLTESMLEPVPELKEQIQAWMRIKQSEDH,-0.7022432,"M37T, D38F, T39K, T51H, R60D, D68N, F70L, N71T, E96I, S100E",10
IEKFKVLAEKVEEEVAQNARAEGDYSDAPDEFRDPLTDTLMTDPVRLPSGTVMDRHIILRHLLNSPTNPFTRQMLTESMLEPVPELKNQIQAWMRAKQSSDH,5.3667517,"L6V, I14E, K17Q, I23G, M37T, S56H, D68N, N71T, E88N, E96A",10
IDKFKLLAEKVEEIVAKNARAEIDYSDAPDYFRDPLTDTLMTDPVRLPSGTVLDRSGILRHLRNSPTNPFTRQMLTESMLEPVPEVKEQIQAIMREKQSSDH,7.2358937,"E2D, E31Y, M37T, M53L, I57G, L63R, D68N, N71T, L86V, W93I",10
IEKFKLLAEKVEEDVAKNARAKFDYSDAPDEFRDPLTDTLMTDPVRLPSGTVMDRSIILRHLLNSGANPFTRQMLTEEMLEPVPELREQIQAWMREKQSSDH,1.0942807,"I14D, E22K, I23F, M37T, P66G, T67A, D68N, N71T, S78E, K87R",10
IEKFKELYEKVEEIVAKNARAEIDYSDAPDEFRDPLTDTLTTDPVRLPSGIVMDRSIILRHLANSPTNPFTRQMLTESMIEPVAELKEQIQAWMREKQSSDH,2.8123493,"L6E, A8Y, M37T, M41T, T51I, L63A, D68N, N71T, L80I, P84A",10
DEKLKLLAEKVEEIVAKNAPAEIDYSDAPDEFRDPLTDNLMTDPVRLPSGTVMDRSIILRHALNSPTNPFTRQMVTESMLEPVPELKEQIQAWMSEKQSSDH,1.3288957,"I1D, F4L, R20P, M37T, T39N, L62A, D68N, N71T, L75V, R95S",10
IEKFKLLAEKVEEIVAKNARARIDYSDAPDEFRNPLTDTLMTDPVTLPSGTVMDRNIILRHLLNSPKNPFTRQMLTESMLETVPELKEQIIAWMREKQSSDH,-0.35825726,"E22R, D34N, M37T, R46T, S56N, T67K, D68N, N71T, P82T, Q91I",10
IEKFKLLAEQVEEIVAKNARAEIDYSDAPNEFCDPLTDTLMKDPVRLPSGTVMDRSIILRHLLNSRTNPFTWQMLTESMLEPVPELKEQIQAWIREKQSSDH,1.9245224,"K10Q, D30N, R33C, M37T, T42K, P66R, D68N, N71T, R72W, M94I",10
MEKFKLLADKVEEIVAKNARAEIDYSDAPDEFRDPLTYTLMTDPVRLPNGTVMDRSIILRHWLNSPTNPFTRQMLTESMLEPVPELKEQIDAWMREKQSSDQ,5.736369,"I1M, E9D, M37T, D38Y, S49N, L62W, D68N, N71T, Q91D, H102Q",10
IEKFKLLAEKVEEIEAKNWRAEIDYSDAPDEFRDPLTHTLMTDPVRLPSGTVMDRSIILRHLLISPTNPFTRQMLTESMLEPVPKLKEQIQAWMRERQSQDH,3.542849,"V15E, A19W, M37T, D38H, N64I, D68N, N71T, E85K, K97R, S100Q",10
IEKFALLAEKHEEIVAKNATAEIDYSDAPDEFRDPLTDTLMTDPVRLPSGTVMDRSIVLRHLLNSPTNPFTRQMLTEGMLIPVPELKEQIQAWMREKQSSEH,3.2688532,"K5A, V11H, R20T, M37T, I58V, D68N, N71T, S78G, E81I, D101E",10
IEEFKLLAEKVREIVAKNARAEIDYSDAPDEFRDPLTDTYMTDPVRLPSGTVLDRSIITRHLENSPTNPFTRQMLTEMMLEPVPELKEQIQAWMREKQSSDH,7.458578,"K3E, E12R, M37T, L40Y, M53L, L59T, L63E, D68N, N71T, S78M",10
IEKFKLLAEKVEEIVAKHDRAEIDYSDAPDEFRDPLTDTLMTDPVRLPSGTVLDRSIILRHLLTSPTNPITRQMLTCSMLEPVPELKDQIQAWMREKQSSDH,3.2773411,"N18H, A19D, M37T, M53L, N64T, D68N, F70I, N71T, E77C, E88D",10
IEKFKLLAEKVEEIDAKNDRAEIDRSDAFDEFDDPLTDTLMTDPVRLPSGTVMDRSIILRHLLNSPTNPFTRQMLTESMLEPYPELKEQIQAWMRIKQSSDH,3.961616,"V15D, A19D, Y25R, P29F, R33D, M37T, D68N, N71T, V83Y, E96I",10
IEKFKLLAEKHEEIVAKYARQEIDLSDAPDEFRDPLTDTLMTDPVRLPSGTVMDRSIILRHLLNSPTNPFTRQMLTESMLEPVPALTEQIQAWMREKQSSHH,3.809669,"V11H, N18Y, A21Q, Y25L, M37T, D68N, N71T, E85A, K87T, D101H",10
IEKFELLAEKVEEIVAKNARAEDDESTAPDEFRDPLTSTLMTDPVRLPSGTVMDRSIILRHLLNSPTNPFTRQMLTESILEPVPELKEQIQAWMREHQSSDH,0.99959916,"K5E, I23D, Y25E, D27T, M37T, D38S, D68N, N71T, M79I, K97H",10
IAKFKGRAEKVEEIVAKNARAEIDESDAPDEFRDPLTYTLMTDPVRLPSGEVMDRSIILRHLLNSPTNPFTRQMLTESMLEPVPELKEQIQAWMNEKQSSDH,5.7451544,"E2A, L6G, L7R, Y25E, M37T, D38Y, T51E, D68N, N71T, R95N",10
IEEFKLLAEKVEEIVAKNARAEIDYSDAPDTFRDPLTDTLMTDPVRLPSGHVMDRSIILRWLRNSNTNPFTRQMLTESMLEPVPTLKEQIQAWMREKQSSDH,3.4693365,"K3E, E31T, M37T, T51H, H61W, L63R, P66N, D68N, N71T, E85T",10
IEKFRLLAEKVEEIAARDARAEIDYSDAPDEFRDPLTDTIMTDPVRLPSGTVMDRSIILEHLLNSPTNPFTRQMLTESMLEPVPELKEQIQAWMREKQSSNH,5.5953035,"K5R, V15A, K17R, N18D, M37T, L40I, R60E, D68N, N71T, D101N",10
IEKFKLLAEKVEEIVAKNARNEIDYSDAPDEFRDPLTDTLMTDPVRLPSGTVMDRSIILRSLLNSATNPLTHQMLTESELEPNPELKEQIQAWMREKQSSDH,-2.3592968,"A21N, M37T, H61S, P66A, D68N, F70L, N71T, R72H, M79E, V83N",10
IEKFKLLAEKAEEIVAKNARAEIDYSDAPDEFENPLTDELMTDPVRLHSGTVMDRSIILRHLLESPTNPFTRQMLTESMLEPVPELKRQIQAWMREKQSSDH,-1.0303724,"V11A, R33E, D34N, M37T, T39E, P48H, N64E, D68N, N71T, E88R",10
IEKFKLLAEKVAEIVAKNANLEIDYSDAPDEFRDPLTDILMTDPVRLPSGTVMDRSIILRHLLNCPTNPFTRQMLTESNLEPVPELKEQIQAWMREKQSEDH,0.8406664,"E12A, R20N, A21L, M37T, T39I, S65C, D68N, N71T, M79N, S100E",10
IEKFKLEAEKVEEIVAKNARAEIDYSDAPDEFRDPLTDTLMTDPVRLPSGTVLDRSIILRHLLNSRTNPFTRQMLDESMLEPVPELKEQIQAQMRIKQGSDH,6.493598,"L7E, M37T, M53L, P66R, D68N, N71T, T76D, W93Q, E96I, S99G",10
IEKFKLLASKVEEIVAKNARAEIDYSDAPDGFRDPLTDTLMTDPVRLPSGTVVDRSIIDNHLNNSPTNPFTRQMLTESMLEPVPELKEQIQAWMQEKQSSDH,7.3463736,"E9S, E31G, M37T, M53V, L59D, R60N, L63N, D68N, N71T, R95Q",10
IEDFHNLAEKVEEIVAKNARAEIDNSDAPDEFRNPLTYTLMTDPVILPSGTVMDRSIILRHLLNSPTNPFTRQMLTESMLEPVPELKEQIQAWMREKQSSDH,3.0713449,"K3D, K5H, L6N, Y25N, D34N, M37T, D38Y, R46I, D68N, N71T",10
IEKFKLEAEKVEEIVAKNARAEIDYSDAPDEFRDPLTDTLMTDPVRLPSGTVMDRSYILEHLLNSKTNPFTRQMLTESMLEPVPELKEQIQQWMREKLSSDD,5.1817474,"L7E, M37T, I57Y, R60E, P66K, D68N, N71T, A92Q, Q98L, H102D",10
IEKFKLLAEKVEEIVAKNARAEIDYSDAPDEFRDPLTDILMDDPVRLPSGTVMDRSIILRHLENSPTNPLTRQMLTEDMLEPVPELKEFIQAWMREKQSSNH,0.17798062,"M37T, T39I, T42D, L63E, D68N, F70L, N71T, S78D, Q89F, D101N",10
IEKFKLLAEKVQEIVAKNAEAEIDTSDAPDEFRDPLTDTLLTDPVRLPSKTVMDRSIILRHLLNSPTNPFTRQMLTESMLEPDPELKEQIQAWLREKQSSDH,3.3021626,"E12Q, R20E, Y25T, M37T, M41L, G50K, D68N, N71T, V83D, M94L",10
IEKFKLLAEKVEEIQAKNARAEIDYVDAPDEFRDPLTDTLMTDPVRLPSGTVMDRSIILRHLLNSPTNPFTRQMLTESMLEPVPDDDEQIQAWMRIVQSSDH,6.275175,"V15Q, S26V, M37T, D68N, N71T, E85D, L86D, K87D, E96I, K97V",10
IEKFKLLAEKVEEIVAKNARAEIDYSKAPDEFRDPLTDTLMTDPVRLPTRTVMDRSIILGHLLNSPTNPFTRQPLTESMLEPVPELKEQIQAWMRIKQSSDT,2.944141,"D27K, M37T, S49T, G50R, R60G, D68N, N71T, M74P, E96I, H102T",10
IEKFKLLAEKVEEIVADNARAEIDYSDEPDHFRDPLTDTLMEDPVRLPSGTVMDNSIILRHLLNSPTNPFTRQMLTESMLEPVPELKEQIQAWLRWKQSSDH,6.325283,"K17D, A28E, E31H, M37T, T42E, R55N, D68N, N71T, M94L, E96W",10
IEKFKELAEKVEEIVAENARSEIDESDAPDEFIDPLTDTLMTDPVRLPSGTVMDREIILRHLLNSPTNPFTRQVLTESMLEPVPELKEQIQAWMREKQSSDH,4.6119037,"L6E, K17E, A21S, Y25E, R33I, M37T, S56E, D68N, N71T, M74V",10
IEKFKLLAEKRWEIVAKNARYEWDYSDAPDEFRDPLTDTLMTDPVRLPSGHVMERSIILRHLLNSPTNPFTRQMLTESMLEPVPELKEQIQAWMREKWSSDH,4.174091,"V11R, E12W, A21Y, I23W, M37T, T51H, D54E, D68N, N71T, Q98W",10
IEKFKELAEKVSEIVAKNTRAEIDYSDAPDEFRDPLTDTLMTDPVRLPSGTVMDRSIILRHLLNSHTNPFTRQMLTESMLEPVVELKEQIQIWMRGKQSSDH,3.5466344,"L6E, E12S, A19T, M37T, P66H, D68N, N71T, P84V, A92I, E96G",10
IEKFPLLAERVEEIVAKNLRAEIDYSDAPDEFRDPLTDELMTDPVRLPSGTVMDRRIILRHLLNSPTNPFTRQMLTESMLEPVPELKEQIQAWMRNKQSSDK,4.5602703,"K5P, K10R, A19L, M37T, T39E, S56R, D68N, N71T, E96N, H102K",10
IEKFKLLAEKVNELVAKNARKEIDDSQAPDEFRDPLTDTLMTDPVRLPSGTVMDRSIILRHLLNSPTNPFTRQMLTESMLKPVPELKEQIQAWMQEKQSSDH,5.147056,"E12N, I14L, A21K, Y25D, D27Q, M37T, D68N, N71T, E81K, R95Q",10
IEKFKLLAEKVEAIVAKNARAEIDYSDAPDEFRDPLTDTLMTDPVMLPSGTVMDRSEILRHLLNSPTNPFTRQMLTESMLEPTPELKAQAQAWMREKQSSDL,3.0227408,"E13A, M37T, R46M, I57E, D68N, N71T, V83T, E88A, I90A, H102L",10
IEKFKLLAEKVEEIVAKNANAIGDYSNAPDEFRDPLTYTLMTDPVRLPSGTVMDRSIILRHLLNSPTNPFTRQPLTESMLEPVPELKEQIQAWMREKQSHDH,7.1973433,"R20N, E22I, I23G, D27N, M37T, D38Y, D68N, N71T, M74P, S100H",10
IEKFKLLAEKVEEIVAKAARAGIDYSKAPDEFSDPLTDTLMTDPVRIPSGTVMDRSIILRHLLNSPTNPFTRQMLTESMLEPVPELKEQIIAWMEEKQSSDH,1.4194738,"N18A, E22G, D27K, R33S, M37T, L47I, D68N, N71T, Q91I, R95E",10
IEKFKLLAEKVEEPVAVNARLEIDYQDAPDEFRDPLTDTLMTDPVALPSGTVMDRSSILRHLLNSPTNPLTRQMLTESMLEPVPELKEQIQAWMREKQSSDH,1.6423233,"I14P, K17V, A21L, S26Q, M37T, R46A, I57S, D68N, F70L, N71T",10
IEKFKLDEEKVEEIVAKLARAEIDYSDAPDEFRDPLTDTLMTDPVRLPSGTVIDRSIILNHLFNSPTNPFTRQMLTESMLEPVPELKEQIQAWMREKGSSDH,8.308804,"L7D, A8E, N18L, M37T, M53I, R60N, L63F, D68N, N71T, Q98G",10
IEAFELLAEKVEEIVAKNARAEIDYSDAPDEFWDPLTDTLMTDPVRLPSGTVMDRSIILRHLLSSPTNPFTRQMLTESMLEPVPELVEQIQAWQRENQSSDH,2.6956363,"K3A, K5E, R33W, M37T, N64S, D68N, N71T, K87V, M94Q, K97N",10
IEKFKLLADKVEEIVEKNARAEIDYSDADDEFRDPLTDRLMTDPVRLPSGTVMDRSIILRHLLNSPTNPFTRQMITESMLEPVPELKEQIQARLREKQSSDH,-0.05966942,"E9D, A16E, P29D, M37T, T39R, D68N, N71T, L75I, W93R, M94L",10
ITKFKLLAEKVEENVAKNARAEIDYSDAPDEFRDPLTYTLMTDPVRLTSGTVMDRSIIKTHLLNSPTNPFTRQMLTESMLEQVPELKEQIQAWMREKQSSDH,2.5550356,"E2T, I14N, M37T, D38Y, P48T, L59K, R60T, D68N, N71T, P82Q",10
IEKFKLLAEKVEEIVAKNARAEIDYLDAPDEFIDPLTFTLMTDPVRLPNGTVMDRSIILRHLLNSPTNPFTRQMLTESMLEPVPELKEQIKAWMRAKQISDH,3.5936303,"S26L, R33I, M37T, D38F, S49N, D68N, N71T, Q91K, E96A, S99I",10
IEKFKLLAEDVERIKAKNARAEDDYSDAPDEFRNPLTDTLMTDPVRLPSGTVMDRSIILRHLLNSPTNPFTKQMLTESMLEPVPELKQQIQAWMREKQSSDH,2.4484534,"K10D, E13R, V15K, I23D, D34N, M37T, D68N, N71T, R72K, E88Q",10
IEKFKLLAEKYEEEVAKNARAEIDYSDAKDEFRDPLTDTLMTDPVRLPSGFVMDRSIILRHILNPPTNPFTRQMLTESMLEPVPELKEQIQAWMRSKQSSDH,1.3020877,"V11Y, I14E, P29K, M37T, T51F, L62I, S65P, D68N, N71T, E96S",10
IEKFKLLAEKVEEMVAKNARAEIDYSDAQDEFYDPLTDDLMTDPVRLPSGTVMDRSIILRHLLNSPTNPFTRQMLTESMLEPVPELKPQIMEWMREKQSSDH,3.1686816,"I14M, P29Q, R33Y, M37T, T39D, D68N, N71T, E88P, Q91M, A92E",10
IEKFKLLAEKVEEIVAKNARAEIDYSDAPKEFRDPLTDTLMTDPVRLPMGTVMDRSIILRHLDNSPTNPITRQMLTESDLEPVPELKEEIQARMREKQSSDH,0.16420035,"D30K, M37T, S49M, L63D, D68N, F70I, N71T, M79D, Q89E, W93R",10
IEKFKLLAEKVETIVAKNARAIIDDSDAPYEFRDPLTDTLMTDPVRLPSGTVMDRSIILRHLLNKPTNPFTRQMLTESMLEPVPELKEQIQQWMRDKQSSDH,4.9945517,"E13T, E22I, Y25D, D30Y, M37T, S65K, D68N, N71T, A92Q, E96D",10
IEKFKLLAEKQEEEEAKNARAEIDYSDAPDEFRDPLTDTLMTDPVRLRSGTVMDRSIILRHLLESPTNPFTRQMLTESMLEPVPELKEQIQAYIREKQSSDH,3.7837152,"V11Q, I14E, V15E, M37T, P48R, N64E, D68N, N71T, W93Y, M94I",10
IEKFKLLAEKVEEQVAKNARAEIDYSDAPDEFRDPLTYTLMTDPVRLSSGTVMDRSIILAHLLNKPTNPFTRQMLTGSMLEPVPELKEQIQAWMREKQSSDA,2.9786427,"I14Q, M37T, D38Y, P48S, R60A, S65K, D68N, N71T, E77G, H102A",10
IEKDKLLAEKVEEIVAKIARAEIDYSDAPDEFYNPLFDTLMTDPVRLPSSTVMDRSIILRHLNNSPTNPFTRQMLTESMLNPVPELKEQIQAWMREKQSSDH,0.59168845,"F4D, N18I, R33Y, D34N, M37F, G50S, L63N, D68N, N71T, E81N",10
IEKFKLLAEVVEEIAAKNARAEIDGSDAPDEFRDPLTDTLMTDPVRIPSGTVMDRSIILRHLLESPTNPFTRQMLTESMVEPVPELKEQAQAWMREKQSSDH,3.149086,"K10V, V15A, Y25G, M37T, L47I, N64E, D68N, N71T, L80V, I90A",10
IEMFKLLAEKVEEIVAENARAKIDYSDAPDEFRDPLTDTLMSDPVLLPSGTVMDRSIILRHLLNSPTNPFTRQMLIESMLEPVPELKERIQAWMREKQSSDH,1.9917059,"K3M, K17E, E22K, M37T, T42S, R46L, D68N, N71T, T76I, Q89R",10
IEKFKLLAEKVSEIVAKNARAEIQYSDAPDEFRDPLTFTLMTDPVRLPSGTTMDRNIILRHLLNSPTNPFTRQMLTESMLEPVKELKEQIQWWMREKQSSDH,4.6818085,"E12S, D24Q, M37T, D38F, V52T, S56N, D68N, N71T, P84K, A92W",10
IEKFKLLAEKVEHVVAKNARAEIDYRDAPDEFRDPLTDTLMTDPVRLKSGTVMDRSIILRHLLNSPTNPFTRQMLGESMLEPVPELKEQIQAWMREKQLNDH,3.003734,"E13H, I14V, S26R, M37T, P48K, D68N, N71T, T76G, S99L, S100N",10
IEKFQLLAEKDEEIRAKNARAEIDYSLAPDEFRDPLTDTLMTDPVRLPSGTVMDRSIILRHLTNSPTNPFTRQELTESMLEPVPELKEQIQAWMEEKQSSDH,5.2482796,"K5Q, V11D, V15R, D27L, M37T, L63T, D68N, N71T, M74E, R95E",10
IEKFELLAEKVEEIVAKNARAEIDYSKAPDYFRDPLTDTLMTDPVTLPSGTVMDRSIILRHLLNSRTNPFTRQMLTESVLEPVPELKEQIQMWMREKQSSDH,0.37097493,"K5E, D27K, E31Y, M37T, R46T, P66R, D68N, N71T, M79V, A92M",10
IEKFKLLAEKVEEIVAKNARAEADYSDAPDEFRDPLTDTLFTDPVRLPSGTVMERSIILRHLLNQPTNPFTRQMLTESMLDPVPALKEQIQQWMREKQSSDH,2.743517,"I23A, M37T, M41F, D54E, S65Q, D68N, N71T, E81D, E85A, A92Q",10
IEKFKLPAEKVEEIVAKNARAEIDYSDAPLEFRDPLTDTLMTDPVRLPSGTVMDRSIILRHLLNSMTNPFTFQMLTESMLRPVPELKEQIQAERREKQSSDH,1.988169,"L7P, D30L, M37T, P66M, D68N, N71T, R72F, E81R, W93E, M94R",10
IEKFKLLAEKVEEEQRKNQRAEIDYSDAPDEFSDPLTDTLMTDPVRLPSGTVMDRSAILRHLLNSPTNPFTREMLTESMLEPVPELKEQIQAWMREKQSSDH,1.8697653,"I14E, V15Q, A16R, A19Q, R33S, M37T, I57A, D68N, N71T, Q73E",10
IEKFKLLAEKVEEIWAKNARAEIDYSDAPDEFRDPLTDALVTDPVRLPSGTVMDRSIILRHLLNSPTNPFTRTLLTESMLEPVPELKEQIQAWMREKISSDG,-0.677858,"V15W, M37T, T39A, M41V, D68N, N71T, Q73T, M74L, Q98I, H102G",10
IEKFKLLAEKVEEIVAKEERAEIDESDAPDEFRDPLTDTLMTDPVRLPSGTVMDRSIILRHLLNNPTNPFTSQMLTESMLEPVDELKEQIEAWMREKQSSDH,1.5342178,"N18E, A19E, Y25E, M37T, S65N, D68N, N71T, R72S, P84D, Q91E",10
IEKFKLLDEKVEEIVAKNARAIIDYSDAPDEFRDPLTDTLMTDPVRLPSGTVMDRSIILRHLLHSPTNPFTRQMFTESMLENVPELKRQIQTWMREKQSSDH,3.2973413,"A8D, E22I, M37T, N64H, D68N, N71T, L75F, P82N, E88R, A92T",10
MEKFKLLSESVEEIVAKNARAEIDYSDAPDEFLDPLTWTLMTDPVRLPSGTVMDRSIILRHLLNSPTNPFTRQMLTESMLEPVPELKEQMQAWMREKVSSDH,3.278205,"I1M, A8S, K10S, R33L, M37T, D38W, D68N, N71T, I90M, Q98V",10
IEKFKLLAEKVEEIVAKNLRAEIDYSDAPDEFRDPITWTLMTDPVRLPSGTVMDRSIIKRHLLESKTNPFTRQMLTESMLEPVPELKEQLQAWMREKQSSDH,6.2991123,"A19L, L36I, M37T, D38W, L59K, N64E, P66K, D68N, N71T, I90L",10
MEKFKLLAEKVEEIVRKNARAEIDASDAHDEFRDPLTDTLMSDPVRLPSGTVMDRSIILRHLLNSPTNPFTYQMLTESMLEPVPELKEQIQAWMREQQSSDH,2.4528165,"I1M, A16R, Y25A, P29H, M37T, T42S, D68N, N71T, R72Y, K97Q",10
IEKFKVLAEKVEEIVAKNARAEIDYSTAPDEFRDPLTDTLMTDPVRLPSGTTMDRSIILRHLLNSPTNPLTYDMLGESMLEPVPELKEQIQAWMREKQSSDH,-1.7454538,"L6V, D27T, M37T, V52T, D68N, F70L, N71T, R72Y, Q73D, T76G",10
EEKQKLLAEKVEEIVAKNARAEIDYSDSPDEFRNPLTDTLMTDPVRLDSGTVMDRSIILRHLLNSPTNPFTLNMLTESMLEPVPELKEQIQAWMREKQSSDH,-0.6122011,"I1E, F4Q, A28S, D34N, M37T, P48D, D68N, N71T, R72L, Q73N",10
MEKFKLLAEKVEEIVAKNARAEIDYSDAPDPFRDPLTDTLMTDPVRLPSGVVMDRSIILRHLNNSPTNPFTRQMLTEEKLEPVPELKEQIQAWMREKQSSDL,3.962206,"I1M, E31P, M37T, T51V, L63N, D68N, N71T, S78E, M79K, H102L",10
IEKFKLLAEKVEEIVAKNARAHIDNSDAPDEFRDPLTDTLMTDPVSLPSGTVLDRSIIERHLLNSSTNPFTRQMITESMLEPVPELKEQIQAWMREKQSSDH,4.198098,"E22H, Y25N, M37T, R46S, M53L, L59E, P66S, D68N, N71T, L75I",10
MEKFKLLAEKVEEIVAQNARAEIDYSDAPDEFDDPLTDTLMTDPVRLPSGTVMDRSTILRHLLNSPTNPFTRQMLTSQALEPVPELKEQIQAWMREKQSSDH,3.7561657,"I1M, K17Q, R33D, M37T, I57T, D68N, N71T, E77S, S78Q, M79A",10
IEKFKLLAEKVEEIVAKNARAHIDYSDAPDEFRNPITDTLMGDPVRLPSGTVMDRSIILRHLLNSPTNPFTRQQLTSSMLEPVPELWEQIQAWMREKQSSDH,4.5161476,"E22H, D34N, L36I, M37T, T42G, D68N, N71T, M74Q, E77S, K87W",10
IEEFKLLAEKVEEIVAKNATAEIDYSDAPHEFRDPLTDELMTDPIRLPNGTVMDRSIILRHLLNSPTNPFTRQMLTESMLEPVPELKEQIQAWMREKQSSDD,2.58353,"K3E, R20T, D30H, M37T, T39E, V45I, S49N, D68N, N71T, H102D",10
IEKFKLLAEKVEEIGAKNARAEIDYSDAPDEFRDPLTDTLMLDPVRLFSGTVMDRSIILRHLLNSPTNPFTRQMLNESMLEPYPELKEMIQAWMRAKQSSDH,3.9901567,"V15G, M37T, T42L, P48F, D68N, N71T, T76N, V83Y, Q89M, E96A",10
IEKFKLLAEKVEEIVAKNAVDEIDYSDAPDEFRDPLTDTFMTDPVRLPSGHVMDRSIILRHLLNSPTNPCTRQMLTESMLEPVPELKEEIQAWMQEKQSSDH,2.903277,"R20V, A21D, M37T, L40F, T51H, D68N, F70C, N71T, Q89E, R95Q",10
IEKFKLLAEKVEEIVAKNAKAEIDYRDAPDEFRDPLTFCLMTTPVRLPSGTVMDRSIILRHLLNSPTNPFTRQMLTESMLENNPELKEQIQAWMREKQSSDH,2.964233,"R20K, S26R, M37T, D38F, T39C, D43T, D68N, N71T, P82N, V83N",10
IEKFKLLAEKVEEIVAKNARAYIDYSDLPDEFRDPLTDELMTDPVRLPSGTVLDRNIILRHLLNSPTNPFTRQMVTESMLEPVPELKEQIQAWMREKQSSNH,5.256156,"E22Y, A28L, M37T, T39E, M53L, S56N, D68N, N71T, L75V, D101N",10
IEKFKLLAEKVEEAVAKNAVVEIDYSDAPDEFRDPLTDELMTDPVRLPSGTVMDRQIILRHLLNSPTNPFTRQMLTEEMLWPVPELKEQIQAWMREKQSSDH,4.0999146,"I14A, R20V, A21V, M37T, T39E, S56Q, D68N, N71T, S78E, E81W",10
MEKFHLLAEKNEIIVAENARAEIDYSDAPDEFRDPLTDTLMTDPVRLPSGTVMDRSAILRHLLNSPTNPFTRQMLTEDMLEPVPELKEQIQAWMREKQSSDH,5.932255,"I1M, K5H, V11N, E13I, K17E, M37T, I57A, D68N, N71T, S78D",10
IEKFKLLAEKKEEIVAKNAAALIDYSDAPGEFRDPLTDQLMTDPVRLPSGTVMDRSIILRHLLNSPTNPFTRQMLTENMLEPVPELKEQIQRWMREKQSSDH,4.363682,"V11K, R20A, E22L, D30G, M37T, T39Q, D68N, N71T, S78N, A92R",10
IGKKKLLAEKVAEIVAKNARDEIDYSDAPDEFRDPITDTLMTDPVRLPNGTVMDRSTILRHLLNSPTNPFTRQMLTESMLEPVPELKEQIQAWMREKQSSDH,8.980097,"E2G, F4K, E12A, A21D, L36I, M37T, S49N, I57T, D68N, N71T",10
IEKFKLLAEKVEEIVAKNARAEIDYSDAPDEFRNPLTDTLMTDPVRLPSGTVLDRSIILVHLLNSPTNPFTRQMLTESMLKPVPELKEQIKAEMREKQSWDH,5.3946342,"D34N, M37T, M53L, R60V, D68N, N71T, E81K, Q91K, W93E, S100W",10
IEKFKLLAEKVEEIVAKNARAEEDYSDAPEEFRDPLTPTLMTDPVRLPSGTVLDRSSILNHLLNSPTNPFTRQMLTESMLEPVPELKEQINAWMREKQSSDH,9.389708,"I23E, D30E, M37T, D38P, M53L, I57S, R60N, D68N, N71T, Q91N",10
IEKFKLLAEKVEEIVAKNARAEIDYSDAPDEFRDPLTDTLMTDPVMLPSGTVMERSIILRHLLTSPTNPFTRQMLTNSDLEPRPELKEQIQAWMREKLSSDH,1.0663257,"M37T, R46M, D54E, N64T, D68N, N71T, E77N, M79D, V83R, Q98L",10
IEKSLLLAEKVEVIVAKNARAEIDYSDAPDEFRDPLTDTLMTDPVRLESGTVMDRSIILRHLLNSPTNPFTRQMLTESMLKPVPELKEQIQAWMREQQNSDH,4.172639,"F4S, K5L, E13V, M37T, P48E, D68N, N71T, E81K, K97Q, S99N",10
IEKFKLLADKEEEIVAKNDRAEIDYSDAPDEFLDPLTDTLMTDPVRLPSGTVMDRSIILRHLENHPTNPFTSQMLTESMLEPVPELKEQIQAWMREKQSSDH,0.21800658,"E9D, V11E, A19D, R33L, M37T, L63E, S65H, D68N, N71T, R72S",10
INKFKLLAEKVEEIVAKNARYEIDYSDAPDEFRNPLTDTLMTDPVRLPSGTVVDRSIILRHLLIKPTNPFTRQMLSESMLEPVPELKEQIQAWMREKQSSDH,5.3256536,"E2N, A21Y, D34N, M37T, M53V, N64I, S65K, D68N, N71T, T76S",10
