Sequence,Score,Mutations,Number of Mutations
IEKFQLLAEKVEEIVAKNARAEIDFSDAPDEFRDPLTDTLMTDPVTLPSGTVLDRSIILRHLLNSPTNPFTRQMLTEKMLEPVPELKEKIQAWMREKQTSDH,6.8994637,"K5Q, Y25F, M37T, R46T, M53L, D68N, N71T, S78K, Q89K, S99T",10
IEKFKLLAEKVEEITAKNARAEIDYSDAPDEFRDPLTDTLMRDPVRLPSGTVMDRSIILRHLENSPTNPFTRQQLTESMLRPVPELKEQIQAWMREKQRSDD,3.958393,"V15T, M37T, T42R, L63E, D68N, N71T, M74Q, E81R, S99R, H102D",10
IEKFKDLAEKVEEIVAKNARAENDYSDAPDEFRDPLTFTLMTDPVRLPSGTVMDRSIIERHLLNRPTNPFTRQKLTESMLEPVPELKEQLQAWMREKQSSDH,2.6386833,"L6D, I23N, M37T, D38F, L59E, S65R, D68N, N71T, M74K, I90L",10
MEKFKLLIEKVEEIVAKNARAEGDYSFAPDEFRDPLTDTLMTDPVVLPSGTVMDRSIILRHLLNSKTNPFTRQMLTLSMLEPVPELKEQIQAWMREKQSSDH,3.7108002,"I1M, A8I, I23G, D27F, M37T, R46V, P66K, D68N, N71T, E77L",10
IEDFKLLAEKVEEIVAKNVRREIDYSDAPDEFRDPLTDTLMTDPVRLPSGTTMDRSIILRHLLNSPQNPFTRQMLTESMLEPVKELKEQIQALMREKQSSDH,1.1118629,"K3D, A19V, A21R, M37T, V52T, T67Q, D68N, N71T, P84K, W93L",10
IEKFKLLAEKVEEIVAKNADAEIDYSDVPDEFRDPLTDTLMTDPVRLPSGTVMDRSIILRHLLNSPTNPLTRQMLTESGLEPVPELLEEIQAWMAEKQSSDH,1.1379776,"R20D, A28V, M37T, D68N, F70L, N71T, M79G, K87L, Q89E, R95A",10
MEKEKLLAEKVEEEVAKNARAEVDYLDAPDEFRDPLTDTLMTDPVRLPSGTMMDRSIILRHLLNSPTNPFTRKMLTESMLEPVPELKEQIQAWMREKQSSDH,4.8533525,"I1M, F4E, I14E, I23V, S26L, M37T, V52M, D68N, N71T, Q73K",10
IEKFKLLAEKVEEIVAKNARAEIDYDDAPDEFRDPLTDTLMTDPVRLPSGLVMDRSEILRHLLNSHTNPFTRQVLTESMLENVPELKEQIQAWMREKQSNDH,5.962949,"S26D, M37T, T51L, I57E, P66H, D68N, N71T, M74V, P82N, S100N",10
IEKFKLLAEKVEEIVAKNAEAEIDYSDAPDEFRDFLTDTLMTDPVRLPSGHVMDRSIILRHLLNSPTNPFTRQMLTEDMLEPVPELKEQIEAVMREKQMSDH,4.8925085,"R20E, P35F, M37T, T51H, D68N, N71T, S78D, Q91E, W93V, S99M",10
IEKVKLLAEKVEEIESKLARAEIDYSDAPDEFRDPLTDTLMTDPVRLPDGTVMDRSIILRHLLNSPQNPFTRQMLTESMLEPVPELKEQIQQWMREKQSSDH,4.601745,"F4V, V15E, A16S, N18L, M37T, S49D, T67Q, D68N, N71T, A92Q",10
IEKFKLLAEKVEYIVAKNARAEIDYSDAPDEFCDPLTDTLMKDPVTLPSGTVIDRSIILRHLLNSPTNPLTRQNLTESMLEPVPELKEQIQAWMREKQSSDH,0.3882223,"E13Y, R33C, M37T, T42K, R46T, M53I, D68N, F70L, N71T, M74N",10
IEKFKLPAEKVEEIVAKNARAEGDYVQAPDEFRDPLTDTLMTDPVRLPSGTVMERSIILDHLLNSPTNPFTRQMLTESMLEPVPELKEQIQAWMREKQSTDH,5.5504136,"L7P, I23G, S26V, D27Q, M37T, D54E, R60D, D68N, N71T, S100T",10
IEKFKLLAEKVSEIVAKNGRAEIDYSDAPDVFRDPLTDTLMTDPVRLPSGTVVDRSIILRHLLNSPTNPLTNQMLTESMLEPVPELKEQIQAWMREKQSSDK,0.9338988,"E12S, A19G, E31V, M37T, M53V, D68N, F70L, N71T, R72N, H102K",10
IEKFKLLAEKVEEIEAKNARAEIQYSDAPDEFRDPLTDTLMTDPVRLPSGTVLDRAIILRHLLNSPINPFTRQMLTESMLKPVPELKEQIQAWLREKQSSDH,4.9689693,"V15E, D24Q, M37T, M53L, S56A, T67I, D68N, N71T, E81K, M94L",10
IEKFKLLAEKVEEIVAKNARAEIDYSDAPDEFRDPLTYTLMKDPVRLPSGTVMDRSIILRHLLNSPTNPFTRQMLTDSMIEPVVPLKEDIQAWMREKQSSDH,5.2854033,"M37T, D38Y, T42K, D68N, N71T, E77D, L80I, P84V, E85P, Q89D",10
IEKFKLLAEKVEEIVAKSATYEIDYSDAPDEFRDPLTDTLMQDPVRLPSGTVIDRSIILAHLLNSPTNPFTRQMLTESMLEPVPELKEQIQAWMREEQSSDH,8.154123,"N18S, R20T, A21Y, M37T, T42Q, M53I, R60A, D68N, N71T, K97E",10
IEKFKLLAEKVEEKVAKNARAERSYSDATDEFRDPLTDTLMTDPVTLPSGTVMDRSILLRHLLNSPTNPFTRQMLTESMLEPVPELKEQIQAWMREKQISDH,0.322829,"I14K, I23R, D24S, P29T, M37T, R46T, I58L, D68N, N71T, S99I",10
IEKFKELAEKVEEIVAKNAGAEDDYSDAPDEFRDPLTYTLMTDPVRLPSGTVMDRSIILRHLLNSPTNPFTRQMLTESMLEPVPELKALIQAQMREKQSSDH,4.8844585,"L6E, R20G, I23D, M37T, D38Y, D68N, N71T, E88A, Q89L, W93Q",10
IEKFKLLEEKVEEDVAKEARAEIDYSDAPDEFRDPLTDTLMTDPVTLPSGTVMDRSIILEHLLNRPTNPFTRQMLTESMLEPVPELKEQIQAWMREQQSSDH,3.8984659,"A8E, I14D, N18E, M37T, R46T, R60E, S65R, D68N, N71T, K97Q",10
IEKEKLLAEKVEEIVAENERAEIDGSDAPDEFRDPLTDTLMTDPVILPSGTVMDRSIIERHLLNSPTNPFTRQMLTESDLEPVPELKEQIQAWMREKQSSDH,4.4497137,"F4E, K17E, A19E, Y25G, M37T, R46I, L59E, D68N, N71T, M79D",10
MERFKLLDMKVEEIVAKNARAEIDYSDAPDEFRNPLTDTLMTDPVRLPSGTVMDRSIILRHLLNSPTNPFTRQMLEDSMLEPVPELKEQIQAWMREKQSSDH,1.5517683,"I1M, K3R, A8D, E9M, D34N, M37T, D68N, N71T, T76E, E77D",10
IEKFKLLAEKVEEIVAVAARAEIDYCDAPDEFRDPLTDTLMTDPVRLPSGTMMDRSIILRHLLNSPTNPFTRQMLTESILVPVPELKEQIRAWMREKQSSDH,2.7261097,"K17V, N18A, S26C, M37T, V52M, D68N, N71T, M79I, E81V, Q91R",10
IEKFKLLAEKVENLVAKNAEAEIDCSDAPDEFRDPLTDTLMTDPVRLPSGTVMDRSIILRHLLNSPTNPHTRQMLTESMLEPVPELKEQIQAWMRELSSSDH,5.277831,"E13N, I14L, R20E, Y25C, M37T, D68N, F70H, N71T, K97L, Q98S",10
IEKFKLLAEKVEEIVAKNARVEIDYSDAEDEFRDPLTDTLMTDPVRLPSGLVVDRSIILRHLLESPTNPFTRQMLTESMLEPVPELKEQIQNWMREKQSIDH,7.302493,"A21V, P29E, M37T, T51L, M53V, N64E, D68N, N71T, A92N, S100I",10
IEKFGLIAEKVEEIVAKNARAEIDYEDAPDEFRDPLTDTLMTDPVRLPSGTVMDRSIILRHLKDSPTNPFTRQPLTESMLEPVPELKEQIQAWMRKKQSSDH,4.6618795,"K5G, L7I, S26E, M37T, L63K, N64D, D68N, N71T, M74P, E96K",10
IEKFRKLAEKVEEIVAKNARAEDDYSKAPDEFRNPLTDTLMTDPVRLPSGTVMDRSIILSHLLNSPTNPFTRQMLNESMLEPVPELKEQIQAWMREKQSSDH,3.1564374,"K5R, L6K, I23D, D27K, D34N, M37T, R60S, D68N, N71T, T76N",10
IEKFKLLAGKVEEIVAKNARAEIDFSDAPDEFRDPLTDTLYTDPVRLPSGTVMDRSIIQRHLLNSPTNPLTRQCLTESMLEPVPELKEQIQQWMREKQSSDH,-0.29579937,"E9G, Y25F, M37T, M41Y, L59Q, D68N, F70L, N71T, M74C, A92Q",10
IEKFKLLAEKVEEIVAKNARAEIDYNDAPDEFRDPLTDELITDPVRLPSGTVVDRSIILNHLENSPTNPFTRQMLTESMLEPVPELKEQIQEWMREKQSSDH,7.413266,"S26N, M37T, T39E, M41I, M53V, R60N, L63E, D68N, N71T, A92E",10
IEKFKLLAKKVEEIVAKNALAEIEYSDAPDEFRDPLTDELMTDPVRLPSGTVMDRSIILRHLQNSPTNPFTRQMITESMLEPVPELKEQIQAWMREKQSGDH,3.947187,"E9K, R20L, D24E, M37T, T39E, L63Q, D68N, N71T, L75I, S100G",10
IEKFKLLAEKVEEIVEKNARIEIDYSDAPDEFRDPLTYTLMTDPVRLPDGTVMDRSIITRHLLMSPTNPFTRHMLTESMLEPVPELKEQIQAWMREKQSSDH,5.003295,"A16E, A21I, M37T, D38Y, S49D, L59T, N64M, D68N, N71T, Q73H",10
IEKFKKLAEKVEEIVADNANAEIDRSDEPNEFRDPLTDTLMTDPVRLPSGTVMDRSIILRHLLNSPTNPFTRQMLTESMLEPVPELKEEIQAWMREKQSSDH,5.9853153,"L6K, K17D, R20N, Y25R, A28E, D30N, M37T, D68N, N71T, Q89E",10
IEKFKLLRYKDEEIVAKNARAEILYSDAPNEFRDPLTDTLMTDPVRLPSGTVMDRWIILRHLLNSPTNPFTRQMLTESMLEPVPELKEQIQAWEREKQSSDH,4.250119,"A8R, E9Y, V11D, D24L, D30N, M37T, S56W, D68N, N71T, M94E",10
IEKFKLLAEKVREIVAKNARAEIDYSDLPDEFRDPLTDTLMTDPVRLPSGTVMDRRIILRHLLGSPTNPFTRQMLNESMLEPVWELKEQIQAWMREKQSFDH,3.1364512,"E12R, A28L, M37T, S56R, N64G, D68N, N71T, T76N, P84W, S100F",10
IEKFKLLAEKVEEIVAKNARALIDDSDAPDEFRDPLTDTLMTDPVRLPSGTVMDRSIILNHLLNSPTNPFTRQMLTESMLEDVPEIKEQILAWMREKQSSDL,5.467695,"E22L, Y25D, M37T, R60N, D68N, N71T, P82D, L86I, Q91L, H102L",10
IEKFKLLAELVEEIDADLARALIDYSDAPDEFRDPLTDTLMTDPVRLPSGTVMDRSIILRHLLNSPKNPFTRKMLTESMLEPVPELKEQIQAWMREKQSSDH,3.1617823,"K10L, V15D, K17D, N18L, E22L, M37T, T67K, D68N, N71T, Q73K",10
IEKFRLLAEKVEEIVAKNARAEIDYSDDPDEFRDPLTDTLMRDPVRLPSGTVMDRSIILRHFENSPTNPFTRQMLTESMLENVPELKEQIQAWMREKGSSDH,1.993053,"K5R, A28D, M37T, T42R, L62F, L63E, D68N, N71T, P82N, Q98G",10
IKKFKLLASKVEEIVAKNTRAEIDYSDAPDDFRDPLTDTLMTDPVRLDSGTVMDRSIILRHLLNSPTNPFTRQMLTESMLEDVPELKEQIQAWMREKQSSLH,4.640648,"E2K, E9S, A19T, E31D, M37T, P48D, D68N, N71T, P82D, D101L",10
IEKFKLLAEKVEEIVEKYARAEIDYEDAPDEFQDPLTDTLMTDPVRLPSGTVLDRSIILRHLLNSPTNPFTRQMLTESMLEPVPELKEQIQHWMREKQSSDQ,7.595253,"A16E, N18Y, S26E, R33Q, M37T, M53L, D68N, N71T, A92H, H102Q",10
IEKFKLLAEKVEEIVAKNARAEIDQSDAEDEFRDPMTDTLMTDPVRLPSGTVMDRSIILRHLLNSPTNPFTQQPLTEEMLEPVPELLEQIQAWMREKQSSDH,-0.6311003,"Y25Q, P29E, L36M, M37T, D68N, N71T, R72Q, M74P, S78E, K87L",10
TEKFKLLAEKVEESVAKNARAEIDYSDPPDEFRDPLTDTLMSDPVILPSGTVMDRSIILRHLLNSSTNPFTRQMLTESMLEPVPELKEQIQAWMREKQSSDM,2.5395207,"I1T, I14S, A28P, M37T, T42S, R46I, P66S, D68N, N71T, H102M",10
IEKFKLLALKVEEIVAKNARAEIDYSMAPDEFRDPLTDTLMTDPVRLPSGTVMDRSIINDHLSNSPTNPFTNQMLTESMLEPVPELKEQIQAWMREKQSSDY,2.663887,"E9L, D27M, M37T, L59N, R60D, L63S, D68N, N71T, R72N, H102Y",10
IEKFKLLAEKYEEWVAKNARAEIDYSDVPDPFRDPLTDTLMTDPVRLPSGHTMDRSIILRHLLNSPTNPFTRQMLTESMLEPVKELKEQIQAWMREKQSSDH,6.3183246,"V11Y, I14W, A28V, E31P, M37T, T51H, V52T, D68N, N71T, P84K",10
YEKFTLLAEKNEEIVAKNARAEIDYSDAPDEFRDPLTDTLMTDPVRLPSGTVMDRSIILRHLLNSPTNPFTRTPLTESMLEPVPELEEQIQAWMREKQRSDH,3.0372572,"I1Y, K5T, V11N, M37T, D68N, N71T, Q73T, M74P, K87E, S99R",10
IEKFKLLAEKVEEIVAKNARAEIDYSDAPDPFRDPLTDTLMTDPVTLPSGTLMDRSIILCHLLNAPTNPFTRQMLTFSMLEPVPELKERIQAWMREKQSSDH,-0.19095537,"E31P, M37T, R46T, V52L, R60C, S65A, D68N, N71T, E77F, Q89R",10
IEKFKLKALKVEEIVAKNARAEIDYSDAPDEFRDPLTDTLMTDPVRTPSGTVMDRSIILRHLLNSPLNPFTRQPLTEAMLEPVPELKEQIQAWMREKQSSDK,4.128457,"L7K, E9L, M37T, L47T, T67L, D68N, N71T, M74P, S78A, H102K",10
IEKFKLLAEKVEETEPKNARIEDDYSDAPDEFRDPLSDTLMTDPVRLPSGTVMDRSIILRHLLNRPTNPFTRQMLTESMLIPVPELKEQIQAWMREKQSSDH,5.1542816,"I14T, V15E, A16P, A21I, I23D, M37S, S65R, D68N, N71T, E81I",10
IEKFKLLAEKVEEIVAQNARAEIDYSDAPDEFRDPLTDTLMTDPVRLPSGTVMDRQIILRHLLNSPTNPFTRQMLPASMLEPVPVLKEEIQAWMREKTSSDH,1.754592,"K17Q, M37T, S56Q, D68N, N71T, T76P, E77A, E85V, Q89E, Q98T",10
IEKFKLKAEKVEEILAKNARALIDYSDLPDEFRDPLTDTLMTDPVRSPSGTVMDRSIILKHLLNSPTNPFTRQMLTESMLRPVPELKEQIQAWMREKQSSDH,4.0829344,"L7K, V15L, E22L, A28L, M37T, L47S, R60K, D68N, N71T, E81R",10
IEKEKDLAEKVEEIVAKNAGAEDDYSDAPDEFIDPLTDTLMTDPVRLPSGTVMDRQIILRHLLNGPTNPFTRQMLTESMLEPVPELKEQIQAWMREKQSSDH,4.0401697,"F4E, L6D, R20G, I23D, R33I, M37T, S56Q, S65G, D68N, N71T",10
IAKFKLLAEKVEENVAKNARSEIDYSDAPDEFRDPLTDTLMTDPVRLPSGTVMDRSIILRILHDSPSNPFTRQMLTESMLEPVPELKEQIQAWMREKQSSDH,0.88399184,"E2A, I14N, A21S, M37T, H61I, L63H, N64D, T67S, D68N, N71T",10
IEKFKLLARKVEEIVAKNARAEIDLSDAPDEFRDPITDELMTDPVRLPSGTVMDRSGILRHLLSSPTNPLTRQMLTESMLEPVPELKEQIQAWMREKQSSDH,1.9159601,"E9R, Y25L, L36I, M37T, T39E, I57G, N64S, D68N, F70L, N71T",10
MEHFKLLEEKVEEIVAKMARAEIDYSDAPDEFRDPLTDTLMTDPVRLPSGTVMDRSIILRHLLNSPTNPFTGQMLTESMLEPVPELKEQILAWMREKQSSGH,0.2900321,"I1M, K3H, A8E, N18M, M37T, D68N, N71T, R72G, Q91L, D101G",10
MEKFKLLAEHVEEIVAKNADAEIAYADAPDTFRDPLTDTLMTDPVRLPSGTVMDRKIILRHLLNSPTNPFTRQMLTESMLEPVPELKEQIQAWMREKQSSDH,4.5976524,"I1M, K10H, R20D, D24A, S26A, E31T, M37T, S56K, D68N, N71T",10
IEKFKLLAEKVDEIVAKSARAEIDYSDAPDVFRDPLTDTLMTDPVRLPSGTTMDRSIILRHLLNSPTNPFTRQMLTESMTKPVPELKEQIQAWMSEKQSSDH,3.6800706,"E12D, N18S, E31V, M37T, V52T, D68N, N71T, L80T, E81K, R95S",10
IEKFSLLEEKDEDIVAKNARAEIDYSDAPDEFRDPLTDTLMTDPVRLGSGTVMDRSSILRHLRNSPTNPFTRQMLTESMLEPVPELKEQIQAWMREKQSSDH,5.9466066,"K5S, A8E, V11D, E13D, M37T, P48G, I57S, L63R, D68N, N71T",10
IEIFKLLAEKNEEIVDKNARAEIDYSLAPDEFRDPLTDTLMTDPVRLPSGTVMDRSIILRHLNNSSTNPFTRQMLTESMLEPVPELKEQIQAWMREKQESDH,4.6791134,"K3I, V11N, A16D, D27L, M37T, L63N, P66S, D68N, N71T, S99E",10
IEKFKLLAEKVEDIVAANARDEIDYSDAPDEFRDPVTDTLMTDPVRLPSGTVMDYSIIQRHLLNSPTNPFTRQMLTESMLEPVPELKEQIQAWMREKQSVDH,7.0476627,"E13D, K17A, A21D, L36V, M37T, R55Y, L59Q, D68N, N71T, S100V",10
IEKFKLLAEKVEEAVAKNARAEIDYSKAPDEFRDPLTDTLMTDPVMLPSGTVMDRSIILRHLLNSATNPFTRQMLTESMLEPVPELNEQIQAWMREKESIDH,3.798715,"I14A, D27K, M37T, R46M, P66A, D68N, N71T, K87N, Q98E, S100I",10
IEKFKELAEKVEEIVAKNADAEIDYSDAPDEFRDPLTDTLMTDPVRLSSGTVMDREIILRHILNSPTNPFTRQLLTESMLEPVPELKEQIKAWMREKQSSDH,2.0781977,"L6E, R20D, M37T, P48S, S56E, L62I, D68N, N71T, M74L, Q91K",10
IEKFKLLAEKVEEIDAKNARALIDYSDAPDEFRDPLTYQLMTDPVRLPSGTVVDRSIILRHLLNSPTNPFTRIMLTEPMLEPVPELKEQIQAWMREKQSSDH,7.578705,"V15D, E22L, M37T, D38Y, T39Q, M53V, D68N, N71T, Q73I, S78P",10
IEKFKLLAEKVAYIVAKNTRAEIDYSDAPDEFRDPLTYTLMTDPARLPSGTVMDRSIILRHLLNSPTNPFTRSMLTESMLEPVPELAEQIQAWMREKQSSDH,4.237073,"E12A, E13Y, A19T, M37T, D38Y, V45A, D68N, N71T, Q73S, K87A",10
IEKFKLLAEKVEEIVAKEARAESDYDDAPDEFEDPLTYTLMTDPVRLPSGTVMDRSIILRHLLNSPTNPFTGQMLTEHMLEPVPELKEQIQAWMREKQSSDH,1.7915905,"N18E, I23S, S26D, R33E, M37T, D38Y, D68N, N71T, R72G, S78H",10
IEKFKLIAEKVEEIVAPNARAEIDDSDAPDEFRDPLTDTLATDPVRLPSGTVMDRSIISRHLLQSPTNPFTRAMLTESMLEPVPELKEQIQAWMREKQSSDH,6.5315924,"L7I, K17P, Y25D, M37T, M41A, L59S, N64Q, D68N, N71T, Q73A",10
IEKFELLAEKMEEEVAKNARAEIDYSDAPDEFRDPLTDTLMEDPVRLPSGTVMDRSIIERHLLNSPTNPFTRQPLTESMLEPVPELKERIQAWMREKQSSDH,5.2795124,"K5E, V11M, I14E, M37T, T42E, L59E, D68N, N71T, M74P, Q89R",10
IEKFKLLAEKVEEIVAKNARATIDYSDLPDEFRDPLTDTLMTDPVVLPSGTVMDRSIIIRHLLNSPTNPFTRQMLTLSMLEPVPELKEKIQAWKREKQSSDH,3.4992285,"E22T, A28L, M37T, R46V, L59I, D68N, N71T, E77L, Q89K, M94K",10
MEKFKLLAEKLEEIVAKNAEAEIDYSDAPDEFRDPLTDTLMTDPVRLPSGTVMDRSIILNHLLNSRTNPFTRQMLTESMLEPVPELKEQIQAWMRENESSDH,4.4943247,"I1M, V11L, R20E, M37T, R60N, P66R, D68N, N71T, K97N, Q98E",10
IEKFKLLAEKVEEIVAKNARREIDYSDAPDEFRDPLTDTLTTDPVILPSGTVMDRSIIERHWLNSPTNPFTRQMLTEAMLEPVPELKEQIAAWMREKQSSDH,-0.2209008,"A21R, M37T, M41T, R46I, L59E, L62W, D68N, N71T, S78A, Q91A",10
IEKFKLLAEKVEEIVAKNARAEINYSDAPDEFRDPLTDTLMTDPVRLPSGEVMDRSIILRHLLNSPTNPFTRQMLTESMLEPVPELKEEIVRWMRENQSSDF,5.0227404,"D24N, M37T, T51E, D68N, N71T, Q89E, Q91V, A92R, K97N, H102F",10
IEKFKLLAETVEEIVAKNARAEIQYSDAHDEFRDPLTDTLMTDPVRLPSGTVLDRSIILRHLLNFQTNPFTRQMLTESMLEPSPELKEQIQAWMREKQSSDH,5.4961376,"K10T, D24Q, P29H, M37T, M53L, S65F, P66Q, D68N, N71T, V83S",10
IEKFKLLAEKVEEIVAKEEAAEIDYSDAPDEFPDPLTDTLMTDPVRLPSGTVMDRSIIDRHLLNSPTNPFTRQMLTESMLEPVPELKEQIQAWYREKQSSDD,6.244383,"N18E, A19E, R20A, R33P, M37T, L59D, D68N, N71T, M94Y, H102D",10
IEKFKLLAEEVEEIVAKNARAEIDYSDAPDEFRDPLTYTLMEDPVRLPSGTVVDRSIILDHLLNSPTNPFTRQTLTESMLEPVPELKERIQAWMREKQSSDH,9.897677,"K10E, M37T, D38Y, T42E, M53V, R60D, D68N, N71T, M74T, Q89R",10
IEKFKELAEKVEEIEAKNAPAEIDYSDDPDEFRDPLTDTLMTDPVRLPSGHVVDRSIIERHLLNSPTNPFTRQMLTESMLEPVPELKEQIQAWMREKQSSDH,7.395763,"L6E, V15E, R20P, A28D, M37T, T51H, M53V, L59E, D68N, N71T",10
IEKEKLLAEKVEERVIKNARAEIDYSDAPDEFRDPLTDTLMTDPVRLHSGTVLDRSIILRHLLNSPTNPFTRQMLTESTLEPVPELKEQIDAWMREKQSSDH,3.5180655,"F4E, I14R, A16I, M37T, P48H, M53L, D68N, N71T, M79T, Q91D",10
IEKFKLLAEKVEEIVAKNARAEIDYSDAPDEFEDPLTDTLMTDPVRLPSGTVVDRSIIERHLLYNPTNPFTRQMLTESMIEPVPELKEQIQAIMREKQSSDH,4.7885137,"R33E, M37T, M53V, L59E, N64Y, S65N, D68N, N71T, L80I, W93I",10
IEKFKLLEEKVEEIVAKNARAEIDYSDAPDEFRDPLTDTLMTDPVRLPSGHVLDRSIILRHLLNSPTNPFTRQMLTESDLLPVPELKEQIQRWMREKQSSHH,8.013607,"A8E, M37T, T51H, M53L, D68N, N71T, M79D, E81L, A92R, D101H",10
IEKFKLLFLKVEEILAKNARKEIDYSDAPDEFRDPLTDTVMTDPVRLPSGTVMDRSIILRHLLKSPTNPFTRQMLTESMLEPVPELKEQIQAWMREKQTSDH,1.8422099,"A8F, E9L, V15L, A21K, M37T, L40V, N64K, D68N, N71T, S99T",10
IEKFKLNAEKVEEIVAKNARAEIDYSDAPDEFRDPMTDTLMTDPVRLPSGTVMDRSIIDRHLLNSPTNPFTRQMLTESMLEPVPDLKEQIRLLMREKQSSDH,-0.7461916,"L7N, L36M, M37T, L59D, D68N, N71T, E85D, Q91R, A92L, W93L",10
IEKFKLLAEKVEEIVAFRARFENDYSDAPDEFRDPLTDTLMTDPVRLPSGTVMNRSIILRHLLNSPTNPFTRQMLTESMLEPVPELKEHIQAWMNEKQSSDH,2.179727,"K17F, N18R, A21F, I23N, M37T, D54N, D68N, N71T, Q89H, R95N",10
IEKFKLLAEKVEEIVAKNARAEIDYSDAPDEFRDPVTDTLMTDPVRLPSGTTMDRSGILRHLLNQPTNPFTRQQLTEGQLEPVPELKEQIQAWMREKQSSDH,5.2083387,"L36V, M37T, V52T, I57G, S65Q, D68N, N71T, M74Q, S78G, M79Q",10
IEKFKLSKEKVDEIVAKNARAEIDDSDAPDEFRDPLTDTLMKDPVRLPSGTVMDRSIILRHLLNSPTNPFTRRMLTESMLEPVPELKEQIEAWMREKQSSDH,5.983776,"L7S, A8K, E12D, Y25D, M37T, T42K, D68N, N71T, Q73R, Q91E",10
IEKFKLLAEKVEEITAKNARAEIDYSDAPDEFRDPLTDTLMEDPVFLPNGTVMDRSIILRHLLNSPTNPFTRQMLTESMLEPVPELKEYIQAWLREKISSDH,5.5430403,"V15T, M37T, T42E, R46F, S49N, D68N, N71T, Q89Y, M94L, Q98I",10
MEKFKLLAEEVEEIQEKNARAEIDYSDAPDEFRDPLTDTLMTDPVRLPSGTVMDRSIILRHLLNSPTNPNTRQMLTESMLEPLPELEEQIQAWMREKQSSDH,4.4764147,"I1M, K10E, V15Q, A16E, M37T, D68N, F70N, N71T, V83L, K87E",10
IEKFKLLAEKVEEIVASNARAEIDYSDAIDEFRDPLTDTLMTDPVRLGSGTVMDRSIILRHLLNSPTNPFTRQMLTESMLEPVPELVEQIQQWMREHQESDH,5.4480114,"K17S, P29I, M37T, P48G, D68N, N71T, K87V, A92Q, K97H, S99E",10
IEKFKNLAEKVEEIAAKNARAEIDYSDAPDEFRDPLTDTLMTDPVRLPSGTVMDRSIILRHLLESPTNPFTRQHLTESMLEPVPELKDQIQAWMREKESSRH,5.308579,"L6N, V15A, M37T, N64E, D68N, N71T, M74H, E88D, Q98E, D101R",10
IEKFKLLAEKVEEIVAKNARAEGDYSDAPDEFRDPLTDTLMTDPVRLPSGTVLDRSIILRHLLNSPTNPFTRQMLDESMLEPVPELKELIQAWMREKQSTIK,7.2462025,"I23G, M37T, M53L, D68N, N71T, T76D, Q89L, S100T, D101I, H102K",10
MEKFKLLAEKGEEIVAKNKRAEDDYIDAPDEFRDPLTDTLMTDPVRLPSGTVMDRSIILRHLLNSPTNPFTRQMLDESMLEPVPELKEQIQAWMREKQSQDH,5.9803176,"I1M, V11G, A19K, I23D, S26I, M37T, D68N, N71T, T76D, S100Q",10
IEKFYLLAEKEEEIEAKNARAEIDYSDAPDEFRDPLTDTLMTDPVRLPKGTVMDRSIILRHLLNSPTNPFTRQMLTESMLAPLPELKEQIQAWMREKQSSDF,4.144826,"K5Y, V11E, V15E, M37T, S49K, D68N, N71T, E81A, V83L, H102F",10
IEEFKLLAEEVEEIQAKNARAEIDYSDAPDEFRDPLTFTLMTDPVRLPSGTVMDRSIILRHLLNHPTNPFTRQMLTESMLDPEPELKEQIQAWMREKQSSDH,3.4975219,"K3E, K10E, V15Q, M37T, D38F, S65H, D68N, N71T, E81D, V83E",10
IEKFKLLAEKVEEIVAANARAEIDYSDAPDEFRDPLTDTLMTDPVRLPSGTVMDRSIILRHLLNSPTNPITRQMITESMLEPVPELKELIQAWMRDCQSGDH,0.42060435,"K17A, M37T, D68N, F70I, N71T, L75I, Q89L, E96D, K97C, S100G",10
IEKFKLLAEKVEEIVASNARAEIDYSDAPDEFRDPLTDTLMTDPVRLPSGTVMDRSIILSHLLNNPTNPQTRQMLTESMLEPVPELHEQIMNWMREKQSSDH,4.4156256,"K17S, M37T, R60S, S65N, D68N, F70Q, N71T, K87H, Q91M, A92N",10
IEKFKLLAETVEEIVAKNARAEIDYSDAPDEFRNPLTDTLMTDPVRLPSGTVMDRHIILRHLLNSPTNPFTKQMLTESMLEPDPKLKEQIQEWMREKQSSDH,2.2302866,"K10T, D34N, M37T, S56H, D68N, N71T, R72K, V83D, E85K, A92E",10
IEKFKLLAEKVEERVAANARAEIDYDDAPDEFRDPITDTLMTDPVFLPSGTQVDRSIILRHLLNSPTNPFTRQMLTESMLEPVPELKEQIQAWMREKQSSDH,11.155695,"I14R, K17A, S26D, L36I, M37T, R46F, V52Q, M53V, D68N, N71T",10
IEKFKLLAEKVEEIVAKNAFAELDYSDDPDEFRDPLTYTLMTDPVRLPSGTVMDRSIILRHLLNSPTNPFTRQMLTESMLEPVPEIKEQIQAWMAEKQRSDH,5.2223806,"R20F, I23L, A28D, M37T, D38Y, D68N, N71T, L86I, R95A, S99R",10
IEKFKLLAEKVEEIVAKNADAEIDPSDACDEFRDPLTDTLMTDPVRLPSGTVLDRSEILRHLLVHPTNPFTRQMLTESMLEPVPELKEQIQAWMREKQSSDH,7.268964,"R20D, Y25P, P29C, M37T, M53L, I57E, N64V, S65H, D68N, N71T",10
IEKFKLLAEKVEEIRAKNARAEIDYSDADQEFRNPLTDTLMTDPVRLPSGTVMDRSIILRHLLNSRTNPFTRQMLTESMIEPVPELKEQIQAWMREKQNSDH,2.4506655,"V15R, P29D, D30Q, D34N, M37T, P66R, D68N, N71T, L80I, S99N",10
ISKFKLLDEKVEEIVAKNARAEIDYSDAPDEFRNPLTDTLRTDPVRLPSGTVLDRSIILRHLLNSPTNPFTRQMLTESMLEPVPELREQIQAWMVEKQSSDH,2.79845,"E2S, A8D, D34N, M37T, M41R, M53L, D68N, N71T, K87R, R95V",10
MEKFKLLAEKVENIVAKNARANIDYSDAPDEFRDPLTDTLMTDPVRLPSGTVMDRSIILRHLNNSPTNPFTRQMLTESMLEPVPELKEQIQDWIREFQSSDH,5.825049,"I1M, E13N, E22N, M37T, L63N, D68N, N71T, A92D, M94I, K97F",10
IEKFKLLAEKVHEIVAKNARAEIDYSDAPERFRDPLTDTLMTDPVRLPSGAVMDRSIILDHLLNSPTNPFTRQMLTESMLEPNKELKEQIQAWMREKQSSDH,4.4271784,"E12H, D30E, E31R, M37T, T51A, R60D, D68N, N71T, V83N, P84K",10
IEKFKILAEKVEEIVAKNARAEIDYSNAPDEFRNPLTDTLMTDPVRLPSGTVMDRSIIERHLLNSPTNPFTRQMLTESMLETDPELKEQIQAWVREKQSSDH,2.554603,"L6I, D27N, D34N, M37T, L59E, D68N, N71T, P82T, V83D, M94V",10
IEKEKLLAEKVEEIVAKNAKAEDDVSDAPDEFEDPLTDTLMTDPVRLPSGTVMDRSIILRHLKNSPTNPFTRQMLTESNLEPVPELKEQIQAWMREKQSSDH,3.3938441,"F4E, R20K, I23D, Y25V, R33E, M37T, L63K, D68N, N71T, M79N",10
IEKFKLLQEKVEEIVAKNAAAEIDYSDAPDEFRDPLTDTLMKDPVRLGSGTVMDRSIILRHLLNSPTNPFTRQMMTESMLEEVKELKEQIQAWMREKQSSDH,3.5179567,"A8Q, R20A, M37T, T42K, P48G, D68N, N71T, L75M, P82E, P84K",10
IERFKLLAEKVDEIVAKNAVAEIDYSDAPDEFRDPLTDTLMTDPVRLPSGTVMDRSIILRHILNSPTNPFTRQMLTESMLKPVPELKEQIEAWMREKQISDH,3.27641,"K3R, E12D, R20V, M37T, L62I, D68N, N71T, E81K, Q91E, S99I",10
IEKFKLLAEKVEEIVAKKARAEIDYSDAPDEFRDPLTDTLMTDPVRVPSGTVMDRSIILRHLLANPTNPFTRQLLTESMLNPVPELKEQIQAWMRSKQSSDH,4.092873,"N18K, M37T, L47V, N64A, S65N, D68N, N71T, M74L, E81N, E96S",10
IEKFKLLIEKVEEIVAKNARAEIDYSDAPDAFRDPLTDTLMTDPVRLPSGTTMDRSIILRHLLNSPTNPFTRQMLTESDLEPVPELKAQIQAWMREKERSDH,3.7195983,"A8I, E31A, M37T, V52T, D68N, N71T, M79D, E88A, Q98E, S99R",10
IEKFKLLAEKVEEIVAKHARAEIDYSKAPDPFRDPLTDQLMTDPVRLPSGTTLDRSIILRHLLNSPTNPFTRQMLTESMLEPHPELKEQIQAWMREKQSSDH,7.3996954,"N18H, D27K, E31P, M37T, T39Q, V52T, M53L, D68N, N71T, V83H",10
IEKFKLLAEKVEEIVAKNARAEIKYVEAPDEFRDPLTDTLMTDPVRLPSGTVMDRSIILRHALNSRTNPFTRHMLTESMLEPVPELKEQIQAWMDEKQSSDH,0.8133252,"D24K, S26V, D27E, M37T, L62A, P66R, D68N, N71T, Q73H, R95D",10
IEKFKLLAEKHEEIVAKNARAEIDYSDAPDEFRDPLTDTLMTDPVRLPSGTVMDRSIILRHLLNSPTNPFTRQMLTESMIEPVPLLKEQIQKWMRGLGSSDH,3.9973483,"V11H, M37T, D68N, N71T, L80I, E85L, A92K, E96G, K97L, Q98G",10
IEKFKLLAEKVEEIVAKNARAEIDYSDAPDEFRNPLTDTLITDPVRLKEGTVMDRSIILRHLDNSPTNPFTRQMLTESMLEPFPELKSQIQAWMREKQSSDH,2.3836231,"D34N, M37T, M41I, P48K, S49E, L63D, D68N, N71T, V83F, E88S",10
IDKFKDLADKVEEIVAKNARAEIDYSDAPDEFRDPLTDTLMTDPVRLPSGTVMERSIILRHLLNSPTNPFTRTMLTESMLEPVPEIKEQIQAWMREVQSSDH,2.5485172,"E2D, L6D, E9D, M37T, D54E, D68N, N71T, Q73T, L86I, K97V",10
IEEFKLLAEKVEEIVAKNQYAEIDYSDAPDEFRNPLTDTLMTDPVRLPSGTVMDRSIILRHLLTNPTNPFTRQMLTESMLEPVPELKEQIQAWIREKQSSDH,1.9429288,"K3E, A19Q, R20Y, D34N, M37T, N64T, S65N, D68N, N71T, M94I",10
IEKFKLLAEIVEEIDAINARAEIDYSDAPDEFRDPLTDTLMTDPVRLPSGTVMDRSIILRHLLNSPRNPFTRQMLTESMLEPVPILKEQIQAKFREKQSSDH,2.0105665,"K10I, V15D, K17I, M37T, T67R, D68N, N71T, E85I, W93K, M94F",10
IEKFKLLAEKVEEIVAKNARAEIDYSDAPDEFRDPLTDTLYTDPVRLPSGTVMDRSAILRHLLNSPTNPFTRNPLDESMLEPVQELKEQIQAWMREKWSSDH,3.959013,"M37T, M41Y, I57A, D68N, N71T, Q73N, M74P, T76D, P84Q, Q98W",10
IEKFKLLAEKVEEGVAKNARAEIDYSDAPDLFRDPLTDTLMTDPVRLPSGTVMDRSIILLHLLNSPDNPTTRQMLTEKMLEPVPELKEGIQAWMREKQSSDH,4.638259,"I14G, E31L, M37T, R60L, T67D, D68N, F70T, N71T, S78K, Q89G",10
IEKFKLLEEKVEEIVAKNARAEIDYSDAFDEFRDPLTDTLMTDPVRLPSGTVLDRSAILRHLLNSPTNPFTRQMLTESMLNPNPELKEAIQAWMREKQSSDH,8.678005,"A8E, P29F, M37T, M53L, I57A, D68N, N71T, E81N, V83N, Q89A",10
IEKFKLLAVKVEEIVAKNARAEIDYSDIPDEFRDPLTDTLMTDPVRLPSGTTMERSIILRHLLNSPTNPFTRQMLTESMLEKVPEIKDQIQAWMREKQSSDH,1.9566114,"E9V, A28I, M37T, V52T, D54E, D68N, N71T, P82K, L86I, E88D",10
IEKDKLLAEKVEEIVIKNARAEIDYSDAPDEFRDPLTDTLMTDPVRLPSGTVMNRSIILRHLLNSPTNPFTRNMLTESMLEPVPEVKEEIQAWMREKQDSDH,4.0553513,"F4D, A16I, M37T, D54N, D68N, N71T, Q73N, L86V, Q89E, S99D",10
IEKFKLDAEKVEEIVAKNARAEIDYSDAPDEFRDPLTDTLMTEPVRLPSGTVMDRSIIERHLLNSPYNPFTRQPLTESMLEPVPELKEQIQAWMRERQTSDH,4.615159,"L7D, M37T, D43E, L59E, T67Y, D68N, N71T, M74P, K97R, S99T",10
IEKNKLLAEKVEEIVAKNDRAEIDYSDAPDEFRDPLTDTLMTDPVRLPSGTVMDRKIILRHLLESPTNPFTRQMLTESDLEPVPELKEQIQAWIKEKQSSDH,2.8405366,"F4N, A19D, M37T, S56K, N64E, D68N, N71T, M79D, M94I, R95K",10
IEKFKLLAHKVEEIVAKNARAEIDYSDKPDEFRDPLTDTLMTDPVRLPSGTVMERSSILRHLLNSPYNPFTRQMLTESMLEPVPELKEQIQAWMREKQSSYY,3.232337,"E9H, A28K, M37T, D54E, I57S, T67Y, D68N, N71T, D101Y, H102Y",10
IEKFKLLAELVEEIVAKNARAEIDYSDAPDEFINPLTDTLMTDPVTLPSGTVMDRSIILRHLLNRPTNPFTRQMLTESMLEDVPELNEQIQAWMREKQSSDH,-1.3644574,"K10L, R33I, D34N, M37T, R46T, S65R, D68N, N71T, P82D, K87N",10
IEKFPLLAEKVEEIVAKNARAEIVISDAPDEFRDPFTDTLMTDPVVLPSGTVMDRSIILRHLLNSPTNPFTRNMLTESMLEPVPELKEEIQAWMREKQSSDH,3.202879,"K5P, D24V, Y25I, L36F, M37T, R46V, D68N, N71T, Q73N, Q89E",10
IEKFKLLARKVEEIVAKNPRAEIDYSDAPDEFRDPLTDTLMTDPVRLPSGHVMDRSIILRHLENSPTNPFTRQMLTESMLEPVPELRTQIDAWMREKQSSDH,5.5815697,"E9R, A19P, M37T, T51H, L63E, D68N, N71T, K87R, E88T, Q91D",10
MEKFKLLAEKVEEIVAKNARAEIVYSDAPDPFRDPLTDTLMTDPVRLPSGTVMDRSIILRHLLNSPTNPVTRQPLTESMLEPVPKLKEQIQAWMREKQSSDS,0.16417846,"I1M, D24V, E31P, M37T, D68N, F70V, N71T, M74P, E85K, H102S",10
IEKFKLSAEKHEEIVAKNARAEIDYSDAPNEFRDPLTDTLMTDPVRLPNGTVMDRSIILRHLLNSPTNPFTRQMLTESMLEPVDELKEQIVAWMRAKQSSDH,4.3656754,"L7S, V11H, D30N, M37T, S49N, D68N, N71T, P84D, Q91V, E96A",10
IEKFKLLEEKVEEIVAKNARAEIDYSDAPDEFRDPLTYTLMTDPVRLPNGTVMDRSIILRHLLNSPTNPLTRQMLPESMLEPVPFCKEQIQAWMREKQSSDH,0.07090078,"A8E, M37T, D38Y, S49N, D68N, F70L, N71T, T76P, E85F, L86C",10
IEKFKLLAEKVEEIVAKNARAEIDYKDAPDEFRDPLTDTLMTDPVRLKSGTVMDRSIIERHLLNSPTNPFTRDMLTDSMLEPVPELKEQIQKWMREKQSSNH,3.8427615,"S26K, M37T, P48K, L59E, D68N, N71T, Q73D, E77D, A92K, D101N",10
IEKFKLLAEKAEEIVAKNARAEIDYFDAPDIFRDPLTDTLMTDPVRLPSGTVMDRSIILRHLLNSPTNPMTRQMLTESDLEPVPNLKLQIQAWMREKQSSDH,4.2361565,"V11A, S26F, E31I, M37T, D68N, F70M, N71T, M79D, E85N, E88L",10
IEKFKLLAEKVEEIVAKNARAEIDYSDAPDEFRNPLTDTLMTDPVRLPSGTKMDRSIILRHLLNSPTNPFTRQPLTESDLEPVPELKAQINAWMREKQYSDH,3.0299575,"D34N, M37T, V52K, D68N, N71T, M74P, M79D, E88A, Q91N, S99Y",10
IEKQKALAEKVEEIVAKNARAEIDYSDAPDEFRNPLTDTLMTDPVRLPSGTVMDRSIILRHLLNSPTNPFTRQMLTESMLRPVPELKAQIRAWMREKQSVDH,3.008792,"F4Q, L6A, D34N, M37T, D68N, N71T, E81R, E88A, Q91R, S100V",10
VEKFKLLAEKVEEIVAKIARAEIDYSDAPDEFRDPLTFTLMTDPVRLPSGTVMDRSIILRHLLNSPTNPFTRQMLTESMLEPDPELKERIQAWMKEKQSRDH,1.3307018,"I1V, N18I, M37T, D38F, D68N, N71T, V83D, Q89R, R95K, S100R",10
IEKRKLLAEKVEEITAKNARAEIDYSDALDEFRDPLTDNLMTDPVRLPSGTVMDRSIILQHLLNIPTNPFTRCMLTESMLEPVPELKEQIQAWMREKQSSDH,-0.24868034,"F4R, V15T, P29L, M37T, T39N, R60Q, S65I, D68N, N71T, Q73C",10
IEKFKLLAEKVEEPVLKNIRAEIDYSDAPDEFRDPLTDTLMTDPVRLPSGTTMDRSIMLRHILNSQTNPFTRQMLTESMLEPVPELKEQIQAWMREKQSSDH,1.8576367,"I14P, A16L, A19I, M37T, V52T, I58M, L62I, P66Q, D68N, N71T",10
IEKFKTLAEQVEEIVAKNARAENDYSDAPDEFRDPLTDDLMTDPVRLPSGTVLDRSIILRHLLNSPTNPFTRSMLTESMLEPVPELKEQILAWMREKQSSDH,8.493894,"L6T, K10Q, I23N, M37T, T39D, M53L, D68N, N71T, Q73S, Q91L",10
IEKTKLVAEKVEEIVAKNARAEIDYSDAPDEFRDPITDTLMRDPVRLPSGTVLDRSIILRHLQNSPTNPFTRQMLTESMLEPVPELKEQIQAWMAEKQSSDH,11.277671,"F4T, L7V, L36I, M37T, T42R, M53L, L63Q, D68N, N71T, R95A",10
IEKFRLLAEKVEEIVAKNARAEIDYSDAPDEFRDPLTYTLMRDPVRTPSGTVMDRSIILRHLLNSPTNPITRQMLTESMLEPVPYLKEQIQAWMREKSSSDH,3.5973964,"K5R, M37T, D38Y, T42R, L47T, D68N, F70I, N71T, E85Y, Q98S",10
IEKFKRLAEKVEEIVAKNARAFIDYYDAPDPFRDPLTDTLMTDPVRLPSGTVMDRSIILRHLLNSPTNPFTRQMLTESMLEPVPELKEQIQKMMQEKQSSDH,3.4743736,"L6R, E22F, S26Y, E31P, M37T, D68N, N71T, A92K, W93M, R95Q",10
IESYTLLAEKVEEIVAKNARAEIDYSTAPDEFRDPLTDTLMTDPVRLPSGTTMDRSIILRHLLNSPTNPFTRQNLTESMLEPVPELKEQIQAWMREKQSSDK,3.3605218,"K3S, F4Y, K5T, D27T, M37T, V52T, D68N, N71T, M74N, H102K",10
IEKFKLLAEKVEEIVAKNVRAELDLSDAPDGFRDPLTDTLMTDPVRLPSGTVMDRSIILRHLLNSPTNPFTRCMLNESMLEPHPELKEQIQAWMREKQSSDH,3.6651144,"A19V, I23L, Y25L, E31G, M37T, D68N, N71T, Q73C, T76N, V83H",10
IEKFKLLAEKVEEIVAKNARAEIDYSDAPDEFRDPLTDTLMTDPVRLMSGTVLERSIILRHLLDSPTNPFTRQMLTESMLEPVPELKEQIQKWMRQKQSMDH,5.949911,"M37T, P48M, M53L, D54E, N64D, D68N, N71T, A92K, E96Q, S100M",10
IEYFKLLLEKVKEIVAKNARAEIDYSDAPDEFRDPLTDTLMTDPVRLPSGTVLDISIILRHLLNSPTNPFTRGMLTESMLEPVPELAEQIQAWMREKQSSDH,7.149202,"K3Y, A8L, E12K, M37T, M53L, R55I, D68N, N71T, Q73G, K87A",10
IEKFKELAEKVEEIVEKNARAEIDYSDAPDEFRDPLTDTLMTDPVRLPSGTVMDRAIILRHLLNSKTNPLTRQMLTESMLEPVPELKPQIQAWMREMQSSDH,1.4391155,"L6E, A16E, M37T, S56A, P66K, D68N, F70L, N71T, E88P, K97M",10
IEKFKLLKEKVEDIVAKNARAEIDYSDAPDEFRDPLTDTLMTDPVRLPSGTTMDESILLRHLLNSNTNPFTRQMLTEFMLEPVPELKEQIQAWMREKQSSDH,4.046221,"A8K, E13D, M37T, V52T, R55E, I58L, P66N, D68N, N71T, S78F",10
IRKFKLLAEKVEEIVGKNARAEIDLSDNPDEFRDPLTDTLMTDPVRLPSGTTMDRSIILRHLLNNPTNPFTGQMLTESMLEPVPELKEQIQAWMREKQSSDH,-0.7927331,"E2R, A16G, Y25L, A28N, M37T, V52T, S65N, D68N, N71T, R72G",10
IEKFKLLAEKVEEIVAKNARAEIDYSDAPDEFRDPLTKTLMTDPVLLPSGEVMDRSIILRHLLNSPTNPLTRQLLTESMLEPVPELKEQIQAWMDEEQSSDH,0.025164852,"M37T, D38K, R46L, T51E, D68N, F70L, N71T, M74L, R95D, K97E",10
IEKFKLLAEKVEEIVAKNARAEIDYSDALDEFRNPLTDTLMTDPVRLPSGTVMDRSIILRHLLNSPTNPFTRQMLPESMLEPVKEVKEQIQAYLREKQSSDH,-1.3489249,"P29L, D34N, M37T, D68N, N71T, T76P, P84K, L86V, W93Y, M94L",10
IEKFKLDAEKVEEIVAKNAKAEIDYSDAPDDFRDPLTDTLMTDPVRLPSGTVMDRSIILRHLDNSPTNPFTRQMLTESMLQPVPELKEQIQAWMREQQSSDR,6.0269184,"L7D, R20K, E31D, M37T, L63D, D68N, N71T, E81Q, K97Q, H102R",10
IEKFKLLAEKVEEIVAGEARAEIDYSDANDEFRDPLTDTLMTDPVRLPSGMVMDRSIILRLLLNSPNNPFTRQMLTESMLEPVPELKEQIQAWMRERQSSDH,0.74909407,"K17G, N18E, P29N, M37T, T51M, H61L, T67N, D68N, N71T, K97R",10
