Sequence,Score,Mutations,Number of Mutations
MKYKLILNGKTLKGETTTEWRFAARALKYFKNYANDNGWDGEWTYDRATKTFTVTE,1.3734294,"Q2K, A20W, V21R, D22F, T25R, E27L, V29Y, Q32N, V39W, D47R",10
MKYYLILNGWTLKGWTTTEAVDAAYWERYFKQYANDNGVDGEWTYYDARKTFTVTE,5.5536504,"Q2K, K4Y, K10W, E15W, T25Y, A26W, K28R, V29Y, D46Y, T49R",10
MTYKLILNGKTLKGRTTVEAYDAATAEKHFKQLANDNGVDSEWTYDRAAKTVTVTE,3.1532106,"Q2T, E15R, T18V, V21Y, V29H, Y33L, G41S, D47R, T49A, F52V",10
MQYKLILKDWTLKGETTCEFVDAARAERVFKQYANDNGVDFEWHYDDATKTGTVTE,-1.8916262,"N8K, G9D, K10W, T18C, A20F, T25R, K28R, G41F, T44H, F52G",10
MQYKLIFNARTLKGEWTTEAVDAATLEKVFKQWAYRNGIDGEWTYDDATKRFTVTE,-0.08975972,"L7F, G9A, K10R, T16W, A26L, Y33W, N35Y, D36R, V39I, T51R",10
MQYKLYVNGKTLKGRTTTEAVDAATAEYVFKQYANDFFPWGEWTYDDATKSFYVTE,-0.02454488,"I6Y, L7V, E15R, K28Y, N37F, G38F, V39P, D40W, T51S, T53Y",10
MRYKLILNGKSLKGETTTHAVDAWTAEKVFRQYAEDNGVDYWWTYRYATKTFTVTE,2.0104523,"Q2R, T11S, E19H, A24W, K31R, N35E, G41Y, E42W, D46R, D47Y",10
MQYKLIRNGKTTKQETTFEAVDAATAYKVFKQYARDNGVDGEWTRDDAWKTFTRRE,-6.922338,"L7R, L12T, G14Q, T18F, E27Y, N35R, Y45R, T49W, V54R, T55R",10
MQYKLILRFKTRKGETTTEAYDAATAEKVFKQYLNRNGRWGEWTYDDATKTFTVRR,1.5669415,"N8R, G9F, L12R, V21Y, A34L, D36R, V39R, D40W, T55R, E56R",10
MQYKLILNNKYLQGETLTEAVDAATAEKVFKQWANDYGVDWEWTLDRATKTFTVTY,-1.317711,"G9N, T11Y, K13Q, T17L, Y33W, N37Y, G41W, Y45L, D47R, E56Y",10
MKYRLIWNGKTLKGEWTYEWVDAATYEVVFKQYANDNGVDGEWWYDDATKTFTVTV,-2.6638212,"Q2K, K4R, L7W, T16W, T18Y, A20W, A26Y, K28V, T44W, E56V",10
MQYKLIRNGKTLFTETTTEAVRAATAERVFKQYMNRNWVDGEWTYDWATRTFTVTE,5.6193953,"L7R, K13F, G14T, D22R, K28R, A34M, D36R, G38W, D47W, K50R",10
MQYKLILNGRTLYGEWTTEAVDAATLERVGKQYANDNWVDGEWTYWDAWKTFTVTK,-3.2943022,"K10R, K13Y, T16W, A26L, K28R, F30G, G38W, D46W, T49W, E56K",10
MQYKLILNGYTLKGFFTTEAVDRATAEHRFKQYANDNGYDGEWTYDDATQTFTRWE,-2.8080068,"K10Y, E15F, T16F, A23R, K28H, V29R, V39Y, K50Q, V54R, T55W",10
MQYQRILNYKTLKSETTTYAVDRATAERVFKYYANDNGVWGEWTYDDATKTFTFTE,-2.6371613,"K4Q, L5R, G9Y, G14S, E19Y, A23R, K28R, Q32Y, D40W, V54F",10
MQYKLALNGKTLKLESTFEAVDAATAERYFRQWANDNGVWGWWTYDDATKTFTVTE,5.6546087,"I6A, G14L, T16S, T18F, K28R, V29Y, K31R, Y33W, D40W, E42W",10
MQYKLILHGKTYKYDTTTEAVDAFYAEKRFKQRANYNGVDGEWTYDDATKTFEVTE,7.487911,"N8H, L12Y, G14Y, E15D, A24F, T25Y, V29R, Y33R, D36Y, T53E",10
MWYKLIHNGKRLKGETTSAAVDAATAEKVFKQWLNDNGVWGEWTYDDACKTFTVVE,4.3738184,"Q2W, L7H, T11R, T18S, E19A, Y33W, A34L, D40W, T49C, T55V",10
MWYKLILNGKTLKWYTTTGAVDKATAWRVFKQYARDNGVDLEATYDDATKTFTVTE,-5.3507843,"Q2W, G14W, E15Y, E19G, A23K, E27W, K28R, N35R, G41L, W43A",10
MQYKLILNGKTLWGETTTEAVDAYTARKVFKRYAVLNGVDGEWTFRDYTKGFTVTE,1.8329535,"K13W, A24Y, E27R, Q32R, N35V, D36L, Y45F, D46R, A48Y, T51G",10
MYYFLILNGKTLKGETTTEAWDRATARKVGKRYANDNGYDGEWTYRDATKTFTVYE,-4.2308064,"Q2Y, K4F, V21W, A23R, E27R, F30G, Q32R, V39Y, D46R, T55Y",10
MQYKLILNRKTLKREFTTEAVDWATAEKVYKRYANDRGWDGEWTYNDATKAFTVTE,-4.0673404,"G9R, G14R, T16F, A23W, F30Y, Q32R, N37R, V39W, D46N, T51A",10
MQYKLILRGKTRKGEWTTEAVDRAMAEKVFKQYANWNGVWWEWTYDDYTRTFTVTE,1.996145,"N8R, L12R, T16W, A23R, T25M, D36W, D40W, G41W, A48Y, K50R",10
MQYKLFLYGKKLKGETTTEAVDAATAKKVFKSYANDNGYDGEWTYDDATRMFTIIE,-0.4787962,"I6F, N8Y, T11K, E27K, Q32S, V39Y, K50R, T51M, V54I, T55I",10
MQYKLILYGKTLYGRTTMPAVDYATAEKYFKQYANDNGVDGEWTYDDANKTFLYTE,0.23528883,"N8Y, K13Y, E15R, T18M, E19P, A23Y, V29Y, T49N, T53L, V54Y",10
MQYKLYKNGKRLKGWTTLEAVDAYTMEKRFKQYANDNGVDFELTYDDATKTFTVTE,-0.4757198,"I6Y, L7K, T11R, E15W, T18L, A24Y, A26M, V29R, G41F, W43L",10
MQYKLILNRKTLKGETWTEAVDRAYAEKVFKKYGNFNGWWGEWTYDDATRTFTVTE,1.4652255,"G9R, T17W, A23R, T25Y, Q32K, A34G, D36F, V39W, D40W, K50R",10
MQVKLILNGKYLKGWTTTHAVDRATAEKVFKQYANDNGVWGWWTYDDAYKTFTRYE,1.4821951,"Y3V, T11Y, E15W, E19H, A23R, D40W, E42W, T49Y, V54R, T55Y",10
MQYKLILNGKTLKGWTTTEAWDAYTVEEVGRQYANDRGVDGEWTYDRWTKTFTVTE,0.5119731,"E15W, V21W, A24Y, A26V, K28E, F30G, K31R, N37R, D47R, A48W",10
MQYRLILNGKTLKGFWTTEAVDAATAEKRWKQRAKDWGVDGEWTYDRATKAFTVTE,1.7236327,"K4R, E15F, T16W, V29R, F30W, Y33R, N35K, N37W, D47R, T51A",10
MLYKLILNGKTLKGYRTTEYVDRATAKKVFKQYINDNGVDGTWTYDDARRTFTVTE,-1.3780001,"Q2L, E15Y, T16R, A20Y, A23R, E27K, A34I, E42T, T49R, K50R",10
MQYKLEFNGKTLKKETTYEAVDAATQEKVLKKYANDNGVDTEWTYDWATKTFIVTE,-2.1341586,"I6E, L7F, G14K, T18Y, A26Q, F30L, Q32K, G41T, D47W, T53I",10
MQYKLCLNGKTLKGETTTEAVDRATAEVVFMQYANDNGVDGEWYYDRYRKYFRVTE,1.6825981,"I6C, A23R, K28V, K31M, T44Y, D47R, A48Y, T49R, T51Y, T53R",10
MQYKLILNGKTLKGEWTTEAVVAATAMKVFRQWARDNGVDIEWTYNRATKRFTVTE,-5.6064253,"T16W, D22V, E27M, K31R, Y33W, N35R, G41I, D46N, D47R, T51R",10
MQYKLIWNGRTLKGETTIEAVDAAYAYKRFKQYANDRFVDGEWTYDDATGRFTVTE,1.0503353,"L7W, K10R, T18I, T25Y, E27Y, V29R, N37R, G38F, K50G, T51R",10
MYYKLILWGKWLKGETTWEAVDAYTAEKRFYQYANDNHVDGEWTYDDATKMFTLTE,5.12581,"Q2Y, N8W, T11W, T18W, A24Y, V29R, K31Y, G38H, T51M, V54L",10
MQSKLILNGKTLWGETTTRAVSAARAEKVFKRYANRNGVDGEWYYDDATKTFTVCW,8.6462145,"Y3S, K13W, E19R, D22S, T25R, Q32R, D36R, T44Y, T55C, E56W",10
MKYKLFLNWKTYKGEYTTEAVDAATAERKFKQRANYNGVDGEWKYDDATKTFTVTE,5.371145,"Q2K, I6F, G9W, L12Y, T16Y, K28R, V29K, Y33R, D36Y, T44K",10
MQYRWILNGKTLKGETYYEAVDAARAEKVFKQWRNDNGLDGEYRYDDATKTFTVTE,-1.8215272,"K4R, L5W, T17Y, T18Y, T25R, Y33W, A34R, V39L, W43Y, T44R",10
MQYKLILNGKTLWGETTTEAVDAYTARKVFKQWCNDNGVWGEWRWDDWTKTYTVTE,5.1402884,"K13W, A24Y, E27R, Y33W, A34C, D40W, T44R, Y45W, A48W, F52Y",10
MQYKLILNKKTLKGETMTEAYDAYTREKWFKQYCNDNGVDREWTYDRATKTFTVTF,-1.1930914,"G9K, T17M, V21Y, A24Y, A26R, V29W, A34C, G41R, D47R, E56F",10
MKYKYILNGKWLKGETTTEYVFARRAEKVFRQYANYNGVDGEWTYDDATKTFTVWE,3.2930255,"Q2K, L5Y, T11W, A20Y, D22F, A24R, T25R, K31R, D36Y, T55W",10
MQYKLWLQGKWGKYETTTEAVDAATARKVFKQYVNDNYVDGEWTYDDATKLFTVYE,-2.749132,"I6W, N8Q, T11W, L12G, G14Y, E27R, A34V, G38Y, T51L, T55Y",10
MQYYLILYNKTRRGETKTEAWDAARAEKVFKQYANYNGVDGEWTYDDAYKTFTVTE,8.079949,"K4Y, N8Y, G9N, L12R, K13R, T17K, V21W, T25R, D36Y, T49Y",10
MQYKFIFRGKRLKGETTTEAVDAYTAEYVFYRYANDAGVDGEWTYDDATKTFQVTE,-0.88518363,"L5F, L7F, N8R, T11R, A24Y, K28Y, K31Y, Q32R, N37A, T53Q",10
MQYKVILNGTTYKGRTTTEYVDRATAEKVCKQYANDNGVDGEWTYDDWTKTFEVKE,2.0513973,"L5V, K10T, L12Y, E15R, A20Y, A23R, F30C, A48W, T53E, T55K",10
MQYKLILNGFTLKGWTTTEWVDAARAEKRFRQYREDNGVDGEWTYDRATKRFTVTE,0.9803789,"K10F, E15W, A20W, T25R, V29R, K31R, A34R, N35E, D47R, T51R",10
MQYKVIWNGKTLKGHTTTEAVDAYTAERVFKQYLNANGVDGRYTYSDATKTFTVTE,1.2479354,"L5V, L7W, E15H, A24Y, K28R, A34L, D36A, E42R, W43Y, D46S",10
MRYLLILNGKTLKYETTTEAVWQATAEKVFKQWANKNGVWREWTYDDATKTITVTE,-1.432551,"Q2R, K4L, G14Y, D22W, A23Q, Y33W, D36K, D40W, G41R, F52I",10
MQYKLILYGKTLKGFTTYEWYDAAKFEKVWKQYANYNGVDGEWRYDDATKTFTVTE,3.4856591,"N8Y, E15F, T18Y, A20W, V21Y, T25K, A26F, F30W, D36Y, T44R",10
MQYKLILNGKTLKGETTTYAVDRARAMKVFKQWANRNYWDGEWTYDDATKTYTVTY,-4.802544,"E19Y, A23R, T25R, E27M, Y33W, D36R, G38Y, V39W, F52Y, E56Y",10
MTYKLIYNGKRLWGETTTEAVDWATAEKVFKQYINDNGVDGEWTYDIADKTFRVYE,-0.8612062,"Q2T, L7Y, T11R, K13W, A23W, A34I, D47I, T49D, T53R, T55Y",10
MQYRLILWGKTLKKETTTEAVDAWTAEKVFKRYVNFNGVDGRWKYDDATKTFTVTR,7.6803,"K4R, N8W, G14K, A24W, Q32R, A34V, D36F, E42R, T44K, E56R",10
MQYKLILNDKTLYGETTTEAVDAATAEKRYKRYINDYGVDCWWTYDDYTKTFTVTE,0.0062899366,"G9D, K13Y, V29R, F30Y, Q32R, A34I, N37Y, G41C, E42W, A48Y",10
MQYKLILWGKKLKYEPTTWYVIAATAEKVFKQYANWNGVDGEWWYDDATKTFYVTE,4.6163716,"N8W, T11K, G14Y, T16P, E19W, A20Y, D22I, D36W, T44W, T53Y",10
MQYKRLLNGKTLWGYLTTEAVDAATAEKVFKQYANDNGVYGKWTYDRATKTFWVTW,7.7878046,"L5R, I6L, K13W, E15Y, T16L, D40Y, E42K, D47R, T53W, E56W",10
MAFKLILNGKTLKGERIIEAVDYATAEWVFKQYANDLGVDVEWTYDDATKTWTVTE,-4.97348,"Q2A, Y3F, T16R, T17I, T18I, A23Y, K28W, N37L, G41V, F52W",10
MQYKRILNGKTLYGETTTEFVDAYTAYKVFKRWIWDNGVDGEWTYDDATKTFTVTW,-5.029801,"L5R, K13Y, A20F, A24Y, E27Y, Q32R, Y33W, A34I, N35W, E56W",10
MQYKLILNGKVQKHETTTEAVDAFTAEKVFKQRAADEGWDGRWTWDDATKTFTVTE,-1.7034446,"T11V, L12Q, G14H, A24F, Y33R, N35A, N37E, V39W, E42R, Y45W",10
MQYKLILRHKTLKWETTTEPYDAATAWKVFKQYVWDNGVDGEWTYDDYTKTFTVRE,-4.8270264,"N8R, G9H, G14W, A20P, V21Y, E27W, A34V, N35W, A48Y, T55R",10
MQYKLILNGKTLKGLTTTEAVDRYTAEKRFKQYANRNGVDGWWTYDDRTKRFFETE,7.07324,"E15L, A23R, A24Y, V29R, D36R, E42W, A48R, T51R, T53F, V54E",10
MQYKLRRNGKTLKGETTTVAVYAATAEKVFKYYWWDNGVWGEWRYDDATKTMTVTE,-2.0636215,"I6R, L7R, E19V, D22Y, Q32Y, A34W, N35W, D40W, T44R, F52M",10
MQFKWILNGKTLKGETWTEADDYATMEKRFWQYANDNGYDGEWTYDDATKTFTVTY,-4.448741,"Y3F, L5W, T17W, V21D, A23Y, A26M, V29R, K31W, V39Y, E56Y",10
MQYKLRLNGKTLKGETTTEAVDAYTAEKVFKQYVYDNWVDGYWTYDDWTYTFTLTH,3.043695,"I6R, A24Y, A34V, N35Y, G38W, E42Y, A48W, K50Y, V54L, E56H",10
MQYKLILNYKTLKREFTTEAVDAYDAEWVFKKYANDLGVDGEWTYDRATKRFTVTE,3.999312,"G9Y, G14R, T16F, A24Y, T25D, K28W, Q32K, N37L, D47R, T51R",10
MQYKLRLNGKYLKGETSTEAVRAATREKVFKQLANDNYVRGEWTYDRATKTFKVTE,4.651142,"I6R, T11Y, T17S, D22R, A26R, Y33L, G38Y, D40R, D47R, T53K",10
MQYKLILNGKTLKGETTRWARDAFTARKVWKQYANDNGWDGEWTYDDATKTIWVTF,-3.117529,"T18R, E19W, V21R, A24F, E27R, F30W, V39W, F52I, T53W, E56F",10
MQYKRILIGKTRKEETRTEYVDAATAEKVFRQYANDNNGDGEWTYDDATKTFTRTE,-5.8842216,"L5R, N8I, L12R, G14E, T17R, A20Y, K31R, G38N, V39G, V54R",10
MQYKLILNWKTLKWWTTTEAVDAARAERRFKQYANDNIWDGEWTYRDATKTFTCTE,3.0168064,"G9W, G14W, E15W, T25R, K28R, V29R, G38I, V39W, D46R, V54C",10
MQYKKILYRKTLNGETTTEAVDRATAEKVFGQYANWNGVDGEWTYDDATRTFSVTY,-5.463276,"L5K, N8Y, G9R, K13N, A23R, K31G, D36W, K50R, T53S, E56Y",10
MQYKLILKGGTLLGETYFEAVDAATAEKVFRQYANDNYVDGEWHYDDATKTWMVTE,1.2539603,"N8K, K10G, K13L, T17Y, T18F, K31R, G38Y, T44H, F52W, T53M",10
MQYKLILNWGTLKYETTTYAVDAAWAEKVFKQYANDNGVDGEWTKDDSRKTFTVWL,2.1579213,"G9W, K10G, G14Y, E19Y, T25W, Y45K, A48S, T49R, T55W, E56L",10
MQYKLILNGKTLGHYTTYEAVDKATWEKVAKQYANDNFMDGEWTYFDATKTFTVTE,-1.9320334,"K13G, G14H, E15Y, T18Y, A23K, A26W, F30A, G38F, V39M, D46F",10
MQYKLILNRYTSKGSTWFEATDAARAEKVFKQYANDRGVDGEWTYDDATKTYTVTE,3.8704443,"G9R, K10Y, L12S, E15S, T17W, T18F, V21T, T25R, N37R, F52Y",10
MQYKLKRNGKTLLGLTTTEAVDAARAEKWFRHYCNDNGVDGEWTYDDAMKTFTVTE,6.093948,"I6K, L7R, K13L, E15L, T25R, V29W, K31R, Q32H, A34C, T49M",10
MQVKRILNGKTRKGETTTRWVDRATAEKVFKQYANDHGVDGEWTYDRATKRFTYTE,-4.2543826,"Y3V, L5R, L12R, E19R, A20W, A23R, N37H, D47R, T51R, V54Y",10
MQYKLIYNGHRLKGETTTEYVDKARAEKVFKQYANDNGVWGEWYYTDATKRFTVTE,5.585914,"L7Y, K10H, T11R, A20Y, A23K, T25R, D40W, T44Y, D46T, T51R",10
MKYKLILNGKTLKGFTLTEAYDRATAWKVFKQYANDNGYDGEWTYDDAFKTLTKTE,-4.1622434,"Q2K, E15F, T17L, V21Y, A23R, E27W, V39Y, T49F, F52L, V54K",10
MQYKLILNWQTLKGETTTWAWDAATAERVFKQWARDNGVDGEWTYDDWTKFFRVTE,3.5414345,"G9W, K10Q, E19W, V21W, K28R, Y33W, N35R, A48W, T51F, T53R",10
MQYKLILNGWTLKGETTTWAWDRATAWKVFKQYYNDNGVDGYWTYDDYWRTFTVTE,-0.8341425,"K10W, E19W, V21W, A23R, E27W, A34Y, E42Y, A48Y, T49W, K50R",10
MQYKLILNGKTLKGFTQTWFVDAATAEKVFKQYAKDYGVDGEWTYDDRTMRFFVTE,1.2847537,"E15F, T17Q, E19W, A20F, N35K, N37Y, A48R, K50M, T51R, T53F",10
MQYKLILNYYSLKGETTTEAVDKATARKVFKAIVKDNGVDGEWTYDDATKTFTVTA,-6.13422,"G9Y, K10Y, T11S, A23K, E27R, Q32A, Y33I, A34V, N35K, E56A",10
MQYKLILRGKTLYGNSTTEWYWAATAYKVFKQYCNDNGVDGEWWYDDATKTFTVTE,2.1559896,"N8R, K13Y, E15N, T16S, A20W, V21Y, D22W, E27Y, A34C, T44W",10
MQYWLILNGKLLKGYTTTEAVDARVWEKVFKQYRNDNGVDGEYTYDDYRKTFTVTE,-4.0366282,"K4W, T11L, E15Y, A24R, T25V, A26W, A34R, W43Y, A48Y, T49R",10
MQYKLILNSKTYKGEWTTEAVDRATAEKRWKQYANDNGVDSEWTYYDATWTFTVYE,-2.9401367,"G9S, L12Y, T16W, A23R, V29R, F30W, G41S, D46Y, K50W, T55Y",10
MQYFLILNWRQLKGETITEAVDAATAWKVFKQYANDNGNQGEWTYDDATKTRTVLE,-5.2409883,"K4F, G9W, K10R, T11Q, T17I, E27W, V39N, D40Q, F52R, T55L",10
MQYKVILNGKTLKGETLYEWVYAATAEKVFKQYINRNGVDGRWTYDDATWKFTVTE,6.509082,"L5V, T17L, T18Y, A20W, D22Y, A34I, D36R, E42R, K50W, T51K",10
MQYKLYLNGKTLKGEVTTEAVDAYTKEKRFKQYAYDNGVDGEWFYDRATNRFTVTE,4.6306715,"I6Y, T16V, A24Y, A26K, V29R, N35Y, T44F, D47R, K50N, T51R",10
MQYKLILNGRLLKGETTTNAVDAATREKVFKKYMWDNGWDGEWRYDDATKRFTVTE,-3.084526,"K10R, T11L, E19N, A26R, Q32K, A34M, N35W, V39W, T44R, T51R",10
MQYKFGLNGKPLWGETTTEAPDVATAEKVFRQWANDNGYDGEWTYDDATKTFTVYE,0.3412136,"L5F, I6G, T11P, K13W, V21P, A23V, K31R, Y33W, V39Y, T55Y",10
MQYKLIFNGKWLNGETTTYAVDAYTAEKVFKQYAYDNGPDGEWTYDDARKTFTKTS,-3.0306313,"L7F, T11W, K13N, E19Y, A24Y, N35Y, V39P, T49R, V54K, E56S",10
MHYKLIRRGKTLKGYTTTEAADAATAEKVFKQYAWDNGVWGEWWYDDYWKTFTVTE,6.968654,"Q2H, L7R, N8R, E15Y, V21A, N35W, D40W, T44W, A48Y, T49W",10
MQKKLILNGKTLLGETTTYAYDWATAEKVFKYYRYDNHVDGEWTYDDASKTFTVTE,-4.6329875,"Y3K, K13L, E19Y, V21Y, A23W, Q32Y, A34R, N35Y, G38H, T49S",10
MTYKLILNGKTYKGELTTWAVDAARAEKVYKQYANDNWWGGEWTYDDATKTFKVTE,2.8018193,"Q2T, L12Y, T16L, E19W, T25R, F30Y, G38W, V39W, D40G, T53K",10
MRYKAILNGKTLKGETTVEARDAATAKKRFKQYLNDLGWDGEWTYDDATKTFTVTL,-3.8099196,"Q2R, L5A, T18V, V21R, E27K, V29R, A34L, N37L, V39W, E56L",10
MYYKLILNGKTLKGWWTTEYVDAATAERRFKRYWNINGVDGFWTYDDATKTFTVTE,4.4522996,"Q2Y, E15W, T16W, A20Y, K28R, V29R, Q32R, A34W, D36I, E42F",10
MKYKLILNGKTMKGETTTEAVDAATRRKVFNQYARDNGVWELWTYDDATKWFTVTE,-6.228139,"Q2K, L12M, A26R, E27R, K31N, N35R, D40W, G41E, E42L, T51W",10
MQYKLILNGKTLKGWTTTEYIKAATAEKVFKQYANDNYWFSEVTYDWATKTFTVTE,-3.7652771,"E15W, A20Y, V21I, D22K, G38Y, V39W, D40F, G41S, W43V, D47W",10
MQYRLILNGKTLKIETTTWARDRAWAKKVFKQYANDNGVDGEWTYDDWTKTFGVTY,-0.048585948,"K4R, G14I, E19W, V21R, A23R, T25W, E27K, A48W, T53G, E56Y",10
MQYKLILNGKVLKEETTTEAVDAWLAWQVFKQYANDWNVDWEWTWDDATKTFTVTE,-4.522743,"T11V, G14E, A24W, T25L, E27W, K28Q, N37W, G38N, G41W, Y45W",10
