Sequence,Score,Mutations,Number of Mutations
IEKFKKLAEKVELLVAKNREAEIDYSDAPDEFRDPLMDTLMTDPVRLPSGTVMDRSVIIRHLLNSPTDPFNRQPLTESMLEPVPELKEQIQAWMAEKSSSDH,3.5985525,"L6K, E13L, I14L, A19R, R20E, I57V, L59I, M74P, R95A, Q98S",10
IAKFSLLAEKVEEIVAKNAVAEIDYSDVPDEFRDPLMDTLMTDPVRLPSGTVMDRSIILRHLLNSPTDPFNRQMLSEDMLEPVPELKERIQAWIREKQSKDS,0.6728397,"E2A, K5S, R20V, A28V, T76S, S78D, Q89R, M94I, S100K, H102S",10
IEKFTLLAKKCEEVVAKNARAEIDFSDAPDEFRDPLMDTLMTDPVRLPSGTVMDRSIILRHLLNSPTDPFNRQMLTESMLEPVPELKEQIQAWVREKVDSKF,0.46568584,"K5T, E9K, V11C, I14V, Y25F, M94V, Q98V, S99D, D101K, H102F",10
IEKFNLLAEKVEELVAKNAAAEIDYSDAPDEFRDPLMDTLMTDPVRLPSGTVMDRSIILRHLLNSQTDPFNRQMLTESMLEPVPELKEKIQAWIKQQQSKDH,-0.34875637,"K5N, I14L, R20A, P66Q, Q89K, M94I, R95K, E96Q, K97Q, S100K",10
IEKFKLLAKKMEEVSAKNARAEADYSDVPDEFKDPLMDTLMTDPVRLPSGTVMDRSIILRHLLNSPTDPFSRQPLTESMLEPVTELKEQIQAWMREKQSSDH,-0.1767386,"E9K, V11M, I14V, V15S, I23A, A28V, R33K, N71S, M74P, P84T",10
VERFKLLAEKVEEIVAKNVMEEIDLSDAPDEFRDPLMDTLMTDPVRLPSGNVMDRSIILRHLLNSPTDPFNRQMLTEDMLEPVSELKQQIQAWMREKQSSDH,-0.02145326,"I1V, K3R, A19V, R20M, A21E, Y25L, T51N, S78D, P84S, E88Q",10
IEQFQLLAEKVEEIAAKNADAEIDYSDAPDEFRDPLMDTLMTDPVRLPSGNVMDRSIIIRHLLNSPTDPFNRQMLTESMLEPVPELKEQIQAWMKEKASKDF,-2.2110758,"K3Q, K5Q, V15A, R20D, T51N, L59I, R95K, Q98A, S100K, H102F",10
IEKFKLLAEKVEEIAAKNADDEIDYSDAPDEFRDPLMCTLMTDPVRLPSGTVMDRSIILRHLLNSPTDPFNRQMLTESMLEPVPELKEQIDMWRRSKQARDH,0.4399017,"V15A, R20D, A21D, D38C, Q91D, A92M, M94R, E96S, S99A, S100R",10
MEKFKLLEEKVEEIVAKNAKVETDYSDAPEEFRDPLMDTLMTDPVRLPSGTVMDRRIILRHLLNSPTDPFNRQMLTESMLEPVPELKEQIQQWMREKSSKDH,2.7500057,"I1M, A8E, R20K, A21V, I23T, D30E, S56R, A92Q, Q98S, S100K",10
IEKFKDLAEKVEGLVAKNARVEIDYSDAPDEFRDPVMDTLMTDPVKLPSGNVMDRAIILRHLLNSPTDPFNRQMLTESMLEPVPELKEQIQAWMDEKQSSAH,0.040001526,"L6D, E13G, I14L, A21V, L36V, R46K, T51N, S56A, R95D, D101A",10
IEKIILLKEKVEEIVAKNARTEVDYSDAPDEFKDPIMDTLMTDPVRLPSGTVMDRSIILRHLLNSPTDPFNRQMLTESMLEPVPELKEQIQAWIREKQKSDE,3.12531,"F4I, K5I, A8K, A21T, I23V, R33K, L36I, M94I, S99K, H102E",10
IEKFRELAIKVEEIAAKNAPAEIDYSDAPDEFRDPLMDTLMTDPVRLPSGSIMDRSIILRHLLNSPTDPFNRQPLTESMLEPVPELKEQIQAWMREKQSSAT,0.80707914,"K5R, L6E, E9I, V15A, R20P, T51S, V52I, M74P, D101A, H102T",10
IEKFKLLAEKVEEITAAANRAHIDYSDAPDEFRDPLMDTLMTDPVRLPSGTVMDRAIILRHLLNSPTDPFNRGMLTESMLEPVPELKEQIQAWVREKQISDR,-0.026116803,"V15T, K17A, N18A, A19N, E22H, S56A, Q73G, M94V, S99I, H102R",10
MEQFKLLASKVEEMVAKNAQAEIDYSDAPEEFRDPLMDTLMTDPVRLPSGNVMDRSTILRHLLNSPTDPFNRQPLTESMLEPVPELKEQIQAWMKEKQSSDH,-0.2734657,"I1M, K3Q, E9S, I14M, R20Q, D30E, T51N, I57T, M74P, R95K",10
IEDFTLLAEKVEELVKVSARAEIDYSDAPDEFRDPLMDTLMTDPVKLPSGTIMDRSIILRHLLNSPTDPFNRQPLTESMLEPVPELKESIQAWMREKQSSDH,0.023521053,"K3D, K5T, I14L, A16K, K17V, N18S, R46K, V52I, M74P, Q89S",10
IEKFKLLAGKVEAIQEKNARAEIDYSDAPEEFRDPLMDTLMTDPVRLPSGTVMDRSIIMRHLLNSPTDPFNRQMLTEEMLEPTPELKEQIQAWVREKQSKDH,0.7122594,"E9G, E13A, V15Q, A16E, D30E, L59M, S78E, V83T, M94V, S100K",10
IEKFKELAQKVNEIVAKNARAEIDYSDAPDEFRDPLMLTLMTDPVRLPSGTVMDRAIIQRHLLNSPTDPFNRQPLTESMLEPLTELKEQIQAWMRSKQSSDH,-1.8916416,"L6E, E9Q, E12N, D38L, S56A, L59Q, M74P, V83L, P84T, E96S",10
MEKFILLKEKVEELVAKNAEAEIDLSDAPDEFRDPLMDTLMTDPVRLPSGTVMDRAIILRHLLNSQTDPFNRGMLTESMLEPVPELKEQIQAWMRTKQSSDH,-0.2811166,"I1M, K5I, A8K, I14L, R20E, Y25L, S56A, P66Q, Q73G, E96T",10
IEKFKLLSEKCEEIVAKNARAEIDFSDAPDEFRDPLMDTLMTDPVRLPSGTVMDRSVIMRHLLNSQTDPFNRQMLTEDMLEPVTELKEQIQAWVRQKQSSDH,1.1815126,"A8S, V11C, Y25F, I57V, L59M, P66Q, S78D, P84T, M94V, E96Q",10
MEKFKLLGQKVEEIVNKNARAEVDYSDAPDEFRDPLMDTLMTDPVRLPSGTVMDRSVILRHLLNSPTDPFNRQPLTESQLEPVPELKEQIQAWIREKQSRDH,0.29023427,"I1M, A8G, E9Q, A16N, I23V, I57V, M74P, M79Q, M94I, S100R",10
MEKCKLLAEKVEEIVAKNKRAEIDYEDAPDEFRDPIMDTLMTDPVRLPSGTVMDRSIILRHLLNSPTDPFNRQMLTEEMLEPVSELKDRIQAWMREKLSSDH,2.255903,"I1M, F4C, A19K, S26E, L36I, S78E, P84S, E88D, Q89R, Q98L",10
MEKFRLLADKVEEIVATNARNEIDYSDAPEEFRDPLMDTLMTDPVRLPSGIVMDRSIILRHLLNSPTDPFNRQMLTESMLEPVPELKERIVAWMREKPSSDH,1.4374566,"I1M, K5R, E9D, K17T, A21N, D30E, T51I, Q89R, Q91V, Q98P",10
MEKFKLLAEKAEEIAAKNAAAEIDYSDAPDEFRDPVMDTLMTDPVKLPSGKVMDRSVILRHLLNSPTDPFNREMLTEDMLEPVPELKEQIQAWMREKQSSDH,1.0135031,"I1M, V11A, V15A, R20A, L36V, R46K, T51K, I57V, Q73E, S78D",10
MDKFALLAEKYEEIQAKNLRAEIDYSDAPEEFRDPLMDTMMTDPVRLPSGTVMDRSIILRHLLNSPTDPFNRQMLTESMLEPVVELKEQIEAWMREKQSSDH,1.5704318,"I1M, E2D, K5A, V11Y, V15Q, A19L, D30E, L40M, P84V, Q91E",10
IEKFKLLRQKVEEIAAKNAAEEIDYSDAPDEFRDPLMDTLMTDPVRLPSGKVMDRSIILRHLLNSPTDPFNRQMLTEEQLEPVPELKEQIQQWMKEKQSSDH,-0.42438763,"A8R, E9Q, V15A, R20A, A21E, T51K, S78E, M79Q, A92Q, R95K",10
IEKFKLLATKVEEIVASNAREEIDYSDAPEEFRDPLMDTLMTDPVRLPSGHVMDRRIILRHLLNSPTDPFNRQMLTESMLEPVTELKERIQAWMREKQQSSH,2.7569237,"E9T, K17S, A21E, D30E, T51H, S56R, P84T, Q89R, S99Q, D101S",10
IEKFKLLAEKVEETVAKQDRAEIDYSDAPDEFRDPIMDTLMTDPVRLPSGNIMDRSIILRHLLNSPTDPFNRTMLTESMLEPVPELKAQIQAWMRTKASSDH,1.099279,"I14T, N18Q, A19D, L36I, T51N, V52I, Q73T, E88A, E96T, Q98A",10
IEKFKLLAEKVEAIVAKNARAETDTSDAPDEFKDPLMDTLMTDPVRLPSGNIMDRSIILRHLLNSPTDPFNRQMLTESMLEPVPELKEKIQAWWREKKVSDH,0.8537183,"E13A, I23T, Y25T, R33K, T51N, V52I, Q89K, M94W, Q98K, S99V",10
IEKFKLLSEKVEEIVAKNARAEIDFSDAPEEFRDPMMDTLMTDPVKLPSGHVVDRSIILRHLLNSPTDPFNRQMLTESMLEPVPELKEQIQAWMLEKQSKKH,-0.062912546,"A8S, Y25F, D30E, L36M, R46K, T51H, M53V, R95L, S100K, D101K",10
IEKFKLLITKVESIVAKNMEAELDLSDAPDEFRDPLMDTLMTDPVRLPSGTVMDRSIILRHLLNSPTDPFSRQMLTESMLEPVPELKEQIRAWIREKQSSDH,2.0091755,"A8I, E9T, E13S, A19M, R20E, I23L, Y25L, N71S, Q91R, M94I",10
MEKFKLLAVQVEEVVAKNARAEIDYSDAPDEFRDPLMDTLMTDPVRLPSGNVMDRSIILRHLLNSPTDPFNRQMLTTDMLEPVPELKEQIQAWMRTKQSRDT,-0.9506972,"I1M, E9V, K10Q, I14V, T51N, E77T, S78D, E96T, S100R, H102T",10
IEKFKLLGEKMEEIVARNSLMDIDYSDAPDEFRDPLMDTLMTDPVRLPSGTVMDRSIILRHLLNSPTDPFNRQMLTEDMLEPVPELKEQIQAWRREKQSLDH,0.46391046,"A8G, V11M, K17R, A19S, R20L, A21M, E22D, S78D, M94R, S100L",10
IEKFKLLAYKVNEIVAKNARAEVDYDDAPEEFRDPLMDTLMTDPVRLPSGTVMDRSIILRHLLNSPTDPFNRQMLTEQMLQPVPELKEQIQAWRREKLSSDT,0.89639735,"E9Y, E12N, I23V, S26D, D30E, S78Q, E81Q, M94R, Q98L, H102T",10
AEKFKLLAAKVEEIAAKSAGAEIDYSDAPDEFRDPLMDTLMTDPVRLPSGTIMDRSMILRHLLNSPTDPFNRQHLTESMLEPVPELKEQIQAWMREKQGQDH,0.84844667,"I1A, E9A, V15A, N18S, R20G, V52I, I57M, M74H, S99G, S100Q",10
IEKFQLLAKKVEEVVARNMRAEIDYSDAPDEFRDPIMDTLMTDPVRLPSGTVMDRSIILRHLLNSPTDPFNRRMLTEDMLEPATELKEQIQAWMREKQSSDH,0.9034929,"K5Q, E9K, I14V, K17R, A19M, L36I, Q73R, S78D, V83A, P84T",10
IERFHGLADKVEVIVGKNARAAIDYSDIPDEFRDPLMDTLMTDPVRLPSGTVMDRSIILRHLLNSPTDPFNRQPLTEDMLEPVPELKEQIQAWMREKQSSDH,-1.0247154,"K3R, K5H, L6G, E9D, E13V, A16G, E22A, A28I, M74P, S78D",10
IEDFRLLCEKVDELAAKNARADIDYSDAPDEFRDPLMDTLMTDPVRLPSGHVMDRSIILRHLLNSPTDPFNRQMLTESMLEPVPELKEQIQAWMRENQSSDQ,0.2966705,"K3D, K5R, A8C, E12D, I14L, V15A, E22D, T51H, K97N, H102Q",10
MEKFQDLAEKVEAIVAKQAAAEIDYSDAPDEFRDPLMDTLMTDPVRLPSGTVMDRSIIIRHLLNSPTDPFNRQMLTENMLEPLPELKEQIQAWMREKLSSDH,-0.59170663,"I1M, K5Q, L6D, E13A, N18Q, R20A, L59I, S78N, V83L, Q98L",10
MEKFKMLAEKVEEIVGKNARNEIDYSDAPEEFRDPLMDTLMTDPVRLPSGTVMDRSIILRHLLNSPTDPFNRQMLTEEMLEPVPELKEKIQKWIREKQSLDH,1.5907936,"I1M, L6M, A16G, A21N, D30E, S78E, Q89K, A92K, M94I, S100L",10
IEKFNLLAEKCEGLVSKNNRAEIDYSDAPEEFRDPLMCTLMTDPVRLPSGTVMDRSIILRHLLNSPTDPFNRQMLTESMLEPVPELKEQIQQWMREKQSSSH,0.36166123,"K5N, V11C, E13G, I14L, A16S, A19N, D30E, D38C, A92Q, D101S",10
MEKFKLLAEKVDETAAKNARAEADFSDAPEEFRDPLMDTLMTDPVRLPSGTVMDRSIILRHLLNSPTDPFNRQPLTESMLEPVPELKEKIQAWMREKQESDH,1.562849,"I1M, E12D, I14T, V15A, I23A, Y25F, D30E, M74P, Q89K, S99E",10
IEKFKLLADKVEAIAAKRARAEDDYSDAPDEFRDPLMDTLMTDPVKLPSGTVMDRSIILRHLLNSPTDPFNRQPLTESALEPVPELKEQIVAWMREKQSSRH,-0.45352793,"E9D, E13A, V15A, N18R, I23D, R46K, M74P, M79A, Q91V, D101R",10
IETFKLLEEKVEEAVAKNAEAEIDLSDAPDEFRDPLMDTLMTDPVRLPSGTVMDRSIILRHLLNSATDPFNRQILTESMLEPVPELKEQIQAWMRQKQSSFK,-0.00822752,"K3T, A8E, I14A, R20E, Y25L, P66A, M74I, E96Q, D101F, H102K",10
IEKFLLLAEKVEEIVHKNANAEIDYDDAPEEFRDPLMDTLMTDPVRLPSGTVMDRAIILRHLLNSPTDPFNRQPLTESMLEPVPELKEQIQNWMREKVSLDH,3.619761,"K5L, A16H, R20N, S26D, D30E, S56A, M74P, A92N, Q98V, S100L",10
LEKFTLLSEKVEEIAAKNAKAEIDYSDAPDEFRDPIMDTLMTDPVRLPSGTVMDRSIILRHLLNSPTDPFNRQPLTEAMLESVPELKEQIQAWMREKVSSDH,2.5096803,"I1L, K5T, A8S, V15A, R20K, L36I, M74P, S78A, P82S, Q98V",10
IEKFALLREKVEEIVAKNLREEIDYSDAPDEFRDPLMDTLMTDPVRLPSGTIMDRSVILRHLLNSPTDPFNRTMLTESMLEPVPELKEQIQLWMREKLSSCH,-0.19417122,"K5A, A8R, A19L, A21E, V52I, I57V, Q73T, A92L, Q98L, D101C",10
QEKFKLLAAKMEEIVAKNAMAEVDYSDAPDEFRDQIMDTLMTDPVRLPSGTVMDRSVILRHLLNSPTDPFNRQMLTESMLEPVPELKEQIQAWMLEKNSSDH,1.6463653,"I1Q, E9A, V11M, R20M, I23V, P35Q, L36I, I57V, R95L, Q98N",10
MEKFKLLGKKVEDIRAANARAEIDYSDAPDEFRDPLMDTLMTDPVRLPSGTVMDRKIILRHLLNSPTDPFNRQMLTESMLEPVPELKERIEAWRREKQSSDH,0.88122535,"I1M, A8G, E9K, E13D, V15R, K17A, S56K, Q89R, Q91E, M94R",10
IEKFKLLKEKLEEINAKNARAEIDFSDAPDEFRDPLMDTLMTDPVRLPSGTVMDRSIILRHLLNSPTDPFNRQMLTESMLEPAPELKERIQAWVREKRSIDD,-0.17507827,"A8K, V11L, V15N, Y25F, V83A, Q89R, M94V, Q98R, S100I, H102D",10
IEKFKLLAEKVEEIAAKNQAADTDYSDAPDEFRDPLMDTLMTDPVRLPSGHVMDRSIILRHLLNSPTDPFNRQMLTEDMLEPVTELKEQIQAWMREKSSTDH,1.9491677,"V15A, A19Q, R20A, E22D, I23T, T51H, S78D, P84T, Q98S, S100T",10
MGKFKLLAQKAEEIVSKNARAEIDYSDAPDEFRDPLMDTLMTDPVRLPSGTVMDRSIILRHLLNSQTDPFNRQMLTEDMLEPVPELKEQIQAWMREKISRDG,-0.63286245,"I1M, E2G, E9Q, V11A, A16S, P66Q, S78D, Q98I, S100R, H102G",10
IEKFRLLAEKVEEIAAKNQGAEVDYSDAPDEFKDPLMDTLMTDPVRLPSGTVMDRSIILRHLLNSPTDPFNRQMLTESMLESVPELKERIQAWTREKQSADH,0.28058556,"K5R, V15A, A19Q, R20G, I23V, R33K, P82S, Q89R, M94T, S100A",10
IEKFSLLAEKAERLAAKNARSEIDYSDAPDEFRDPLMDTLMTDPVRLPSGTVMDRSIILRHLLNSSTDPFNRQMLTESQLEPVPELKERIQAWMREKQSSSH,-0.025463479,"K5S, V11A, E13R, I14L, V15A, A21S, P66S, M79Q, Q89R, D101S",10
VEKFKLLAEKVEEVAKKNARAEIDYSDAPEEFRDPLMDTLMTDPVRLPSGTIMDRSVILRHLLNSPTDPFNRQPLTESMLEPVTELKEQIQAWMREKQLSDH,1.4858758,"I1V, I14V, V15A, A16K, D30E, V52I, I57V, M74P, P84T, S99L",10
ITKFKNLAEKVEEIVAKNARAEIDYSDAPDEFRDPLMDTLMTDPVKLPSGTIMDRAIILRHLLNSPTDPFNRSMLTEDMLEPALELKEQIQAWMREKQSSDE,-0.87946475,"E2T, L6N, R46K, V52I, S56A, Q73S, S78D, V83A, P84L, H102E",10
IEKFKKLTKKVEEIVAKNARAEVDYSDAPDEFRDPLMDTLMTDPVRLPSGKVMDRSVILRHLLNSPTDPFNRQMLTPSMLLPVPELKERIQNWMREKQSSDH,1.2531142,"L6K, A8T, E9K, I23V, T51K, I57V, E77P, E81L, Q89R, A92N",10
IEKMKLLANKVEEIVAKNARAEIDYSDAPDEFRDPLMDTLMTDPVRLPSGTIMDRSVILRHLLNSPTDPFNRQMLTESMLEPMPELKEQIQAWTRKKVISDE,0.5634391,"F4M, E9N, V52I, I57V, V83M, M94T, E96K, Q98V, S99I, H102E",10
IEKFNELGEKVEELVAMNAVEEIDYSDAPDEFRDPLMDTLMTDPVRLPSGTVMDRSIILRHLLNSPTDPFNRQMLTESMLEPVPELKERIQAWMREKQSSKS,1.055848,"K5N, L6E, A8G, I14L, K17M, R20V, A21E, Q89R, D101K, H102S",10
ISKFKLLAEKVGEIVAKNAIAEIDYSDVPDEFRDPLMDTLMTDPVRLPSGTVMDRDTIVRHLLNSPTDPFNRQMLTEDMLEPVPELKAQIQAWMREKQSSGH,2.1116257,"E2S, E12G, R20I, A28V, S56D, I57T, L59V, S78D, E88A, D101G",10
IEKFKLLAEKVEEIEAANARAEIDYSDAPDEFRDPLMDTLMRDPVRLPSGTVMDRSIILRHLLNSPTDPFNRTPLTEDMLEPVPELKERIQAWMREKQAEDE,0.72548676,"V15E, K17A, T42R, Q73T, M74P, S78D, Q89R, S99A, S100E, H102E",10
IEKFSLLAAKVDEIVAKNARAEIDYSDCPDEFRDPLMDTLMTDPVRLPSGTVMDRSVIMRHLLNSPTDPFNRQPLTEDMLEPVPELKEKIQAWMRQKQSSDH,1.2781594,"K5S, E9A, E12D, A28C, I57V, L59M, M74P, S78D, Q89K, E96Q",10
IEKFKLLAEKVEELVAKNTRAEIDYSDAPDEFRDRLMDTLMTDPVKLPSGNVMDRSIILRHLLNSPTDPFNRQMLTEKMLEPLPELKEQIEAWMREKQQSGH,-2.4767032,"I14L, A19T, P35R, R46K, T51N, S78K, V83L, Q91E, S99Q, D101G",10
MTKFKLLAEKVEEIVADQARAEIDYSDAPDEFRDPLMDTLMTDPVRLPSGTVMDRSIILRHLLNSPTDPFNRQPLTENMLEPAPELKERIQAWMREKLSSRH,-0.98189086,"I1M, E2T, K17D, N18Q, M74P, S78N, V83A, Q89R, Q98L, D101R",10
MDKFKLLADKVDEIVEKNARAEIDYSDAPDEFRDRLMDTLMTDPVRLPSGNVMDRSIILRHLLNSPTDPFNRQMLTESMLQPVPELKEQIQAWVKEKQSSDH,-2.9064732,"I1M, E2D, E9D, E12D, A16E, P35R, T51N, E81Q, M94V, R95K",10
IEKFKALTEKVEEIAAKNADAEIDYSDAPDEFRDALMDTLMTDPVRLPSGTVMDRSIILRHLLNSPTDPFNRQMLTEEMLEPVPELKERISKWMEEKQSSDH,-1.5017762,"L6A, A8T, V15A, R20D, P35A, S78E, Q89R, Q91S, A92K, R95E",10
IEKFKLLGEKVEKIVAKNARAEIDLSDAPEDFRDPLMDTLMTDPVRLPSGTVMDRSIILRHLLNSPTDPFNRQMLTEDMLEPVPELKEQIQAWMAKKVSSDS,1.0608897,"A8G, E13K, Y25L, D30E, E31D, S78D, R95A, E96K, Q98V, H102S",10
MEKFKALAEKVEEIVEKANRMEIDYSDAPDEFKDPLMDTLMEDPVRLPSGTVMDRSIILRHLLNSPTDPFNRQMLTESMLEPVPELKERIQAWIREKQSSDH,1.9323881,"I1M, L6A, A16E, N18A, A19N, A21M, R33K, T42E, Q89R, M94I",10
IEKFKLLAERVDEISLSNARAQIDYSDAPDEFRDPLMDTLMTDPVRLPSGTVMDRSIILRHLLNSPTDPFNRQMLTESMLEPVPELKEQIQAWVRERLSKDH,0.2731796,"K10R, E12D, V15S, A16L, K17S, E22Q, M94V, K97R, Q98L, S100K",10
IELFKDLCENVEEIVAAHARAEIDLSDAPEEFRDPLMDTLMTDPVRLPSGTVMDRSIILRHLLNSPTDPFNRQMLTESMLEPVPELKEQIERWMREKQSSDH,1.5509249,"K3L, L6D, A8C, K10N, K17A, N18H, Y25L, D30E, Q91E, A92R",10
IEKFEELAEKVDSLVAKEARDEIDYSDAPDEFRDPLMDTLMTDPVRLPSGKVMDRSIILRHLLNSPTDPFNRQMLTESMLEPVPELKEQIQAWMREKQSSRR,1.5616682,"K5E, L6E, E12D, E13S, I14L, N18E, A21D, T51K, D101R, H102R",10
IEKFKLLSAKVEEIVAKNAREEIDYSDAPDEFRDPIMDTIMTDPVRLPSGTVMDRSVILRHLLNSQTDPFNRQPLTESMLEPVVELKEQIQAWIREKQSSDH,5.756536,"A8S, E9A, A21E, L36I, L40I, I57V, P66Q, M74P, P84V, M94I",10
MEKFKLLCEKVDVMVAKHIRAEIDYSDAPDEFRDPLMDTLMTDPVRLPSGTVMDRSIILRHLLNSPTDPFNRQMLTEDMLEPVTELKEQIQAWMREKQSSDA,-0.06496738,"I1M, A8C, E12D, E13V, I14M, N18H, A19I, S78D, P84T, H102A",10
MERMKLLAEKVDEIVAKNLAAEIDYSDAPDEFRDPLMDTLMTDPVRLPSGTVMDRSIILRHLLNSQTDPFNRSMLTESELEPVTELKEQIQAWMREKQSSDH,-1.1585271,"I1M, K3R, F4M, E12D, A19L, R20A, P66Q, Q73S, M79E, P84T",10
MEKFKRLKEKVEELVAKNARAEIDYSDAPDEFRDPLMDTLMTDPVKLPSGTVMDRSVILRHLLNSPTDPFNRQMLTEDMLEPVPELKERIHAWMRNKQSSDH,-0.2241295,"I1M, L6R, A8K, I14L, R46K, I57V, S78D, Q89R, Q91H, E96N",10
IEKFKLLAEKMEEVVAKQARAEIDYSDAPDEFLDPLMDTLMTDPVRLPSGTVMDRSIILRHLLNSPTDPFNRQMLTEDMLEPVPELKQQIQHWIREKQSSRK,1.1069329,"V11M, I14V, N18Q, R33L, S78D, E88Q, A92H, M94I, D101R, H102K",10
IEKFKLLCEKVEEIVKLNAIAEIDYSDAPDEFRDPLMDTLMLDPVRLPSGTVMDRKIILRHLLNSPTDPFNRQDLTESMLEPVPELKEQIHAWMRSKQSSDS,1.2328622,"A8C, A16K, K17L, R20I, T42L, S56K, M74D, Q91H, E96S, H102S",10
MQKFKLLAEKVNQLVAKNARDEIDLSDAPDEFRDPLMDTLMTDPVRLPSGTVMDRSIILRHLLNSPTDPFNRQMLTESMLEPVPELKERIQAWMRERQSSDT,-0.7023208,"I1M, E2Q, E12N, E13Q, I14L, A21D, Y25L, Q89R, K97R, H102T",10
IEKFKTLSEKVEAIVAKNALAEIDYSDAPEEFRDPLMDTLMTDPVRLPSGTVMDRAIILRHLLNSPTDPFNRQPLTESMLEPAPELKEQIEAWMREKASSDH,1.2336912,"L6T, A8S, E13A, R20L, D30E, S56A, M74P, V83A, Q91E, Q98A",10
IEKFKLLSEKVEEIAAKNARAESDYSDAPEEFRDPLMDTLMTDPVRLPSGTVADRSIILRHLLNSPTDPFNRQPLTEDMLEPVPELKEQIQGWMREKQSRGH,1.4071422,"A8S, V15A, I23S, D30E, M53A, M74P, S78D, A92G, S100R, D101G",10
IEKFKLLAAKAEEISAKNARAEIDYSDAPDEFRDPLMNTLMTDPVKLPSGTVMDRSIILRHLLNSPTDPFNRQMLTEDMLEPVPELKEQIQAWMKRKNRSDH,-1.8882937,"E9A, V11A, V15S, D38N, R46K, S78D, R95K, E96R, Q98N, S99R",10
IEAFKALDEKMEEIVQKNQSAEIDYSDAPDEFRDPLMDTLMTDPVRLPSGTVMDRSIILRHLLNSPTDPFNRSELTESMLEPVPELKEQIQAWMREKQSSDS,0.25924176,"K3A, L6A, A8D, V11M, A16Q, A19Q, R20S, Q73S, M74E, H102S",10
IEKFALLAKKVEEIVAIRARAEIDYSDAPDEFRDALMDTLMTDPVRLPSGTVMDRKIILRHLLNSPTDPFNRQMLTESMLLPVPELKEQIQEWMKEKQTSDH,-2.6148314,"K5A, E9K, K17I, N18R, P35A, S56K, E81L, A92E, R95K, S99T",10
IEKFTLLSKKVEEIVAKNARAEIDYSDAPDEFRDPLMDTLMTDPVKLPSGTVMDRSVIMRHLLNSPTDPFNRQMLTESMLEPAVELKEQIQAWMKEKMSSDH,-2.0991912,"K5T, A8S, E9K, R46K, I57V, L59M, V83A, P84V, R95K, Q98M",10
IEKFKALTEKADELVAKQARAEIDYSDAPPEFRDPLMDTLMTDPVKLPSGTVMDRSIILRHLLNSPTDPFNRQMLTESMLEPVPELKEQIRAWMREKQPSDH,0.88381666,"L6A, A8T, V11A, E12D, I14L, N18Q, D30P, R46K, Q91R, S99P",10
IEKFKALAEKMEELAAKNQRAEIDYSDAPDEFRDPLMDTLMTDPVRLPSGTIMDRSIILRHLLNSQTDPFSRQPLTESMLEPVPELKEQIQAWIREKQSSDH,0.5449047,"L6A, V11M, I14L, V15A, A19Q, V52I, P66Q, N71S, M74P, M94I",10
IEHFKLLAVKLEEIVAKNAMEEMDYSDAPVEFRDPLMDTLMTDPVRLPSGTVMDRSIILRHLLNSPTDPFNRQMLTESMLEPVPELKEQIQAWMRSKQTSPH,-0.9696566,"K3H, E9V, V11L, R20M, A21E, I23M, D30V, E96S, S99T, D101P",10
IDKFKLLAEKVDEIVAKNRRAEIDYSDAPEEFRDPVMDTLMTDPVKLPSGNVMDRSIILRHLLNSQTDPFNRQMLTESMLEPVPELKEQIQAWMREKQTSDN,1.7214451,"E2D, E12D, A19R, D30E, L36V, R46K, T51N, P66Q, S99T, H102N",10
IEKFKALAEKVEEVVAKNAREEIDYSDAPDEFRDPLMDTLMTDPVRLPSGKVMDRSIILRHLLNSPTDPFNRQMLTESQLEPVPELKEQIQKWMEEKQRPDL,0.5249084,"L6A, I14V, A21E, T51K, M79Q, A92K, R95E, S99R, S100P, H102L",10
IEKFKSLAEKVEEIVQKSAAAEIDYSDAPDEFRDPLMDTLMTDPVRLPSGTVMDRAIILRHLLNSPTDPFNRQRLTESMLEPVPELREQIQAWVRSKQSSDA,1.4018176,"L6S, A16Q, N18S, R20A, S56A, M74R, K87R, M94V, E96S, H102A",10
MEKFKLLKEKVEEIAAENATQEIDYSDAPDEFRDPLMDTLMTDPVRLPSGKIMDRSIILRHLLNSPTDPFNRQMLTESQLEPVPELKEQIQKWMREKQSSDH,1.6652317,"I1M, A8K, V15A, K17E, R20T, A21Q, T51K, V52I, M79Q, A92K",10
IEGFKLLAEKVEEIVASNAQAEIDYSDAPEEFRDPLMDTLMTDPVKLPSGNVMDRSVILRHLLNSPTDPFNRQMLTESMLEPVPELKEQIQAWVRNKQPSDH,1.7620152,"K3G, K17S, R20Q, D30E, R46K, T51N, I57V, M94V, E96N, S99P",10
LEKFKLLAEKLEAIVAQNAEAEIDYSDAPEEFRDTLMDTLMTDPVRLPSGTIMDRSVILRHLLNSPTDPFNRQMLTESMLEPVPELKEQIQAWMREKQGSDH,-1.5987341,"I1L, V11L, E13A, K17Q, R20E, D30E, P35T, V52I, I57V, S99G",10
IESFKLLREKVEEAQAKTLRAEIDYSDAPDEFRDPLMDTLMTDPVRLPSGTVMDRSIILRHLLNSPTDPFNRQMLTESMLEPVPELKAQIQAWIREKQKSGH,0.7109481,"K3S, A8R, I14A, V15Q, N18T, A19L, E88A, M94I, S99K, D101G",10
IEDFELLAKKAEEIVAKNARAEIDFSDAPDEFRDPLMSTLMLDPVRLPSGTVMDRSIILRHLLNSPTDPFNREMLTESMLEPVPELREQIQAWMREKQSSDN,-2.0912755,"K3D, K5E, E9K, V11A, Y25F, D38S, T42L, Q73E, K87R, H102N",10
MEKFQLLAEKMEEMVAKNARAEVDYSDAPDEFKDPLMDTLMTDPVRLPSGTIMDRSIILRHLLNSPTDPFNRQMLTESMLEPVPELKEQIQAWMREKLNSDA,-0.24565041,"I1M, K5Q, V11M, I14M, I23V, R33K, V52I, Q98L, S99N, H102A",10
IESFKLLAEKCEEIVNKNAMAEIDYSDAPDEFRDPIMDTLMVDPVKLPSGNVMDRSIIMRHLLNSPTDPFNRQMLTESMLEPVVELKEQIQAWMREKQSSDH,3.5640292,"K3S, V11C, A16N, R20M, L36I, T42V, R46K, T51N, L59M, P84V",10
IEKFKLLQEKCEEIVAKNARQEIDYSDAPDEFRDPLMDTLMTDPVRLPSGNVMDRSVILRHLLNSPTDPFNRQPLTEEMLEPVPELKEQIQAWMAEKKASDH,2.4595475,"A8Q, V11C, A21Q, T51N, I57V, M74P, S78E, R95A, Q98K, S99A",10
TEKFKLLKEKCEEIVAKSAAEEIDYSDAPDEFRDPLMDTLMTDPVRLPSGNVMDRSIILRHLLNSPTDPFNRQMLTESMLEPAPELKEQIAAWMREKQSSDY,0.091453075,"I1T, A8K, V11C, N18S, R20A, A21E, T51N, V83A, Q91A, H102Y",10
MEKFKVLAEKVEEIAAKNARVEIDYSDAPDEFRDPLMDTLMTDPVRLPSGKIMDRPIILRHLLNSETDPFNRQMLTESMLEPVPELKEQIQAWMREKVSKDH,1.1717739,"I1M, L6V, V15A, A21V, T51K, V52I, S56P, P66E, Q98V, S100K",10
MEKFKLLTEKVEELVAKNAADEIDYSDAPDEFRDPLMDTLMTDPVRLPSGNIMDRSIILRHLLNSPTDPFNRQMLTESKLEPVPELKAQIQAWMREKQSSRH,-0.4005813,"I1M, A8T, I14L, R20A, A21D, T51N, V52I, M79K, E88A, D101R",10
IEKFKLLAEKVDEIVAKNQIEDIDYSDAPDEFRDPLMDTLMTDPVRLPSGTVMDRSIILRHLLNSPTDPFNRQMLTESMLEPQPELKEQINAWMKEKLSSDS,-0.45082843,"E12D, A19Q, R20I, A21E, E22D, V83Q, Q91N, R95K, Q98L, H102S",10
IEKFKLLAEKVEAIAAKNARKEMDYSDVPDEFRDPLMDTIMTDPVRLPSGTIMDRSIILRHLLNSPTDPFNRQSLTESMLEPVPELKEQIQAWMREKQSSVP,2.3303146,"E13A, V15A, A21K, I23M, A28V, L40I, V52I, M74S, D101V, H102P",10
ISKFKPLCEKAEEIVAKRARAEIDYSDAPDEFRDPLMDTLMTDPVRLPSGTIMDRSIILRHLLNSPTDPFNRQMLTEDMLEPAPELKEQIEAWVREKQSSDH,0.903052,"E2S, L6P, A8C, V11A, N18R, V52I, S78D, V83A, Q91E, M94V",10
MEKFKELAEKVQEIVAKNTGAEIDYSDAPDEFRDSLMDTLMTDPVKLPSGVVMDRKIILRHLLNSPTDPFNRQMLTESMLEPAPELKEQIQAWMREKQSSDH,-2.6135805,"I1M, L6E, E12Q, A19T, R20G, P35S, R46K, T51V, S56K, V83A",10
IEKFLLLAEKVEEIVAKNHRADIDYSDAPDEFRDKLMDTLMTDPVRLPSGTIMDRSIILRHLLNSPTDPFNRQPLTEDMLEPAIELKEQIQAWQREKQSSDH,0.11844018,"K5L, A19H, E22D, P35K, V52I, M74P, S78D, V83A, P84I, M94Q",10
IEKFKLLAEKVEEIVAKNAAAEIDYSDAPDEFRDPLMSTLMTDPVKLPSGTVMDRSIILRHLLNSPTDPFSRQMLTEDMLEPLVELKEQIQAWIREKQSSSM,0.060864747,"R20A, D38S, R46K, N71S, S78D, V83L, P84V, M94I, D101S, H102M",10
MEKFKELAMKVEEIAAKQQRAEIDYSDAPDEFRDPLMDTLMTDPVRLPSGNIMDRSIILRHLLNSPTDPFNRQMLTEDMLEPVPELKEQIQAWMREKLSSDH,0.6676,"I1M, L6E, E9M, V15A, N18Q, A19Q, T51N, V52I, S78D, Q98L",10
IEKFKQLAEKVEEIAAKNAAAEADYSDAPEEFRDPLMDTLMTDPVRLPSGHVMDRSIILRHLLNSPTDPFNRQMLTEDMLEPVPELKERIQAWMREKQSKRH,3.3253736,"L6Q, V15A, R20A, I23A, D30E, T51H, S78D, Q89R, S100K, D101R",10
IEKFNLLAEKCEEIVKKKARAEIDYSDAPDEFRDPLMDTLMTDPVRLPSGTVMDRSIILRHLLNSPTDPFNRQMLTESMLEPVPELKEQIQKWREEKQSKLG,-0.07650831,"K5N, V11C, A16K, N18K, A92K, M94R, R95E, S100K, D101L, H102G",10
IEKFKDLAEKADEIVAKNQRDEIDYSDAPDEFKDPLMDTLMTDPVRLPSGHVMDRSVILRHLLNSPTDPFNRQMLTESMLESVPELKEQIQAWMREKQSSDM,2.2410772,"L6D, V11A, E12D, A19Q, A21D, R33K, T51H, I57V, P82S, H102M",10
MEKFALLAEKAEEIVAKNARAEIDYSDAPDEFLDPLMATLMTDPVRLPSGSVMDRSTILRHLLNSPTDPFTRQPLTESMLEPVPELKEQIQAWIREKQSSDH,4.119583,"I1M, K5A, V11A, R33L, D38A, T51S, I57T, N71T, M74P, M94I",10
IESFKLLAEKVENIVALAARAEIDYSDAPDEFRDPLMDTLMTDPVRLPSGTVMDRSIILRHLLNSPTDPFNRQPLTESQLEPVPELKEKIQAWIREKVSSKH,1.969275,"K3S, E13N, K17L, N18A, M74P, M79Q, Q89K, M94I, Q98V, D101K",10
IEKFKLLEEKVEEIFAKAARAEIDYSDAPDEFKDPIMDTLMTDPVRLPSGTVMDRSIILRHLLNSPTDPFNRQMLTESMLESVPELKEQIQDWMRLKASQDH,3.0257635,"A8E, V15F, N18A, R33K, L36I, P82S, A92D, E96L, Q98A, S100Q",10
IEKFHLLAQKVESLVAKNAVAEIDLSDAPDEFKDPLMDTLMVDPVKLPSGTVMDRSIILRHLLNSPTDPFNRQMLTESMLEPVPELKEQIQAWMREKQSSDR,0.4432469,"K5H, E9Q, E13S, I14L, R20V, Y25L, R33K, T42V, R46K, H102R",10
MEKFKLLAEKAEEITAKNANAEIDYSDAPDEFKDPLMDTLMTDPVKLPSGTVMDRPIILRHLLNSPTDPFNRQPLTESMLEPVPELKEKIQAWLREKQSSDH,1.4584191,"I1M, V11A, V15T, R20N, R33K, R46K, S56P, M74P, Q89K, M94L",10
IEKFKLLAEKVNELVAKNMSAEIDYSDAPDEFRDPLMDTLMTDPVRLPSGTVMDRSIILRHLLNSPTDPFNRQPLTEDMLESVPELKEQIQAWIRSKQSSDK,0.5190728,"E12N, I14L, A19M, R20S, M74P, S78D, P82S, M94I, E96S, H102K",10
IEKFKLLCEKVEEIVIKNAHAEFDYSDAPDEFRDPLMDTLMTDPVRLPSGTVMDRSIILRHLLNSPTDPFNREPLTESMLEPVPELKQQIKAWMRKKKSSDH,0.6601138,"A8C, A16I, R20H, I23F, Q73E, M74P, E88Q, Q91K, E96K, Q98K",10
IENFKLLATKVEEIVAKNARAEIDYSDAPDEFRDPLMDTLMTDPVRLPSGTIMDRGIILRHLLNSPTDPFNRQPLTESMLEPVPELREQIFAWMREKGISIH,0.54555225,"K3N, E9T, V52I, S56G, M74P, K87R, Q91F, Q98G, S99I, D101I",10
LEKFNLLAEKCEEIVAANARAEIDYSDAPDEFRDPIMDTLMTDPVRLPSGTIMDRSVILRHLLNSPTDPFNRQMLTEDMLEPVPELKEQIQAWMREKLSSDR,3.9741454,"I1L, K5N, V11C, K17A, L36I, V52I, I57V, S78D, Q98L, H102R",10
IEKFKLLAEKVEEIAAKNAAAEIDYSDAPEEFRDPLMDTLMTDPVRLPSGTVMDRSIILRHLLNSNTDPFNRQPLTEADLEPVPELKEQIQAWVREKLSSWH,1.919755,"V15A, R20A, D30E, P66N, M74P, S78A, M79D, M94V, Q98L, D101W",10
IEKFKLLAEKVEEIQEKNKRAEIDYSDAPDEFRDPIMDTLMTDPVRLPSGTVMDRSVILRHLLNSPTDPFNRQMLTESMLEPVTELKEQIQAWLREKQSNIA,4.4717474,"V15Q, A16E, A19K, L36I, I57V, P84T, M94L, S100N, D101I, H102A",10
IEKFKELAEKVEMLVAKNARAEIDYSDAPEEFRDPIMDTLMTDPVRLPSGTVMDRSIILRHLLNSPTDPFNRQMLTEDMLEPVPELKEQISAWVREKQPGDH,4.524782,"L6E, E13M, I14L, D30E, L36I, S78D, Q91S, M94V, S99P, S100G",10
MEDFKLLAEKVEEIVAKNANDEIDYSDAPDEFRDPLMDTLMTDPVRLPSGTVMDRSVIQRHLLNSPTDPFNRQMLTESMLEPVPELKERIQAWMRQKNSSSH,0.9174445,"I1M, K3D, R20N, A21D, I57V, L59Q, Q89R, E96Q, Q98N, D101S",10
MSKFKLLAEKVETIVAKNVRAEIDYSDAPEEFLDPLMDTLMTDPVRLPSGNVMDRSIILRHLLNSPTDPFNRQMLTEDMLEPVPELKEQIQAWMKEKQSSDD,-1.913863,"I1M, E2S, E13T, A19V, D30E, R33L, T51N, S78D, R95K, H102D",10
IEKFKVLAEKVEEVAAKAARAEIDISDAPDEFRDPLMDTLMTDPVRLPSGTVMDRSIILRHLLNSETDPFNRMPLTESMLEPVPELKEQIQAWLREKLSSDH,-0.10482246,"L6V, I14V, V15A, N18A, Y25I, P66E, Q73M, M74P, M94L, Q98L",10
MEKFALLARKAEEIVAKNTRAEIDYADAPEEFRDPIMDTLMTDPVRLPSGTIMDRSIILRHLLNSPTDPFNRQMLTESMLEPVVELKEQIQAWMREKQSSDH,3.7279153,"I1M, K5A, E9R, V11A, A19T, S26A, D30E, L36I, V52I, P84V",10
IEKFKLLCEKVEEIVAKNASSEVDYSDAPDEFRDPIMDTLMTDPVRLPSGTVMDRSVILRHLLNSPTDPFNRQMLTESMLEPVIELKAQIQAWMREKQIGDH,3.8070054,"A8C, R20S, A21S, I23V, L36I, I57V, P84I, E88A, S99I, S100G",10
MEKFKLLAEKVNVIVAKNARADIDFGDAPDEFRDPLMDTLMTDPVRLPSGHIMDRSIILRHLLNSPTDPFNRQMLTESMLEPVTELKEQIQAWIREKQSSDH,-0.91780436,"I1M, E12N, E13V, E22D, Y25F, S26G, T51H, V52I, P84T, M94I",10
IEKFQLLAEKVEEIAAKVARAEIDYSDIPDEFRDPLMDTLMSDPVRLPSGTVMDRSIILRHLLNSPTDPFNRQMLTESMLEPVPELKERIQAWRKEKQSRKH,-1.9376936,"K5Q, V15A, N18V, A28I, T42S, Q89R, M94R, R95K, S100R, D101K",10
IEKFKLLSEKVEEIAQANARAEIDYSDAPDEFKDPLMDTLMTDPVRLPSGSVMDRSIILRHLLNSPTDPFNRQMLTMDMLEPVVELKEQIQAWMREKQSVDH,1.0869346,"A8S, V15A, A16Q, K17A, R33K, T51S, E77M, S78D, P84V, S100V",10
IEEFKLLNEKVESIVQKTARAEIDYSDAPEEFKDPLMDTLMTDPVRLPSGTVMDRSIILRHLLNSRTDPFNRQMLEESMLEPVPELKEQIQAWMREKQSYDH,-0.23992696,"K3E, A8N, E13S, A16Q, N18T, D30E, R33K, P66R, T76E, S100Y",10
PEKFKLLAEKVENIVAKNARADIDYSDAPDEFRDPLMDTLMTDPVKLPSGTIMDRSIILRHLLNSSTDPFNRQPLTESMLEPVPELKNQIQAWMREKFRSDH,-0.4367846,"I1P, E13N, E22D, R46K, V52I, P66S, M74P, E88N, Q98F, S99R",10
MEKFKLLAVKVEEHTAKNARAEIDYSDAPDEFQDPLMDTLMTDPVKLPSGTVMDRSIILRHLLNSPTDPFTRQMLTESMLEPVPELKERIQVWMREKQSSDL,-0.018738601,"I1M, E9V, I14H, V15T, R33Q, R46K, N71T, Q89R, A92V, H102L",10
MEKFKLLAEKVEEIVAKNMRDEIDYSDAPEEFRDPLMDTLMTDPVRLPSGTVMDRSIILRHLLNSPTDPFNRQMLTEDMLEPVVELKEKIFAWMREKKSADH,2.36473,"I1M, A19M, A21D, D30E, S78D, P84V, Q89K, Q91F, Q98K, S100A",10
IDRFKLLAEKVDNIFAKKVSAEIDYSDAPDEFRDPLMDTLMTDPVRLPSGTVMDRSIILRHLLNSPTDPFNRQMLTESMLEPVPELKEKIQAWMREKQSQDH,0.32487398,"E2D, K3R, E12D, E13N, V15F, N18K, A19V, R20S, Q89K, S100Q",10
IEKFKKLAEKVEEIVAKNAFSEIDYSDAPDEFRDPVMDTLMTDPVRLPSGTVMDRSIILRHLLNSPTDPFNRTMLTESMLEPVVELKEQIQAWIREKLSSAF,0.26029468,"L6K, R20F, A21S, L36V, Q73T, P84V, M94I, Q98L, D101A, H102F",10
IEKFKLLAEKVEAIVAKNAEAEIDYSDAPDEFRDPLMDTLMTDPVRLPSGYIMDRSIILRHLLNSPTDPFNRQPLTESMLESVPELKERIQAWIREKQSSKK,1.642204,"E13A, R20E, T51Y, V52I, M74P, P82S, Q89R, M94I, D101K, H102K",10
IEKFKLLAEKAENIVTKNAVADIDYSDAPDEFRDPLMDTLMTDPVRLPSGTVADRSIILRHLLNSPTDPFNRQPLTESMLEPVPELKEQILAWQREKQSSAH,1.331908,"V11A, E13N, A16T, R20V, E22D, M53A, M74P, Q91L, M94Q, D101A",10
IEKFKLLAEKVEQLVARNARAEIDLSDAPDEFCDPIMDTLMTDPVRLPSGTVMDRSIILRHLLNSQTDPFNRQMLTESMLEPVPELKEQIDAWLREKQSSFH,2.0743585,"E13Q, I14L, K17R, Y25L, R33C, L36I, P66Q, Q91D, M94L, D101F",10
MEQFKVLSEKVEQISAANVRAEIDYSDAPDEFRDPLMDTLMTDPVRLPSGTVMDRSTILRHLLNSPTDPFNRQMLTEDMLEPVPELKEQIQAWMREKQSSDH,1.307128,"I1M, K3Q, L6V, A8S, E13Q, V15S, K17A, A19V, I57T, S78D",10
IEKFKLLAEKVEEMVAKNAAAEIDFSDAPDEFRDPLMDTLMTDPVRLPSGTVMDRSVILRHLLNSKTDPFNRQMLTEDMLEPVVELKERIQAWMREKLSSDA,2.3687594,"I14M, R20A, Y25F, I57V, P66K, S78D, P84V, Q89R, Q98L, H102A",10
IEKFKLLGEKVEEIAAKQARAEVDYSDAPDEFRDPLMDTLMTDPVRLPSGTIMDRSIILRHLLNSPTDPFNRQMLTEDMLEPVPELKTKIQAWMREKQSSSS,1.1235653,"A8G, V15A, N18Q, I23V, V52I, S78D, E88T, Q89K, D101S, H102S",10
IEKFKLLAEKMEFVVAKNQRAEIDYSDAPDEFRDPLMDTLMTDPVRLPSGTVMDRSVILRHLLNSPTDPFNRQPLTESMLEPVPELKEQIQIWIKEKQSLDH,-1.4772054,"V11M, E13F, I14V, A19Q, I57V, M74P, A92I, M94I, R95K, S100L",10
IEKFAILAEKVEEIVAKHARDEIDLSDAPDEFKDPLMDTLMTDPVRLPSGTVMDRSIILRHLLNSPTDPFNRQMLTESMLEPVPELKERIQAWMREKGVLDH,0.40259174,"K5A, L6I, N18H, A21D, Y25L, R33K, Q89R, Q98G, S99V, S100L",10
IEKFKLLAEKVEEIVAKNAMEEIDYSDAPEEFKDPLMDTLMTDPVRLPSGTVMDRSIILRHLLNSQTDPFNRQPLTESMLEPLPELKERIQAWVREKQSSKH,2.480136,"R20M, A21E, D30E, R33K, P66Q, M74P, V83L, Q89R, M94V, D101K",10
IEKFKELAEKAEEVVAKNARQEIDFSDAPEEFRDPLMDTLMTDPVRLPSGTVMDRSIILRHLLNSPTDPFNRQMLTESMLEPVVELKEKIQAWMKEKQHSDH,-0.038433533,"L6E, V11A, I14V, A21Q, Y25F, D30E, P84V, Q89K, R95K, S99H",10
