Sequence,Score,Mutations,Number of Mutations
MDKFKLLAQKVEEIVAKNAHSEIDYSDAPEEFQDPLMDTLMTDPVKLPSGTVMDRSIILRHLLNSPTDPFNRQMLTEDMLEPVPELKEQINAWMREKQSSDH,-0.2567926,"I1M, E2D, E9Q, R20H, A21S, D30E, R33Q, R46K, S78D, Q91N",10
MEKFKLLAEKVEEIAAKAARAEIDYSDAPEEFRDPLMDTLMTDPVKLPSGTVMDRSAILRHLLNSPTDPFNRQMLTESMLEPAPELKEQIQAWIAEKQSRDH,0.54701114,"I1M, V15A, N18A, D30E, R46K, I57A, V83A, M94I, R95A, S100R",10
IEKFKLLRTQVEEIVNKHAVAEIDYSDAPDEFLDPLMDTLMTDPVRLPSGTVMDRSIILRHLLNSPTDPFNRQMLTESMLEPAPELKEKIQAWMREKQASDH,-0.20199746,"A8R, E9T, K10Q, A16N, N18H, R20V, R33L, V83A, Q89K, S99A",10
AEKFKALAARVEEIVAKNARAEIDYSDAPDEFRDPLMDTLMTDPVRLPSGTVMDRSVILRHLLNSPTDPFNRQPLTEDQLEPVPELKEQIQAWMREKLSKDH,0.9545382,"I1A, L6A, E9A, K10R, I57V, M74P, S78D, M79Q, Q98L, S100K",10
IEKFKLLAEKAEEIVAKQADAEIDYDDAPDEFRDPIMDTLMTDPVRLPSGTVMDRSIILRHLLNSSTDPFNRQMLTESMLEPVPELKEQIEAWIREKQSARH,4.082626,"V11A, N18Q, R20D, S26D, L36I, P66S, Q91E, M94I, S100A, D101R",10
IEKFKVLAEKVEEVVAKNARDEIDYSDAPDEFRDPLMDTLMTDPVRLPSGTVMDRSIILRHLLNSPTDPFTRVMLTESMLEPVPELKEQIVAWMNEKRSSVS,1.5049496,"L6V, I14V, A21D, N71T, Q73V, Q91V, R95N, Q98R, D101V, H102S",10
IEKFKSLATKVEEIVAKAARAEIDYSDAPDEFRDPLMDTLMTDPVRLPSGTVMDRPIILRHLLNSPTDPFNRQMLTEDMLEPSPELKEQILAWIRDKQSSDI,1.9468119,"L6S, E9T, N18A, S56P, S78D, V83S, Q91L, M94I, E96D, H102I",10
MESFKNLAEKCEEIVNKNIQAEIDYSDAPDEFKDPLMSTLMTDPVRLPSGTVMDRSIILRHLLNSPTDPFNRQMLTESMLEPVPELKEQIQAWMREKQSSDA,0.40907758,"I1M, K3S, L6N, V11C, A16N, A19I, R20Q, R33K, D38S, H102A",10
IEKFKELAEKVEEVVAKNARAEVDYSDAPDEFRDPLMDTLMTDPVRLPSGTVMDRSIILRHLLNSQTDPFNRSMLTPSMLEPVPELKEKIQNWMRERQSSDE,0.33851975,"L6E, I14V, I23V, P66Q, Q73S, E77P, Q89K, A92N, K97R, H102E",10
IEKFKLLAERVETIVANNARAEIDYSDAPDEFRDALMDTLMTDPVKLPSGTVMDRSIILRHLLNSPTDPFNRQMLTEDMLEPVPELKEQIFAWMHTKQRSDH,-1.9639721,"K10R, E13T, K17N, P35A, R46K, S78D, Q91F, R95H, E96T, S99R",10
IEKFKLLKKKVEEIAAENAEAEIDLSDAPDEFRDPLMNTLMTDPVRLPSGTVMDRPIILRHLLNSPTDPFNRQMLTESMLEPVPELKEQIQAWMREKQSGNH,-0.80747646,"A8K, E9K, V15A, K17E, R20E, Y25L, D38N, S56P, S100G, D101N",10
IDKFALLCEKVEEIAAKNRRAEIDVSDAPDEFRDPLMDTLMNDPVRLPSGTVMDRSVILRHLLNSPTDPFNRQMLTESMLEPVPELKEQIQAWMREKTSKDH,1.7559061,"E2D, K5A, A8C, V15A, A19R, Y25V, T42N, I57V, Q98T, S100K",10
MEKFKLLAEKVETVAAKNARAEIDYSDAPDEFKDPLMDTLMTDPVKLPSGTVMDRSVILRHLLNSPTDPFNRQMLTESMLEEVPELKQQIQAWMREKQSADH,-0.26916572,"I1M, E13T, I14V, V15A, R33K, R46K, I57V, P82E, E88Q, S100A",10
MEKFKQLAEKSEEIVAKAAAAEIDYSDAPDEFRDPLMFTLMTDPVRLPSGNVMDRSIILRHLLNSPTDPFNRQMLTESMLEPVPELKAQIQAWMRHKQSSAH,-0.114929035,"I1M, L6Q, V11S, N18A, R20A, D38F, T51N, E88A, E96H, D101A",10
MEKFKLLAEKVEEMAAKNALAEIDFSDAPDEFRDPLMDTLMTDPVRLPSGTVMDRSVILRHLLNSSTDPFNRQMLTESMLEPLPELKEQIRAWIREKQSSDH,0.31113675,"I1M, I14M, V15A, R20L, Y25F, I57V, P66S, V83L, Q91R, M94I",10
IEKFKLLAEKVEQIVAKNARAEIDLSDAPEEFRDPVMDTLMTDPVRLPSGTVMDRSIILRHLLNSPTDPFSRQELTEDMLEPVPELKEQIRAWMREKLSSKH,0.68908775,"E13Q, Y25L, D30E, L36V, N71S, M74E, S78D, Q91R, Q98L, D101K",10
MEKFKLLAEKVEEAVENNARADIDFSDAPDEFRDPLMDTLMTDPVRLPSGNVMDRSIILRHLLNSPTDPFNRQMLTEDMLEPVPELKEQIQEWMREKLSSDH,0.0842998,"I1M, I14A, A16E, K17N, E22D, Y25F, T51N, S78D, A92E, Q98L",10
IEKFKLLKEKTEEVVAKHARAEIDYSDAPDEFRDPLMDTLMTDPVRLPSGTVMDRAIILRHLLNSPTDPFNRQMLTEDMLEPVPELKEQIQAWLREKMSRTH,0.3715127,"A8K, V11T, I14V, N18H, S56A, S78D, M94L, Q98M, S100R, D101T",10
IEKFKTLAEKVEEINAKAALAGIDYEDAPDEFKDPLMDTLMTDPVRLPSGTVMDRSIILRHLLNSPTDPFNRQMLTESMLEPVPELKAQIQAWMKEKQSLDH,-1.1034975,"L6T, V15N, N18A, R20L, E22G, S26E, R33K, E88A, R95K, S100L",10
MAKFKLLSEKCEEIVAQNARAEIDFSDAPDEFRDPLMDTLMTDPVRLPSGTVMDRSIILRHLLNSPTDPFNRKMLTEDMLEPVPELKEQIQAWMRQKQSSPH,-1.1288161,"I1M, E2A, A8S, V11C, K17Q, Y25F, Q73K, S78D, E96Q, D101P",10
IEKFKLLAEKVEEIQAKNNRADIDYSDAPEEFRDPLMSTLMTDPVRLPSGNIMDRSIILRHLLNSPTDPFNRQPLTESMLEPVPELKEQIQAWIKEKQSSDH,-0.945081,"V15Q, A19N, E22D, D30E, D38S, T51N, V52I, M74P, M94I, R95K",10
LAKFKLLAEKVEEIAQKNARAEIDYSDAPDEFRDPLMDTLMTDPVRLPSGHVMDRSVILRHLLNSPTDPFTRQQLTESMLEPVPELKEQIQAWIREKLSSDH,3.3252096,"I1L, E2A, V15A, A16Q, T51H, I57V, N71T, M74Q, M94I, Q98L",10
IEKFKLLAEKVEEVAAGNARTEIDLSDAPDEFRDPIMDTLMTDPVRLPSGTVMDRSIIARHLLNSPTDPFNRQMLTESMLEPVVELKEQIQAWMRERQSTDH,3.316516,"I14V, V15A, K17G, A21T, Y25L, L36I, L59A, P84V, K97R, S100T",10
IEKLSTLAEKVEEIVAKNARAEIDLSDAPDEFRDPLMDTLMTDPVRLPSGSIMDRSIILRHLLNSPTDPFNRQMLTESMLEPAPELKEQIQNWIREKQASDH,1.1581025,"F4L, K5S, L6T, Y25L, T51S, V52I, V83A, A92N, M94I, S99A",10
IEKFCLLAEKVEEIVNKNARAEVDYSDAPDEFRDPIMGTLMTDPVRLPSGTVMDRSIILRHLLNSETDPFNRQMLTESMLEPAPELKEKIQEWMREKVSSDH,-0.253559,"K5C, A16N, I23V, L36I, D38G, P66E, V83A, Q89K, A92E, Q98V",10
IEKFKQLASKVEEIVAKNTRAEIDYSDAPDEFKDPIMDTLMTDPVRLPSGTIMDRSIILRHLLNSPTDPFNRQPLTEDMLEPVPELKEQIQAWMRGKVSSDH,4.442724,"L6Q, E9S, A19T, R33K, L36I, V52I, M74P, S78D, E96G, Q98V",10
MEKFKLLCEKVNEIVAKNMRAEVDYSDAPEEFRDPLMDTLMTDPVKLPSGTVMDRSIILRHLLNSPTDPFNRQPLTESMLEPVPELKERIQAWMREKQSSAH,0.34939307,"I1M, A8C, E12N, A19M, I23V, D30E, R46K, M74P, Q89R, D101A",10
AEKFKLLAEKVEQIVAKNAAAEIDYSDAPDEFRDPLMDTLMTDPVRLPSGTVVDRSVILRHLLNSPTDPFNRQPLTESMLEPVPELKERIQAWMREKKSSCN,3.718099,"I1A, E13Q, R20A, M53V, I57V, M74P, Q89R, Q98K, D101C, H102N",10
MENFKLLCEKVEDIVAKNARAEIDYSDAPDEFRDPLMDTLMEDPVKLPSGTVMDRSVILRHLLNSPTDPFNRQMLTESSLEPVPELKQRIQAWMREKQSSDH,-0.28579783,"I1M, K3N, A8C, E13D, T42E, R46K, I57V, M79S, E88Q, Q89R",10
IERFKLLAEKVEHIVAKNQRAEIDYSDAPEEFRDPLMDTLMTDPVRLPSGTVMDRSVILRHLLNSQTDPFNRQMLTESMLEPVPELKERINAWMQEKQISDH,0.3578742,"K3R, E13H, A19Q, D30E, I57V, P66Q, Q89R, Q91N, R95Q, S99I",10
IEKFKELTEKVEKIVAENAREEIDYSDAPDEFRDPLMDTLMTDPVKLPSGTVMDRSIIMRHLLNSPTDPFNRQMLTESMLEPAPELKEQIQAWMREKQRSDR,0.12665837,"L6E, A8T, E13K, K17E, A21E, R46K, L59M, V83A, S99R, H102R",10
MEKFKLLREKMEEIVAKNARDEIDFSDAPEEFRDPLMDTLMTDPVRLPSGTIMDRSVILRHLLNSPTDPFNRQMLTESMLEPVPELKEQIQAWRREKQSSQH,1.2901063,"I1M, A8R, V11M, A21D, Y25F, D30E, V52I, I57V, M94R, D101Q",10
IEKFKHLATKCEELAAKNARNEIDYSDAPEEFRDPLMDTLMTDPVRLPSGTVMDRSIILRHLLNSPTDPFNRQMLTESMLEPVPELKEQIQAWMQEKLSSTH,-0.09148979,"L6H, E9T, V11C, I14L, V15A, A21N, D30E, R95Q, Q98L, D101T",10
IEKFTELSEKVEAIVARNADAEIDYSDAPDEFRDPLMDTLMTDPVRLPSGTVMDRSIILRHLLNSPTDPFNRQRLTESMLEPVPELKEQIEAWMREKQTSSH,0.7467193,"K5T, L6E, A8S, E13A, K17R, R20D, M74R, Q91E, S99T, D101S",10
MEKIKLLAEKVKEIAAKNAMAEIDLSDAPDEFRDPLMDTLMTDPVRLPSGHVMDRSIILRHLLNSPTDPFNRQMLTESMLEPVPELKEQIQAWRREKGLSDH,1.1780286,"I1M, F4I, E12K, V15A, R20M, Y25L, T51H, M94R, Q98G, S99L",10
IEKFKQLAEKVEEISQKNARAEIDYSDAPDEFRDPLMDTLMVDPVRLPSGTVMDRSVILRHLLNSPTDPFSRAMLTESMLEPVVELKEQILAWRREKQSSDH,0.24717325,"L6Q, V15S, A16Q, T42V, I57V, N71S, Q73A, P84V, Q91L, M94R",10
VELFKLLAEKVEEIGAKNAREEIDYSDAPEEFTDPLMDTLMTDPVRLPSGTVMDRSVILRHLLNSPTDPFNRKMLTESMLEPAPELKEQIQAWMREKQGSDH,-1.0815697,"I1V, K3L, V15G, A21E, D30E, R33T, I57V, Q73K, V83A, S99G",10
IEKFKLLNEKVEEIVAKQAKMEIDYSDAPEEFRDPLMDTLMTDPVRLPSGHVMDRSIILRHLLNSPTDPFNRSMLTENMLEPVPELKERIQAWMREKISSDH,1.72737,"A8N, N18Q, R20K, A21M, D30E, T51H, Q73S, S78N, Q89R, Q98I",10
IEAFKTLAEKVEMIVAKNARAEIDYSDAPDEFRDPLMNTLMTDPVRLPSGTVMDRSIIVRHLLNSPTDPFNRQMLTESMLEPVPELKEKIQTWMRRKQSSKK,-2.0415263,"K3A, L6T, E13M, D38N, L59V, Q89K, A92T, E96R, D101K, H102K",10
ISKFKLLCEKVENVVAKNARAEIDYEDAPDEFRDPLMDTLMTDPVKLPSGTVMDRSIILRHLLNSPTDPFNRQPLTESMLEPCPELKEQIQAWIREKQSSDS,2.1056812,"E2S, A8C, E13N, I14V, S26E, R46K, M74P, V83C, M94I, H102S",10
IEKFKLLAEKIEEIVATNNRDEVDYSDAPDEFRDPLMDTLMTDPVKLPSGNVMDRSIILRHLLNSPTDPFNRQKLTESMLEPVPELKEKIQAWMREKQISDH,1.6386939,"V11I, K17T, A19N, A21D, I23V, R46K, T51N, M74K, Q89K, S99I",10
IERFALLCEKVEQIAAANARAEIDLSDAPDEFRDPLMDTLMTDPVRLPSGTVMDRSIILRHLLNSPTDPFNRQMLTESMLEPVPELKEQIQAWRREKQSHDM,0.42883003,"K3R, K5A, A8C, E13Q, V15A, K17A, Y25L, M94R, S100H, H102M",10
AEKLRLLAEKVEEIVAEKAAAEIDYSDAPDEFRDPLMHTLMTDPVRLPSGTVMDRSIILRHLLNSPTDPFNRQELTESMLEPAPELKEQIQAWMREKQQSDH,-1.5308055,"I1A, F4L, K5R, K17E, N18K, R20A, D38H, M74E, V83A, S99Q",10
IERFKLLAEKATEISAKNARAEIDYSDAPDEFRDPLMDTLMTDPVRLPSGTVMDRAVILRHLLNSPTDPFNRQMLTEDMLEPVPELREKIQAWMREKQSSDQ,0.91603047,"K3R, V11A, E12T, V15S, S56A, I57V, S78D, K87R, Q89K, H102Q",10
IEKFKLLGVKVEEQVAKNAREEIDYGDAPEEFRDPIMDTLMTDPVRLPSGTVMDRSIILRHLLNSPTDPFNRQMLEESMLEPVPELKEQIQAWIREKQSSRH,4.38806,"A8G, E9V, I14Q, A21E, S26G, D30E, L36I, T76E, M94I, D101R",10
IEKFELLAAKVEEILAKNARAEIDDSDAPDEFRDPLMDTLMTDPVKLPSGTVMDRSIILRHLLNSPTDPFNRSMLTESMLEPVPELKEQIQAWVREKRRSGH,0.32692313,"K5E, E9A, V15L, Y25D, R46K, Q73S, M94V, Q98R, S99R, D101G",10
IEKYKALAEKVEEIVAKNAAAEIDYSDAPDEFRDPLMDTLMTDPVKLPSGTVMDRPIILRHLLNSQTDPFNRQMLTEDMLETVPELKERIQAWMREKQKSDH,0.90427375,"F4Y, L6A, R20A, R46K, S56P, P66Q, S78D, P82T, Q89R, S99K",10
ITNFRLLAEKVEEIVAQNARSEIDYSDAPDEFKDPLMDTLMTDPVRLPSGTIMDRSVILRHLLNSPTDPFNRQMLTESMLEPVPELKEQIQAWMRQKQSSDI,0.9667901,"E2T, K3N, K5R, K17Q, A21S, R33K, V52I, I57V, E96Q, H102I",10
IEKFKLLAQKVEEVVARNARAEIDYSDAPEEFRDPLMDTLMTDPVRLPSGTVMDRSIILRHLLNSPTDPFNRQALTESMLEPVTELKEQIRAWMKEKQSLDQ,-1.6857297,"E9Q, I14V, K17R, D30E, M74A, P84T, Q91R, R95K, S100L, H102Q",10
IEKFALLAEKCEEIVAKSARAEVDYSDAPEEFRDPLMNTLMTDPVRLPSGTVMDRSIILRHLLNSPTDPFNRQMLTESMLEPVPELKEQIQTWIREKVSADH,-0.8984465,"K5A, V11C, N18S, I23V, D30E, D38N, A92T, M94I, Q98V, S100A",10
IEKFKLLAEKVEEIVAKNQRAEIDYSDAPEEFRDPLMDTLMTDPVRLPSGHVMDRSVILRHLLNSPTDPFNRQMLTESQLESVPELKEQIQAWIREKLHSDT,2.0107696,"A19Q, D30E, T51H, I57V, M79Q, P82S, M94I, Q98L, S99H, H102T",10
IEKFRLLEEKVEELVAENSMTEIDYSDAPDEFRDPLMDTLMTDPVRLPSGTIMDRSIILRHLLNSPTDPFNRQMLTESELEPVPELKEQIQAWMREKQSVDH,1.2569487,"K5R, A8E, I14L, K17E, A19S, R20M, A21T, V52I, M79E, S100V",10
IEKFKLLCHKVEEITMKNARAEIDYSDAPEEFRDPLMDTLMTDPVRLPSGNVMDRSIILRHLLNSPTDPFNRQMLTEDMLEPVPELKEQISAWMRENQSCDH,1.5633287,"A8C, E9H, V15T, A16M, D30E, T51N, S78D, Q91S, K97N, S100C",10
IEKFKLLKVKVEELVAINARAEIDLSDAPDEFRDRLMDTLMTDPVRLPSGTIMDRSIILRHLLNSPTDPFNRQMLTESMLEPVPELKEKIQAWMREKQKSDK,-2.0667686,"A8K, E9V, I14L, K17I, Y25L, P35R, V52I, Q89K, S99K, H102K",10
IEKFKLLAQRVEEIAAKNQRAEIDYSDAPDEFKDPLMDTLMTDPVRLPSGTIMDRSIILRHLLNSPTDPFNRQMLTEDMLEPVPELKEQIEAWLRQKQSSDH,1.5022988,"E9Q, K10R, V15A, A19Q, R33K, V52I, S78D, Q91E, M94L, E96Q",10
IEKFKLLAAKVEAIAAKNARAEIDYSDAPDEFRDQLMDTLMTDPVRLPSGKVMDRSIILRHLLNSPTDPFNRQPLTEDMLEPVPELKEQIQAWMREKQVSHL,-0.9547134,"E9A, E13A, V15A, P35Q, T51K, M74P, S78D, S99V, D101H, H102L",10
IEKFTLLASKVEAIAAQNARSEIDYSDAPDEFRDPLMDTLMTDPVRLPSGHVMDRSIIMRHLLNSPTDPFNRQPLTESMLEPVPELKEQIQAWMQEKQSSDH,0.17834607,"K5T, E9S, E13A, V15A, K17Q, A21S, T51H, L59M, M74P, R95Q",10
IAEFKSLAEKVEEIVAKNARMEIDYSDAPDEFRDPLMDTLMTDPVRLPSGTVMDRKIILRHLLNSPTDPFNRQPLTEEMLEPVPELKEQIQAWLREKDSADH,0.76982665,"E2A, K3E, L6S, A21M, S56K, M74P, S78E, M94L, Q98D, S100A",10
IEKFKRLAVQVEEIVAKNSSAEIDYSDAPDEFRDPLMDTLMTDPVRLPSGTVMDRTVILRHLLNSPTDPFNRQMLTESMLEPVPELKEKIQAWMREKLSKDH,-0.1520853,"L6R, E9V, K10Q, A19S, R20S, S56T, I57V, Q89K, Q98L, S100K",10
MEKFKLLAEKAEEIVAANARDEIDLSDAPEEFRDPLMCTLMTDPVRLPSGTVMDRSIILRHLLNSPTDPFNRQMLTESMLEPVPELKEQIQAWMRQKQLSRH,1.2666785,"I1M, V11A, K17A, A21D, Y25L, D30E, D38C, E96Q, S99L, D101R",10
IEKFKLLNEKYEEIVEKNNRDEIDYSDAPDEFRDPLMDTLMTDPVRLPSGTVMDRSVILRHLLNSPTDPFNRQMLTEDMLEPVPELKEQIQAWIREKKGSDH,3.4001913,"A8N, V11Y, A16E, A19N, A21D, I57V, S78D, M94I, Q98K, S99G",10
IEKFKLLANKVEEIVAKNNRMEIDYSDAPDEFRDPIMDTLMTDPVRLPSGTVMDRSIIRRHLLNSPTDPFNRQPLTESMLEPVTELKEQIQAWIRNKLSSDH,2.6296072,"E9N, A19N, A21M, L36I, L59R, M74P, P84T, M94I, E96N, Q98L",10
IEKFKLLQTKVEEIAAKNAMAEIDYSDAPDEFRDPIMDTLMTDPVRLPSGTVMDRSVILRHLLNSPTDPFNRQMLTESMLEPLPELKEQIQAWMREKTDSDA,4.9962425,"A8Q, E9T, V15A, R20M, L36I, I57V, V83L, Q98T, S99D, H102A",10
IEKFKLLGKKAEEIAAANAREEMDYSDAPDEFRDKLMDTLMTDPVRLPSGTVMDRAIILRHLLNSPTDPFNRQMLTESMLEPVPELKEKIQAWMREKQSSDH,1.5095778,"A8G, E9K, V11A, V15A, K17A, A21E, I23M, P35K, S56A, Q89K",10
INKFKLLAGKVEEIVQKNARAEIDLSDAPEEFVDPLMDTLMTDPVRLPSGHVMDRSIILRHLLNSPTDPFNRQMLTESMLEPAPELKERIQAWMRNKQSSDH,-1.4708238,"E2N, E9G, A16Q, Y25L, D30E, R33V, T51H, V83A, Q89R, E96N",10
IEKFKLLKHRIEEIVAKKARAEIDYSDAPDEFRDKLMDTLMTDPVRLPSGTVMDRSIILRHLLNSPTDPFNRQMLTESQLESVPELKEQIQAWMREKQGSLH,-1.1171453,"A8K, E9H, K10R, V11I, N18K, P35K, M79Q, P82S, S99G, D101L",10
IEEFKLLAEKVEEIVAKNAYAEIDYSDAPEEFKDPLMDTLMTDPVRLPSGIVMDRSIIARHLLNSPTDPFNRSMLTESMLEPVVELKERIQAWMREKGSSDH,2.2947943,"K3E, R20Y, D30E, R33K, T51I, L59A, Q73S, P84V, Q89R, Q98G",10
IEKFKLLAEKMEKIVAKNQLAEIDYSDAPDEFRDPLMDTLMTDPVRLPSGTVMDRSVILRHLLNSQTDPFNRQMLTEDMLEPVPELKERIQAWMREKESSDT,1.6755724,"V11M, E13K, A19Q, R20L, I57V, P66Q, S78D, Q89R, Q98E, H102T",10
IEKFALLAEKCEAIVAKNARSEIDYADAPEEFRDPLMDTLMTDPVRLPSGTVMDRSIILRHLLNSPTDPFNRQMLTEDVLEPVPELKEQIQAWMREKQSRDA,-0.48310083,"K5A, V11C, E13A, A21S, S26A, D30E, S78D, M79V, S100R, H102A",10
IEKFKELAEKVESIAAENATAEVDYSDAPDEFRDPLMDTLMTDPVRLPSGTVMDRSIILRHLLNSNTDPFNRQMLTEEMLDPVPELKEQIDAWMREKQSSDH,1.4258928,"L6E, E13S, V15A, K17E, R20T, I23V, P66N, S78E, E81D, Q91D",10
MEKFKALVEKVEEIVAKNARLEIDWSDAPDEFRDPLMDTLMTDPVRLPSGTVMDRPIILRHLLNSPTDPFNRQMLTESMLEPVPELKEKIQAWIHEKQSGDH,0.91899574,"I1M, L6A, A8V, A21L, Y25W, S56P, Q89K, M94I, R95H, S100G",10
KEKFKLLAEKVDLIVAKNMEADIDWSDAPEEFRDPLMDTLMTDPVRLPSGTVMDRSIILRHLLNSPTDPFNRQMLTESMLEPVPELKEQIQAWMAEKQKSDH,2.562879,"I1K, E12D, E13L, A19M, R20E, E22D, Y25W, D30E, R95A, S99K",10
VEKFKLLAEKVEEIVAAKAREEIDYSDAPDEFRDPIMDTLMTDPVRLPSGNVMDRSIILRHLLNSPTDPFNRQMLVEDMLESVPELKEQIQAWMREKQSSDL,1.9599137,"I1V, K17A, N18K, A21E, L36I, T51N, T76V, S78D, P82S, H102L",10
MEKFKLLAEKVEEINAQNADAEIDYSDAPDEFRDPLMDTLMVDPVRLPSGNVMDRSIILRHLLNSPTDPFSRQPLTESMLIPVTELKEQIQAWMREKQSSDH,-0.76182425,"I1M, V15N, K17Q, R20D, T42V, T51N, N71S, M74P, E81I, P84T",10
MEKFKLLAEKVKEINAKNARDEIDYSDAPDEFRDPLMDTLMTDPVRLPSGTIMDRSIILRHLLNSPTDPFNRQMLTEDMLEPAAELKSQIQAWMREKMSSDH,0.07873076,"I1M, E12K, V15N, A21D, V52I, S78D, V83A, P84A, E88S, Q98M",10
ISKFKLLAEKVEEVVAKNAMAEVDLSDAPDDFRDPIMDTLMTDPVRLPSGTVMDRSIILRHLLNSPTDPFNRQMLTESMLEPVPELKEQIQAWMQEKQLSDT,3.1000037,"E2S, I14V, R20M, I23V, Y25L, E31D, L36I, R95Q, S99L, H102T",10
IEKFKLLAEKAEEIAAKNARAEIDLGDAPLEFRDPIMDTLMTDPVRLPSGTVMDRSIILRHLLNSPTDPFNRQMLTEDMLEPEPELKEKIQAWMREKQQSDH,3.9935594,"V11A, V15A, Y25L, S26G, D30L, L36I, S78D, V83E, Q89K, S99Q",10
IEKFKLLVERVEEIFAENLRAEIDLSDAPDEFRDPLMDTLMTDPVKLPSGTIMDRSIILRHLLNSPTDPFNRQMLTESMLEPVPELKEKIQAWMREKQSSDK,1.9987801,"A8V, K10R, V15F, K17E, A19L, Y25L, R46K, V52I, Q89K, H102K",10
MEKMKLLQTKVEELLAKNALAEIDYSDAPDEFRDPLMDTLMTDPVRLPSGTVMDRSIILRHLLNSPTDPFNRQMLTESMLEPVTELKDQIQAWVREKQSSDH,0.16880755,"I1M, F4M, A8Q, E9T, I14L, V15L, R20L, P84T, E88D, M94V",10
GEKFKLLAAKVEEIAAKNARAEIDYSDAPDEFRDPIMDTLMTDPVRLPSGTIMDRSIILRHLLNSPTDPFNRQMLTESMLEPVPELREKIQAWMRQKASSCH,1.6337856,"I1G, E9A, V15A, L36I, V52I, K87R, Q89K, E96Q, Q98A, D101C",10
IEKFKLLAEKVEEIAAKNAASEIDLSDAPDEFRDPLMDTLMTDPVRLPSGTIMDRKVILRHLLNSPTDPFNRQMLTESMLEPVPELKEKIQAWMRQKQSSDT,2.5518074,"V15A, R20A, A21S, Y25L, V52I, S56K, I57V, Q89K, E96Q, H102T",10
IEGFKLLAAKVEEIVAKNARAEIDYSDAPDEFKDPIMDTLMTDPVRLPSGNVMDRSVILRHLLNSPTDPFNRQMLTESMLEPSPELKEKISAWMREKQSADH,1.9291198,"K3G, E9A, R33K, L36I, T51N, I57V, V83S, Q89K, Q91S, S100A",10
IERFKRLEEKVEEVNAKNARLEIDYSDAPDEFRDPLMDTLMTDPVRLPSGTVMDRSIILRHLLNSPTDPFNRQMLTEEMLESVPELKEQIQAWMREKQSTNH,-0.5930145,"K3R, L6R, A8E, I14V, V15N, A21L, S78E, P82S, S100T, D101N",10
MSKFKLLAEKVEEIVAKNKIDEIDYSDAPDDFRDPLMNTLMTDPVKLPSGTVMDRSIILRHLLNSPTDPFNRKMLTESMLEPVPELKEQIQAWMREKQSNDH,-1.1777005,"I1M, E2S, A19K, R20I, A21D, E31D, D38N, R46K, Q73K, S100N",10
IEKFKELAEKVNEIVEQNAREEIDFSDAPEEFRDPLMDTLMTDPVRLPSGTVMDRSIILRHLLNSPTDPFNRQMLTESMLEPVPELKEKIQAWRREKQSSHH,0.29924875,"L6E, E12N, A16E, K17Q, A21E, Y25F, D30E, Q89K, M94R, D101H",10
IEDLRLLEEKVEEIVAKNARDEIDYSDAPDEFMDPLMDTLMTDPVRLPSGTVMDRSIIQRHLLNSPTDPFNRQMLTESMLEPVPELKEQIHAWMRTKQPSDH,0.61098623,"K3D, F4L, K5R, A8E, A21D, R33M, L59Q, Q91H, E96T, S99P",10
AEKFKLLAEKMEEAVAKNAREEIDYSDAPEEFRDPLMDTLMTDPVRLPSGNVMDRSIILRHLLNSPTDPFNRQPLTEDMLEPVPELKERIQAWMREKQVSDH,1.372114,"I1A, V11M, I14A, A21E, D30E, T51N, M74P, S78D, Q89R, S99V",10
IEKFKLLAEKVEEIVAANAPAEIDLSDAPDDFRDPIMDTLMTDPVRLPSGTVMDRAIILRHLLNSPTDPFNRQMLTESMLEPSPELKTQIQAWMREKQGSDE,3.3257978,"K17A, R20P, Y25L, E31D, L36I, S56A, V83S, E88T, S99G, H102E",10
IESFKLLAEKVQEIVAKSANAEVDYSDAPDEFRDPLMDTLMTDPVRLPSGTVMDRSIILRHLLNSPTDPFSRQMLTEEMLEPVPELKEQIQAWIEEKSSSDH,0.11094674,"K3S, E12Q, N18S, R20N, I23V, N71S, S78E, M94I, R95E, Q98S",10
IEKFKLLAKKVEQAAAKNAREEIDYSDAPDEFRDPLMDTLMTDPVRLPSGTVVDRSIILRHLLNSPTDPFNRQMLTEDMLEPVPELKERIQAWMKEKLSSDH,1.4799143,"E9K, E13Q, I14A, V15A, A21E, M53V, S78D, Q89R, R95K, Q98L",10
IEKFKLLAEKSEEIAAKNAEAEIDLSDAPDEFLDPLMDTLMTDPVRLPSGTVMDRSIILRHLLNSPTDPFNRQMLTEDMLESLPELKEQIQAWMREKMSSNH,0.3575214,"V11S, V15A, R20E, Y25L, R33L, S78D, P82S, V83L, Q98M, D101N",10
IVKFKLLAEKIDQIVAKNQRAEIDLSDAPDEFRDPLMDTLMTDPVRLPSGTVMDRSIILRHLLNSPTDPFNRQPLTEDMLEPVTELKEQIQAWMKEKQSSDH,-1.5001459,"E2V, V11I, E12D, E13Q, A19Q, Y25L, M74P, S78D, P84T, R95K",10
VEKFKLLAEKVEEIVAKNARGEIDYSDAPEEFRDPLMDTVMTDPVRLPSGRVMDRSIIFRHLLNSPTDPFNRQMLTESMLEPVPELKEQIQQWQREKFSSHH,0.3393231,"I1V, A21G, D30E, L40V, T51R, L59F, A92Q, M94Q, Q98F, D101H",10
PEDFKLLAEKVEQIVAKNARAEIDYSDAPEEFKDPLMDTLMTDPVRLPSGTVMDRSIILRHLLNSPTDPFNRQMLTEQMLEPVPELKEKIQAWMQEKLASDH,-0.74182427,"I1P, K3D, E13Q, D30E, R33K, S78Q, Q89K, R95Q, Q98L, S99A",10
IEKFKLLAEKYEEITAENARAEIDYDDAPDEFKDPIMETLMTDPVRLPSGTVMDRSIILRHLLNSPTDPFNRQMLTESMLEPVPELKDQIQAWMREKLHSDH,2.4222755,"V11Y, V15T, K17E, S26D, R33K, L36I, D38E, E88D, Q98L, S99H",10
IEKFKLLAEKVEETAAKIARAEIDFSDAPDEFRDPLMDTLMTDPVRLPSGTVMDRSIILRHLLNSPTDPFNRQMLTEDMLEPVPELKEQIRAWLREKLSSTE,-0.49894375,"I14T, V15A, N18I, Y25F, S78D, Q91R, M94L, Q98L, D101T, H102E",10
IGKFKLLAEKADEAVKKNAGAELDYSDAPDEFRDPLMDTLMTDPVRLPSGNVMDRSIILRHLLNSQTDPFNRQMLTESMLEPVPELKEQIQAWMRRKQSSDH,-0.91949844,"E2G, V11A, E12D, I14A, A16K, R20G, I23L, T51N, P66Q, E96R",10
TEKFSLLAERVEELAAKNARAEIDYSDAPDEFRDSLMDTLMTDPVRLPSGTIMDRSIILRHLLNSPTDPFTRQPLTESMLEPVPELKEQIQAWMREKQTSDH,-0.803642,"I1T, K5S, K10R, I14L, V15A, P35S, V52I, N71T, M74P, S99T",10
IEKFKELAEKVEEIVAKNAREEIDYSDAPEEFRDPLMDTLMTDPVRLPSGTIMDRTIILRHLLNSPTDPFNRQMLTEDMLEPVPELKERIQAWLKEKQSSDV,0.18595897,"L6E, A21E, D30E, V52I, S56T, S78D, Q89R, M94L, R95K, H102V",10
IEKFKLLAERCNEIVAKNANAEIDYSDAPDEFRDPLMDTLMTDPVRLPSGTIMDRKIILRHLLNSPTDPFNRQMLTESQLEPLPELKEQIQRWMREKQSSPH,-0.8920497,"K10R, V11C, E12N, R20N, V52I, S56K, M79Q, V83L, A92R, D101P",10
MEKFKLLAEKVEEIVAKRARADVDYSDAPEEFRDPIMDTLMTDPVRLPSGTVMDRSVILRHLLNSPTDPFNRQMLTESMLEPVPELKAQIQAWMKEKISSDH,1.0250683,"I1M, N18R, E22D, I23V, D30E, L36I, I57V, E88A, R95K, Q98I",10
MEKFSNLAEKVEEAAAKNARAEIDYSDAPDEFRDPLMFTLMTDPVRLPSGTVMDRSIILRHLLNSPTDPFNRQPLTESMLESVPELKAQIQAWMREKSSSDH,0.10870157,"I1M, K5S, L6N, I14A, V15A, D38F, M74P, P82S, E88A, Q98S",10
IEKFKLLAEQVDEIVAKNARDEIDYSDAPDEFRDPLMDTLMVDPVRLPSGNIMDRSIILRHLLNSPTDPFNRQMLTEDMLEPVPELKEQIQAWMREKLSVDR,1.2076635,"K10Q, E12D, A21D, T42V, T51N, V52I, S78D, Q98L, S100V, H102R",10
IELFKQLGEAVEEIVAKNNRLEEDYSDAPEEFRDPLMDTLMTDPVRLPSGHVMDRSIILRHLLNSPTDPFNRQMLTESMLEPVPELKEQIQAWMKEKQSSDH,-0.40577084,"K3L, L6Q, A8G, K10A, A19N, A21L, I23E, D30E, T51H, R95K",10
IGKFKLLAEKVDEIVAKNARAEIDYSDAPDEFLDPLMQTLMTDPVRLPSGTVADRSIILRHLLNSPTDPFNRQMLTESMLEPAPELKERIQAWMREKGRLDH,-1.1140254,"E2G, E12D, R33L, D38Q, M53A, V83A, Q89R, Q98G, S99R, S100L",10
IEKFKLLCEKVEEIAAKNATAEIDYSDAPDEFRDPIMDTLMTDPVKLPSGTVMDRSIILRHLLNSKTDPFNRQPLTESMLEPAPELKEQIQAWIREKQSSDE,3.028756,"A8C, V15A, R20T, L36I, R46K, P66K, M74P, V83A, M94I, H102E",10
IEKFKLLSERVEQINAQNAQAEIDYSDAPDEFRDPLMDTLMTDPVKLPSGTVMDRSIILRHLLNSPTDPFNRQMLTESMLEPVPELKEQIDAWMREKQSADE,0.3770538,"A8S, K10R, E13Q, V15N, K17Q, R20Q, R46K, Q91D, S100A, H102E",10
IRKFKLLAEKVEEIVALNSRAEIDMSDAPDEFRDPLMDTLMIDPVRLPSGTIMDRSIILRHLLNSPTDPFNRQKLTESMLEPVPELKEQIVAWMREKQHQDH,-0.25071552,"E2R, K17L, A19S, Y25M, T42I, V52I, M74K, Q91V, S99H, S100Q",10
IEDFKLLAEKIEELSAKNGAKEIDYSDAPDEFRDPLMDTLMTDPVKLPSGTVMDRSIILRHLLNSPTDPFNRQMLTESMLEPVPELKERIQAWMREKQSQDH,1.0230253,"K3D, V11I, I14L, V15S, A19G, R20A, A21K, R46K, Q89R, S100Q",10
IEKFALLAEKVEEMVAKNAREEIDYSDAPDEFRDPLMDTLMTDPVRLPSGNVMDRSIILRHLLNSPTDPFNRQTLNEEMLEPVPELKEQIQAWLREKQRSDA,0.9120059,"K5A, I14M, A21E, T51N, M74T, T76N, S78E, M94L, S99R, H102A",10
IEKFKVLAEKVNMINAKNNRAEIDYSDAPDEFRDPLMDTLMTDPVRLPSGTVMDRSIILRHLLNSPTDPFNRQMLTESMLEPLPELKDRIQAWIREKLSSDH,-0.7396966,"L6V, E12N, E13M, V15N, A19N, V83L, E88D, Q89R, M94I, Q98L",10
IEKFKELAQKVNEIVAKNARAEIDYSDAPEEFRDPLMDTLMTDPVRLPSGNVMDRSIILRHLLNSPTDPFNRQMLAESMLEPVVELKNQIQAWMAEKQKSDH,-0.6339938,"L6E, E9Q, E12N, D30E, T51N, T76A, P84V, E88N, R95A, S99K",10
IEKFKELAVKVEEMVAANSRAEIDYSDAPDEFRDPLMGTLMTDPVKLPSGTVADRSIILRHLLNSPTDPFNRQMLTESMLEPLPELKEQIEAWMREKQSSDH,-1.920628,"L6E, E9V, I14M, K17A, A19S, D38G, R46K, M53A, V83L, Q91E",10
IEKFKLLSKKVEEIVAKNAREEIDFSDVPDEFRDPLMDTLMTDPVRLPSGTVMDRSVILRHLLNSPTDPFNRQPLTESMLEPVPELKEQIVAWMREKKQSDH,2.0959454,"A8S, E9K, A21E, Y25F, A28V, I57V, M74P, Q91V, Q98K, S99Q",10
IEKFKLLSEKCEEIAAKKASLEIDYSDAPDEFRDPLMDTLMTDPVRLPSGTVADRSIILRHLLNSPTDPFNRQMLTEAMLEPLPELKEQIQAWIREKQSSDH,0.9275397,"A8S, V11C, V15A, N18K, R20S, A21L, M53A, S78A, V83L, M94I",10
IERFKLLAEKVSEISARNARAEIDYSDAPDEFRDPLMDTLMTDPVRLPSGNVMDRAVILRHLLNSPTDPFNRQMLTESMLEPVVELKEQIAAWMREKQSFDH,-0.40792596,"K3R, E12S, V15S, K17R, T51N, S56A, I57V, P84V, Q91A, S100F",10
IGKFKGLAEKVEEIAAANARAEIDYSDAPEEFRDPLMDTLMTDPVRLPSGTVMDRSIILRHLLNSPTDPFNRQMLTEAMLEPVPELKEQIQAWMVAKRSSDA,1.2433394,"E2G, L6G, V15A, K17A, D30E, S78A, R95V, E96A, Q98R, H102A",10
IEKFKLLCEKVEEIAAEDARAEIDYSDAPDEFRDPLMDTLMADPVRLPSGNVMDRSIILRHLLNSPTDPFNREMLTESMLEPVPELKEQIQAWMREKQSQRK,-0.16609462,"A8C, V15A, K17E, N18D, T42A, T51N, Q73E, S100Q, D101R, H102K",10
IEKFKLLGEKVEEIVAAEARAEIDYSDAPEEFRDPLMDTLMTDPVRLPSGKVMDRSIILRHLLNSPTDPFNREMLTESMLEPAPELKEQIQAWKREKKSSAH,-0.71562004,"A8G, K17A, N18E, D30E, T51K, Q73E, V83A, M94K, Q98K, D101A",10
IEKFKELASKVEEIVAKNAGAEIDYSDAPAEFRDPLMDTLMTDPVRLPSGNVMDRSVILRHLLNSPTDPFNRQMLTEDMLEPVTELKERIQAWMKEKQSSDH,-0.89833504,"L6E, E9S, R20G, D30A, T51N, I57V, S78D, P84T, Q89R, R95K",10
IEKFKLLAEKVEEIVSKNAASEIDYSDAPDEFRDPVMDTLMTDPVRLPSGTVMDRSIILRHLLNSPTDPFNRQMLTESMLEPVPELKERIQAWMRERMSKRR,1.9362507,"A16S, R20A, A21S, L36V, Q89R, K97R, Q98M, S100K, D101R, H102R",10
IEKFKSLAEKVEAIVAQNNAAEIDYSDAPEEFRDPLMCTLMTDPVRLPSGTVMDRSIILRHLLNSPTDPFNRQPLTESMLEPAVELKEQIQAWMREKQSSDH,1.2853848,"L6S, E13A, K17Q, A19N, R20A, D30E, D38C, M74P, V83A, P84V",10
MEKFKLLAEKVDSIVAKNQRAEIDFSDAPDEFMDPLMDTLMTDPVRLPSGTVMDRSIILRHLLNSPTDPFNRQMLTEDMLEPVPELKEKIQAWMREKLSIDH,0.3500014,"I1M, E12D, E13S, A19Q, Y25F, R33M, S78D, Q89K, Q98L, S100I",10
IEQFRLLADKVEEIVAKNARAEIDESDAPQEFRDPLMDTLMTDPVRLPSGTVMDRSIIMRHLLNSPTDPFNRQPLTESMLEPVTELKERIQAWMREKQSSTH,-1.5560063,"K3Q, K5R, E9D, Y25E, D30Q, L59M, M74P, P84T, Q89R, D101T",10
IEKFKLLSEKVEEIVAKNAAAEIDLSDAPDEFRDPLMDTLMTDPVKLPSGTVMDRSIILRHLLNSPTDPFNRQPLTESMLEPVPELKNQIQAWIREKCTNDH,1.8609016,"A8S, R20A, Y25L, R46K, M74P, E88N, M94I, Q98C, S99T, S100N",10
MEKFKLLNEKVEELVAKEARAEIDYSDAPDEFRDPLMDTLMTDPVRLPSGTVMDRSVILRHLLNSPTDPFNRQMLTEAQLEPVPELKDQIQAWMREKQSSET,0.68237925,"I1M, A8N, I14L, N18E, I57V, S78A, M79Q, E88D, D101E, H102T",10
ISKFKLLAEKVEEVVAKNAREEIDYSDAPDEFRDPLMDTLMTDPVRLPSGQVMDRSIILRHLLNSPTDPFNRQMLTESMLEPVPELKEQIQAWKREKLRTGA,0.24462159,"E2S, I14V, A21E, T51Q, M94K, Q98L, S99R, S100T, D101G, H102A",10
IEKFKELCQKVEEIVARNAAEELDYSDAPDEFRDPLMDTLMTDPVKLPSGTVMDRSIILRHLLNSPTDPFNRQELTESMLEPVPELKEQIQAWMRERQSSDH,3.1738472,"L6E, A8C, E9Q, K17R, R20A, A21E, I23L, R46K, M74E, K97R",10
IEKFELLAEKVEEAVAKCAREEIDLSDAPDEFRDPLMDTLMTDPVRLPSGHVMDRSIILRHLLNSPTDPFTRQMLTESMLEPVPELKTQIQAWMREKQQSDG,4.607547,"K5E, I14A, N18C, A21E, Y25L, T51H, N71T, E88T, S99Q, H102G",10
REKFKELAEKVEEIVTKNARAEVDYSDAPDEFRDPIMDTLMTDPVRLPSGTVMDRSIILRHLLNSPTDPFNRQMLTEEMLEPAEELKEQIQAWMREKQISDL,1.736809,"I1R, L6E, A16T, I23V, L36I, S78E, V83A, P84E, S99I, H102L",10
IEKFKKLAEKVEEMVASNARNEIDLSDAPDEFRDPLMDTLMTDPVKLPSGNVMDRPIILRHLLNSPTDPFNRQMLTEDMLEPVPELKEQIQAWMREKISSDH,1.4643769,"L6K, I14M, K17S, A21N, Y25L, R46K, T51N, S56P, S78D, Q98I",10
MEKFKLLCQKAEEIVAANARAEIDYSDAPDSFRDPLMDTLMTDPVRLPSGAVMDRSIILRHLLNSPTDPFNRQMLTESMLEPAPELKEQIQAWMREKQLSSH,-0.48059645,"I1M, A8C, E9Q, V11A, K17A, E31S, T51A, V83A, S99L, D101S",10
IEKFKLLAERVEAIAAANADAEIDYSDAPDEFRDPLMDTLMSDPVRLPSGTVMDRSIILRHLLNSPTDPFNRSMLTESMLEPVPELKEQIQAWMRQRQSEDH,0.8562429,"K10R, E13A, V15A, K17A, R20D, T42S, Q73S, E96Q, K97R, S100E",10
IEKFKLLAEKVEEIFAKNAFADIDYSDAPDEFRDGLMDTLMTDPVRLPSGTVMDRAIILRHLLNSPTDPFNRAMLTESMLEPVPELKEQIQKWVREKQSSVQ,0.21170115,"V15F, R20F, E22D, P35G, S56A, Q73A, A92K, M94V, D101V, H102Q",10
IPKFKLLAQKVEEVAAKNARAEIDYSDAPDEFRDPLMDTLMTDPVRLPSGTVMDRAVILRHLLNSPTDPFNRQMLTEDLLEPVPELKERIQAWIREKQSSDH,-0.08009432,"E2P, E9Q, I14V, V15A, S56A, I57V, S78D, M79L, Q89R, M94I",10
IEKFKLLREKSEEIVAKNAGAEIDYSDAPEEFRDPLMDTLMTDPVRLPSGHVMDRSIILRHLLNSPTDPFNRQPLTEAMLEPVPELKEQIQAWMREKQNSTE,0.9304512,"A8R, V11S, R20G, D30E, T51H, M74P, S78A, S99N, D101T, H102E",10
VEKFKLLAEKVEEIAAENAKAEVDYSDAPDEFRDPLMLTLMSDPVRLPSGTVMDRSIILRHLLNSPTDPFNRQMLTESMLEPVPELKEQIEAWRREKQSSDS,-0.3493392,"I1V, V15A, K17E, R20K, I23V, D38L, T42S, Q91E, M94R, H102S",10
IEKFKLLNEKVEEISAKNIRAEIDYSDAPDEFKDPLMDTLMTDPVRLPSGNVMDRSVILRHLLNSQTDPFNRQMLTESQLEPVPELKEQIQAWMRKKQSNDH,1.199256,"A8N, V15S, A19I, R33K, T51N, I57V, P66Q, M79Q, E96K, S100N",10
IESFKLLCEKCEEIVARNARAEIDYSDAPDEFRDPLMDTLMTDPVKLPSGNVMDRSIILRHLLNSPTDPFNRQPLTESQLEPVPELKEQIQAWVREKQSSDA,1.512965,"K3S, A8C, V11C, K17R, R46K, T51N, M74P, M79Q, M94V, H102A",10
MEKFKNLAEKMEEIAAANARAEIDYSDAPDEFRDPLMDTLMTDPVRLPSGTVMDRSVILRHLLNSPTDPFNRQPLTEDMLEPVPELKEQIQAWMREKLSIDH,1.4338582,"I1M, L6N, V11M, V15A, K17A, I57V, M74P, S78D, Q98L, S100I",10
IAKFKTLAEKVEEIVEKNAAAEIDYSDAPDEFRDPLMDTLMTDPVRLPSGTVMDRSIILRHLLNSPTDPFNRQMLTESMLEPVPELKERIHAWIKEKQGSTH,-1.4376522,"E2A, L6T, A16E, R20A, Q89R, Q91H, M94I, R95K, S99G, D101T",10
IEKFKLLAEKVEEAVAKNARAEIDYSDAPDEFRDPLMDTLMTDPVRLPSGNIMDRSVILRHLLNSPTDPFNRQALTESMLESVPELKEQIQQWMREKQGSAT,0.6144757,"I14A, T51N, V52I, I57V, M74A, P82S, A92Q, S99G, D101A, H102T",10
IEKFKLLNEKCEEIVQRNLRAEIDYSDAPDEFRDPLMDTLMTDPVRLPSGKVMDRSIILRHLLNSPTDPFSRQMLTESMLEPLPELKEQIQEWVREKQSSDH,0.43096974,"A8N, V11C, A16Q, K17R, A19L, T51K, N71S, V83L, A92E, M94V",10
MSKFTLLAEKLEQIVAKNARAEIDYSDAPDEFRDPLMDTLMTDPVRLPSGTVMDRSIILRHLLNSPTDPFNRQKLTEQMLEPVPELKERIHAWMREKQRSDH,-1.0873406,"I1M, E2S, K5T, V11L, E13Q, M74K, S78Q, Q89R, Q91H, S99R",10
IEKFRKLTEKVEEIVAKNARMEIDYSDAPDEFRDPLMDTLMTDPVRLPSGTVMDRSIILRHLLNSPTDPFNRSMLTESMLEPVPELKEQITAWRRQKQESDS,0.0929078,"K5R, L6K, A8T, A21M, Q73S, Q91T, M94R, E96Q, S99E, H102S",10
MEKFKLLCEKVEEIVAQNARAEIDLSDAPDEFRDPLMDTLMTDPVRLPSGTVCDRAIILRHLLNSPTDPFNRQMLTESMLEPVPELKEKIQAWMETKQASDH,2.6566586,"I1M, A8C, K17Q, Y25L, M53C, S56A, Q89K, R95E, E96T, S99A",10
