Sequence,Score,Mutations,Number of Mutations
IEKFKLLAEKVEEIVAVNARQDIDYSDAPDEFRDPLMDTLMTDPVRLPSGAVMDRSIILRHLLNSPTDPFNRQCLTESMLEPVPELKEQILAWMRTKCLIDH,1.0589492,"K17V, A21Q, E22D, T51A, M74C, Q91L, E96T, Q98C, S99L, S100I",10
IEKFKLLAEKVDEIVAKNALDEIDYGDAPDEFKDPLMDTLMTDPVKLPSGTVMDRPIILRHLLNSPTDPFNRQMLTESMLEPVPELKEQISAWMREKMSLDH,1.7883363,"E12D, R20L, A21D, S26G, R33K, R46K, S56P, Q91S, Q98M, S100L",10
IEKFKRLTEKVEEIVAKNARAAIDYSDAPEEFKDPLMDTIMTDPVRLPSGTVMDRSIILRHLLNSATDPFSRQMLTESMLEPVPELKEQIQAWMRKKQSEDH,-0.06373685,"L6R, A8T, E22A, D30E, R33K, L40I, P66A, N71S, E96K, S100E",10
IGNFKELAEKCEQIEAKNNRAEIDYSDAPDEFRDPLMDTIMTDPVRLPSGTVMDRSIILRHLLNSPTDPFNRQPLTESMLEPVPELKEQIQAWMREKQSSFH,1.7453432,"E2G, K3N, L6E, V11C, E13Q, V15E, A19N, L40I, M74P, D101F",10
IEKFKLLHEKAEEIVAQNARLEIDYSDAPDEFKDPLMDTLMTDPVRLPSGTVMDRSIILRHLLNSPTDPFNREMLTESMLEPVPELKERIQAWMRQKQSEKH,-0.57894015,"A8H, V11A, K17Q, A21L, R33K, Q73E, Q89R, E96Q, S100E, D101K",10
ITKFKLLAEKVEEIVKKQARAEIDYSDAPDEFRDPIMDTLMTDPVRLPSGTIMDRGTILRHLLNSPTDPFNRQMLTEAMLEPVPELKEQIQAWMREKQSSKT,5.1054854,"E2T, A16K, N18Q, L36I, V52I, S56G, I57T, S78A, D101K, H102T",10
REKFALLIEKFEEISASNARAEIDYSDAPDEFRDPLMDTLMTDPVRLPSGTVMDRSIILRHLLNSPTDPFNRQMLKEDMLESVPELKEQIQAWMKEKQSSDH,-1.164295,"I1R, K5A, A8I, V11F, V15S, K17S, T76K, S78D, P82S, R95K",10
IESFQVLAEKVEEIVAKELRREIDYSDAPEEFRDPLMDTLMTDPVKLPSGTVMDRSIILRHLLNSPTDPFNRQMLTESMLEPVPELKEQIQAWMNEKASSDH,-0.06427268,"K3S, K5Q, L6V, N18E, A19L, A21R, D30E, R46K, R95N, Q98A",10
IEDFKLLAEKVEEIVVKQARAEIDYSDAPEEFRDPLMDTLMTDPVRLPSGTVMDRSIILRHLLNSPTDPFNRQMLTESMLEPVPELKEKIHAWMAEKGLSDF,0.080343276,"K3D, A16V, N18Q, D30E, Q89K, Q91H, R95A, Q98G, S99L, H102F",10
IEKFKLLAEKVEEISAKHFRAELDLSDAPDEFKDPLMDTLMTDPVRLPSGRVMDRTIILRHLLNSPTDPFTRQMLTESMLEPVPELKEQIQAWMREKQSSGH,3.07852,"V15S, N18H, A19F, I23L, Y25L, R33K, T51R, S56T, N71T, D101G",10
IEKFKLLKEKCEEAVAKQARAEIDLSDAPAEFRDPLMDTIMTDPVRLPSGTVMDRSIILRHLLNSPTDPFNRQMLTESMLEPVPELKERIQAWMREKIASDH,1.6603975,"A8K, V11C, I14A, N18Q, Y25L, D30A, L40I, Q89R, Q98I, S99A",10
IEKFKLLCEKVEEVVAKNARAEIDYSDAPDEFRDPLMSTLMTDPVRLPSGNVMDRSIILRHLLNSETDPFNRQMLTESMLESAVELKERIQAWMREKQSSDE,-1.7143488,"A8C, I14V, D38S, T51N, P66E, P82S, V83A, P84V, Q89R, H102E",10
MERFTLLAEKCEEIVQKNARAEIDFSDAPDEFRDPLMDTLMTDPVRLPSGTVMDRSVILRHLLNSSTDPFNRQMLTESMLEPVPELKEQIQAWMREKQASSH,-0.8353655,"I1M, K3R, K5T, V11C, A16Q, Y25F, I57V, P66S, S99A, D101S",10
IEKFKLLGEKIEEIAAKQARMEIDMSDAPDEFMDPLMDTIMTDPVRLPSGTKMDRSIILRHLLNSPTDPFNRQMLTESMLEPVTELKEQIQAWMREKQSSDH,0.99076116,"A8G, V11I, V15A, N18Q, A21M, Y25M, R33M, L40I, V52K, P84T",10
IEKFKLLAKKAEEIVLKAARAEEDYSDAPDEFRDPLMDTLMTDPVRLPSGVVMDRSIILRHLLNSPTDPFNRQMLTESQLEPVTELKEQIQSWMREKQSKDH,-0.0036240444,"E9K, V11A, A16L, N18A, I23E, T51V, M79Q, P84T, A92S, S100K",10
IEKFKSLAEKMEEIVEKGARAEIDNSDAPDEFRDPLMDTLMTDPVKLPSGTVMDRSVILRHLLNSSTDPFNRQMLTEDMLEPVPELKEQIQAWMREKKSSDH,0.8797245,"L6S, V11M, A16E, N18G, Y25N, R46K, I57V, P66S, S78D, Q98K",10
IEKFKELAGKVDSIVAKNARAEIDYSDAPDEFRDPLMDTLMTDPVRLPSGTVMDRSIILRHLLNSQTDPFNRQPLKESMLEPLPELKEQIQAWIREKQSSDV,-0.104014836,"L6E, E9G, E12D, E13S, P66Q, M74P, T76K, V83L, M94I, H102V",10
LEKFKLLAERVDEIVAKNAEEEIDYSDAPDEFRDPLMDTLMTDPVRLPSGTVMDRSVIVRHLLNSPTDPFNRDMLTEDMLEPVPELKEQIQAWMREKQSSDE,0.5829905,"I1L, K10R, E12D, R20E, A21E, I57V, L59V, Q73D, S78D, H102E",10
VEKFKLLTTKVEDIVAKNARAEIDYSDAPEEFRDPLMDTLMTDPVRLPSGTVMDRSIILRHLLNSPTDPFNRTMLTEEMLEPVPELKEQILAWMRRKQSHDH,-1.5108249,"I1V, A8T, E9T, E13D, D30E, Q73T, S78E, Q91L, E96R, S100H",10
MEKFEKLAEKVEEIAAKNAAAEIDYSDAPDEFRDPLMDTLMTDPVRLPSGTVMDRKIILRHLLNSPTDPFNRQPLTESMLEPVVELKEQIRAWMRQKQSSDH,1.0873864,"I1M, K5E, L6K, V15A, R20A, S56K, M74P, P84V, Q91R, E96Q",10
IEKFKLLSEKVEEIVAKNARAGIDYSDAPDEFRDPLMDTIMTDPVKLPSGTVMDRSIILRHLLNSPTDPFNRQPLTESMLEPARELKEQIQAWMREKQSQNL,-0.7664394,"A8S, E22G, L40I, R46K, M74P, V83A, P84R, S100Q, D101N, H102L",10
IENFRLLASKVEEIVAKNIRAEIDYSDAPDEFRDPIMDTLMTDPVRLPSGTVMDRSIILRHLLNSPTDPFNRQMLTESMLEPVPELKEQIQAWIREKTQSKL,3.9124355,"K3N, K5R, E9S, A19I, L36I, M94I, Q98T, S99Q, D101K, H102L",10
IEKFKLLAEKVEEIVAKNARKETDESDAPDEFRDPLMDTLMVDPVRLPSGNRMDRSIILRHLLNSPTDPFNRTMLTEEMLEPVPELKEQIQAWLREKQSSDS,-0.16539776,"A21K, I23T, Y25E, T42V, T51N, V52R, Q73T, S78E, M94L, H102S",10
MEKFKELAEKVEEIVAKNARAEIDLSDAPDEFRDPLMNTLMTDPVRLPSGTVMDRAIILRHLLNSPTDPFNRQPLTESMLEPVPELKEQINAWMETKRSSDH,-1.1482332,"I1M, L6E, Y25L, D38N, S56A, M74P, Q91N, R95E, E96T, Q98R",10
IEKFKKLAEKVEEIAAKNQRAEIDYSDAPEEFRDPIMDTLMTDPVRLPSGTVADRSIILRHLLNSPTDPFNRAMLTEDMLVPVPELKEQIQAWIREKQSSDH,4.980694,"L6K, V15A, A19Q, D30E, L36I, M53A, Q73A, S78D, E81V, M94I",10
IEKFKWLAEKVEEIVAKNQRAEADYSDAPDEFRDPLMATLMTDPVRLPSGTVMDRSIILRHLLNSPTDPFNRQMLTESMLEPVPELKEQIEAWIRRKVSSQA,0.5371672,"L6W, A19Q, I23A, D38A, Q91E, M94I, E96R, Q98V, D101Q, H102A",10
IDKFKLLAEKVEEIVAKNATAEIDYSDAPDEFRDPIMDTLMTDPVKLPSGTVMDRSIIQRHLLNSPTDPFNRKPLTESMLEPVPELKEQIQAWIRMKQSSDS,2.5956168,"E2D, R20T, L36I, R46K, L59Q, Q73K, M74P, M94I, E96M, H102S",10
IEKFKSLSEKVEEITAKNARSEIDYSDAPGEFRDPLMDTLMTDPVRLPSGTVMDRSIILRHLLNSPTDPFNRQPLTESMLEPAAELKEQIQAWMREKMSSQH,-0.47372568,"L6S, A8S, V15T, A21S, D30G, M74P, V83A, P84A, Q98M, D101Q",10
IEKVKLLAEKVEEIVAKKAREEIDYSDAPEEFRDPLMDTLMTDPVRLPSGTVMDRSIILRHLLNSPTDPFNRQMLTESMLEPAPELREQIQLWVREKQSSAI,0.22224364,"F4V, N18K, A21E, D30E, V83A, K87R, A92L, M94V, D101A, H102I",10
IEKFNLLARKVEEIVTKNNRQDIDYSDAPEEFRDPLMDTLMTDPVRLPSGTVMDRSIITRHLLNSPTDPFNRQMLTEEMLEPVPELKEQIQAWMRSKQSSDH,1.4506986,"K5N, E9R, A16T, A19N, A21Q, E22D, D30E, L59T, S78E, E96S",10
MEKFKLLAEKVEEIAAKNARDEVDYSDAPDEFRDPVMDTLMTDPVRLPSGTVMDRSVILRHLLNSQTDPFNRQMLTESQLEPVPELKEQIQAWMREKQSKDA,1.6456634,"I1M, V15A, A21D, I23V, L36V, I57V, P66Q, M79Q, S100K, H102A",10
IEKFKLLAERVEEIVAKNARAEIDYSDAPEEFRDPLMDTLMTDPVRLPSGTVMDRRIILRHLLNSPTDPFTRQELNESMLEPVPELKEQIQAWMKAKTSSSH,2.2238925,"K10R, D30E, S56R, N71T, M74E, T76N, R95K, E96A, Q98T, D101S",10
IEKFKKLAEKCEEIVAKNAREEIDYSDAPDEFKDPLMDTLMTDPVRLPSGTVMDRKIILRHLLNSPTDPFNRSELTEDMLEPVPELKEQIQAWMREKQRSDA,2.1277375,"L6K, V11C, A21E, R33K, S56K, Q73S, M74E, S78D, S99R, H102A",10
IEEFKELAEKVEEIVAKKARAEIDYSDAPDEFRDPLMDTLMTDPVKLPSGTVMDRAIILRHLLNSPTDPFNRSMLTESMLEPLPELKERIEAWMKEKQSSDH,-2.38876,"K3E, L6E, N18K, R46K, S56A, Q73S, V83L, Q89R, Q91E, R95K",10
IEKFTLLAEKVEEIAAQNARAEIDYSDAPDEFRDPLMDTLMRDPVRLPSGTVMDRSIILRHLLNSPTDPFNRQMLTEDMLEPVPELKERIQQWIRSKQSLDH,0.17211059,"K5T, V15A, K17Q, T42R, S78D, Q89R, A92Q, M94I, E96S, S100L",10
IEKFKALKEKCEEIVAKNARAEIDFSDAPDEFRDPIMDTLMTDPVKLPSGTVMDRSIILRHLLNSPTDPFNRQMLTESQLEPVPELKEQIQTWIREKQFSDH,3.453543,"L6A, A8K, V11C, Y25F, L36I, R46K, M79Q, A92T, M94I, S99F",10
IEKFKLLAEKVEEAVAAHARARIDYSDAPDEFRDPLMDTLMTDPVRLPSGTVMDRSIILRHLLNSSTDPFNRQMLTESMLEPVAELKEQIQEWVKEKQASDH,-1.6616492,"I14A, K17A, N18H, E22R, P66S, P84A, A92E, M94V, R95K, S99A",10
MEKFKTLNEKVEEIVAKNAAAEIDYEDAPDEFRDPLMDTLMTDPVRLPSGTVMDRSIILRHLLNSPTDPFNRLMLTESMLEPVPELKERIQAWMKEKQSNDR,-0.9485827,"I1M, L6T, A8N, R20A, S26E, Q73L, Q89R, R95K, S100N, H102R",10
MEKFKLLAEKVEEIVAKNAVAEIDYSDAPEEFRDPLMDTLMTDPVRLPSGNVMDRSVILRHLLNSPTDPFNRQMLTESMLEPVPELQEQIQAWLKEKQQSDV,-0.56531125,"I1M, R20V, D30E, T51N, I57V, K87Q, M94L, R95K, S99Q, H102V",10
IEKFKHLAEKVEEIAAKNQRAEIDYSDAPEEFRDPLMDTLMSDPVRLPSGTIMDRSIIIRHLLNSPTDPFNRQALTESMLEPVPELKEQIQKWMRDKQSSDH,1.3005626,"L6H, V15A, A19Q, D30E, T42S, V52I, L59I, M74A, A92K, E96D",10
IEKFKLLCEKIEELVAKNARDEIDFSDAPEEFRDPLMDTLMTDPVRLPSGTVMDRSIILRHLLNSDTDPFNRQMLTGSMLEPVPELKEKIQAWMREKMSSDH,1.1379364,"A8C, V11I, I14L, A21D, Y25F, D30E, P66D, E77G, Q89K, Q98M",10
IEKFQELAEKHEEAVKKNSRDEIDYSDAPEEFRDPLMDTLMTDPVRLPSGTVMDRSIILRHLLNSPTDPFNRQMLTEDMLEPVPELKEQIQAWMREKQSSQH,1.6667655,"K5Q, L6E, V11H, I14A, A16K, A19S, A21D, D30E, S78D, D101Q",10
IEDFKLLTEKVEEIVAKNARAEIDLADAPEEFKDPLMDTLMTDPVRLPSGTVMDRSIILRHLLNSPTDPFNRQALTESMLEPVPELKEQIQAWQREKQTSDK,1.2365818,"K3D, A8T, Y25L, S26A, D30E, R33K, M74A, M94Q, S99T, H102K",10
IEKFKLLREKYEEIAAKNARAEIDFSDAPEEFRDPLMDTLMTDPVRLPSGTVMDRAIIMRHLLNSQTDPFNRQMLTESMLEPVVELKEQIQAWMREKVSSDH,1.3342001,"A8R, V11Y, V15A, Y25F, D30E, S56A, L59M, P66Q, P84V, Q98V",10
IEKFSLLANKVEEIVAQNARAEMDFSDAPDEFRDPLMNTLMTDPVRLPSGTVMDRAIILRHLLNSPTDPFNRQMLTEDMLEPVPELKEQIQAWMREKMVSDH,-0.9010232,"K5S, E9N, K17Q, I23M, Y25F, D38N, S56A, S78D, Q98M, S99V",10
IEKFKLLRSKLEEIVAANARAEVDYSDAPDEFRDPLMDTLMTDPVRLPSGNIMDRAIILRHLLNSPTDPFNRQPLTESMLEPVPELKERIQAWMREKQSSDH,1.2539585,"A8R, E9S, V11L, K17A, I23V, T51N, V52I, S56A, M74P, Q89R",10
IEKFKQLADHVEEIQAKNARAEIDYSDAPDEFRDPLMDTLMTDPVRLPSGTVMDRSIILRHLLNSPTDPFTRQPLTESMLEPVPELKEQIQSWKREKQRSTH,2.7894514,"L6Q, E9D, K10H, V15Q, N71T, M74P, A92S, M94K, S99R, D101T",10
PEKFKELAEKVEGIVAKNATEEIDYSDAPDEFRDPLMDTLMTDPVKLPSGTVMDRPIILRHLLNSPTDPFNRQMLTESMLEPMPELKEQIQAWMREKQSSAE,-0.81690216,"I1P, L6E, E13G, R20T, A21E, R46K, S56P, V83M, D101A, H102E",10
MERFKLLAEKVEEITAKNARIEIDYSDAPEEFRDPLMDTLMTDPVRLPSGTVMDRSIILRHLLNSQTDPFNRQMLTESMLEPVPELKEQIQAWMNEKQRAAH,-1.3071353,"I1M, K3R, V15T, A21I, D30E, P66Q, R95N, S99R, S100A, D101A",10
IEKFKLLCTRVEEIVAENARTEVDYSDAPDEFRDPLMDTLMTDPVRLPSGTIMDRSIILRHLLNSPTDPFNRQPLTESMLEPVPELKEQIQAWMRKKQSSQH,2.0055313,"A8C, E9T, K10R, K17E, A21T, I23V, V52I, M74P, E96K, D101Q",10
MEKFKLLREKVEEIAAKEARVEIDYSDAPDEFRDSLMDTLMTDPVRLPSGTVMDRSIILRHLLNSPTDPFNRQMLTEDMLEPVPELKEQIQAWARERQSSDK,-1.8707163,"I1M, A8R, V15A, N18E, A21V, P35S, S78D, M94A, K97R, H102K",10
IEKFKLLADKVEAIVAKNARAEIDYSDAPEEFRDPLMDTLMTDPVRLPSGNVMDRSVILRHLLNSPTDPFNRQMLTESMLEPLPELKEKIGAWMAEKNSSDH,1.1678188,"E9D, E13A, D30E, T51N, I57V, V83L, Q89K, Q91G, R95A, Q98N",10
EEKFKALCAKVEEIAAKNAQAEIDYSDAPEEFRDPLMDTLMTDPVRLPSGAVMDRSIILRHLLNSPTDPFNRQPLTESMLEPVPELKEQIQAWMREKQSSAH,0.99013084,"I1E, L6A, A8C, E9A, V15A, R20Q, D30E, T51A, M74P, D101A",10
IEKFKLLEEKVEKVAAKQARAEIDYSDAPDEFRDPLMDTLMTDPVRLPSGTVMDRSVIMRHLLNSPTDPFNRQMLTESMLEPVPELKERIRAWIREKQSSDH,1.2399708,"A8E, E13K, I14V, V15A, N18Q, I57V, L59M, Q89R, Q91R, M94I",10
IEKFKLLAEKVEKVVAKNARAEIDYSDAPDEFRDPLMLTLMTDPVKLPSGTVMDRAVILRHLLNSPTDPFNRQMLTEEMLESLPELKEQILAWMREKQSSDH,-0.6807033,"E13K, I14V, D38L, R46K, S56A, I57V, S78E, P82S, V83L, Q91L",10
IQKFKLLATKVEEIVAKNNATEVDYSDAPDEFRDPLMHTLMTDPVRLPSGTIMDRSIILRHLLNSPTDPFNRQMLTESMLEPVPELKERIQAWMREKQSHDH,-0.5478219,"E2Q, E9T, A19N, R20A, A21T, I23V, D38H, V52I, Q89R, S100H",10
IEKFKELAAKVEEIVAKNSRAEIDYSDAPDEFRDPLMDTLMTDPVRLPSGTVADRSVIIRHLLNSPTDPFNRQPLTEDMLEPVPELKEQIQAWLREKVSSDH,1.5809389,"L6E, E9A, A19S, M53A, I57V, L59I, M74P, S78D, M94L, Q98V",10
ISKFQLLCEKVQEIVQKNARAEVDYSDAPDEFRDPLMDTLMTDPVRLPSGTVADRSIILRHLLNSPTDPFNRQTLTESMLEPVPELKERIQAWMREKQSADH,-0.5537009,"E2S, K5Q, A8C, E12Q, A16Q, I23V, M53A, M74T, Q89R, S100A",10
IEKFKLLAQKVDEIVAKNALAEIDYSDAPDEFRDPLMDTLMTDPVRLPSGTVMDRSVIMRHLLNSPTDPFNRQPLTEDQLEPVPELKEKIQAWIREKQSSDH,1.9815675,"E9Q, E12D, R20L, I57V, L59M, M74P, S78D, M79Q, Q89K, M94I",10
IEKFRTLGQKVEEIAAKKARAEIDYSDVPDEFRDPLMDTLMTDPVRLPSGNVMDRSIILRHLLNSPTDPFNRQMLTESMLEPVPELKEQIQAWMREKRSSDA,-0.68268526,"K5R, L6T, A8G, E9Q, V15A, N18K, A28V, T51N, Q98R, H102A",10
IEKFKALSEKIETISAKKVRAEIDYSDAPDEFRDPLMDTLMTDPVRLPSGTVMDRSIILRHLLNSPTDPFNRQMLTESMLEPVPELKEQIQAWMNEKISSSH,-0.38412458,"L6A, A8S, V11I, E13T, V15S, N18K, A19V, R95N, Q98I, D101S",10
IEKFKNLAEKVEEIAAKNAREEIDYSDAPEEFRDPLMDTLMTDPVRLPSGRVMDRSIILRHLLNSPTDPFNRQMLTESMLEPAPELKEQIDAWMRERQSMDF,1.16819,"L6N, V15A, A21E, D30E, T51R, V83A, Q91D, K97R, S100M, H102F",10
IEKFKELSEKVERIVAKNARAEIDYSDAPDEFRDPLMHTLMTDPVRLPSGNVMDRSIILRHLLNSPTDPFSRQMLTEDMLEPVPELKEQIEAWMREKQSSQG,-0.88484406,"L6E, A8S, E13R, D38H, T51N, N71S, S78D, Q91E, D101Q, H102G",10
IDKFKELKEKVDKIVAKNARAEIDYSDAPDEFKDPLMDTLMTDPVRLPSGTVMDRSIILRHLLNSPTDPFNRQPLTESMLEPLPELKEQIQQWMREKQSSKH,0.19253993,"E2D, L6E, A8K, E12D, E13K, R33K, M74P, V83L, A92Q, D101K",10
MEKFKLLAEKVEEIAVKNKRAEIDYSDAPDEFRDPLMDTLMNDPVRLPSGTVMDRSIILRHLLNSPTDPFNRQMLTEEMLESVPELKEQIDAWLNEKQSSDH,-0.6366194,"I1M, V15A, A16V, A19K, T42N, S78E, P82S, Q91D, M94L, R95N",10
MEKFKLLAEKAEEIVAKNLREEVDYSDAPDEFKDPLMDTLMTDPVRLPSGTVMDRSIILRHLLNSPTDPFNRQPLTESMLEPVPELKEQIQQWMREKCSSDP,1.70776,"I1M, V11A, A19L, A21E, I23V, R33K, M74P, A92Q, Q98C, H102P",10
MEKFKLLSEKVEEVAAKNANAEIDLSDAPDEFRDPLMNTLMTDPVRLPSGNVMDRSIILRHLLNSPTDPFNRQMLTESMLEPVPELKEQIQAWRREKQSGDH,-1.6152158,"I1M, A8S, I14V, V15A, R20N, Y25L, D38N, T51N, M94R, S100G",10
LEKFKLLAEKVEEIAAKAAAAEVDYSDAPEEFRDPLMDTLMTDPVRLPSGTVMDRSVILRHLLNSPTDPFNRQMLTEDMLEPVPELKEKIQAWMKEKQSSDH,0.6012559,"I1L, V15A, N18A, R20A, I23V, D30E, I57V, S78D, Q89K, R95K",10
IEKFAALAEKVEELVAKNARAEIDYSDAPDEFRDPLMDTIMTDPVRLPSGQVMDRSIILRHLLNSPTDPFNRQMLTEDMLQPVPELKERIDAWMREKQKSDH,2.4350934,"K5A, L6A, I14L, L40I, T51Q, S78D, E81Q, Q89R, Q91D, S99K",10
HEKFKELAEKVEEIVAKNQRMEIDESDAPQEFLDPLMDTLMTDPVKLPSGTVMDRSIILRHLLNSPTDPFNRQMLTESMLEPVPELKEQIQAWIREKMSSDH,1.8851278,"I1H, L6E, A19Q, A21M, Y25E, D30Q, R33L, R46K, M94I, Q98M",10
IEKFMLLKEKVEEIVAKNARAEIDYSDAPDEFKDPLMDTLMTDPVRLPSGTVMDRSIILRHLLNSPTDPFTRQMLTESMLEPVSELKERIQDWMREKLSSTS,2.2388096,"K5M, A8K, R33K, N71T, P84S, Q89R, A92D, Q98L, D101T, H102S",10
IQKFKALNEKVEEIVAKNARAEIDYSDAPDEFRDPLMDTLMTDPVRLPSGTIMDRSSILRHLLNSPTDPFNRQPLTESMLVPVVELKEQIQAWMREKLSSDA,1.5429013,"E2Q, L6A, A8N, V52I, I57S, M74P, E81V, P84V, Q98L, H102A",10
IEKFKLLAEKTEQIVAKNARAEIDYNDAPEEFRDPLMDTLMTDPVRLPSGTVMDRSIIMRHLLNSPTDPFNRQMLTESMLTPVPELKERIQQWMREKQMQDH,2.1446767,"V11T, E13Q, S26N, D30E, L59M, E81T, Q89R, A92Q, S99M, S100Q",10
METFKLLEEKCEAIVAKKARAEIDYADAPDEFRDPLMDTLMTDPVRLPSGTVMDRSIILRHLLNSPTDPFNRQPLTESQLEPVPELKEQIQAWMREKQSSTH,-0.83383155,"I1M, K3T, A8E, V11C, E13A, N18K, S26A, M74P, M79Q, D101T",10
MEKFKLLAEKVEEINAKNAMAEEDYSDAPDEFRDPLMDTLMTDPVRLPSGNVMDRAIILRHLLNSPTDPFNRQMLTESMLESVPELKERIQSWRREKQSSDH,0.24786556,"I1M, V15N, R20M, I23E, T51N, S56A, P82S, Q89R, A92S, M94R",10
VEKFKLLAEKAEEIVAKAQKAEIDYSDAPDEFRDPLMDTLMTDPVRLPSGTVMDRSIILRHLLNSPTDPFNRQMLTESMLEPVPELKERIQAWLREKQHSSA,1.5656904,"I1V, V11A, N18A, A19Q, R20K, Q89R, M94L, S99H, D101S, H102A",10
MEKFKLLAEKAEEIVARNIQAEIDESDAPDEFRDPLMDTLMTDPVRLPSGTIMDRSIILRHLLNSPTDPFNRQMLSESMLEPVPELRDQIQAWMREKQSSDH,0.48699558,"I1M, V11A, K17R, A19I, R20Q, Y25E, V52I, T76S, K87R, E88D",10
IEKFKLLAEKVKQIAASQARAEIDYSDAPDEFRDPLMCTLMTDPVRLPSGNVMDRSIILRHLLNSPTDPFNRQPLTESMLEPVPELKEQIAAWMRSKQSSDH,-0.5696042,"E12K, E13Q, V15A, K17S, N18Q, D38C, T51N, M74P, Q91A, E96S",10
IQKFRLLQEKVEMIVAKNAGAEIDYSDAPDEFRDPLMDTLMTDPVKLPSGNVLDRSIILRHLLNSPTDPFNRQMLTESMLEPVPELKEQIQAWMQEKQSSDV,2.4216924,"E2Q, K5R, A8Q, E13M, R20G, R46K, T51N, M53L, R95Q, H102V",10
IEKFKELAEKVEEIAAKNTRAEIDYSDAPDEFRDPLMGTLMTDPVRLPSGTVMDRSIILRHLLNSPTDPFNRQPLTEDMLEPMPELKEQIIAWVREKQSSDV,-1.2029111,"L6E, V15A, A19T, D38G, M74P, S78D, V83M, Q91I, M94V, H102V",10
IEKFKLLQEKVELAVAKNARAEIDYSDAPDEFRDPVMDTLMTDPVRLPSGVVMDRSIILRHLLNSPTDPFNRQMLTESMLEPAPELKERIDAWMREKQTSDV,0.3777947,"A8Q, E13L, I14A, L36V, T51V, V83A, Q89R, Q91D, S99T, H102V",10
IEKFKLLCTKVEEIVAKNAAAEIDYSDAPDEFLDPLMNTLMTDPVRLPSGTVMDRSTILRHLLNSPTDPFNRQMLTEDQLEPVPELKEQIQAWIREKQSSGH,1.4390485,"A8C, E9T, R20A, R33L, D38N, I57T, S78D, M79Q, M94I, D101G",10
MEKFDLLAKRVEEINAKNAREEIDYSDAPDEFRDPLMDTLMTDPVKLPSGTVMDRSIILRHLLNSPTDPFNRQMLTESMLEPVPELKEQIQAWMSSKQSSKH,0.18415198,"I1M, K5D, E9K, K10R, V15N, A21E, R46K, R95S, E96S, D101K",10
IEKFKKLAEKVEELVAKKARAEIDYTDAPDEFRDPLMDTLMTDPVRLPSGTVMDRSIILRHLLNSNTDPFNRQMLAESMLEPVPELKEQIEAWSREKLSSDR,-0.39408463,"L6K, I14L, N18K, S26T, P66N, T76A, Q91E, M94S, Q98L, H102R",10
LEKFKLLAEKVDEIVAKNAEAEVDYSDAPEEFRDPLMDTLMTDPVRLPSGTVMDRAIILRHLLNSPTDPFNRQMLTESMLEPVPELKEQIQAWLREKQSLKT,1.3981698,"I1L, E12D, R20E, I23V, D30E, S56A, M94L, S100L, D101K, H102T",10
IEKFKLLREKMEEIVAKNTRAEIDYSDAPDEFKDPLMDTLMTDPVRLPSGKVMDRRIILRHLLNSPTDPFTRQMLTEEMLEPVPELKEQIQAWMKEKNSSDH,1.7720921,"A8R, V11M, A19T, R33K, T51K, S56R, N71T, S78E, R95K, Q98N",10
IEKFKLLSQKVKIIVAKNARAEIDLSDAPDEFLDPIMDTLMTDPVKLPSGTVVDRSIILRHLLNSPTDPFNRAMLTESMLEPVPELKEQIQAWMREKQSSDH,5.575431,"A8S, E9Q, E12K, E13I, Y25L, R33L, L36I, R46K, M53V, Q73A",10
IEKFKLLHEKVEEIVAKHQRAEIDYSDAPDEFRDPLMDTLMTDPVRLPSGNVMDRSIILRHLLNSPTDPFNRSMLTEDMLEPVPELKEKIQQWMRSKQQSDH,0.5224436,"A8H, N18H, A19Q, T51N, Q73S, S78D, Q89K, A92Q, E96S, S99Q",10
IEKLKLLAEKTEEIVASNARAEIDYSDAPDEFRDPLMDTLMTDPVRLPSGHVMDRAVILRHLLNSPTDPFNRQMLTESMLEPVPELKEQITAWIREKQMGDH,3.079287,"F4L, V11T, K17S, T51H, S56A, I57V, Q91T, M94I, S99M, S100G",10
IEKFKLLAEKAETAAAANARAEIDYSDAPDEFCDPLMDTLMTDPVRLPSGTIMDRSIILRHLLNSQTDPFNRQMLTESMLEPVPELKERIQAWMREKQSSDG,0.30931285,"V11A, E13T, I14A, V15A, K17A, R33C, V52I, P66Q, Q89R, H102G",10
IERFRLLALKVEEIVAKNARAEIDYSDAPEEFRDPLMDTLMTDPVRLPSGTVMDRSIILRHLLNSPTDPFNRQMLTEDMLEPAPELKAQIQAWIREKQSSSS,-0.6524589,"K3R, K5R, E9L, D30E, S78D, V83A, E88A, M94I, D101S, H102S",10
ITKFKLLAEKLEELVAKQQRAEIDYSDAPDEFRDPLMDTLMTDPVRLPSGTIMDRSTIMRHLLNSPTDPFNRQMLTESMLEPVPELKERIQAWMNEKQSSDH,0.80356884,"E2T, V11L, I14L, N18Q, A19Q, V52I, I57T, L59M, Q89R, R95N",10
IEKFKLLAERVEEIVAKNNRAEVDYSDAPDEFRDPLMDTLMTDPVRLPSGNVMDRAIILRHLLNSPTDPFNRQMLTESMLESVPELKEQIQAWIRSKRSEDH,-0.05399668,"K10R, A19N, I23V, T51N, S56A, P82S, M94I, E96S, Q98R, S100E",10
IEKIKLLAEKVEELQAKNARQEIDYSDAPDEFRDPLMDTLMTDPVKLPSGTVMDRIIIQRHLLNSPTDPFNRQPLTESMLEPVTELKEQIQAWMKEKQSSDH,-0.7426261,"F4I, I14L, V15Q, A21Q, R46K, S56I, L59Q, M74P, P84T, R95K",10
IEKFAALAEKVDELVAKNARAELDYSDAPDEFRDPLMDTLMTDPVRLPSGTIMDRSIILRHLLNSPTDPFNRQMLTEAMLESVPELKEQIQAWMREKISSDL,0.60879165,"K5A, L6A, E12D, I14L, I23L, V52I, S78A, P82S, Q98I, H102L",10
IEKFKLLEEKVEEIVAKNRGAEIDYSDAPDEFRDPLMDTLMTDPVRLPSGTVMDRKIILRHLLNSPTDPFNRQPLTESMLEPVPELKEKIQAWMKSKRQSDH,0.64186907,"A8E, A19R, R20G, S56K, M74P, Q89K, R95K, E96S, Q98R, S99Q",10
IEKFKLLSEKVEEVAAKNARAEIDYSDAPDEFRDPLMDTLMTDPVRLPSGIVMDRSIILRHLLNSPTDPFNRQMLTEDMLEPVPELKEQILKWMREKHKSIH,1.9387075,"A8S, I14V, V15A, T51I, S78D, Q91L, A92K, Q98H, S99K, D101I",10
IEKFKELAAKVEEIAAKQARAIIDYSDAPEEFRDPLMDTLMTDPVRLPSGTVMDRSIILRHLLNSPTDPFNRQMLTESQLEPVVELKEQIQEWMRLKQSSDH,0.24358895,"L6E, E9A, V15A, N18Q, E22I, D30E, M79Q, P84V, A92E, E96L",10
MEQFKTLCEKVEAAVAKNARAEVDYSDAPDEFRDPLMDTLMTDPVRLPSGTVMDRSVILRHLLNSPTDPFNRQPLTESMLEPVPELKEQIQAWMREKQSSKH,-0.1568357,"I1M, K3Q, L6T, A8C, E13A, I14A, I23V, I57V, M74P, D101K",10
IEKFKVLAEKVEEIVAKNAMEEIDYSDAPDEFRDELMDTLMTDPVRLPSGKVMDRAVILRHLLNSPTDPFNRQMLTESMLEPVPELKEQIAAWMREKRSRDH,1.0381951,"L6V, R20M, A21E, P35E, T51K, S56A, I57V, Q91A, Q98R, S100R",10
IEKFKLLAEKAEEIVAKNANTEIDYSDAPEEFRDPIMDTLMTDPVRLPSGTVMDRSIILRHLLNSQTDPFNRQMLTESMLEPAPELKEQIQEWMREKQSLSH,2.9048572,"V11A, R20N, A21T, D30E, L36I, P66Q, V83A, A92E, S100L, D101S",10
IEKFKLLCPKVDEIVAKNARAEIDYSDAPDEFRDPIMDTLMTDPVRLPSGTIMDRQIILRHLLNSPTDPFNRQMLTEDSLEPLPELKEQIQAWMREKLSSDH,2.064249,"A8C, E9P, E12D, L36I, V52I, S56Q, S78D, M79S, V83L, Q98L",10
IEKFKQLAEKCEEISAKNAREEIDYEDAPDEFRDPLMDTLMTDPVRLPSGHVMDRSIILRHLLNSPTDPFNRQMLTESMLEPVPELKESIQAWMTEKQRSDD,2.1152654,"L6Q, V11C, V15S, A21E, S26E, T51H, Q89S, R95T, S99R, H102D",10
IEGFKLLAEKVEQQVAKNARADVDYSDAPDEFRDPLMDTLMTDPVRLPSGNVMDRAIILRHLLNSQTDPFNRTMLTESMLEPVPELKEQIQAWRREKQSSDH,-1.877933,"K3G, E13Q, I14Q, E22D, I23V, T51N, S56A, P66Q, Q73T, M94R",10
IEKFKLLAEKVEEIVKKNARDEIDYSDAPDEFRDPLMDTLMTDPVRLPSGSVMDRKIILRHLLNSPTDPFNRQMLTESMLEPVPELKQQIEEWLREKRSSHH,0.9233279,"A16K, A21D, T51S, S56K, E88Q, Q91E, A92E, M94L, Q98R, D101H",10
IQHFILLAEKVEKIAAENAQAEIDYSDAPDEFRDPLMDTLMTDPVRLPSGTVMDRSIILRHLLNSPTDPFNRQMLTEDMLEPVPELKEQIQAWMREKVSSDK,0.41902328,"E2Q, K3H, K5I, E13K, V15A, K17E, R20Q, S78D, Q98V, H102K",10
MQKFKLLAKKVDEIAAKNAAAEIDYSDAPDEFRDPLMDTLMTDPVRLPSGNVMDRSIILRHLLNSPTDPFNRQMLTESMLEPVTELKEQIHAWMREKYSSDH,-0.7901921,"I1M, E2Q, E9K, E12D, V15A, R20A, T51N, P84T, Q91H, Q98Y",10
IEKFKLLAEKVECIAAKNIRAEIDYSDAPDEFRDPLMDTLMTDPVRLPSGTIVDRAIITRHLLNSPTDPFNRQPLTESMLAPVPELKEQIQAWMREKQSSQH,4.291213,"E13C, V15A, A19I, V52I, M53V, S56A, L59T, M74P, E81A, D101Q",10
IEKFKLLKEKVDELVAKKHRDEIDYSDAPDEFRDPLMDTLMTDPVRLPSGTVMDRSIIMRHLLNSPTDPFSRQMLTESMLEPVPELKEQINAWMREKQSSKH,-0.16923489,"A8K, E12D, I14L, N18K, A19H, A21D, L59M, N71S, Q91N, D101K",10
IEKFSLLAEKTESIVKKHARAEIDYSDVPDEFRDPLMDTLMTDPVRLPSGKVMDRSVILRHLLNSPTDPFNRQMLTESMLEPVPELKEQIIAWMREKQSSAH,1.8620754,"K5S, V11T, E13S, A16K, N18H, A28V, T51K, I57V, Q91I, D101A",10
MSKFKLLAEKVNVIAAKNARAEIDYSDAPDEFRDPLMDTLMEDPVRLPSGTVMDRSIILRHLLNSPTDPFNREMLTESMLEPVPELKEQIQKWMREKQGSGH,-2.2877092,"I1M, E2S, E12N, E13V, V15A, T42E, Q73E, A92K, S99G, D101G",10
IQKFKELAEKCEQIVAVNSRKEIDYSDAPDEFRDPLMDTLMTDPVRLPSGTVMDRSIILRHLLNSPTDPFNRAPLTEDMLEPVPELKEQIQAWMREKQSSDH,1.4588423,"E2Q, L6E, V11C, E13Q, K17V, A19S, A21K, Q73A, M74P, S78D",10
MEKFKLLAEKVEEIVAKNAQAEIDYSDAPDEFHDPLMNTLMTDPVKLPSGTVMDRSIILRHLLNSATDPFNRQMLTESMLEPVPELKTRIQAWMREKYSADH,-2.0743656,"I1M, R20Q, R33H, D38N, R46K, P66A, E88T, Q89R, Q98Y, S100A",10
GELFKLLAEKVDEIVAKNNRAEIDLSDAPDEFRDPLMDTLMTDPVRLPSGTVMDRRVILRHLLNSPTDPFNRQPLTESMLEPVPELKEQIQAWMRQKQSSPH,0.1892519,"I1G, K3L, E12D, A19N, Y25L, S56R, I57V, M74P, E96Q, D101P",10
IEKFKKLAEKVDEIVAKNARAEVDYSDAPDEFRDPLMDTLMTDPVRLPSGTVMDRSVILRHLLNSPTDPFNRKELTESMLEPAPELKERIHAWTREKQSSDH,-0.17244822,"L6K, E12D, I23V, I57V, Q73K, M74E, V83A, Q89R, Q91H, M94T",10
IEKFRLLATKVEEAVAKNARAEVDYSDAPDEFRDHLMDTLMTDPVRLPSGHTMDRAIILRHLLNSPTDPFTRQPLTESMLEPVPELKEQIQAWMREKQSSDH,0.241306,"K5R, E9T, I14A, I23V, P35H, T51H, V52T, S56A, N71T, M74P",10
IEKFKLLAEKVRILVTQNAMAEIDYSDAPDEFRDPIMDTLMTDPVRLPSGTVMDRKIILRHLLNSPTDPFNRQMLTESMLEPLPELKEQIQAWMREKVSSDH,2.39251,"E12R, E13I, I14L, A16T, K17Q, R20M, L36I, S56K, V83L, Q98V",10
AEKFKILASKVEEIVAENADADIDYSDAPDEFRDPLMDTLMTDPVRLPSGTVMDRAIILRHLLNSPTDPFNRQPLTEDMLEPVPELKEQIQAWRREKQSSDH,2.2058847,"I1A, L6I, E9S, K17E, R20D, E22D, S56A, M74P, S78D, M94R",10
MEKFKELAEKVEEIVAKNAAAEIDYSDAPDEFRDPLMDTLMTDPVRLPSGTIMDRSIILRHLLNSETDPFNRAMLTESMLEPVTELKEQIRAWIREKQSSDN,1.4299372,"I1M, L6E, R20A, V52I, P66E, Q73A, P84T, Q91R, M94I, H102N",10
IEKFKLLNEMVEEIVAKHNREELDYSDAPDEFRDPLMDTLMTDPVRLPSGTVMDRKIILRHLLNSPTDPFNRQMLTESMLEPVPELKETIQAWMRSKQSSDK,1.8105013,"A8N, K10M, N18H, A19N, A21E, I23L, S56K, Q89T, E96S, H102K",10
MHRFKLLAEKVEEIVAKHAMAEIDYSDAPSEFRDPLMDTLMTDPVRLPSGTVMDRPIILRHLLNSPTDPFNRGMLTESMLEPVPELKERIQAWMREKQSSTH,-1.81747,"I1M, E2H, K3R, N18H, R20M, D30S, S56P, Q73G, Q89R, D101T",10
MEKFKLLAEKVEEIAALNAAAEIDYSDAPDEFRDPIMDTLMTDPVKLPSGEVMDRSVILRHLLNSQTDPFNRQPLTESMLEPVPELKEQIQAWMREKQSSDH,4.533801,"I1M, V15A, K17L, R20A, L36I, R46K, T51E, I57V, P66Q, M74P",10
IEKFKLLNEKVEEIVAKQNRAEIDYSDAPDEFRDQLMDTLMTDPVMLPSGTVMDRSVILRHLLNSPTDPFNRQMLTESMLEPVPELKERIQAWMRKKQGSDV,-0.32947734,"A8N, N18Q, A19N, P35Q, R46M, I57V, Q89R, E96K, S99G, H102V",10
IEKFKLLSEKVEEIVASHSRAEIDYSDAPEEFRDPLMDTLMTDPVRLPSGTVMDRSIILRHLLNSPTDPFNRSELTESMLVPLPELKEQIQAWMKEKQSSDH,-1.7450899,"A8S, K17S, N18H, A19S, D30E, Q73S, M74E, E81V, V83L, R95K",10
IEKFKLLAEKMEEIQAKNQRAELDYTDAPDEFRDPLMDTLMLDPVRLPSGNVMDRSIIMRHLLNSPTDPFNRQMLTESMLEPAPELKEQIQAWMKEKQSSDH,-1.9213469,"V11M, V15Q, A19Q, I23L, S26T, T42L, T51N, L59M, V83A, R95K",10
IEKFKLLAERAEQIVTRNAREEIDYSDAPEEFRDPLMDTLMTDPVRLPSGTVMDRSVILRHLLNSPTDPFNRQPLTESMLEPVPELKEQIQAWLREKQSSDH,2.646761,"K10R, V11A, E13Q, A16T, K17R, A21E, D30E, I57V, M74P, M94L",10
IEKFKLLAKKVEEIAAKNERAEIDYSDAPDEFRDPLMDTLMTDPVRLPSGTMMDRKIIVRHLLNSPTDPFNREMLTEDMLEPVPELKEQISAWIREKQSSDH,-0.3147615,"E9K, V15A, A19E, V52M, S56K, L59V, Q73E, S78D, Q91S, M94I",10
IEKMKCLSEKVEEIIASNAEAEIDYSDAPDEFRDPLMDTLMTDPVRLPSGTVMDRSIILRHLLNSPTDPFNRQPLTESMLEPVPELKEQIQKWIREKQSMDH,1.0574384,"F4M, L6C, A8S, V15I, K17S, R20E, M74P, A92K, M94I, S100M",10
IEKFKLLAEKVEELVAKQARAEIDYSDAPDEFRDPLMDTLMSDPVRLPSGTVMDRSVILRHLLNSETDPFTRQKLTESMLEPVVELKDKIQAWMREKQSSDH,4.092474,"I14L, N18Q, T42S, I57V, P66E, N71T, M74K, P84V, E88D, Q89K",10
IEKFLLLAKKCEEIVLKNQAAEIDYSDAPDEFRDPLMDTLMVDPVRLPSGTIMDRSIILRHLLNSPTDPFNRQMLTESMLVSVPELKEQIQAWMREKQSSDH,0.46238106,"K5L, E9K, V11C, A16L, A19Q, R20A, T42V, V52I, E81V, P82S",10
IEKFKLLAEKVEEVAVQQARDEIDYSDAPDEFKDPLMDTLMTDPVRLPSGNVMDRSIILRHLLNSPTDPFNRQMLTESMLEPVPELKEQIQAWMREKQKSDS,0.32817507,"I14V, V15A, A16V, K17Q, N18Q, A21D, R33K, T51N, S99K, H102S",10
IERFKLLTEKVEEIVAKQYTAEIDYSDAPDEFRDPLMDTLMTDPVRLPSGTVMDRSIILRHLLNSRTDPFNRQPLTEEMLEPVPELKEQIQAWKREKQSSTH,-1.1914144,"K3R, A8T, N18Q, A19Y, R20T, P66R, M74P, S78E, M94K, D101T",10
IEKFTLLAEKVEEIVAKNARAEIDLSDAPDAFRDPLMDTLMTDPVRLPSGKVMDRKIIMRHLLNSPTDPFNRQMLTESMLEPVPELKEQIQAWMRQKLSRDQ,-0.7723141,"K5T, Y25L, E31A, T51K, S56K, L59M, E96Q, Q98L, S100R, H102Q",10
IEKFKLLREKVEEIVAQHARAEIDYSDAPDEFRDPLMDTLMMDPVRLPSGTIADRSIILRHLLNSPTDPFNRQPLTESMLEPVPELKEKIQAWTREKTSSDH,0.50739366,"A8R, K17Q, N18H, T42M, V52I, M53A, M74P, Q89K, M94T, Q98T",10
IEKMKLLTEKVEEIVAKNARAAIDFSDAPDEFRDPLMDTLMTDPVRLPSGKVMDRSIILRHLLNSPTDPFNRQMLTEDMLEPVPELKERIQQWMHEKTSSDH,0.35763788,"F4M, A8T, E22A, Y25F, T51K, S78D, Q89R, A92Q, R95H, Q98T",10
IENFKELAAKVEAIVAENHRAEIDYSDAPDEFRDPLMDTLMTDPVRLPSGTVMDRPIILRHLLNSPTDPFNRQELTESMLEPVPELKEQIQAWMIEKQTSDH,0.38479507,"K3N, L6E, E9A, E13A, K17E, A19H, S56P, M74E, R95I, S99T",10
IHMFAKLAEKCEEIAAKNARAEIDYEDAPDEFRDELMDTLMTDPVRLPSGTVMDRSIILRHLLNSPTDPFNRQMLTESMLEPVPELKEQIQAWMRSKQASDH,-0.8427404,"E2H, K3M, K5A, L6K, V11C, V15A, S26E, P35E, E96S, S99A",10
IEKFKLLAEKVDEIVAKNARIEIDLSDVPDEFRDPIMDTLMTDPVRLPSGTIMDRSVILRHLLNSPTDPFNRQMLTESMLEPLPELKEQIQAWMREKQNSNH,4.016498,"E12D, A21I, Y25L, A28V, L36I, V52I, I57V, V83L, S99N, D101N",10
LEKFKLLAEKVEEIAAANMRAEIDYSDAPDEFRDPIMDTLMTDPVRLPSGTVMDRSYILRHLLNSPTDPFNRQPLTESMLEPVPELKEQIRAWLREKQASDH,5.038743,"I1L, V15A, K17A, A19M, L36I, I57Y, M74P, Q91R, M94L, S99A",10
IEEFKLLAEKIEEIVAQNVAAEIDYSDAPDEFRDPLMDTLMTDPVRLPSGTVMDRSIIMRHLLNSPTDPFNRQPLTEDMLEPVPELKEQIQAWMRERMSSDH,1.1573522,"K3E, V11I, K17Q, A19V, R20A, L59M, M74P, S78D, K97R, Q98M",10
IEKFKALNEKVEEIVAKNIRAEVDYSDAPDEFRDPLMDTLMTDPVRLPSGTIMDRSIILRHLLNSPTDPFNRQELTESMLEPVTELKEQIQDWIREKQSSDD,1.4424334,"L6A, A8N, A19I, I23V, V52I, M74E, P84T, A92D, M94I, H102D",10
MEKFKLLAKKVDDIVARNAREEMDYSDAPDEFRDPLMDTLMTDPVRLPSGTVMDRSIILRHLLNSPTDPFNRQMLTESMLEPAPELKEQIQAWMRKKQQSDH,0.09045276,"I1M, E9K, E12D, E13D, K17R, A21E, I23M, V83A, E96K, S99Q",10
IEKFKLLALKVEELVAKNARAEIDFSDAPDEFRDPLMDTLMTDPVRLPSGTVMDRPIILRHLLNSPTDPFNRSMLTEDMLEPVLELKEQIQAWIREKQSNKH,-0.15059152,"E9L, I14L, Y25F, S56P, Q73S, S78D, P84L, M94I, S100N, D101K",10
MEKFKLLAEKAEEIVAKHAQAEIDYSDAPDEFRDPLMDTLMTDPVRLPSGNIMDRRIILRHLLNSPTDPFNRQPLTESMLEPVPELKEQIQAWLREKQSSDT,1.1556106,"I1M, V11A, N18H, R20Q, T51N, V52I, S56R, M74P, M94L, H102T",10
KEKFKDLAEKVEEIVARNARAEIDYSDAPDEFRDPLMDTLMTDPVRLPSGHVMDRSIILRHLLNSPTDPFNRQMLTEGMLEPVPELKEQIEAWKREKASSGN,0.6246702,"I1K, L6D, K17R, T51H, S78G, Q91E, M94K, Q98A, D101G, H102N",10
MEDFKLLAEKTEQIVAANAPTEIDYSDAPDEFRDPLMDTLMTDPVRLPSGSVMDRSNILRHLLNSPTDPFNRQMLTESMLEPVPELKEQIQAWMREKQSTDH,-0.94850034,"I1M, K3D, V11T, E13Q, K17A, R20P, A21T, T51S, I57N, S100T",10
