Sequence,Score,Mutations,Number of Mutations
MYKFKLLAEKVEQLVAKNARAEIDYSDAPDEFRDPLMDTLMTDPVRLPSGTVMDRSIILRHLLNSPTDPFNRQPLTEDMLVPVVELKEQIQAWMREKLSLDH,-0.3155466,"I1M, E2Y, E13Q, I14L, M74P, S78D, E81V, P84V, Q98L, S100L",10
IEKFKELAEKVEEMVAKNAREERDYSDAPDEFRDPLMDTLMTDPVRLPSGTIMDRAIILRHLLNSPTDPFTRQMLTESMLEPVPELKEQIQAWMRKKQKSDD,4.730585,"L6E, I14M, A21E, I23R, V52I, S56A, N71T, E96K, S99K, H102D",10
IEKFKLLAEKVEELVAKNARADIDYSDIPDEFRDALMDTLMTDPVKLPSGTVMDRHAILRHLLNSPTDPFNRTMLTESMLEPVPELKEQIQAWMKEKQESDH,-2.7271032,"I14L, E22D, A28I, P35A, R46K, S56H, I57A, Q73T, R95K, S99E",10
IEDFKLLAEKVEEINAKNQLAEIDYSDAPDEFKDPLMDTLMTDPVRLPSGHVMDRSIITRHLLNSPTDPFNRQMLTESMLEPVPELKERIQAWMAEKRSSDH,1.3158419,"K3D, V15N, A19Q, R20L, R33K, T51H, L59T, Q89R, R95A, Q98R",10
IEKFKLLEERVEEIQATNARAEIDLSDAPDEFRDPLMDTLMTDPVRLPSGTVMDRSIILRHLLNSNTDPFNRQQLTESMLEPVPELKVQIQAWMREKVSSDD,1.6157317,"A8E, K10R, V15Q, K17T, Y25L, P66N, M74Q, E88V, Q98V, H102D",10
IEKFSLLAEKVEEIQVKNARAEIDYSDAPDEFRDPLMDTLMTDPVKLPSGTVMDRSIILRHLLNSPTDPFNRQPLTESDLEPVPELKERICAWMREKGLSDH,1.0039581,"K5S, V15Q, A16V, R46K, M74P, M79D, Q89R, Q91C, Q98G, S99L",10
IESFSLLAQKVDEIVAKNARAEIDYSDAPEEFRDPLMDTLMTDPVRLPSGTVVDRSIILRHLLNSETDPFNRQMLTESQLEPVTELKERIQAWMREKQSSDH,2.7411997,"K3S, K5S, E9Q, E12D, D30E, M53V, P66E, M79Q, P84T, Q89R",10
IEKFKLLGEKVEEIVAKNARAEIDYSDAPAEFRDPLMDTLMTDPVKLPSGTIMDRSIILRHLLNSPTDPFTRGPLTQSMLEPVPELKEQIQAWMSAKQSSDH,1.887286,"A8G, D30A, R46K, V52I, N71T, Q73G, M74P, E77Q, R95S, E96A",10
IPKFKLLAERCEEAVAKNARAEIDYSDAPDEFRDPLMDTLMTDPVRLPSGTVMDRSIILRHLLNSPTDPFNRQPLTEDMLEPVPELKEQIQAWMRTKQVLDD,-0.029475143,"E2P, K10R, V11C, I14A, M74P, S78D, E96T, S99V, S100L, H102D",10
IEKFKLLAEKVESIAAKNNRMEIDYSDAPDEFRDPLMDTLMTDPVRLPSGQIMDRSIILRHLLNSPTDPFNRQMLTESMLEPVPELKERIEAWMRAKQESDH,2.5158484,"E13S, V15A, A19N, A21M, T51Q, V52I, Q89R, Q91E, E96A, S99E",10
IEKFKLLAEKVEEIVAKNQRADIDYSDAPEEFRDPLMDTLMTDPVRLPSGTVMDRSVILRHLLNSETDPFNRMPLTESMLEPVMELKEQIQAWMREKRSSHH,0.7887417,"A19Q, E22D, D30E, I57V, P66E, Q73M, M74P, P84M, Q98R, D101H",10
IEKFNKLAEKVEMIVAKNARAEIDYSDAPDEFVDPIMDTLMTDPVRLPSGTVMDRSVILRHLLNSPTDPFNRQPLTESMLEPVPELKERIQQWMREKISSDH,3.1140194,"K5N, L6K, E13M, R33V, L36I, I57V, M74P, Q89R, A92Q, Q98I",10
IEKFKLLCQKSDEAVAKAAGDEIDYSDAPDEFRDPLMDTLMTDPVRLPSGNVMDRSIILRHLLNSPTDPFNRQMLTESMLEPVPELKEQIQAWVREKQSSDH,1.7983592,"A8C, E9Q, V11S, E12D, I14A, N18A, R20G, A21D, T51N, M94V",10
IEGFKLLAEKCDEIVQKQMREEIDLSDAPDEFRDPLMDTLMTDPVRLPSGTVMDRSVILRHLLNSPTDPFNRQMLTESMLEPVPELKEQIQAWMREKQSRDH,1.1130731,"K3G, V11C, E12D, A16Q, N18Q, A19M, A21E, Y25L, I57V, S100R",10
IEEFKLLAEKVEEIVAKNAAAEIDYSDAPDEFRDPIMCTLMTDPVRLPSGTVMDRAIILRHLLNSPTDPFNRGMLTESMLEPVPELREQIRAWMREKMSSDD,1.5326663,"K3E, R20A, L36I, D38C, S56A, Q73G, K87R, Q91R, Q98M, H102D",10
MEKFTLLKEKVEELVAKNARAEIDYSDAPDEFRDPLMDTLMTDPVRLPSGYVMDRAIILRHLLNSPTDPFNRQMLTESMLEPLPELRERIQAWMREKQSSDG,-0.31631854,"I1M, K5T, A8K, I14L, T51Y, S56A, V83L, K87R, Q89R, H102G",10
IEKFKTLAEKHEEIVAKRTAAEIDYSDAPDEFRDPLMDTLMTDPVRLPSGNIMDRSIILRHLLNSPTDPFNRQMLTEDMLEPVPELKEQIDAWMREKQRSDH,1.2222763,"L6T, V11H, N18R, A19T, R20A, T51N, V52I, S78D, Q91D, S99R",10
IEKFKLLSEKVEEIVAKNAAEEIDLSDAPDEFCDPLMDTLMTDPVKLPSGNVMDRSIILRHLLNSPTDPFNRQMLTESQLEPVPELKERIQAWMREKQQSDH,1.2270764,"A8S, R20A, A21E, Y25L, R33C, R46K, T51N, M79Q, Q89R, S99Q",10
IKKFKLLAEKVDEIAAKNARAELDYSDAPDEFKDPLMDTLMTDPVRLPSGTLMDRAIILRHLLNSPTDPFNRQMLTEDMLEPTPELKEQIQAWMREKQSIDH,-0.15586239,"E2K, E12D, V15A, I23L, R33K, V52L, S56A, S78D, V83T, S100I",10
IEGFKKLAEKVEEIVAANARAEVDYSDAPDEFRDKLMDTLMTDPVKLPSGTVMDRSIILRHLLNSPTDPFTRQPLTESMLEPLPELKEQIQAWMREKMSSDH,2.3521247,"K3G, L6K, K17A, I23V, P35K, R46K, N71T, M74P, V83L, Q98M",10
IAKFKELAEKCEEIAAQQARAEIDYSDAPDEFRDPLMDTLMTDPVRLPSGTVMDRSVILRHLLNSPTDPFNRTMLTESMLEPVPELKAQIQAWMREKLSSDH,-1.1031916,"E2A, L6E, V11C, V15A, K17Q, N18Q, I57V, Q73T, E88A, Q98L",10
IEDFALLAEKVEQIVVVNARAEIDYGDAPDEFRDPLMDTLMTDPVRLPSGNVMDRSIILRHLLNSPTDPFNRQMLTESMLEPVVELKEQIDAWMAEKQSSDH,0.18816128,"K3D, K5A, E13Q, A16V, K17V, S26G, T51N, P84V, Q91D, R95A",10
VETFKLLAEKVEEIVAANARAVIDYSDAPDEFKDPLMDTLMTDPVRLPSGTVADRSIILRHLLNSPTDPFNRQELTESMLEPLPELKEKIQAWMREKGSSDH,-0.8178874,"I1V, K3T, K17A, E22V, R33K, M53A, M74E, V83L, Q89K, Q98G",10
IEKFKLLAEKVEEIVLKEARAEVDYSDAPEEFRDPLMSTLMTDPVRLPSGTVMDRSIILRHLLNSPTDPFNRQMLNESMLEPVPELKEQIQAWMESRKSSDH,-0.9113257,"A16L, N18E, I23V, D30E, D38S, T76N, R95E, E96S, K97R, Q98K",10
IEKFKLLVEKVEEIAAQNARAEVDYSDAPDEFRDPLMDTLMCDPVRLPSGTVMDRAIIMRHLLNSPTDPFNRHMLTESMLEPVPELKEQIQAWMQEKQSSDY,-2.178964,"A8V, V15A, K17Q, I23V, T42C, S56A, L59M, Q73H, R95Q, H102Y",10
IEKFKLLAEKMEEIVDKSSRGEIDYSDAPDEFRDPLMDTLMTDPVRLPSGTVMDRSIILRHLLNSQTDPFNRQMLTESMLEPVPELKKQIQAWMRQKASHDH,-0.8185115,"V11M, A16D, N18S, A19S, A21G, P66Q, E88K, E96Q, Q98A, S100H",10
IEKFKLLAEKAEEIVAHNARAEIDYSDAPDEFRDPLMDTLMSDPVRLPSGTIMDRSVILRHLLNSPTDPFNRQMLTESMLESVPELKERIQAWMKEKKSSDT,-1.2540349,"V11A, K17H, T42S, V52I, I57V, P82S, Q89R, R95K, Q98K, H102T",10
IEKFKLLAEKVEEIVKENAAAEIDLSDAPDEFRDPLMDTLMTDPVRLPSGTIMDRSIILRHLLNSPTDPFNRQMLTESMLEPQPELKEQIQAWINEKAMSDH,1.9356937,"A16K, K17E, R20A, Y25L, V52I, V83Q, M94I, R95N, Q98A, S99M",10
IEKFRQLGEKARAIVAKNARNEIDYSDAPDEFRDPLMDTLMTDPVRLPSGTVMDRSIILRHLLNSPTDPFNRQMLTESMLEPVTELKERIQAWMREKGSSDH,-0.2535513,"K5R, L6Q, A8G, V11A, E12R, E13A, A21N, P84T, Q89R, Q98G",10
MEKFKSLAEKVEEIVQKNAAAEVDYSDAPDEFRDPLMDTLMTDPVRLPSGHVMDRSIILRHLLNSPTDPFNRQMLTESMLEPVIELKEKIHAWMAEKQSSDH,1.3112905,"I1M, L6S, A16Q, R20A, I23V, T51H, P84I, Q89K, Q91H, R95A",10
IEKFKTLAEKMEEIVARNAEEEIDYSDAPEEFRDPLMDTLMTDPVRLPSGTVMDRSIILRHLLNSPTDPFNRQMLTESMLEPVPELKERIHAWMREKQSRRH,1.2936825,"L6T, V11M, K17R, R20E, A21E, D30E, Q89R, Q91H, S100R, D101R",10
LAKFKLLQEKVTEVAAKNARAEIDYSDAPDEFRDPLMDTLMTDPVRLPSGTVCDRSIILRHLLNSPTDPFNRQMLTESMLEPVPELKERIQAWIREKQSADH,0.7826787,"I1L, E2A, A8Q, E12T, I14V, V15A, M53C, Q89R, M94I, S100A",10
MEKFKLLAEKVEEIVAKNALAEIDYSDAPDEFRDPLMDTLMTDPVRLPSGNVMDRKIILRHLLNSPTDPFNRTPLTEKMLEPVPELKEQIQAWIRSKQGSDH,0.22290458,"I1M, R20L, T51N, S56K, Q73T, M74P, S78K, M94I, E96S, S99G",10
IEKFKLLAKKVEESVAKNARDEIDYSDAPDEFRDALMDTLMTDPVRLPSGNVMDRSVILRHLLNSPTDPFNRQALTESMLEPVPELKEKIAAWMKEKQSSDH,-2.3847344,"E9K, I14S, A21D, P35A, T51N, I57V, M74A, Q89K, Q91A, R95K",10
IEKFKQLAEKVEEIEAKNARAEFDYSDAPDEFKDPLMDTLMTDPVRLPSGTVMDRSIILRHLLNSPTDPFNRQALTESMLEPQPELKEQILAWIRERRSSDH,2.6555705,"L6Q, V15E, I23F, R33K, M74A, V83Q, Q91L, M94I, K97R, Q98R",10
MENFKLLQEKVEAIVLKNARAEIDYSDAPEEFRDPLMDTLMTDPVKLPSGHVMDRSIILRHLLNSETDPFNRQMLTESMLEPVPELKEQIQAWMQEKQSSDH,0.20520422,"I1M, K3N, A8Q, E13A, A16L, D30E, R46K, T51H, P66E, R95Q",10
IEKFQLLSQKAEAIVAKNAVAEIDYSDAPEEFRDPLMDTLMTDPVRLPSGHVMDRSIILRHLLNSQTDPFNRQPLTESMLEPVPELKEQIQAWMREKQSSDH,0.8068348,"K5Q, A8S, E9Q, V11A, E13A, R20V, D30E, T51H, P66Q, M74P",10
IEKFKLLVEKVEEIYAKNLRAEIDYSDAPEEFRDPIMDTLMTDPVRLPSGTVMDRSIILRHLLNSPTDPFNRQPLTEKMLEPVPELKEQISAWMREKQSSLR,4.5408974,"A8V, V15Y, A19L, D30E, L36I, M74P, S78K, Q91S, D101L, H102R",10
IDKFKLLAEKVEEVVAKNARMEIDYSDAPDEFRDPLMDTLMTDPVRLPSGNVMDRSIILRHLLNSATDPFNRQMLTEEMLEAVPELKEQIQAWIRERMSSDH,0.5043304,"E2D, I14V, A21M, T51N, P66A, S78E, P82A, M94I, K97R, Q98M",10
IEKFRLLAEKVEQIVAKNARAEIDYSDAPDEFRDPLMDTLMTDPVRLPSGTVMDRSIILRHLLNSPTDPFNRQPLTQNMLEPVPELKEQIDAWKEEKQRSDF,-1.5216713,"K5R, E13Q, M74P, E77Q, S78N, Q91D, M94K, R95E, S99R, H102F",10
IEKFCMLAEKAEAIVAKHARAEIDYSDAPEEFRDPLMDTLMTDPVRLPSGHVMDRSIILRHLLNSQTDPFNRQPLTESMLEPVPELKEQIQAWMEEKQSSDH,0.8632338,"K5C, L6M, V11A, E13A, N18H, D30E, T51H, P66Q, M74P, R95E",10
IEQFKLLAEKVEEIVAQNARAELDYSDAPEEFIDPLMDTLMTDPVRLPSGTVMDRSIILRHLLNSPTDPFNRQMLTEDMLEPVPELKERIQAWMKEKQSSRK,-2.1452098,"K3Q, K17Q, I23L, D30E, R33I, S78D, Q89R, R95K, D101R, H102K",10
MEKFKELAEKVEELAAKNARAEIDLSDAPDEFRDPLMDTLMTDPVRLPSGTVVDRSIILRHLLNSETDPFNRQMLTESMLEPLPELKEQIQAWMAERQSSDH,2.7678862,"I1M, L6E, I14L, V15A, Y25L, M53V, P66E, V83L, R95A, K97R",10
EEKFALLAERVEETVAKAASAEIDYSDAPDEFRDPLMDTLMTDPVRLPSGTVMDRSIILRHLLNSPTDPFNRQELTESMLEPVPELREQIQAWLREKQLSDH,1.315166,"I1E, K5A, K10R, I14T, N18A, R20S, M74E, K87R, M94L, S99L",10
IERFKLLAEKVEEIVAKNARAEIDYSDAPDEFRDPLMDTLMTDPVKLPSGTIMDRSIILRHLLNSPTDPFNRMMLTEDQLEPLPELKEKIQAWMREKQSSKT,-0.3281206,"K3R, R46K, V52I, Q73M, S78D, M79Q, V83L, Q89K, D101K, H102T",10
IEEFKLLAEKVEALVAKNARAQVDYSDAPDEFRDPIMDTLMTDPVRLPSGTVMDRSIILRHLLNSPTDPFNRQMLTEDMLEPVDELKEQIQAWMREKLSSMH,1.2551982,"K3E, E13A, I14L, E22Q, I23V, L36I, S78D, P84D, Q98L, D101M",10
IEKFKLLANKVEEIVAKNARMEVDYSDAPEEFTDPLMDTLMTDPVKLPSGTVMDRSIILRHLLNSPTDPFNRQPLTESMLEPVPELKEQIQAWIRKKQSSRH,0.66227984,"E9N, A21M, I23V, D30E, R33T, R46K, M74P, M94I, E96K, D101R",10
IEKFKLLAGKVEEIAAKNAAAEIDYSDAPDEFRDPLMDTLMTDPVKLPSGNVMDRSVILRHLLNSPTDPFNRQALTEDMLEPVPELKERIQAWMREKQSSDP,1.6168647,"E9G, V15A, R20A, R46K, T51N, I57V, M74A, S78D, Q89R, H102P",10
IEKFKLLAEKAEAIVQKNARAEIDYSDAPDEFRDPLMDTLMTDPVRLPSGRIMDRSIILRHLLNSPTDPFNRKMLTESMLEPAPELKEKIGAWMREKASSDH,-0.98244274,"V11A, E13A, A16Q, T51R, V52I, Q73K, V83A, Q89K, Q91G, Q98A",10
IEKFKLLAEKVEGAKAKNARAEIDYSDAPDEFRDTLMDTLMTDPVKLPSGTVMDRSVILRHLLNSPTDPFNRQMLTESMLEPVPELKQQIQDWMDEKQSSTH,-2.4413261,"E13G, I14A, V15K, P35T, R46K, I57V, E88Q, A92D, R95D, D101T",10
IEKFKLLAEKVEELARKNARAEVDFSDAPDEFKDPLMDTLMTDPVRLPSGTVADRSVILRHLLNSPTDPFNRQMLTESMLEPVPELKEQIQAWMAEKRSSDH,0.630572,"I14L, V15A, A16R, I23V, Y25F, R33K, M53A, I57V, R95A, Q98R",10
IVKFKELAEKTEVIVAKNARAEIDYSDAPDEFKDPLMDTLMTDPVRLPSGTVMDRAIILRHLLNSPTDPFTRQMLTESMLVPVPELKERIQAWMREKQSDDH,3.4995413,"E2V, L6E, V11T, E13V, R33K, S56A, N71T, E81V, Q89R, S100D",10
MEKFKELAEKVEVIVASNARAEIDYSDAPDEFKDPLMDTLMTDPVRLPSGNVMDRVIILRHLLNSPTDPFNRQMLTESMLEPATELKERIQAWMREKQSSDH,-1.0252455,"I1M, L6E, E13V, K17S, R33K, T51N, S56V, V83A, P84T, Q89R",10
IEKFKYLAEKVEAIVAKCARQEIDYSDAPDEFRDPLMDTLMNDPVRLPSGTVMDRSIILRHLLNSPTDPFNRQMLTESMLEPATELKAQIQAWMKEKQSSDD,-2.3356347,"L6Y, E13A, N18C, A21Q, T42N, V83A, P84T, E88A, R95K, H102D",10
IEKFALLAQRVEEVVAHNARAEIDYSDAPDEFRDPLMDTLMTDPVKLPSGTVMDRSIILRHLLNSPTDPFNRQKLTESMLEPVPELKEQIQAWMREKQLVPH,-0.07043681,"K5A, E9Q, K10R, I14V, K17H, R46K, M74K, S99L, S100V, D101P",10
IKGFTLLAEKVEEIAAKQSRAEIDYSDAPDEFRDPLMDTLMVDPVRLPSGTVMDRSIIIRHLLNSPTDPFNRQMLTESMLEPVPELKEQIQAWRREKQKSDH,-0.715492,"E2K, K3G, K5T, V15A, N18Q, A19S, T42V, L59I, M94R, S99K",10
IETFKALAEKVEEIVEKQAREEIDYADAPEEFRDPLMDTLMTDPVRLPSGTVMDRAIILRHLLNSPTDPFNRQVLTESMLMPVPELKEQIQAWMREKQSSDH,1.6661326,"K3T, L6A, A16E, N18Q, A21E, S26A, D30E, S56A, M74V, E81M",10
IEKFKKLAEKVEELVVRNARAEIDYSDAPEEFRDPLMDTLMTDPVKLPSGTVMDRPIIQRHLLNSPTDPFTRQMLTESMLEPVPELKEQIQAWMREKQSSSH,4.2571845,"L6K, I14L, A16V, K17R, D30E, R46K, S56P, L59Q, N71T, D101S",10
FEKFKLLAEKAEEIAAKNARAEIDLGDAPDEFRDPVMDTLMTDPVRLPSGTVMDRSIILRHLLNSQTDPFNRQMLTENMLEPVPELKEQIQAWMREKMSSSH,-0.63625264,"I1F, V11A, V15A, Y25L, S26G, L36V, P66Q, S78N, Q98M, D101S",10
IEKFKLLAEKVDEIVLRNSQAETDYSDAPDEFRDPLMDTLMTDPVRLPSGHVMDRSIILRHLLNSPTDPFNRQMLTESMLEPVPELKAQIQAWMEEKRSSDH,-0.34514534,"E12D, A16L, K17R, A19S, R20Q, I23T, T51H, E88A, R95E, Q98R",10
IEKFKELKSKVEEIVAKNLNAEIDYSDAPEEFRDPLMDTLMTDPVRLPSGTIMDRSIILRHLLNSSTDPFNRQMLTESMLEPVPELKEQIHAWMREKQSSNH,1.9894218,"L6E, A8K, E9S, A19L, R20N, D30E, V52I, P66S, Q91H, D101N",10
IEKFKLLAEKFEAIAARNARAEIDYSDAPDEFRDPLMSTLMTDPVRLPSGTVMDRSIILRHLLNSPTDPFNRQPLTESMLEPVPELKERIQQWMRVKQSSDL,-0.8342547,"V11F, E13A, V15A, K17R, D38S, M74P, Q89R, A92Q, E96V, H102L",10
IERFKGLAEKVDEIVAKNTRAEIDYSDAPEEFRDPLMDTLMTDPVRLPSGTVMDRSVILRHLLNSPTDPFNRQMLTEDMLEPVPELKEKIQAWVREKQSADH,1.838821,"K3R, L6G, E12D, A19T, D30E, I57V, S78D, Q89K, M94V, S100A",10
MEKFKALAEKVESIVAKNAAAEIDYSDAPDEFRDPIMDTLMTDPVRLPSGTVMDRSIILRHLLNSPTDPFNRQMLTESMLEPVPELKERIQAWVRQKQRSDA,3.939944,"I1M, L6A, E13S, R20A, L36I, Q89R, M94V, E96Q, S99R, H102A",10
IEKFKLLAEKVEQIVSQRVRDDIDYSDAPDEFRDPLMDTLMTDPVRLPSGTVMDRSIILRHLLNSPTDPFNRQMLTEDMLEPVVELKEQIQAWMREKQSSDK,0.8909167,"E13Q, A16S, K17Q, N18R, A19V, A21D, E22D, S78D, P84V, H102K",10
VEKFKLLAEKVEEIVAKHQRAAIDYSDAPEEFKDPLMDTLMTDPVRLPSGTVMDRSVILRHLLNSPTDPFNRSMLTESMLEPVPELKEQIQAWLREKQSSDM,0.33866072,"I1V, N18H, A19Q, E22A, D30E, R33K, I57V, Q73S, M94L, H102M",10
MEKFKLLQENVEEIVAKNVIAEIDYSDAPDEFRDPLMDTIMTDPVRLPSGTVMDRSVILRHLLNSPTDPFNRQMLTEDMLEPVPELKEQIQAWVREKQSSDF,2.7387874,"I1M, A8Q, K10N, A19V, R20I, L40I, I57V, S78D, M94V, H102F",10
IEDFKLLAEKVEEIVAKNATAEIDYSDAPEEFRDPLMDTLMTDPVRLPSGTVMDRSIILRHLLNSPTDPFSRQPLTQDMLEPEPELKEQIQAWMREKMSSRH,-0.83477235,"K3D, R20T, D30E, N71S, M74P, E77Q, S78D, V83E, Q98M, D101R",10
IEKFQLLAEKVEEIVAKNARAEVDYSDAPDEFKDPLMDTLMVDPVRLPSGTVMDRCIILRHLLNSPTDPFNRLMLTEDQLEPVLELKEQIQAWMREKQSSDP,-0.68810856,"K5Q, I23V, R33K, T42V, S56C, Q73L, S78D, M79Q, P84L, H102P",10
IEKFKLLAEKVKEIATKNARAEADYSDAPDEFRDPLMDTLMTDPVRLPSGHVMDRSVILRHLLNSPTDPFTRQMLTESMLEPLPELKERIQAWMREKQSRDH,3.9456277,"E12K, V15A, A16T, I23A, T51H, I57V, N71T, V83L, Q89R, S100R",10
IEKFQLLAEKLEELLQKNLREEIDYSDAPDEFRDPLMSTLMTDPVRLPSGTIMDRSIILRHLLNSPTDPFSRQMLTESMLEPVPELKEQIQAWMREKQSSDH,-1.5296247,"K5Q, V11L, I14L, V15L, A16Q, A19L, A21E, D38S, V52I, N71S",10
AERFKELAEKVEEIAALNARAEIDYSDAPDEFRDPLMDTLMTDPVRLPSGTVMDRSVIMRHLLNSSTDPFNRQPLTESMLEPAPELKEQIQAWMREKQSSDH,-0.8373443,"I1A, K3R, L6E, V15A, K17L, I57V, L59M, P66S, M74P, V83A",10
MYKFKELAEKVENIVAANAAADIDYSDAPDEFRDPLMDTLMTDPVRLPSGTVMDRSIILRHLLNSPTDPFNRQMLSESMLEPVPELKEQIQAWMRGKQSSDG,0.7795092,"I1M, E2Y, L6E, E13N, K17A, R20A, E22D, T76S, E96G, H102G",10
MEKFKVLTEKVEQVVAKNAAAEIDYSDAPDEFRDPLMDTLMTDPVRLPSGNIMDRSIILRHLLNSPTDPFNRQMLTESMLEPVPELKEKIQAWMREKQGSDH,0.7378223,"I1M, L6V, A8T, E13Q, I14V, R20A, T51N, V52I, Q89K, S99G",10
IEKFKSLCSKVEEIVAKAARAEIDYSDAPDEFRDPLMDTLMVDPVRLPSGTVMDRKIIMRHLLNSPTDPFNRSMLTEDMLEPVPELKEQIQAWMREKQSSSH,2.0050964,"L6S, A8C, E9S, N18A, T42V, S56K, L59M, Q73S, S78D, D101S",10
IEKFKLLADRVSEIAAKNARAEIDYSDAPDEFCDPLMATLMTDPVRLPSGHVMDRSIILRHLLNSPTDPFSRQMLTEKMLEPVPELKEQIQAWMREKQSSTH,-1.2365823,"E9D, K10R, E12S, V15A, R33C, D38A, T51H, N71S, S78K, D101T",10
IEKFKLLAEKCEEVVAKNARAEIDLEDAPDEFRDPLMDTLMTDPVRLPSGQVMDRSVILRHLLNSPTDPFNRQMLTESSLEPVTELKEQIQAWIRQKQSSDH,0.27609998,"V11C, I14V, Y25L, S26E, T51Q, I57V, M79S, P84T, M94I, E96Q",10
IEKFTLLANKVEEIAAKNAREEIDYSDAPDEFLDPLMDTLMTDPVKLPSGTVMDRSIIIRHLLNSPTDPFNRQMLTEEMLEPVKELKEQIQAWVREKQSSDH,1.6404744,"K5T, E9N, V15A, A21E, R33L, R46K, L59I, S78E, P84K, M94V",10
IERFKLLCEKVDEIAAKNARAEIDYSDAPEEFRDPLMDTLMTDPVRLPSGTVMDRAIILRHLLNSPTDPFNRQMLTEGMLEPLPELKEQIQAWMKEKKSSDH,-1.3969121,"K3R, A8C, E12D, V15A, D30E, S56A, S78G, V83L, R95K, Q98K",10
IEKFKLLLEKVEEAATKNATAEIDYSDAPDEFKDPLMDTLMTDPVRLPSGTVMDRAIILRHLLNSPTDPFNREMLTESMLEPVLELKEQIQAWMRSKQSSDH,-1.6135855,"A8L, I14A, V15A, A16T, R20T, R33K, S56A, Q73E, P84L, E96S",10
IEKFKLLAEKVEEIVQKNMRAEIDYSDLPEEFRDPLMETLMTDPVKLPSGTVMDRSIILRHLLNSPTDPFTRQMLTESMLEPVPELKEQIQAWMRSKQSKDN,2.7438784,"A16Q, A19M, A28L, D30E, D38E, R46K, N71T, E96S, S100K, H102N",10
IEKFKLLREKVESLAKKNARDEIDYSDAPDEFRDPLMDTLMTDPVKLPSGTVMDRSIILRHLLNSPTDPFNRQMLTESMLEPVPELKERIQAWMREKYSSDT,1.1751657,"A8R, E13S, I14L, V15A, A16K, A21D, R46K, Q89R, Q98Y, H102T",10
IEKFRLLSEKIEEIVAKNTRAEIDYSDAPEEFRDPIMDTLMTDPVKLPSGRVMDRSVILRHLLNSPTDPFNRQMLTESQLEPVPELKEQIQAWMREKQSSDH,3.4833333,"K5R, A8S, V11I, A19T, D30E, L36I, R46K, T51R, I57V, M79Q",10
IERFKSLAEKTEEIVAKNAREEIDYSDAPDEFRDPLMDTLMTDPVRLPSGTVMDRSIILRHLLNSQTDPFNRQMLTESMLEPVSELKERIQAWRRTKLSSDH,0.3544132,"K3R, L6S, V11T, A21E, P66Q, P84S, Q89R, M94R, E96T, Q98L",10
IEKFNNLAEKAEEIVAKNARAQEDYSDAPEEFRDPLMDTLMTDPVRLPSGTVMDRSIIQRHLLNSPTDPFNRQMLTESMLEPVPELKEQIQAWIREKQSSRM,1.442539,"K5N, L6N, V11A, E22Q, I23E, D30E, L59Q, M94I, D101R, H102M",10
IEKFKLLAEKVEEISQKNARAEIDYSDAPDEFRDPLMDTLMTDPVRLPSGHVMDRSIILRHLLNSPTDPFNRQMLTESMLESVVELKEQIQEWMNAKLYSDH,-0.3186972,"V15S, A16Q, T51H, P82S, P84V, A92E, R95N, E96A, Q98L, S99Y",10
IEKFSKLARKVEEIVATNARAEVDYSDAPEEFKDPLMDTLMTDPVRLPSGTVMDRSIILRHLLNSPTDPFNRQMLTEDMLEPVPELREQIQAWMREKQRSDH,1.6942644,"K5S, L6K, E9R, K17T, I23V, D30E, R33K, S78D, K87R, S99R",10
MEKFKLLEEKCEEIVKKNARAEIDYSDAPDEFRDPLMFTLMTDPVRLPSGTVMDRSIILRHLLNSPTDPFNRQPLTESMLEPVPELKERIQAWMQEKLSRDH,0.35279632,"I1M, A8E, V11C, A16K, D38F, M74P, Q89R, R95Q, Q98L, S100R",10
IEKFKLLASKAEEIVAKNSEAEIDYSDAPDEFRDPLMDTLMTDPVRLPSGTVMDRSIILRHLLNSPTDPFNRQPLTESMLEPVPELKEQIQAWIAQKQSSSE,1.136498,"E9S, V11A, A19S, R20E, M74P, M94I, R95A, E96Q, D101S, H102E",10
IEKFKLLGEKVEEIATKKARAEIDYSDAPDEFRDPLMDTLMTDPVKLPSGTVMDRSIILRHLLNSPTDPFNRQMLTEDMLSPAPELKEQIQAWMREKQSSKK,-0.6244999,"A8G, V15A, A16T, N18K, R46K, S78D, E81S, V83A, D101K, H102K",10
KENFKLLSEKTEDIVAKNARAEIDLSDAPDEFRDPLMDTLMTDPVRLPSGNVMDRSIILRHLLNSPTDPFNRQMLTESMLEPVPELKERIQAWMREKQSSSN,0.75588644,"I1K, K3N, A8S, V11T, E13D, Y25L, T51N, Q89R, D101S, H102N",10
ISKFKLLEEKISEIVAKNARAEIDYSDAPDEFRDPLMDTLMTDPVRLPSGTVMDRSIILRHLLNSPTDPFNRQPLTESMLEPVPELKERIQAWMLEKQKCGH,0.88840926,"E2S, A8E, V11I, E12S, M74P, Q89R, R95L, S99K, S100C, D101G",10
IEKFKLLAEKVEEIVAKNARAEVDYSDAPDEFRDPLMDTLMTDPVRLPSGHVMDRAIILRHLLNSQTDPFNRQPLTQDMLEPVPELKEQIQEWKRQKQSSDH,0.037566215,"I23V, T51H, S56A, P66Q, M74P, E77Q, S78D, A92E, M94K, E96Q",10
IEKFKLLREKVSEIVAKQARTEIDYSDAPDEFKDPLMDTLMTDPVKLPSGTVMDRSIILRHLLNSKTDPFNRQMLTESMLEPVPELKEQISAWMRERQSSRH,0.3674801,"A8R, E12S, N18Q, A21T, R33K, R46K, P66K, Q91S, K97R, D101R",10
IEKFKLLAEKVEETVLQNHRAEIDFSDAPDEFRDGLMDTLMTDPVRLPSGTIMDRSIILRHLLNSPTDPFNRQMLTESMLEPVPELKEQIQQWMKEKQLSDH,-2.0316253,"I14T, A16L, K17Q, A19H, Y25F, P35G, V52I, A92Q, R95K, S99L",10
IEKFKRLAEKVEEIVAKNSNEEIDYSDAPEEFRDPLMSTLMTDPVRLPSGTVMDRSIILRHLLNSPTDPFNRSMLTESMLEPVPELKEQIQAWSREKQASQH,0.41738814,"L6R, A19S, R20N, A21E, D30E, D38S, Q73S, M94S, S99A, D101Q",10
MEKFKLLAHKVEEISAKNAAAEIDYSDAPDEFRDPLMSTLMTDPVRLPSGNVMDRSIIMRHLLNSPTDPFNRQMLTESMLEPVPELKERIQAWMREKTSKDH,-0.2709339,"I1M, E9H, V15S, R20A, D38S, T51N, L59M, Q89R, Q98T, S100K",10
IEKFKDLAEKVEEIVRSNAREEIDYSDAPEEFRDPLMDTLMTDPVRLPSGNVMDRSVILRHLLNSPTDPFNRQMLTESMLEPVPELKERIMAWMREKMSSDH,2.2051935,"L6D, A16R, K17S, A21E, D30E, T51N, I57V, Q89R, Q91M, Q98M",10
IEKFKLLNIKVEDLVAKNAIAEIDYSDAPDEFRDPLMDTLMTDPVRLPSGTVMDRSVILRHLLNSSTDPFNRQMLTESMLEPVPELKEKIQAWMREKQASRH,1.5109699,"A8N, E9I, E13D, I14L, R20I, I57V, P66S, Q89K, S99A, D101R",10
IEKFKELAEKVEEIVAKNALAEIDYEDAPDEFRDPLMDTLMTDPVKLPSGTVMDRSIILRHLLNSPTDPFNRQPLTESALEPVTELKDQIQAWLREKQSSRH,0.57734424,"L6E, R20L, S26E, R46K, M74P, M79A, P84T, E88D, M94L, D101R",10
IEKFKLLAEKVEMIVKERAEAEIDYSDAPDEFRDPLMDTLMTDPVRLPSGTVMDRSVILRHLLNSPTDPFNRSMLTENMLEPVPELKEKIQAWMREKQTSDH,1.2262903,"E13M, A16K, K17E, N18R, R20E, I57V, Q73S, S78N, Q89K, S99T",10
IEKFKLLCEKVEEIVTKNARDEIDYSDAPEEFRDPLMDTLMTDPVRLPSGTVMDRSVILRHLLNSPTDPFNRQMLTEDMLEPVPELKEQIQAWLRKKQLLDH,3.5761678,"A8C, A16T, A21D, D30E, I57V, S78D, M94L, E96K, S99L, S100L",10
MEKFKELAEKVEEMVAKNAEAEIDYSDAPDEFRDPLMSTLMSDPVRLPSGTVMDRSIILRHLLNSPTDPFNRQMLTEDMLEPVPELKEQIQQWMREKTSGDH,-0.5980565,"I1M, L6E, I14M, R20E, D38S, T42S, S78D, A92Q, Q98T, S100G",10
IEKFKLLTEKTERIVAKNARQEIDYSDAPDEFRDPLMDTLMTDPVRLPSGTVMDRSIILRHLLNSQTDPFNRQPLTEDMLEPAPELKEQIQSWMREKKSSDH,0.41726065,"A8T, V11T, E13R, A21Q, P66Q, M74P, S78D, V83A, A92S, Q98K",10
IEKFKLLASRVEEIVAKNNLAEIDYSDAPEEFRDPLMDTLMTDPVRLPSGTVMDRSLILRHLLNSPTDPFNRQPLTESMLEPVPELKEKIQAWIREKQSCDH,1.9796281,"E9S, K10R, A19N, R20L, D30E, I57L, M74P, Q89K, M94I, S100C",10
IEKFKALAEKVEEIVRKNERAEIDYSDAPDEFRDPIMDTLMTDPVRLPSGNVMDRSIILRHLLNSPTDPFNRQMLTESMLLPVPELKEKIQQWIAEKQSSDH,3.5911467,"L6A, A16R, A19E, L36I, T51N, E81L, Q89K, A92Q, M94I, R95A",10
IEKFKLLAEKVDEIVAKNARAEIDYSDAPDEFRDPIMDTLMTDPVRLPSGHVMDRSIILRHLLNSPTDPFNRQPLTADMLEPVPELKEQIQAWRREKTKSEH,2.9457154,"E12D, L36I, T51H, M74P, E77A, S78D, M94R, Q98T, S99K, D101E",10
IKKFKYLAEKVEEIVAKNQREEIDYSDAPDEFRDPLMDTLMTDPVRLPSGNIMDRSIILRHLLNSPTDPFNRQPLTESMLEPVPELKEQIQAWIRQKQSSDY,1.8022761,"E2K, L6Y, A19Q, A21E, T51N, V52I, M74P, M94I, E96Q, H102Y",10
IEKFKLLAEKVEEIVARNARSEIDYSDAPDEFTDPLMDTLMVDPVRLPSGNVMDRSIILRHLLNSDTDPFNRQMLTESMLQPVPELKERIQAWMRDKMSSDH,-1.0323346,"K17R, A21S, R33T, T42V, T51N, P66D, E81Q, Q89R, E96D, Q98M",10
IEKFKELAEKVEKIVAANARADIDYSDAPDEFRDPLMDTLMTDPVRLPSGTVMDRSVILRHLLNSPTDPFNRQPLTEDMLEPVPELKEQIQAWRRTKQSSDS,1.4567214,"L6E, E13K, K17A, E22D, I57V, M74P, S78D, M94R, E96T, H102S",10
PEKFSLLCEKVEEIVAKDAKAEIDYSDAPDEFRDPIMDTLMTDPVRLPSGTVMDRSIILRHLLNSPTDPFNRQMLTESMLEPVPELKEQIRKWMRSKQLSDH,2.931876,"I1P, K5S, A8C, N18D, R20K, L36I, Q91R, A92K, E96S, S99L",10
IEKFKSLAEKVEEIVAKNARAEIDFSDAPDEFRDPIMDTLMTDPVRLPSGTIMDRAIILRHLLNSPTDPFNRQPLTEDMLEPAPELKEQIQCWMREKQSSDQ,3.1441894,"L6S, Y25F, L36I, V52I, S56A, M74P, S78D, V83A, A92C, H102Q",10
IEKFKVLGEKVEEIVAKNAAAEIDYSDAPEEFRDPLMDTLMKDPVRLPSGTVMDRSIILRHLLNSPTDPFNRQPLDESMLEPVPELKEQIQQWLREKQSSFH,1.6794145,"L6V, A8G, R20A, D30E, T42K, M74P, T76D, A92Q, M94L, D101F",10
AEKFGLLAEKVEEIVTKNARREIDLSDAPDEFRDPLMDTLMTDPVRLPSGTVMDRSIILRHLLNSPTDPFNRQMLTESMLEPVTELKEKIQAWLREKQKSVH,0.3753925,"I1A, K5G, A16T, A21R, Y25L, P84T, Q89K, M94L, S99K, D101V",10
IETFKLLAEKTEEIVAKNLTAEIDYEDAPDEFRDPLMDTLMTDPVRLPSGTVCDRSVILRHLLNSPTDPFNRQMLTENMLEPVPELKEQIEAWMREKQSSEH,2.5001268,"K3T, V11T, A19L, R20T, S26E, M53C, I57V, S78N, Q91E, D101E",10
IEKFTLLAEKLEEVVQKNADAEIDYSDAPDEFRDPLMDTLMTDPVKLPSGTVMDRSVILRHLLNSPTDPFNRQMLTEEMLEPVPELKEQIQAWMRAKQESDH,0.32960397,"K5T, V11L, I14V, A16Q, R20D, R46K, I57V, S78E, E96A, S99E",10
IEKFALLHEKVEEIVAQNARADIDYSDAPEEFRDPLMDTLMTDPVRLPSGTVMDRSTILRHLLNSPTDPFNRQPLTESMLEPVPELKEQIQNWMREKQAADH,3.2591755,"K5A, A8H, K17Q, E22D, D30E, I57T, M74P, A92N, S99A, S100A",10
ISNFTLLAEKVEEIRAKEATAEIDYSDAPDEFRDPLMDTLMTDPVKLPSGTVMDRSIILRHLLNSPTDPFNRQSLTESMLEPVPELKEQIQAWMREKQQSDP,0.91374767,"E2S, K3N, K5T, V15R, N18E, R20T, R46K, M74S, S99Q, H102P",10
IEKFKLLAEKVEAIVAANAAAEIDYSDAPDEFRDPIMDTLMTDPVKLPSGTVMDRSIILRHLLNSPTDPFNRQELTEHMLEPVPELKEQINAWMREKQQSHH,3.6276438,"E13A, K17A, R20A, L36I, R46K, M74E, S78H, Q91N, S99Q, D101H",10
IQKLKDLADKVTEIVAKNARAEIDYSDAPQEFRDPLMDTLMTDPVRLPSGVVMDRSIILRHLLNSPTDPFNRQPLTESMLEPVPELKEQIQAWIREKQSQDH,1.3087227,"E2Q, F4L, L6D, E9D, E12T, D30Q, T51V, M74P, M94I, S100Q",10
MEKFKLLAEKAEEIVALNDRAEIDYSDAPEEFLDPLMDTLMTDPVRLPSGTVLDRSIILRHLLNSQTDPFNRQMLSEEMLEPVPELKEQIQAWMREKQSSDH,3.4903827,"I1M, V11A, K17L, A19D, D30E, R33L, M53L, P66Q, T76S, S78E",10
IEKFTLLAEKVEEIAAKNLRAEIDLSDAPDEFRDPLMDTLMTDPVRLPSGTVMDRSIILRHLLNSPTDPFNRQMLTQSLLEPVPELKEQIQEWMREKGISDT,-0.86203825,"K5T, V15A, A19L, Y25L, E77Q, M79L, A92E, Q98G, S99I, H102T",10
IEKFKILQEKVEVIVGKNMEAEIDYSDAPDEFRDPIMDTLMTDPVRLPSGTVMDRSVILRHLLNSPTDPFNRQMLTESMLEPVPELKTQIQAWMREKQSSKH,3.7762756,"L6I, A8Q, E13V, A16G, A19M, R20E, L36I, I57V, E88T, D101K",10
KEKFTLLCEKVEGIVAKNARDEIDYSDAPDEFRDPLMSTLMTDPVKLPSGTVMDRSIILRHLLNSPTDPFNRQMLTEDMLEPVPELKEQIQAWIREKQSSDK,0.052492097,"I1K, K5T, A8C, E13G, A21D, D38S, R46K, S78D, M94I, H102K",10
MERFKELDKKVEEIVAKNARAEIDYSDAPDEFRDPLMDTLMTDPVRLPSGNVMDRSIILRHLLNSSTDPFNRQMLTESMLEPVPELKERIQAWLREKQCSDH,-1.1220951,"I1M, K3R, L6E, A8D, E9K, T51N, P66S, Q89R, M94L, S99C",10
IEKFKLLREKVEEIVAKNAIAEIDLSDAPDEFRDPLMDTLMTDPVKLPSGTVMDRSIILRHLLNSPTDPFNRQMLEESMLEPAGELKEQIQAWMREKLSKQH,0.7515198,"A8R, R20I, Y25L, R46K, T76E, V83A, P84G, Q98L, S100K, D101Q",10
IEKFKLLCGKVEELVAKNARAEIDYSDAPDEFRDPLMNTLMTDPVRLPSGTVMDRSVIARHLLNSSTDPFNRAMLTESMLEPAPELKEQIQAWMREKQASDH,-1.4448009,"A8C, E9G, I14L, D38N, I57V, L59A, P66S, Q73A, V83A, S99A",10
IEQFAQLAEKVEEIVKKNARAEIDYSDAPDEFRDSLMDTLMTDPVRLPSGTVMDRSVILRHLLNSPTDPFNRQMLTESMLEPVPELKQQIQQWMREKQQSRH,-2.4109473,"K3Q, K5A, L6Q, A16K, P35S, I57V, E88Q, A92Q, S99Q, D101R",10
IEKFKLLAEKVEEIVAKNARAEIDYSDAPPEFRDPLMDTLMTDPVRLPSGTVMDRSIILRHLLNSQTDPFNRQMLDESMLEDVPELKERIQQWMREKKAELH,0.49539924,"D30P, P66Q, T76D, P82D, Q89R, A92Q, Q98K, S99A, S100E, D101L",10
IEKFKLLAENVDEIVAKNTREEIDYSDIPDEFRDPLMDTLMTDPVRLPSGTVADRSIILRHLLNSPTDPFNRTMLTESMLEPVPELKEQIQAWRREKSSQDH,0.46448615,"K10N, E12D, A19T, A21E, A28I, M53A, Q73T, M94R, Q98S, S100Q",10
IEKFKLLADKSEEIVQRNSRAESDYSDAPDEFRDPLMDTLMTDPVRLPSGTVMDRAIILRHLLNSQTDPFNRQMLTEDMLEPVPELKEQIQAWIREKQSSDH,1.0243088,"E9D, V11S, A16Q, K17R, A19S, I23S, S56A, P66Q, S78D, M94I",10
IEKFRLLAEKSEGIVAKNTQAEIDYSDAPDEFRDPLMDTLMTDPVRLPSGTIMDRSNILRHLLNSPTDPFNRLMLTESMLEPVPELKEKIQAWIREKQSSDH,0.27597302,"K5R, V11S, E13G, A19T, R20Q, V52I, I57N, Q73L, Q89K, M94I",10
IEKFAELSVKVETIVAKNARAEIDYSDAPDEFRDPLMDTLMTDPVRLPSGTIMDRSVILRHLLNSPTDPFNREMLTESMLEPVPELKEQIQAWMREKQHKDH,-1.070758,"K5A, L6E, A8S, E9V, E13T, V52I, I57V, Q73E, S99H, S100K",10
IEKFKLLAEKVDEVAAKNARAEIDYSDAPDEFRDPVMDTLMTDPVRLPSGTVMDRGIILRHLLNSPTDPFTRQMLTESMLEPVPELKSQIQAWLNEKQISDH,3.512117,"E12D, I14V, V15A, L36V, S56G, N71T, E88S, M94L, R95N, S99I",10
IEKFKLLEEKVESIVAAQTKEEIDYSDAPAEFRDPLMDTLMTDPVRLPSGTVMDRSIILRHLLNSPTDPFNRQMLTESMLESVPELKEQIQAWVREKQSSDH,2.258762,"A8E, E13S, K17A, N18Q, A19T, R20K, A21E, D30A, P82S, M94V",10
IDKFKFLAEKVEGIVAKNAKAEIDYSDAPEEFRDPLMDTLMTDPVRLPSGTVMDRSIIMRHLLNSPTDPFNRQMLTESQLEPVPELKEQIQAWIRQKQSNDH,0.6214835,"E2D, L6F, E13G, R20K, D30E, L59M, M79Q, M94I, E96Q, S100N",10
IEKFSLLAQKVEDIAAKNARAEIDYSDAPDEFRDPIMDTLMTDPVKLPSGTVMDRSIILRHLLNSPTDPFNRQMLTESMLEPVVELKEQIQAWLREKQSSSL,3.582791,"K5S, E9Q, E13D, V15A, L36I, R46K, P84V, M94L, D101S, H102L",10
IEKFQLLAEKVEELVAKNARAEVDYSDAPEEFRDPLMDTLMTDPVRLPSGNVMDRSIILRHLLNSPTDPFNRQPLTESMLEPMKELKDQIQAWMREKQRSDH,-0.41227114,"K5Q, I14L, I23V, D30E, T51N, M74P, V83M, P84K, E88D, S99R",10
IEKFKLLAEKIEETVAKNAQAEIDYSDAPDEFTDPVMDTLMTDPVRLPSGTVMDRSIILRHLLNSPTDPFNRQMLTEEMLEPVPELKEQIEAWMREKMQSDE,0.66179514,"V11I, I14T, R20Q, R33T, L36V, S78E, Q91E, Q98M, S99Q, H102E",10
IEKFKELAEKVEVITAKNAREEIDYSDAPDEFLDPLMDTLMTDPVRLPSGTVMDRPIILRHLLNSCTDPFNRQVLTESMLEPVVELKEQIQAWMRERQSSDH,1.6340322,"L6E, E13V, V15T, A21E, R33L, S56P, P66C, M74V, P84V, K97R",10
IEKFKLLAQKVEAIVAKNARAEIDYSDAPDEFTDPLMDTLMTDPVKLPSGTVMDRSIILRHLLNSPTDPFNRQPLSESMLEPVPELREQIQAWLREKQSSRK,-0.8685373,"E9Q, E13A, R33T, R46K, M74P, T76S, K87R, M94L, D101R, H102K",10
IEKFKLLGQKVDEIVAKNTKAEIDYSDAPDEFRDPLMDTLMTDPVKLPSGTIMDRSIILRHLLNSPTDPFNRQELTESMLEPAPELKEQIQAWMKEKQSSDH,-1.9138995,"A8G, E9Q, E12D, A19T, R20K, R46K, V52I, M74E, V83A, R95K",10
MEKFKLLAEKCEEIVAKNTRAEVDYSDAPEEFRDPIMDTLMTDPVKLPSGTVMDRSVILRHLLNSPTDPFTRQMLTESMLEPVPELKEQIEAWMREKQSSDH,7.163726,"I1M, V11C, A19T, I23V, D30E, L36I, R46K, I57V, N71T, Q91E",10
IEKFKLLAEKLEEIVAQNAQAEVDYSDAPDEFRDPLMDTLMTDPVKLPSGTIMDRSVILRHLLNSPTDPFNRQMLTEDMLEPVPELKEQIQAWMAEKQSSDQ,1.7697113,"V11L, K17Q, R20Q, I23V, R46K, V52I, I57V, S78D, R95A, H102Q",10
IEKFKLLAEKCEEIAAQNASAEIDYSDAPEEFRDPLMDTLMTDPVRLPSGAVMDRSIILRHLLNSPTDPFNRQPLTESQLEPVPELKEQIQNWMQEKQSSDH,1.1239702,"V11C, V15A, K17Q, R20S, D30E, T51A, M74P, M79Q, A92N, R95Q",10
MENFKLLAEKVEEIVAKNAAAEVDYSDAPEEFRDPLMDTLMTDPVRLPSGTVMDRNVILRHLLNSPTDPFNRQMLTESMLEPVPELREQIQAWMREKMSSGH,1.472111,"I1M, K3N, R20A, I23V, D30E, S56N, I57V, K87R, Q98M, D101G",10
