Sequence,Score,Mutations,Number of Mutations
INKFKLLAEKVEEIVAKQARAEIDYSDAPDEFRDPLMYTLMTDPVRLPSGTLMDRSIIRRHLLNSPTNPFNRQMLTESMLESVPELKTQIQAWMQEQQSSDH,2.7786965,"E2N, N18Q, D38Y, V52L, L59R, D68N, P82S, E88T, R95Q, K97Q",10
IKKFKDNAVKVEEIVVKNSRKEIDYSDAPDEFRDPLMDTLMTDPVRLPSGTVMDRSIILRHLKNSPTNPFNRQMLTESMLEPVPELKEQIQAWMREKQSSDK,1.942637,"E2K, L6D, L7N, E9V, A16V, A19S, A21K, L63K, D68N, H102K",10
IEKFKLLAEKVEEIVAKNARAEIDYSDAPNEFRCPLTDTLMTDPVRLPTGTVMDRSIILRHLQESPTSPFNRQMLTESSLEPVPELKEQIQAWMREKQQSFH,-2.0019336,"D30N, D34C, M37T, S49T, L63Q, N64E, D68S, M79S, S99Q, D101F",10
IEKFKLLAEKVEEIVAKNARAEIDTSLAPDEFRCPLMDTLMTDPVRLPSGTVMDRSIILDHLLNSPTNPFNRQPLTESMLEPVPELKEQIQAWMRRRSSSDF,2.0192254,"Y25T, D27L, D34C, R60D, D68N, M74P, E96R, K97R, Q98S, H102F",10
IEKIKLLAEKVEEQVAKNARAEIDYSDAPDEFRDPLMDTLMTDPVRLPSGTVMDRKNILEHLLSRPTNPFNRQMLTESMLVPVPELKEQIQAWMREKQSKDH,0.24289867,"F4I, I14Q, S56K, I57N, R60E, N64S, S65R, D68N, E81V, S100K",10
IEKFKLLTEKVEEIVAVNIRAEIDYSDAPDEFRDPLMLTIMTDPVRLPSGTVMDRSIIQRHLLNSPTNPFNRQMLTENMLIPVPELKMQIQAWMREKQSSDH,3.7252831,"A8T, K17V, A19I, D38L, L40I, L59Q, D68N, S78N, E81I, E88M",10
IEKFKSLAEKEEEIVSKNARAEIDYSDAPDEFRDPLMDTLMGDPVRLPSGTVLDRTIILRHLLNSPTHPFNRQMLTESMLEPVPELKERIQAWLREQQSSDH,1.0957944,"L6S, V11E, A16S, T42G, M53L, S56T, D68H, Q89R, M94L, K97Q",10
IEKFKLLAEKVEEFVAKNARAEIDYEDAPDEFRDPVMDDLMTDPVRLPDGTVMDRSLIMRHLLNSPTNPFNRQMLTESTLEPVYELKEQIQAWMREKQSSDH,1.0847359,"I14F, S26E, L36V, T39D, S49D, I57L, L59M, D68N, M79T, P84Y",10
IEKFKRLLEKVEEINAKNARAEIDYSQAPDEFRDPLMDTLMTDPVQLPSGTVMDRSIILRHLLNSPTNPFTRVMLTESMLQPVPELKEQINAWMREKQSSDH,5.1281033,"L6R, A8L, V15N, D27Q, R46Q, D68N, N71T, Q73V, E81Q, Q91N",10
IEKFQLLAEKVEEIFAKMHRAEINYSDAPDEFRDPLMDTLMTDPVRLPSGTVMDRSIILRHLQNSPTNPFNRQMLTESDLIPVPGLKEQIQAWMREKQSSDH,0.7303654,"K5Q, V15F, N18M, A19H, D24N, L63Q, D68N, M79D, E81I, E85G",10
IEKKKLLAEKVEEIVAENARAEIDYSDAPDEFRDPLMDTLMTDPVRLPSGTVMDRSIILRHLLNSQTNPFNRQMLTESMLEKVPELKERIQKWLREKQGRDH,2.3788562,"F4K, K17E, P66Q, D68N, P82K, Q89R, A92K, M94L, S99G, S100R",10
IEDFKLLAEKVEEIVAENARAEIDVSDAPAEFRDPLMDTLMDDPVRSPSGTVMDRSIILRHLLNSPTNPFNRQPLTESMLEPVPELKKQIQAWMRTKQSSDH,1.7920403,"K3D, K17E, Y25V, D30A, T42D, L47S, D68N, M74P, E88K, E96T",10
IEKFKLLAEKVEEIYAKNSDQWIDYSDAPDDFRDPLMDTLMTDPVRLPSGTVLDRSIILRHLLNSPTNPFNRQMLTESMLEPVPELKEQIQAWMRLKQSSDR,5.6285906,"V15Y, A19S, R20D, A21Q, E22W, E31D, M53L, D68N, E96L, H102R",10
IEKVDLLAKKVEEIVAKNARAEIRYSDAPDEFRDPLMDTLMTDPVRLPSGTVMDRSIILKHLLNQPTNPFNRQMLTESMIEPVPELKEKIQAWMREKQSSDQ,1.0663134,"F4V, K5D, E9K, D24R, R60K, S65Q, D68N, L80I, Q89K, H102Q",10
PEPFKLLAEKNEIIVAKNARYEIAYDDAPDEFRDPLMDTLMTDPVRLPSGTVMDRSIILRHLLSSPTNPFNRQMLTESMLEPVPELKEQIQAWMREKQSSDS,0.8038751,"I1P, K3P, V11N, E13I, A21Y, D24A, S26D, N64S, D68N, H102S",10
IEKFKLIAEEVEEIVAKNARAEIDYNDAPDEFRDPLTNTLMTDPVRLPSGTVMDRSIILRHLQRSPTNPFNRQMLTEDMLEPVPELKERIQAWMREKQSSDH,1.4204562,"L7I, K10E, S26N, M37T, D38N, L63Q, N64R, D68N, S78D, Q89R",10
IEPFKLIAEKVEEIVAKNARAEIDYDDAPDEFIDPLMDTLMSDPVRLPSGLVMDRSIILRHLLNSPTNPFNRQMLTESMLEPVPELKEQIQAWMISKQSADH,1.0680242,"K3P, L7I, S26D, R33I, T42S, T51L, D68N, R95I, E96S, S100A",10
IEKFKLLVEKVEENVADAARAVIDYSDAPDEFRDPLMDTLMTDPVRLPSGKVLDRSIILRHLLNDPTNPFNRQMLTESMLEPVPELKEQIQHWMREKQSSDH,5.7609334,"A8V, I14N, K17D, N18A, E22V, T51K, M53L, S65D, D68N, A92H",10
TEKFKLLAEKVEEIVAKNARAEIDYSKAPEYFRCPLMDTLMTDPVRLPSGTVMDRSIILRHLLNSNTNPFNRQMLTEENLEPVPELKEKIQAWMREKQSSDH,2.3102598,"I1T, D27K, D30E, E31Y, D34C, P66N, D68N, S78E, M79N, Q89K",10
MEKFKLLAEKVEKIVAKNQRAEEDYMDAPDEFRQPLMDTLMTDPVRLPSGTVMDRSIILRHLTNSPRNPFNRQMLTESMLEPNPELKEQIQAWMREKQSSDH,1.8042414,"I1M, E13K, A19Q, I23E, S26M, D34Q, L63T, T67R, D68N, V83N",10
IEKFKLLAEKVEELVAANARAEIDMSDAPDDFRDPLMDTLMTDPVRLPSGTVMDRSIILKHLLNSPTNPFNRQMLTESMLEPVPELKQRIQAWMREKQDVDH,3.9385557,"I14L, K17A, Y25M, E31D, R60K, D68N, E88Q, Q89R, S99D, S100V",10
EEKYKLLAKKVEEIVAKNARAEIDYSDAPDEFRDPLMYTLMTDPVRLPSGTVMDRSIILRHLLNSPTNPFNRTMLTESMLEPVIELKDQIQAWNREKQISDH,2.8055706,"I1E, F4Y, E9K, D38Y, D68N, Q73T, P84I, E88D, M94N, S99I",10
YQKFKLLAEKVEELVAKNAGAEIDYSDAPDEFRDPLMDTLMTDPVRLPSGTVLDRSIIVRHLLNSNTNPFNRQLLTESMLEPVPELKEQIQAWMREKRSSDH,5.404069,"I1Y, E2Q, I14L, R20G, M53L, L59V, P66N, D68N, M74L, Q98R",10
IEKYKLLAEKVEEIVAKNARAEIDYSDAPDEFRDPLTDTLMKDPVRLPSGTVMDRSIIERHLRSSPTNPFNRQKLTISMLEPVTELKEQIQAWMREKQSSDH,0.3897316,"F4Y, M37T, T42K, L59E, L63R, N64S, D68N, M74K, E77I, P84T",10
MEKFKLHAEKVEEIVAKNARAAIDYSDAPDEFRDPVMDTLMTDPVRLPSGTLMDRSIILRHLLNSPTNPFTREMLTESMLEPVPELKRQIQAWRREKQSSDH,1.8154013,"I1M, L7H, E22A, L36V, V52L, D68N, N71T, Q73E, E88R, M94R",10
IEEFKLLAEKVEEIVAKNTRTEIDYSDAPDEFRDPLMDTLMTDPVRLPSGTVMDRNIILQHLLNCPTNPFNRQMLTESMLEPVKELKEQIQAWIREQQSSDH,-0.74311006,"K3E, A19T, A21T, S56N, R60Q, S65C, D68N, P84K, M94I, K97Q",10
IEKFHLLAEKVEEIVAKNARAEIDYSDAPDEFRCPLMDTLMTDPVRLPSGTVMDRSIILRHLQNSPTNPFNRQTLTEAMLEPVPELKQQIQDWMLEKQSSDD,2.0362904,"K5H, D34C, L63Q, D68N, M74T, S78A, E88Q, A92D, R95L, H102D",10
MEKFKLLASKMVELVAKNARAEIDYSDAPDEFRDPLMNTLMTDPVRLPSGLVMDRSIILRHLLNSPTNPFNRQMLTESMLEPDPELQEQIQAWMREKQSSDH,0.21843106,"I1M, E9S, V11M, E12V, I14L, D38N, T51L, D68N, V83D, K87Q",10
IEKFKLLAQEVEEIVAKNSDAEIDYSDAPDEFRDPLMDTLMTDPVRLPSGTVMDRSIIKRHLLNSPTNPFNRQMLTESMLEPVPEMKQQIQAWMREKQSSIS,2.2471874,"E9Q, K10E, A19S, R20D, L59K, D68N, L86M, E88Q, D101I, H102S",10
IEKFNLLAEKVEEIVAKNALAEIDESDAPDEFRDPLMDTLMTDPVRLPSGTVMDRSIILKHLLNSPTNPFNRQMLTESMLEPVPTIKNQIQAWMKEKQSSFH,0.052702114,"K5N, R20L, Y25E, R60K, D68N, E85T, L86I, E88N, R95K, D101F",10
IEKFKLLQEKIEEIVAKNAEAEIHYADAPDEFRDPLMDTLMTDPVRLPSGTVMDRSIIMRHLLNSPTNPFNRQMLTESMLEPVPVMKEQIQAWSREKQSSDH,2.1998682,"A8Q, V11I, R20E, D24H, S26A, L59M, D68N, E85V, L86M, M94S",10
IEKHKKLAEKVEELVAKNARAEIDYSDAPDEFLDPLMDTLMIDPVRLPSGHVMDRQIILRHLLNSPTNPFNRQMLRQSMLEPVPELKEQIQAWMREKQSSDH,2.4381115,"F4H, L6K, I14L, R33L, T42I, T51H, S56Q, D68N, T76R, E77Q",10
DEKFKLLAERVEEIVAKNARAEIDASDAPDEFRDPIMDTLMTDPVRLPSGTVMDRSIILRHLLTSPTNPFNRQMLTESDLEPVPELKAQIQEWMREKQQSDH,3.0666995,"I1D, K10R, Y25A, L36I, N64T, D68N, M79D, E88A, A92E, S99Q",10
IEKYNLLAEKWEEIVMTNARAEIDYSDAPDEFRDPLMYTLMTDPVRLPSGHVMDRSIILRHLLNSPTNPFNRQMLTESMLEPVDELKEQITAWMREKQSSDH,5.6749334,"F4Y, K5N, V11W, A16M, K17T, D38Y, T51H, D68N, P84D, Q91T",10
IEKFKALATKVKEIVAKNQRQEIDYSDIPDEFRDPLMDTLMTDPVRLPSGTLMDRSIILRHLLNSPTNPFNRQMLTESMLQPVPELKEQIQAWMREKQSSKH,2.713159,"L6A, E9T, E12K, A19Q, A21Q, A28I, V52L, D68N, E81Q, D101K",10
IMKFKLLAEKNEEIVAKNARAEIDYSDAPDEFRCPLMDTLMTDPVRLPEGTVMDRSIILRHLLNSPTNPFTRQMLTESNLTPVPELKEKIQAWMREKRSSDH,5.8407965,"E2M, V11N, D34C, S49E, D68N, N71T, M79N, E81T, Q89K, Q98R",10
MEKFKQLALKVEEFVANNAAAEIDYSDAPDEFRDPLIDTLMTDPVRTPSGTVMDRSIILRHLKNSPTNPFNRQMLTESMLEPVPELKEQIQAWMREKQSSDH,1.2233725,"I1M, L6Q, E9L, I14F, K17N, R20A, M37I, L47T, L63K, D68N",10
IEKFKLLAEKVEEIVAKNARDEIQYSDAPDEFRDPLMDTLMRDPVRLPSGTIMDRSHILRHLLNSPTNPFNRQMLTERMLEPIPEIKEQIQAWMREKQSVDH,1.9331126,"A21D, D24Q, T42R, V52I, I57H, D68N, S78R, V83I, L86I, S100V",10
IEKFKELAEKVEEIVAKNARADFDYSDAPEEFRDPIMDTLMTDPVRLPSGTVMDRSIILRHLLSSPTNPFNRQPLTESMLEPVPELKAQIQAWMQEKQSSDH,5.1267214,"L6E, E22D, I23F, D30E, L36I, N64S, D68N, M74P, E88A, R95Q",10
IEKFKLLAEKVEEEVASNARAEIDYSDAPDEFLDPLMDTLMTDPVVLPFGTVMDRSIIIRHLLNSTTNPFNRQPLTESMLIPVPELKEQIQAWMREKQSSDH,2.3775144,"I14E, K17S, R33L, R46V, S49F, L59I, P66T, D68N, M74P, E81I",10
IEKFKELAFKAEEEVRKNARVAIDYSDAPDEFRDPLMDTLMTDPVRLPSGTVMDREIILRHLLNSPTNPFNRQMLTESMLEPVPELKEQIQAWMREKQSSEH,1.9532633,"L6E, E9F, V11A, I14E, A16R, A21V, E22A, S56E, D68N, D101E",10
IEKFKLLAEKVEEIKAKNARAEIDYSDAPDEFRCPLMLTLMTDPVRLPYGTVLDRSIILRHLLNSPTNPFNRQMLTESMLEPVPQLKAQIQAWMREHQSSDA,6.0480843,"V15K, D34C, D38L, S49Y, M53L, D68N, E85Q, E88A, K97H, H102A",10
IEKFKQLAEKNEEAVKKNATAEIDYSDAPEEFLDPLMDTLMTDPVRLPSGTVMDRSIILRHLLNSPTNPFNRLMLTESMLEPVPELKEQIQIWMREKQSSDH,2.3869557,"L6Q, V11N, I14A, A16K, R20T, D30E, R33L, D68N, Q73L, A92I",10
IEKFKLLAKEVNEIVASNARAEIDYSDAPDEFRDPLMDTIMTDPVRLPSGTVMDRSNILRHLNNSPTNPFNRVMLTESMLEPVPELKEQIQQWMREKQSSDH,1.9080168,"E9K, K10E, E12N, K17S, L40I, I57N, L63N, D68N, Q73V, A92Q",10
IVKFKLLAEKVEEIVAKNADAEIDYSDAPDEFRCPLMDTLMTDPVRLPSGTVMDRGNILRHLLNSPTNPFNRQMLTEDQLEPVPELKEQIQAWMRERQISDH,2.0970423,"E2V, R20D, D34C, S56G, I57N, D68N, S78D, M79Q, K97R, S99I",10
IEKFKILAAKVQEIVAKNDRAEEKYSDAPDEFRDPLMYTLMTDPVRLPSGTVMDRSIILRHLLTSPTNPFNRQMLTESMLEPVPELKEQIQDWMREKQSSDH,1.518257,"L6I, E9A, E12Q, A19D, I23E, D24K, D38Y, N64T, D68N, A92D",10
IMKFKLLAEKVEEIVAKNARAEIDDSDVPDEFRDPLMDTLMTDPVRLPSGAVMDRSIILRHLLNSPTNPFNRQSLTESMLTPAPELKEQIQLWMREKQSKDH,3.6103907,"E2M, Y25D, A28V, T51A, D68N, M74S, E81T, V83A, A92L, S100K",10
IEKFKLLAEKVEEIFIKNARAEIDYSDAPDEFRDPLMDMLMKDPVRLPSGTVMDRSIILKHLLNSPTNPFNRQMLTEDTLEPVPELKKQIQAWMREKKSSDH,-0.70434785,"V15F, A16I, T39M, T42K, R60K, D68N, S78D, M79T, E88K, Q98K",10
IEKFKKLAEKWEEIYAKNARATIDYSDAPDEFRDPIMDTLMVDPVRLPSGTVMDRSIILRHLLNSPTNPFNRQMLTESMIEPVPELKEQIKAWMRSKQSSDH,4.528656,"L6K, V11W, V15Y, E22T, L36I, T42V, D68N, L80I, Q91K, E96S",10
PEDFDLVATKVEEIVAKNARANIDYSDAPDEFRDPLMDTLMTDPVRLPSGTVMDRSIILRHLLKSPTNPFNRQMLTESMLEPVPELKEQIQAWMDRKQSSDH,-2.2527175,"I1P, K3D, K5D, L7V, E9T, E22N, N64K, D68N, R95D, E96R",10
IAKFALLAEKVENIVAKNARAEIDYSDAPDEFRDPLMYTLMTDPVRLPSGTTMDRSIILRHLGNSPTNPFNRQMLTESMLEPVPELKEQIQAWMDKKQSMDH,4.6631165,"E2A, K5A, E13N, D38Y, V52T, L63G, D68N, R95D, E96K, S100M",10
IEKFKLLAKKLETAVAKNARAEIDFSDAPDEFRCPLMDTLMTDPVRLPSGTVMDRSIILRHLLPSPTNPFNRQMLTENMLEPVPELKEQIQAWMREKASSDH,0.7074382,"E9K, V11L, E13T, I14A, Y25F, D34C, N64P, D68N, S78N, Q98A",10
IEKFKLLAEAVEGIVAKNARLEIDAGDAPDEFRDPLMDTLMTDPVMLPSGTVMDRSTILRHLLNSPTNPFNRQMLTESMLEPVYELKEQIFAWMREKQSSDH,4.230857,"K10A, E13G, A21L, Y25A, S26G, R46M, I57T, D68N, P84Y, Q91F",10
IEKFKLLAEKVEEIVAKNAVAEIRYSDAPDEFLDPLMDTLMTDPVRLPSGTVMDRSIILRHLLNSPNNPFNRIMLTETMLEPAPELKEQIEAWMREKQSSSH,0.01123544,"R20V, D24R, R33L, T67N, D68N, Q73I, S78T, V83A, Q91E, D101S",10
IELFKLLAEKVEEIVAKNARAELDYSDAPEEFRDPLMDTLMTDPVRLPSGKVMDRSIIERHLLNSPTNPFNRQMLTESMLEPVPELKEQIQAWMQEHQSSVY,3.0862243,"K3L, I23L, D30E, T51K, L59E, D68N, R95Q, K97H, D101V, H102Y",10
IIKFKKLAETVEEIVAKNARAEIDYSDAPDEFRDPLMDTLMTDPVRLPSGTVMDRPIILRHLLNSPTNPFNRQMLTENMLEPVPELKEQIQAWMRKKVSHDA,3.068268,"E2I, L6K, K10T, S56P, D68N, S78N, E96K, Q98V, S100H, H102A",10
IEDYKQLAEKVEEIVAKNARAEIDYSDAPDEFRDPLMDTLMTDPVRLPSGQVYDRSNILQHLKNSPTNPFNRQMLTERMLEPVPELKEQIQAWMREKQSSDH,1.8405128,"K3D, F4Y, L6Q, T51Q, M53Y, I57N, R60Q, L63K, D68N, S78R",10
SEKFKLLAEKVEEIVAKNARAEADYSDAPDEFRDPLMDTLMTDPVRLPSGTVMERSIILRHLRNSNTNPFNRQMLTESSLQPVPELKEQIQAWMREKQISDG,1.4066968,"I1S, I23A, D54E, L63R, P66N, D68N, M79S, E81Q, S99I, H102G",10
IEKFRLLAEKVEEIVAKNADAEIDYSDIPDEFRDPLMDTLMVDPVRLPSGTVMDRAIILRHLLNSPTNPFNREMLTEDMLEPVPELKEQIQAWMREKQSNDL,1.5028765,"K5R, R20D, A28I, T42V, S56A, D68N, Q73E, S78D, S100N, H102L",10
IEKFKALAEKVEEIVAKNARLEIDESDAPDEFRDPLMDELMTDPVRLPSGTVMDRSIILRHFLNSPTNPFNRQMLTESMLEPVPELKQRIQDWMREQQSSDH,2.148635,"L6A, A21L, Y25E, T39E, L62F, D68N, E88Q, Q89R, A92D, K97Q",10
IEKFKLLAEKVEEIVDKNARAEIDYSDAPDEFRDPLSAHLMTDPVRLPSGTVMDRSLILRHLLTSSTNPFNRQMLTESMVEPVPELKEQIQAWMREKQQSDH,-1.4995857,"A16D, M37S, D38A, T39H, I57L, N64T, P66S, D68N, L80V, S99Q",10
IEKEKLLAEKVEEIAAKNAELEIDYSDAPDEFRDPLMDTLMTDPVRLPSGTVMDRSIIMRHLRNSHTNPFNRQMLTESMLEVVPELKEQIQAWMREKQSQDH,2.3564415,"F4E, V15A, R20E, A21L, L59M, L63R, P66H, D68N, P82V, S100Q",10
IEKFKLPAEKVEQIVAKNARAEEDYSDAPDEFLDPLMKTLMTDPVRLPSGKVMDRSIILRHLLNSPTNPFNRQMLTESYLEPVPELKEQIRAWMKEKQSSDH,-0.14227325,"L7P, E13Q, I23E, R33L, D38K, T51K, D68N, M79Y, Q91R, R95K",10
IEKAFLLAEKVAEIGAKNARAEIDYSDAPDEFRDPLMDTLMTDPVRLPSGTVMDRSIILRHLLSAPTNPFNRQMLTESSLEPVPELKEQIQAWTREKESSDH,-1.0063845,"F4A, K5F, E12A, V15G, N64S, S65A, D68N, M79S, M94T, Q98E",10
IEKEKLLAEKVEEIVAKNARAEEDYNDAPDEFRDPIMDTLMKDPVRLPSGTVMDRSIILRHLKNSPTNPFTRQMLTESMLEPVPELKEQIQAWMREKQLSDT,9.810499,"F4E, I23E, S26N, L36I, T42K, L63K, D68N, N71T, S99L, H102T",10
IEKFKKLIEKVEEIVAKNARAEIEYSDAPDEFSDPLTDTLMTDPVRLPSGTVMDRSIILRHLLNSPTNPFNRQMLTESMVEPVPELKTQIQAWVREKQSSNH,-0.11786283,"L6K, A8I, D24E, R33S, M37T, D68N, L80V, E88T, M94V, D101N",10
IEKFKLLAEKVEEIVAKNARAELDYSDAPDEFRDPLMDTLMLDPVRLPSGTVMDRVIILRHLRNDPTNPFNRQPLTESMLEPVPELREQIKKWMREKQSSDH,2.8537388,"I23L, T42L, S56V, L63R, S65D, D68N, M74P, K87R, Q91K, A92K",10
IEQFKLLAEKVEEIVAKQARAEIDYSDAPDEFLDPLMDTLMLDPVRLPDGTVMDRSIILRHLLNSPTNPFNRQMLTESMLEPVQELKEQIDEWMQEKQSSDH,0.8657855,"K3Q, N18Q, R33L, T42L, S49D, D68N, P84Q, Q91D, A92E, R95Q",10
IAKLKLLAEKVEEIVAKNARDEIDYKDAPDEFRDPLMDTLMTDPVRLPSGTVMDRSIILRHLLNSPTNPFNRQMLTPSMLEPVPELKEDIKAWMREKLKSDH,2.7240293,"E2A, F4L, A21D, S26K, D68N, E77P, Q89D, Q91K, Q98L, S99K",10
LEKFKLLAEKVEEIVSKNARAEIDYSDAPDEFRDPLMYTLMTDPVRLPSGTVMDRSIILKHLLNSNTNPFNRQMLTESMLEPVPELKEQIQAWMNEKYSADY,2.3398929,"I1L, A16S, D38Y, R60K, P66N, D68N, R95N, Q98Y, S100A, H102Y",10
IEQFKMLAGKVEEIFAKNARAEIDYSDAPDEFRDPLMDTLMTDPVRLPSGTVMDRSIILTHLLNSNTNPFNRTMLTESMLEPVPELREQIQAWMREKQSSDA,0.10733946,"K3Q, L6M, E9G, V15F, R60T, P66N, D68N, Q73T, K87R, H102A",10
IEKSNLLREKVEEIVAKNARAEIDYSDAPDEFRDPLMDTIMTDPVRTPSGIVMDRSIILRHLLNSPTNPFTRQMLTESMLEPVPELKNQIDAWMREKQSSDH,7.1181865,"F4S, K5N, A8R, L40I, L47T, T51I, D68N, N71T, E88N, Q91D",10
IEKFKLLAEKVEEQVAKNARAEIDYSDAPDEFIDPLTDTLMTDPVKLPSGTVLDRSIILRHLLNSPTNPFNRQMLTESDLEPVEELKERIQAWMREKCSSDH,3.8976746,"I14Q, R33I, M37T, R46K, M53L, D68N, M79D, P84E, Q89R, Q98C",10
ITKFKLLAEKVEEIVAKNAIAEDDYSDAPDEFICPLMTTLMTDPVRLPSGTTMDRSIILRHLLNSPTNPFNRQMLTESMLEPVPELKEQIQAWMRRHQSSDH,0.46137154,"E2T, R20I, I23D, R33I, D34C, D38T, V52T, D68N, E96R, K97H",10
IEKFRLLLEKAEEIVAKNARAEIKYSDAPDEFVDPLMDTIMTDPVRLPSGTVMDRSIILRHLLNNPTNPFNRQMLTESMLEPVPELKEQIQAWMEEKQSKDH,0.15292925,"K5R, A8L, V11A, D24K, R33V, L40I, S65N, D68N, R95E, S100K",10
IEKFKLLAEKVNEIVAKNARAEIDMSAIPDEFRDPLMDTLMTDPVKLPSGTVMDRSIILNHLRNSPTNPFNRQMLTESMLEPVPELKERIQAWMREKYSSDH,1.0978743,"E12N, Y25M, D27A, A28I, R46K, R60N, L63R, D68N, Q89R, Q98Y",10
IDKFKLLAEKVEEIVAKNARAEIDYSDAPDEFRDPLMDTLMTDPVKLPSGTVMERSIILRHLLNSPTNPFNRQMLTESMLESYPELASQIQAWMNEKSSSDH,0.7787825,"E2D, R46K, D54E, D68N, P82S, V83Y, K87A, E88S, R95N, Q98S",10
IEKFKLLAELVEEIVKKHARAEIDYSDAPDVFLCPLMDTLMSDPVRLPSGTVMDRSIILRHLLNSPTNPFNRQMLTESMLEPVPELKEQIGKWMREKQSSDH,1.036299,"K10L, A16K, N18H, E31V, R33L, D34C, T42S, D68N, Q91G, A92K",10
ITKFKLLAEKVEAIVHKNAREEIDYSDAPDEFRDPLMFTLMRDPVRLPSGTVLDRSIILKHLLNSPTNPFNRQMLTESMLEPVPELKEQIQAWMREKQSSDY,6.1887035,"E2T, E13A, A16H, A21E, D38F, T42R, M53L, R60K, D68N, H102Y",10
MEKFKLLAEKVEEIVNANARAEIDHSDAPDEFRDPIMDTLMTDPVRLPSGTVMDRSIILRHLLNSQTNPFNRQSLTESDLEPVPELKEQIQAWMREKASSDH,4.7999983,"I1M, A16N, K17A, Y25H, L36I, P66Q, D68N, M74S, M79D, Q98A",10
IEHFKLLAEKVEEIVAHNARAEIDYSDAPDEFIDPLMDVLMTDPVRLPSGTVMDREIILRHLKNSPTNPFTRQMLTESMLEPVPELKEQIQAWMSEKRSSDH,3.235657,"K3H, K17H, R33I, T39V, S56E, L63K, D68N, N71T, R95S, Q98R",10
IEKFKLLTEKVEEIVAKNARAEIDYIDVPDEFRDPLMDTLMKDPVRLPSGTVMDRSCILRHLLNSPTNPFNRQMLTEDMLEPVPELKEQIQAWYRENQSSDK,5.3491325,"A8T, S26I, A28V, T42K, I57C, D68N, S78D, M94Y, K97N, H102K",10
IEKFKLLAEKVTESYAVNARAEIDYSDAPDQFRDPLMDDLMTDPVRLPSGQVMDRSIILRHLLNDPTNPFNRQMLTESMLEPVPELKEQIQAWMREKRSSDH,3.399325,"E12T, I14S, V15Y, K17V, E31Q, T39D, T51Q, S65D, D68N, Q98R",10
IEKFQLLAAKVEEIVAKNARAEIPYADAPDEFRDPLMDTIMLDPVRLPSGTMMDRSIILSHLLNSPTNPFNRQMLTESMLEPVPELKEQIYAWMREKQSSDH,2.1553292,"K5Q, E9A, D24P, S26A, L40I, T42L, V52M, R60S, D68N, Q91Y",10
IEKQKLLAERVEEIVAKNNRAEIDYADAPDEFRDPLMDTLMTDPVRLPSGTVMDRSIILKHLHNSPTNPFNRQMLTESMLVPVIELKEQILAWMREKQSSDH,3.4803143,"F4Q, K10R, A19N, S26A, R60K, L63H, D68N, E81V, P84I, Q91L",10
IEKFKLLAEKVEEIVAKNERIEIDYSDAPDEFRDPLMDTLMTDPVRLPSGTVMDRSIIQRHLLNSHTNPFNRQMLTESMLEPVPEWKEQIQAWMEESQSSKF,2.9442155,"A19E, A21I, L59Q, P66H, D68N, L86W, R95E, K97S, D101K, H102F",10
IEKFEVLAEKVEEIQAKYARAEIDYSDAPDEFRDPLMDTLMTDPVRLPSGKVMDRAIILRHLLNSPTNPFNRQELTESMLEPIPELKEQIQQWMREKQSSDH,2.444209,"K5E, L6V, V15Q, N18Y, T51K, S56A, D68N, M74E, V83I, A92Q",10
IEKAKLLAEKYNEIVAKNARAEIDYSDAPDEFRCPLMQTLMTDPVRLPSGTVMDRSIILRHLLSSPTNPFNRQMLTESQLEPVPEIKEQIEAWMREKQSSDH,-0.04403367,"F4A, V11Y, E12N, D34C, D38Q, N64S, D68N, M79Q, L86I, Q91E",10
IEKFKLLAEVVEEAVAKNARAEIDYSDAPDEFRDPLLDTLMTDPVRLPSGQVLDRTIILRHLLNTETNPFNRQMLTESMLEPVPELKEQIVAWMREKQSSDH,4.8315735,"K10V, I14A, M37L, T51Q, M53L, S56T, S65T, P66E, D68N, Q91V",10
IEQFKLLAEKVAEIVAKNARAEIDYSDAPDEFKCPLMDTLMTDPVRLPSGTVMDRSIILRHLLNSNTNPFNRQMLTESMLEPVPDLKEQIQLWMREKRLSDH,0.894487,"K3Q, E12A, R33K, D34C, P66N, D68N, E85D, A92L, Q98R, S99L",10
IEKFKLLAEKVEQIVAKRARAEINYSDAPDEFRDPLMDTLMTDPVRLPSGTVMDRQIILRHLLNSPTNPFNRTMLTESMLEPVSELKEQIQKWMREKQSSPD,-0.28745815,"E13Q, N18R, D24N, S56Q, D68N, Q73T, P84S, A92K, D101P, H102D",10
IEKFKLLAEKVEEITAKNKSAEIDYSNAPDEFRDPLMDTLMTDPVRLPSGTVMDRSTILRHLLNSPTNPFNRQMLTESMLEPVDSLKEQIQLWMREKASSDH,3.6437316,"V15T, A19K, R20S, D27N, I57T, D68N, P84D, E85S, A92L, Q98A",10
IEKFKNLQAKVEEIVAKNPRAEIDYSDAPDEFIDPLADTLMTDPVRLPSGTVMDRSIILRHLLNSPTNPFNRQMLTESMCEPVPELKEQIQAWMDEKQSSHH,-0.22523716,"L6N, A8Q, E9A, A19P, R33I, M37A, D68N, L80C, R95D, D101H",10
IEKFFLLAEKVEEFVAKNARAEIDYSDAPDWFRDPLMYTLMTDPVRLPSGTVMDRSIILEHLRNHNTNPFNRQMLTESMLEPVPELKEQIQAWMRKKQSSDH,3.4788256,"K5F, I14F, E31W, D38Y, R60E, L63R, S65H, P66N, D68N, E96K",10
IEKFKLLNNKVEEVVHKNARAEIVYDDAPDEFCDPLMDSLMEDPVRLPSGTVMDRSIILRHLLNSPTNPFNRQMLTESMLEPVPELKEQIQAWMREKQSSDH,1.470806,"A8N, E9N, I14V, A16H, D24V, S26D, R33C, T39S, T42E, D68N",10
IEKLKLLAEKVNKIDAENARAEIDESDAPDEFRDPVMDTLMTDPVRLPSGTVMDRSIILRHLRNSPTNPFNRQMLTESMLEPVPELKERIQAWMREKQSSDH,2.503923,"F4L, E12N, E13K, V15D, K17E, Y25E, L36V, L63R, D68N, Q89R",10
IEKFKLLAEKVENIVAQNNRAEITNSDVPDEFRDPLMDTLMTDPVRLPSGTVMDRSIILRHLLYSPTNPFNRQMLTESMLEPVPELKEQIQAWQREKQTSDH,4.1081247,"E13N, K17Q, A19N, D24T, Y25N, A28V, N64Y, D68N, M94Q, S99T",10
IEKSKLLAEKVEEIVAKNARAEIDYSDAPDEFRDPLMHTLMNDPVMLPSGTVMDRSLILKHLLNTPTNPFNRQPLTESMLEPVPELKEQIQAWMREKQSKDH,-1.3162484,"F4S, D38H, T42N, R46M, I57L, R60K, S65T, D68N, M74P, S100K",10
IEKFKLLAEKVEEIVAQNARDEIDVSDAPDEFRDPLMDTLMTDPVRLPSGTVFDRSIILRHLLNSPTNPFTRQMLTEDMLVPVPELKEQIQAWMRFKQSSKH,6.14183,"K17Q, A21D, Y25V, M53F, D68N, N71T, S78D, E81V, E96F, D101K",10
NEKFDLLADKVEEIVASNARAEIDYSDAPDEFRCPIMDTLMTDPVRLPSGTVMDRSIIVRHLLNSPTNPFNRQMLTESMLEPVPELKEQIQAWMREKESSDV,4.506221,"I1N, K5D, E9D, K17S, D34C, L36I, L59V, D68N, Q98E, H102V",10
IEKFKLDAEKVNKIVAKNARAEIDTSAAPDEFRDPLMDELMTDPVRLPSGTVLDRPIILRHLLNSPTNPFNREMLTESMLEPVPELKEQIQAWMREKQSSDH,1.4446976,"L7D, E12N, E13K, Y25T, D27A, T39E, M53L, S56P, D68N, Q73E",10
IEKFKLLAEKVKEIVAKNARAEIDYVDAPDEFRDPLMDTLMTDPVRLPSGHIMDRGIILRHLLNSPTNPFNRQPLTESMLEPVPELKEQIRSWMREYQSSDH,5.6475616,"E12K, S26V, T51H, V52I, S56G, D68N, M74P, Q91R, A92S, K97Y",10
IEKFKLLAEKVEEVVAKNSRAEIDYSDAPDEFKDPLMMTHMTDPVRLPSGTVMARSIILRHLLNSPTNPFNRQMLTESMLEPVPELKEQIQAWKREKPQSDH,-0.058857348,"I14V, A19S, R33K, D38M, L40H, D54A, D68N, M94K, Q98P, S99Q",10
IEQFQLLAEKVEEINAKNARAEIDYSDAPDEFLDPLMDTIMTDPVRLPSGTVMDRSAILRHLLNSPTNPFTRQMLTEYMLEPVPELKEQITAWMREKQSSDH,5.4991407,"K3Q, K5Q, V15N, R33L, L40I, I57A, D68N, N71T, S78Y, Q91T",10
IEDAKLLIEKVEEIVAKNARTEIDYSDAPDEFLDPLVDTLMTDPVRLPSGKVMDRSIILRHLLNSPTNPFNRQMLTEEMLEPVPELKEQIQAWMNEKQSSDH,1.6724359,"K3D, F4A, A8I, A21T, R33L, M37V, T51K, D68N, S78E, R95N",10
IEKFKLANEKVEEIVAKHARVEIDYSDAPDEFRDPLMDELMHDPVRLPSGTVMDRSIITRHLLSSPTNPFNRQMLTESMLEPVPELKEQIQAWMRLKQSSDH,1.2108223,"L7A, A8N, N18H, A21V, T39E, T42H, L59T, N64S, D68N, E96L",10
ISKFKLLAEKVDEIVAKAAEADIEYSDAPDEFRDPLMDTLMTDPVRLPEGTVMDRSIILKHLLNSPTNPFNRQMLTESMLEPVPELKEQIQAWVREKQSSDH,3.9118762,"E2S, E12D, N18A, R20E, E22D, D24E, S49E, R60K, D68N, M94V",10
IEKQALLAEKVEEIVNKNAEAEIDYSDAPDEFRDPLMDTLMTDPVRLPSGTIMDRDIILRHLLNSPTNPFNRQMLTEAMLEPVPELKEQIAAWMRDKQSSDH,3.474615,"F4Q, K5A, A16N, R20E, V52I, S56D, D68N, S78A, Q91A, E96D",10
REKTKLLAEKVEEIVDKNAVAEIDYSDAPDEFRDPLMDTVFTDPVRLPSGTVMDRAIILRHLLNSPTNPFNRQMLTESMLEPVPELKEQIQVWMEEKQSSDH,2.0091724,"I1R, F4T, A16D, R20V, L40V, M41F, S56A, D68N, A92V, R95E",10
IEKFKLLAEKVEEIVAKNALAEVDYSDAPDRFRDPLMYTLMTDPVRLPCGTVMDRSIILRHLQNSPTNPFNRQMLTESMLEPVPELKEQIEAWLKEKQSSDH,1.9965852,"R20L, I23V, E31R, D38Y, S49C, L63Q, D68N, Q91E, M94L, R95K",10
IEKFKLLVEEVEEIVAKNARKEIDYSDAPDEFLDPLMDTLMKDPVRLPSGTVMDRAIILRHLLNCPTNPFNRQMLTEDMLEPVPELKEQINAWMREKQSSDH,0.8031867,"A8V, K10E, A21K, R33L, T42K, S56A, S65C, D68N, S78D, Q91N",10
IEKFKLLAEKVEEIVAKNSDAEIEYSDAPDEFRDPLLDTLMTDPVRLPSGTVMDRSVILRHLNNSPTNPFNRQPLTESMLEPVPELKEQIQAWQREKQSSDY,5.0303845,"A19S, R20D, D24E, M37L, I57V, L63N, D68N, M74P, M94Q, H102Y",10
IEKFKLLAEKVEQIVAKNARCEDDYEDAPDEFRDPLMDTLMTDPVRLPSGTVLDRSIILKHLLNSPTNPFNRQMLTESMLEPVPELKEQIKAWMEEKHSSDH,6.512783,"E13Q, A21C, I23D, S26E, M53L, R60K, D68N, Q91K, R95E, Q98H",10
IEKFKLLAEKVEEIVAKNAPAEIDYSDAPDEFRDPLMDTLMTDPVRLPSGTVMDRSIILRHLLNSPTNPFNRQMLRENMLEAVPELKEKIQAWMKSHQSSDD,0.12479276,"R20P, D68N, T76R, S78N, P82A, Q89K, R95K, E96S, K97H, H102D",10
IEKFKLLAEKVEGIVAKNAREEIDYVDAPDEFRDPIMDTLMRDPVRLPSGTVMDRPIILRHLRNSPTNPFNRQMLTESMLEPVPELKEQIMRWMREKQSSDH,6.913496,"E13G, A21E, S26V, L36I, T42R, S56P, L63R, D68N, Q91M, A92R",10
IEKFRLYAGKVEEITAKNARAEIDYSDIPDEFRDPLMDTLMTDPVRLPTGTVMDRSIILRHLLNSPTNPFNRQMLTESDLEPVPELKEQIQLWMRSKQSSDH,0.87634766,"K5R, L7Y, E9G, V15T, A28I, S49T, D68N, M79D, A92L, E96S",10
ITKFKLLEEKVEEIVAKNARAEIDSSDAPDEFRDPLMDTLMTDPVRLPSGHTMDRSIILRHLLNSPTNPFNRQPLTESMLEPDPEMKEQIQAWIREKQSSDH,4.2727766,"E2T, A8E, Y25S, T51H, V52T, D68N, M74P, V83D, L86M, M94I",10
IEKFKLKAEKTEEIVAKNAQKEIDYSDAPDEFLDPLMDTLMTDPVRLPSGTVMDRSIILRHLLNSPTNPFNRQMLTESQLEDVPTLKEQIQAWMREKQSTDH,2.7559147,"L7K, V11T, R20Q, A21K, R33L, D68N, M79Q, P82D, E85T, S100T",10
IEKFKLLAEKVEDIVARNVREEIDYRDAPDEFRDPLMYTLMTDPVRLPSGTVMDRSIILRHLRNSPTNPFNRQMLTESMLEPVPEMKEQIQAWMREKQISDH,4.3680067,"E13D, K17R, A19V, A21E, S26R, D38Y, L63R, D68N, L86M, S99I",10
ILAFKLLADKVEEIKAKNARAEIDYSDAPDEFRDPLMDTLMTDPVRLPAGTVMDRHIILRHLLNKPTNPFNRQMLTESMLEPVPELKERIQAWMREKASSDH,2.429965,"E2L, K3A, E9D, V15K, S49A, S56H, S65K, D68N, Q89R, Q98A",10
IHKFKLLAEKVEEIVAKNARAEIDLSDAPDEFRDPLMDTLMTDPVRLPSGTIMDRIHILRHLRNSQTNPFNRQMLTESMLEPVPELKTQIQAWIREKQSSDH,3.645904,"E2H, Y25L, V52I, S56I, I57H, L63R, P66Q, D68N, E88T, M94I",10
IEKFKLLAEKVEEIVADNARAEIDYSDIPDEFRDPLMWSLMTDPVILPSGTVMDRSIILKHLLNSPTNPFNRQMLTESMLRPVPELKEQIQEWMRERQSSDH,0.55819416,"K17D, A28I, D38W, T39S, R46I, R60K, D68N, E81R, A92E, K97R",10
IEKFKLLYEKVEEIVAKNARAEIDYSDAPDEFRDPLMDTLFTDPVRLPSGTVIDRSIILRHLLNSPVNPFNRQMLTESMLEPVPLLKEQIEQWMTENQSSDH,3.6508386,"A8Y, M41F, M53I, T67V, D68N, E85L, Q91E, A92Q, R95T, K97N",10
IEKFKLLAEKVEEIVAKNQRAEIDYSDAPEEFCDPLMDTIMTDPVRLPSGTVMDRSIILRHLLNSLTNPFNRQMLTENMIEPVPELKEQIQAWLREKRSSDH,2.2927709,"A19Q, D30E, R33C, L40I, P66L, D68N, S78N, L80I, M94L, Q98R",10
MEEFKLLADKVDEIVAKNARAEIDYSDAPDEFRDPLMDTLMEDPVRLPSGTVYDRSIILRHLLSSPTNPFNRQMLTESMLEPVPELKQQINAWMREKQSSDH,1.9676485,"I1M, K3E, E9D, E12D, T42E, M53Y, N64S, D68N, E88Q, Q91N",10
MEKFKLLAEQVEEAVAKNALAEIDYEDAPDEFRDPLTYTLMTDPVRLPNGTVMDRSIILRHLLNSPTNPFNRQMLTEDMLEPVPELKEQIQAWMREKQSSDH,4.590372,"I1M, K10Q, I14A, R20L, S26E, M37T, D38Y, S49N, D68N, S78D",10
IEKFKNLVEKVEEIAAKNAEAEIDLSDAPDEFRDPLMDTLMTDPVKLPSGTIMDRSIILRHLNNSPTNPFNRQMLTEDMLEPVPELKEQIQAWMREKQSSDH,4.268168,"L6N, A8V, V15A, R20E, Y25L, R46K, V52I, L63N, D68N, S78D",10
IEKFKLLAEKVEEIQAKNMRAEIDYSDAPDEFRDPLMNTLMTDPVRLPSGTVMDRSIILRHLLISNQNPFNRQMLTESMLEPVPVLKEQIQAWMREKQSLRH,0.522164,"V15Q, A19M, D38N, N64I, P66N, T67Q, D68N, E85V, S100L, D101R",10
IEKFKLLAVKVEEIVAINARAEIDYSDPPDEFRDPLMDTLMTDPVRLPSGTVMDRSIILRHLLNNPTNPFTRYMLTESMLEPVPELKQQIAAWLREKQSSDH,4.5916796,"E9V, K17I, A28P, S65N, D68N, N71T, Q73Y, E88Q, Q91A, M94L",10
IPKFKELAEKVEEIVAKNARAEIDYSDAPDEFRDPLMDTLMEDPVRLPSGTVMDRSIILRHLLNSPTNPFNRHMLLESQLEPVPELKEQIQRWMRNKQSSKH,-1.2802908,"E2P, L6E, T42E, D68N, Q73H, T76L, M79Q, A92R, E96N, D101K",10
IEKFCLLAEKVEEIEQKNARAEIDYSDAPDEFRCPLMDTLMTDPVRLPSGTVMDRSIILRHLENSPTNPFNRQMLTESMLEPVPEIKEQIEAWMRTKQSSDY,2.616861,"K5C, V15E, A16Q, D34C, L63E, D68N, L86I, Q91E, E96T, H102Y",10
IEKNKLWAEKVDEIVAKNARANIDYSDAPDEFRDPLMDTLMTDPVILPSGTIMDRSIILRHLLNCPTNPFNRQMLTESMLEPVPELKEQIETWMREKQSSDH,-0.6775117,"F4N, L7W, E12D, E22N, R46I, V52I, S65C, D68N, Q91E, A92T",10
IEKFKLLAEKVEAIVAKNARNEIDYSDAPDEFRDPLMGTLMTDPVRLPSGVVMDRSIILRHLQNSPTNPFNRQSLTEKMLEPVPELKEQIDAWMREKQRSDH,1.1670946,"E13A, A21N, D38G, T51V, L63Q, D68N, M74S, S78K, Q91D, S99R",10
IEKYKLLAEKVERIVAKNARAEIDYSDAPDAFRDPLMFTLMTDPVRLPSGTVMDRSIILRHLLNSPTNPFNRQPLTESMLEPEPELKEQIQLWMREKQSRDP,1.3069891,"F4Y, E13R, E31A, D38F, D68N, M74P, V83E, A92L, S100R, H102P",10
MEKFKLTAEKVEEIVAKNVRAEFDYSDAPDEFRNPLMDTLMTDPVRLPSGTVMDRGIILRHLLSNPTNPFNRQMLTELMLEPVPELKEQIQAWMREKQSSDH,0.16305384,"I1M, L7T, A19V, I23F, D34N, S56G, N64S, S65N, D68N, S78L",10
ITKFKLLAEKVEEIVVKTARAEIDISDAPDEFRDPLMDTLMTDPVRLPDGTVMDRSIILRHLLNNPTNPFNRQMLTESMLEPVPTLKLQIQAWLREKQSSDH,0.96987665,"E2T, A16V, N18T, Y25I, S49D, S65N, D68N, E85T, E88L, M94L",10
QERFKLLAEKVTEIVAKNARAAIEYSDAPDEFRDPLMDTLMTDPVRLPSGTVMDRSIILRHLLNSPTNPFNRDMLTESMLEPVPELKEQIEAWMREEQSSKH,0.9128833,"I1Q, K3R, E12T, E22A, D24E, D68N, Q73D, Q91E, K97E, D101K",10
IEEFKLLAEKVEEIVAKNAETEIDYSDAPDEFRDPLMDTLMTDPVRLPSGHVMDRNIILRHLLNSPTNPFNRQVLTESMLEPNPELKEQIQAWMREKQSNIH,2.3880954,"K3E, R20E, A21T, T51H, S56N, D68N, M74V, V83N, S100N, D101I",10
IEKFKLLAEKVEEIVAKNARAEIDYSDAPDEFLDPLMDTLMTDPVTLPSGTVMERSIILRHLLNHPTNPFTRQMLTEEQLEPVPELKEQIQRWMSEKQSSDH,2.3369489,"R33L, R46T, D54E, S65H, D68N, N71T, S78E, M79Q, A92R, R95S",10
IEKAKLLAEKVEEGLAENARAEIDYSDAPQEFLDPLMDTLMQDPVRLPSGTVMDRSIILRHLLNSPTNPFNRQMLTESMLEPVPELKEQIQAWKREKQSMDH,3.2615075,"F4A, I14G, V15L, K17E, D30Q, R33L, T42Q, D68N, M94K, S100M",10
IEKFKLLAEKMEEIVAKNARAEIDYSMAPDEFRDPLMYTVMTDPVRLPSGHVMDRSIILRHLLNSNTNPFNRQPLTESMLEPVPELKERIQAWMREKQSSTH,4.138234,"V11M, D27M, D38Y, L40V, T51H, P66N, D68N, M74P, Q89R, D101T",10
IEKFKKLAEKAEEIVAKNGRAEDDYSDAPDEFRDPLMDTLMTDPVRLPSGYVMDRSIIIRHLLNSPTNPFNRKMLTESMLEPIPELKEQIQAWMREKQSSDK,2.7369308,"L6K, V11A, A19G, I23D, T51Y, L59I, D68N, Q73K, V83I, H102K",10
IEKFKLLAEKVEEIVGKNAKAEIDYGDAPDEFRDPLMDTLMTDPVRLPSGRVLDRSIILRHLLNSKTSPFTRQMLTESMLEPDPELKEQIQAWMRSKQSSDH,5.9944835,"A16G, R20K, S26G, T51R, M53L, P66K, D68S, N71T, V83D, E96S",10
IEKFKLLAEKVEEIVAKHARAEIDYSDAPDEFRCPLMYTLMTDPVRLPSGTVMDRQIILRHLLNSPTNPFNRQMLTEDMLQPVPGLKTQIDAWMREKQSSDH,3.9960124,"N18H, D34C, D38Y, S56Q, D68N, S78D, E81Q, E85G, E88T, Q91D",10
IEKFKLLAEKVKEISARNASAEIDVSDAPDEFRDPLMDTLMVDPVRLPSGHVMDREIILRHLLNSPTNPFNRQMLTESMLEPVPELKEQIQAWMREKESSDH,3.521501,"E12K, V15S, K17R, R20S, Y25V, T42V, T51H, S56E, D68N, Q98E",10
IEKFILLAEKVEEIVAGNRDAEIDYSDAPDEFRDPLMDTLMTDPVRLPSGTVMDRAIIERHLLNSPTNPFNRQMLTESMLEPVPELKEQILAWMDEKQTSDH,3.42164,"K5I, K17G, A19R, R20D, S56A, L59E, D68N, Q91L, R95D, S99T",10
IEEFKLLAEKVKEIEEKNARAEIDYSDAPDEFRDPLMDTIMTDPVRLPSGTVMDRSIIARHLLSSPTNPFNRQMLSESMLEPVPELKEQIQAWMREKKSSDH,2.1121893,"K3E, E12K, V15E, A16E, L40I, L59A, N64S, D68N, T76S, Q98K",10
