Sequence,Score,Mutations,Number of Mutations
QDKFKLLAEKVEEIVAKNARAEIDYHDAPDEFIDPLMQTLMTDPVLLPSGYVMDRPIILRHLLNSPTNPFNRQMLTESMLEPVPELKAQIQAWMREKQSSDH,0.6623421,"I1Q, E2D, S26H, R33I, D38Q, R46L, T51Y, S56P, D68N, E88A",10
MEQFKLLAEKNEEIVAKNNRAEIDYSDAPDEFRDPLMYTLMTDPVILPSGHVMDRSIILRHLLNSPTNPFNRQMLTESMLEPVPEIKEQIQRWMREKQSSDH,2.1913505,"I1M, K3Q, V11N, A19N, D38Y, R46I, T51H, D68N, L86I, A92R",10
QEKFKLLAEKVEEIVAKNSRAELDYSDAPEEFRDPLMDTLMTDPVRLPSGHVMDRSIILRHLLNSPTNPFNRQMLTEEMLEPVPELKIQIQAWMRERRSSDH,3.7572556,"I1Q, A19S, I23L, D30E, T51H, D68N, S78E, E88I, K97R, Q98R",10
IEKFKLLAEKSHEIVAKNAYAEWDYEDAPDEFRDPLMDRLMTDPVRLPSGTVMDRSIILRHLLNQPTNPFNRQMLTEDMLEPVPELKEQIQAWMRERQSSDH,3.872643,"V11S, E12H, R20Y, I23W, S26E, T39R, S65Q, D68N, S78D, K97R",10
IEKFKLRAEKLEEIVAKNARAEIDYSDAPDEFRDPLMDTLMTDPVKLPSGTVMDRSIILKHLLNSPTNPFNRVTLFESMLEPVPELKEQIQAWMEEKKSSDH,1.550735,"L7R, V11L, R46K, R60K, D68N, Q73V, M74T, T76F, R95E, Q98K",10
EEKFKLLAEKVEEIVAKNVRAEIDYSDAPDEFRDPIMDTLMTDPVRLPSGTVMDRSIILRHLLVSPTNPFTREMLTESQLEPVPELKEQIQKWMAEKQSSDH,5.6318398,"I1E, A19V, L36I, N64V, D68N, N71T, Q73E, M79Q, A92K, R95A",10
IEKFKLLAEKVEELVAKNARAEIDYDDAPDEFRDPLMDTLMTDPVRLPSGTVLDRSIILRHLLSSPTNPFNRQMLTEDMIEPVPELKEKIQAWMREKQAEDH,6.423167,"I14L, S26D, M53L, N64S, D68N, S78D, L80I, Q89K, S99A, S100E",10
IEKFKLLAEKVEEEKARNARAEIDYSDVPDEFRDPLMDTLMTDPVRLPSGTVMDRSIILRHLLNSPTNPFNRQPLTESMLEPVPSLKEQIMAWMREKQSGSH,2.680785,"I14E, V15K, K17R, A28V, D68N, M74P, E85S, Q91M, S100G, D101S",10
IEKFKLLREKVEELVAKNARAEIDYSDAPDEFRDPLMDTLMTDPVRLPSGTVMDRSIILRHLLNSETNPFNRSMLTESMLEPVPELKQQIQAWIRSKQSSRP,1.9034386,"A8R, I14L, P66E, D68N, Q73S, E88Q, M94I, E96S, D101R, H102P",10
MEKFKLLAEKTQEIVRKNARAELDYQDAPDEFRDPLMDTLMTDPVRLPSGTVMDRSIIQRHLLNSPTNPFNRQMLTENMLEPVLELKEQIQAWMREKQSSDH,1.9718227,"I1M, V11T, E12Q, A16R, I23L, S26Q, L59Q, D68N, S78N, P84L",10
IEKGKLLMEKVEEIVIRNAFAEIDYSDAPDEFRDPLMDDLMTDPVRLPSGTVMDRSIILRHLQNSPTNPFNRQMLTESMLEPVPELKEQIQAWLREKQSSDA,5.569729,"F4G, A8M, A16I, K17R, R20F, T39D, L63Q, D68N, M94L, H102A",10
IEKFKLTAEKVEEIVAKNARAEIDYSDAPDEFLDPLMDTLMLDPVRLPSGTVLDRSIILRHLLNEPTNPFTRQMLTESMLEPVPELKMQIQAWMREKDSSDT,9.631387,"L7T, R33L, T42L, M53L, S65E, D68N, N71T, E88M, Q98D, H102T",10
IEKFKLLAEKVEEIFAKNARNEIDYSDAPDEFRDPLMDTLMTDPVRLPDGTVMDRSIILRHLLNSPTNPFNREMLTESMLEPVPQLKEQIQHWKREKQVKDH,0.8437766,"V15F, A21N, S49D, D68N, Q73E, E85Q, A92H, M94K, S99V, S100K",10
IEKFKLLAEKVNEIVAKSARREIDYIDAPDEFLDPLMDTLMTDPVKLPSGTVMDRSNILRHLLNSPTNPFNRQMLTISMLEPVPELKEQIQAWMREKQSNDH,0.68999076,"E12N, N18S, A21R, S26I, R33L, R46K, I57N, D68N, E77I, S100N",10
IEKFRALAEKVEEIVAKAAVAEIDYSDAPDEFRDPLMDTLMTDPVRLPWGTVMERSIILRHLLNSPTNPFNRQPLTESMLEPVPELKEQIQAWMRTKKSSDH,2.747089,"K5R, L6A, N18A, R20V, S49W, D54E, D68N, M74P, E96T, Q98K",10
IPKFKLLAQKVEEIVADTARAEIDYSDAPDEFRDPLLDTLMTDPVRLPSGIVMDRSIILRHLLNNPTNPFNRQMLTESMLFPVPELKEQIQAWMREKGSSDH,2.6394205,"E2P, E9Q, K17D, N18T, M37L, T51I, S65N, D68N, E81F, Q98G",10
IFKFKLLAEKVETLFAKNARAEIDYSDAPDEFRDPLMDTLMTDPVRLPSGTVVDRSIIMRHLLNSPTNPFNRQHLTESMLEPVPELKEQIQCWMREKQSSAH,4.1087523,"E2F, E13T, I14L, V15F, M53V, L59M, D68N, M74H, A92C, D101A",10
IEKFKLLNEKVEEIVAHNDRAEVDYADAPDEFRCPLMDTLMTDPVKLPSGTVMDRSIILRHLLNSPTNPFNRQMLTEAMLVPVPELKEQIQAWMREKQSSDH,2.714644,"A8N, K17H, A19D, I23V, S26A, D34C, R46K, D68N, S78A, E81V",10
MEKFKLLAEKVEEIVAKNARAEIDLSDAPDEFRDPLMDTLMTDPVRLPDGTVMDRSIIVRHLLSVGTNPFNRQMLTESMLEPVPELRERIQAWMREKQSSDH,0.2598474,"I1M, Y25L, S49D, L59V, N64S, S65V, P66G, D68N, K87R, Q89R",10
INQFKLLAEKVEEIVNKNARAEIDYSDAPDEFRDPLMYTLMTDPVRLPSGTVMDRTTILRHLLNSPTNPFNREMLTESMLEPVPELKEQIQAWMAEKQSSKH,3.1621592,"E2N, K3Q, A16N, D38Y, S56T, I57T, D68N, Q73E, R95A, D101K",10
IEKFKLLAERVEEIVAENARNEIDYSDAPDEFRDPIMDTLMTDPVRLPSGTILDRSIILRHLLNHPTNPFNRIMLTESMLEPVPELKEQIQAWMAEKQSSDH,8.310854,"K10R, K17E, A21N, L36I, V52I, M53L, S65H, D68N, Q73I, R95A",10
IEKFKLLVEKVEEIVAKNARAEIDYSDAPDEFRDPIMDDLMTDPVRLPSGTVMDRSIILRHLLNSPTNPFNRQNLTEQMLEPVPELKEQIDAWTNEKQISDH,5.005821,"A8V, L36I, T39D, D68N, M74N, S78Q, Q91D, M94T, R95N, S99I",10
IEKFKDLAKKVEEIVAPNSRAEFDYSDAPDEFRDPLMDTLMTDPVRLPSGTVMDRSLILRHLLNSPTNPFNRSMLTESMLEPVPELKEVIQAWMREKQSRDH,1.4674885,"L6D, E9K, K17P, A19S, I23F, I57L, D68N, Q73S, Q89V, S100R",10
IEKFKKLAEKVEEIVAKNARAELDVADAPSEFMDPLMDTLMTDPVRLPSGHVMDRSIILRHLLNSPTNPFNRQMLTESMLEPVPELKEQIQKWMREKLSSDH,2.4616847,"L6K, I23L, Y25V, S26A, D30S, R33M, T51H, D68N, A92K, Q98L",10
IEKFKLQAEEVEEEVAKNNRQEIDYSDAPDEFRDPIMDTLMTDPVRLPDGTVMDRSIILRHLLNSPTNPFTRQMLTESMLLPVPELKEQIQAWMREKQSSDH,9.612112,"L7Q, K10E, I14E, A19N, A21Q, L36I, S49D, D68N, N71T, E81L",10
IEANKLLAEKVEKIVAKNARAEIDYSDAPDEFRNPLMDTLMTDPVRLPSGTVMDRSIILRHLLNNPTNPFNRQPLTESMLEPVPELKEQIQNWLREKQSKDH,1.2237387,"K3A, F4N, E13K, D34N, S65N, D68N, M74P, A92N, M94L, S100K",10
IDKFKLLAEKVEEIVAKNMRAEIQYSDAPDEFRDPLMYTLMTDPVRLPSGTVLERSIILRHLLNSPHNPFNRQPLTESMLEPVPELKRQIQAWMREKQSSDH,6.0878944,"E2D, A19M, D24Q, D38Y, M53L, D54E, T67H, D68N, M74P, E88R",10
AEVFKLLAEKVEEIVAKDDQAEIDYSDAPDEFRDPLMDTLMTDPVRLPSGTVMDRSIILRHLLNNPTNPFNRQMLTESTLEPVPELKRQIQAWMAEKQSSDH,0.12940031,"I1A, K3V, N18D, A19D, R20Q, S65N, D68N, M79T, E88R, R95A",10
IEKFKLLAEKVEEIVARNAREEIDYSDAPDEFRDPLMDTLMDDPVRLPSGTVLDRSIILRHLRNSPTNPFNRQMLTETMLEPVPELKEQIRAWLREKPSSDH,7.2370677,"K17R, A21E, T42D, M53L, L63R, D68N, S78T, Q91R, M94L, Q98P",10
IEKFAADAEKVEEIVAKNARAEDDYSDAPDEFRDPLMDTLMDDPVRLPSGTVMDRKTILRHLLNSPTNPFNRQMLTESMLEPVPELKMKIQAWMREKQSSDH,5.400694,"K5A, L6A, L7D, I23D, T42D, S56K, I57T, D68N, E88M, Q89K",10
IEKFKCLAEKVEEIVAKNARAEIDYSDAPDEFLDPLMDTLMTDPVRLPSGTVMDRSIILRHLLSSPTNPFNRQMLTESMLEPDPELKRRIQEWMQERQSSDH,0.8722458,"L6C, R33L, N64S, D68N, V83D, E88R, Q89R, A92E, R95Q, K97R",10
IEKFKLLAEKVEEIVAKNAYAEIIYSDAPDEFRDPLMDILMRDPVRLPNGTVMDRSIILQHLLNSPTNPFNRQMLTEDMLEPVPELKEQIQAWLEEKQSSDH,1.006273,"R20Y, D24I, T39I, T42R, S49N, R60Q, D68N, S78D, M94L, R95E",10
IEKFKLMAHKVEEYVAKNARAEIDYSDAPDEFRDPLMFTLMVDPVRLPSGIVMDRSIILRHLLNSPTNPFTRQMLTESMLEPVPELKEQIQAWMNEKQSLDH,5.6988993,"L7M, E9H, I14Y, D38F, T42V, T51I, D68N, N71T, R95N, S100L",10
MAKFKLLAEKVEEIVNKNARAEIMVSDAPDSFRDPLMDELMTDPVRLPSGTVMDRSIILRHLLNSPTNPFNRQMLTESMLEPVPELKEQIQAWMREKQSSCA,0.031836927,"I1M, E2A, A16N, D24M, Y25V, E31S, T39E, D68N, D101C, H102A",10
IEKFKDLAENVEEIYAKNARAEIDYSDAPDEFRDPLMDTLMTDPVRLPEGTVMDRAIILKHLLNSNTNPFNRQMLTESMLEPVPELKEQIQAWMKEKQSSDF,1.1119442,"L6D, K10N, V15Y, S49E, S56A, R60K, P66N, D68N, R95K, H102F",10
MEKMKLLAEKVEEIVAKNARDDIDYSDAPDEFRDPLMDTLMTDPVRLPSGHVMDRSIITRHLLNSPTNPFNRQALTESMLIPEPELKEQIQAWMREKQSSDH,3.0457249,"I1M, F4M, A21D, E22D, T51H, L59T, D68N, M74A, E81I, V83E",10
IEKTKLLAEKVEEIWAKNARAEIKYSDAPDEFRDPLLRTLMTDPVRLPSGTVMDRSIILKHLLNSPTNPFNRQMLTESMLETSPPLKEQIQAWMREKQSSDH,0.6270173,"F4T, V15W, D24K, M37L, D38R, R60K, D68N, P82T, V83S, E85P",10
IEKFKLLAEKVEEIVQKNARAEIDYSTAPDEFRDPLMDTLMTDPVRLPSGTVMDRSIILKHLNNSPTNPFNRQPLTESMLEPVPELKEQIQAWMREQKSSKI,2.8256335,"A16Q, D27T, R60K, L63N, D68N, M74P, K97Q, Q98K, D101K, H102I",10
IEKFKLAAEIVEEIVAKNARKEIDYSDAPREFRDPLMYELMTDPVRLPSGHVMDRSIILQHLLNSPTNPFNRQMLTERMLEPVPELKEQIQAWMREKQSSDH,2.475449,"L7A, K10I, A21K, D30R, D38Y, T39E, T51H, R60Q, D68N, S78R",10
KKKFQLLAEKVEQIVAKNARAEIDYSDAPDEFTDPLLDTLMTDPVRLPSGTVMDRSIIVRHLLNNPTNPFNRQMLTESMLEPVPELKEQIQAWMREKQSQDH,0.4997601,"I1K, E2K, K5Q, E13Q, R33T, M37L, L59V, S65N, D68N, S100Q",10
IEKFKHLADKVEYLVAKPARAEIDYSDAPDEFRDPLMFTLMTEPVRLPSGTVMDRSIILRHLLNSPTNPFNRQMLTESMLEPVPELKEQIQAWMLEKQSIDH,0.5751248,"L6H, E9D, E13Y, I14L, N18P, D38F, D43E, D68N, R95L, S100I",10
IEKYKLLQEKVEEISASNAREEIDYSQAPDEFRDPLMRTLMTDPVRLPSGTVMDRSIILRHLLNNPTNPFNRQMLTESMLEPVPELKEQIQNWMREKQSSDH,3.9018412,"F4Y, A8Q, V15S, K17S, A21E, D27Q, D38R, S65N, D68N, A92N",10
IEKFKLEAGKVEEVVAKNARAEIDYSDAPDEFRDPIMDTLMTDPVRLPFGTVMDRKNILRHLLNSPTNPFNRQMLTESMLEPVPELKEQIQAWMREKKSSSH,4.0410132,"L7E, E9G, I14V, L36I, S49F, S56K, I57N, D68N, Q98K, D101S",10
IEKFELLAEKVREIYAKNGRAEIDYDDAPDEFRNPLMDTLMTDPVRLPSGTVCDRSIILRHLLNSPTNPFNRQMLTESMLEPVPELKEQIFAWMRERQSSDH,2.924182,"K5E, E12R, V15Y, A19G, S26D, D34N, M53C, D68N, Q91F, K97R",10
IDKFKLLAEKVKEIVAKNNRAEIDYNDAPDEFRDPLMDTLMTDPVRLPSGEVMERSIILRHLLVSPTNPFNRQMLTESELEPVPELKEQIQAWMEEKQSSDH,1.2189739,"E2D, E12K, A19N, S26N, T51E, D54E, N64V, D68N, M79E, R95E",10
EEKFRLMAEKVEEIVAKNKRAEIDYSDAPDEFRCPLADTLMTDPVRLPSGTVMDRSIILRHLLNSPTNPFNRQMLTESMLIPVPALKEQIQAWMRSKQSSDH,1.2289431,"I1E, K5R, L7M, A19K, D34C, M37A, D68N, E81I, E85A, E96S",10
IEKLKLLAEKVEEIVAKNRRAEIDYSDVPDEFCDPLMDTLMTDPVRLPSGTVMDRSIILKHLLNNPTNPFNRQPLTEEMLEPVPELKEQIQAWIREKQSSDH,3.404209,"F4L, A19R, A28V, R33C, R60K, S65N, D68N, M74P, S78E, M94I",10
IEKFKLLAKKVEEIVAKNARAETDNSYAPDEFRDPLMYTVMTDPVRLPSGTVMDRSIILRHLLNEPTNPFNRWMLTESMLEPVPELKEQIQAWMRKKQSSDH,2.3512998,"E9K, I23T, Y25N, D27Y, D38Y, L40V, S65E, D68N, Q73W, E96K",10
PEKFKLLKEKVEEIVAKNARAEIDYSDAPDEFRYPLMDTLMTDPVKLPSGTVMDRSIILNHLINSPTNPFNRQMLTESMLEPVPELKEQIQKWMREKRSSDQ,-0.18563336,"I1P, A8K, D34Y, R46K, R60N, L63I, D68N, A92K, Q98R, H102Q",10
IEKLKLLAHKVEEIVHTNARAEIDYSDAPDEFRCPLMDTLMTDPVRLPSGTVMDRSIILRHLLNSQTNPFNRQMLTESSLEPVPELKEQIQAWMREKQSKDE,1.1205728,"F4L, E9H, A16H, K17T, D34C, P66Q, D68N, M79S, S100K, H102E",10
IEEFKLLAEKVEEIHTKNARAEIDYSDAPDEFRDPIMDTLMTDPVRLPSGQVMDRSTILRHLENSPTNPFNRQMLTEWMLEPVPELKERIQAWMREKQSSDH,6.292865,"K3E, V15H, A16T, L36I, T51Q, I57T, L63E, D68N, S78W, Q89R",10
IEKFKLLAEKVEKIVIKNAREEIDYSDAPDEFADPLMDTLMTDPVRLPSGKIMDRSIILRHLRNSHTNPFNRQMLTESMLEPVQELKEQIQAWMREKQSSDH,2.0161843,"E13K, A16I, A21E, R33A, T51K, V52I, L63R, P66H, D68N, P84Q",10
IEKEKLLAFKVEEIYAKYTRLEIDYSDAPDEFRDPLMDTLMTDPVRLPSGTVMDRSIILRHLLNSPTNPFNRQTLTESMLEPVPELREQIQAWMREKHSSDH,2.5964768,"F4E, E9F, V15Y, N18Y, A19T, A21L, D68N, M74T, K87R, Q98H",10
IAKFVLLAEKVEEIVAKNAREEEDYSDAPDEFRCPLMDTLMTDPVRSPSGTVMDRSIILRHLLNSSTNPFNRQMLTEEMLEPVPELKEQIQAWMRQKQSSDH,2.4020324,"E2A, K5V, A21E, I23E, D34C, L47S, P66S, D68N, S78E, E96Q",10
IEKFKELAEKVEEIYRKNAREEIDYSDAPDEFRDPLMDTLMQDPVNLPSGTVMDRSVIYKHLLNSPTNPFNRQMLTESMLEPVPELKEQIQAWMREKQSSDH,3.8465924,"L6E, V15Y, A16R, A21E, T42Q, R46N, I57V, L59Y, R60K, D68N",10
IEKTKLLAEFVEGIKAKYARAEIDYSDAPDEFRDPLTDTLMTDPVRLPSGTVMDRSIILRHLLASPTNPFNRYMLTESMLEPVPELKEQIQAWMREKQSSFH,1.0315361,"F4T, K10F, E13G, V15K, N18Y, M37T, N64A, D68N, Q73Y, D101F",10
IEKFKLLAAKVEEIVANNARAEIDYSEAPEEFRDPLMDTLMWDPVRLPSGTVMDRSIILRHLECSPTNPFNRQMLTESMLEPVPELKERIQAWMREKQSEDH,2.0580525,"E9A, K17N, D27E, D30E, T42W, L63E, N64C, D68N, Q89R, S100E",10
IEKFKLLAEAVEEIVAKLARAEIDYSDAPDEFRCPLMDTLMTDPVRLPSGNVMDRSIILRHLLNTPTNPFNRQMLTESMIEPVPELKERIQAWMREKPSGDH,-0.1994694,"K10A, N18L, D34C, T51N, S65T, D68N, L80I, Q89R, Q98P, S100G",10
IEKFKSLVEKVEEIVAKNARAEIDYGDAPDEFIDPLMDTLMTDPVRLPSGTVMDRSQILQHLQNSPTNPFNRQMLTESMLEPVPELKEQIQAWMTKKQSSDH,1.6072186,"L6S, A8V, S26G, R33I, I57Q, R60Q, L63Q, D68N, R95T, E96K",10
IDKWNLLAEKVEEIVAKNARQEIDYSDAPDEFRCPLMDTIMTDPVRLPSGNVMDRSNILRHLLNSPTNPFNREMLTESMLEPVPELKEQIQAWMREKQSSDH,0.79489434,"E2D, F4W, K5N, A21Q, D34C, L40I, T51N, I57N, D68N, Q73E",10
IEKFKSLAEKVEEIVAKNARAEIDYSDAPDEFRDPIMHTLFTDPVRLPSGTVMDRHIILRHLLDSPTNPFNRQMLTESMLEPVPELKEQIQAWQREKQLSDD,2.5060506,"L6S, L36I, D38H, M41F, S56H, N64D, D68N, M94Q, S99L, H102D",10
IEKFKLLAEKFEEIVAENAREEIDYSDAPDEFRDPLMDTLMEDPVRLPSGTVMDRTIILRHLLNSPTSPFNRQMLTESQLEPVRELKEQINAWMREKQSSNH,-0.076394156,"V11F, K17E, A21E, T42E, S56T, D68S, M79Q, P84R, Q91N, D101N",10
IEKFKALAEKVEKIVAKNARAEADYSDAPDEFLDPLSDTLMTDPVKLPSGTVMDRSIILRHLLNSPTNPFTRQMLTESMLEPVPELKRQIQAWMREKGSSDH,5.7117023,"L6A, E13K, I23A, R33L, M37S, R46K, D68N, N71T, E88R, Q98G",10
IEKFKLLAEKVEEIVAKNARAEDDYSDAPEEFRDPLMDTLMTDPVKLPSGTVMDRSIILRHLLNSPTNPFNRQPLTESMLEPVPELKKQIQAWMREHKSSPT,4.030351,"I23D, D30E, R46K, D68N, M74P, E88K, K97H, Q98K, D101P, H102T",10
IEKFRLLAEKVEEIFAKVARAEIEYMDAPDEFRDPLMQTLMTEPVRLPSGTVLDRSIILRHLLNSPTNPFNRQMLTESMLEPVPELKEQIQAWMRSKQSSDH,6.180463,"K5R, V15F, N18V, D24E, S26M, D38Q, D43E, M53L, D68N, E96S",10
IEKFKLLAEWVEEITAKHWREEIDYSDAPDEFRDPLMYTLMTDPVKLPSGTVMDRSIILRHLLNSPTNPFNRQGLTESMLEPVPELKEQIQAWMREKQWSDH,4.279203,"K10W, V15T, N18H, A19W, A21E, D38Y, R46K, D68N, M74G, S99W",10
IEKFRLLAKEVEEIVRKNARAEIDYSDAPDEFRDPLMDTLMTDPVRLPSGTVMDRSIILRHLLNHPTNPFTRQMLTESMLEPVPGLKEQIQAWRREEQSSDH,3.7533817,"K5R, E9K, K10E, A16R, S65H, D68N, N71T, E85G, M94R, K97E",10
IEKFKLLTEKVEEIVAANARDEIDYSDAPDEFRDPLMDTLFTDPVRLPSGTVMERSIILRHLLNSPTNPFNRQMLTESMLEPKPELKEQIQAWMRQHQSSDQ,1.5127904,"A8T, K17A, A21D, M41F, D54E, D68N, V83K, E96Q, K97H, H102Q",10
IEKFKLLAEKYAEIVAKQARAEDDDSDAPDEFRDPLMDFLMTDPVRLPSGTVMDRSIILRHLLNSPTNPFTRQMLTESMLEPVPELKEKIQQWMREKQSSDH,7.544522,"V11Y, E12A, N18Q, I23D, Y25D, T39F, D68N, N71T, Q89K, A92Q",10
IEKFKLLAEKVGEIVAKNTRAEIDYSDAPDEFRCPLMDTLMTDPVRLPSGTVMDRSIILRHLLNSPTNPFTRQMLTESMLEPVVELKERIEAWMREKQSSHL,5.1609488,"E12G, A19T, D34C, D68N, N71T, P84V, Q89R, Q91E, D101H, H102L",10
IEKFKLLAEKAEEIAAQNARAEDDYSDAPDEFRDPLMDRLMHDPVRLPSGTVLDRSIILRHLLNSPTNPFNRQPLTESMLEPVPELKEQIQTWMREKQSSDH,6.068779,"V11A, V15A, K17Q, I23D, T39R, T42H, M53L, D68N, M74P, A92T",10
IEKFKLLAEKVKELVLKLARAKIDYSDAPDEFRDPLMDELMTDPVRLPSGTVMDRVIILRHMLNSPTNPFNRQMLTESMLEPVPELKEQIQNWMREKQSSDH,1.0414089,"E12K, I14L, A16L, N18L, E22K, T39E, S56V, L62M, D68N, A92N",10
IAKFKIAAEKVEEIVAKNARAEIDYSMAPDEFRDPLMDTLMTDPVRLPSGHVMDRSFILRHLLNSPKNPFTRQMLTESMLEPVPELKEQIQAWMREKQASDH,4.90979,"E2A, L6I, L7A, D27M, T51H, I57F, T67K, D68N, N71T, S99A",10
IEKEKLLKEKVEEAVAKNARAEIDESDAPDEFRDPIMDTLMTDPVRLPSGTVMDRSIILRHLANSPTNPFNRQPLTESMLEPVPELKERIQAWMEEKQSSDH,6.430155,"F4E, A8K, I14A, Y25E, L36I, L63A, D68N, M74P, Q89R, R95E",10
YEKFKLLAEKVNSIVAKNARAEIDYEDAPDEFRCPLMETLMTDPVRLPSGTVMDRSNIERHLLNSPTNPFNRQMLTESMLEPDPELKEQIQAWMREKQSSDH,-0.51390296,"I1Y, E12N, E13S, S26E, D34C, D38E, I57N, L59E, D68N, V83D",10
IEKFKLLAEKVEEIVAKNADAAIDYSDVPDEFRDPLMDTLMTDPVFLPSGTVMDRSIILRHLLNSPTNPFNRTMLTESMLEPVPELKEKIQQWMREEQSTDH,1.5368869,"R20D, E22A, A28V, R46F, D68N, Q73T, Q89K, A92Q, K97E, S100T",10
IEKFKLLDEFRTEIVAKNARAEIDYSDAPDEFRDPLMDTLMTDPVTLPSGTVMDRSIILKHLRNSPTNPFNRQMLTESMLEPVPELKEQIQAWMKERQSSDH,-0.2883171,"A8D, K10F, V11R, E12T, R46T, R60K, L63R, D68N, R95K, K97R",10
IEKFKLLAEKVNEIVAKNARAEIDKSDIPDEFRDPIMDTLMTNPVRLPSGTVMDRSIILRHLLNSPTNPFNRQMLTESMLEPVPELKERIQMWVEEKQSSDH,3.151167,"E12N, Y25K, A28I, L36I, D43N, D68N, Q89R, A92M, M94V, R95E",10
IEKFKLLAEKSEEIVAKNTRREIDMRDAPDEFRDPLMDTLMTDPVRLPSGTVMDRSIILRHLLQSPTNPFNRQMLTESMLEPVPELKEQIEAWQRENQSSDH,3.2271469,"V11S, A19T, A21R, Y25M, S26R, N64Q, D68N, Q91E, M94Q, K97N",10
IEKFKLLAEKVNEIVAKNARAEIDYSDAPDEFRCPLMDTLMSDPVRLPSGTVMDRSLIERHLVNSPTNPFNRQMLTESMLEPVPELKEQIQAWMKTKQSSDA,-0.8625685,"E12N, D34C, T42S, I57L, L59E, L63V, D68N, R95K, E96T, H102A",10
IEKFKLLAEKVEEIVIKNERAEIDYSNVPDEFCDPLMDTLMTDPVKLPSGTVMDRSIILQHLLDSPTNPFNRQMLTESMLEPFPELKEQIQAWMREKQSSDH,-0.1528543,"A16I, A19E, D27N, A28V, R33C, R46K, R60Q, N64D, D68N, V83F",10
IEYFKLLAVKVEAIVAKNARVEIDYSDAPDEFRDPLMDVLMHDPVRLPSGTVMDRSIILRHLRNSPTNPFNRQMLTESMLTPVPELKEQIEAWMREKQSSDH,1.7677361,"K3Y, E9V, E13A, A21V, T39V, T42H, L63R, D68N, E81T, Q91E",10
IEKFKLLAEKVEEITAKNKRAEIDYSDAPDEFLDPLMGTLMTDPVRLPNGTVYDRSIILRHLLNSPTNPFNRQMLTEEMLEPVPEIKEQIQAWCREKQSSDH,1.6640162,"V15T, A19K, R33L, D38G, S49N, M53Y, D68N, S78E, L86I, M94C",10
IEKFKLLADSCSEIVAKNAKAEIDYSDAPDEFRDPLMDTLMHDPVRLPSGTVMDRSIILRHLLNSPTNPFNRQMLTLSMLEPVPELKEQIQAWMRERQSLDH,2.4748132,"E9D, K10S, V11C, E12S, R20K, T42H, D68N, E77L, K97R, S100L",10
IEKSKLLAEKVERIVAKNARAEDDYYDAPDEFQDPLMDTLMTDPVRLPSGTVMDRSIILRHLLNEPTNPFNRQTLTESSLEPVPELKEQIQAWMQEKQSSDH,-0.016491294,"F4S, E13R, I23D, S26Y, R33Q, S65E, D68N, M74T, M79S, R95Q",10
IEKFKKLAEKVEEIVAKNAAAEIDYSDAPDEFRDPLMYTLMEDPVRLPSGTVMDRSIILRHLLQSPTNPFNRQMLTESMLEPVPELVEQIQAWKERKQSSDH,3.4818397,"L6K, R20A, D38Y, T42E, N64Q, D68N, K87V, M94K, R95E, E96R",10
IEKFKLLAEKVRQIVAKNARAEIDLSDAPDEFRDPLMDTLMTDPVRLPSGTVMDRAIIERHLQMSPTNPFNRVMLTESMLEPVPELKEQIQAWMREKQSSTH,1.1117128,"E12R, E13Q, Y25L, S56A, L59E, L63Q, N64M, D68N, Q73V, D101T",10
IEKFKALAEKVEEEVQKNARAEIDYSDAPEEFRDPLMDTLMTDPVRLPSGTVMERSIILRHLLNSPTNPFNREALTESMLEPVPELKEQIQAWMREKQRSDA,1.0685188,"L6A, I14E, A16Q, D30E, D54E, D68N, Q73E, M74A, S99R, H102A",10
IEKFKLLAEKVHEIVEKNAREEIDPSDAPDEFRDPLSDTLMTDPVRLPSGTVMDRSIILRHLQNSPTNPFNRVMLTESMLEPVPELKEQIQEWRREKQSSDH,2.9211802,"E12H, A16E, A21E, Y25P, M37S, L63Q, D68N, Q73V, A92E, M94R",10
IEKFKLTAEKVEEIVAKNTRAEIDYSDAPDEFADPLMDTLMTDPVRLPSGTVMDRSIILRHLMNSPTNPFNRQMLQESMLEPYPELKERIQHWMREKQGSDH,1.5392805,"L7T, A19T, R33A, L63M, D68N, T76Q, V83Y, Q89R, A92H, S99G",10
MEKFKLLVEKVEEIVAKNARAEIDTSDAPDQFCCPLMDTLMTDPVRLPSGTVMDRSNILRHLLDSPTNPFTRQMLTESMLEPVPELKEQIQAWMREKQSSDH,2.0121062,"I1M, A8V, Y25T, E31Q, R33C, D34C, I57N, N64D, D68N, N71T",10
KEKFKLLAEKVEETVLKNARAEIDHSDAPDEFRDPLMATLMTDPVRLPSGTVIDRSIILRHLRNSPTNPFTRQMLTESMLEPVPELKEQIQAWMREKKSSDH,6.7295036,"I1K, I14T, A16L, Y25H, D38A, M53I, L63R, D68N, N71T, Q98K",10
EEKNELLAEKVEEIVAKNARAEEAYSDAPDEFRDPLMDTLMDDPVRLPTGTVMDRSIILRHLLNSPTSPFTRQMLTLSMLEPVPELKEQIQAWMREKQSSDH,1.1592591,"I1E, F4N, K5E, I23E, D24A, T42D, S49T, D68S, N71T, E77L",10
MEKFKLLAEKVEEIVAKNHRAEIDYDDAPDEFRDPLMDTLMTDPVRLPSGKVMDRSVILQHLLNSPTNPFNRQMLTESDVEPVPELKEQIQAWMREKQSSDL,1.7718711,"I1M, A19H, S26D, T51K, I57V, R60Q, D68N, M79D, L80V, H102L",10
MEKFKLLAEKVEEQVAKNHRQEIDYSDAPDEFRDPLMDTLMTDPVRLPSGTVMDRDIILRHLLNSPTNPFTRQPLTEEMLEPVPELKEQIQAWMYEKQSSDH,6.631691,"I1M, I14Q, A19H, A21Q, S56D, D68N, N71T, M74P, S78E, R95Y",10
IEEFKLLAEKVEEIVARNARAEIDYSDAPDEFRDPLMLTLMDDPVRLPSGTVMDRSIILRHLLNSPTNPFNRQPLTEEMLVPVPELKHQIQAWMREKQSSDD,1.9821324,"K3E, K17R, D38L, T42D, D68N, M74P, S78E, E81V, E88H, H102D",10
IEKFKLLAEKVEVIVAKNARAEIDHSDAPDEFRDPLMLQLMWDPVRLPSGTVMDRSIILRHLLNSPTNPFNRQMLTQSMLEPVQELKEQINAWMRESQSSDH,0.7252456,"E13V, Y25H, D38L, T39Q, T42W, D68N, E77Q, P84Q, Q91N, K97S",10
IEKFKLLAVKVEEIVAKQARAEIDYSDAPDEFRCPLMDELMTDPVRSPSGTVMDRSIILRHLLNSPTCPFTRQMLTESMLEPVQELKEQISAWMRQKQSSDH,0.7159482,"E9V, N18Q, D34C, T39E, L47S, D68C, N71T, P84Q, Q91S, E96Q",10
IEKFKLLAEKVSEIVAKNNRAEIAYVDAPDEFRNPLMDTLMTDPVRLPSGQVFDRSIILRHLLNSPTNPFNRQPLTESMLEPVPELKEQIQAWMREKQSSDN,2.979595,"E12S, A19N, D24A, S26V, D34N, T51Q, M53F, D68N, M74P, H102N",10
IEKFHLLAQKVEEISASSARAEIDYSDAPDEFRDPVMDTLMTDPVRLPSGTVMDRPIILRHLLNSPTNPFNRQMLTESKLEPCPELKEQIQAWMREKQSSDH,1.7305579,"K5H, E9Q, V15S, K17S, N18S, L36V, S56P, D68N, M79K, V83C",10
DEKFKLLAEKVEEVVAANLRAEIDLSDAPDEFRDPIMDTLMTDPVRLPSGTVMERSIILRHLLNSPTNPFNRQMLTENMLEPVPELKEQIQAWVREKQSSDH,5.333158,"I1D, I14V, K17A, A19L, Y25L, L36I, D54E, D68N, S78N, M94V",10
IAKYKLLAEKLEEIVAKNARAEIDYSDAPDEFKDPLMDTLMMDPVRLPSGTVMDRPIILRHLLNSPTNPFNRQMLTESMLSPVPELKERIQAWMSEKQSSDH,1.2864001,"E2A, F4Y, V11L, R33K, T42M, S56P, D68N, E81S, Q89R, R95S",10
IEKFKLLAEKVEEIVAKNSRAEIDVSDAPDEFRDPLMDTIMTDPVRLPSGRVMERSIIMRHLLNSPTNPFNRQMLTESMLEPVSELKEQIQQWYREKQSSDH,1.2930403,"A19S, Y25V, L40I, T51R, D54E, L59M, D68N, P84S, A92Q, M94Y",10
IEKVKLLAEKAEEIVAKNARAEIDYSDAPDEFRDPLMDELMRDPVRLPSGTVMDRSIILRHLRNSPTNPFNRQMLTENMLEPDPELKEQIQAWMREKQLNDH,1.821013,"F4V, V11A, T39E, T42R, L63R, D68N, S78N, V83D, S99L, S100N",10
IEKFKLLKETVEEIVAIHARAEIDYSAAPDEFRDPLMDTLMTDPVRLPSGTVMDRSIILRHLLYSPTNPFNRVMLTVSMLEPVPELKEQIQAWMREKDSSDH,2.4500725,"A8K, K10T, K17I, N18H, D27A, N64Y, D68N, Q73V, E77V, Q98D",10
MEKFKLLAEKVEEIVAKNARAEIDSSDTPDEFRDPIMDTLMLDPVNLPSGNVMDRSIILRHLRNSPTNPFNRQMLTESMLEPVPELKEQIQAWMREKQNSDH,4.349964,"I1M, Y25S, A28T, L36I, T42L, R46N, T51N, L63R, D68N, S99N",10
IEEFKTLAEKVEEIVAKNARAEIDYSDAPDEFLDPLMMTLMTDPVKLPSGQVMDRSTILKHLLNNPTNPFNRQMLTESMLEPVPELKEQIQAWMREKQSSDH,3.0395498,"K3E, L6T, R33L, D38M, R46K, T51Q, I57T, R60K, S65N, D68N",10
IEKFKLLAEKVEEQVAKNARQEIDYSDAPEEFRNPLLYTLMDDPVRLPSGTVMDRSIIMRHLLNSPTNPFNRQMLTESMLEPVPELKEQIQAWMREKQSHDH,4.494173,"I14Q, A21Q, D30E, D34N, M37L, D38Y, T42D, L59M, D68N, S100H",10
IEKFKTLAEKVDEIVAKNADAEIGPSDAPDEFRDPLMDTLFVDPVRLPSGTVMDRSIILRHLLNSPTNPFTRQMLTESMLEPVPQLKEQIQAWMREKQSSDH,4.361002,"L6T, E12D, R20D, D24G, Y25P, M41F, T42V, D68N, N71T, E85Q",10
IEKKELLAEKVEEIVAKFARAEIDYSDAPDEFRDPLMYTFMVDPVRLPSGTVMDRSIILRHVLNSPTNPFNRQMLTESMLEPVPELKEQIQKWMRENQSSDH,0.870342,"F4K, K5E, N18F, D38Y, L40F, T42V, L62V, D68N, A92K, K97N",10
IAKFKLLAEKSEEEVAKNARAEIDYSDAPDEFRDPLMDTLMTDPVKLPSGTVMDRSIILRHLLNSNTNPFNRTMLNEDMLEPVPELKEQIQAWMREDQSSDH,1.5538763,"E2A, V11S, I14E, R46K, P66N, D68N, Q73T, T76N, S78D, K97D",10
IEKFKLLAEKVETIVAENARAEIDTSDAPDEFLDPLMDTLMWDPVRLPDGTVLDRSIILRHLLNSPTNPFNRQMLTESMLEPVPELKEQIQAWMREKSSSDR,6.858884,"E13T, K17E, Y25T, R33L, T42W, S49D, M53L, D68N, Q98S, H102R",10
IEKAKLLAEKVEEIVAKNARLEIDNSDAPDEFRDPLMDQLMTDPVRLPSGTVMDRSVILRHLLNSPTNPFNRQMLTEQMLKPVPELKEQIDRWMREKQSSDH,3.1359081,"F4A, A21L, Y25N, T39Q, I57V, D68N, S78Q, E81K, Q91D, A92R",10
IEKFKLLAEKVEEIYAENARAEIDYNDAPDEFLDPLMDTLMTDPVRLPSGTVMDRAIILRHLLASPTNPFTRQMLTESMLEPVPELKETIQSWMREKQSSDH,6.9276347,"V15Y, K17E, S26N, R33L, S56A, N64A, D68N, N71T, Q89T, A92S",10
IEKYKLLAEKVKEIVHKNVRAEIDYIDAPDEFRDPLMDTLMTDPVRLPSGTVMDRSIILRHLLNSPTNPFTRQMLTESMLEPVTELKEQIQQWMAEKQSSDH,6.3407416,"F4Y, E12K, A16H, A19V, S26I, D68N, N71T, P84T, A92Q, R95A",10
IEKFKLLAEKVERIVAKNSRAEIDYSDAPDEFRHPLTDALMLDPVRLPSGTVMDRSIILRHLLNSPTNPFNRQMLTESMLEPVPELKEQIQAWTRMKQSYDH,-1.1187888,"E13R, A19S, D34H, M37T, T39A, T42L, D68N, M94T, E96M, S100Y",10
IEEFKLLAEKVETIVAKNARAEIDDSDAPDHFRDPLMDTLMRDPVRLPSGTVMDRSIILRHLRNSPTNPFNRNMLSESMLEPVPELKEQIQQWMREKQSSDH,3.1159358,"K3E, E13T, Y25D, E31H, T42R, L63R, D68N, Q73N, T76S, A92Q",10
TEKFKTLAEKVEEIVNKNARAEIDYSEAPDEFRSPLMDTLMVDPVRLPSGTVLDRIIILRHLLNSPTNPFTRQMLTESMLEPVPELKEQIQAWMREKQSSDH,8.425426,"I1T, L6T, A16N, D27E, D34S, T42V, M53L, S56I, D68N, N71T",10
IEDFKLLAEKVEEIVAKNARAEIDYSDAPDEFRDPLMYTLMTDPVRSPSGKVMDRSIILRHLQNSPTNPFNRQMLTESQLEPVPELKEQINAWMQEKQSHDH,3.9150996,"K3D, D38Y, L47S, T51K, L63Q, D68N, M79Q, Q91N, R95Q, S100H",10
PEKIKLLAEKVEEIVAKNARAEIDYSDAPDEFRDPLMDTIMTDPVRLPSGTVMDRSIILRHLLNSPTNPFNRMMLTESMLEPDPELKEQINAWIAERQSSDH,3.2391777,"I1P, F4I, L40I, D68N, Q73M, V83D, Q91N, M94I, R95A, K97R",10
IEKYKLLAEKVDEIYAKNNRAEIDYSDAPDEFRDPILYTLMTDPVRLPSGTVMDRSIILRHLLNSPTNPFNRQMLTESMLEPVPELKEQIQAWMLEKHSSDH,7.269888,"F4Y, E12D, V15Y, A19N, L36I, M37L, D38Y, D68N, R95L, Q98H",10
IEKFKLLAEKVEEIVAPNANEEIDYSDAPDEFRDPLMYTLMDDPVALPSGTVMDRSIILRHLLNSPTNPFNRQMLTESMLQPVPEVKEQIQAWMREKQSSTH,5.0149374,"K17P, R20N, A21E, D38Y, T42D, R46A, D68N, E81Q, L86V, D101T",10
IEKFKLLAEKVEEIVAKNSAAETDYSDAPDEFRCPLMDTLMTDPVRLPSGTVMDRSIILRHLLQNPTNPFNRQMLTESMLEPVPELKLQIQAWMRAKQSSTH,1.2632983,"A19S, R20A, I23T, D34C, N64Q, S65N, D68N, E88L, E96A, D101T",10
IGKFKLLAEKVEEIVAKNADAEIDESDAPDEFLDPLMDTLMDDPVRLPSGTVVDRSIILRHLNNSPTNPFTRQMLTEDMLEPVPELKEQIQAWMREKQSSDH,9.692728,"E2G, R20D, Y25E, R33L, T42D, M53V, L63N, D68N, N71T, S78D",10
IEKFKLLAEKVEVPVALRLRAEIDYSDAPDEFRDPLMDTLMEDPVRLPSGTVMDRTIILRHLLNDPTNPFNRQMLTESMLEPVPELKEQIQKWMREKQSSDH,2.1001625,"E13V, I14P, K17L, N18R, A19L, T42E, S56T, S65D, D68N, A92K",10
IEKFKVLKEKVEEIVAKNARAEIDYSEAPDEFRDPLMQTLMTDPVRLPSGTVMDRSNILRHLLNSPTNPFNRDPLTESMLEPVPELKEQIQAWMREQQSSDV,0.9343513,"L6V, A8K, D27E, D38Q, I57N, D68N, Q73D, M74P, K97Q, H102V",10
IEKFKLLAEKVEEHVAKNARAEIDYSDAPDEFRDPLMDTLMTDPVRLPSGVVMDRSMILRHLLNSPTNPFNRQSLTEEMLEPVPELKAQIDTWRREKQSSDH,1.8707391,"I14H, T51V, I57M, D68N, M74S, S78E, E88A, Q91D, A92T, M94R",10
IEKYKLLAEKVNELVAKNARAEIDYQDAPDEFRDPLMNTLFTDPVRLPSGVVMDRSIILRHLLNSPTNPFNRQMLTESMLEPVPELKEQIQAWMKEKQSPDH,-1.8612429,"F4Y, E12N, I14L, S26Q, D38N, M41F, T51V, D68N, R95K, S100P",10
MEKFKLLAEKVEEIVAKNARARSDYSDAPDEFLDPLMDTLMWDPVRLPSGTVMDRSIIKRHLLNSPTNPFNRQPLTESMLEPVPELKEQIKAWMKEKQSSDH,0.23922151,"I1M, E22R, I23S, R33L, T42W, L59K, D68N, M74P, Q91K, R95K",10
HEKFSLLMEKVEEIVAEEARAEIDYSDAPDEFRDPLMDTLMTDPVMLPSGTIMDRSIILRHLLNSPTNPFNRQMLTEDMLVPVPELKEQIQAWMREKQSSDH,4.53238,"I1H, K5S, A8M, K17E, N18E, R46M, V52I, D68N, S78D, E81V",10
IEKFKLLAEKVEEERAKNARAEIDYSDIPDEFRDPLMDTLFTDPVRLPSGTVMDRYIILRHLLNSPTNPFNRQMLTESMLEPVPELKEQIQAWMVEKSESTH,1.484781,"I14E, V15R, A28I, M41F, S56Y, D68N, R95V, Q98S, S99E, D101T",10
IETTKLLAEKVNEIVAKNARAEIQYSDAPDEFRDPLMTTLMTDPVRLPSGTVVDRSIILRHLLNSPTNPFNRQMLTESMLEPVPELKEQIEAWMREKQVSTH,1.6951907,"K3T, F4T, E12N, D24Q, D38T, M53V, D68N, Q91E, S99V, D101T",10
IEVLKLYAEKVAEIVAKNARAEIDYSDAPDEFVDPLMDELMTDPVKLPSGTVYDRSIILRHLLNSPTNPFNRQMLTESMLEPVPELKEQIDAWMREKQSSDH,2.524733,"K3V, F4L, L7Y, E12A, R33V, T39E, R46K, M53Y, D68N, Q91D",10
IEKFKLLACKVEEIVAKNARAEIDYSDAPDEFRDPLMDTLMTDPVRLPSGTLMDRAIILRHLQNSPTNPFNRQMLTEEMLEPIPELKEQIQAWMRSKQASEH,1.6931795,"E9C, V52L, S56A, L63Q, D68N, S78E, V83I, E96S, S99A, D101E",10
IEKFKLLVEKVEEIVNNSHRAEIDYQDAPDEFRDPLMDTLMTDPVRLPSGNVMDRSIILRHLLNSPTNPFNRQMLTESMLEPVPELKEQIQAWKREKASSDH,2.8905432,"A8V, A16N, K17N, N18S, A19H, S26Q, T51N, D68N, M94K, Q98A",10
IDKFKLLAEKVGEIVAKNARQEISYSDAPDEFRCPLMDTLMTDPVRLPSGTVMERSIILRHLLNNPTNPFNRQMLTESMLEPVPGLKEQIQAWMREKQSSEH,0.4657557,"E2D, E12G, A21Q, D24S, D34C, D54E, S65N, D68N, E85G, D101E",10
IEKFKLLAEKVEEIVAKNARLQISYSDAPDEFKDPLMDTLMTDPVRVPYGTVMDRSIILRHLLNSPTNPFNRQMLTESDLEPVPELKEQIQAWMREHNSSDH,4.58068,"A21L, E22Q, D24S, R33K, L47V, S49Y, D68N, M79D, K97H, Q98N",10
IEKQKLLAEKVDEIVAGNTEAEIDLSDAPDEFRDPLMDTLMTDPVRLPSGYVMDRSIILRHLLNSPTNPFNRQPLTEDMLEPVPELKEQIQAWMREKQSSDH,4.0248713,"F4Q, E12D, K17G, A19T, R20E, Y25L, T51Y, D68N, M74P, S78D",10
IEKFKLLAEKVEEIVAYNARAEIQYSTAPDEFRDPLMDTLMTDPVRLPSGTIMDRSIILRHLLNSSTNPFNRTMLTESMLEPVPELKARIQAWMREKQSSLH,-0.091247454,"K17Y, D24Q, D27T, V52I, P66S, D68N, Q73T, E88A, Q89R, D101L",10
IEKFKSLAEKVEEYCAKNMRAEIDYSDAPDEFRDPLMYTLMTDPVRLPSGTVMDRSIILRHLLISPTNPFNRQMLTESDLQPVPELKEQIQAWMAEKQSSDH,5.135004,"L6S, I14Y, V15C, A19M, D38Y, N64I, D68N, M79D, E81Q, R95A",10
IEKFKLIAEKYREYVAKNARAEIDYSDAPDEFIDPLMDTLMEDPVRLPSGTVMDRSSILRHLLNSPTSPFNRQMLTESMLYPVPELKEQIQAWMRKKQSSDH,-1.363767,"L7I, V11Y, E12R, I14Y, R33I, T42E, I57S, D68S, E81Y, E96K",10
IEEFKLLAEKAEEIVHKNARVEIDESDAPDEFRDPLMDTLMTDPVVLPSGQVMDRAIILQHLLNSPTNPFNRQMLTESMLEPVPELKEQIQAWMREKQSSDH,1.986598,"K3E, V11A, A16H, A21V, Y25E, R46V, T51Q, S56A, R60Q, D68N",10
IEKFKLVVEKQEEIVAKNARAENDYSDAPDEFRCPLDDTLMTDPVRLPSGTVMDRSIILRHLLNSPDNPFNRQMLTESMLEPVPELKEQIQAWMQQKQSSDH,0.8690433,"L7V, A8V, V11Q, I23N, D34C, M37D, T67D, D68N, R95Q, E96Q",10
IEKFKLLAEKVEEFVAKNSRAETDYEAAPDEFRDPLMDTLMTDPVRLPSGTVMDRAIILRHLLNSPTNPFNRQPLTEEMLEPVPELKEQIQAWMREKRSSDH,2.3543563,"I14F, A19S, I23T, S26E, D27A, S56A, D68N, M74P, S78E, Q98R",10
IEDFKLLAEKVEEIVAKNQREEIDYSDAPDEFRDPLMDTLMTDPVRLPSGTVIERSAILRHLLNSPTNPFTRAMLTEDMLEPVPELKEQIQAWMREKQSSDH,8.754772,"K3D, A19Q, A21E, M53I, D54E, I57A, D68N, N71T, Q73A, S78D",10
IEKTKLLAEKVEEIVAKNARAEIDYSDAPDEFRDPLMDDLMSDPVRLPSGTVLDRSIIKRHLLNSPTNPFNRQMLTDSMLEPVPELKEQIQTWMRTKYSSDH,6.176749,"F4T, T39D, T42S, M53L, L59K, D68N, E77D, A92T, E96T, Q98Y",10
IEKFKLLAEKVEEIVAKTARVDIDYSDAPDEFRDPLMLTLMTDPVRLPSGTVMERSIILRHLLNSPTNPFNRAMLTESMLEPVPELKEQIELWMREKQSSAH,1.0561669,"N18T, A21V, E22D, D38L, D54E, D68N, Q73A, Q91E, A92L, D101A",10
