Sequence,Score,Mutations,Number of Mutations
MEEFKLTAEKVEEIVAKNARVEIDYSDAPKEFRDPLMDTLMTDPVRLPSGTVFDRSSILRHLLNSPTNPFNRQMLTEEMLEPEPELKEQIQAWMREKQSSDH,2.5773625,"I1M, K3E, L7T, A21V, D30K, M53F, I57S, D68N, S78E, V83E",10
IEKFKLLWEKVEEAYAKNARACIDYSDAPDEFWDPLMDTLMTDPVRLPWGTVMDRSIILRHLLNSPTNPFNRQMLTESMLVPVPELKEQIDTWMREKQSSDH,1.4033793,"A8W, I14A, V15Y, E22C, R33W, S49W, D68N, E81V, Q91D, A92T",10
IEKFKLLAEKYAEIAAENARCEIDYSDAPEEFRDPLMDTLMTDPVRLPSGTVMDRSIILRHLLNSPTNPFNRQMLTESMLEPVPELKEQIQAWMREKLVSTH,2.678639,"V11Y, E12A, V15A, K17E, A21C, D30E, D68N, Q98L, S99V, D101T",10
IEKFKRLAEKVEEIVAKSARAEIEYSDAPDEFRDPLMDTLMTDPVRLPGGHVMDRSIILRHLKNSPTNPFNRQMLTESMLEPVPELKERIQAWQREFQSSDH,3.816149,"L6R, N18S, D24E, S49G, T51H, L63K, D68N, Q89R, M94Q, K97F",10
IKKIQLLAEKVEEIVAKNADAEIDYSDAPDEFRDPLMDTLMTDPVKLPSGTVMDRSLILRHLLNSPTNPFNRQPLTQSMLEPVPELKEQIQAWMREKQSSDW,1.5235624,"E2K, F4I, K5Q, R20D, R46K, I57L, D68N, M74P, E77Q, H102W",10
IEKFKLLAEKVEEIVAKNARNQIDYSDAPDEFRDPITYTLMTDPVRLPSGTVMDRSNILKHLQNSPTDPFNRQHLTESMLEPVPELKEQIQAWLREKQSSDH,3.390337,"A21N, E22Q, L36I, M37T, D38Y, I57N, R60K, L63Q, M74H, M94L",10
IEKFKLLQEKVEEIVALNAEREIDYSDAPDEFRDPLMDTLMTDPVRLPSGQVMDRSIIMRHILNSPTNPFNRQPLTESMLEPVPELKEQIQAWMREKQSSSH,2.3508344,"A8Q, K17L, R20E, A21R, T51Q, L59M, L62I, D68N, M74P, D101S",10
IEKFKLLAEKVEEGFAKQARAEIDYSDAPDEFRYPLMDTLMTDPVRLPSGTVMDRSIILRHLNNQPTNPFNRHMLTESMLVPVPELKEQIQAWMMEKQSSDH,-1.7984761,"I14G, V15F, N18Q, D34Y, L63N, S65Q, D68N, Q73H, E81V, R95M",10
IEKFQLAHEKVEEIVAQNAAEEVDYSDAPDEFRDPLMDTLMTDPVRLPSGTVCDRSIILRHLLNSPTNPFNRQMLTESMLEPVPELKEQIEAWMREKQSSDH,5.742094,"K5Q, L7A, A8H, K17Q, R20A, A21E, I23V, M53C, D68N, Q91E",10
IEKFKLLADKVEEIVAKNARAEIGYSDAPDEFRDPLMDTLMTDPVVLPSGTVLDRSIIQRHLANSPTNPFNRQMLQESMLEPVPHLKEQIQAWMREKQSSYH,5.179509,"E9D, D24G, R46V, M53L, L59Q, L63A, D68N, T76Q, E85H, D101Y",10
IEKFKLLALKVEDIFAKNARREIDYSDAPDEFRDPLMDTLMTEPVRLPSGTVMDRSIILRHLLNSQTNPFNRIMLTESMLEPVPELKQQIQAWMREKQSSDL,1.055959,"E9L, E13D, V15F, A21R, D43E, P66Q, D68N, Q73I, E88Q, H102L",10
MEKTKLLAEKVEEIVRKNARAEIDYEEAPDEFRDPLMNTLMDDPVRLPSGTVMDRSIILRHLLNSPTNPFNRQMLTESMLEPVPELKSQIQAWMREKQASDH,1.4319304,"I1M, F4T, A16R, S26E, D27E, D38N, T42D, D68N, E88S, S99A",10
IEKFKLLAEEVEEEMAKNADKEIDVSDAPDEFRDPLMDTLMTDPVRLPSGTVMDRSIILRHLLNSPTNPFNRQMLTESILEPVPELKEQIQAWMREKPSSDQ,0.23659089,"K10E, I14E, V15M, R20D, A21K, Y25V, D68N, M79I, Q98P, H102Q",10
EEKFKLLLEKVEEIVAKNARAEIDYSDAPKEFRDPLMLTIMTDPVRLPSGTVMDRNIILRHLLNSPTNPFTRQPLTESMLEPVPELKLQIQAWMREKQSSDH,6.9221997,"I1E, A8L, D30K, D38L, L40I, S56N, D68N, N71T, M74P, E88L",10
IEKFKLLAEKVHEIVAKNARAEADYDDAPDGFRDPLMDTLMTDPVRHPDGTVMDRSIITRHLLNSPTNPFTRQMLTESMLEPVPELKEQIQAWMREKQSSDY,5.7614675,"E12H, I23A, S26D, E31G, L47H, S49D, L59T, D68N, N71T, H102Y",10
TEKNKLLAQQVEEIVAKNARAEISYSDAPDEFRDPLMYTLMTDPVRLPSGTVMDRSIILRHLLNSPTNPFNRQPLTESMLEPVPTLKSQIQAWMREKQSSDH,3.528389,"I1T, F4N, E9Q, K10Q, D24S, D38Y, D68N, M74P, E85T, E88S",10
IEKFKLLAEKVEEIVAKNARAEIDYDDAPDEFRDPLMDTLMTDPVRLPGGTVMDRSIILRHLLASNTNPFNRSMLTENMLEPVPELKEQIRAWMNEKQSRDH,1.528632,"S26D, S49G, N64A, P66N, D68N, Q73S, S78N, Q91R, R95N, S100R",10
IEKFKQLLEKVEEIVAKNARAEIDYSDAPDEFVDPLMDTLMTDPVRLPSGTVMDRSCILRHLLNAPTNPFTRQPLTESLLEPVPELKEQIQAWMREKQSSDK,3.153099,"L6Q, A8L, R33V, I57C, S65A, D68N, N71T, M74P, M79L, H102K",10
IEKFKLLAEKVDEIVAKTPRAEIDYSDAPDEFLDPLMDTLMYDPVRLPSGTVVDRSIILRHLLSSPTNPFNRQMLTEEMLEPIPELKEQIQAWMREKQSSDH,3.209268,"E12D, N18T, A19P, R33L, T42Y, M53V, N64S, D68N, S78E, V83I",10
IEKFKLLAEKVELIYAKNARAEIDYSDAPDEFRDPLMDTLMTDPVRLPSGTVFDRSIIIRHLLNSPTNPFNRQMLTDAMLEPVPELREQIEAWMREKQRSDH,2.9656181,"E13L, V15Y, M53F, L59I, D68N, E77D, S78A, K87R, Q91E, S99R",10
IEEFKQLAEKVEEAVAVLPRAEIAYSDAPDEFRDPLMDTLMTDPVRLPSGTVLDRSIILRHLLGSPTNPFNRQMLTESMLEPVPELKEQIQAWMREKQSSDH,4.513091,"K3E, L6Q, I14A, K17V, N18L, A19P, D24A, M53L, N64G, D68N",10
IAKFKLLEEKVNELVAKSARAEIDYSDAPDEFRDPLMDTLMTDPVRLPSGTVMDRSIILRHMRNSETNPFNRQMLTEEMLEPVPELKEQIQAWMREKQSSDH,1.3295984,"E2A, A8E, E12N, I14L, N18S, L62M, L63R, P66E, D68N, S78E",10
MEHFKLLTEKVEEIVAKNARLEIDYSDAPEQFRDPIMDTLMTDPVRLPSGTVMDRGIILRHLSNSPTSPFNRQMLTESMLEPVPELKEQIQAWMREKQSSDH,1.4574604,"I1M, K3H, A8T, A21L, D30E, E31Q, L36I, S56G, L63S, D68S",10
MEKFKLLSHKVEEIHAINAAAVIDYSDAPDEFRDPLMDTLMTDPVRLPSGTVMDRSIILRHLLNSPTNPFTRQMLTESMLEPVPELKEQIQAWMREKQSSDG,6.3304224,"I1M, A8S, E9H, V15H, K17I, R20A, E22V, D68N, N71T, H102G",10
IEKFELLAEKEEEISAKNARAEIDYGDAPDEFRDPLMDTLMTDPVRLPTGTVIDRSIILRHLLNSPTNPFNRQMLTESMLTPDPELKEQIQAWMRSKQSSDH,5.61108,"K5E, V11E, V15S, S26G, S49T, M53I, D68N, E81T, V83D, E96S",10
IEKFKLSADQVEEIYAKNARAEIDYSDAPDEFRDPLMDTLMVDPVRLPDGTVMDRSIILQHLLNSPTNPFNRKMLTESMLVPVPELKEQIQAWMREKQSSDH,1.3786653,"L7S, E9D, K10Q, V15Y, T42V, S49D, R60Q, D68N, Q73K, E81V",10
IEDFKLLAEKIEETVAKNARAELDYSDAPDEFMDPLMDTLMTDPVVLPSGTYMDRSNILRHLLNSPTNPFNRQMLTESMLEPVPELKEQIQAWMREKQSGDH,0.6278667,"K3D, V11I, I14T, I23L, R33M, R46V, V52Y, I57N, D68N, S100G",10
IEKFKLLAEKVGEIAAKNARAEIDYSDAPDEFRDPIMDTIMTDPVRLPSGTILDRSIILRHLLNGPTNPFNRQMLTESMLEPVPELKEKIQAWMREKQSTDH,8.896175,"E12G, V15A, L36I, L40I, V52I, M53L, S65G, D68N, Q89K, S100T",10
IEKFRLLAEKVEKIVADNARAEIDYSDAPDEFRDPIMDTLMVDPVRLPSGTVMDRSIIKRHLLNSPTNPFNRQALTESMLEPVPELREQIQQWMREKQSSDH,4.7762594,"K5R, E13K, K17D, L36I, T42V, L59K, D68N, M74A, K87R, A92Q",10
IEKFKLLAEAHEEIVAKNGRAEIDYSDAPDEFRHPLMDGLMTDPVRLPSGQVMDRSIILRHLLNSPTNPFNRRMLTEDMLEPVPELKERIQAWMREKQSSDH,1.7519519,"K10A, V11H, A19G, D34H, T39G, T51Q, D68N, Q73R, S78D, Q89R",10
IEKFKLLAEKVEEIERKNAEAEIDYSEAPDEFRCPLMDSLMTDPVRLPSGTVMDRSIILRHLLNSPTNPFTRVMLTESHLEPVPELKEQIQAWMREKQSSDH,3.8582017,"V15E, A16R, R20E, D27E, D34C, T39S, D68N, N71T, Q73V, M79H",10
IEKFKRLAEKVEEIYAKNARTTIKYSDAPDEFRDPLVDTLMTDPVRLPSGTVMDRSLILRHLQNSPTNPFNRAMLTESMLEPVPELKEQIQAWMREKQSSDH,-0.43372717,"L6R, V15Y, A21T, E22T, D24K, M37V, I57L, L63Q, D68N, Q73A",10
IEKSKLLAEYVDEIVAKNARAEADYSDAPDEFRDPLMLTLMTDPVRLPSGTVMDRSVILRHLLNSPTNPFNRQPLTELMLEPVPELKEQIEAWMREKQSSDH,3.1147604,"F4S, K10Y, E12D, I23A, D38L, I57V, D68N, M74P, S78L, Q91E",10
DEKFKLLAEKVEEIVAKNRRAEIDYSDAPDEFRDPLMDTLFTDPVRLPSGTVMDRSTIQRHLLNEPTNPFNRQMLTESMLEPVPELKEQIDAWMRKKQESDH,4.2394667,"I1D, A19R, M41F, I57T, L59Q, S65E, D68N, Q91D, E96K, S99E",10
IEKFKLLAELVEEIVASRATAEIDDSDAPDEFRDPLMNTLMTDPVRLPSGTVMDRSVILYHLLNSPTNPFNRQMLTESLLEPVPELKEQIQAWMREKQSSDH,1.8689041,"K10L, K17S, N18R, R20T, Y25D, D38N, I57V, R60Y, D68N, M79L",10
IEKFKLLAEKVEEIVAKNAQAEIDMSDAPDEFRDPLLDTLMTDPVRLPSGQVMDRSIILRHLLNSPTNPFNRQMLTESMLEPVPELKEQIEVWRREKKSSDY,3.8368115,"R20Q, Y25M, M37L, T51Q, D68N, Q91E, A92V, M94R, Q98K, H102Y",10
IEKFKLLARKVEEIVEATAKAEIDYSDAPDEFRDPLMDTLMTDPVRLPSGKVMDRSIILRHLLNSPTNPFNRQMLTESMLEPVVELKEQIQAWMRNKQSSDI,4.604374,"E9R, A16E, K17A, N18T, R20K, T51K, D68N, P84V, E96N, H102I",10
IEKFKLLEEKVEEIVAKNARAEIDYSDAPEEFRCPLMLELFTDPVRLPSGYVMDRSIILRHLLNSPTNPFNRQPLTESMLEPVPELKEQIEAWMREKQSSDH,3.0459836,"A8E, D30E, D34C, D38L, T39E, M41F, T51Y, D68N, M74P, Q91E",10
IEKERLLAEKVEEIVAKNARAEIDYSDAPDEFRDPLMDTLFCDPVRLPSGHVLDREIILRHLLNSPTNPFNRQMLTESMLSPVPELKEQIQKWMREKQSSDH,5.6598454,"F4E, K5R, M41F, T42C, T51H, M53L, S56E, D68N, E81S, A92K",10
IEKFKLLAEKVDTIVAKNARAEIDYSEAPDEFRDPLMDTLMTDPVRLPSGNVMDRSTILRHLNNSPTNPFNRQMLTESDLIPVPELKERIQAWMREKQSSDH,2.9110332,"E12D, E13T, D27E, T51N, I57T, L63N, D68N, M79D, E81I, Q89R",10
IEKFKLVAEKVEAIVAKNARAEIDYSDAPDEFRDPLMDTLMTDPVRLPNGIVMDRSIILRHLLNSPTNPFNRQMLTESMLTAVPELKEQIQAWVEEKQSSHH,3.1588812,"L7V, E13A, S49N, T51I, D68N, E81T, P82A, M94V, R95E, D101H",10
IEKFKNMLEKVEEIVAKNARAEIDYSDAPDWFRDPLTDTLMTDPVRLPSGTVMDRSIILRHLQNSPTNPFNRQMLTESMLEPVPELKERIQRWMREKQSTDH,1.6192976,"L6N, L7M, A8L, E31W, M37T, L63Q, D68N, Q89R, A92R, S100T",10
IEKFKLLAEKVEEIMAKNARAEIDYSDAPDEFRDPLMDTLMTDPVRLPSGTYMDRSIILRHLLNSPTNPFNRQELEESMLEPVPELKTQINAWLANKQSSDH,2.6674566,"V15M, V52Y, D68N, M74E, T76E, E88T, Q91N, M94L, R95A, E96N",10
IEKFKLLAEKVEEIKAKHAQAEIDYSDAPDEFRDPLMDTLMTDPVRLPDGTVMDRSIILRHLLQSPTNPFTRQPLTESSLKPVPELKEQIQAWMREKQSSDH,4.7193356,"V15K, N18H, R20Q, S49D, N64Q, D68N, N71T, M74P, M79S, E81K",10
IEKFKVNAEKVEEIVAKNARAEIVYSDAPDEFRDPLMYTLMTDPVRLPSGTVMERSIILRHLLNSPTNPFNRSMLTESMLVPVPELKEQIQRWMREKISSDH,2.2490616,"L6V, L7N, D24V, D38Y, D54E, D68N, Q73S, E81V, A92R, Q98I",10
IEKFKLLAEKVEKIVAKNARTEIDYSDAPDEFRDPLMDTIMTDPVKLPSGTVMDRSIILRHLLNSPKNPFNRQMLTESMLEPVLELKEQINAWMRAKQTSDH,1.9218879,"E13K, A21T, L40I, R46K, T67K, D68N, P84L, Q91N, E96A, S99T",10
MEKFKLLREKVEEGEAKNAIAEIDYSDAPDEFRDPLMDTLMVDPVRLPSGTVMDRSIILRHLLNSPTNPFNRQMLTESMLEPVPELKAQIQAWQREKQSEDH,3.0271022,"I1M, A8R, I14G, V15E, R20I, T42V, D68N, E88A, M94Q, S100E",10
IEKFNLLAEKVEGIVAKNARAEIDETDAPDEFRDPLMDTLMTDPVRLPSGTVMDRSIILRHLENSPKNPFNRQYLTESMLEPVPELKERIQAWMREKMSSDH,2.3088064,"K5N, E13G, Y25E, S26T, L63E, T67K, D68N, M74Y, Q89R, Q98M",10
IEKFKLLAESVEEIVAKNDRAEIDYSDAPDEFRDPLMDTLMTDPVRLPSGQVMDRSIILRHLLNSPTNPFNRQSLTETMLEPVPELKEQILAWMREKQSKRK,2.8487597,"K10S, A19D, T51Q, D68N, M74S, S78T, Q91L, S100K, D101R, H102K",10
KEEMKLLAEKVEEIVKKNARAEIDYSDAPDEFRDPLMDTLMTDPVRLPSGTIMDRSIILRHLLNSPTNPFNRQMLTESMLEPAVELKEQIQAWMREKQVSDY,0.9265978,"I1K, K3E, F4M, A16K, V52I, D68N, V83A, P84V, S99V, H102Y",10
IEKFKLLAEKVEKIAAKNARAEIDYSDAPDEFRDPLMDTLMTDPVRLPSGTVMDRSIILRHLQMSPTNPFNRQMLTESMLEPIPELKEQILAWMREQCSSGH,1.8137261,"E13K, V15A, L63Q, N64M, D68N, V83I, Q91L, K97Q, Q98C, D101G",10
IEKFKLLATKVEEISAKNARATIDYSDAPDEFRDPLMDTLMTDPVRLPSGTVMDRSAILRHLLNSPTNPFTRQMLTESMLEPVVEVKEQIQNWLREKQSSDH,6.789206,"E9T, V15S, E22T, I57A, D68N, N71T, P84V, L86V, A92N, M94L",10
IEKFKLLAEKVDEIAAKNARAEIDYSDAPDEFRCPLMDTIMTDPVRLPSGNVMDRSIILRHLQNSPTNPFNRQMLTESMLEPVPELKQQIDAWMREKQSRDH,3.1817489,"E12D, V15A, D34C, L40I, T51N, L63Q, D68N, E88Q, Q91D, S100R",10
IEKFKLLAEKVEEIVADNAAKEICYSDAPDEFRDPLMDTLLTDPVRLPSGVVMDRRIILRHLLHSPTNPFNRQMLTESMLEPVPELKEQIQAWMRERQSSDH,2.074235,"K17D, R20A, A21K, D24C, M41L, T51V, S56R, N64H, D68N, K97R",10
IEKFKLLAEKVEEIVAKNARAEIRFSDAPEEFRDPLMDTLMTDPVSLPSGTVMDRSIILRHLARTPTNPFNRQMLTESMLKPVPELKEQIQAWMREKQSQDH,0.64255,"D24R, Y25F, D30E, R46S, L63A, N64R, S65T, D68N, E81K, S100Q",10
ISKFKLIAEKVEEIVAKNQRAEIDYSDAPEEFRDPLSDTLMTDPVRLPSGRVMDRSIILRHLLNSPTNPFNRQMLTESMLEPVPELKERIQAWMDERQSSDH,3.021824,"E2S, L7I, A19Q, D30E, M37S, T51R, D68N, Q89R, R95D, K97R",10
MEKFKLLAEKCEEIVAKNARAEIDASDAPDEFRDPLMDTLMTDPVVLPSGTVLDRSTILQHLLNSPTNPFNRQMLTESMLEPVPEVKEQIQAWRREKQSSDH,5.7030883,"I1M, V11C, Y25A, R46V, M53L, I57T, R60Q, D68N, L86V, M94R",10
IEEFKLLAEKVEEIVAKNARAEKDYSDIPDEFRDPLMDTLMTEPVRLPSGTVIDRSTILKHLLNSPTNPFNRQMLTESMLEPVEELKEQIQAWMMEKQSSDH,5.72122,"K3E, I23K, A28I, D43E, M53I, I57T, R60K, D68N, P84E, R95M",10
IEKFKLLAEKVEEIVAKNADVEIDYSEAPDEFKDPLMYTLMTDPVRLPSGTVMDRSIILRHLLNSPTNPFNRQMLMESMLQPVEEIKEQIQAWMREKQSSDH,3.8567734,"R20D, A21V, D27E, R33K, D38Y, D68N, T76M, E81Q, P84E, L86I",10
IEEFKLNAKKVEEIVAANARAEIDYSDAPDEFRDPLEDTLMADPVRLPSGTVMDRSIILKHLLNSPTNPFNRQMLTESMLEPVPELKEQIQAWVREKQSTDH,1.5487454,"K3E, L7N, E9K, K17A, M37E, T42A, R60K, D68N, M94V, S100T",10
IEKFKLLAEKVEEIVKVNARAEIDPSDAPDEFRDPLMDTLMTDPVRLPSGQVMDRSIILRHLLNSPSNPFNRQALTESMLQPVPELKERIQAWMRERQSSDH,3.4780812,"A16K, K17V, Y25P, T51Q, T67S, D68N, M74A, E81Q, Q89R, K97R",10
IEKFKLEAEKVEEIVHKNARAEIDYDDAPDEFRDPIMDELMTDPVRLPTGLVMDRSIILRHLLNSPTNPFNRQMLTESMLEPVNELKEQIQAWMREKQSRDH,6.2036653,"L7E, A16H, S26D, L36I, T39E, S49T, T51L, D68N, P84N, S100R",10
IEKFKLLAEKVEEIVAKNAQVEVDYSDAPDEFRDPLMDTLMTDPVRLPSGTVMDRSIILDHLLRSPTNPFNRHMLTESMLIPVPELKSQIQAWMREQQSSDH,0.3833087,"R20Q, A21V, I23V, R60D, N64R, D68N, Q73H, E81I, E88S, K97Q",10
IEKFKLLAEYVEEIVAKNADAEIDYSDAPDEFRDPLTDTLMTDPVRLPSGTVMDRSIILKHLLNSPTNPFNRQMLTESMLEPVKELAEQIQAWKREKAASDH,2.2361016,"K10Y, R20D, M37T, R60K, D68N, P84K, K87A, M94K, Q98A, S99A",10
IEKFKDLKEKVEEIVAKNARAEIDYIDVPDEFRDPLMDTLMEDPVRLPEGTVMDRSIILRHLLNSPTNPFTREMLTESMLEPVPELKERIQAWMREKQSSDH,6.1874304,"L6D, A8K, S26I, A28V, T42E, S49E, D68N, N71T, Q73E, Q89R",10
IEKFKLLAEKVEKIIQNNARAEIDYSDIPDEFRDPLMDTLMTDPVRLPSGTLMDRSIILRHLRNSPTNPFNRQMLTESMLEPVPELKQQIQAWMREKGSSDH,1.5318297,"E13K, V15I, A16Q, K17N, A28I, V52L, L63R, D68N, E88Q, Q98G",10
IEKFKLLADKVEEIVAKNARAEIDYSDAPDEFRDPLMYTLMTDPVRLPSGTVMERSIILRHLLNSPTNPFNRQPLTEDMLEPVPDLKDQIQAWMKEKQWSDH,1.3996358,"E9D, D38Y, D54E, D68N, M74P, S78D, E85D, E88D, R95K, S99W",10
IEKFKLLAEKVSEIVAKNARAEIDYLDAPDEFRDPLMDTLMKDPVRLPSGSVMDRSIILRHLLNSQTNPFNRQLLTESNLEPNPELKEQIVAWMREKQSSDH,1.9600224,"E12S, S26L, T42K, T51S, P66Q, D68N, M74L, M79N, V83N, Q91V",10
IEKFKLAAEKVEEIVAKNATAEITYSDAPDEFRDPLMDTLMTDPVRLPDGTVMDRGIILRHLLNSPTNPFNRQMLTESMLEPDPELKQRIAAWMREKQSSDH,2.393692,"L7A, R20T, D24T, S49D, S56G, D68N, V83D, E88Q, Q89R, Q91A",10
IEKFKLLAEKVEETVAKNARAEIDYSDAPDEFRDPLMDSLMQDPVRLPSGHVMDRSSILRHLLNSNTNPFNRQPLTESMLEPVPELKEQIEAWMREKQSTDH,2.24993,"I14T, T39S, T42Q, T51H, I57S, P66N, D68N, M74P, Q91E, S100T",10
IENFKILAEKVEEIVDKNARAEIDYSDAPDEFRDPLMDTLMTDPVRLPSGTVIDRSIILRHLRNSPTNPFNRQMLTESMLRPVPELKEQIQAWMDENESSDH,5.897605,"K3N, L6I, A16D, M53I, L63R, D68N, E81R, R95D, K97N, Q98E",10
IEKFKLLCEKVEEIVAKNARAEIPYSTAPDEFRDPLMDTLMTDPVRLPSGTVMDRTIILRHLLNSNTNPFNRQMLTESMLEPVPELKEKIQNWMREKQSSYM,2.7151723,"A8C, D24P, D27T, S56T, P66N, D68N, Q89K, A92N, D101Y, H102M",10
IEKFKLLAAKVEEIVAKNARVEIDYSDAPDEFRDPLMDTLYTDPVRLPSGTVLDRSIILRHLENSPTNPFNRNQLTESMLEPVPELKEQIQQWMRFKQSSDH,5.3620224,"E9A, A21V, M41Y, M53L, L63E, D68N, Q73N, M74Q, A92Q, E96F",10
IEKFKLEAEKVEEIVKKNARAEIDYDDAPDYFRDPLMDTLMTDPVKLPSGTVMDRSIILKHLLNSPTNPFNRQMLTESMLEPVPELKERIEKWMREKQSSDH,4.5705347,"L7E, A16K, S26D, E31Y, R46K, R60K, D68N, Q89R, Q91E, A92K",10
DEKFKVLAELVEEIVAKNAVAEEDYSDAPDEFRDPLMDTLMTDPVRLPSGTVMDRSIILRHLLNSPTNPFNRQPLTESMLEPVPELKEQIQAWLREEQSSDS,3.548425,"I1D, L6V, K10L, R20V, I23E, D68N, M74P, M94L, K97E, H102S",10
IEKFKLAANKVEEIVAKNARAEIDFSDAPDEFVDPLMDTLMTDPVKLPSGTVMDRQIILRHLLNSPTNPFNRQMLTTSMLEPVPELQEQIQAWMNEKQSSDH,1.332515,"L7A, E9N, Y25F, R33V, R46K, S56Q, D68N, E77T, K87Q, R95N",10
IEKFKLLAEKVEEIVAKNARADIDYSDAPDEFRDPITDTLMNDPVRLPSGTVMDRSVILRHLLNSPTNPFNRTMLTEDMLEPVPELKCQIQAWIREKQSSDH,4.2404566,"E22D, L36I, M37T, T42N, I57V, D68N, Q73T, S78D, E88C, M94I",10
IEKFKLLSAKVEEIVAKNARAQIDYSDAPDEFRDPLMYTLMTDPVRLPSGTVMDRQIILRHLLNSPTNPFNRQMLTESMLTPVPELKEVIQAWMREKQSYDN,3.708062,"A8S, E9A, E22Q, D38Y, S56Q, D68N, E81T, Q89V, S100Y, H102N",10
IEQFKALAEKVEEIVAKNARAEIDYSDVPDEFRDPLMDTLMTDPVRLPYGTVMDRSIILRHLLNSPTNPFNRQPLTESDLEPVPELKESIQTWMREKQSSGH,1.8174136,"K3Q, L6A, A28V, S49Y, D68N, M74P, M79D, Q89S, A92T, D101G",10
AEKFKLLAEKVEEINAKNADAEIDYSDAPDEFLDPLMDTLMTDPVRLPSGTVMDRSIIKRHLLNSPTNPFNRQMLTESMLEPVEELKEQIEAWMRENQSSTH,3.9303021,"I1A, V15N, R20D, R33L, L59K, D68N, P84E, Q91E, K97N, D101T",10
IERFKLLAEKVERIVAKNARAEIDLSDAPDEFRDPIMDTLMTDPVRLPSGTVMDRHIILRHLLTSPTNPFNRCMLTESMLEPVPELKEQIQAWMRERRSSDH,3.219232,"K3R, E13R, Y25L, L36I, S56H, N64T, D68N, Q73C, K97R, Q98R",10
IEKFKLLAEKEKELVAINAQAEIDYSDAPDEFRDPIMDTLMTDPVRLPNGTVMDRSIILKHLLNSPTNPFNRQMLTESMLEPVPELKEQIQLWMREKQSSDH,6.3758125,"V11E, E12K, I14L, K17I, R20Q, L36I, S49N, R60K, D68N, A92L",10
IEKIKALNEKVEEIVAKNARAEIDDSDAPDEFRDPLMNTLMTDPVRLPSGIVMDRSIILKHLLNSPTNPFNRVMLTESMLEPVPELKEQIQAWMRERQSSDH,4.030178,"F4I, L6A, A8N, Y25D, D38N, T51I, R60K, D68N, Q73V, K97R",10
IEKFRLLAKKVEEIVAKNARANIDYSDAPDEFRCPLMRTLMTDPVRLPSGTVMDRSIILRHLLNSPVNPFNRQMLTESMLEPVPELQEQIQAWMREHQGSDH,0.6029781,"K5R, E9K, E22N, D34C, D38R, T67V, D68N, K87Q, K97H, S99G",10
IEEMTLLAEKVEEIVAKNNRAESDPSDAPDEFRDPLMDTLMTDPVRLPSGTVMDRSIILRHLLNSPTNPFNRQKLTESMLEPVPELKEQIQAWIKEKQSSDH,0.46973592,"K3E, F4M, K5T, A19N, I23S, Y25P, D68N, M74K, M94I, R95K",10
IEKFKLLAEKVEEIVGKNAAAEIDYGDAPDEFMDPLMDTLMTDPVRLPDGTIMDRSIILRHLLNSPTNPFNRQMLTPSMLEPVQELKEQIQAWMREKQSSDQ,2.4037738,"A16G, R20A, S26G, R33M, S49D, V52I, D68N, E77P, P84Q, H102Q",10
IEKFKLLAEKVEEIVAKNARLEIVYSDAPDEFRDPLMDTLMTDPVRLPSGVLMDRSIILRHLTNSPTNPFNRCMLTESMLEPVPELKEQIQAWIREMQSSRH,2.1451187,"A21L, D24V, T51V, V52L, L63T, D68N, Q73C, M94I, K97M, D101R",10
IYKFKLLAEQVEEIVAKNARAEIDYSDAPDEFRDPLMDTLMWDPVRLPSGKVIDRSIILRHLLNSPSNPFNRQTLTESMLEPVPELKERIQAWMREKQSSHH,3.2241073,"E2Y, K10Q, T42W, T51K, M53I, T67S, D68N, M74T, Q89R, D101H",10
IEKFRLLAEKVEEEVAKNARAEIDYSDAPDEFRDPLMCTLMTDPVRLPEGTVLDRSIILRHLLNNPTNPFNRAMLTESMLEPVPELKERIQAWMREKNSSDH,5.4533596,"K5R, I14E, D38C, S49E, M53L, S65N, D68N, Q73A, Q89R, Q98N",10
IEKFLLQAEKTEEIVAKNARLEIDYSDAPDEFRDPLMFTLMTDPVRLPSGTVLDRAIILRHLLNNPTNPFNRQMLTENMLEPVPELKEQIQAWMREKQSSDH,5.7667418,"K5L, L7Q, V11T, A21L, D38F, M53L, S56A, S65N, D68N, S78N",10
KEKFKLLAEKVEVIVAKNARAEIPYSDAPDEFRDPLMDTLMTDPVRLPDGTVMDRSIILRHLQNSPTSPFTRQLLTESMLEPVPELKEQIQAWMRENSSSDH,3.753097,"I1K, E13V, D24P, S49D, L63Q, D68S, N71T, M74L, K97N, Q98S",10
DEKFKTLAEKVEEIVAKNRRAEIDLSDAPEEFRDPLMDTLMTDPVRLPSGTVMDRSIILRHLLNSPTNPFNRQMLTESMLEPVPTLKEQIQAWMKAKQSSDT,1.6600516,"I1D, L6T, A19R, Y25L, D30E, D68N, E85T, R95K, E96A, H102T",10
IEKFKLLAEKVEELVSKNARAEIDFIDAPDEFRDPLMDTLMYDPVRVPSGTVMDRSIILKHLLNSPTNPFNRQMLTESMLKPVPELKEQIQAWMREKPSSDH,3.8471632,"I14L, A16S, Y25F, S26I, T42Y, L47V, R60K, D68N, E81K, Q98P",10
IEKFKLLQEKVKEIVAKNAAPEIDYSDAPDEFRDPLMDSLMTDPVRLPSGTVMDRSIILRHLLNSNTNPFNRQPLTESMLEPVPELKKQIQAWMREKQKSDH,2.92909,"A8Q, E12K, R20A, A21P, T39S, P66N, D68N, M74P, E88K, S99K",10
PEKFDLLAQKVEEIVSKNARAEIDYSDAPDEFRDPLMDTLMTDPVRLPSGYVMDRSIILRHLLNSPTNPFTREMLTESMLEPVPELKSQIQAWMREKQSSPH,2.2195263,"I1P, K5D, E9Q, A16S, T51Y, D68N, N71T, Q73E, E88S, D101P",10
IQKEKLLAEKNEEIVAKNARAEIDYSDAPDEFRDPLMDTLMTDPVSLPSGTVIDRSIILRHLSNFPTNPFNRQMLTESMLEPVPELKEQIQAWMRWKQSSDQ,1.575505,"E2Q, F4E, V11N, R46S, M53I, L63S, S65F, D68N, E96W, H102Q",10
MEKFKLLKKKVEDIVAKNAVAEIDYSDAPDEFRDPLMDTLMTDPVRLPSGTVMDRSIILRHLLNSPTNPFNRQMLTEKMLEPVEELKVQIQAWMREKQSNDH,2.421062,"I1M, A8K, E9K, E13D, R20V, D68N, S78K, P84E, E88V, S100N",10
IEEFRLLAEKVEEVVAKNARAEIDNSDAPDEFRNPLMDTLMTDPVRLPSGHVMDRSIILRHLLNSPTNPFNRQMLTKSALEPVPELKEQIQAWMAEKQSSDH,-1.5712881,"K3E, K5R, I14V, Y25N, D34N, T51H, D68N, E77K, M79A, R95A",10
IEKFKLLATKVEEIVASNARAEIDYSDAPDEFRDPIMDTLMTDPVRLPSGTVMDRSIIVIHLNNSPTNPFNRQMLTETMLEPVPELKEQIQAWMRERQPSDH,6.0434217,"E9T, K17S, L36I, L59V, R60I, L63N, D68N, S78T, K97R, S99P",10
IEKMKLLAKEVEEIVAKNAPAEIDYSDAPDEFRDPLMDTLMTDPVKLPSGTVMDRSIILKHLANSPTNPFNRQMLTESMLMPVPELKEQIQAWMRENQSSDH,3.9403882,"F4M, E9K, K10E, R20P, R46K, R60K, L63A, D68N, E81M, K97N",10
IEKFKALFEKVEEIVAKNARAEIDYSSAPDEFRDPLMDTLITDPVRLPSGTVMDRSIIVRHLLNSPTNPFNRQMLTESMLIPVPELKNQIQAWMREKVSSEH,2.5800972,"L6A, A8F, D27S, M41I, L59V, D68N, E81I, E88N, Q98V, D101E",10
IEKFKLLAEKVEEIVAKNARAEIDYSDAPDEFRDPLMCTLMTDPVRLPSGTVMDRAIILRHLQNSPTNPFNRQPLTESMLEPLPELKQQIQAWMTEKQDSLH,2.9179246,"D38C, S56A, L63Q, D68N, M74P, V83L, E88Q, R95T, S99D, D101L",10
IEDFKLLAEKVHEIRAKNARAEIDYSDAPDEFRDPLMDTLMTDPVRLPNGTVMDRSIILRHLLNNPTNPFNRTPLTESMLEPVPELKERIQAWMREKNSSDH,1.1359886,"K3D, E12H, V15R, S49N, S65N, D68N, Q73T, M74P, Q89R, Q98N",10
IEKFKLLAEKTETIVAKNANEEIRYSDAPDEFRDPLMYTLMTDPVRLPSGTVMDRSVILRHLQNSPTNPFNRQMLTESMLEPVPELKEKIQAWMREKQSSDH,6.6046057,"V11T, E13T, R20N, A21E, D24R, D38Y, I57V, L63Q, D68N, Q89K",10
IEKFKELAEKVETIEAKNARAETDYQDAPDEFRDPLMDTLMTDPVRLPSGTVMDRDIILHHLLNSLTNPFNRQMLTESMLEPVPELKEKIQAWMREKQSSDH,2.9696815,"L6E, E13T, V15E, I23T, S26Q, S56D, R60H, P66L, D68N, Q89K",10
IEPFKLSAELVEEIQAKNARAEDDYSDAPDEFRDPLMDTLMTDPVRLPTGTVMDRSIILRHLLNEPTNPFNRQMLTESNLEPIPELKEQIQAWMREKQSSDH,0.93274367,"K3P, L7S, K10L, V15Q, I23D, S49T, S65E, D68N, M79N, V83I",10
IEKFKLLASKGEEIVAKNARAEIDYSDAPDEFRDPLFDTLMTDPVKLPSGTVMDRSIIDRHLLSSPTNPFNRQMLTESMIEPVPELKEQIQAWMRENKSSDH,1.0568811,"E9S, V11G, M37F, R46K, L59D, N64S, D68N, L80I, K97N, Q98K",10
IEKFKLLAEKVEEIVAEDARAEIDYSDAPDEFRDPIMDTLMTDPVRLPDGTVMDRAVILRHLLNSPTNPFNRQPLTESMLEPVPELKERIYAWMREKQSSDH,6.820452,"K17E, N18D, L36I, S49D, S56A, I57V, D68N, M74P, Q89R, Q91Y",10
IEKFKLLARKVEEIVAKNARLETDTSTAPDEFRDPLMLTLMTDPVRLPSGTVMDRSIILRHLNNSPTNPFNRQMLTESMLEPVPELTSQIQAWMREKQSSDH,1.8964958,"E9R, A21L, I23T, Y25T, D27T, D38L, L63N, D68N, K87T, E88S",10
IEKFKLLAEKVEEIVKKNARAEIDYDDAPDEFRDPLMFTLMTDPVRLPSGTVMDRSIILNHLRNSPTNPFNRQILTESMLEPVPELKKQIQNWMREKYSSDH,3.6444306,"A16K, S26D, D38F, R60N, L63R, D68N, M74I, E88K, A92N, Q98Y",10
IEKFKLWAEKVEEIAVKNERKEIDKSDAPDEFRDPLMDTLMIDPVRLPSGNVMDRSIILRHLLQSPTNPFNRQMLTESMLEPVPELKEQIQAWMREKQSSDH,2.6823745,"L7W, V15A, A16V, A19E, A21K, Y25K, T42I, T51N, N64Q, D68N",10
IEKFRLLAEKFEEIVKKNARAEIDYSDAPDEFRDPLMDTLMTDPVRLPSGTIMDRSIILRHLLNSPTNPFNRQMLTESMLEPVPKLKEVIQAWMREKDSVLH,3.5485249,"K5R, V11F, A16K, V52I, D68N, E85K, Q89V, Q98D, S100V, D101L",10
IEKFKQLAEKVEEIVASNARAEIDYSDAPDEFLDPIMFTLMTDPVRLPSGTVLDRSIILRHLLNSPTNPFNRQMLTESMYKPVPELKEQIQAWVREKQSSDH,8.767664,"L6Q, K17S, R33L, L36I, D38F, M53L, D68N, L80Y, E81K, M94V",10
IEKFKLLAEKVTEIVAKNARAEIDYQDAPDEFRDPLMDTLMTDPVRLPSGTVMDRSIILRHLLNSRTNPFTRQMLTEHMLEPMTELKEQIQAWMREYQSSDT,5.111488,"E12T, S26Q, P66R, D68N, N71T, S78H, V83M, P84T, K97Y, H102T",10
IEKFKLTAEKVEEIVAKNARAEIDYSDVPDEFRDPLMDTLMTDPVRTPSGTVMDRSNILRHLRNSPANPFNRVMLTESMLEPVPELKEQIRAWMRNKQSSDH,-1.7582986,"L7T, A28V, L47T, I57N, L63R, T67A, D68N, Q73V, Q91R, E96N",10
IEKFKLLAEQVEEITAKYARAEIDYSDAPDEFRDPLMDTLMTDPVRLPSGTVMDRSVILEHLCNSPTNPFNRQMLTESMLEPVPELKEVIQAWLREKQSDDH,3.3240247,"K10Q, V15T, N18Y, I57V, R60E, L63C, D68N, Q89V, M94L, S100D",10
IEKFKLLAEKVEESLAKNARAEIDYSDAPDEFRDPLMDTLMTDPVRLPSGNVIDRSIILRHLLNSPTNPFNRQMLTEDMLVPVPELKEQIDAWMREKQSRDQ,4.78191,"I14S, V15L, T51N, M53I, D68N, S78D, E81V, Q91D, S100R, H102Q",10
IEKFKLLAAKQEEIYAKNARSEIDYEDAPDEFRDPLMDTLMTDPVRLPSGNVMDRSIILRHLLNNPTNPFNRQMLTEIMLTPVPELKEQIQAWMREKQSSDH,1.3908734,"E9A, V11Q, V15Y, A21S, S26E, T51N, S65N, D68N, S78I, E81T",10
IEKFKLLAEKVEEIVAKNARIEIDISDAPDEFLDPLMYTLMTDPVRLPSGHVMDRSIILKHLLTSPTNPFNRQMLTEDMLEPVPELKEQIQEWMREKQSSDH,3.8902092,"A21I, Y25I, R33L, D38Y, T51H, R60K, N64T, D68N, S78D, A92E",10
MEKFKLLAEKVNENVAKNARAEIDPSDAPDEFLDPLMDTLMIDPVRLPSGTVLDRSIILRHLLNSPTNPFNRQMLTESMLEPVEELKEQIQLWMREKQSSDH,4.5456777,"I1M, E12N, I14N, Y25P, R33L, T42I, M53L, D68N, P84E, A92L",10
IEEFKLLAEKVEAIVAKDARQEISYSDAPDEFRDPLMDTLMTDPVRLPSGNVMDRSIILRHLLNSPTNPFTRQMLTESMLEPVPELKEQIQAWMQEKQSSDF,4.774124,"K3E, E13A, N18D, A21Q, D24S, T51N, D68N, N71T, R95Q, H102F",10
IEKFKLLAAKVEEIVAKNERQEIDYSDAPDEFRDPLMLTLMTDPVRLPSGTVLDRSIIRRHLLNSPTNPFNRQELTESMLEPVPELQEQIQTWMREKQSSDH,5.765399,"E9A, A19E, A21Q, D38L, M53L, L59R, D68N, M74E, K87Q, A92T",10
ITKHKLLAEKVEEIVAKNARAEIDYSDAPDEFVDPLMLTLMTDPVRLPSGTVMDRSWILRHLLNSPTNPFNRQMLTESMLEPVPELKEQINRWMHEKQSSAH,1.3596715,"E2T, F4H, R33V, D38L, I57W, D68N, Q91N, A92R, R95H, D101A",10
IEKFKLLNEKVEEILAENARAEIDTSDAPDEFRDPLMDTLMTDPVRLPSGTVMDRSIIERHLQNSPTNPFNRQMLTESMLEPVLTLKEQILAWMREKQSSDH,2.758004,"A8N, V15L, K17E, Y25T, L59E, L63Q, D68N, P84L, E85T, Q91L",10
IESFKLLAEKVEEIVAKNARAEIDESDAPDEFKDPLMDTLMTDPVRLPSGTVMDRSIILRHLLNSPTNPFNREPLTESMLEPVPELRERIQAWMREKQKSDE,1.2949672,"K3S, Y25E, R33K, D68N, Q73E, M74P, K87R, Q89R, S99K, H102E",10
IEKFRLLAEKVNTITARNARAEIDYSDAPDEFVDPLMDTLMTDPVRLPSGRVMDRRIILRHLLNSPTNPFNRQMLTESMLEPVPELKERIQAWMREKQSSDH,-0.45412415,"K5R, E12N, E13T, V15T, K17R, R33V, T51R, S56R, D68N, Q89R",10
DEKFKELAEKIETIVAKNARAEIDYSDAPDEFRDPLMDTLMTDPVRLPSGTVMDRSIILRHLLNSPTNPFNRQMLTESMLEPVPELKERIQEWMRDKQSKDY,2.5957174,"I1D, L6E, V11I, E13T, D68N, Q89R, A92E, E96D, S100K, H102Y",10
IEKFKNLAEKVEEIVGKNVRAEIDYEDAPDEFRCPLMDTLMTDPVRLPSGTVMDRSIILRHLANSPTNPFNRQMLTESMLEPDPELKERIQMWMREKQSSDH,3.010837,"L6N, A16G, A19V, S26E, D34C, L63A, D68N, V83D, Q89R, A92M",10
IEKFKLLAEKVKEIVAKNARAEIDLSDAPDEFLDPLMDTLMTDPVILPNGTVMDRSIILRHLQNSPTNPFTRQMLTESMLEPVPELKEQIDAWFREKQSSDH,5.887843,"E12K, Y25L, R33L, R46I, S49N, L63Q, D68N, N71T, Q91D, M94F",10
ISKFKLLAEQVEEFVADFARDEIDYSDAPDEFRDPLMDTVMTDPVRLPSGTVMDRSIILRHLLSSPSNPFNRQMLTESMLEPVPELKEQIQAWMREKQSSDH,0.6445674,"E2S, K10Q, I14F, K17D, N18F, A21D, L40V, N64S, T67S, D68N",10
IEKRKLLAEKVEEIVAKNARAEIEYYDAPREFRDPVMDTLMTDPVRLPDGTVVDRSIILRHLLNSPTNPFNRTMLTESDLEPVPELKEQIQAWMREKQSSDH,5.299362,"F4R, D24E, S26Y, D30R, L36V, S49D, M53V, D68N, Q73T, M79D",10
IEKFKQLAEKVEEIVAKPARAEDDYEDAPDEFRDPLMDTLMTDPVRLPSGTVMDRSIILRHLKNSPTNPFNRQMLTESMLENHPELKAQIQAWMREKQSSYH,2.339817,"L6Q, N18P, I23D, S26E, L63K, D68N, P82N, V83H, E88A, D101Y",10
IENFKLLAEKVEEIVAKNARAEIDFSDAPDEFRDPLMDTLMTDPVRLPDGTVMDRSIILRHLLNSPTNPFNRQMLTESMLVPVDELKVRIQQWMREKQDSDH,3.3472028,"K3N, Y25F, S49D, D68N, E81V, P84D, E88V, Q89R, A92Q, S99D",10
IEKFKLLAEKVEEIVAKNARAEIDYKDVPDEFRDPLMDTLMTDPVHLPSGTVMDRDIILRHLLNSPTNPFNRQMLTESMLEPVPELHNQIQAWARERQISDH,4.6632786,"S26K, A28V, R46H, S56D, D68N, K87H, E88N, M94A, K97R, S99I",10
MEKFQLLAEKVEEIVAKNARAEIDYKEAPDIFRDPLMYTLMTDPVRLPSGTVMERSIILRHLLNSPTNPFNRQMLTESMLTPVPELKEQIQAWMREKQKSDH,3.8861754,"I1M, K5Q, S26K, D27E, E31I, D38Y, D54E, D68N, E81T, S99K",10
IEKFKLLQEKVEEIERKNAAAEIDYSDAPDEFRDPLMDTLMTDPVRLPSGQVMDRSIILRHLLNSPTNPFNRQMLTESMLEPVPELKEQIDVWMREKESSAH,3.5968518,"A8Q, V15E, A16R, R20A, T51Q, D68N, Q91D, A92V, Q98E, D101A",10
IEKFSILAKKVEEIVAKNARAEIDYSDAPDEFLDPLMDKLMTDPVRLPSGRVVDRSVILRHLLNSPTNPFNRQMLTESMLEPVPELKEQIQAWMREKQSSRH,4.380665,"K5S, L6I, E9K, R33L, T39K, T51R, M53V, I57V, D68N, D101R",10
IEKFKLLAEKTEEIVAKNARAEIDPSDVPDEFRDPLMDTLMTDPVRLPSGTVMDRSTILRHLLNSQTNPFTRQMLTESMLEPVPELKEQIQAWIREKKSKDH,8.49646,"V11T, Y25P, A28V, I57T, P66Q, D68N, N71T, M94I, Q98K, S100K",10
IEKFRLLVEKVEEIVVKNSRAEIDYSDAPDEFRCPLMDTLMTDPVRLPSGTVMDRSIILRHLLNSPTNPFTRQPLTESMLEPVPELKEQIQAWMREKQSLDR,4.5621357,"K5R, A8V, A16V, A19S, D34C, D68N, N71T, M74P, S100L, H102R",10
IEDFKLLAEKVEEIVAKNNRLEIDYSDLPDEFRDPLMDTLMTDPVRLPSGTVLERSIILKHLTNSPTNPFTRQMLTESMLEPVPELKEQIQAWMREKQSSDH,8.314604,"K3D, A19N, A21L, A28L, M53L, D54E, R60K, L63T, D68N, N71T",10
IEKYKLLAEKVEEIVAKNARAELDYSDAPHEFRDPLMDTLMTDPVRLPSGTVMDRSVILRHLLNSSTNPFNRQMLTESMLEPVPELKERIDAWMREQQSSTH,1.257052,"F4Y, I23L, D30H, I57V, P66S, D68N, Q89R, Q91D, K97Q, D101T",10
ITKFKLLAEEVERIVACNARAEIDYSKAPEEFRDPLMDTLMTDPVRLPSGTVVDRSIIQRHLLNSPTNPFNRQPLTESMLEPVPELKEQIQAWMREKQSSDH,6.645797,"E2T, K10E, E13R, K17C, D27K, D30E, M53V, L59Q, D68N, M74P",10
IDKFETLAEKVEEIVAENAPVEIDYSDAPDEFRDPLMRTLMTDPVRLPSGTVMDRSIILRHLLNSPTNPFNRQMLTESMLEPIPELKEQIDAWMREKQSSDH,2.0866246,"E2D, K5E, L6T, K17E, R20P, A21V, D38R, D68N, V83I, Q91D",10
DETDKLLAEKVEEIVAKNARAEVDYSDAPDEFRDPLMDTLMTDPVRLPSGNVMDRQIILNHLLNSPTNPFNRQPLTESMLELVPELKEQIQAWMREKQSSDH,-0.6536099,"I1D, K3T, F4D, I23V, T51N, S56Q, R60N, D68N, M74P, P82L",10
IEKFKLLAEKAEEIAAKHADAEIGYSDAPDEFRDPLMYTLMTDPVRLPSGTVMDRSIILRHLLNSPTNPFNRVMLTENMLEPVPELKSQIQAWMREKQSSDH,3.1402807,"V11A, V15A, N18H, R20D, D24G, D38Y, D68N, Q73V, S78N, E88S",10
IEKFKLLAEQVEEMVAKNARAEIDYSDAPDEFRDPLMYTLMTDPVLLPSGTVMDRSIILRHLLTSPTNPFNRQMLTESDLEPVPELREQIQAWLREKQDSDH,3.1407132,"K10Q, I14M, D38Y, R46L, N64T, D68N, M79D, K87R, M94L, S99D",10
IQKFKDLTDKVEEIVAKNARAEIDYSDAPDEFRNPLMDTLMTDPVRLPSGTVMDRSVILRHLMNSETNPFNRQMLTESMLEPVPELKEQIQTWMREKQSSDH,0.9536618,"E2Q, L6D, A8T, E9D, D34N, I57V, L63M, P66E, D68N, A92T",10
