Sequence,Score,Mutations,Number of Mutations
IEKFKLLASKVEEIVAGNARAEIDDSDAPDEFRDPIMDTLMTDPVRLPSGTVMDRSLILRHLLNSPTNPFNRQMLTESDLEPVPELKVQIQLWNREKQSSDH,5.5722356,"E9S, K17G, Y25D, L36I, I57L, D68N, M79D, E88V, A92L, M94N",10
IEKFKLLAEKVENIVAKNAVAEIDYSDAPDEFVDPLMDTLMTDPVRLPSGTVMDRSIIVRHKQNSPTNPFNRTSLTESMLEPVPELKRQIQAWMREKQSSDH,1.3742274,"E13N, R20V, R33V, L59V, L62K, L63Q, D68N, Q73T, M74S, E88R",10
MEKFKLLAEKMEEIVAKNANAEIDYSDAPDEFRDPIMDTLFKDPVRLPSGTVMDRSIILRHLLNSQTNPFNRQMLTEPMLEPVPELKEQIQAWMREKTSSDH,3.4364762,"I1M, V11M, R20N, L36I, M41F, T42K, P66Q, D68N, S78P, Q98T",10
IEKFCKLAEKVEEIVAKNARAEIDYSDAPDEFRDPILYTLMTDPVRLPSGTVMDRSIILRHLLNSPTNPFTRVMLTESMLQPVTELKEQIQAWMREKQSSDH,9.969056,"K5C, L6K, L36I, M37L, D38Y, D68N, N71T, Q73V, E81Q, P84T",10
IEKFKLLLEKTKEIVAKNARTEIDYSQAPDEFRDPLMLTLMTDPVRLPSGTVLDRSIILRHLLNSPTNPFNRQMLTESMLEPVPELKEQIQAWMSKKQSSDH,5.620659,"A8L, V11T, E12K, A21T, D27Q, D38L, M53L, D68N, R95S, E96K",10
SKKFKELAEKVEEIVAKNERAEIDYSDAPDEFRDPLMDTLMQDPVRLPSGTVMDRSIIRRHLLNSPTNPFTRSMLTESMLEPVPGLKEQIQAWMREKQSSDH,5.701269,"I1S, E2K, L6E, A19E, T42Q, L59R, D68N, N71T, Q73S, E85G",10
MEKFKALAEKVEEIVAKNARAEIDLSDAPDEFRDPLTDTLMTDPVRLPSGRVMDRGIILRHLLNSPTNPFNRQPLTESMLEPVPELKEQIEAWMRQKQSSDH,2.0423157,"I1M, L6A, Y25L, M37T, T51R, S56G, D68N, M74P, Q91E, E96Q",10
IEKFKLLAEMVEKIVAKNNRAELDYSDAPDEFRDPLMDTLMTDPVRNPSGTVLDRSIILRHLLNSPTNPFTRQMLTESMLEPVPELKQQIQKWMREKQSSDH,9.413904,"K10M, E13K, A19N, I23L, L47N, M53L, D68N, N71T, E88Q, A92K",10
IEKFKLLAETQEEIVAKEARAEIDLSDVPDDFRDPLMDTLMTDPVRLPSGTVMDRSIILRHLLNSPTNPFNRQTLTESNLRPVPELKEQIQAWMREKQSSDH,2.5445535,"K10T, V11Q, N18E, Y25L, A28V, E31D, D68N, M74T, M79N, E81R",10
IEKFKLLAEKVEEIVANNARREIDYSTAPDEFRDPLLDTLMTDPVRLPSGTVMDRSIILRHLLNSPTNPFNRQPLTESQLEPVIELKEQIQAWAREYQSSDH,3.618531,"K17N, A21R, D27T, M37L, D68N, M74P, M79Q, P84I, M94A, K97Y",10
IEKFKLLAEKVEEIVAKNARVDIDYSDAPDEFRDPLMDTLMTDPVRLPSGVVMDRSIILRHLLQSQTNPFNRQPLTESMLVPVPELKEQIQAWIRSKQSSDH,3.1154366,"A21V, E22D, T51V, N64Q, P66Q, D68N, M74P, E81V, M94I, E96S",10
IEKFRLLAEKVEKIVAKNARAEIDYSDAPDEFRDPIMDTLMKDPVRLPSGTIMERSIILRHLLNSQTNPFNRQMLTESDLEPVPDLKEQIQAWMREKQSSDH,2.7302513,"K5R, E13K, L36I, T42K, V52I, D54E, P66Q, D68N, M79D, E85D",10
IEKFQLLAEKVEEVAAKNARAEIDYSDAPDEFRDPLMDKLMTDPVRLPSGTVMDRSIILRHLLNSPTNPFNRQMLTESQLEPDPELKEHIQAWMRQHQSSDH,0.054456476,"K5Q, I14V, V15A, T39K, D68N, M79Q, V83D, Q89H, E96Q, K97H",10
IEKFKLLAEEVEEIVAKNARAEIDYSDAPDEFTCPIMKTLMTWPVRLPSGQVIDRSIILRHLLNSPTNPFNRQMLTESMLEPVPELKEQIQAWMREKQSKDH,6.1728325,"K10E, R33T, D34C, L36I, D38K, D43W, T51Q, M53I, D68N, S100K",10
IEKFKKLAEKVEEIVAKNARAEIDYSDAPDAFRDPLMDTLMTDPVRLPSGTYMDRAIILRHLLASPTNPFTRQMLTESMLEPVPELKEQILAWRREKQTSDH,4.7675576,"L6K, E31A, V52Y, S56A, N64A, D68N, N71T, Q91L, M94R, S99T",10
IEKFKLLKEKAEEIVVKNARAEYDYIDAPDEFRNPLMDTLMTDPVRLPSGTVMDRSIILRHLLNSPTNPFNRIMLTESMLEPVRELKEQIQKWMREKQSSDH,1.2301137,"A8K, V11A, A16V, I23Y, S26I, D34N, D68N, Q73I, P84R, A92K",10
ITKFKLLAEKVYEIVAENARAEIDYSDAPDEFRCPLMDTLMTDPVRLPSGTVIDRSIILRHLLNHPTNPFNRQMLTESMLEPVPKLKEQIQAWMREKQTSPH,3.7409863,"E2T, E12Y, K17E, D34C, M53I, S65H, D68N, E85K, S99T, D101P",10
IEKFKLLLVKVEEIVAKNARAEIDVGYAPDYFRDPLMDTLMTDPVRLPSGTVMDRSIILRHLLNSPTNPFTRQMLTESMMEPVPELKERIQAWMREKQSSDH,1.5057459,"A8L, E9V, Y25V, S26G, D27Y, E31Y, D68N, N71T, L80M, Q89R",10
IEKFNLLAEKVENIVAKNARVEIDYLDAPDEFLDPIMDTLMTDPVRLPSGTVMDRSIILRHLLNSPTNPFNRQMLHESMLIPVPELKEQIQAWMREKQLSDH,6.471942,"K5N, E13N, A21V, S26L, R33L, L36I, D68N, T76H, E81I, S99L",10
IEKFKLLAEKVEEIWAKNARAELDYSDAPDEFRDPLMLTLMTDPVRLPDGTVMDRSIILRHLLNSPTNPFNRMMLTESMLEPVPELKERIQAWMQLKQSSDD,0.8977556,"V15W, I23L, D38L, S49D, D68N, Q73M, Q89R, R95Q, E96L, H102D",10
IAKFKLLAEHLEEAVAKNSRAEIDESDAPDEFRDPLMDTLMTDPVRLPSGTVMDRSIIHRHLLNSPTNPFNRQMLTESMLEPVPELKEQIQAWMSEKNSSDH,1.5988507,"E2A, K10H, V11L, I14A, A19S, Y25E, L59H, D68N, R95S, Q98N",10
IEKFKELAEKAEEIVAKNARAEEDYSDAPDEFRDPVMDTLMTDPVRLPSGTVIDRSIIRRHLLNSPHNPFNRQNLTESMLEPVPELKEQIQAWMREKSSSDH,5.640338,"L6E, V11A, I23E, L36V, M53I, L59R, T67H, D68N, M74N, Q98S",10
IEKFKQLAEKIEEIVAINARREFDYSDAPDEFRDPLMDTLMTDPVRLPSGTVMDRSIILRHLLNSTTNPFTRQMLTEEMAEPVPELKEQIQAWMREKQSSDH,5.986088,"L6Q, V11I, K17I, A21R, I23F, P66T, D68N, N71T, S78E, L80A",10
IETRKHLAEKVQEIVSKNAEAEIDYSDAPDGFRDPLMDTLMQDPVRLPSGTVMDRSIILRHLLNSPTNPFNRDMLTESMLEPVPELKEQIQAWMREKQSSDH,-0.22604583,"K3T, F4R, L6H, E12Q, A16S, R20E, E31G, T42Q, D68N, Q73D",10
IEKFKSLADKVEEIYAGNARAEIDYSDAPDEFRDPLMDDLMTDPVRLPSGIVFDRSIILRHLLNSPTNPFNRQMLTESMLEPVPELKEQIQAWCREKQSSDN,5.6036134,"L6S, E9D, V15Y, K17G, T39D, T51I, M53F, D68N, M94C, H102N",10
IEEFKQNAEKVEEISAKVARAEIDYSDAPDEFRDPLMDTLMTDPVRLPSGTVMDRSTILRHLQTSPTNPFNRQPLTESMLEPVPELKEQIQAWMREKQSSDH,3.5461745,"K3E, L6Q, L7N, V15S, N18V, I57T, L63Q, N64T, D68N, M74P",10
MEKFKLLAEKVEEIVAKNARAEEDYADAPDEFRDPLLDTLMTDPVRLPSGTVMDRTIILRHLLNSPTNPFTRQMLTEGMLEPVPELKEQIQAWMLEHQSSDH,6.0397973,"I1M, I23E, S26A, M37L, S56T, D68N, N71T, S78G, R95L, K97H",10
IKKFKLWAEKVEEIVAKNAEAEIDYSQAPDEFRDPLMDTLMTDPVRLPSGTVMDRSIILRHLLNSPTNPFTRQMLTESMLEPMPELKKQIQAWMRENQLSDH,6.5101576,"E2K, L7W, R20E, D27Q, D68N, N71T, V83M, E88K, K97N, S99L",10
IEKFNLLAEKVEQLVVKNAEAEIQYSDAPDEFRDPLQDTLMTDPVCLPSGTVMDRSIILRHLLNSPTNPFNRQMLTESMLEPVPELKEQIQAWMREKQSSSH,1.1148058,"K5N, E13Q, I14L, A16V, R20E, D24Q, M37Q, R46C, D68N, D101S",10
MEKFKLLAEKVEEIYDPSDRAEIDYSDAPDEFADPLMYTLMTDPVRLPSGTVMDRSIILRHLLNSPTNPFNRQMLTESMLEPVPELKQQIQAWMREKQSSDH,2.7664242,"I1M, V15Y, A16D, K17P, N18S, A19D, R33A, D38Y, D68N, E88Q",10
IEKFKLLAEKIEEIVAKDARAEVDYSDAPDHFLDPLMDTLMTDPVRLPSGHVMDRSIILRHLLNSPTNPFNRQALTESMLEPVPGLKEQIQAWMREKQRSDH,3.555582,"V11I, N18D, I23V, E31H, R33L, T51H, D68N, M74A, E85G, S99R",10
IEKTKLLAETVEEIVARNARAEIDYTDAPVEFRDPLMDTLMTDPVRLPSGTVMDRQIILRHLLNSPTNPFNRQMLTESMLEPVPELKEQIQNWMREKQSSHN,2.5334814,"F4T, K10T, K17R, S26T, D30V, S56Q, D68N, A92N, D101H, H102N",10
IEKFKLLAEKVEEIVAKNAHAEIDYNDAPDEFVDPLDDTLMTDPVRLPSGTVMDRSIILRHLLDSPTNPFNRQMLTESMLRPVPELQEQIQAWMTEKASSDH,0.9357002,"R20H, S26N, R33V, M37D, N64D, D68N, E81R, K87Q, R95T, Q98A",10
LEKFKRLAEKVEEIVAKNARAEIDYKDAPDEFRDPIMDTLMTDPVRLPSGTVMDRSIILRHLLNHRTNPFNRKPLTESYLEPVPELKEQIQAWMREKQSSDH,2.4315114,"I1L, L6R, S26K, L36I, S65H, P66R, D68N, Q73K, M74P, M79Y",10
IEKFKELASKVEEIVAKSARAEILYSDAPDEFRDPLMDTLMKDPVRLPSGTVMDRHIILDHLLNDPTNPFNRLMLTESMLEPVPELKEQIQAWMREKQSSDH,1.2829504,"L6E, E9S, N18S, D24L, T42K, S56H, R60D, S65D, D68N, Q73L",10
IEKFKALAEEVEEIVAKNARPEIDYSEAPDEFIDPLMDTLMTDPVRLPSGTVMDRSIILRHLLNSPTNPFNRQMLTESMLEPVPELLEQIQLWMRLKQSCDH,0.6763891,"L6A, K10E, A21P, D27E, R33I, D68N, K87L, A92L, E96L, S100C",10
DEKFQLLAEKVEDIVAKNARAEIDMSDAPDEFRDPLMYHLMTDPVRLPSGLVMDRSIILRHLLNSPTNPFNRQMLTESMLEPVPELKEQIQAWMNEKVSSDH,3.2762837,"I1D, K5Q, E13D, Y25M, D38Y, T39H, T51L, D68N, R95N, Q98V",10
IDKFKLLAGKIEEINAKNAGAEIDYSDAPDEFRDPLMDTLMTDPVRLPSGTVMDRKIILEHLLNSPTNPFNRQMLTESQLEVVPELKEQIQAWMREKQSSDH,1.6956221,"E2D, E9G, V11I, V15N, R20G, S56K, R60E, D68N, M79Q, P82V",10
IEKFKLLAEKVEAIYAKYARAEIDYSDAPDEFRCPLMDTLMTDPVRLPSGTVMDRSYILRHLLNSPTNPFNRQMLTEDMLEPIPELKERIQAWMREKKSSDH,2.2101622,"E13A, V15Y, N18Y, D34C, I57Y, D68N, S78D, V83I, Q89R, Q98K",10
IEKFKLLAEKVEEIVAKHVRAELDPSDAPDEFRDPLMDTLMTDPVRLPSGTIMDRSIILRHLLNSPTNPFTRQHLTESMLEPVPELKEQIQAWMREKDSSDK,6.9106774,"N18H, A19V, I23L, Y25P, V52I, D68N, N71T, M74H, Q98D, H102K",10
IEKFKLLAEKYEEIVAKNARAEIDVSDAPDEFVDPIMDTLMTDPVRLPSGTVMDRSIILTHLLNSPTNPFNRQMLTESDLEPVPELKEQIQAWMRRKDSSDY,2.7297409,"V11Y, Y25V, R33V, L36I, R60T, D68N, M79D, E96R, Q98D, H102Y",10
MEAFKLLLEKVEEGVAKNARAEIDYSDAPDEFRDPLMDTLMTDPVRLPSGTVMDRSIILRHLQNHPTNPFTRQMLTEQMLEPVPELKEQIQAWMREKQSSDV,3.762064,"I1M, K3A, A8L, I14G, L63Q, S65H, D68N, N71T, S78Q, H102V",10
IEKNKELLEKVEEIVAKNARAEIDYSEAPDEFLDPLMDTLMTDPVRAPSGTVMDRSIILRHLLNSPTNPFNRQMLTLSMLEPVPELKERIQAWMKEKQSSDH,-0.67089367,"F4N, L6E, A8L, D27E, R33L, L47A, D68N, E77L, Q89R, R95K",10
IEKFELLAEKVEEIQAKSTRAEIDFSDAPDEFRDPLMDTLMTDPVRLPSGTVMDRSIILRHLANSPTNPFNRQSLTESMLEPVTELKEQIQAWMREKASSDH,2.8553185,"K5E, V15Q, N18S, A19T, Y25F, L63A, D68N, M74S, P84T, Q98A",10
VEKFKLLAEKVEEVVAGAPRAEIDYSDAPDEFRDPLMDTLMTDPVRLPSGTVVDRSIILKHLLNSPTNPFNRQMLTESMLEPVPELKEQIQAWMRERQESDH,5.1617513,"I1V, I14V, K17G, N18A, A19P, M53V, R60K, D68N, K97R, S99E",10
IEKFKLLMEKVEEIVAKTARAEIDYSDAPDEFRDPLTDTLMTDPVRLPSGKVVDRSIILRHLLNSPTNPFTRQPLTESMLEPVPELKEQIQAWIREKQSSDR,8.827368,"A8M, N18T, M37T, T51K, M53V, D68N, N71T, M74P, M94I, H102R",10
IEKFKLLAEKVEEIVAKNARAEDDYSDAPDEFRDPLMDTLMTDPVRLPSGTVLERSVILRHLLNSPTNPFTRQMLSEEMLEPVPELKYQIQAWIREKQSSDH,9.436821,"I23D, M53L, D54E, I57V, D68N, N71T, T76S, S78E, E88Y, M94I",10
IEKFKLLFEKHEEIVAKNARAEIDYSDAPDEFLDPLMDTLMTDPVRLPSGTVMDRSIILRHLLTSPTNPFNRQMLTESMVEPSPELKERIQAWVRENQSSDH,1.769242,"A8F, V11H, R33L, N64T, D68N, L80V, V83S, Q89R, M94V, K97N",10
IEKFNLLLEKVEEEVAKNARAEIDLSDAPDEFRDPLMDTLMTDPVRLPSGTVMERSIILKHLLNSPTNPFNRQMLTEHMLEPVPELKEQIQAWMTEKQSSDE,0.60329497,"K5N, A8L, I14E, Y25L, D54E, R60K, D68N, S78H, R95T, H102E",10
IEKFKILKEKVEEIVASNARAEIDYEDAPDEFRDPLMDTLMEDPVRLPSGTVMDRSIILRHLKNSPTNPFNRQMLTESMIEPVPELKEQIQAWMREKQSQSH,4.0054398,"L6I, A8K, K17S, S26E, T42E, L63K, D68N, L80I, S100Q, D101S",10
IEKFKYLAEKVEEIVAENARHEIDYSDAPDEFRDPLMDTLMTDPVRLPSGTVMDRRHILRHLLNSPTNPFNREMLTESMLEPEPELKEQIQAWIREKQSGDH,2.542531,"L6Y, K17E, A21H, S56R, I57H, D68N, Q73E, V83E, M94I, S100G",10
IEKFKLLAEKVEEILRKNAHIEIDYDDAPDEFRDPLMDTLMTDPVRLPSGTVMDRSNILKHLRNSPTNPFNRQMLTESMLVPVPELKEQIQAWMREKQSSDH,3.772179,"V15L, A16R, R20H, A21I, S26D, I57N, R60K, L63R, D68N, E81V",10
IEKFKLLAEKVEEIVANNKRVEIDYSDAPDEFRDPLMDTLMTDPVRLPRGTVMERSIILRHLLNNPTNPFNRQMLTESMLEPLPELKEQIQAWMREKTSSDT,1.7000515,"K17N, A19K, A21V, S49R, D54E, S65N, D68N, V83L, Q98T, H102T",10
IEKFKTLAEKLEEIFAKNARAEIDYSDAPDEFRDPLCDTLMTDPVRLPSGTVMDRSIIVRHFLNSPTNPFNRIMLTESMLEPVPDLKEQIQQWMREKQSSDH,0.43273157,"L6T, V11L, V15F, M37C, L59V, L62F, D68N, Q73I, E85D, A92Q",10
IEKFVLLAEKVEEDVAENARAEIDYSDAPDEFADPLLDTLMTDPVRLPSGQVLDRSIILRHLLNSPTNPFNRQMLTESMLEPDPELKEQIQAWMREKQSGDH,6.625764,"K5V, I14D, K17E, R33A, M37L, T51Q, M53L, D68N, V83D, S100G",10
MEKFKLLAEKVREIVAKNARAEIDYSDAPDEFKDPLMDTLMVEPVRLPSGTVMDRSIILRHLLFSPTNPFNRWMLTESMLEPVPELKEQIQAWMRQKQSRDH,1.0817139,"I1M, E12R, R33K, T42V, D43E, N64F, D68N, Q73W, E96Q, S100R",10
IEQFKLLAEKVEEKVAKNARIEEDYSDAPDEFRDPLMDTLMTDPVRLPSGTVMDRSIILRHLLNSPTNPFNRQMLTMDMIEPVPELKDQIQAWMRAKQSSDH,1.6806064,"K3Q, I14K, A21I, I23E, D68N, E77M, S78D, L80I, E88D, E96A",10
MEKFKLLAEKTEELVAKNADAEIDYSDAPDEFRDPLMDTLMVDPVKLPSGTVLDRSIILRHLLNSPTNPFNRQMLHESMLEPVPELKERIQAWMREKQSSDH,6.3106055,"I1M, V11T, I14L, R20D, T42V, R46K, M53L, D68N, T76H, Q89R",10
IEKFKLLAEKVEIFVAKNTRAEIDFSDAPDEFRDPLMDTLMTDPVRLPTGTVMDRSIILRHLRNSPTNPFNRQQLTESMLEPVPELKEQIDYWMREKQSSDH,2.9035492,"E13I, I14F, A19T, Y25F, S49T, L63R, D68N, M74Q, Q91D, A92Y",10
IEKFKDLIEKVEEIVAKNARAEIDYSDAPDEFRDPLTDTLMRDPVRLPSGTVMDRSIILRHLLNSPTNPFTRQMLTESMLEPVPVLKEQIDRWMREKQSSDS,4.886089,"L6D, A8I, M37T, T42R, D68N, N71T, E85V, Q91D, A92R, H102S",10
IEKFKLLAAKVEEIYAKNARAEIDYSDIPDEFRDPLQDYVMTDPVRLPSGTVMDRSIILRHLLSSPTNPFNRQMLTESMLEPVPELKEQILAWQREKQSSDH,0.76851755,"E9A, V15Y, A28I, M37Q, T39Y, L40V, N64S, D68N, Q91L, M94Q",10
IDKFKLLAEKVEEIVAKNADAAINESDAPDEFIDPLMDTLMSDPVRLPSGTVMDRSIILRHLLNSPTNPFNRQMLTEDMLEPVPELKEQIQEWMREKQSSDH,-0.084213436,"E2D, R20D, E22A, D24N, Y25E, R33I, T42S, D68N, S78D, A92E",10
IEKFKLLAEKVSETVAKKALAEIDYSDAPDEFRDPLMDTLMTDPVRLPSGTVMDRSIILRHLLNSPTNPFNRQMLTESMLIPVPELKERIDAWLREKQKSDH,3.1465876,"E12S, I14T, N18K, R20L, D68N, E81I, Q89R, Q91D, M94L, S99K",10
IEKNKLLQKKVEEIVAKNARAFIDYSDAPNEFRDPLMHTLMTDPVRLPSGTVMDRSIILRHLKNSPTNPFNRQMLTESMLEPVPELKEQIQAWLVEKQSSDH,0.58566463,"F4N, A8Q, E9K, E22F, D30N, D38H, L63K, D68N, M94L, R95V",10
IEKLELLAEKVHEIVEKNARASIDYSDAPDEFRDPIMRTLMTDPVRLPSGTVMDRSIILRHLLDSPTNPFNRQMLTESMLEPVPELKEQIQAWSREKQSSDH,3.6889615,"F4L, K5E, E12H, A16E, E22S, L36I, D38R, N64D, D68N, M94S",10
IEKFKLEAEKVEEIYAKLARAEVDYSDAPDEFRCPLMDTLMTDPVRLPSGTVMDRGPILRHLLNSPTNPFNRQMLTESMLEPVPELKEQIQAWMREKQSSRR,3.540935,"L7E, V15Y, N18L, I23V, D34C, S56G, I57P, D68N, D101R, H102R",10
ITKFKLLAEELEEIVAKNARAEIDYSDVPDEFRDPLMDTLMTDPVRTPSGTVMDRSIIIRHLQNSPTNPFNRQMLTESSLEPVPELKEKIQAWMREKQSSDH,2.59894,"E2T, K10E, V11L, A28V, L47T, L59I, L63Q, D68N, M79S, Q89K",10
IEKFKLLAEKVEEIVPFNARANIEYSDAPDEFRDPLMDTLMTDPVRLPSGTVMDRSIIHRHLLQSPTNPFTRQPLTESMLEPVPELKEQIQAWMREKQSSSH,6.419956,"A16P, K17F, E22N, D24E, L59H, N64Q, D68N, N71T, M74P, D101S",10
IEKVKLLFEKVEEAEAKNARAEITYSDAPDEFRCPLMDTLMTDPVRLPSGTVMDRSIILRHLLNSPTNPFNRTMLTESDLEPVPELKEQIQAWMREKQSSDA,0.8223848,"F4V, A8F, I14A, V15E, D24T, D34C, D68N, Q73T, M79D, H102A",10
FEKFNLLAEKVEETVAKNARAQILYSDAPDEFRDPLMDTLMTDPVRTPSGTVMDRSIILRHLNNSPTNPFNRQALTESMLEPVPELKEQIQAWRREKQSSDH,-0.8819424,"I1F, K5N, I14T, E22Q, D24L, L47T, L63N, D68N, M74A, M94R",10
QEKFDLPQEKVKEIVAANARAEIDYSDAPDEFRDPLMDTLMTDPVRLPHGTVMDRSIILRHLLNSPTNPFNRQMLTESMLEPVLELKEQIQHWMREKQSSDH,3.2214048,"I1Q, K5D, L7P, A8Q, E12K, K17A, S49H, D68N, P84L, A92H",10
IEKFKLLKEKVEEIVAPNARAEIDYSDAPDEFRDPLMDTLMTDPVRLPNGVVMDRSIILRHLLNSPTNPFNRQMLTESMLEPVMELHEKIQAWMREKQESDN,4.584182,"A8K, K17P, S49N, T51V, D68N, P84M, K87H, Q89K, S99E, H102N",10
IEKFKLLREKVEEIVAKNARLEIDYSDAPDEFRDPLMDTLMTDPVRLPSGTVMDRSNIMRHLLNSPSNPFNRTMLTEDMLENVPEMKEQIQAWMREKQSSDH,-0.66987157,"A8R, A21L, I57N, L59M, T67S, D68N, Q73T, S78D, P82N, L86M",10
IEKFELLANKVEEIVAKNAPAEIDYDDAPDEFMCPLMDTLMTDPVRLPAGTVMDRSIILRHLLNSPTNPFNRQMLTESMLEPVPELKEQIQAWLREKQSSDE,3.4845624,"K5E, E9N, R20P, S26D, R33M, D34C, S49A, D68N, M94L, H102E",10
IDNFKLLAEKVEEMVALNARKEIDYSDAPDEFRDPLMDTLMTDPVRLPSGTVMDRSIILRHLLNSPTNPFNRQMLTESMLKPVPELKEQIQAWLREKESSIH,2.6796942,"E2D, K3N, I14M, K17L, A21K, D68N, E81K, M94L, Q98E, D101I",10
IEKFKLPAEKVEEIYAKNARAEIDYSDVPDEFRGPLLYTLMTDPVRLPSGTVMDRAIILRHLLNSPTNPFNRQMLTENMLEPVPELKEQIQAWMRSKQSSDH,1.2513987,"L7P, V15Y, A28V, D34G, M37L, D38Y, S56A, D68N, S78N, E96S",10
IEKFKLLAEEVEEIVRKNARAEIDLSDAPDEFRDPLMDTLMTDPVRLPSGTVMDRVIILRHLLNSNTNPFNRKMLTESMLEPVPELKRQIQAWMREKISSVH,2.3736644,"K10E, A16R, Y25L, S56V, P66N, D68N, Q73K, E88R, Q98I, D101V",10
IEKFKLLALKVEEGVAKSKRAEIDYSDAPDEFRDPLMYTLMTDPVKLPSGIVMDRSIILRHLLNSRTNPFTRQMLTESMLEPVPELKEQIQAWMREKQSSDH,8.230524,"E9L, I14G, N18S, A19K, D38Y, R46K, T51I, P66R, D68N, N71T",10
IEKFKLLAEGVEAIVAKYARAEIDYADAPDEFRDPLMDTLMTDPVRLPSGKVMDRSIILRHLLNSPTNPFNREMLTESMLEPVPELKEQIDKWMRQKQSSDH,0.8195518,"K10G, E13A, N18Y, S26A, T51K, D68N, Q73E, Q91D, A92K, E96Q",10
IEKFKLFADKVEEIVAKNKRAEDDYSDAPDEFWDPLMYTLMTDPVRLPSGTVMDRRIILRHLLNSSTNPFNRQMLTESMLEPVPELKEQIQAWMREKQSSDI,3.5958803,"L7F, E9D, A19K, I23D, R33W, D38Y, S56R, P66S, D68N, H102I",10
IEKLKLLVEKVEKIVAKNARARIDYSDAPDEFRDPLMDTLMTDPVRLPSGTVMDRQIILRHLLNSPTNPFNRQLLTESMLEPVPELKTQIKAWMREKQSSDE,1.0948198,"F4L, A8V, E13K, E22R, S56Q, D68N, M74L, E88T, Q91K, H102E",10
IEKFDLLAEKIEEIVAKNARAEIDYSDAPDEFRDPIMDTLLNDPVKLPSGTVMDRSIILKHLLNSPTNPFNRQMLTESMLEPVPELKEQIQAWMNEQQSSDH,2.5537453,"K5D, V11I, L36I, M41L, T42N, R46K, R60K, D68N, R95N, K97Q",10
IEKFKLLAEKTEEIVRENARAEIDYSDAPDEFRDPLMDTLMTDPVRLPSGMVMDRSTILRHLYNSPTNPFNRQMLTEAMLEPVPELKEQIDAWMRRKQSSDH,4.473095,"V11T, A16R, K17E, T51M, I57T, L63Y, D68N, S78A, Q91D, E96R",10
IEKFKLWTTKVEAIVAKNARADIDYSDAPDEFRDPLMDTLMTDPVRLPSGHVMERSIILRHLLNSPTNPFNRQMLTESMLEPVTELKEQIQAWMRENQSSDH,2.545147,"L7W, A8T, E9T, E13A, E22D, T51H, D54E, D68N, P84T, K97N",10
IEKFKLLAEKVEKVVALPARAEIKYSDAPDEFRDPLLDTLMTDPVRLPSGTVMDRTIILRHLQNSPTNPFNRQMLTESMLEPVPELKEKIQAWMREKQSSDH,1.499327,"E13K, I14V, K17L, N18P, D24K, M37L, S56T, L63Q, D68N, Q89K",10
IEKFKLLAEKVEELTAKNARAEIDYNDAPDEFCCPLMDTLMTDPVRLPSGTVMDRKIILRHLLNSPTNPFNRQMLTESMLEPVPELKEQIQEWLREKQASDH,2.9412675,"I14L, V15T, S26N, R33C, D34C, S56K, D68N, A92E, M94L, S99A",10
IEKCKLLAEKVEELTAKNARAEIDYSDAPDEFCDPLMLTLMTDPVRLPSGTVMDRSIIQRHLLNSPTNPFNRQPLTESMLEPVPELKEQIQAWMREKQSDDY,1.2772248,"F4C, I14L, V15T, R33C, D38L, L59Q, D68N, M74P, S100D, H102Y",10
IEKFKLLAEKVEEIVAKNARAEIDESDAPDEFRDPLMRTLMTDPVRLPSGNVMDRSIIERHLQNNPTNPFNRQPLTESMLEPVPELKEQIQAWMREKDSSLH,3.2351155,"Y25E, D38R, T51N, L59E, L63Q, S65N, D68N, M74P, Q98D, D101L",10
IEKFKLLVEKVEEIVADNANAEIDYSDAPDEFRDPLMDRLMTDPVRLPSGTVMDREIIQRHLLNSPTNPFNRQMLTESMLEPVPEIKEQIQEWMREKKSSDH,2.5439398,"A8V, K17D, R20N, T39R, S56E, L59Q, D68N, L86I, A92E, Q98K",10
IEKFKLLEEKVEEIVAKNARAELDVSDAPDEFRDPLMDTLMTDPVRLPSGTVMDRSVILRHLLNYETNPFNRQMLTESMLEPVPELKERIQAWAREKQSSLH,2.7203648,"A8E, I23L, Y25V, I57V, S65Y, P66E, D68N, Q89R, M94A, D101L",10
MEKFKLLADKVEEIVAKNAREEIDYDDIPDEFRDPLMDTLMTDPVRLPSGTVCDREIILRHLLNSPTNPFNRQMLTESMLEPVPEIKEQIQKWMREKQSSDH,5.4749975,"I1M, E9D, A21E, S26D, A28I, M53C, S56E, D68N, L86I, A92K",10
IEAFKLLAEKVEEIVAKNAREEIDYKDAPDEFRCPLMDTLMTDPVRLPSGDIMDRSIILRHLLNSPTNPFNRQRLTESMLEPVPELKEKIQAWMREKKSSDH,4.9127126,"K3A, A21E, S26K, D34C, T51D, V52I, D68N, M74R, Q89K, Q98K",10
IEKYKLLAEKVEEIVAKNARAEIDYSDAPDEFKDPLMYTLFTDPVRLPSGTVMDRSIIERHLLNSPTNPFNRQMLTESMLEPVPELKERIQAWCREHESSDH,4.6637726,"F4Y, R33K, D38Y, M41F, L59E, D68N, Q89R, M94C, K97H, Q98E",10
IEKFKLLAEKVEEIRVKNARKEIDISDAPDEFRCPLMDTLMTDPVRLPSGTVVDRSIILKHLLNSPTNPFNRQMLTESMLIPVPELKEQIQAWMRSKQSSDH,4.509865,"V15R, A16V, A21K, Y25I, D34C, M53V, R60K, D68N, E81I, E96S",10
ILKFKLAAIKVELIVAKNARAEIGYSDAPDEFRDPLMYTLMTDPVRLPSGTVMDRSIILRHLRNSPTNPFNRQMLTESMLEPVPELKQQIQRWMREKQSSDH,3.95125,"E2L, L7A, E9I, E13L, D24G, D38Y, L63R, D68N, E88Q, A92R",10
IEKDKLLAEKVEEIVAENARPEIAYSDAPDEFVDPLMDTLMTDPVVLPSGTVMDRSIILRHLLNSPTNPFNRQMLTESMLVPVPELKEQIQAWMREKQSAYH,0.66276383,"F4D, K17E, A21P, D24A, R33V, R46V, D68N, E81V, S100A, D101Y",10
MEKFRLLAEKQEEIVAKHARAEIDYSDAPDEFRDPLMDVLMTDPVRLPAGTVMDRSIILRHLLNKPTNPFNRQMLTEDMLVPVPELKEQIQAWMREKQSSDH,1.7384007,"I1M, K5R, V11Q, N18H, T39V, S49A, S65K, D68N, S78D, E81V",10
IEKFNLLAEKVEKIVAKNAYAEIDYSDAPDEFRDPLMDTIMTDPVRLPSGTVMNRSSILRHLLNSPTNPFNRQMLTESMLEPVPELKEQIQAWMRAHQSSDA,2.209084,"K5N, E13K, R20Y, L40I, D54N, I57S, D68N, E96A, K97H, H102A",10
IEKFKLLLEKVEHIVAKNARAEIDYSDAPDEFRDPLMDTLMQDPVRLPSGQVLDRSIILQHLLNSPTNPFNRQMLTESDLVPVPELREQIQAWMREKQSSDH,4.421236,"A8L, E13H, T42Q, T51Q, M53L, R60Q, D68N, M79D, E81V, K87R",10
IEKLKLLAEKVEKIVAKNARAQIDYNDAPDEFRDPLMDTLMTDPVRTPAGTVLERSIILRHLLNNPTNPFNRQMLTESMLEPVPELKEQIQAWMREKQSSDH,4.708556,"F4L, E13K, E22Q, S26N, L47T, S49A, M53L, D54E, S65N, D68N",10
IEKFKLLAQKVEEIVAKNARAKIDYSDIPDEFRDPLMDTLMTDPVRLPSGTVMDRSIILRHLLNSRTNPFNRGMLTESMLEPVPELREQIQLWMKEKGSSDH,-1.6489098,"E9Q, E22K, A28I, P66R, D68N, Q73G, K87R, A92L, R95K, Q98G",10
DEKFKLLAKKVENIVAKNARAEIDVSDAPDEFRDPLMDELMTDPVRLPSGTVVDRSIILRHLLNSPTNPFNRQPLTEEMLEPVPELKEQIQAWMREKQSSDM,5.432465,"I1D, E9K, E13N, Y25V, T39E, M53V, D68N, M74P, S78E, H102M",10
DEKFKLLAEKVEEIVAKVARAEIDYSDVPEEFRDPLMDTLMTDPVRLPSGTVLDRTNILRHLENSPTNPFNRQPLTESMLEPVPELKEQIQAWMREKQSSDH,6.6386805,"I1D, N18V, A28V, D30E, M53L, S56T, I57N, L63E, D68N, M74P",10
MEKFKILAEKVEEIVALNARAEIDYGDIPDEFRDPLMDTLMTDPVRAPSGTVYDRSIILRHLLNSPTNPFNRQMLTESMLQPVPELKEQIQEWMREKQSSDH,4.478936,"I1M, L6I, K17L, S26G, A28I, L47A, M53Y, D68N, E81Q, A92E",10
ITKFKLLADKVEEIVAKNARAEIQYSDAPDEFRDPLMDTLMTDPVRLPNGTVMDRSIILRHLLNNPTNPFNRQVLTESMLVPVPELKEQIQAWKREKQSSEH,1.1613467,"E2T, E9D, D24Q, S49N, S65N, D68N, M74V, E81V, M94K, D101E",10
IEKFKLLAEKVEEINAKNARAEIDISDAPDYFRDPLMDTLMTDPVRLPSGTVLDRSIILRHLLNSPTNPFTRQMLTENMLEPVPEMKEQIQAWMVEKQSSVH,7.6442184,"V15N, Y25I, E31Y, M53L, D68N, N71T, S78N, L86M, R95V, D101V",10
IEKFKLLAEKVEEINSKPARAEIDYSDAPDEFCDPLMDTLMTDPVRLPSGTVMDRSIILRHIKNDPTNPFNRQMLTESMLEPVPELKEQIKAWMREKQSSDK,0.37171268,"V15N, A16S, N18P, R33C, L62I, L63K, S65D, D68N, Q91K, H102K",10
IEKFKLLQEEVEEIVAKNDRAEIDYSDIPDEFRDPLNDTLMTDPVRTPSGTVMDRSIILRHLKNNPTNPFNRQMLTESMLEPVPELKEQIQAWMREKQSVDH,3.2834716,"A8Q, K10E, A19D, A28I, M37N, L47T, L63K, S65N, D68N, S100V",10
IEEFKLLAQKVNEIVAKNERAEEDYSDAPDEFRDPLMDTLMTDPVRLPSGTVMDRSIILRHLLNSPTNPFTRQMLTEMMLEPVSELKERIQAWMREKQSSDH,3.8415737,"K3E, E9Q, E12N, A19E, I23E, D68N, N71T, S78M, P84S, Q89R",10
ITKFKLLIEKVEEIYAKNARAEIDYSDAPDEFRDPLMDELMVDPVRLPSGLVMDRSIIMRHLLNSPQNPFNRQMLTEEMLEPVPELKEQIQAWMREKQSSDH,2.6968708,"E2T, A8I, V15Y, T39E, T42V, T51L, L59M, T67Q, D68N, S78E",10
IEKFLLLAEKVEEIVAKNARAEDWLSDAPPEFRCPLMDTLMTDPVRLPSGVVMDRSIILRHLLNSPTNPFNRQMLTENQLEPVPELKEQIQAWMREKQSSDH,2.5671887,"K5L, I23D, D24W, Y25L, D30P, D34C, T51V, D68N, S78N, M79Q",10
IEKFKLLAEKVEEIVAKNARAEIDYSDAPDEFRDPLMDTLMTDPVRLPSGQVMDRSIILRHLLNNPTNPFTRETLTPSMLEPVPELRETIQAWMREKQSSHH,2.750218,"T51Q, S65N, D68N, N71T, Q73E, M74T, E77P, K87R, Q89T, D101H",10
MEKFKLLAEEVEEIVAKNRRAEIDSSDAPDEFRDPLMDTLMTDPVRLPSGTVMDRSIILRHLKLSPTNPFNRQMLTEESLEPVPELKEQIQAWMVEKQSSDH,2.2717936,"I1M, K10E, A19R, Y25S, L63K, N64L, D68N, S78E, M79S, R95V",10
IEKFKLLREHVEEIVAKQARAEIDYEDAPDEFRDPLMYTLMTDPVRLPTGTVIDRSIILRHLLNSPTNPFNRSMLTESMLEPVPELKEQIQAWMREKQKSDH,6.6635942,"A8R, K10H, N18Q, S26E, D38Y, S49T, M53I, D68N, Q73S, S99K",10
IERFKLLAEKVEEEVAKNARAEIDYSDAPDVFYDPLMDTLMTDPVRLPSGHVMDRSIILRHLLNSPTNPFNRAMLTESMLEDVPELKEQIQAWKREKQSEDH,1.1248093,"K3R, I14E, E31V, R33Y, T51H, D68N, Q73A, P82D, M94K, S100E",10
IEKFKLLYEKVEEIVAKPARAEIDESDAPEEFRDPLMDTLMTDPVRLPSGTVMDRSIILRHLLNSPTNPFTRQMLTESMIEPVPELKQQIQAWMREKQDSGH,6.4303684,"A8Y, N18P, Y25E, D30E, D68N, N71T, L80I, E88Q, S99D, D101G",10
IEKFYLLAEKVEKEVAKNAPADEDYSDAPDEFRDPLMDTLMTDPVRLPSGTVMDRSIILRHLLNSQTNPFNRQMLTESMLEPVPELKEQIRAWMREKQSLDH,2.155702,"K5Y, E13K, I14E, R20P, E22D, I23E, P66Q, D68N, Q91R, S100L",10
IEKFKLLKEKVESIQAKNARAEIKYSDAPEEFRDPLMDTLMIDPVRLPSGTVMDRSIILRHLLNSPTNPFNRQMLTESMLEPVQELKEQIQRWMREKQSSHH,2.2314959,"A8K, E13S, V15Q, D24K, D30E, T42I, D68N, P84Q, A92R, D101H",10
ITKFKLLQEKVEEIVAKNAVAEIDYSDAPDEFRDPLMDALMTDPVLLPSGTLFDRSIIERHLLNSPTNPFNRQMLTLSMLEPVPELKEQIQAWMREKQSSDH,-1.137467,"E2T, A8Q, R20V, T39A, R46L, V52L, M53F, L59E, D68N, E77L",10
IEKFALLAEKVSEIVYKNARLEIDYSDAPDEFRDPLMDTLMTDPVRLPSGIVMDRSIILRHLRNDPTNPFNRQMLTESMLEPVPELKERIQAWMREKQSPDH,3.787878,"K5A, E12S, A16Y, A21L, T51I, L63R, S65D, D68N, Q89R, S100P",10
IEKAKILAEKVEEIVAKHARAAIDYSDAPDEFRDPLMDTLMDDPVRLPSGTVMDRSIILRHLLNSPTNPFNRQSLTESMLEPNPELKERIQAWMEEKQSSDH,2.0362635,"F4A, L6I, N18H, E22A, T42D, D68N, M74S, V83N, Q89R, R95E",10
IEKFKLLAEKVEEIVAKNARAELDYSDAPDEFRCPLMDDLFTDPVRLPSGTVMDRSIIQRHLLNSPTNPFNRQMLTVSMLEPVPELKQQIQLWMREKFSSDH,1.804095,"I23L, D34C, T39D, M41F, L59Q, D68N, E77V, E88Q, A92L, Q98F",10
IEKFHLLAEKVEEIVAANARARIDYEDAPDEFRKPLMDELMTDPVRLPSGNVMDRSIILRHLLNSPTNPFNRQPLTESMLEPVPELKEQIQAWMREKQSSLH,2.3193636,"K5H, K17A, E22R, S26E, D34K, T39E, T51N, D68N, M74P, D101L",10
IEKFKLLAEKFEEIDSKNERAEIDYNDAPDEFRDPLMDKLMTDPVRLPSGQVMDRSIILRHLLNSPTNPFNRQMLTESMLEPVPELKEQIQAWQREKQSSDT,2.98981,"V11F, V15D, A16S, A19E, S26N, T39K, T51Q, D68N, M94Q, H102T",10
MEKFKLLAEKVEELVAKNNRAEIQYRDAPDEFRDPLMDTLMTDPVRLPSGTVMDRSIIQRHLLNSPTNPFNRQMLTESMLEPVPELKEVIQAWQREKQSSDN,2.0169625,"I1M, I14L, A19N, D24Q, S26R, L59Q, D68N, Q89V, M94Q, H102N",10
IEKFKLLAEKVEEIYAENARAEIFYDEAPDEFLDPLMDTLMTDPVRLPSGTVMDRSIILRHLLNSPTNPFNRTMLTESMLEPVPELKERIQAWLREKQSSDH,3.6461062,"V15Y, K17E, D24F, S26D, D27E, R33L, D68N, Q73T, Q89R, M94L",10
IEKFKLLAEKVEEIVAKNARAEIEYHDAPDEFCDPLMDTLMTDPVRLPSGTVMDRSIILRHLRNSDTNPFNRQMLTESMLFPVDELKEQIQAWIKEKQSSDH,0.99247015,"D24E, S26H, R33C, L63R, P66D, D68N, E81F, P84D, M94I, R95K",10
IEKHKLLAQKVEEIVAKNADAEIDYSDAPDEFRDPLMDTLMTDPVRLPSGTVMERSVILRHLLNSQTNPFNRQMLTESMLAPVPELKEQIQAWMRRQQSSDH,1.4398563,"F4H, E9Q, R20D, D54E, I57V, P66Q, D68N, E81A, E96R, K97Q",10
IEKFKNLAEKVEEIVAKNARAEIDYSDAPDEFMDPLMDTLMTDPVRLPSGIVMDRSIILEHLLNSPTNPFNRQMLTRSMLEPVPDLKEQINAWMREKQSKDD,3.1806962,"L6N, R33M, T51I, R60E, D68N, E77R, E85D, Q91N, S100K, H102D",10
LEKFELLAEKVEFIVAKNARVEIDYSDAPDEFRDPLMDTLMDDPVRLPSGTVMDRSIILRHLLNSPTNPFTRQMLTESMLEPVPELKEQIQEWMGEKQSRDH,4.815894,"I1L, K5E, E13F, A21V, T42D, D68N, N71T, A92E, R95G, S100R",10
IEKFKLLAEKVEEIVAKAARAEIDYGDAPDEFRDPLMLTLMTDPVRLPDGTVMDRSIILRHLHNSPTNPFTRQVLTESMLEPVPELKEQIQAWMAEKQSWDH,6.442528,"N18A, S26G, D38L, S49D, L63H, D68N, N71T, M74V, R95A, S100W",10
IEKFKLLAEKVEEIVAKNYEAEIDNSDAPDEFRDPLMDTLMTDPVRLPSGTVMDRSIIKRHLLNSPTNPFNRQMLTESDLEPVPELKERIQAWMREKQDSLS,3.2564676,"A19Y, R20E, Y25N, L59K, D68N, M79D, Q89R, S99D, D101L, H102S",10
IEKFKLVTETVEEIVEKNARAEIDYSDAPDEFRDPLIDTLMYFPVRLPSGTVMDRSIILRHLLNSPTNPFNRTMLTESMLEPVPELKERIQAWMREKQSSDH,-0.7604066,"L7V, A8T, K10T, A16E, M37I, T42Y, D43F, D68N, Q73T, Q89R",10
IEKFKLLAEKVEEIVHSNARAEIDYSDAPDEFRDPLLDKLMTDPVRLPSGTVMDRSIILRHLLNSPTNPFNRQPLTESMLEPVVELKEQIQTWMRENVSSDH,3.2068136,"A16H, K17S, M37L, T39K, D68N, M74P, P84V, A92T, K97N, Q98V",10
MERFQLLAEKVEEIVAKNARAEIDYNDIPDEFRDPLMDTLMTDPVRLPSGTVMDRSIILSHMLNSPTNPFNRQMLTESMLEPVPELKEQIQAWMRQKQSSSH,1.5230604,"I1M, K3R, K5Q, S26N, A28I, R60S, L62M, D68N, E96Q, D101S",10
IRSFKTLAEKVEEIFAKNARAEIDYSDIPDEFRDPLMYTLMTDPVRLPSGTVMDRSIILRHLLNSPTNPFNRQMLTESMLEPVPELKEQIDQWMREKQSSDK,3.6923895,"E2R, K3S, L6T, V15F, A28I, D38Y, D68N, Q91D, A92Q, H102K",10
IEKFKLLAEKVEEISAKNARAEIAYSDAPDEFRCPLMDTLFTDPVRLPSGTIMDRSIILRHLLSSKTNPFNRQMLTESMLEPVPELKEQIQAWRREKQLSDH,0.20753932,"V15S, D24A, D34C, M41F, V52I, N64S, P66K, D68N, M94R, S99L",10
IEKFKLVAEKVEEIVATTARAEIDYSDAPDEFRCPLMDTLMTDPVRLPSGTVMDRAIILRHLLNCPTNPFNRQMLTESMLEPVPELKAQIQAWMVEKRSSDH,-0.9341623,"L7V, K17T, N18T, D34C, S56A, S65C, D68N, E88A, R95V, Q98R",10
DEKFALLAEKVEAIVAKNARAEEEYSDAPDEFRDPLMDTLMQDPVRLPSGTVVDRSIILRHLLNSPTNPFNRQMLTEEMLEPVPELKEQIQAWVREKQSSDH,6.631274,"I1D, K5A, E13A, I23E, D24E, T42Q, M53V, D68N, S78E, M94V",10
IEKFKLLAQKVEEIVAKNARDEIDYSDAPEEFRDPLLDTLMTDPVRLPSGVVMDRSIILRHLRTNPTNPFNRQMLTESMLVPVPELKEQIQAWMREKQSSDH,2.840921,"E9Q, A21D, D30E, M37L, T51V, L63R, N64T, S65N, D68N, E81V",10
IEKFKLLIEQVEEIVAKNARAEIDYEDAPDEFLDPLMDTLMYDPVRLPSGTVMDRSIILRHLLNSPTNPFNRQMLTESQLEPVPDLKEQIQAWMRENQGSDH,3.467697,"A8I, K10Q, S26E, R33L, T42Y, D68N, M79Q, E85D, K97N, S99G",10
MEKFKKLAEKVEEMVVKNARDEIDYSDAPDEFRCPLMDELMTDPVRLPSGTVMDRRIILRHLLNSPTNPFNRQMLTESDLEPVPELKEQIQAWMREKQSSDH,1.6594017,"I1M, L6K, I14M, A16V, A21D, D34C, T39E, S56R, D68N, M79D",10
IEKFKLLAEKVEEIVAKNARAEIDYSDAPDEFRCPLMDTLMTDPVRLPSGTVMDRSIILRHLLNKPTNPFNRQMLTESMFEPLPELKTRIQNWMREKTKSDH,1.7787675,"D34C, S65K, D68N, L80F, V83L, E88T, Q89R, A92N, Q98T, S99K",10
IEKFKQLREKVEEIVAKRARAELDYSDAPDEFRDPLMDQLMTDPVRLPSGTVMDRSTILRHLLNSPTNPFNRAMLTEDMLEPVPELKEQIQAWMREKNSSDH,4.5817585,"L6Q, A8R, N18R, I23L, T39Q, I57T, D68N, Q73A, S78D, Q98N",10
IEKFKLLIEKVEEIVAKGANAEIDYSDAPDEFYDPLMDTLMVDPVRLPSGTVMERSIILRHLLNSPTNPFNRVMLTESDLEPVPELKEQIQAWMREKESSDH,1.137338,"A8I, N18G, R20N, R33Y, T42V, D54E, D68N, Q73V, M79D, Q98E",10
IEKFKLLAERVEEISAKNARVEIDYSAAPDEFRDPLMDTLMVDPVRLPSGTVMDRAIILRHLRNSPTNPFNRQQLTEDMLEPVPELKEQIQAWMREKQSSDH,3.0467184,"K10R, V15S, A21V, D27A, T42V, S56A, L63R, D68N, M74Q, S78D",10
IEKAKLLADKVEEIVAKNAQAEIDYSDAPDEFRDPLMYTLMTDPVRLPSGTLMDRSIILRHLLNSPTNPFNRQMLTESMLIPVPELKEQIQTWMRSKYSSDH,3.3528047,"F4A, E9D, R20Q, D38Y, V52L, D68N, E81I, A92T, E96S, Q98Y",10
