Sequence,Score,Mutations,Number of Mutations
MQYKLILNGKTLKGETTTECVDAARAEKVFKDYANDNGVWGEWTYDRATKTFTVTE,4.0499315,"A20C, T25R, Q32D, D40W, D47R",5
MIYKLILNGKTLKGETTTEARDRATAEAVFKQYANDNGVDGEWTYDRATKTFTVTE,-0.52320707,"Q2I, V21R, A23R, K28A, D47R",5
MQYKLILNGYTLKGETTTEAVDAATAERRFKQYANDNGVDGEWTYYRATKTFTVTE,4.7327595,"K10Y, K28R, V29R, D46Y, D47R",5
MKYKLILNGKTLKGETTTEAVDAAQHEKVMKQYANDNGVDGEWTYDRATKTFTVTE,-0.23868516,"Q2K, T25Q, A26H, F30M, D47R",5
MQYKLILNGKTLKGHTTTEAVDAATAEKVFKQLANDNGVDGRWTYDRATRTFTVTE,5.5906463,"E15H, Y33L, E42R, D47R, K50R",5
MQYKLILNGKTLKGVTTTEAVDAATAEKKFKQYANDNGVDGEWTYDRAAKTLTVTE,4.0893893,"E15V, V29K, D47R, T49A, F52L",5
MRYKLILNGKTLKGETTGEAVRAATAEKVFKQYANDNGVDGEWTYDRATKTFRVTE,4.5647225,"Q2R, T18G, D22R, D47R, T53R",5
MQYKLILNGKTLKGETTTERVDAATVEKVFKQYANDNGVDGIWTYDRATKTLTVTE,2.7349064,"A20R, A26V, E42I, D47R, F52L",5
MQYKLILRGWTLKGETTCEAVDAATAERVFKQYANDNGVDGEWTYDRATKTFTVTE,4.2559967,"N8R, K10W, T18C, K28R, D47R",5
MQYKLILNRKTLKGEWTTEAVDAATLEKVFKQYANRNGVDGEWTYDRATKTFTVTE,-1.6205069,"G9R, T16W, A26L, D36R, D47R",5
MQYKLILNLKTLKGETTTEAVDAATAEKVFKQYRNDNGGDGEWTYDRATKRFTVTE,-4.9856653,"G9L, A34R, V39G, D47R, T51R",5
MQYKLIRNGRTLKGETTTEAVDAATAERVFKQYANDRGVDGEWTYDRATKTFTVTE,0.35946345,"L7R, K10R, K28R, N37R, D47R",5
MQYKLKLNGKTLKGETTTEAVDAATAEKVFKQYANDNGVYCEWTYDRATKTFKVTE,2.8281846,"I6K, D40Y, G41C, D47R, T53K",5
MQYKLILNGKTLKGEGTTEAVDAATAEKVFKQYANDNKFDGEWTYDRATKVFTVTE,2.577067,"T16G, G38K, V39F, D47R, T51V",5
MRYKLIVNGKTLKGETTTEAVDAATAEKVFKQYANDNGFDGEWTYDRARKTFTVTE,4.5748706,"Q2R, L7V, V39F, D47R, T49R",5
MQYKLILNGKTLKGETTTEAVDAWTAEKVFKQYASDNGVDKYWTYDRATKTFTVTE,-2.0526917,"A24W, N35S, G41K, E42Y, D47R",5
MQYKLILNGKTLKGETTTEYVDAATAEKVFRQYANDNGVDGEHTYDRYTKTFTVTE,-3.1962063,"A20Y, K31R, W43H, D47R, A48Y",5
MQYKLILNGKVLKGETTTEAVDAATAKKVFKQYANDNGVDGEWTYRRATKTFTLTE,-2.9237301,"T11V, E27K, D46R, D47R, V54L",5
MQYKLIRNGKTLKGETTIEAVDAATAEKVFKQYANRNGVDGEWTYDRATKTFTRTE,-2.099174,"L7R, T18I, D36R, D47R, V54R",5
MQYKLILNGKTRKRETTTEAVDAATAEKVFKQYANDNGVDGEWTYDRAMKTFTVRE,1.5101486,"L12R, G14R, D47R, T49M, T55R",5
MQYKLILNGKTLKGETTTEAYDAATAEKVFKQYANDNGVWGEWTYRRATKTFTVSE,6.500188,"V21Y, D40W, D46R, D47R, T55S",5
MQYKLILNGKTVKGETTTEAVDAATAEKVFKQYANRNGVDGEWTYDRATKTLTVTR,0.6632376,"L12V, D36R, D47R, F52L, E56R",5
MQYKLIRNRKTLKGETTTEAVDAATAEKVFKQYLNDNGRDGEWTYDRATKTFTVTE,-4.755049,"L7R, G9R, A34L, V39R, D47R",5
MQYKLILNGKTLKGETTTEAVDAATAEKVFKQWANDNGVDGEWTLDRATDTFTVTR,1.3938116,"Y33W, Y45L, D47R, K50D, E56R",5
MQYKLILNKKTLKGETTLEAVDAATAEKVFKQYANDNYVDMEWTYDRATKTFTVTE,-2.5230026,"G9K, T18L, G38Y, G41M, D47R",5
MIYKLILNGKKLRGETTTEYVDAATAEKVFKQYANDNGVDGEWTYDRATKTFTVTE,2.943163,"Q2I, T11K, K13R, A20Y, D47R",5
MQYKLIHNGKTLKGEWTPEAVDAATIEKVFKQYANDNGVDGEWTYDRATKTFTVTE,-4.177801,"L7H, T16W, T18P, A26I, D47R",5
MQYRLILNGKTLRGETTTEAVDAATAERVFKQYANDNGVDGEWTYDRATKTFTVTL,2.2293136,"K4R, K13R, K28R, D47R, E56L",5
MQYKLILNGKTLKRETTTEAVDAATAEKVFKQYAKRNGVDGEWTYDKATKRFTVTE,-1.4924921,"G14R, N35K, D36R, D47K, T51R",5
MQYKLIYNGKTLKGETTTEAVRAATAEKVFKQYANDNHVDGEWTYDRATKTFTVTR,0.6853222,"L7Y, D22R, G38H, D47R, E56R",5
MQYKLILNGRTLKGETTTEAVDAATALRVFKQYANDNGYDGEWTYDRATKTFTVTE,-4.578075,"K10R, E27L, K28R, V39Y, D47R",5
MQYKLILNGKTLKGETWTEAVDAATAEKVFRQYANDNGVDGEWTYDRAWKTFRVTE,3.303846,"T17W, K31R, D47R, T49W, T53R",5
MQYKLILNGKTLKGETTTEAVDAATAEKRFKQYANDNGVYGEWTYYRATKTFTVKE,7.0064425,"V29R, D40Y, D46Y, D47R, T55K",5
MQYKLILNGQTLKGRTTTEAVDRATAEKVFKQYANDNGVDGEWTYDRATKTFTRTE,-3.0738862,"K10Q, E15R, A23R, D47R, V54R",5
MQYKLILNGKTLKGETTTEAVDAATAEQVFKKYANDNGVDKEWTYDRATKTFTVHE,-3.8710282,"K28Q, Q32K, G41K, D47R, T55H",5
MQYKAILNGKTLKGGTTTEYVDRATAEKVFKQYANDNGVDGEWTYDRATKTFTVTE,-1.2708236,"L5A, E15G, A20Y, A23R, D47R",5
MQYKLILNGKTLKGETTTEAVDAATAERRFRQYANDNGVWGEWTYDRATKTFTVTE,4.61594,"K28R, V29R, K31R, D40W, D47R",5
MQYKLGLNGKTLKLEGTTEAVDAATAEKKFKQYANDNGVDGEWTYDRATKTFTVTE,2.8416634,"I6G, G14L, T16G, V29K, D47R",5
MQYKLILYGKTLKGETTTPAVDAATAEKVFKQMANDNGVDGEWTYDRATKRFTVTE,5.029766,"N8Y, E19P, Y33M, D47R, T51R",5
MQYKLILNGKTLKGETTTEAVDARTAEKVFKQYLNRNGVDGEWHYDRATKTFTVTE,1.4284763,"A24R, A34L, D36R, T44H, D47R",5
MQYKLILNGKTLKDRTTTEAVDAATAEKRFKQYANDNGVDGEWTYDRATKTFEVTE,4.242505,"G14D, E15R, V29R, D47R, T53E",5
MQYKLILNGKTFKGETTTEAVDAATREKVFKQWLNDNGVDGEWTYDRATKTFTVTE,-3.662225,"L12F, A26R, Y33W, A34L, D47R",5
MQYKLILNGKRLKGETTTEAVDAATAEKVFRQYANDNGVWGEWTYDRACKTFTVTE,3.7071817,"T11R, K31R, D40W, D47R, T49C",5
MYYKLILNGKELKGETTTELVDAATAEKVFKQYANDNGVDGEWTYDRATKTFTVVE,2.351628,"Q2Y, T11E, A20L, D47R, T55V",5
MQYKLIYNGKTLKGETTVEAVDAATAEFVFKQYANDNGVDGEWAYDRATKTFTVTE,0.8747737,"L7Y, T18V, K28F, T44A, D47R",5
MQYKLILNGKTLKWKTTTEAVDRATAEKVFKQYANDNGVDGLWTYDRATKTFTVTE,1.2327498,"G14W, E15K, A23R, E42L, D47R",5
MYYKLILNGKTLKGETTTAAVDAATAEKRFKQYARDNGVDGEWTYDRATKTFTVTE,2.073325,"Q2Y, E19A, V29R, N35R, D47R",5
MQYKLILNGKTLKGETTTEAVDAATAEKVFKQRANDLGVDGEWTYRRKTKTFTVTE,2.843908,"Y33R, N37L, D46R, D47R, A48K",5
MQYKLILNGKTLKGETTTEAVDAATAERVFKRYANANGVDGEWTYDRATKVFTVTE,5.15663,"K28R, Q32R, D36A, D47R, T51V",5
MQYKLILNGKTLMGETTTEAVDAARAEKVFKQYANDNGIDGEWTYDRATKTFTVKE,5.428994,"K13M, T25R, V39I, D47R, T55K",5
MNYKLILNGKTLKGETTTEAVDRATARKVFKQYANDNGVDGEWTYRRATKTFTVTE,-4.300213,"Q2N, A23R, E27R, D46R, D47R",5
MQYKLILNGKTLKGETTTEAVYAATAEKVIKRYANDNGYDGEWTYDRATKTFTVTE,0.48029193,"D22Y, F30I, Q32R, V39Y, D47R",5
MQYKLILNGKTLKGETTTEAVDYATAEKVFKRYANDNGVDGEWTYKRATKGFTVTE,-0.12757662,"A23Y, Q32R, D46K, D47R, T51G",5
MQYKLILNRKTLKRETTTEAVDAATAEKVFKQYANHNRVDGEWTYDRATKTFTVTE,1.3968047,"G9R, G14R, D36H, G38R, D47R",5
MQYKLILNGKTLKGETWTEAVDRATAEKVFKQYANDNGVDMEWTYDRATRTFTVTE,-2.1657927,"T17W, A23R, G41M, D47R, K50R",5
MQYKLIRNGKTGKGETTTEAVDAARAEKVFKQYANDNGVDGEWTYDRTTKTFTVTE,2.279964,"L7R, L12G, T25R, D47R, A48T",5
MQYKLILNGKTLKGETTTEAVDAATAERVFKQYANDNGVWGEWTYDRATRYFTVTE,5.823619,"K28R, D40W, D47R, K50R, T51Y",5
MQYKLILNGKTLKGETTTEAVDAATAEKVFKQYANDNGRDGEWTYDRATRTFTRRE,-4.226576,"V39R, D47R, K50R, V54R, T55R",5
MQYKLQLNGKRLKGETTTEAVDAATAEKVFKVYANDNGVDGEWTYDRLTKTFTVTE,3.15825,"I6Q, T11R, Q32V, D47R, A48L",5
MQYKLILKGKTLNGETTYEAVAAATAEKVFKQYANDNGVDGEWTYDRATKTFTVTE,5.3425474,"N8K, K13N, T18Y, D22A, D47R",5
MQYKLILNGKTLKGETTTWAVDNATAEKKFKQYANDNGVDGEWTYDRATKTFKVTE,5.120827,"E19W, A23N, V29K, D47R, T53K",5
MQYKLILNGKTLKGETTLRLVDAATAEKVFKQYANDNGVDGEWTYDRATKTFLVTE,2.9493592,"T18L, E19R, A20L, D47R, T53L",5
MQYKLKLNGKTLKGETTTEAVDAATMEKVAKQYANDNGVDGELTYDRATKTFTVTE,-4.74054,"I6K, A26M, F30A, W43L, D47R",5
MQYKLILNGKRLKGWTTTEAVDAYTAEKVFKQYANDNGVDREWTYDRATKTFTVTE,0.25648782,"T11R, E15W, A24Y, G41R, D47R",5
MQYKLIINSKTLKGETMTEAVDAATREKVFKQYANDNGVDGEWTYDRATKTFTVTE,-0.5711281,"L7I, G9S, T17M, A26R, D47R",5
MQYRLILNGKTLKGETTTEAVDRATAEKRFKQYANDNGMDGEWTYDRATKTFTVTE,2.7402189,"K4R, A23R, V29R, V39M, D47R",5
MQYKLILNGKTLKGETTTEAVDAATAEKVFKQYLNRNGVWGEWTYDRATRTFTVTE,3.9965808,"A34L, D36R, D40W, D47R, K50R",5
MQYKLILNGKKLKGETTTEAVDRATAEKVFKQYANDNGVDGHWTYDRAKKTFTVTE,1.0278612,"T11K, A23R, E42H, D47R, T49K",5
MKAKLILNGKTLKGETTTEAVDAATAEKVFKQYANDNGVWGEWTYDRATKTFTVKE,4.766707,"Q2K, Y3A, D40W, D47R, T55K",5
MQYKLILNGKTLKGYTTTYAVDAATGEKVFKQYANDNGVDGEWTYDRATKTFTRTE,0.19678658,"E15Y, E19Y, A26G, D47R, V54R",5
MQYKLILNGKTLKGETTTEAVKAARAEKVARQYANDNGVDGEWTYDRATKTFTVTE,1.6370405,"D22K, T25R, F30A, K31R, D47R",5
MQYKLILNGKTLKGWTTTEAVDAATAERVFKQYANDNGVDGEWTYDRYRKTFTVTE,4.514022,"E15W, K28R, D47R, A48Y, T49R",5
MQAKLILNGKTLKGRTTTEAVDAATAEKVFKQYANDWFVDGEWTYDRATKTFTVTE,0.9118535,"Y3A, E15R, N37W, G38F, D47R",5
MQYKLILNGKTLKGEYTTEAVDAATAEKVFKQYLNRNGVDGEWTYDRATKAFTVTE,1.0017785,"T16Y, A34L, D36R, D47R, T51A",5
MLYKLILNGKTLKGETTTEAVDAATAEKVAYQYANDNGVDGEVTYDRATKTFTVTE,-5.543801,"Q2L, F30A, K31Y, W43V, D47R",5
MQYKLILNGKTLKGKTTTEAVDRATAEKVFKQYARDNGVDGEWTYDRATRTFTVTE,-2.2694402,"E15K, A23R, N35R, D47R, K50R",5
MQYKLILNGKTLKGERTTEAVDRATARKVFKQYANDNGVDGEWTYDRARKTFTVTE,-4.7025633,"T16R, A23R, E27R, D47R, T49R",5
MQYKLILNGKTLKRETTTEKVDAATAEKVFAQYANDNGVDSEWTYDRATKTFTVTE,-5.8988843,"G14R, A20K, K31A, G41S, D47R",5
MQYKLIINGKTLKGETTFEAVDAATARKVFKQFANDNGVDGEWTYDRATKTFTVTE,-0.8939993,"L7I, T18F, E27R, Y33F, D47R",5
MQYKLELNGKTLKGETTTEAVDAATAEKVFKKYANDNGVDGEWTYDRRRKTFTVTE,5.3735447,"I6E, Q32K, D47R, A48R, T49R",5
MQYKLCLNGKTLKGETTTEAVDRATAEKVFKQYANDNGVDGEWTYDRATKKFRVTE,1.7143296,"I6C, A23R, D47R, T51K, T53R",5
MQYKLILNGKTLKGETTTEAVGAATAEEVFKRYARDNGVDGEWTYDRATKTFTVTE,-3.7125998,"D22G, K28E, Q32R, N35R, D47R",5
MQYKLILNGKTLKGEWTTEAVDAATAFKVFKQYCNDNGVDGEWTYDRATKRFTVTE,-2.0973485,"T16W, E27F, A34C, D47R, T51R",5
MQYKLILNGRTLKGETTTEAVDAATREKRFKQYANDNGVDGIWTYDRATKTFTVTE,1.9920591,"K10R, A26R, V29R, E42I, D47R",5
MQYKLILNGKTLKGETTREAVDAATARKVFKQYANDNGVDGEWTYDRATVRFTVTE,-1.4799083,"T18R, E27R, D47R, K50V, T51R",5
MQYKLIYNGKTLKGETTTEAVDAATAKKVFKQYANDNRTDGEWTYDRATKTFTVTE,-4.7760577,"L7Y, E27K, G38R, V39T, D47R",5
MQYKLILNGKYLKGETTTEAVDAATAEKVFKQYANDNFVDGEWTYDRATKQVTVTE,-0.25966763,"T11Y, G38F, D47R, T51Q, F52V",5
MQYKLILNGKTLKGETTTEAVDAATASKRFKQYANDNGVDGEWRYDRATKTFTLTE,-1.4982337,"E27S, V29R, T44R, D47R, V54L",5
MKYKLILWGKTLKGETTTWAVDAARAEKVFKQYANDNGVDGEWTYDRATKTFTVTE,6.5202975,"Q2K, N8W, E19W, T25R, D47R",5
MQYKLILNGKTLKGETTTRAVSAARAEKVFKQYANDRGVDGEWTYDRATKTFTVTE,4.547572,"E19R, D22S, T25R, N37R, D47R",5
MQGKLILNGKTLYGETTTEAVDAATAEKVFKQYANDNGVDGEWTYDRATKTFTVCA,-1.2135565,"Y3G, K13Y, D47R, T55C, E56A",5
MQYKLILNGKTLKGETTTEAVDAATAEKVFKRYANDFGVDGEWRYDRATKTFTVTY,1.1253412,"Q32R, N37F, T44R, D47R, E56Y",5
MQYKLKLNGKTYKGETTTEAVDAATAEKRFKQYVNDNGVDGEWTYDRATKTFTVTE,2.2215996,"I6K, L12Y, V29R, A34V, D47R",5
MKYKLILNMKTLKGETTTEAVDAATAEKVFKQRANDNGVDGEWRYDRATKTFTVTE,2.2966197,"Q2K, G9M, Y33R, T44R, D47R",5
MQYKMILNGKTLKGEFTTEAVDAATAEKRFKQYANDNGVDGEITYDRATKTFTVTE,-1.8545598,"L5M, T16F, V29R, W43I, D47R",5
MQYKLILNGKTLKGETQTEAVDAATAEKVFKQFRNDNGVRGEWTYDRATKTFTVTE,1.0020066,"T17Q, Y33F, A34R, D40R, D47R",5
MQYRLILNGKTLKGETTTNAVDAARAEKVFKQYANDNGVDGEWRYDRATKTFTVTE,6.208595,"K4R, E19N, T25R, T44R, D47R",5
MQYKLILNGKTLCGETTTEAVDARTAEKVFKQYANDNGVDGEWRYYRATKTFTVTE,3.9032917,"K13C, A24R, T44R, D46Y, D47R",5
MQYKLILNGKTLKGETTTEAVDAATAEKVFKQYYHDNGVDGEWTYDRYTKTYTVTE,-4.154175,"A34Y, N35H, D47R, A48Y, F52Y",5
MQYKLILNGKTLYGETTTEAVDAATARKVFKQYANDNGVWGEWTYDRATKTFTVKE,-0.92079675,"K13Y, E27R, D40W, D47R, T55K",5
MQYKLILNGKTLKGETTTEARDAATAEKVFKQYANDNGVDGRWTYDRATKTFRVTR,4.319625,"V21R, E42R, D47R, T53R, E56R",5
MQYKLRLNGKTLKGETRTEAVDAATAEKVCKQYCNDNGVDGEWTYDRATKTFTVTE,3.8807857,"I6R, T17R, F30C, A34C, D47R",5
MQYKLILNRKTLKGETFTEAVRAARAEKVFKQYANDNGVDGEWTYDRATKTFTVTE,4.3491387,"G9R, T17F, D22R, T25R, D47R",5
MRYKLILNGKTLKGETTTEAVDAATGEKVFKQRANDNGVDGEWTYDRATKTFTVFE,3.32044,"Q2R, A26G, Y33R, D47R, T55F",5
MQYKFILNGKNLKGETTTEAVDRRTAEKVFKQYANDNGVDGEWTYDRATKTFTVTE,-0.90177506,"L5F, T11N, A23R, A24R, D47R",5
MQYKLILNGKTLKGETTTEAYDAARAEKVFKRYANKNGVDGEWTYDRATKTFTVTE,6.58584,"V21Y, T25R, Q32R, D36K, D47R",5
MQYKLILIGKTAKGETTTEAVDAATARKVFKQYANDNGVDGEWTYDRATKTFTVRE,-3.406593,"N8I, L12A, E27R, D47R, T55R",5
MQYKLILNGKTLKTETTTEAVDAATAEKVFKQYLNDNNVDGEWTYDRATKLFTVTE,0.5007355,"G14T, A34L, G38N, D47R, T51L",5
MQYKLWLNGKHLKGETTTEAMDAARAEKVFKQYANDNGVDGEWTYDRATKTFTVTE,4.4813957,"I6W, T11H, V21M, T25R, D47R",5
MQYKLILKRKTLEGETTTEAVDAATAEKVFKQYANDNGVDGEWTYDRAQKTFTVTE,3.487954,"N8K, G9R, K13E, D47R, T49Q",5
MQYKRILNGKTRKGETRTEAVDAATAEKVFKQYANDNGVDGEWTYRRATKTFTVTE,-1.1719903,"L5R, L12R, T17R, D46R, D47R",5
MQYKLIRRGKRLKGETTTEAVDAATAEKVFKKYANDNGVDGEWTYDRATKTFTVTE,2.4884243,"L7R, N8R, T11R, Q32K, D47R",5
MQYKLILNGKTLKGETTTEAVDAYTAEKVFKQKANDNGVDGEWTYDRATKTFRVRE,5.2597313,"A24Y, Y33K, D47R, T53R, T55R",5
MQYKLILNGRTYKGETTTEYVDRATAEKVFKQYANDNGVDGEWTYDRATKTFTVTE,-1.17445,"K10R, L12Y, A20Y, A23R, D47R",5
MQYKLILNGRTLKGGTTTEAVDAATAEKVFKQYANDNGVDGEWTYDRHTKTLTVTE,2.5874648,"K10R, E15G, D47R, A48H, F52L",5
MQQKLILNGKTLKGETTTEAVDAATAEKVLWQYANDNGVDGEWTYDRATKRFTVTE,-4.034962,"Y3Q, F30L, K31W, D47R, T51R",5
MQYKLILNGKTLKGETTTEHVDAARAEKVFRQYRNDNGVDGEWTYDRATKTFTVTE,-1.2197945,"A20H, T25R, K31R, A34R, D47R",5
MQYKLILNGKTLKGKMTTEAVDAATAEKVFKQYANANGVDGRWTYDRATKTFTVTE,5.289688,"E15K, T16M, D36A, E42R, D47R",5
MQYKVILNGKTLKGETTTEAVDAATAEKVFKQYLNANGVDGEITYDRATKTFTVTE,-3.9947526,"L5V, A34L, D36A, W43I, D47R",5
MQYKLIMNGKTLKGETTTEAVDARTAERVFKQYANDNGVDGEWTYVRATKTFTVTE,2.1261077,"L7M, A24R, K28R, D46V, D47R",5
MRYKLILNGKTLKGETTTEAVDYATAEKVFKQYRNDNGVDGEWTYDRATKTLTVTE,-4.6785083,"Q2R, A23Y, A34R, D47R, F52L",5
MQYLLILNGKTLKKETTTEAVDAATAEKVFKQYANRNGVYGEWTYDRATKTFTVTE,5.2428207,"K4L, G14K, D36R, D40Y, D47R",5
MQYKLILNGKTLKGRTTTEARDAATREKVFKQYANDNGVDGEWTYDRATRTFTVTE,0.7243023,"E15R, V21R, A26R, D47R, K50R",5
MQYKLILNGKTLKGETTIEAVDAARAEKVFYQYANDNGVDGEWRYDRATKTFTVTE,-0.43600503,"T18I, T25R, K31Y, T44R, D47R",5
MQYKLILQGKTLKGETTTEAWDAARVEKVFKQYANDNGVDGEWTYDRATKTFTVTE,4.8026648,"N8Q, V21W, T25R, A26V, D47R",5
MQYKLILNGKTLKGETTTFAVDAATAEKVFKQYANRNRCDGEWTYDRATKTFTVTE,3.147164,"E19F, D36R, G38R, V39C, D47R",5
MQYKLILNGKTLKGETTTEAVDRATAEKVFKQYCNDNGVDGEWTYDRATKTYTVTK,-2.329397,"A23R, A34C, D47R, F52Y, E56K",5
MRYKLIRNGKRLKGETTTEAVDAATAEKVFKQYANDNGVDGEWTYDRARKTFTVTE,2.5012658,"Q2R, L7R, T11R, D47R, T49R",5
MQYKLILNGKTLWGETTTEAVDYATAEKVFKQYARDNGVDGEWTYDRATKTFRVTE,-3.945505,"K13W, A23Y, N35R, D47R, T53R",5
MQYGLILNGKTLKGETTTEAVDAATAEKVFKQYANDNGVDGEWRYDRATKTFTVKR,2.6047654,"K4G, T44R, D47R, T55K, E56R",5
MQYKLILWGKTLKGETTTEAVDAATAEKVFKRYANDQGVDGGWTYDRATKTFTVTE,4.3250165,"N8W, Q32R, N37Q, E42G, D47R",5
MQRKLILNGKTLKRETTTEAVDAYTAEKVFKQYLNDNGVDGEWTYDRATKTFTVTE,-1.5189335,"Y3R, G14R, A24Y, A34L, D47R",5
MQYKLILNRKTLWGETTTEAVDAATAEKVRKRYANDNGVDGEWTYDRATKTFTVTE,-1.2220368,"G9R, K13W, F30R, Q32R, D47R",5
MQYKLILNGKTLTGETTTEAVDAATAEKVFKQYANDNYVDGCWTYDRKTKTFTVTE,5.251082,"K13T, G38Y, E42C, D47R, A48K",5
MQYKLILNGKTLRGETTTMAVDAATAEKRFKQYARDNGVDGEWTYDRATKTFTVTE,1.9011067,"K13R, E19M, V29R, N35R, D47R",5
MQYKLILNGKRLKGETTTEYVRAATAEKVFKQYANDWGVDGEWTYDRATKTFTVTE,0.6962731,"T11R, A20Y, D22R, N37W, D47R",5
MQYKLILHGKTLKQERTTEAVDAATAEKVFKQYANDNGVDGEWTYDRATKTFRVTE,3.4040694,"N8H, G14Q, T16R, D47R, T53R",5
MQYKLILNGKTLMGETLTEAVDAATAEKVFKQYANDNGVYGEWTYDRATKTFTVTW,4.7416043,"K13M, T17L, D40Y, D47R, E56W",5
MQYKVLLNGKTLKGQTTTEAVDAATAEKVFKQYANDNGVDGEVTYDRATKTFTVTE,-1.1962036,"L5V, I6L, E15Q, W43V, D47R",5
MQYKLILNGKTLKGETTREAVDLATAEKVFKQYANDNGVDGRWTYDRATKTFHVTE,2.3483598,"T18R, A23L, E42R, D47R, T53H",5
MAYKLILNGKTLKGETRTEAVDAATAEKVFKQYANDLGVDGEWTYDRATKTYTVTE,1.632576,"Q2A, T17R, N37L, D47R, F52Y",5
MQYKLRLNGKTLKGETRTEAVDKATAERVFKQYANDNGVDGEWTYDRATKTFTVTE,1.251133,"I6R, T17R, A23K, K28R, D47R",5
MQRKLILNGKTLKGETTTERVDAATAEYVFKQYANYNGVDGEWTYDRATKTFTVTE,-1.3651924,"Y3R, A20R, K28Y, D36Y, D47R",5
MQYKLILNGKTLKGETTTEAVDAATAIKVFKQWRNDNGVDGEWTYRRATKTFTVTE,-5.151572,"E27I, Y33W, A34R, D46R, D47R",5
MQYKVILNGKTLIGETTTEAVDAATAEKVFKQRANDNGVDGEWTYDRATKTFTVTY,1.2169608,"L5V, K13I, Y33R, D47R, E56Y",5
MQYKLILNGKGIKYETTTEAVDAYTAEKVFKQYANDNGVDGEWTYDRATKTFTVTE,3.5935373,"T11G, L12I, G14Y, A24Y, D47R",5
MQYKLILNGKTLKGETTTEAVDAATAEKVFKQGANLNGWDGEGTYDRATKTFTVTE,-4.810124,"Y33G, D36L, V39W, W43G, D47R",5
MQYKLILEGKTLKGETTTEARDARTAWKVFKQYANDNGVDGEWTYDRATKTFTVTE,-1.7649314,"N8E, V21R, A24R, E27W, D47R",5
MQYKLILNGKTLKYETTTEARDAATAEKVFKQYAWDNGVDGEWTYDRRTKTFTVTE,-0.01668346,"G14Y, V21R, N35W, D47R, A48R",5
MQYKLILNGKTLKGLTTTEAVDRATAEKVFKQYANDNGVDGEHTYDRATKTFTVRE,-3.942295,"E15L, A23R, W43H, D47R, T55R",5
MQYKLILNGKTLKGETTTEAVDAATAEKRFKQYANRNGVDGEWTYDRRTKTFTGTE,4.5608864,"V29R, D36R, D47R, A48R, V54G",5
MQYKLRLNGKTLKGETTTEGVDAATAEKVFKQYANDNGVDGEWRYDRATKRFTVTE,5.088615,"I6R, A20G, T44R, D47R, T51R",5
MQYKLIRNGKTLKGETTTEAVDRATAEKVFKQYCKDNGVDGEWTYDRATKTFTVTE,-4.91971,"L7R, A23R, A34C, N35K, D47R",5
MQYKLILNGKTLKGETTTEAVDAATAEKRFKQWANDNGFDGEWTYDRATKTYTVTE,1.7828166,"V29R, Y33W, V39F, D47R, F52Y",5
MQYKYILNGKTLKGETHTEARDKATAEKVFKQYANDNGVDGEWTYDRATKTFTVTE,-0.18157929,"L5Y, T17H, V21R, A23K, D47R",5
MQKHLILNGKTLKGETTTEAVDAATKEKVFKWYANDNGVDGEWTYDRATKTFTVTE,-4.618617,"Y3K, K4H, A26K, Q32W, D47R",5
MQYKLRLNGKTLKGETTTEAVDAAHAEKVFKQRANDNGVDGEWTYDRATKTFTVTR,2.545323,"I6R, T25H, Y33R, D47R, E56R",5
MQYKLILNGKTLKGETTTEAVDAATARKVFKQYANRNFVDGEWTYDRATKTFTLTE,-2.8396816,"E27R, D36R, G38F, D47R, V54L",5
MQYKLILNGKTLKGETTTEAVDAYTAEKVFKQYANDNGVDGTWTYDRYTKTFTVTF,5.9888167,"A24Y, E42T, D47R, A48Y, E56F",5
MQYKLILNGKTLKGERTTEAVDAARAEKVFKQYLNDNLVDGEWTYDRATKTFTVTE,2.2499886,"T16R, T25R, A34L, G38L, D47R",5
MQYKLILNGKTLKRETTTEAVDAARARKVFKQYANDNGVDGEWTFDRATKTFTVTE,-2.789799,"G14R, T25R, E27R, Y45F, D47R",5
MQYKLILNYKTLKGETTTEAVDANTAEQVFKRYANDNGVDGEWTYDRATKTFTVTE,1.7140009,"G9Y, A24N, K28Q, Q32R, D47R",5
MQYKLILNGKKLKGETTGEAVDAATAEKVFKQYANDNKVDGEWTYDRATKRFTVTE,2.8913453,"T11K, T18G, G38K, D47R, T51R",5
MQYKLVLNGKTLKGETTTEAVDRATARKVFKQYANDNGVDGEWTYDRATKTFRVTE,-3.8527195,"I6V, A23R, E27R, D47R, T53R",5
MQYKLILNGKTLKGETTTEAVDAATAERVFKQAANDNGVDGEWTYDRATKTFRVTR,0.34393352,"K28R, Y33A, D47R, T53R, E56R",5
MQYKLILNGKTLKGETTFEAVDAATAEKVFKQYANDNGVWGEWTYDRATKTFRVTR,4.6349816,"T18F, D40W, D47R, T53R, E56R",5
MQYKLILNGKTLKGETTTEAVRAATAEQVFKQYANDNGVDGEWTYDRATKTGWVTE,-3.5601285,"D22R, K28Q, D47R, F52G, T53W",5
MQYKLILNGKTLKGETTTRAVDAARAERVMKQYANDNGVDGEWTYDRATKTFTVTE,4.404102,"E19R, T25R, K28R, F30M, D47R",5
MQYKLILNGKTKKGETTTEFVDAATAEKVFRQYANDNRVDGEWTYDRATKTFTVTE,-1.1734946,"L12K, A20F, K31R, G38R, D47R",5
MQYKAILNGKTRKVETRTEAVDAATAEKVFKQYANDNGVDGEWTYDRATKTFTVTE,1.6187191,"L5A, L12R, G14V, T17R, D47R",5
MQYKLILRCKTLKGETTTEAVDAATAEKVFKQYANDNGVRGEWTYDRATKTFTRTE,0.017631017,"N8R, G9C, D40R, D47R, V54R",5
MQYKLILNGKTLKGWTTTEAVDAATAERVGKQYANDNGVDGEWTYDRATKTFTCTE,0.735906,"E15W, K28R, F30G, D47R, V54C",5
MQYKLILNGKTLKGECTTEAVDAARAEKVFKQYANDNGRDGEWTYERATKTFTVTE,0.8843194,"T16C, T25R, V39R, D46E, D47R",5
MQYKLILKGKTLKGETTTEAVDAATAEKVFKQYANWNGVWGEWTYDRATWTFTVTE,6.157121,"N8K, D36W, D40W, D47R, K50W",5
MQYKVILNGKTLRGETTTEAVDAATAEKVFKQYANDNGVDGEWTYDRATRTFSVTE,5.0388722,"L5V, K13R, D47R, K50R, T53S",5
MQYTLILNGKTLKGETTTEAVDRATAEKVFVQYANDNGVDGEWTYDRATKTFTVTK,-5.2917767,"K4T, A23R, K31V, D47R, E56K",5
MQYKLILRGKTLKLETTTEAVDAATARKVFRQYANDNGVDGEWTYDRATKTFTVTE,-4.628692,"N8R, G14L, E27R, K31R, D47R",5
MQYKLILNGKTLKGETKTEAVDAATAEKVFKQYANDNGVDGEWKYDRATKTYFVTE,1.6635654,"T17K, T44K, D47R, F52Y, T53F",5
MQYKLILNGGTLKGETTFYAVDAATAEKVFKQYANDNGFDGEWTYDRATKTFTVTE,3.3885064,"K10G, T18F, E19Y, V39F, D47R",5
MQYKLILNMKTLKGFTTTEAVDAATWEKVFKQYANDNGVDGEWTYDRYTKTFTVTE,-0.5129139,"G9M, E15F, A26W, D47R, A48Y",5
MQYKLILNGKTLKGETTTEAVDAATAEKVFRQYANDNGVDGEWTYRRVKKTFTVTE,3.5647113,"K31R, D46R, D47R, A48V, T49K",5
MQYKLILNGVTLKGETTTEAVDAATAEKVFKQYANDNGVDGEWTYDRARKTFTVWL,2.8251889,"K10V, D47R, T49R, T55W, E56L",5
MQYKLILNGKTLKGTGTTEAVDRATAEKVFKQYANDNGRDGEWTYDRATKTFTVTE,-3.0715058,"E15T, T16G, A23R, V39R, D47R",5
MQYKLILNGKTLKYETTFEAVDAATAEKVAKQYANDNGVWGEWTYDRATKTFTVTE,2.2711399,"G14Y, T18F, F30A, D40W, D47R",5
MQYKLILNGKTLGGGTTTEAVDAATAYKVFKQYANDRGVDGEWTYDRATKTFTVTE,-3.7287867,"K13G, E15G, E27Y, N37R, D47R",5
MQYKLILNGKTLKGETTFEARDAATAEKVFKQYANDNGVDGEWTYDRATRTVTVTE,1.4167142,"T18F, V21R, D47R, K50R, F52V",5
MQYKLILNGKTVKGETHTEAVDAATGEKVFKQYANDRGVDGEWTYDRATKTFTVTE,2.3051803,"L12V, T17H, A26G, N37R, D47R",5
MQYKLILNGKTLLGLTTTEAVDAATAEKVFKRYANDNKVDGEWTYDRATKTFTVTE,3.5936384,"K13L, E15L, Q32R, G38K, D47R",5
MQYKLKLNGKTLKGETTTEAVDAATAEKVCKQYCNDNGVDGEWTYDRANKTFTVTE,3.6844065,"I6K, F30C, A34C, D47R, T49N",5
MQYKLRLNGKTLKGETTTEAVDAATAEKVFKQWANDYGLDGEWTYDRATKTFTVTE,2.3046129,"I6R, Y33W, N37Y, V39L, D47R",5
MQGKLILNGKTLKGETTTEWVDAATAEKVFKQYARDNGVDGEWTYDRATKTFTATE,-4.2468114,"Y3G, A20W, N35R, D47R, V54A",5
MQYRLILNGKTLKGETTTRAVDAYTAEKVFKQYANDNGVDGEWTYDRATKTFTKTE,2.2137012,"K4R, E19R, A24Y, D47R, V54K",5
MQYKLIPNGKTRKGETTTEAVDAATAEKVFKQYANDNGVWGEWTYDRATKRFTVTE,4.0093956,"L7P, L12R, D40W, D47R, T51R",5
MQYKLILNGRTLKGETTTERVDAATAEKVFKQWANDNGVDGEWTYRRATKTFTVTE,5.5233455,"K10R, A20R, Y33W, D46R, D47R",5
MQYKLILNGFGLKGETTTEAVDRATAEKVFKQYANDNGVDGEWFYDRATKTFTVTE,0.3046632,"K10F, T11G, A23R, T44F, D47R",5
MRYKLILNGKTLKGETTTEAVDAARARKVFKQYANDNGVDGEWTYDRATKTFTRTE,-5.022647,"Q2R, T25R, E27R, D47R, V54R",5
MQYKLILNGKTLKGETLTEAVDRATAEYVFKQYANDNGVDGEWTYDRAKKTFTVTE,-1.4024614,"T17L, A23R, K28Y, D47R, T49K",5
MQYKLILNGKTLKGETTTEAFDRATAEKVFKQYANDNGWDGEWTYDRATKTLTVTE,-3.7253604,"V21F, A23R, V39W, D47R, F52L",5
MQYKLILNGKTLKGEPTTEAVDAATAEKVFKQYANDNGYDGEWTYDRYTKKFTVTE,1.6064043,"T16P, V39Y, D47R, A48Y, T51K",5
MQYKLILIRRTLKGETTTEAYDAATAEKVFKQYANDNGVDGEWTYDRATKTFTVTE,3.9531686,"N8I, G9R, K10R, V21Y, D47R",5
MQYKLILNGKTLKGETTTEAVDAATAERVFKQYIRDNGVDGEWTYDRATKTFRVTE,-3.4586535,"K28R, A34I, N35R, D47R, T53R",5
MQYKLILYGKTLKGETTTYAVDAATAEKVFKQYANDNGVDGEWTYDRNTKRFTVTE,6.137931,"N8Y, E19Y, D47R, A48N, T51R",5
MQYKLILNGWTLKGETTTEAWDAYTAEKVFKQYANDNGVDGEWTYDRATHTFTVTE,7.213135,"K10W, V21W, A24Y, D47R, K50H",5
MQYKLILNGKTLKGETTTYAVDAATAMKVFKQYINDNGVDGEITYDRATKTFTVTE,-5.14612,"E19Y, E27M, A34I, W43I, D47R",5
MQYKLILNGKTLKGETTTYAVDAATAEKVFKQYANDNYVDGEWTYDRARKRFTVTE,5.0932894,"E19Y, G38Y, D47R, T49R, T51R",5
MQYKLILNGKTLKGRTITMTVDAATAEKVFKQYANDNGVDGEWTYDRATKTFTVTE,4.880617,"E15R, T17I, E19M, A20T, D47R",5
MQYKLILKGRTLKGETTTEAVDAATAEKVFKQYARDNGVDGEWTYDRATKRFTVTE,1.3306997,"N8K, K10R, N35R, D47R, T51R",5
MQYKLILNGRRLKGETTTEAVDAATAEKVFKQRANDNGVDGEWTYDRATKRFTVTE,3.5542796,"K10R, T11R, Y33R, D47R, T51R",5
MQYKLILNGKTLKGETTTEAVDAATARKVFKQYARDNGVDGRWTYDRATKTFTVTA,-5.7303615,"E27R, N35R, E42R, D47R, E56A",5
MQYKLILNGKTLKGETTTEAVDTATARKVFKQLARDNGVDGEWTYDRATKTFTVTE,-6.0453906,"A23T, E27R, Y33L, N35R, D47R",5
MQYKLILNGKTLKGRTTTEAWDAATAERVFKQYANDNGVDGEWYYDRATKTFTVTE,4.3026547,"E15R, V21W, K28R, T44Y, D47R",5
MQYTLILNGKTLRGETTTEADDWATAEKVFKQYANDNGVDGEWTYDRATKTFTVTE,-0.6739449,"K4T, K13R, V21D, A23W, D47R",5
MQYKLILRGKTLKGETATEAVDAATAYKVFKQYCNDNGVDGEWTYDRATKTFTVTE,-0.96850044,"N8R, T17A, E27Y, A34C, D47R",5
MQYKLILNGKLLKGETTTEAVDAATAEKVFKQYARDNGVDGEWRYDRARKTFTVTE,-0.47649506,"T11L, N35R, T44R, D47R, T49R",5
MQHKLILNGKTLKGFTTTEAVDAATLEKVFKQYANDNGVDGEWTYDRARKTFTVTE,0.03382177,"Y3H, E15F, A26L, D47R, T49R",5
MQYKLILNGKTRKGETTTEAVDAARAEKVFKQYANDNGVDGEWRYNRATKTFTVTE,4.585971,"L12R, T25R, T44R, D46N, D47R",5
MQYKLILNGKTLKGETTTEAVDRATAEKRMKQYANDNGVDGEWTYDRATHTFTVTE,2.333848,"A23R, V29R, F30M, D47R, K50H",5
MQYKLILNGSTLKGEYTTEAVDAATAYKVFKQYANDNGVDGEWTYDRATKTFTVLE,-3.1905358,"K10S, T16Y, E27Y, D47R, T55L",5
MQYKLILNWKTLKGETRTEAVDAATAEKVFKQYANDNGVDLEWTYDRATKTATVTE,-4.495024,"G9W, T17R, G41L, D47R, F52A",5
MQYKLILKGKRLKGETTTEAVDAATAEKVFKQYRNDNGVFGEWTYDRATKTFTVTE,0.76325643,"N8K, T11R, A34R, D40F, D47R",5
MQYKLILNGKTLKGETTLEAVNAATAEKVFKQYANDNGVDGELTYDRATKKFTVTE,-1.4257083,"T18L, D22N, W43L, D47R, T51K",5
MQYRLILNGKTLKGETTFECVDAATAEKVFKQYANRNGVDGEWTYDRATKTFTVTE,4.97834,"K4R, T18F, A20C, D36R, D47R",5
MQYKLILNGKTLKGELTTEAVDAATREKVFKQYATDNGVDGEWTYDRATHTFTVTE,-2.939993,"T16L, A26R, N35T, D47R, K50H",5
MQYKLKLNGKTLKGETTTEAVDAARAEKVAKQYANDNGVDGEWRYDRATKTFTVTE,3.7710526,"I6K, T25R, F30A, T44R, D47R",5
MQYKLILNGKTLKGETTTEAVDAATARKVFKQYAIDNGVDGEWRYDRATKRFTVTE,-4.6532774,"E27R, N35I, T44R, D47R, T51R",5
MQYKLILNGKTLKGETTTIAVDAATAEKVFKIYANHNGWDGEWTYDRATKTFTVTE,-0.26398647,"E19I, Q32I, D36H, V39W, D47R",5
MQYKLILNGRLLKGETTTEAVDAATAEKVFKQYANDNGVDGEWTYKRATKTFTVRE,4.1663113,"K10R, T11L, D46K, D47R, T55R",5
MQYKIILNGKQLKGETTTEAVDAATAEKVFKEYANDNGVYGEWTYDRATKTFTVTE,0.8013134,"L5I, T11Q, Q32E, D40Y, D47R",5
MQYKLILNGKTLYGETTTEAVRAATAEKVFSQYVNDNGVDGEWTYDRATKTFTVTE,-3.8183236,"K13Y, D22R, K31S, A34V, D47R",5
MQYKLLLNGKRLKGETTTEARDAVTAEKVFKQYANDNGVDGEWTYDRATKTFTVTE,5.107985,"I6L, T11R, V21R, A24V, D47R",5
MQYKLILNGKTLKGETTTEAVDAATAEKVFKQYANDNGRVGEWTYDRATKTFTRTG,-4.0302544,"V39R, D40V, D47R, V54R, E56G",5
MQYKLILNGKWLKGETTTEAVDARRAEKVFKQYANDNGVDGEWTYDRATRTFTVTE,3.9863288,"T11W, A24R, T25R, D47R, K50R",5
MQYKLILNGKTLRGETTTKAVDAATAEKVFKQYARDNGVDGEWTYTRATKTFTVTE,1.3980246,"K13R, E19K, N35R, D46T, D47R",5
MQYKLIRNGKTLKGETRTEAVDAATAEKVFKQYANDNGVDMEWTYDRATRTFTVTE,-1.4478959,"L7R, T17R, G41M, D47R, K50R",5
MQYKLILNGKTLKGPTTTEAVRAATAEKVFKQYAWDNGVDGEWTYDRRTKTFTVTE,-0.3097736,"E15P, D22R, N35W, D47R, A48R",5
MQYKLILNGKTLKGETTTEALDAATAEKVFKQYANDNGVDGEWYYDRAWKTFTATE,4.705865,"V21L, T44Y, D47R, T49W, V54A",5
MQYKLIRRGKTLKGETTTEAVDWATAEKVFKKYANDNGVDGEWTYDRATKTFTVTE,-1.9721001,"L7R, N8R, A23W, Q32K, D47R",5
MQYKLILNGKTLKGETTTEAVKWATAEKVFKQYANDNNVDGEWTYDRAVKTFTVTE,-1.4228386,"D22K, A23W, G38N, D47R, T49V",5
MQYKLILNGKTLLGETTTRAVDAATAEKVFKQYARRNGVDGEWTYDRATKTFTVTE,0.71873087,"K13L, E19R, N35R, D36R, D47R",5
MQTKLILNGKTIKGETTTWAVDAARAEKVFKQYANDNGVDGEWTYDRATKTFTVTE,2.2964277,"Y3T, L12I, E19W, T25R, D47R",5
MRYKLILNGKTLKGETLTEAVDAATAEKVIKQYANDNGWDGEWTYDRATKTFTVTE,-1.6093477,"Q2R, T17L, F30I, V39W, D47R",5
MQYKAILNGKTLKGETTTEAVDAATAEKRFKQYANDNGWDLEWTYDRATKTFTVTE,-3.8754425,"L5A, V29R, V39W, G41L, D47R",5
MQYKLILNGKTLKGETTREAVDAATARKVFKQYANDNLYDGEWTYDRATKTFTVTE,-4.276356,"T18R, E27R, G38L, V39Y, D47R",5
MRYKLILNGKTLKGETTTRARDAATAEKVFKQYANDNGWDGEWTYDRATKTFTVTE,1.5280677,"Q2R, E19R, V21R, V39W, D47R",5
MQYKLILNGKTLKGETTTEAVDAATAEKVFKQYLNDRGVDGEKTYDRATKTFTVTL,-5.3590384,"A34L, N37R, W43K, D47R, E56L",5
MQYKLILNGKTLKGETTTEYVDAATAERVFKQYWNDNGVDGRWTYDRATKTFTVTE,-1.6103427,"A20Y, K28R, A34W, E42R, D47R",5
MQYKLILNGKTLKGWTTTEAVDAATAEKRGKRYANDNGVDGEWTYDRATKTFTVTE,2.9346993,"E15W, V29R, F30G, Q32R, D47R",5
MQYKLILNGKTLKGEMTTEAVDAATREKVFKQYANSNGVWGEWTYDRATKTFTVTE,1.2862604,"T16M, A26R, D36S, D40W, D47R",5
MPYKLILNGKTYKGETTTEAVDAATAEKVFKQYANDNGVDGMLTYDRATKTFTVTE,-2.328367,"Q2P, L12Y, E42M, W43L, D47R",5
MQYKLILNGKTLKGETTTEAVDAATAERVFKRYANDNGVDGRWTYDRATKMFTVTE,5.225185,"K28R, Q32R, E42R, D47R, T51M",5
MQYKLILNGKTLKGWTTTEAYDAATAEKVFKQYANDNGFDGRWTYDRATKTFTVTE,4.850611,"E15W, V21Y, V39F, E42R, D47R",5
MQYKLILNGKTLKGETTTEARRAATAEKVFKQYANDNGVDVEWRYDHATKTFTVTE,0.3394455,"V21R, D22R, G41V, T44R, D47H",5
MQYKLILNGKTLKGETTTEAVDAAGARKVFKQYANDNGVWGEWTYDRATKTFTVTR,-1.7014685,"T25G, E27R, D40W, D47R, E56R",5
MQRKLILNGKTLKRETTTEAGDRATAEKVFKQYANDNGVDGEWTYDRATKTFTVTE,-3.430099,"Y3R, G14R, V21G, A23R, D47R",5
MQYKLILNGKTLKGETTTWAVDAATFEKVFKQYANDNGVDGEWTYDRHTKTFAVTE,0.30840734,"E19W, A26F, D47R, A48H, T53A",5
MQYKLILNGKVLKGETTTEAVDAALAHKVFKQYANDNGVDHEWTYDRATKTFTVTE,-5.270805,"T11V, T25L, E27H, G41H, D47R",5
MQYKLILNGKTLKVETTTEAVDAYTAERVFKQYANDNGRDGEWTYDRATKTFTVTE,0.24511561,"G14V, A24Y, K28R, V39R, D47R",5
MQYKLILNGKTLKTLTTTEAVDAATAEKVFKQYANDNCVDGEWTYDRATKTYTVTE,0.06248349,"G14T, E15L, G38C, D47R, F52Y",5
MQYKLILNGKTLKQETTTEAVDRRTAEKVFKQYANDNGVDGEWTYDRRTKTFTVTE,-0.48963624,"G14Q, A23R, A24R, D47R, A48R",5
MQYKLILRGKTLKGETTTEAVDWARAEKVFKQYANDNGVDGEWTMDRATKTFTVTE,-0.8656114,"N8R, A23W, T25R, Y45M, D47R",5
