Sequence,Score,Mutations,Number of Mutations
MQYKLILNGKTLKGHTRTLAVDAATAEKVFFQYANDNGVDGEWTYDRATKTFTVTE,0.0076229796,"E15H, T17R, E19L, K31F, D47R",5
MQYKLILNGKTLKGETTTEAVDRATAEKRFKQYANDNGVYGEWTYDRATKTFTVTN,2.755897,"A23R, V29R, D40Y, D47R, E56N",5
MQYKLILNGSTLKGETTTERVDARTAEKVFKQYANDNGVDGEWTYNRATKTFTVTE,4.691561,"K10S, A20R, A24R, D46N, D47R",5
MQYKLILNGKTLKGVTTTEAVDAATAEKVFKQYANDNYVDGRWWYDRATKTFTVTE,5.289953,"E15V, G38Y, E42R, T44W, D47R",5
MQYKLILNGKTVKSETTTEAVDAATAEKVFKKYANDNGVDGTWTYDRATKTFTVTE,3.2350538,"L12V, G14S, Q32K, E42T, D47R",5
MQYKWILFRKTRKGETTTEAVDAATAEKVFKQYANDNGVDGEWTYDRATKTFTVTE,-0.23195797,"L5W, N8F, G9R, L12R, D47R",5
MRYKLILNGKTLKGETTTLAVDAYTAEKVFRQYANDNGVDGEWTYDRATKTFTVTE,5.8189173,"Q2R, E19L, A24Y, K31R, D47R",5
MQYKLILNKKTLKAETTTEAVDAATAEKVFKQYANDNGVDGWWTYDRATRTFTVTE,2.4494195,"G9K, G14A, E42W, D47R, K50R",5
MQYKLILNGKTLKGLTTTEAVNAATAEKVFKQYANDNGVDGEWYYDRRTKTFTVTE,4.9142766,"E15L, D22N, T44Y, D47R, A48R",5
MGYKLILNGKTLKGETTTEAVRAATAEKVFKKYANDNGVDGEVTYDRATKTFTVTE,-0.8983809,"Q2G, D22R, Q32K, W43V, D47R",5
MQYKLILNGKTLKGITTTEAVDAATAFKVFKQYANDNGVDGEWTYDRATKRFTVCE,-1.1423562,"E15I, E27F, D47R, T51R, T55C",5
MQYKLILNGKTLKGETTTEAVDAATAEKRFKQAANDNGVDGEWQYDRAKKTFTVTE,4.7582464,"V29R, Y33A, T44Q, D47R, T49K",5
MQYKLILNGKTLKGETTTEARDAATAEKVFKQWANDNGVDGEWTYDRATQTFTVRE,4.466478,"V21R, Y33W, D47R, K50Q, T55R",5
MQYKLILNGKTLKGRTTTEAVDGATAEKVARQYANDNGVDGEWTYDRATKTFTVTE,0.49210352,"E15R, A23G, F30A, K31R, D47R",5
MQYKLILNGKTLKGETTTRAVDAATHEKVFKQYANDNGVDGEITRDRATKTFTVTE,-4.798282,"E19R, A26H, W43I, Y45R, D47R",5
MQYKLILNGKTLKGETTTEAVDAATAEKVVKQYARDNGVDGMWTYDRATKTFTLTE,-1.7513813,"F30V, N35R, E42M, D47R, V54L",5
MQYKLILNGETLKGETTTEAVDAATARKVFKQRANDNGVDGEWKYDRATKTFTVTE,-3.1809535,"K10E, E27R, Y33R, T44K, D47R",5
MQYRLILNGKTLIGETTTEAVDAATAEKVFKQYANDNGVDGEWTYDRATKTFRVYE,4.084969,"K4R, K13I, D47R, T53R, T55Y",5
MQYKLIRNGKTLKGETTTEAVDAATAEKVFKQYAMDNGADGEWTYDRATKTFRVTE,-4.903516,"L7R, N35M, V39A, D47R, T53R",5
MQYKLILRGKTLKHETTTNALDAATAEKVFKQYANDNGVDGEWTYDRATKTFTVTE,3.9127274,"N8R, G14H, E19N, V21L, D47R",5
MQYKLILNGKTLKGETTTEAYDAATAEMRFKQYARDNGVDGEWTYDRATKTFTVTE,-0.4520753,"V21Y, K28M, V29R, N35R, D47R",5
MQYKLILNGKTLKGETTTRAVDAYTALKVFKQYANDNGVDGEWTYDRATKTFTYTE,-2.7491908,"E19R, A24Y, E27L, D47R, V54Y",5
MQRKLKLNGKTLKGETTTEAVDAAYAEKVFKQFANDNGVDGEWTYDRATKTFTVTE,1.9615772,"Y3R, I6K, T25Y, Y33F, D47R",5
MQYKLILNGKTLKGETTTEAVDAATAEIRFKQYANRNGVDGEWYYDRATKTFTVTE,4.9223275,"K28I, V29R, D36R, T44Y, D47R",5
MQYKLILNGKTLKFETTTEARDAARAEKVFKQYMNDNGVDGEWTYDRATKTFTVTE,3.6526573,"G14F, V21R, T25R, A34M, D47R",5
MQYKLILNGKTLKGETYTEAVDRARAEKVFKQWANDNGVDGEWTYDRATKTFTVTE,2.1719937,"T17Y, A23R, T25R, Y33W, D47R",5
MQYKLILNGKNLKGEFTTEAVDAATARKVFKQYANDNGVDGEWTYDRATKTFTVWE,-3.3419542,"T11N, T16F, E27R, D47R, T55W",5
MQYKLILNGRTLKGETTTVAVDAATARKVFKQYANDNGVDGEWTYHRATKTFTVTE,-0.7643955,"K10R, E19V, E27R, D46H, D47R",5
MQYRLILNGKTLKGETTTEAYDAATAGKVFKQYANDNKVDGEWTYDRATKTFTVTE,-2.035392,"K4R, V21Y, E27G, G38K, D47R",5
MQYKLILNGKTLKRETTTEAVDAATCGKVFKQYANDNGVDGEWTYDRATRTFTVTE,-3.6360838,"G14R, A26C, E27G, D47R, K50R",5
MQYKLILRGKTLKRETTTEAVDAATAEKVFKQYKNDRGVDGEWTYDRATKTFTVTE,-3.1039867,"N8R, G14R, A34K, N37R, D47R",5
MQYKLILNGKTRKGETTTEAVDAARAEKVFKQYANDNGYDGEWTYDRATKTFRVTE,1.4549229,"L12R, T25R, V39Y, D47R, T53R",5
MGYKLILNRKTLKGETTTEAVDAATAEKVFKQYANDNGVDCFWTYDRATKTFTVTE,0.6837802,"Q2G, G9R, G41C, E42F, D47R",5
MQYKLILNGKTLKGETTTEAKDAATAERRFKQYANDHGVDGEWTYDRATKTFTVTE,3.706485,"V21K, K28R, V29R, N37H, D47R",5
MQYKLILNGKRLKRETTTEAVDAATAEKVGKQYANDNGVDGEWRYDRATKTFTVTE,-1.0848315,"T11R, G14R, F30G, T44R, D47R",5
MQYKLILNGKTLKGETTTIAADRATAEKVFKQYANDNGVDGEWTYDRATKTFTVTR,0.7152723,"E19I, V21A, A23R, D47R, E56R",5
MQYKLILNGKTLKGETTTEAVDAAYAMKVFKQYANDNGVDGHWTYDRATKTFRVTE,-1.3601642,"T25Y, E27M, E42H, D47R, T53R",5
MQYKLILNGKTLKKETTTEYVDAATAEKVFKQYANDNGVDGEWTYDRRRKTFTVTE,2.0574818,"G14K, A20Y, D47R, A48R, T49R",5
MQYKLILNGKTLKGETLTEAVDRATAEKVFKRYANDNGVDGEWFYDRATKTFTVTE,1.8543687,"T17L, A23R, Q32R, T44F, D47R",5
MQYKLILNGKTLKGETTTEWVDAATAEKVFKQYANLNGVDPEWTYDRATKRFTVTE,-1.6729538,"A20W, D36L, G41P, D47R, T51R",5
MQYKLILNGKTLKGETRTEAVDRATAEKVFKQYANDNGRDGEWTYDRQTKTFTVTE,-1.9805975,"T17R, A23R, V39R, D47R, A48Q",5
MQYKLILNGKTYKRETTTEAVDAATAEKVFKRYANDNGVDGEWTYDRARKTFTVTE,1.7760597,"L12Y, G14R, Q32R, D47R, T49R",5
MQYKLILNGKTLKGGTTTEAPDAATAEKVFKQYANDNGVDGEWTYDRAKKVFTVTE,4.627023,"E15G, V21P, D47R, T49K, T51V",5
MQYKLILNGKTLWGETTTEAVDAATAEKVAKQYANDNGWDGEWTPDRATKTFTVTE,-4.727674,"K13W, F30A, V39W, Y45P, D47R",5
MQYKLILNGKRLKGETTTEQVDAATLEKVFKQYANDNGVDGEWTYDRATKTWTVTE,-5.4652,"T11R, A20Q, A26L, D47R, F52W",5
MQYKLILNGKTLKGRTTTEAVDAATALKVFKQYANDNGVDAEWTYDRATKTFTVWE,-3.9165554,"E15R, E27L, G41A, D47R, T55W",5
MQYKLILNGKTLKGETTTEAVDRYTAEKVFKQYARDNGVDGEWTYDRATRTFTVTE,-0.4295271,"A23R, A24Y, N35R, D47R, K50R",5
MQYKLILNGKTLKGETTTEAVYAATAEKVFKQYAYDNGWDGEITYDRATKTFTVTE,-4.6372957,"D22Y, N35Y, V39W, W43I, D47R",5
MQYRLILNGKRLKGETTTDAVDAATAEKVFKQYANDQGVDGEWTYDRATKTFTVTE,2.876539,"K4R, T11R, E19D, N37Q, D47R",5
MQYKIILNGKTLKGETTTEAVDLATARKVFKQYANDNGVDGEWTYDRAKKTFTVTE,-4.7319245,"L5I, A23L, E27R, D47R, T49K",5
MQYKLILNGKTLHGETTTEAVDAATAVKVFKRYANDNWVDGEWTYDRATKTFTVTE,-2.0953887,"K13H, E27V, Q32R, G38W, D47R",5
MRYKLILNGKTLKGETTTEARDAATAAKVFRQYANDNGVDGEWTYDRATKTFTVTE,-2.212867,"Q2R, V21R, E27A, K31R, D47R",5
MQYKLILNGKTLKGETTTEAVDAATAERVFKQYANDNGVDGEWTYDRYTKKFTVWE,4.085919,"K28R, D47R, A48Y, T51K, T55W",5
MQYRLILNGKTLKGETTTEAVDAARARKVFKQYANDNGVDGEFTYDRATKTFTVTE,-5.137404,"K4R, T25R, E27R, W43F, D47R",5
MRYKLILNGKTLKGETTTEAVDAATAEKRFKQYAKDNGVDGEWTYDRATKTFRVTE,1.1900914,"Q2R, V29R, N35K, D47R, T53R",5
MQYRLILNRKTLKGETTTEAVDAATWEKVFKQYANDNGVDGEWTYDRANKTFTVTE,-0.45911497,"K4R, G9R, A26W, D47R, T49N",5
MQYKLILNGKTLKGETTTEAVDAATAEKVFKQYANDNGWDGEWNYDRATRRFTVTE,0.62635726,"V39W, T44N, D47R, K50R, T51R",5
MQYKLILNGKTLYGETTIEAVDARRAEKVFKQYANDNGVDGEWTYDRATKTFTVTE,4.051153,"K13Y, T18I, A24R, T25R, D47R",5
MQYKLILNGKTLKGETTTEAVDAHTFRKVFKQYANDNGVDGEWTYDRATKLFTVTE,-4.267045,"A24H, A26F, E27R, D47R, T51L",5
MQYKLILNGRTLKGHTTTEAVDAATREKVFKQYANDNGVDGEWTYDRATKTFHVTE,0.20205626,"K10R, E15H, A26R, D47R, T53H",5
MQYKLILNGKTLKGERTTEAVDAAYAEKVFKQYANDNGVDGEWTYKRATKTFTVRE,4.7868605,"T16R, T25Y, D46K, D47R, T55R",5
MQYKLILNGKTLKGEWTTEAVDAATARRVFKQYANDNGVDGEWYYDRATKTFTVTE,-4.1283326,"T16W, E27R, K28R, T44Y, D47R",5
MQYKLILNGKTLKPERTTEAVDAATAEKVFKQYANKNGVDGEWTYDRATKAFTVTE,2.5842714,"G14P, T16R, D36K, D47R, T51A",5
MQYKLILNGKTLKGRLTTEAVDAATAEKVFKQYARDNGVDGEWTYDRATKTFTVTR,-1.0781078,"E15R, T16L, N35R, D47R, E56R",5
MQYKLILNGKTLKGETTIEAVDRATAEKVFKQYANDNGVDGEWTYRRATKTFTVRE,1.5545902,"T18I, A23R, D46R, D47R, T55R",5
MQYKLILNGKTLKGEKTTERVDAATAEKVFKQYAKDNGYDGEWTYDLATKTFTVTE,-3.1266658,"T16K, A20R, N35K, V39Y, D47L",5
MQVKLILNGKTLKGETTTEAVLAATAEKVFKQYAYDNGVDGYWTYDRATKTFTVTE,-0.5248832,"Y3V, D22L, N35Y, E42Y, D47R",5
MQYKLILNGKTLKRETTTEAVDAATARKVFRQYANDNGVDGEWTYDRARKTFTVTE,-4.770667,"G14R, E27R, K31R, D47R, T49R",5
MQYKLILNGKVFKGETTTEAVDAATAEKVFKQYANRKGVDGEWTYDRATKTFTVTE,2.398285,"T11V, L12F, D36R, N37K, D47R",5
MRYKLILNGKTLKLLTTTEAVDAATARKVFKQYANDNGVDGEWTYDRATKTFTVTE,-3.0856566,"Q2R, G14L, E15L, E27R, D47R",5
MQYKLRLNGRTLKGETTTEAVDAATAEKVFKRYANDNGVDGEWTYDRATKTITVTE,2.2898226,"I6R, K10R, Q32R, D47R, F52I",5
MQYKLIRNGKTLKGETTTEAVDAARAEKVFKQYANDNGYYGEWTYDRATKTFTVTE,2.5213633,"L7R, T25R, V39Y, D40Y, D47R",5
MQYKLILNGKTLKGETTTEARDAATAEKVFKRYANDNGVDGEWTYDRARKTFTVTR,4.3487167,"V21R, Q32R, D47R, T49R, E56R",5
MQYKLILNGKTLKGETTTEAVDAATAEKVFRQWANDNGVDGEWRYDRATRTFTVTE,2.8388507,"K31R, Y33W, T44R, D47R, K50R",5
MQYKLILNGKTWKGETTTEAVDAATAEKRFKQYANDNGVFGRWTYDRATKTFTVTE,6.0031023,"L12W, V29R, D40F, E42R, D47R",5
MQYKLILNGRTLKGETTTEYVDAATAEKVFKQYANDNGVDGEWTYKRATKTFTRTE,-1.3579872,"K10R, A20Y, D46K, D47R, V54R",5
MQYKLILNGKMLKGETTTEAVDAKTAELVFMQYANDNGVDGEWTYDRATKTFTVTE,-4.3763633,"T11M, A24K, K28L, K31M, D47R",5
MQYKQILNGKELKGETTTEAVDAAKAEKVLKQYANDNGVDGEWTYDRATKTFTVTE,0.52778465,"L5Q, T11E, T25K, F30L, D47R",5
MQYKLILNGKTLKGETTTEAVDAARAEKVFKQYANDNGVWGEWTYDRKTKRFTVTE,7.7720585,"T25R, D40W, D47R, A48K, T51R",5
MQYKLILNGKTLKGETTIEAYDAATAEKVFKQYASDNGVDGEVTYDRATKTFTVTE,-4.0049295,"T18I, V21Y, N35S, W43V, D47R",5
MKYKLILNGKTLKGETTVEAVDRATAEKVFKQYANDNGVDGEWRYDRATKTFTVTE,2.2814562,"Q2K, T18V, A23R, T44R, D47R",5
MQYKLILNGKTLKRSTTTEAVDAATAWKVFKQYANDNGVDGEWTYDRATKRFTVTE,-2.1770504,"G14R, E15S, E27W, D47R, T51R",5
MWYKLIHNGKTLKGETTTEAVDAATAEKVFKQYANDNGVDGPWEYDRATKTFTVTE,1.7236732,"Q2W, L7H, E42P, T44E, D47R",5
MQYKLRLNGKTLKGETTTEAVDAATAEYVKKQYANDMGVDGEWTYDRATKTFTVTE,-3.5605094,"I6R, K28Y, F30K, N37M, D47R",5
MQYKLILNGKTRKGETTTEAVDAATAEKVFKQYANDNGVDGEWTYDRATKTFRRTR,-3.372951,"L12R, D47R, T53R, V54R, E56R",5
MQYKLILNGKTLKGETTTEAVDAATGEKVFQYYANDNGVDGEWTYDRATKTFTKTE,-4.7645755,"A26G, K31Q, Q32Y, D47R, V54K",5
MQYKLILNGKTLFGETTTEAVDAATAEKRFKQYANDNGVDGEWTYDRATKRFTRTE,0.7839478,"K13F, V29R, D47R, T51R, V54R",5
MQYKLILNGKTLKGETTTEAYDAATAEKVFRQYANDNGVDGEWTYDRARKTFTVRE,3.3325233,"V21Y, K31R, D47R, T49R, T55R",5
MQYRLILSGHTLKGETTTEAVDAATAEKVFKQYANDNGWDGEWTYDRATKTFTVTE,0.24490848,"K4R, N8S, K10H, V39W, D47R",5
MQYRLILNGKTLKGETTFEALDAARAEKVFKQYANDNGVDGEWTYDRATKTFTVTE,5.4923406,"K4R, T18F, V21L, T25R, D47R",5
MQYKLIYNGLTLKGETTTEAVRAATAEKVFKQYANDNGVDREWTYDRATKTFTVTE,-3.242238,"L7Y, K10L, D22R, G41R, D47R",5
MQVKLILNRKTLKGETTTEAVDAATVEKVFNQYANDNGVDGEWTYDRATKTFTVTE,-5.4442873,"Y3V, G9R, A26V, K31N, D47R",5
MQYKLILNGRTKKGETTTEAVDAATAEKVFKSYANDNGVDGEWTYDRATKTVTVTE,-0.34223685,"K10R, L12K, Q32S, D47R, F52V",5
MQYKLILNGKTLKGETTTEAVDAATAEKVFKQYANDNGVDGRWRYDRATKRFTLTE,4.7622404,"E42R, T44R, D47R, T51R, V54L",5
MQYKLILCGKTLKGETTTEAVDAATVEKVLKQYANDNGVDGEWTYDRATKTFTVTR,1.70007,"N8C, A26V, F30L, D47R, E56R",5
MQYKLILNGKTLKYETTTEAVDAATAEKVFKQYAKDRGVDVEWTYDRATKTFTVTE,-5.471148,"G14Y, N35K, N37R, G41V, D47R",5
MQYKLILNGKTLKGSTTTEFVDAATAFKRFKQYANDNGVDGEWTYDRATKTFTVTE,-1.3240579,"E15S, A20F, E27F, V29R, D47R",5
MQYKLILNGKTLYGETTKEYVDAATAEKVFKQYANDNGVDGEWTYDRATKTFTLTE,1.9063002,"K13Y, T18K, A20Y, D47R, V54L",5
MQYKLIRRGKTLKGETTTEAVDAATAEKVIKQYANDNGVDGEWTYIRATKTFTVTE,0.83307356,"L7R, N8R, F30I, D46I, D47R",5
MQYKLILNGSRLKGWTTTEAVDAATAEKVFKQYANRNGVDGEWTYDRATKTFTVTE,4.6116796,"K10S, T11R, E15W, D36R, D47R",5
MQYKLILNGKTLKGETYTEAVDAATAEKVFKQYANDWGVDGEWTYRRATKTFTVTR,1.9124942,"T17Y, N37W, D46R, D47R, E56R",5
MQYKLILNGKTLKGETTVEAVDHATAEKVFRQYANDNGVDGEWTYDRATKTFWVTE,0.30718693,"T18V, A23H, K31R, D47R, T53W",5
MQYKLILNGKTLKGETYTEAVDRATAEKKFKQYANDNGVDGEWTYDRATKTFKVTE,2.6448398,"T17Y, A23R, V29K, D47R, T53K",5
MQRKLILNGKTLKGETTVEAVDAATAERVFKQYANDNGVDGEWTYDRATKTFNVTE,0.1398547,"Y3R, T18V, K28R, D47R, T53N",5
MQYKLILNGKTLKGERTTEAVDAATAEKRFKQYANDNGVWGRWTYDRATKTFTVTE,7.9956446,"T16R, V29R, D40W, E42R, D47R",5
MQYRLILNGKTLKGETTTEAVDAATAEKVFKQYANDNGVYGHWRYDRATKTFTVTE,6.6023436,"K4R, D40Y, E42H, T44R, D47R",5
MQYKLILNGKTLKGITTTGAYDAATARKVFKQYANDNGVDGEWTYDRATKTFTVTE,-0.93610317,"E15I, E19G, V21Y, E27R, D47R",5
MQYKLILNGTTLKVETTTEAVDAATAEKVFKQYANDLGVDGYWTYDRATKTFTVTE,2.7139854,"K10T, G14V, N37L, E42Y, D47R",5
MQYKLLLNGKTLKGETTTEPVDAATAEKVRKQYANDNWVDGEWTYDRATKTFTVTE,-3.1565487,"I6L, A20P, F30R, G38W, D47R",5
MQYKLILNGKTLKWETTTEAVDAATAEKVFKQYANDNGFDGEWTYDRATKTVTVTL,-3.1426322,"G14W, V39F, D47R, F52V, E56L",5
MQYKLILNGKTLKGETTTYAVDAATAEKVFKQYANDNGVDGEMTYDRKTKVFTVTE,-0.067469105,"E19Y, W43M, D47R, A48K, T51V",5
MQYKLRLNGKHLCGWTTTEAVDAATAEKVFKQYANDNGVDGEWTYDRATKTFTVTE,4.1856933,"I6R, T11H, K13C, E15W, D47R",5
MQYKLILNGKTLKGETTTEAVDAATARKVFKQYANRNGVDGRWRYDRATKTFTVTE,-0.4427345,"E27R, D36R, E42R, T44R, D47R",5
MQYKLIRNGKTLKGETTTEAVDAARAEKVVKQYANDNGVDGEWTYDRASKTFTVTE,2.3582766,"L7R, T25R, F30V, D47R, T49S",5
MQYKLILNGKYLKGETTTEAVDRATAERVFKQYANDNLVDGEWTYDRATKTFTVTE,-1.118461,"T11Y, A23R, K28R, G38L, D47R",5
MQYKLILNYKTLKGETTTEAVDAATAEKVAKRYANDNGVDGEWHYDRATKTFTVTE,1.7510056,"G9Y, F30A, Q32R, T44H, D47R",5
MQYKLILNRNTLKGETGTEAVDAATARKVFKQYANDNGVDGEWTYDRATKTFTVTE,-2.7123845,"G9R, K10N, T17G, E27R, D47R",5
MQYKLILNGKTLCGETTTRAVDAATAEKVFKQYCNDNGVDGAWTYDRATKTFTVTE,5.452429,"K13C, E19R, A34C, E42A, D47R",5
MQYRLILNGKTLKGETTTEAVDAATAESRFKQYANDNGVDGEWTYRRATKTFTVTE,2.8018928,"K4R, K28S, V29R, D46R, D47R",5
MQYKLRLNGKTLKGETTTEAVDRATAEKVFKRYANDNGVDGEWTYDRATKTYTVTE,-0.18742877,"I6R, A23R, Q32R, D47R, F52Y",5
MQYKLILNGKTLKGETTREAYDAATAEKVFKQRANDNGVDGEWTYRRATKTFTVTE,4.14263,"T18R, V21Y, Y33R, D46R, D47R",5
MQYKLILRGKTLKGETTFEARDAHTAEKVFKQYANDNGVDGEWTYDRATKTFTVTE,6.8861804,"N8R, T18F, V21R, A24H, D47R",5
MRYKLILNKKTLKGETTIEAVDAATAEKVFKQYANDFGVDGEWTYDRATKTFTVTE,0.6233059,"Q2R, G9K, T18I, N37F, D47R",5
MQYKLILRGKYLKGETTTEAVDAATAEKVFKRYANDNGVDGRWTYDRATKTFTVTE,5.113965,"N8R, T11Y, Q32R, E42R, D47R",5
MQYKLILNGKTLKGETTREIVDAATAERVFKQYANDNGVYGEWTYDRATKTFTVTE,3.9889698,"T18R, A20I, K28R, D40Y, D47R",5
MQYKLILNGKTLKGETTTEAVDAATARKVFKQRANDNGLDGEWTYDRATKTFRVTE,-3.0080612,"E27R, Y33R, V39L, D47R, T53R",5
MQYTLILNGKTLKDETRTEAVDAATAEKVFRQYANDNGVDGEWTYDRATKTFTVTE,1.1566656,"K4T, G14D, T17R, K31R, D47R",5
MQYKLILNGKTLKGYTTTEAVDAATAEKVFKQYANDNGVDGQWTYSRATKTFYVTE,5.6219015,"E15Y, E42Q, D46S, D47R, T53Y",5
MQYRLILNGKTGKGETTTEAVDAAKAEKVFKQYANDNGVDYEWTYDRATKTFTVTE,-1.1746925,"K4R, L12G, T25K, G41Y, D47R",5
MQYKLILNGKTLKGETTTEAVDAATAEKVAKQYRNDNGVDGELTYDRATNTFTVTE,-5.014603,"F30A, A34R, W43L, D47R, K50N",5
MQYKLILNGKTLKGETTTEAVDAATARKVFSQYANDNGVDGEWTYDRARKTITVTE,-6.2166824,"E27R, K31S, D47R, T49R, F52I",5
MQYKLRLNGKTLKGELTTEAVDAATAERVFKQYANDNGVDGEWTYDRATKTFTVTG,1.9790158,"I6R, T16L, K28R, D47R, E56G",5
MQYKLILNGKTLKGRTTFEAVDAAVAEKVFKQYANDNGVDGEWTYDRALKTFTVTE,4.950102,"E15R, T18F, T25V, D47R, T49L",5
MQRKLILNGKTLKGETTTEAVDAATAEKVFKQYANRNGLDGEWTYDRRTKTFTVTE,2.522852,"Y3R, D36R, V39L, D47R, A48R",5
MQYKLILHGKTLKGETTVEAVDAATAEKRFKQYANDNGVDGEVTYDRATKTFTVTE,0.0907718,"N8H, T18V, V29R, W43V, D47R",5
MQYKLILNGKTLKGETTTEAVDAATAEKVFRQYANDNGVDGEWTYDRATKTFFVRK,0.6763569,"K31R, D47R, T53F, T55R, E56K",5
MQYKLILNGKTLKGSTITEAVDAATGEKVFKQYANDNGVDREWTYDRATKTFTVTE,-1.3472297,"E15S, T17I, A26G, G41R, D47R",5
MQYKLILNGKTLKGETVTEAVDAATAEKVAKQYCNRNGVDGEWTYDRATKTFTVTE,2.8765225,"T17V, F30A, A34C, D36R, D47R",5
MQYKLILEGKTLKGETLTEAVDAATAEKVFKQYANDNGVDGEWTYDRWTKTFTLTE,3.5778031,"N8E, T17L, D47R, A48W, V54L",5
MQYKLIRNSKTLKGETTTERVDAALAEKVFKQYANDNGVDGEWTYDRATKTFTVTE,2.5031552,"L7R, G9S, A20R, T25L, D47R",5
MQYKLILNGKTLKGETTTEAEDAATAEKVFKQIANRNGVDGEWTYDRYTKTFTVTE,3.5484643,"V21E, Y33I, D36R, D47R, A48Y",5
MQYKLKLNGKTLKGETTTEAVDAATAEKVAKQYANDNGRDGRWTYDRATKTFTVTE,-0.8375303,"I6K, F30A, V39R, E42R, D47R",5
MQYKLILNGKTLKGETTTEAVDAATAERVFKQYANDNGVWGEWRYDRATKTFKVTE,5.3010597,"K28R, D40W, T44R, D47R, T53K",5
MQYKLILNGKTLKGETTTEARDAATAERVFKQYANDNGVDGEWTYDRATKTFTVRL,2.1347752,"V21R, K28R, D47R, T55R, E56L",5
MQYKLILNGKTLKGERTTEAVDAARAEKVFKQYANDNGVWGEWTYDRATKQFTVTE,7.4813685,"T16R, T25R, D40W, D47R, T51Q",5
MQFKLILAGKTLKGETTTEAVDAATAEKVFKQYANDNGVDGIWTYDRATKTFTVTR,4.115665,"Y3F, N8A, E42I, D47R, E56R",5
MQYKLILNGKTLKGETTTERVDAARAEKVFKQYANDKGVDGEWTYDRATETFTVTE,4.617709,"A20R, T25R, N37K, D47R, K50E",5
MQYKLILNGKTLKGETHTEAVDAATAEKVFKQYANDHGVDGRKTYDRATKTFTVTE,-1.445915,"T17H, N37H, E42R, W43K, D47R",5
MQYKLIRNGKTLKGETTTYAVDAATAEHVFKQYANDNGVDGRWTYDRATKTFTVTE,1.132823,"L7R, E19Y, K28H, E42R, D47R",5
MQYKLILNGKTLLGETTFERVDAATAEKVFKQYARDNGVDGEWTYDRATKTFTVTE,0.25527626,"K13L, T18F, A20R, N35R, D47R",5
MQYKLILNGKTRKGETTTEAVDAATAEKVFKQYAKDNGVDGEWTYDRATRTFRVTE,-1.8538917,"L12R, N35K, D47R, K50R, T53R",5
MQYKLILNGKTLKGETTTEAVDAATAEKVFKQYANDNGVWGEITYDRARKRFTVTE,0.90710056,"D40W, W43I, D47R, T49R, T51R",5
MFYKLILNGKTFKGETTTEAVRAATAEKVFRQYANDNGVDGEWTYDRATKTFTVTE,2.4496527,"Q2F, L12F, D22R, K31R, D47R",5
MQYKLILNGKTLKGETTTEAVDRATCEKVFKQYANDNGRDGEWTYDRATKTFTRTE,-5.0004683,"A23R, A26C, V39R, D47R, V54R",5
MQYKLRLNGKTLKGETTTEAVDAAWAEKVFKQYANDNGVDGFWQYDRATKTFTVTE,6.3691826,"I6R, T25W, E42F, T44Q, D47R",5
MQYKLILNGKTLKGETTTEAVDRATAEKVFKQYAWDNGVDGEVTYDRATRTFTVTE,-4.5355253,"A23R, N35W, W43V, D47R, K50R",5
MQYKLILNIKTAKGETTTEAVDAATAKKVFKQYANDNGVDGEWTIDRATKTFTVTE,-5.464362,"G9I, L12A, E27K, Y45I, D47R",5
MQYKLILNGKTLKGERTTEAVDAATALKRFKQYANDNLVDGEWTYDRATKTFTVTE,-0.53496623,"T16R, E27L, V29R, G38L, D47R",5
MQYKLILNGKTLKGETTTEAVDAYTAEKVFKQYANDNRVWGEWTYDRATKTFYVTE,6.757347,"A24Y, G38R, D40W, D47R, T53Y",5
MQYKLILNGKTLKGERFTRAVDAATAEKVFKQYANDNGVDGEWTYDRATKTFRVTE,5.092487,"T16R, T17F, E19R, D47R, T53R",5
MQYKLILNGKTLKGETTTEAVDRATAEKVFKQYANDNGVDGEIWYDRATKCFTVTE,-3.4159365,"A23R, W43I, T44W, D47R, T51C",5
MQYKLILRGKTLKGETITEAVNAATAEKVFKQYANDYGVDGEWTYDRATKTFTVTE,2.6862335,"N8R, T17I, D22N, N37Y, D47R",5
MQYKLILNGKTLKGETTCEAVDAATAEKVFKQYANDNGVRGEWTYDRATKTFTVRR,3.8325207,"T18C, D40R, D47R, T55R, E56R",5
MYYKLILRGKTLKGETETEAVDAATAEKVFKQKANDNGVDGEWTYDRATKTFTVTE,3.7639468,"Q2Y, N8R, T17E, Y33K, D47R",5
MQYKLILNGKTLKGETTTEAVDAATAEKVFKQYANDNGLDGKWFYDRATKTFTVRE,5.4336753,"V39L, E42K, T44F, D47R, T55R",5
MQRKLILNGKTLKGETTTEAVDAATAEKVFKQYANDNGVDGEWTYDRHTKRFRVTE,1.8813405,"Y3R, D47R, A48H, T51R, T53R",5
MQYKLILNGKTLKRETTTEAVDAATAEKVAKQYANDNGVDGEWTYDRATKTFTRTA,-4.9154205,"G14R, F30A, D47R, V54R, E56A",5
MQYKLILNGKTKKGETTTEAVDAYTAEKVFKKYANDNGVDGEWTYDRATKTFTVRE,5.437945,"L12K, A24Y, Q32K, D47R, T55R",5
MQYKLILNGKTLKGETRTEARDAYTAERVFKQYANDNGVDGEWTYDRATKTFTVTE,6.444553,"T17R, V21R, A24Y, K28R, D47R",5
MQYKLIINGFTLKGETTTERVDAATAERVFKQYANDNGVDGEWTYDRATKTFTVTE,4.9098644,"L7I, K10F, A20R, K28R, D47R",5
MQYKLILNGKTLKGETTTEANDAATAERVFKQYANDNAVDGMWTYDRATKTFTVTE,4.3209815,"V21N, K28R, G38A, E42M, D47R",5
MQYKLILNGKTLKGETTTEAVAAATAEKIFKQYANDNGVWGEWTYDRATKRFTVTE,7.2743287,"D22A, V29I, D40W, D47R, T51R",5
MQYKLILNGKTLKGETTTEAVDAATAEKVFKHYANRNGVDGEWTYDRATKTYTVTR,1.6315968,"Q32H, D36R, D47R, F52Y, E56R",5
MQYKLRLNGKTLKRETTTETVDRATAEKVFKQYANDNGVDGEWTYDRATKTFTVTE,-0.020950727,"I6R, G14R, A20T, A23R, D47R",5
MQYKLILNGKTLKGETTCEAVDAYTAEKVFKQYANRNGVDGEYTYDRATKTFTVTE,2.2495685,"T18C, A24Y, D36R, W43Y, D47R",5
MQYKLILNGKTLKGETTTEAVAAATARKVCKQYANDNGVDGEWTYDRATKTITVTE,-4.5314217,"D22A, E27R, F30C, D47R, F52I",5
MRYKLILNGKTLKGEPTTEAVDAATAEKVFKQYANDNGEDGEWTYDRATKTFTVTL,-0.8635041,"Q2R, T16P, V39E, D47R, E56L",5
MQYKLIRNGKTLKGETTTEAVDAATAEKVFKQYANDNYVDGTWTYDRATKTFSVTE,2.7892687,"L7R, G38Y, E42T, D47R, T53S",5
MQYKLIFNGKTLWGKTTTEAVDAATAEKVRKQYANDNGVDGEWTYDRATKTFTVTE,-1.184383,"L7F, K13W, E15K, F30R, D47R",5
MQYKLILNGKTLKGETRTEAVDAATAEKRFKQYANDNGLYGEWTYDRATKTFTVTE,7.9261546,"T17R, V29R, V39L, D40Y, D47R",5
MQYKLILNGKRLKGETTTEAYDRATAEKVFKQYANDNGVDGEWTYDRATKTFTRTE,-4.1565433,"T11R, V21Y, A23R, D47R, V54R",5
MQYKLILNGKTLKGETTTEAVDAAGAEKRFKQWANDNGVDGEYTYDRATKTFTVTE,0.04317175,"T25G, V29R, Y33W, W43Y, D47R",5
MQYKLILNGYTLKGETTTEAVDAATAEKVLKQYANDNGVDVEWTYDRATKTFLVTE,-1.0678283,"K10Y, F30L, G41V, D47R, T53L",5
MQYKLILMGKRLKGETTTEAVDAATAEKVFKQYANDNGVDREWTYDRATKTFTVRE,-2.4848905,"N8M, T11R, G41R, D47R, T55R",5
MKYKLILNGKTLKGETLTEAVDAAKAEKVFKQYANRNGVDGEWTYDRATKTFTVTE,5.626378,"Q2K, T17L, T25K, D36R, D47R",5
MQYKLILNGKTLKGETTTEAVDAATAEKRFKRYANDNGVDGEYTYDYATKTFRVTE,0.33330944,"V29R, Q32R, W43Y, D47Y, T53R",5
MQYKLILNGKTLRGETTTEARDAATAEKVFKQYANDNAVDGEWTYDRATQTFTVTE,5.449866,"K13R, V21R, G38A, D47R, K50Q",5
MQYKLILNGKTLKGETLTEAVDAATAERRFKQYANDNGVDGEWTYDRATRTFTVTE,4.9702578,"T17L, K28R, V29R, D47R, K50R",5
MQYKLILNGRTLKGGTTTEYVDAATAVKVFKQYANDNGVDGEWTYDRATKTFTVTE,-3.259812,"K10R, E15G, A20Y, E27V, D47R",5
MQYKLILNGKTLKGETTTEAVDAATSEKVFKQYLNDNGVDGEWTYDRATKTFTVRY,-0.5845322,"A26S, A34L, D47R, T55R, E56Y",5
MQYKLILNGKTLKGETTTWAVKAATAEKRFKRYANDNGVDGEWTYDRATKTFTVTE,6.3381824,"E19W, D22K, V29R, Q32R, D47R",5
MQYKLILNGKTLKGWTTTEAVDRATAEKVFKQYANVNGVDGEWTYDRATKTFTRTE,-2.5568597,"E15W, A23R, D36V, D47R, V54R",5
MQYKLILNGKTLKRPTTTEARDAATAEKVFKRYANDNGVDGEWTYDRATKTFTVTE,2.3462443,"G14R, E15P, V21R, Q32R, D47R",5
MQYKLILNYKTLKGETTTEAVRAATAEKVFKQYANDNGVDGEWKYDRYTKTFTVTE,3.7803907,"G9Y, D22R, T44K, D47R, A48Y",5
MQYKLILNGKTLKGETTTEAVDAATAEKVCKQYFNDNGWLGEWTYDRATKTFTVTE,-3.949425,"F30C, A34F, V39W, D40L, D47R",5
MQYKLILNGKTLKGETTTEAVDAARAEKVFKQYLNDRGVDGEWTYDRATKTFTVRE,0.77877754,"T25R, A34L, N37R, D47R, T55R",5
MQYKLILRGKRLKGETTTERVDAATAEKVFKQYANDNGVDGEWTYDRATKTMTVTE,2.8074121,"N8R, T11R, A20R, D47R, F52M",5
MQYKLILNGKTLKGETTTEAVDRATAEKVFKQYANRNGLDGEWTYDRATKTFTVTR,1.2473369,"A23R, D36R, V39L, D47R, E56R",5
MQYKLILNGKTLKGETRTEYVDAATAEAVFKQYANDNGVDGEWTYDRATKTFTVTR,-0.7937537,"T17R, A20Y, K28A, D47R, E56R",5
MQRKLILNGKTLKGETTTEAVRAATARKVFKQYANDNGVDGEWTYRRATKTFTVTE,-4.746488,"Y3R, D22R, E27R, D46R, D47R",5
MQYKLILNGKTLKQETTTEAVDAATAEKRFKQYANDNGVDGEWTYDRATRTFQVTE,4.6214175,"G14Q, V29R, D47R, K50R, T53Q",5
MQYKLILNGKTLKGYTTTEAVDAATAEKVFKQYANDNGVYGEWTYDRATRTFYVTE,6.3011165,"E15Y, D40Y, D47R, K50R, T53Y",5
MQYKLILKGKTRKGETTTFAVDAATAEKVFKQYAFDNGVDGEWTYDRATKTFTVTE,-0.14230417,"N8K, L12R, E19F, N35F, D47R",5
MQYKLILNGKTLKGETTTEAVDAATREKRFKQYANDNGVYGEWTYDRAKKTFTVTE,2.5095794,"A26R, V29R, D40Y, D47R, T49K",5
MQYKLILNGKTLKGETRTEAVDRATAEKVFKQYANDIGVDGEWTYDRRTKTFTVTE,1.1862602,"T17R, A23R, N37I, D47R, A48R",5
MQYKLILNGKFLKGETTTEAVDAATAEKRFRQYANDNGVDGEWTYDRATKTFTVTA,1.9431024,"T11F, V29R, K31R, D47R, E56A",5
MQYRLILFGKTLKGETTTEAVDAATAEKVFKQYARDNGVWGEWTYDRATKTFTVTE,2.2195408,"K4R, N8F, N35R, D40W, D47R",5
MKYKLILNGKPLKGRTTTEAVDAATAEKVFKQYANDLGVDGEWTYDRATKTFTVTE,2.6054337,"Q2K, T11P, E15R, N37L, D47R",5
MQYKLILNGKTLKGETTTEAVDAATAEKVFKQYMNDNGVYGEWTYDRATKRFIVTE,5.8546224,"A34M, D40Y, D47R, T51R, T53I",5
MQYKLIHNGKTLKGETVTEAVDAATAEKVFKQYANDRGVDGEWTYDRARKTFTVTE,0.50678396,"L7H, T17V, N37R, D47R, T49R",5
MQYKLIINGKTLKGETTTEAVDAATAEKVFKQYANDNGVDGEWRYDRATKTFRVRE,5.2270575,"L7I, T44R, D47R, T53R, T55R",5
MQLKLILNGKTLKGERTTEAVDAATAEKVFKQYANDNGVDGEWTYHRARKTFTVTE,4.4413533,"Y3L, T16R, D46H, D47R, T49R",5
MQYKLILNGKTLKGETTTERVDAYTAEKVFKQYANDNGVDGEWTYDRKTKTFTVYE,7.268474,"A20R, A24Y, D47R, A48K, T55Y",5
MQKKLILNGKTLKGETTKEAVDAATAEKVFKRYANDNGVDGEWTYDRATKTFRVTE,1.1838536,"Y3K, T18K, Q32R, D47R, T53R",5
MQYKLILNGKTEKGETTTEAVDAATAEKVFKQYYNRNGVDGEWTYNRATKTFTVTE,-0.0013480112,"L12E, A34Y, D36R, D46N, D47R",5
MQYKLILNGKALKGETTTEAVDQATAEKVFKQYANDLGVDGEVTYDRATKTFTVTE,-4.8315897,"T11A, A23Q, N37L, W43V, D47R",5
MQYKLILNGKTLKRETTTPAVDAATAEKVFKQYANDNGVDGWWTYDRATKTFTVTR,2.770072,"G14R, E19P, E42W, D47R, E56R",5
MQYKFILNGKTLKGETTTEAVDAATAEKRFRQYANDNGVDGEWTYYRATKTFTVTE,3.264108,"L5F, V29R, K31R, D46Y, D47R",5
MQYKLILNQKTLKGETTTEAVDAATAEKVFKQYANDNGVDLEWTYDRATKKFTVVE,-2.2892346,"G9Q, G41L, D47R, T51K, T55V",5
MQYRLILNGKTLKGETTTEAVDAAKAEKVAKQYANLNGVDGEWTYDRATKTFTVTE,3.2759354,"K4R, T25K, F30A, D36L, D47R",5
MQYKLILNGKHLKGETRTEAVDAATAEKVFKQYANDNGVDLEWTYDRATKQFTVTE,-0.36094952,"T11H, T17R, G41L, D47R, T51Q",5
MQYKLILNGKTLKGERTTGAVDRATAEKVFKQYARDNGVDGEWTYDRATKTFTVTE,-2.6529577,"T16R, E19G, A23R, N35R, D47R",5
MQRKLILNGKTLKGETTTEAVDAATAEKVFKLYANDKGWDGEWTYDRATKTFTVTE,-4.169922,"Y3R, Q32L, N37K, V39W, D47R",5
MKYKLTLNGKTLKGETTTEAVDAATAEKVFKRYANDWGVDGEWTYDRATKTFTVTE,3.5426564,"Q2K, I6T, Q32R, N37W, D47R",5
MQYKLILNGKTLYGETTTEAVDAATAEKVFKQYANDNGVDGEWVYHRATKTRTVTE,-2.275708,"K13Y, T44V, D46H, D47R, F52R",5
MQYKLILNGKLLKGETTTEAVDARTAEKVFKQYANDNGVWGEWTYDRATKTFTVTR,3.0393867,"T11L, A24R, D40W, D47R, E56R",5
MQYKLILNGKTRKGETTTEWVDAATAEKVFKQYANRNGVDGEWTYDRATKTFRVTE,2.437142,"L12R, A20W, D36R, D47R, T53R",5
MQYKLIRKGKTLKGETTTEAVDAATAERVFKQYANDNGVDGEWTYRRATKTFTVTE,2.0243905,"L7R, N8K, K28R, D46R, D47R",5
MQYKLIKNGKTLKGETTTEARDAAMAEKVFKQYANRNGVDGEWTYDRATKTFTVTE,4.806567,"L7K, V21R, T25M, D36R, D47R",5
MQYKLTLDGKTLKGETTTEAVDAATAEKVFKQYANDNGVDGEWTYDRRQKTFTVTE,5.035539,"I6T, N8D, D47R, A48R, T49Q",5
MQYKLILNGKTLKGETTTEAVDRATAEKVFKQLANDNGVDYEWRYDRATKTFTVTE,-3.3120492,"A23R, Y33L, G41Y, T44R, D47R",5
MQYKLILHGKTLKGEYTTEAVDAATAEKVFKQYANDNGVDGERTYDRRTKTFTVTE,-1.485639,"N8H, T16Y, W43R, D47R, A48R",5
MKYKLILNYKTLKGETTTEAVDAATAEKVFKWYANDNGVDGEWTYDRATKTFVVTE,2.2913935,"Q2K, G9Y, Q32W, D47R, T53V",5
MQYKLILNGKVLKGETTTEAVDAAMAEKVFKQYANDNGVDGEWTYDRATKTYTVTR,0.6626592,"T11V, T25M, D47R, F52Y, E56R",5
MRYKLIFNGKTLKGETTTEAVDAARAEKVFKQYLNDNGVDGEWTYDRATKTFTVTE,1.9455413,"Q2R, L7F, T25R, A34L, D47R",5
MQYKLILNGKTLKGETTTEAVDAATVEKVFKQYAEDNGVWGEWRYDRATKTFTVTE,0.044155583,"A26V, N35E, D40W, T44R, D47R",5
MRYKLILNGKTLKGEHTVEAVDAATAEKVFKQYANDNGVDGEWTYDRATKTFTFTE,4.3170753,"Q2R, T16H, T18V, D47R, V54F",5
MQYKCILNGKTLKGETTTEAVDAATAEKVFKQYANRNGVDGEWTYDRATKTYRVTE,2.3869615,"L5C, D36R, D47R, F52Y, T53R",5
MQYKLILNGKTRKGEYTTEAVDAATAEKVFKQYANDNGVDGEWTYDRATRTFTVRE,2.4642215,"L12R, T16Y, D47R, K50R, T55R",5
MQYKLILNGKTLKGYTTTEAVRASTAEKVFKQYANDRGVDGEWTYDRATKTFTVTE,4.320548,"E15Y, D22R, A24S, N37R, D47R",5
MQYKLILNGKTYKGETTTEAVDRATAEKVFKQYANDNGVDGEWRYDRATKTFYVTE,-0.6187203,"L12Y, A23R, T44R, D47R, T53Y",5
MQYKLILNGKTLKGETTTEAVDAATAEKRFKQYANDNGVDGEWTYQRATKRYTVTE,3.8911545,"V29R, D46Q, D47R, T51R, F52Y",5
MQYKLILNGKTLKGETTTEARLAATAEKVFKQYANDNFVDGEWTYDRKTKTFTVTE,5.032323,"V21R, D22L, G38F, D47R, A48K",5
MRYKLILNGKTLKGRTTVEAVDAATAEKVFKQYANDNWVDGEWTYDRATKTFTVTE,5.0216165,"Q2R, E15R, T18V, G38W, D47R",5
MQYKLILNGKTLKGETTTEAVDAATAEKQFKQYANDNGVDGEWRYDRATKTFRVTA,3.9636223,"V29Q, T44R, D47R, T53R, E56A",5
MQYKHILNGKTLKGRTTTEAVDAATAEKVFKQYANDNGVDGEWTYDRATKRFTVRE,2.7960408,"L5H, E15R, D47R, T51R, T55R",5
MQYKLILNGKTLSGETTTEAVDAATAEKVFKQYANRNGVLGEWTFDRATKTFTVTE,5.3248143,"K13S, D36R, D40L, Y45F, D47R",5
MQYKLILNGKTLKGERTTEARDAATAEKVFKQYANDNGVDGLWTYRRATKTFTVTE,6.056244,"T16R, V21R, E42L, D46R, D47R",5
MQYKLILNGKTLKGETTTEAVDLATAEKVFKQYANDNGYDGEWTYDRRTKTFTLTE,-1.4430245,"A23L, V39Y, D47R, A48R, V54L",5
MQYKLILNGKTLRGLTTTEARDAATAMKVFKQYANDNGVDGEWTYDRATKTFTVTE,-0.89106774,"K13R, E15L, V21R, E27M, D47R",5
MQYKLILNGKTLKGETTTEAVDAATAKKVFKQYANDNGLDGEWTYDRATKTITVTY,-5.242391,"E27K, V39L, D47R, F52I, E56Y",5
MQYKLILNGKTLKGETTTEGVDAATAERVFKQYANDNFVDGEWTVDRATKTFTVTE,0.17554027,"A20G, K28R, G38F, Y45V, D47R",5
MQYKLRLNGKTLKGETTTEAVDAATAEKVCRQYANDNGVDGEWTYDRATKTFTVTY,0.18332505,"I6R, F30C, K31R, D47R, E56Y",5
MQYKLILNGKTLKGYTTTEAVDAARAEKVFKQYARDNDVDGEWTYDRATKTFTVTE,0.95244086,"E15Y, T25R, N35R, G38D, D47R",5
MQKKLYLNGKYLKRETTTEAVDAATAEKVFKQYANDNGVDGEWTYDRATKTFTVTE,-1.2737567,"Y3K, I6Y, T11Y, G14R, D47R",5
MQYKLISNGKTLKGETTTEAVDAATRLKVFKQYANDNGVDGEWTYDRRTKTFTVTE,-5.5135384,"L7S, A26R, E27L, D47R, A48R",5
MQYKLIVNGKTLKGETTTEAVDAYTAEKVFKQYMNDNGVDGEWTYDRATKTFTPTE,1.5088724,"L7V, A24Y, A34M, D47R, V54P",5
MQYKLILNGKTLKGETTTEAVDAATARKVFKQYANDQGVDGEWTYIRATKTFTVRE,-3.0893748,"E27R, N37Q, D46I, D47R, T55R",5
MQYKLILNGKTLKGETTTERVDAATKEKVFKQYANDNGVRGEWTYDRATKTFRVTE,0.3154555,"A20R, A26K, D40R, D47R, T53R",5
