Sequence,Score,Mutations,Number of Mutations
MQYKLILNGKTLKGETTTEAVDAATAERVFKQRANDNGVDGEWHYDRATKTITVTE,-0.79749715,"K28R, Y33R, T44H, D47R, F52I",5
MQYKLILNGKTVKGETTTEAVDAYTAEKVFKQYFNDNGVDGEWTYDRYTKTFTVTE,1.5612184,"L12V, A24Y, A34F, D47R, A48Y",5
MQYKLILNGKTLKGKTTTEAVDAATAEKVFKQIANDNGVDCEWVYDRATKTFTVTE,-0.7462546,"E15K, Y33I, G41C, T44V, D47R",5
MQMKLILIGKTLKGETTTEAVDAATAEKVLKQYANDNGVDGEWTYDRATKKFTVTE,3.512211,"Y3M, N8I, F30L, D47R, T51K",5
MQYKLILNGKTLEGETYTEAVDAARAEKVFKQYANDNGVDGEWTYDRATKTFTVTK,4.0325184,"K13E, T17Y, T25R, D47R, E56K",5
MQFKLILVGKTLKGGTTTEAVDAATAEKVFKQYANDNGVDGEWTYDRATKTFKVTE,3.7966628,"Y3F, N8V, E15G, D47R, T53K",5
MQYKLLFNGKTLKGETTTEAVDAATAEKVFKQYARRNGVDGEWTYDRATKTFTVTE,0.030976616,"I6L, L7F, N35R, D36R, D47R",5
MQYKLILNGKTLKGETTTEAWDAYTAEKVFKQYAYDNGVDGEWTYDRATKTFTVTY,1.3229903,"V21W, A24Y, N35Y, D47R, E56Y",5
MQYKLILNGKTLKGETTTEAVDAATAERVFKQYANDNLVDGGWTYDRATKTFTKTE,-1.4285091,"K28R, G38L, E42G, D47R, V54K",5
MQYKLILNGKTLKGETTIEAVDIATAEKVFKQYANDNGVDGEWTYDRATKTITVTY,-2.9374819,"T18I, A23I, D47R, F52I, E56Y",5
MQYKLILNGKTLKGETTTEKVDAATAERVFKQYANDNWVDGEWTYDRATKTLTVTE,1.0931877,"A20K, K28R, G38W, D47R, F52L",5
MQYKLILNGKTLKGETTTELVDAARAEKVFKQYVNDNGVDGEWTYKRATKTFTVTE,2.853145,"A20L, T25R, A34V, D46K, D47R",5
MQYKLILNGKTLKGETTTEAVRMATAEKVFKQYANDNGVWGEWTYDRATKTFRVTE,2.53633,"D22R, A23M, D40W, D47R, T53R",5
MQYKLILNGKTLKGETTTEAVDAATAEKVFKQYARRNGVDGEWGYDRATKTFTVKE,0.94414455,"N35R, D36R, T44G, D47R, T55K",5
MQYRLILNGKKLKGETTTEAVDAATAEKVFKKWANDNGVDGEWTYDRATKTFTVTE,3.5880704,"K4R, T11K, Q32K, Y33W, D47R",5
MQYKLIRNGKTLVGETTTEAVDAAAAEKVFKQYLNDNGVDGEWTYDRATKTFTVTE,-0.35569584,"L7R, K13V, T25A, A34L, D47R",5
MQYKLILNGKTLKGETTTEAVDAATFEKVFKQYANDNGVDGWWKYDRATKTFTRTE,-4.2414584,"A26F, E42W, T44K, D47R, V54R",5
MQYKLILNGKTLKGITTTEAVDAATAGKVLKQYANDNGVDGEWTYDRATRTFTVTE,-1.464136,"E15I, E27G, F30L, D47R, K50R",5
MQYKLILNGKTLRGETTTEAVDAATAEKVFKRYANDNCVDGEWTYDRRTKTFTVTE,4.9193783,"K13R, Q32R, G38C, D47R, A48R",5
MQYKLRLNGRTLKGETTTERVDAATAEKVFKQYANDNGVDGEWTYDRATKTITVTE,2.660295,"I6R, K10R, A20R, D47R, F52I",5
MQYKLILNGKYLKGETTTEAVDAATKEKRFKQYANDNGVDGEWTWDRATKTFTVTE,0.093046546,"T11Y, A26K, V29R, Y45W, D47R",5
MQYKLILNGKTLKGETTTEAVDAATAEKVFKEWANDNGVDGRWTYDRFTKTFTVTE,2.3184915,"Q32E, Y33W, E42R, D47R, A48F",5
MQYKLILNGKTLKGETTTEAVDARTAEKVFKQYANDNGGWGEWTYDRYTKTFTVTE,0.6012793,"A24R, V39G, D40W, D47R, A48Y",5
MQYKLILNGKTLKQETTTEAMDAATQEKVFKQYANDNGVDGERTYDRATKTFTVTE,-5.116857,"G14Q, V21M, A26Q, W43R, D47R",5
MQYKLTLNGKTLYGETTTEAVDAATAEYVFKQYANDNKVDGEWTYDRATKTFTVTE,0.027154692,"I6T, K13Y, K28Y, G38K, D47R",5
MQYKLKLNGKTFKGETTTYAVDAATAEKVFKQYAKDNGVDGEWTYDRATKTFTVTE,-0.8793287,"I6K, L12F, E19Y, N35K, D47R",5
MQYKLILNGKTLKGETTTEAVDAATAEKVFKRYANDNGVDGRWKYSRATKTFTVTE,6.105308,"Q32R, E42R, T44K, D46S, D47R",5
MQYKLILNGKTLKGHTTTEAVDAATAEKVFKQYANDNGVDGEWTYDRRTRTFTRTE,0.44029835,"E15H, D47R, A48R, K50R, V54R",5
MQYRLILNGKTLKRETTTEAVDAATAEKVFKQYANDIGVDGEWRYDRATKTFTVTE,2.3302746,"K4R, G14R, N37I, T44R, D47R",5
MQKKLILNGKTLKGETTTEARDAATAEKVFKQYANDNGVDGEWHYDRATKTITVTE,-1.7457079,"Y3K, V21R, T44H, D47R, F52I",5
MQYKLILNGKTLRGETTTEAVDAATAERVFKQYANDRGWDGEWTYDRATKTFTVTE,-2.083831,"K13R, K28R, N37R, V39W, D47R",5
MQYKLILNGKTLKGETTTRAVDAYTARKVFKQYANDNGVWGEWTYDRATKTFTVTE,2.1399662,"E19R, A24Y, E27R, D40W, D47R",5
MQYKLILNGKTLKGETYTEAVAAATAEKVRKQYANDNGVDGEWTYDRATKTLTVTE,-2.3687143,"T17Y, D22A, F30R, D47R, F52L",5
MQYKLILNGKTYLGEKTTEAVDAATAEKVFKQYANDNGVDGEWTYDRATKTLTVTE,-0.053376902,"L12Y, K13L, T16K, D47R, F52L",5
MQYKLILNGKTYKGRTYTEAVRAATAEKVFKQYANDNGVDGEWTYDRATKTFTVTE,3.2991164,"L12Y, E15R, T17Y, D22R, D47R",5
MQYKLILNGKTLKGETCTEARNAATAEKVFKQYANDNGVDGEWTYDRATKTFTVTR,4.0109224,"T17C, V21R, D22N, D47R, E56R",5
MQYRLILNGKTLKGETTTEAVDAYTAEKVFKQYLNDNGVDGEMTYDRATKTFTVTE,-2.2935789,"K4R, A24Y, A34L, W43M, D47R",5
MQYKRILNGKTLKGETTTRAVDAATAEKVFKQYINDNGVDGEWTYDRATKTFTVTK,-4.101325,"L5R, E19R, A34I, D47R, E56K",5
MQYKLILKGKTLKGETWTEAVDAATAEKVFKQLANRNGVDGEWTYDRATKTFTVTE,5.3873672,"N8K, T17W, Y33L, D36R, D47R",5
MQYKLILNGKRLKGETTTEAVDAATAEKVAKQYANDNGVDGEWTYDRATKTVTVTR,-3.8233552,"T11R, F30A, D47R, F52V, E56R",5
MRYKLILNGKTLKGETTTEAIDAATAEKVFKQYANDNGVDGEWTYYRATKTFTVTR,3.8726172,"Q2R, V21I, D46Y, D47R, E56R",5
MQYDLILNFKTLKGETTTEYVDAATAEKVWKQYANDNGVDGEWTYDRATKTFTVTE,-0.43737784,"K4D, G9F, A20Y, F30W, D47R",5
MQYKLILNGKTLKGETTTGHVDAATAEKVFKQYAKDNGVDGEWTYDRATKTFTVKE,-0.88962924,"E19G, A20H, N35K, D47R, T55K",5
MQYKLKLNGKTLKGETTTEAVDAARAEKVFKQYANRNGVDGEWTYDRRTKTFTVTE,6.485341,"I6K, T25R, D36R, D47R, A48R",5
MQYKLIRNGKTLKGETTTEYVDAYTAEKVFKQYANDNGVDTEWTYDRATKTFTVTE,-2.7949336,"L7R, A20Y, A24Y, G41T, D47R",5
MQYKLILNGKTLKGETTTEAVDAATARKVFKQYANDNGVDGEWTYYRATKTSTVGE,-5.8760138,"E27R, D46Y, D47R, F52S, T55G",5
MQYRLILNGKTLKGETTTEYVDAATAEKVFKQYANDNGVDGEWTYPRATKRFTVTE,-0.03590329,"K4R, A20Y, D46P, D47R, T51R",5
MQYKLILNGKTYKTETTTEAVDRATAEKVFKQYANDNGVDGEWTYDRAHKTFTVTE,-1.5866613,"L12Y, G14T, A23R, D47R, T49H",5
MQYKLILNGKRLKGETLTEAVDAATAEKVFGQYANRNGVDGEWTYDRATKTFTVTE,-1.6308664,"T11R, T17L, K31G, D36R, D47R",5
MQYKLIRNGKTLKRLTTTEAVDAATARKVFKQYANDNGVDGEWTYDRATKTFTVTE,-4.7411647,"L7R, G14R, E15L, E27R, D47R",5
MQYKLILNGKTLKGETTTEYVKRATAEKRFKQYANDNGVDGEWTYDRATKTFTVTE,1.3931735,"A20Y, D22K, A23R, V29R, D47R",5
MQYKLILNGKTLKGETTTEAVFAATAEKVFKQYANQNGVDGEFTYDRFTKTFTVTE,1.0286423,"D22F, D36Q, W43F, D47R, A48F",5
MRYKLILNGKTLKGETTTECRDAATAEKVFKQYARDNGVDGEWTYDRATKTFTVTE,1.0291781,"Q2R, A20C, V21R, N35R, D47R",5
MQYKLILNGKPLKGYTTIEAVDAATAEKVFKQYANDNGVDGEWYYDRATKTFTVTE,3.1269498,"T11P, E15Y, T18I, T44Y, D47R",5
MNYKLILNGKTLKGETTTEAVDRATAEKVFKQYANDRGVDGEWTYDRDTKTFTVTE,0.12361906,"Q2N, A23R, N37R, D47R, A48D",5
MQYKLILNGKGLLGETTTEAVDAATAEKVFKQYANDNGVDGEWTYDRATKTFTRRE,-2.48225,"T11G, K13L, D47R, V54R, T55R",5
MQYKLILNGKTLKGETTTMAVKAATAEKVFKQYRNDNGVDGEWTYARATKTFTVTE,0.1738854,"E19M, D22K, A34R, D46A, D47R",5
MRYKLILKGKTLKGETTTEAVDAAYAEKVFWQYANDNGVDGEWTYDRATKTFTVTE,-0.09244521,"Q2R, N8K, T25Y, K31W, D47R",5
MQYKLILNGKTLKGETTTEAVDRATAEKVFKQYANDNGYDGEWTYDRATKKFTRTE,-4.598885,"A23R, V39Y, D47R, T51K, V54R",5
MQYKLILNGKTLKGEATTEAVDAATAEKVFVQRANKNGVDGEWTYDRATKTFTVTE,-2.5939476,"T16A, K31V, Y33R, D36K, D47R",5
MKYKLILNGKTLKGETTTEAVDAATAEKVFKQYANDNGVLKEWTYDRATKTFRVTE,-1.1007594,"Q2K, D40L, G41K, D47R, T53R",5
MQYKLILNGKTLKGETTTEAVDAATAEKVFKQYARDNYVWGEWTYRRATKTFTVTE,1.3330734,"N35R, G38Y, D40W, D46R, D47R",5
MQYKFILNGKTLKGETTTEAVDAYTAEKVFKQRANDWGVDGEWTYDRATKTFTVTE,2.9637759,"L5F, A24Y, Y33R, N37W, D47R",5
MQYKLILNGKTLKGETTTEAVDAATARKVLKQYARDNGVDGEWTYRRATKTFTVTE,-5.4661307,"E27R, F30L, N35R, D46R, D47R",5
MQYKLILNGKTLKGETTLEAVDAATAEKVFKQYANDNTRDGEWTYDRATRTFTVTE,-0.45130807,"T18L, G38T, V39R, D47R, K50R",5
MKYKLMLNGKTLKGETTTEAVDAATAEKVFKQYANDQGRDGEWTYDRATKTFTVTE,-0.54375494,"Q2K, I6M, N37Q, V39R, D47R",5
MQYKLILNGKTLKGITTTEAVDAFTAEKVFKQYCNDNGVDREWTYDRATKTFTVTE,0.48540357,"E15I, A24F, A34C, G41R, D47R",5
MQYKLILNGKTLKGETITEAVDAATAEKVFKQYANWNGVDGEWTYDRATRTITVTE,1.2024267,"T17I, D36W, D47R, K50R, F52I",5
MQYRWILNGKTLKGETTTEAVDAATAEKVFKNYANDNGVYGEWTYDRATKTFTVTE,3.8409107,"K4R, L5W, Q32N, D40Y, D47R",5
MQYKLILNGKTLKGETTTPAVDAATAEKVFKQYANDNGVDLEWTYDRATKLFTVTR,-0.55749273,"E19P, G41L, D47R, T51L, E56R",5
MQYKLILNHKTLKGETTTEAVDRATAEKVFKQYAKDNGVDGEWTYDRARKTFTVTE,-4.5021386,"G9H, A23R, N35K, D47R, T49R",5
MQYKLILRGGTVKGETTTEAVDAATAEKRFKQYANDNGVDGEWTYDRATKTFTVTE,4.72962,"N8R, K10G, L12V, V29R, D47R",5
MQYKLILNGKTLKGEQTTEAVDAARAEKVFKQYRNRNGVDGEWTYDRATKTFTVTE,1.238575,"T16Q, T25R, A34R, D36R, D47R",5
MQYKLILRGKTLKGETTTEAVDAATAEKVFKQYANDNFVDGEWTYHKATKTFTVTR,2.9034383,"N8R, G38F, D46H, D47K, E56R",5
MQYKLILNGKTLKGETTTEAVDAATAEKVFKQYANYNKVDGEWTYDRATKTFTVYR,2.1325083,"D36Y, G38K, D47R, T55Y, E56R",5
MQYKLILNGKTLKGELTTRAVDAATAEKVFKQYANDNGVDREWTYDRATKRFTVTE,-0.6565229,"T16L, E19R, G41R, D47R, T51R",5
MQYKVILNGKRLKGETTIEAVDAATAEKVFKQYYNDNGVDGEWTYDRATKTFTVTE,-0.6009879,"L5V, T11R, T18I, A34Y, D47R",5
MQYKYILNGKRLGGETTTEAVDAATAEKVFKQYANDNGVDGEWTYNRATKTFTVTE,1.2908096,"L5Y, T11R, K13G, D46N, D47R",5
MQYKLILNGKTLKGERTTEAVDAATAEKVFKQWANDNGVDGEWTVERATKTFTVTE,1.7110367,"T16R, Y33W, Y45V, D46E, D47R",5
MQYKLILQGKTLKGETTCEAVDAATAERVFKQYLNDNGVDGEWTYDRATKTFTVTE,0.89668256,"N8Q, T18C, K28R, A34L, D47R",5
MQYYLILNGKTLKGETTTEAVDRATAEKVFKQYANDNGVDGEWIYDRATRTFTVTE,1.0856808,"K4Y, A23R, T44I, D47R, K50R",5
MQYKLILNGKLLKGETTTEAVSAATAEKVMKQYANDNGVDGEWTYIRATKTFTVTE,3.3288975,"T11L, D22S, F30M, D46I, D47R",5
MQYKLKLNGKTLKGETTTEAVDAATARKVFKKYANDNGVDGEWTYDRARKTFTVTE,-1.1844513,"I6K, E27R, Q32K, D47R, T49R",5
MQYKLILNGKTLKGETTTEAVDAATARKVFKQYARDNGVDGRWTYDRATKTFTKTE,-5.28093,"E27R, N35R, E42R, D47R, V54K",5
MRYKLILNGKTLKGETTTRAVDRATAERVFKQYANDNGVDGEWTYDRATKTFTVTE,1.662945,"Q2R, E19R, A23R, K28R, D47R",5
MQYKLILNGKTLKGETTTSAVDAATAEKKFKQYANDKGVDGELTYDRATKTFTVTE,-1.5911708,"E19S, V29K, N37K, W43L, D47R",5
MQYKLILNGKTLWGETTTEAVDAARAEKVFKQYANDNGVDGEWRYDRRTKTFTVTE,6.562508,"K13W, T25R, T44R, D47R, A48R",5
MQYKYILNWKTLKRETTTEAVDAATAEKVFKQYANDNGVDGEWTYDRARKTFTVTE,-0.21704534,"L5Y, G9W, G14R, D47R, T49R",5
MQYKLVLNGKTLKGYTTTEAMDAATAEKVLKQYANDNGVDGEWTYDRATKTFTVTE,4.4331713,"I6V, E15Y, V21M, F30L, D47R",5
MQYKLILIGKTLKGETMTEAVDAATAEKVFKQYANDNGVDGEMTYDRATKTFTVKE,-1.7369205,"N8I, T17M, W43M, D47R, T55K",5
MQYKLILNGKTLKGETTTEAVDFATAEKRFKQYANDNGVDGYWTYDRYTKTFTVTE,1.6241248,"A23F, V29R, E42Y, D47R, A48Y",5
MQWKLILNYKTLKGETTTEAVRAATAEKVFKQYANDNGVDGERTYDRATKTFTVTE,-2.5732198,"Y3W, G9Y, D22R, W43R, D47R",5
MQYKLILNGKTLKHETTTEAVDAATAEKVFKQYARDNGYDGEWTYDRATKTFRVTE,-3.985029,"G14H, N35R, V39Y, D47R, T53R",5
MQYKLYLPGKTLKGETTTEAVDAYTLEKVFKQYANDNGVDGEWTYDRATKTFTVTE,-1.4606655,"I6Y, N8P, A24Y, A26L, D47R",5
MQYKLILAGKTRKGETTTEAVDAATAERVFKQYANDNGWDGEWTYDRATKTFTVTE,-2.5001936,"N8A, L12R, K28R, V39W, D47R",5
MYYKLILNGKTYKGELTQEAVDAATAEKVFKQYANDNGVDGEWTYDRATKTFTVTE,2.7253718,"Q2Y, L12Y, T16L, T18Q, D47R",5
MQYKLIVNGKTLKGETTTEAVDAATAEKVFKQYANDNGVDGRWRYDRATKTFTRTE,0.4335612,"L7V, E42R, T44R, D47R, V54R",5
MQYKLILNGKTLKGETKTEAVDAATARKVMKQWANDNGVDGEWTYDRATKTFTVTE,-2.9672828,"T17K, E27R, F30M, Y33W, D47R",5
MQYKLILNGKTLKGETTYEAVDAYTAEKVFKQYANDNGVWGEWTYYRATKTFTVTE,8.026514,"T18Y, A24Y, D40W, D46Y, D47R",5
MQYKLRLNGKTLKGETKTEAPDAATAEKVFKQYANDNGVDGEWTYDRATKTFTVIE,3.949486,"I6R, T17K, V21P, D47R, T55I",5
MQYKLILNGKTLKGETTTEAVDAATAERVFKQYARDNGVDGEWRYDRATKKFTVTE,-0.2011354,"K28R, N35R, T44R, D47R, T51K",5
MQYKLILNGKTLKGETTTEAVDRATAEKVFKQRANDRGVDGEITYDRATKTFTVTE,-4.8841653,"A23R, Y33R, N37R, W43I, D47R",5
MQYKLILNGKRLKPETTTEAVDAATAEKKFKQYANDRGVDGEWTYDRATKTFTVTE,1.6122699,"T11R, G14P, V29K, N37R, D47R",5
MQYKLILNGKTLKRETTTEAVDAATAERVFKRYANDNGVMGEWTYDRATKTFTVTE,2.343404,"G14R, K28R, Q32R, D40M, D47R",5
MQYKLILHGKTLKGETKTEAVDAYTAEKVFKQYANDNLVDGEWTYDRATKTFTVTE,6.409813,"N8H, T17K, A24Y, G38L, D47R",5
MQYKLRLNGKRLRGEGTTEAVDAATAEKVFKQYANDNGVDGEWTYDRATKTFTVTE,3.4552703,"I6R, T11R, K13R, T16G, D47R",5
MQYRLILNGKTLKGETTLEAVDAATAEKVFKQYANDNGVDGEWTYHRATKTFTVRE,4.319937,"K4R, T18L, D46H, D47R, T55R",5
MQYKLILNGKTLRGETTTEAVDAATAEKVFRQYANQNGVDGEWYYDRATKTFTVTE,3.471522,"K13R, K31R, D36Q, T44Y, D47R",5
MQYKLILNGKTLKGETTTEAVDYARAEKKFKQYANDNGVDGEWTYDRATKTWTVTE,-3.5454125,"A23Y, T25R, V29K, D47R, F52W",5
MQYKLYLNQKTLKGETTTEAVDRATAEKVFKQYANDNGVDGEWTYDRATKTFTVTA,-1.3755596,"I6Y, G9Q, A23R, D47R, E56A",5
MQYKLILNGKTLNGEITTEAVDAATAEKVFKQYANDNGLDGEWTRDRATKTFTVTE,1.632662,"K13N, T16I, V39L, Y45R, D47R",5
MQYKLILNGKVLKGETTTEAVDRATAEKVFKQYANRNGVDGEWTYDRARKTFTVTE,1.4225447,"T11V, A23R, D36R, D47R, T49R",5
MQYKLILRGKTLKGETTTEAVSAATAEKVFKQYANDNGVDGEWTYDRATNTFRVTE,5.060963,"N8R, D22S, D47R, K50N, T53R",5
MQYKLILKGKTLKGETTTEAVDAATAEKVFKRYANDNGRDGEWTYKRATKTFTVTE,1.3118086,"N8K, Q32R, V39R, D46K, D47R",5
MQYKLILNGHTLKGETTTEARDAATAEKVFKKYKNDNGVDGEWTYDRATKTFTVTE,-0.27495617,"K10H, V21R, Q32K, A34K, D47R",5
MQYKLILNGKTLKEETTTEAVDAATMEKVFKQYAYDNGVDGEVTYDRATKTFTVTE,-5.8400593,"G14E, A26M, N35Y, W43V, D47R",5
MQVKLILNGKTLKGETTTEAVDAATAEKVFKRYANDNGVDGEWTYDRATKTLTRTE,-3.7714493,"Y3V, Q32R, D47R, F52L, V54R",5
MQYKLILNGKTLKGEFTTEAVDTARAEKVFKQYANDNGVDGKWTYDRATKTFTVTE,3.8995817,"T16F, A23T, T25R, E42K, D47R",5
MQYKLILNGKTLKGETTREAVRAATAEKVFKQYANDNGVDGELTYDRATRTFTVTE,-1.0360835,"T18R, D22R, W43L, D47R, K50R",5
MQYKLILNGKRTKGPTTTEAVDAATAEKVFKQYARDNGVDGEWTYDRATKTFTVTE,-3.068718,"T11R, L12T, E15P, N35R, D47R",5
MMYKLILSGKTLKGETTTYAVDAATAEKVFKQYANDNGVKGEWTYDRATKTFTVTE,5.325317,"Q2M, N8S, E19Y, D40K, D47R",5
MQYKLRLNGKTLKGETTTEARDAATAEKVFKQYANDNGVDGEWSYDRAAKTFTVTE,5.4562006,"I6R, V21R, T44S, D47R, T49A",5
MQYKLILNGKTLKGETTTKAVDAATAEKRFKQYANDNKVDGEITYDRATKTFTVTE,-0.40014586,"E19K, V29R, G38K, W43I, D47R",5
MQYKLILNGKTLKGETTTEAVDAATAEKVFKQYKNDRGVDGKWTYDRATKTFTKTE,-4.5129833,"A34K, N37R, E42K, D47R, V54K",5
MQYKLILNGKTIKGETTTEAVDAATWEKVFKQYANDNGVDGRWTYDRATKTFTRTE,-4.026031,"L12I, A26W, E42R, D47R, V54R",5
MQYKLKLNGWTLKGETTTEAVDAATARKVFKQYANDNYVDGEWTYDRATKTFTVTE,-2.2791066,"I6K, K10W, E27R, G38Y, D47R",5
MQYKLILNGKTFGGETTTEAVDAYTAEKVFKQYANDNGVDGEWTYDRATKTVTVTE,1.6150919,"L12F, K13G, A24Y, D47R, F52V",5
MRYKLILNGKTLKGETITEAVDAATAEKVFKQYANDNLVDGEYTYDRATKTFTVTE,-0.73565936,"Q2R, T17I, G38L, W43Y, D47R",5
MQKKLRLNGKTLKGETTTEAVDAATARKVFKQYANDNGVDGEWTYDRATKTVTVTE,-5.8393726,"Y3K, I6R, E27R, D47R, F52V",5
MQYKLILTGKTLKGETYTEAVDAATLEKVFKQYANDNYVDGEWTYDRATKTFTVTE,-0.8654127,"N8T, T17Y, A26L, G38Y, D47R",5
MQYKRILNGKTLKGETTTEAVDAARAEKVFKQYARDNGVDGEWTYDRATKRFTVTE,-3.4228697,"L5R, T25R, N35R, D47R, T51R",5
MQAKLILNGKTLKGETTTEAVDAATAEKVFKQYANDNWVDGEWTYRRATKTFTHTE,-0.047055192,"Y3A, G38W, D46R, D47R, V54H",5
MQYKLILNGKYLKGETTTEAVNAATAEKVVKQYARDNGVDGEWTYDRATKTFTVTE,-2.1332917,"T11Y, D22N, F30V, N35R, D47R",5
MQYKLILNGRTLKGETTLEAVDRATAEKVFKQYARDNGVDGEWTYDRATKTFTVTE,-2.7488103,"K10R, T18L, A23R, N35R, D47R",5
MQYKLILKGKTLKKERTTEAVDAATAEKVFKQYANDNGVDWEWTYDRATKTFTVTE,-1.5096797,"N8K, G14K, T16R, G41W, D47R",5
MQYKLILNGKSLKGETTTYAVDAATAEHVFKQYANDNGVDGEWTYDRATKTFSVTE,2.495256,"T11S, E19Y, K28H, D47R, T53S",5
MQYKLILNAKTLKGETTTRAVDAATAEKVFKRYANDNGVDGEWTWDRATKTFTVTE,5.7663064,"G9A, E19R, Q32R, Y45W, D47R",5
MQYKLILNGKGLKGETLTERVDAATAEKVFKQYRNDNGVDGEWTYDRATKTFTVTE,-0.4833021,"T11G, T17L, A20R, A34R, D47R",5
MQYKLILNGKTLKGEGTTEAVDAATAEKVFKQYANDHGVDGEWGYDRHTKTFTVTE,3.452481,"T16G, N37H, T44G, D47R, A48H",5
MQYKLILNGKTLKGETTTEAVDAATAEKVFKQYANDNGYDGRWTYDRARKTFTVTR,1.5762601,"V39Y, E42R, D47R, T49R, E56R",5
MQYKLILNGKTLKGETTTRAVRAATAEKVFKQYANDNGVDVEITYDRATKTFTVTE,-4.3547416,"E19R, D22R, G41V, W43I, D47R",5
MQYKLILNGKTLKGETTLEAVDAATAEKVFKQYANDNGVDGEWTYDRATKKWTVRE,-0.71453124,"T18L, D47R, T51K, F52W, T55R",5
MQYKLILNGKTLKGETTTEAVDAATAEKRFKQYVNDNGVDGEWTYDRATKTFQVTK,2.5423217,"V29R, A34V, D47R, T53Q, E56K",5
MQLKLILNGKTLKGETTTEAVRAATAEKVFKQYANDNGVDVEWTYDRATKTFTVWE,-0.9262004,"Y3L, D22R, G41V, D47R, T55W",5
MQPKLILNRKTLKGETTTEAVDAATAEKVFKQYANDNGVDGEWTYRRATKTYTVTE,-3.078219,"Y3P, G9R, D46R, D47R, F52Y",5
MQYKLILNGKTLKGETTTEAVRAATAEKVFKKYANDNGVDGWATYDRATKTFTVTE,-0.18928558,"D22R, Q32K, E42W, W43A, D47R",5
MQYKLILNGKTLKGETTTEAVDAATAEKRFRQYANDNGVRGEWTYDRATKTFTVTG,3.055149,"V29R, K31R, D40R, D47R, E56G",5
MQKKLKLNGKTLKGETTTEAVDAATAEKVRKQYANDNGVDGEWTYDRATKTFRVTE,-3.9107723,"Y3K, I6K, F30R, D47R, T53R",5
MQYKLILNGKTLKGKTTTEAVDAATAEKVYRQYWNDNGVDGEWTYDRATKTFTVTE,-2.6758828,"E15K, F30Y, K31R, A34W, D47R",5
MQYFLQLNGKTLKGETTTEAVDAATAEKVFKDYANDNGVDGRWTYDRATKTFTVTE,2.2423,"K4F, I6Q, Q32D, E42R, D47R",5
MRYKLILNGKTLKGETTGEAVDAATAEKVFKQYAKDNGVDGVWTYDRATKTFTVTE,0.21052584,"Q2R, T18G, N35K, E42V, D47R",5
MQYKLILNGKTLKGETTTEAVDARTAEKVFRQYARDNGVDGEWTYDRATKTFTVTV,-3.5609667,"A24R, K31R, N35R, D47R, E56V",5
MRYKLILNGKTLKGETTTEAVDAATAEKVFRQYANDNGVDGEWRYDRATKTFTRTE,-1.6007164,"Q2R, K31R, T44R, D47R, V54R",5
MQYKLILNGKTLKGEFTTEAVDAATAVKVFKRYANDNGVDGEVTYDRATKTFTVTE,-5.683725,"T16F, E27V, Q32R, W43V, D47R",5
MQYKLILNGKTLKGETTTEAVDAATAEKVFKQYANDNTVDREWTYDRATKTFTVYL,-4.277416,"G38T, G41R, D47R, T55Y, E56L",5
MQYKGILNGKTLKGETTTEAHDAATAEKVFKQYANDNGAYGEWTYDRATKTFTVTE,1.3674201,"L5G, V21H, V39A, D40Y, D47R",5
MQYKLVLNGKTLKGETLTEAVDAATAEKVFKQYCNDNGVDGEWTYDRRTKTFTVTE,4.627259,"I6V, T17L, A34C, D47R, A48R",5
MQYKLILNGKTLKGELTTRAYDAARAEKVFKQYANDNGVDGEWTYDRATKTFTVTE,5.9879456,"T16L, E19R, V21Y, T25R, D47R",5
MQYKLILNGKTLIGETTTEAVDAATWEKVFKQYANDNGVDGEITYDRATKTFTKTE,-4.6306977,"K13I, A26W, W43I, D47R, V54K",5
MQYKLILNGKTLKGLTTTEAVDAATAEKVFKQVANDLGVDGEWTYDRATKRFTVTE,2.0331943,"E15L, Y33V, N37L, D47R, T51R",5
MQYKLILNGKTLKGETTTEAVDAATAEKRAKQYARDNGVDGEKTYDRATKTFTVTE,-5.0124,"V29R, F30A, N35R, W43K, D47R",5
MQYKLILNGKTAKGETTTEAVDARRAEKVFKQYANDNGVDGEWTYKRATKTFTVTE,3.291218,"L12A, A24R, T25R, D46K, D47R",5
MQYKLILNGKTLKGEYTTEAVDAATAEKVFKQYARDWGVDGEWVYDRATKTFTVTE,-3.3134549,"T16Y, N35R, N37W, T44V, D47R",5
MQYRLILNGKTLKGETTTEAVDAATAEKVFKQWANDNGVDGEWTYDRATKTFTRQE,-1.4210306,"K4R, Y33W, D47R, V54R, T55Q",5
MQYRLILNGKTLKGERLTEAVDAATAEKVFKQYANDNGVDGEWEYDRATKTFTVTE,4.5469737,"K4R, T16R, T17L, T44E, D47R",5
MQYKLILNGKTLKGETTIEAVDRARAEKVFKQYANDNGVDGYWTYDRATKTFTVTE,2.786971,"T18I, A23R, T25R, E42Y, D47R",5
MQYKLKLNGKYLKGETTTEAVDAATAEKRFKQYANDNGVDGEWTYDRARKTFTVTE,5.198,"I6K, T11Y, V29R, D47R, T49R",5
MQYRLILNGKTLKGETTTEAVDAATAEKVFKQYANLNMVDGGWTYDRATKTFTVTE,4.6596518,"K4R, D36L, G38M, E42G, D47R",5
MQYKHILNGGTLKGETTTEAVDAATAEKVFKQYANRNGVDGEWTYDRATRTFTVTE,2.5754235,"L5H, K10G, D36R, D47R, K50R",5
MQYRLILNGKTLGGETTTEAVDAATARKVFKQYANDNGVDGEWTYDRATKTFRVTE,-2.2976747,"K4R, K13G, E27R, D47R, T53R",5
MQYKLILNGKTLKGETTREAVDAATAEKVFKQYANDNIVDGEWTYDRATKTFTLTR,0.83563125,"T18R, G38I, D47R, V54L, E56R",5
MQYKLILNGKTLKGETTTEMVDAYTARKVFKQYARDNGVDGEWTYDRATKTFTVTE,-4.775697,"A20M, A24Y, E27R, N35R, D47R",5
MQYKLILNGKTLKGETTTEAVRAYTAEKVFKQYANDNGVDGEITYDRATKTFTVYE,0.36506128,"D22R, A24Y, W43I, D47R, T55Y",5
MQYKLILNGKTLKGETTTPAVDAATAEKVFKQYANDNWVDGHFTYDRATKTFTVTE,0.12978813,"E19P, G38W, E42H, W43F, D47R",5
MQYKLKLNGKTLKGETTVEAVDAATAEKVFKQYANKNGVDGEWTYDRATRTFTVTE,5.450708,"I6K, T18V, D36K, D47R, K50R",5
MQYKLIRNGKTLKGETTLEAVDAATAEKVFKQYANDNGVDGEWTYVRARKTFTVTE,2.4967265,"L7R, T18L, D46V, D47R, T49R",5
MQYKLILNGKTLKGETTTEAVDAATAERVFKQYARRNGVYGEWTYDRATKTFTVTE,1.3516316,"K28R, N35R, D36R, D40Y, D47R",5
MQYKLILNGKTLKRETTTEAVDAATALRVFKRYANDNGVDGEWTYDRATKTFTVTE,-3.9733155,"G14R, E27L, K28R, Q32R, D47R",5
MQYKLILNGKTLKGETTTEAVDRATAEKRFKQYANDNGVDGEWTYDRYRKTFTVTE,3.2524385,"A23R, V29R, D47R, A48Y, T49R",5
MQAALILNGKTLKGETTTEAVDAATAERVFKQYLNDNGVDGEWTYDRATKTFTVTE,-1.7135458,"Y3A, K4A, K28R, A34L, D47R",5
MQYKLILNGKTLKGETKTEYVDAATAEKVFKQYANDNGVDGEWRYDRATKTFEVTE,3.4388578,"T17K, A20Y, T44R, D47R, T53E",5
MQYKLILNGKTLKGETTTEAVDAATAEKVFKQYANDNGVDYEWTYDRKTKKFTITE,-0.5167359,"G41Y, D47R, A48K, T51K, V54I",5
MQYKLILNGKTLDGETTTEAVDAARAEKVFKQYLNDNGVDGEWTYDRATKTFTLTE,0.84370714,"K13D, T25R, A34L, D47R, V54L",5
MQYKLILRGKTLKGETTTEAVDAATAEKVFKQYTNKNGVDGEWTYDRATKTFYVTE,3.0789068,"N8R, A34T, D36K, D47R, T53Y",5
MLYKLILNGKTLKGETTTEAYDAATAEKVFKQYFNDNGVDGEWTYDRATKYFTVTE,1.2970729,"Q2L, V21Y, A34F, D47R, T51Y",5
MQYKLILNGKTLRGETTTEAVDAATAEKVFKQYANDMIVDGEWTYDRATKTFTVTR,0.58142024,"K13R, N37M, G38I, D47R, E56R",5
MQYKLILNGKTDKGETTTEAVDAATAERVFKQYVNDNGYDGEWTYDRATKTFTVTE,-3.1052368,"L12D, K28R, A34V, V39Y, D47R",5
MQYKLHLEGKTLKGETTTEAVDAATAEKRFKQYANDNGVDGEWTYDRATKTFTVTA,4.6611924,"I6H, N8E, V29R, D47R, E56A",5
MQYKLYRNGKTLKGETTTEAVDAATIERVFKQYANDNGVDGEWTYDRATKTFTVTE,-0.7221359,"I6Y, L7R, A26I, K28R, D47R",5
MQYKGILNGKTLGGETTTEAVDAATAEIVFKQYANDNGVDGEWTYDRKTKTFTVTE,1.2221317,"L5G, K13G, K28I, D47R, A48K",5
MQYKLILNGKKLKGETTTEAVDAATAEKVFRQYANVNGVDREWTYDRATKTFTVTE,-3.3776717,"T11K, K31R, D36V, G41R, D47R",5
MQYKLILNGKTLKGETTTEAVIARTAEKVFKQYANDNGVDGEWTYDRTTKTFWVTE,4.1757026,"D22I, A24R, D47R, A48T, T53W",5
MQYKLILNGKTLKGETTKEAVDAARAEKVFKQYANDNGVDGEVTFDRATKTFTVTE,-0.5874184,"T18K, T25R, W43V, Y45F, D47R",5
MQYKLILNGKTLKGEITKEAVDKATAEKVFKQYANDNGVDGEWTYDRATKTVTVTE,-2.3276508,"T16I, T18K, A23K, D47R, F52V",5
MRYKLILNGKTLKGETTTEAVDRATAEKVVKQYANDNGVDGEWTYDRATKTWTVTE,-3.6786516,"Q2R, A23R, F30V, D47R, F52W",5
MQYKVILNGRTLKGETTTEAVRAATAEKVFKQYANKNGVDGEWTYDRATKTFTVTE,5.1010303,"L5V, K10R, D22R, D36K, D47R",5
MQYKLILNGKTLKGETTTFAVDAATKEKVFKQYANDNGVDGEWTYDRATKRFTVKE,-0.11651177,"E19F, A26K, D47R, T51R, T55K",5
MQYKLILNGFTLKGETTTELVDAATAEKVFKQYANDNWVDGEWTYDRETKTFTVTE,3.0568283,"K10F, A20L, G38W, D47R, A48E",5
MQYKLILNGKTLKGETTTWAYDAATAEKVFKQYARDNGVDGEWTYDRATKTFYVTE,0.45184937,"E19W, V21Y, N35R, D47R, T53Y",5
MQYKLILNGKTLKGETTTEAVDAATAERVFKQYWNDNRVDGEWHYDRATKTFTVTE,-1.9495897,"K28R, A34W, G38R, T44H, D47R",5
MQYKLILNGKTLKGETTTEAVDAATAERVFKQYANDNWVDGEWVYDRATKQFTVTE,2.678862,"K28R, G38W, T44V, D47R, T51Q",5
MQYKLILNGKTLKGETTTEAVARATAEKVFRQYANDNGVDGEWTYDRATKTFRVTE,0.30917698,"D22A, A23R, K31R, D47R, T53R",5
MQYKLILNAKTLKGETTTEAVDAATARKVFKQYANDNWVDGEWTYDRRTKTFTVTE,-2.184599,"G9A, E27R, G38W, D47R, A48R",5
MQYTLILNGKTLKHETTTEAVDRATAEKVRKQYANDNGVDGEWTYDRATKTFTVTE,-5.220986,"K4T, G14H, A23R, F30R, D47R",5
MQYKLILNGKTLKGETTTEAVDAATAFKVFKQYMNDNGVDGEWTYDRWTKTFTVRE,-1.7623829,"E27F, A34M, D47R, A48W, T55R",5
MQYKLILNGKTLKGERTTEAVDAARARKVFKQYANDRGVDGEWTYDRATKTFTVTE,-2.0051894,"T16R, T25R, E27R, N37R, D47R",5
MQIKLILNGKKLKGETTTEAVDAATAEKVLKQYANDNGVDGEWTYDRATKTFTVTR,0.10718542,"Y3I, T11K, F30L, D47R, E56R",5
MQYKLILNGKLLWGATTTEAVDAATAEKVFKQYANDNGVDGEWTYDRATKTFTVTM,2.5284662,"T11L, K13W, E15A, D47R, E56M",5
MQYKLILNGKTLKGETTTWAVDAATAEKVFKQYANDMGVDGEWTYDRATKTFAVRE,3.3212962,"E19W, N37M, D47R, T53A, T55R",5
MQYKLILNGKTLYGETTTEAVDAYTAEKVFKQYANRNGVDKEWTYDRATKTFTVTE,1.1050797,"K13Y, A24Y, D36R, G41K, D47R",5
MTYKLILNGKTLKGETTTEAVDAATAEKVFKQYANRNGVFGRWTYDRATKTFTVTE,7.364721,"Q2T, D36R, D40F, E42R, D47R",5
MQWKLILNGKTLKGETTTEAVDAATAEKVFKKYANDNGIDGEWTYDRATKRFTVTE,5.656189,"Y3W, Q32K, V39I, D47R, T51R",5
MQYKLILNGKTLWGETTTEAVDAATAEKVFKQYARRNGVDGEWTYDRATKTFRVTE,1.3198876,"K13W, N35R, D36R, D47R, T53R",5
MQYKLILNGKTLKGETTTEAVRAARAEKVFKRLANDNGVDGEWTYDRATKTFTVTE,5.49873,"D22R, T25R, Q32R, Y33L, D47R",5
MQYKLIRNGKTLKGETTTEFVDAATAIKVFKQYANDNGVDTEWTYDRATKTFTVTE,-6.12629,"L7R, A20F, E27I, G41T, D47R",5
MQYKLILNGKTLKGETTTEAKDAATAEKVFKQWANDNGVDGEWTYDRATKTFKVTK,2.5602853,"V21K, Y33W, D47R, T53K, E56K",5
MQYKLILNGKTYKGETTTEAVKAYTAEKRFKQYANDNGVDGEWTYDRATKTFTVTE,5.8278565,"L12Y, D22K, A24Y, V29R, D47R",5
MQYKLILNGKTLKGETTTEAVDAWRAEKVFKQYANRNGVDGEWTYDRATKTFRVTE,7.776834,"A24W, T25R, D36R, D47R, T53R",5
MQYKLILLGRTRKGETTTEAVDAATAEKVFKQYLNDNGVDGEWTYDRATKTFTVTE,0.5392485,"N8L, K10R, L12R, A34L, D47R",5
MQYKIILNGKTLKGETTTEAVDAATALKVLKQYANDNGVDGEWTYDRAKKTFTVTE,-3.7035754,"L5I, E27L, F30L, D47R, T49K",5
MQYKLILNGKTLKGETTTELVDAATYEKVFKQYLNDNGVDGEWTYDRAYKTFTVTE,-4.4447746,"A20L, A26Y, A34L, D47R, T49Y",5
