Sequence,Score,Mutations,Number of Mutations
MQYKLILNGKTLKGETTTEACDAYTAEKVFKKYANRNGVDGEWTYDRATKTFTVTE,7.6238294,"V21C, A24Y, Q32K, D36R, D47R",5
MRYKLILNGKTLKGETTTEAVDAATIERVFKQYANDNGVDGEWTYDRATKTFTVIE,1.3611434,"Q2R, A26I, K28R, D47R, T55I",5
MQYKLILNTKTLKGETTTEAVDAATWTKVFKQYANDNGVDGEWTYDRAKKTFTVTE,-4.9191155,"G9T, A26W, E27T, D47R, T49K",5
MRYKLILNGKTLKGETTTEAVDAATAYKVFKQYANDNHVDGEWTYDRATKTVTVTE,-5.2238398,"Q2R, E27Y, G38H, D47R, F52V",5
MQYKLILNGKTLKGETTTEAWDAATAFKVFKSYANDRGVDGEWTYDRATKTFTVTE,-2.7970672,"V21W, E27F, Q32S, N37R, D47R",5
MRYKLILNGKTLKLETTTEAVDAATAEKVFKQYANDNGVDGYKTYDRATKTFTVTE,-2.2491553,"Q2R, G14L, E42Y, W43K, D47R",5
MQYKLIKKGKTLKGEYTTEAVDAATAEKVFKQYANDNGVDGRWTYDRATKTFTVTE,3.07466,"L7K, N8K, T16Y, E42R, D47R",5
MQYKLIRNGKTLKGETTTEAVRAATAEKVFKQYANDNGVDGEWTYLRATKTYTVTE,-0.1132424,"L7R, D22R, D46L, D47R, F52Y",5
MQYKLIYNGKTLTGETTTEAVDAATAIKVFKQYANDNGVDGEWTYDRATKRFTVTE,-2.9239163,"L7Y, K13T, E27I, D47R, T51R",5
MQYKLILNGKTLKGEWTKEAVDWATARKVFKQYANDNGVDGEWTYDIATKTFTVTE,-5.5438128,"T16W, T18K, A23W, E27R, D47I",5
MQYKLILNGKTRKGETTTEAVDAATAIKVFKQYANDNGVDGYWTYDRYTKTFTVTE,-2.366777,"L12R, E27I, E42Y, D47R, A48Y",5
MQYKLILNGKMLRGETTTEAVDAATAEKVFKQYANDNGVWGEWLYDRATKTFTVTE,5.1369486,"T11M, K13R, D40W, T44L, D47R",5
MQYKRILNHKTLRGETTTEAVDAATAEKVFKQYANDNGVDGEWTYDRATKTFRVTE,-1.3662539,"L5R, G9H, K13R, D47R, T53R",5
MQYKLIENGKTLKGETTTEFVDAATAEKVFRQYAKDNGVDGEWTYDRATKTFTVTE,-4.8594623,"L7E, A20F, K31R, N35K, D47R",5
MQYKLILNGKTEKGETTTEAVDAATAERVFKRYANDNGVDGEWTYDRATKTFTVTW,1.1442329,"L12E, K28R, Q32R, D47R, E56W",5
MQYKLIYNGKTLKGETTTEAVDAATTAKVFKQYLNDNGVDGEWTYDRATKTFTVTE,-5.6106725,"L7Y, A26T, E27A, A34L, D47R",5
MQYKLILRGRTLKGETTTEARDAATAEKVFKQYANDNGVYGEWTYDRATKTFTVTE,7.381696,"N8R, K10R, V21R, D40Y, D47R",5
MQYKLILNGKTLRGETTTEIVDAATAEKVFKQYANDNGVDGEWTYDRETYTFTVTE,3.593189,"K13R, A20I, D47R, A48E, K50Y",5
MQYKLILNGKTYKWETTTEAVDAATAEKVLKQYANDNGVDGEWTYDRATKTFTKTE,-3.0410032,"L12Y, G14W, F30L, D47R, V54K",5
MQYHLILNGKTLKGETTTEAVDAATAEKVFKQYANDNGVWGEWTYHRATKTFRVTE,6.0372043,"K4H, D40W, D46H, D47R, T53R",5
MKYKLILNGKTLKGETMTEAVDAATAEKVIKQYANDNGVDGEWTYDRARKTFTVTE,2.976163,"Q2K, T17M, F30I, D47R, T49R",5
MWYKLIQNGKTLKGETTTEAVDAATAEKVFKQYANDNYYDGEWTYDRATKTFTVTE,0.4053538,"Q2W, L7Q, G38Y, V39Y, D47R",5
MQYKLILNGKTLKGETTTEAVFAATAERVFKQYANDNGVDGEVTIDRATKTFTVTE,-3.599937,"D22F, K28R, W43V, Y45I, D47R",5
MQYKLILNGKTLKGERTTEAVDAATAEKVFKQYAKDNGVDGIWRYDRATKTFTVTE,0.42850682,"T16R, N35K, E42I, T44R, D47R",5
MQYKLILNGKTLRGETTTEAVDAATAERVFRQYANDNGVDGEWTYDRRTKTFTVTE,2.6574743,"K13R, K28R, K31R, D47R, A48R",5
MQYKLILNGRTLKGETTTEAVDKATAEKVFKQYANDNWVDGEWTYNRATKTFTVTE,1.9411701,"K10R, A23K, G38W, D46N, D47R",5
MWYKLILNGKTLKGETTTEAVDAATAERVFKQQANDNGVDGEWTYDRATKTFTVTR,1.2200245,"Q2W, K28R, Y33Q, D47R, E56R",5
MQRKLILNGRTLKRETTTEAVDAATGEKVFKQYANDNGVDGEWTYDRATKTFTVTE,-0.29155394,"Y3R, K10R, G14R, A26G, D47R",5
MQYYLKLNGKTLKGETTTSAVDAATAEKVFKQYANDNGVDGEWTYDRYTKTFTVTE,5.0203743,"K4Y, I6K, E19S, D47R, A48Y",5
MQYKFMLNGKVLKGETTTEAVDAATSEKVFKQYANDNGVDGEWTYDRATKTFTVTE,2.4474177,"L5F, I6M, T11V, A26S, D47R",5
MQYKLILNGKTLKGETTTGAVDALTAEKVFKQYRNLNGVDGEWTYDRATKTFTVTE,0.92551565,"E19G, A24L, A34R, D36L, D47R",5
MQYKLIWNGKTLKGETTTRAVDAATAEKVFKQYVNDNGVDGEWTYDRATKTYTVTE,-1.9084443,"L7W, E19R, A34V, D47R, F52Y",5
MQYKLILNGKTLKGETTTEAVDAATAEKVFRQYANDRGVDGEWTYDRATKTFRVTK,-0.34175274,"K31R, N37R, D47R, T53R, E56K",5
MQYRLILNGKTQKGETTTEAVDAAWAEKVFKQYANDNGVDGEWTYDRATKTFTVTR,2.887703,"K4R, L12Q, T25W, D47R, E56R",5
MQYKLILNGHTLKGETTTEAWDAATGEKVFKQYANDNGVDGWWTYDRATKTFTVTE,5.720107,"K10H, V21W, A26G, E42W, D47R",5
MQYLLILNGKTLSGETTTEAVDAATVEKVFKQYCNDNGVDGEWTYDRATKTFTVTE,4.0480556,"K4L, K13S, A26V, A34C, D47R",5
MQYKLILNGKTLKGFTTTRAVDAATAEKVFKQYANDNGVDGEWRYDRAVKTFTVTE,5.4833755,"E15F, E19R, T44R, D47R, T49V",5
MQYKLILNGKTLRGEWTTEAVDAATAEKVFKQRANDNGVDGEWTYRRATKTFTVTE,2.9606578,"K13R, T16W, Y33R, D46R, D47R",5
MQYKLILNGKTLKGETTTEAVDAATAEKRFKQYLNDNGVDGEWTYDRARKTFTVTY,1.4721687,"V29R, A34L, D47R, T49R, E56Y",5
MQYKLILNGKTLKGETTTPAVDAATAEKVCKQYANDNGVDGEWTIDRATKTFTVRE,1.866397,"E19P, F30C, Y45I, D47R, T55R",5
MQYKLILRGKTLKGETTTEAVDRATAEKVFKQYANDNGVDGEWKYDRATKTFCVTE,2.109158,"N8R, A23R, T44K, D47R, T53C",5
MQYKLILNGKTLKGETTTEATDAATARKVAKQYANDNGVDVEWTYDRATKTFTVTE,-5.6668315,"V21T, E27R, F30A, G41V, D47R",5
MQYKLILNGKTLKGETTTEAVDAATAERVFKQYANDNGVYWEWTYTRATKTFTVTE,0.4888959,"K28R, D40Y, G41W, D46T, D47R",5
MQYKLILNGKTLKGETWTEAVDAATAEKVFRQYANDRGVDGEWTYDRRTKTFTVTE,1.8350185,"T17W, K31R, N37R, D47R, A48R",5
MQYKLILNRKTDKGETTTEGVDAATAEKVFKQYANDNGVDGEWTYDRFTKTFTVTE,1.4516884,"G9R, L12D, A20G, D47R, A48F",5
MQYRLILNGKTLKGETTTEAVDAATAEKVFKQYANRNRVDYEWTYDRATKTFTVTE,-0.0023781508,"K4R, D36R, G38R, G41Y, D47R",5
MQPKLILNAKTTKGETTTEAVDAATAEKVFKQYLNDNGVDGEWTYDRATKTFTVTE,-3.5449204,"Y3P, G9A, L12T, A34L, D47R",5
MQYKLTLNGKTLKRETTTEAVDAATAEKVFKQYANDNGVDGEWTYDRATKTVTITE,-2.4674847,"I6T, G14R, D47R, F52V, V54I",5
MQYKLIHNGKYLKGETRTEAVDAATAEKVFKQYANANGVDGEWTYDRATKTFTVTE,1.994386,"L7H, T11Y, T17R, D36A, D47R",5
MQYKLILNGKHLKGETTWEAVDRATAEKVWKQYANDNGVDGEWTYDRATKTFTVTE,-0.75523114,"T11H, T18W, A23R, F30W, D47R",5
MFYKLILNGKRLKGETTTEAVDAATARKRFKQYANDNGVDGEWTYDRATKTFTVTE,-0.9488084,"Q2F, T11R, E27R, V29R, D47R",5
MQYKLILNGKTLKGETCTERVDAATAEKQFKQYANDNGVDGEWTYDRATKTFTVLE,5.199719,"T17C, A20R, V29Q, D47R, T55L",5
MQYKLILNGKTLKGETTTEAVDAATAFKRFKQYANDNGVDGRWQYDRATKTFTVTE,0.68373096,"E27F, V29R, E42R, T44Q, D47R",5
MQYKLILNGKCLKGETTTEAVDRATAEKVFKQYANDNGVDYEWTYDRATKTYTVTE,-4.620152,"T11C, A23R, G41Y, D47R, F52Y",5
MQYKLILNGKTLRGETSTEAVDRATAEKVFKQYANDNGVDREWTYDRATKTFTVTE,-3.6359525,"K13R, T17S, A23R, G41R, D47R",5
MQYKLILNGKTLKGETTIEAVDAWTAEKVFKQYANDNGVDGEWTYDRTTKTFTVTR,5.132836,"T18I, A24W, D47R, A48T, E56R",5
MQYKLILNGKTLKGQTTTRYVDAATAEKVFKQYANDNGVDGEWTYDRATKTFTLTE,3.0434756,"E15Q, E19R, A20Y, D47R, V54L",5
MQYKLILNVKTLKGETTTETYDAATAHKVFKQYANDNGVDGEWTYDRATKTFTVTE,-2.754475,"G9V, A20T, V21Y, E27H, D47R",5
MQYKLILNGKTLKGEHTTEYVDAATAEKVFKQYANDNGVWGEWTYDRATRTFTVTE,4.642057,"T16H, A20Y, D40W, D47R, K50R",5
MQYKLILNGKTLKGETTTEAVDAARAEKVAKQYANRNGVDGEWTYDRATKTFTVTK,2.6668222,"T25R, F30A, D36R, D47R, E56K",5
MQYKLILNGKTLKGHTTTEAVDAATAEKVFKQYANDNLVDGEWTLDRATKTFTVRE,3.4654846,"E15H, G38L, Y45L, D47R, T55R",5
MQRKLILNGKTLKGETTTEARDAATAEKVFKQYANDMNVDGEWTYDRATKTFTVTE,-0.44218624,"Y3R, V21R, N37M, G38N, D47R",5
MQYKLRLNGKTLKGETTTEAFDAATAEKRFKRYANDNGVDGEWTYDRATKTFTVTE,6.5471888,"I6R, V21F, V29R, Q32R, D47R",5
MQYKLVLNGKTLRGETTTEAVDAATREKVFKQYANDNGVRGEWTYDRATKTFTVTE,0.38460994,"I6V, K13R, A26R, D40R, D47R",5
MQYKLTLNGRTLKGETTTEAVDAARAEKVFKQRANDNGVDGEWTYDRATKTFTVTE,4.852834,"I6T, K10R, T25R, Y33R, D47R",5
MQYKLILNGLTHKGETTTEAVDAATAEKVFKQYANDNGVDGEWRLDRATKTFTVTE,2.251088,"K10L, L12H, T44R, Y45L, D47R",5
MQYKLILNGKQLKGETTTEAVDAATAEKVFKRYANDNGVDGEWTYDRATKTFVVRE,3.9916387,"T11Q, Q32R, D47R, T53V, T55R",5
MQYKLILNGKTLPGETTTEALDAATAEKVFKQYANDNGVDGEWTYDRATKTFTRTV,-3.1883068,"K13P, V21L, D47R, V54R, E56V",5
MQYKLILNGRTLKGETTTEAVDAATAEKKFKQYANSNGVWGEWTYDRATKTFTVTE,8.119836,"K10R, V29K, D36S, D40W, D47R",5
MQYKLILNGKTLKGETTTEAVNAATVERVFKQYANDNGVDGEWLYDRATKTFTVTE,2.6305523,"D22N, A26V, K28R, T44L, D47R",5
MQYKLILNGKRLRGETTCEAVDAATAEKVFKQYANDNGVDGEWTYDRATKTFTVRE,4.1899085,"T11R, K13R, T18C, D47R, T55R",5
MQYKLILNGKRLKGETRTEAVDAATAEKVFKQYANWNGVDGEWTYDRATRTFTVTE,4.192275,"T11R, T17R, D36W, D47R, K50R",5
MQYKLILNGKTLKGETTTEAVDRATAEKVFKQYARDNGVDGRWTYDRATKTFAVTE,-2.1068277,"A23R, N35R, E42R, D47R, T53A",5
MQYKLILNGKTLKGETTTRAVDRATAEKVAKQYANDNGVDGEWTYDRRTKTFTVTE,0.31726125,"E19R, A23R, F30A, D47R, A48R",5
MQYKLILNGKTLKRETTTEAVDAATAEKVFKQYANDNGVDGWWTYDRRTKRFTVTE,4.4159784,"G14R, E42W, D47R, A48R, T51R",5
MQYKLILRGKTLKGETTTEAVDAATAEKVFKQRANDNGVDGWWTYDRATKRFTVTE,4.952636,"N8R, Y33R, E42W, D47R, T51R",5
MQRKLILNGKTLKGETTTEAVDAATAEYVFKYYVNDNGVDGEWTYDRATKTFTVTE,-4.0467324,"Y3R, K28Y, Q32Y, A34V, D47R",5
MQYKLILNGKTLKGETTTEAVIAATAEKVFKRYALDNGVDGEWSYDRATKTFTVTE,0.79967326,"D22I, Q32R, N35L, T44S, D47R",5
MQYKLILNGKTLLRETTTEAVDAATAEKVFKQYARDNGVDGEVTYDRATKTFTVTE,-5.8105984,"K13L, G14R, N35R, W43V, D47R",5
MQYKLILNGKTLKGETTTGAVDAATAEKLFKHYANDNGVDGEWRYDRATKTFTVTE,5.4712863,"E19G, V29L, Q32H, T44R, D47R",5
MQYKLILNGKTLKGETTTEAVDAATAEKVYKQRANDNGVDKEWTYDRLTKTFTVTE,-3.1579103,"F30Y, Y33R, G41K, D47R, A48L",5
MQYKRILNGKRLKGETTTEAVDAATAEKVFKQYANDNGVDGEWTYLRATKTFTVTR,-2.0264976,"L5R, T11R, D46L, D47R, E56R",5
MQYKLILNGKTLKGETTTEAVDAATAEKRFKQYARDNRVDGEWTYDRATKRFTVTE,0.87613034,"V29R, N35R, G38R, D47R, T51R",5
MKYKLILNGKTLKGYTLTEAVDAATAKKVFKQYANDNGVDGEWTYDRATKTFTVTE,-0.6583602,"Q2K, E15Y, T17L, E27K, D47R",5
MQYKLILNGKTLKGETTTEMVDAATAQKVFKQYANDNGVRGLWTYDRATKTFTVTE,-0.65552884,"A20M, E27Q, D40R, E42L, D47R",5
MQYKLILNGRTLKGETTTEAWDAATAEKVFKQYANDNGKDGEWTYLRATKTFTVTE,1.695422,"K10R, V21W, V39K, D46L, D47R",5
MKYKLILNGRTLKCETTTEAVDAATAEKVFKQYANDNGVDGEWTYDRATKTRTVTE,-1.8819318,"Q2K, K10R, G14C, D47R, F52R",5
MQYKLILNGKTYKGETTTEAVDAATAEKVFKRYANDNGVWGEWTYDRATKTFTVIE,4.1008334,"L12Y, Q32R, D40W, D47R, T55I",5
MQYKLILNGKTLKGETTTEAVDHYKAELVFKQYANDNGVDGEWTYDRATKTFTVTE,2.2930999,"A23H, A24Y, T25K, K28L, D47R",5
MQYKLILNGKKLKGETTTEAVDAATAEKVFKRYANDNGVDGEWTYDRWNKTFTVTE,4.368281,"T11K, Q32R, D47R, A48W, T49N",5
MQYKLRLNGKTLKGETTTEAVDKATAEKVFKQYANDNCVDGEWRYDRATKTFTVTE,1.2018558,"I6R, A23K, G38C, T44R, D47R",5
MQYKLILNGKPLKGETTTEAVDAATARKVFKQYANDNGVYGEWTYDRATKTFTVHE,-2.5217853,"T11P, E27R, D40Y, D47R, T55H",5
MRYKLILNGKTLKGETTTEAVDAATAEKVFKQYANDNGVDCEWTYDRQTKTFTVTI,0.20377985,"Q2R, G41C, D47R, A48Q, E56I",5
MQYKLIVNGKTLKRETTTEAVDAATAEKRFRQYANDNGVDGEWTYDRATKTFTVTE,2.6560543,"L7V, G14R, V29R, K31R, D47R",5
MRYKLILNGKTLRGSTYTEAVDAATAEKVFKQYANDNGVDGEWTYDRATKTFTVTE,6.052012,"Q2R, K13R, E15S, T17Y, D47R",5
MQYKLILNGKTLKGETTTEAVDAAMLEKVFKRYANDNGVDGEWTYDRATKTFSVTE,1.0799009,"T25M, A26L, Q32R, D47R, T53S",5
MQYKLILNGKLLKGETTTEAVDAATAEKVFKQYANRNGVDGEVTYDRATRTFTVTE,-1.5341128,"T11L, D36R, W43V, D47R, K50R",5
MQYKRIRNGKTLKGETTAEAVDAAYAEKVFKQYANDNGVDGEWTYDRATKTFTVTE,-1.9375168,"L5R, L7R, T18A, T25Y, D47R",5
MQYKLILNGKTLKGETTTYAVDAATAKKVFKQRANDNGVDPEWTYDRATKTFTVTE,-5.122142,"E19Y, E27K, Y33R, G41P, D47R",5
MQYKLILNGKTLKGHTTTEAVDAATAEKVFKQYANDNGWDGEWFYDRRTKTFTVTE,0.98700863,"E15H, V39W, T44F, D47R, A48R",5
MQYKLSLFGKTLKGETTTEAVVAATAEKVFKQYANDNGVDGWWTYDRATKTFTVTE,5.7316527,"I6S, N8F, D22V, E42W, D47R",5
MQYKLILNGKTLKGETTTEAVDAATAEKVFKQFLNDNGVDGEWTYDRWTKTFTVYE,1.9332029,"Y33F, A34L, D47R, A48W, T55Y",5
MQYKLILNGKTLKGVTTTEAQDAATAEKVFKQYANDNGVDGEWTYWRATKVFTVTE,5.6156435,"E15V, V21Q, D46W, D47R, T51V",5
MQYKLILNGKTLKGETTTEAVDAARAEKVFTQFANDNGVDGEWTYDRATKTLTVTE,-2.3047576,"T25R, K31T, Y33F, D47R, F52L",5
MQRKLILNGKFLKGETTTEAVDAATAEYVFKQYANDNGVDGRWTYDRATKTFTVTE,-2.3978314,"Y3R, T11F, K28Y, E42R, D47R",5
MQYKLLLNGKYLKGETTTEAVDAATEEKVFKQYANDNGVDGEWTYDRATRTFTVTE,-1.0856341,"I6L, T11Y, A26E, D47R, K50R",5
MQYKLILNGKTLKGRYTTEAVDAATAEKVFKQYANDNGVDCEWTYDRATKTFLVTE,0.22317472,"E15R, T16Y, G41C, D47R, T53L",5
MQYKLILNGKTLKGETTTEARDARTAEKVAKQYANDNGVDGLWTYDRATKTFTVTE,2.9636207,"V21R, A24R, F30A, E42L, D47R",5
MQKKLILNKKTLKGETTTEAVDAATAEKVFKQYANYNGVWGEWTYDRATKTFTVTE,0.49341285,"Y3K, G9K, D36Y, D40W, D47R",5
MQKKLILNGKTLKGETYTEAVTKATAEKVFKQYANDNGVDGEWTYDRATKTFTVTE,-1.5861037,"Y3K, T17Y, D22T, A23K, D47R",5
MQYKLILNGKTLRGRTTTHAVDAATAEKVFKQYANDNGRDGEWTYDRATKTFTVTE,1.5711925,"K13R, E15R, E19H, V39R, D47R",5
MQYKLILNGKTLKGETTTEAVDAATAEKVARQYANWNGVDGFWTYDRATKTFTVTE,1.1951754,"F30A, K31R, D36W, E42F, D47R",5
MQYKLILNGKTLTGETTTEAVDAATAEKVFKQYANDNGVDGEIRYDRATKTFTVTF,-2.1994402,"K13T, W43I, T44R, D47R, E56F",5
MQYKLILNGKTLKGETTTEAVDAYTAEKRFKQYVNDNGRDGEWTYDRATKTFTVTE,1.8822225,"A24Y, V29R, A34V, V39R, D47R",5
MQYKLILNGKTLKGETRFEAVDAATAEKVFKQFANDNGVDGEWTYDRRTKTFTVTE,5.573669,"T17R, T18F, Y33F, D47R, A48R",5
MQYKLILNGKKLKGETIIEAVDAATAEKVFKQYANDLGVDGEWTYDRATKTFTVTE,2.3946512,"T11K, T17I, T18I, N37L, D47R",5
MQYKLIRNGKTLKGETTTEAVDAATWERVFKQYANDNGVWGEWTYDRATKTFTVTE,-0.8382638,"L7R, A26W, K28R, D40W, D47R",5
MQHKLIRNGKTLKGETTTEAVDAATAEKVFKQYANDAGVDGEWTYDRATKTFTVTR,-0.08045474,"Y3H, L7R, N37A, D47R, E56R",5
MKYKLILNGKTLKGETTTEAVDRWTAEKVIKQYANDNGVDGEWTYDRATKTFTVTE,1.5529069,"Q2K, A23R, A24W, F30I, D47R",5
MQYKLILNGKTLKLVTTTEAVDAATAEKVFKQYANDNGVKGEWTYRRATKTFTVTE,3.4072158,"G14L, E15V, D40K, D46R, D47R",5
MQYRLILNGKTLKGETTTEAVDAATAEKVFRQYANKNKVDGEWTYDRATKTFTVTE,2.4705052,"K4R, K31R, D36K, G38K, D47R",5
MQYKRILNGKTLKGETYTEAVDAAKREKVFKQYANDNGVDGEWTYDRATKTFTVTE,-4.388797,"L5R, T17Y, T25K, A26R, D47R",5
MQRKLILNGKTLKGETTTRLVDAATAEKVFKQYAYDNGVDGEWTYDRATKTFTVTE,-3.4095275,"Y3R, E19R, A20L, N35Y, D47R",5
MQYKLILNGKTLKGSTTTEAVDRAHAEKVFKQYANLNGVDGEWTYDRATKTFTVTE,2.7997284,"E15S, A23R, T25H, D36L, D47R",5
MQYKLILNGKTLKGERTTEAVDAADAEKVFKQYLNDNGVDGELTYDRATKTFTVTE,-5.2176003,"T16R, T25D, A34L, W43L, D47R",5
MQYKLILDGKELKGEMTTEAVDAATAEKVFKRYANDNGVDGEWTYDRATKTFTVTE,3.2942643,"N8D, T11E, T16M, Q32R, D47R",5
MQYKLILNGKTLKGETTTEYVDAATAEKVFKQYANDNWVDGYWAYDRATKTFTVTE,3.6461005,"A20Y, G38W, E42Y, T44A, D47R",5
MQYTLILNGKTLKGETTTEAVDAATAEKVMRQYANDNGVDGEVTYDRATKTFTVTE,-3.5741382,"K4T, F30M, K31R, W43V, D47R",5
MQYKLILNGKTLKGETTTKAVDGATAEYVFKQYANDHGVDGEWTYDRATKTFTVTE,-0.08190022,"E19K, A23G, K28Y, N37H, D47R",5
MQYKLILNGKTLKGETTTEAVDAATAEKVFKQYARDLGVKGEVTYDRATKTFTVTE,-5.27225,"N35R, N37L, D40K, W43V, D47R",5
MQYKLILNGRTLKGETTTEAVDARTAEKVWKRYANDNGVDGEWTYDRATKTFTVTE,3.3370783,"K10R, A24R, F30W, Q32R, D47R",5
MQYKLIRNGKTLKGETTTEAVDAATAEKVAKQYANDNGVDGEWTYDRMTRTFTVTE,0.9975623,"L7R, F30A, D47R, A48M, K50R",5
MQYKLILNGKTLKGETTTEAVDAATAEKVFKQYANDNLRDGEWTYERATKTFTLTE,-1.117418,"G38L, V39R, D46E, D47R, V54L",5
MQYKLILNGKTLKGETTTEAVDAATAEKVRKQYANDKGWDGEWTYDRATKKFTVTE,-4.3331,"F30R, N37K, V39W, D47R, T51K",5
MQYKLILNRKHLKGETTTEAVDAATAEKVFKQYANDNGVDGEWTYTRFTKTFTVTE,3.1571302,"G9R, T11H, D46T, D47R, A48F",5
MQYKLILNGKTLKGETTTEARDAATAEKVFKRYANDNGVDGEFTYDRATKTFRVTE,0.9125515,"V21R, Q32R, W43F, D47R, T53R",5
MQYKLILNGKTLKGETRTEARDAATAEKVFKQYANDNKVDGKWTYDRATKTFTVTE,5.0446362,"T17R, V21R, G38K, E42K, D47R",5
MQYKLILRGKTLIGETRTEAVDAATAEKVFKQYANDNGVDGEWTYDRATKKFTVTE,5.562393,"N8R, K13I, T17R, D47R, T51K",5
MQYKLILNVKTLKGETTIEAVDAYTAEKVFKQYANDNGVDGEWYYDRATKTFTVTE,4.725437,"G9V, T18I, A24Y, T44Y, D47R",5
MQYKLILNGPTLKGELTTEAVDRATAEKVFIQYANDNGVDGEWTYDRATKTFTVTE,-5.050304,"K10P, T16L, A23R, K31I, D47R",5
MQYKLILNGKTLKGETVHEAVTAATAEKVFGQYANDNGVDGEWTYDRATKTFTVTE,-1.4738874,"T17V, T18H, D22T, K31G, D47R",5
MQYKLILNGKTLKGERTTEGVDAATAEKVFKQWARDNGVDGEWTYDRATKTFTVTE,-0.55297434,"T16R, A20G, Y33W, N35R, D47R",5
MQYKLILNGKTLKGEWTTEAVDAATFEKRFKQYANDNGVDGEWTYDRATKTVTVTE,-3.9134297,"T16W, A26F, V29R, D47R, F52V",5
MQYKLILNGKRLKGETTTEWVDAATAEKVFKQYARDNGVDGEWTYDRATKTFTVTA,-3.2633293,"T11R, A20W, N35R, D47R, E56A",5
MQYKLILNGKTFSGETTTEAVDAATAEKVLKQYANDNGVDGEWTYDRRTKTFTVTE,4.0226655,"L12F, K13S, F30L, D47R, A48R",5
MQYKLILNGKTLKGETTTCAVDAAKAEKVFKQYARDNGVDGEWTYDRARKTFTVTE,0.88142246,"E19C, T25K, N35R, D47R, T49R",5
MQYKLILNGRTLKGETTTEAVDAATAEKVFKQYANRKGVDGEWTYDRATKTFTVTQ,3.3249257,"K10R, D36R, N37K, D47R, E56Q",5
MQYKLILNGKTLKGEYTTRAVDRATAEKVFKQRANDNGVDGEWTYDRATKTFTVTE,-0.033509582,"T16Y, E19R, A23R, Y33R, D47R",5
MQYKLILYGKTLKGETTTEAVDAATAEKVFKQYAYDNGVDGEWSYDRATCTFTVTE,0.97748023,"N8Y, N35Y, T44S, D47R, K50C",5
MQYKLVLNGKTLKGETTTEAVDAATAEKVFKQYKNDEGVDGWWTYDRATKTFTVTE,-2.2573574,"I6V, A34K, N37E, E42W, D47R",5
MQYKLILNGKTLKGETTTEAVDLATREKVFKLYANDNGVDYEWTYDRATKTFTVTE,-4.729099,"A23L, A26R, Q32L, G41Y, D47R",5
MQYKAKLNGKTLKGITTTEAVDAATAEKVFKQYANDNGVDGWWTYDRATKTFTVTE,5.067701,"L5A, I6K, E15I, E42W, D47R",5
MQYKLILNGKTGKYEHTTEAVDAATAEKVFKQYANDNGVDGEWTYDRATKMFTVTE,1.7424843,"L12G, G14Y, T16H, D47R, T51M",5
MQYRLILNGRTLKGETKTEAVDAATAEKVFKQYANDNGVDGEWTYRRATKTFTVTE,5.2944827,"K4R, K10R, T17K, D46R, D47R",5
MQYKLILNGKTLKGETTTERVRAATWEKVFKQYANDNGKDGEWTYDRATKTFTVTE,-2.6959624,"A20R, D22R, A26W, V39K, D47R",5
MQYKLILNGKTLKGETYTEAVDAATAEKVFKQYANRNGVDGEWTYDRWSKTFTVTE,5.8737116,"T17Y, D36R, D47R, A48W, T49S",5
MQYKLILNGKTLWGETTTEAVDRANREKVFKQYANDNGVDGEWTYDRATKTFTVTE,-2.597335,"K13W, A23R, T25N, A26R, D47R",5
MQYKLILNGKTLKGETTTEAVDAATAEKVFKQYARDNGVDGEWTYDRATKTLTLKE,-3.2221684,"N35R, D47R, F52L, V54L, T55K",5
MQYKLILNGKTLKGETTTEAVFAAHAEKVFRQYLNDNGVDGEWTYDRATKTFTVTE,0.48352158,"D22F, T25H, K31R, A34L, D47R",5
MRYKLILNGKTLKGETTTEAVDAATAVKVFKQYANDNGVDGEWTYDRATKTLTLTE,-4.333336,"Q2R, E27V, D47R, F52L, V54L",5
MQYKLIRNGKTLSGETTTEAVDAATAEKVFKQLANDNGVDGEWTYDRRTKTFTVTE,2.8272212,"L7R, K13S, Y33L, D47R, A48R",5
MQYRLILNGKTLKGETTTEAVDAATAEKVFKQYANDNGVDGERTYDRATKTITYTE,-5.1561475,"K4R, W43R, D47R, F52I, V54Y",5
MPYKLILNGKTLKGETTYEAVDRATAEKVFKQYANDNGVDGEWTYDRATRTFTVTE,2.207664,"Q2P, T18Y, A23R, D47R, K50R",5
MQYKLILNGKTLKGVTTTEAVDAATAEKKFKKYANDNGIDGEWTYDRATKTFTVTE,6.554452,"E15V, V29K, Q32K, V39I, D47R",5
MQYKLILNGKTLKGEYTTEAVDAATAEKVFKQYLYDNGVDQEWTYDRATKTFTVTE,-5.7225113,"T16Y, A34L, N35Y, G41Q, D47R",5
MQYKLILNGRTLKGETTTERVVAATAEKVFKQYANDNGRDGEWTYDRATKTFTVTE,1.9438215,"K10R, A20R, D22V, V39R, D47R",5
MQYKLILNGKTLKGRTTTEAVDAYTAECVFKQYANDNGVRGEWTYDRATKTFTVTE,5.243323,"E15R, A24Y, K28C, D40R, D47R",5
MQYKLILNGKTLYGETTTEAVDAATLEKVFKQYARDNGVDGYWTYDRATKTFTVTE,-4.4988008,"K13Y, A26L, N35R, E42Y, D47R",5
MTRKLILNGKTLKGRTTTEAVDAATAEKVFRQYANDNGVDGEWTYDRATKTFTVTE,0.20802751,"Q2T, Y3R, E15R, K31R, D47R",5
MQYKLLLNGKTLKGETTTEAVDAATAEKVFKQYCNDNGVDGRWTYDRATLTFTVTE,5.4090977,"I6L, A34C, E42R, D47R, K50L",5
MQYKLILNGKTLKGESLTEAVDAATAEKVFKQYANRNGLDGEWTYDRATKTFTVTE,4.895244,"T16S, T17L, D36R, V39L, D47R",5
MQYKLILHGKTLKGETTTEAVDAATAEKVFKQKANDNGVDGEWTYDRATKTFTRTK,-2.8119156,"N8H, Y33K, D47R, V54R, E56K",5
MQYKLILNGKTLKGEHTTELRDAATAEKVFKQYANDNGVDGEWTYDRATKTFTVRE,3.3681743,"T16H, A20L, V21R, D47R, T55R",5
MQYKLILNGCTLKGETTIEAVDAATAEKVFKQYAKDNGVDGEWTYDRFTKTFTVTE,-0.32787913,"K10C, T18I, N35K, D47R, A48F",5
MQYKLILNGKTLFGETTTEAVDAATAKKVFKKYANDNGVDGEWTRDRATKTFTVTE,-4.0678234,"K13F, E27K, Q32K, Y45R, D47R",5
MQRKLILDGKTLKGEATTEAVRAATAEKVFKQYANDNGVDGEWTYDGATKTFTVTE,-0.43543622,"Y3R, N8D, T16A, D22R, D47G",5
MQYKLILNGYTLKGETTTVAVDAATAEKVFKLYANDNGVDGKWTYDRATKTFTVTE,5.503104,"K10Y, E19V, Q32L, E42K, D47R",5
MQYKLKWNGKTLKGETTTEAVDAATAEKVFKQWANDNGVDGEWTRDRATKTFTVTE,-1.5486794,"I6K, L7W, Y33W, Y45R, D47R",5
MQYKLILHGKTLKGETYTEAVDAATAEKVFKQYANDNGVDGERTIDRATKTFTVTE,-2.5848615,"N8H, T17Y, W43R, Y45I, D47R",5
MQYRLIHNRKTLKGETTTEAVDAATAEKVFKQYMNDNGVDGEWTYDRATKTFTVTE,0.12744701,"K4R, L7H, G9R, A34M, D47R",5
MQYKLILNGKTLKGERTTEAVDAATAEKVFKQYANRNGMDGEITYDRATKTFTVTE,-0.76940113,"T16R, D36R, V39M, W43I, D47R",5
MQYRLIYNGKTLKGETTTEAVDAATAERVFKQYANDNGVDGEWTYDRATKTFTRTE,-3.5895908,"K4R, L7Y, K28R, D47R, V54R",5
MQRKLILNGKTYKGETTTEAVDAKTAEKVFKRYANDNGVDGEWTYDRATKTFTVTE,-2.3348374,"Y3R, L12Y, A24K, Q32R, D47R",5
MQYKLILNGKTRKFETTTEKVDAATAEKVFQQYANDNGVDGEWTYDRATKTFTVTE,-3.8859472,"L12R, G14F, A20K, K31Q, D47R",5
MQYKVIGNGKTLKGETTFEAVDAATAEKVFKQYANDNGVDGEWRYDRATKTFTVTE,2.7166839,"L5V, L7G, T18F, T44R, D47R",5
MQYTLILNGKTLKGETTTEAVDAATAERVFKQYANDNGVDPEWTYDRATRTFTVTE,-1.8622227,"K4T, K28R, G41P, D47R, K50R",5
MQYKLILRGKTLKGETTTEFVDAATAEKVRKQYANDNGVDGEWTYDRGTKTFTVTE,-1.594065,"N8R, A20F, F30R, D47R, A48G",5
MQYKLILNGKRLKGETTTKAYDAATAEKVCKQYANDNGVDGEWTYDRATKTFTVTE,3.4391744,"T11R, E19K, V21Y, F30C, D47R",5
MQYKLIRNGKTLKGETTTEAVDAATAEKVFKQYCNDNGVWGEWTYDRATKTFTVLE,3.4708712,"L7R, A34C, D40W, D47R, T55L",5
MQYKLIRNGKTMKGETTTEAVDAATAEKVLKDYANDNGVDGEWTYDRATKTFTVTE,-2.4882836,"L7R, L12M, F30L, Q32D, D47R",5
MQYRLILNGKTLKGETTTEAVDAATAEKVFKKVANWNGVDGEWTYDRATKTFTVTE,3.108255,"K4R, Q32K, Y33V, D36W, D47R",5
MQYKLILNGKTLKGETTTEAVDAYTAEKVFKKYANDRGVDGEWTYDRRTKTFTVTE,5.6406584,"A24Y, Q32K, N37R, D47R, A48R",5
MQYKLIRNGMTYKGETTTEAVDAATAEKVFKQYARDNGVDGEWTYDRATKTFTVTE,-3.8851986,"L7R, K10M, L12Y, N35R, D47R",5
MQVKLRLNGKTLKRETTTEAVDAAHAEKVFKQYANDNGVDGEWTYDRATKTFTVTE,1.6685848,"Y3V, I6R, G14R, T25H, D47R",5
MQYKLILNGKTRKGETTTERVDAATAEKVFKQYANDNGVDGEWTYDRYTKTLTVTE,1.9878054,"L12R, A20R, D47R, A48Y, F52L",5
MQYRLILKGKTLKGETTTEAVDARTAEKVFKQYANDNGVDGEWTYDRARKTFTVTE,4.3001604,"K4R, N8K, A24R, D47R, T49R",5
MIYKLILNGKTLKGETTTEAVDAATAEKVAKQYANDNGLDGEWTYDRATMTFTVTE,2.8995507,"Q2I, F30A, V39L, D47R, K50M",5
MQYKLILNGKTLKGETTTEAVDAATAEKVFKQYARDNGVDGEWLYDRQTKTFTVTK,-1.0869125,"N35R, T44L, D47R, A48Q, E56K",5
MQYKLIRNGKTLKGETTTEAVDAATAEKVFKQYANDNGVDGEFTYDRRTKTFTVRE,-1.8436879,"L7R, W43F, D47R, A48R, T55R",5
MQYKLILNGKTLKGETTTERIDAATAEKVFKQYANDNGVDGEWTYDRARKTFLVTE,5.1492953,"A20R, V21I, D47R, T49R, T53L",5
MQVKLVLNGKTLLGETTTEAVDAATAEKVFKQYANDNGVDGEWTYDRATKTFTVTL,0.43121737,"Y3V, I6V, K13L, D47R, E56L",5
MQYKLILNGKTLKGHTTTEAVNAATAYKVFKQFANDNGVDGEWTYDRATKTFTVTE,-0.27323464,"E15H, D22N, E27Y, Y33F, D47R",5
MQYKLILNGKTLKGETTTERVDAATAEKRFKQYANDNGVDGEWTYDRARKTFTVTY,5.244294,"A20R, V29R, D47R, T49R, E56Y",5
MQYKLILNGKTLKGETTTEAVFAATAEKVFKQYANDNGVDGRWTYDRRTKTITVTE,2.5195327,"D22F, E42R, D47R, A48R, F52I",5
MQYRLILNGKTLKGETTTEARDAATAEFVFKQYANDHGVDGEWTYDRATKTFTVTE,1.8889658,"K4R, V21R, K28F, N37H, D47R",5
MQYKLILRGKTLKGETTTERVDAATAEKVFKQYANDNGVDGAWTYDRATKTLTVTE,4.0293036,"N8R, A20R, E42A, D47R, F52L",5
MQYRLILNRKTLKGGTTTEAVDAWTAEKVFKQYANDNGVDGEWTYDRATKTFTVTE,4.4275403,"K4R, G9R, E15G, A24W, D47R",5
MQYKLILNGKTLKGETTTEAVRANTAEKVFKKYANDKGVDGEWTYDRATKTFTVTE,4.4720325,"D22R, A24N, Q32K, N37K, D47R",5
MQYKLILNGKTLKGETTTEAVDAATMEKVFKQYANDNGLDGRLTYDRATKTFTVTE,-2.9733052,"A26M, V39L, E42R, W43L, D47R",5
MQYKLILNGATFKGETTTRAVDAATAEKVFKQYANDNGVDGEWTYKRATKTFTVTE,4.2493973,"K10A, L12F, E19R, D46K, D47R",5
MQYKLILNGKTLKGETTTVAVDAATLEKVFKQYANSNGVDGEWTYDRATKTFTVTK,-0.7368811,"E19V, A26L, D36S, D47R, E56K",5
MQYKLILNGKTLRGLTTTEAVRAATAEKVFKQYANDNGVDGEWRYDRATKTFTVTE,5.110353,"K13R, E15L, D22R, T44R, D47R",5
MQYKLILNGKTLKGETTIEARDAATAEKVFKQYANDFGYDGEWTYDRATKTFTVTE,-0.060793336,"T18I, V21R, N37F, V39Y, D47R",5
MQYKLILNGKTLKGETTTEAVDAATAEKVFKQYANDNPVYGHWTYDRATKTFTVRE,1.4230108,"G38P, D40Y, E42H, D47R, T55R",5
MQYKLRLNGKTLKGETTTEAVDARTAEKVFKQYANDNGVDGYWTYDRATKTFTVHE,3.6721554,"I6R, A24R, E42Y, D47R, T55H",5
MQYKLILCGKTLKGETTTEAVDAYTAEKVFKQHANDNGVDGEWTYDRATKTFLVTE,5.222753,"N8C, A24Y, Y33H, D47R, T53L",5
MQYKLILNGKTLIGETTTEAVDAATIEKVFKQYRNDNGVDGEWTYDRATKTFRVTE,-2.6097193,"K13I, A26I, A34R, D47R, T53R",5
MQYKLIRNGKTLKGETVTEAADAATAEKVFKQYANDNGVDGEWTYDRATKTFRVTE,2.1017156,"L7R, T17V, V21A, D47R, T53R",5
MQYKLILNGKTLKGETTTEAVDAATGEKVFKQRANDNGYLGEWTYDRATKTFTVTE,0.47544563,"A26G, Y33R, V39Y, D40L, D47R",5
MQYRLILNGKTLKGETTTEAVDAATARKVFKQYANDNGVDGEWTYRRATKTFTVTR,-3.1639907,"K4R, E27R, D46R, D47R, E56R",5
MQYKLILNGKTLKMETTTEAVDAYTAEKVFKQYANDNGVDGEWTYWRATKTFRVTE,4.358121,"G14M, A24Y, D46W, D47R, T53R",5
MQYKKILNGKTLKGETTTEAVDAATAEKVFYRYANDNGVDGEWTYDRARKTFTVTE,-4.8442993,"L5K, K31Y, Q32R, D47R, T49R",5
MQYRLILNGKTLKGETTTEAVDAATAEKVFKQYRNDCGVYGEWTYDRATKTFTVTE,0.99910337,"K4R, A34R, N37C, D40Y, D47R",5
MQYKLILNGKTLKGETYTEAVDAATAERVFKQYYNDNIVDGEWTYDRATKTFTVTE,-1.9008878,"T17Y, K28R, A34Y, G38I, D47R",5
MQYKLIRNGKTLKGETATEAVDAATAERVFKQYLNDNGVDGEWTYDRATKTFTVTE,-1.4913492,"L7R, T17A, K28R, A34L, D47R",5
MQYKLILNGKTLKRETTTEAVDRATAEKVAKQRANDNGVDGEWTYDRATKTFTVTE,-3.854022,"G14R, A23R, F30A, Y33R, D47R",5
MQYKLILNGKTLKGETTTEYVDAALAEKVFKQYANDNGVDGEMKYDRATKTFTVTE,-2.250084,"A20Y, T25L, W43M, T44K, D47R",5
MQYKLILNGKTLKGRTTTEAVDAATAEKVLKQYARRNGVDGEWTYDRATKTFTVTE,0.76505756,"E15R, F30L, N35R, D36R, D47R",5
MQYKLILNGKTLKGETTTEARDAATAEKRFKRYANDFGVDGEWTYDRATKTFTVTE,4.0593004,"V21R, V29R, Q32R, N37F, D47R",5
MQYKLILNGKTLKGETTTEAVDYATAEKVFKQRANDNGVDKEWTYDRATKTFTVTR,-5.4599905,"A23Y, Y33R, G41K, D47R, E56R",5
MQYKLILNGKTLKRETTTEAVDAATKEKVFKQYANDNGVWGEWRYDRATKTFTVTE,-0.6128864,"G14R, A26K, D40W, T44R, D47R",5
MQYKLYLNGKRLKGETTTEAVDAHTAEKVFKQYANDNGVDGEITYDRATKTFTVTE,-0.07217045,"I6Y, T11R, A24H, W43I, D47R",5
MQYKLIIRGKTLKGRTTTEAVDAATAEKVFKQYCNDNGVDGEWTYDRATKTFTVTE,5.887322,"L7I, N8R, E15R, A34C, D47R",5
MQYKLILNGKTLKGETTTEAEDAATAEKVFKQYANDNGVDGEWTYHRATKTFWVYE,3.9219513,"V21E, D46H, D47R, T53W, T55Y",5
MQKKLILIGKTLKGETTTEAVDRAWAEKVFKQYANDNGVDGEWTYDRATKTFTVTE,-1.341138,"Y3K, N8I, A23R, T25W, D47R",5
MQYKLILNGKTLKGEYTTEARDAATAEKVFKQYANRNGVDGEWTYDRATKTFTVTR,3.5801022,"T16Y, V21R, D36R, D47R, E56R",5
MQYKLILRGKTLKGWTTTEAVDAATAERVFKQYANDNGVDGEWTYRRATKTFTVTE,4.5876546,"N8R, E15W, K28R, D46R, D47R",5
MQRKLILNGKTLKGETTTEAVYAATAERVFKQYCNDNGVDGEWTYDRATKTFTVTE,0.55037636,"Y3R, D22Y, K28R, A34C, D47R",5
MQYKLIRNGKTLRGETLTEAVDAATAERVFKQYANDNGVDGEWTYDRATKTFTVTE,1.7329047,"L7R, K13R, T17L, K28R, D47R",5
MQYKLILNGKTLKMETTTEAVDAAVAEKVAKQYANDNGVDGEWTYDRARKTFTVTE,0.37812236,"G14M, T25V, F30A, D47R, T49R",5
MQYKLILRGKTLKGETTTEAVDAATAEKVFKQYANLNGVDGWWTYDRATKTFTVTR,4.8503203,"N8R, D36L, E42W, D47R, E56R",5
MQYKLILNGKTYKVETTTERVRAATAEKVFKQYANDNGVDGEWTYDRATKTFTVTE,2.116153,"L12Y, G14V, A20R, D22R, D47R",5
MQYKLIRNGKTRKGETTTEAVRAATAEKRFKQYANDNGVDGEWTYDRATKTFTVTE,2.3050349,"L7R, L12R, D22R, V29R, D47R",5
MKYKLILNYKTLKGETTTEAVDAATAERVFKRYANDNGVDGEWTYDRATKTFTVTE,3.0738337,"Q2K, G9Y, K28R, Q32R, D47R",5
MQYKLILNGKTLKGETRTEAVDAYTAEKVLKQYANDNGVDGEWTRDRATKTFTVTE,3.3260477,"T17R, A24Y, F30L, Y45R, D47R",5
MKYKLYLKGKTLKGETTTEAVDAATAEKVFKQYANDNGVDGEWTYDRKTKTFTVTE,5.903359,"Q2K, I6Y, N8K, D47R, A48K",5
MKYKLIYNGKTLKGETTTEAYDAATAEKVFKQYANDNGVDGERTYDRATKTFTVTE,-2.4817088,"Q2K, L7Y, V21Y, W43R, D47R",5
MQYKLILWGKTLKGETTTEAVDAATAEKVFKAYANDNGVKGEWTYDRATKTVTVTE,0.83660483,"N8W, Q32A, D40K, D47R, F52V",5
MQYKLILNGKTLKGETYTEFVDAATAEKVWKQYANDNGVDGEWTYDRATKTFTVTL,0.25892425,"T17Y, A20F, F30W, D47R, E56L",5
MQYKLILNGKTLKGRTTTEAVDAATAEKVFRQYANGNGVDGEWTYDRATKTFTVTR,2.3903677,"E15R, K31R, D36G, D47R, E56R",5
MQYKLKLNGKTTKPETTTEAVDAATAEKRFKQYANDNGVDGEWTYDRATKTFTVTE,2.3781538,"I6K, L12T, G14P, V29R, D47R",5
MQYKLILNGKTLKGETLTEAVDRRTAEKVFKQYANDNGVDGEWTYYRATKTFTVTE,0.511533,"T17L, A23R, A24R, D46Y, D47R",5
MQYHLLLNGKTLKGETTTHAVDAATAEKVFKQYANDNGVDGYWTYDRATKTFTVTE,5.5423927,"K4H, I6L, E19H, E42Y, D47R",5
MQYKLELNGKTLKGETYTEAVRAATAEKVFKQYANDNGVDGEWTYDRATKTFTFTE,4.2934847,"I6E, T17Y, D22R, D47R, V54F",5
MQYKLILNGKTLKGEYTTEAVDAATAEKVARQYANDNGLDGEWTYDRATKTFTVTE,0.17255932,"T16Y, F30A, K31R, V39L, D47R",5
MQYKLLLYGKTEKGETTTEAVDAATFEKVFKQYANDNGVDGEWTYDRATKTFTVTE,-1.1147931,"I6L, N8Y, L12E, A26F, D47R",5
MQYKLILNGKTAKGETTFEAVDAATAEKVFKQYQNDNGVDGEWTYDRRTKTFTVTE,-1.8650409,"L12A, T18F, A34Q, D47R, A48R",5
MRYKLILRGKTLKGETTTEAVDAATAEKVFKQYANDNGVDGEWKYDRFTKTFTVTE,6.0103345,"Q2R, N8R, T44K, D47R, A48F",5
MQYKLILNGKTLKGETTMEAVDAAHAERVFKQYVNDNGVDGEWTYDRATKTFTVTE,1.2620697,"T18M, T25H, K28R, A34V, D47R",5
MQYKLILNGKTLKGETTTEAVDAATARKVFKQYAEDNGVDCEWTYNRATKTFTVTE,-5.6240673,"E27R, N35E, G41C, D46N, D47R",5
