Sequence,Score,Mutations,Number of Mutations
MKYKLILNNKTLKGETTTEAPDVADAIKNFKQYANDNNVDGEIVYDDATKTFTVTE,-5.4298744,"Q2K, G9N, V21P, A23V, T25D, E27I, V29N, G38N, W43I, T44V",10
MTYKLILNGKTLKGETTTEEVDADTAEMNFKLYANDNGVEGEWTYDAETKTVTVTE,3.7529325,"Q2T, A20E, A24D, K28M, V29N, Q32L, D40E, D47A, A48E, F52V",10
MQYKLIINHKTLKGEAHVEAVDAVTAVKVFKQYANDNGVTGEPTYDDATKTLTVTE,-4.627553,"L7I, G9H, T16A, T17H, T18V, A24V, E27V, D40T, W43P, F52L",10
MQYKLTLDAGTLKGMTTTEAVDAALAEKVFKDYVEDNGVDGEWTYDDATRTFTVTE,-0.77368903,"I6T, N8D, G9A, K10G, E15M, T25L, Q32D, A34V, N35E, K50R",10
MAYKIVLNGKTLKGETTTEAVDAATADKVFKQYANTKVWDGEWTYDTATGTFTVTE,-3.035544,"Q2A, L5I, I6V, E27D, D36T, N37K, G38V, V39W, D47T, K50G",10
MQYKLILNGKVLKGETTDEAVNAATAEKVAKQYLNDNGFPFEWVYDDATKTFTLTE,-4.375658,"T11V, T18D, D22N, F30A, A34L, V39F, D40P, G41F, T44V, V54L",10
MQYKLELNGKELTGEDTTEAVDAATVEKVFKQYLNDNQVDGEATYDQATKTFTVEE,-3.5619767,"I6E, T11E, K13T, T16D, A26V, A34L, G38Q, W43A, D47Q, T55E",10
MQYKLIVTGKGLKGETTTPAVDAATAEKVFKQLAADGGVDGEWQYDDATSTFTVVE,2.4970195,"L7V, N8T, T11G, E19P, Y33L, N35A, N37G, T44Q, K50S, T55V",10
MIYKLILKGKTEKGELTFEAVDAATAEKVFKKYANDNGYDGELTYDDDTKTFTVTI,-1.3531908,"Q2I, N8K, L12E, T16L, T18F, Q32K, V39Y, W43L, A48D, E56I",10
MQYELIYNGKTISGMTDTEAVDADTAEKVFKQYANDNGVDGEITYDDASKTFTVTL,-1.065366,"K4E, L7Y, L12I, K13S, E15M, T17D, A24D, W43I, T49S, E56L",10
MQYKLTLNGKTFKGETTTEEVDAALAEKAFKQWASDNGVDGEWMYDMATKTITVTE,1.6681969,"I6T, L12F, A20E, T25L, V29A, Y33W, N35S, T44M, D47M, F52I",10
MQYKLILNDKTLKTITTTEAVDAATAFRVFKQYANDNEVDGEFTYDDTTKTFTFIE,-5.7574873,"G9D, G14T, E15I, E27F, K28R, G38E, W43F, A48T, V54F, T55I",10
MQYKAILKGKTLGGETTIEAEDAATAEAVLQQYANDNGFDGEWTYDDATKTFTITE,-2.8787973,"L5A, N8K, K13G, T18I, V21E, K28A, F30L, K31Q, V39F, V54I",10
MTYKLIFNGKTLAGATITEAVDAATAENVFKKYANDNKVQGNWTYDDATKTFTVTE,5.0475073,"Q2T, L7F, K13A, E15A, T17I, K28N, Q32K, G38K, D40Q, E42N",10
MQYKLILNGTTITSETTTEAVDATTAESVFKNLADDNGVDGEWTYDDATKTFSVTE,0.5548127,"K10T, L12I, K13T, G14S, A24T, K28S, Q32N, Y33L, N35D, T53S",10
MNYKLIFNGKVLKGETSLEAVDAATAFKVAKQYANDNWVDGEWTYDDHTKTFTVAE,-1.5152161,"Q2N, L7F, T11V, T17S, T18L, E27F, F30A, G38W, A48H, T55A",10
MQYKLILNGKTLHTETTLEATDAATAERVFKEYLNDNGVAGVATYDDATKTFTVTE,-3.529796,"K13H, G14T, T18L, V21T, K28R, Q32E, A34L, D40A, E42V, W43A",10
MQYDLILNGKTYKGETTTEAVDDATAEKVFIQYLADKGVDGEVSYDDATGTFTVTE,-6.724898,"K4D, L12Y, A23D, K31I, A34L, N35A, N37K, W43V, T44S, K50G",10
MQYKLILDGKTLEGYTTTEYSNAATAEKDFTQYANENGVDGEWTYDDAAKTFTVTE,1.458659,"N8D, K13E, E15Y, A20Y, V21S, D22N, V29D, K31T, D36E, T49A",10
MQYKLIQNGKVLKGETTTEAVDADTARKVFKQYANDNYYDGEWTYDDETYTFTEVE,-4.0393114,"L7Q, T11V, A24D, E27R, G38Y, V39Y, A48E, K50Y, V54E, T55V",10
MQYKTIPNGTTIKGETYYEAVDAATAEFVFAQYANDEGVDGEWTADDATKTFTVTE,-5.6508713,"L5T, L7P, K10T, L12I, T17Y, T18Y, K28F, K31A, N37E, Y45A",10
MQYKFILNGKTLKFELTVVAKDAKTAEKAFKQYANDNGVDLEWTYDDATKTFAVTE,0.40308562,"L5F, G14F, T16L, T18V, E19V, V21K, A24K, V29A, G41L, T53A",10
MQYKLILDGKELKGFTTTEAADATTAETVFKQVINDNDIDGEWTYDDATKTFTVTE,1.7006359,"N8D, T11E, E15F, V21A, A24T, K28T, Y33V, A34I, G38D, V39I",10
MDAKLILNGKTLKFETKTEATDAASAEKVFKQYANDNGYKGEWTYDDKTKTFTVKE,3.6096795,"Q2D, Y3A, G14F, T17K, V21T, T25S, V39Y, D40K, A48K, T55K",10
MQAKLILNGKTLKRNTTTEYVDKATAVKAAKQYAFDNGVDGEWTYDKATKTFTVTE,-5.355107,"Y3A, G14R, E15N, A20Y, A23K, E27V, V29A, F30A, N35F, D47K",10
MAYKLILNGKTLKTVTTTEAADAATAEKAFKVNVNDNGVDGEWTYDDAAGTFTVTE,5.2492504,"Q2A, G14T, E15V, V21A, V29A, Q32V, Y33N, A34V, T49A, K50G",10
MQYKATLNGKTLTGEQTTTAVDAATAEKVLIQYANDNGIDGEWFYDSATKTFTVTE,3.7974658,"L5A, I6T, K13T, T16Q, E19T, F30L, K31I, V39I, T44F, D47S",10
MQYKWILNGKTLKGMTTTEASDAATALKVAKQYANDNGVDGIWSYDGATNTLTVTE,-2.36574,"L5W, E15M, V21S, E27L, F30A, E42I, T44S, D47G, K50N, F52L",10
MQYKLQLNGKTLKGETRTEAVDADSPEDVFKQYANEPGVTGEWTYDDATETFTVTE,-1.7223651,"I6Q, T17R, A24D, T25S, A26P, K28D, D36E, N37P, D40T, K50E",10
MPYKLIWNGKQLKGETMTEAVDPATAEKAGKQYANDNGVDGTWTYDDANKTFTLTE,2.4841442,"Q2P, L7W, T11Q, T17M, A23P, V29A, F30G, E42T, T49N, V54L",10
MAYKLILNGKTNKGETTVEAVDAATAEVVFGTYAKDNGVDGTWTYDDATKTFTVHQ,-5.2345977,"Q2A, L12N, T18V, K28V, K31G, Q32T, N35K, E42T, T55H, E56Q",10
MTYTLTLNGKPLKGKPPTEAVDAATAEKVFKVYANDNAVDGTWTYDDATKTFTVTE,5.233349,"Q2T, K4T, I6T, T11P, E15K, T16P, T17P, Q32V, G38A, E42T",10
MQYKLILNGKTFKGESTTTAVDAATAEKVFKKWANDNNVTGEFTYDPATKTVTVTE,0.4896246,"L12F, T16S, E19T, Q32K, Y33W, G38N, D40T, W43F, D47P, F52V",10
MVYKLTLDGKTLKGENTTETVDKATAEKYFKEWANDNGVDGEWTYDDATKTFTVKE,2.6746027,"Q2V, I6T, N8D, T16N, A20T, A23K, V29Y, Q32E, Y33W, T55K",10
MQYKFIINGKALKGETTTKADDASTAEKVAKQVINDNGVDGEWTYDDATLTFTVTE,2.3443456,"L5F, L7I, T11A, E19K, V21D, A24S, F30A, Y33V, A34I, K50L",10
MQYQLMKDGYTGIGETTTQAVDAATAEKVFKQYAKDNGVDGEWTYDKATKTFTVTE,1.6246232,"K4Q, I6M, L7K, N8D, K10Y, L12G, K13I, E19Q, N35K, D47K",10
MQYKSTGNGSTVKGETTTEAVDAATAEKVGDQYANANGVDGEVTYDDATKTYTVTE,-6.826539,"L5S, I6T, L7G, K10S, L12V, F30G, K31D, D36A, W43V, F52Y",10
MQYKAILNSKFLKAETTIEASDAATAEKMFKQYANDNGVDGEWTYDKATKTLTVSE,4.3261385,"L5A, G9S, T11F, G14A, T18I, V21S, V29M, D47K, F52L, T55S",10
MTYKLILNGDTLKFETTFEAVDAETAEKAAKQFANDNGVDGEWTFDDATRTFTVTE,8.126415,"Q2T, K10D, G14F, T18F, A24E, V29A, F30A, Y33F, Y45F, K50R",10
MQYKAKLNGKTLKDETTTEAVDVATAEAVFKAYLADNGVSGEATYDDATKTFTVTE,-5.862705,"L5A, I6K, G14D, A23V, K28A, Q32A, A34L, N35A, D40S, W43A",10
MAYLLILNGKTLDSEITTTAKDAATAEKVFKDYADDNGVDGEWTYDDTTKTFTVTE,0.5575873,"Q2A, K4L, K13D, G14S, T16I, E19T, V21K, Q32D, N35D, A48T",10
MQYKLIKNGKTLKGETTPHATDASTAQKVSKQYAKECGVDGEWTYDDATKTFTVTE,-4.1532307,"L7K, T18P, E19H, V21T, A24S, E27Q, F30S, N35K, D36E, N37C",10
MSYKLTLNGETWKGETTTEAFDAATAEKVFKNFANDNGVDGTWTYDDTTKTFTVTK,8.795184,"Q2S, I6T, K10E, L12W, V21F, Q32N, Y33F, E42T, A48T, E56K",10
MQSGLIHNGKTLTGETTTEAVPAATAEKVFEQEAKDNGVGGEWTYDDATKTFTVTG,-5.7641387,"Y3S, K4G, L7H, K13T, D22P, K31E, Y33E, N35K, D40G, E56G",10
MQYKLILDGDTIKGETTYDAVDAATAEEQFTQDANDNGVHGEWTYDDATKTFTVTE,-4.0395546,"N8D, K10D, L12I, T18Y, E19D, K28E, V29Q, K31T, Y33D, D40H",10
MQYKLIMNGKTQNGETTTEEVDAATAEKVFKQYANDNGSDGEFAIDDATKTITVTM,-6.181193,"L7M, L12Q, K13N, A20E, V39S, W43F, T44A, Y45I, F52I, E56M",10
MAYTAILNGKTLKTVTTTEAKDAATAGKVFKQYAADNGVEGEWTYDDATKTFKVTE,-2.779587,"Q2A, K4T, L5A, G14T, E15V, V21K, E27G, N35A, D40E, T53K",10
MEYKLILNGKTIKGETTVEAVDAADAFKVFVDYCNDNGVDGEWEYDDATKTFTVTN,-6.4058304,"Q2E, L12I, T18V, T25D, E27F, K31V, Q32D, A34C, T44E, E56N",10
MQYTLILNGGTLKGETTTEAVADATAEKVFKAYLNAHGVDAEITYDDATKTFTVTE,-3.6080441,"K4T, K10G, D22A, A23D, Q32A, A34L, D36A, N37H, G41A, W43I",10
MQYKLILSGKTLNGETTTVTVDKATMEKVFKQVCNDNGVDGEWTYDEATKTFTVEE,2.4947753,"N8S, K13N, E19V, A20T, A23K, A26M, Y33V, A34C, D47E, T55E",10
MQYKAILVGKTLKLETTTEAEDAATAERVFKQYAEDNGSDKEWTYDDATDTFTLTE,-5.7805405,"L5A, N8V, G14L, V21E, K28R, N35E, V39S, G41K, K50D, V54L",10
MQYYFIVNGKTLKGNTTAEAPDAATAEKVFQQWANDKGVDGTWTYDDATKTFTVTE,1.5137331,"K4Y, L5F, L7V, E15N, T18A, V21P, K31Q, Y33W, N37K, E42T",10
MQFKVILNGKTLKGETTTEAVDQATAEKVYKVYTNKNGVDGEWTYDDKTKTFTLTI,0.25871122,"Y3F, L5V, A23Q, F30Y, Q32V, A34T, D36K, A48K, V54L, E56I",10
MQYKLILNGKTLEGRTTTEAVTAESAEKVFKQTANLNGVTGEWTYDKATKTFTVTQ,10.536883,"K13E, E15R, D22T, A24E, T25S, Y33T, D36L, D40T, D47K, E56Q",10
MQYKLILNGKTLKGEATTEAADSARAQKVFDQYANINGVDGEVTYDDATRTFEVTE,-5.0044847,"T16A, V21A, A23S, T25R, E27Q, K31D, D36I, W43V, K50R, T53E",10
MQYKLILNGKTLKGETKTEVVDVATAKKFFKAYANDNKVDGEWTYDDATKEWTVTI,-4.538115,"T17K, A20V, A23V, E27K, V29F, Q32A, G38K, T51E, F52W, E56I",10
MQYKVILNGKELVGESVYDAVDAATAAKVAKQYANSNGVDGEWTYDDATKTFTVTE,-0.36380163,"L5V, T11E, K13V, T16S, T17V, T18Y, E19D, E27A, F30A, D36S",10
MQYKLISHGKTLYWETTTEAVDEATARKEFKQYANDNAVDGEATYDDATKTFTCTE,-5.3683734,"L7S, N8H, K13Y, G14W, A23E, E27R, V29E, G38A, W43A, V54C",10
MQYKAIKEGKTVKGETTTEAVDAATAEKVFKQYCNDSQVDGEWTYDDENKTLTVTE,2.7661264,"L5A, L7K, N8E, L12V, A34C, N37S, G38Q, A48E, T49N, F52L",10
MQYKLIRNGATLLGEDTTEAADAAAAEKVAKQYANDNGVDGDWTYDDATKTYTVTK,-0.5841419,"L7R, K10A, K13L, T16D, V21A, T25A, F30A, E42D, F52Y, E56K",10
MQYKLILNGKTLPGEFITEAVDAKTAEKVAKQYANDPGVDGEATYTSATKTFTVTL,-4.974361,"K13P, T16F, T17I, A24K, F30A, N37P, W43A, D46T, D47S, E56L",10
MQYKLILNGKTLQREFTTEAPDAATAEKAFKQYAEDSPVDGETTYDDATKTFTVNE,-5.736736,"K13Q, G14R, T16F, V21P, V29A, N35E, N37S, G38P, W43T, T55N",10
MQYKLILNGKVAKAENPTVAVDAENAEKVFKQYANENGVDGEWTYDDETKTFTVTE,6.5622187,"T11V, L12A, G14A, T16N, T17P, E19V, A24E, T25N, D36E, A48E",10
MQYKTTLNGKTLLGETTTEAVDAATAEKMAQQWANTAGVDGEWTYDKATKTFTVTE,-0.7163721,"L5T, I6T, K13L, V29M, F30A, K31Q, Y33W, D36T, N37A, D47K",10
MQAELILNGKTLKGETTSMAVTAATAEKVFKQAANKNGVDGEWTFDDATGTFTFTE,6.0200677,"Y3A, K4E, T18S, E19M, D22T, Y33A, D36K, Y45F, K50G, V54F",10
MQYKLTLNYKVLKGETTVEAPDAATAEKVFKRYANDNGYDGQWSYDDATETFTVTE,5.7837224,"I6T, G9Y, T11V, T18V, V21P, Q32R, V39Y, E42Q, T44S, K50E",10
MTYKLILNGSTLKGELTTDAEDAVEAMKVFKQYANDNGVDGEWTYDDKTKTFTITE,1.2413087,"Q2T, K10S, T16L, E19D, V21E, A24V, T25E, E27M, A48K, V54I",10
MQYKLIKNGKTLKTETFTEQADAATAEKVFKKIANDQGVDGEWTYDDATQTATVTE,0.118492484,"L7K, G14T, T17F, A20Q, V21A, Q32K, Y33I, N37Q, K50Q, F52A",10
MQYKLILNYKTLKGETTIYAVDAATIEKVFKQFANDNGVDSEWTYDSNSVTFTVTE,3.0146227,"G9Y, T18I, E19Y, A26I, Y33F, G41S, D47S, A48N, T49S, K50V",10
MQYKLILTESTLKTETTFEAVDAAEAEKVFKEYENDNGVDGEWTYDDATTTITVTE,-5.34706,"N8T, G9E, K10S, G14T, T18F, T25E, Q32E, A34E, K50T, F52I",10
MQYKLILNDKTLKGETTTEAPDAATAKKVFLGVVNDNGVVGKWTYDDATKTFTVTL,-5.89873,"G9D, V21P, E27K, K31L, Q32G, Y33V, A34V, D40V, E42K, E56L",10
MQYKLIVNGVTVKEGTTTRAHDAAYAEKVFKNNANDNGVDGEWTYDDATKTFTVTE,6.369173,"L7V, K10V, L12V, G14E, E15G, E19R, V21H, T25Y, Q32N, Y33N",10
MQYKLILTGKELKDKTTTEAVDAATAEKNFKQYANDNGVDGTITYDSNTKTFTVKE,2.0124087,"N8T, T11E, G14D, E15K, V29N, E42T, W43I, D47S, A48N, T55K",10
MQYKLIPHGTTLKGELTTEAKDAANAEKVFKQYANDNGLDGEWTYDDAKKTVTLTE,3.8177934,"L7P, N8H, K10T, T16L, V21K, T25N, V39L, T49K, F52V, V54L",10
MQYTLILNGKTLKAETKFEAVDRADAEKEFKQYINDNGVDAEWGYDDATKTFTVTE,-2.6563032,"K4T, G14A, T17K, T18F, A23R, T25D, V29E, A34I, G41A, T44G",10
MQYKIILNSATLKGETTLEAVDAAEAEKVFQQWCNDYGVDGEWTYDDATDTFTVTE,-2.8137527,"L5I, G9S, K10A, T18L, T25E, K31Q, Y33W, A34C, N37Y, K50D",10
MQYKLILNGITFKGETTTVVVAAATAEKVAKEYANDNLVDGEVTYDDATKTFTVTL,-3.8243823,"K10I, L12F, E19V, A20V, D22A, F30A, Q32E, G38L, W43V, E56L",10
MQYKLTLNGHTEKGETTIEAVDEATAEKVFKQPANDAGVDGEITYDDETKTFTTTE,-3.6253204,"I6T, K10H, L12E, T18I, A23E, Y33P, N37A, W43I, A48E, V54T",10
MKYKLVLNGKTLKTETTTLARDAATAEKVFKQWANDNGYDGQWTYDNATKTFTATE,7.6220055,"Q2K, I6V, G14T, E19L, V21R, Y33W, V39Y, E42Q, D47N, V54A",10
MSYKLIVNGKELKGETTIENWDAATAEKVFQQTVNDNGVDGEWTYDAATKTFTVTE,-0.23095411,"Q2S, L7V, T11E, T18I, A20N, V21W, K31Q, Y33T, A34V, D47A",10
MSYKAILNGKTLKGLRHTEAVDAATAEGDFKQYANDFGLDGEWTYDDATKTITVTE,-0.7024856,"Q2S, L5A, E15L, T16R, T17H, K28G, V29D, N37F, V39L, F52I",10
MAYKLILNGKTLKGETVTVAVDAATGEKVFKAYARLYKVDGEWTYDDATKTFTVTL,1.0409558,"Q2A, T17V, E19V, A26G, Q32A, N35R, D36L, N37Y, G38K, E56L",10
MQYKLILNGKTLKHQTTIEAVDAATAEAEFRQYLNDNGFESEWTYDDATKTFTVTE,-4.8842854,"G14H, E15Q, T18I, K28A, V29E, K31R, A34L, V39F, D40E, G41S",10
MTYKLILNGKPLKYETTTDAVDAATAEKVAKQYANDIGVSASWTYDDATNTFTVTE,2.1804774,"Q2T, T11P, G14Y, E19D, F30A, N37I, D40S, G41A, E42S, K50N",10
MQGKLILNGKTLTGETTTLTSDAATGEKVFKQYANDNQIDGEWTWDDATKTFTVTP,4.458419,"Y3G, K13T, E19L, A20T, V21S, A26G, G38Q, V39I, Y45W, E56P",10
MQYKLILNGVTLKGETTYEAVDLPTYIKVFKQYANDNGHDGEYTYDKATKTLTVTE,-5.3392615,"K10V, T18Y, A23L, A24P, A26Y, E27I, V39H, W43Y, D47K, F52L",10
MQYKLIGNGKTLPAETTTEAEAKATAEKVFKQYANWSGVDGEKTYDVATKTFTVTE,-3.5992897,"L7G, K13P, G14A, V21E, D22A, A23K, D36W, N37S, W43K, D47V",10
MQYKLILNGVTLKNESLVEAVDAATAEKEIKQYANDNGIDGEFTYDDATKTFTVTK,-1.6486636,"K10V, G14N, T16S, T17L, T18V, V29E, F30I, V39I, W43F, E56K",10
MQYYLILDGKVLVGETTTEAVEAATAEKVGQQYANDNGVTGMFTYDDATKTFTVTE,-4.128188,"K4Y, N8D, T11V, K13V, D22E, F30G, K31Q, D40T, E42M, W43F",10
MVYKLILQGKELALETTLEAVDAATAEKVAKQYANDNGVQGQWTYDDASKTFTVTE,5.2605753,"Q2V, N8Q, T11E, K13A, G14L, T18L, F30A, D40Q, E42Q, T49S",10
MAYKLILGGKTLKTETTTEFKDAATGEKVGKQYANDNGVDAEWTYDGATGTFTVTE,1.3045993,"Q2A, N8G, G14T, A20F, V21K, A26G, F30G, G41A, D47G, K50G",10
MQYKLILNGKTLKGETTTSAVDAATAEAAANAYANDNGVDGKWTYDDKTKTFTVHI,-2.2935948,"E19S, K28A, V29A, F30A, K31N, Q32A, E42K, A48K, T55H, E56I",10
MQYKLILNGKTLKVETTVEAADAAQAEKTFKQIANDNGVQVEATYDDATKTFTLTE,-3.2437813,"G14V, T18V, V21A, T25Q, V29T, Y33I, D40Q, G41V, W43A, V54L",10
MQYTLIKDGKTLIGETTTEAVDAATAEKVFKSAHNDGGVDGTWTYDDATKTFTVKE,-0.2127499,"K4T, L7K, N8D, K13I, Q32S, Y33A, A34H, N37G, E42T, T55K",10
MKYKLILNGKTLNGETSIDAVDAATAFTVFKQQANDNGLDGEWTYDDATKTFTFTE,-0.11000378,"Q2K, K13N, T17S, T18I, E19D, E27F, K28T, Y33Q, V39L, V54F",10
MQVKTILNGKTLKGETTTEAVDAKTLKKIFTKYTNDNGVDGKWTYDDATKTFTVTE,-6.3658853,"Y3V, L5T, A24K, A26L, E27K, V29I, K31T, Q32K, A34T, E42K",10
MQYKLTLNGKPLPGEFTTEITDAETAEKVFKNYANDNGVDGEWTFDDATKTFTVFE,5.240342,"I6T, T11P, K13P, T16F, A20I, V21T, A24E, Q32N, Y45F, T55F",10
MQYDLILNGKTLTGITATDAVDAASLEKVFKQYANDKGVDGEMTYDDTTKTFTVTE,-1.961457,"K4D, K13T, E15I, T17A, E19D, T25S, A26L, N37K, W43M, A48T",10
MQYKAIVNGKELTGETTTEAVDKAHAEKVFKQMANEKGVDGEWTYDDATKTVTVTE,0.13030957,"L5A, L7V, T11E, K13T, A23K, T25H, Y33M, D36E, N37K, F52V",10
MAYKLILNSTTLKGETTTTAVDAATAITEFKQYAKDNGWDGTWTYDDATKTFTVTE,-5.548553,"Q2A, G9S, K10T, E19T, E27I, K28T, V29E, N35K, V39W, E42T",10
